db_file,table_name,id,zh,en,vi
lang_multi_text.db,MultiText,Flow_11000001_688,捉迷藏！捉迷藏！,Hide-and-seek! Hide-and-seek!,Trốn tìm! Trốn tìm!
lang_multi_text.db,MultiText,Flow_11000001_689,有你们护着啊，我们老婆子老头子一切都好。,"With you fighting on the frontlines protecting us, we old people are doing just fine.","Có các cháu che chở, vợ chồng già chúng tôi đều ổn cả."
lang_multi_text.db,MultiText,Flow_11000001_69,好呀，再来一次。,Sure. Let's play another game.,"Được, chơi thêm lần nữa nào."
lang_multi_text.db,MultiText,Flow_11000001_690,你要多注意照顾自己啊，多休息，不用天天都往我们这跑。,You should take care of yourself and get more rest. There's no need for you to visit every day.,"Cháu phải chú ý chăm sóc bản thân, nghỉ ngơi nhiều vào, không cần ngày nào cũng chạy đến chỗ chúng tôi đâu."
lang_multi_text.db,MultiText,Flow_11000001_691,有你们护着啊，我们老婆子老头子一切都好。,"With you fighting on the frontlines protecting us, we old people are doing just fine.","Có các cháu che chở, vợ chồng già chúng tôi đều ổn cả."
lang_multi_text.db,MultiText,Flow_11000001_692,好啊。,Let's do it.,Được thôi.
lang_multi_text.db,MultiText,Flow_11000001_693,哎……可惜我这把老骨头走不动咯，要不怎么着我也得去前线看一看呐……,"*sigh*... If it weren't for my age, I'd want to go up there and have a look for myself...","Hài... tiếc là thân già này không đi nổi nữa rồi, không thì thế nào tôi cũng phải ra tiền tuyến xem một chuyến..."
lang_multi_text.db,MultiText,Flow_11000001_694,{Male=小伙子;Female=姑娘}，你能替我去找找孤鸿吗？,{Male=Young man;Female=Young lady}. Can you help an old lady find Guhong?,"{Male=Cậu trai;Female=Cô gái}, cháu có thể thay tôi đi tìm Cô Hồng được không?"
lang_multi_text.db,MultiText,Flow_11000001_695,好的。,"Sure thing, ma'am.",Được ạ.
lang_multi_text.db,MultiText,Flow_11000001_696,那就拜托{Male=小伙子;Female=姑娘}你了，路上小心啊。,Thank you. Do be careful on your way.,"Vậy nhờ {Male=cậu trai;Female=cô gái} nhé, đi đường cẩn thận."
lang_multi_text.db,MultiText,Flow_11000001_698,好。,Leave it to me.,Được.
lang_multi_text.db,MultiText,Flow_11000001_699,谢谢，我有守岗职责在身，不能擅离。孤鸿就拜托你了。,"I can't thank you enough. As you can see, I'm still on my sentry duty and cannot leave the post unattended, so I have no choice but to leave the task to you.","Cảm ơn, tôi có nhiệm vụ trực gác, không thể tự ý rời đi. Chuyện Cô Hồng nhờ cậu nhé."
lang_multi_text.db,MultiText,Flow_11000001_70,现在还有事，下次吧。,I've still got other things to do. Maybe next time.,"Giờ còn bận, để lần sau nhé."
lang_multi_text.db,MultiText,Flow_11000001_702,此地不宜久留，我们先回今州。,We're not out of the woods yet. We should head back to Jinzhou.,"Nơi này không nên ở lâu, chúng ta về Kim Châu trước đã."
lang_multi_text.db,MultiText,Flow_11000001_703,你看我这肌肉，想不到我以前是个病秧子吧？都靠哥哥护着，才能平安长大。,See these muscles? I bet you wouldn't even believe it if I told you I used to get sick all the time back in the day. I wouldn't even be here if it weren't for my bigger brother looking after me.,"Nhìn cơ bắp của tôi này, không ngờ ngày xưa tôi là đứa ốm yếu đúng không? Đều nhờ anh trai che chở mới bình an lớn lên được."
lang_multi_text.db,MultiText,Flow_11000001_704,只要看到这白白胖胖的包子蒸起来啊，一天的盼头就又有咯！,Would you look at the size of these puffy white dumplings? Don't they just make your day!,Chỉ cần nhìn mấy cái bánh bao trắng phau phau xếp lên xửng là cả ngày lại có thêm niềm vui rồi!
lang_multi_text.db,MultiText,Flow_11000001_705,阿民去了那么久，我一个人也能把摊子支起来了。,"It's been a while with Aming not around. But here I am, still keeping this here food stall running on my own.","A Dân đi lâu rồi, một mình tôi vẫn lo được cái quán này."
lang_multi_text.db,MultiText,Flow_11000001_706,阿民？,Aming?,A Dân?
lang_multi_text.db,MultiText,Flow_11000001_707,就是我家那口子。,He's my other half.,Là ông xã tôi đó.
lang_multi_text.db,MultiText,Flow_11000001_708,曾经啊我俩一起支起这早餐摊，现在就剩我一个咯。,The two of us used to run this food stall together. But now I'm the only one left.,"Ngày xưa hai vợ chồng cùng nhau lo cái quán sáng này, giờ chỉ còn mình tôi thôi."
lang_multi_text.db,MultiText,Flow_11000001_709,抱歉……,Sorry for asking...,Xin lỗi...
lang_multi_text.db,MultiText,Flow_11000001_710,节哀。,I'm sorry for your loss.,Chia buồn với chị.
lang_multi_text.db,MultiText,Flow_11000001_711,哎，没事，都过去了。,"Oh, don't be. It's all a thing of the past.","Ôi, không sao, chuyện qua rồi."
lang_multi_text.db,MultiText,Flow_11000001_712,只要这摊子还在，蒸笼上的烟气还是照常升起，就感觉什么都没变似的。,"With this food stall still here, and the stream running up the air per usual. It's as if nothing's changed.","Chỉ cần cái quán còn đây, hơi nước trên xửng vẫn bốc lên như thường, thì cảm giác như mọi thứ chẳng thay đổi gì."
lang_multi_text.db,MultiText,Flow_11000001_713,承蒙各位厚爱，虽然没有店面，我这寻遗生意也算是做起来了。,"Thanks to my kind patrons, this small relic business of mine has been thriving despite having no storefront.","Nhờ mọi người chiếu cố, tuy không có cửa tiệm, nhưng việc buôn bán tầm di của tôi cũng tạm ổn rồi."
lang_multi_text.db,MultiText,Flow_11000001_714,哟，这不是见多识广的漂泊者嘛，莫不是发现了声匣，特地来照顾生意？,"Well, if isn't the insightful Rover? Here to support my business with more Sonance Caskets again?","Ồ, đây chẳng phải Lữ Khách hiểu biết rộng sao, chẳng lẽ tìm được Âm Hạp, đặc biệt đến chiếu cố làm ăn à?"
lang_multi_text.db,MultiText,Flow_11000001_715,声匣很值钱吗？,Are Sonance Caskets valuable?,Âm Hạp có giá trị lắm sao?
lang_multi_text.db,MultiText,Flow_11000001_716,“值钱”这个词很有意思，做买卖乃生财之道，但钱财要是成了万事万物唯一的衡量标准……那可就糟喽。,"""Value"" is a complex term. In the business world, money talks. But once it becomes the sole measure of worth, we must proceed with caution.","""Giá trị"" là một từ rất thú vị. Buôn bán là con đường sinh lợi, nhưng nếu tiền bạc trở thành thước đo duy nhất cho mọi thứ... thì hỏng to rồi."
lang_multi_text.db,MultiText,Flow_11000001_717,我陈皮做交易，最看重的是合乎双方心意。,A mutually beneficial agreement is what I strive for.,"Trần Bì tôi làm giao dịch, coi trọng nhất là hợp ý cả đôi bên."
lang_multi_text.db,MultiText,Flow_11000001_718,于你无用的东西于我有用，他人眼里不值一提的破旧玩意儿，在我这，说不定就是岁月和历史的印记。,"One's discarded items can hold great value for another, especially in my line of work as a collector of relics.","Thứ với cậu vô dụng thì với tôi lại có ích, đồ cũ kỹ người khác chẳng thèm để mắt, ở chỗ tôi biết đâu lại là dấu ấn của năm tháng và lịch sử."
lang_multi_text.db,MultiText,Flow_11000001_719,所以说啊，有缘捡到声匣的话，不妨交给我。报酬什么的都好说，绝对不会亏待你。,"Should you come across any Sonance Caskets in your travels, I'd gladly take them off your hands for a price that'll make it worth your while.","Nên nói vậy, nếu có duyên nhặt được Âm Hạp thì cứ mang đến cho tôi. Thù lao gì cũng dễ nói, chắc chắn không để cậu thiệt đâu."
lang_multi_text.db,MultiText,Flow_11000001_72,嘿嘿，赢了{Male=大哥哥;Female=大姐姐}两次呢~,Yeah! We won two rounds in a row!,"Hehe, thắng {Male=anh;Female=chị} hai lần rồi nè~"
lang_multi_text.db,MultiText,Flow_11000001_720,生计之余，不要忘记风景。可能在某个山顶，就藏有文明的痕迹。,Remember to stop and look around as you explore. Maybe there are ancient relics on those faraway mountains. Who knows?,"Ngoài chuyện mưu sinh, đừng quên ngắm cảnh. Biết đâu trên đỉnh núi nào đó, lại ẩn giấu dấu vết của nền văn minh."
lang_multi_text.db,MultiText,Flow_11000001_721,今儿个不开张，明儿个香火旺。遇见讲求缘分，来日方长。,"Sorry, I'm closed for today, Come back tomorrow during regular hours, will you?","Hôm nay không mở hàng, ngày mai hương khói vượng. Gặp gỡ cũng cần duyên, còn dài lắm mà."
lang_multi_text.db,MultiText,Flow_11000001_722,聚沙成塔，集腋成裘，哪怕数量再少，也能掀开文明面纱的一角。,Every small discovery adds up to the bigger picture. Today's findings can lead us to uncover age-old mysteries about human civilization.,"Góp cát thành tháp, gom lông thành áo, dù số lượng ít đến đâu, cũng có thể hé mở một góc bức màn văn minh."
lang_multi_text.db,MultiText,Flow_11000001_723,让古物重见光明，这才是交易的乐趣……哎哟，八角太激动，让你见笑了。,Giving relics the chance to see the light of day again. Now that's the joy of doing business... See? Even Bajiao's getting excited.,"Cho cổ vật được thấy lại ánh sáng, đó mới là niềm vui của giao dịch... Ôi chà, Bát Giác hào hứng quá, để cậu cười rồi."
lang_multi_text.db,MultiText,Flow_11000001_724,承蒙各位街坊邻居厚爱，我这六羡茶馆啊，也平平安安开了几十载了。,"Thanks to the patronage from my lovely neighbors, Liuxian Teahouse is still driving after all these years.","Nhờ bà con láng giềng chiếu cố, quán trà Lục Tiện của tôi cũng bình an mở được mấy chục năm rồi."
lang_multi_text.db,MultiText,Flow_11000001_725,这熟客往店里一坐，把茶杯往那一放，我就知道大家想喝什么。,"When a regular customer enters the teahouse and sit down with their teacup ready, I would know exactly what tea they want to have.","Khách quen vừa ngồi xuống, đặt tách trà lên bàn, là tôi biết ngay mọi người muốn uống gì."
lang_multi_text.db,MultiText,Flow_11000001_726,陈皮喜欢喝普洱、片羽喜欢喝白茶、至于渊武老板么……,"Chenpi likes to have Pu'er, Pianyu prefers white tea, and as for Master Yuanwu...","Trần Bì thích uống trà Phổ Nhĩ, Phiến Vũ thích uống bạch trà, còn ông chủ Uyên Vũ thì..."
lang_multi_text.db,MultiText,Flow_11000001_727,我每天都亲自焙好三清茶，用油纸包着，给拳馆送去呐。,"I'd roast some fresh Trine Tea myself every day, wrap it in oil paper, and then bring it over to his boxing gym.","Tôi mỗi ngày đều tự tay sao trà Tam Thanh, gói trong giấy dầu, rồi mang đến võ quán cho ông ấy."
lang_multi_text.db,MultiText,Flow_11000001_728,这三清茶的配方是渊武老板亲自调配的，至于那茶叶，可都是我亲手采摘，亲自烘焙的。,It's a blend Master Yuanwu devised himself. I usually pick the tea leaves and roast them here at the teahouse.,"Công thức trà Tam Thanh này do chính ông chủ Uyên Vũ pha chế, còn lá trà thì đều do tôi tự tay hái, tự tay sao cả."
lang_multi_text.db,MultiText,Flow_11000001_729,有时候觉得，这人情啊也就跟茶叶一样，都是越焙越香呐。,"Sometimes I feel that relationships between people are like tea leaves. The more they are encompassed in warmth, the more fragrant they become.","Đôi khi nghĩ lại, tình người cũng giống như trà vậy, càng sao càng thơm."
lang_multi_text.db,MultiText,Flow_11000001_73,我们从小生活在这里，爹爹还教过我们躲藏术，找不到也很正常。,We grew up around here and Daddy taught us plenty of hiding skills. It's okay if it was hard for you to find us.,"Bọn mình lớn lên ở đây từ nhỏ, bố còn dạy cả thuật ẩn nấp nữa, tìm không ra cũng là chuyện bình thường mà."
lang_multi_text.db,MultiText,Flow_11000001_730,失落的真心，就像在无光之森孤独绽开的花，绯色依旧，却脆弱缥缈，遍体鳞伤。,"The lost heart is like a flower blooming alone in the Dim Forest. Its scarlet color remains, but fragile and indistinct, with scars running down its body.","Trái tim lạc lối, tựa đóa hoa cô độc nở giữa rừng tối. Sắc đỏ vẫn còn, nhưng mong manh hư ảo, đầy thương tích."
lang_multi_text.db,MultiText,Flow_11000001_731,哇！吓我一跳……原来是暗夜骑士{PlayerName}啊。,"Eek! You startled me for a moment there... If it isn't the Night Champion, {PlayerName}?",Oa! Giật mình quá... Hóa ra là hiệp sĩ bóng đêm {PlayerName} đây mà.
lang_multi_text.db,MultiText,Flow_11000001_732,你在念诗吗？,Are you reciting a poem?,Cậu đang ngâm thơ à?
lang_multi_text.db,MultiText,Flow_11000001_733,穿越凋零荆棘的英雄，终于来拯救被尖刺划伤的少女了吗。,"Through fading thorns, has the hero finally arrived to rescue the maiden wounded by the spikes?","Vị anh hùng vượt qua bụi gai tàn úa, cuối cùng cũng đến cứu thiếu nữ bị gai cào xước rồi sao."
lang_multi_text.db,MultiText,Flow_11000001_734,你似乎认错人了。,You must've gotten the wrong person.,Cậu nhận nhầm người rồi.
lang_multi_text.db,MultiText,Flow_11000001_735,是吗？看来尘封的记忆，终究无法靠单向的情愫去唤醒。,Have I? It seems that the dusty memories cannot be awakened by a single sentiment after all.,"Vậy sao? Có lẽ ký ức phủ bụi, rốt cuộc không thể đánh thức bằng tình cảm một chiều."
lang_multi_text.db,MultiText,Flow_11000001_736,你我如背道而驰的两颗流星，直到坠落才能救赎相遇的罪孽吧……,"You and I are like two meteors flying off in opposite directions, only til we fall can we seek redemption from the sins of convergence...","Cậu và tôi như hai ngôi sao băng lao ngược chiều nhau, phải đến khi rơi xuống mới có thể chuộc lại tội lỗi của cuộc gặp gỡ này..."
lang_multi_text.db,MultiText,Flow_11000001_737,……,...,...
lang_multi_text.db,MultiText,Flow_11000001_738,为了家人和朋友。,For family and friends.,Vì gia đình và bạn bè.
lang_multi_text.db,MultiText,Flow_11000001_739,为了金钱和名誉。,For money and honor.,Vì tiền bạc và danh tiếng.
lang_multi_text.db,MultiText,Flow_11000001_74,捉迷藏，好玩！铭铭没玩够……还要玩还要玩！,Hide-and-seek is so much fun! I wanna play more!,"Trốn tìm vui quá! Minh Minh chưa chơi đã đời... Chơi nữa, chơi nữa!"
lang_multi_text.db,MultiText,Flow_11000001_740,没有为什么。,No reason.,Không vì lý do gì cả.
lang_multi_text.db,MultiText,Flow_11000001_741,若降妖除魔，确实可以名扬天下，甚至流传千古。好事，好事！,Exorcise demons and monsters and become an undying legend... You're seeking the right stuff!,"Nếu diệt yêu trừ ma, quả thực có thể nổi danh thiên hạ, thậm chí lưu truyền muôn đời. Hay lắm, hay lắm!"
lang_multi_text.db,MultiText,Flow_11000001_742,哦？但我看你的眼神坚定纯粹，想必并非是没有理由，而是无论何时都愿出手相助？,"Oh? But I see a firm and pure determination in your eyes. I guess it's not that you don't have a reason, but you're always ready to lend a hand, right?","Ồ? Nhưng tôi thấy ánh mắt cậu kiên định và thuần khiết, chắc hẳn không phải là không có lý do, mà là bất kể lúc nào cũng sẵn lòng ra tay giúp đỡ phải không?"
lang_multi_text.db,MultiText,Flow_11000001_743,原来是这样啊……等等，有灵感了！谢谢你，我先继续排戏了。,"So that's how it is... Wait, I've got an idea! Thanks, I'll get back to my rehearsal.","Thì ra là vậy... Khoan, có cảm hứng rồi! Cảm ơn cậu, để tôi tiếp tục tập kịch đã."
lang_multi_text.db,MultiText,Flow_11000001_744,是的。,"Indeed, I am.",Ừ.
lang_multi_text.db,MultiText,Flow_11000001_745,关于今州剧场……,About Jinzhou Theater...,Về nhà hát Kim Châu...
lang_multi_text.db,MultiText,Flow_11000001_746,关于英雄戏……,About Hero Play...,Về kịch anh hùng...
lang_multi_text.db,MultiText,Flow_11000001_747,关于演出剧目……,About the play...,Về các vở diễn...
lang_multi_text.db,MultiText,Flow_11000001_748,没什么事。,Nothing.,Không có gì.
lang_multi_text.db,MultiText,Flow_11000001_749,接着就到我们的灼火，要火光冲天，要火星四散，要让这年节的夜晚敞亮亮！,"Next up, the Torch Sword! Let its flames burn, let the sparks fly and lighten up tonight!","Tiếp theo là màn Chước Hỏa của chúng ta, phải lửa bốc ngút trời, phải tàn lửa bắn tung tóe, phải làm cho đêm lễ hội sáng rực lên!"
lang_multi_text.db,MultiText,Flow_11000001_75,再来一次。,Another game it is then.,Thêm lần nữa.
lang_multi_text.db,MultiText,Flow_11000001_750,好了好了，这一下我又入到戏里了，您多担待。,"Sorry, I got carried away again. Please forgive my manners.","Thôi thôi, lại nhập vai mất rồi, ngài thông cảm nhé."
lang_multi_text.db,MultiText,Flow_11000001_751,这英雄戏，我演了几百上千场了。,"I've performed this Hero Play hundreds, even thousands of times.","Vở kịch anh hùng này, tôi đã diễn mấy trăm, cả ngàn lần rồi."
lang_multi_text.db,MultiText,Flow_11000001_752,次次演这火焰小英雄，演得多了，就好像自己是那人，那人是自己。,"Playing Fiamma over and over, it feels like we're becoming one entity.","Lần nào cũng đóng vai tiểu anh hùng lửa, diễn nhiều rồi, cứ như mình là người đó, người đó là mình vậy."
lang_multi_text.db,MultiText,Flow_11000001_753,不过啊，我还是会把这火焰英雄演下去。毕竟每次戏演结束，看着台下孩子们明亮亮的眼睛，我就开心。,"But you know, I'll keep playing the Fiamma role. After all, every time the show ends, I feel happy seeing the bright eyes of the children in the audience.","Nhưng mà, tôi vẫn sẽ tiếp tục diễn vai anh hùng lửa. Bởi mỗi lần diễn xong, nhìn thấy đôi mắt sáng ngời của bọn trẻ dưới sân khấu, tôi thấy vui lắm."
lang_multi_text.db,MultiText,Flow_11000001_754,这演戏要能打动人鼓舞人，就无所谓排练起来有多累。,"If the performance can move and inspire people, it doesn't matter how tiring the rehearsals can be.","Diễn kịch mà lay động được lòng người, truyền cảm hứng cho người ta, thì tập luyện có mệt mấy cũng chẳng sao."
lang_multi_text.db,MultiText,Flow_11000001_755,也是炽霞让我深切感受到这一点，她小时候就爱来听我这英雄戏，现在人做巡尉了，可是把这炽霞名号发扬光大！,It was Chixia who made me realize this. She was a dedicated audience to my play when she was a kid. Now she's a Patroller. More and more people will know her as Chixia!,"Cũng chính Xí Hà khiến tôi cảm nhận sâu sắc điều này. Hồi nhỏ cô ấy rất thích đến xem kịch anh hùng của tôi, giờ đã làm Tuần Úy rồi, thật sự đã làm rạng danh cái tên Xí Hà!"
lang_multi_text.db,MultiText,Flow_11000001_756,比起我，现在她才是那今州的火焰英雄啦，你看，多好！,"Well, I think she fits the real Fiamma of Jinzhou better than me. I'm happy for her.","So với tôi, bây giờ cô ấy mới là anh hùng lửa thực sự của Kim Châu đấy, ngài thấy không, tuyệt vời chứ!"
lang_multi_text.db,MultiText,Flow_11000001_757,最近呢，还是老样，《飞羽侠》、《火焰英雄》要轮番上演，绝对不让这气悬妖祸害人间。,"Same old arrangements. ""Speedster"" and ""Fiamma"" are taking turns to perform, making sure the Fluffernox doesn't wreak havoc on the human world.","Dạo này vẫn như cũ thôi, ""Phi Vũ Hiệp"" với ""Anh Hùng Lửa"" diễn luân phiên, nhất định không để con yêu quái Khí Huyền tác oai tác quái."
lang_multi_text.db,MultiText,Flow_11000001_758,不过我们也在加紧排演新的剧目，到时候啊，你可一定要来看看。,But we're also working on a new play. Don't forget to come and see it yourself when it's out!,"Nhưng chúng tôi cũng đang gấp rút tập luyện vở mới, lúc đó nhất định phải đến xem nhé."
lang_multi_text.db,MultiText,Flow_11000001_759,好，那你随意逛逛，要有什么问题，问我就行。,"Alright, feel free to look around. If you have any questions, just ask me.","Được rồi, ngài cứ tự nhiên dạo chơi, có gì thắc mắc cứ hỏi tôi."
lang_multi_text.db,MultiText,Flow_11000001_76,下次吧。,Maybe next time.,Để lần sau đi.
lang_multi_text.db,MultiText,Flow_11000001_760,你好。,Hello.,Xin chào.
lang_multi_text.db,MultiText,Flow_11000001_761,所以啊，我才这么喜欢青禾姐的戏！,That's why I love Qinghe's plays so much!,"Cho nên đó, tôi mới thích kịch của chị Thanh Hòa đến vậy!"
lang_multi_text.db,MultiText,Flow_11000001_762,还没那么快。,Not so soon.,Chưa nhanh thế đâu.
lang_multi_text.db,MultiText,Flow_11000001_763,我们耐心等等。,We'll wait patiently.,Chúng ta kiên nhẫn chờ thêm chút.
lang_multi_text.db,MultiText,Flow_11000001_765,现在这戏台就是他们这些年轻人的了，看着他们这心里也有劲儿。,"Now, this stage belongs to these young folks, and watching them gives me a real kick.","Giờ sân khấu này là của bọn trẻ rồi, nhìn chúng nó mà trong lòng cũng thấy hăng hái."
lang_multi_text.db,MultiText,Flow_11000001_766,现在人没那么多了，有一场是一场，你可别把人都训没了。,"The performances are precious. Try not to scare them away with your silver tongue, okay?","Bây giờ người ta không đông như trước, được buổi nào hay buổi đó, đừng có mà rầy la khiến người ta bỏ hết đấy."
lang_multi_text.db,MultiText,Flow_11000001_767,毕竟这人生如戏，戏如人生啊……,"After all, life's a stage, and all the men and women are mere players...","Xét cho cùng, đời như kịch, kịch như đời..."
lang_multi_text.db,MultiText,Flow_11000001_768,火焰英雄全新的冒险故事，真想早点看到啊！,Can't wait to see Fiamma's brand new adventure story!,"Câu chuyện phiêu lưu mới toanh của Anh Hùng Lửa, muốn được xem sớm quá!"
lang_multi_text.db,MultiText,Flow_11000001_771,玲珑？,Linglong?,Linh Lung?
lang_multi_text.db,MultiText,Flow_11000001_772,分店？,A branch?,Chi nhánh?
lang_multi_text.db,MultiText,Flow_11000001_773,“珑玥”总店每次新出了什么设计，都要提前好久排队才能买上。,"Whenever Longyue's main store gets new arrivals, people literally camp out to get their hands on her latest drops.","Mỗi lần cửa hàng chính ""Lung Nguyệt"" ra mẫu mới, phải xếp hàng từ rất lâu mới mua được."
lang_multi_text.db,MultiText,Flow_11000001_774,为了设计出更有趣的作品，也为了让更多顾客买到心仪的衣服，玲珑决定把分店开遍世界各地！,"In order to create more interesting designs and to let more customers buy their favorite clothes, Linglong has decided to open branches all over the world!","Để thiết kế ra những tác phẩm thú vị hơn, cũng để nhiều khách hàng hơn mua được quần áo ưng ý, Linh Lung quyết định mở chi nhánh khắp nơi trên thế giới!"
lang_multi_text.db,MultiText,Flow_11000001_775,既然要在不同地方开分店，那就要在保持品牌整体调性的同时，融合进地方特色啦！,"With plans to expand globally, she's gotta keep that Longyue vibe while adding local characteristics.","Đã mở chi nhánh ở nhiều nơi khác nhau, thì phải vừa giữ được phong cách chung của thương hiệu, vừa kết hợp nét đặc trưng địa phương!"
lang_multi_text.db,MultiText,Flow_11000001_776,所以玲珑总是一边赶路，一边取材……或许等她到这儿的时候，就已经做出什么新设计了……玲珑的新设计，真期待呀！,"So Linglong's always on the move, soaking up inspiration from different places. I bet she's already had some amazing designs for Jinzhou!","Nên Linh Lung lúc nào cũng vừa đi vừa tìm chất liệu... Biết đâu khi đến đây, cô ấy đã nghĩ ra mẫu thiết kế mới rồi... Thiết kế mới của Linh Lung, thật đáng mong chờ!"
lang_multi_text.db,MultiText,Flow_11000001_777,嘿嘿，要是今州的大家穿上玲珑设计的服装，一定会互相映衬，产生1+1>2的效果！,"Haha, just imagine everyone here wearing Linglong's designs. Nice people in nice clothes.... It'll be fabulous!","Hehe, nếu mọi người ở Kim Châu mặc trang phục do Linh Lung thiết kế, chắc chắn sẽ tôn nhau lên, tạo ra hiệu ứng 1+1>2!"
