db_file,table_name,id,zh,en,vi
lang_multi_text.db,MultiText,Main_Rinascita_2_12_641_10,但如果！利维亚坦可以找寻一个「<ano=代行者>现实的锚点</ano>」，令黑潮造物降临现世……,I have an idea! If Leviathan found Its <ano=Harbinger>Anchor of Reality</ano> to summon the Tidespawn into our world...,"Nhưng nếu! Leviathan có thể tìm một ""<ano=Đại Diện>Điểm Neo Thực Tại</ano>"" để khiến tạo vật Bi Minh giáng lâm xuống hiện thế..."
lang_multi_text.db,MultiText,Main_Rinascita_2_12_641_11,那么我们，也可以通过一个「精神的锚点」，在黑潮的世界中找到方向。,We follow suit and find an Anchor of Hope to find a way out of the world of the Dark Tide!,"Thì chúng ta cũng có thể thông qua một ""điểm neo tinh thần"" để tìm ra phương hướng trong thế giới Bi Minh."
lang_multi_text.db,MultiText,Main_Rinascita_2_12_641_12,而这个锚点——正是你，{PlayerName}。,"And who better for that… than you, {PlayerName}.","Và điểm neo này... chính là cậu, {PlayerName}."
lang_multi_text.db,MultiText,Main_Rinascita_2_12_641_13,即使深陷黑暗也从未放弃，即使绝望缠身仍坚信希望……正是这些信念，令你成为了大家的「精神锚点」。,"Even in the depths of despair, you held on to hope... That unwavering faith makes you worthy of being our Anchor of Hope.","Dù chìm sâu trong bóng tối cũng chưa từng bỏ cuộc, dù tuyệt vọng bủa vây vẫn vững tin vào hy vọng... Chính những niềm tin đó đã khiến cậu trở thành ""điểm neo tinh thần"" của mọi người."
lang_multi_text.db,MultiText,Main_Rinascita_2_12_641_14,我们也正是循着，与搭档之间那份<ano=牵绊>坚固的链接</ano>，最终成功抵达了这里。,And the <ano=bond>unbreakable tether</ano> we share is what led us to you.,Chúng tôi cũng chính là nương theo <ano=mối liên kết>sợi dây bền chặt</ano> giữa những người đồng hành ấy mà cuối cùng đã đến được đây.
lang_multi_text.db,MultiText,Main_Rinascita_2_12_642_1,我不会辜负你们。,I won't let you down.,Tôi sẽ không phụ lòng mọi người.
lang_multi_text.db,MultiText,Main_Rinascita_2_12_642_2,你们也帮助了我。,"I'm here because of all of you, too.",Mọi người cũng đã giúp tôi mà.
