db_file,table_name,id,zh,en,vi
lang_multi_text.db,MultiText,JKXCCZST_17_8,唉，就是书架那边那个自称监测员的家伙。,Look at that guy over there by the bookshelf. The so-called <i>caretaker</i>.,"Hừ, chính là gã ở bên kệ sách tự xưng là nhân viên giám sát ấy."
lang_multi_text.db,MultiText,JKXCCZST_17_9,他平常不是在看书，就是在声骸旁边转来转去……甚至有一次，我看到他一边摸一只声骸的翅膀，一边喃喃自语什么！,"He's either buried in books or pacing around the Echoes... I even saw him reach out and touch one of their wings! He was muttering to himself the whole time, too.","Hắn bình thường không đọc sách thì quanh quẩn bên mấy con Thanh Hài... Thậm chí có lần, tôi thấy hắn vừa sờ cánh một con Thanh Hài vừa lẩm bẩm gì đó!"
lang_multi_text.db,MultiText,JKXCCZST_18_1,别过来，别过来……,"Don't come any closer, don't come any closer…","Đừng lại gần, đừng lại gần..."
lang_multi_text.db,MultiText,JKXCCZST_18_2,什么别过来？,What are you talking about?,Gì mà đừng lại gần?
lang_multi_text.db,MultiText,JKXCCZST_18_3,我要过来咯。,I'm coming closer.,Tôi lại gần đây.
lang_multi_text.db,MultiText,JKXCCZST_18_4,咿啊啊啊啊啊！,Eeeehhh!!,Aaaaaah!
lang_multi_text.db,MultiText,JKXCCZST_18_5,等等，原来不是声骸啊……,"Wait, you're not an Echo...","Khoan, hóa ra không phải Thanh Hài à..."
lang_multi_text.db,MultiText,JKXCCZST_18_6,刚刚，我好像看见有什么光闪了一下，我还以为是有声骸活过来了……,Wait. I think I just saw something flash and for a second there I thought one of those Echoes came to life.,"Vừa rồi, tôi hình như thấy cái gì đó lóe sáng, tưởng là có Thanh Hài sống dậy rồi..."
lang_multi_text.db,MultiText,JKXCCZST_18_7,唉，在这个地方工作太可怕了。我要辞职，我一定要辞职……,Working here is just terrifying. I'm quitting... I have to quit...,"Hừ, làm việc ở chỗ này đáng sợ quá. Tôi phải nghỉ việc, nhất định phải nghỉ việc..."
lang_multi_text.db,MultiText,JKXCCZST_1_1,有问题，我们刚才送进去的雕塑绝对有问题……,"I'm telling you, there's something wrong with that statue we dropped off...","Có vấn đề, cái bức tượng chúng ta vừa chuyển vào chắc chắn có vấn đề..."
lang_multi_text.db,MultiText,JKXCCZST_1_10,万一你把他们的“秘密”说中了，那就太可怕了。,"And if you so much as slip and reveal one of their ""secrets""? Well, that could turn very ugly for you.","Lỡ mày nói trúng ""bí mật"" của bọn họ, thì khỏi nói rồi đấy."
lang_multi_text.db,MultiText,JKXCCZST_1_2,怎么可能整座雕塑都保存完好，只有底座上有一道划痕呢？说不定，这就是打开某个贵族地下密室的机关。,"How is the whole thing still intact, except for a scratch on the base? Could it be some kind of trigger for a nobleman's hidden chamber?","Làm sao mà cả bức tượng được bảo quản nguyên vẹn, chỉ có bệ tượng là có một vết xước? Biết đâu, đây chính là cơ quan mở cánh cửa dẫn đến phòng bí mật dưới lòng đất của quý tộc nào đó."
lang_multi_text.db,MultiText,JKXCCZST_1_3,而那具雕塑的内容，一只霜鬃狼……这是死亡与复仇的象征，难道说，这间地下密室里，正酝酿着什么反叛的计划……,"And the statue itself... Frostscourge Stalkers are symbols of death and vengeance, you know! Maybe there's a rebellion brewing in that secret chamber...","Mà nội dung bức tượng đó, một con Sương Tông Lang... đó là biểu tượng của cái chết và sự trả thù. Chẳng lẽ, trong căn phòng bí mật dưới lòng đất ấy, đang ấp ủ âm mưu phản loạn gì đó..."
lang_multi_text.db,MultiText,JKXCCZST_1_4,闭嘴吧你。活儿太少的话，下班可以去修会做义工中和一下。,"Oh, shut it. If you've got time for daydreaming, go take up volunteering at the Order.",Câm mồm đi. Rảnh quá thì tan ca đi làm tình nguyện ở Giáo Đoàn cho bớt nhàn.
lang_multi_text.db,MultiText,JKXCCZST_1_5,啧，你这人怎么这么没劲？,"Ah, you're no fun.","Tch, mày chán thật đấy."
lang_multi_text.db,MultiText,JKXCCZST_1_6,我们每天把这些宝贝从列车上搬下来——这可是看穿那些贵族秘密的好机会啊。,We haul these treasures down the express every day. It's a golden opportunity to uncover all the nobles' dirty little secrets.,Ngày nào chúng ta cũng khuân mấy thứ quý giá này xuống tàu - đây là cơ hội tuyệt vời để nhìn thấu bí mật của mấy tay quý tộc kia đấy.
lang_multi_text.db,MultiText,JKXCCZST_1_7,你应该知道，金库出于安全考量，给每一件藏品都配备了可以实时查看、附带录音的监控吧。,"You know the vault monitors everything, right? Cameras and audio, all synced to record every word you say.","Mày biết rồi đấy, vì lý do an ninh, kho bạc lắp camera giám sát có thu âm theo thời gian thực cho từng hiện vật cơ mà."
lang_multi_text.db,MultiText,JKXCCZST_1_8,那又怎么样？,So what?,Thì sao?
lang_multi_text.db,MultiText,JKXCCZST_1_9,我的意思是，他们能看到藏品，也能听到你在说什么。,"What I'm saying is, they're watching the items... and listening to you.","Ý tao là, họ vừa thấy hiện vật, vừa nghe được mày đang nói gì."
lang_multi_text.db,MultiText,JKXCCZST_2_1,怀念拉古那城，怀念热闹的空气，怀念不被天花板遮盖的蓝天……,"Ah, Ragunna... I miss the noise and bustle of the city. And the blue skies, not this ceiling overhead...","Nhớ thành phố Ragunna quá, nhớ bầu không khí sôi động, nhớ bầu trời xanh không bị trần nhà che khuất..."
lang_multi_text.db,MultiText,JKXCCZST_2_2,在这种密不透风的地方工作，和被诫令院关起来有什么区别……,Working in a place like this is no different than being locked away by the Chamber of Discipline.,"Làm việc ở nơi kín mít thế này, có khác gì bị Viện Giới Luật nhốt lại đâu..."
lang_multi_text.db,MultiText,JKXCCZST_2_3,狂欢节还没结束，要不我们趁这段时间请个假，回一趟城里。,"It's still the Carnevale, isn't it? How about we take a little time off and head back to the city?","Lễ hội hóa trang vẫn chưa kết thúc, hay là chúng ta tranh thủ xin nghỉ phép, về thành phố một chuyến đi."
lang_multi_text.db,MultiText,JKXCCZST_2_4,运气好的话，说不定还能见到今年的“桂冠”。,"If we're lucky, we might even get a glimpse of this year's Laureate.","May mắn thì biết đâu còn được gặp ""Nguyệt Quế"" năm nay."
lang_multi_text.db,MultiText,JKXCCZST_3_1,我要在贵行存入一批新的藏品。,I'd like to deposit a new collection of items.,Tôi muốn gửi một lô sưu tập mới vào quý ngân hàng.
lang_multi_text.db,MultiText,JKXCCZST_3_2,很荣幸为您提供服务，提贝里奥先生。,"It is our pleasure to assist you, Mr. Tiberio.","Rất hân hạnh được phục vụ ngài, ngài Tiberio."
lang_multi_text.db,MultiText,JKXCCZST_3_3,您是我们的终身储户，我们将为您的藏品追加额外保险。,"As our lifelong patron, your collection will receive additional insurance for safekeeping.","Ngài là khách hàng trọn đời của chúng tôi, chúng tôi sẽ bổ sung bảo hiểm thêm cho bộ sưu tập của ngài."
lang_multi_text.db,MultiText,JKXCCZST_3_4,不过，您这次亲自到场，而不使用终端委托，是还有什么需要么？,"But if you don't mind me asking, you came in person today instead of using a Terminal for delivery. Is there something else you require?","Tuy nhiên, lần này ngài đích thân đến thay vì ủy thác qua thiết bị đầu cuối, ngài còn cần gì thêm không ạ?"
lang_multi_text.db,MultiText,JKXCCZST_3_5,我祖父在这里存储过一幅油画，我想检查一下。,My grandfather stored a painting here. I'd like to check on it.,"Ông nội tôi từng gửi một bức tranh sơn dầu ở đây, tôi muốn kiểm tra nó."
lang_multi_text.db,MultiText,JKXCCZST_3_6,好的。贵金属与艺术品藏区在这个方向，请跟我来。,Alright. The Precious Metals and Artworks Despository is in this direction. Please follow me.,"Vâng. Khu trưng bày kim loại quý và tác phẩm nghệ thuật ở hướng này, mời ngài đi theo tôi."
lang_multi_text.db,MultiText,JKXCCZST_4_1,欢迎光临埃弗拉德金库，请问您需要办理什么业务？,Welcome to Averardo Vault. Is there something I can help you with?,"Chào mừng quý khách đến với Hầm Averardo, xin hỏi quý khách cần sử dụng dịch vụ gì?"
lang_multi_text.db,MultiText,JKXCCZST_4_10,好的。感谢您选择埃弗拉德金库的声骸存储服务。,Alright. Thank you for choosing Averardo Vault's Echo storage services.,Vâng. Cảm ơn quý khách đã chọn dịch vụ lưu trữ Thanh Hài của Hầm Averardo.
lang_multi_text.db,MultiText,JKXCCZST_4_11,“咕咕河豚”属于低估值声骸，如需储存，您需要自行为其购买保险，并以占地面积为单位支付保管费用。,"Gulpuffs are classified as low-value Echoes. If you wish to store them, you will need to purchase insurance yourself and pay a storage fee based on their storage unit.","""Gulpuff"" thuộc loại Thanh Hài giá trị thấp. Nếu cần lưu trữ, quý khách phải tự mua bảo hiểm và thanh toán phí bảo quản theo diện tích chiếm dụng."
lang_multi_text.db,MultiText,JKXCCZST_4_12,如需办理，我们将联系声骸藏区与您沟通。我们的团队会为您制定专属化方案，确保所有咕咕河豚在存储过程中都能得到最妥善的安置。,"If you'd like to sign up for this service, we'll have the Echo Depository contact you regarding further details right away. Our team will create a custom plan to meet all your storage needs, ensuring your Gulpuffs are carefully looked after during their time with us.","Nếu quý khách muốn đăng ký, chúng tôi sẽ liên hệ Khu Lưu Trữ Thanh Hài để trao đổi với quý khách. Đội ngũ của chúng tôi sẽ thiết kế phương án riêng, đảm bảo tất cả Gulpuff được bảo quản ổn thỏa nhất trong quá trình lưu trữ."
lang_multi_text.db,MultiText,JKXCCZST_4_13,如果还有事需要帮助，欢迎再次咨询。,I'll be here should you require any more assistance.,"Nếu còn cần hỗ trợ gì, xin quý khách cứ liên hệ."
lang_multi_text.db,MultiText,JKXCCZST_4_14,稍等，正在为您核实身份信息。,"One moment, I'll verify your identity details.","Xin quý khách chờ một chút, đang xác minh thông tin danh tính."
lang_multi_text.db,MultiText,JKXCCZST_4_15,非常抱歉，根据系统显示，您的账户中并没有存储相应数量的黄金。,"I'm sorry, but it appears your account doesn't currently show an order of one ton of gold.","Rất xin lỗi, theo hệ thống hiển thị, tài khoản của quý khách không có lưu trữ lượng vàng tương ứng."
lang_multi_text.db,MultiText,JKXCCZST_4_16,不过，您的账户经珂莱塔小姐认证，拥有最高的业务权限。,But I see your account has been verified by Lady Carlotta and currently enjoys premium services.,"Tuy nhiên, tài khoản của quý khách đã được tiểu thư Carlotta xác nhận, được hưởng quyền hạn dịch vụ cao nhất."
lang_multi_text.db,MultiText,JKXCCZST_4_17,如果您将来有存储一吨黄金的需求，我们将为您提供专属的黄金存储方案，确保您的资产得到最专业的保护与管理。,"Should you wish to store a ton of gold in the future, we'll provide an exclusive plan and ensure your assets receive the most professional management and protection.","Nếu trong tương lai quý khách có nhu cầu lưu trữ một tấn vàng, chúng tôi sẽ cung cấp phương án bảo quản vàng riêng biệt, đảm bảo tài sản của quý khách được bảo vệ và quản lý chuyên nghiệp nhất."
lang_multi_text.db,MultiText,JKXCCZST_4_18,如果还有事需要帮助，欢迎再次咨询。,I'll be here should you require any more assistance.,"Nếu còn cần hỗ trợ gì, xin quý khách cứ liên hệ."
lang_multi_text.db,MultiText,JKXCCZST_4_19,……,...,...
lang_multi_text.db,MultiText,JKXCCZST_4_2,介绍一下这里。,I'd appreciate a formal introduction.,Giới thiệu cho tôi về nơi này đi.
lang_multi_text.db,MultiText,JKXCCZST_4_20,（她刚才是不是叹气了？）,(Did she really just sigh?),(Cô ấy vừa thở dài à?)
lang_multi_text.db,MultiText,JKXCCZST_4_21,（小声）每天到底要来多少这种怪人……,(Quietly) How many more of these wackjobs are we going to get every day...,(Nhỏ giọng) Mỗi ngày đến bao nhiêu người kỳ quặc thế này...
lang_multi_text.db,MultiText,JKXCCZST_4_22,抱歉，我的意思是，很抱歉无法为您提供餐饮服务。,"Ahem, apologies. I mean I'm afraid we don't offer dining services here.","Xin lỗi, ý tôi là, rất tiếc chúng tôi không thể cung cấp dịch vụ ăn uống."
lang_multi_text.db,MultiText,JKXCCZST_4_23,如果您需要用餐，可以前往上层的杜卡特拍卖厅，那里的宴会厅有丰富的美食可供您选择。,"If you're looking to eat, you can visit the Ducat Hall upstairs. Their banquet hall offers a wide variety of delicious options.","Nếu quý khách cần dùng bữa, có thể đến Đại Sảnh Đấu Giá Ducat ở tầng trên, phòng tiệc ở đó có rất nhiều món ngon cho quý khách lựa chọn."
lang_multi_text.db,MultiText,JKXCCZST_4_24,如果还有事需要帮助，欢迎再次咨询。,I'll be here should you require any more assistance.,"Nếu còn cần hỗ trợ gì, xin quý khách cứ liên hệ."
lang_multi_text.db,MultiText,JKXCCZST_4_3,我要存一百只咕咕河豚。,I'd like to store a hundred Gulpuffs.,Tôi muốn gửi một trăm con Gulpuff.
lang_multi_text.db,MultiText,JKXCCZST_4_4,我那一吨黄金怎么样了？,How's my ton of gold coming along?,Một tấn vàng của tôi thế nào rồi?
lang_multi_text.db,MultiText,JKXCCZST_4_5,来碗炒饭。,I'd like a bowl of fried rice.,Cho tôi một bát cơm chiên.
lang_multi_text.db,MultiText,JKXCCZST_4_6,当然。埃弗拉德金库秉持着“私有财产神圣不可侵犯”的原则，是黎那汐塔内最为安全、稳固的场所。,"Averardo Vault operates under the principles of ""utmost respect for all private properties."" It is the safest and most impregnable place in Rinascita.","Tất nhiên. Hầm Averardo tuân thủ nguyên tắc ""tài sản tư hữu bất khả xâm phạm"", là nơi an toàn và kiên cố nhất trong Rinascita."
lang_multi_text.db,MultiText,JKXCCZST_4_7,您现在位于的是埃弗拉德金库的下层。您送入金库的藏品，都将被安全地保存在这里。,You are currently in the lower level of Averardo Vault. Any items you choose to deposit will be stored here.,Quý khách đang ở tầng dưới của Hầm Averardo. Mọi vật phẩm quý khách gửi vào đều sẽ được bảo quản an toàn tại đây.
lang_multi_text.db,MultiText,JKXCCZST_4_8,下层共设有三个主要分区：贵金属与艺术品藏区、声骸藏区与人才藏区。无论资产还是才能，埃弗拉德金库都将最大程度为您保存它们的价值。,"The underground is divided into three main areas: The Precious Metals and Artworks Depository, the Echo Depository, and the Talent Depository. Whether you're storing valuables or showcasing creativity, Averardo Vault is here to help you make the most of them with unmatched service.","Tầng dưới có ba khu vực chính: Khu Kim Loại Quý và Nghệ Thuật Phẩm, Khu Thanh Hài và Khu Nhân Tài. Dù là tài sản hay tài năng, Hầm Averardo đều sẽ bảo toàn giá trị của chúng ở mức tốt nhất."
lang_multi_text.db,MultiText,JKXCCZST_4_9,如果还有事需要帮助，欢迎再次咨询。,I'll be here should you require any more assistance.,"Nếu còn cần hỗ trợ gì, xin quý khách cứ liên hệ."
lang_multi_text.db,MultiText,JKXCCZST_5_1,今天的交接清单核对了吗？我看贵金属区域有新增的条目。,Have you gone over the shift change checklist? I see there's a new entry in the precious metals section.,Danh sách bàn giao hôm nay đã đối chiếu chưa? Tôi thấy khu kim loại quý có mục mới.
lang_multi_text.db,MultiText,JKXCCZST_5_2,没问题，编号都录入系统了。,Nothing to be concerned about. The serial number is already in the system.,"Không vấn đề gì, mã số đã được nhập vào hệ thống rồi."
lang_multi_text.db,MultiText,JKXCCZST_6_1,艺术品区376号柜的报警响了，好像湿度超出了正常范围。,The alarm on Display Case 376 in the artworks depository just went off. Looks like the humidity level got too high.,"Tủ 376 ở khu nghệ thuật phẩm bị báo động rồi, có vẻ độ ẩm vượt quá mức bình thường."
lang_multi_text.db,MultiText,JKXCCZST_6_2,是湿度探测器的问题，已经联系技术部门了。,Just the humidity detector acting up. I've already notified Maintenence.,"Là do cảm biến độ ẩm có vấn đề, đã liên hệ bộ phận kỹ thuật rồi."
lang_multi_text.db,MultiText,JKXCCZST_6_3,再写一份事故报告请示上级吧。,"Write up an incident report for the higher-ups, will you?",Viết thêm một bản báo cáo sự cố trình lên cấp trên đi.
lang_multi_text.db,MultiText,JKXCCZST_6_4,毕竟是高价值藏品，我们担不起这个责任。,"With such high-value pieces, we don't want any liability on our heads.","Dù sao cũng là vật phẩm giá trị cao, chúng ta không gánh nổi trách nhiệm này đâu."
lang_multi_text.db,MultiText,JKXCCZST_7_1,听说了吗？最近又来了一伙想偷“秘藏”的盗贼。,"Heard the latest? Another one's tried to make off with the ""secret cache.""","Nghe chưa? Gần đây lại có một nhóm trộm muốn lấy cắp ""bảo vật bí mật"" đấy."
lang_multi_text.db,MultiText,JKXCCZST_7_2,这么多年了，他们能不能成功一次？我也想知道这金库里的“秘藏”到底是什么。,"After all these years, you'd think one of them would actually succeed. Honestly, I'm a bit curious myself about what it actually is.","Bao nhiêu năm rồi, có ai thành công lần nào chưa? Tôi cũng muốn biết ""bảo vật bí mật"" trong hầm rốt cuộc là gì."
lang_multi_text.db,MultiText,JKXCCZST_7_3,难道是莫塔里家的惊天大秘密？比如……珂莱塔小姐原本其实是翡萨烈家的孩子，但因为共鸣天赋被看重，所以被送到了莫塔里家？！,"The Montelli family's most scandalous secret? Something like... Lady Carlotta was actually born to a Fisalia, but her Resonance abilities got her sent to the Montellis!","Hay là bí mật chấn động của gia tộc Montelli? Ví dụ... tiểu thư Carlotta thực ra là con nhà Fisalia, nhưng vì thiên phú cộng hưởng nổi bật nên được gửi sang gia tộc Montelli?!"
lang_multi_text.db,MultiText,JKXCCZST_7_4,呃……你想象力真好。,Ugh... your imagination is something else.,Ơ... trí tưởng tượng của cậu phong phú thật.
lang_multi_text.db,MultiText,JKXCCZST_7_5,我倒是想起来，金库很多年前有过一位传奇职员。因为当时的借贷部经理收回了对他家企业的贷款，弄得他家破人亡，誓要向金库复仇。,"But you reminded me of a tale. Years ago, the Vault had a legendary employee. The loan manager pulled the funding on his family business and ruined him. The man vowed vengeance against the Vault itself after that.","Tôi lại nhớ ra, nhiều năm trước hầm có một nhân viên huyền thoại. Vì lúc đó trưởng bộ phận cho vay thu hồi khoản vay của doanh nghiệp nhà anh ta, khiến anh ta khuynh gia bại sản, thề phải trả thù hầm."
lang_multi_text.db,MultiText,JKXCCZST_7_6,听说他在工作中神挡杀神，佛挡杀佛，一边说着什么“百倍奉还”，一边把阻挠他的人都报复了个遍。,"I heard he vowed to pay back the man who did that to him a hundredfold, come hell or high water.","Nghe nói trong công việc anh ta chẳng sợ trời sợ đất, vừa nói gì đó ""trả gấp trăm lần"", vừa trả thù hết tất cả những ai cản trở mình."
lang_multi_text.db,MultiText,JKXCCZST_7_7,说不定“秘藏”就是他的复仇计划？,"Maybe the ""secret cache"" is his way of finally getting even?","Biết đâu ""bảo vật bí mật"" chính là kế hoạch trả thù của anh ta?"
lang_multi_text.db,MultiText,JKXCCZST_8_1,唉，要是能再看一次就好了……,"Oh, if only I could see them again...","Hah, giá mà được xem lại một lần nữa..."
lang_multi_text.db,MultiText,JKXCCZST_8_2,你好。,Hello there.,Xin chào.
lang_multi_text.db,MultiText,JKXCCZST_8_3,你想看什么？,Hi there. What do you want to see?,Bạn muốn xem gì?
lang_multi_text.db,MultiText,JKXCCZST_8_4,你好，你是来金库办理业务的客户吗？,Hello! Are you one of the Vault's customers?,"Xin chào, bạn là khách hàng đến hầm làm thủ tục à?"
lang_multi_text.db,MultiText,JKXCCZST_8_5,我是在这里工作的鉴定师，这么多年一直负责藏品的估值工作。,I'm an appraiser here. I've been valuing collections for years.,"Tôi là thẩm định viên làm việc ở đây, bao nhiêu năm nay phụ trách công việc định giá vật phẩm lưu trữ."
lang_multi_text.db,MultiText,JKXCCZST_8_6,不过，几年前有件事让我一直很在意。当时，莫塔里家的家主亲自送来一批藏品，我就按照惯例对它们进行了估值。,"Well, but something's been bothering me for a long time. Once, the head of the Montellis brought in some items for appraisal. I evaluated them the usual way.","Nhưng có một chuyện mấy năm trước khiến tôi cứ bận tâm mãi. Lúc đó, đương gia gia tộc Montelli đích thân mang đến một lô vật phẩm, tôi làm theo thường lệ và tiến hành định giá chúng."
lang_multi_text.db,MultiText,JKXCCZST_8_7,我本来以为那会是我人生中数额最大的一个单子呢。但奇怪的是，它们中的很多以市场角度看，几乎可以说……毫无价值。,"At the time, I was sure it was the most valuable collection I'd ever handled. But to my surprise, many of the pieces seemed... almost worthless when judged by market value.","Tôi cứ tưởng đó sẽ là đơn hàng lớn nhất đời tôi. Nhưng kỳ lạ thay, rất nhiều trong số đó, xét theo góc độ thị trường, gần như có thể nói... chẳng có giá trị gì."
lang_multi_text.db,MultiText,JKXCCZST_8_8,不久之后，那批藏品就被封存起来，再也没人见过了。,"Not long after, the collection was sealed away and has never been seen since.","Không lâu sau, lô vật phẩm đó bị niêm phong, không ai được nhìn thấy nữa."
lang_multi_text.db,MultiText,JKXCCZST_8_9,难道是我当时看漏了什么吗……唉，要是能再看一次，我一定能对它们进行正确的估值。,"Could I have overlooked something? Oh… if only I could examine those items once more, I would be certain to appraise them with the clarity they deserve.","Hay là lúc đó tôi bỏ sót điều gì... Hah, nếu được xem lại một lần, tôi chắc chắn sẽ định giá chúng chính xác."
lang_multi_text.db,MultiText,JKXCCZST_9_1,你、好，欢迎光临、埃弗拉德金库！,H-hello! Welcome to... Averardo Vault!,"Xin, chào, chào mừng đến với, Hầm Averardo!"
lang_multi_text.db,MultiText,JKXCCZST_9_2,就由我来为您，带、带、带……带鹿！,Allow me to... show you... show you the wire!,"Để tôi, dẫn, dẫn, dẫn... dẫn lụ!"
lang_multi_text.db,MultiText,JKXCCZST_9_3,你是想说“带路”吧。,You mean show me the way?,"Ý bạn là ""dẫn lối"" chứ."
lang_multi_text.db,MultiText,JKXCCZST_9_4,噢，没错，“带路”！,"Oh! Yes! ""Show the way""!","Ồ, đúng rồi, ""dẫn lối""!"
lang_multi_text.db,MultiText,JKXCCZST_9_5,非常抱歉，让我们拥有对话功能的改造者，已经、离开很久。我们的常识模块，需要校准。,"Apologies. Our creator, the one who gave us speech, has been gone for a long time. Our knowledge module... needs fine-tuning.","Rất xin lỗi, người cải tạo đã cho chúng tôi chức năng nói chuyện, đã, rời đi từ lâu. Mô-đun kiến thức của chúng tôi, cần được hiệu chỉnh."
lang_multi_text.db,MultiText,JKXCCZST_9_6,如果您能帮助我们，我们会、感谢你。,If you can help us... We will... Thank you.,"Nếu bạn có thể giúp chúng tôi, chúng tôi sẽ, cảm ơn bạn."
lang_multi_text.db,MultiText,JKXCCZST_9_7,那个人、教育过我们，对帮助自己的人，要感恩、感恩。,"That person... Taught us... The one who helps... Tell them thank you, big thank you.","Người đó, đã dạy chúng tôi, với người giúp đỡ mình, phải biết ơn, biết ơn."
lang_multi_text.db,MultiText,JijianTask_12903500_HintText,将深空测界台推进至阶段Ⅱ：悬台工程,Reach the Platform Phase,Đưa Đài Quan Sát Không Gian Sâu đến Giai Đoạn II: Công Trình Bệ Nổi
