db_file,table_name,id,zh,en,vi
lang_favor.db,FavorStory,142,"茶馆有许多客人，渊武在这里与客人们品茶闲谈。
无光一役后，渊武重伤，他主动离开了夜归，重新回到家中，继承了这间茶馆。他努力回忆着记忆中父母的样子，练习烹茶的方法，学习待人接客之道，将幼时不愿做的杂事，一一拾起。
因主人年老体弱而停业的茶馆，再次弥漫起了茶香。曾经困住了渊武的小小茶室，现在却恰到好处地安放了他那颗被撕裂的心。
在这里，他可以与客人品茶论道，可以用茶疗术解开他人的心结，若是茶馆不忙，偷得浮生半日闲，他还能在门前逗逗猫。
他不必再一遍又一遍回忆无光之森中，那令他恐惧的一切。那些阴森的树影，那些骇人的哀嚎，那些无法摆脱的泥沼，都被茶水阻隔于记忆的对岸。
只是，那道他追求已久，相伴已久的电光，却也极少再次闪现。

渊武翻出了父亲留下的茶叶，一一品尝过去。
茶的品种不同，沏茶的方法不同，都会让茶有很大的差别，有甘甜，有苦涩，有酸，有香，有浓，有淡……正是父亲所说的百味人生。
他再次将一绿一紫两种茶摆在自己面前。
紫色的茶汤在茶杯之中微漾，渊武端起浅酌，入口微甘的茶汤立刻让他回想起曾经，只是那曾令他甘之如饴的铁锈味道，立刻化作辛辣的刀子顺着喉管，贯穿他的心脏。
渊武颤抖着将茶杯放下，转而品尝另一杯。
也许是时光易逝，新茶变作陈茶，曾经翠绿的茶水此刻已转变为幽绿，他叹息着喝了一口，浓烈的苦涩却裹挟着一切过不去的过往，被他咽下。
他选择的人生，只有他才能知道其中滋味，也只有他，或许可以在以后让自己走出无光，再次握住人生的闪光。",,"Quán trà có nhiều khách, Uyên Vũ ở đây thưởng trà trò chuyện cùng khách.
Sau trận Vô Quang, Uyên Vũ bị trọng thương, cậu chủ động rời Dạ Quy, trở về nhà, thừa kế quán trà này. Cậu cố nhớ lại hình ảnh cha mẹ trong ký ức, luyện cách pha trà, học cách tiếp khách, nhặt lại từng việc vặt thuở nhỏ không muốn làm.
Quán trà đã đóng cửa vì chủ nhân già yếu, nay lại tỏa hương trà. Gian trà nhỏ từng giam cầm Uyên Vũ, giờ lại vừa vặn an ủi trái tim bị xé nát của cậu.
Ở đây, cậu có thể cùng khách thưởng trà đàm đạo, có thể dùng trà liệu pháp gỡ mối u sầu cho người khác, nếu quán vắng, trộm được nửa ngày thảnh thơi, cậu còn trêu mèo trước cửa.
Cậu không phải nhớ đi nhớ lại những gì khiến cậu kinh hãi trong Rừng Vô Quang. Những bóng cây âm u, những tiếng gào rùng rợn, những vũng lầy không thoát được, đều bị dòng trà ngăn cách bên kia bờ ký ức.
Chỉ là, đạo điện quang cậu theo đuổi bấy lâu, đồng hành bấy lâu, cũng hiếm khi lóe sáng trở lại.

Uyên Vũ lục ra trà cha để lại, nếm thử từng loại.
Loại trà khác nhau, cách pha khác nhau, đều khiến trà rất khác, có ngọt, có đắng, có chua, có thơm, có đậm, có nhạt... đúng là trăm vị đời người như cha nói.
Cậu lại đặt hai loại trà xanh và tím trước mặt.
Trà tím gợn nhẹ trong chén, Uyên Vũ nâng lên nhấp một ngụm, trà vừa vào miệng hơi ngọt lập tức đưa cậu nhớ về ngày xưa, chỉ là vị tanh sắt từng khiến cậu say mê, lập tức hóa thành con dao cay nồng trượt xuống cổ họng, xuyên qua tim.
Uyên Vũ run rẩy đặt chén trà xuống, quay sang nếm chén kia.
Có lẽ vì thời gian trôi mau, trà mới thành trà cũ, trà xanh lục ngày nào giờ đã chuyển sang lục sẫm, cậu thở dài uống một ngụm, vị đắng nồng nàn kéo theo mọi quá khứ không qua nổi, bị cậu nuốt trôi.
Cuộc đời cậu chọn, chỉ mình cậu mới biết mùi vị, và cũng chỉ mình cậu, có lẽ sau này mới có thể tự mình bước ra khỏi bóng tối, một lần nữa nắm lấy tia sáng đời mình."
lang_favor.db,FavorStory,143,关于阿呜,,Về A Ô
lang_favor.db,FavorStory,144,"阿呜是一个特殊的客人。
一个爱来夜莺茶馆，却从不进门的客人。
野性难驯的小老虎总是将茶疗术所使用的茶叶，与森林中苦涩的草药等同起来，不是很愿意靠近。不过这倒是方便了渊武避开他。
“我又来挑战了！”
“老板，阿呜小团长又来了。”
爱看热闹的客人趁机起哄，怂恿渊武去和年轻气盛的挑战者对战，而渊武只是无奈地摇头。
“唉……我这可是正经茶馆，总来踢馆，迟早叫人把这里当成是武馆。”
“嗷呜？阿大，这次是你来应战吗？好啊，让我们痛快地来打一场吧！看招吧，嘿！”
渊武躲在茶香氤氲的柜台之后，隔着茶馆的大门看向阳光下，肆意与野猫追逐嬉闹的阿呜的身影。
一扇门内外，仿佛两段岁月。
那些年轻、锐利、闪闪发光的时光，就在他一伸手便可以推开的门外。
渊武盯着看了一会，终究还是收回了目光，默默擦拭起手边的茶杯。
“喵呜！”
“我又输了……阿大，你可真厉害！”
“阿呜小团长那么强，结果大猫却打不过小猫，不管看几次都觉得有意思。老板你也快看啊。”
“让客人在我这因战斗受伤可不好。而且，‘小咪’才是她的名字，可不是什么‘阿大’，叫她那么难听的名字，她肯定会生气抓人的。”
“呃，老板，你这起名水平也……呵呵……”
不管屋内两人的讨论，阿呜抱起仍在伸爪子挠人的猫咪，已经习惯了人类触摸的猫咪总算安静下来。
“我听说这里的主人也有很强的拳头，不知道和我们俩的比起来，哪个更厉害呢？”
也许还有许多人，在等待着雷光再次闪耀。",,"A Ô là một vị khách đặc biệt.
Một vị khách thích đến quán trà Dạ Oanh, nhưng không bao giờ bước vào.
Cô hổ nhỏ hoang dã khó thuần hóa luôn coi trà dùng trong trà liệu pháp ngang hàng với thảo dược đắng trong rừng, không mấy muốn lại gần. Nhưng điều này lại tiện cho Uyên Vũ tránh cô ấy.
""Tôi lại đến thách đấu đây!""
""Ông chủ ơi, tiểu đoàn trưởng A Ô lại đến rồi.""
Khách thích xem náo nhiệt nhân dịp xúi giục Uyên Vũ đi đấu với đối thủ trẻ tuổi hiếu thắng, còn Uyên Vũ chỉ bất lực lắc đầu.
""Hà... đây là quán trà đàng hoàng mà, cứ đến phá hoài, sớm muộn người ta tưởng đây là võ đường mất.""
""Hẩu? A Đại, lần này cậu ra ứng chiến à? Hay đấy, cho mình đánh một trận sướng tay nào! Xem chiêu, hé!""
Uyên Vũ núp sau quầy nghi ngút hương trà, qua cánh cửa quán nhìn ra bóng dáng A Ô dưới ánh nắng thoải mái đuổi bắt đùa giỡn với lũ mèo hoang.
Một cánh cửa trong ngoài, tựa hai quãng đời.
Những tháng ngày trẻ trung, sắc bén, tỏa sáng lấp lánh, ở ngay ngoài cánh cửa cậu chỉ cần đưa tay đẩy.
Uyên Vũ nhìn một lúc, rồi rốt cuộc vẫn thu ánh mắt lại, lặng lẽ lau chiếc chén trà bên tay.
""Meo!""
""Tôi lại thua rồi... A Đại, cậu giỏi thật đấy!""
""Tiểu đoàn trưởng A Ô mạnh vậy mà con hổ lớn lại thua con mèo nhỏ, xem mấy lần vẫn thấy hay. Ông chủ, xem đi!""
""Để khách bị thương vì đánh nhau ở chỗ tôi thì không tốt. Mà 'Tiểu Mị' mới là tên nó, không phải 'A Đại' gì đâu, gọi tên khó nghe thế nó chắc chắn sẽ cáu mà cào cho đấy.""
""Ơ, ông chủ, khả năng đặt tên của ông cũng... hehe...""
Bất chấp cuộc bàn tán của hai người trong nhà, A Ô ôm lấy con mèo vẫn đang vươn vuốt cào người, con mèo đã quen với sự vuốt ve của con người cuối cùng cũng yên lặng.
""Nghe nói chủ nhân ở đây cũng có nắm đấm rất mạnh, không biết so với hai đứa mình, ai giỏi hơn nhỉ?""
Có lẽ còn nhiều người đang chờ đợi sấm sét một lần nữa tỏa sáng."
lang_favor.db,FavorStory,145,关于卡卡罗,,Về Carlotta
lang_favor.db,FavorStory,146,"渊武和无数客人打交道，在茶香中听过无数……小道消息。
夜莺茶馆虽然是一个正经茶馆，但有人聚集的地方，自然就有着各种流言、传闻和故事。
身为茶馆老板的渊武，在招待客人的时候，也总会顺势听上那么一耳朵，因此确实比寻常天城市民要了解更多的新信息。
据说那个来自异国的奇怪战士加入了夜归，据说他总不遵守夜归纪律，仗着武力值高就往外乱跑，据说，他对无光之森很有兴趣……
他会强大到能够拯救那一天陷入苦战的夜归吗？他又是否可以终结无光之森的噩梦呢？

渊武在各种零碎的信息中，寻找着那个人强大的证据，来验证他会在无光之森中成功，抑或失败。但渊武却从未想过会和他直接见面，也未想过此人会与传闻有如此大的出入。
“我这次差点就到达无光之森了，就差几百米的一个沟，结果被新任务叫去别的地方了。怎么那么巧啊，你说忌炎是不是在我身上装监控了？但我觉得他不是这种人，不是说我信任他……我是觉得既然我觉得他装了，那他应该就是没装，毕竟我觉得的一般都不准。”
那是个平常的午后，客人不多，渊武便在茶馆后院悠闲地喂猫，却突然听到一墙之隔外传来狗叫声和碎碎念的声音。
渊武默默理了一下声音主人的逻辑，只感觉一阵眩晕，立刻放弃了。但碎碎念还在继续着。
“下次我肯定能到，就能会会那家伙有多厉害，它让森林无光，那我就让森林重新亮起来。”
是否真的会有一天，能有人让无光之森迎来了它的黎明呢？",,"Uyên Vũ tiếp xúc vô số khách, trong hương trà đã nghe vô số... tin vỉa hè.
Quán trà Dạ Oanh tuy là quán trà đàng hoàng, nhưng nơi có người tụ tập, tự nhiên có đủ loại tin đồn, truyền thuyết và câu chuyện.
Với tư cách ông chủ quán trà, Uyên Vũ khi tiếp khách cũng thuận tiện lắng nghe một tai, nên quả thật biết nhiều tin tức mới hơn dân Thiên Thành bình thường.
Nghe nói chiến sĩ kỳ lạ từ nước ngoài đã gia nhập Dạ Quy, nghe nói hắn luôn không tuân thủ kỷ luật Dạ Quy, cậy sức mạnh cao mà chạy lung tung, nghe nói, hắn rất hứng thú với Rừng Vô Quang...
Hắn có mạnh đến mức cứu được những Dạ Quy lâm vào khổ chiến ngày ấy không? Hắn có thể kết thúc ác mộng Rừng Vô Quang không?

Uyên Vũ trong đống thông tin vụn vặt, tìm kiếm bằng chứng về sức mạnh của người đó, để xác nhận hắn sẽ thành công hay thất bại ở Rừng Vô Quang. Nhưng Uyên Vũ chưa bao giờ nghĩ sẽ gặp trực tiếp, cũng không ngờ người này khác xa tin đồn đến thế.
""Lần này tôi suýt nữa đã đến Rừng Vô Quang rồi, chỉ thiếu một cái rãnh vài trăm mét, kết quả bị nhiệm vụ mới gọi đi chỗ khác. Sao trùng hợp thế, anh nói Kỵ Viêm có lắp thiết bị theo dõi trên người tôi không? Nhưng tôi thấy ổng không phải loại người đó, không phải tôi tin ổng... Tôi thấy vì tôi thấy ổng lắp rồi, thì ổng chắc là không lắp, vì cái tôi thấy thường là không đúng.""
Đó là một buổi chiều bình thường, khách không đông, Uyên Vũ thảnh thơi cho mèo ăn ở sân sau quán trà, bỗng nghe thấy tiếng chó sủa và tiếng lẩm bẩm từ bên kia bức tường.
Uyên Vũ lặng lẽ sắp xếp logic của người nói, chỉ thấy chóng mặt, lập tức bỏ cuộc. Nhưng tiếng lẩm bẩm vẫn tiếp tục.
""Lần sau tôi chắc chắn đến được, sẽ gặp thử xem thằng cha đó mạnh cỡ nào, nó làm rừng vô quang, thì tôi sẽ làm rừng sáng trở lại.""
Liệu thật sự sẽ có ngày, có người khiến Rừng Vô Quang đón bình minh?"
lang_favor.db,FavorStory,147,test/测试文本,,test/Văn bản thử nghiệm
lang_favor.db,FavorStory,148,test/测试文本,,test/Văn bản thử nghiệm
lang_favor.db,FavorStory,149,test/测试文本,,test/Văn bản thử nghiệm
lang_favor.db,FavorStory,150,test/测试文本,,test/Văn bản thử nghiệm
lang_favor.db,FavorStory,151,test/测试文本,,test/Văn bản thử nghiệm
lang_favor.db,FavorStory,152,test/测试文本,,test/Văn bản thử nghiệm
lang_favor.db,FavorStory,153,test/测试文本,,test/Văn bản thử nghiệm
lang_favor.db,FavorStory,154,test/测试文本,,test/Văn bản thử nghiệm
lang_favor.db,FavorStory,155,test/测试文本,,test/Văn bản thử nghiệm
lang_favor.db,FavorStory,156,test/测试文本,,test/Văn bản thử nghiệm
lang_favor.db,FavorStory,157,关于卡卡罗,,Về Calcharo
lang_favor.db,FavorStory,158,"渊武和无数客人打交道，在茶香中听过无数……小道消息。
夜莺茶馆虽然是一个正经茶馆，但有人聚集的地方，自然就有着各种流言、传闻和故事。
身为茶馆老板的渊武，在招待客人的时候，也总会顺势听上那么一耳朵，因此确实比寻常天城市民要了解更多的新信息。
据说那个来自异国的奇怪战士加入了夜归，据说他总不遵守夜归纪律，仗着武力值高就往外乱跑，据说，他对无光之森很有兴趣……
他会强大到能够拯救那一天陷入苦战的夜归吗？他又是否可以终结无光之森的噩梦呢？

渊武在各种零碎的信息中，寻找着那个人强大的证据，来验证他会在无光之森中成功，抑或失败。但渊武却从未想过会和他直接见面，也未想过此人会与传闻有如此大的出入。
“我这次差点就到达无光之森了，就差几百米的一个沟，结果被新任务叫去别的地方了。怎么那么巧啊，你说忌炎是不是在我身上装监控了？但我觉得他不是这种人，不是说我信任他……我是觉得既然我觉得他装了，那他应该就是没装，毕竟我觉得的一般都不准。”
那是个平常的午后，客人不多，渊武便在茶馆后院悠闲地喂猫，却突然听到一墙之隔外传来狗叫声和碎碎念的声音。
渊武默默理了一下声音主人的逻辑，只感觉一阵眩晕，立刻放弃了。但碎碎念还在继续着。
“下次我肯定能到，就能会会那家伙有多厉害，它让森林无光，那我就让森林重新亮起来。”
是否真的会有一天，能有人让无光之森迎来了它的黎明呢？",,"Uyên Vũ tiếp đãi vô số khách, giữa hương trà đã nghe biết bao... tin đồn.
Dù Quán Trà Dạ Oanh là một quán trà đàng hoàng, nhưng nơi nào có người tụ họp, nơi đó tự nhiên sẽ có đủ loại lời đồn, tin đồn và câu chuyện.
Với tư cách chủ quán, mỗi khi tiếp khách, Uyên Vũ luôn tranh thủ lắng nghe đôi chút, vì thế cô nắm được nhiều thông tin mới hơn hẳn so với người dân Thiên Thành bình thường.
Nghe nói có một chiến binh kỳ lạ đến từ nước ngoài đã gia nhập Dạ Quy, nghe nói anh ta luôn không tuân thủ kỷ luật Dạ Quy, cậy sức mạnh vượt trội mà chạy lung tung ra ngoài, nghe nói, anh ta rất hứng thú với Rừng Vô Quang...
Liệu anh ta có đủ mạnh để cứu Dạ Quy khỏi trận khổ chiến ngày ấy không? Liệu anh ta có thể chấm dứt cơn ác mộng của Rừng Vô Quang?

Từ những mẩu thông tin vụn vặt, Uyên Vũ tìm kiếm bằng chứng về sức mạnh của người đó, để xác nhận liệu anh ta sẽ thành công hay thất bại ở Rừng Vô Quang. Nhưng Uyên Vũ chưa bao giờ nghĩ sẽ gặp trực tiếp anh ta, càng không ngờ người này lại khác xa so với lời đồn đến vậy.
""Lần này tôi suýt nữa đã tới được Rừng Vô Quang rồi, chỉ còn cách một cái khe vài trăm mét thôi, kết quả lại bị nhiệm vụ mới gọi đi chỗ khác. Sao mà trùng hợp thế nhỉ, anh nói xem Kỵ Viêm có gắn thiết bị theo dõi lên người tôi không? Nhưng tôi thấy anh ấy không phải kiểu người như vậy, không phải là tôi tin tưởng anh ấy đâu... Ý tôi là, nếu tôi nghĩ anh ấy có gắn, thì chắc là anh ấy không gắn, vì cái tôi nghĩ thường là không đúng.""
Đó là một buổi chiều bình thường, khách không đông, Uyên Vũ đang thong thả cho mèo ăn ở sân sau quán trà, thì đột nhiên nghe thấy tiếng chó sủa và tiếng lẩm bẩm vọng từ bên kia bức tường.
Uyên Vũ lặng lẽ sắp xếp lại logic của chủ nhân giọng nói, chỉ thấy chóng mặt, rồi lập tức bỏ cuộc. Nhưng tiếng lẩm bẩm vẫn tiếp tục.
""Lần sau tôi nhất định sẽ tới được, sẽ xem thử thứ đó lợi hại cỡ nào, nó khiến khu rừng mất đi ánh sáng, thì tôi sẽ khiến khu rừng sáng trở lại.""
Liệu có thật sẽ đến một ngày, có ai đó mang đến bình minh cho Rừng Vô Quang?"
lang_favor.db,FavorStory,159,关于卡卡罗,,Về Calcharo
lang_favor.db,FavorStory,160,"渊武和无数客人打交道，在茶香中听过无数……小道消息。
夜莺茶馆虽然是一个正经茶馆，但有人聚集的地方，自然就有着各种流言、传闻和故事。
身为茶馆老板的渊武，在招待客人的时候，也总会顺势听上那么一耳朵，因此确实比寻常天城市民要了解更多的新信息。
据说那个来自异国的奇怪战士加入了夜归，据说他总不遵守夜归纪律，仗着武力值高就往外乱跑，据说，他对无光之森很有兴趣……
他会强大到能够拯救那一天陷入苦战的夜归吗？他又是否可以终结无光之森的噩梦呢？

渊武在各种零碎的信息中，寻找着那个人强大的证据，来验证他会在无光之森中成功，抑或失败。但渊武却从未想过会和他直接见面，也未想过此人会与传闻有如此大的出入。
“我这次差点就到达无光之森了，就差几百米的一个沟，结果被新任务叫去别的地方了。怎么那么巧啊，你说忌炎是不是在我身上装监控了？但我觉得他不是这种人，不是说我信任他……我是觉得既然我觉得他装了，那他应该就是没装，毕竟我觉得的一般都不准。”
那是个平常的午后，客人不多，渊武便在茶馆后院悠闲地喂猫，却突然听到一墙之隔外传来狗叫声和碎碎念的声音。
渊武默默理了一下声音主人的逻辑，只感觉一阵眩晕，立刻放弃了。但碎碎念还在继续着。
“下次我肯定能到，就能会会那家伙有多厉害，它让森林无光，那我就让森林重新亮起来。”
是否真的会有一天，能有人让无光之森迎来了它的黎明呢？",,"Uyên Vũ tiếp đãi vô số khách, giữa hương trà đã nghe biết bao... tin đồn.
Dù Quán Trà Dạ Oanh là một quán trà đàng hoàng, nhưng nơi nào có người tụ họp, nơi đó tự nhiên sẽ có đủ loại lời đồn, tin đồn và câu chuyện.
Với tư cách chủ quán, mỗi khi tiếp khách, Uyên Vũ luôn tranh thủ lắng nghe đôi chút, vì thế cô nắm được nhiều thông tin mới hơn hẳn so với người dân Thiên Thành bình thường.
Nghe nói có một chiến binh kỳ lạ đến từ nước ngoài đã gia nhập Dạ Quy, nghe nói anh ta luôn không tuân thủ kỷ luật Dạ Quy, cậy sức mạnh vượt trội mà chạy lung tung ra ngoài, nghe nói, anh ta rất hứng thú với Rừng Vô Quang...
Liệu anh ta có đủ mạnh để cứu Dạ Quy khỏi trận khổ chiến ngày ấy không? Liệu anh ta có thể chấm dứt cơn ác mộng của Rừng Vô Quang?

Từ những mẩu thông tin vụn vặt, Uyên Vũ tìm kiếm bằng chứng về sức mạnh của người đó, để xác nhận liệu anh ta sẽ thành công hay thất bại ở Rừng Vô Quang. Nhưng Uyên Vũ chưa bao giờ nghĩ sẽ gặp trực tiếp anh ta, càng không ngờ người này lại khác xa so với lời đồn đến vậy.
""Lần này tôi suýt nữa đã tới được Rừng Vô Quang rồi, chỉ còn cách một cái khe vài trăm mét thôi, kết quả lại bị nhiệm vụ mới gọi đi chỗ khác. Sao mà trùng hợp thế nhỉ, anh nói xem Kỵ Viêm có gắn thiết bị theo dõi lên người tôi không? Nhưng tôi thấy anh ấy không phải kiểu người như vậy, không phải là tôi tin tưởng anh ấy đâu... Ý tôi là, nếu tôi nghĩ anh ấy có gắn, thì chắc là anh ấy không gắn, vì cái tôi nghĩ thường là không đúng.""
Đó là một buổi chiều bình thường, khách không đông, Uyên Vũ đang thong thả cho mèo ăn ở sân sau quán trà, thì đột nhiên nghe thấy tiếng chó sủa và tiếng lẩm bẩm vọng từ bên kia bức tường.
Uyên Vũ lặng lẽ sắp xếp lại logic của chủ nhân giọng nói, chỉ thấy chóng mặt, rồi lập tức bỏ cuộc. Nhưng tiếng lẩm bẩm vẫn tiếp tục.
""Lần sau tôi nhất định sẽ tới được, sẽ xem thử thứ đó lợi hại cỡ nào, nó khiến khu rừng mất đi ánh sáng, thì tôi sẽ khiến khu rừng sáng trở lại.""
Liệu có thật sẽ đến một ngày, có ai đó mang đến bình minh cho Rừng Vô Quang?"
lang_favor.db,FavorWord,1,心声·一,,Tâm Thanh - 1
lang_favor.db,FavorWord,2,有什么不适应的你可以随时找我。并，并不是出于什么任务才这么说的，只是觉得……你会需要我。,Tell me whenever you feel strange. N-not for the sake of the quests. I just... feel you might need me.,"Có gì không quen thì cứ tìm tôi bất cứ lúc nào. Kh, không phải vì nhiệm vụ gì mà nói vậy đâu, chỉ là cảm thấy... cậu sẽ cần tôi."
lang_favor.db,FavorWord,3,心声·二,,Tâm Thanh - 2
lang_favor.db,FavorWord,4,流淌在耳边的风，和我说了一个有趣的故事，你想听吗？,"The wind flowed beside my ears and whispered a spellbinding story, do you wish to hear it?","Gió thoảng bên tai kể cho tôi một câu chuyện thú vị, cậu có muốn nghe không?"
lang_favor.db,FavorWord,5,心声·三,,Tâm Thanh - 3
lang_favor.db,FavorWord,6,美好的事物总是令人心生向往。长夜后的黎明，暴雨后的轻风，嗯……还有你的笑脸。,"Those beautiful raise yearnings in us. Dawns after long nights, breezes after rainstorms, and... and your smiling face.","Những điều tươi đẹp luôn khiến người ta khao khát. Bình minh sau đêm dài, gió nhẹ sau cơn mưa lớn, ừm... còn có nụ cười của cậu."
lang_favor.db,FavorWord,7,心声·四,,Tâm Thanh - 4
lang_favor.db,FavorWord,8,你身旁的流息不同寻常，靠太近仿佛会让人失控。但我还是不想只在一旁看着，可以的话，想和你站得更近，无论你会引发怎样的暴风雨。,"Streams around you are different: they disturb minds that come too close. But I can't just stand aside and watch. I want to stay close to you if I may, no matter what storm you will bring.","Luồng khí quanh cậu rất khác thường, đến gần quá dường như sẽ khiến người ta mất kiểm soát. Nhưng tôi vẫn không muốn chỉ đứng nhìn từ xa, nếu được, tôi muốn đứng gần cậu hơn, bất kể cậu có gây ra cơn bão nào đi nữa."
lang_favor.db,FavorWord,9,心声·五,,Tâm Thanh - 5
lang_favor.db,FavorWord,10,需要的时候，就呼唤我的名字吧……从荒芜之地到生机之所，从起点到世界的终结，只要你愿意，我就会陪你一同见证。,"Call my name when you’re in need... From lands of desolation to places of vibrancy, from beginning to end of the world, I shall witness everything at your side as long as you wish.","Khi nào cần, hãy gọi tên tôi nhé... Từ vùng đất hoang vu đến nơi tràn đầy sức sống, từ khởi đầu đến tận cùng thế giới, chỉ cần cậu muốn, tôi sẽ cùng cậu chứng kiến tất cả."
lang_favor.db,FavorWord,11,秧秧的喜好,,Sở thích của Ương Ương
lang_favor.db,FavorWord,12,歌声，是从心底迸发出的共鸣，它会传递最真挚的心情。,Songs are resonances that burst from the bottom of your heart. They carry the sincerest feelings.,"Tiếng hát là sự cộng hưởng bật ra từ tận đáy lòng, nó sẽ truyền tải tâm trạng chân thành nhất."
lang_favor.db,FavorWord,13,秧秧的烦恼,,Phiền muộn của Ương Ương
lang_favor.db,FavorWord,14,过度考虑他人……是不是也会给他们带来负担呢？,Will it bring burdens to people... when you care too much for them?,Quan tâm người khác quá mức... liệu có khiến họ thêm gánh nặng không nhỉ?
