db_file,table_name,id,zh,en,vi
lang_multi_text.db,MultiText,Side_JZKW_11_1,有了这些问答作为参考，我对《看今州》的编纂有了新的想法。,These Q&A gave me fresh ideas for our next issue of “Jinzhou: A Closer Look”.,"Có những câu hỏi đáp này làm tham khảo, tôi có thêm ý tưởng mới cho việc biên soạn ""Khám Phá Kim Châu""."
lang_multi_text.db,MultiText,Side_JZKW_11_10,那么，希望我们今后合作愉快。,Looking forward to a great collaboration ahead.,"Vậy thì, mong rằng chúng ta sẽ hợp tác vui vẻ."
lang_multi_text.db,MultiText,Side_JZKW_11_11,下次再见也要做好被我提问的心理准备哦。,"We’ll have more Q&A next time, so get ready!","Lần sau gặp lại, nhớ chuẩn bị tinh thần để bị tôi hỏi đấy nhé."
lang_multi_text.db,MultiText,Side_JZKW_11_12,那是当然，无论我个人还是今州书院，都不会让你白白付出。,"Rest assured, we won’t let you contribute for nothing.","Đương nhiên rồi, dù là cá nhân tôi hay Kim Châu Thư Viện, đều không để cậu phải làm không công đâu."
lang_multi_text.db,MultiText,Side_JZKW_11_13,作为感谢，我还会把你的名字放在题献页。,"As a token of thanks, I will also put your name on the acknowledgement page.","Để cảm ơn, tôi sẽ đặt tên cậu ở trang đề tặng nữa."
lang_multi_text.db,MultiText,Side_JZKW_11_14,嗯！{PlayerName}的帮助值得被记住！,Yes! {PlayerName}’s help is worth remembering!,Ừm! Sự giúp đỡ của {PlayerName} xứng đáng được ghi nhận!
lang_multi_text.db,MultiText,Side_JZKW_11_15,{PlayerName}，下次我也会准备一些题目，肯定比姐姐的那些更有趣。,"{PlayerName}, next time I will also prepare some questions. They’ll be way more interesting than my sister’s.","{PlayerName}, lần sau tôi cũng sẽ chuẩn bị một số câu hỏi, chắc chắn sẽ thú vị hơn mấy câu của chị tôi."
lang_multi_text.db,MultiText,Side_JZKW_11_16,希望咱们之后合作愉快啦。,Looking forward to a great collaboration ahead.,Mong chúng ta hợp tác vui vẻ nhé.
lang_multi_text.db,MultiText,Side_JZKW_11_2,看来之前一直闭门造车，还是忽略了很多东西……,I missed a bunch of stuff by working alone before...,"Có vẻ trước đây cứ tự mình mò mẫm, nên đã bỏ sót khá nhiều thứ..."
lang_multi_text.db,MultiText,Side_JZKW_11_3,请你收下这些报酬，这是你应得的。,"Please take these rewards, you earned them.","Cậu nhận phần thù lao này nhé, đây là thứ cậu xứng đáng được nhận."
