db_file,table_name,id,zh,en,vi
lang_multi_text.db,MultiText,Area_1301_Title,原点科考站,Tower of Adversity,Nguyên Điểm Khoa Khảo Trạm
lang_multi_text.db,MultiText,Area_13101_Title,北落峡谷,Norfall Valley,Bắc Lạc Hiệp Cốc
lang_multi_text.db,MultiText,Area_13102_Title,悬浮废墟,Suspended Ruins,Phế Tích Treo
lang_multi_text.db,MultiText,Area_13105_Title,dnt/北落野流程大空气墙,Invisible Walls in Norfall Barrens process,Invisible Walls in Norfall Barrens process
lang_multi_text.db,MultiText,Area_13_Title,原点科考站,Tower of Adversity,Nguyên Điểm Khoa Khảo Trạm
lang_multi_text.db,MultiText,Area_14001_Title,dnt/忌炎副本空气墙1,Invisible Walls for Jiyan's side mission,Invisible Walls for Jiyan's side mission
lang_multi_text.db,MultiText,Area_14002_Title,dnt/忌炎副本空气墙1,Invisible Walls for Jiyan's side mission,Invisible Walls for Jiyan's side mission
lang_multi_text.db,MultiText,Area_14003_Title,dnt/忌炎副本空气墙1,Invisible Walls for Jiyan's side mission,Invisible Walls for Jiyan's side mission
lang_multi_text.db,MultiText,Area_14004_Title,dnt/忌炎副本空气墙1,Invisible Walls for Jiyan's side mission,Invisible Walls for Jiyan's side mission
lang_multi_text.db,MultiText,Area_14005_Title,dnt/忌炎副本空气墙1,Invisible Walls for Jiyan's side mission,Invisible Walls for Jiyan's side mission
lang_multi_text.db,MultiText,Area_14006_Title,dnt/忌炎副本空气墙1,Invisible Walls for Jiyan's side mission,Invisible Walls for Jiyan's side mission
lang_multi_text.db,MultiText,Area_14007_Title,dnt/忌炎副本空气墙1,Invisible Walls for Jiyan's side mission,Invisible Walls for Jiyan's side mission
lang_multi_text.db,MultiText,Area_14008_Title,dnt/忌炎副本空气墙1,Invisible Walls for Jiyan's side mission,Invisible Walls for Jiyan's side mission
lang_multi_text.db,MultiText,Area_14011_Title,dnt/忌炎副本空气墙1,Invisible Walls for Jiyan's side mission,Invisible Walls for Jiyan's side mission
lang_multi_text.db,MultiText,Area_14012_Title,dnt/忌炎副本空气墙1,Invisible Walls for Jiyan's side mission,Invisible Walls for Jiyan's side mission
lang_multi_text.db,MultiText,Area_14013_Title,dnt/忌炎副本空气墙1,Invisible Walls for Jiyan's side mission,Invisible Walls for Jiyan's side mission
lang_multi_text.db,MultiText,Area_14_Title,乘霄山,Mt. Firmament,Thừa Tiêu Sơn
lang_multi_text.db,MultiText,Area_1500001_Title,dnt/TD测试用例空气墙,Invisible Walls for TD test cases,Invisible Walls for TD test cases
lang_multi_text.db,MultiText,Area_1500002_Title,dnt/93-TD测试空气墙,93-Invisible Walls for TD test cases,93-Invisible Walls for TD test cases
lang_multi_text.db,MultiText,Area_1501_Title,艾多斯之镜,Eidoscope,Gương Eidolos
lang_multi_text.db,MultiText,Area_1502_Title,数据洪流,Data Torrent,Hồng Lưu Dữ Liệu
lang_multi_text.db,MultiText,Area_1504_Title,调律大厅,Modulation Hall,Đại Sảnh Điều Luật
lang_multi_text.db,MultiText,Area_1505_Title,能源中心,Energy Hub,Năng Lượng Trung Tâm
lang_multi_text.db,MultiText,Area_1506_Title,谬误收容所,Error Cell,Mậu Ngộ Thu Dung Sở
lang_multi_text.db,MultiText,Area_1507_Title,金枝地,Bank of Life,Kim Chi Địa
lang_multi_text.db,MultiText,Area_1511_Title,神秘房间,Mysterious Room,Phòng Bí Ẩn
lang_multi_text.db,MultiText,Area_1561_Title,谬误收容所地下一层,Error Cell Sublevel 1,Mậu Ngộ Thu Dung Sở - Tầng Hầm 1
lang_multi_text.db,MultiText,Area_1562_Title,谬误收容所一层,Error Cell Floor 1,Mậu Ngộ Thu Dung Sở - Tầng 1
lang_multi_text.db,MultiText,Area_1571_Title,金枝地一层,Bank of Life Floor 1,Kim Chi Địa - Tầng 1
lang_multi_text.db,MultiText,Area_1572_Title,金枝地二层,Bank of Life Floor 2,Kim Chi Địa - Tầng 2
lang_multi_text.db,MultiText,Area_15_Title,泰缇斯之底,Tethys' Deep,Đáy Tethys
lang_multi_text.db,MultiText,Area_1601_Title,叩天关·上层,Truthseeker's Pass: Upper Tier,Khấu Thiên Quan - Thượng Tầng
lang_multi_text.db,MultiText,Area_1602_Title,叩天关·中层,Truthseeker's Pass: Middle Tier,Khấu Thiên Quan - Trung Tầng
lang_multi_text.db,MultiText,Area_1603_Title,叩天关·下层,Truthseeker's Pass: Lower Tier,Khấu Thiên Quan - Hạ Tầng
lang_multi_text.db,MultiText,Area_1611_Title,隙光滩,Luminous Shore,Hích Quang Than
lang_multi_text.db,MultiText,Area_1612_Title,璇玑岭,Xuanji Ridges,Toàn Cơ Lĩnh
lang_multi_text.db,MultiText,Area_1613_Title,虹镇,Hongzhen,Hồng Trấn
lang_multi_text.db,MultiText,Area_1614_Title,天取木,Tianqu Tree,Thiên Thủ Mộc
lang_multi_text.db,MultiText,Area_1615_Title,游龙脊,Loong's Ridge,Du Long Tích
lang_multi_text.db,MultiText,Area_1616_Title,卧龙冈,Loong's Rest,Ngọa Long Cương
lang_multi_text.db,MultiText,Area_1617_Title,盘龙崖,Loong's Crest,Bàn Long Nhai
lang_multi_text.db,MultiText,Area_1631_Title,环木阙·上层,Woodveil Hall: Upper Tier,Hoàn Mộc Khuyết - Thượng Tầng
lang_multi_text.db,MultiText,Area_1632_Title,环木阙·中层,Woodveil Hall: Middle Tier,Hoàn Mộc Khuyết - Trung Tầng
lang_multi_text.db,MultiText,Area_1633_Title,环木阙·下层,Woodveil Hall: Lower Tier,Hoàn Mộc Khuyết - Hạ Tầng
lang_multi_text.db,MultiText,Area_1641_Title,眠龙庭·上层,Mianloong Chamber: Upper Tier,Miên Long Đình - Thượng Tầng
lang_multi_text.db,MultiText,Area_1642_Title,眠龙庭·下层,Mianloong Chamber: Lower Tier,Miên Long Đình - Hạ Tầng
lang_multi_text.db,MultiText,Area_1691_Title,莫塔里区,Montelli Quarter,Khu Montelli
lang_multi_text.db,MultiText,Area_1692_Title,广场区,City Square,Khu Quảng Trường
lang_multi_text.db,MultiText,Area_1693_Title,银行街,Bank Street,Phố Ngân Hàng
lang_multi_text.db,MultiText,Area_1694_Title,隐海修会,Order of the Deep,Ẩn Hải Tu Hội
lang_multi_text.db,MultiText,Area_16_Title,拉古那城,Ragunna City,Thành Ragunna
lang_multi_text.db,MultiText,Area_1701_Title,埃弗拉德金库,Averardo Vault,Kim Khố Averardo
lang_multi_text.db,MultiText,Area_1702_Title,泊金港,Gold's Landing,Cảng Bạc Kim
lang_multi_text.db,MultiText,Area_1703_Title,多洛米蒂断桥,Dolomites Broken Bridge,Đoạn Kiều Dolomites
lang_multi_text.db,MultiText,Area_17_Title,埃弗拉德金库,Averardo Vault,Kim Khố Averardo
lang_multi_text.db,MultiText,Area_1801_Title,愚人乐土,Fool's Elysium,Ngu Nhân Lạc Thổ
lang_multi_text.db,MultiText,Area_1802_Title,船首祭地,Figurehead's Shrine,Tế Địa Thuyền Thủ
lang_multi_text.db,MultiText,Area_1803_Title,嗟叹长阶,Wailing Ascent,Trường Giai Ta Thán
lang_multi_text.db,MultiText,Area_1804_Title,船葬滩,The Strand,Bãi Thuyền Táng
lang_multi_text.db,MultiText,Area_1805_Title,浮光海窟,Iridescent Hollow,Hải Quật Phù Quang
lang_multi_text.db,MultiText,Area_18_Title,悲叹墓岛,Penitent's End,Bi Thán Mộ Đảo
lang_multi_text.db,MultiText,Area_1901_Title,遗颂河谷,Requiem Ravine,Di Tụng Hà Cốc
lang_multi_text.db,MultiText,Area_1902_Title,赞悼圣迹 · 地下,Hallowed Reach: Underground,Tán Điệu Thánh Tích - Địa Hạ
lang_multi_text.db,MultiText,Area_199_Title,dnt/秧秧角色任务用空气墙,Invisible Walls for Yangyang's character mission,dnt/Tường khí vô hình dùng cho nhiệm vụ nhân vật Yangyang
lang_multi_text.db,MultiText,Area_19_Title,赞悼圣迹,Hallowed Reach,Tán Điệu Thánh Tích
lang_multi_text.db,MultiText,Area_1_Title,dnt/大世界,Overworld,dnt/Thế giới mở
lang_multi_text.db,MultiText,Area_2001_Title,白月林迹,Silver Moon Grove,Bạch Nguyệt Lâm Tích
lang_multi_text.db,MultiText,Area_2002_Title,独眼风车群,Polyphemos Windmills,Cụm Phong Xa Độc Nhãn
lang_multi_text.db,MultiText,Area_2003_Title,白雾堤,Mistveil Bay,Bạch Vụ Đê
lang_multi_text.db,MultiText,Area_2004_Title,埃格拉镇,Egla Town,Thị Trấn Egla
lang_multi_text.db,MultiText,Area_2005_Title,沉没幻想·遗址,Sunken Ideals: Ruins,Trầm Một Huyễn Tưởng - Di Chỉ
lang_multi_text.db,MultiText,Area_2006_Title,岩栖残垣,Fractured Cavern,Nham Thê Tàn Viên
lang_multi_text.db,MultiText,Area_202_Title,鸣钟涧,Bell-Borne Ravine,Minh Chung Giản
lang_multi_text.db,MultiText,Area_203_Title,玉龙台,Memento Square,Ngọc Long Đài
lang_multi_text.db,MultiText,Area_204_Title,夜明坡,Clouded Cliffs,Dạ Minh Pha
lang_multi_text.db,MultiText,Area_20_Title,拂风水畔,Whisperwind Haven,Phất Phong Thủy Bạn
lang_multi_text.db,MultiText,Area_2101_Title,咏夜歌庭,Atrium of Reflections,Vịnh Dạ Ca Đình
lang_multi_text.db,MultiText,Area_2102_Title,白雾堤,Mistveil Bay,Bạch Vụ Đê
lang_multi_text.db,MultiText,Area_2103_Title,泊金港,Gold's Landing,Cảng Bạc Kim
lang_multi_text.db,MultiText,Area_21_Title,氤柔水境,Nimbus Sanctum,Nhân Nhu Thủy Cảnh
lang_multi_text.db,MultiText,Area_2201_Title,青栎庭院,Oakheart Highcourt,Thanh Lịch Đình Viện
lang_multi_text.db,MultiText,Area_2202_Title,蒙召海,Coast of Anticipation,Mông Triệu Hải
lang_multi_text.db,MultiText,Area_2203_Title,残息海岸,Shores of Last Breath,Tàn Tức Hải Ngạn
lang_multi_text.db,MultiText,Area_2204_Title,青栎庭院·下层,Oakheart Highcourt: Lower Tier,Thanh Lịch Đình Viện - Hạ Tầng
lang_multi_text.db,MultiText,Area_22_Title,槲生半岛,Fagaceae Peninsula,Bán đảo Hộc Sinh
lang_multi_text.db,MultiText,Area_2301_Title,三重冠塔,Thorncrown Rises,Tam Trọng Quan Tháp
lang_multi_text.db,MultiText,Area_2302_Title,双子峪,Twin Peaks,Song Tử Dục
lang_multi_text.db,MultiText,Area_2303_Title,波蒂维诺堡,Porto-Veno Castle,Lâu Đài Porto-Veno
lang_multi_text.db,MultiText,Area_2304_Title,失乐园,Garden of the Lost,Thất Lạc Viên
lang_multi_text.db,MultiText,Area_23_Title,狄萨莱海脊,Thessaleo Fells,Hải Tích Thessaleo
lang_multi_text.db,MultiText,Area_24_Title,拉古那,Ragunna,Ragunna
lang_multi_text.db,MultiText,Area_25001_Title,扉页书馆·遗址,Titular Repository: Ruins,Phỉ Hiệt Thư Quán - Di Chỉ
lang_multi_text.db,MultiText,Area_25002_Title,海影试炼,Abyssal Crucible,Hải Ảnh Thí Luyện
lang_multi_text.db,MultiText,Area_25003_Title,剑授大厅·遗址,Hall of Swordsmanship: Ruins,Kiếm Thụ Đại Sảnh - Di Chỉ
lang_multi_text.db,MultiText,Area_25004_Title,札贡花园·遗址,Zargon Garden: Ruins,Hoa Viên Zargon - Di Chỉ
lang_multi_text.db,MultiText,Area_25005_Title,联结之塔,Tower of Unity,Liên Kết Chi Tháp
lang_multi_text.db,MultiText,Area_25006_Title,圣言之间,Holy Spire of Confluence,Thánh Ngôn Chi Gian
lang_multi_text.db,MultiText,Area_25007_Title,向上之塔,Tower of Ascension,Tháp Hướng Thượng
lang_multi_text.db,MultiText,Area_25008_Title,拯救之塔,Tower of Salvation,Tháp Chửng Cứu
lang_multi_text.db,MultiText,Area_25009_Title,贝奥海沟,Beohr Trench,Hải Câu Beohr
