db_file,table_name,id,zh,en,vi
lang_multi_text.db,MultiText,Character_Rococo_11_8,她撑过了最危险的时候，会好起来的。,She's past the worst part. She'll recover soon.,"Em ấy đã qua cơn nguy kịch nhất rồi, sẽ khỏe lại thôi."
lang_multi_text.db,MultiText,Character_Rococo_11_9,对了，其他人的情况如何？,"How about the others, Tina?","Đúng rồi, tình hình của những người khác thế nào?"
lang_multi_text.db,MultiText,Character_Rococo_12_1,你好，手臂好些了吗？,Hello. How's your arm?,"Chào bạn, cánh tay đỡ hơn chưa?"
lang_multi_text.db,MultiText,Character_Rococo_12_10,对啊，这戏描绘了一个自由的世界。在那里，大家可以随心所欲地追寻自己的信仰，而不只是遵循一种单调而严苛的教义。,Exactly. It's about a world where people can choose their own beliefs instead of blindly following some rigid creed.,"Đúng vậy, vở kịch này miêu tả một thế giới tự do. Ở đó, mọi người có thể tùy ý theo đuổi tín ngưỡng của mình, chứ không chỉ tuân theo một giáo nghĩa đơn điệu và hà khắc."
lang_multi_text.db,MultiText,Character_Rococo_12_11,强制的修会集会、强制的礼拜日、强制的行为守则……连唱什么戏，在哪里笑都要规定。,"Mandatory gatherings, worship, enforced codes of conduct... They even dictate what plays we can watch and how we should laugh and smile.","Những buổi tập hợp Tu Hội bắt buộc, ngày lễ bái bắt buộc, quy tắc ứng xử bắt buộc... Ngay cả hát vở gì, cười ở đâu cũng phải quy định."
lang_multi_text.db,MultiText,Character_Rococo_12_12,我好想回到我的家乡……但如今的拉古那又不太像我的家乡了。,"Oh, I want to go home, I really do... but Ragunna isn't the same place anymore.",Tôi rất muốn trở về quê hương... nhưng Ragunna bây giờ lại không giống quê hương tôi lắm.
lang_multi_text.db,MultiText,Character_Rococo_12_13,而「朝圣」的时候，有人弹琴、有人吹奏……大家在船上一起围着“星星”歌唱，互相打气。,"During our so-called pilgrimage, people played lunachords and flutes. Everyone on board gathered around a ""star"" to sing opera and uplift each other's spirits.","Mà lúc ""hành hương"", có người đàn, có người thổi sáo... Mọi người trên thuyền cùng vây quanh ""ngôi sao"" ca hát, cổ vũ lẫn nhau."
lang_multi_text.db,MultiText,Character_Rococo_12_14,那一刻，我觉得只要大家还能一起自由地歌唱，「朝圣船」也可以是我的家乡。,"In those moments, I felt that as long as we could sing freely together, the Pilgrim's Sail could become my new home.","Khoảnh khắc đó, tôi cảm thấy chỉ cần mọi người còn có thể cùng nhau tự do ca hát, ""thuyền hành hương"" cũng có thể là quê hương tôi."
lang_multi_text.db,MultiText,Character_Rococo_12_15,可是……当我们漂流得越远，遇到的危险越多……船上剩下来的人就越来越少……就连心爱的演出道具都损坏了……,"But as we drifted farther out to sea, we faced more dangers, and fewer of us survived. Even our instruments got wrecked.","Nhưng mà... khi chúng tôi trôi dạt càng xa, nguy hiểm gặp phải càng nhiều... người còn lại trên thuyền càng lúc càng ít... ngay cả đạo cụ diễn xuất yêu thích cũng bị hỏng rồi..."
lang_multi_text.db,MultiText,Character_Rococo_12_16,直到现在……剩下的人已经没法再合演了。,And now... there's no way to perform again with what's left of us.,Cho đến bây giờ... những người còn lại đã không thể diễn chung được nữa rồi.
lang_multi_text.db,MultiText,Character_Rococo_12_17,唉……我真不知道，我该前往何方，又该回去哪里了。,"I'm lost now. Nowhere to go, and no home to return to.","Haiz... tôi thật sự không biết, tôi nên đi về đâu, và nên trở về đâu nữa."
lang_multi_text.db,MultiText,Character_Rococo_12_18,菲利波说着说着，原本上扬了一些的嘴角又撇了下去，面露悲色。,"The brief smile that once graced his lips has vanished, leaving his face shrouded in sadness.","Filippo nói một hồi, khóe miệng vốn hơi nhếch lên lại trễ xuống, lộ vẻ bi thương."
lang_multi_text.db,MultiText,Character_Rococo_12_19,……,...,...
lang_multi_text.db,MultiText,Character_Rococo_12_2,好多了，谢谢你们帮我包扎。,Feeling much better. Thanks for patching me up.,"Tốt hơn nhiều rồi, cảm ơn các bạn đã băng bó giúp tôi."
lang_multi_text.db,MultiText,Character_Rococo_12_20,"菲利波的手臂已经好多了，但他依旧十分消沉。
他说起过往的遭遇——拉古那被修会严格管制，他们因为唱禁剧《珀伽索斯》而被流放。
流放的路途中，伙伴们遭遇危险接连逝去，剩下的人已经没法合演他们心爱的戏剧了。","Filippo’s arm has mostly recovered, but he remains deeply depressed. 
He recounts how Ragunna, under the Order's rule, strictly regulated theatrical performances. 
He and others were exiled for performing the banned opera, ""Pegasus."" 
During their exile, many of their companions perished in perilous encounters, leaving the survivors unable to continue the beloved opera.","Cánh tay của Filippo đã đỡ hơn nhiều, nhưng anh ấy vẫn vô cùng suy sụp.
Anh ấy kể về những chuyện đã qua - Ragunna bị Tu Hội quản chế nghiêm ngặt, họ vì hát vở kịch cấm ""Pegasus"" mà bị lưu đày.
Trên đường lưu đày, bạn bè gặp nguy hiểm lần lượt qua đời, những người còn lại đã không thể diễn chung vở kịch yêu thích của họ nữa."
lang_multi_text.db,MultiText,Character_Rococo_12_3,菲利波的手臂被包扎好了，不再肿胀。,Filippo's hand is now covered in bandages and is no longer swollen.,"Cánh tay của Filippo đã được băng bó xong, không còn sưng tấy nữa."
lang_multi_text.db,MultiText,Character_Rococo_12_4,你们用的止痛药，是迷迭香药店的货吧？以前我家就在那附近，经常能闻到这种味道。,"Those pain relievers you used are from Rosemary's Apothecary, right? My family used to live not far from them. I'd recognize that smell anywhere.","Thuốc giảm đau các bạn dùng là hàng của Hiệu Thuốc Rosemary phải không? Trước đây nhà tôi ở ngay gần đó, thường xuyên ngửi thấy mùi này."
lang_multi_text.db,MultiText,Character_Rococo_12_5,我有时候也会想家，有时候又不想。,"Sometimes I think about home. Other times, I'd rather not.","Tôi đôi khi cũng nhớ nhà, đôi khi lại không muốn."
lang_multi_text.db,MultiText,Character_Rococo_12_6,我喜欢家里软软的沙发，药店清新的药草味儿……但我不喜欢修会活动，也不喜欢千篇一律的经文剧。,I miss my soft couch and the smell of herbs wafting from the apothecary. But those Order activities? Those boring plays full of Codex verses? No thanks.,"Tôi thích ghế sô pha êm ái ở nhà, mùi thảo dược tươi mát của hiệu thuốc... nhưng tôi không thích hoạt động Tu Hội, cũng không thích những vở kịch kinh văn nghìn bài như một."
lang_multi_text.db,MultiText,Character_Rococo_12_7,我总觉得，如果圣女还在，她也不会喜欢这种「哀悼」。,"You know, I bet if the Blessed Maiden were still around, she'd loathe this form of penitance.","Tôi luôn cảm thấy, nếu Thánh Nữ còn sống, người cũng sẽ không thích kiểu ""tưởng niệm"" này."
lang_multi_text.db,MultiText,Character_Rococo_12_8,“千星在夜空中闪耀，自由如百花般绽放”，这是圣女常唱的戏剧。,"""A thousand stars light up the air. Freedom blooms like flowers wide."" That was her favorite line from an opera.","""Ngàn sao lấp lánh trên bầu trời đêm, tựa như trăm hoa đua nở"", đây là vở kịch Thánh Nữ thường hát."
lang_multi_text.db,MultiText,Character_Rococo_12_9,是《珀伽索斯》。,That's a line from <i>Pegasus</i>.,"Là ""Pegasus""."
lang_multi_text.db,MultiText,Character_Rococo_13_1,你好，身体好些了吗？,"Hello, sir. Are you feeling better?","Chào ông, sức khỏe đỡ hơn chưa ạ?"
lang_multi_text.db,MultiText,Character_Rococo_13_10,讨厌？怎么会呢。,"Get tired of it? No, why would we do that?",Ghét sao? Làm gì có chuyện đó.
lang_multi_text.db,MultiText,Character_Rococo_13_11,这戏多好啊，大家多多少少都在不顺的时候受到过它的鼓舞。,"It's a real gem, that one. Lifted everyone's spirits during the hard times.","Vở kịch này hay biết bao, mọi người ít nhiều đều từng được nó cổ vũ những lúc không suôn sẻ."
lang_multi_text.db,MultiText,Character_Rococo_13_12,要是这世道和戏里唱的那样，人人都能自由地活着，我这一把年纪了，也不会受这种苦唷……,"If only the world were like that, where everyone lives freely. I wouldn't have to endure so much at this age...","Nếu thế đạo này cũng giống như trong kịch hát, ai ai cũng có thể sống tự do, thì tôi từng này tuổi rồi cũng sẽ không phải chịu khổ thế này đâu..."
lang_multi_text.db,MultiText,Character_Rococo_13_13,说是「朝圣」，一路上到处都是残象，没了那么多人，明眼人都知道是咋回事。,"They called it a ""pilgrimage,"" but Tacet Discords pursued us the entire journey... We lost so many. The truth is clear to everyone now.","Nói là ""hành hương"", nhưng dọc đường đâu đâu cũng toàn Tàn Tượng, mất đi bao nhiêu người, người sáng mắt đều biết là chuyện gì."
lang_multi_text.db,MultiText,Character_Rococo_13_14,唉……可惜我这把老骨头活了下来，一些年轻人却……,"<i>Sigh</i> I survived, while so many young souls did not...","Haiz... đáng tiếc bộ xương già này của tôi lại sống sót, còn mấy người trẻ tuổi thì..."
lang_multi_text.db,MultiText,Character_Rococo_13_15,就连他们生前留下的、珍爱的东西，我也没力气带回来……唉……,I didn't even have the strength to take their cherished belongings with me...,"Ngay cả những món đồ họ trân trọng để lại khi còn sống, tôi cũng chẳng còn sức mang về... haiz..."
lang_multi_text.db,MultiText,Character_Rococo_13_16,"古力欧也是因表演《珀伽索斯》而被流放的其中一员。
他表达了对戏剧中所歌颂的自由的向往，以及对逝去伙伴的怀念。","Giulio, another exile, shares his longing for the freedom celebrated in ""Pegasus"" and his deep nostalgia for his departed partner.","Giulio cũng là một trong những thành viên bị lưu đày vì biểu diễn ""Pegasus"".
Ông ấy bày tỏ sự khao khát đối với tự do được ca ngợi trong vở kịch, cũng như nỗi nhớ nhung những người bạn đã khuất."
lang_multi_text.db,MultiText,Character_Rococo_13_2,嗯，好多了，谢谢你们的肉酱烩面。,Much better. Thank you for the pasta.,"Ừ, tốt hơn nhiều rồi, cảm ơn mì sốt thịt của các cháu."
lang_multi_text.db,MultiText,Character_Rococo_13_3,入口时那种温暖而又家常的味道，一度让我产生了错觉。,"Oh, that warmth… that taste of home. For a moment there, I thought I was dreaming.","Hương vị ấm áp và bình dị lúc đưa vào miệng đó, đã từng khiến ta nảy sinh ảo giác."
lang_multi_text.db,MultiText,Character_Rococo_13_4,就好像我还坐在玛格烈特餐馆里，吃着熟悉的早午餐……唉，本来以为能吃一辈子的。,"It took me back to Margherita's, having the usual from their brunch menu... Oh, that's something I thought I'd get to enjoy for the rest of my life.","Cứ như thể ta vẫn đang ngồi trong nhà hàng Margherita, ăn bữa sáng muộn quen thuộc... haiz, vốn tưởng rằng có thể ăn cả đời."
lang_multi_text.db,MultiText,Character_Rococo_13_5,结果前些日子，我哼了两句《珀伽索斯》……,"But... here I am, simply because I sang a few lines from <i>Pegasus</i>...","Kết quả mấy hôm trước, ta ngâm nga hai câu ""Pegasus""..."
lang_multi_text.db,MultiText,Character_Rococo_13_6,又是《珀伽索斯》吗……,<i>Pegasus</i>. I see...,"Lại là ""Pegasus"" sao..."
lang_multi_text.db,MultiText,Character_Rococo_13_7,是啊，船上的大家以前就在一起演戏……想演什么就演什么，就是得躲着点修会的人。,"That's right. Folks on the ship used to perform together, letting the day's mood pick the song. Just had to keep an eye out for the Order.","Đúng vậy, mọi người trên thuyền trước đây vẫn diễn kịch cùng nhau... muốn diễn gì thì diễn nấy, chỉ là phải tránh người của Tu Hội một chút."
lang_multi_text.db,MultiText,Character_Rococo_13_8,《珀伽索斯》是大家最喜欢的剧目呢。,That one was an all-time favorite.,"""Pegasus"" là vở kịch mọi người thích nhất đấy."
lang_multi_text.db,MultiText,Character_Rococo_13_9,那你们……会讨厌再次听到它吗？,Would you ever get tired of it?,Vậy mọi người... có ghét khi nghe lại nó không?
lang_multi_text.db,MultiText,Character_Rococo_14_1,大家遭受了这些……,Everyone has been through so much...,Mọi người đã phải chịu đựng những chuyện này...
lang_multi_text.db,MultiText,Character_Rococo_14_10,不愧是「桂冠」，一下子就点醒了洛可可。,"Oh, what would I do without the Laureate around?","Không hổ danh là ""Quế Quán"", nói một cái là Roccia hiểu ra ngay."
lang_multi_text.db,MultiText,Character_Rococo_14_11,身体上的伤痛可以通过药品和食物治愈，心灵上的伤痛则可以通过心灵医生——戏剧来治疗。,"Medicine for the body, sure. But for the soul? We need something grand.","Nỗi đau thể xác có thể chữa lành bằng thuốc và thức ăn, còn nỗi đau tâm hồn thì có thể chữa trị bằng bác sĩ tâm hồn - kịch nghệ."
lang_multi_text.db,MultiText,Character_Rococo_14_12,刚刚大家都提到了《珀伽索斯》，或许，可以让大家再和伙伴们合演一次……,Everyone we talked to kept mentioning the <i>Pegasus</i> opera. Maybe we could arrange a little performance with them and their companions...,"Vừa rồi ai cũng nhắc đến ""Pegasus"", có lẽ, có thể để mọi người diễn chung với bạn bè một lần nữa..."
lang_multi_text.db,MultiText,Character_Rococo_14_13,决定了，迎新戏剧就选《珀伽索斯》吧。,It's decided then. The welcoming opera will be <i>Pegasus</i>.,"Quyết định rồi, kịch chào mừng sẽ chọn ""Pegasus"" nhé."
lang_multi_text.db,MultiText,Character_Rococo_14_14,迎新戏剧？,A welcoming opera?,Kịch chào mừng?
lang_multi_text.db,MultiText,Character_Rococo_14_15,可他们的伙伴不是已经……,But most of their companions are already...,Nhưng bạn bè của họ chẳng phải đã...
lang_multi_text.db,MultiText,Character_Rococo_14_16,嗯，剧团有一项传统，会为救助的「朝圣者」们举办迎新戏剧。,"Well, traditionally the troupe always puts on a show for newly rescued pilgrims.","Ừm, đoàn kịch có một truyền thống, sẽ tổ chức kịch chào mừng cho những ""người hành hương"" được cứu giúp."
lang_multi_text.db,MultiText,Character_Rococo_14_17,庆祝他们的获救与新生，听过戏剧后，希望他们能有一个新的开始。,"It's our way of saying, ""Congrats, you survived!"" We hope it sets the tone for something better for them.","Chúc mừng họ được cứu sống và tái sinh, sau khi xem kịch, hy vọng họ có thể có một khởi đầu mới."
lang_multi_text.db,MultiText,Character_Rococo_14_18,唔，洛可可有办法。,"Hmm, I know a way.","Ừm, Roccia có cách."
lang_multi_text.db,MultiText,Character_Rococo_14_19,我和佩洛检查过船舱，带回了一些东西。其中就有他们伙伴生前的珍爱之物。,Pero and I searched through the ship and found what must be their companions' belongings.,"Mình và Pero đã kiểm tra khoang thuyền, mang về một số thứ. Trong đó có những vật trân quý khi còn sống của bạn bè họ."
lang_multi_text.db,MultiText,Character_Rococo_14_2,严格的管制，强制的流放，伙伴的失散……,"All those rules on how to live, forced exile, friends gone missing...","Sự quản chế nghiêm ngặt, bắt buộc lưu đày, bạn bè thất lạc..."
lang_multi_text.db,MultiText,Character_Rococo_14_20,虽然有些已经损坏了，但是没关系。洛可可是道具师，能把它们修好……并让它们也参演戏剧。,"Some are a bit damaged, but nothing I can't fix. I'll patch them up and we'll use them in the performance.","Tuy có vài thứ đã hỏng, nhưng không sao. Roccia là đạo cụ sư, có thể sửa chúng lại... và để chúng cũng tham gia diễn kịch."
lang_multi_text.db,MultiText,Character_Rococo_14_21,这样，大家就能和伙伴们再次合演了。,"That way, they can be together again… on stage.","Như vậy, mọi người sẽ có thể diễn chung với bạn bè một lần nữa."
lang_multi_text.db,MultiText,Character_Rococo_14_22,"通过和朝圣者们沟通，细心的洛可可分析出了目前他们需要的东西——和伙伴们合演《珀伽索斯》。
作为舞台道具师，洛可可收集了伙伴们遗留的物件，并决心将物件修好，一起参与到迎新戏剧中。
这样，大家就可以再次和伙伴们合演《珀伽索斯》了。","After speaking with the pilgrims, Roccia concludes that their biggest wish is to perform ""Pegasus"" with their companions once again. 
As a stage prop maker, Roccia resolves to collect and repair the objects left behind by her partners so she can participate in the welcoming opera alongside them.","Thông qua giao tiếp với những người hành hương, Roccia tinh tế đã phân tích ra thứ họ cần hiện tại - diễn chung ""Pegasus"" với bạn bè.
Là đạo cụ sư sân khấu, Roccia đã thu thập những vật dụng bạn bè để lại, và quyết tâm sửa chữa chúng, cùng tham gia vào vở kịch chào mừng.
Như vậy, mọi người có thể diễn chung ""Pegasus"" với bạn bè một lần nữa rồi."
lang_multi_text.db,MultiText,Character_Rococo_14_3,*佩洛佩洛……*,"Pero, pero...",*Pero Pero...*
lang_multi_text.db,MultiText,Character_Rococo_14_4,有什么能让他们打起精神来呢？,Is there anything we can do to cheer them up?,Có gì có thể khiến họ phấn chấn lên không nhỉ?
lang_multi_text.db,MultiText,Character_Rococo_14_5,止痛药。,Pain relievers.,Thuốc giảm đau.
lang_multi_text.db,MultiText,Character_Rococo_14_6,肉酱烩面。,Pasta.,Mì sốt thịt.
lang_multi_text.db,MultiText,Character_Rococo_14_7,戏剧。,An opera.,Kịch nghệ.
lang_multi_text.db,MultiText,Character_Rococo_14_8,嗯，止痛药是必需品。可以修复身体上的伤痛，已经给大家使用过了。,"Well, pain relievers are a start. We've already handed those out. That'll help with the physical pain part.","Ừm, thuốc giảm đau là nhu yếu phẩm. Có thể chữa lành nỗi đau thể xác, đã dùng cho mọi người rồi."
lang_multi_text.db,MultiText,Character_Rococo_14_9,嗯，充足的食物是必需品。可以填饱饥肠辘辘的肚皮，已经分给大家了。,"True, food is always an essential. But bellies are full, and spirits are still in the gutter.","Ừm, thức ăn đầy đủ là nhu yếu phẩm. Có thể lấp đầy cái bụng đói meo, đã chia cho mọi người rồi."
lang_multi_text.db,MultiText,Character_Rococo_15_1,月弦琴、道具枪、碎船片、海萤石……,"A lunachord, a prop gun, ship debris, Luceanites...","Nguyệt Huyền Cầm, súng đạo cụ, mảnh vỡ thuyền, Đá Hải Huỳnh..."
lang_multi_text.db,MultiText,Character_Rococo_15_10,他们在意的理念消散的时候？,When what they stood for fades away?,Khi lý tưởng mà họ coi trọng tan biến sao?
lang_multi_text.db,MultiText,Character_Rococo_15_11,嗯，是有这个说法。不过，只要有我和佩洛在，这些物品的主人就永远不会被忘怀。,"Well, there is some truth to that. But as long as Pero and I are here, whoever owned these items will never be forgotten.","Ừm, có cách nói như vậy. Nhưng mà, chỉ cần có tôi và Pero ở đây, chủ nhân của những món đồ này sẽ không bao giờ bị lãng quên."
lang_multi_text.db,MultiText,Character_Rococo_15_12,嗯，是有这个说法。不过，剧团会把大家在意的理念编进戏剧，口口相传，不易消散。,"Well, there is some truth to that. Unless, of course, you have a troupe like ours. We'll weave what they stood for into operas and pass them down. Their memories will live on.","Ừm, có cách nói như vậy. Nhưng mà, đoàn kịch sẽ đưa lý tưởng mà mọi người coi trọng vào trong vở kịch, truyền miệng cho nhau, không dễ gì tan biến."
lang_multi_text.db,MultiText,Character_Rococo_15_13,“飞出高墙，穿过迷雾，跃过破碎的船头，追寻自由的金羊毛，翱翔在北极星的光辉下。”,"""Beyond high walls we fly, through mist where dangers lie. Over wrecked bows and ships adrift, I chase the Golden Fleece's gift, under the North Star's light.""","""Bay qua tường cao, xuyên qua sương mù, vượt qua mũi tàu vỡ nát, truy tìm Bộ Lông Cừu Vàng tự do, chao liượn dưới ánh hào quang của sao Bắc Cực."""
lang_multi_text.db,MultiText,Character_Rococo_15_14,要是一切都跟戏剧里唱的一样就好了。,If only life could be as grand as the opera scripts.,Giá mà mọi chuyện đều giống như những gì được hát trong kịch thì tốt biết mấy.
lang_multi_text.db,MultiText,Character_Rococo_15_15,洛可可一定会好好修复、使用这些东西，让大家再合演一次。,"Anyway, I'll fix these items up, give'em a good shine, and voilà—everyone gets to perform together again.","Roccia nhất định sẽ sửa chữa cẩn thận, sử dụng những thứ này để mọi người cùng diễn lại một lần nữa."
lang_multi_text.db,MultiText,Character_Rococo_15_16,"洛可可开始进行迎新戏剧之前的舞台装置以及道具准备。
你和她一起清点佩洛带回来的物件，看看如何使用更合适。",Roccia begins setting up the stage and preparing props for the welcoming opera. You help her inventory the items Pero brought back to determine how they can best be used.,"Roccia bắt đầu chuẩn bị thiết bị sân khấu và đạo cụ trước vở kịch chào mừng.
Bạn cùng cô ấy kiểm kê lại những vật phẩm Pero mang về, xem sử dụng thế nào cho phù hợp hơn."
lang_multi_text.db,MultiText,Character_Rococo_15_2,这些都是佩洛带回来的，好样的，佩洛。,"Would you look at that! Well done, Pero.","Những thứ này đều là do Pero mang về đấy, giỏi lắm, Pero."
lang_multi_text.db,MultiText,Character_Rococo_15_3,佩洛能装下这么多？,I didn't know Pero could carry so much.,Pero có thể chứa được nhiều thế sao?
lang_multi_text.db,MultiText,Character_Rococo_15_4,佩洛很能干嘛。,"Very impressive, Pero.",Pero giỏi thật đấy.
lang_multi_text.db,MultiText,Character_Rococo_15_5,嗯，如果佩洛愿意，一整艘船都能吞下。而且，佩洛还能解析频率，告诉我这些物品上曾经发生的事。,"Not only that, Pero could swallow an entire ship if she wanted to. She can even analyze frequencies and give me the full backstory on all this stuff.","Ừm, nếu Pero muốn, cả một con tàu cũng có thể nuốt trọn. Hơn nữa, Pero còn có thể phân tích tần số, kể cho tôi nghe những chuyện đã từng xảy ra trên những vật phẩm này."
lang_multi_text.db,MultiText,Character_Rococo_15_6,*佩洛佩洛！*,"Pero, pero!",*Pero Pero!*
lang_multi_text.db,MultiText,Character_Rococo_15_7,物品寄存着人的念想，而戏剧，可以将这些念想更好地传达出去……,"You see, objects carry people's thoughts and feelings. And what better way to share those than through an opera?","Đồ vật chứa đựng tâm tư của con người, còn kịch nghệ có thể truyền tải những tâm tư này tốt hơn..."
lang_multi_text.db,MultiText,Character_Rococo_15_8,{PlayerName}，你觉得什么时候一个人才是真正地逝去了？,"What do you think, {PlayerName}? When is someone really gone?","{PlayerName}, bạn cảm thấy khi nào thì một người mới thực sự ra đi?"
lang_multi_text.db,MultiText,Character_Rococo_15_9,没有人记得他们的时候？,When no one remembers them?,Khi không còn ai nhớ đến họ nữa?
lang_multi_text.db,MultiText,Character_Rococo_16_1,这把月弦琴，寄存在上面的频率告诉我，即便在流放的路途上，它的主人也并未停止弹奏。,"The frequencies lingering in this lunachord tell me that its owner never stopped playing, not even during her exile.","Cây Nguyệt Huyền Cầm này, tần số lưu lại trên đó nói với tôi rằng, ngay cả trên đường lưu đày, chủ nhân của nó cũng chưa từng ngừng đàn."
