db_file,table_name,id,zh,en,vi
lang_multi_text.db,MultiText,Main_LahaiRoi_3_2_58_8,敬自由！,To freedom!,Kính tự do!
lang_multi_text.db,MultiText,Main_LahaiRoi_3_2_58_9,敬文明。,To civilization.,Kính văn minh.
lang_multi_text.db,MultiText,Main_LahaiRoi_3_2_5_10,其实，它对能量的压缩利用率超过了95%，不仅远超新联邦与瑝珑华胥研究所在同领域取得的成果，更是近乎达到了已知的理论极限水平。,"In fact, its energy compression efficiency exceeds 95%. That exceeds the benchmarks set by both the New Federation and Huaxu Academy, even nearing the theoretical limit.","Thực ra, hiệu suất nén năng lượng của nó vượt quá 95%, không chỉ vượt xa thành tựu trong cùng lĩnh vực của Tân Liên Bang và Viện Nghiên Cứu Hoa Tư của Hoàng Long, mà còn gần đạt đến giới hạn lý thuyết đã biết."
lang_multi_text.db,MultiText,Main_LahaiRoi_3_2_5_11,相比于口感，这无疑是更具突破性的成就。,"From a scientific standpoint, it's a far greater achievement than taste.","So với hương vị, đây rõ ràng là một thành tựu mang tính đột phá hơn nhiều."
lang_multi_text.db,MultiText,Main_LahaiRoi_3_2_5_12,嗯……我明白了……,I... see...,Ừm... tôi hiểu rồi...
lang_multi_text.db,MultiText,Main_LahaiRoi_3_2_5_13,下次，我会把对口感需求的优先级提高的……,I'll... raise the priority level of flavor optimization for the next iteration.,"Lần sau, tôi sẽ nâng mức ưu tiên cho yêu cầu về hương vị lên..."
lang_multi_text.db,MultiText,Main_LahaiRoi_3_2_5_14,那，接下来，我想问一些有关海维夏探测器失控时的情况。,"Now, I'd like to review the incident with the Hyvatia Detector.","Vậy, tiếp theo, tôi muốn hỏi một số thông tin về lúc máy dò Hyvatia mất kiểm soát."
lang_multi_text.db,MultiText,Main_LahaiRoi_3_2_5_15,琳奈，{PlayerName}，可以向我具体描述一下你们镇压它的手段吗？,"Lynae, {PlayerName}, can you walk me through exactly how you managed to contain it?","Lynae, {PlayerName}, hai bạn có thể mô tả cụ thể cách đã khống chế nó không?"
lang_multi_text.db,MultiText,Main_LahaiRoi_3_2_5_16,（描述镇压海维夏时的情景）,(Describe how you contained the Hyvatia incident.),(Mô tả tình huống khi khống chế Hyvatia)
lang_multi_text.db,MultiText,Main_LahaiRoi_3_2_5_18,也就是说，你们使海维夏停止运行的手段，包括但不限于使用迅刀进行劈砍，使用特殊的涂料子弹多次射击，以及物理上的踩踏和击打，直至目标报废并完全丧失行动能力。,"To summarize, your method of stopping the Hyvatia included blade slashes, repeated shots with coated rounds, and physical force—stomping, striking—until it was rendered inoperable and immobile.","Nói cách khác, phương pháp mà hai bạn dùng để khiến Hyvatia ngừng hoạt động bao gồm nhưng không giới hạn ở việc dùng đao nhanh để chém, bắn nhiều lần bằng đạn sơn đặc biệt, cùng với giẫm đạp và đánh trực tiếp, cho đến khi mục tiêu hỏng hoàn toàn và mất khả năng hành động."
lang_multi_text.db,MultiText,Main_LahaiRoi_3_2_5_19,还有什么遗漏的吗？,Did I miss anything?,Còn gì thiếu sót không?
lang_multi_text.db,MultiText,Main_LahaiRoi_3_2_5_2,呜呜，好多食物的味道都混在了一起……有点腥，口感也又湿又黏……,"Ugh... the smells are all mixing together. It's kinda fishy, and the texture is wet and gooey.","Hu hu, mùi vị của bao nhiêu thứ đồ ăn trộn lẫn vào nhau... Hơi tanh, lại còn ướt nhẹp và dính nhớp..."
lang_multi_text.db,MultiText,Main_LahaiRoi_3_2_5_20,那个，莫宁教授，你该不会……,"Uh... Professor Mornye, you're not here to...","Ơ, Giáo sư Mornye, chẳng lẽ..."
lang_multi_text.db,MultiText,Main_LahaiRoi_3_2_5_21,是来找我们要赔偿的吧……,"...Make us pay for it, are you?",...đến bắt bọn tôi đền bù chứ gì...
lang_multi_text.db,MultiText,Main_LahaiRoi_3_2_5_22,呜呜，听我们解释，当时真的是情况紧急，我们实在是没有其他阻止它的办法！,"I mean, it all happened really fast! We didn't have any other way to stop it!","Hu hu, nghe bọn tớ giải thích đã, lúc đó tình hình thực sự rất gấp, bọn tớ không có cách nào khác để ngăn nó lại!"
lang_multi_text.db,MultiText,Main_LahaiRoi_3_2_5_23,何况，我们两个学生，也赔不起啊……,"Besides, we're just students! We couldn't afford that even if we wanted to...","Hơn nữa, hai đứa sinh viên bọn tớ, đền cũng không nổi..."
lang_multi_text.db,MultiText,Main_LahaiRoi_3_2_5_24,……不，你们误会了。,No. You're misunderstanding.,"...Không, các bạn hiểu lầm rồi."
lang_multi_text.db,MultiText,Main_LahaiRoi_3_2_5_25,不同的破坏方式，造成的损伤和修复方法是不一样的。,"Different damage mechanisms cause distinct failures, and require specific repair methods.","Những cách phá hủy khác nhau sẽ gây ra tổn thương khác nhau, và phương pháp sửa chữa cũng khác nhau."
lang_multi_text.db,MultiText,Main_LahaiRoi_3_2_5_26,毕竟如果是特殊共鸣能力造成的损伤，在不知情的状况下是难以依靠常规的检测手段发现的……嗯，所以都是直接打击这一点，你们做得很好。,"Damage from certain special Resonance abilities is hard to detect through standard diagnostics without prior data. So, you two did well to suppress it physically.","Bởi vì nếu tổn thương do năng lực cộng hưởng đặc biệt gây ra, khi không biết trước thì rất khó phát hiện bằng phương pháp kiểm tra thông thường... Vâng, vì vậy việc chỉ dùng đòn tấn công trực tiếp là điều rất tốt."
lang_multi_text.db,MultiText,Main_LahaiRoi_3_2_5_27,<te href=700016>换日仪式</te>中，<te href=700013>海维夏</te>探测器用于监测环境参数，不可或缺。我已经将刚才的信息整理给安瑟姆教授了，相信他很快就能完成维修。,"During the <te href=700016>New Solar Ceremony</te>, the <te href=700013>Hyvatia Detector</te> is essential in monitoring environmental parameters. I've already passed your report to Professor Anslem. He should complete repairs soon.","Trong <te href=700016>Nghi Lễ Đổi Nhật</te>, máy dò <te href=700013>Hyvatia</te> được dùng để theo dõi các thông số môi trường, không thể thiếu. Tôi đã tổng hợp thông tin vừa rồi gửi cho Giáo sư Anslem, tin rằng ông ấy sẽ sớm hoàn thành việc sửa chữa."
lang_multi_text.db,MultiText,Main_LahaiRoi_3_2_5_28,在之后与<te href=700015>罗伊族</te>的例行会议上，深空联合必须给出完整的修复方案，才能确保合作继续推进。,"At the upcoming meeting with the <te href=700015>Roya</te>, the Spacetrek Collective will need to present a full restoration plan to keep our partnership intact.","Trong cuộc họp định kỳ sắp tới với <te href=700015>Tộc Roya</te>, Liên Hợp Thâm Không phải đưa ra phương án phục hồi hoàn chỉnh để đảm bảo hợp tác tiếp tục được đẩy mạnh."
lang_multi_text.db,MultiText,Main_LahaiRoi_3_2_5_29,「换日仪式」还有合作方吗？,"There's a third party involved in this ""New Solar Ceremony""?","""Nghi Lễ Đổi Nhật"" còn có bên hợp tác nào nữa sao?"
lang_multi_text.db,MultiText,Main_LahaiRoi_3_2_5_30,嗯，说来话长……从哪里开始呢……,"Yes, though it's a long story. Where do I even begin...","Vâng, nói ra thì dài lắm... Bắt đầu từ đâu nhỉ..."
lang_multi_text.db,MultiText,Main_LahaiRoi_3_2_5_31,寻找违规人员！违规事项：宿舍内使用大功率电器，无视本机命令，对本机进行非法攻击！如有发现，请立刻通报！,"SCANNING FOR OFFENDERS! VIOLATION DETECTED: Unauthorized high-wattage device in the dormitory. An offender has assaulted this unit. If sighted, report immediately!","Truy tìm người vi phạm! Nội dung vi phạm: Sử dụng thiết bị điện công suất lớn trong ký túc xá, phớt lờ lệnh của đơn vị này, tấn công bất hợp pháp đơn vị này! Nếu phát hiện, hãy báo cáo ngay lập tức!"
lang_multi_text.db,MultiText,Main_LahaiRoi_3_2_5_32,噗哧……原来就算是莫宁教授，也免不了被准时宝追着跑的命运啊。,"Pfft... Even Professor Mornye isn't safe from TARD-E's wrath, huh?",Pfft... Hóa ra ngay cả Giáo sư Mornye cũng không thoát khỏi số phận bị TARD-E rượt đuổi nhỉ.
lang_multi_text.db,MultiText,Main_LahaiRoi_3_2_5_33,放心，这个我擅长。我去引开它，你们就趁其不备，一口气溜出去就好！,"No worries, I got this. I'll draw its attention while you two make for it.","Yên tâm, cái này tớ rành. Tớ sẽ đi dụ nó ra, còn hai người thì nhân lúc nó sơ hở, chuồn luôn một mạch nhé!"
lang_multi_text.db,MultiText,Main_LahaiRoi_3_2_5_34,三、二、一——,"Three, two, one—","Ba, hai, một--"
lang_multi_text.db,MultiText,Main_LahaiRoi_3_2_5_35,我们走吧。,That's our cue.,Đi thôi.
lang_multi_text.db,MultiText,Main_LahaiRoi_3_2_5_36,嗯。,Mm.,Vâng.
lang_multi_text.db,MultiText,Main_LahaiRoi_3_2_5_37,品尝完莫宁带来的研究院特色食物，莫宁询问了你们一些有关与海维夏战斗时的情况，并得知：换日仪式即将到来，海维夏在其中的作用不可或缺。正打算继续询问，准时宝打断了对话。,"After you try the Research Institute food samples Mornye brought, she asks about your fight with Hyvatia. From her account, you learn that the New Solar Ceremony is approaching and that Hyvatia is essential to it. Just as she prepares to explain more, a TARD-E Unit interrupts.","Sau khi nếm thử món ăn đặc sản của Viện Nghiên Cứu mà Mornye mang đến, cô ấy hỏi các bạn về tình huống khi chiến đấu với Hyvatia, và bạn được biết: Nghi Lễ Đổi Nhật sắp tới, vai trò của Hyvatia trong đó là không thể thiếu. Đang định hỏi thêm thì TARD-E cắt ngang cuộc trò chuyện."
lang_multi_text.db,MultiText,Main_LahaiRoi_3_2_5_4,我听说深空联合的研究员为了节省时间，发明了一种“虽然口味不佳，但吃上一口就能供能三天”的食物。这竟然是真的……,"So it's true, huh? You guys actually made food that tastes awful but keeps you running for three days straight. I thought that was just a joke.","Tớ nghe nói các nhà nghiên cứu của Liên Hợp Thâm Không để tiết kiệm thời gian đã phát minh ra một loại thức ăn ""tuy hương vị tệ, nhưng chỉ cần ăn một miếng là đủ năng lượng ba ngày"". Không ngờ lại là thật..."
lang_multi_text.db,MultiText,Main_LahaiRoi_3_2_5_5,……这是研究院的一项科研成果，使用了最前沿的能量压缩技术，是最能代表深空联合的食物……,It's a scientific breakthrough using energy-compression tech. It's one of Collective's most iconic achievements.,"...Đây là một thành tựu nghiên cứu của Viện, sử dụng công nghệ nén năng lượng tiên tiến nhất, là món ăn tiêu biểu nhất của Liên Hợp Thâm Không..."
lang_multi_text.db,MultiText,Main_LahaiRoi_3_2_5_6,{PlayerName}，你也……不喜欢？,"{PlayerName}, do you... also not like it?","{PlayerName}, bạn cũng... không thích sao?"
lang_multi_text.db,MultiText,Main_LahaiRoi_3_2_5_7,这是科技的结晶。,This is peak science.,Đây là tinh hoa của khoa học.
lang_multi_text.db,MultiText,Main_LahaiRoi_3_2_5_8,还是味道更重要。,"If this is what progress tastes like, I want to go back.",Hương vị vẫn quan trọng hơn.
lang_multi_text.db,MultiText,Main_LahaiRoi_3_2_5_9,……没错！我就知道你能看出这一点。,Yes! I knew you would understand.,...Đúng vậy! Tôi biết bạn sẽ nhận ra điều này mà.
lang_multi_text.db,MultiText,Main_LahaiRoi_3_2_6_1,唔，刚才与你建立连接的频率应该就是来自这里。但是，现在什么也没有了……,"Hmm... the frequency that connected with you was coming from here. But now, I don't smell a thing.","Ừm, tần số vừa kết nối với cậu chắc là từ chỗ này. Nhưng giờ thì chẳng còn gì cả..."
lang_multi_text.db,MultiText,Main_LahaiRoi_3_2_6_14,我听到的那个声音说，他把日轮强制停止了。,"In that memory, I heard a voice say he would force the Heliogyre to a standstill.","Giọng nói tôi nghe được bảo rằng, anh ta đã ép Nhật Luân dừng lại."
lang_multi_text.db,MultiText,Main_LahaiRoi_3_2_6_15,……停止？,A standstill?,...Dừng lại?
lang_multi_text.db,MultiText,Main_LahaiRoi_3_2_6_16,（向莫宁描述刚才看到的画面）,(Describe what you saw to Mornye.),(Kể lại cho Mornye những gì vừa nhìn thấy)
lang_multi_text.db,MultiText,Main_LahaiRoi_3_2_6_17,你是说，你听到有一个声音在向你求救，并且强制停下了日轮……,"You're saying you heard a voice asking for help, saying he would stop the Heliogyre's workings.","Ý cậu là, cậu nghe thấy một giọng nói cầu cứu, và đã ép Nhật Luân dừng lại..."
lang_multi_text.db,MultiText,Main_LahaiRoi_3_2_6_18,难道，刚才的会议被取消，就是因为这个……,Could that be why the meeting was cancelled?,"Chẳng lẽ, cuộc họp lúc nãy bị hủy chính là vì chuyện này..."
lang_multi_text.db,MultiText,Main_LahaiRoi_3_2_6_19,（打倒虚诞虫时，有一个声音告诉我要保护太阳。目前来看，声音的主人没有敌意，反而给出了很多帮助，可以先按她说的行动。）,"(When I handled the Voidworm, a voice told me to protect the sun. Whoever she is, I don't think she intends harm. She offered to help. For now, I'll do what she suggested.)","(Khi đánh bại Voidworm, có giọng nói bảo tôi phải bảo vệ mặt trời. Hiện tại mà nói, chủ nhân giọng nói đó không có ác ý, ngược lại còn giúp đỡ rất nhiều, có thể tạm thời hành động theo lời cô ấy.)"
lang_multi_text.db,MultiText,Main_LahaiRoi_3_2_6_2,（刚才那个声音提到，“用日轮的最后一点力量使它免于消散”……是维持到这里就消失了吗？）,(The voice from earlier said it would share the last of the Heliogyre's strength so it wouldn't fade. It must be that Soliskin. Did it eventually vanish here?),"(Giọng nói lúc nãy có đề cập, ""dùng chút sức lực cuối cùng của Nhật Luân để giữ nó khỏi tan biến""... Chẳng lẽ nó duy trì đến đây rồi biến mất sao?)"
lang_multi_text.db,MultiText,Main_LahaiRoi_3_2_6_20,（而且，可以确定的是，知道「御者」这一称呼的那人需要我的帮助。）,"(And one thing is certain. The one who knows me by my ""Arbiter"" title needs my help.)","(Hơn nữa, có thể chắc chắn rằng, người biết danh xưng ""Ngự Giả"" đang cần sự giúp đỡ của tôi.)"
lang_multi_text.db,MultiText,Main_LahaiRoi_3_2_6_21,（黑色的长袍，金色的花纹……）,(Black robes with golden embroidery...),"(Áo choàng đen, hoa văn vàng...)"
lang_multi_text.db,MultiText,Main_LahaiRoi_3_2_6_22,（双角形状的头饰……）,(A headpiece shaped like two horns...),(Trang sức hình đôi sừng trên đầu...)
lang_multi_text.db,MultiText,Main_LahaiRoi_3_2_6_23,（还有，奇怪的眼睛……）,(And those unusual eyes...),(Và đôi mắt kỳ lạ...)
lang_multi_text.db,MultiText,Main_LahaiRoi_3_2_6_24,莫宁，我想打听一下这个人。你知道哪里有消息比较灵通的罗伊族么？,"I need to find out who he is, Mornye. Do you know any Roya who are familiar with the tribe's inner workings?","Mornye, tôi muốn hỏi thăm về người này. Cô có biết người Roya nào thạo tin không?"
lang_multi_text.db,MultiText,Main_LahaiRoi_3_2_6_25,唔……我有一些罗伊族的学生，也许会知道你想打听的事。,Hmm... I do have some Royan students. They might know who he is.,"Ừm... Tôi có một số sinh viên người Roya, có lẽ họ sẽ biết chuyện cậu muốn hỏi."
lang_multi_text.db,MultiText,Main_LahaiRoi_3_2_6_26,现在是星炬学院的上课时间，要返回学校吗？,It's class hours at the Academy. Should we head back?,"Giờ đang là giờ học của Học viện Startorch, quay lại trường chứ?"
lang_multi_text.db,MultiText,Main_LahaiRoi_3_2_6_27,救、救命啊，玛嘉……玛嘉她！谁去救救她！,"Help! Help! Maja—Maja, she... Someone, please help!","Cứu, cứu với, Maja... Maja cô ấy! Ai đó cứu cô ấy đi!"
lang_multi_text.db,MultiText,Main_LahaiRoi_3_2_6_28,不然的话——我们的期末论文数据就要全部消失了！,"Otherwise, our thesis data will disappear entirely!",Không thì- dữ liệu luận văn cuối kỳ của chúng tôi sẽ mất hết!
lang_multi_text.db,MultiText,Main_LahaiRoi_3_2_6_29,……请放心，{PlayerName}。当学生的一句话里出现“论文”，不管喊得多大声，都一定不是什么需要“救命”的情况。,"Don't worry, {PlayerName}. If you see a student shouting ""help"" and ""thesis"" in the same breath, no matter how loudly they scream, it's never really an emergency.","...Yên tâm, {PlayerName}. Khi sinh viên nhắc đến ""luận văn"" trong câu, thì dù có la to đến mấy, chắc chắn không phải tình huống cần ""cứu mạng"" đâu."
lang_multi_text.db,MultiText,Main_LahaiRoi_3_2_6_3,你找到你想要的了吗？,Did you find what you're looking for?,Cậu tìm được thứ mình cần chưa?
lang_multi_text.db,MultiText,Main_LahaiRoi_3_2_6_30,不过，玛嘉就是我刚才说的罗伊族学生之一。既然有事找她，还是去看看吧。,"But Maja is one of the Roya students I mentioned. Since you're looking for her, we might as well see what it's about.","Tuy nhiên, Maja chính là một trong những sinh viên Roya tôi vừa nhắc đến. Đã có việc cần tìm cô ấy, thì cứ đi xem thử vậy."
lang_multi_text.db,MultiText,Main_LahaiRoi_3_2_6_31,（又是和研究院有关的事出问题了，看来暂时不要让那边知道我们的行动比较好。）,(Hm. Yet another problem tied to the Research Institute. We shouldn't reveal our plans to them just yet.),"(Lại là chuyện liên quan đến Viện Nghiên cứu gặp trục trặc, xem ra tạm thời không nên để bên đó biết về hành động của chúng ta thì hơn.)"
lang_multi_text.db,MultiText,Main_LahaiRoi_3_2_6_34,海维夏虽然能监测环境数据，但来自炉芯内部的原始观测数据，只能由同属隧者的部件——「日轮」来观测。,"Hyvatia can monitor environmental data, but raw observational data on the Reactor Drive can only be obtained from the Heliogyre—a component of the Exostrider itself.","Hyvatia tuy có thể theo dõi dữ liệu môi trường, nhưng dữ liệu quan sát nguyên thủy từ bên trong lò phản ứng chỉ có thể được quan sát bởi Nhật Luân - một bộ phận cùng thuộc về Exostrider."
lang_multi_text.db,MultiText,Main_LahaiRoi_3_2_6_35,只有罗伊族能够从日轮中获取数据，因此，深空联合在换日仪式中需要与他们保持合作。,Only the Roya tribe can discern the Heliogyre's readings. That's why the Collective needs their cooperation during the New Solar Ceremony.,"Chỉ có tộc Roya mới có thể thu thập dữ liệu từ Nhật Luân, vì vậy Collective cần duy trì hợp tác với họ trong Lễ Đổi Mặt Trời."
lang_multi_text.db,MultiText,Main_LahaiRoi_3_2_6_36,你们没有找到那段频率的来源，却得知了另外的线索：那段求助中提到的“日轮”是换日仪式中必要的物件，只能由罗伊族使用。你与莫宁打算去询问学院的罗伊族学生，却听到求救声传来。,"You find no trace of the frequency's source but uncover a new clue: the ""Heliogyre"" mentioned in the vision is an indispensable component of the New Solar Ceremony, and only the Roya can discern its workings. Just as you plan to question Roya students, a cry for help rings out.","Các bạn không tìm được nguồn phát tần số đó, nhưng lại có được manh mối khác: ""Nhật Luân"" được nhắc đến trong lời cầu cứu là vật không thể thiếu trong Lễ Đổi Mặt Trời, và chỉ tộc Roya mới sử dụng được. Bạn và Mornye định đi hỏi sinh viên Roya ở học viện thì nghe thấy tiếng kêu cứu."
lang_multi_text.db,MultiText,Main_LahaiRoi_3_2_6_4,不，这条线索中断了。不过，那段记忆里还提到一些别的东西。,No. The trail ends here. But I saw other things in that memory.,"Không, manh mối này đứt đoạn rồi. Nhưng trong ký ức đó còn nhắc đến vài thứ khác."
lang_multi_text.db,MultiText,Main_LahaiRoi_3_2_6_5,莫宁，你知道「日轮」吗？,"Mornye, do you know of a ""Heliogyre""?","Mornye, cô có biết ""Nhật Luân"" không?"
lang_multi_text.db,MultiText,Main_LahaiRoi_3_2_6_6,……我知道。,Yes.,...Tôi biết.
lang_multi_text.db,MultiText,Main_LahaiRoi_3_2_6_7,「<te href=700019>日轮</te>」，是换日仪式中最重要的东西之一。,"The ""<te href=700019>Heliogyre</te>"" is one of the most important components of the New Solar Ceremony.","""<te href=700019>Nhật Luân</te>"" là một trong những thứ quan trọng nhất trong Lễ Đổi Mặt Trời."
lang_multi_text.db,MultiText,Main_LahaiRoi_3_2_700_1,六席之一，位列「归律」之席。他的呼吸有些冰冷。,"One of the Six, holding the ""Chronicler"" seat. His breath carries a strange chill.","Một trong Lục Tịch, giữ ghế ""Quy Luật"". Hơi thở của ông ta có chút lạnh lẽo."
lang_multi_text.db,MultiText,Main_LahaiRoi_3_2_701_1,六席之一，位列「镌律」之席。她的衣袍上没有一丝尘埃。,"One of the Six, holding the ""Recorder"" seat. Not a single speck of dust lies upon her robes.","Một trong Lục Tịch, giữ ghế ""Quyên Luật"". Áo bào của bà không dính lấy một hạt bụi."
lang_multi_text.db,MultiText,Main_LahaiRoi_3_2_702_1,六席之一，位列「拨缕」之席。她闭眼的样子不像休息，而像一种被设定的状态。,"One of the Six, holding the ""Refiner"" seat. Her closed eyes seem less like rest, and more like a designed state.","Một trong Lục Tịch, giữ ghế ""Bát Lũ"". Dáng vẻ nhắm mắt của bà không giống đang nghỉ ngơi, mà như một trạng thái được thiết lập sẵn."
lang_multi_text.db,MultiText,Main_LahaiRoi_3_2_703_1,六席之一，位列「视界」之席。她看起来已经很久没有出现在阳光下了。,"One of the Six, holding the ""Eye"" seat. She looks as if she hasn't seen the sun in a very long time.","Một trong Lục Tịch, giữ ghế ""Thị Giới"". Trông bà như đã rất lâu không xuất hiện dưới ánh nắng."
lang_multi_text.db,MultiText,Main_LahaiRoi_3_2_704_1,六席之一，位列「灵悉」之席。他像一座由时间雕刻成的容器。,"One of the Six, holding the ""Binder"" seat. He resembles a vessel carved by time itself.","Một trong Lục Tịch, giữ ghế ""Linh Tất"". Ông như một chiếc bình được thời gian chạm khắc nên."
lang_multi_text.db,MultiText,Main_LahaiRoi_3_2_708_1,我看错了吗，那是……虚质磁暴？可是引日殿并没有发布消息啊？,Am I seeing things? Is that... a Void Storm? But the Solisylum did not sound the alarm!,"Tôi nhìn nhầm sao, đó là... Bão Hư Chất? Nhưng Solisylum đâu có phát thông báo gì?"
lang_multi_text.db,MultiText,Main_LahaiRoi_3_2_708_2,难道引日殿对虚质磁暴的预测不准确了……,Could the Solisylum's predictions of the Void Storm be wrong...,Chẳng lẽ dự đoán Bão Hư Chất của Solisylum không còn chính xác nữa...
lang_multi_text.db,MultiText,Main_LahaiRoi_3_2_708_3,不可能，秘日六席的预测不会出错！一定只是我们没收到消息！,Impossible! The predictions of the Heliodic Six are never wrong! We must have missed the warning!,"Không thể nào, dự đoán của Lục Tịch không bao giờ sai! Chắc chắn chỉ là chúng ta chưa nhận được tin thôi!"
lang_multi_text.db,MultiText,Main_LahaiRoi_3_2_708_4,对了，我记得艾丝翠德前阵子刚从浮光林回来！她是牧者，应该知道更多情况，我们去问问她吧！,"Wait, I remember now! Astrid just returned from Bjartr Woods! As a Shepherdess, she must know more. We will go ask her!","À đúng rồi, tôi nhớ Astrid mới từ Bjartr Woods về! Cô ấy là người chăn dắt, chắc hẳn biết thêm tình hình, chúng ta đi hỏi cô ấy đi!"
lang_multi_text.db,MultiText,Main_LahaiRoi_3_2_708_5,是啊，希望她只是忘记将预测结果通知给我们了……,Yes. Let us hope she simply forgot to tell the rest of us...,"Ừ, hy vọng cô ấy chỉ quên thông báo kết quả dự đoán cho chúng ta thôi..."
lang_multi_text.db,MultiText,Main_LahaiRoi_3_2_709_1,你还好吗？！,Are you alright?!,Cô không sao chứ?!
