db_file,table_name,id,zh,en,vi
lang_multi_text.db,MultiText,Main_Linaxita_2_4_136_23,它利用我的返回舱制造了名为“芙露德莉斯”的个体，意图将她作为自己的共鸣者。,"The Threnodian used my return pod to conceive an entity known as ""Fleurdelys,"" to make her Its Resonator.","Nó lợi dụng khoang hồi hương của ta tạo ra cá thể mang tên ""Fleurdelys"", nhằm biến cô ấy thành Cộng Hưởng Giả của nó."
lang_multi_text.db,MultiText,Main_Linaxita_2_4_136_24,在经过数百年的时间，无法计数的失败后，他用穷举的方式碰上了唯一一次成功。,"After centuries of failure, by sheer trial it found success but once.","Sau hàng trăm năm và vô số lần thất bại, nó bằng cách thử từng cái một mà tình cờ đạt được thành công duy nhất."
lang_multi_text.db,MultiText,Main_Linaxita_2_4_136_25,我与利维亚坦已经融合成了一个个体，所以“芙露德莉斯”既是它的共鸣者，亦是我的。,"We were of one body. Therefore, when Fleurdelys became Leviathan's Resonator, she also became mine.","Ta và Leviathan đã dung hợp thành một cá thể, nên ""Fleurdelys"" vừa là Cộng Hưởng Giả của nó, cũng là Cộng Hưởng Giả của ta."
lang_multi_text.db,MultiText,Main_Linaxita_2_4_136_26,对岁主来说，共鸣者是存世的锚点；而对鸣式来说，这锚点便成了困住他的枷锁。,"But mark this well. To the Sentinel, a Resonator is an anchor; to the Threnodian, they are but a shackle.","Với Tuế Chủ, Cộng Hưởng Giả là điểm neo tồn tại trên đời; còn với Minh Thức, điểm neo ấy trở thành xiềng xích giam giữ nó."
lang_multi_text.db,MultiText,Main_Linaxita_2_4_136_27,那你为何还将「提尔芬」交予翡萨烈家族？,What made you decide to leave Tyrvine with the Fisalias?,"Vậy sao Ngài còn giao ""Tyrvine"" cho gia tộc Fisalia?"
