db_file,table_name,id,zh,en,vi
lang_multi_text.db,MultiText,Guide_YFSH_1_12,额……听起来怎么有点怪怪的……老太太……怎么会喜欢声骸？景烛爷爷，你确定吗？,"Uh... Grandpa Jingzhu, are you really sure about that? It sounds a bit strange. It's not every day you see a lady keen on Echoes.","Ơ... nghe sao hơi kỳ kỳ... Bà cụ... lại thích Thanh Hài à? Ông Cảnh Chúc, ông chắc chứ?"
lang_multi_text.db,MultiText,Guide_YFSH_1_13,哎呀，感情的事情，不试试怎么知道呢？,"At least, it seems to be the only way to her heart.","Ôi dào, chuyện tình cảm, không thử sao biết được?"
lang_multi_text.db,MultiText,Guide_YFSH_1_14,只要有万分之一的可能，我都愿意为了她试一试！,"Despite the odds, I’m resolved to attempt it.","Chỉ cần có một phần vạn khả năng, tôi cũng sẵn lòng thử vì bà ấy!"
lang_multi_text.db,MultiText,Guide_YFSH_1_15,但是你现在这个情况，可千万不能再乱动了。,But you’re not at your best. You really should take some good rest.,"Nhưng tình trạng ông bây giờ, tuyệt đối không được loạn động nữa."
lang_multi_text.db,MultiText,Guide_YFSH_1_16,不然，再从山坡上滚下来一次，谁都不好说……,Who knows what might happen if you take another tumble down that hillside...,Chứ lỡ lại lăn xuống dốc một lần nữa thì ai mà dám chắc...
lang_multi_text.db,MultiText,Guide_YFSH_1_17,呸呸呸，我怎么能说这种不吉利的话！,"Oh, sorry! I shouldn’t have said such things!","Khụ khụ khụ, sao mình lại nói mấy lời xui xẻo thế này!"
lang_multi_text.db,MultiText,Guide_YFSH_1_18,小巡尉，你现在还不明白，身上的痛只是皮毛而已，心里的痛才是……,"Little Patroller, you're still too young to understand what love means. Enduring physical pain is one thing, but the ache of unrequited love is something even great heroes can't overcome.","Cô tuần úy ơi, cô còn trẻ chưa hiểu đâu, đau ngoài da chỉ là chuyện nhỏ thôi, đau trong lòng mới là..."
lang_multi_text.db,MultiText,Guide_YFSH_1_19,唉，总之我就是要去抓威风的声骸，抓到了才能安心。,"Anyway, I’ll capture an impressive Echo and seize my love.","Hà, nói chung tôi nhất định phải đi bắt một con Thanh Hài oai phong, bắt được rồi mới yên lòng."
lang_multi_text.db,MultiText,Guide_YFSH_1_2,唉……唉……嘶……,*sigh*...,Hà... hà... xì...
lang_multi_text.db,MultiText,Guide_YFSH_1_20,景烛爷爷，急不得急不得，声骸啥时候没有，你先把身体养好，下次肯定一抓一个准！,"Oh, please reconsider, Grandpa Jingzhu! Echoes will always be there for you to capture. Once you recover, you can catch as many as you want!","Ông Cảnh Chúc, từ từ đã, Thanh Hài thì lúc nào chả có, ông cứ dưỡng thương cho khỏe đã, lần sau chắc chắn bắt một phát trúng ngay!"
lang_multi_text.db,MultiText,Guide_YFSH_1_21,下次，下次……总说下次，我都这把年纪了，下次得等到什么时候？,"Once I recover... But kid, I grow tired of waiting. When will the opportunity arise again?","Lần sau, lần sau... cứ nói lần sau hoài, tôi già thế này rồi, lần sau phải đợi đến bao giờ?"
lang_multi_text.db,MultiText,Guide_YFSH_1_22,再说，最近正是声骸活跃的时候，最容易抓到厉害的声骸。,"Besides, Tacet Discords are most active recently, so it’s the best time to capture impressive Echoes!","Hơn nữa, dạo này đúng lúc Thanh Hài hoạt động mạnh, dễ bắt được con lợi hại nhất."
lang_multi_text.db,MultiText,Guide_YFSH_1_23,错过这次，下次就难说咯。,I can’t let this chance slip away.,"Bỏ lỡ lần này, lần sau khó nói lắm."
lang_multi_text.db,MultiText,Guide_YFSH_1_24,那……咱们做个交易吧！,"Okay, okay. How about this?",Vậy thì... mình thỏa thuận thế này đi!
lang_multi_text.db,MultiText,Guide_YFSH_1_25,我替你去抓声骸，但是作为交换，你要乖乖去医院处理伤口，可以吗？,I’ll go catch Echoes for you and you’ll go to the hospital. Is that okay?,"Cháu đi bắt Thanh Hài thay ông, nhưng đổi lại, ông phải ngoan ngoãn đến bệnh viện xử lý vết thương, được không?"
lang_multi_text.db,MultiText,Guide_YFSH_1_26,这、这怎么好意思？,But I don’t want to bother you with my own issue...,Thế... thế ngại quá...
lang_multi_text.db,MultiText,Guide_YFSH_1_27,照顾街坊是社区巡尉的职责呀~这是我的工作，不用不好意思。,"No worries. It’s no trouble at all! After all, it’s a Patroller’s duty to take care of the residents’ needs.","Chăm lo cho bà con hàng xóm là trách nhiệm của tuần úy khu phố mà~ Đây là công việc của cháu, ông đừng ngại."
lang_multi_text.db,MultiText,Guide_YFSH_1_28,话虽这么说，但为了老头子我的私事让你加班……实在是过意不去呀。这样吧，我这些年攒了一些钱，你要帮忙可以，必须收下报酬。,"Well, it doesn’t sit right with me having you work overtime for my personal issues. If you’re going to help, you have to accept some compensation from my savings. It’s the least I can do.","Nói vậy thì đúng, nhưng vì chuyện riêng của lão già này mà để cháu làm thêm giờ... thật quá ý không được. Vậy nhé, mấy năm nay tôi dành dụm được ít tiền, cháu muốn giúp thì phải nhận thù lao."
lang_multi_text.db,MultiText,Guide_YFSH_1_29,我的工资够用啦！唔……不过我有个很厉害的朋友，不如我叫{TA}来帮忙，报酬给{TA}就好啦。,"Oh, no need to worry about paying me! Actually, I have a really skilled friend who could help. What if we hire {Male=him;Female=her} to help instead?","Lương cháu đủ xài rồi mà! Ừm... nhưng cháu có một người bạn rất giỏi, hay là cháu gọi {TA} đến giúp, thù lao trả cho {TA} là được!"
lang_multi_text.db,MultiText,Guide_YFSH_1_3,景烛爷爷，你都这样了，就别急着去抓什么<ano=可吸收的残象频率>声骸</ano>了，先去医院吧！,"Grandpa Jingzhu, seriously, you’re not well... Let’s forget about capturing <ano=TD Frequencies>Echoes</ano> for now and head straight to the hospital, okay?","Ông Cảnh Chúc, ông đã thế này rồi thì đừng vội đi bắt <ano=Tàn Tượng có thể hấp thu tần số>Thanh Hài</ano> nữa, đi bệnh viện trước đi ạ!"
lang_multi_text.db,MultiText,Guide_YFSH_1_30,也好，也好。,That’s fine for me.,"Cũng được, cũng được."
lang_multi_text.db,MultiText,Guide_YFSH_1_31,那就这么说定了！景烛爷爷你先去医院吧，伤口可耽误不得。,"Excellent! Leave it to me! Grandpa Jingzhu, now please go to the hospital and tend to your injuries.","Vậy là nói xong nhé! Ông Cảnh Chúc đi bệnh viện trước đi, vết thương không chậm trễ được đâu."
lang_multi_text.db,MultiText,Guide_YFSH_1_4,……不行！我必须得抓个威风的声骸，不然我饭都吃不下，觉也睡不着……,"No way! If I don't capture an impressive Echo, I'll be too anxious to even think about eating or sleeping.","...Không được! Tôi nhất định phải bắt cho được một con Thanh Hài oai phong, nếu không thì cơm ăn không nổi, ngủ cũng không yên..."
lang_multi_text.db,MultiText,Guide_YFSH_1_5,哎呀，景烛爷爷，你都这个岁数了，硬要去抓声骸做什么？,"Oh, come on! You shouldn't be out there chasing them at your age. Why do you have to get one?","Ôi trời, ông Cảnh Chúc, ông tuổi này rồi, cứ đòi đi bắt Thanh Hài làm gì?"
lang_multi_text.db,MultiText,Guide_YFSH_1_6,咳咳，不是我喜欢，是我喜欢的人喜欢！,"Ahem, because the person I like wants one!","Khụ khụ, không phải tôi thích, mà là người tôi thích thích!"
lang_multi_text.db,MultiText,Guide_YFSH_1_7,喜欢的人喜欢……？,The person you like...?,Người ông thích thích...?
lang_multi_text.db,MultiText,Guide_YFSH_1_8,嗯……我都这把岁数了，好不容易有个喜欢的老太太，但是对方一直拒绝我。,"Yes. You know, it's not usual for a man of my years to seek love, but I love her. She keeps rejecting me.","Ừ... tôi tuổi này rồi, khó lắm mới có một bà cụ mình thích, nhưng bà ấy cứ từ chối tôi hoài."
lang_multi_text.db,MultiText,Guide_YFSH_1_9,我知道她喜欢威风的声骸，就只能从这点入手了。,"She’s into impressive Echoes, so that’s my in.","Tôi biết bà ấy thích Thanh Hài oai phong, nên chỉ có thể bắt đầu từ điểm này thôi."
lang_multi_text.db,MultiText,Guide_YFSH_20_1,想训练声骸。,I want to train Echoes.,Muốn luyện tập Thanh Hài.
lang_multi_text.db,MultiText,Guide_YFSH_20_2,哦，明白了。那请到这边来，根据自己的实力，选择合适的训练吧。,I see. Follow me. Select a training program that aligns with your current skill level.,"Ồ, hiểu rồi. Vậy mời đi theo tôi, hãy chọn bài luyện tập phù hợp với thực lực của mình."
lang_multi_text.db,MultiText,Guide_YFSH_20_3,你好，又见面了，这次有何贵干？,"Hello, our paths cross again. What brings you here this time?","Xin chào, lại gặp nhau rồi. Lần này đến có việc gì?"
lang_multi_text.db,MultiText,Guide_YFSH_20_4,温馨提示，选择时不要心存侥幸，别想着一口气吃成胖子。,Just a word of caution. Don’t let overconfidence cloud your judgment when choosing. It’s wise not to bite off more than you can chew.,"Lời nhắc nhỏ, khi chọn đừng có ảo tưởng, đừng nghĩ một bước lên trời."
lang_multi_text.db,MultiText,Guide_YFSH_20_5,不然你们很有可能会哭着出来。,"Otherwise, you may find yourself in tears.",Không thì rất có thể các người sẽ khóc mà chạy ra đấy.
lang_multi_text.db,MultiText,Guide_YFSH_21_1,不错，不错，远超预期。,Not bad. Far beyond my expectations.,"Không tồi, không tồi, vượt xa kỳ vọng."
lang_multi_text.db,MultiText,Guide_YFSH_21_2,{PlayerName}，你果然每次都不会让我失望。,"{PlayerName}, you never fail to impress me.","{PlayerName}, quả nhiên lần nào cậu cũng không làm tôi thất vọng."
lang_multi_text.db,MultiText,Guide_YFSH_21_3,以后你有任何需要都可以来找我，我很乐意为有干劲的年轻人提供各种强度的训练。,Don’t hesitate to come to me if you need help. I’d be happy to provide training at different levels for enthusiastic people like you.,"Sau này cậu có cần gì cứ đến tìm tôi, tôi rất vui lòng cung cấp các bài luyện tập với nhiều cường độ khác nhau cho những người trẻ có chí tiến thủ."
lang_multi_text.db,MultiText,Guide_YFSH_21_4,怎么听着……有点可怕？哈哈。,"Haha, that sounds a tad... intimidating, doesn't it?",Sao nghe... có hơi đáng sợ nhỉ? Haha.
lang_multi_text.db,MultiText,Guide_YFSH_21_5,不过，今天居然这么快就顺利搞定了？真不愧是你，{PlayerName}！,"I never imagined we’d breeze through all that training so quickly! You’re truly living up to your name, {PlayerName}!","Nhưng hôm nay lại xong nhanh thế à? Đúng là giỏi thật, {PlayerName}!"
lang_multi_text.db,MultiText,Guide_YFSH_21_6,走吧走吧，咱们赶紧出去，把好消息告诉景烛爷爷吧。,Let’s go break the good news to Grandpa Jingzhu!,"Đi thôi đi thôi, chúng ta mau ra ngoài báo tin vui cho ông Cảnh Chúc nào."
lang_multi_text.db,MultiText,Guide_YFSH_22_1,这么快就出来了？,Back so soon?,Ra nhanh thế à?
lang_multi_text.db,MultiText,Guide_YFSH_22_2,严彦可是个狠角色，能在他手下这么快过关，真是后生可畏。,Yhan is quite a formidable figure. Breezing through his training is truly commendable.,"Nghiêm Ngạn là tay cứng cựa, mà vượt qua nhanh như vậy dưới tay hắn, thật đáng nể."
lang_multi_text.db,MultiText,Guide_YFSH_22_3,以后肯定就是你们这帮年轻人的天下了！,"I have no doubt that the world will soon be at your feet, youngsters!","Sau này chắc chắn là thời đại của các ngươi, lũ trẻ!"
lang_multi_text.db,MultiText,Guide_YFSH_22_4,哈哈，话不多说，先办正事。,"Haha, enough banter. Let’s get down to the business first. The scythes of the Havoc Warrior await our sharpening!","Haha, không nói nhiều nữa, lo việc chính trước đã."
lang_multi_text.db,MultiText,Guide_YFSH_23_1,哇，果然更厉害了！,Whoa! It’s even more impressive now! Check out those scythes—they’re seriously intimidating!,"Oa, quả nhiên mạnh hơn rồi!"
lang_multi_text.db,MultiText,Guide_YFSH_23_4,嘿嘿，这就是能经受住严彦考验的训练成果啊。,"Despite your youthful vigor, enduring Yhan’s training again in such a brief span may still be quite a challenge. Maybe, we can...","Hehe, đây chính là thành quả luyện tập khi vượt qua thử thách của Nghiêm Ngạn."
lang_multi_text.db,MultiText,Guide_YFSH_23_5,这声音……果然是你，景烛前辈。,"This voice... I knew it's you, Mr. Jingzhu.","Giọng nói này... Quả nhiên là ngài, Cảnh Chúc tiền bối."
lang_multi_text.db,MultiText,Guide_YFSH_23_6,严、严彦教官？,In-Instructor Yhan?,"Ngh, Nghiêm Ngạn giáo quan?"
lang_multi_text.db,MultiText,Guide_YFSH_24_1,哎呀呀，还是被你小子认出来了啊。,"Ah, you still recognize this old face, Yhan.","Ái chà chà, vẫn bị mi nhận ra rồi."
lang_multi_text.db,MultiText,Guide_YFSH_24_10,可是，前辈你都退役这么久了……,But you have retired for a long time...,"Nhưng, tiền bối đã giải ngũ lâu rồi mà..."
lang_multi_text.db,MultiText,Guide_YFSH_24_11,退役归退役，我身子骨还硬朗着呢！不过，确实挺久了啊，自打退役后就很少见到你们这些毛头小子了。,"Retired I may be, but the fire still burns within me! It’s been quite some time since I retired, and opportunities to mingle with you youngsters are rare these days.","Giải ngũ thì giải ngũ, ta vẫn còn khỏe mạnh lắm! Nhưng quả thật lâu rồi, từ khi giải ngũ rất ít gặp lại bọn nhóc các ngươi."
lang_multi_text.db,MultiText,Guide_YFSH_24_12,再见面，站在我面前的已经是三军总教官严彦了，不错嘛！,"And here stands Chief Instructor Yhan. You’ve been keeping well, I trust?","Gặp lại, đứng trước mặt ta giờ đã là tổng giáo quan tam quân Nghiêm Ngạn rồi, khá lắm!"
lang_multi_text.db,MultiText,Guide_YFSH_24_13,发挥余热罢了。话说，景烛前辈的老队友们都还好吗？,I’m merely fulfilling my duty. And how fare your old comrades?,"Chỉ là cống hiến chút sức lực còn lại thôi. Nhân tiện, những đồng đội cũ của tiền bối đều khỏe chứ?"
lang_multi_text.db,MultiText,Guide_YFSH_24_14,他们啊，除了我和队长，都……罢了罢了，难得见面，不提这些伤感的事。,"Except for Captain and myself, they all... Ah, never mind. Let’s focus on happier topics during this once-in-a-while reunion.","Bọn họ à, ngoài ta và đội trưởng ra, đều đã... Thôi thôi, khó mà gặp nhau, đừng nhắc chuyện buồn."
lang_multi_text.db,MultiText,Guide_YFSH_24_15,过去的都过去了，老头子我活到这把年纪，就学会了一件事，要专注当下！,"The past is the past. When you reach my age, you’ll realize that the present moment holds the most significance in life!","Chuyện đã qua thì để nó qua, lão già ta sống đến tuổi này, chỉ học được một điều, phải tập trung vào hiện tại!"
lang_multi_text.db,MultiText,Guide_YFSH_24_16,专注当下，过好现在的日子，才不枉队友们的付出啊……,Live in the moment and cherish each passing day. That’s how we honor our comrades’ sacrifices.,"Tập trung vào hiện tại, sống tốt những ngày trước mắt, mới không phụ sự hy sinh của đồng đội..."
lang_multi_text.db,MultiText,Guide_YFSH_24_17,景烛前辈说的是，做好眼前的事比什么都重要。,"Indeed, Mr. Jingzhu. The present demands our full attention.","Tiền bối nói đúng, làm tốt việc trước mắt quan trọng hơn tất cả."
lang_multi_text.db,MultiText,Guide_YFSH_24_18,嗯，不错，那咱们就来聊点眼前的事。你也知道我现在缺什么，方便的话，给点？,"Exactly, then let’s talk about the present. You know what I need now. Are you willing to lend a hand?","Ừ, hay lắm, vậy chúng ta nói chuyện trước mắt đi. Mi cũng biết ta đang thiếu gì, tiện thì cho ít được không?"
lang_multi_text.db,MultiText,Guide_YFSH_24_19,……前辈你果然，和当年一样精神抖擞。,"You’re as spirited as ever, Mr. Jingzhu.","...Tiền bối quả nhiên, vẫn khỏe khoắn như ngày xưa."
lang_multi_text.db,MultiText,Guide_YFSH_24_2,景烛爷爷和严彦教官居然认识？,You two know each other?,Ông Cảnh Chúc và giáo quan Nghiêm Ngạn quen nhau sao?
lang_multi_text.db,MultiText,Guide_YFSH_24_20,哈哈，谬赞谬赞！,"Haha, I’m truly flattered.","Haha, quá khen quá khen!"
lang_multi_text.db,MultiText,Guide_YFSH_24_21,但声骸材料还是得靠正当途径获取。就算是景烛前辈的请求，我也没办法破这个例。,These should be enough for your needs. Take them.,"Nhưng nguyên liệu Thanh Hài vẫn phải lấy bằng con đường chính đáng. Dù là yêu cầu của tiền bối, tôi cũng không thể phá lệ."
lang_multi_text.db,MultiText,Guide_YFSH_24_23,嘿嘿，你小子果然一点都没变！,"Great, thanks.","Hehe, mi quả nhiên chẳng thay đổi gì cả!"
lang_multi_text.db,MultiText,Guide_YFSH_24_3,认识，而且认识很久了。,We do and for a long time.,"Quen, mà còn quen từ rất lâu rồi."
lang_multi_text.db,MultiText,Guide_YFSH_24_30,严彦教官，果然和传说中的一样严格啊。,Instructor Yhan doesn’t seem half as evil as the rumors make him out to be.,"Giáo quan Nghiêm Ngạn, quả nhiên nghiêm khắc đúng như lời đồn."
lang_multi_text.db,MultiText,Guide_YFSH_24_4,当年景烛还在夜归的时候，就是我尊敬的前辈。,"In the days of the Midnight Rangers, Mr. Jingzhu commanded my utmost respect.","Năm xưa khi Cảnh Chúc còn ở Dạ Quy, ông ấy là tiền bối mà tôi rất kính trọng."
lang_multi_text.db,MultiText,Guide_YFSH_24_5,许久未见，前辈你看起来还是精神抖擞啊……就是怎么腿脚看着没那么利索了？,It’s been a while since we last met. Mr. Jingzhu. You still look spirited... though your legs don’t seem as nimble?,"Lâu ngày không gặp, tiền bối trông vẫn khỏe mạnh lắm... Chỉ là sao chân cẳng có vẻ không còn nhanh nhẹn như trước?"
lang_multi_text.db,MultiText,Guide_YFSH_24_6,咳、咳，老头子我年纪大了，前阵子爬山不小心踩空而已嘛，小事，小事！,"Ahem, just a minor accident. You see, I’m getting on in years. A little slip while hiking. Nothing to worry about!","Khụ, khụ, lão già ta tuổi lớn rồi, hôm trước leo núi lỡ trượt chân thôi mà, chuyện nhỏ, chuyện nhỏ!"
lang_multi_text.db,MultiText,Guide_YFSH_24_7,已经修养了一阵子了，马上就能痊愈！,I’ve been resting and should recover soon.,"Nghỉ dưỡng một thời gian rồi, sắp khỏi hẳn rồi!"
lang_multi_text.db,MultiText,Guide_YFSH_24_8,唔……看起来确实没有伤到筋骨，但前辈你还是要注意休息才是。,"Your injuries seem to have healed well, but don’t underestimate the importance of rest.","Ừm... Trông có vẻ không bị thương đến xương cốt, nhưng tiền bối vẫn nên chú ý nghỉ ngơi."
lang_multi_text.db,MultiText,Guide_YFSH_24_9,你这小子，怎么和当年一样啰嗦？当年咱们受的伤比这重多了，不是一样打仗嘛？,"You’re as talkative as ever, boy. Back in the day, we endured far worse and still fought valiantly in battles. Remember?","Mi này, sao vẫn lắm lời như ngày xưa vậy? Hồi đó chúng ta bị thương nặng hơn thế này nhiều, chẳng phải vẫn đánh trận đó sao?"
lang_multi_text.db,MultiText,Guide_YFSH_25_10,我就等着对凌寒一鸣惊人呐！哦不对，应该是让凌寒一见倾心！,Make her fall in love with me with only one shot!,"Ta chờ ngày khiến Lăng Hàn phải kinh ngạc đây! À không đúng, phải là khiến Lăng Hàn say đắm mới phải!"
lang_multi_text.db,MultiText,Guide_YFSH_25_11,以我的风采，再配上这炉火纯青的声骸，想必这次一定能让凌寒接过我手中的夜息香！,"With my natural charm and these finely honed scythes, I’m confident this time I’ll win Linghan’s heart and let her accept my Noctemint!","Với phong thái của ta, thêm Thanh Hài đã luyện đến mức tinh thông, chắc chắn lần này sẽ khiến Lăng Hàn nhận bông Dạ Tức Hương từ tay ta!"
lang_multi_text.db,MultiText,Guide_YFSH_25_12,这次一定？,Are you sure?,Lần này chắc chắn chứ?
lang_multi_text.db,MultiText,Guide_YFSH_25_13,真的可以吗？,Really?,Thật sự được sao?
lang_multi_text.db,MultiText,Guide_YFSH_25_14,咳、咳，这次肯定！,"Ahem, absolutely!","Khụ, khụ, lần này chắc chắn!"
lang_multi_text.db,MultiText,Guide_YFSH_25_15,为啥景烛爷爷这么肯定，有个好声骸，就能让凌寒奶奶答应你呢……,What makes Grandpa Jingzhu so sure that having a powerful Echo will win Grandma Linghan’s heart?,Tại sao ông Cảnh Chúc lại chắc chắn là có Thanh Hài tốt thì bà Lăng Hàn sẽ đồng ý vậy...
lang_multi_text.db,MultiText,Guide_YFSH_25_16,对啊，为啥景烛爷爷这么肯定，有个好声骸，就能让凌寒奶奶答应你呢……,I’m with you on this one. What makes Grandpa Jingzhu so sure that having a powerful Echo will win Grandma Linghan’s heart?,"Đúng vậy, tại sao ông Cảnh Chúc lại chắc chắn là có Thanh Hài tốt thì bà Lăng Hàn sẽ đồng ý vậy..."
lang_multi_text.db,MultiText,Guide_YFSH_25_17,当然不是只靠声骸啦！凌寒曾经说过她心上人的标准——,"Of course, it’s not just the Echo I’ve prepared! Linghan once shared her criteria for an ideal partner.",Tất nhiên không chỉ dựa vào Thanh Hài! Lăng Hàn từng nói tiêu chuẩn người trong mộng của bà ấy -
lang_multi_text.db,MultiText,Guide_YFSH_25_18,她说她的心上人是一个英明神武的战士，他会扛着帅气的大刀，带着威风的声骸，面不改色直面千军万马。,"She said her ideal partner is a wise and valiant soldier wielding a handsome greatsword, accompanied by a majestic Echo, facing countless foes with unrivaled poise.","Bà ấy nói người trong mộng phải là một chiến sĩ anh minh thần võ, vác thanh đại đao oai phong, dẫn theo Thanh Hài uy nghiêm, mặt không đổi sắc đối diện nghìn quân vạn mã."
lang_multi_text.db,MultiText,Guide_YFSH_25_19,你们看看这条件，我除了缺个威风的声骸，其他不都完美符合嘛！,"You see? Apart from the majestic Echo, everything else fits me to a tee!","Các ngươi xem, điều kiện đó, ta ngoài việc thiếu Thanh Hài oai phong ra, còn lại chẳng phải hoàn toàn phù hợp sao!"
lang_multi_text.db,MultiText,Guide_YFSH_25_20,……,...,...
lang_multi_text.db,MultiText,Guide_YFSH_25_21,……,...,...
lang_multi_text.db,MultiText,Guide_YFSH_25_22,看你们的表情，是对老头子我信心不足？也是，毕竟隔了几十岁，有点代沟是正常的。,"Why the look? Do you lack faith in me? It’s understandable, given the generation gap between us.","Nhìn vẻ mặt các ngươi, là không tin tưởng lão già này à? Cũng phải, cách nhau mấy chục tuổi, có chút khoảng cách thế hệ là bình thường."
lang_multi_text.db,MultiText,Guide_YFSH_25_23,但在感情问题，尤其是老年人的感情问题上，相信我这个过来人，准没错的！,"But when it comes to matters of love, especially for us seniors, trust me. I’ve got this!","Nhưng về chuyện tình cảm, nhất là tình cảm của người già, tin ta đi, không sai đâu!"
lang_multi_text.db,MultiText,Guide_YFSH_25_24,好啦，万事俱备，我们去找凌寒吧。,"Alright, all set and ready. Let’s pay a visit to Linghan.","Được rồi, mọi thứ đã sẵn sàng, chúng ta đi tìm Lăng Hàn thôi."
lang_multi_text.db,MultiText,Guide_YFSH_25_8,真没想到，没想到景烛爷爷居然是夜归的战士……,I’m still surprised at the revelation that Grandpa Jingzhu was once a Midnight Ranger.,"Thật không ngờ, không ngờ ông Cảnh Chúc lại từng là chiến sĩ Dạ Quy..."
lang_multi_text.db,MultiText,Guide_YFSH_25_9,哼，老头子我平时低调惯了，这叫韬光养晦！,"Hmph, I’m used to keeping a low profile. Bide my time to impress Linghan.","Hừ, lão già ta bình thường quen giữ kín rồi, gọi là giấu mình chờ thời!"
lang_multi_text.db,MultiText,Guide_YFSH_26_1,又回来啦，这个熟悉的地方。,"Back here again, in this familiar spot.","Lại quay về rồi, nơi quen thuộc này."
lang_multi_text.db,MultiText,Guide_YFSH_26_2,爷爷，你又来找奶奶啦！,"Grandpa Jingzhu, you’re here to see Grandma, right?","Ông ơi, ông lại đến tìm bà rồi!"
