db_file,table_name,id,zh,en,vi
lang_multi_text.db,MultiText,InfoDisplay_186700013_Text,"……公共声骸的能量来自岁主的馈赠以及那比海底更深的未知领域中蕴藏的纯净能量，经过岁主指引，隐海修会很快拥有了掌控公共声骸的能力，并以此帮助祂引导人民……

……出现了第一次公共声骸需求告急的情况，私运、私购声骸事件已在城内贵族中出现，急需更新频率剪切技术，降低剪切桥接不同残象频率过程所消耗的时间，最终完成批量创造形态、能力各异的声骸流水生产线……

……隐海修会已获得对超距聚合技术的直接控制权，自此之后，隐海修会创造的公共声骸将在黎那汐塔境内永续维持频率聚合状态，除非出现特殊状况，隐海修会才会将声骸回收销毁，公共声骸在突破时空限制上更进一步，稳定性也大幅提升……

……反对意见增加趋势明显，隐海修会针对这一现状制造出了新型声骸：卫冕节使。作为修会无处不在的眼睛和令人无法反抗的双手，这些新型声骸的出现，提升了人们对普通公共声骸的信任……

……对试验场中生产的声骸进行意识植入与塑造试验初见成效，但初始样本的试验数据还不能复用于任何种类的公共声骸，意识稳定性仍待提升……","Ragunna Echoes Archive

...The energy of the Common Echoes comes from the Sentinel and unknown realms deeper than the ocean. With the Sentinel's guidance, the Order of the Deep swiftly gained control of the Common Echoes and used them to guide Their people...

...The first serious shortage of Common Echoes emerged, accompanied by a rise in smuggling and private purchases of Echoes among the city's nobility. There is an immediate need to upgrade the frequency-cutting technology to reduce the time needed to cut and merge different TD frequencies, ultimately establishing a mass-production line for creating Echoes of diverse forms and abilities...

...The Order of the Deep has obtained direct control of long-range aggregation technology. The Common Echoes they created would remain in a perpetual frequency-aggregate state within the boundaries of Rinascita, only to be disassembled under rare circumstances. This marks a breakthrough in the spatial and temporal limitations of Common Echoes, as well as a significant improvement in their stability...

...As opposition grew, the Order developed a new kind of Echo: La Guardia. They served as the watchful eyes and forceful hands of the Order, and their creation helped restore public trust in the ordinary Common Echoes...

...The experiments on implanting and shaping the consciousness of the Echoes in the Fabricatorium have shown progress. However, the data from the first samples couldn't be applied to any Common Echo, and the stability of their consciousness requires further refinement...","...Năng lượng của Thanh Hài Công Cộng đến từ sự ban tặng của Tuế Chủ cũng như năng lượng tinh khiết ẩn chứa trong vùng chưa biết sâu hơn cả đáy biển, được Tuế Chủ chỉ dẫn, Hội Ẩn Hải đã rất nhanh chóng nắm giữ khả năng kiểm soát Thanh Hài Công Cộng, và dùng nó giúp Ngài dẫn dắt nhân dân...

...Xuất hiện tình huống khan hiếm Thanh Hài Công Cộng lần đầu tiên, sự việc buôn lậu, mua bán tư nhân Thanh Hài đã xuất hiện trong giới quý tộc trong thành, cấp thiết cần cập nhật kỹ thuật cắt tần số, giảm thiểu thời gian tiêu hao trong quá trình cắt và nối tần số Tàn Tượng khác nhau, cuối cùng hoàn thành dây chuyền sản xuất hàng loạt Thanh Hài với hình thái, năng lực khác nhau...

...Hội Ẩn Hải đã giành được quyền kiểm soát trực tiếp đối với kỹ thuật tụ hợp siêu xa, từ đó về sau, Thanh Hài Công Cộng do Hội Ẩn Hải tạo ra sẽ duy trì trạng thái tụ hợp tần số vĩnh viễn trong lãnh thổ Rinascita, trừ khi xuất hiện tình huống đặc biệt, Hội Ẩn Hải mới thu hồi và tiêu hủy Thanh Hài, Thanh Hài Công Cộng tiến thêm một bước trong việc đột phá giới hạn thời không, độ ổn định cũng được nâng cao đáng kể...

...Xu hướng ý kiến phản đối gia tăng rõ rệt, Hội Ẩn Hải nhằm vào hiện trạng này đã chế tạo ra loại Thanh Hài kiểu mới: Sứ Giả Tụng Chiếu. Là con mắt có mặt khắp nơi và đôi tay không thể phản kháng của Hội, sự xuất hiện của những Thanh Hài kiểu mới này, đã nâng cao lòng tin của mọi người đối với Thanh Hài Công Cộng bình thường...

...Thử nghiệm cấy ghép ý thức và tạo hình đối với Thanh Hài được sản xuất trong trường thử nghiệm đã có hiệu quả bước đầu, nhưng dữ liệu thử nghiệm của mẫu ban đầu vẫn chưa thể tái sử dụng cho bất kỳ loại Thanh Hài Công Cộng nào, độ ổn định ý thức vẫn cần được nâng cao..."
lang_multi_text.db,MultiText,InfoDisplay_186700013_Title,拉古那声骸旧记,Ragunna Echoes Archive,Ký Sự Cũ Về Thanh Hài Ragunna
lang_multi_text.db,MultiText,InfoDisplay_186700014_Text,"-大量残象天然拥有意识，即使剪切桥接后，混乱的意识依然残存，即使改造为稳定的声骸后，它们仍有极大概率会出现吸收残响后自行进化的情况。虽然现在可以锁住频率剪切后声骸的吸收本能，阻止它们意识进化后再次变得混乱不可控，但彻底摘除意识……
-不如调整方向，直接建立新的意识模块，只放入我们需要声骸拥有的意识，在声骸原有意识上强制覆盖。祂赐予我们的力量是可以做到的，我试过了。
-强行意识对冲会让公共声骸的稳定性进一步下降，还会影响已确定的声骸制造方式。
-我觉得有个办法或许可行。新的意识模块直接隐藏嫁接到声骸原有意识的深处，只会在我们需要它出现时出现，而在它隐藏的这段时间中，我们仍然可以继续研究如何提升声骸意识转化后的稳定性。但有一点，如果深处的意识被激活，不可逆转。
-在无法确保意识改变后声骸会安然无恙之前，无限延迟激活……","""Project Echo Reborn"" Meeting Record

- Many TDs inherently possess consciousness. Even after being cut and bridged, their chaotic consciousness persists. That means they still tend to evolve by absorbing Reverberations after being stabilized into Common Echoes. While we've managed to suppress their absorption instinct post-frequency cutting, preventing their chaotic evolution, but to fully eliminate their consciousness...

- Perhaps we should change course and create entirely new consciousness modules. We can implant only the consciousness we need into the Echoes, forcibly overriding their original consciousness. The power They granted to us allows this. I've tested it.

- Overwriting their consciousness will only further destabilize the Common Echoes and disrupt the established methods of their creation.

- I think there might be a solution. The new consciousness module could be planted deep within the Echoes' original consciousness, functioning only when needed. In the meantime, we can continue researching how to improve the stability of consciousness transformation. But there's one thing, if the deeper consciousness is activated, it would be irreversible.

-We must delay activation indefinitely until we can ensure the Echoes' stability after alteration.","- Lượng lớn Tàn Tượng bẩm sinh đã có ý thức, cho dù sau khi cắt và nối, ý thức hỗn loạn vẫn còn sót lại, ngay cả khi cải tạo thành Thanh Hài ổn định, chúng vẫn có xác suất cực lớn xuất hiện tình trạng tự tiến hóa sau khi hấp thụ Tàn Hưởng. Mặc dù hiện tại có thể khóa bản năng hấp thụ của Thanh Hài sau khi cắt tần số, ngăn cản chúng trở nên hỗn loạn mất kiểm soát lần nữa sau khi ý thức tiến hóa, nhưng loại bỏ triệt để ý thức...
- Chi bằng điều chỉnh phương hướng, trực tiếp thiết lập mô-đun ý thức mới, chỉ đưa vào ý thức mà chúng ta cần Thanh Hài có, cưỡng chế ghi đè lên ý thức vốn có của Thanh Hài. Sức mạnh Ngài ban cho chúng ta có thể làm được, tôi đã thử rồi.
- Cưỡng chế xung đột ý thức sẽ khiến độ ổn định của Thanh Hài Công Cộng giảm thêm, còn ảnh hưởng đến phương thức chế tạo Thanh Hài đã xác định.
- Tôi cảm thấy có một cách có lẽ khả thi. Mô-đun ý thức mới trực tiếp ẩn giấu và ghép vào sâu trong ý thức vốn có của Thanh Hài, chỉ xuất hiện khi chúng ta cần nó xuất hiện, và trong khoảng thời gian nó ẩn giấu, chúng ta vẫn có thể tiếp tục nghiên cứu làm thế nào để nâng cao độ ổn định sau khi chuyển hóa ý thức Thanh Hài. Nhưng có một điểm, nếu ý thức sâu bên trong bị kích hoạt, sẽ không thể đảo ngược.
- Trước khi không thể đảm bảo Thanh Hài sẽ bình an vô sự sau khi thay đổi ý thức, thì trì hoãn kích hoạt vô thời hạn..."
lang_multi_text.db,MultiText,InfoDisplay_186700014_Title,「声骸改进计划」密会记录,"""Project Echo Reborn"" Meeting Record","Ghi Chép Cuộc Họp Mật ""Kế Hoạch Cải Tiến Thanh Hài"""
lang_multi_text.db,MultiText,InfoDisplay_186700016_Text,"神需完整。
无论神力往哪里去，我必领其回归。
我将为其追赶仇敌，直至残存在外的神力尽数回归「天国」，将人们的意识继续保存在那片安宁地。
神重新归来之时，便是我们再次走向团结光明之日。","The Divinity must be whole.
No matter where the divine power scatters, I shall lead it back.
I will pursue Their enemies until every last fragment of the divine power is reclaimed to the Paradise, where the consciousnesses of people shall dwell securely.
When the Divinity returns, it shall be the day we walk toward unity and light once more.","Thần cần trọn vẹn.
Bất kể thần lực đi về đâu, ta nhất định sẽ dẫn nó quay về.
Ta sẽ vì Ngài truy đuổi kẻ thù, cho đến khi thần lực tàn dư bên ngoài quay về hết ""Thiên Quốc"", tiếp tục bảo tồn ý thức của mọi người ở vùng đất an ninh đó.
Khi Thần quay trở lại lần nữa, chính là ngày chúng ta lại bước về phía đoàn kết và ánh sáng."
lang_multi_text.db,MultiText,InfoDisplay_186700017_Text,"为什么总会遗忘？是因为岁月的流逝还是其他什么……我必须将一切秘密记录下来。记住：

从天而降的黑潮即是「天难」，它自我们心中而生，不断扭曲着信仰以此壮大不义的摧毁力量。
深不见底的黑暗长久禁锢着拉古那人的深层意识，让人们缺失着相信偏离的天道。
在这条求生之路上，殉道者的牺牲已无比沉重。
人们无法意识到不存在于自己意识中的存在，窥探到真相的我需要用外力让拉古那人成为完整的、真正的自己。
强大的代行者将在拥趸之间，将黑潮中的生命与毁灭带来这个世界。
唯有打败代行者，步入黑暗深处，用祂的力量将所有被困的意识融合到我的躯体中，才能将所有人的意识带离。
安全、平稳的失亡彼岸将是这些意识新的归宿。
当万千完整的心灵联结成一体，筑起壁垒，共同相信它不会到来，那么它就将不复存在。
「联结」是度过「天难」的唯一道路，如遇意外，记住，「提灯」永远都在这里，它一定会指引你，走向真正的光明。","Why do I forget? Is it the erosion of time, or some deeper failing? I must inscribe these secrets. I must remember:

The Dark Tide descending from the sky is the Divine Ordeal. It is born from the shadows of our hearts, twisting faith to fuel its unjust force of destruction.
This unfathomable darkness has long shackled the Ragunnesi's subconscious mind, blinding them to the true righteous path.
On this journey of survival, the weight of the martyrs' sacrifices has become unbearable.
People cannot perceive what lies beyond their own consciousness. Yet I, who have glimpsed the truth, must use external force to restore the Ragunnesi to their true and complete selves.
From among the faithful, a powerful Harbinger shall arise, bringing both life and annihilation from the Dark Tide into this world. 
Only by striking down this Harbinger, by descending into the depths of the darkness and using Their power to merge all the trapped souls into my own body, can I lead them all away from the Dark Tide.
The safe, undisturbed Lost Beyond shall be our new sanctuary. There, these souls shall find rest.
When tens of thousands of restored spirits unite as one to form a fortress of unshaken faith, believing together that it shall not come, then it will cease to exist.
Unity is our sole deliverance from the Divine Ordeal. Should the path falter, remember, ""The Lantern"" endures. It will guide you to the true light.","Tại sao luôn quên lãng? Là vì năm tháng trôi qua hay là gì khác... Tôi bắt buộc phải ghi lại tất cả bí mật. Hãy nhớ:

Hắc Triều từ trên trời giáng xuống chính là ""Thiên Nạn"", nó sinh ra từ trong lòng chúng ta, không ngừng bóp méo đức tin để từ đó lớn mạnh sức mạnh hủy diệt bất nghĩa.
Bóng tối sâu không thấy đáy giam cầm tầng ý thức sâu của người Ragunna từ lâu, khiến mọi người thiếu đi thiên đạo lệch lạc mà họ tin tưởng.
Trên con đường cầu sinh này, sự hy sinh của người tuẫn đạo đã vô cùng nặng nề.
Con người không thể nhận thức được sự tồn tại không có trong ý thức của mình, tôi người đã nhìn trộm được chân tướng cần dùng ngoại lực để khiến người Ragunna trở thành bản thân trọn vẹn, chân chính.
Người Đại Diện hùng mạnh sẽ ở giữa những kẻ ủng hộ, mang sự sống và hủy diệt trong Hắc Triều đến thế giới này.
Chỉ có đánh bại Người Đại Diện, bước vào nơi sâu thẳm của bóng tối, dùng sức mạnh của Ngài dung hợp tất cả ý thức bị giam cầm vào cơ thể tôi, mới có thể đưa ý thức của tất cả mọi người rời đi.
Bờ bên kia của sự mất mát an toàn, bình ổn sẽ là nơi trở về mới của những ý thức này.
Khi hàng vạn tâm hồn trọn vẹn liên kết thành một thể, dựng lên thành lũy, cùng tin rằng nó sẽ không đến, thì nó sẽ không còn tồn tại nữa.
""Liên kết"" là con đường duy nhất vượt qua ""Thiên Nạn"", nếu gặp chuyện ngoài ý muốn, hãy nhớ, ""Đèn Lồng"" vĩnh viễn đều ở đây, nó nhất định sẽ chỉ dẫn bạn, đi về phía ánh sáng chân chính."
lang_multi_text.db,MultiText,InfoDisplay_186700018_Text,"你们会愿意让我将这首乐曲用在这里吗？
它会变得潮湿、深沉，布满扭曲的愿望。
陪我一起面对变化吧，也在未来一起见证。","Would you be willing to let me use this song here?
It will become damp, heavy, filled with twisted desires.
Let's face the changes and witness them together in the future.","Các người sẽ sẵn lòng để tôi dùng bản nhạc này ở đây không?
Nó sẽ trở nên ẩm ướt, thâm trầm, phủ đầy những nguyện vọng méo mó.
Hãy cùng tôi đối mặt với sự thay đổi, cũng cùng nhau chứng kiến trong tương lai."
lang_multi_text.db,MultiText,InfoDisplay_186700018_Title,旋律中残存的信息,Words Between Melodies,Thông Tin Còn Sót Lại Trong Giai Điệu
lang_multi_text.db,MultiText,InfoDisplay_186700019_Text,"那时的情感和这里人们此时的愿景如出一辙。
人们想要得到的东西各不相同，却会因为期盼，出现相似的情感呢。
那这样的旋律应该会引发强烈的共鸣吧。","The emotions of that moment are strikingly similar to the visions of the people who are present.
People's desires differ, yet through anticipation, they may produce similar emotions.
Such a melody should evoke a powerful resonance.","Tình cảm lúc đó và nguyện cảnh của mọi người ở đây lúc này giống hệt nhau.
Thứ mọi người muốn có thì khác nhau, nhưng lại vì mong đợi, mà xuất hiện tình cảm tương tự nhỉ.
Vậy giai điệu như thế này chắc hẳn sẽ gây ra sự cộng hưởng mãnh liệt."
lang_multi_text.db,MultiText,InfoDisplay_186700019_Title,旋律中残存的信息,Words Between Melodies,Thông Tin Còn Sót Lại Trong Giai Điệu
lang_multi_text.db,MultiText,InfoDisplay_186700020_Text,"强烈的情绪与节奏影响着深海与彼岸，让一切生命陷入不可控的躁动。
好吧，好吧……
冷静下来，再认真想想，什么样的乐曲拥有指引一切、抚平一切的力量。","Intense emotions and rhythms affect the deep sea and the Beyond, plunging all life into an uncontrollable turbulence.
All right, all right...
Calm down, and think carefully: Which kind of music possesses the power to guide and soothe everything?","Cảm xúc mãnh liệt và nhịp điệu ảnh hưởng đến biển sâu và bờ bên kia, khiến mọi sinh mệnh rơi vào sự xao động mất kiểm soát.
Được rồi, được rồi...
Bình tĩnh lại, suy nghĩ kỹ thêm chút nữa, loại nhạc khúc nào sở hữu sức mạnh chỉ dẫn tất cả, xoa dịu tất cả."
lang_multi_text.db,MultiText,InfoDisplay_186700020_Title,旋律中残存的信息,Words Between Melodies,Thông Tin Còn Sót Lại Trong Giai Điệu
lang_multi_text.db,MultiText,InfoDisplay_186700021_Text,"他们总是窥视着我调整旋律，似乎想明白其中的奥秘。
他们想夺取这份权力，却不知近在耳畔的，是他们避之不及的死亡之音。
如果他们来询问、索要，我会给予吗？他们会接受吗？","They always watch me Orchestrate the melodies, seemingly trying to understand their mysteries.
They wish to seize this power, unaware that the songs in their ears are the whispers of death they so desperately try to avoid.
If they were to ask, to demand, would I give them what they want? Would they accept?","Họ luôn nhìn trộm tôi điều chỉnh giai điệu, dường như muốn hiểu rõ bí mật trong đó.
Họ muốn đoạt lấy quyền lực này, nhưng lại không biết ngay bên tai, là âm thanh tử vong mà họ tránh còn không kịp.
Nếu họ đến hỏi, đòi hỏi, tôi sẽ cho không? Họ sẽ chấp nhận không?"
lang_multi_text.db,MultiText,InfoDisplay_186700021_Title,旋律中残存的信息,Words Between Melodies,Thông Tin Còn Sót Lại Trong Giai Điệu
lang_multi_text.db,MultiText,InfoDisplay_186700022_Text,"虚幻的美好掩盖着脆弱的现实。
这首完美契合的乐曲为这里奠定了基调，是否也预兆着这里的未来？
最近时常这样悲观想着。","An illusory beauty conceals the fragile reality.
Does this perfectly matched song, which establishes its tone here, also foretell a future?
A question I've been pondering so pessimistically as of late.","Vẻ đẹp hư ảo che đậy hiện thực mong manh.
Bản nhạc khớp hoàn hảo này đã đặt nền móng cho nơi đây, liệu cũng báo trước tương lai của nơi này?
Gần đây thường hay suy nghĩ bi quan như vậy."
lang_multi_text.db,MultiText,InfoDisplay_186700022_Title,旋律中残存的信息,Words Between Melodies,Thông Tin Còn Sót Lại Trong Giai Điệu
lang_multi_text.db,MultiText,InfoDisplay_186700023_Text,"完成最全面、最虔诚的朝拜需要几步？

1.跪下。
2.朝拜。
3.站起。","How many steps does it take to offer one's most extensive and reverent prayers?

1. Kneel.
2. Pray.
3. Stand.","Hoàn thành buổi triều bái toàn diện nhất, thành kính nhất cần mấy bước?

1. Quỳ xuống.
2. Triều bái.
3. Đứng dậy."
lang_multi_text.db,MultiText,InfoDisplay_186700023_Title,朝拜之书,Pilgrim's Scriptures,Sách Triều Bái
lang_multi_text.db,MultiText,InfoDisplay_186700024_Text,"「生灵显地」区域声骸产量已成功实现翻倍，残次品占比低至1.5％。
已优化「千殁沉岛」销毁区域输送管道，使其更有利于将可回收频率运至能源储存区域「蓄能中枢」。
「涌明高塔」控制中心日常检修已完成，并无异常。","The production of Echoes in Anima Cradle has doubled, with defective outputs reduced to 1.5%.
The transport pipelines in the Fallen Grave's disposal zone have been optimized to ensure a more efficient transfer of recycled frequencies to the Energy Hub for storage.
Routine inspections of Lumen Tower's control center have been completed, and no irregularities have been detected.","Sản lượng Thanh Hài ở khu vực ""Vùng Đất Sinh Linh"" đã thành công tăng gấp đôi, tỷ lệ phế phẩm thấp xuống còn 1.5%.
Đã tối ưu hóa đường ống vận chuyển khu vực tiêu hủy ""Đảo Trầm Ngàn Xác"", khiến nó thuận lợi hơn cho việc vận chuyển tần số có thể tái chế đến khu vực lưu trữ năng lượng ""Trung Khu Tích Năng"".
Việc bảo trì định kỳ trung tâm điều khiển ""Tháp Cao Vĩnh Minh"" đã hoàn thành, không có bất thường."
lang_multi_text.db,MultiText,InfoDisplay_186700024_Title,隐海试验场汇报总结片段,Fabricatorium of the Deep Summary Report (Extract),Đoạn Tổng Kết Báo Cáo Trường Thử Nghiệm Ẩn Hải
lang_multi_text.db,MultiText,InfoDisplay_201001001_Text,"第15天。 

有人开始质疑这次远行的意义，想给翡萨烈的荣耀蒙上阴翳。这样的声音不该存在。

自狄萨莱海脊长途跋涉，穿越风暴和湍流，我们付出了一艘船的代价才抵达这里。现在正是勇敢探索的时候。这些年修会刻意向家族隐瞒的“圣物“，就隐藏在这些让人生厌的废墟里。那些只会在梦里出现的宝藏，从未像现在这样触手可及。

达利会留在相对安全的遗迹里，他的双腿被残象洞穿，已经不能再行走了。

我们留下了必要的饮水和食粮，余下骑士会向<color=Highlight>西南方向的遗迹</color>前行。

愿一切行于公义的道途。","Day 15.

Some have begun to question the worth of this endeavor, and the very honor we strive to uphold for Fisalia. Such whispers should have no place here.

We have crossed the ridges of Thessaleo Fells, weathered storms, and dared currents to reach this place, losing a ship on the way. Now, it's time to claim our rewards. The ""relic"" that has been kept from our family by the Order lies somewhere within these forsaken ruins, and treasures glimpsed only in dreams seem at last within our grasp.

Dario will stay behind. His legs were pierced by a TD and he can no longer walk. We've left him with enough provisions.

The rest of the knights will press on, toward the ruins in the <color=Highlight>southwest</color>.

May we walk ever upon the righteous path.","Ngày thứ 15.

Có người bắt đầu nghi ngờ ý nghĩa của chuyến đi xa này, muốn phủ bóng đen lên vinh quang của Fisalia. Những tiếng nói như vậy không nên tồn tại.

Từ Sống Núi Biển Thessaleo lặn lội đường xa, xuyên qua bão tố và dòng chảy xiết, chúng tôi phải trả giá bằng một con tàu mới đến được đây. Bây giờ chính là lúc dũng cảm khám phá. ""Thánh Vật"" mà Hội nhiều năm nay cố tình giấu giếm gia tộc, đang ẩn giấu trong những phế tích đáng ghét này. Những kho báu chỉ xuất hiện trong mơ, chưa bao giờ gần ngay trước mắt như bây giờ.

Dario sẽ ở lại trong di tích tương đối an toàn, hai chân của cậu ta bị Tàn Tượng đâm xuyên, đã không thể đi lại được nữa.

Chúng tôi để lại nước uống và lương thực cần thiết, những hiệp sĩ còn lại sẽ tiến về phía <color=Highlight>di tích hướng Tây Nam</color>.

Nguyện mọi sự đi trên con đường công nghĩa."
lang_multi_text.db,MultiText,InfoDisplay_201001001_Title,日志残页其一,Journal Page I,Trang Nhật Ký Tàn Khuyết 1
