db_file,table_name,id,zh,en,vi
lang_multi_text.db,MultiText,Chengxiaoshan_main_1_1_150_29,你大可将此举视为一种双重保险，毕竟将一把钥匙分置两地，有心之人就不能轻易如愿了。,"It's an extra safeguard. By splitting the key and its control panel, it'll be harder for malicious individuals to access them.","Cậu hoàn toàn có thể coi hành động này là một loại bảo hiểm kép, dù sao chia một chiếc chìa khóa ra hai nơi, kẻ có dã tâm sẽ không thể dễ dàng toại nguyện."
lang_multi_text.db,MultiText,Chengxiaoshan_main_1_1_150_3,（关于眠龙庭。）,(Ask about Mianloong Chamber.),(Về Miên Long Đình.)
lang_multi_text.db,MultiText,Chengxiaoshan_main_1_1_150_30,昔日岁主在残象潮中保下虹镇时，便已将乘霄山内时流缓慢的事实告知了虹镇人——,"Long ago, the Sentinel protected people of Hongzhen from Tacet Discords, and it also revealed a harsh truth—","Ngày xưa khi Tuế Chủ bảo vệ Hồng Trấn trong Triều Tàn Tượng, đã cho người Hồng Trấn biết sự thật về dòng thời gian trôi chậm trong Thừa Tiêu Sơn-"
lang_multi_text.db,MultiText,Chengxiaoshan_main_1_1_150_31,离开乘霄山需要增龄以承受时间代偿，而留在乘霄山，时间越久，就越无法离去。,"Leaving Mt. Firmament shortened one's lifespan exponentially. The longer someone has lived inside the Temporal Barrier, the less likely they can make it out alive.","Rời khỏi Thừa Tiêu Sơn cần phải tăng tuổi để chịu sự trả giá về thời gian, còn ở lại Thừa Tiêu Sơn, thời gian càng lâu, thì càng không thể rời đi."
lang_multi_text.db,MultiText,Chengxiaoshan_main_1_1_150_32,考虑到这其中的代价，一部分身强力壮的青年离开故土，前往远方，出乎意料地建立了如今繁华的今州。,"Later, a group of brave young people who could afford the aging left Mt. Firmament, and they eventually built Jinzhou city.","Cân nhắc đến cái giá phải trả trong đó, một bộ phận thanh niên trai tráng rời bỏ quê hương, đi đến phương xa, ngoài dự liệu đã xây dựng nên Kim Châu phồn hoa như ngày nay."
lang_multi_text.db,MultiText,Chengxiaoshan_main_1_1_150_33,而另一些人则选择留在虹镇，他们将提供庇护的岁主奉为神祇，立誓世代守护，并将山柱凿刻为岁主的形貌。,"Others stayed and worshiped the Sentinel as their god, vowing to protect it for generations and carving its likeness into the mountain.","Còn những người khác chọn ở lại Hồng Trấn, họ tôn thờ Tuế Chủ đã che chở mình như thần linh, thề đời đời kiếp kiếp bảo vệ, và tạc cột núi thành hình dáng của Tuế Chủ."
lang_multi_text.db,MultiText,Chengxiaoshan_main_1_1_150_35,静待各位佳音。我也有我该去完成的事。,"I pray for your safe return. Now, if you'll excuse me, I have other responsibilities to attend to.",Chờ tin tốt của các vị. Ta cũng có việc ta cần phải hoàn thành.
lang_multi_text.db,MultiText,Chengxiaoshan_main_1_1_150_4,（关于眠龙庭防护机关。）,(Ask about the Mianloong Chamber's defense.),(Về cơ quan phòng thủ Miên Long Đình.)
lang_multi_text.db,MultiText,Chengxiaoshan_main_1_1_150_5,（关于心核。）,(Ask about the Cipher Key.),(Về Tâm Hạch.)
lang_multi_text.db,MultiText,Chengxiaoshan_main_1_1_150_6,（关于寿命代偿。）,(Ask about the lifespan cost of leaving.),(Về sự trả giá tuổi thọ.)
lang_multi_text.db,MultiText,Chengxiaoshan_main_1_1_150_7,没什么要问的了。,I have nothing to ask.,Không còn gì để hỏi nữa.
lang_multi_text.db,MultiText,Chengxiaoshan_main_1_1_150_8,这次危机的确给虹镇造成了很大的冲击。,This crisis hit Hongzhen hard.,Cuộc khủng hoảng lần này thực sự đã gây ra cú sốc lớn cho Hồng Trấn.
lang_multi_text.db,MultiText,Chengxiaoshan_main_1_1_150_9,事发突然，许多人仍像往常那般劳作、休憩，毫无防备地被卷入失控的时流，甚至没有逃生的机会。,"People were going about their day as usual, but then chaos erupted without warning. They didn't even have the time to escape.","Sự việc xảy ra đột ngột, nhiều người vẫn đang làm việc, nghỉ ngơi như thường ngày, không hề phòng bị đã bị cuốn vào dòng thời gian mất kiểm soát, thậm chí không có cơ hội chạy thoát."
lang_multi_text.db,MultiText,Chengxiaoshan_main_1_1_156_1,回来了，你那头咋样？,How did it go for you?,"Về rồi à, bên cậu thế nào?"
lang_multi_text.db,MultiText,Chengxiaoshan_main_1_1_156_10,（询问福伯。）,(Ask about Uncle Fu.),(Hỏi thăm về bác Phúc.)
lang_multi_text.db,MultiText,Chengxiaoshan_main_1_1_156_11,呃……你不知道福伯？,Uh... Have you never heard about Uncle Fu?,Ơ... Cậu không biết bác Phúc sao?
lang_multi_text.db,MultiText,Chengxiaoshan_main_1_1_156_12,……{TA}是刚才辛夷大人说的那位从今州来的客人。,...{Male=He;Female=She} must be the esteemed guest from Jinzhou Lady Xinyi mentioned.,...{TA} là vị khách đến từ Kim Châu mà Tân Di đại nhân vừa nhắc đến.
lang_multi_text.db,MultiText,Chengxiaoshan_main_1_1_156_13,哦哦，难怪了。,"Ah, I see.","À à, thảo nào."
lang_multi_text.db,MultiText,Chengxiaoshan_main_1_1_156_14,福伯就是那边那个穿白衫的老伯，他是虹镇的老掌事，虽说退下来了，但在虹镇说话还是有份量的。,"That man in the white shirt is Uncle Fu, former leader of Hongzhen. Despite having stepped down from his position, he still commands respect from the townsfolk.","Bác Phúc là ông bác mặc áo trắng đằng kia, bác ấy là trưởng quản cũ của Hồng Trấn, tuy đã lui về rồi, nhưng tiếng nói ở Hồng Trấn vẫn rất có trọng lượng."
lang_multi_text.db,MultiText,Chengxiaoshan_main_1_1_156_15,而且啊，大家都说他其实已经有一百多岁了，是虹镇最年长的人。,"He's said to be over a hundred years old, making him the oldest person in town.","Hơn nữa, mọi người đều nói bác ấy thực ra đã hơn trăm tuổi rồi, là người cao tuổi nhất Hồng Trấn."
lang_multi_text.db,MultiText,Chengxiaoshan_main_1_1_156_16,唔……也难为福伯了……年纪这么大了，还要跟着我们遭这种罪……,"Sigh... It must be tough for him, enduring all this chaos at his age...","Hầy... cũng làm khó bác Phúc quá... lớn tuổi thế rồi, còn phải chịu khổ cùng chúng ta..."
lang_multi_text.db,MultiText,Chengxiaoshan_main_1_1_156_2,该安置的都安置了，剩下的……尽力了。,I saved as many people as possible and directed them to safety. But there were others... I did what I could.,"Những người cần sắp xếp đều đã sắp xếp rồi, số còn lại... đã cố hết sức."
lang_multi_text.db,MultiText,Chengxiaoshan_main_1_1_156_3,你也别太往心里去，至少咱们行动快，救下来的也不少。,"Don't beat yourself up, we acted quickly and saved a lot of lives.","Cậu cũng đừng để bụng quá, ít nhất chúng ta hành động nhanh, cứu được cũng không ít."
lang_multi_text.db,MultiText,Chengxiaoshan_main_1_1_156_4,唉，那是因为有辛夷大人在……,*sigh* It's all thanks to Lady Xinyi...,"Haizz, đó là nhờ có Tân Di đại nhân ở đây..."
lang_multi_text.db,MultiText,Chengxiaoshan_main_1_1_156_5,当时……我真是慌了神，心里没个主意，得亏辛夷大人在旁边指挥着，不然别说是救人了，我自己也得搭进去。,"I was so overwhelmed, my mind went blank. If she hadn't been there to give orders, I wouldn't have even made it out alive, let alone save anyone.","Lúc đó... tôi hoảng hốt thật sự, trong lòng không có chủ kiến gì, may mà có Tân Di đại nhân ở bên chỉ huy, nếu không đừng nói là cứu người, bản thân tôi cũng tiêu đời."
lang_multi_text.db,MultiText,Chengxiaoshan_main_1_1_156_6,你说这话，难得。,It's rare to hear that from you.,"Cậu nói câu này, hiếm thấy đấy."
lang_multi_text.db,MultiText,Chengxiaoshan_main_1_1_156_7,记得以前福伯要把掌事的位置给她的时候，你还嚷嚷过不同意呢。,I remember how much you opposed Uncle Fu's decision to let her take the reins back in the day.,"Nhớ hồi trước bác Phúc định nhường vị trí trưởng quản cho bà ấy, cậu còn la lối không đồng ý mà."
lang_multi_text.db,MultiText,Chengxiaoshan_main_1_1_156_8,……那会儿……觉得她是个外来的不懂虹镇的事……,...Well... I thought she knew nothing about our town as an outsider...,...Lúc đó... nghĩ bà ấy là người ngoài không hiểu chuyện của Hồng Trấn...
lang_multi_text.db,MultiText,Chengxiaoshan_main_1_1_156_9,再说我的想法也影响不了结果，她当时呼声最高，我也没啥说的。,"But it was too late, the decision had been made based on the support she received. In the end, I just accepted the inevitable.","Hơn nữa suy nghĩ của tôi cũng chẳng ảnh hưởng được kết quả, lúc đó tiếng tăm bà ấy cao nhất, tôi cũng chẳng nói được gì."
lang_multi_text.db,MultiText,Chengxiaoshan_main_1_1_157_1,令尹……那孩子我看着像……,Have you seen the Magistrate of Jinzhou... She looks familiar...,Lệnh Doãn... đứa trẻ đó tôi trông giống như...
lang_multi_text.db,MultiText,Chengxiaoshan_main_1_1_157_2,是不是当年岁主带回来那个……,She looks like the baby our Sentinel brought back all those years ago...,Có phải là đứa bé năm xưa Tuế Chủ mang về không...
lang_multi_text.db,MultiText,Chengxiaoshan_main_1_1_157_3,……瞧上去都十六、七了，岁数对不上。,...She appears to be 16 or 17 years old though. It doesn't make sense...,"...Trông cũng mười sáu, mười bảy rồi, tuổi tác không khớp."
lang_multi_text.db,MultiText,Chengxiaoshan_main_1_1_157_4,乘霄山和外面不一样，外头过了多少年，算不清的。,"Time works differently here in Mt. Firmament, remember? Good luck figuring out the math.","Thừa Tiêu Sơn và bên ngoài không giống nhau, bên ngoài trôi qua bao nhiêu năm, tính không rõ đâu."
lang_multi_text.db,MultiText,Chengxiaoshan_main_1_1_158_1,试过了，都不行。,Nothing I've tried so far is working.,"Thử rồi, đều không được."
lang_multi_text.db,MultiText,Chengxiaoshan_main_1_1_158_2,中枢被破坏了……,The Nexus is completely out of commission...,Trung tâm bị phá hủy rồi...
lang_multi_text.db,MultiText,Chengxiaoshan_main_1_1_158_3,但暂时不清楚是乱流还是残星会造成的。,Can't tell if it's the Temporal Disruption or the Fractsidus' doing.,Nhưng tạm thời không rõ là do dòng chảy rối loạn hay Hội Tàn Tinh gây ra.
lang_multi_text.db,MultiText,Chengxiaoshan_main_1_1_158_4,所以用终端信号找失踪者的法子行不通？,So we can't use our Terminals to locate those missing people?,Vậy nên cách dùng tín hiệu thiết bị tìm người mất tích không khả thi sao?
lang_multi_text.db,MultiText,Chengxiaoshan_main_1_1_158_5,嗯……,"Nah, we can't...",Ừm...
lang_multi_text.db,MultiText,Chengxiaoshan_main_1_1_159_1,咳咳……,Cough cough...,Khụ khụ...
lang_multi_text.db,MultiText,Chengxiaoshan_main_1_1_15_1,{PlayerName}，是您？,"Greetings, {PlayerName}.","{PlayerName}, là ngài sao?"
lang_multi_text.db,MultiText,Chengxiaoshan_main_1_1_15_10,与此同时，令尹也失去了对岁主的感应。,It was around the same time that Madam Magistrate lost track of Sentinel Jué.,"Cùng lúc đó, Lệnh Doãn cũng mất đi cảm ứng với Tuế Chủ."
lang_multi_text.db,MultiText,Chengxiaoshan_main_1_1_15_11,若当真有此变故，或是这一消息被有心人加以利用，于今州而言......皆是不亚于鸣式来犯的灭顶之灾。,"If our Sentinel is truly in danger… Or if someone with malicious intent obtains this information, the potential consequences could be as catastrophic as the previous Threnodian invasion.","Nếu thực sự có biến cố này, hoặc tin tức này bị kẻ có dã tâm lợi dụng, thì đối với Kim Châu mà nói... đều là tai họa ngập đầu không kém gì Minh Thức xâm phạm."
lang_multi_text.db,MultiText,Chengxiaoshan_main_1_1_15_12,为能尽快确认岁主的安危，前段时间，令尹已动身赶往祂最近一次的现身地——乘霄山，追查其动向。,"In order to investigate the Sentinel's whereabouts, Madam Magistrate has left for Mt. Firmament, its last recorded location.","Để có thể sớm xác nhận sự an nguy của Tuế Chủ, thời gian trước, Lệnh Doãn đã lên đường đến nơi Ngài xuất hiện lần cuối cùng - Thừa Tiêu Sơn, để truy tìm tung tích."
lang_multi_text.db,MultiText,Chengxiaoshan_main_1_1_15_13,有人与今汐同行吗？联系看看。,Did Jinhsi bring anyone with her? Bodyguards? Can you get in touch with them?,Có ai đi cùng Jinhsi không? Liên lạc thử xem.
lang_multi_text.db,MultiText,Chengxiaoshan_main_1_1_15_14,令尹并无指派陪同。,Madam Magistrate traveled to Mt. Firmament alone.,Lệnh Doãn không chỉ định người đi cùng.
lang_multi_text.db,MultiText,Chengxiaoshan_main_1_1_15_15,一因当时鸣式复苏在即，令尹不欲抽调人手，分散兵力。二是事关岁主，并非单凭武力可解。,"The looming threat of the Threnodian discouraged any additional divertion of human resources. Furthermore, when it comes to the Sentinel, force is not a viable solution.","Một là vì lúc đó Minh Thức sắp thức tỉnh, Lệnh Doãn không muốn điều động nhân lực, phân tán binh lực. Hai là việc liên quan đến Tuế Chủ, không phải chỉ dựa vào vũ lực là có thể giải quyết."
lang_multi_text.db,MultiText,Chengxiaoshan_main_1_1_15_16,我想去乘霄山见岁主。,I need to go to Mt. Firmament to meet with the Sentinel.,Tôi muốn đến Thừa Tiêu Sơn gặp Tuế Chủ.
lang_multi_text.db,MultiText,Chengxiaoshan_main_1_1_15_17,今汐可能遇上了麻烦，我想帮忙。,"Jinhsi might be in trouble, and I want to help.","Jinhsi có thể đã gặp rắc rối, tôi muốn giúp đỡ."
lang_multi_text.db,MultiText,Chengxiaoshan_main_1_1_15_18,您是令尹所信所托之人，我无权阻拦。,Madam Magistrate trusts you. It is beyond my authorization to meddle in your decisions.,"Ngài là người được Lệnh Doãn tin tưởng ủy thác, tôi không có quyền ngăn cản."
lang_multi_text.db,MultiText,Chengxiaoshan_main_1_1_15_19,不过去乘霄山的路暗藏玄机，需得“引路人”相伴方能到达，具体情状，我也不甚了解。,"However, the landscape around Mt. Firmament is complex. One must be accompanied by a special ""Wayfinder"" to navigate safely. That's all I know.","Tuy nhiên, đường đến Thừa Tiêu Sơn ẩn chứa nhiều huyền cơ, cần phải có ""Người Dẫn Đường"" đi cùng mới có thể đến được, tình hình cụ thể tôi cũng không hiểu rõ lắm."
lang_multi_text.db,MultiText,Chengxiaoshan_main_1_1_15_2,您来边庭，所为何事？,What can I help you with today?,Ngài đến Biên Đình có việc gì không?
lang_multi_text.db,MultiText,Chengxiaoshan_main_1_1_15_20,在哪里能找到“引路人”？,"Where can I find this Wayfinder, then?","Có thể tìm thấy ""Người Dẫn Đường"" ở đâu?"
lang_multi_text.db,MultiText,Chengxiaoshan_main_1_1_15_21,眼下……她大概在怨鸟泽附近的渡口，稍后我会传讯于她。,"Currently, she's likely at the ferry terminal in Whining Aix's Mire. I'll reach out to her.","Hiện tại... cô ấy chắc đang ở bến đò gần Đầm Oán Điểu, lát nữa tôi sẽ truyền tin cho cô ấy."
lang_multi_text.db,MultiText,Chengxiaoshan_main_1_1_15_22,您可以先到渡口与她相见，以她的身份，应当比我更了解乘霄山的现状。,"To learn more about Mt. Firmament, you can meet her at the ferry. I lack the same level of understanding of the situation there as she does.","Ngài có thể đến bến đò gặp cô ấy trước, với thân phận của cô ấy, chắc hẳn sẽ hiểu rõ hiện trạng của Thừa Tiêu Sơn hơn tôi."
lang_multi_text.db,MultiText,Chengxiaoshan_main_1_1_15_23,好的。,All right.,Được thôi.
lang_multi_text.db,MultiText,Chengxiaoshan_main_1_1_15_24,我相信令尹的决策。在她离开的这段时日，我会尽心看顾好边庭的事务。,I trust Madam Magistrate's decisions. I will do my utmost to handle the public matters on her behalf while she is away.,"Tôi tin vào quyết sách của Lệnh Doãn. Trong khoảng thời gian người rời đi, tôi sẽ tận tâm trông coi công việc của Biên Đình."
lang_multi_text.db,MultiText,Chengxiaoshan_main_1_1_15_25,……只不过，我心中放不下忧虑。,I just... This worry about her safety won't leave me.,"...Chỉ là, trong lòng tôi không bỏ được nỗi lo âu."
lang_multi_text.db,MultiText,Chengxiaoshan_main_1_1_15_26,在令尹传回的最后一则通讯中，我注意到令尹比平日看上去虚弱，且她似乎在极力掩饰这点，强打精神。,"In her last video message, I could tell she seemed weaker than usual, despite her efforts to maintain composure.","Trong thông tin liên lạc cuối cùng mà Lệnh Doãn gửi về, tôi nhận thấy Lệnh Doãn trông yếu hơn ngày thường, hơn nữa người dường như đang cố sức che giấu điều đó, gượng gạo tỏ ra tỉnh táo."
lang_multi_text.db,MultiText,Chengxiaoshan_main_1_1_15_27,令尹现在的处境，恐怕不太乐观……,Madam Magistrate's situation might not be optimistic...,"Tình cảnh hiện tại của Lệnh Doãn, e rằng không mấy khả quan..."
lang_multi_text.db,MultiText,Chengxiaoshan_main_1_1_15_28,{PlayerName}，您也是。乘霄山一行还需多加保重。,"{PlayerName}, Mt. Firmament is a dangerous place. Please take care.","{PlayerName}, ngài cũng vậy. Chuyến đi Thừa Tiêu Sơn hãy bảo trọng."
lang_multi_text.db,MultiText,Chengxiaoshan_main_1_1_15_29,渡口的位置我已传至您的终端。无论结果如何，散华先谢过了。,I have sent the coordinates to your Terminal. Thank you for your kind help. I pray you will both return safely.,"Vị trí bến đò tôi đã gửi đến thiết bị của ngài. Dù kết quả thế nào, Sanhua xin cảm ơn trước."
lang_multi_text.db,MultiText,Chengxiaoshan_main_1_1_15_3,我来找今汐，询问关于岁主的事。,I'm here for Jinhsi. I have questions about the Sentinel.,"Tôi đến tìm Jinhsi, hỏi về chuyện của Tuế Chủ."
lang_multi_text.db,MultiText,Chengxiaoshan_main_1_1_15_30,（阿布。）,(Abby.),(Abby.)
lang_multi_text.db,MultiText,Chengxiaoshan_main_1_1_15_31,（能听到吗？）,"(Abby, are you there?)",(Nghe thấy không?)
lang_multi_text.db,MultiText,Chengxiaoshan_main_1_1_15_32,我在。,I'm here.,Ta đây.
lang_multi_text.db,MultiText,Chengxiaoshan_main_1_1_15_33,我一直听着呢。,I'm listening!,Ta vẫn luôn nghe mà.
lang_multi_text.db,MultiText,Chengxiaoshan_main_1_1_15_34,说起来，乘霄山那边那种怪怪的气味闻起来还挺香的，但感觉不太能吃……,"Hey, did you notice how the mountain has a strangely pleasant smell? It doesn't look edible though...","Nói mới nhớ, cái mùi kỳ lạ bên phía Thừa Tiêu Sơn ngửi thì thấy thơm đấy, nhưng cảm giác không ăn được..."
lang_multi_text.db,MultiText,Chengxiaoshan_main_1_1_15_35,你很饿吗？,Are you hungry again?,Ngươi đói lắm hả?
lang_multi_text.db,MultiText,Chengxiaoshan_main_1_1_15_36,靠不靠得住啊你。,I'm suddenly unsure whether I can count on you.,Ngươi có đáng tin không đấy.
lang_multi_text.db,MultiText,Chengxiaoshan_main_1_1_15_37,睡吧，接下来我能应付。,Go get some rest. I can handle it.,"Ngủ đi, tiếp theo ta lo được."
lang_multi_text.db,MultiText,Chengxiaoshan_main_1_1_15_38,倒不是饿，就是容易犯困。我好像只能在睡觉的时候消化吃下去的频率，不然噎得慌。,Not that I'm hungry or anything. I just tend to doze off easily. Feels like my body can only process what I consume while sleeping.,"Cũng không hẳn là đói, chỉ là dễ buồn ngủ. Hình như ta chỉ có thể tiêu hóa tần số đã ăn vào trong lúc ngủ, nếu không sẽ bị nghẹn."
lang_multi_text.db,MultiText,Chengxiaoshan_main_1_1_15_39,靠得住当然是靠得住啦，就算我一不小心睡得太死没听到动静——,Well of course I'm reliable! Even if I do happen to fall asleep and can't hear you...,"Đáng tin dĩ nhiên là đáng tin rồi, cho dù ta có lỡ ngủ say quá không nghe thấy động tĩnh-"
lang_multi_text.db,MultiText,Chengxiaoshan_main_1_1_15_4,令尹现下不在边庭，而是去往了乘霄山。,I regret to inform you that Madam Magistrate is not in the City Hall. She has left for Mt. Firmament.,"Lệnh Doãn hiện không ở Biên Đình, mà đã đi đến Thừa Tiêu Sơn rồi."
lang_multi_text.db,MultiText,Chengxiaoshan_main_1_1_15_40,嘿，我也这么觉得，毕竟我这么厉害，你肯定也不差。,"Of course you can! When I'm already so cool, you must be pretty amazing too!","Hê, ta cũng thấy vậy, dù sao ta lợi hại thế này, ngươi chắc chắn cũng không kém."
lang_multi_text.db,MultiText,Chengxiaoshan_main_1_1_15_41,反正，只要你遇到危险，我就会本能地醒过来，跟之前一样。,"And don't worry, if there's any danger coming your way, I'll wake up like clockwork, just like last time.","Dù sao thì, chỉ cần ngươi gặp nguy hiểm, ta sẽ tỉnh lại theo bản năng, giống như trước đây vậy."
lang_multi_text.db,MultiText,Chengxiaoshan_main_1_1_15_42,除非，没有东西能对你造成一丁点威胁。,"Well, unless there's nothing that can even remotely challenge you.","Trừ phi, không có thứ gì có thể gây ra chút đe dọa nào cho ngươi."
lang_multi_text.db,MultiText,Chengxiaoshan_main_1_1_15_43,自然也就叫不醒……我……,"In that case, I probably won't... wake... up...",Tự nhiên cũng sẽ không gọi tỉnh... Ta...
lang_multi_text.db,MultiText,Chengxiaoshan_main_1_1_15_44,在边庭，散华表示令尹已独自前往乘霄山确认岁主安危，数日杳无音讯。你打算前往乘霄山，得知进山之路难寻，需有“引路人”相伴。散华愿意帮忙传讯于“引路人”，你们将在怨鸟泽附近渡口相见。,"In City Hall, Sanhua reveals that the Magistrate ventured to Mt. Firmament days ago, concerned for the Sentinel's safety. You express your intent to follow and Sanhua offers to contact a guide for the treacherous journey. She arranges a meeting with the Wayfinder at Whining Aix's Mire.","Tại Biên Đình, Sanhua cho biết Lệnh Doãn đã một mình đến Thừa Tiêu Sơn để xác nhận an nguy của Tuế Chủ, mấy ngày nay bặt vô âm tín. Bạn định đến Thừa Tiêu Sơn, nhưng biết được đường vào núi khó tìm, cần có ""Người Dẫn Đường"" đi cùng. Sanhua sẵn lòng giúp truyền tin cho ""Người Dẫn Đường"", các bạn sẽ gặp nhau tại bến đò gần Đầm Oán Điểu."
lang_multi_text.db,MultiText,Chengxiaoshan_main_1_1_15_5,实际上……令尹与边庭的联系，已经中断了数日。,In fact... We have not heard back from her for days.,Thực ra... liên lạc giữa Lệnh Doãn và Biên Đình đã bị gián đoạn mấy ngày rồi.
lang_multi_text.db,MultiText,Chengxiaoshan_main_1_1_15_6,所以你们也不清楚今汐的现况？,So you don't know what she is up to?,Vậy nên mọi người cũng không rõ tình hình hiện tại của Jinhsi?
lang_multi_text.db,MultiText,Chengxiaoshan_main_1_1_15_7,嗯，此事还请您替为保密，鸣式一战后，今州的局势尚不稳定。有关令尹的诸事，切不可被外界知晓。,"Unfortunately, no. Please keep this confidential. The situation in Jinzhou is still unstable after our battle with the Threnodian. We must limit discussion of the Magistrate's whereabouts to a select few.","Vâng, chuyện này xin ngài giữ bí mật thay, sau trận chiến Minh Thức, cục diện Kim Châu vẫn chưa ổn định. Mọi chuyện liên quan đến Lệnh Doãn, tuyệt đối không thể để bên ngoài biết được."
lang_multi_text.db,MultiText,Chengxiaoshan_main_1_1_15_8,发生了什么？,What's going on?,Đã xảy ra chuyện gì?
lang_multi_text.db,MultiText,Chengxiaoshan_main_1_1_15_9,我们设局擒获伤痕时，他曾扬言残星会已将岁主囚禁。,"When we captured Scar, he claimed that the Fractsidus has imprisoned our Sentinel.","Khi chúng tôi gài bẫy bắt được Scar, hắn từng rêu rao rằng Hội Tàn Tinh đã giam cầm Tuế Chủ."
lang_multi_text.db,MultiText,Chengxiaoshan_main_1_1_160_1,咳咳咳咳咳……,Cough cough...,Khụ khụ khụ khụ khụ...
lang_multi_text.db,MultiText,Chengxiaoshan_main_1_1_160_2,帮……帮帮我……,Help... Help me...,Giúp... giúp tôi với...
lang_multi_text.db,MultiText,Chengxiaoshan_main_1_1_160_3,别怕，我在……,"Don't worry, I'm here with you...","Đừng sợ, tôi ở đây..."
lang_multi_text.db,MultiText,Chengxiaoshan_main_1_1_160_4,再忍耐一下，我很快处理好。,Hang in there. I'll have you patched up in no time.,"Ráng chịu chút nữa, tôi sẽ xử lý xong nhanh thôi."
