db_file,table_name,id,zh,en,vi
lang_multi_text.db,MultiText,Character_Rococo_16_2,她希望通过戏剧化解大家心中的郁结，直到被海上凶恶的残象……,"She tried lifting everyone's spirits with song, right up until those nasty Tacet Discords got her...","Cô ấy hy vọng thông qua kịch nghệ có thể hóa giải những u uất trong lòng mọi người, cho đến khi bị Tàn Tượng hung ác trên biển..."
lang_multi_text.db,MultiText,Character_Rococo_16_3,只留下这把空无一弦的琴。,"Now all that's left is this lunachord, minus the strings.","Chỉ để lại cây đàn trống không, chẳng còn dây nào này."
lang_multi_text.db,MultiText,Character_Rococo_16_4,琴是用来弹奏的。,The lunachord served its purpose.,Đàn là dùng để gảy.
lang_multi_text.db,MultiText,Character_Rococo_16_5,琴是用来帮助别人的。,The lunachord was used for helping others.,Đàn là dùng để giúp đỡ người khác.
lang_multi_text.db,MultiText,Character_Rococo_16_6,嗯，她弹奏着这把琴，帮助着别人……,"Yeah, she kept strumming away, supporting those around her...","Ừm, cô ấy đã gảy cây đàn này, giúp đỡ người khác..."
lang_multi_text.db,MultiText,Character_Rococo_16_7,有了。即便手头没有与之匹配的琴弦，我也可以为它换上别的东西，让它继续帮助别人。,"Wait, I've got an idea! Even without the right strings, we can rig up something else. It can still be used to help people.","Có rồi. Cho dù trong tay không có dây đàn phù hợp, tôi cũng có thể thay thế bằng thứ khác cho nó, để nó tiếp tục giúp đỡ người khác."
lang_multi_text.db,MultiText,Character_Rococo_16_8,"洛可可对你讲述这把月弦琴上发生过的事。
在危险的朝圣船上，月弦琴的主人希望通过戏剧化解大家心中的郁结，直到生命的最后一刻也没有停止演奏。
月弦琴虽然失去了琴弦，但洛可可能为它换上别的东西，让它成为帮助别人的舞台道具。","Roccia reflects on a lunachord left behind by the Pilgrim’s Sail. 
Its owner sought to ease everyone’s hearts through music, and they performed till the last second of their life. 
Though the lunachord has lost its strings, Roccia replaces them with something new, transforming it into a stage prop to inspire others.","Roccia kể cho bạn nghe chuyện đã xảy ra trên cây Nguyệt Huyền Cầm này.
Trên con tàu hành hương đầy nguy hiểm, chủ nhân của Nguyệt Huyền Cầm hy vọng dùng kịch nghệ để hóa giải nỗi u uất trong lòng mọi người, cho đến giây phút cuối cùng của cuộc đời cũng không ngừng biểu diễn.
Tuy Nguyệt Huyền Cầm đã mất đi dây đàn, nhưng Roccia có thể thay thế bằng thứ khác cho nó, biến nó thành đạo cụ sân khấu giúp đỡ người khác."
lang_multi_text.db,MultiText,Character_Rococo_18_1,看似不起眼的碎船片，曾经是一艘艘「朝圣船」。,"These bits of ship debris may not look like much, but they were once part of countless Pilgrim's ships.","Những mảnh vỡ thuyền trông có vẻ tầm thường này, từng là một phần của những con ""Tàu Hành Hương""."
lang_multi_text.db,MultiText,Character_Rococo_18_10,谢谢你的好意，{PlayerName}。,"That's nice of you, {PlayerName}.","Cảm ơn ý tốt của bạn, {PlayerName}."
lang_multi_text.db,MultiText,Character_Rococo_18_11,不过，让尊贵的客人搬运重物，这并不符合剧团的礼仪。,But the troupe doesn't make its honored guests carry heavy stuff.,"Nhưng mà, để khách quý khuân vác vật nặng, điều này không phù hợp với lễ nghi của đoàn kịch."
lang_multi_text.db,MultiText,Character_Rococo_18_12,"洛可可对你讲述碎船片上发生过的事。
碎船片曾经是一艘艘朝圣船，承载着大家的恐惧与迷惘，也记录了大家的坚强与不屈。
碎船片体积较大，适合做成场景装置。","Roccia reflects on the ship debris. These fragments once belonged to a Pilgrim's Sail—a vessel that carried everyone’s fear and confusion, while also recording their resilience and defiance. 
The debris is large and well-suited for use as scene props for the stage.","Roccia kể cho bạn nghe chuyện đã xảy ra trên mảnh vỡ thuyền.
Mảnh vỡ thuyền từng là một phần của những con tàu hành hương, chứa đựng nỗi sợ hãi và hoang mang của mọi người, cũng ghi lại sự kiên cường và bất khuất của họ.
Mảnh vỡ thuyền có kích thước khá lớn, thích hợp làm thiết bị bối cảnh."
lang_multi_text.db,MultiText,Character_Rococo_18_13,佩洛佩洛！,"Pero, pero!",Pero Pero!
lang_multi_text.db,MultiText,Character_Rococo_18_14,"佩洛立刻从箱中钻出，在洛可可的指挥下，像一阵狂风般席卷了台上的碎船片。
拆解、拼接、组合……霎时间，这些碎船片组成了一个个舞台装置。","Pero emerges out of her box and sweeps up the debris on the stage like a whirlwind under Roccia's command.
Through a process of disassembling, mixing, matching, and reassembling, the debris pieces transform into stage props.","Pero lập tức chui ra khỏi vali, dưới sự chỉ huy của Roccia, quét sạch những mảnh vỡ thuyền trên sân khấu như một cơn gió lốc.
Tháo dỡ, ghép nối, kết hợp... trong chốc lát, những mảnh vỡ thuyền này đã tạo thành từng thiết bị sân khấu."
lang_multi_text.db,MultiText,Character_Rococo_18_15,嗯，场景初步布置完毕。,There. That pretty much covers the basics.,"Ừm, bố trí bối cảnh sơ bộ đã xong."
lang_multi_text.db,MultiText,Character_Rococo_18_2,上面承载着大家的恐惧与迷惘。,They carry all the fear and confusion people felt.,Trên đó chứa đựng nỗi sợ hãi và hoang mang của mọi người.
lang_multi_text.db,MultiText,Character_Rococo_18_3,也记录了大家的坚强与不屈。,But they also hold onto their strength.,Cũng ghi lại sự kiên cường và bất khuất của mọi người.
lang_multi_text.db,MultiText,Character_Rococo_18_4,看起来很适合当布景。,"Perfect for stage props, right?",Trông rất thích hợp làm bối cảnh.
lang_multi_text.db,MultiText,Character_Rococo_18_5,嗯，碎船片很适合做成场景装置。,"Mm-hmm, this debris will make a good backdrop material.","Ừm, mảnh vỡ thuyền rất thích hợp làm thiết bị bối cảnh."
lang_multi_text.db,MultiText,Character_Rococo_18_6,或许布置在舞台周围会比较合适。,Or we can scatter them around the stage to help set the mood.,Có lẽ bố trí xung quanh sân khấu sẽ phù hợp hơn.
lang_multi_text.db,MultiText,Character_Rococo_18_7,走，佩洛。我们一起把碎船片放到舞台上去吧。,"Come on, Pero. Let's get them up there.","Đi thôi, Pero. Chúng ta cùng đưa những mảnh vỡ thuyền lên sân khấu nhé."
lang_multi_text.db,MultiText,Character_Rococo_18_8,我也一起去吧。,I'll come with you.,Tôi cũng đi cùng nhé.
lang_multi_text.db,MultiText,Character_Rococo_18_9,我也来帮忙。,I'll help too.,Tôi cũng đến giúp.
lang_multi_text.db,MultiText,Character_Rococo_1_1,{PlayerName}，你好。,"Hello, {PlayerName}.","{PlayerName}, chào bạn."
