db_file,table_name,id,zh,en,vi
lang_multi_text.db,MultiText,Character_ChangLi_1_15,来来来，听我给你们细细道来……,"Gather around now, people. You're in for the story of a lifetime...","Lại đây lại đây, nghe ta kể cho mà nghe thật tường tận..."
lang_multi_text.db,MultiText,Character_ChangLi_1_16,……长离？,…Changli?,...Changli?
lang_multi_text.db,MultiText,Character_ChangLi_1_19,嘘。,Shh...,Suỵt.
lang_multi_text.db,MultiText,Character_ChangLi_1_2,樵夫望了望天，心想他在这山中观棋还不到一个时辰，怎么就天色已晚了？这老人怕是觉得他打扰了对弈的雅兴，于是樵夫打算道歉离开。,"As he glanced at the sky, the woodcutter was shocked to see how much time had passed. ""It couldn't have been more than two hours,"" he thought in disbelief. Feeling apologetic, he prepared to leave, worried that the guru would be annoyed with him.","Tiều phu ngẩng đầu nhìn trời, trong lòng thầm nghĩ mình ngồi xem cờ trên núi chưa đầy một canh giờ, sao trời đã tối rồi? Chắc là lão nhân cảm thấy mình quấy rầy cuộc đối ẩm thanh nhã, thế nên tiều phu định xin lỗi rồi rời đi."
lang_multi_text.db,MultiText,Character_ChangLi_1_20,……再会。,...I'll see you there.,...Hẹn gặp lại.
lang_multi_text.db,MultiText,Character_ChangLi_1_21,呼哈……什么声音这么热闹……诶？这是什么？,"*yawn* What's with the ruckus... Huh, what’s that in your hands?",Hừ hà... tiếng gì mà ồn ào vậy... Ơ? Cái này là gì thế?
lang_multi_text.db,MultiText,Character_ChangLi_1_22,刚才长离给了我这个。,Changli gave it to me a moment ago.,Changli vừa đưa cho tôi cái này.
lang_multi_text.db,MultiText,Character_ChangLi_1_23,唔……「纵览虹景，环迹望飞檐处，雪影成溪时，静候君归。」,"Hmm... ""Behold Hongzhen in its entirety, next to a ring and hanging eaves. When eternal snow thaw into flowing streams, let us reconvene.""","Ừm... ""Tung lãm hồng cảnh, hoàn tích vọng phi thiềm xứ, tuyết ảnh thành khê thời, tĩnh hậu quân quy."""
lang_multi_text.db,MultiText,Character_ChangLi_1_24,嘶……喔……原来如此……,"Ooh... I see, I see...",Tss... Ồ... Thì ra là vậy...
lang_multi_text.db,MultiText,Character_ChangLi_1_25,你看懂了？,Do you know what it means?,Cậu đọc hiểu rồi à?
lang_multi_text.db,MultiText,Character_ChangLi_1_26,噢噢……原来如此……,Ooh... So that's how it is...,Ồ ồ... Thì ra là vậy...
lang_multi_text.db,MultiText,Character_ChangLi_1_27,完全看不懂！,I see I've got no clue at all!,Hoàn toàn không hiểu gì hết!
lang_multi_text.db,MultiText,Character_ChangLi_1_28,白期待了！,So much for the anticipation!,Kỳ vọng hão cả rồi!
lang_multi_text.db,MultiText,Character_ChangLi_1_29,真是毫不意外。,"Wow, I'm so shocked to hear that.",Thật chẳng bất ngờ chút nào.
lang_multi_text.db,MultiText,Character_ChangLi_1_3,——可这一回头却差点吓得他三魂丢了七魄，哪有什么隐士高人举盏对弈，他面前只是一个破败的棋盘，和一副腐朽的骸骨罢了。,"But when the woodcutter turned around, he nearly jumped out of his skin. The hermit guru, who had been playing Weiqi and drinking wine, was now gone. In his place lay a shattered Weiqi board and a heap of decaying bones.","- Thế nhưng vừa quay đầu lại thì suýt nữa tiều phu hồn xiêu phách lạc, nào có ẩn sĩ cao nhân nào nâng chén đối ẩm, trước mặt ông chỉ là một bàn cờ đổ nát, và một bộ hài cốt mục ruỗng mà thôi."
lang_multi_text.db,MultiText,Character_ChangLi_1_30,不过最后一句我知道，是要约你见面对吧，那个大姐姐的心思，可真复杂……,"I get the very last part, at least! She’s asking you out! Well that's a fancy way to write stuff...","Nhưng câu cuối thì tôi biết, là hẹn gặp cậu đúng không, tâm tư của chị ấy thật phức tạp..."
lang_multi_text.db,MultiText,Character_ChangLi_1_31,……第一句是方位信息。,...The first part reads like it's about the meeting spot.,...Câu đầu tiên là thông tin phương vị.
lang_multi_text.db,MultiText,Character_ChangLi_1_32,看描述，地点应该就在虹镇内部。,"According to the description, it's somewhere in Hongzhen.","Nhìn mô tả, địa điểm hẳn là ở bên trong Hồng Trấn."
lang_multi_text.db,MultiText,Character_ChangLi_1_33,你是怎么从这团谜语里看出这么多意思的？,How did you manage to get all that hidden meaning?,Cậu làm sao mà đọc ra nhiều ý nghĩa đến vậy từ mớ câu đố này?
lang_multi_text.db,MultiText,Character_ChangLi_1_34,似曾相识的做法，这次更简单些。,I'm experienced. Dealt with Jinhsi's riddles already.,"Cách làm này có vẻ quen thuộc, lần này còn đơn giản hơn."
lang_multi_text.db,MultiText,Character_ChangLi_1_35,我脑子好使。,Thanks to my big brain.,Tại tớ thông minh.
lang_multi_text.db,MultiText,Character_ChangLi_1_36,不过虹镇到处都是长得差不多的建筑，她指的是哪呢……,But the buildings in Hongzhen all look pretty much the same. Which one exactly was she talking about?,"Nhưng Hồng Trấn toàn những kiến trúc trông na ná nhau, chị ấy chỉ chỗ nào nhỉ..."
lang_multi_text.db,MultiText,Character_ChangLi_1_37,和之前一样，去四处问问。,We can ask around to find out. I’ve done this before.,"Giống lần trước thôi, đi hỏi thăm xung quanh."
lang_multi_text.db,MultiText,Character_ChangLi_1_38,有道理，你带路！,Makes sense. Lead the way!,"Có lý, cậu dẫn đường!"
lang_multi_text.db,MultiText,Character_ChangLi_1_39,还有这下一句……雪影成溪？唔……真是让人摸不着头脑。,"And now... this next sentence, ""eternal snow thaw into streams""... What is that supposed to mean?","Còn câu tiếp theo nữa... ""Tuyết ảnh thành khê""? Ừm... Thật khiến người ta chẳng hiểu đầu đuôi gì cả."
lang_multi_text.db,MultiText,Character_ChangLi_1_4,那樵夫吓得丢下赤竹篓子，头也不回地朝山下逃去。,The woodcutter was so scared that he dropped his bamboo basket and ran down the mountain without even looking back.,"Tiều phu sợ đến mức vứt luôn chiếc giỏ xích trúc, đầu cũng không ngoảnh lại mà chạy thẳng xuống núi."
lang_multi_text.db,MultiText,Character_ChangLi_1_40,或许和虹镇的文化有关。,Maybe it has something to do with local folklore.,Có lẽ liên quan đến văn hóa của Hồng Trấn.
lang_multi_text.db,MultiText,Character_ChangLi_1_41,虹镇的一位老者正在讲述乘霄山“棋局里隐藏着长生秘法”的传说，旁听的你发现长离也在身边，她交给你一件挂饰和一张字条后便悄然离去。字条上的内容似乎隐含邀你会面的信息，你决定去四处问问。,"In Hongzhen, an elderly storyteller shares the legend of a hidden Weiqi game on Mt. Firmament that is said to grant immortality. While listening, you notice Changli nearby. She hands you an accessory and a note before quietly leaving. The note hints at a secret meeting, and to decipher its meaning, you decide to ask around.","Một vị lão giả ở Hồng Trấn đang kể truyền thuyết về ""bí pháp trường sinh ẩn giấu trong ván cờ"" trên núi Thừa Tiêu. Đang nghe thì cậu phát hiện Changli cũng ở bên cạnh, cô trao cho cậu một món trang sức và một mảnh giấy rồi lặng lẽ rời đi. Nội dung trên giấy dường như ẩn chứa thông tin mời cậu gặp mặt, cậu quyết định đi hỏi thăm xung quanh."
lang_multi_text.db,MultiText,Character_ChangLi_1_5,回到山下却发现一切都变了样，小山村变成了镇子，茅草屋也变成了结实的砖瓦房，曾经的家只留下一片光秃秃的荒地。,"As he reached the mountain's base, he was hit with a stark realization. The quaint village he remembered had bloomed into a bustling town, with sturdy brick houses replacing the humble thatched cottages. And where his home once stood, only an empty wasteland remained.","Trở về chân núi thì phát hiện mọi thứ đã đổi khác, ngôi làng nhỏ đã biến thành thị trấn, nhà tranh vách đất cũng thành nhà gạch ngói kiên cố, nơi từng là nhà mình giờ chỉ còn lại một bãi đất trống trơn."
lang_multi_text.db,MultiText,Character_ChangLi_1_6,日历上的年号更是从未见过，他大惊失色，连忙抓着路过的人问，现在是什么时候了？,"He noticed a date on the calendar that he had never seen before. In shock, he grabbed a passerby and urgently asked, ""Excuse me, can you tell me the current date and time?""","Niên hiệu trên lịch lại chưa từng thấy bao giờ, tiều phu kinh hãi biến sắc, vội vàng túm lấy người qua đường hỏi, bây giờ là thời nào rồi?"
lang_multi_text.db,MultiText,Character_ChangLi_1_7,得到的答复让他吓软了腿——岂止是年号变了，这日月更迭已逾百年，他的家人、朋友全都已经作了土，无人记得了。,"As he heard the answer, his legs went weak. Everything had changed—time had passed and his loved ones were gone. No one remembered him anymore.","Câu trả lời nhận được khiến ông ta sợ đến mềm cả chân - đâu chỉ niên hiệu thay đổi, nhật nguyệt luân chuyển đã hơn trăm năm, gia đình, bạn bè đều đã hóa thành cát bụi, chẳng còn ai nhớ đến ông nữa."
lang_multi_text.db,MultiText,Character_ChangLi_1_8,他既出了乘霄山，这百年的时间一起叠加在身上，他都该……怎么还能活蹦乱跳的？,"So the woodcutter left Mt. Firmament, but how was he still alive and kicking? With a hundred year's worth of time inside him, shouldn't he...","Ông ấy đã rời khỏi núi Thừa Tiêu, trăm năm thời gian dồn hết lên người, lẽ ra ông ấy phải... sao còn có thể sống nhăn răng được chứ?"
lang_multi_text.db,MultiText,Character_ChangLi_1_9,是啊，您这故事……艺术加工的成分有点太高了吧？如果咱不是土生土长的虹镇人，可能还信了。,"Your story... It's a bit far-fetched, don't you think? I mean, if I wasn't from Hongzhen, I might have fallen for it.","Đúng vậy, câu chuyện của ông... thành phần nghệ thuật gia công hơi nhiều quá rồi đấy? Nếu không phải là người Hồng Trấn chính gốc, có khi còn tin thật."
lang_multi_text.db,MultiText,Character_ChangLi_20_10,只听说几个月前他申请了长假……和伏翎一起离开了。,"I remember he went on sabbatical months ago, and he left with Fuling...",Chỉ nghe nói vài tháng trước anh ấy xin nghỉ phép dài... rồi cùng Fuling rời đi.
lang_multi_text.db,MultiText,Character_ChangLi_20_11,伏翎？,Fuling?,Fuling?
lang_multi_text.db,MultiText,Character_ChangLi_20_12,啊，伏翎是他的恋人，这次也和他一起来虹镇了，就在那边的旅馆落脚。,"Yes, Fuling, his girlfriend. I think they're visiting Hongzhen together. They're staying at the inn over there.","À, Fuling là người yêu của anh ấy, lần này cũng cùng anh ấy đến Hồng Trấn, đang ở trọ tại quán trọ bên kia."
lang_multi_text.db,MultiText,Character_ChangLi_20_13,伏翎不久前还来打听他的消息，看上去挺担心的。,"Oh, Fuling asked us about his whereabouts not long ago. She seemed quite worried.","Fuling mới đây còn đến hỏi thăm tin tức của anh ấy, trông có vẻ khá lo lắng."
lang_multi_text.db,MultiText,Character_ChangLi_20_14,话说……他真的没事吗？还是先带他去医馆吧？,Speaking of... Is he really okay? Perhaps we should get him to a hospital first...,Mà nói thật... anh ấy thật sự không sao chứ? Hay là đưa anh ấy đến y quán trước đi?
lang_multi_text.db,MultiText,Character_ChangLi_20_15,不，不去医馆……伏翎……她在等我……,"No, I'm not going... Fuling... She's waiting for me...","Không, không đi y quán... Fuling... cô ấy đang đợi tôi..."
lang_multi_text.db,MultiText,Character_ChangLi_20_16,无需担心，我们这就带你去找她。,Don't worry. We'll help you find Fuling.,"Không cần lo lắng, chúng ta sẽ đưa anh đến gặp cô ấy ngay."
lang_multi_text.db,MultiText,Character_ChangLi_20_2,呜……！是长离大人！,"Woah...! G-Greetings, Lady Changli!",Ôi...! Là Changli đại nhân!
lang_multi_text.db,MultiText,Character_ChangLi_20_3,您，您找我有什么事情吗？啊，{PlayerName}也在，你背着的那个人是……,"H-How may I help you today, Lady Changli? Oh and, hello {PlayerName}! The person on your back... Is he okay?","Ngài, ngài tìm tôi có chuyện gì ạ? À, {PlayerName} cũng ở đây, người mà cậu cõng trên lưng là..."
lang_multi_text.db,MultiText,Character_ChangLi_20_4,我们在乘霄山中遇到了这个人，你可知道他是否有同伴，现在在何处？,We found him on Mt. Firmament. Do you know where his companions might be?,"Chúng ta gặp người này trong Thừa Tiêu Sơn, ngươi có biết anh ta có đồng hành không, hiện giờ đang ở đâu?"
lang_multi_text.db,MultiText,Character_ChangLi_20_5,这不是梧黎吗……怎么伤成这样？,Isn't this Wuli? What happened to him?,Đây chẳng phải là Wuli sao... sao lại bị thương nặng thế này?
lang_multi_text.db,MultiText,Character_ChangLi_20_6,在乘霄山里遭到了残象围攻。,He was attacked by Tacet Discords.,Bị Tàn Tượng trong Thừa Tiêu Sơn vây đánh.
lang_multi_text.db,MultiText,Character_ChangLi_20_7,……,...,...
lang_multi_text.db,MultiText,Character_ChangLi_20_8,他还在昏迷……,He's still unconscious...,Anh ấy vẫn còn hôn mê...
lang_multi_text.db,MultiText,Character_ChangLi_20_9,他是先行公约的探险家，不过并不经常来今州，所以平时也很少见面。,"He's one of the Pioneer Association's explorers, but we don't see him around Jinzhou too often.","Anh ấy là nhà thám hiểm của Tiên Hành Công Ước, nhưng không thường xuyên đến Kim Châu, nên bình thường cũng ít khi gặp mặt."
lang_multi_text.db,MultiText,Character_ChangLi_21_1,啊……！是梧黎！咳咳……,W-Wuli! I.. *cough*...,A...! Ngô Lê! Khụ khụ...
lang_multi_text.db,MultiText,Character_ChangLi_21_10,你是说……那个传说……是真的？,You mean... that legend? It's real?,Ý anh là... truyền thuyết đó... là thật sao?
lang_multi_text.db,MultiText,Character_ChangLi_21_11,伏翎……你，不高兴吗？,Fuling... Are you... Are you not happy?,"Phục Linh... cô, không vui sao?"
lang_multi_text.db,MultiText,Character_ChangLi_21_12,不……我很高兴……真是太好了。,No... I am... I'm so glad to hear it.,Không... tôi rất vui... thật tốt quá.
lang_multi_text.db,MultiText,Character_ChangLi_21_13,嗯……太好……了……,Haha... Yes...,Ừm... tốt quá... rồi...
lang_multi_text.db,MultiText,Character_ChangLi_21_14,——梧黎！,...Wuli!,-- Ngô Lê!
lang_multi_text.db,MultiText,Character_ChangLi_21_15,将力竭昏睡的梧黎送去医馆，请医师处理了伤势。,You carry an exhausted and unconscious Wuli to a doctor to treat his injuries.,"Đưa Ngô Lê đã kiệt sức và hôn mê đến y quán, nhờ thầy thuốc xử lý vết thương."
lang_multi_text.db,MultiText,Character_ChangLi_21_16,{PlayerName}还有长离大人，谢谢你们救了他……,"Thank you, {PlayerName}, Lady Changli. You saved his life...","{PlayerName} và Changli đại nhân, cảm ơn hai vị đã cứu anh ấy..."
lang_multi_text.db,MultiText,Character_ChangLi_21_17,人没事就好。,I'm glad he's okay.,Người không sao là tốt rồi.
lang_multi_text.db,MultiText,Character_ChangLi_21_19,请问……究竟发生了什么？我从来没有见过梧黎那副样子……,May I please ask... what on earth happened? I've never seen Wuli like that...,Xin hỏi... rốt cuộc đã xảy ra chuyện gì? Tôi chưa bao giờ thấy Ngô Lê như vậy...
lang_multi_text.db,MultiText,Character_ChangLi_21_2,小心，不要勉强。,Breathe. Take it easy.,"Cẩn thận, đừng gắng sức."
lang_multi_text.db,MultiText,Character_ChangLi_21_20,其实……,Well...,Thực ra...
lang_multi_text.db,MultiText,Character_ChangLi_21_22,——然后，我们就找到了你。,... And then we found you.,"-- Rồi sau đó, chúng tôi tìm thấy cô."
lang_multi_text.db,MultiText,Character_ChangLi_21_23,……你们刚才说，他在山中仅度过了半日？,So... He said he only spent half a day in the mountains?,"...Hai vị vừa nói, anh ấy chỉ ở trong núi nửa ngày thôi sao?"
lang_multi_text.db,MultiText,Character_ChangLi_21_24,嗯？莫非……对你来说并不是这样？,Was that not the case?,Hm? Chẳng lẽ... đối với cô thì không phải vậy?
lang_multi_text.db,MultiText,Character_ChangLi_21_25,嗯，我已经……在这里等了他快七日了。,No... I've been... I've been waiting for almost a week.,"Vâng, tôi đã... đợi anh ấy ở đây gần bảy ngày rồi."
lang_multi_text.db,MultiText,Character_ChangLi_21_26,因为他经常出远门，三四日无音讯的情况也是常事，只是这次实在太久，如果不是两位及时出现，我就要去请求夜归军带我进山寻人了……,"It's not unusual for Wuli to be out of touch for a few days when he goes on long trips. This time, however, seemed longer than usual. If it weren't for you two showing up, I would have asked the Midnight Rangers to help me search for him in the mountains.","Vì anh ấy thường đi xa, ba bốn ngày không có tin tức cũng là chuyện thường, chỉ là lần này thực sự quá lâu. Nếu không phải hai vị xuất hiện kịp thời, tôi đã phải nhờ quân Dạ Quy đưa tôi vào núi tìm người rồi..."
lang_multi_text.db,MultiText,Character_ChangLi_21_27,他为什么要执意进山？,What's his obsession with the mountains?,Tại sao anh ấy lại nhất quyết phải vào núi?
lang_multi_text.db,MultiText,Character_ChangLi_21_28,梧黎是……为了我。,"Wuli, he... He did it for me.",Ngô Lê... là vì tôi.
lang_multi_text.db,MultiText,Character_ChangLi_21_29,我原本是一个风景画师，因为工作和梧黎结识，我们一起游历了很多地方。,"I used to work as a landscape painter. Wuli and I met through work, and we traveled to many places together.","Tôi vốn là một họa sĩ phong cảnh, vì công việc mà quen biết Ngô Lê, chúng tôi cùng nhau du lịch rất nhiều nơi."
lang_multi_text.db,MultiText,Character_ChangLi_21_3,咳……谢谢你，我没事，请问你们是……还有梧黎他……,"*cough*... Thank you. I'm okay now. Who are you? ... And Wuli, is he...","Khụ... cảm ơn, tôi không sao, xin hỏi các vị là... còn Ngô Lê anh ấy..."
lang_multi_text.db,MultiText,Character_ChangLi_21_30,半年前我生了一场重病，行动越来越困难，已经不能像以前那样和他一起探险写生……梧黎就推掉了所有委托，为我四处寻医问药。,"A few months ago, I got really sick. It affected my ability to walk, which got worse over time. We couldn't go on our adventures like we used to. Wuli stopped taking on work and traveled all over the world to find a cure for me.","Nửa năm trước tôi mắc một trận bệnh nặng, đi lại ngày càng khó khăn, không thể như trước cùng anh ấy thám hiểm và vẽ tranh nữa... Ngô Lê liền từ chối hết mọi ủy thác, khắp nơi tìm thầy chạy thuốc cho tôi."
lang_multi_text.db,MultiText,Character_ChangLi_21_34,即使每次……都是无功而返，他也从未放弃过。但就在两周前，他带着我来到了虹镇，告诉我要给我一个惊喜。,"Despite his efforts, we couldn't find any cures... Until two weeks ago, when he brought me to Hongzhen. Said he had a surprise for me.","Dù mỗi lần... đều trở về tay không, anh ấy cũng chưa bao giờ từ bỏ. Nhưng hai tuần trước, anh ấy đưa tôi đến Hồng Trấn, nói rằng muốn tặng tôi một bất ngờ."
lang_multi_text.db,MultiText,Character_ChangLi_21_35,我原本以为他想让我在这里散散心，但他却消失了七天，回来时满身狼狈，说找到了能延缓我的病的办法……,"I thought it was just going to be a relaxing trip, but he disappeared for seven days. Now he's back, rambling about having found a way to stop my condition from progressing...","Tôi vốn tưởng anh ấy muốn tôi đến đây thư giãn, nhưng anh ấy lại biến mất bảy ngày, khi trở về thì đầy thương tích, nói đã tìm được cách trì hoãn bệnh tình của tôi..."
lang_multi_text.db,MultiText,Character_ChangLi_21_36,刚才听到他说有关“传说”的事情……,"He was saying something about the ""legend""...","Vừa rồi nghe anh ấy nhắc đến chuyện ""truyền thuyết""..."
lang_multi_text.db,MultiText,Character_ChangLi_21_37,是指乘霄山中的「长生秘法」，对吗？,"Mt. Firmament's ""Secret of Immortality"", I presume?","Là ""Bí pháp Trường Sinh"" trên núi Thừa Tiêu, đúng không?"
lang_multi_text.db,MultiText,Character_ChangLi_21_38,嗯……梧黎说，他查阅了很多资料，得知乘霄山中有一片不被打扰的世外桃源，那里有着永恒停滞的时间，只要在那里生活，我的病就永远也不会恶化。,"Yes... Wuli told me that he's researched and found an untouched paradise on Mt. Firmament. A place where time stands still. He said if I lived there, my condition would never worsen...","Ừ... Ngô Lê nói rằng anh ấy đã tra cứu rất nhiều tài liệu, biết được trên núi Thừa Tiêu có một chốn thiên đường không bị ai quấy nhiễu, nơi thời gian đình trệ vĩnh hằng. Chỉ cần sống ở đó, bệnh của tôi sẽ không bao giờ trở nặng thêm."
lang_multi_text.db,MultiText,Character_ChangLi_21_39,……虽然没有办法治愈，但在那里我们能永远在一起。,"...It cannot fully cure me, but at least we can spend eternity together.","...Tuy không thể chữa khỏi, nhưng ở nơi đó chúng tôi có thể mãi mãi bên nhau."
lang_multi_text.db,MultiText,Character_ChangLi_21_4,你就是伏翎吧？,You must be Fuling?,Cô là Fuling phải không?
lang_multi_text.db,MultiText,Character_ChangLi_21_40,我原本认为这只是一个遥不可及的传说……直到刚才你们说，他在山中只待了半日……,"At first, I thought it was just a myth... But then you brought up how he only spent half a day in the mountains...",Ban đầu tôi nghĩ đó chỉ là một truyền thuyết xa vời... Cho đến khi các người nói rằng anh ấy chỉ ở trong núi có nửa ngày...
lang_multi_text.db,MultiText,Character_ChangLi_21_42,他很可能是遇到了时间乱流？,He may have run into Temporal Disruptions.,Rất có thể anh ấy đã gặp phải loạn lưu thời gian?
lang_multi_text.db,MultiText,Character_ChangLi_21_43,我原本也是这样猜测，但梧黎非常肯定地对我说，他寻找的那个传说是真实存在的。,"Those were my thoughts as well, but Wuli seemed very certain.","Ban đầu tôi cũng đoán như vậy, nhưng Ngô Lê rất khẳng định với tôi rằng truyền thuyết anh ấy tìm kiếm là có thật."
lang_multi_text.db,MultiText,Character_ChangLi_21_46,乘霄山曾因历史原因陷入时间紊乱之中，但在今汐和{PlayerName}的努力下，乘霄山中理论上应该已经不再有时间乱流才对。,"Mt. Firmament used to have Temporal Disruptions caused by its tumultuous history. However, thanks to Magistrate Jinhsi and Rover, these disruptions have been dealt with. Or so we had hoped.","Núi Thừa Tiêu từng vì nguyên nhân lịch sử mà rơi vào tình trạng rối loạn thời gian, nhưng nhờ nỗ lực của Jinhsi và {PlayerName}, về lý thuyết trên núi Thừa Tiêu lẽ ra không còn loạn lưu thời gian nữa mới đúng."
lang_multi_text.db,MultiText,Character_ChangLi_21_47,看来还有漏网之鱼。,Looks like there might still be some of them.,Xem ra vẫn còn cá lọt lưới.
lang_multi_text.db,MultiText,Character_ChangLi_21_48,……也就是说，山中还存在被隐藏的时间乱流，而梧黎出于某种原因误入，认为它便是自己追寻的传说。,"So there are still unaddressed Temporal Disruptions in the mountains. And unfortunately, Wuli has stumbled upon one, mistaking it for the legendary cure he was searching for.","...Nghĩa là, trong núi vẫn tồn tại loạn lưu thời gian ẩn giấu, và Ngô Lê vì lý do nào đó đã lạc vào, cho rằng đó chính là truyền thuyết mà mình theo đuổi."
lang_multi_text.db,MultiText,Character_ChangLi_21_49,但它并不是解决问题之法，反而……危机重重。,"But little did he know, it would only put him in more danger.","Nhưng nó không phải là cách giải quyết vấn đề, ngược lại... đầy rẫy nguy hiểm."
lang_multi_text.db,MultiText,Character_ChangLi_21_5,我是……究竟是发生了什么……,"Yes, I am... Can you please tell me what happened?",Tôi là... rốt cuộc đã xảy ra chuyện gì...
lang_multi_text.db,MultiText,Character_ChangLi_21_50,原来……是这样……,I see...,Thì ra... là vậy...
