db_file,table_name,id,zh,en,vi
lang_infodisplay.db,InfoDisplay,56,"聚焦阵列将于9月10日正式开始施工，届时将由黑石工业运输站负责转运工作，请相关工作人员注意维护路面安全，仔细核对物资，定时监测环境，保证鸣液安全储存。
施工过程中，非技术人员请远离施工现场，禁止在无防护的情况下直接接触鸣液。如有身体不适，请及时上报。

新历158年8月30日","The construction of the focus array will officially begin on September 10, when the Tacetite Industrial Transportation Station will be responsible for the transfer work. Relevant staff is asked to pay attention to maintaining road safety, close check of supplies, regular monitor of the environment to ensure the safe storage of the Wutherium Fluid.
During the construction process, non-technical staff should stay away from the site, and direct contact with Wutherium Fluid without protection is prohibited. If you feel unwell, please report it in time.

158 A. L. August 30","Cụm Hội Tụ sẽ chính thức bắt đầu thi công vào ngày 10 tháng 9, khi đó Trạm Vận Chuyển Công Nghiệp Hắc Thạch sẽ chịu trách nhiệm công tác trung chuyển, xin nhân viên liên quan chú ý duy trì an toàn đường sá, kiểm tra vật tư cẩn thận, giám sát môi trường định kỳ, đảm bảo Minh Dịch được lưu trữ an toàn.
Trong quá trình thi công, nhân viên không chuyên môn xin tránh xa công trường, nghiêm cấm tiếp xúc trực tiếp với Minh Dịch khi không có bảo hộ. Nếu thấy cơ thể khó chịu, xin báo cáo kịp thời.

Ngày 30 tháng 8 năm 158 Tân Lịch"
lang_infodisplay.db,InfoDisplay,57,小心恶霸！,Beware of Bullies!,Coi Chừng Hai Tên Côn Đồ!
lang_infodisplay.db,InfoDisplay,58,"各位外来人员，如果您在转运站门口发现流浪猫，请不要随意投喂或者呼唤。
附近有两只恶霸经常以柔顺亲人的姿态接近工作人员，趁机偷跑进站，躲藏在重要设备的阴暗处。被发现时又张牙舞爪，蓄意伤人，已是惯犯！
为了保证黑石产品安全储存以及您的人身安全，请小心两只恶霸，不要被它们的外表蒙骗。

**我们有专人定点投喂。","Visitors, if you find stray cats at the entrance of the transfer station, please do not feel free to feed or call out to them.
There are two bullies nearby who often approach the staff with the posture of soft relatives and take the opportunity to sneak into the station and hide in the shadows of important equipment. When they are found, they stretch claws and deliberately hurt people. They have become recidivists!
To ensure the safe storage of Tacetite products and your personal safety, please beware of the two bullies and do not be deceived by their appearance.

**We have dedicated members of staff to feed them.","Gửi các nhân viên ngoại lai, nếu bạn phát hiện mèo hoang ở cổng trạm trung chuyển, xin đừng tùy tiện cho ăn hay gọi chúng.
Gần đây có hai tên côn đồ thường xuyên tiếp cận nhân viên bằng vẻ hiền lành thân thiện, thừa cơ lẻn vào trạm, trốn trong bóng tối của các thiết bị quan trọng. Khi bị phát hiện lại vung vuốt gào thét, cố ý gây thương tích, đã là phạm nhân nhiều lần!
Để đảm bảo an toàn lưu trữ sản phẩm Hắc Thạch cũng như sự an toàn cá nhân của bạn, xin cẩn thận với hai tên côn đồ, đừng bị vẻ bề ngoài của chúng lừa gạt.

**Chúng tôi có người chuyên trách cho ăn định kỳ."
lang_infodisplay.db,InfoDisplay,59,安适心新情~第100期~,Hotel of Comfort Weekly ~ Issue 100 ~,An Thích Tâm Tin Mới ~ Số 100 ~
lang_infodisplay.db,InfoDisplay,60,"~安适心旅店~
每周读物 第100期 特别加量版

*每周新鲜* 千缘相会
祈池村第一届抛花节顺利结束。与往年不同，为了纪念北面村庄完工，祈池村邀请了不少附近的村民参加，以此感谢大家的支援。
抛花是祈池村村民过去的习俗，在三月往雨华池池中抛入新折的花枝或是花瓣，让池水感受初春的生机，祈愿这新生的喜悦能够传递到人的心中，不再受困于悲鸣的毁灭。
另外，我们旅店附近也有一个小池塘，如果客人有兴趣，饭后散步时也可以试试往里面抛一捧花瓣哦。虽然大小不如祈池村的雨华池，但这种祈望和喜悦一定是共通的。


*一刻开心* 厕所读物
“为什么虎口山脉一点都不像虎口呢？”
“因为很久很久以前，有一只羊在山里迷了路……”

科学家分析黑石成分，发现都是共鸣者的愿望。

啾啾河豚沿河而下，遇到了正在捕食的羽鹭，大声叫道：“啾啾！！”

（这一页比其他页面更老旧，似乎是被翻阅过很多次）


*特别后记* 最后的告别
不知不觉见，安适心已经陪伴各位旅客走过两年零两个月的时间，安适心新情也顺利走到了100期。在这充满纪念意义的一期最后，我们要跟大家说一声再见。
悲鸣和鸣式战争已经彻底改变了中曲台地，各种突发灾害让我们难以抵抗。这样下去，安适心也无法对得起招牌的名字，给旅客一个真正安全舒适的居住体验。
不过安适心的告别，不会像悲鸣一样突然哦。我们还会坚持再运营一个月，完成交接后，建筑也会保留，由天城接手。至于会变成什么，各位敬请期待喽！","~ Hotel of Comfort ~
Weekly Read Issue 100 Extra packed edition

*Weekly Fresh News* Bounds of Meeting
The first Flower Tossing Festival in Qichi Village ended successfully. Unlike previous years, in order to commemorate the completion of the village in the north, the village invited many nearby villagers this year to participate in the festival as a way of thanking them for their support.
It is a custom of the Qichi villagers to toss newly picked flowers branchesor into the Pond of Rain Petals in March to let the water feel the vitality of the early spring and to pray that the joy of the new life will reach the hearts of people so they will not be trapped by the sadness of destruction of the Lament.
There is also a small pond near our hotel, so if you are interested, you can also try throwing a handful of flower petals into it when you take a walk after dinner. Although the size of the pond is not as big as the Pond of Rain Petals, but the prayer and joy must be common ~

*Moment of Laughter* Bathroom Read
""Why does Hukou, the Tiger's Maw seem nothing like a tiger's mouth?""
""Because once upon a time, a goat got lost in the mountains...""

Scientists did an analysis into Tacetite components and found they were all wishes of Resonators.

A chirpuff went down the river and found a hunting heron. He cried:"" chirp chirp!""

(This page seems more yellow than the others. Seems like being leafedmany times)

*Special Afterward* Our Last Farewell
We have been with you for two years and two months without noticing, and our magazine has successfully reached its 100th issue. At the end of this monumental issue, we would like to say goodbye to all of you.
The Lament and the Threnodian War have completely changed the Central Plains, and various sudden disasters have made it difficult for us to resist. At this rate, the Hotel of Comfort will not be able to live up to its name and give travelers a truly safe and comfortable living experience.
But our farewell will not be as sudden as Lament. We will continue to operate for another month, and after the transfer, the building will be preserved and taken over by Tiancheng. As for what will become of it, please stay in the loop!","~Nhà Trọ An Thích Tâm~
Ấn phẩm hàng tuần, số 100, phiên bản đặc biệt tăng lượng

*Tin mới hàng tuần* Nghìn Duyên Tương Hội
Lễ hội ném hoa lần đầu tiên của thôn Kỳ Trì đã kết thúc tốt đẹp. Khác với mọi năm, để kỷ niệm hoàn thành ngôi làng phía bắc, thôn Kỳ Trì đã mời nhiều dân làng lân cận tham gia, nhằm cảm ơn sự hỗ trợ của mọi người.
Ném hoa là phong tục xưa của dân làng Kỳ Trì, vào tháng ba ném những cành hoa hoặc cánh hoa mới bẻ vào ao Vũ Hoa Trì, để nước ao cảm nhận sức sống đầu xuân, cầu nguyện niềm vui mới sinh này truyền đến lòng người, không còn bị giam cầm trong sự hủy diệt của Bi Minh.
Ngoài ra, gần nhà trọ chúng tôi cũng có một ao nhỏ, nếu quý khách có hứng thú, khi đi dạo sau bữa ăn cũng có thể thử ném một nắm cánh hoa vào đó. Tuy kích thước không bằng ao Vũ Hoa Trì của thôn Kỳ Trì, nhưng niềm mong ước và niềm vui chắc chắn là chung nhau.


*Phút vui vẻ* Đọc vật trong toilet
""Tại sao dãy núi Hổ Khẩu chẳng giống hổ khẩu chút nào?""
""Vì rất lâu rất lâu trước đây, có một con cừu bị lạc trong núi...""

Nhà khoa học phân tích thành phần Hắc Thạch, phát hiện toàn là ước nguyện của Cộng Hưởng Giả.

Cá nóc Cù Cù trôi xuôi dòng sông, gặp con cò lông đang bắt mồi, kêu to: ""Cù Cù!!""

(Trang này cũ hơn các trang khác, có vẻ đã được lật xem rất nhiều lần)


*Hậu ký đặc biệt* Lời chia tay cuối cùng
Không biết không hay, An Thích Tâm đã đồng hành cùng quý khách du lịch suốt hai năm lẻ hai tháng, An Thích Tâm Tin Mới cũng đã thuận lợi đến số 100. Ở cuối số đầy ý nghĩa kỷ niệm này, chúng tôi phải nói lời tạm biệt với mọi người.
Bi Minh và chiến tranh Minh Thức đã thay đổi hoàn toàn Trung Khúc Đài Địa, các thảm họa bất ngờ khiến chúng tôi khó lòng chống chọi. Cứ thế này, An Thích Tâm cũng không xứng với cái tên trên biển hiệu, không thể mang đến cho khách du lịch trải nghiệm ở thật sự an toàn và thoải mái.
Nhưng lời chia tay của An Thích Tâm sẽ không đột ngột như Bi Minh đâu. Chúng tôi sẽ kiên trì hoạt động thêm một tháng nữa, sau khi bàn giao xong, tòa nhà sẽ được giữ lại và do Thiên Thành tiếp quản. Còn sẽ biến thành gì, mời quý vị hãy chờ đón nhé!"
lang_infodisplay.db,InfoDisplay,61,哲思笔记-风望灯塔小札,,Bút Ký Triết Lý - Ghi Chú Nhỏ Về Hải Đăng Phong Vọng
lang_infodisplay.db,InfoDisplay,62,"……关于它的传言很多，不仅是外界，就连先行公约内部都有各种不同的说法。
自从点燃了对它的兴趣，我几乎翻阅了所有前人留下的资料，也去询问过曾接下调查任务的前辈，但都没有什么定论，只在这里留下一些有记忆的只言片语。

“风望灯塔之上，是点燃宇宙的星。”
“很少能见到这样焕发生机的古物，它就像那些诗人说的，是文明的灯。”
“这片大地浸满了伤痕，但它从未放弃过自愈，每晚亮起的光，正是它在愈合的表现，一呼一吸，一呼、一吸……如果有一天这光不再亮起，也许……”
“灯塔，灯塔！它亮起的究竟是什么？光明的希望，还是一个通往黑暗的，未知之谜？”",,"...Có rất nhiều tin đồn về nó, không chỉ bên ngoài, ngay cả bên trong Hiệp Ước Tiên Phong cũng có đủ loại quan điểm khác nhau.
Kể từ khi đốt lên hứng thú với nó, tôi gần như đã lật hết tất cả tư liệu tiền nhân để lại, cũng đi hỏi các bậc tiền bối từng nhận nhiệm vụ điều tra, nhưng đều không có kết luận rõ ràng, chỉ ghi lại đây vài câu còn nhớ được.

""Trên đỉnh Hải Đăng Phong Vọng, là ngôi sao thắp sáng vũ trụ.""
""Rất hiếm khi thấy một cổ vật tràn đầy sức sống như vậy, nó giống như những gì các nhà thơ nói, là ngọn đèn của văn minh.""
""Mảnh đất này đầy rẫy vết thương, nhưng nó chưa bao giờ từ bỏ việc tự chữa lành, ánh sáng sáng lên mỗi đêm chính là biểu hiện của sự chữa lành, một hít một thở, một hít, một thở... Nếu một ngày ánh sáng ấy không còn sáng nữa, có lẽ...""
""Hải đăng, hải đăng! Thứ nó thắp lên rốt cuộc là gì? Hy vọng của ánh sáng, hay một bí ẩn chưa biết dẫn đến bóng tối?"""
lang_infodisplay.db,InfoDisplay,63,工作安排,,Phân Công Công Việc
lang_infodisplay.db,InfoDisplay,64,"老大要去龙望郊附近打猎，搞点兽肉回来囤着。
被选中随行的人自觉报道，把自己名字划了（没来的罚三天口粮）。
名单：<s>马山</s>、志岩、<s>谢奇水</s>
其他人自行安排。

【注意】
不准和皇龙官方起冲突，不准和其他帮派起冲突，除非你能把他们全部打趴下。
切记，掂量掂量自己的本事再动手。",,"Đại ca sẽ đi săn gần ngoại ô Long Vọng, kiếm ít thịt thú về tích trữ.
Những người được chọn đi theo tự giác báo danh, gạch tên mình đi (ai không đến phạt ba ngày khẩu phần).
Danh sách: <s>Mã Sơn</s>, Chí Nham, <s>Tạ Kỳ Thủy</s>
Những người khác tự sắp xếp.

[LƯU Ý]
Không được gây xung đột với phía chính quyền Hoàng Long, không được gây xung đột với các băng đảng khác, trừ khi ngươi có thể đánh gục hết bọn chúng.
Ghi nhớ, cân nhắc bản lĩnh mình rồi hãy ra tay."
lang_infodisplay.db,InfoDisplay,65,首领日记,,Nhật Ký Thủ Lĩnh
lang_infodisplay.db,InfoDisplay,66,"<i>首领专用信息触板，识相点别乱动</i>
日期：不知道
今天好像有个怂包没来，叫什么志岩？看我回去怎么收拾他。其他几个人干事缩手缩脚的，连森栖牛都怕，还得靠老大我出马，哼哼。
赶巧碰到个破房子，正好让他们把这些肉处理了再带走。这几个家伙磨蹭了半天还没搞定，等会别把鬃狼引来了……",,"<i>Bảng thông tin chuyên dụng của thủ lĩnh, biết điều thì đừng đụng vào</i>
Ngày: không biết
Hôm nay hình như có thằng nhát gan không đến, tên gì Chí Nham ấy? Về rồi xem ta thu xếp thế nào. Mấy thằng khác làm việc rụt rè co ro, đến con bò Sâm Thê cũng sợ, vẫn phải nhờ đại ca ta ra tay, hừ hừ.
Tình cờ gặp cái nhà hoang, vừa hay để bọn chúng xử lý mấy miếng thịt này rồi hẵng mang đi. Mấy thằng này mài mò nửa ngày vẫn chưa xong, lát nữa lại dẫn sói Tông đến thì khổ..."
lang_infodisplay.db,InfoDisplay,67,研究日记,,Nhật Ký Nghiên Cứu
lang_infodisplay.db,InfoDisplay,68,"你好，过路人。
如果可以的话，请花两分钟试试眼前的装置吧，它能让你体验化身为蝶，自由翱翔的感觉，与此同时，你的使用可以为我收集实验数据。

【实验原理说明】
<i>嫌长可以不看。</i>
我从多个定音体中析出了一个稳定的飞行声骸，将其中的信息频谱分解为解至遗传信息级别，并利用鸣素与该信息结合复制幻象的异能力，此时声骸的使用者就可以通过对鸣素的操纵以复现对应幻象或异变生物的异能力。

<i>有兴趣可以来研究院旁听我的声骸课程。</i>
联系方式：没有确切地点和时间，来了再问问（经常因为选课人少而停课）。",,"Xin chào, khách qua đường.
Nếu có thể, hãy dành hai phút thử thiết bị trước mắt nhé, nó có thể cho bạn trải nghiệm cảm giác hóa thân thành bướm, tự do bay lượn. Đồng thời, việc bạn sử dụng sẽ giúp tôi thu thập dữ liệu thí nghiệm.

[Giải Thích Nguyên Lý Thí Nghiệm]
<i>Dài quá thì có thể không đọc.</i>
Tôi đã tách chiết từ nhiều Định Âm Thể ra một Thanh Hài bay ổn định, phân giải phổ thông tin bên trong đến cấp độ thông tin di truyền, và sử dụng Minh Tố kết hợp với thông tin đó để sao chép dị năng của Ảo Ảnh. Khi đó người sử dụng Thanh Hài có thể thông qua thao tác Minh Tố để tái hiện dị năng tương ứng của Ảo Ảnh hoặc sinh vật dị biến.

<i>Có hứng thú thì có thể đến Viện Nghiên cứu dự thính khóa học Thanh Hài của tôi.</i>
Cách liên hệ: Không có địa điểm và thời gian cố định, đến rồi hỏi (thường bị ngưng vì ít người đăng ký)."
lang_infodisplay.db,InfoDisplay,69,嘉平的日记,Jiaping's Diary,Nhật Ký Của Gia Bình
lang_infodisplay.db,InfoDisplay,70,"（封面写着“嘉平”，应该是日记主人的名字）

10月18日
螯合众的人与一般的流放者并不相同，他们的身份太过复杂，并不是那种只追求蛮力的流放者。他们有自己的规矩，谈判未必是个好选择。
但如果你真的下定了决心，我会陪你试试。

（夹层的字条）
……你应该也受够了这种日子吧？我每天晚上都在为此焦虑，痛苦。我想你，我想跟你一起生活。是我过去的错误造成了今天的结果，我不能一个人在天城里躲着，让你在那种地方受苦……我好后悔，如果当时选的是我去当人质……
我应该跟他们谈谈……就算是还债，我也该还完了。他们那些见不得人的勾当，找另外的人去做。我要跟他们两清。
之后我们离开天城，离开皇龙也行。只要跟你在一起，去哪里都好。
（字条背面写着<color=#ffd12f>1012</color>，似乎是日期）


10月20日
螯合众的规矩还是跟七年前一样。但我们俩……肯定无法通过。
我看过太多次这种戏码。决斗，听起来公平，但他们绝不会遵守规矩。
需要更强大的力量……我们只能赌一把。

（粘贴的文件和剪报）
《天城一女子误食黑石，竟成为共鸣者，当即加入夜归！》
《长期暴露在黑石环境中的超频风险：追踪调查结论》

10月21日
阅川的状态，比我更好。他比我幸运……
这样也好，只要我们中有一个人能赢下去，就有机会拿到声料……在完全超频之前……挽回一切……

10月22日
没时间了……我……
力量……",,"(Bìa viết ""Gia Bình"", có lẽ là tên chủ nhật ký)

18 tháng 10
Những người trong Ngao Hợp Chúng khác với Kẻ Lưu Đày thông thường, thân phận họ quá phức tạp, không phải loại Kẻ Lưu Đày chỉ chạy theo sức mạnh thô bạo. Họ có luật lệ riêng, đàm phán chưa chắc là lựa chọn tốt.
Nhưng nếu anh thật sự đã quyết tâm, tôi sẽ cùng anh thử.

(Mảnh giấy kẹp trong trang)
...Anh chắc cũng chịu đủ kiểu sống này rồi phải không? Mỗi đêm tôi đều lo lắng, đau khổ vì điều này. Tôi nhớ anh, tôi muốn cùng anh sống. Chính lỗi lầm trong quá khứ của tôi đã gây ra kết quả hôm nay, tôi không thể một mình trốn ở Thiên Thành, để anh chịu khổ ở nơi đó... Tôi hối hận quá, nếu lúc đó người đi làm con tin là tôi...
Tôi nên nói chuyện với bọn chúng... dù là trả nợ, tôi cũng đáng lẽ đã trả xong rồi. Mấy chuyện mờ ám của bọn chúng, tìm người khác mà làm. Tôi muốn hai bên sòng phẳng.
Sau đó chúng ta rời Thiên Thành, rời Hoàng Long cũng được. Chỉ cần ở bên anh, đi đâu cũng tốt.
(Mặt sau mảnh giấy viết <color=#ffd12f>1012</color>, có vẻ là ngày tháng)


20 tháng 10
Luật lệ của Ngao Hợp Chúng vẫn giống bảy năm trước. Nhưng hai chúng tôi... chắc chắn không thể vượt qua.
Tôi đã xem quá nhiều lần cảnh này rồi. Đấu tay đôi, nghe có vẻ công bằng, nhưng bọn chúng tuyệt đối sẽ không tuân thủ luật lệ.
Cần sức mạnh lớn hơn... chúng tôi chỉ có thể đánh cược một phen.

(Tài liệu và mẩu báo dán kèm)
""Một phụ nữ Thiên Thành ăn nhầm Hắc Thạch, bỗng trở thành Cộng Hưởng Giả, lập tức gia nhập Dạ Quy!""
""Rủi ro Vượt Tần khi tiếp xúc lâu dài với môi trường Hắc Thạch: Kết luận điều tra theo dõi""

21 tháng 10
Tình trạng của Duyệt Xuyên tốt hơn tôi. Anh ấy may mắn hơn tôi...
Như vậy cũng tốt, chỉ cần một trong hai người chúng tôi thắng được, sẽ có cơ hội lấy được thanh liệu... trước khi Vượt Tần hoàn toàn... cứu vãn tất cả...

22 tháng 10
Hết thời gian rồi... tôi...
Sức mạnh..."
lang_infodisplay.db,InfoDisplay,71,关于迷雾深坑内迷雾的成分调查说明,Component Analysis for Mists in Hazy Depths,Báo Cáo Điều Tra Thành Phần Sương Mù Trong Hố Sâu Mê Vụ
