db_file,table_name,id,zh,en,vi
lang_favor.db,FavorWord,15,喜欢的食物,,Món ăn yêu thích
lang_favor.db,FavorWord,16,潮饼、四杰豆腐、天城冒菜……下次带你尝尝家乡菜，啊，都是我喜欢的，排名不分先后哦。,"Wuthercake, Four-Great Tofu, Tiancheng Maocai... Let me show you some local dishes next time. Oh, they are all my favorites, no particular order.","Triều Bính, Tứ Kiệt Đậu Hủ, Thiên Thành Mạo Thái... Lần sau tôi dẫn cậu thử món quê nhà nhé, à, đều là món tôi thích cả, không phân thứ tự đâu."
lang_favor.db,FavorWord,17,讨厌的食物,,Món ăn ghét
lang_favor.db,FavorWord,18,任何食物都该被好好对待吧？欸？黑，黑暗料理的话……,"Shouldn't any food be treated seriously? Hm? If, if it's unpalatable cuisine...",Món nào cũng nên được đối xử tử tế chứ nhỉ? Hả? Mà nếu là món... đen tối thì...
lang_favor.db,FavorWord,19,抱负和理想,,Hoài bão và lý tưởng
lang_favor.db,FavorWord,20,就算没发生在我身上，那些美好的事物也是真实存在的。能见证并守护它们，就足够了。,"Those beautiful things do exist, even if they don't happen to me. To only witness and watch over them is sufficient for me.","Cho dù không xảy đến với tôi, những điều tươi đẹp ấy vẫn thực sự tồn tại. Được chứng kiến và gìn giữ chúng, thế là đủ rồi."
lang_favor.db,FavorWord,21,凝音·一,,Ngưng Âm - 1
lang_favor.db,FavorWord,22,在意我的发带？这是加入夜归时，一个有点任性的朋友送的礼物。风纹刻录其上，庆贺一次新生，也提醒我不要忘记自己真正的心意。,"Interested in my ribbon? It's gift from a wild friend for my admission into Midnight Rangers. Stripes of winds are engraved upon to celebrate a rebirth, and also remind me of the true purpose.","Để ý dải tóc của tôi à? Đây là món quà của một người bạn hơi bướng bỉnh tặng khi tôi gia nhập Dạ Quy. Hoa văn gió khắc trên đó, chúc mừng một lần tái sinh, cũng nhắc tôi đừng quên tâm nguyện thật sự của mình."
lang_favor.db,FavorWord,23,凝音·二,,Ngưng Âm - 2
lang_favor.db,FavorWord,24,敏锐的感知曾经令我非常痛苦。讯息会从四面八方涌来，嘈杂、紊乱、猛烈，而我只是风暴中的一片落羽。不过……没关系……都过去了，我已经找到了稳住方向的诀窍，也由此，发现了你。,"Sharp senses once put me in severe pains. Messages flooded from everywhere with noisiness, disorder, and violence, and I was but a feather in the storm. However... (deeply breathing) it's OK... it's all gone. I have found the key to stabilizing the direction, and by that, I have found you.","Khả năng cảm nhận nhạy bén từng khiến tôi rất đau khổ. Thông tin ùa đến từ khắp nơi, ồn ào, hỗn loạn, dữ dội, còn tôi chỉ là chiếc lông vũ giữa cơn bão. Nhưng mà... không sao... đã qua rồi, tôi đã tìm được bí quyết giữ vững phương hướng, và nhờ vậy, tìm thấy cậu."
lang_favor.db,FavorWord,25,生日祝福,,Lời chúc sinh nhật
lang_favor.db,FavorWord,26,生日快乐，漂泊者。祝你生日快乐，祝你生日快乐……,"Happy birthday, Rover. (clear throat and start singing) Happy birthday to you, happy birthday to you...","Chúc mừng sinh nhật, Lữ Khách. Chúc cậu sinh nhật vui vẻ, chúc cậu sinh nhật vui vẻ..."
lang_favor.db,FavorWord,27,闲趣·一,,Nhàn thú - 1
lang_favor.db,FavorWord,28,轻飘飘、慢悠悠地坠落……会抵达什么样的远方呢？,Falling lightly and lingeringly... Where in the distance will we be led to?,"Nhẹ bẫng, chầm chậm rơi xuống... sẽ đến được nơi xa xôi nào đây?"
lang_favor.db,FavorWord,29,闲趣·二,,Nhàn thú - 2
lang_favor.db,FavorWord,30,风能将事物吹散，亦能将事物聚拢。聚散是自然的常态，不用太介怀。,"Wind scatters things, and gathers things. Coming and going is a constant of nature. Don't mind it too much.","Gió có thể thổi tan mọi thứ, cũng có thể gom chúng lại. Hợp tan là lẽ thường của tự nhiên, đừng bận tâm quá."
lang_favor.db,FavorWord,31,闲趣·三,,Nhàn thú - 3
lang_favor.db,FavorWord,32,等……下次准备好的时候，再为你好好唱一首吧？,Can I sing you another song when... I am more prepared?,"Đợi... lần sau khi chuẩn bị xong, tôi hát cho cậu nghe một bài nhé?"
lang_favor.db,FavorWord,33,初奏,,Sơ Tấu
lang_favor.db,FavorWord,34,我叫秧秧，流息指引我与你相遇……我有预感，未来很长一段时间里，我们都会是彼此的旅伴。,"I am Yangyang. The flowing streams of wind guided me to you... I have a vision that for a long time coming, we will keep each other accompanied for the journey.","Tôi tên Ương Ương, luồng khí dẫn lối tôi gặp cậu... Tôi có linh cảm, trong một thời gian dài sắp tới, chúng ta sẽ là bạn đồng hành của nhau."
lang_favor.db,FavorWord,35,入队·一,,Nhập đội - 1
lang_favor.db,FavorWord,36,和我一起，聆听风中的声音吧。,Listen to the sounds in wind with me.,Cùng tôi lắng nghe thanh âm trong gió nhé.
lang_favor.db,FavorWord,37,入队·二,,Nhập đội - 2
lang_favor.db,FavorWord,38,云雀的歌，即将唱响。,The lark's song is about to sound.,Bài ca của vân tước sắp vang lên.
lang_favor.db,FavorWord,39,入队·三,,Nhập đội - 3
lang_favor.db,FavorWord,40,我会竭尽所能回应大家的期待。,"To the best of me, I will respond to your expectations.",Tôi sẽ cố hết sức đáp lại kỳ vọng của mọi người.
lang_favor.db,FavorWord,41,突破·一,,Đột phá - 1
lang_favor.db,FavorWord,42,流息越发强烈，它……想告诉我什么呢？,Wind strikes.,"Luồng khí ngày càng mạnh mẽ, nó... muốn nói gì với tôi đây?"
lang_favor.db,FavorWord,43,突破·二,,Đột phá - 2
lang_favor.db,FavorWord,44,我从没感受过这样的充盈……是因为你，对吗？谢谢你，漂泊者。谢谢你……为我所做的一切。,Converge.,"Tôi chưa từng cảm nhận được sự tràn đầy như thế này... Là nhờ cậu, đúng không? Cảm ơn cậu, Lữ Khách. Cảm ơn cậu... vì tất cả những gì cậu đã làm cho tôi."
lang_favor.db,FavorWord,45,突破·三,,Đột phá - 3
lang_favor.db,FavorWord,46,流息从四周聚集，而我站在中心，等待着起风的时机。,Howling turbulence.,"Luồng khí tụ lại từ bốn phía, còn tôi đứng giữa trung tâm, chờ đợi thời khắc gió nổi."
lang_favor.db,FavorWord,47,突破·四,,Đột phá - 4
lang_favor.db,FavorWord,48,此时此刻，是我距离天空最近的时候。,The shapeless breaks the shaped.,"Giây phút này, là lúc tôi gần bầu trời nhất."
lang_favor.db,FavorWord,49,共鸣技能·一,,Kỹ Năng Cộng Hưởng - 1
lang_favor.db,FavorWord,50,风袭。,"Storm, take everything.",Gió ập tới.
lang_favor.db,FavorWord,51,共鸣技能·二,,Kỹ Năng Cộng Hưởng - 2
lang_favor.db,FavorWord,52,汇聚于此。,Waltz of the streams.,Hội tụ nơi đây.
lang_favor.db,FavorWord,53,共鸣技能·三,,Kỹ Năng Cộng Hưởng - 3
lang_favor.db,FavorWord,54,涡流，呼啸而至。,Doesn't matter.,"Xoáy lốc, gào thét ập đến."
lang_favor.db,FavorWord,55,共鸣解放·一,,Giải Phóng Cộng Hưởng - 1
lang_favor.db,FavorWord,56,无形破有形。,"D, don't worry about me.",Vô hình phá hữu hình.
lang_favor.db,FavorWord,57,共鸣解放·二,,Giải Phóng Cộng Hưởng - 2
lang_favor.db,FavorWord,58,风，席卷一切。,I shall... fight back!,"Gió, cuốn sạch tất cả."
lang_favor.db,FavorWord,59,共鸣解放·三,,Giải Phóng Cộng Hưởng - 3
lang_favor.db,FavorWord,60,流息的圆舞。,Let me take it...,Vũ điệu của luồng khí.
lang_favor.db,FavorWord,61,受击·一,,Trúng đòn - 1
lang_favor.db,FavorWord,62,不要紧。,It's not breaking me.,Không sao.
lang_favor.db,FavorWord,63,受击·二,,Trúng đòn - 2
lang_favor.db,FavorWord,64,别，别担心我。,"This, isn't working...","Đ, đừng lo cho tôi."
lang_favor.db,FavorWord,65,受击·三,,Trúng đòn - 3
lang_favor.db,FavorWord,66,我会……反击！,Only... making it here with you.,Tôi sẽ... phản công!
lang_favor.db,FavorWord,67,重伤·一,,Trọng thương - 1
lang_favor.db,FavorWord,68,由我承受……,Is the wind... stilling...,Để tôi chịu...
lang_favor.db,FavorWord,69,重伤·二,,Trọng thương - 2
