db_file,table_name,id,zh,en,vi
lang_multi_text.db,MultiText,Kouweigailiang_13_15,……我好像吃了。,...Feels like I ate something.,...Hình như tôi đã ăn.
lang_multi_text.db,MultiText,Kouweigailiang_13_16,又好像没有……,And yet ate nothing at all...,Mà hình như cũng chưa...
lang_multi_text.db,MultiText,Kouweigailiang_13_2,嗯！嗯……嗯……？嗯…………,Mm! Hmm... hmm...? Hmmm...,Ừm! Ừm... ừm...? Ừm............
lang_multi_text.db,MultiText,Kouweigailiang_13_3,阿布的表情从兴奋逐渐变成了迷茫。好在，这次没有变成一片空白。,"Abby's expression gradually changes from excitement to confusion. At least this time, its eyes didn't go completely blank.",Biểu cảm của Abby từ phấn khích dần chuyển sang hoang mang. May mắn là lần này không trở nên trống rỗng hoàn toàn.
lang_multi_text.db,MultiText,Kouweigailiang_13_4,还是没味道吗？,Does it still taste like nothing?,Vẫn không có vị sao?
lang_multi_text.db,MultiText,Kouweigailiang_13_5,有！但是……好奇怪……总感觉，和想象中不太一样……,"No! I can feel something, but... it's strange... It's not quite what I imagined...","Có! Nhưng mà... lạ quá... cứ cảm thấy, không giống như tưởng tượng lắm..."
lang_multi_text.db,MultiText,Kouweigailiang_13_6,（再次尝试嘻嘻果冻。）,(Taste the Squeezy Jelly again.),(Thử lại Thạch Hí Hí.)
lang_multi_text.db,MultiText,Kouweigailiang_13_7,你吸了一口，这次的果冻带上了强烈的味道。,You take a slurp. The jelly has an intense flavor this time.,"Bạn hút một hơi, thạch lần này mang theo mùi vị mãnh liệt."
lang_multi_text.db,MultiText,Kouweigailiang_13_8,它就像绚烂的烟花那样在你的舌尖炸开，但仅仅片刻就消弭于无形，与此同时你还感到了错位般的饱腹感。,"It explodes at the tip of your tongue like fireworks, but only for a brief moment before vanishing. At the same time, you get a twisted sensation of feeling full.","Nó như pháo hoa rực rỡ nổ tung trên đầu lưỡi bạn, nhưng chỉ trong chốc lát đã tan biến vào vô hình, cùng lúc đó bạn còn cảm thấy cảm giác no bụng đầy sai lệch."
lang_multi_text.db,MultiText,Kouweigailiang_13_9,而最终停留在舌尖的仍旧只有……淡淡的虚无。,And what ultimately lingers on your tongue is still just... bland emptiness.,Và cuối cùng đọng lại trên đầu lưỡi vẫn chỉ là... sự hư vô nhạt nhẽo.
lang_multi_text.db,MultiText,Kouweigailiang_14_1,明明已经有了味道，但怎么吃起来还是……,"It's got flavors now, but why does it still taste...","Rõ ràng đã có vị rồi, nhưng sao ăn vào vẫn thấy..."
lang_multi_text.db,MultiText,Kouweigailiang_14_2,对吗？不对，对的对的，不对不对……,"Is this right? No... Yes, it is right! No, it's not...","Đúng không? Không đúng, đúng rồi đúng rồi, không đúng không đúng..."
lang_multi_text.db,MultiText,Kouweigailiang_1_1,这味道……好、好虚无……,This taste... Tastes like... emptiness...,"Mùi vị này... thật, thật hư vô..."
lang_multi_text.db,MultiText,Kouweigailiang_1_2,我好像吃了，又好像没有……,"Feels like I ate something, and yet ate nothing at all...","Hình như tôi đã ăn, mà hình như cũng chưa..."
lang_multi_text.db,MultiText,Kouweigailiang_2_1,嗅嗅，嗅嗅……饿了……,Sniff-sniff... I'm hungry...,"Hít hít, hít hít... Đói quá..."
lang_multi_text.db,MultiText,Kouweigailiang_2_10,来都来了……不能浪费。我先替你试试！,"Well, we already paid for these... Can't let it go to waste. I'll go first!",Mua cũng mua rồi... không thể lãng phí. Ta thử trước cho ngươi!
lang_multi_text.db,MultiText,Kouweigailiang_2_11,阿布拧开盖子，努力捏着果冻青绿色的包装吸了一大口。,"Abby twists open the cap, pinches the green packaging with its paws, and slurps in a huge mouthful.","Abby vặn nắp, cố gắng bóp cái bao bì xanh ngắt của gói thạch và hút một hơi lớn."
lang_multi_text.db,MultiText,Kouweigailiang_2_12,你看到它的表情从迷茫，思索，放空逐渐过渡到了一片空白……,"You watch as Abby's expression goes from confused to wondering, and its staring eyes gradually turn blank...","Bạn thấy biểu cảm của nó từ hoang mang, suy tư, thẫn thờ dần chuyển sang một mảng trắng xóa..."
lang_multi_text.db,MultiText,Kouweigailiang_2_13,阿布，静止了……,Did someone hit the pause button on Abby...?,"Abby, đứng hình rồi..."
lang_multi_text.db,MultiText,Kouweigailiang_2_14,阿布？阿布？你还好吗？,Abby? Abby? Everything all right in there?,Abby? Abby? Ngươi ổn chứ?
lang_multi_text.db,MultiText,Kouweigailiang_2_15,……,...,...
lang_multi_text.db,MultiText,Kouweigailiang_2_16,这么难吃吗？,Is it really that bad?,Khó ăn thế sao?
lang_multi_text.db,MultiText,Kouweigailiang_2_17,不是难吃，就是、就是！我好像吃了，又好像没有……,"It's not that! It's just... it's just... It's like I ate something, but ate nothing at all...","Không phải khó ăn, chỉ là, chỉ là! Ta hình như đã ăn, mà hình như cũng chưa..."
lang_multi_text.db,MultiText,Kouweigailiang_2_18,{PlayerName}，是不是我的问题？你也……试试？,"Or it's just me, {PlayerName}. You give it a try... maybe?","{PlayerName}, có phải ta có vấn đề không? Ngươi cũng... thử xem?"
lang_multi_text.db,MultiText,Kouweigailiang_2_19,你也拧开盖子，吸了一口果冻。,"You twist open the cap the same way Abby did, and slurp up a mouthful of jelly.","Bạn cũng vặn nắp, hút một ngụm thạch."
lang_multi_text.db,MultiText,Kouweigailiang_2_2,{PlayerName}，我刚听走廊上的学生们聊天说，食堂的“罐装惊喜”又甜，又软，果酱特别特别香……,"Hey {PlayerName}! I just overheard some students in the hall going on and on about the cafeteria's ""Canned Surprise."" Said it's super sweet, spongy, and just loaded with good-smelling jam...","{PlayerName}, ta vừa nghe đám sinh viên ở hành lang nói chuyện, bảo là ""Lon Bất Ngờ"" của nhà ăn vừa ngọt, vừa mềm, mứt quả cực kỳ cực kỳ thơm..."
lang_multi_text.db,MultiText,Kouweigailiang_2_20,很快，那种平静、营养、必要、正常、可控的味道，带着虚无的口感，静静地从你的味觉中滑远了。,"Before you realize, that calm, nutritious, essential flavor, so normal and pliable with its texture of complete emptiness, softly slides away from your taste buds.","Rất nhanh, cái mùi vị bình ổn, dinh dưỡng, thiết yếu, bình thường, có thể kiểm soát đó, mang theo cảm giác hư vô, lặng lẽ trôi tuột khỏi vị giác của bạn."
lang_multi_text.db,MultiText,Kouweigailiang_2_21,……,...,...
lang_multi_text.db,MultiText,Kouweigailiang_2_22,我好像吃了，又好像没有……,"Feels like I ate something, and yet ate nothing at all...","Hình như tôi đã ăn, mà hình như cũng chưa..."
lang_multi_text.db,MultiText,Kouweigailiang_2_3,嗯……今天的菜单好像写的不是这个。,Hmm... I don't think that's what they have on the menu today.,Ừm... thực đơn hôm nay hình như không có món đó.
lang_multi_text.db,MultiText,Kouweigailiang_2_4,没、没有了吗！那今天是……“嘻嘻果冻”？没吃过。,W-Wait a minute. Are they sold out?! That means today it's... Squeezy Jelly? Never had those before.,"H-Hết rồi sao! Vậy hôm nay là... ""Thạch Hí Hí""? Chưa ăn bao giờ."
lang_multi_text.db,MultiText,Kouweigailiang_2_5,不过，这个名字听起来也是甜的，肯定不会差！我们点两份试试看吧？,But the name has a sweet ring to it. I'll bet it's just as good! How about we order two and give it a go?,"Cơ mà, cái tên này nghe cũng có vẻ ngọt, chắc chắn không tệ đâu! Chúng ta gọi hai phần thử xem nhé?"
lang_multi_text.db,MultiText,Kouweigailiang_2_6,片刻后，你拿到了两份“全营养嘻嘻果冻”。,"A moment later, you find yourself holding two Complete Nutrition Squeezy Jellies in your hands.","Một lát sau, bạn nhận được hai phần ""Thạch Hí Hí Dinh Dưỡng Toàn Diện""."
lang_multi_text.db,MultiText,Kouweigailiang_2_7,这个包装……看起来……,This packaging... feels...,Cái bao bì này... trông có vẻ...
lang_multi_text.db,MultiText,Kouweigailiang_2_8,非常实用。,Very practical.,Rất thực dụng.
lang_multi_text.db,MultiText,Kouweigailiang_2_9,不太好吃。,Not very appetizing.,Không ngon lắm.
lang_multi_text.db,MultiText,Kouweigailiang_3_1,不行不行，这个东西出现在食堂的菜单里也太奇怪了吧。,Uh-uh... Stuff like this is too weird to be on the cafeteria menu.,"Không được không được, thứ này xuất hiện trong thực đơn nhà ăn thì kỳ cục quá."
lang_multi_text.db,MultiText,Kouweigailiang_3_2,{PlayerName}，我们去写那个什么意见信箱吧？让他们做点好吃的——,"How about we write something for that suggestion box, {PlayerName}? Ask them to make something that's actually tasty...","{PlayerName}, chúng ta đi viết cái hòm thư góp ý gì đó đi? Bảo họ làm chút gì ngon ngon..."
lang_multi_text.db,MultiText,Kouweigailiang_3_3,咳……那边那位同学，你刚才是吃了嘻嘻果冻吧？,"Ahem... You there! I noticed you just had a Squeezy Jelly, no?","Khụ... Bạn học đằng kia, vừa rồi cậu đã ăn Thạch Hí Hí đúng không?"
lang_multi_text.db,MultiText,Kouweigailiang_4_1,打扰了，我是詹卢卡，餐能中心的工作人员。,"Pardon me, my name is Gianluca. I work at the cafeteria.","Xin lỗi đã làm phiền, tôi là Gianluca, nhân viên của Trung Tâm Năng Lượng Thực Phẩm."
lang_multi_text.db,MultiText,Kouweigailiang_4_10,为了改善情况，餐能中心这边想试试由我们推出一些定制口味的果冻，每周轮换，也许能让它的接受度变得更高。,"To remedy the situation, the cafeteria would like to release a few select-flavored Jellies that change weekly. Perhaps it can make the product more acceptable to a greater audience.","Để cải thiện tình hình, phía trung tâm muốn thử tung ra một số loại thạch có hương vị tùy chỉnh, thay đổi hàng tuần, có lẽ sẽ giúp nó dễ được chấp nhận hơn."
lang_multi_text.db,MultiText,Kouweigailiang_4_11,{PlayerName}同学，能请你帮忙收集并协调一下其他学生的意见，来判断这周我们该尝试什么口味吗？,"{PlayerName}, I'd like to ask your help in gathering and organizing feedback from other students, so we can decide on what flavor to test out for this week.","Bạn học {PlayerName}, cậu có thể giúp thu thập và điều phối ý kiến của các sinh viên khác để quyết định xem tuần này chúng ta nên thử vị gì không?"
lang_multi_text.db,MultiText,Kouweigailiang_4_12,为了果冻新品研发！,For science! And for a new jelly!,Vì sự nghiệp nghiên cứu thạch mới!
lang_multi_text.db,MultiText,Kouweigailiang_4_13,为了不让学生在食堂体验虚无……,For no more empty flavors in the cafeteria...,Để sinh viên không phải trải nghiệm sự hư vô trong nhà ăn nữa...
lang_multi_text.db,MultiText,Kouweigailiang_4_14,那就拜托你了，我在这里静候佳音。,"Thank you, I really appreciate it. I'll await your results here.","Vậy nhờ cậy vào cậu, tôi sẽ ở đây đợi tin tốt."
lang_multi_text.db,MultiText,Kouweigailiang_4_2,其实……你不是第一个想要反馈嘻嘻果冻口味问题的学生了。,To be frank... you're not the first student to have given feedback regarding the Squeezy Jelly's taste.,Thực ra... cậu không phải là sinh viên đầu tiên muốn phản hồi về vấn đề hương vị của Thạch Hí Hí.
lang_multi_text.db,MultiText,Kouweigailiang_4_3,嘻嘻果冻原本是作为方便的营养补充品开发的，重点在于便携、适应性强、营养充沛。,"Squeezy Jelly was originally developed as a convenient nutrient supplement. It's supposed to offer portability, adaptability, and maximize nutrition in one single package.","Thạch Hí Hí vốn được phát triển như một thực phẩm bổ sung dinh dưỡng tiện lợi, trọng tâm là tính di động, khả năng thích ứng cao và giàu dinh dưỡng."
lang_multi_text.db,MultiText,Kouweigailiang_4_4,星炬学院开发新品时也会考虑味道，实际上，这款菜品是支持自定义口味的。,"Startorch Academy also takes taste into consideration when developing a new product. As a matter of fact, this product supports customizable flavors.","Học Viện Startorch khi phát triển sản phẩm mới cũng cân nhắc đến mùi vị, thực tế thì món này hỗ trợ tùy chỉnh hương vị."
lang_multi_text.db,MultiText,Kouweigailiang_4_5,为了适配“自定义”，在它没有被定义前，口感自然是无限趋近于……中性。,"To accommodate this ""customizability,"" it's only natural that the taste tends to be... neutral, before the flavor has been set.","Để phù hợp với tính năng ""tùy chỉnh"", khi chưa được định nghĩa, khẩu vị tự nhiên sẽ tiến đến vô hạn với... trung tính."
lang_multi_text.db,MultiText,Kouweigailiang_4_6,怪不得我什么味道都没尝出来……,No wonder I couldn't taste a thing...,Hèn gì tôi chẳng nếm ra mùi vị gì cả...
lang_multi_text.db,MultiText,Kouweigailiang_4_7,这个想法虽然不错，但实际落地的时候却遇到了一些问题。,"While on paper the idea may sound great, we've run into some snags in its implementation.","Ý tưởng này tuy không tồi, nhưng khi thực hiện thực tế lại gặp một số vấn đề."
lang_multi_text.db,MultiText,Kouweigailiang_4_8,嘻嘻果冻既然是作为方便食品推出，师生们选择它自然也是因为方便，比如利于在罗伊冰原这种环境恶劣的考察地食用。,"Since Squeezy Jelly was advertised as a convenience food, it's understandable that the faculty and students chose it for that very reason. The ready-to-eat feature during harsh expedition environments like the Roya Frostlands, for example.","Vì Thạch Hí Hí được tung ra như một loại thực phẩm tiện lợi, giảng viên và sinh viên chọn nó đương nhiên cũng vì sự tiện lợi, ví dụ như dễ ăn ở những nơi có môi trường khắc nghiệt như Băng Nguyên Roya."
lang_multi_text.db,MultiText,Kouweigailiang_4_9,这么一来，自然就没有额外定制口味的余裕和时间。“自定义”和“方便速食”本身的设计方向就有点冲突。,"So, as you can imagine, we ended up not having enough development time to implement a flavor. The design goals of ""customizability"" and ""convenience"" kind of go against each other.","Như vậy, tự nhiên sẽ không có thời gian và dư dả để tùy chỉnh hương vị thêm. Thiết kế ""tùy chỉnh"" và ""tiện lợi ăn liền"" bản thân nó đã hơi mâu thuẫn."
lang_multi_text.db,MultiText,Kouweigailiang_5_1,口味改良？嗨，只要不是现在那让人感觉在虚质无防护浸泡的味道都可以吧。,"Change of flavor? Heh, as long as it's not the current flavor that makes you feel like you're floating aimlessly inside the void, anything's fine.","Cải thiện hương vị? Hầy, miễn không phải cái vị như đang ngâm mình trần trụi trong Hư Chất như hiện tại là được."
lang_multi_text.db,MultiText,Kouweigailiang_5_2,实在要说的话……我想试试“今州烩”口味。,"But if I had to choose... I'd like to try a ""Jinzhou Stew"" flavor.","Nếu thực sự phải nói... tôi muốn thử vị ""Kim Châu Hội""."
lang_multi_text.db,MultiText,Kouweigailiang_5_3,这是我老家的美食，当初我在今州华胥研究院参观的时候，和那位首席研究员相里要一起吃过呢！,"That's a dish from my home. Back when I was visiting the Jinzhou Campus of Huaxu Academy, I had some with Principal Investigator Xiangli Yao!","Đó là món ngon quê tôi, hồi tôi đi tham quan Viện Nghiên Cứu Hoa Tư ở Kim Châu, tôi đã từng ăn cùng nhà nghiên cứu trưởng Xiangli Yao đấy!"
lang_multi_text.db,MultiText,Kouweigailiang_5_4,就是因为他，我才决定踏上科研之路的，所以那顿饭我到现在都记忆犹新。,It's all because of him that I set out on the path of scientific research. I still remember that meal like it was yesterday.,"Chính vì anh ấy mà tôi mới quyết định dấn thân vào con đường nghiên cứu khoa học, nên bữa ăn đó đến giờ tôi vẫn nhớ như in."
lang_multi_text.db,MultiText,Kouweigailiang_5_5,有肉有菜又热乎，出锅时再剪一把香柠草，啧啧，那个香！,"Piping hot meat and veggies, garnished with a sprinkle of Lemongrass. Mm-mmm! Sweet aroma!","Có thịt có rau lại nóng hổi, lúc ra lò cắt thêm nắm sả chanh, chậc chậc, thơm phức!"
lang_multi_text.db,MultiText,Kouweigailiang_6_1,口味……嗯……果冻这种东西，虽然食堂说是便携营养食品，但我总觉得它不该是这样的。,"A flavor? ... Hmm... You know, even though the cafeteria says the Jelly is convenient and nutrient-packed, I just don't think it should be presented the way it is now.","Hương vị... ừm... Thạch ấy mà, tuy nhà ăn nói là thực phẩm dinh dưỡng tiện lợi, nhưng tôi cứ thấy nó không nên như thế này."
lang_multi_text.db,MultiText,Kouweigailiang_6_2,通常来说，这种食品都是零食……对吧？,"Normally, food like this is called snacks... right?",Thông thường thì loại thực phẩm này đều là đồ ăn vặt... đúng không?
lang_multi_text.db,MultiText,Kouweigailiang_6_3,我想要“扁竹花花片”口味的果冻，那是我坐贡多拉去七丘看角斗时买过的竞技场小吃。,I want a Bamboo Iris Crisps-flavored Jelly. That's the arena snack I had when I rode a Gondola to Septimont to watch Gladiator tournaments.,"Tôi muốn thạch vị ""Bánh Hoa Biển Trúc"", đó là món ăn vặt ở đấu trường mà tôi từng mua khi đi thuyền Gondola đến Thất Khâu xem giác đấu."
lang_multi_text.db,MultiText,Kouweigailiang_6_4,我很喜欢那种酥酥脆脆又带着花香的味道……赶论文的时候吃点甜的，有利于心情愉快。,"I love that crispy, crunchy texture and flowery aroma... When I'm grinding for a paper, having something sweet helps keep me in a good mood.",Tôi rất thích cái vị giòn tan lại thoang thoảng hương hoa đó... Lúc chạy luận văn mà ăn chút đồ ngọt sẽ giúp tâm trạng vui vẻ hơn.
lang_multi_text.db,MultiText,Kouweigailiang_6_5,……我也好几年没回家了呢。听妈妈寄来的信件说，最近家乡发生了不少大事，真想回去看看。,"Plus, I haven't been home in years. From what I can tell from my mom's letters, a lot of things happened over there. I really wish I could go back for a visit.","...Tôi cũng mấy năm chưa về nhà rồi. Nghe thư mẹ gửi bảo dạo này quê nhà xảy ra nhiều chuyện lớn, thật muốn về thăm quá."
lang_multi_text.db,MultiText,Kouweigailiang_7_1,两种口味听起来都很好吃！{PlayerName}，你更喜欢哪种？,"Both of those flavors sound really delicious, {PlayerName}! Which one do you like better?","Hai vị nghe đều ngon cả! {PlayerName}, cậu thích loại nào hơn?"
lang_multi_text.db,MultiText,Kouweigailiang_7_2,听詹卢卡的意思，这周应该只能选一种口味作为改良方向……,"From what Gianluca said earlier, we can probably only choose one for this week...",Nghe ý của Gianluca thì tuần này chắc chỉ chọn được một vị để cải thiện thôi...
lang_multi_text.db,MultiText,Kouweigailiang_7_3,今州烩。,Jinzhou Stew.,Kim Châu Hội.
lang_multi_text.db,MultiText,Kouweigailiang_7_4,扁竹花花片。,Bamboo Iris Crisps.,Bánh Hoa Biển Trúc.
lang_multi_text.db,MultiText,Kouweigailiang_7_5,感觉是吃完会觉得饱腹感很强很满足的口味呢……那我们去找阿尔芭，问问她愿不愿意试试这个吧？,"Sounds like a satisfying flavor that'll make your belly full, doesn't it...? Let's go find Alba and ask her if she wants to give it a try!","Cảm giác là vị ăn xong sẽ thấy no bụng và thỏa mãn lắm đây... Vậy chúng ta đi tìm Alba, hỏi xem cô ấy có muốn thử cái này không nhé?"
lang_multi_text.db,MultiText,Kouweigailiang_7_6,嘿嘿，甜的……弥补了没吃到“罐装惊喜”的遗憾！那我们去找诚溪，问问他愿不愿意试试这个吧？,"Hee-hee, that's the sweet tooth talking right there... That'll make up for not getting a Canned Surprise! Let's go find Chengxi and ask him if he wants to give it a try!","Hì hì, đồ ngọt... bù đắp cho tiếc nuối không được ăn ""Lon Bất Ngờ""! Vậy chúng ta đi tìm Chengxi, hỏi xem cậu ấy có muốn thử cái này không nhé?"
lang_multi_text.db,MultiText,Kouweigailiang_8_1,“扁竹花花片”？我倒是没什么意见啦，我这人就喜欢尝鲜。,"Bamboo Iris Crisps? I don't have anything against it. Personally, I love trying out something novel.","""Bánh Hoa Biển Trúc""? Tôi thì không có ý kiến gì, tôi là người thích nếm thử cái mới."
lang_multi_text.db,MultiText,Kouweigailiang_8_2,不过，毕竟事关嘻嘻果冻的改造初印象，还是要为同学们把把关！,"Although, since this is about making a good first impression for the new-and-improved Squeezy Jelly, we should do our due diligence for the sake of our fellow students!","Nhưng mà, dù sao cũng liên quan đến ấn tượng đầu tiên về sự cải tạo Thạch Hí Hí, vẫn phải kiểm tra kỹ cho các bạn học!"
lang_multi_text.db,MultiText,Kouweigailiang_8_3,这样吧，你陪我玩一局《荣耀之丘》如何？,How about we play a game of Peaks of Prestige?,"Thế này đi, cậu chơi với tôi một ván ""Ngọn Đồi Vinh Quang"" nhé?"
lang_multi_text.db,MultiText,Kouweigailiang_8_4,我们边吃边玩。既然是往零食的方向改良，肯定能经得起决斗这种娱乐活动的陪伴考验吧！,"We'll snack as we duel. Since they want it to be more like a snack, I'm sure it'll go well with a fun activity like Peaks of Prestige!","Chúng ta vừa ăn vừa chơi. Đã là cải thiện theo hướng đồ ăn vặt, chắc chắn phải chịu được thử thách đồng hành cùng hoạt động giải trí như quyết đấu chứ!"
lang_multi_text.db,MultiText,Kouweigailiang_8_5,没问题。,No problem.,Không thành vấn đề.
lang_multi_text.db,MultiText,Kouweigailiang_8_6,可以但为什么要用决斗来决定啊！,"Sure, but why over a duel?!",Được thôi nhưng tại sao lại quyết định bằng quyết đấu chứ!
lang_multi_text.db,MultiText,Kouweigailiang_9_1,噢，原来是这种味道啊~的确是甜脆口的，感觉热量也不低。,"Oh, so this is what it tastes like... It sure is sweet and crispy. I bet it's got a high-calorie count as well.","Ồ, thì ra là vị này à~ Quả thực là ngọt giòn, cảm giác calo cũng không thấp."
lang_multi_text.db,MultiText,Kouweigailiang_9_2,让我尝到了新东西，多谢你！,Thanks for letting me taste something new!,"Được nếm món mới, cảm ơn cậu nhiều!"
lang_multi_text.db,MultiText,Kouweigailiang_9_3,当初我也是因为想要见识到更多的新理论新知识，才努力考来星炬学院的啊！,Expanding my intellectual horizons is the reason I got into Startorch Academy in the first place!,"Hồi đó tôi cũng vì muốn kiến thức thêm nhiều lý thuyết mới, tri thức mới nên mới nỗ lực thi vào Học Viện Startorch mà!"
lang_multi_text.db,MultiText,LGNCZSTBC_1_1,又回到了拉古那——这一成不变的街道，还有一成不变的风景……,"We're back in Ragunna again—the same old streets, the same old scenery... How boring.","Lại quay về Ragunna rồi... con phố bất biến này, còn cả phong cảnh bất biến này nữa..."
lang_multi_text.db,MultiText,LGNCZSTBC_1_2,同意。只有去过了黎乔利，才算是感受过世界的鲜活。,Agreed. Only after visiting Riccioli Islands can one truly feel the world's vibrancy.,Đồng ý. Chỉ khi đến đảo Riccioli mới coi là cảm nhận được sự sống động của thế giới.
lang_multi_text.db,MultiText,LGNCZSTBC_1_3,还有莉莉兰德的时装周，还有七丘角斗的热血沸腾……,"Then there's Lilyland Fashion Week, and the heart-pounding battles of Septimont...","Còn tuần lễ thời trang Lilyland, còn sự sôi sục nhiệt huyết của giác đấu Thất Khâu..."
lang_multi_text.db,MultiText,LGNCZSTBC_1_4,说得我又想逃离这里了，你说……我们接下来去哪里旅行好呢？,All this talk makes me crave another escape from our life here. So... where should we travel next?,"Nói làm tôi lại muốn trốn khỏi đây rồi, cô nói xem... tiếp theo chúng ta đi đâu du lịch thì hay?"
lang_multi_text.db,MultiText,LGNCZSTBC_2_1,哥哥，这并不是我想要的人生，我……,"But Nesta, this isn't the life I wanted, I...","Anh trai, đây đâu phải cuộc đời em muốn, em..."
