db_file,table_name,id,zh,en,vi
lang_multi_text.db,MultiText,DIY_RegionName_5,庭园,Garden,Sân Vườn
lang_multi_text.db,MultiText,DIY_RegionName_6,放映厅,Screening Room,Phòng Chiếu Phim
lang_multi_text.db,MultiText,DIY_RegionName_7,书房,Study,Thư Phòng
lang_multi_text.db,MultiText,DIY_RegionShiftWindow_Content,当前布置尚未保存，是否要在切换区域前进行保存？,You have not saved the current design. Save it before switching to another area?,"Bố trí hiện tại chưa được lưu, bạn có muốn lưu trước khi chuyển khu vực không?"
lang_multi_text.db,MultiText,DIY_RegionShiftWindow_Shift_Button,切换,Switch,Chuyển
lang_multi_text.db,MultiText,DIY_RegionShiftWindow_ShiftAndSave_Button,保存并切换,Save and Switch,Lưu và chuyển
lang_multi_text.db,MultiText,DIY_RegionShiftWindow_Title,切换区域,Switch Area,Chuyển khu vực
lang_multi_text.db,MultiText,DIY_RegionSlotState_Content,{0}/{1},{0}/{1},{0}/{1}
lang_multi_text.db,MultiText,DIY_RegionSlotState_Title,派对装潢,Party Decor,Trang Trí Tiệc
lang_multi_text.db,MultiText,DIY_RemoveBannedTips,此类型陈设不支持卸下，只可进行替换。,This type of decoration cannot be removed and can only be replaced.,"Loại nội thất này không hỗ trợ gỡ bỏ, chỉ có thể thay thế."
lang_multi_text.db,MultiText,DIY_RolePresentTip,完成任务<color=Highlight>{0}</color>，于霎那之书领取,Complete the quest <color=Highlight>{0}</color> accepted from the Book of Moments,"Hoàn thành nhiệm vụ <color=Highlight>{0}</color>, nhận tại Sách Khoảnh Khắc"
lang_multi_text.db,MultiText,DIY_Save_Button,保存当前布置,Save Design,Lưu bố trí hiện tại
lang_multi_text.db,MultiText,DIY_SaveSuccess_Tip,当前布置已保存,Current design saved,Đã lưu bố trí hiện tại
lang_multi_text.db,MultiText,DIY_Shop_Name,柯布·科波,Cobb Copo,Cobb Copo
lang_multi_text.db,MultiText,DIY_Shop_Talk,欢迎来到魔术陈设商店。,Welcome to the Magical Decor Shop.,Chào mừng đến với cửa hàng nội thất ma thuật.
lang_multi_text.db,MultiText,DIY_Shop_Title,陈设采购,Decor Shop,Mua Sắm Nội Thất
lang_multi_text.db,MultiText,DIY_ShopItem_Window_LackMoney_Tip,银河古币不足,Insufficient Starfall Coins,Không đủ Xu Ngân Hà
lang_multi_text.db,MultiText,DIY_ShopItem_Window_Title,陈设详情,Decor Details,Chi tiết nội thất
lang_multi_text.db,MultiText,DIY_Stair_Button_1F,1F,1F,1F
lang_multi_text.db,MultiText,DIY_Stair_Button_2F,2F,2F,2F
lang_multi_text.db,MultiText,DontHaveRole,未拥有共鸣者,Resonator not unlocked,Chưa sở hữu Cộng Hưởng Giả
lang_multi_text.db,MultiText,Double_reward_tips_02,今日剩余双倍奖励次数：,Double Drop Chances Today:,Số lần nhận thưởng gấp đôi còn lại hôm nay:
lang_multi_text.db,MultiText,Download_ChangeSexVideoDesc,"切换漂泊者时需要使用的资源。请在下载完成后再进行切换。

支持边玩边下载，下载完成后将会有系统提示。","Switching Rover's appearance requires this resource. Please finish downloading before switching.

You may continue playing the game while downloading. A prompt will appear once downloading is finished.","Tài nguyên cần thiết để chuyển đổi Lữ Khách. Vui lòng thực hiện chuyển đổi sau khi tải xuống hoàn tất.

Hỗ trợ vừa chơi vừa tải, sau khi tải xong sẽ có thông báo hệ thống."
lang_multi_text.db,MultiText,Download_ChangeSexVideoTag,漂泊者切换资源,Resources to Switch Rover's Appearance,Tài nguyên chuyển đổi Lữ Khách
lang_multi_text.db,MultiText,Download_ChangeSexVideoTitle,漂泊者切换资源,Resources to Switch Rover's Appearance,Tài nguyên chuyển đổi Lữ Khách
lang_multi_text.db,MultiText,Download_RemainingVideoDesc,"检测到后续任务的剧情资源未下载完全，是否选择下载完整内容？

支持边玩边下载，下载完成后将会有系统提示。","Quest resources for the later storyline have only been partially downloaded. Do you want to finish downloading them? 

You may continue playing the game while downloading. A prompt will appear once downloading is finished.","Phát hiện tài nguyên cốt truyện của nhiệm vụ tiếp theo chưa được tải đầy đủ, bạn có muốn tải nội dung hoàn chỉnh không?

Hỗ trợ vừa chơi vừa tải, sau khi tải xong sẽ có thông báo hệ thống."
lang_multi_text.db,MultiText,Download_RemainingVideoTag,后续剧情资源,Later Storyline Resources,Tài nguyên cốt truyện tiếp theo
lang_multi_text.db,MultiText,Download_RemainingVideoTitle,后续剧情资源,Later Storyline Resources,Tài nguyên cốt truyện tiếp theo
lang_multi_text.db,MultiText,DownloadBeforeTask,下载缺失资源以继续推进,Download story assets to continue,Tải xuống tài nguyên còn thiếu để tiếp tục
lang_multi_text.db,MultiText,DownLoadButton_Cancel,取消下载,Cancel,Hủy tải xuống
lang_multi_text.db,MultiText,DownLoadButton_Continue,继续下载,Resume,Tiếp tục tải
lang_multi_text.db,MultiText,DownLoadButton_Down,下载,Download,Tải xuống
lang_multi_text.db,MultiText,DownLoadButton_Pause,暂停,Pause,Tạm dừng
lang_multi_text.db,MultiText,DownloadCompletedTip1,后续剧情资源下载完成，可继续推进剧情,Story resources download complete. You may now proceed with the story.,"Đã tải xong tài nguyên cốt truyện tiếp theo, có thể tiếp tục tiến hành cốt truyện"
lang_multi_text.db,MultiText,DownloadCompletedTip2,漂泊者切换资源下载完成，可前往切换漂泊者,Alternative Rover Appearance resources download complete. You may now switch Rover Appearance.,"Đã tải xong tài nguyên chuyển đổi Lữ Khách, có thể tiến hành chuyển đổi Lữ Khách"
lang_multi_text.db,MultiText,DownloadResource,下载缺失资源以继续推进,Download missing assets to proceed,Tải xuống tài nguyên còn thiếu để tiếp tục
lang_multi_text.db,MultiText,DownLoadText_Downing,下载中,Downloading,Đang tải
lang_multi_text.db,MultiText,DownLoadText_LeftSpace,剩余空间：{0},Storage space available: {0},Dung lượng còn lại: {0}
lang_multi_text.db,MultiText,DownLoadText_NeedSpace,所需空间：{0},Storage space required: {0},Dung lượng cần thiết: {0}
lang_multi_text.db,MultiText,DownLoadText_Pause,暂停中,Pausing,Đang tạm dừng
lang_multi_text.db,MultiText,DownLoadTips_Done,资源下载完成，请打开任务界面推进剧情,Resources downloaded. Please open the Quest list to proceed with the story,"Tài nguyên đã tải xong, vui lòng mở giao diện nhiệm vụ để tiếp tục cốt truyện"
lang_multi_text.db,MultiText,DownLoadTips_Downing,资源正在下载中，弹窗入口已缩略到主界面,Downloading resources. Access the download window again in the main interface,"Tài nguyên đang được tải xuống, cửa sổ đã được thu nhỏ về giao diện chính"
lang_multi_text.db,MultiText,DownLoadTips_NotEnough,设备空间不足，请清理空间后重新尝试,Insufficient storage space. Please clear up some space and try again.,"Dung lượng thiết bị không đủ, vui lòng dọn dẹp bộ nhớ và thử lại"
lang_multi_text.db,MultiText,DownLoadTips_OtherDown,请等待其他资源下载完成后再尝试,Please wait until the download of the current resource is completed and try again.,Vui lòng đợi các tài nguyên khác tải xong rồi thử lại
lang_multi_text.db,MultiText,DownLoadTips_WaitDownDone,请等待当前资源下载完成后再重试,Please wait for the download of the current resource to complete,Vui lòng đợi tài nguyên hiện tại tải xong rồi thử lại
lang_multi_text.db,MultiText,DownLoadTips_WaitOtherDown,等待其他资源下载,Waiting on other resources in the download queue,Đợi tải tài nguyên khác
lang_multi_text.db,MultiText,DownShopItem,下架：,Available Until:,Ngừng bán:
lang_multi_text.db,MultiText,Dream_Cat_Challenge_Reward,通关奖励,Stage Rewards,Thưởng Vượt Ải
lang_multi_text.db,MultiText,Dream_Cat_Integral_Reward,积分奖励,Point Rewards,Thưởng Điểm
lang_multi_text.db,MultiText,Dream_Challenge_Locked,未解锁,Locked,Chưa mở khóa
lang_multi_text.db,MultiText,Dream_Task_Title01,失序梦途,Somnium Labyrinth,Đường Mộng Hỗn Loạn
lang_multi_text.db,MultiText,Dream_Task_Title02,深梦历程,Dreamscape Odyssey,Hành Trình Mộng Sâu
lang_multi_text.db,MultiText,Dream_Task_Title03,异梦封锁,Rift Runner,Dị Mộng Phong Tỏa
lang_multi_text.db,MultiText,Dream_Task_Title04,永夜重现,Nightmare Revisits,Đêm Trường Tái Hiện
lang_multi_text.db,MultiText,DreamCat_Title,心之集域,Somnoire,Vùng Tập Hợp Tâm Trí
lang_multi_text.db,MultiText,DreamLink_Reward_Ins_Progress,<color=#56e2e7>{0}</color>/{1},<color=#56e2e7>{0}</color>/{1},<color=#56e2e7>{0}</color>/{1}
lang_multi_text.db,MultiText,DreamLinkDungeonLock,未明晰的梦,Undefined Dream,Giấc Mơ Chưa Rõ
lang_multi_text.db,MultiText,DreamLinkDungeonUnlockTips,继续推进任务「暗夜叩响白昼之门」以解锁,"Proceed with ""When the Night Knocks"" to unlock","Tiếp tục làm nhiệm vụ ""Đêm Đen Gõ Cửa Ban Ngày"" để mở khóa"
lang_multi_text.db,MultiText,DreamLinkWhiteCatSettlePanel_RecordTitle,挑战得分,Challenge Score,Điểm Thử Thách
lang_multi_text.db,MultiText,DreamLinkWhiteCatSettleView_LifeScore,深梦电话完整度积分,Dreamscape Telephone Integrity Points,Điểm Độ Bền Điện Thoại Mộng Sâu
lang_multi_text.db,MultiText,DreamLinkWhiteCatSettleView_PassTime,消耗时间,Time Consumed,Thời Gian Tiêu Hao
lang_multi_text.db,MultiText,DreamLinkWhiteCatSettleView_StepScore,怪物击杀积分,Monster Points,Điểm Hạ Gục Quái
lang_multi_text.db,MultiText,DreamLinkWhiteCatSettleView_TimeScore,剩余时间积分,Time Points,Điểm Thời Gian Còn Lại
lang_multi_text.db,MultiText,DreamLinkWorldRun_1_Desc,梦魇入侵了世界，在多个区域侵扰现实。漂泊者需前往各个区域，利用白猫给予的能力【盈梦速行】来解除异常。,"Nightmares have torn through the veil of reality, wreaking havoc across the world. It's down to you to restore the crumbling order to the land, with the mystic boon of Illusive Sprint received from the strange white cat.","Ác mộng đã xâm chiếm thế giới, quấy nhiễu thực tại ở nhiều khu vực. Lữ Khách cần đi đến các khu vực, sử dụng năng lực [Mộng Tốc Doanh] do mèo trắng ban tặng để giải trừ dị thường."
lang_multi_text.db,MultiText,DreamLinkWorldRun_1_Name,异梦封锁-Ⅰ,Rift Runner I,Dị Mộng Phong Tỏa - I
lang_multi_text.db,MultiText,DreamLinkWorldRun_1_Title,Ⅰ,I,I
lang_multi_text.db,MultiText,DreamLinkWorldRun_2_Desc,梦魇入侵了世界，在多个区域侵扰现实。漂泊者需前往各个区域，利用白猫给予的能力【盈梦速行】来解除异常。,"Nightmares have torn through the veil of reality, wreaking havoc across the world. It's down to you to restore the crumbling order to the land, with the mystic boon of Illusive Sprint received from the strange white cat.","Ác mộng đã xâm chiếm thế giới, quấy nhiễu thực tại ở nhiều khu vực. Lữ Khách cần đi đến các khu vực, sử dụng năng lực [Mộng Tốc Doanh] do mèo trắng ban tặng để giải trừ dị thường."
lang_multi_text.db,MultiText,DreamLinkWorldRun_2_Name,异梦封锁-Ⅱ,Rift Runner II,Dị Mộng Phong Tỏa - II
lang_multi_text.db,MultiText,DreamLinkWorldRun_2_Title,Ⅱ,II,II
lang_multi_text.db,MultiText,DreamLinkWorldRun_3_Desc,"梦魇入侵了世界，在多个区域侵扰现实。漂泊者需前往各个区域，利用白猫给予的能力【盈梦速行】来解除异常。
<color=#c25757>完成潮汐任务「风消雪霁」后解锁。</color>","Nightmares have torn through the veil of reality, wreaking havoc across the world. It's down to you to restore the crumbling order to the land, with the mystic boon of Illusive Sprint received from the strange white cat.
<color=#c25757>Complete Main Quest ""When the Snow Clears"" to unlock the event.</color>","Ác mộng đã xâm chiếm thế giới, quấy nhiễu thực tại ở nhiều khu vực. Lữ Khách cần đi đến các khu vực, sử dụng năng lực [Mộng Tốc Doanh] do mèo trắng ban tặng để giải trừ dị thường.
<color=#c25757>Mở khóa sau khi hoàn thành nhiệm vụ Minh Triều ""Gió Ngừng Tuyết Tạnh"".</color>"
lang_multi_text.db,MultiText,DreamLinkWorldRun_3_Name,异梦封锁-Ⅲ,Rift Runner III,Dị Mộng Phong Tỏa - III
lang_multi_text.db,MultiText,DreamLinkWorldRun_3_Title,Ⅲ,III,III
lang_multi_text.db,MultiText,DreamLinkWorldRun_4_Desc,"梦魇入侵了世界，在多个区域侵扰现实。漂泊者需前往各个区域，利用白猫给予的能力【盈梦速行】来解除异常。
<color=#c25757>完成潮汐任务「来自毁灭的回声」后解锁。</color>","Nightmares have torn through the veil of reality, wreaking havoc across the world. It's down to you to restore the crumbling order to the land, with the mystic boon of Illusive Sprint received from the strange white cat.
<color=#c25757>Complete Main Quest ""From the Echoes of Destruction"" to unlock the event.</color>","Ác mộng đã xâm chiếm thế giới, quấy nhiễu thực tại ở nhiều khu vực. Lữ Khách cần đi đến các khu vực, sử dụng năng lực [Mộng Tốc Doanh] do mèo trắng ban tặng để giải trừ dị thường.
<color=#c25757>Mở khóa sau khi hoàn thành nhiệm vụ Minh Triều ""Tiếng Vọng Từ Hủy Diệt"".</color>"
lang_multi_text.db,MultiText,DreamLinkWorldRun_4_Name,异梦封锁-Ⅳ,Rift Runner IV,Dị Mộng Phong Tỏa - IV
lang_multi_text.db,MultiText,DreamLinkWorldRun_4_Title,Ⅳ,IV,IV
lang_multi_text.db,MultiText,DreamLinkWorldRun_5_Desc,梦魇入侵了世界，在多个区域侵扰现实。漂泊者需前往各个区域，利用白猫给予的能力【盈梦速行】来解除异常。,"Nightmares have torn through the veil of reality, wreaking havoc across the world. It's down to you to restore the crumbling order to the land, with the mystic boon of Illusive Sprint received from the strange white cat.","Ác mộng đã xâm chiếm thế giới, quấy nhiễu thực tại ở nhiều khu vực. Lữ Khách cần đi đến các khu vực, sử dụng năng lực [Mộng Tốc Doanh] do mèo trắng ban tặng để giải trừ dị thường."
lang_multi_text.db,MultiText,DreamLinkWorldRun_5_Name,异梦封锁-Ⅴ,Rift Runner V,Dị Mộng Phong Tỏa - V
lang_multi_text.db,MultiText,DreamLinkWorldRun_5_Title,Ⅴ,V,V
lang_multi_text.db,MultiText,DreamLinkWorldRun_6_Desc,梦魇入侵了世界，在多个区域侵扰现实。漂泊者需前往各个区域，利用白猫给予的能力【盈梦速行】来解除异常。,"Nightmares have torn through the veil of reality, wreaking havoc across the world. It's down to you to restore the crumbling order to the land, with the mystic boon of Illusive Sprint received from the strange white cat.","Ác mộng đã xâm chiếm thế giới, quấy nhiễu thực tại ở nhiều khu vực. Lữ Khách cần đi đến các khu vực, sử dụng năng lực [Mộng Tốc Doanh] do mèo trắng ban tặng để giải trừ dị thường."
lang_multi_text.db,MultiText,DreamLinkWorldRun_6_Name,异梦封锁-Ⅵ,Rift Runner VI,Dị Mộng Phong Tỏa - VI
lang_multi_text.db,MultiText,DreamLinkWorldRun_6_Title,Ⅵ,VI,VI
lang_multi_text.db,MultiText,DreamLinkWorldRun_7_Desc,梦魇入侵了世界，在多个区域侵扰现实。漂泊者需前往各个区域，利用白猫给予的能力【盈梦速行】来解除异常。,"Nightmares have torn through the veil of reality, wreaking havoc across the world. It's down to you to restore the crumbling order to the land, with the mystic boon of Illusive Sprint received from the strange white cat.","Ác mộng đã xâm chiếm thế giới, quấy nhiễu thực tại ở nhiều khu vực. Lữ Khách cần đi đến các khu vực, sử dụng năng lực [Mộng Tốc Doanh] do mèo trắng ban tặng để giải trừ dị thường."
lang_multi_text.db,MultiText,DreamLinkWorldRun_7_Name,异梦封锁-Ⅶ,Rift Runner VII,Dị Mộng Phong Tỏa - VII
lang_multi_text.db,MultiText,DreamLinkWorldRun_7_Title,Ⅶ,VII,VII
lang_multi_text.db,MultiText,DreamLinkWorldRunLockText,{0},{0},{0}
lang_multi_text.db,MultiText,DRINKS_AnotherNeed_01,使用橄榄制成的果汁,Use Olive Juice,Nước ép làm từ ô liu
lang_multi_text.db,MultiText,DRINKS_AnotherNeed_02,使用青枝果制成的果粒,Use Viscum Berry Bits,Hạt trái cây làm từ Quả Tầm Gửi
lang_multi_text.db,MultiText,DRINKS_AnotherNeed_03,具有柠果香气的香草,Use Lemongrass,Thảo mộc có hương chanh
lang_multi_text.db,MultiText,DRINKS_AnotherNeed_04,使用青枝果制成的果粒,Use Viscum Berry Bits,Hạt trái cây làm từ Quả Tầm Gửi
lang_multi_text.db,MultiText,DRINKS_AnotherNeed_05,红色的小型浆果,Red small berries,Quả mọng nhỏ màu đỏ
lang_multi_text.db,MultiText,DRINKS_AnotherNeed_06,切开的新鲜橙果,Freshly sliced orange,Cam tươi cắt lát
lang_multi_text.db,MultiText,DRINKS_AnotherNeed_07,拉海洛特产植物饮品,Lahai-Roi specialty plant-based drink,Thức uống thực vật đặc sản Lahai-Roi
lang_multi_text.db,MultiText,DRINKS_AnotherNeed_08,巧克力味的棉花糖,Chocolate-flavored marshmallow,Kẹo dẻo vị sô-cô-la
lang_multi_text.db,MultiText,DRINKS_AnotherNeed_09,磨碎的曲奇,Crushed cookies,Bánh quy nghiền vụn
lang_multi_text.db,MultiText,DRINKS_AnotherNeed_10,略带苦味的坚果,Slightly bitter nuts,Các loại hạt có vị hơi đắng
lang_multi_text.db,MultiText,Drinks_Button_First,发起邀约,Invite,Gửi lời mời
lang_multi_text.db,MultiText,Drinks_Button_Next,再次邀约,Invite Again,Mời lần nữa
lang_multi_text.db,MultiText,Drinks_ConfirmBox_hit,只能添加2种配料,You can only add up to 2 Add-ins,Chỉ có thể thêm 2 loại nguyên liệu phụ
lang_multi_text.db,MultiText,DRINKS_DrinkBase_Desc_101,以发酵工艺加工的茶叶。在传入黎那汐塔后，它成为了一种相当经典的饮料。,"Tea leaves fully fermented to develop a deep, robust aroma. Since its introduction to Rinascita, it has become a timeless classic.","Lá trà được chế biến bằng công nghệ lên men. Sau khi du nhập vào Rinascita, nó đã trở thành một loại đồ uống vô cùng kinh điển."
lang_multi_text.db,MultiText,DRINKS_DrinkBase_Desc_102,在茶叶中加入薄荷制成的冰茶，口感冰凉清爽。,Tea infused with fresh mint. Chilly and wonderfully refreshing.,"Trà đá được pha chế bằng cách thêm bạc hà vào lá trà, mang lại cảm giác mát lạnh sảng khoái."
