db_file,table_name,id,zh,en,vi
lang_multi_text.db,MultiText,Character_ZheZhi_10_29,老、老板！我们今天来是想问问那个奇画师传闻。,"W-wait, Mr. Shilang! We're actually here today to talk about the tale of the Arcane Artist.","Ông, ông chủ! Hôm nay chúng tôi đến là muốn hỏi về lời đồn Kỳ Họa Sư kia."
lang_multi_text.db,MultiText,Character_ZheZhi_10_3,我们追月节见过几面。,We met during the Moon-Chasing Festival.,Chúng tôi từng gặp nhau vài lần ở Lễ Hội Truy Nguyệt.
lang_multi_text.db,MultiText,Character_ZheZhi_10_34,哦，这件事啊。我听说了，但是还没有亲身遇到。,"Oh, I know the tale, but I've never come across this mystical maestro myself.","Ồ, chuyện này à. Tôi có nghe nói, nhưng vẫn chưa tận mắt gặp."
lang_multi_text.db,MultiText,Character_ZheZhi_10_37,不过…按理说如果真的出现了这种人，我应该认识才对。,"If such an artist truly existed, I'd be the first to know, without a doubt!","Tuy nhiên... theo lý mà nói nếu thực sự xuất hiện người như vậy, tôi phải biết mới đúng."
lang_multi_text.db,MultiText,Character_ZheZhi_10_38,那最近来买颜料的人有没有异常？,Anything suspicious about the pigment buyers?,Vậy gần đây những người đến mua màu vẽ có gì bất thường không?
lang_multi_text.db,MultiText,Character_ZheZhi_10_39,最近……颜料销量一般，而且买家都是熟人，没什么异常。,"Hmm... pigments aren't flying off the shelves these days. Just a few regulars, you know?","Gần đây... lượng tiêu thụ màu vẽ bình thường, hơn nữa người mua đều là người quen, không có gì bất thường cả."
lang_multi_text.db,MultiText,Character_ZheZhi_10_4,但是还一直没有机会正式认识……,But I've never had the chance to introduce myself properly...,Nhưng vẫn chưa có cơ hội làm quen chính thức...
lang_multi_text.db,MultiText,Character_ZheZhi_10_40,前段时间，有几个人来我这里大量购入矿石，但是却只买最便宜的边角料，还要我对他们来这里买东西的事保密……,They bought heaps of leftover ore—the cheapest type—and told me not to let anyone know they got the ore here.,"Thời gian trước, có mấy người đến chỗ tôi mua số lượng lớn khoáng thạch, nhưng lại chỉ mua những loại vụn vặt rẻ tiền nhất, còn bắt tôi phải giữ bí mật chuyện họ đến đây mua đồ..."
lang_multi_text.db,MultiText,Character_ZheZhi_10_41,从来没有人会要那种东西的……哎，不对，很久之前折枝来买过一次。,"People don't usually buy that stuff. Oh wait, Zhezhi, didn't you buy some once? A long time ago, right?","Chưa từng có ai cần những thứ đó cả... à, không đúng, rất lâu trước đây Chiết Chi từng đến mua một lần."
lang_multi_text.db,MultiText,Character_ZheZhi_10_42,当时你好像是因为手头比较紧，日常练习就只好用自制颜料凑合了一段时间，对吧？,"I remember you saying you couldn't afford the fancy pigments, so you made your own. That stuck with me.","Lúc đó hình như vì cô túng thiếu, nên luyện tập hàng ngày đành phải dùng màu tự chế để dùng tạm một thời gian, đúng không?"
lang_multi_text.db,MultiText,Character_ZheZhi_10_43,这件事让我印象颇深，所以后来这些人来买我也多加留意了。,"So when those guys asked for leftovers, I paid extra attention.","Chuyện này khiến tôi ấn tượng khá sâu sắc, nên sau này những người đó đến mua tôi cũng lưu ý hơn."
lang_multi_text.db,MultiText,Character_ZheZhi_10_44,要保密的话，现在告诉我们会不会……,Are you sure you can tell us this? I thought they asked you to keep it a secret...,"Muốn giữ bí mật, vậy bây giờ nói cho chúng tôi biết liệu có..."
lang_multi_text.db,MultiText,Character_ZheZhi_10_45,后来，我发现这些人晚上会来偷矿石，所以就向巡尉报了案。从那以后，我就再也没和他们交易过了。,"Pft, they turned out to be thieves who stole from me during the night! When I found out, I reported the theft to the Patrollers and that was the end of it.","Sau đó, tôi phát hiện những người này ban đêm sẽ đến trộm khoáng thạch, nên đã báo án với Tuần Úy. Từ đó về sau, tôi không còn giao dịch với họ nữa."
lang_multi_text.db,MultiText,Character_ZheZhi_10_46,我们可以看看他们的购买记录吗？,May I have a look at your transaction record?,Chúng tôi có thể xem lịch sử mua hàng của họ không?
lang_multi_text.db,MultiText,Character_ZheZhi_10_47,当然可以，尽管看。,Of course. Help yourself.,"Tất nhiên là được, cứ xem thoải mái."
lang_multi_text.db,MultiText,Character_ZheZhi_10_48,我也算是颜料公司的老供应商了，所以我的店铺里也会帮他们出售颜料。今州的画师很多都来我这里买颜料的。,"I supply ore to pigment manufacturers, and sometimes serve as their sales proxy, so most painters in Jinzhou come to my shop to buy pigments.","Tôi cũng được coi là nhà cung cấp lâu năm của công ty màu vẽ, nên cửa hàng của tôi cũng giúp họ bán màu vẽ. Họa sĩ ở Kim Châu rất nhiều người đến chỗ tôi mua màu vẽ đấy."
lang_multi_text.db,MultiText,Character_ZheZhi_10_49,没，还没有……,"N-no, not yet...","Không, vẫn chưa..."
lang_multi_text.db,MultiText,Character_ZheZhi_10_5,那现在就是好时机呀。折枝的性格我还是了解一些的，她呀，努力迈出一步的勇气刚刚冒出来就会缩回去。,"Great moment for it! Here's the thing, Rover. I can't say I know Zhezhi very well, but I do know she's got this quirk where her courage tends to crumble right when it's crunchtime.","Vậy bây giờ là thời cơ tốt đấy. Tính cách của Chiết Chi tôi vẫn hiểu một chút, cô ấy ấy mà, dũng khí cố gắng bước ra một bước vừa mới nhen nhóm lên là sẽ rụt lại ngay."
lang_multi_text.db,MultiText,Character_ZheZhi_10_50,现在，我们已经是朋友了。,We're already friends.,"Bây giờ, chúng tôi đã là bạn rồi."
lang_multi_text.db,MultiText,Character_ZheZhi_10_51,为什么这么说？,What makes you say that?,Tại sao lại nói vậy?
lang_multi_text.db,MultiText,Character_ZheZhi_10_52,不过……买矿石的人倒是有点奇怪。,"Oh... but those ore buyers from a while back, they seemed a bit suspicious.",Nhưng mà... những người mua khoáng thạch lại có chút kỳ lạ.
lang_multi_text.db,MultiText,Character_ZheZhi_10_53,他们做出这种事，我也没必要对他们保持尊重。,Thieves don't deserve my business or respect.,"Họ đã làm ra chuyện như vậy, tôi cũng không cần thiết phải giữ sự tôn trọng với họ."
lang_multi_text.db,MultiText,Character_ZheZhi_10_54,折枝？折枝？,Hello? Zhezhi?,Chiết Chi? Chiết Chi?
lang_multi_text.db,MultiText,Character_ZheZhi_10_55,在矿石商人石琅的鼓励下，折枝勇敢说出她想成为你的朋友。你的欣然应允让她非常开心。这时听到石琅的调侃，折枝尴尬地很快转移话题，询问起画师的事情。在石琅口中，二人得知，近期有奇怪的人购买了大量矿石边角料，并偷走了大量矿石。二人在石琅处查看了矿石交易记录。,"With the merchant Shilang's encouragement, Zhezhi drums up the courage to ask to be your friend and is relieved by your response. To shift the conversation away from Shilang's friendly teasing, she mentions the Arcane Artist. You learn that some suspicious individuals had purchased heaps of leftover ore and even stole from Shilang at night. To confirm the details, you check Shilang's transaction records.","Dưới sự khích lệ của thương nhân khoáng thạch Thạch Lang, Chiết Chi dũng cảm nói ra việc cô ấy muốn trở thành bạn của bạn. Sự đồng ý vui vẻ của bạn khiến cô ấy rất vui. Lúc này nghe Thạch Lang trêu chọc, Chiết Chi ngại ngùng nhanh chóng chuyển chủ đề, hỏi thăm về chuyện họa sĩ. Qua lời kể của Thạch Lang, hai người biết được gần đây có người kỳ lạ mua số lượng lớn khoáng thạch vụn vặt và trộm đi rất nhiều khoáng thạch. Hai người đã xem lịch sử giao dịch khoáng thạch tại chỗ Thạch Lang."
lang_multi_text.db,MultiText,Character_ZheZhi_10_6,说不定她在说出刚才那句话之前，已经想过无数次要去主动找你相识的场景了。,"So, when it comes to introducing herself to you, I'd bet money on it she's been mentally rehearsing it for forever before she got the guts to take action.","Biết đâu trước khi nói ra câu vừa rồi, cô ấy đã tưởng tượng vô số lần cảnh chủ động tìm bạn làm quen rồi ấy chứ."
lang_multi_text.db,MultiText,Character_ZheZhi_10_7,不不，没有。,"No, it's not like that!","Không không, không có đâu."
lang_multi_text.db,MultiText,Character_ZheZhi_10_8,折枝，这次可不要再等下去了，有句话说得好：不要总是逃避，自己不主动的话，什么也不会改变的！不要留下遗憾！,"Zhezhi, you can't keep avoiding things! You've got to take action, or you'll never get what you want! You only live once, right?!","Chiết Chi, lần này đừng đợi nữa, có câu nói rất hay: Đừng luôn trốn tránh, bản thân không chủ động thì sẽ chẳng có gì thay đổi đâu! Đừng để lại tiếc nuối!"
lang_multi_text.db,MultiText,Character_ZheZhi_10_9,也…有些道理……,That does make sense.,Cũng... có lý...
lang_multi_text.db,MultiText,Character_ZheZhi_12_1,这么看起来……,If this is the situation...,Nhìn thế này thì...
lang_multi_text.db,MultiText,Character_ZheZhi_12_17,呃…但我们在查…我……好。,Uh... but we're still investig— I... O-okay.,Ơ... nhưng chúng tôi đang điều tra... tôi... được.
lang_multi_text.db,MultiText,Character_ZheZhi_12_19,现在去没问题吗？,Are you sure we can go now?,Bây giờ đi có ổn không?
lang_multi_text.db,MultiText,Character_ZheZhi_12_2,咦？{PlayerName}？{PlayerName}！,Hmm? {PlayerName}? Hey! {PlayerName}!,Hả? {PlayerName}? {PlayerName}!
lang_multi_text.db,MultiText,Character_ZheZhi_12_20,什么事情？你们是在调查什么案子吗？,Investigate? About what? A new case?,Chuyện gì thế? Các bạn đang điều tra vụ án gì sao?
lang_multi_text.db,MultiText,Character_ZheZhi_12_21,我们在查奇画师的传闻。,"Yes, about the Arcane Artist tale.",Chúng tôi đang điều tra lời đồn về Kỳ Họa Sư.
lang_multi_text.db,MultiText,Character_ZheZhi_12_22,原来如此！那现在确实不是回城聚会的好时机。,"Oh, I get it! In that case, it's probably not the best time for a get-together.",Ra là vậy! Thế thì bây giờ đúng là không phải lúc thích hợp để về thành phố tụ tập rồi.
lang_multi_text.db,MultiText,Character_ZheZhi_12_23,抱歉……,Sorry...,Xin lỗi...
lang_multi_text.db,MultiText,Character_ZheZhi_12_25,不过，炽霞你为什么也在这？,"Thanks. But why are you here, Chixia?","Có điều, Xích Hà sao cô cũng ở đây?"
lang_multi_text.db,MultiText,Character_ZheZhi_12_26,这个啊！是因为不久前矿场出现了残象伤人事件，附近巡尉人手不够，我就过来帮忙啦！,"I'm here to support the Patrollers. There was an assault near the mine recently, and they're short on people to investigate.","Cái này à! Là vì cách đây không lâu ở mỏ khoáng xuất hiện sự việc Tàn Tượng tấn công người, Tuần Úy gần đây không đủ nhân lực, nên tôi qua đây giúp đỡ!"
lang_multi_text.db,MultiText,Character_ZheZhi_12_27,不过我们来了之后残象就没动静了，所以只能先从目击者口中了解情况，具体缘由还在调查中。,"What's odd is those monsters haven't caused any more trouble since we got here. Right now, we're talking to witnesses and trying to figure out what triggered the incident.","Nhưng sau khi bọn tôi đến thì Tàn Tượng lại không có động tĩnh gì nữa, nên chỉ đành tìm hiểu tình hình qua nhân chứng trước, nguyên do cụ thể vẫn đang điều tra."
lang_multi_text.db,MultiText,Character_ZheZhi_12_28,那边出什么事了吗……,Did something just happen over there...,Đằng kia xảy ra chuyện gì sao...
lang_multi_text.db,MultiText,Character_ZheZhi_12_29,不会这么巧吧。等等，我收到了信息……好像出现了新的残象异动，我先去确认一下！,"Don't tell me it's a Tacet Discord... Hold on, just got a message... Seems like they really are stirring up trouble again. Sorry, but I gotta go check this out!","Không trùng hợp vậy chứ. Khoan đã, tôi nhận được tin nhắn... hình như xuất hiện biến động Tàn Tượng mới, tôi đi xác nhận trước đây!"
lang_multi_text.db,MultiText,Character_ZheZhi_12_3,你怎么在这里？我们很久没见了吧！最近巡宁所太忙了，我都没时间和你们见面。,"What brings you here? It's been ages since we last met! The Patrol Station's been pretty busy lately, so I haven't had the time to catch up with you.","Sao bạn lại ở đây? Chúng ta lâu rồi không gặp nhỉ! Gần đây Sở Tuần Ninh bận quá, tôi chẳng có thời gian gặp các bạn."
lang_multi_text.db,MultiText,Character_ZheZhi_12_30,我们也去。,We'll go with you.,Chúng tôi cũng đi.
lang_multi_text.db,MultiText,Character_ZheZhi_12_32,我、我们也去？,S-should we go as well?,"Chúng, chúng tôi cũng đi?"
lang_multi_text.db,MultiText,Character_ZheZhi_12_33,诶？你还好吧？看起来脸色有点差……需要帮忙吗？,Oh? Are you alright? You don't look well... Do you need help?,Hả? Bạn vẫn ổn chứ? Sắc mặt trông hơi tệ... cần giúp đỡ không?
lang_multi_text.db,MultiText,Character_ZheZhi_12_34,哎？择日不如撞日，你要回城吗？不如和我一起吧？,"Wait, how bout' coming to the station with me today? Are you heading back to the city?","Ơ? Chọn ngày không bằng gặp ngày, bạn muốn về thành phố không? Hay là đi cùng tôi đi?"
lang_multi_text.db,MultiText,Character_ZheZhi_12_35,等等，事情还没查清。,"Wait, we have a case to investigate.","Khoan đã, sự việc vẫn chưa điều tra rõ."
lang_multi_text.db,MultiText,Character_ZheZhi_12_36,嗯？是有什么不方便吗？,"Oh, is this not a good time?",Hả? Có gì bất tiện sao?
lang_multi_text.db,MultiText,Character_ZheZhi_12_37,没关系啦。对了，要是需要帮忙的话，就尽管来找我！,That's okay! Just tell me if you need any help!,"Không sao đâu. Đúng rồi, nếu cần giúp đỡ thì cứ tìm tôi nhé!"
lang_multi_text.db,MultiText,Character_ZheZhi_12_38,或许和我们要查的事情有关。,Why not? Maybe we'll find some clues useful to our case.,Có lẽ liên quan đến chuyện chúng ta đang điều tra.
lang_multi_text.db,MultiText,Character_ZheZhi_12_39,有道理。但还有件事……,"You could be right, but there's one other thing...",Có lý. Nhưng còn một chuyện...
lang_multi_text.db,MultiText,Character_ZheZhi_12_4,折枝也在！你还记得我吗？我们追月节的时候见过。,And Zhezhi's here too! Hiya! Do you remember me? We met at the Moon-Chasing Festival.,Chiết Chi cũng ở đây! Bạn còn nhớ tôi không? Chúng ta từng gặp nhau ở Lễ Hội Truy Nguyệt ấy.
lang_multi_text.db,MultiText,Character_ZheZhi_12_40,炽霞的到来打断了二人的讨论，面对她热情的关心和邀请，折枝紧张万分，不好意思拒绝，最终忍不住答应了她一起回城的邀请，你见状，及时帮忙解释并婉拒了邀请。炽霞得知你们在查案后，表示自己正是因为残象伤人事件才来到矿场。三人说话时，不远处传来动乱的声音，考虑到或许和自己的事情有关，大家纷纷过去查看。,"Your discussion is interrupted by Chixia's arrival. Zhezhi, feeling shy and a little awkward, is unsure how to decline Chixia's invitation to return to the city. Just when she is about to give in to Chixia's friendly insistence, you politely excuse both of you from the gathering. Chixia mentions she is also investigating the Tacet Discords that have been acting strangely. Just then, a loud noise nearby interrupts your conversation and you all decide to check it out.","Sự xuất hiện của Xích Hà làm gián đoạn cuộc thảo luận của hai người. Trước sự quan tâm nhiệt tình và lời mời của cô ấy, Chiết Chi vô cùng căng thẳng, ngại từ chối, cuối cùng không kìm được mà đồng ý lời mời cùng về thành phố. Thấy vậy, bạn kịp thời giúp giải thích và khéo léo từ chối lời mời. Xích Hà biết các bạn đang phá án, cho biết mình đến mỏ khoáng cũng chính vì sự kiện Tàn Tượng tấn công người. Khi ba người đang nói chuyện, cách đó không xa truyền đến tiếng động hỗn loạn, nghĩ rằng có thể liên quan đến chuyện của mình, mọi người liền cùng qua đó xem xét."
lang_multi_text.db,MultiText,Character_ZheZhi_12_5,你好……不是，不用…谢谢……,"H-hello... No, it's not... uh... no, thank you...","Chào... à không, không cần... cảm ơn..."
lang_multi_text.db,MultiText,Character_ZheZhi_12_6,过节的时候我们所里委托你画的那张画大家都很喜欢！现在还挂在墙上呢！,"The painting we had you do for us during the festival is awesome! Everyone loves it, so we put it up on the wall!","Lúc lễ hội, bức tranh sở chúng tôi ủy thác bạn vẽ mọi người đều rất thích! Giờ vẫn còn treo trên tường đấy!"
lang_multi_text.db,MultiText,Character_ZheZhi_12_7,真的吗？嘿嘿，谢谢你们喜欢……,"Really? Hehe, I'm glad you all like it...","Thật sao? Hì hì, cảm ơn các bạn đã thích..."
lang_multi_text.db,MultiText,Character_ZheZhi_12_8,我们打算邀请你去所里做客来着，大家都想当面谢谢你呢！,"We'd also like to invite you to our station, so we can formally thank you in person!","Chúng tôi đang định mời bạn đến sở làm khách đây, mọi người đều muốn cảm ơn bạn trực tiếp đấy!"
lang_multi_text.db,MultiText,Character_ZheZhi_13_33,谢谢……,Thank you...,Cảm ơn...
lang_multi_text.db,MultiText,Character_ZheZhi_13_36,呼……{PlayerName}，对不起。,"Phew... Sorry to trouble you, {PlayerName}.","Phù... {PlayerName}, xin lỗi nhé."
lang_multi_text.db,MultiText,Character_ZheZhi_13_37,怎么突然道歉？,Why are you apologizing all of a sudden?,Sao tự nhiên lại xin lỗi?
lang_multi_text.db,MultiText,Character_ZheZhi_13_38,没关系。,Don't worry about it.,Không sao đâu.
lang_multi_text.db,MultiText,Character_ZheZhi_13_39,谢…啊不，我还没说为什么啊。,"Thanks... Uh, wait, I haven't said why.","Cảm... à không, tôi vẫn chưa nói lý do mà."
lang_multi_text.db,MultiText,Character_ZheZhi_13_40,我是想说……,What I'm trying to say is...,Tôi muốn nói là...
lang_multi_text.db,MultiText,Character_ZheZhi_13_41,刚才我要是及时向炽霞说清楚，就不会麻烦你帮我解释了。,"If I had been clearer, you wouldn't have had to explain things to Chixia for me.",Lúc nãy nếu tôi kịp thời nói rõ với Xích Hà thì đã không phiền bạn giúp tôi giải thích rồi.
lang_multi_text.db,MultiText,Character_ZheZhi_13_42,因为还不算熟悉，所以我不太确定该如何回应这份热情…最后就没好意思拒绝……,"She's really nice. It's just... we're not that close, and I'm not sure how to respond to how friendly she is... I didn't want to be rude, so I... I couldn't bring myself to turn her down.","Vì cũng chưa thân quen lắm, nên tôi không chắc phải đáp lại sự nhiệt tình này thế nào... cuối cùng lại ngại từ chối..."
lang_multi_text.db,MultiText,Character_ZheZhi_13_43,没关系，我明白。,It's okay. I got you.,"Không sao, tôi hiểu mà."
lang_multi_text.db,MultiText,Character_ZheZhi_13_44,她的热情我也无法拒绝。,Her friendliness is infectious.,Sự nhiệt tình của cô ấy tôi cũng không thể từ chối được.
lang_multi_text.db,MultiText,Character_ZheZhi_13_45,以后我会努力及时说出自己的真实想法的，尽量不给你添麻烦……,I'll do my best not to trouble you and express my feelings properly next time...,"Sau này tôi sẽ cố gắng nói ra suy nghĩ thật sự của mình kịp thời, cố gắng không gây phiền phức cho bạn..."
lang_multi_text.db,MultiText,Character_ZheZhi_13_46,好。,I'm sure you will.,Được.
lang_multi_text.db,MultiText,Character_ZheZhi_13_47,这算不上什么麻烦。,No trouble at all.,Cái này đâu tính là phiền phức gì.
lang_multi_text.db,MultiText,Character_ZheZhi_13_48,解释清楚后，二人决定去找其他人问问这里的情况。,Then both of you decide to ask people around about the situation.,"Sau khi giải thích rõ ràng, hai người quyết định đi tìm người khác hỏi thăm tình hình ở đây."
lang_multi_text.db,MultiText,Character_ZheZhi_13_49,折枝欲言又止，似乎想说出刚才没来得及说出口的话。,"Zhezhi seems to be struggling to tell what she couldn't express earlier, but eventually stays silent.","Chiết Chi ngập ngừng muốn nói lại thôi, dường như muốn nói ra những lời lúc nãy chưa kịp nói."
lang_multi_text.db,MultiText,Character_ZheZhi_13_50,折枝对自己不擅拒绝而给你添了麻烦感到抱歉，并表示自己以后会努力及时说出自己的想法。你们二人说通后，决定一起去看看残象伤人现场的情况。,"Regretting her earlier hesitation, Zhezhi promises to speak up more decisively as you make your way to the scene.","Chiết Chi cảm thấy có lỗi vì bản thân không giỏi từ chối mà gây phiền phức cho bạn, và bày tỏ sau này sẽ cố gắng nói ra suy nghĩ của mình kịp thời. Sau khi hai người nói chuyện thông suốt, quyết định cùng đi xem tình hình hiện trường vụ Tàn Tượng tấn công người."
lang_multi_text.db,MultiText,Character_ZheZhi_14_1,与{PlayerName}相遇后，我们一起调查完矿场就跟着炽霞巡尉去往了出事现场。,"After {PlayerName} and I bumped into each other, we decided to investigate the surroundings and follow Patroller Chixia to the scene of the incident.","Sau khi gặp {PlayerName}, chúng tôi cùng điều tra xong mỏ khoáng rồi đi theo Tuần Úy Xích Hà đến hiện trường xảy ra vụ việc."
lang_multi_text.db,MultiText,Character_ZheZhi_14_2,在那里，我们得知了明砚伤人的具体情况，也因此知道了奇画师传闻的真相。,It was there we learned about the details of Mingyan's offense and the truth behind the tale of the Arcane Artist.,"Tại đó, chúng tôi biết được tình hình cụ thể việc Minh Nghiên đả thương người, cũng nhờ đó mà biết được chân tướng lời đồn về Kỳ Họa Sư."
lang_multi_text.db,MultiText,Character_ZheZhi_14_3,（果然，折枝一旦拿起画笔就放松下来了。）,"(Once Zhezhi has the paintbrush in her hand, she begins to speak calmly.)","(Quả nhiên, Chiết Chi một khi cầm cọ vẽ lên là thả lỏng ngay.)"
lang_multi_text.db,MultiText,Character_ZheZhi_14_5,（接下来的陈述可以放手交给她了。）,(She'll be fine making the statement on her own now.),Trần thuật tiếp theo có thể yên tâm giao cho cô ấy rồi.
lang_multi_text.db,MultiText,Character_ZheZhi_15_1,终于找到惹事的家伙了，还好没有造成更大的灾难……{PlayerName}，谢谢你来帮忙！,"Thanks for your help, {PlayerName}! We caught the culprit before anything worse could happen... We were lucky to have you here!","Cuối cùng cũng tìm được kẻ gây chuyện rồi, may mà không gây ra thảm họa lớn hơn... {PlayerName}, cảm ơn bạn đã đến giúp đỡ!"
lang_multi_text.db,MultiText,Character_ZheZhi_15_10,我一会能去看看那张画吗？,Can I check on that painting later?,Lát nữa tôi có thể đi xem bức tranh đó không?
lang_multi_text.db,MultiText,Character_ZheZhi_15_11,嗯，没问题！,You sure can!,"Ừm, không thành vấn đề!"
lang_multi_text.db,MultiText,Character_ZheZhi_15_12,看来她就是那个奇画师。,So she is the Arcane Artist.,Xem ra cô ấy chính là Kỳ Họa Sư đó.
lang_multi_text.db,MultiText,Character_ZheZhi_15_13,辛苦你了，接下来现场的收尾工作就交给我们吧！,Thanks for all your help. We'll take it from here!,"Vất vả cho bạn rồi, công việc thu dọn hiện trường tiếp theo cứ giao cho chúng tôi nhé!"
lang_multi_text.db,MultiText,Character_ZheZhi_15_14,画师的情况怎么样？,What's the situation with the artist?,Tình hình của họa sĩ thế nào?
