db_file,table_name,id,zh,en,vi
lang_multi_text.db,MultiText,Event_QQQXQY_4_2,等回黑海岸之后，要为七丘申请更高级的数据收集装置了啊。,Looks like I'll have to request a more advanced monitoring device once I return to the Black Shores.,"Đợi quay về Bờ Biển Đen, phải xin thiết bị thu thập dữ liệu cao cấp hơn cho Septimont mới được."
lang_multi_text.db,MultiText,Event_QQQXQY_4_3,要尝试帮忙完成这一地区的侦测数据收集么？,"In the meantime, can you help me gather data within this area?",Cậu muốn giúp thu thập dữ liệu thăm dò ở khu vực này không?
lang_multi_text.db,MultiText,Event_QQQXQY_4_4,好的。,Alright.,Được rồi.
lang_multi_text.db,MultiText,Event_QQQXQY_4_5,再等等。,Maybe some other time.,Đợi thêm chút.
lang_multi_text.db,MultiText,Event_QQQXQY_4_6,好的，那就辛苦你了，{PlayerName}。,"Good. I greatly appreciate it, {PlayerName}.","Tốt, vậy thì nhờ cậu rồi, {PlayerName}."
lang_multi_text.db,MultiText,Event_QQQXQY_4_7,没问题，准备好了以后随时可以来找我。,Take your time. I'll be here whenever you're ready.,"Không vấn đề, chuẩn bị xong thì đến tìm tôi bất cứ lúc nào nhé."
lang_multi_text.db,MultiText,Event_QQQXQY_5_1,这附近的数值还比较正常，符合当初我们估算的预期。,The data in this area seems fine. They still match our calculations.,"Chỉ số ở khu vực này còn khá bình thường, phù hợp với dự đoán ban đầu của chúng tôi."
lang_multi_text.db,MultiText,Event_QQQXQY_5_2,让我们继续努力吧，{PlayerName}！希望能得到些好消息！,"Let's keep at it, {PlayerName}! Hopefully, we'll have some good news down the road.","Chúng ta tiếp tục cố gắng nhé, {PlayerName}! Hy vọng sẽ có tin tốt!"
lang_multi_text.db,MultiText,Event_QQQXQY_5_3,要尝试帮忙完成这一地区的侦测数据收集么？,"In the meantime, can you help me gather data within this area?",Cậu muốn giúp thu thập dữ liệu thăm dò ở khu vực này không?
lang_multi_text.db,MultiText,Event_QQQXQY_5_4,好的。,Alright.,Được rồi.
lang_multi_text.db,MultiText,Event_QQQXQY_5_5,再等等。,Maybe some other time.,Đợi thêm chút.
lang_multi_text.db,MultiText,Event_QQQXQY_5_6,好的，那就辛苦你了，{PlayerName}。,"Good. I greatly appreciate it, {PlayerName}.","Tốt, vậy thì nhờ cậu rồi, {PlayerName}."
lang_multi_text.db,MultiText,Event_QQQXQY_5_7,没问题，准备好了以后随时可以来找我。,Take your time. I'll be here whenever you're ready.,"Không vấn đề, chuẩn bị xong thì đến tìm tôi bất cứ lúc nào nhé."
lang_multi_text.db,MultiText,Event_QQQXQY_6_1,原来黑潮云的涨落对数据的影响那么大啊……,Turns out the density of Blight Clouds has a significant impact on the readings…,Hóa ra sự lên xuống của mây Hắc Triều ảnh hưởng đến dữ liệu lớn đến vậy...
lang_multi_text.db,MultiText,Event_QQQXQY_6_2,库库，看来有必要重点采样重点分析了呢。,"Ku ku ku, looks like we'll need to amp up our sampling and analysis work in this particular area.","Ku ku, có vẻ cần phải lấy mẫu trọng điểm và phân tích kỹ hơn rồi."
lang_multi_text.db,MultiText,Event_QQQXQY_6_3,要尝试帮忙完成这一地区的侦测数据收集么？,"In the meantime, can you help me gather data within this area?",Bạn có muốn giúp thu thập dữ liệu dò tìm ở khu vực này không?
lang_multi_text.db,MultiText,Event_QQQXQY_6_4,好的。,Alright.,Được rồi.
lang_multi_text.db,MultiText,Event_QQQXQY_6_5,再等等。,Maybe some other time.,Đợi thêm chút.
lang_multi_text.db,MultiText,Event_QQQXQY_6_6,好的，那就辛苦你了，{PlayerName}。,"Good. I greatly appreciate it, {PlayerName}.","Được, vậy phiền bạn rồi, {PlayerName}."
lang_multi_text.db,MultiText,Event_QQQXQY_6_7,没问题，准备好了以后随时可以来找我。,Take your time. I'll be here whenever you're ready.,"Không sao, chuẩn bị xong rồi thì lúc nào cũng có thể đến tìm tôi."
lang_multi_text.db,MultiText,Event_QQQXQY_7_1,我们很快就能完成七丘数据收集的工作了！,We're getting there! Data collection in Septimont is almost complete!,Chúng ta sắp hoàn thành việc thu thập dữ liệu ở Septimont rồi!
lang_multi_text.db,MultiText,Event_QQQXQY_7_2,库库……再加把劲吧，{PlayerName}！,"Ku ku ku... Let's go, {PlayerName}!","Ku ku... Cố thêm chút nữa nhé, {PlayerName}!"
lang_multi_text.db,MultiText,Event_QQQXQY_7_3,要尝试帮忙完成这一地区的侦测数据收集么？,"In the meantime, can you help me gather data within this area?",Bạn có muốn giúp thu thập dữ liệu dò tìm ở khu vực này không?
lang_multi_text.db,MultiText,Event_QQQXQY_7_4,好的。,Alright.,Được rồi.
lang_multi_text.db,MultiText,Event_QQQXQY_7_5,再等等。,Maybe some other time.,Đợi thêm chút.
lang_multi_text.db,MultiText,Event_QQQXQY_7_6,好的，那就辛苦你了，{PlayerName}。,"Good. I greatly appreciate it, {PlayerName}.","Được, vậy phiền bạn rồi, {PlayerName}."
lang_multi_text.db,MultiText,Event_QQQXQY_7_7,没问题，准备好了以后随时可以来找我。,Take your time. I'll be here whenever you're ready.,"Không sao, chuẩn bị xong rồi thì lúc nào cũng có thể đến tìm tôi."
lang_multi_text.db,MultiText,Event_QQQXQY_8_1,你好，{PlayerName}，要尝试帮忙完成这一地区的侦测数据收集么？,"Hello, {PlayerName}. Shall we start collecting data in this area?","Chào, {PlayerName}, bạn có muốn giúp thu thập dữ liệu dò tìm ở khu vực này không?"
lang_multi_text.db,MultiText,Event_QQQXQY_8_2,是的。,Alright.,Được.
lang_multi_text.db,MultiText,Event_QQQXQY_8_3,我再想想。,Maybe some other time.,Để tôi nghĩ thêm.
lang_multi_text.db,MultiText,Event_QQQXQY_8_4,好的，那就辛苦你了，{PlayerName}。,"Good. I greatly appreciate it, {PlayerName}.","Được, vậy phiền bạn rồi, {PlayerName}."
lang_multi_text.db,MultiText,Event_QQQXQY_8_5,没问题，准备好了以后随时可以来找我。,Take your time. I'll be here whenever you're ready.,"Không sao, chuẩn bị xong rồi thì lúc nào cũng có thể đến tìm tôi."
lang_multi_text.db,MultiText,Event_QQQXQY_9_1,你好，{PlayerName}，要尝试帮忙完成这一地区的侦测数据收集么？,"Hello, {PlayerName}. Shall we start collecting data in this area?","Chào, {PlayerName}, bạn có muốn giúp thu thập dữ liệu dò tìm ở khu vực này không?"
lang_multi_text.db,MultiText,Event_QQQXQY_9_2,是的。,Alright.,Được.
lang_multi_text.db,MultiText,Event_QQQXQY_9_3,我再想想。,Maybe some other time.,Để tôi nghĩ thêm.
lang_multi_text.db,MultiText,Event_QQQXQY_9_4,好的，那就辛苦你了，{PlayerName}。,"Good. I greatly appreciate it, {PlayerName}.","Được, vậy phiền bạn rồi, {PlayerName}."
lang_multi_text.db,MultiText,Event_QQQXQY_9_5,没问题，准备好了以后随时可以来找我。,Take your time. I'll be here whenever you're ready.,"Không sao, chuẩn bị xong rồi thì lúc nào cũng có thể đến tìm tôi."
lang_multi_text.db,MultiText,Event_QXJZWSB_1_1,骊珠啊骊珠，你怎么能如此懈怠！课题快收尾了，不能再拖延下去了……,"Come on, Lizhu! The project deadline's coming up—you can't keep loafing around like this.","Lệ Châu ơi Lệ Châu, sao cậu lại lười biếng thế này! Đề tài sắp kết thúc rồi, không thể trì hoãn thêm nữa..."
lang_multi_text.db,MultiText,Event_QXJZWSB_1_10,……用两支模拟小队施展“空间钳形战术”，在有限时间里对抗无穷无尽的敌潮！,"You control two teams to perform a ""pincer maneuver"" and fight off endless waves of enemies in a limited time.","...Dùng hai đội mô phỏng thi triển ""chiến thuật gọng kìm không gian"", chống lại làn sóng kẻ thù bất tận trong thời gian giới hạn!"
lang_multi_text.db,MultiText,Event_QXJZWSB_1_11,这是宣传语吗？,Is this an ad?,Đây là lời quảng cáo à?
lang_multi_text.db,MultiText,Event_QXJZWSB_1_12,广告打得有点硬。,It's a bit awkward for an ad.,Quảng cáo hơi gượng đấy.
lang_multi_text.db,MultiText,Event_QXJZWSB_1_13,是那个匿名上传者在帖子里写的简介，懂的都懂，这种往往是夸大其词。我很好奇，就在研究之余体验了下……,"Anyway, that's what the anonymous uploader posted. I know, a lot of the game ads are kind of fake, but this one intrigued me. So I gave it a try after work.","Đó là phần giới thiệu mà người đăng ẩn danh viết trong bài, ai cũng hiểu, mấy cái này thường phóng đại lắm. Tôi tò mò quá nên tranh thủ lúc rảnh thử chơi..."
lang_multi_text.db,MultiText,Event_QXJZWSB_1_14,看得出来参考的是以前研究院和黑海岸合作开发的战术推演项目，但多了一些趣味性改动，很让人减压。,"Apparently, it's based on a tactical simulation project co-developed by the Academy and the Black Shores. They added some fun little features that make it surprisingly relaxing.","Nhìn ra được là tham khảo từ dự án mô phỏng chiến thuật mà Viện Nghiên cứu hợp tác phát triển với Bờ Biển Đen trước đây, nhưng có thêm một số thay đổi thú vị, chơi rất giải tỏa căng thẳng."
lang_multi_text.db,MultiText,Event_QXJZWSB_1_15,"哎，我也是忙里偷闲，不知不觉就在上面花了""少许""时间。",That's why I may have squeezed in A LITTLE free time from my research to play it. Can't blame me for this.,"Hài, tôi cũng chỉ tranh thủ lúc rảnh thôi, không ngờ lại bỏ ra ""chút xíu"" thời gian cho nó."
lang_multi_text.db,MultiText,Event_QXJZWSB_1_16,这下摸鱼坐实了。,"So, you're slacking off again.",Vậy là lại cà lơ thật rồi.
lang_multi_text.db,MultiText,Event_QXJZWSB_1_17,不摸了，彻底不摸了，导师知道了又该找我谈话了。,"No, I'm not! Don’t tell my mentor or I'll be in trouble.","Không cà nữa, dứt khoát không cà nữa, thầy hướng dẫn mà biết lại gọi lên nói chuyện mất."
lang_multi_text.db,MultiText,Event_QXJZWSB_1_18,现在有你在，我冲浪多年的论坛账号就先托付给你，省得我老惦记。,"Since you're here, I'm trusting you with my Huaxu Hive account so I can stay focused.","Giờ có bạn ở đây, tôi giao tạm tài khoản diễn đàn lướt bao năm cho bạn, để tôi khỏi cứ nhớ tới nó."
lang_multi_text.db,MultiText,Event_QXJZWSB_1_19,你可以顺便体验一下这个模拟程序，真的很有意思。拜托拜托，这是我的请求。,"And if you're not too busy, why not try the program yourself? It's actually pretty fun! I promise!","Bạn tiện thể trải nghiệm thử chương trình mô phỏng này đi, thật sự rất hay. Làm ơn làm ơn, đây là lời nhờ của tôi đó."
lang_multi_text.db,MultiText,Event_QXJZWSB_1_2,发生什么事了？,Did something happen?,Có chuyện gì vậy?
lang_multi_text.db,MultiText,Event_QXJZWSB_1_20,行吧。,"Alright, alright.",Được thôi.
lang_multi_text.db,MultiText,Event_QXJZWSB_1_21,不好玩我就在问卷里写反馈。,"If it's boring, I'm leaving a complaint on the feedback form.",Không hay là tôi viết phản hồi trong bảng khảo sát đó.
lang_multi_text.db,MultiText,Event_QXJZWSB_1_22,好哦，终端给我一下。,"I knew I could count on you! Here, let me set up your terminal.","Tốt lắm, đưa thiết bị đầu cuối cho tôi một chút."
lang_multi_text.db,MultiText,Event_QXJZWSB_1_23,可以啊，你怎么知道会有体验问卷的？终端给我一下。,"No problem. Wait, how do you know there's a feedback form... Anyway, let me set up your terminal.","Được chứ, sao bạn biết có bảng khảo sát trải nghiệm vậy? Đưa thiết bị đầu cuối cho tôi một chút."
lang_multi_text.db,MultiText,Event_QXJZWSB_1_24,骊珠接过了你的终端，在上面进行了一番操作……,Lizhu takes your terminal and operates on it for a while...,"Lệ Châu nhận lấy thiết bị đầu cuối của bạn, thao tác một hồi trên đó..."
lang_multi_text.db,MultiText,Event_QXJZWSB_1_25,这样一来，你就可以直接用我的账号登录这个模拟程序了。,All set. Now you can log in with my account.,Như vậy là bạn có thể dùng tài khoản của tôi để đăng nhập vào chương trình mô phỏng này rồi.
lang_multi_text.db,MultiText,Event_QXJZWSB_1_3,又在摸鱼吗？,Slacking off again?,Lại cà lơ nữa à?
lang_multi_text.db,MultiText,Event_QXJZWSB_1_4,啊，{PlayerName}，你来得正是时候。,"Oh, hi {PlayerName}. You're here just in time.","A, {PlayerName}, bạn đến đúng lúc quá."
lang_multi_text.db,MultiText,Event_QXJZWSB_1_5,哪有！今天我可是好好地在跑数据，只放松了一会儿，真的只有一小会儿！,"Nonsense! I've been collecting data all day, so I think I deserve a tiny little break.","Đâu có! Hôm nay tôi chạy dữ liệu nghiêm chỉnh lắm, chỉ nghỉ ngơi một chút thôi, thật sự chỉ một chút xíu thôi!"
lang_multi_text.db,MultiText,Event_QXJZWSB_1_6,虽然这么说有点唐突……呃，你听说过「钳形激战无双版」吗？,Now… have you heard of Pincer Maneuver Warriors?,"Dù hỏi hơi đường đột... ờ, bạn có nghe nói về ""Kìm Kích Kịch Chiến Vô Song"" chưa?"
lang_multi_text.db,MultiText,Event_QXJZWSB_1_7,什么无双版？,Pincer what?,Vô song gì cơ?
lang_multi_text.db,MultiText,Event_QXJZWSB_1_8,好怪的名字。,Sounds weird.,Tên lạ quá.
lang_multi_text.db,MultiText,Event_QXJZWSB_1_9,那是近期在今涯论坛上流行的一个模拟程序，可以用数据体和残象数据之类的进行战斗，模拟实战环境。,It's a simulation program that's gone viral on the Huaxu Hive. It simulates combat scenarios using data from digital entities and Tacet Discords.,"Đó là một chương trình mô phỏng đang thịnh hành trên diễn đàn Kim Nhai gần đây, có thể dùng thực thể dữ liệu và dữ liệu Tàn Tượng để chiến đấu, mô phỏng môi trường thực chiến."
lang_multi_text.db,MultiText,Event_QXJZWSB_2_1,你来了，正好让我看看你的体验进度……,There you are! How's the program? Let me check your progress.,"Bạn đến rồi, để tôi xem tiến độ trải nghiệm của bạn..."
lang_multi_text.db,MultiText,Event_QXJZWSB_2_10,不会就是你吧？,Don't tell me it's you.,Không phải là cậu đấy chứ?
lang_multi_text.db,MultiText,Event_QXJZWSB_2_11,好像我眼前就有这么一位？,Sounds like someone I know… right in front of me.,Hình như ngay trước mặt tôi có một người như vậy?
lang_multi_text.db,MultiText,Event_QXJZWSB_2_12,啊哈哈哈……我像吗？我身上可还压着一篇结项论文呢。,"Ahaha... Nice try, but don't forget, I've got a thesis to write.",Ahahaha... Tôi giống lắm sao? Tôi còn đang gánh một bài luận kết đề tài đây này.
lang_multi_text.db,MultiText,Event_QXJZWSB_2_13,（不动声色，认真观察。）,(Stare at Lizhu quietly),"(Không lộ vẻ gì, quan sát chăm chú.)"
lang_multi_text.db,MultiText,Event_QXJZWSB_2_14,……不是，你认真的?那个上传者真的不是我啦。,"...Come on, seriously? It's not me, I swear.","...Không phải, bạn nói thật đấy à? Người đăng tải đó thật sự không phải tôi mà."
lang_multi_text.db,MultiText,Event_QXJZWSB_2_15,你看，这个貌似消遣的程序似乎是在<color=blue>用各种实验环境验证什么特殊的战斗理论？</color>,"You see, this program may seem entertaining, but it actually <color=blue>simulates a variety of experimental scenarios to test certain combat theories</color>, don't you think?","Bạn xem, cái chương trình trông như giải trí này có vẻ đang <color=blue>dùng đủ loại môi trường thực nghiệm để kiểm chứng một lý thuyết chiến đấu đặc biệt nào đó?</color>"
lang_multi_text.db,MultiText,Event_QXJZWSB_2_16,尽管它主打的是<color=red>激情火热</color> 的战斗，但界面风格却意外的<color=red>精致严谨</color>呢？,"Plus, while you're enjoying those <color=red>fiery and exciting</color> battles, you might also notice the UI is so <color=red>elegant and well-designed</color>.","Dù chủ đạo là trận chiến <color=red>sôi động, nhiệt huyết</color>, nhưng phong cách giao diện lại <color=red>tinh tế, chặt chẽ</color> đến bất ngờ?"
lang_multi_text.db,MultiText,Event_QXJZWSB_2_17,此外，程序对<color=white>回音声态数据</color> 的运用似乎反映了上传者在这个领域……相当深刻的理解。,"And the use of <color=white>Remnant Ecoacoustics data</color> in this program shows the developer has... ahem, a deep understanding of that research field.","Ngoài ra, cách chương trình sử dụng <color=white>dữ liệu hồi âm thanh thái</color> dường như cho thấy người đăng tải có... sự hiểu biết rất sâu sắc trong lĩnh vực này."
lang_multi_text.db,MultiText,Event_QXJZWSB_2_18,我好像有些头绪了。,I think I know who they are.,Hình như tôi có manh mối rồi.
lang_multi_text.db,MultiText,Event_QXJZWSB_2_19,你在刻意暗示我什么吗？,Are you hinting at something on purpose?,Cậu đang cố ý ám chỉ gì tôi à?
lang_multi_text.db,MultiText,Event_QXJZWSB_2_2,最后的关卡都通过了，而且还是这么高的分数？果然你非常擅长这种类型的模拟战斗程序！,Final stage cleared with such a high score? I knew it! You've got a knack for combat simulations.,"Màn cuối cũng qua rồi, mà điểm còn cao thế này? Quả nhiên bạn rất giỏi loại chương trình mô phỏng chiến đấu kiểu này!"
lang_multi_text.db,MultiText,Event_QXJZWSB_2_20,啊哈哈……没什么事的话，我就先忙研究去了。,"Well, well... If there's nothing else, I'll get back to my research. Catch you later!",Ahahaha... Nếu không có gì thì tôi đi lo nghiên cứu trước nhé.
lang_multi_text.db,MultiText,Event_QXJZWSB_2_3,还行，只是一般的擅长。,No biggie. Just average.,"Cũng bình thường, chỉ là giỏi tầm trung thôi."
lang_multi_text.db,MultiText,Event_QXJZWSB_2_4,比起实战，难度还是低了些。,"It's simulated, after all—real combat's a different story.",So với thực chiến thì độ khó vẫn còn thấp.
lang_multi_text.db,MultiText,Event_QXJZWSB_2_5,说起来，论坛里关于它的讨论帖热度一直居高不下。,"By the way, the thread about the program has been trending nonstop.","Nói về nó, bài thảo luận trên diễn đàn lúc nào cũng nóng hừng hực."
lang_multi_text.db,MultiText,Event_QXJZWSB_2_6,有人还细扒了下这个内网程序，发现它接入的是院里的公共数据库，协议很规范，没什么数据泄露的风险。,"Someone even dug into this internal program and found it connects to the Academy's public database. The protocol seems solid, so no risk of data leaks.","Có người còn mổ xẻ kỹ chương trình nội bộ này, phát hiện nó kết nối với cơ sở dữ liệu công cộng của Viện, giao thức rất chuẩn, không có nguy cơ rò rỉ dữ liệu."
lang_multi_text.db,MultiText,Event_QXJZWSB_2_7,这个到底是谁制作的？,Who made this program anyway?,Rốt cuộc ai làm ra cái này vậy?
lang_multi_text.db,MultiText,Event_QXJZWSB_2_8,不知道，那个匿名上传者甚至还时不时地更新程序呢，但每次都是把程序包丢在论坛上，别的什么也不说。,"No clue. The anonymous poster keeps releasing new patches on the Huaxu Hive, but no other details.","Không biết, người đăng ẩn danh đó thỉnh thoảng còn cập nhật chương trình nữa, nhưng mỗi lần chỉ đăng gói chương trình lên diễn đàn rồi thôi, chẳng nói gì thêm."
lang_multi_text.db,MultiText,Event_QXJZWSB_2_9,嗯，有一点我倒非常肯定——那个人的研究工作肯定不太饱和。,"Though, I have a feeling they've got a lot of free time on their hands.","Ừm, có một điều tôi khá chắc chắn - công việc nghiên cứu của người đó chắc hẳn không bận lắm đâu."
lang_multi_text.db,MultiText,Event_QXJZWSB_3_1,你要体验「钳形激战无双版」吗？这段时间的程序访问量可是越来越高了。,"Hi, up for a round of Pincer Maneuver Warriors? It's really gaining a lot of players lately!","Bạn muốn chơi ""Kìm Kích Kịch Chiến Vô Song"" không? Dạo này lượng truy cập chương trình ngày càng tăng đấy."
lang_multi_text.db,MultiText,Event_RGXZSJ_10_1,你克制着自己的力道，尽管有些束手束脚，仍然成功解救了濒临超频的少女。,"You hold back your full strength—though constrained, you still manage to save the girl teetering on the edge of Overclocking.","Bạn kiềm chế sức mạnh của mình, dù có phần gò bó, vẫn thành công giải cứu cô gái đang trên bờ vực Vượt Tần."
lang_multi_text.db,MultiText,Event_RGXZSJ_10_2,第二天，你和少女一起离开了小屋，村人褒奖了你的义举。,"The next day, you leave the cabin with her, rewarded by the villagers for your selfless act.","Ngày hôm sau, bạn cùng cô gái rời khỏi căn nhà nhỏ, dân làng khen ngợi hành động nghĩa hiệp của bạn."
lang_multi_text.db,MultiText,Event_RGXZSJ_11_1,你的粗神经超乎了魔女的意料，她静静地观察你的睡颜，什么也没做。,"Your obliviousness has surpassed even the witch's expectations. She quietly studies you as you sleep, doing nothing.","Sự vô tư của bạn vượt ngoài dự liệu của mụ phù thủy, bà ta lặng lẽ ngắm khuôn mặt ngủ của bạn, chẳng làm gì cả."
lang_multi_text.db,MultiText,Event_RGXZSJ_11_2,第二天，你平安地离开了小屋，精神充沛。,"The next day, you leave the cabin unharmed, feeling refreshed.","Ngày hôm sau, bạn bình an rời khỏi căn nhà nhỏ, tinh thần tràn đầy sức sống."
lang_multi_text.db,MultiText,Event_RGXZSJ_1_1,篝火边，你与一个来自黑海岸的年轻人相对而坐。,"By the campfire, you sit across a young man from the Black Shores.","Bên đống lửa trại, bạn ngồi đối diện với một chàng trai trẻ đến từ Bờ Biển Đen."
lang_multi_text.db,MultiText,Event_RGXZSJ_1_2,前辈，我想要更多的历练，去各地挑战那些强大的残象。,"{PlayerName}, I want to be stronger. I want to challenge those powerful Tacet Discords across the world.","Tiền bối, tôi muốn được rèn luyện thêm, đi khắp nơi thách đấu những Tàn Tượng mạnh mẽ."
lang_multi_text.db,MultiText,Event_RGXZSJ_1_3,为什么？,Why?,Tại sao?
lang_multi_text.db,MultiText,Event_RGXZSJ_1_4,对新人来说太早了。,That's a bit early for a newcomer.,Với người mới thì còn sớm quá.
lang_multi_text.db,MultiText,Event_RGXZSJ_1_5,我不想再在外勤任务里拖大家的后腿了。,But I don't want to keep holding everyone back during field missions.,Tôi không muốn cứ kéo chân mọi người trong các nhiệm vụ ngoài thực địa nữa.
lang_multi_text.db,MultiText,Event_RGXZSJ_1_6,我必须尽快积攒经验……哪怕只是听您讲讲关于它们的情报也好。,I have to grow stronger quickly... Even just knowing more about their information would help.,Tôi phải tích lũy kinh nghiệm nhanh nhất có thể... dù chỉ là nghe tiền bối kể về thông tin của chúng cũng được.
lang_multi_text.db,MultiText,Event_RGXZSJ_2_1,你讲起那些不息的烈火，轮胎与大地摩擦的粗砺声响……,"You recount those unquenchable flames, the harsh sound of tires grinding fiercely against the earth...","Bạn kể về những ngọn lửa không bao giờ tắt, tiếng lốp xe cọ xát thô ráp với mặt đất..."
lang_multi_text.db,MultiText,Event_RGXZSJ_2_2,少年听得出神，身体却渐渐变得透明……,"The young man listens intently, his body becoming transparent, slowly fading away...","Chàng trai trẻ nghe mê mải, nhưng thân thể dần trở nên trong suốt..."
lang_multi_text.db,MultiText,Event_RGXZSJ_2_3,我想起来了，原来我……曾和大家一起战胜过它们了。,I remember now... I once stood with my comrades and defeated them.,"Tôi nhớ ra rồi, hóa ra tôi... đã từng cùng mọi người chiến thắng chúng."
lang_multi_text.db,MultiText,Event_RGXZSJ_2_4,你依稀看到了年轻人真正的终点，那是一场吞噬了整座城市的悲鸣。,"For a fleeting moment, you catch a glimpse of his true end—a Lament that devoured an entire city.",Bạn mơ hồ nhìn thấy điểm kết thúc thật sự của chàng trai trẻ - đó là một trận Bi Minh nuốt chửng cả thành phố.
lang_multi_text.db,MultiText,Event_RGXZSJ_3_1,你讲起那片寒潭，巨影自沉眠复苏，古钟的回声响彻深谷……,"You recount the icy pond where a colossal shadow stirred from its deep slumber, the echo of an ancient bell reverberating through the ravine...","Bạn kể về hồ nước lạnh buốt ấy, bóng khổng lồ tỉnh giấc từ giấc ngủ sâu, tiếng chuông cổ vang vọng khắp thung lũng..."
