db_file,table_name,id,zh,en,vi
lang_multi_text.db,MultiText,XJXYDTK_16_4,嗯嗯！就是那个！在大多数罗伊人的记忆中，第一门“数学课”并不是学院带来的数字表，而是这样一枚古老螺壳的切片。,"Yes, that's it! For most Roya children, our first ""math class"" isn't a number chart, it's an ancient spiral shell cut open to reveal its shape.","Ừ ừ! Đúng cái đó! Trong ký ức của phần lớn người Roya, ""bài toán"" đầu tiên không phải bảng số do học viện mang đến, mà là lát cắt của một vỏ ốc cổ như thế này."
lang_multi_text.db,MultiText,XJXYDTK_16_5,你看它的内部结构，这一圈圈向心的凹槽，是不是很像一种天然形成的数理宫格？,"See its internal structure? These chambers, spiraling inward... doesn't it look like a naturally occurring mathematical grid?","Cậu nhìn cấu trúc bên trong nó xem, những rãnh xoắn hướng tâm từng vòng từng vòng, trông có giống một loại cung cách toán học hình thành tự nhiên không?"
lang_multi_text.db,MultiText,XJXYDTK_16_6,我们会将五颜六色的小石头与细棍投入壳格，模仿加减乘除、分配与配对……久而久之，我们的脑海里也同样形成了一枚“虚幻的螺壳影像”。,"We drop colored stones and sticks into the shell, mimicking all the math fundamentals: addition, subtraction, division, distribution, and pairing… Over time, a ""virtual spiral shell"" forms in our minds.","Bọn tôi sẽ thả những viên đá nhỏ đủ màu và que nhỏ vào các ngăn vỏ ốc, mô phỏng cộng trừ nhân chia, phân phối và ghép cặp... Lâu dần, trong đầu bọn tôi cũng hình thành một ""hình ảnh vỏ ốc ảo"" tương tự."
lang_multi_text.db,MultiText,XJXYDTK_16_7,就是类似于瑝珑同学们说的“珠心算”之类的算法吧。借用脑内形成的“工具影像”模拟，用视觉、记忆与思维协同完成运算……,"So it's like Huanglong's ""mental abacus""? You just visualize the tool and do the math in your mind that way?","Giống kiểu ""tính nhẩm bàn tính"" mà các bạn Hoàng Long hay nói đó nhỉ. Mượn ""hình ảnh công cụ"" hình thành trong não để mô phỏng, dùng thị giác, trí nhớ và tư duy phối hợp hoàn thành phép tính..."
lang_multi_text.db,MultiText,XJXYDTK_16_8,也没那么深奥啦。很久以前，罗伊人必须借助数学，测算、推演冰原灾难来临的时间，延续生存。,"Nothing that deep. For us, it was born from necessity. Long ago, the Roya relied on math to predict when disasters would strike the frostlands.","Cũng không sâu xa đến thế đâu. Ngày xưa, người Roya phải dựa vào toán học để tính toán, dự đoán thời điểm thảm họa ập đến vùng băng nguyên, để duy trì sự sống."
lang_multi_text.db,MultiText,XJXYDTK_16_9,后来，在罗伊人尚不熟悉现代社会语言的时候，数学又成为了我们与外界交流唯一的纽带。,"And before we learned the modern languages, mathematics became our first bridge to the outside world.","Sau này, khi người Roya còn chưa quen với ngôn ngữ xã hội hiện đại, toán học lại trở thành sợi dây liên kết duy nhất giữa chúng tôi với thế giới bên ngoài."
lang_multi_text.db,MultiText,XJXYDTK_17_1,传说……在第一纪的末尾，世界坠入冰冷的渊狱……,"Legend says… at the end of the First Epoch, the world froze over. A ""Great Glacial Lock.""","Truyền thuyết kể rằng... vào cuối Kỷ Nguyên Thứ Nhất, thế giới rơi vào vực thẳm băng giá..."
lang_multi_text.db,MultiText,XJXYDTK_17_2,我记得你们七丘人不是不信神吗？怎么有兴趣了解这些？,But I thought you Septimont folks don't believe in gods? What's with the sudden interest?,Tôi nhớ người Thất Khâu các cậu không tin thần linh mà? Sao lại có hứng tìm hiểu mấy chuyện này?
lang_multi_text.db,MultiText,XJXYDTK_18_1,传说……在第一纪的末尾，世界坠入冰冷的渊狱，「朔尔神」为汹涌的浪潮困于高天，罗伊人也失去了与星辰宇宙对话的媒介……,"Legend says… at the end of the First Epoch, the world froze over. A ""Great Glacial Lock,"" they called it. Raging tides trapped our god, Sol, in the sky, and the Roya lost their means to speak with the universe...","Truyền thuyết kể rằng... vào cuối Kỷ nguyên thứ nhất, thế giới rơi vào vực thẳm băng giá, ""Thần Sol"" bị những đợt sóng hung dữ giam cầm trên cao, và người Roya cũng mất đi phương tiện để đối thoại với vũ trụ tinh tú..."
lang_multi_text.db,MultiText,XJXYDTK_18_10,之前我对“神明”的看法太过偏激了，如果有冒犯到你们……抱歉。,"I admit my past views on ""gods"" were far too rigid. If I ever came off as disrespectful, I'm sorry.","Trước đây quan điểm của tôi về ""thần minh"" quá khắt khe rồi, nếu có xúc phạm đến các bạn... xin lỗi."
lang_multi_text.db,MultiText,XJXYDTK_18_11,哈哈哈！没事没事！求同存异嘛！,Hahaha! No harm done! We can agree to disagree.,Hahaha! Không sao không sao! Cầu đồng tồn dị mà!
lang_multi_text.db,MultiText,XJXYDTK_18_12,族里的长老也说，根据他们的测算，在这一纪元，罗伊人要做的是居安思危，与所有盟友携手并肩……凡此种种，皆为“黄昏纪”之绸缪……,"Our elders say that in this epoch, the Roya must remain watchful and stand with all our allies... For everything we do is but preparation for the coming Twilight Epoch...","Các trưởng lão trong tộc cũng nói, theo tính toán của họ, trong kỷ nguyên này, người Roya cần phải cảnh giác trong lúc yên bình, sát cánh cùng tất cả đồng minh... Mọi thứ đều là sự chuẩn bị cho ""Hoàng Hôn Kỷ""..."
lang_multi_text.db,MultiText,XJXYDTK_18_2,在第二纪，「朔尔神」的人间化身「巴德尔」，暂封了外来的邪祇「赫龙格」，但也为其所中伤……,"In the Second Epoch, Sol took the form of Baldur to walk among us mortals. It managed to seal away the foreign god, Hvedrungr, but was gravely wounded...","Vào Kỷ nguyên thứ hai, hóa thân nhân gian của ""Thần Sol"" là ""Baldur"" đã tạm phong ấn tà thần ngoại lai ""Hvedrungr"", nhưng cũng bị hắn trọng thương..."
lang_multi_text.db,MultiText,XJXYDTK_18_3,而在陷入永梦之前，巴德尔的心脏化作了地下绿洲的第二个太阳，罗伊族在其引导下建立了新的家园……,"Just before Baldur fell into its long slumber, its heart became a second sun beneath the earth, guiding the Roya to build a new home under its light...","Và trước khi rơi vào giấc mộng vĩnh hằng, trái tim của Baldur đã hóa thành mặt trời thứ hai của ốc đảo ngầm, tộc Roya dưới sự dẫn dắt ấy đã dựng nên quê hương mới..."
lang_multi_text.db,MultiText,XJXYDTK_18_4,原来是这样……我完全理解了一切，谢谢。,I see... It all makes sense now. Thanks for explaining.,"Thì ra là vậy... Tôi hiểu hết rồi, cảm ơn."
lang_multi_text.db,MultiText,XJXYDTK_18_5,不用谢！不过，我记得你们七丘人不是不信神吗？怎么有兴趣了解这些？,No problem! But I thought you Septimont folks don't believe in gods? What's with the sudden interest?,"Không có gì! Nhưng, tôi nhớ người Thất Khâu các bạn không tin thần mà? Sao lại hứng thú tìm hiểu những chuyện này?"
lang_multi_text.db,MultiText,XJXYDTK_18_6,罗伊人的三纪神话，还有拉古那的岁主神话也是……它们的内容，都与我们目前的科考发现有一定的“匹配之处”。,"The Roya's Trine Myth, and even the Sentinel legends from Ragunna... they're starting to line up with data collected on expeditions.","Thần thoại Tam Kỷ của người Roya, và cả thần thoại Tuế Chủ của Ragunna nữa... Nội dung của chúng đều có những ""điểm khớp"" nhất định với các phát hiện khảo sát khoa học hiện tại của chúng tôi."
lang_multi_text.db,MultiText,XJXYDTK_18_7,比如，科学史将拉海洛第一纪的灾变定义为“悲鸣”，罗伊神话则将其称为“渊狱”……,"For example, what our scientific records call the ""Lament"" of Lahai-Roi's First Epoch, Roya myths call the ""Glacial Lock.""","Ví dụ, lịch sử khoa học định nghĩa tai biến Kỷ nguyên thứ nhất của Lahai-Roi là ""Bi Minh"", còn thần thoại Roya thì gọi nó là ""Uyên Ngục""..."
lang_multi_text.db,MultiText,XJXYDTK_18_8,名为“巴德尔”的存在已经被统称为隧者，而你们口中的“第二个太阳”，无疑正对应着“炉芯”了。,"The figure you call ""Baldur"" is classified academically as the Exostrider, and the ""second sun"" clearly corresponds to the Reactor Drive.","Thực thể mang tên ""Baldur"" đã được thống nhất phân loại là Toại Giả, còn ""mặt trời thứ hai"" mà các bạn nhắc đến, chắc chắn chính là ""Lò Tâm""."
lang_multi_text.db,MultiText,XJXYDTK_18_9,尽管解读方式有所不同，但二者所描绘的现象都是一致的。,We're just looking at the same mountain from different sides.,"Dù cách diễn giải có khác nhau, nhưng hiện tượng mà cả hai mô tả đều nhất quán."
lang_multi_text.db,MultiText,XJXYDTK_19_1,一手抓学习、一手抓健康、一手抓科研、一手抓活动……,"You want to juggle coursework, health, research, club activities...","Một tay lo học hành, một tay lo sức khỏe, một tay lo nghiên cứu, một tay lo hoạt động..."
