db_file,table_name,id,zh,en,vi
lang_multi_text.db,MultiText,Shixifeidu_main_2_8_43_3,只是随便转转。,I was just passing through.,Chỉ tiện đường ghé qua thôi.
lang_multi_text.db,MultiText,Shixifeidu_main_2_8_43_4,千咲现在已经转入黑海岸的封闭式房间，正在接受监测和分阶段的治疗干预。,Chisa's been moved to a sealed treatment chamber. She's under close observation and receiving phased therapeutic support.,"Chisa hiện đã được chuyển vào phòng cách ly của Bờ Biển Đen, đang được theo dõi và can thiệp điều trị theo giai đoạn."
lang_multi_text.db,MultiText,Shixifeidu_main_2_8_43_5,因为身体长时间处在一种接近超频的高负荷状态，她的几项生命体征数据确实不太理想，简单来说就是……身体还在撑着，但已经很疲惫了。,"Her body's been running under Overclocked strain for quite some time; some of her vitals aren't in great shape. Simply put… she's holding on, but her body is clearly exhausted.","Do cơ thể ở trong trạng thái tải trọng cao gần ngưỡng Vượt Tần quá lâu, vài chỉ số sinh tồn của cô ấy quả thực không được lý tưởng lắm, nói đơn giản là... cơ thể vẫn đang cầm cự, nhưng đã rất mệt mỏi rồi."
lang_multi_text.db,MultiText,Shixifeidu_main_2_8_43_6,不过！好消息是，我们已经找到了一些方法，从初步反应来看，还是有效果的。虽然没法立刻将她调整到最佳状态，但只要给我们一点时间，后续问题应该不会太大。,"That said, we've started identifying some promising treatment paths. Early response looks good. We're not going to get back to full strength overnight, but with a little time, she should recover steadily. Nothing critical at this point.","Nhưng mà! Tin tốt là, chúng tôi đã tìm ra một số phương pháp, nhìn từ phản ứng ban đầu thì vẫn có hiệu quả. Tuy không thể lập tức đưa cô ấy về trạng thái tốt nhất, nhưng chỉ cần cho chúng tôi chút thời gian, vấn đề về sau chắc sẽ không quá lớn."
lang_multi_text.db,MultiText,Shixifeidu_main_2_8_43_7,那我先继续去分析千咲的身体状况了！啊不过……情况大致是顺利的，只要再多给点时间，后续问题应该不会太大！,"Then I'll get back to analyzing her readings! Overall, things are moving in the right direction. Just give us a bit more time, and she'll be alright.","Vậy tôi tiếp tục đi phân tích tình trạng cơ thể của Chisa đây! A nhưng mà... tình hình đại khái là thuận lợi, chỉ cần thêm chút thời gian, vấn đề về sau chắc sẽ không quá lớn!"
lang_multi_text.db,MultiText,Shixifeidu_main_2_8_44_1,我叫朽叶千咲……,My name is Kuchiba Chisa...,Tôi tên là Kuchiba Chisa...
lang_multi_text.db,MultiText,Shixifeidu_main_2_8_44_10,又是，这样……,Again... these voices...,"Lại nữa, như thế này..."
lang_multi_text.db,MultiText,Shixifeidu_main_2_8_44_11,觉醒是因为……保护受欺负的同学吗？,You Awakened... to protect a classmate who was being bullied?,Thức tỉnh là vì... bảo vệ bạn học bị bắt nạt sao?
lang_multi_text.db,MultiText,Shixifeidu_main_2_8_44_12,别害怕,Don't be afraid.,Đừng sợ.
lang_multi_text.db,MultiText,Shixifeidu_main_2_8_44_13,是谁……谁做的？,Who... who did this?,Là ai... ai làm vậy?
lang_multi_text.db,MultiText,Shixifeidu_main_2_8_44_14,有什么可怕的？,So what?,Có gì đáng sợ chứ?
lang_multi_text.db,MultiText,Shixifeidu_main_2_8_44_15,等等，不要刺激她……,"Stop it, don't provoke her...","Từ từ, đừng kích động cô ấy..."
lang_multi_text.db,MultiText,Shixifeidu_main_2_8_44_16,也太会给人添麻烦了吧？,I guess some people don't care about putting others in jeopardy.,Cũng quá biết gây phiền phức cho người khác rồi đấy?
lang_multi_text.db,MultiText,Shixifeidu_main_2_8_44_17,去别的车厢吧,Let's just move to another carriage.,Sang toa khác đi.
lang_multi_text.db,MultiText,Shixifeidu_main_2_8_44_18,我可不想和怪物待一起……,I don't want to sit near a monster...,Tôi không muốn ở cùng quái vật đâu...
lang_multi_text.db,MultiText,Shixifeidu_main_2_8_44_19,综上所述……对共鸣者的管控是维护社会治安的必要措施……,In conclusion... strict oversight of Resonators is essential to ensuring societal stability...,Tóm lại... việc kiểm soát Cộng Hưởng Giả là biện pháp cần thiết để duy trì trị an xã hội...
lang_multi_text.db,MultiText,Shixifeidu_main_2_8_44_2,我出身的国家,My homeland,Đất nước nơi tôi sinh ra
lang_multi_text.db,MultiText,Shixifeidu_main_2_8_44_20,哎，你是不是也听说啦？,Hey... did you hear?,"Này, bà cũng nghe nói rồi hả?"
lang_multi_text.db,MultiText,Shixifeidu_main_2_8_44_21,朽叶家的女儿啊,You mean that Kuchiba girl?,Con gái nhà Kuchiba đấy
lang_multi_text.db,MultiText,Shixifeidu_main_2_8_44_22,她的父母挺可怜的,I feel bad for her parents.,Bố mẹ con bé cũng tội nghiệp
lang_multi_text.db,MultiText,Shixifeidu_main_2_8_44_23,最近，客户都撤回订单了,Clients have been canceling orders lately…,"Gần đây, khách hàng đều rút đơn đặt hàng rồi"
lang_multi_text.db,MultiText,Shixifeidu_main_2_8_44_24,你想说，这是因为女儿的错吗？,Are you blaming this on our daughter?,"Bà muốn nói, chuyện này là lỗi do con gái sao?"
lang_multi_text.db,MultiText,Shixifeidu_main_2_8_44_25,不，我不是那个意思,"No, I didn't mean it like that.","Không, tôi không có ý đó."
lang_multi_text.db,MultiText,Shixifeidu_main_2_8_44_26,抱歉啊，小千……,"I'm sorry, Chisa...","Xin lỗi nhé, Chisa..."
lang_multi_text.db,MultiText,Shixifeidu_main_2_8_44_27,已经……,Enough...,Đã...
lang_multi_text.db,MultiText,Shixifeidu_main_2_8_44_28,受够了,I've had enough.,Chịu đủ rồi.
lang_multi_text.db,MultiText,Shixifeidu_main_2_8_44_29,是一座被高墙环绕的孤岛,"is a solitary island, walled in on all sides...",Là một hòn đảo cô độc bị bao quanh bởi những bức tường cao.
lang_multi_text.db,MultiText,Shixifeidu_main_2_8_44_3,……就像我一样,...Much like myself.,...Cũng giống như tôi vậy.
lang_multi_text.db,MultiText,Shixifeidu_main_2_8_44_30,真是好孩子呢,What a good girl.,Thật là đứa trẻ ngoan.
lang_multi_text.db,MultiText,Shixifeidu_main_2_8_44_31,这个装置，可以帮助你回归普通人的生活,This device can help you return to a normal life.,"Thiết bị này, có thể giúp cháu trở lại cuộc sống của người bình thường."
lang_multi_text.db,MultiText,Shixifeidu_main_2_8_44_32,我早知道她不对劲了,I knew there was something off about her.,Tôi biết thừa con bé đó không bình thường rồi mà.
lang_multi_text.db,MultiText,Shixifeidu_main_2_8_44_33,都这样了还要搭电车吗？,She's taking the train in that state?,Đã như vậy rồi mà còn muốn đi tàu điện sao?
lang_multi_text.db,MultiText,Shixifeidu_main_2_8_44_34,真是没想到啊……啧啧……,"Who would've thought, right? Tch...",Thật không ngờ đấy... chậc chậc...
lang_multi_text.db,MultiText,Shixifeidu_main_2_8_44_35,因为小千的事——,Because of Chisa...,Vì chuyện của Chisa...
lang_multi_text.db,MultiText,Shixifeidu_main_2_8_44_36,是爸爸妈妈没能照顾好你……,Mom and Dad should've done better...,Là bố mẹ không chăm sóc tốt cho con...
lang_multi_text.db,MultiText,Shixifeidu_main_2_8_44_4,各位乘客，受沿线出现的小型无音区影响，预计列车将延误30分钟……,"Dear Passengers, a minor Tacet Field detected has caused the train to be delayed by approximately 30 minutes.","Kính thưa quý khách, do ảnh hưởng của Vùng Vô Thanh cỡ nhỏ xuất hiện dọc tuyến đường, dự kiến tàu sẽ chậm trễ 30 phút..."
lang_multi_text.db,MultiText,Shixifeidu_main_2_8_44_5,又是因为共鸣者吗？,Don't tell me it's those Resonators again.,Lại là vì Cộng Hưởng Giả sao?
lang_multi_text.db,MultiText,Shixifeidu_main_2_8_44_6,饶了我吧，上班要迟到了……,"Ugh, give me a break. I'll be late for work...","Tha cho tôi đi, đi làm muộn mất..."
lang_multi_text.db,MultiText,Shixifeidu_main_2_8_44_7,他们被声痕吞噬了就会变成无音区……,"When their Tacet Marks take over, they turn into Tacet Fields...",Họ bị Dấu Ấn Âm Thanh nuốt chửng thì sẽ biến thành Vùng Vô Thanh...
lang_multi_text.db,MultiText,Shixifeidu_main_2_8_44_8,能不能禁止这些怪物坐车啊？,Can't they just ban those freaks from public transport already?,Có thể cấm mấy con quái vật này đi tàu không vậy?
lang_multi_text.db,MultiText,Shixifeidu_main_2_8_44_9,喂，小点声，看那边……,Keep your voice down. Look...,"Này, bé tiếng thôi, nhìn đằng kia kìa..."
lang_multi_text.db,MultiText,Shixifeidu_main_2_8_4_1,黑海岸各成员已搭建起观测平台，一个通往未知索诺拉的神秘裂隙出现在你们面前。你想前去一看究竟，卜灵却隐有不安的预感。,"A mysterious spatial rift appears, leading to an unknown Sonoro Sphere. Researchers from the Black Shores quickly assemble a makeshift observation platform nearby. You want to enter the rift, but Buling can't shake a sense of dread.","Các thành viên Bờ Biển Đen đã dựng đài quan sát, một khe nứt bí ẩn dẫn đến Sonora chưa biết hiện ra trước mặt các bạn. Bạn muốn tiến lên xem xét, nhưng Bốc Linh lại có dự cảm bất an."
lang_multi_text.db,MultiText,Shixifeidu_main_2_8_4_10,（但，如果是真实存在过的城市，怎么会被投影到裂隙中？这个坐标又为什么会被发送到黑海岸来？）,"(But if that's true, why is it being projected into the rift? And why were its coordinates sent to the Black Shores?)","(Nhưng, nếu là thành phố có thật, sao lại bị chiếu vào trong khe nứt? Tọa độ này tại sao lại được gửi đến Bờ Biển Đen?)"
lang_multi_text.db,MultiText,Shixifeidu_main_2_8_4_11,嘿，老板？你刚刚走了一会儿神哦，是在想这个裂隙的事吧？,"Hey, Boss! You zoned out again. Still thinking about the creepy rift, huh?","Này, Sếp? Vừa nãy ngẩn người một lúc đó nha, đang nghĩ về khe nứt này à?"
lang_multi_text.db,MultiText,Shixifeidu_main_2_8_4_12,……我觉得这件事，发生得有古怪。,...Something about this isn't normal.,...Tôi cảm thấy chuyện này xảy ra có chút kỳ lạ.
lang_multi_text.db,MultiText,Shixifeidu_main_2_8_4_13,被发送到黑海岸的频率信息，空间坐标指向的裂隙，由末日都市组成的索诺拉……目前无法判断的信息太多，如果不进去亲眼看过……,"The frequency data sent to the Black Shores, the coordinates pointing to this rift, this Sonoro of a ruined city... It's hard to make sense of the info we have. If only we could enter it ourselves...","Thông tin tần số được gửi đến Bờ Biển Đen, tọa độ không gian chỉ về khe nứt, Sonora được tạo thành từ đô thị tận thế... Hiện tại có quá nhiều thông tin không thể phán đoán, nếu không vào tận nơi xem..."
lang_multi_text.db,MultiText,Shixifeidu_main_2_8_4_14,很可惜，这个裂隙拒绝旁人的进入。虽然{PlayerName}的话或许又会不一样，你身上总在发生着许多不可控的可能性……,"Would've been nice, huh? But this thing's got its doors shut tight to outsiders. But you {PlayerName}, you might be different! You're always full of surprises.","Tiếc là, khe nứt này từ chối người ngoài xâm nhập. Mặc dù với {PlayerName} thì có thể sẽ khác, trên người cậu luôn xảy ra nhiều khả năng không thể kiểm soát..."
lang_multi_text.db,MultiText,Shixifeidu_main_2_8_4_15,不过，你真的要进去吗？我已经“看”到了——这开的可是「死门」。,"Still, are you sure you want to? I've ""seen"" it... That's a Death Gate, clear as day.","Nhưng mà, cậu thực sự muốn vào sao? Tôi đã ""nhìn"" thấy rồi... thứ mở ra chính là ""Tử Môn"" đấy."
lang_multi_text.db,MultiText,Shixifeidu_main_2_8_4_16,（或许……可以试试「分离」的力量？将这幅景象，与这个裂隙……）,(Maybe I should try using the power of separation? I might be able to split the projection from the rift...),"(Có lẽ... thử dùng sức mạnh ""Phân Tách"" xem sao? Tách cảnh tượng này với khe nứt kia...)"
lang_multi_text.db,MultiText,Shixifeidu_main_2_8_4_2,啊，{PlayerName}，你来了！,"Great, {PlayerName}, you're here!","A, {PlayerName}, cậu đến rồi!"
lang_multi_text.db,MultiText,Shixifeidu_main_2_8_4_3,我来了。,Here I am.,Tôi tới rồi.
lang_multi_text.db,MultiText,Shixifeidu_main_2_8_4_4,情况如何？,How's everything going?,Tình hình thế nào?
lang_multi_text.db,MultiText,Shixifeidu_main_2_8_4_5,好，那么我快速整理一下已知的信息……这个空间裂隙，通往一个未知的索诺拉。,Good. Let me give you a quick briefing on what we've learned so far. This spatial rift leads to an unknown Sonoro Sphere.,"Được, vậy tôi sẽ tóm tắt nhanh thông tin đã biết... Khe nứt không gian này dẫn đến một Sonora chưa xác định."
lang_multi_text.db,MultiText,Shixifeidu_main_2_8_4_6,已有执花尝试进入调查，但现在看来，这个裂隙既无法进入，也无法被干预。,"Some Bloom Bearers attempted to enter for investigation, but... the rift appears to resist all forms of entry and interference.","Đã có Hoa Chấp thử xâm nhập điều tra, nhưng hiện tại xem ra, khe nứt này không thể vào được, cũng không thể can thiệp."
lang_multi_text.db,MultiText,Shixifeidu_main_2_8_4_7,这个空间裂隙，通往一个未知的索诺拉。已有执花尝试进入调查，可现在看来，这个裂隙既无法进入，也无法被干预。,"As far as we know, this spatial rift leads to an unknown Sonoro Sphere. Some Bloom Bearers attempted to enter for investigation, but... the rift appears to resist all forms of entry and interference.","Khe nứt không gian này dẫn đến một Sonora chưa xác định. Đã có Hoa Chấp thử xâm nhập điều tra, nhưng hiện tại xem ra, khe nứt này không thể vào được, cũng không thể can thiệp."
lang_multi_text.db,MultiText,Shixifeidu_main_2_8_4_8,眼前的海市蜃楼，正是这个索诺拉溢出现实的投影。,The mirage we're seeing is a projection leaking from the Sonoro into reality.,Ảo ảnh trước mắt chính là hình chiếu của Sonora này tràn ra thực tại.
lang_multi_text.db,MultiText,Shixifeidu_main_2_8_4_9,（刚才有研究员说，这可能是一座真实存在过的城市……）,(The researcher from earlier said it might have been a real city...),"(Vừa nãy có nghiên cứu viên nói, đây có thể là một thành phố từng tồn tại thực sự...)"
lang_multi_text.db,MultiText,Shixifeidu_main_2_8_5_1,警报！警报！紧急事态已确认，当前威胁等级突破临界值！,Alert! Alert! Emergency situation confirmed. Current threat level has exceeded critical threshold!,"Cảnh báo! Cảnh báo! Tình trạng khẩn cấp đã được xác nhận, cấp độ đe dọa hiện tại vượt ngưỡng giới hạn!"
lang_multi_text.db,MultiText,Shixifeidu_main_2_8_5_2,全体民众注意，剩余安全撤离时间：1分41秒……,"Attention all civilians. Estimated safe evacuation time remaining: 1 minute, 41 seconds...","Toàn thể người dân chú ý, thời gian sơ tán an toàn còn lại: 1 phút 41 giây..."
lang_multi_text.db,MultiText,Shixifeidu_main_2_8_5_3,逃生路线标识已切换为████色，携带武器与补给者请走████通道……,"Look for the evacuation route indicated by the ████ light. Personnel carrying weapons or supplies, proceed through the ████ passage...","Biển báo lộ trình thoát hiểm đã chuyển sang màu ████, người mang theo vũ khí và nhu yếu phẩm vui lòng đi lối ████..."
lang_multi_text.db,MultiText,Shixifeidu_main_2_8_5_4,重复：立即执行逃生预案……重复：立即执行逃生预案……,Repeat: Initiate emergency evacuation immediately... Repeat: Initiate emergency evacuation immediately...,Lặp lại: Thực hiện phương án thoát hiểm ngay lập tức... Lặp lại: Thực hiện phương án thoát hiểm ngay lập tức...
lang_multi_text.db,MultiText,Shixifeidu_main_2_8_7001_1,这新品怎么辣成这样……,"Ugh, this new dish is too spicy...",Món mới này sao cay thế không biết...
lang_multi_text.db,MultiText,Shixifeidu_main_2_8_7001_2,唉，早知道不买什么限定了……,Shouldn't have fallen for the limited edition hype...,"Haiz, biết thế đã không mua cái gì mà bản giới hạn..."
lang_multi_text.db,MultiText,Shixifeidu_main_2_8_7002_1,今天校车来得好晚呀……,Why's the school bus so late today...,Hôm nay xe buýt trường đến muộn quá...
lang_multi_text.db,MultiText,Shixifeidu_main_2_8_7002_2,都要迟到啦……,I'm going to be late...,Sắp muộn học rồi...
lang_multi_text.db,MultiText,Shixifeidu_main_2_8_7003_1,啊……假期近在眼前了。,Finally... the holiday is almost here.,A... kỳ nghỉ ngay trước mắt rồi.
lang_multi_text.db,MultiText,Shixifeidu_main_2_8_7004_1,其实……我打算下个月就辞职……,"Well, I'm planning to resign next month...",Thật ra... tôi định tháng sau xin nghỉ việc...
lang_multi_text.db,MultiText,Shixifeidu_main_2_8_7004_2,咦？起码拿了奖金再走吧？,Huh? At least wait until you get your bonus!,Hả? Ít nhất cũng nhận thưởng xong hãy đi chứ?
lang_multi_text.db,MultiText,Shixifeidu_main_2_8_7004_3,虽然是这个道理……但是……,"Yeah, I know, I know...",Tuy là nói vậy... nhưng mà...
lang_multi_text.db,MultiText,Shixifeidu_main_2_8_7004_4,天气这么好，想尽早跟家人一起出去走走啊。,But look at the weather. It's so nice. Days like this just make me want to quit and spend more time with my family.,"Thời tiết đẹp thế này, muốn sớm cùng gia đình ra ngoài đi dạo một chút."
lang_multi_text.db,MultiText,Shixifeidu_main_2_8_7005_1,看来看去，还是商业街那边的水果最便宜呀。,I checked around. The fruit's cheapest over on Commercial Street.,"Xem đi xem lại, vẫn là trái cây bên phố thương mại rẻ nhất."
lang_multi_text.db,MultiText,Shixifeidu_main_2_8_7005_2,哎，我听说今天又会打折呢。,"Oh, and I heard there's another sale today!","Này, tôi nghe nói hôm nay lại có giảm giá đấy."
lang_multi_text.db,MultiText,Shixifeidu_main_2_8_7005_3,正好，一会儿给孩子买点新鲜的去……,Fantastic! I'll pick up some fresh ones for the kids later...,"Vừa hay, lát nữa mua ít đồ tươi cho bọn trẻ..."
lang_multi_text.db,MultiText,Shixifeidu_main_2_8_7006_1,听说了吗？下周的篮球赛我们要对决三班！,"Yo, you hear? We're up against Class C in next week's basketball game!",Nghe nói gì chưa? Trận bóng rổ tuần sau chúng ta đấu với lớp 3 đấy!
lang_multi_text.db,MultiText,Shixifeidu_main_2_8_7006_2,三班吗？！那肯定打不过了……,Class C?! No way we're winning that...,Lớp 3 á?! Thế thì chắc chắn không thắng nổi rồi...
lang_multi_text.db,MultiText,Shixifeidu_main_2_8_7006_3,唉，本来我爸还说打赢的话奖励家族旅行呢……,Man… My dad promised a family trip if we won…,"Haiz, bố tớ còn bảo nếu thắng sẽ thưởng chuyến du lịch gia đình nữa chứ..."
lang_multi_text.db,MultiText,Shixifeidu_main_2_8_7007_1,嗯？你好……怎么了，找错车站了吗？,"Yes, hello? What's the matter? Did you come to the wrong bus stop?","Hửm? Xin chào... Sao vậy, tìm nhầm trạm xe à?"
lang_multi_text.db,MultiText,Shixifeidu_main_2_8_7007_10,今天……今天不是她生日吗？为什么……我没有到家？,Isn't it... Isn't it her birthday today...? Then why am I not home...?,Hôm nay... hôm nay không phải sinh nhật con bé sao? Tại sao... tôi vẫn chưa về nhà?
lang_multi_text.db,MultiText,Shixifeidu_main_2_8_7007_2,这是什么地方？,What is this place?,Đây là đâu?
lang_multi_text.db,MultiText,Shixifeidu_main_2_8_7007_3,你要去哪里？,Where are you going?,Anh muốn đi đâu?
lang_multi_text.db,MultiText,Shixifeidu_main_2_8_7007_4,这是什么地方？这不是穗波市的市中心吗？,What is this place? This is downtown Honami.,Đây là đâu ư? Đây không phải trung tâm Honami sao?
lang_multi_text.db,MultiText,Shixifeidu_main_2_8_7007_5,啊，我知道了！你是外地过来旅游的对吧！的确是到了适合旅行的季节啊……可惜我请不出假……明明今天还是我女儿的生日来着……,"...Ah, I see. You must be a traveler! This is a nice season for sightseeing, after all... Shame I can't take any time off. It's even my daughter's birthday today...","À, tôi biết rồi! Bạn là khách du lịch từ nơi khác đến đúng không! Quả thực đã đến mùa thích hợp để du lịch rồi... Tiếc là tôi không xin nghỉ được... Rõ ràng hôm nay còn là sinh nhật con gái tôi nữa chứ..."
lang_multi_text.db,MultiText,Shixifeidu_main_2_8_7007_6,去哪里……当然是去公司了，唉……,"Where...? To the office, of course...","Đi đâu à... Đương nhiên là đến công ty rồi, haiz..."
lang_multi_text.db,MultiText,Shixifeidu_main_2_8_7007_7,虽然想到上班就胸闷气短头晕恶心！但是……今天是我女儿的生日呢，我得早点去公司，把工作都尽快处理好了，免得拖到加班……,"Just thinking about work makes me feel sick. But today's my daughter's birthday, so I've got to finish early. No overtime.","Mặc dù nghĩ đến đi làm là tức ngực khó thở chóng mặt buồn nôn! Nhưng mà... hôm nay là sinh nhật con gái tôi, tôi phải đến công ty sớm, giải quyết công việc nhanh chóng, tránh để phải tăng ca..."
lang_multi_text.db,MultiText,Shixifeidu_main_2_8_7007_8,今天到底是什么日子？,What day is it today?,Hôm nay rốt cuộc là ngày gì?
lang_multi_text.db,MultiText,Shixifeidu_main_2_8_7007_9,什么日子……今天是我女儿的生日啊……我要早点下班取了蛋糕回去的……诶？,"Today... I just said, it's my daughter's birthday. I need to clock out early and get the cake and...?",Ngày gì á... Hôm nay là sinh nhật con gái tôi mà... Tôi phải tan làm sớm để lấy bánh kem về... Ơ?
lang_multi_text.db,MultiText,Shixifeidu_main_2_8_7008_1,你好呀！有什么需要我帮忙的吗？,Hi! Hello! Do you need any help?,Xin chào! Có cần tôi giúp gì không?
lang_multi_text.db,MultiText,Shixifeidu_main_2_8_7008_2,你还记得刚才发生的事情吗？,Do you remember what just happened?,Cô còn nhớ chuyện vừa xảy ra không?
lang_multi_text.db,MultiText,Shixifeidu_main_2_8_7008_3,这里出了什么事？,What happened here?,Ở đây đã xảy ra chuyện gì?
lang_multi_text.db,MultiText,Shixifeidu_main_2_8_7008_4,刚才……的事情？,Huh? What just happened...?,Chuyện... vừa nãy?
lang_multi_text.db,MultiText,Shixifeidu_main_2_8_7008_5,这里？出了什么事？咦，你是说穗波市吗？,"What happened here? Oh, you mean in Honami?","Ở đây? Xảy ra chuyện gì? Ơ, ý anh là Honami à?"
lang_multi_text.db,MultiText,Shixifeidu_main_2_8_7008_6,穗波市不是很好吗？这么宽敞、繁华，比我家乡那个小地方好多啦……,"Well, you know, everything's really nice here! Honami is so big and busy, a lot livelier than the little town I'm from!","Honami không phải rất tốt sao? Rộng rãi, sầm uất thế này, tốt hơn cái nơi nhỏ bé quê tôi nhiều..."
lang_multi_text.db,MultiText,Shixifeidu_main_2_8_7008_7,咦，你在说什么呀？我们不是才见面吗？,What do you mean? We've only just met.,"Ủa, anh đang nói gì vậy? Chúng ta không phải mới gặp nhau sao?"
lang_multi_text.db,MultiText,Shixifeidu_main_2_8_7009_1,诶！你好！怎么啦？,"Oh, hi! Do you need something?",Ê! Xin chào! Sao thế?
lang_multi_text.db,MultiText,Shixifeidu_main_2_8_7009_10,你觉得，我给她买花的话，她会意识到……我其实，是在说对不起吗？,"Do you think… if I give her flowers, she'll know it's an apology?","Anh nghĩ xem, nếu tôi mua hoa cho bà ấy, bà ấy có nhận ra... thực ra tôi đang nói xin lỗi không?"
lang_multi_text.db,MultiText,Shixifeidu_main_2_8_7009_11,她会感受到你的心意的。,She'll definitely know that it is.,Bà ấy sẽ cảm nhận được tấm lòng của cô.
lang_multi_text.db,MultiText,Shixifeidu_main_2_8_7009_12,她一定也在等待能与你坦诚沟通的时刻。,"She's probably waiting to talk to you, too.",Bà ấy chắc chắn cũng đang đợi khoảnh khắc có thể trò chuyện thẳng thắn với cô.
lang_multi_text.db,MultiText,Shixifeidu_main_2_8_7009_13,那就……那就借你吉言！谢谢你！等我回家我就……嗯？,"You really think so? Thanks! When I get home, I'll—",Vậy thì... mượn lời chúc của anh nhé! Cảm ơn anh! Đợi tôi về nhà tôi sẽ... Hả?
