db_file,table_name,id,zh,en,vi
lang_multi_text.db,MultiText,Character_Encore_25_10,我知道了。,Got it.,Tôi hiểu rồi.
lang_multi_text.db,MultiText,Character_Encore_25_11,你们来到了信念之盾牌的所在处。冒险小队三人分工明确，开始寻宝。,"Upon reaching the sands where the Shield of Faith is hidden, you and your team split up to search for the relic.","Mọi người đã đến nơi ẩn giấu Khiên Tín Niệm. Đội phiêu lưu ba người phân công rõ ràng, bắt đầu tìm kho báu."
lang_multi_text.db,MultiText,Character_Encore_25_2,据说，这个盾牌考验着冒险者们的心，只有最坚定的勇者才能找到。,They say only the bravest adventurers can find it as it puts their will to the test.,"Nghe nói, tấm khiên này thử thách trái tim của các nhà phiêu lưu, chỉ có dũng giả kiên định nhất mới có thể tìm thấy."
lang_multi_text.db,MultiText,Character_Encore_25_3,把这里翻个遍吧。,Time to comb the beach.,Lục tung chỗ này lên nào.
lang_multi_text.db,MultiText,Character_Encore_25_4,看起来有点累……,Seems like a hassle...,Nhìn có vẻ hơi mệt...
lang_multi_text.db,MultiText,Character_Encore_25_5,好，劲头十足！,Yeah! That's the spirit!,"Tốt, đầy năng lượng luôn!"
lang_multi_text.db,MultiText,Character_Encore_25_6,可不要在开始的时候就认输啦。,"Oh, you don't wanna jinx it.",Đừng có chịu thua ngay từ lúc bắt đầu chứ.
lang_multi_text.db,MultiText,Character_Encore_25_7,我们可以分头去找，小盈负责左边，安可负责右边，中间的部分就交给{Male=大哥哥;Female=大姐姐}吧！,"Ying can go left, Encore will go right, and you can take care of the middle!","Chúng ta chia ra mà tìm nhé, Tiểu Doanh phụ trách bên trái, Encore phụ trách bên phải, phần ở giữa thì giao cho {Male=anh;Female=chị} nhé!"
lang_multi_text.db,MultiText,Character_Encore_25_8,要是找到什么特别的东西，就拿到我这里来，我们一起看看！,"If anyone finds anything interesting, show me and we can take a look at it together!","Nếu tìm thấy thứ gì đặc biệt thì mang đến chỗ tôi, chúng ta cùng xem nhé!"
lang_multi_text.db,MultiText,Character_Encore_25_9,好、好的。,O-Okay.,Đ-Được rồi.
lang_multi_text.db,MultiText,Character_Encore_26_1,这个也不是，唉……,"Hmm... Not this one, either...","Cái này cũng không phải, haiz..."
lang_multi_text.db,MultiText,Character_Encore_26_10,其实看到那把剑的时候我就觉得，这可能就是妈妈留给我的一场游戏。,"When I first saw that sword, I was getting a feeling that it might just be a game Mom left for me.","Thật ra lúc nhìn thấy thanh kiếm đó, tớ đã có linh cảm rằng đây có thể là một trò chơi mà mẹ để lại cho tớ."
lang_multi_text.db,MultiText,Character_Encore_26_11,那些大人都说，现实中不存在什么实现愿望的大门，那只是一个故事。,Grown-ups always tell me that there's no such thing as a Gateway of Wishes. It only exists in imagination.,"Mấy người lớn đều nói, trong thực tế không tồn tại cánh cửa thực hiện ước nguyện nào cả, đó chỉ là một câu chuyện thôi."
lang_multi_text.db,MultiText,Character_Encore_26_13,之前安可说过，只要相信，故事里发生的那些事情就是真实存在的。,"Remember what Encore said before? As long as you believe, everything that happens in the story can be real.","Trước đó Encore đã nói rồi mà, chỉ cần tin tưởng, thì những chuyện xảy ra trong câu chuyện đều là thật."
lang_multi_text.db,MultiText,Character_Encore_26_14,在确认结果之前，不妨先继续找找看。,"But before we make our decisions, how about we search a bit more?","Trước khi xác nhận kết quả, cứ tiếp tục tìm thử xem đã."
lang_multi_text.db,MultiText,Character_Encore_26_15,嗯……我明白了，谢谢你！,Okay... I see. Thanks!,"Ừm... tớ hiểu rồi, cảm ơn cậu!"
lang_multi_text.db,MultiText,Character_Encore_26_16,那我继续找盾牌啦，不知道它到底被藏在哪里……,I should keep looking for the shield. I wonder where it is in all this sand...,"Vậy tớ tiếp tục tìm chiếc khiên nhé, không biết nó bị giấu ở đâu nữa..."
lang_multi_text.db,MultiText,Character_Encore_26_2,收获如何？,Find anything?,Tìm được gì không?
lang_multi_text.db,MultiText,Character_Encore_26_3,只是一些普通的贝壳……看上去也不是盾牌呢。,Just some ordinary shells... I don't think they count as shields...,Chỉ là mấy cái vỏ sò bình thường thôi... trông cũng không giống chiếc khiên nhỉ.
lang_multi_text.db,MultiText,Character_Encore_26_4,虽然安可非常肯定，但{Male=哥哥;Female=姐姐}觉得实现愿望的大门真的存在吗？,"Encore seems to be very sure about it, but do you really believe that the Gateway of Wishes exists?","Tuy Encore rất chắc chắn, nhưng {Male=anh;Female=chị} có nghĩ cánh cửa thực hiện ước nguyện thật sự tồn tại không?"
lang_multi_text.db,MultiText,Character_Encore_26_5,存在。,It exists.,Có tồn tại.
lang_multi_text.db,MultiText,Character_Encore_26_6,不一定存在。,It might not exist.,Chưa chắc đã tồn tại.
lang_multi_text.db,MultiText,Character_Encore_26_7,安可也这样说。,That's what Encore's said too.,Encore cũng nói vậy đấy.
lang_multi_text.db,MultiText,Character_Encore_26_8,但我总是在想，会不会就只是个故事呢……,"But I keep on thinking, could it just be a story?...","Nhưng tớ cứ nghĩ mãi, liệu đó có chỉ là một câu chuyện thôi không..."
lang_multi_text.db,MultiText,Character_Encore_26_9,这样啊……其实我也在想，会不会就只是个故事呢……,"Oh, I see... Actually, I've been thinking the same thing, could it just be a story?...","Vậy à... thật ra tớ cũng đang nghĩ, liệu đó có chỉ là một câu chuyện thôi không..."
lang_multi_text.db,MultiText,Character_Encore_27_1,{Male=大哥哥;Female=大姐姐}，怎么样，你找到盾牌了吗？,Well? Did you find the shield?,"{Male=大哥哥;Female=大姐姐}, thế nào rồi, cậu tìm được tấm khiên chưa?"
lang_multi_text.db,MultiText,Character_Encore_27_10,所以，盾牌一定是存在的。,Encore's absolutely certain that the shield is out there somewhere.,Nên tấm khiên nhất định là có thật.
lang_multi_text.db,MultiText,Character_Encore_27_11,安可要继续找找看啦。,And that's why Encore will keep looking for it.,Encore sẽ tiếp tục tìm xem sao đây.
lang_multi_text.db,MultiText,Character_Encore_27_2,还没有。,No luck yet.,Vẫn chưa tìm được.
lang_multi_text.db,MultiText,Character_Encore_27_3,安可也还没找到，刚才小盈还问我，这个盾牌真的存在吗，{Male=大哥哥;Female=大姐姐}觉得呢？,Me neither. Ying even came over just now and asked me if the shield trully exists. What do you think?,"Encore cũng chưa tìm được, lúc nãy Tiểu Doanh còn hỏi mình, tấm khiên này có thật sự tồn tại không, {Male=大哥哥;Female=大姐姐} nghĩ sao?"
lang_multi_text.db,MultiText,Character_Encore_27_4,存在。,It exists.,Có tồn tại.
lang_multi_text.db,MultiText,Character_Encore_27_5,不存在。,It doesn't exist.,Không tồn tại.
lang_multi_text.db,MultiText,Character_Encore_27_6,你和安可想得一样呢！,We're thinking the same thing!,Cậu nghĩ giống Encore luôn!
lang_multi_text.db,MultiText,Character_Encore_27_7,确实有这个可能，但安可不这样想。,"That could be possible, but Encore doesn't believe so.","Cũng có khả năng đó, nhưng Encore không nghĩ vậy."
lang_multi_text.db,MultiText,Character_Encore_27_8,因为那张藏宝图，是小盈的妈妈留给她的。,It's because the treasure map was given to Ying by her mother.,"Bởi vì tấm bản đồ kho báu đó, là mẹ Tiểu Doanh để lại cho bạn ấy mà."
lang_multi_text.db,MultiText,Character_Encore_27_9,安可觉得，她的妈妈一定是希望她能实现自己的愿望，才给了她那张藏宝图。,And she did it so that Ying's wishes could come true.,"Encore nghĩ, mẹ bạn ấy nhất định muốn bạn ấy thực hiện được ước nguyện, nên mới trao tấm bản đồ kho báu đó cho bạn ấy."
lang_multi_text.db,MultiText,Character_Encore_28_1,仔仔细细把这一片都翻了个遍，什么都没有找到。你不禁思考：故事里的信念之盾牌真的存在吗？,"As you search the beach and find nothing, you can't help but wonder: Does the Shield of Faith from the story really exist?",Lục tung cả khu vực này rồi mà chẳng tìm thấy gì. Cậu không khỏi tự hỏi: Tấm Khiên Tín Niệm trong câu chuyện có thật sự tồn tại không?
lang_multi_text.db,MultiText,Character_Encore_29_1,翻出来了一个旧皮靴。是谁乱扔垃圾！,You dig up an old boot. Hey! No littering!,Đào được một chiếc ủng da cũ. Ai mà xả rác bừa bãi thế này!
lang_multi_text.db,MultiText,Character_Encore_2_1,什么时候故事才开始啊，上次安可只讲到一半，回去后我翻了好多书都找不到后续……,"Ohh, I hope Encore starts her story soon, she only finished half of it last time, and I couldn't find the rest of it in any of the books at home...","Bao giờ câu chuyện mới bắt đầu đây, lần trước Encore mới kể được một nửa thôi, về nhà tìm bao nhiêu sách cũng không thấy phần tiếp theo..."
lang_multi_text.db,MultiText,Character_Encore_2_2,也不知道她的故事都从哪里来的，毕竟她又不是我们这儿的人。,"I wonder where she gets all her stories from. I mean, she's not from around here.","Cũng không biết cô ấy lấy những câu chuyện đó từ đâu ra, dù sao cô ấy cũng không phải người ở đây mà."
lang_multi_text.db,MultiText,Character_Encore_2_3,是哦，安可的家在哪儿呢？等故事讲完了，我们就去问问她吧！,"Yeah, where is Encore from? Let's ask her once the story's finished.","Ừ nhỉ, nhà Encore ở đâu nhỉ? Đợi kể xong chuyện, mình đi hỏi cô ấy đi!"
lang_multi_text.db,MultiText,Character_Encore_30_1,惊喜！一个没有人要的宝箱，打开来之后说不定会有些亮闪闪的东西？,Surprise! An abandoned treasure chest! Who knows—maybe there's something shiny inside?,"Bất ngờ chưa! Một chiếc rương kho báu không ai nhận, mở ra biết đâu có gì lấp lánh bên trong?"
lang_multi_text.db,MultiText,Character_Encore_31_1,找到了，这应该就是信念之盾牌。,Bingo. This has to be the Shield of Faith.,"Tìm được rồi, đây chắc chắn là Tấm Khiên Tín Niệm."
lang_multi_text.db,MultiText,Character_Encore_31_2,嗯？还有一封信，收起来给安可她们看看吧。,Hmm? There's a letter attached to it. I should bring it over to Encore and Ying.,"Hm? Còn có một bức thư nữa, mang về cho Encore và mọi người xem thử."
lang_multi_text.db,MultiText,Character_Encore_32_1,{Male=大哥哥;Female=大姐姐}，怎么样，你找到盾牌了吗？,Well? Did you find the shield?,"{Male=大哥哥;Female=大姐姐}, thế nào rồi, cậu tìm được tấm khiên chưa?"
lang_multi_text.db,MultiText,Character_Encore_32_2,找到了。,Got it in my hands.,Tìm được rồi.
lang_multi_text.db,MultiText,Character_Encore_32_3,好厉害，看来找东西还得看你！我去找小盈过来吧！,Way to go! I know who to call if I ever need to find something. I'll go get Ying!,"Giỏi quá, xem ra tìm đồ thì phải nhờ cậu thôi! Để Encore đi gọi Tiểu Doanh đến nha!"
lang_multi_text.db,MultiText,Character_Encore_33_1,你们看，这应该就是故事里所说的盾牌了。,This should be the shield mentioned in the story.,"Mọi người xem, đây chắc chắn là tấm khiên được nhắc đến trong câu chuyện rồi."
lang_multi_text.db,MultiText,Character_Encore_33_10,“即使努力过后仍一无所获，你也没有放弃寻找。这面信念之盾牌就是你应得的嘉奖。”,"""Although the bulk of your efforts were in vain, you did not give up and continued searching. Hence, this Shield of Faith is your well-deserved reward.""","""Dù sau bao nỗ lực vẫn chẳng tìm được gì, con vẫn không từ bỏ việc tìm kiếm. Tấm Khiên Tín Niệm này chính là phần thưởng xứng đáng dành cho con."""
lang_multi_text.db,MultiText,Character_Encore_33_11,“在未来，当你感到迷茫的时候，不妨想想这次旅行的意义吧。”,"""If you ever feel lost in the future, why not take a moment and ponder on the meaning of your journey?""","""Trong tương lai, khi con cảm thấy lạc lõng, hãy thử nghĩ lại ý nghĩa của chuyến hành trình này nhé."""
lang_multi_text.db,MultiText,Character_Encore_33_12,“藏在我们心中那坚定的信念，会带领我们穿过迷雾，看见希望之光。”,"""The firm belief in our hearts shall guide us through darkness until we reach the light of hope.""","""Niềm tin vững chắc ẩn sâu trong trái tim chúng ta sẽ dẫn dắt ta vượt qua màn sương mù, nhìn thấy ánh sáng của hy vọng."""
lang_multi_text.db,MultiText,Character_Encore_33_13,“而接下来，我会告诉你有关希望之花冠的线索。”,"""Now, I'm sure you're wondering how can you find the Wreath of Hope.""","""Và tiếp theo, ta sẽ cho con biết manh mối về Vòng Hoa Hy Vọng."""
lang_multi_text.db,MultiText,Character_Encore_33_14,“请带上小小的心愿，到我们约定的小花田去吧。”,"""Bring with you your wishes and proceed to the Garden of Promise.""","""Hãy mang theo những điều ước nhỏ bé, và đến Cánh Đồng Hoa Ước Hẹn của chúng ta nhé."""
lang_multi_text.db,MultiText,Character_Encore_33_15,小花田……？,The garden?,Cánh đồng hoa nhỏ...?
lang_multi_text.db,MultiText,Character_Encore_33_16,约定的花田——啊，原来如此。,The Garden of Promise—,"Cánh Đồng Hoa Ước Hẹn - à, ra là vậy."
lang_multi_text.db,MultiText,Character_Encore_33_17,我想……我知道那个地方。大家可以陪我去吗？,Oh! I think... I might know where it is.,Mình nghĩ... mình biết nơi đó. Mọi người đi cùng mình được không?
lang_multi_text.db,MultiText,Character_Encore_33_18,那太好了！安可当然要去！{Male=大哥哥;Female=大姐姐}，我们出发啦！,Fantastic! Then that's our next stop! Onwards!,"Tuyệt vời quá! Encore đương nhiên phải đi chứ! {Male=Anh ơi;Female=Chị ơi}, chúng ta xuất phát thôi!"
lang_multi_text.db,MultiText,Character_Encore_33_19,"终于找到了信念之盾牌和第二封信。根据信中的线索，希望之花冠就在约定的花田之中。
小盈表示自己知道花田在哪。你们决定一起前往约定的花田。","After discovering the Shield of Faith along with a second letter, you learn that the Wreath of Hope is hidden within the Garden.

Ying then reveals that she knows the location of the Garden, and you agree to journey there together.","Cuối cùng cũng tìm được Khiên Tín Niệm và bức thư thứ hai. Theo manh mối trong thư, Vòng Hoa Hy Vọng nằm trong Cánh Đồng Hoa Ước Hẹn.
Tiểu Doanh cho biết cô ấy biết cánh đồng hoa ở đâu. Mọi người quyết định cùng nhau đến Cánh Đồng Hoa Ước Hẹn."
lang_multi_text.db,MultiText,Character_Encore_33_2,这也是木头做的……,It's also made of wood...,Cái này cũng làm bằng gỗ luôn...
lang_multi_text.db,MultiText,Character_Encore_33_3,但看起来很精致呢！配合那把勇气之宝剑，一定能让勇者所向披靡！,"But look at how well-made it is! With the Sword of Courage in one hand, and the Shield of Faith in the other, it's an invincible combo!","Nhưng trông tinh xảo lắm nè! Kết hợp với Bảo Kiếm Dũng Khí, chắc chắn sẽ giúp dũng sĩ bách chiến bách thắng!"
lang_multi_text.db,MultiText,Character_Encore_33_4,那位打造盾牌的人，肯定很了不起吧！,The person who crafted this shield really knew their stuff!,Người chế tác tấm khiên này chắc hẳn rất tài giỏi!
lang_multi_text.db,MultiText,Character_Encore_33_5,这里还有一封信。,There's also a letter.,Ở đây còn có một bức thư nữa.
lang_multi_text.db,MultiText,Character_Encore_33_6,想必里面会有花冠的线索。,Time for clues about the next relic. The Wreath of Hope.,Chắc bên trong sẽ có manh mối về vòng hoa.
lang_multi_text.db,MultiText,Character_Encore_33_7,小盈，快看看信里写了什么！,"Hurry, Ying! What does it say?","Tiểu Doanh, mau xem trong thư viết gì đi!"
lang_multi_text.db,MultiText,Character_Encore_33_8,好、好，我来看看，这上面写着……,O-Okay. Let's see here. It says...,"Được, được, để mình xem nào, trên này viết rằng..."
lang_multi_text.db,MultiText,Character_Encore_33_9,“再次恭喜你，我的小小勇士。”,"""Congratulations again to you, my little warrior.""","""Một lần nữa chúc mừng con, dũng sĩ nhỏ bé của ta."""
lang_multi_text.db,MultiText,Character_Encore_34_1,就是这里了。,This is it.,Chính là chỗ này rồi.
lang_multi_text.db,MultiText,Character_Encore_34_10,我当然知道，只是总会想起和妈妈的约定。,I understood that. But it always reminds me of my promise to Mom.,"Tất nhiên mình biết, chỉ là cứ nhớ mãi lời hứa với mẹ."
lang_multi_text.db,MultiText,Character_Encore_34_11,我真的好想好想她……,I miss her so much...,Mình nhớ mẹ lắm lắm...
lang_multi_text.db,MultiText,Character_Encore_34_12,我现在都知道了，这个盾牌和剑，都是妈妈留给我的宝物。,"Now I see, this shield and sword are all treasures that Mom left me.","Giờ mình hiểu rồi, cái khiên và thanh kiếm này, đều là bảo vật mẹ để lại cho mình."
lang_multi_text.db,MultiText,Character_Encore_34_13,还有这里，妈妈是想用那些花和我一起编一顶花冠吧……,"And here, I think she probably wanted to make a wreath with me using those flowers...","Còn chỗ này, chắc mẹ muốn dùng mấy bông hoa đó để cùng mình kết một vòng hoa nhỉ..."
lang_multi_text.db,MultiText,Character_Encore_34_14,小盈……,"Oh, Ying...",Tiểu Doanh...
lang_multi_text.db,MultiText,Character_Encore_34_15,安可，{PlayerName}，谢谢你们。,"Thank you, Encore and {PlayerName}.","Encore, {PlayerName}, cảm ơn các cậu."
lang_multi_text.db,MultiText,Character_Encore_34_16,其实之前看到爸爸拿着地图时难过的样子，我就感觉到，妈妈她……,"Actually, when I saw Dad looking sad while holding the map, I had the feeling that Mom...","Thật ra trước đó khi thấy bố cầm tấm bản đồ với vẻ buồn bã, mình đã linh cảm rằng, mẹ..."
lang_multi_text.db,MultiText,Character_Encore_34_17,她留下这份藏宝图，可能只是想和我玩一个游戏。,Might have left this treasure map to play a game with me.,"Mẹ để lại tấm bản đồ kho báu này, có lẽ chỉ muốn chơi một trò chơi với mình thôi."
lang_multi_text.db,MultiText,Character_Encore_34_18,我可能真的再也见不到她了，我不能再和她说话，不能告诉她我长大了……,"And I may never get to see her again, talk to her, and tell her how much I've grown...","Có lẽ mình thật sự sẽ không bao giờ gặp lại mẹ nữa, không thể nói chuyện với mẹ, không thể kể cho mẹ nghe rằng mình đã lớn rồi..."
lang_multi_text.db,MultiText,Character_Encore_34_19,但是，妈妈一定是想要给我一个惊喜，让我开心……,"But Mom must've wanted to give me a surprise, to make me happy...","Nhưng mà, mẹ chắc chắn muốn tặng mình một bất ngờ, muốn mình vui..."
lang_multi_text.db,MultiText,Character_Encore_34_2,这里……光秃秃的，什么都没有。,This place... feels empty. There's nothing here.,"Chỗ này... trống trơn, chẳng có gì cả."
lang_multi_text.db,MultiText,Character_Encore_34_20,我、我还是很开心，因为我们一起把妈妈留下来的宝物都找到了。,I am happy because we managed to find all the treasures she left behind together.,"Mình, mình vẫn rất vui, vì chúng ta đã cùng nhau tìm được hết bảo vật mẹ để lại rồi."
lang_multi_text.db,MultiText,Character_Encore_34_21,这把剑和这面盾牌，我会一直好好保存的。,I'll definitely find a nice place to keep this sword and shield safe.,"Thanh kiếm và tấm khiên này, mình sẽ luôn giữ gìn cẩn thận."
lang_multi_text.db,MultiText,Character_Encore_34_22,而这次冒险，就在这里结束吧。谢谢你们，安可，{PlayerName}。,"I think we should end our adventure here. Thank you, Encore and {PlayerName}.","Và chuyến phiêu lưu lần này, kết thúc ở đây nhé. Cảm ơn các cậu, Encore, {PlayerName}."
lang_multi_text.db,MultiText,Character_Encore_34_23,不用谢。,You're welcome.,Không có gì đâu.
lang_multi_text.db,MultiText,Character_Encore_34_24,要结束了啊……,We're ending it here...?,Kết thúc rồi sao...
lang_multi_text.db,MultiText,Character_Encore_34_25,……,...,...
lang_multi_text.db,MultiText,Character_Encore_34_26,安可？,Encore?,Encore?
lang_multi_text.db,MultiText,Character_Encore_34_27,队长都还没宣布冒险结束，你怎么就要先走啦。,"Our captain hasn't announced the end of our adventure yet, and you're thinking about leaving already?","Đội trưởng còn chưa tuyên bố kết thúc phiêu lưu, sao cậu lại định đi trước vậy."
lang_multi_text.db,MultiText,Character_Encore_34_28,不过，算啦算啦，今天的冒险就到这里吧，安可也要好好想想……,"Well, okay then. Let's call it a day right here. There's some stuff I need to wrap my head around too...","Mà thôi thôi, cuộc phiêu lưu hôm nay đến đây thôi nhé, Encore cũng cần suy nghĩ kỹ đã..."
lang_multi_text.db,MultiText,Character_Encore_34_29,你不是问过我羊咩勇士冒险故事的结局吗？,"I remember you asked me about the ending of the Wooly Warrior, right?",Cậu không phải đã hỏi mình về kết cục của câu chuyện phiêu lưu Chiến Binh Cừu sao?
lang_multi_text.db,MultiText,Character_Encore_34_3,现在确实是这样……,It is now...,Giờ thì đúng là vậy...
lang_multi_text.db,MultiText,Character_Encore_34_30,虽然陪你找宝物的旅途结束了，但羊咩小队的冒险还要继续呀。,"Even though we finished finding the relics, Team Wooly's adventure goes on.","Dù hành trình cùng cậu tìm bảo vật đã kết thúc, nhưng cuộc phiêu lưu của Đội Cừu vẫn phải tiếp tục chứ."
lang_multi_text.db,MultiText,Character_Encore_34_31,那些故事安可还没有讲完呢……这样吧！,"There are still plenty of stories to tell... Oh, I know!",Mấy câu chuyện đó Encore còn chưa kể hết mà... Vậy thì thế này!
lang_multi_text.db,MultiText,Character_Encore_34_32,明天下午的时候，小盈愿意来这里听安可讲故事吗？,How about you come to Encore's story session tomorrow afternoon?,"Ngày mai buổi chiều, Tiểu Doanh có muốn đến đây nghe Encore kể chuyện không?"
lang_multi_text.db,MultiText,Character_Encore_34_33,明天……就在这里吗？,Tomorrow... You mean right here?,Ngày mai... ở đây luôn sao?
lang_multi_text.db,MultiText,Character_Encore_34_34,嗯！你要是想见证羊咩小队的冒险，就过来听听看，可不要缺席！,"Yes! If you want to find out what happens to Team Wooly, come over and listen to the rest of the story. Be there or be square!","Ừ! Nếu cậu muốn chứng kiến cuộc phiêu lưu của Đội Cừu, thì đến nghe thử nhé, không được vắng mặt đâu đấy!"
lang_multi_text.db,MultiText,Character_Encore_34_35,我……好的。那，明天再见啦，安可、{PlayerName}！,I... Okay then. I'll see you tomorrow!,"Mình... được thôi. Vậy, ngày mai gặp lại nhé, Encore, {PlayerName}!"
lang_multi_text.db,MultiText,Character_Encore_34_36,嗯，明天再见啦，小盈。,"Yup. See you tomorrow, Ying.","Ừ, ngày mai gặp lại nhé, Tiểu Doanh."
lang_multi_text.db,MultiText,Character_Encore_34_37,明天见，小盈。,"See you tomorrow, Ying.","Ngày mai gặp nhé, Tiểu Doanh."
lang_multi_text.db,MultiText,Character_Encore_34_38,{PlayerName}{Male=大哥哥;Female=大姐姐}，你觉得，就这样结束的话，算是个好结局吗？,"{PlayerName}, do you think this is a good ending to the story?","{PlayerName}{Male=大哥哥;Female=大姐姐}, cậu nghĩ sao, nếu cứ kết thúc thế này, thì có được coi là một kết cục tốt đẹp không?"
lang_multi_text.db,MultiText,Character_Encore_34_39,是个好结局。,It's a good ending.,Là một kết cục tốt đẹp.
lang_multi_text.db,MultiText,Character_Encore_34_4,但、但之前，这里开着很多鸢尾花。,B-But it used to be filled with irises.,"Nhưng, nhưng trước đây, ở đây nở rất nhiều hoa diên vĩ."
