db_file,table_name,id,zh,en,vi
lang_multi_text.db,MultiText,FavorWord_160714_Content,一个是活泼的海星，一个是柔软的海兔。啊，要说哪个是哪个，嗯……我也分不太清呢。,"A lively Starfish and a gentle Sea Bunny... But I must admit, I can't tell them apart.","Một cô là sao biển hoạt bát, một cô là thỏ biển dịu dàng. À, nói về ai là ai ấy nhỉ, ừm... tôi cũng không phân biệt rõ lắm."
lang_multi_text.db,MultiText,FavorWord_160714_Title,关于珈德妮娅&罗斯玛丽,About Gardenia & Rosemary,Về Gardenia & Rosemary
lang_multi_text.db,MultiText,FavorWord_160715_Content,拎个大箱子，还会放烟花的那个小姑娘？很有趣哦，要是能把她接过来，宅子里也会热闹一些吧？呵呵，开玩笑的。,"The little girl with a giant box who plays with fireworks? A fascinating child. I wonder if bringing her into this castle would liven it up a little. Oh relax, I'm only teasing.","Cô bé xách chiếc hộp to đùng, lại còn biết bắn pháo hoa ấy à? Thú vị lắm đấy, nếu đón cô bé về đây, dinh thự chắc cũng vui hơn nhỉ? Hehe, đùa thôi."
lang_multi_text.db,MultiText,FavorWord_160715_Title,关于洛可可,About Roccia,Về Roccia
lang_multi_text.db,MultiText,FavorWord_160716_Content,原来「人」的灵魂，真的可以冲破「神」的躯壳……当狂欢的花瓣再次洒落<te href=850097>拉古那</te>的街巷，「圣女」也终能做回她自己。,"She accomplished the impossible, reclaiming her humanity from the cage of a Divinity's vessel. When the Carnevale petals fall upon <te href=850097>Ragunna</te>'s streets again, the Holy Maiden will at last be herself.","Hóa ra linh hồn của ""người"" thực sự có thể phá vỡ thân xác của ""thần""... Khi cánh hoa lễ hội một lần nữa rải xuống đường phố <te href=850097>Ragunna</te>, ""Thánh Nữ"" cuối cùng cũng có thể trở lại là chính mình."
lang_multi_text.db,MultiText,FavorWord_160716_Title,关于卡提希娅,About Cartethyia,Về Cartethyia
lang_multi_text.db,MultiText,FavorWord_160717_Content,很难形容呢，一定要说的话，大概是灯塔水母吧？小小的灯塔水母，孤独地漂泊在漫无边际的时光中，一点一点摸索着驱散黑暗……{TA}散发出的光芒细密绵长，温柔地照拂着世间万物，自始至终。,"Hmm, what would be a fitting analogy... perhaps an immortal jellyfish? Like these delicate, shimmering creatures roving alone in the darkness, {Male=he;Female=she} dispels shadows with {Male=his;Female=her} gentle light, inch by inch, until the end of time.","Thật khó mô tả, nếu nhất định phải nói thì... có lẽ là sứa bất tử nhỉ? Chú sứa bất tử nhỏ bé, cô độc trôi dạt trong dòng thời gian vô tận, từng chút từng chút tìm cách xua tan bóng tối... Ánh sáng {TA} tỏa ra dịu dàng mà bền bỉ, nhẹ nhàng soi chiếu vạn vật trên đời, từ đầu đến cuối."
lang_multi_text.db,MultiText,FavorWord_160717_Title,关于漂泊者,About Rover,Về Lữ Khách
lang_multi_text.db,MultiText,FavorWord_160718_Content,黑珍珠磨成粉、淋上紫合欢汁、撒上荆棘海星花冠，封进以你为名的琉璃瓶中，用我们共同经历的时光缓慢发酵……到了今天，成色刚刚好。打开这瓶生日秘药，轻轻倒上一滴……看到了吗，荡漾在你漫长生命中特殊一刻的，独属于我们二人的旖旎之海。,"Fine black pearl powder, the essence of Albizia flowers, and the petals of starfish blooms, all sealed in a glass vial bearing your name. For all the time we've shared, it has slowly fermented, ripening to perfection. Today, the moment has finally come. Unseal this birthday elixir, and look... Do you see? A fleeting moment in your long life, a private stretch of sea that belongs to only the two of us.","Ngọc trai đen nghiền thành bột, rưới nước ép hoa hợp hoan tím, rắc vương miện hoa sao gai, phong kín trong bình lưu ly mang tên cậu, để thời gian chúng ta cùng trải qua lên men chậm rãi... Đến hôm nay, sắc đã vừa vặn. Mở chai bí dược sinh nhật này ra, nhỏ nhẹ một giọt... Cậu thấy không, đang gợn sóng trong khoảnh khắc đặc biệt của cuộc đời dài đằng đẵng ấy - biển mộng mơ chỉ thuộc về hai chúng ta."
lang_multi_text.db,MultiText,FavorWord_160718_Title,生日祝福,Birthday Wishes,Chúc mừng sinh nhật
lang_multi_text.db,MultiText,FavorWord_160719_Content,（语气词）,(Effort sound),(Tiếng thở)
lang_multi_text.db,MultiText,FavorWord_160719_Title,闲趣·一,Idle: I,Nhàn thú - I
lang_multi_text.db,MultiText,FavorWord_160720_Content,嗯……味道还不错。,Hmmm... it tastes good.,Ừm... hương vị cũng khá ngon đấy.
lang_multi_text.db,MultiText,FavorWord_160720_Title,闲趣·二,Idle: II,Nhàn thú - II
lang_multi_text.db,MultiText,FavorWord_160721_Content,（语气词）,(Effort sound),(Tiếng thở)
lang_multi_text.db,MultiText,FavorWord_160721_Title,闲趣·三,Idle: III,Nhàn thú - III
lang_multi_text.db,MultiText,FavorWord_160722_Content,<te href=850094>翡萨烈</te>现任家主，「毒药」坎特蕾拉。是「毒」，还是「药」，取决于你的用法哦……嘘，不用说出口，当你进入我的海域，周身浮现的波纹，已经将一切都告诉了我。,"The current head of <te href=850094>Fisalia</te>, Cantarella, the Bane. Whether I am the Bane of the wicked or the pure is yours to decide. Shh, no need to answer. The moment you arrived, the ripples that surrounded you told me all I needed to know.","Gia chủ đương nhiệm của <te href=850094>Fisalia</te>, ""Độc Dược"" Cantarella. Là ""độc"" hay là ""dược"", phụ thuộc vào cách cậu dùng đấy... Suỵt, không cần nói ra đâu. Khi cậu bước vào vùng biển của tôi, những gợn sóng lan tỏa quanh người cậu đã nói hết cho tôi rồi."
lang_multi_text.db,MultiText,FavorWord_160722_Title,自我介绍,Self-Introduction,Tự giới thiệu
lang_multi_text.db,MultiText,FavorWord_160723_Content,去哪逛逛呢？,Shall we take a walk?,Đi đâu dạo chơi nhỉ?
lang_multi_text.db,MultiText,FavorWord_160723_Title,入队·一,Join Team: I,Nhập đội - I
lang_multi_text.db,MultiText,FavorWord_160724_Content,和你一起？可以哦。,With you? I'd be delighted.,Cùng cậu à? Được thôi.
lang_multi_text.db,MultiText,FavorWord_160724_Title,入队·二,Join Team: II,Nhập đội - II
lang_multi_text.db,MultiText,FavorWord_160725_Content,游啊游~,Let's dive in.,Bơi thôi bơi thôi~
lang_multi_text.db,MultiText,FavorWord_160725_Title,入队·三,Join Team: III,Nhập đội - III
lang_multi_text.db,MultiText,FavorWord_160726_Content,很温暖哦，我感受到了……抚摸着平静海面的细碎阳光。,"I can feel that warmth, just like the caress of sunlight tracing the sea.","Ấm áp lắm, tôi cảm nhận được rồi... Ánh nắng vụn vặt nhẹ nhàng vuốt ve mặt biển yên bình."
lang_multi_text.db,MultiText,FavorWord_160726_Title,突破·一,Ascension: I,Đột phá - I
lang_multi_text.db,MultiText,FavorWord_160727_Content,很畅快呢……就像暴雨洒进沉寂已久的海面，激起波涛万丈。,"Mmm, how exquisite... Like a storm crashing into a still sea, stirring it to life with waves that reach for the sky.","Thật sảng khoái... Như cơn mưa rào trút xuống mặt biển tĩnh lặng bấy lâu, dấy lên sóng cuộn ngàn trượng."
lang_multi_text.db,MultiText,FavorWord_160727_Title,突破·二,Ascension: II,Đột phá - II
lang_multi_text.db,MultiText,FavorWord_160728_Content,嗯~一股汹涌的力量搅动着漩涡，让整个大海为之荡漾。,"Ah... Like a fierce undertow sweeping through the abyss, causing the sea itself to tremble.","Hm~ Một luồng sức mạnh cuồn cuộn khuấy động xoáy nước, khiến cả đại dương phải rung chuyển."
lang_multi_text.db,MultiText,FavorWord_160728_Title,突破·三,Ascension: III,Đột phá - 3
lang_multi_text.db,MultiText,FavorWord_160729_Content,无人可以探求深渊的底部，无人可以知晓大海的心意……而勇敢的人涉过暗潮，深海则会给予最温柔、最本真的回应——献出所有的珍宝，共享最深的秘密。,"Who can plumb the sea's depths, or uncover its secrets? Yet for those who brave its dark currents, the sea offers her truest, most tender gifts—her treasures, her deepest secret.","Không ai có thể thăm dò đáy vực sâu, không ai có thể thấu hiểu lòng biển cả... Nhưng người dũng cảm lội qua ám triều, thì biển sâu sẽ đáp lại bằng sự dịu dàng nhất, chân thành nhất - dâng hết mọi châu báu, chia sẻ bí mật sâu thẳm nhất."
lang_multi_text.db,MultiText,FavorWord_160729_Title,突破·四,Ascension: IV,Đột phá - 4
lang_multi_text.db,MultiText,FavorWord_160730_Content,游过倒悬的天与海，穿过交叠的过去与未来，你终于触碰到了最深的海底。即便海面之下毒液弥漫，也总会有这么一块纯净之地为你而留。这里的海水流淌得很慢，我想和你一起，慢慢遨游。,"You rose from the ocean in the sky, wove through loops of time, and now you've reached the sea's depths. Remember, no matter how venomous the seabed, there will always be a place for you here. Here, the currents move slowly, and I long to... drift with you.","Bơi qua trời và biển đảo ngược, xuyên qua quá khứ và tương lai chồng chéo, cuối cùng ngươi đã chạm tới đáy biển sâu nhất. Dù bên dưới mặt biển độc dịch tràn lan, vẫn sẽ luôn có một vùng đất tinh khiết được giữ lại cho ngươi. Nước biển nơi đây chảy rất chậm, ta muốn cùng ngươi, chậm rãi ngao du."
lang_multi_text.db,MultiText,FavorWord_160730_Title,突破·五,Ascension: V,Đột phá - 5
lang_multi_text.db,MultiText,FavorWord_160731_Content,沉沦幻海。,Surge of deep tides.,Chìm vào biển ảo.
lang_multi_text.db,MultiText,FavorWord_160731_Title,重击·一,Heavy Attack: I,Trọng Kích - 1
lang_multi_text.db,MultiText,FavorWord_160732_Content,游曳深渊。,Call from the abyss.,Du ngoạn vực sâu.
lang_multi_text.db,MultiText,FavorWord_160732_Title,重击·二,Heavy Attack: II,Trọng Kích - 2
lang_multi_text.db,MultiText,FavorWord_160733_Content,别眨眼哦。,Try not to blink.,Đừng chớp mắt nhé.
lang_multi_text.db,MultiText,FavorWord_160733_Title,共鸣技能·一,Resonance Skill: I,Kỹ Năng Cộng Hưởng - 1
lang_multi_text.db,MultiText,FavorWord_160734_Content,嘘……安静些。,Shh... silence.,Suỵt... Yên lặng nào.
lang_multi_text.db,MultiText,FavorWord_160734_Title,共鸣技能·二,Resonance Skill: II,Kỹ Năng Cộng Hưởng - 2
lang_multi_text.db,MultiText,FavorWord_160735_Content,一起遨游吧。,Feel the tide pull.,Cùng ngao du thôi.
lang_multi_text.db,MultiText,FavorWord_160735_Title,共鸣技能·三,Resonance Skill: III,Kỹ Năng Cộng Hưởng - 3
lang_multi_text.db,MultiText,FavorWord_160736_Content,沉溺吧。,Surrender to it.,Chìm đắm đi.
lang_multi_text.db,MultiText,FavorWord_160736_Title,共鸣技能·四,Resonance Skill: IV,Kỹ Năng Cộng Hưởng - 4
lang_multi_text.db,MultiText,FavorWord_160737_Content,海的爱抚。,Caresses of the waves.,Vỗ về của biển.
lang_multi_text.db,MultiText,FavorWord_160737_Title,共鸣技能·五,Resonance Skill: V,Kỹ Năng Cộng Hưởng - 5
lang_multi_text.db,MultiText,FavorWord_160738_Content,暗潮汹涌。,Riptides claim you.,Ám triều cuồn cuộn.
lang_multi_text.db,MultiText,FavorWord_160738_Title,共鸣技能·六,Resonance Skill: VI,Kỹ Năng Cộng Hưởng - 6
lang_multi_text.db,MultiText,FavorWord_160739_Content,满溢而出……,Crash forth in fury...,Tràn ngập tuôn ra...
lang_multi_text.db,MultiText,FavorWord_160739_Title,共鸣技能·七,Resonance Skill: VII,Kỹ Năng Cộng Hưởng - 7
lang_multi_text.db,MultiText,FavorWord_160740_Content,深渊之底。,To sunken depths.,Đáy vực sâu thẳm.
lang_multi_text.db,MultiText,FavorWord_160740_Title,共鸣技能·八,Resonance Skill: VIII,Kỹ Năng Cộng Hưởng - 8
lang_multi_text.db,MultiText,FavorWord_160741_Content,窒息吧。,Suffocate.,Ngạt thở đi.
lang_multi_text.db,MultiText,FavorWord_160741_Title,共鸣回路·一,Forte Circuit: I,Cộng Hưởng Hồi Lộ - 1
lang_multi_text.db,MultiText,FavorWord_160742_Content,挣扎吧。,Struggle.,Giãy giụa đi.
lang_multi_text.db,MultiText,FavorWord_160742_Title,共鸣回路·二,Forte Circuit: II,Cộng Hưởng Hồi Lộ - 2
lang_multi_text.db,MultiText,FavorWord_160743_Content,呜咽吧。,Smother.,Rên rỉ đi.
lang_multi_text.db,MultiText,FavorWord_160743_Title,共鸣回路·三,Forte Circuit: III,Cộng Hưởng Hồi Lộ - 3
lang_multi_text.db,MultiText,FavorWord_160744_Content,沉入，无边幽海~,"Sink, into the endless deep.","Chìm vào, biển u tối vô biên~"
lang_multi_text.db,MultiText,FavorWord_160744_Title,共鸣解放·一,Resonance Liberation: I,Giải Phóng Cộng Hưởng - 1
lang_multi_text.db,MultiText,FavorWord_160745_Content,毒液，吞没深渊~,"Engulfed, by sea's venom.","Nọc độc, nhấn chìm vực sâu~"
lang_multi_text.db,MultiText,FavorWord_160745_Title,共鸣解放·二,Resonance Liberation: II,Giải Phóng Cộng Hưởng - 2
lang_multi_text.db,MultiText,FavorWord_160746_Content,请收下吧，海的呢喃……,"Sleep, in the whispers of sirens.","Hãy đón nhận đi, lời thì thầm của biển..."
lang_multi_text.db,MultiText,FavorWord_160746_Title,共鸣解放·三,Resonance Liberation: III,Giải Phóng Cộng Hưởng - 3
lang_multi_text.db,MultiText,FavorWord_160747_Content,放轻松，有我呢。,"Take a breath, I'm right here.","Thư giãn đi, có ta ở đây."
lang_multi_text.db,MultiText,FavorWord_160747_Title,变奏技能·一,Intro Skill: I,Biến Tấu Kỹ - 1
lang_multi_text.db,MultiText,FavorWord_160748_Content,就陪你会儿吧。,I'll keep you company.,Ở bên cậu một lúc vậy.
lang_multi_text.db,MultiText,FavorWord_160748_Title,变奏技能·二,Intro Skill: II,Biến Tấu Kỹ - 2
lang_multi_text.db,MultiText,FavorWord_160749_Content,呀，真失礼。,How rude.,"Ôi, thật thất lễ."
lang_multi_text.db,MultiText,FavorWord_160749_Title,受击·一,Hit: I,Bị Đánh - 1
lang_multi_text.db,MultiText,FavorWord_160750_Content,胆子不小嘛。,The nerve...,Gan cũng không nhỏ nhỉ.
lang_multi_text.db,MultiText,FavorWord_160750_Title,受击·二,Hit: II,Bị Đánh - 2
lang_multi_text.db,MultiText,FavorWord_160751_Content,有点痒呢……,"Hehe, that tickles...",Hơi ngứa đấy...
lang_multi_text.db,MultiText,FavorWord_160751_Title,重伤·一,Injured: I,Trọng Thương - 1
lang_multi_text.db,MultiText,FavorWord_160752_Content,哦？水准不错。,"Quite the standard, I see.",Ồ? Trình độ không tệ.
lang_multi_text.db,MultiText,FavorWord_160752_Title,重伤·二,Injured: II,Trọng Thương - 2
lang_multi_text.db,MultiText,FavorWord_160753_Content,熟悉的感觉……,I'm no stranger to this sensation...,Cảm giác quen thuộc...
lang_multi_text.db,MultiText,FavorWord_160753_Title,重伤·三,Injured: III,Trọng thương - 3
lang_multi_text.db,MultiText,FavorWord_160754_Content,从水中来，在水中去。,"From water, to water...","Từ nước mà đến, trong nước mà đi."
lang_multi_text.db,MultiText,FavorWord_160754_Title,力竭·一,Fallen: I,Kiệt sức - 1
lang_multi_text.db,MultiText,FavorWord_160755_Content,随着浮沫飘散吧……,Like sea foam on the shore...,Hãy tan theo bọt nước trôi đi...
lang_multi_text.db,MultiText,FavorWord_160755_Title,力竭·二,Fallen: II,Kiệt sức - 2
lang_multi_text.db,MultiText,FavorWord_160756_Content,出来吧，小东西。,"Come on out, little critter.","Ra đây nào, nhóc con."
lang_multi_text.db,MultiText,FavorWord_160756_Title,声骸异能·召唤,Echo Summon,Thanh Hài dị năng - Triệu hồi
lang_multi_text.db,MultiText,FavorWord_160757_Content,嗯~还挺有趣。,"Oh, this will be fun.",Hm~ cũng thú vị đấy.
lang_multi_text.db,MultiText,FavorWord_160757_Title,声骸异能·变身,Echo Transform,Thanh Hài dị năng - Biến hình
lang_multi_text.db,MultiText,FavorWord_160758_Content,又有谁，想沉入海中呢？,Who will sink into the depths with me?,Lại có ai muốn chìm xuống đáy biển đây?
lang_multi_text.db,MultiText,FavorWord_160758_Title,进战提醒,Enemies Near,Nhắc nhở giao chiến
lang_multi_text.db,MultiText,FavorWord_160759_Content,吹风的感觉不错。,What a divine breeze...,Đón gió thế này cũng dễ chịu nhỉ.
lang_multi_text.db,MultiText,FavorWord_160759_Title,滑翔,Glider,Lượn
lang_multi_text.db,MultiText,FavorWord_160760_Content,哦？有好东西呢。,"Oh? A little treasure, perhaps.",Ồ? Có đồ tốt kìa.
lang_multi_text.db,MultiText,FavorWord_160760_Title,感知,Sensor,Cảm nhận
lang_multi_text.db,MultiText,FavorWord_160761_Content,别急嘛。,"Why not savor this, hm?",Đừng vội mà.
lang_multi_text.db,MultiText,FavorWord_160761_Title,冲刺,Dash,Chạy nước rút
lang_multi_text.db,MultiText,FavorWord_160762_Content,所想即所得。,"We desire, and so we find.",Nghĩ gì được nấy.
lang_multi_text.db,MultiText,FavorWord_160762_Title,获得补给·一,Supply Chest: I,Nhận tiếp tế - 1
lang_multi_text.db,MultiText,FavorWord_160763_Content,想要的东西，总会在不经意间冒出来呢。,What we want has a way of appearing when least expected.,"Thứ mình muốn, tổng luôn xuất hiện lúc bất ngờ nhất."
lang_multi_text.db,MultiText,FavorWord_160763_Title,获得补给·二,Supply Chest: II,Nhận tiếp tế - 2
