db_file,table_name,id,zh,en,vi
lang_multi_text.db,MultiText,GNNPC_SJYDXZ_3_5,也可以在后方努力。,You can still help in the rear.,Cũng có thể nỗ lực ở hậu phương mà.
lang_multi_text.db,MultiText,GNNPC_SJYDXZ_3_6,相信总督的判断吧。,Let's trust the Ephor's judgment.,Hãy tin vào phán đoán của Tổng Đốc.
lang_multi_text.db,MultiText,GNNPC_SJYDXZ_3_7,是啊，所以我才会待在这里，想着能在后勤上努努力，为行猎的大家提供些帮助。,"I know. That's why I'm here, doing everything I can to support the hunt.","Đúng vậy, nên tôi mới ở lại đây, nghĩ là có thể cố gắng làm công tác hậu cần, giúp đỡ chút gì đó cho mọi người đi săn."
lang_multi_text.db,MultiText,GNNPC_SJYDXZ_3_8,……嗯。虽然一开始我无法接受，但冷静之后能理解如今的安排。,"Yeah. Took me a while to accept it, but I get it now.","...Ừm. Tuy ban đầu tôi không chấp nhận được, nhưng bình tĩnh lại thì có thể hiểu được sự sắp xếp hiện tại."
lang_multi_text.db,MultiText,GNNPC_SJYDXZ_3_9,不知道行猎的大家都怎么样了……这次黑潮云的起落比过往来得更为汹涌，希望他们不要出什么意外。,I wonder how they're doing… This Blightcloud is fiercer than usual. I hope they stay safe.,"Không biết mọi người đi săn thế nào rồi... Đợt mây Hắc Triều lần này dữ dội hơn trước nhiều, hy vọng họ không gặp chuyện gì bất trắc."
lang_multi_text.db,MultiText,GNNPC_SJYDXZ_3_10,没关系啦，要相信队长他们的实力。再说还有呜獭獭它们负责后勤整备，你就放心好了。,"They'll be fine. Have a little faith in the captain. Also, the Wootters are backing them up, so they are in good hands.","Không sao đâu, phải tin vào thực lực của đội trưởng và mọi người chứ. Hơn nữa còn có bọn Wootter lo liệu hậu cần, cậu cứ yên tâm đi."
lang_multi_text.db,MultiText,GNNPC_SJYDXZ_3_11,现在大伙应该都在赶路，等他们回到营地之后应该就会和我们联络了吧。,Now they're likely still on the move. I'm sure they'll get in touch once they're back at the camp.,"Chắc giờ mọi người đang trên đường, đợi họ về đến trại chắc sẽ liên lạc với chúng ta thôi."
lang_multi_text.db,MultiText,GNNPC_SJYDXZ_3_12,嗯，说得也是。我们盘点下所需的食物，早点把物资准备好给他们送过去吧。,You're right. Let's do a quick inventory and get the next supply shipment ready.,"Ừm, nói cũng phải. Chúng ta kiểm kê lại thực phẩm cần thiết, chuẩn bị vật tư sớm để gửi qua cho họ đi."
lang_multi_text.db,MultiText,GNNPC_SJYDXZ_4_1,桑古伊斯狩原……按照旅游手册上所说的，我们是不被允许前往吗？,"The Sanguis Plateaus... The travel guide says we're not allowed to go, right?",Cao Nguyên Sanguis... Theo như cẩm nang du lịch nói thì chúng ta không được phép đến đó sao?
lang_multi_text.db,MultiText,GNNPC_SJYDXZ_4_2,是啊，听说那里危险重重，并非所有人都被允许前往。,"That's right. It's said to be extremely dangerous, not a place for anyone.","Đúng thế, nghe nói ở đó nguy hiểm trùng trùng, không phải ai cũng được phép đến đâu."
lang_multi_text.db,MultiText,GNNPC_SJYDXZ_4_3,像我们这样只能围观角斗赛的普通游客就别去凑热闹了。,Tourists like us should just watch the Agon and stay out of the trouble.,Khách du lịch bình thường chỉ xem thi đấu giác đấu như chúng ta thì đừng có đi hóng hớt làm gì.
lang_multi_text.db,MultiText,GNNPC_SJYDXZ_4_4,真遗憾啊……这下没办法亲眼去看看狩原的传说了。,Shame. I was hoping to see the legend for myself.,Tiếc thật đấy... Thế này thì không được tận mắt chứng kiến truyền thuyết về Cao Nguyên rồi.
lang_multi_text.db,MultiText,GNNPC_SJYDXZ_4_5,看你的打扮你也是初来的游客吧？你也是为了狩原的传说而来吗？,You look like a first-time visitor too. Are you also here for the legend of the hunting grounds?,Nhìn cách ăn mặc thì cậu cũng là khách du lịch mới đến đúng không? Cậu cũng đến vì truyền thuyết về Cao Nguyên à?
lang_multi_text.db,MultiText,GNNPC_SJYDXZ_4_6,狩原的传说？,Legend of the hunting grounds?,Truyền thuyết về Cao Nguyên?
lang_multi_text.db,MultiText,GNNPC_SJYDXZ_4_7,那是什么？,What's that?,Đó là cái gì?
lang_multi_text.db,MultiText,GNNPC_SJYDXZ_4_8,我也只是听说的。在那个传说中，只要带上“两条命”抵达狩原深处的玛涅斯之底，你就将会获得英雄王的力量，获得无上的幸福。,"Just a story I heard. It says if you reach Manes Deep in the hunting grounds with ""two lives,"" you'll become the Hero of Heroes and find true happiness.","Tôi cũng chỉ nghe nói thôi. Trong truyền thuyết đó, chỉ cần mang theo ""hai mạng sống"" đến được Đáy Manes sâu trong Cao Nguyên, cậu sẽ nhận được sức mạnh của Vua Anh Hùng, đạt được hạnh phúc tột cùng."
lang_multi_text.db,MultiText,GNNPC_SJYDXZ_4_9,……你真的相信吗？之前我就想问了。“两条命”是指什么？还有那所谓的幸福……到底是什么？财富？还是指权力？,"And do you believe that? I've been wondering, what could ""two lives"" possibly mean? And the ""happiness""… is it wealth? Or power?","...Cậu tin thật à? Trước đây tôi đã muốn hỏi rồi. ""Hai mạng sống"" là chỉ cái gì? Còn cái gọi là hạnh phúc kia... rốt cuộc là gì? Của cải? Hay là quyền lực?"
lang_multi_text.db,MultiText,GNNPC_SJYDXZ_4_10,讲述这个传说的吟游诗人看上去疯疯癫癫的，继续问他也没能得到什么有用的信息。,"The bard telling it looked demented. I tried asking him for details, but got no answers.","Tên thi sĩ lang thang kể truyền thuyết này trông cứ điên điên khùng khùng, hỏi thêm cũng chẳng moi được thông tin gì hữu ích."
lang_multi_text.db,MultiText,GNNPC_SJYDXZ_4_11,谁知道呢，说不定压根没有什么幸福，到最后也就是幻梦一场。,"Who knows. It's probably nothing, no happiness, just one of his wild dreams.","Ai biết được chứ, có khi chẳng có hạnh phúc nào cả, đến cuối cùng cũng chỉ là một giấc mộng hão huyền thôi."
lang_multi_text.db,MultiText,GNNPC_SJYDXZ_4_12,虽然我很想去亲眼看看，但现在这情况还是算了吧……我可不想和那些发狂的黑潮造物碰上。,"I admit I'm curious, but with the ways things are now, forget it… I don't want to run into those frenzied Dark Tide creations.","Tuy tôi rất muốn đi xem tận mắt, nhưng tình hình hiện tại thì thôi bỏ đi... Tôi không muốn đụng độ với mấy tạo vật Hắc Triều phát điên đâu."
lang_multi_text.db,MultiText,GNNPC_SJYDXZ_4_13,就是。还是命要紧啊。,Agreed. Better to stay alive.,Chuẩn. Vẫn là cái mạng quan trọng hơn.
lang_multi_text.db,MultiText,GNNPC_SJYDXZ_5_1,放假放假！终于可以回家休息了！,Vacation time! I can finally go home and rest!,Nghỉ phép nghỉ phép! Cuối cùng cũng được về nhà nghỉ ngơi rồi!
lang_multi_text.db,MultiText,GNNPC_SJYDXZ_5_2,辛苦了，剩余的工作就交给我来做吧。,You've earned it. I'll handle the last bits here.,"Vất vả rồi, công việc còn lại cứ giao cho tôi."
lang_multi_text.db,MultiText,GNNPC_SJYDXZ_6_1,真快啊，没想到这里都建好了啊。,That was quick! Didn't expect it to be finished already.,"Nhanh thật đấy, không ngờ chỗ này đã xây xong rồi."
lang_multi_text.db,MultiText,GNNPC_SJYDXZ_6_2,别感慨啦……买周边要紧，免得被抢光了。,Enough marveling. We need to find that merch before it sells out!,"Đừng cảm thán nữa... Mua đồ lưu niệm quan trọng hơn, kẻo bị mua hết bây giờ."
lang_multi_text.db,MultiText,GNNPC_SJYDXZ_7_1,唉，真想和大伙一起去行猎啊！,"By the sun, I wish I could've joined the hunt.","Haizz, thật muốn đi săn cùng mọi người quá!"
lang_multi_text.db,MultiText,GNNPC_SJYDXZ_7_2,是啊，要是队长他们带上我们就好了。,Yeah. Would've been great if the captain had taken us along.,"Đúng vậy, giá mà đội trưởng cho chúng ta đi cùng thì tốt biết mấy."
lang_multi_text.db,MultiText,GNNPC_SJYDXZ_8_1,我们只能到这里了啊……不能同去狩猎真可惜啊。,So this is it for us… Shame we can't join the hunt.,Chúng ta chỉ đến được đây thôi à... Không được cùng đi săn tiếc thật đấy.
lang_multi_text.db,MultiText,GNNPC_SJYDXZ_8_2,算了吧，比起验证传说我还是觉得保命要紧。,Forget it. No legend's worth risking our lives for.,"Thôi bỏ đi, so với việc kiểm chứng truyền thuyết thì tôi thấy giữ mạng quan trọng hơn."
lang_multi_text.db,MultiText,GNNPC_SJYDXZ_9_1,说起来你准备在休整的这段时间做什么？买装备？还是看比赛？,"So, what's your plan for your break? Gonna stock up on gear or watch a few matches?","Nhắc mới nhớ, cậu định làm gì trong thời gian nghỉ ngơi này? Mua trang bị? Hay là xem thi đấu?"
lang_multi_text.db,MultiText,GNNPC_SJYDXZ_9_2,应该会去旅游吧？难得休息，想去瑝珑转转。,"Might take a little trip. A rare chance, this is. I've always wanted to see Huanglong.","Chắc là đi du lịch? Hiếm khi được nghỉ, tôi muốn đến Hoàng Long dạo một vòng."
lang_multi_text.db,MultiText,GNNPC_SJYDXZ_9_3,那挺好的。我也想去，但一直没有时间。,"Nice choice. I keep saying I'll go, but I never have the time.","Thế thì tốt quá. Tôi cũng muốn đi, nhưng mãi chưa có thời gian."
lang_multi_text.db,MultiText,GNNPC_SJYDXZ_9_4,等下次放假吧，下次我们一起去。,"Next break, we make it a trip for two.","Đợi lần nghỉ tới đi, lần sau chúng ta cùng đi."
lang_multi_text.db,MultiText,GNNPC_SJYDXZ_10_1,把这份报告书交上去这里的工作就告一段落了。,"The report is in, and we're officially done here.",Nộp bản báo cáo này lên là công việc ở đây coi như tạm ổn rồi.
lang_multi_text.db,MultiText,GNNPC_SJYDXZ_10_2,唉……没想到临别的时候还有些怀念呢。,Well… didn't think I'd get attached to this place.,Haizz... Không ngờ lúc sắp chia tay lại thấy hơi luyến tiếc.
lang_multi_text.db,MultiText,GNNPC_SJYDXZ_10_3,毕竟在这里工作了一年，会怀念也很正常。,A whole year will do that to you.,"Dù sao cũng làm việc ở đây cả năm trời, thấy luyến tiếc cũng là bình thường."
lang_multi_text.db,MultiText,GNNPC_SJYDXZ_10_4,是啊，等之后我会以游客的身份再回来的。,"Right. I think I'll visit again, as a tourist.","Đúng vậy, sau này tôi sẽ quay lại với tư cách khách du lịch."
lang_multi_text.db,MultiText,GNNPC_SJYDXZ_11_1,……真不知道家主为什么来这么落后的地方。,...I don't know what possessed his lordship to come to such a backwater place.,...Thật không hiểu tại sao gia chủ lại đến cái nơi lạc hậu này.
lang_multi_text.db,MultiText,GNNPC_SJYDXZ_11_2,谁知道呢。反正我也就是跟着来赴命的。,Beats me. I'm only here because I was told to be.,Ai biết được. Dù sao tôi cũng chỉ đi theo làm nhiệm vụ thôi.
lang_multi_text.db,MultiText,GNNPC_SJYDXZ_11_3,我也一样，等忙完就准备提前回去。,Same. I'm heading back once it's over.,"Tôi cũng thế, đợi xong việc là chuẩn bị về sớm."
lang_multi_text.db,MultiText,GNNPC_SJYDXZ_11_4,……希望家主在这里待得习惯。,"Let's hope his lordship survives the ""charm"" of this place.",...Hy vọng gia chủ ở đây quen.
lang_multi_text.db,MultiText,GNNPC_SJYDXZ_12_1,狩原上的黑潮造物比预想要多……真头疼啊。,The Dark Tide's way worse than we thought… What a mess.,Tạo vật Hắc Triều trên Cao Nguyên nhiều hơn dự kiến... Đau đầu thật đấy.
lang_multi_text.db,MultiText,GNNPC_SJYDXZ_12_2,是啊，那边现在特别缺人。,"Yeah, now they're short on fighters.","Đúng vậy, bên đó hiện giờ đang thiếu người trầm trọng."
lang_multi_text.db,MultiText,GNNPC_SJYDXZ_12_3,我准备收拾收拾，拿上东西就重新回营地。,I'm gonna pack up and head back to the camp.,"Tôi chuẩn bị thu dọn đồ đạc, cầm theo đồ rồi quay lại trại ngay."
lang_multi_text.db,MultiText,GNNPC_SJYDXZ_12_4,以呼嚎向你致意，希望你一切顺利，朋友。,"May howls of triumph follow you. Good luck, brother.","Gửi lời chào quyết thắng đến cậu, chúc mọi việc thuận lợi, người anh em."
lang_multi_text.db,MultiText,GNNPC_SJYDXZ_13_1,这就是那个有限定周边的城镇？店在哪啊？,So this is the town with the limited-edition merch? Where's the shop?,Đây chính là thị trấn có bán đồ lưu niệm giới hạn sao? Cửa hàng ở đâu vậy?
lang_multi_text.db,MultiText,GNNPC_SJYDXZ_13_2,别急，我听说是一个街边的商人在售卖。,Be patient. I heard it's a street vendor.,"Đừng vội, tôi nghe nói là do một thương nhân bên đường bán."
lang_multi_text.db,MultiText,GNNPC_SJYDXZ_13_3,可能现在还没到出摊的时候？我们再等等吧。,Maybe it's not time yet. Let's wait a bit longer.,Có khi giờ chưa đến giờ dọn hàng? Chúng ta đợi thêm chút nữa xem sao.
lang_multi_text.db,MultiText,GNNPC_SJYDXZ_14_1,话说，连我们这些随行人员都不能去狩原吗？,Even we are not allowed into the hunting grounds?,"Nói chứ, ngay cả nhân viên tùy tùng như chúng ta cũng không được đến Cao Nguyên sao?"
lang_multi_text.db,MultiText,GNNPC_SJYDXZ_14_2,为了安全考虑还是算了吧。,It's for the best. Safety takes priority.,Vì lý do an toàn thì thôi bỏ đi.
lang_multi_text.db,MultiText,GNNPC_SJYDXZ_14_3,我们还是听安排，在后方支援就好。,Let's follow command and do what we can to support them.,"Chúng ta cứ nghe theo sắp xếp, hỗ trợ ở hậu phương là được."
lang_multi_text.db,MultiText,GNNPC_SJYDXZ_14_4,嗯……希望大家可以平安无事。,Right… I just hope everyone makes it back safe.,Ừm... Hy vọng mọi người đều bình an vô sự.
lang_multi_text.db,MultiText,GNNPC_SJYDXZ_15_1,完成这里的建设后，我们会调回主城工作吗？,Think they'll reassign us to the city once construction's done?,"Sau khi hoàn thành việc xây dựng ở đây, chúng ta có được điều về thành phố chính làm việc không nhỉ?"
lang_multi_text.db,MultiText,GNNPC_SJYDXZ_15_2,应该会吧……不过我还挺想留在这里的。,Probably… but I wouldn't mind staying here.,Chắc là có đấy... cơ mà tôi lại khá muốn ở lại đây.
lang_multi_text.db,MultiText,GNNPC_SJYDXZ_15_3,我也是。等调令发布，和队长争取下吧。,Me neither. I'll bring it up with the captain as soon as the assignment comes in.,"Tôi cũng vậy. Đợi có lệnh điều động, mình thử xin đội trưởng xem sao."
lang_multi_text.db,MultiText,GNNPC_SUIBOC_1_1,啊哈哈，让你见笑了。真是一场不顺利的告白啊。,"Haha… sorry about that. That was a pretty terrible confession, huh?","A ha ha, để bạn chê cười rồi. Đúng là một màn tỏ tình không suôn sẻ chút nào."
lang_multi_text.db,MultiText,GNNPC_SUIBOC_1_2,没什么，我只是路过。,Don't worry. I'm just passing by.,"Không có gì, tôi chỉ đi ngang qua thôi."
lang_multi_text.db,MultiText,GNNPC_SUIBOC_1_3,这经验必可活用于下一次。,Think of it as practice for next time.,Kinh nghiệm này chắc chắn sẽ có ích cho lần sau.
lang_multi_text.db,MultiText,GNNPC_SUIBOC_1_4,嗯，我是不会放弃的。大概，现在好感度还不够吧。,Thanks. I'm not giving up yet. Guess I just haven't gained enough affection points.,"Ừm, tôi sẽ không bỏ cuộc đâu. Có lẽ là do độ thiện cảm hiện tại chưa đủ."
lang_multi_text.db,MultiText,GNNPC_SUIBOC_1_5,请放心，我是不会放弃的。大概，现在好感度还不够吧。,Don't worry. I'm not giving up yet. Guess I just haven't gained enough affection points.,"Yên tâm đi, tôi sẽ không bỏ cuộc đâu. Có lẽ là do độ thiện cảm hiện tại chưa đủ."
lang_multi_text.db,MultiText,GNNPC_SUIBOC_1_6,我和久实算是青梅竹马，但小时候就分开了，没想到，能在高中再次相遇。,Kumi and I… we were kind of childhood friends. Got separated when we were kids. Never thought we'd reunite in high school.,"Tôi và Kumi coi như là thanh mai trúc mã, nhưng hồi nhỏ đã xa nhau rồi, không ngờ lại có thể gặp lại ở trường cấp ba."
lang_multi_text.db,MultiText,GNNPC_SUIBOC_1_7,嘶……我右手里的“恶魔”在隐隐作痛。明天，我会以更好的状态，来触发告白事件的。,"Ugh... The ""devil"" in my right hand is starting to ache. I'll be in better shape to trigger the Confession Event tomorrow!","Hự... ""Ác quỷ"" trong tay phải tôi đang đau âm ỉ. Ngày mai, tôi sẽ kích hoạt sự kiện tỏ tình với trạng thái tốt hơn."
lang_multi_text.db,MultiText,GNNPC_SUIBOC_1_8,……？,...?,...?
lang_multi_text.db,MultiText,GNNPC_SUIBOC_1_10,咳，不好意思，久实也说过我，我总把妄想的事挂在嘴上。,"Ahem, sorry. Kumi complained about this before. Sometimes my delusions slip out loud.","Khụ, xin lỗi nhé, Kumi cũng từng nói tôi rồi, tôi cứ hay mở miệng là nói mấy chuyện hoang tưởng."
lang_multi_text.db,MultiText,GNNPC_SUIBOC_2_1,前辈真是个笨蛋……明明，一点也不懂我的心情……,"Senpai, you idiot… You don't understand my feelings at all...",Tiền bối đúng là đồ ngốc... Rõ ràng chẳng hiểu chút nào về tâm tư của em cả...
lang_multi_text.db,MultiText,GNNPC_SUIBOC_3_1,唉，前辈总是这样，擅自地把人约出来，又擅自地告白……,Sigh... Senpai's always like this… calling me out and confessing on a whim.,"Haizz, tiền bối lúc nào cũng vậy, tự tiện hẹn người ta ra, rồi lại tự tiện tỏ tình..."
lang_multi_text.db,MultiText,GNNPC_SUIBOC_3_2,明明是他把之前的事情都忘了。,But he's the one who's forgotten what happened.,Rõ ràng là anh ấy đã quên hết chuyện trước kia rồi.
lang_multi_text.db,MultiText,GNNPC_SUIBOC_3_3,这是什么意思？,What do you mean?,Nghĩa là sao?
lang_multi_text.db,MultiText,GNNPC_SUIBOC_3_4,你拒绝他……还有别的原因？,Is there another reason you turned him down?,Cô từ chối cậu ấy... còn có lý do khác sao?
lang_multi_text.db,MultiText,GNNPC_SUIBOC_3_5,其实……我们早就在一起了。但不知什么时候开始，他就忘记了这件事，还总来和我告白。,"Actually… we've been together for a long time. But somewhere along the way, he forgot. And ever since then, he's kept coming to confess again and again.","Thực ra... chúng tôi đã ở bên nhau từ lâu rồi. Nhưng không biết từ bao giờ, anh ấy lại quên mất chuyện này, và cứ liên tục đến tỏ tình với tôi."
lang_multi_text.db,MultiText,GNNPC_SUIBOC_3_6,……我依稀记得，这样的事已经发生过了很多次，我们就像困在了……,…I feel like this has happened many times already. Like we're stuck...,"...Tôi nhớ mang máng là chuyện như thế này đã xảy ra rất nhiều lần, chúng tôi giống như bị kẹt trong..."
lang_multi_text.db,MultiText,GNNPC_SUIBOC_3_7,一个循环里？,Like in a loop?,Một vòng lặp sao?
lang_multi_text.db,MultiText,GNNPC_SUIBOC_3_8,对，我还以为是自己出了问题。但这几天，我终于可以确信了。,"Yes. At first, I thought something was wrong with me. But these last few days, I've started to believe it's really happening.","Đúng vậy, tôi còn tưởng bản thân mình có vấn đề. Nhưng mấy ngày nay, cuối cùng tôi cũng có thể chắc chắn rồi."
lang_multi_text.db,MultiText,GNNPC_SUIBOC_3_9,请问，你能帮我和他说明一下情况吗？,Could you tell him for me?,"Xin hỏi, bạn có thể giúp tôi giải thích tình hình với anh ấy không?"
lang_multi_text.db,MultiText,GNNPC_SUIBOC_3_10,如果是我去，前辈一定会像之前的很多次一样，觉得我在开玩笑的。,"If it's me, he'll just take it as a joke like all the other times.","Nếu là tôi nói, tiền bối chắc chắn sẽ giống như bao lần trước, nghĩ rằng tôi đang nói đùa."
lang_multi_text.db,MultiText,GNNPC_SUIBOC_4_1,哈哈，还是不行，这次告白又失败了啊。,"Haha… dumped again. Another failed confession, huh?","Ha ha, vẫn không được, lần tỏ tình này lại thất bại rồi."
lang_multi_text.db,MultiText,GNNPC_SUIBOC_4_2,（说出你向久实了解的情况。）,(Tell him what Kumi said.),(Kể lại tình hình mà bạn nghe được từ Kumi.)
lang_multi_text.db,MultiText,GNNPC_SUIBOC_4_3,……,...,...
lang_multi_text.db,MultiText,GNNPC_SUIBOC_4_4,久实……她是这么说的吗？我也不是什么都不知道……,She really said that? Well… it's not like I don't remember anything.,Kumi... em ấy nói vậy sao? Tôi cũng không phải là không biết gì...
lang_multi_text.db,MultiText,GNNPC_SUIBOC_4_5,我只是不能确信，那些模糊的印象，是真实发生过的事。,"It's just… those memories feel too fuzzy, too good to be true.",Tôi chỉ là không thể tin chắc rằng những ấn tượng mơ hồ đó là chuyện đã thực sự xảy ra.
lang_multi_text.db,MultiText,GNNPC_SUIBOC_4_6,其实……是我自己不敢承认那些沉眠在记忆里的幸福瞬间吧。,Maybe I've just been too scared to accept that those happy moments were real.,Thật ra... là do chính tôi không dám thừa nhận những khoảnh khắc hạnh phúc đang ngủ yên trong ký ức đó thôi.
lang_multi_text.db,MultiText,GNNPC_SUIBOC_4_7,现在，选择权在你手里。,"But now, you get to decide.","Bây giờ, quyền lựa chọn nằm trong tay bạn."
lang_multi_text.db,MultiText,GNNPC_SUIBOC_4_8,谢谢，我马上就去和久实聊聊。,Thanks. I'll talk to Kumi right away.,"Cảm ơn nhé, tôi sẽ đi nói chuyện với Kumi ngay đây."
lang_multi_text.db,MultiText,GNNPC_SUIBOC_5_1,久实……我……抱歉……,Kumi… I… I'm sorry.,Kumi... anh... xin lỗi...
lang_multi_text.db,MultiText,GNNPC_SUIBOC_5_2,前辈，我啊，经常听不懂你说的那些话。,"Senpai, you know, half the time I don't understand what you're talking about.","Tiền bối à, em ấy nhé, thường xuyên chẳng hiểu anh đang nói cái gì cả."
lang_multi_text.db,MultiText,GNNPC_SUIBOC_5_3,明明不是共鸣者，却总说什么“右手里潜藏着神秘的力量”“眼睛可以看到未来发生的事”……,"You're not a Resonator, but you always say things like, ""There's a mysterious power sealed in my right hand"" or ""My eyes can see the future""...","Rõ ràng không phải là Cộng Hưởng Giả, mà cứ luôn miệng nói cái gì mà ""tay phải ẩn chứa sức mạnh thần bí"", ""đôi mắt có thể nhìn thấy tương lai""..."
lang_multi_text.db,MultiText,GNNPC_SUIBOC_5_4,你总信誓旦旦地念叨不知哪来的名人名言，把虚构的事当做大家都知道的常识。,And you just kept spouting some quotes from who-knows-where and treating made-up things like common knowledge...,"Anh lúc nào cũng hùng hồn đọc mấy câu danh ngôn chẳng biết của ai, rồi coi chuyện hư cấu như kiến thức thường thức mà ai cũng biết."
lang_multi_text.db,MultiText,GNNPC_SUIBOC_5_5,但是，我都在尝试去记住，尝试去理解，只因为……我想多了解你。,"But still, I tried. I kept trying to remember, to understand... because I wanted to know more about you.","Nhưng mà, em đều cố gắng ghi nhớ, cố gắng để hiểu, chỉ vì... em muốn hiểu thêm về anh."
lang_multi_text.db,MultiText,GNNPC_SUIBOC_5_6,我拒绝你的告白，不是讨厌你，只是因为——我们的关系，早就不需要告白了啊！,"I didn't reject you because I disliked you. It's just... we're already together, and you don't need to do that anymore!","Em từ chối lời tỏ tình của anh không phải vì ghét anh, mà chỉ vì... mối quan hệ của chúng ta đã sớm không cần phải tỏ tình nữa rồi!"
lang_multi_text.db,MultiText,GNNPC_SUIBOC_5_7,……原来，你是这样想的啊。这次，我完全理解了。,I see... So that's what you really meant. I get it now.,"...Hóa ra, em nghĩ như vậy sao. Lần này thì anh hoàn toàn hiểu rồi."
lang_multi_text.db,MultiText,GNNPC_SUIBOC_5_8,我放弃告白了，久实。从今天起，多多沟通，好好相处吧。,"No more confessions, Kumi. From now on, let's just... talk more. Be together, happily.","Anh bỏ cuộc việc tỏ tình rồi, Kumi. Từ hôm nay, chúng ta hãy trò chuyện nhiều hơn, chung sống thật vui vẻ nhé."
lang_multi_text.db,MultiText,GNNPC_SUIBOC_5_9,嗯。前辈，这样……就可以。,"Yeah. That'll do, Senpai.","Vâng. Tiền bối, như vậy... là được rồi."
