db_file,table_name,id,zh,en,vi
lang_multi_text.db,MultiText,ZX_YCZX_23_8,还记得坎特蕾拉曾说过，翡萨烈会尝试让通过圣女试炼的人在超频状态下与「提尔芬」中的力量共鸣吗？,Remember when Cantarella said that the Fisalias would try to make those who pass the Divine Trials resonate with Tyrvine while Overclocking?,"Cậu còn nhớ Cantarella từng nói, Fisalias sẽ cố để những người vượt qua thử luyện Thánh Nữ cộng hưởng với sức mạnh trong ""Tyrvine"" ở trạng thái Vượt Tần không?"
lang_multi_text.db,MultiText,ZX_YCZX_23_9,从她的讲述来看，那些人虽然都失败了，但是却很少因为超频而死亡。,"Though all those attempts failed, very few actually died from Overclocking.","Theo lời kể của cô ấy, tuy tất cả những người đó đều thất bại, nhưng rất ít ai thiệt mạng vì Vượt Tần."
lang_multi_text.db,MultiText,ZX_YCZX_2_1,那个方向不是……这里的环境似乎发生了些许变化……我们去看看。,That direction is... Something here seems changed. Let's go check it out.,Hướng đó chẳng phải là... Môi trường ở đây dường như đã có chút thay đổi... Chúng ta đi xem thử.
lang_multi_text.db,MultiText,ZX_YCZX_3_1,（这处升降台通往的是卡提希娅曾经的封印地。）,(This elevator leads to the place where Cartethyia was once sealed.),(Bệ nâng này dẫn đến nơi Cartethyia từng bị phong ấn.)
lang_multi_text.db,MultiText,ZX_YCZX_3_15,走吧，我们去弄清楚这里到底还有什么。,"Come on Abby, we have a secret to uncover.","Đi thôi, chúng ta đi tìm hiểu xem ở đây còn gì nữa."
lang_multi_text.db,MultiText,ZX_YCZX_3_2,为什么带我来这里？,Why did this little one guide us here?,Tại sao lại dẫn chúng ta đến đây?
lang_multi_text.db,MultiText,ZX_YCZX_3_3,云海妖精毫无阻碍地穿过了你脚下的地面。,The Nimbus Wraith directly flies through the floor.,Yêu Tinh Vân Hải xuyên thẳng qua mặt đất dưới chân bạn mà không gặp trở ngại gì.
lang_multi_text.db,MultiText,ZX_YCZX_3_4,啊，原来是可以下去的吗？,Huh? There's more beneath that floor?,"À, hóa ra có thể đi xuống dưới sao?"
lang_multi_text.db,MultiText,ZX_YCZX_3_5,我可没有这么方便的能力啊。,Wish I had such a handy ability.,Tôi thì không có khả năng tiện lợi như vậy đâu.
lang_multi_text.db,MultiText,ZX_YCZX_3_6,云海妖精重新冒出来，似乎刚刚意识到了你的困境。,"As if sensing your confusion, the Nimbus Wraith returns to help.","Yêu Tinh Vân Hải trồi lên lại, dường như vừa nhận ra tình cảnh khó xử của bạn."
lang_multi_text.db,MultiText,ZX_YCZX_3_7,在云海妖精释放力量时，你想起了这股熟悉的气息来自哪里。,The Wraith's power reminds you of the source of the familiar energy.,"Khi Yêu Tinh Vân Hải giải phóng sức mạnh, bạn chợt nhớ ra hơi thở quen thuộc này đến từ đâu."
lang_multi_text.db,MultiText,ZX_YCZX_3_8,刚才的气息……是当初卡提希娅拦下攻击时，「提尔芬」中的气息。,This aura… it's the same as Tyrvine's when Cartethyia wielded it to block the attack.,"Khí tức lúc nãy... là khí tức từ ""Tyrvine"" khi Cartethyia chặn đòn tấn công lần trước."
lang_multi_text.db,MultiText,ZX_YCZX_3_9,「提尔芬」在那场战斗后就不知道被击飞到哪里去了，这段混合频率到底是什么？,But Tyrvine's nowhere to be found after that battle. What exactly are these frequencies?,"""Tyrvine"" sau trận chiến đó đã bị đánh bay không biết đi đâu, đoạn tần số hỗn hợp này rốt cuộc là gì?"
lang_multi_text.db,MultiText,ZX_YCZX_4_1,信仰岁主者必将得救，然欲得救者必先自救。,"Those who revere the Sentinel shall find salvation. Yet to be saved, they must first save themselves.","Kẻ tín ngưỡng Tuế Chủ ắt sẽ được cứu rỗi, song muốn được cứu rỗi, trước tiên phải tự cứu lấy mình."
lang_multi_text.db,MultiText,ZX_YCZX_4_2,不可沉溺于岁主的福祉，贪图享乐，止步于自我欲望之中。,"Let none linger in the blessings of the Sentinel, nor seek indulgence in fleeting pleasures, for such paths lead only to the snares of desires.","Chớ đắm chìm trong phúc lành của Tuế Chủ, tham cầu hưởng lạc, dừng bước trong dục vọng bản thân."
lang_multi_text.db,MultiText,ZX_YCZX_4_3,必勉励自我，磨砺精神。严于律己，谨记箴言。,"Endeavor to sharpen the spirit with unwavering resolve. Be stern in discipline, and heed the sacred words.","Phải tự khích lệ bản thân, mài giũa tinh thần. Nghiêm khắc với chính mình, ghi nhớ châm ngôn."
lang_multi_text.db,MultiText,ZX_YCZX_4_4,所行所想所做，不可有毫厘之差。,"In thought, word, and deed, let no flaw be found.","Mọi hành vi, suy nghĩ, việc làm, không được sai lệch dù chỉ một ly."
lang_multi_text.db,MultiText,ZX_YCZX_4_5,以身指定方圆规矩，感悟“向上”之教义，方可打开“向下”之门。,"Let thy path be measured by actions, and may thy heart follow the path of ""ascension,"" for only thus shall the gate of ""descent"" be opened.","Lấy thân mình định ra phép tắc khuôn phép, lĩnh ngộ giáo lý ""hướng thượng"", mới có thể mở cánh cửa ""hướng hạ""."
lang_multi_text.db,MultiText,ZX_YCZX_4_6,若能力行五番，方可迎接最终试炼。,"When thou hast trodden thy path with rigor five times, then and only then shalt thou stand ready for the final reckoning.","Nếu có thể thực hành đủ năm lượt, mới được đón nhận thử thách cuối cùng."
lang_multi_text.db,MultiText,ZX_YCZX_4_7,“以身指定方圆规矩”……是要我按地上的图案走吗？,"""Let thy path be measured by actions""… Does it mean I should follow the trail on the ground?","""Lấy thân mình định ra phép tắc khuôn phép""... Là muốn tôi đi theo hoa văn trên mặt đất sao?"
lang_multi_text.db,MultiText,ZX_YCZX_5_1,看来方向没错。,It seems to be the right direction.,Có vẻ hướng đi không sai.
lang_multi_text.db,MultiText,ZX_YCZX_6_1,看来还需要再让路线更贴合点。,Need to follow the trail more closely.,Có vẻ cần phải đi sát theo lộ tuyến hơn nữa.
lang_multi_text.db,MultiText,ZYFZDDDA_10_1,……,...,...
lang_multi_text.db,MultiText,ZYFZDDDA_10_10,我可以在这里坐一会儿吗？,Could I sit here for a bit?,Tôi có thể ngồi đây một lát được không?
lang_multi_text.db,MultiText,ZYFZDDDA_10_11,没有。我只是……不知道还有哪里能去。,Not at all. I just... don't know where else to go.,Không có gì. Tôi chỉ... không biết còn có thể đi đâu nữa.
lang_multi_text.db,MultiText,ZYFZDDDA_10_12,当然没问题。我只是……不知道还有哪里能去。,Of course. I just... don't know where else to go.,Tất nhiên không sao. Tôi chỉ... không biết còn có thể đi đâu nữa.
lang_multi_text.db,MultiText,ZYFZDDDA_10_13,学院里的其他地方要么太吵，要么太安静。太吵的话，我没法思考；可是安静的环境……总会让我时不时想起另一个人。,"Everywhere else in the Academy is either too noisy or too quiet. If it's too noisy, I can't think. But if it's too quiet... I always end up thinking of someone.","Những nơi khác trong Học viện hoặc quá ồn ào, hoặc quá yên tĩnh. Quá ồn thì tôi không thể suy nghĩ; nhưng nếu yên tĩnh quá... tôi lại hay nghĩ đến một người khác."
lang_multi_text.db,MultiText,ZYFZDDDA_10_14,你是说……塞娜？,You mean... Sena?,Cậu nói... Sena?
lang_multi_text.db,MultiText,ZYFZDDDA_10_15,我听说你们发生了一些矛盾。,I heard you two had some sort of disagreement.,Tôi nghe nói hai người xảy ra mâu thuẫn gì đó.
lang_multi_text.db,MultiText,ZYFZDDDA_10_16,……消息传得还挺快。,...News sure travels fast.,...Tin đồn lan nhanh thật.
lang_multi_text.db,MultiText,ZYFZDDDA_10_17,我和她……我们可能想法不太一样……,We're... Not really on the same page anymore...,Tôi và cô ấy... có lẽ suy nghĩ không còn giống nhau nữa...
lang_multi_text.db,MultiText,ZYFZDDDA_10_18,能和我说说吗？比如……,"Like how, for example?",Cậu có thể kể cho tôi nghe không? Ví dụ như...
lang_multi_text.db,MultiText,ZYFZDDDA_10_19,……比如之前那次虚质磁暴微场模拟实验……当时，我们捕捉到了一组毫无规律的数据。,"Well... that Void Storm microfield simulation, for instance... At the time, we captured a set of highly irregular data.","...Ví dụ như thí nghiệm mô phỏng vi trường bão từ hư chất trước đó... Lúc đó, chúng tôi thu được một tổ dữ liệu hoàn toàn không có quy luật."
lang_multi_text.db,MultiText,ZYFZDDDA_10_2,你来到埃里欧的身侧，温暖的风掠过喧嚣的广场。你听到了某种微不可察的律动，像是谁在寂静地呼吸。,"You walk up to Erio as a warm breeze sweeps over the bustling square. You hear a faint beat, like steady breaths breaking the silence.","Bạn đến bên cạnh Erio, gió ấm lướt qua quảng trường ồn ào. Bạn nghe thấy một nhịp điệu gần như không thể nhận ra, tựa như ai đó đang thở trong tĩnh lặng."
lang_multi_text.db,MultiText,ZYFZDDDA_10_20,塞娜觉得那些随机波动是一种“脉息”，她说能量是“活”的，我们应该顺着它的变化去观察。,"Sena thought these random waves were a kind of ""pulse,"" that the energy was ""living"" and we should continue to observe its changes.","Sena cho rằng những dao động ngẫu nhiên đó là một loại ""mạch tức"", cô ấy nói năng lượng là ""sống"", và chúng tôi nên thuận theo sự biến đổi của nó mà quan sát."
lang_multi_text.db,MultiText,ZYFZDDDA_10_21,可我认为，如果连读数结果都不能确定，那实验本身根本毫无意义。,"Whereas I believed that if these readings couldn't even be verified, then the experiment itself was moot.","Nhưng tôi cho rằng, nếu ngay cả kết quả đo đọc cũng không thể xác định, thì bản thân thí nghiệm chẳng có ý nghĩa gì cả."
lang_multi_text.db,MultiText,ZYFZDDDA_10_22,……呵呵，听起来无非是两人研究方式的不同，但我知道……那其实是无法融合的偏差。,"...Heh, I know it sounds like nothing more than contrasting research methodologies... but it's actually an irreconcilable difference.","...Heh, nghe thì chẳng qua là phương thức nghiên cứu khác nhau giữa hai người, nhưng tôi biết... đó thực ra là sự lệch lạc không thể dung hòa."
lang_multi_text.db,MultiText,ZYFZDDDA_10_23,每一次我们都以为抚平了分歧，然而到最后却还是各自困守在了自己的思维里，谁也不肯退让。,"Every time we thought we'd worked through our differences, we'd just end up circling back to our respective ways of thinking. Neither of us was willing to yield.","Mỗi lần chúng tôi đều tưởng đã san bằng được bất đồng, nhưng cuối cùng vẫn mỗi người cố thủ trong cách nghĩ của mình, không ai chịu nhượng bộ."
lang_multi_text.db,MultiText,ZYFZDDDA_10_24,你打算怎么办？,What will you do then?,Cậu định làm sao đây?
lang_multi_text.db,MultiText,ZYFZDDDA_10_25,……没什么好怎么办的。,...There's nothing I can do.,...Chẳng có gì để làm cả.
lang_multi_text.db,MultiText,ZYFZDDDA_10_26,我与她之间没有对错，仅仅是不够合拍罢了。,It's not a matter of right and wrong—we're just incompatible.,"Giữa tôi và cô ấy không có đúng sai, chỉ đơn giản là không đủ hòa hợp mà thôi."
lang_multi_text.db,MultiText,ZYFZDDDA_10_27,……不过至少……现在我还能听到她的声音。,But at least... I can still hear her voice right now.,...Nhưng ít nhất... bây giờ tôi vẫn còn nghe được giọng cô ấy.
lang_multi_text.db,MultiText,ZYFZDDDA_10_28,虽然这声音总是隔着风……,Even if that voice is carried by the wind...,Dù giọng nói ấy luôn cách qua làn gió...
lang_multi_text.db,MultiText,ZYFZDDDA_10_3,……这里的风声有些特别。,...The wind here sounds unusual.,...Tiếng gió ở đây có gì đó đặc biệt.
lang_multi_text.db,MultiText,ZYFZDDDA_10_4,你也听到了？那是镀心花的“回音”。,"You can hear it, too? That's the ""echo"" of the Platinheart Bloom.","Cậu cũng nghe thấy sao? Đó là ""hồi âm"" của hoa Độ Tâm."
lang_multi_text.db,MultiText,ZYFZDDDA_10_5,这种植株对声波频率的变化很敏感。它的组织结构能够反射并削弱低频振动，好让周围的声场保持稳定、纯粹。,"It's sensitive to noise frequency. Its structure reflects and dampens low-frequency vibrations, keeping the surrounding sounds stable and pristine.","Loài thực vật này rất nhạy cảm với sự thay đổi tần số sóng âm. Cấu trúc mô của nó có thể phản xạ và làm suy yếu dao động tần thấp, giữ cho trường âm xung quanh ổn định, thuần khiết."
lang_multi_text.db,MultiText,ZYFZDDDA_10_6,……用某个人的话来说，镀心花让世界安静了下来，这样……风就能听到它的心跳了。,"...Or, as someone else once put it, the Platinheart Bloom hushes the world... so the wind can hear its heartbeat.","...Theo cách nói của một người nào đó, hoa Độ Tâm khiến thế giới lặng yên, để... gió có thể nghe thấy nhịp tim của nó."
lang_multi_text.db,MultiText,ZYFZDDDA_10_7,拉贝尔学部，{PlayerName}。,I'm {PlayerName} from Rabelle College.,"{PlayerName}, học bộ Rabelle."
lang_multi_text.db,MultiText,ZYFZDDDA_10_8,埃里欧，虚质科学学部。,"Erio, Department of Voidmatters","Erio, học bộ Khoa học Hư Chất."
lang_multi_text.db,MultiText,ZYFZDDDA_10_9,……我没有打扰到你吧。,I hope I'm not disturbing you.,...Mình không làm phiền cậu chứ.
lang_multi_text.db,MultiText,ZYFZDDDA_15_1,……,...,...
lang_multi_text.db,MultiText,ZYFZDDDA_15_10,拉贝尔学部，{PlayerName}。,I'm {PlayerName} from Rabelle College.,"{PlayerName}, học bộ Rabelle."
lang_multi_text.db,MultiText,ZYFZDDDA_15_11,我叫塞娜，虚质科学学部的二年级生。,"I'm Sena, a second-year student at the Department of Voidmatters.","Mình tên Sena, sinh viên năm hai của học bộ Khoa Học Hư Chất."
lang_multi_text.db,MultiText,ZYFZDDDA_15_12,……拉贝尔学部啊……那边的课业可不轻松。要是偶尔想偷偷懒，我倒是知道几个放松的好地方……,"Rabelle College classes are pretty tough. If you ever need to sneak in some downtime, I know a few good places to unwind...","...Học bộ Rabelle à... Bên đó bài vở không nhẹ nhàng gì đâu. Nếu thỉnh thoảng muốn nghỉ ngơi một chút, mình biết vài chỗ thư giãn khá hay..."
lang_multi_text.db,MultiText,ZYFZDDDA_15_13,其实……,Actually...,Thực ra...
lang_multi_text.db,MultiText,ZYFZDDDA_15_14,（塞娜之前的情绪看上去有些低落，直接提起埃里欧似乎太过冒昧……或许可以换个委婉的方式。）,(Sena looks rather down. Instead of asking her about Erio directly... I could try something more subtle.),"(Tâm trạng Sena lúc nãy có vẻ hơi trầm, nếu nhắc thẳng đến Erio thì có lẽ hơi đường đột... Hay là thử hỏi một cách khéo léo hơn.)"
lang_multi_text.db,MultiText,ZYFZDDDA_15_15,我在找人。,I'm looking for someone.,Mình đang tìm người.
lang_multi_text.db,MultiText,ZYFZDDDA_15_16,一个叫埃里欧的学生。,A student named Erio.,Một sinh viên tên Erio.
lang_multi_text.db,MultiText,ZYFZDDDA_15_17,他啊……,"Oh, him...",Cậu ấy à...
lang_multi_text.db,MultiText,ZYFZDDDA_15_18,那边，浅褐色头发、穿灰色校服的就是他。,That's him over there. The one with the light brown hair and grey uniform.,"Ở đằng kia, người tóc nâu nhạt, mặc đồng phục xám chính là cậu ấy."
lang_multi_text.db,MultiText,ZYFZDDDA_15_19,……你去吧。我……我还是待在这儿比较好。,...You can go. I... I'd better stay over here.,...Cậu cứ đi đi. Mình... mình ở đây thì hơn.
lang_multi_text.db,MultiText,ZYFZDDDA_15_2,在等人吗？,Are you waiting for someone?,Đang đợi ai à?
lang_multi_text.db,MultiText,ZYFZDDDA_15_20,我听说你们关系很好。,I heard you two are good friends.,Mình nghe nói hai người quan hệ rất tốt.
lang_multi_text.db,MultiText,ZYFZDDDA_15_21,……,...,...
lang_multi_text.db,MultiText,ZYFZDDDA_15_22,……我们确实曾经无话不谈。,...We used to be able to talk about anything.,...Bọn mình đúng là từng nói chuyện gì cũng được với nhau.
lang_multi_text.db,MultiText,ZYFZDDDA_15_23,可是现在，我们都走在各自认为“正确”的道路上。,"But now... we've gone our separate ways... down paths that are ""right"" for each of us.","Nhưng bây giờ, mỗi người đều đi trên con đường mà mình cho là ""đúng""."
lang_multi_text.db,MultiText,ZYFZDDDA_15_24,发生了什么？,What happened?,Chuyện gì xảy ra vậy?
lang_multi_text.db,MultiText,ZYFZDDDA_15_25,“发生了什么”吗……真要说起来，也没什么特别的。,"What happened? Well, if I had to put my finger on it... it wasn't anything in particular.","""Xảy ra chuyện gì"" ư... Nói thật thì cũng chẳng có gì đặc biệt."
lang_multi_text.db,MultiText,ZYFZDDDA_15_26,我们只不过又一次各执己见，谁也没能说服谁。,We just ended up at odds again. And neither of us was able to win over the other.,"Bọn mình chỉ là lại một lần nữa mỗi người giữ một ý kiến, không ai thuyết phục được ai."
lang_multi_text.db,MultiText,ZYFZDDDA_15_27,……最近的一回争论的确要比以往更激烈一点。,...Our latest argument was certainly more heated than usual.,...Lần tranh luận gần nhất thì đúng là gay gắt hơn mọi khi một chút.
lang_multi_text.db,MultiText,ZYFZDDDA_15_28,我们原本是想让磁暴的微场模型表现得更稳定，最后却因为这场实验，起了双方都无法退让的分歧。,"We'd been trying to stabilize the Void Storm microfield, but the experiment ultimately led to an irreconcilable disagreement between us.","Ban đầu bọn mình muốn làm cho mô hình vi trường của bão từ ổn định hơn, nhưng cuối cùng chính thí nghiệm đó lại gây ra bất đồng mà hai bên đều không thể nhượng bộ."
lang_multi_text.db,MultiText,ZYFZDDDA_15_29,……数据的变化，对我而言是一种值得探索的可能性；但在他看来，那是必须要消除的误差。,"...To me, the data fluctuations represented a new possibility worth investigating. But he saw them as an anomaly to exclude from the analysis.","...Sự biến đổi trong dữ liệu, với mình là một khả năng đáng để khám phá; nhưng trong mắt cậu ấy, đó là sai số cần phải loại bỏ."
lang_multi_text.db,MultiText,ZYFZDDDA_15_3,在看实验数据吗？,Are you looking at experimental data?,Đang xem dữ liệu thí nghiệm à?
lang_multi_text.db,MultiText,ZYFZDDDA_15_30,听起来只是研究思路不同。,Sounds like your research approaches are somewhat different.,Nghe có vẻ chỉ là hướng nghiên cứu khác nhau thôi.
lang_multi_text.db,MultiText,ZYFZDDDA_15_31,如果是这样就好了……只可惜，我们始终是不同的两种人……,"It wouldn't be a big deal if that's all it was... but unfortunately, we're just different people.","Nếu chỉ vậy thì tốt rồi... Tiếc là, bọn mình từ đầu đến cuối vẫn là hai kiểu người khác nhau..."
lang_multi_text.db,MultiText,ZYFZDDDA_15_32,不一样的音符，也能谱出动听的旋律。,Different notes can come together to form a beautiful melody.,Những nốt nhạc khác nhau vẫn có thể tạo nên giai điệu hay mà.
lang_multi_text.db,MultiText,ZYFZDDDA_15_33,是嘛……,Is that so...,Thế sao...
lang_multi_text.db,MultiText,ZYFZDDDA_15_34,……我想……我还没学会在这段旋律里，找到属于自己的声音……,I... I don't think I've found my own voice in this melody yet...,...Mình nghĩ... mình vẫn chưa học được cách tìm ra thanh âm thuộc về mình trong giai điệu ấy...
lang_multi_text.db,MultiText,ZYFZDDDA_15_4,等人？,Waiting for someone?,Đang đợi ai à?
lang_multi_text.db,MultiText,ZYFZDDDA_15_5,……也许吧……只是我也不太确定，我等的那个人究竟会不会来……,"Perhaps... Only, I'm not sure if they'll come...","...Có lẽ vậy... Chỉ là mình cũng không chắc, người mình đợi rốt cuộc có đến hay không..."
lang_multi_text.db,MultiText,ZYFZDDDA_15_6,嗯？啊……算是吧。,Huh? Oh... I guess I am.,Hả? À... cũng coi như là vậy.
lang_multi_text.db,MultiText,ZYFZDDDA_15_7,……一个人站着有些无聊，想着……至少找点事情来做。,"...It's kind of dull just standing around by myself, so I thought I could at least find something to occupy myself.","...Đứng một mình hơi buồn chán, nên nghĩ rằng... ít nhất cũng tìm việc gì đó để làm."
lang_multi_text.db,MultiText,ZYFZDDDA_15_8,……唔……说是在发呆，大概会更诚实一点。,"Um... To be honest, it's more like I'm just spacing out.",...Ừm... nói là đang ngẩn ra thì có lẽ thành thật hơn.
lang_multi_text.db,MultiText,ZYFZDDDA_15_9,有些陌生的面孔呢，是这学期来的新生？,I don't think we've met. Are you a new student?,"Gương mặt hơi lạ nhỉ, là tân sinh viên học kỳ này à?"
lang_multi_text.db,MultiText,ZYFZDDDA_1_1,皮可啾，慢了一分钟哦。,"You're a minute behind, Pikjo!","Pikjo, chậm mất một phút rồi đấy."
lang_multi_text.db,MultiText,ZYFZDDDA_1_2,不过不用担心，世界偶尔也会放缓步子。,But that's okay—sometimes even the whole world moves slowly.,"Nhưng đừng lo, thỉnh thoảng thế giới cũng chậm lại bước chân mà."
lang_multi_text.db,MultiText,ZYFZDDDA_1_3,或者……唔，要不要试着先打个节拍？,Or... You could try clapping to a beat.,"Hoặc là... ừm, hay thử vỗ nhịp trước xem?"
lang_multi_text.db,MultiText,ZYFZDDDA_1_4,……,...,...
lang_multi_text.db,MultiText,ZYFZDDDA_1_5,别紧张，跟着风的节奏，呼吸、放松。,"Just breathe, relax, and follow the wind's tempo.","Đừng căng thẳng, hãy theo nhịp gió mà hít thở, thả lỏng."
lang_multi_text.db,MultiText,ZYFZDDDA_1_6,——对，就是这样。现在，你和风也是好朋友了。,"Yes, just like that. Now the wind is your friend, too!","- Đúng rồi, cứ như vậy đó. Giờ thì cậu và gió cũng là bạn tốt rồi."
lang_multi_text.db,MultiText,ZYFZDDDA_20_1,{PlayerName}同学，欢迎回来。,"{PlayerName}, welcome back.","Bạn học {PlayerName}, chào mừng trở lại."
lang_multi_text.db,MultiText,ZYFZDDDA_20_10,就像皮可啾和皮可啵，明明时间差了两分钟，却始终记得对方的节奏。,"They're just like Pikjo and Pikbo—clearly two minutes apart, yet always matching the other's tempo.","Giống như Pikjo và Pikbo vậy, rõ ràng lệch nhau hai phút, nhưng luôn nhớ nhịp điệu của đối phương."
lang_multi_text.db,MultiText,ZYFZDDDA_20_11,所以嘛，和好啊……也许只是需要一些时间而已。,So... maybe they just need a little time to make up.,"Nên là, làm hòa ấy... có lẽ chỉ cần thêm một chút thời gian thôi."
lang_multi_text.db,MultiText,ZYFZDDDA_20_12,时间并不能解决一切问题。,Time won't solve everything.,Thời gian không thể giải quyết mọi vấn đề.
lang_multi_text.db,MultiText,ZYFZDDDA_20_13,嗯……那就让风替他们慢慢传话吧。,Yeah... let's wait for the wind to break the ice for them.,Ừm... vậy thì để gió thay họ từ từ truyền lời đi nhé.
lang_multi_text.db,MultiText,ZYFZDDDA_20_14,那就……再多一个机会，多一点勇气。,Then... they'll need another opportunity and a little more courage.,"Vậy thì... thêm một cơ hội nữa, thêm một chút dũng khí."
lang_multi_text.db,MultiText,ZYFZDDDA_20_15,嘿嘿，风最擅长的，就是不动声色地传话呢。,"Hehe, being an impartial messenger is what the wind does.","Hehe, gió giỏi nhất chính là âm thầm truyền lời đấy."
lang_multi_text.db,MultiText,ZYFZDDDA_20_16,……我一直相信，相互在意的两个人，最后总会重逢的。,...I have faith that two people who care about each other will always reunite in the end.,"...Tôi luôn tin rằng, hai người quan tâm lẫn nhau, cuối cùng nhất định sẽ gặp lại."
lang_multi_text.db,MultiText,ZYFZDDDA_20_2,看表情……你见过他们了，对吧？,"Judging by your expression... You went to see them, didn't you?","Nhìn biểu cảm... cậu đã gặp họ rồi, đúng không?"
lang_multi_text.db,MultiText,ZYFZDDDA_20_3,你向露比娅转述了埃里欧和塞娜的情况。,You tell Rubia about the situation between Erio and Sena.,Bạn kể lại cho Rubia nghe về tình hình giữa Erio và Sena.
