db_file,table_name,id,zh,en,vi
lang_hot_patch.db,HotPatchText,SubPackageHttp_Fail_Content,拉取更新数据失败，请重试或者直接全量下载,Upgraded data loading failed. Please retry or full download.,Lấy dữ liệu cập nhật thất bại. Vui lòng thử lại hoặc tải toàn bộ.
lang_hot_patch.db,HotPatchText,UserProtocol,查看用户协议,Terms of Use,Xem điều khoản sử dụng
lang_hot_patch.db,HotPatchText,ValidateResourceFailed,校验资源文件失败，请重启尝试或联系客服,Failed to verify file integrity. Please restart the game client and try again or contact customer service.,Xác minh tệp tài nguyên thất bại. Vui lòng khởi động lại game hoặc liên hệ hỗ trợ.
lang_influence.db,Influence,1,随机势力,Random Forces.,Thế Lực Ngẫu Nhiên.
lang_influence.db,Influence,2,先行公约,Pioneer Association,Hiệp Ước Tiên Phong
lang_influence.db,Influence,3,"先行公约会是人类共同体在鸣式战争后讨论并成立的组织——“先行公约”，简称先约。
在皇龙，因为全体人民对共鸣者更加信任，共鸣者与普通人之间的矛盾极为少见，因此先约的规模较大，承担了诸多的责任与功能。先约组织的成员在皇龙被视为一种光荣的职业，也是孩童梦想中的英雄。","Pioneer Association was founded after the Wuthering War by human community. They sometimes go by PA for short.
Due to the trusting relationship between Resonators and regular people in Huanglong, PA got relatively huge scale in Huanglong, and take on more responsibility. Joining the PA is something worth being proud of in Huanglong.","Hội Hiệp Ước Tiên Phong là tổ chức được cộng đồng nhân loại thảo luận và thành lập sau cuộc chiến Minh Thức - mang tên ""Hiệp Ước Tiên Phong"", gọi tắt là Tiên Ước.
Tại Hoàng Long, nhờ toàn dân tin tưởng Cộng Hưởng Giả, mâu thuẫn giữa Cộng Hưởng Giả và người thường cực kỳ hiếm gặp, nên quy mô Tiên Ước ở đây khá lớn, đảm nhận rất nhiều trách nhiệm và chức năng. Thành viên Tiên Ước được xem là một nghề cao quý tại Hoàng Long, cũng là hình mẫu anh hùng trong giấc mơ của trẻ nhỏ."
lang_influence.db,Influence,4,皇龙分部,Huanglong Branch,Chi Nhánh Hoàng Long
lang_influence.db,Influence,5,吱吱快运,Squeak Express,Squeak Express
lang_influence.db,Influence,6,业务遍布全球的运输企业，承担过许多重要而危险的运输任务，深受多方信任。秉持“和气生财”的理念，吱吱快运及旗下成员都会主动避免用武力解决问题。,"A transportation company with their business all over the world. They would commit to the most dangerous transportation task and were trusted by many forces. With the belief ""Peace brings fortune"", They always avoid any force situation.","Một doanh nghiệp vận tải có chi nhánh khắp toàn cầu, từng đảm nhận nhiều nhiệm vụ vận chuyển quan trọng và nguy hiểm, được nhiều bên tin tưởng sâu sắc. Với phương châm ""Hòa khí sinh tài"", Squeak Express cùng các thành viên luôn chủ động tránh dùng vũ lực để giải quyết vấn đề."
lang_influence.db,Influence,7,皇龙分部,Huanglong Branch,Chi Nhánh Hoàng Long
lang_influence.db,Influence,8,蛟龙帮,The Sea Drake.,Giao Long Bang
lang_influence.db,Influence,9,以蛟龙修理厂为据点，活跃在皇龙各地的发明爱好者团体，因崇尚帮派文化自称为蛟龙帮。爱好：拉投资。特长：惹事生非。,"They gather in the Serpent Repair Shop, and is a group of invention lovers from different places of Huanglong. They call themselves the Sea Drakes. While they're all trying to get investment, things always go south for them.","Lấy Xưởng Sửa Chữa Giao Long làm căn cứ, đây là nhóm những người yêu thích phát minh hoạt động khắp nơi ở Hoàng Long. Vì ngưỡng mộ văn hóa giang hồ nên tự xưng là Giao Long Bang. Sở thích: kêu gọi đầu tư. Sở trường: gây rắc rối."
lang_influence.db,Influence,10,流放者-猪婆帮,The Piggy.,Kẻ Lưu Đày - Bang Trư Bà
lang_influence.db,Influence,11,流放者是各国对游荡在城市外以犯罪和拾荒方式为生的团体的统称。流放者没有统一的组织架构，每个营地之中战力最强的人会作为首领发号施令。在皇龙地区，他们主要集中在旧城遗址中，因人数众多理念不同，已经形成了两个帮派，其中的“猪婆帮”出于某些原因，对外来者似乎没有那么排斥。,"Exile is a name for all the individuals and organizations who was tossed out of the city and committed crime and scavenge for a living. They follow no jurisdiction. The most powerful individuals of each camp will have the right to give orders. In Huanglong, they gather in Wasted Metropolis. They're divided into 2 different group cause of their believes. One of the gang seems to be quite welcoming when it comes to outsiders.","Kẻ Lưu Đày là tên gọi chung mà các nước dùng để chỉ những nhóm lang thang bên ngoài thành phố, sống bằng cách phạm tội và nhặt nhạnh. Kẻ Lưu Đày không có tổ chức thống nhất, người mạnh nhất trong mỗi trại sẽ làm thủ lĩnh ra lệnh. Tại khu vực Hoàng Long, họ chủ yếu tập trung ở phế tích thành cổ. Do đông người và lý tưởng khác nhau, họ đã hình thành hai bang phái - trong đó ""Bang Trư Bà"" vì lý do nào đó, dường như không quá bài xích người ngoài."
lang_influence.db,Influence,12,残星会,Fractsidus,Tàn Tinh Hội
lang_influence.db,Influence,13,游走于世界各地秘密结社，组织中对力量与进化的崇拜近乎病态，目前可知该组织成员外形相对诡异，更多的情报尚在调查中。,A secret association wandered around the world. Their members crave for only power and evolutions and all preserve weird looks. More info of them await for revealing.,"Một hội kín hoạt động khắp nơi trên thế giới, bên trong tổ chức sùng bái sức mạnh và tiến hóa đến mức bệnh hoạn. Hiện biết rằng ngoại hình các thành viên tổ chức này khá quái dị, nhiều thông tin khác vẫn đang được điều tra."
lang_influence.db,Influence,14,黑海岸,Black Shores,Bờ Biển Đen
lang_influence.db,Influence,15,以黑海岸之名建立神秘的救世组织，游走在世界最险恶之地，不断集聚同伴，始终怀抱理想主义的热火，拯救这个摇摇欲坠的世界。黑海岸的成员与被邀请登岛的客人，都会佩戴一朵黑花作为信物。,A secret organization sworn to save the world under the name of Black Shore. They venture to the most dangerous place and gather allies with the same will to save the world. Their members and their guest will all carry a black flower as a symbol.,"Một tổ chức cứu thế bí ẩn được thành lập dưới danh nghĩa Bờ Biển Đen, hoạt động tại những nơi nguy hiểm nhất thế giới, không ngừng tập hợp đồng đội, luôn ôm ấp ngọn lửa lý tưởng để cứu lấy thế giới đang trên bờ sụp đổ này. Thành viên Bờ Biển Đen và khách được mời lên đảo đều đeo một bông hoa đen làm tín vật."
lang_influence.db,Country,1,随机国家,Random Country,Quốc gia ngẫu nhiên
lang_influence.db,Country,2,皇龙,Huanglong,Hoàng Long
lang_influence.db,Country,3,"皇龙建国至今已千年有余，漫长的历史让这个国家散发着悠久而浓厚的文化积淀，悲鸣虽然打断了皇龙的发展，但植根于人们心中的抗争与传承精神还留存于世。
复苏时代，皇龙依靠黑石工业实现了快速发展，源源不断的黑石订单让皇龙成为当之无愧的经济之国。","Huanglong is a nation of thousands of years. Long history forged a special and traditional culture for this nation. Although the Lament fracture it's development, but its people are still fighting and trying their best to inherit whatever the nation remains.
In the Recovery Age. Huanglong's Tacetite Industry brought life again to this country. With the endless order for the Tacetite, Huanglong's economy has ever stopped booming.","Hoàng Long lập quốc đã hơn ngàn năm, lịch sử lâu đời khiến đất nước này mang trong mình nền văn hóa sâu dày và đặc sắc. Dù Bi Minh đã làm gián đoạn sự phát triển của Hoàng Long, nhưng tinh thần đấu tranh và truyền thừa đã ăn sâu vào lòng người vẫn còn lưu giữ đến ngày nay.
Thời đại Phục Hưng, Hoàng Long dựa vào ngành công nghiệp Hắc Thạch để phát triển vượt bậc. Những đơn hàng Hắc Thạch không ngừng đổ về đã đưa Hoàng Long trở thành cường quốc kinh tế xứng danh."
lang_influence.db,Country,4,无国界组织,Organization without any Borders,Tổ chức Phi Biên Giới
lang_influence.db,Country,5,不受任何国家管辖，以自己的准则行事的诸多组织。其中不乏一些危险的存在，不谨慎应对的话，可能遭遇一些非常严峻的情况。,"Under no jurisdiction, they act on their own will and rules. We need to deal with the dangerous ones carefully, in case the situation went dire.","Không chịu sự quản lý của bất kỳ quốc gia nào, hành động theo quy tắc riêng của mình - đó là những tổ chức đa dạng này. Trong số đó không thiếu những thế lực nguy hiểm, nếu không ứng phó cẩn thận, rất có thể sẽ rơi vào tình huống vô cùng nghiêm trọng."
lang_infodisplay.db,InfoDisplay,1,无光之森生态调查1,Dim Forest Ecological Survey (1),Khảo Sát Sinh Thái Rừng Vô Quang 1
lang_infodisplay.db,InfoDisplay,2,"无光之森毫无疑问是皇龙区域里最伟大的宝库，没有一个区域的物种丰度可以与之相比。
 仅仅站在这个大门的入口，我就能清晰地听到植物的声音，听见它们的召唤。
 更幸运的是，如此珍贵的植物资料竟然近在咫尺！黑色猩猩手中握着的，正是图像资料中名为香牙蕉的芭蕉属植物的样子。据记录这种老少咸宜的水果，曾在悲鸣前被广泛种植。
 然而作为一种三倍体植物，香牙蕉与大多数的需要育种技术的经济作物植物一样，在悲鸣后便销声匿迹了。现在能在部分历史文献中，寻找到这一脆弱品种的相关信息。
 虽然十分遗憾，但这也是自然的演替规律。根据维里奈定律，停滞不前正是生物灭绝的重要因素之一，被人为剥夺繁衍能力的香牙蕉进入野外必然会有这样的结局。","The Dim Forest is, no doubt, the greatest treasure trove in Huanglong, and there is no region that compares to it in terms of species abundance.
Just standing at the entrance of this gate, I could clearly hear the voices of the plants and hear their call.
Even more fortunately, such precious plant data is so close in reach! What the chimpanzee was holding in his hand was exactly what the plantain plant named XXX looked like in the image documents. It was recorded that this fruit, popular among both young and old, had been widely cultivated before the Lament.
However, as a triploid plant, XXX, like most cash crop plants that require breeding techniques, disappeared after the Lament. Information about this fragile species can now be found in some historical literature.
Although regretable this is also the natural law of succession. According to Verina's law, stagnation is one of the most important factors of biological extinction, and this is the inevitable end of XXX in the wild, which has been artificially deprived of its ability to reproduce.","Rừng Vô Quang chắc chắn là kho báu vĩ đại nhất trong khu vực Hoàng Long, không nơi nào có thể sánh được về sự đa dạng loài.
 Chỉ đứng ở lối vào cánh cổng này, tôi đã có thể nghe rõ tiếng của cây cối, nghe thấy lời gọi của chúng.
 Còn may mắn hơn nữa, những tư liệu thực vật quý giá như vậy lại ở ngay trước mắt! Thứ mà con tinh tinh đen đang cầm trong tay chính xác là hình dáng của loài cây thuộc họ chuối có tên Hương Nha Tiêu trong tư liệu hình ảnh. Theo ghi chép, loại trái cây già trẻ đều thích này từng được trồng rộng rãi trước thời Bi Minh.
 Tuy nhiên, với tư cách là một loài thực vật tam bội thể, Hương Nha Tiêu cũng giống như hầu hết các loại cây kinh tế cần kỹ thuật nhân giống, đã biến mất sau Bi Minh. Hiện chỉ có thể tìm thấy thông tin về loài giống mỏng manh này trong một số tư liệu lịch sử.
 Tuy rất đáng tiếc, nhưng đây cũng là quy luật diễn thế tự nhiên. Theo định luật Verina, trì trệ chính là một trong những yếu tố quan trọng dẫn đến tuyệt chủng sinh vật, Hương Nha Tiêu bị tước đoạt khả năng sinh sản một cách nhân tạo, khi vào tự nhiên tất yếu sẽ có kết cục như vậy."
lang_infodisplay.db,InfoDisplay,3,无光之森生态调查2,Dim Forest Ecological Survey (2),Khảo Sát Sinh Thái Rừng Vô Quang 2
lang_infodisplay.db,InfoDisplay,4,"在星星花与植物之声的指引下，我来到了这桩绝美的紫色枝叶大型乔木面前。
 从叶片形状上看，这株植物有可能是榕属乔木的一个亚种。但叶片上的奇妙紫色来源不明，有待进一步的研究查证。
 这棵大树树下常年盘踞着育儿的母猩猩，这使得这些猩猩敏锐且狂暴。为了避免正面冲突，我通过数日的收集，拔取了大量的猩猩毛，并将其制成了外衣。通过这样的手段，我勉强靠近了大树，并采集了部分树叶的样本。
 但因为季节的原因，并没有采集到该树种的花以及果实的样本，周边也没有见到传粉昆虫的踪影。仍有诸多待揭示的谜题。
 不过我敢肯定，这是这个树种第一次被发现。我将其暂定名为紫叶榕，并跟它约好有机会再来倾听它讲述了一个多世纪的故事。
 再见了紫叶榕，等下次季节合适我们再见面。","Guided by the XXX and the sounds of the plant, I came to this stunningly beautiful large tree with purple branches and leaves.
Judging from the shape of the leaves, it is possible that this plant is a subspecies of Ficus arborvitae. However, the origin of the wonderful purple color on the leaves is unknown, and further research is needed to verify it.
The large tree is perennially cooped up with parenting female orangutans underneath, which makes them sensitive and rabid. To avoid a head-on confrontation, I plucked a large amount of gorilla hair through days of collecting and making it a coat. By such means, I took and effort to get close enough to the big tree and collected samples of some of the leaves.
However, because of the season, no samples of the flowers as well as the fruits of the species were collected, and no pollinating insects were seen in the vicinity. There are still many mysteries to be revealed.
But I am sure that this is the first time this species is discovered. I tentatively named it XXX and made an appointment with it to come back sometime to hear its story of more than a century.
Goodbye, XXX and I'll see you again when the season is right.","Dưới sự dẫn dắt của hoa sao và tiếng nói của thực vật, tôi đã đến trước cây đại mộc tuyệt đẹp với cành lá màu tím này.
 Xét về hình dáng lá, loài cây này có thể là một phân loài của chi đa (Ficus). Tuy nhiên, nguồn gốc của sắc tím kỳ diệu trên lá vẫn chưa rõ, cần nghiên cứu thêm để xác minh.
 Dưới gốc cây lớn này quanh năm có những con tinh tinh mẹ đang nuôi con trú ngụ, khiến chúng trở nên nhạy cảm và hung dữ. Để tránh đối đầu trực diện, tôi đã dành nhiều ngày thu thập một lượng lớn lông tinh tinh và làm thành áo khoác. Bằng cách này, tôi mới miễn cưỡng tiếp cận được cây lớn và thu thập một số mẫu lá.
 Nhưng vì lý do mùa vụ, tôi không thu thập được mẫu hoa và quả của loài cây này, xung quanh cũng không thấy dấu vết côn trùng thụ phấn. Vẫn còn nhiều bí ẩn chờ được giải đáp.
 Tuy nhiên tôi dám chắc, đây là lần đầu tiên loài cây này được phát hiện. Tôi tạm đặt tên nó là Tử Diệp Dung, và hẹn với nó rằng khi có dịp sẽ quay lại lắng nghe câu chuyện hơn một thế kỷ của nó.
 Tạm biệt Tử Diệp Dung, mùa sau thích hợp chúng ta sẽ gặp lại."
lang_infodisplay.db,InfoDisplay,5,无光之森生态调查3,Dim Forest Ecological Survey (3),Khảo Sát Sinh Thái Rừng Vô Quang 3
lang_infodisplay.db,InfoDisplay,6,"在告别了紫叶榕后，我向着最重要的目标——幽闭禁林，前进。
 那是一颗目测超过200m高的大树，任何人都能嗅到，这巨树身上发散出的，伟大冒险的气息。它的存在仿佛昭示着生命的无穷伟力，我和灯灯花都被其若午后艳阳一般的勃勃生机吸引，不自觉的雀跃欢呼。
 但越靠近这个大树，植物们的声音便越惴惴不安。就连脚下的浮萍都在发出异样的声响。
 我很少在无音区辐射范围外发现这种现象。找到这个现象的源头说不定就可以发现整个无光之森的树木，无论是幽闭禁林还是刚才的紫叶榕都这么巨大的原因。
 那还等什么，坐而言不如起而行，现在就出发！","After bidding farewell to the Xxx, I headed towards the most important goal, the Confinement Woods.
It was a tree that was visually over 200m high, and anyone could smell the aura of great adventure emanating from this giant tree. Its presence seemed to indicate the infinite power of life, and I and Xxx were attracted by its vitality like then afternoon sun. We were involuntarily leaping and cheering.
But the closer we get to the tree, the more anxious the plants sound. Even the duckweed beneath the feet are making strange noises.
I rarely find this phenomenon outside the radiation range of Tacet Fields. Finding the source of this phenomenon may be lead to the reason why the trees throughout the Dim Forest, both the Confinement Woods and the Xxx just now are so huge.
So what am I waiting for? It's better to get up and go now than to sit and talk!","Sau khi từ biệt Tử Diệp Dung, tôi tiến về mục tiêu quan trọng nhất - U Bế Cấm Lâm.
 Đó là một cây đại thụ cao hơn 200m theo ước lượng bằng mắt, bất kỳ ai cũng có thể ngửi thấy hơi thở của cuộc phiêu lưu vĩ đại tỏa ra từ cây khổng lồ này. Sự tồn tại của nó như muốn tuyên bố sức mạnh vô tận của sự sống, tôi và hoa đèn đều bị sức sống mãnh liệt tựa nắng chiều rực rỡ của nó thu hút, vui sướng reo hò không kiềm được.
 Nhưng càng đến gần cây đại thụ, tiếng của cây cỏ càng bất an lo lắng. Ngay cả bèo dưới chân cũng phát ra âm thanh lạ lùng.
 Tôi rất hiếm khi phát hiện hiện tượng này bên ngoài phạm vi bức xạ của Vùng Vô Thanh. Tìm ra nguồn gốc của hiện tượng này biết đâu có thể khám phá ra lý do tại sao cây cối trong toàn bộ Rừng Vô Quang, dù là U Bế Cấm Lâm hay Tử Diệp Dung vừa rồi, đều khổng lồ đến vậy.
 Còn chờ gì nữa, nói không bằng làm, xuất phát ngay thôi!"
lang_infodisplay.db,InfoDisplay,7,无光之森生态调查4,Dim Forest Ecological Survey (4),Khảo Sát Sinh Thái Rừng Vô Quang 4
lang_infodisplay.db,InfoDisplay,8,"呼，上一次这么剧烈的运动已经不知道是什么时候了。
 跳下来的时候踩到的汽车外壳里竟然藏有一个结合科的幻象。我第一次见到这么执着的幻象，就好像真的被激怒了一样开始穷追不舍。从幽闭禁林旁一直追到这里才将它甩开。
 
 不过这已经是无音区附近了，土壤荒败不堪，植物也仅剩下痛苦的弥留之声。这个状态下的植物我也无能为力了。振作振作！衰败与灭亡也是生态的一部分，大自然不总是温和的，我的责任就是探明并见证这一切。","Whew, I don't know when the last time was when I had such a strenuous movement.
The shell of the car I stepped on when I jumped down was surprisingly hiding a TD of XXX. It was the first time I saw such a persistent TD, which started to chase as if really enraged. It chased me from the Confinement Woods all the way here before I could get rid of it.

But this is already near the Tacet Field, with soil barren and the plants left with only sounds of pain. There is nothing I can do for plants in this state. I have to cheer up! Decay and extinction are also part of ecology. Nature is not always gentle, and it is my duty to detect and witness it.","Phù, lần vận động mãnh liệt gần nhất như thế này là khi nào tôi cũng không nhớ nổi.
 Vỏ xe hơi mà tôi giẫm lên khi nhảy xuống lại giấu bên trong một Ảo Ảnh thuộc họ Kết Hợp. Lần đầu tiên tôi thấy một Ảo Ảnh kiên trì đến vậy, cứ như thật sự bị chọc giận mà bắt đầu đuổi theo không buông. Từ bên cạnh U Bế Cấm Lâm đuổi đến tận đây mới cắt đuôi được.
 
 Tuy nhiên đây đã là gần Vùng Vô Thanh rồi, đất đai hoang tàn không chịu nổi, cây cối chỉ còn lại tiếng rên rỉ đau đớn trước khi chết. Cây cối trong tình trạng này thì tôi cũng bất lực rồi. Phấn chấn lên nào! Suy tàn và diệt vong cũng là một phần của hệ sinh thái, thiên nhiên không phải lúc nào cũng hiền hòa, trách nhiệm của tôi là tìm hiểu rõ và chứng kiến tất cả."
lang_infodisplay.db,InfoDisplay,9,无光之森生态调查5,Dim Forest Ecological Survey (5),Khảo Sát Sinh Thái Rừng Vô Quang 5
