db_file,table_name,id,zh,en,vi
lang_multi_text.db,MultiText,Side_QTDWZS_10_4,事先声明，我绝对没有尾随过你！虽然你的盘古终端对我的课题很重要……,"And for the record, I absolutely didn't follow you! Even though your Pangu Terminal is essential for my research.","Tuyên bố trước nhé, tôi tuyệt đối không hề bám theo ngài! Mặc dù thiết bị Bàn Cổ của ngài rất quan trọng đối với đề tài của tôi..."
lang_multi_text.db,MultiText,Side_QTDWZS_10_5,但我更相信客观世界的必然性，骰子的数字不是随机的，我们的每次相遇被过去的因与未来的果所注定。,I believe in the inevitability of objectivity. Just like the numbers rolled on the dice aren't random; our every encounter is destined by past causes and future consequences.,"Nhưng tôi tin vào tính tất yếu của thế giới khách quan hơn, con số trên xúc xắc không phải ngẫu nhiên, mỗi lần gặp gỡ của chúng ta đều được định sẵn bởi nhân trong quá khứ và quả trong tương lai."
lang_multi_text.db,MultiText,Side_QTDWZS_10_6,听起来是不是很浪漫？,Doesn't that sound romantic?,Nghe có vẻ rất lãng mạn đúng không?
lang_multi_text.db,MultiText,Side_QTDWZS_10_7,讲正事。,Let's stick to the topic.,Nói vào việc chính đi.
lang_multi_text.db,MultiText,Side_QTDWZS_10_8,好吧，其实我在观察这些青杂兔。你有发现特别之处吗？,"Okay, fine. Actually, I'm now observing these Green Rabbits. Did you notice anything special?","Được rồi, thật ra tôi đang quan sát những con Thỏ Thanh Tạp này. Ngài có phát hiện ra điểm gì đặc biệt không?"
lang_multi_text.db,MultiText,Side_QTDWZS_10_9,没有尾巴？,They don't have tails?,Không có đuôi?
lang_multi_text.db,MultiText,Side_QTDWZS_10_10,没错，它们的尾巴会定期脱落。脱尾后的青杂兔会躲起来，离原先的族群远远的。,"Exactly, their tails shed periodically. After shedding, the Green Rabbits will hide away from their original group.","Đúng vậy, đuôi của chúng sẽ rụng định kỳ. Thỏ Thanh Tạp sau khi rụng đuôi sẽ trốn đi, tránh xa bầy đàn ban đầu."
lang_multi_text.db,MultiText,Side_QTDWZS_10_11,对这种行为的解读众说纷纭，正好翻译模块能派上用场，说不定今天我就能找出真相！,"There are various interpretations of this behavior. With the translation module, we can probably find out the truth today!","Có rất nhiều ý kiến khác nhau về hành vi này, vừa hay mô-đun dịch thuật có thể phát huy tác dụng, biết đâu hôm nay tôi sẽ tìm ra chân tướng!"
lang_multi_text.db,MultiText,Side_QTDWZS_10_12,【悬音在你的盘古终端上加载了兔语翻译模块。】,Xuanyin loads the Rabbit Language Translation Module onto your Pangu Terminal.,[Huyền Âm đã cài đặt mô-đun dịch tiếng thỏ lên thiết bị Bàn Cổ của bạn.]
lang_multi_text.db,MultiText,Side_QTDWZS_11_1,呜呜呜……,Sobbing...,Hu hu hu...
lang_multi_text.db,MultiText,Side_QTDWZS_11_2,断了尾的小家伙在哭吗？看来它们的心理活动远比我想象的更复杂。,Is this little tailless one crying? Seems like there is a lot happening inside them.,Con vật nhỏ bị đứt đuôi đang khóc sao? Xem ra diễn biến tâm lý của chúng phức tạp hơn tôi tưởng nhiều.
lang_multi_text.db,MultiText,Side_QTDWZS_11_3,呜呜呜……,Sobbing...,Hu hu hu...
lang_multi_text.db,MultiText,Side_QTDWZS_11_4,翻译模块是不是又故障了？,Is the translation module malfunctioning again?,Mô-đun dịch thuật lại bị hỏng rồi à?
lang_multi_text.db,MultiText,Side_QTDWZS_11_5,唔，信息传输一切正常，没什么问题，我们找些对照组来试试？,"Hmm, the information transmission is all normal, and no issues were found. How about we try finding some control groups?","Ưm, truyền tải thông tin vẫn bình thường, không có vấn đề gì, hay chúng ta tìm vài nhóm đối chứng để thử xem?"
lang_multi_text.db,MultiText,Side_QTDWZS_11_6,没断尾的青杂兔？,Do you mean the Green Rabbits with tails?,Thỏ Thanh Tạp chưa đứt đuôi?
