db_file,table_name,id,zh,en,vi
lang_multi_text.db,MultiText,Character_ZheZhi_15_15,刚才我去询问了那位画师，她对自己的罪行供认不讳。但当我继续深入询问时，她却又什么都不说了。,"She fessed up when I first started talking to her, but clammed up when I tried to dig deeper.","Vừa rồi tôi có đi hỏi vị họa sĩ đó, cô ấy thú nhận tội lỗi của mình không chút giấu giếm. Nhưng khi tôi tiếp tục hỏi sâu hơn, cô ấy lại chẳng nói gì nữa."
lang_multi_text.db,MultiText,Character_ZheZhi_15_16,你在炽霞和研究员口中了解到，残象的行动与现场发现的一幅画的频率波动有关。画卷的能量来自画师接近超频的共鸣能力。,You learn from Chixia and a researcher that the Tacet Discords had gone wild due to a frequency fluctuation from a painting scroll found at the site. The scroll's power came from the artist's nearly Overclocked Forte.,Bạn biết được từ Xích Hà và nghiên cứu viên rằng hành động của Tàn Tượng có liên quan đến dao động tần số của một bức tranh được tìm thấy tại hiện trường. Năng lượng trong bức tranh đến từ năng lực cộng hưởng gần như Vượt Tần của họa sĩ.
lang_multi_text.db,MultiText,Character_ZheZhi_15_2,这次动乱是什么原因？,What was the cause of the incident?,Nguyên nhân của vụ hỗn loạn lần này là gì?
lang_multi_text.db,MultiText,Character_ZheZhi_15_3,经过临时检验，我们初步推测，这些残象的行动与现场发现的一幅画卷的频率波动有关。,"According to the preliminary examination, we suspect that these Tacet Discords were agitated by the Frequency Fluctuations from a scroll painting found at the scene.","Qua kiểm tra tạm thời, chúng tôi sơ bộ suy đoán rằng hành động của những Tàn Tượng này có liên quan đến dao động tần số của một bức tranh cuộn được tìm thấy tại hiện trường."
lang_multi_text.db,MultiText,Character_ZheZhi_15_4,留存在画卷里的能量，来自那位画师接近超频的共鸣能力。,The energy remaining in the painting was generated by its creator's Forte nearly overclocking.,Năng lượng lưu lại trong bức tranh đến từ năng lực cộng hưởng gần như Vượt Tần của vị họa sĩ đó.
lang_multi_text.db,MultiText,Character_ZheZhi_15_5,我们现在已经帮她稳定下来了，应该不会有事了。,"But rest assured, we've calmed her down and contained the energy.","Hiện giờ chúng tôi đã giúp cô ấy ổn định lại rồi, chắc sẽ không sao đâu."
lang_multi_text.db,MultiText,Character_ZheZhi_15_6,果然是共鸣能力……,It's a Forte. Just as I suspected...,Quả nhiên là năng lực cộng hưởng...
lang_multi_text.db,MultiText,Character_ZheZhi_15_8,那张画我们需要带回去详细检查，最终确定一下残象与它之间产生的关联，避免它继续引发危险。,The painting needs to be thoroughly examined to identify its connection with the monsters and eliminate any potential risk it still poses.,"Bức tranh đó chúng tôi cần mang về kiểm tra chi tiết, xác định lần cuối mối liên hệ giữa Tàn Tượng và nó, tránh để nó tiếp tục gây nguy hiểm."
lang_multi_text.db,MultiText,Character_ZheZhi_15_9,嗯…我是觉得她的状况有些怪怪的……不过当务之急是清理现场，避免危险扩散。,"Well... honestly, she seemed a bit off to me, but we don't have time for that now. We've got to clean up the scene and get the damage under control.","Ừm... tôi thấy tình trạng của cô ấy cứ lạ lạ thế nào ấy... nhưng việc cấp bách là dọn dẹp hiện trường, tránh để nguy hiểm lan rộng."
lang_multi_text.db,MultiText,Character_ZheZhi_16_1,为…什么……,Why...,T-tại sao...
lang_multi_text.db,MultiText,Character_ZheZhi_16_10,你为什么要这样做？,Why did you do this?,Tại sao cô lại làm như vậy?
lang_multi_text.db,MultiText,Character_ZheZhi_16_13,……,...,...
lang_multi_text.db,MultiText,Character_ZheZhi_16_14,明砚看起来并不愿意继续这个话题。,Mingyan appears to be done talking about the matter.,Minh Nghiên trông có vẻ không muốn tiếp tục chủ đề này.
lang_multi_text.db,MultiText,Character_ZheZhi_16_15,你查看画师明砚的情况时发现，她与折枝曾经是一起学画的同学。她断断续续的话语中似乎在说自己就是伤人事件的罪魁祸首，但她面露难色，似乎有所隐瞒，并不愿意开口透露更多信息。,"While investigating Mingyan, the artist in question, you discover she had once studied art alongside Zhezhi. Although Mingyan's fragmented speech suggests that she may be guilty, her expression hints at a more complicated story. However, she is unwilling to reveal more.","Khi bạn kiểm tra tình hình của họa sĩ Minh Nghiên, bạn phát hiện cô ấy từng là bạn học vẽ cùng với Chiết Chi. Những lời nói ngắt quãng của cô ấy dường như đang nói rằng mình chính là thủ phạm của vụ tấn công, nhưng vẻ mặt cô ấy lộ vẻ khó xử, dường như có điều che giấu, không muốn tiết lộ thêm thông tin."
lang_multi_text.db,MultiText,Character_ZheZhi_16_2,明砚？怎么是你……,Mingyan? Why are you...,Minh Nghiên? Sao lại là cô...
lang_multi_text.db,MultiText,Character_ZheZhi_16_3,你认识她？,Do you know her?,Bạn quen cô ấy à?
lang_multi_text.db,MultiText,Character_ZheZhi_16_4,见过几面，我们以前是一起学画的同学。,"Yes, we used to take painting lessons together.","Từng gặp vài lần, trước đây chúng tôi là bạn học vẽ cùng nhau."
