db_file,table_name,id,zh,en,vi
lang_multi_text.db,MultiText,AccessPath_303025_Description,凝素领域·荒萋旧殿,Forgery Challenge: Forsaken Remnants,Ngưng Tố Lĩnh Vực - Hoang Thê Cựu Điện
lang_multi_text.db,MultiText,AccessPath_303026_Description,凝素领域·灾逆旧殿,Forgery Challenge: Corroded Remnants,Ngưng Tố Lĩnh Vực - Tai Nghịch Cựu Điện
lang_multi_text.db,MultiText,AccessPath_303027_Description,B.1.N.G.O.,B.1.N.G.O.,B.1.N.G.O.
lang_multi_text.db,MultiText,AccessPath_401000_Description,索拉里斯探索获得,Exploring Solaris-3,Nhận từ khám phá Solaris-3
lang_multi_text.db,MultiText,AccessPath_401001_Description,拉古那探索获得,Ragunna Exploration,Nhận từ khám phá Ragunna
lang_multi_text.db,MultiText,AccessPath_402001_Description,野外采集获得,Overworld Collection,Nhận từ thu thập ngoài hoang dã
lang_multi_text.db,MultiText,AccessPath_402002_Description,动物掉落获得,Animals,Nhận từ rơi ra khi hạ gục động vật
lang_multi_text.db,MultiText,AccessPath_402003_Description,捕捉鱼类获得,Fishing,Nhận từ bắt cá
lang_multi_text.db,MultiText,AccessPath_402004_Description,捕捉昆虫获得,Insects,Nhận từ bắt côn trùng
lang_multi_text.db,MultiText,AccessPath_403001_Description,推荐：云陵谷采集,Gorges of Spirits,Đề xuất: Thu thập tại Vân Lăng Cốc
lang_multi_text.db,MultiText,AccessPath_403002_Description,推荐：中曲台地采集,Central Plains,Đề xuất: Thu thập tại Trung Khúc Đài Địa
lang_multi_text.db,MultiText,AccessPath_403003_Description,推荐：今州城采集,Jinzhou,Đề xuất: Thu thập tại Kim Châu
lang_multi_text.db,MultiText,AccessPath_403004_Description,推荐：荒石高地采集,Desorock Highland,Đề xuất: Thu thập tại Hoang Thạch Cao Địa
lang_multi_text.db,MultiText,AccessPath_403005_Description,推荐：北落野采集,Norfall Barrens,Gợi ý: Thu thập tại Bắc Lạc Dã
lang_multi_text.db,MultiText,AccessPath_403006_Description,推荐：无明湾采集,Wuming Bay,Gợi ý: Thu thập tại Vô Minh Loan
lang_multi_text.db,MultiText,AccessPath_403007_Description,推荐：虎口山脉采集,Tiger's Maw,Gợi ý: Thu thập tại Sơn Mạch Hổ Khẩu
lang_multi_text.db,MultiText,AccessPath_403008_Description,推荐：归墟港市采集,Port City of Guixu,Gợi ý: Thu thập tại Cảng Thị Quy Khư
lang_multi_text.db,MultiText,AccessPath_403009_Description,推荐：无光之森采集,Dim Forest,Gợi ý: Thu thập tại Rừng Vô Quang
lang_multi_text.db,MultiText,AccessPath_403010_Description,推荐：怨鸟泽采集,Whining Aix's Mire,Gợi ý: Thu thập tại Oán Điểu Trạch
lang_multi_text.db,MultiText,AccessPath_403011_Description,推荐：黑海岸采集,Black Shores,Gợi ý: Thu thập tại Hắc Hải Ngạn
lang_multi_text.db,MultiText,AccessPath_403012_Description,推荐：桃源乡采集,Taoyuan Vale,Gợi ý: Thu thập tại Đào Nguyên Hương
lang_multi_text.db,MultiText,AccessPath_403013_Description,推荐：鸣钟涧采集,Bell-Borne Ravine,Gợi ý: Thu thập tại Minh Chung Giản
lang_multi_text.db,MultiText,AccessPath_403014_Description,推荐：焚焰海采集,Sea of Flames,Gợi ý: Thu thập tại Phần Diễm Hải
lang_multi_text.db,MultiText,AccessPath_403015_Description,推荐：羽鹭湿地采集,Heron Wetland,Gợi ý: Thu thập tại Vũ Lộ Thấp Địa
lang_multi_text.db,MultiText,AccessPath_403016_Description,推荐：虎口矿场采集,Tiger's Maw Mine,Gợi ý: Thu thập tại Khoáng Trường Hổ Khẩu
lang_multi_text.db,MultiText,AccessPath_403017_Description,推荐：中央巨榕采集,Giant Banyan,Gợi ý: Thu thập tại Trung Ương Cự Dong
lang_multi_text.db,MultiText,AccessPath_403018_Description,推荐：猢思崖采集,Forbidden Forest,Gợi ý: Thu thập tại Hồ Tư Nhai
lang_multi_text.db,MultiText,AccessPath_403019_Description,推荐：凋零防线采集,Withered Line,Gợi ý: Thu thập tại Điêu Linh Phòng Tuyến
lang_multi_text.db,MultiText,AccessPath_403020_Description,推荐：远望营地采集,Camp Overwatch,Gợi ý: Thu thập tại Viễn Vọng Doanh Địa
lang_multi_text.db,MultiText,AccessPath_403021_Description,推荐：无音区附近采集,Proximity of Tacet Field,Gợi ý: Thu thập gần Vùng Vô Thanh
lang_multi_text.db,MultiText,AccessPath_403022_Description,推荐：海岸附近采集,Proximity of Coast,Gợi ý: Thu thập gần bờ biển
lang_multi_text.db,MultiText,AccessPath_403023_Description,推荐：乘霄山采集,Mt. Firmament,Gợi ý: Thu thập tại Thừa Tiêu Sơn
lang_multi_text.db,MultiText,AccessPath_403024_Description,推荐：隙光滩附近采集,Luminous Shore,Gợi ý: Thu thập gần Khích Quang Than
lang_multi_text.db,MultiText,AccessPath_403025_Description,推荐：眠龙庭附近采集,Mianloong Chamber,Gợi ý: Thu thập gần Miên Long Đình
lang_multi_text.db,MultiText,AccessPath_403026_Description,推荐：拂风水畔采集,Whisperwind Haven,Gợi ý: Thu thập tại Phất Phong Thủy Bạn
lang_multi_text.db,MultiText,AccessPath_403027_Description,推荐：氤柔水境采集,Nimbus Sanctum,Gợi ý: Thu thập tại Nhân Nhu Thủy Cảnh
lang_multi_text.db,MultiText,AccessPath_403028_Description,推荐：槲生半岛采集,Fagaceae Peninsula,Gợi ý: Thu thập tại Bán Đảo Hộc Sinh
lang_multi_text.db,MultiText,AccessPath_403029_Description,推荐：埃弗拉德金库采集,Averardo Vault,Gợi ý: Thu thập tại Kim Khố Averardo
lang_multi_text.db,MultiText,AccessPath_403030_Description,推荐：悲叹墓岛采集,Penitent's End,Gợi ý: Thu thập tại Bi Thán Mộ Đảo
lang_multi_text.db,MultiText,AccessPath_403031_Description,推荐：狄萨莱海脊采集,Thessaleo Fells,Gợi ý: Thu thập tại Địch Tát Lai Hải Tích
lang_multi_text.db,MultiText,AccessPath_404000_Description,烹饪获得,Cooking,Nhận từ nấu ăn
lang_multi_text.db,MultiText,AccessPath_405000_Description,合成获得,Synthesis,Nhận từ Hợp Thành
lang_multi_text.db,MultiText,AccessPath_406000_Description,切配制作获得,Ingredient Making,Nhận từ Chế biến nguyên liệu
lang_multi_text.db,MultiText,AccessPath_501000_Description,唤取获得,Convene,Nhận từ Triệu Hoán
lang_multi_text.db,MultiText,AccessPath_502001_Description,海市兑换,Store,Đổi tại Hải Thị
lang_multi_text.db,MultiText,AccessPath_503001_Description,干涉波片兑换处兑换,Waveplate Exchange,Đổi tại Quầy đổi Phiến Sóng Can Thiệp
lang_multi_text.db,MultiText,AccessPath_503002_Description,“纪念品”商店兑换,Souvenir Store,"Đổi tại cửa hàng ""Kỷ Niệm Phẩm"""
lang_multi_text.db,MultiText,AccessPath_503003_Description,古物交付,Casket Delivery,Giao nộp Cổ Vật
lang_multi_text.db,MultiText,AccessPath_503004_Description,马和杂货购买,Mahe's Grocery,Mua tại Tạp hóa Mahe
lang_multi_text.db,MultiText,AccessPath_503005_Description,拾方药房购买,Shifang Pharmacy,Mua tại Nhà thuốc Thập Phương
lang_multi_text.db,MultiText,AccessPath_503006_Description,锻造商店购买（印造台旁）,Weapon Shop,Mua tại Cửa hàng Rèn (cạnh Đài Ấn Tạo)
lang_multi_text.db,MultiText,AccessPath_503007_Description,异想商店兑换,Illusive Store,Đổi tại Cửa hàng Dị Tưởng
lang_multi_text.db,MultiText,AccessPath_503008_Description,深塔兑换所兑换,Adversity Exchange,Đổi tại Quầy đổi Thâm Tháp
lang_multi_text.db,MultiText,AccessPath_503009_Description,演练商店兑换,Simulation Training Store,Đổi tại Cửa hàng Diễn Luyện
lang_multi_text.db,MultiText,AccessPath_503010_Description,试炼商店兑换,Trial Store,Đổi tại Cửa hàng Thí Luyện
lang_multi_text.db,MultiText,AccessPath_503011_Description,乘宵山纪念品商店购买,Souvenir Store on Mt. Firmament.,Mua tại Cửa hàng Kỷ Niệm Phẩm Thừa Tiêu Sơn
lang_multi_text.db,MultiText,AccessPath_503012_Description,库默尼商行购买,KU-Money's Shop,Mua tại Thương hành KU-Money
lang_multi_text.db,MultiText,AccessPath_503013_Description,开启物资箱获得,Supply Pack,Nhận từ mở Hòm Vật Tư
lang_multi_text.db,MultiText,AccessPath_503014_Description,药剂商店「迷迭香」购买,Rosemary's Apothecary,"Mua tại Cửa hàng Dược phẩm ""Rosemary"""
lang_multi_text.db,MultiText,AccessPath_503015_Description,玛格烈特家庭餐厅购买,Trattoria Margherita,Mua tại Nhà hàng gia đình Margherita
lang_multi_text.db,MultiText,AccessPath_503016_Description,贡多拉水市购买,Gondola Market,Mua tại Chợ nổi Gondola
lang_multi_text.db,MultiText,AccessPath_503017_Description,共鸣医疗科购买,Resonator Nursing Unit,Mua tại Khoa Y tế Cộng Hưởng
lang_multi_text.db,MultiText,AccessPath_504000_Description,先约电台寰宇特约专属奖励,Connoisseur Channel,Phần thưởng độc quyền kênh Hoàn Vũ Đặc Ước - Đài Tiên Ước
lang_multi_text.db,MultiText,AccessPath_601001_Description,呓语种残象掉落,Whisperins,Tàn Tượng chủng Ê Ngữ rơi
lang_multi_text.db,MultiText,AccessPath_601002_Description,巨浪级呓语种残象掉落,Elite Class Whisperins,Tàn Tượng chủng Ê Ngữ cấp Cự Lãng rơi
lang_multi_text.db,MultiText,AccessPath_602001_Description,啸叫种残象掉落,Howlers,Tàn Tượng chủng Hào Khiếu rơi
lang_multi_text.db,MultiText,AccessPath_602002_Description,巨浪级啸叫种残象掉落,Elite Class Howlers,Tàn Tượng chủng Hào Khiếu cấp Cự Lãng rơi
lang_multi_text.db,MultiText,AccessPath_603001_Description,流放者掉落,Exiles,Lưu Phóng Giả rơi
lang_multi_text.db,MultiText,AccessPath_603002_Description,残星会掉落,Fractsidus,Tàn Tinh Hội rơi
lang_multi_text.db,MultiText,AccessPath_604001_Description,世界探索获得,Overworld Exploration,Khám phá thế giới
lang_multi_text.db,MultiText,AccessPath_605001_Description,轰鸣种与静默种残象掉落,Clamorlings or Tranquilites,Tàn Tượng chủng Oanh Minh và Tĩnh Mặc rơi
lang_multi_text.db,MultiText,AccessPath_605002_Description,巨浪级轰鸣种与静默种残象掉落,Elite Class Clamorlings or Tranquilites,Tàn Tượng chủng Oanh Minh và Tĩnh Mặc cấp Cự Lãng rơi
lang_multi_text.db,MultiText,AccessPath_606001_Description,受黑潮影响的残象掉落,Tacet Discords influenced by the Dark Tide,Tàn Tượng chịu ảnh hưởng Hắc Triều rơi
lang_multi_text.db,MultiText,AccessPath_606002_Description,巨浪级受黑潮影响的残象掉落,Elite Class influenced by the Dark Tide,Tàn Tượng cấp Cự Lãng chịu ảnh hưởng Hắc Triều rơi
lang_multi_text.db,MultiText,AccessPath_607001_Description,拉海洛轰鸣种残象掉落,Clamorling TDs in Lahai-Roi,Tàn Tượng chủng Oanh Minh tại Lahai-Roi rơi
lang_multi_text.db,MultiText,AccessPath_608001_Description,罗伊族流民信物,Roya Outcasts,Tín vật lưu dân tộc Roya
lang_multi_text.db,MultiText,AccessPath_609001_Description,隧群掉落,Exoswarm,Toại Quần rơi
lang_multi_text.db,MultiText,AccessPath_701000_Description,成就奖励,Trophy Rewards,Phần thưởng thành tựu
lang_multi_text.db,MultiText,AccessPath_702000_Description,共鸣者好感度奖励,Resonator Intimacy Rewards,Phần thưởng hảo cảm Cộng Hưởng Giả
lang_multi_text.db,MultiText,AccessPath_801000_Description,数据坞奖励,Data Bank Rewards,Phần thưởng Dữ Liệu Ổ
lang_multi_text.db,MultiText,AccessPath_802000_Description,索拉指南奖励,Guidebook Rewards,Phần thưởng Chỉ Nam Sora
lang_multi_text.db,MultiText,AccessPath_803000_Description,先行奖励,Exploration Rewards,Phần thưởng Tiên Hành
lang_multi_text.db,MultiText,AccessPath_804000_Description,全球预约奖励,Global Pre-registration Rewards,Phần thưởng đăng ký trước toàn cầu
lang_multi_text.db,MultiText,AccessPath_805000_Description,参与创作活动奖励,Fan Creation Event Participation Rewards,Phần thưởng tham gia hoạt động sáng tạo
lang_multi_text.db,MultiText,AccessPath_805001_Description,礼包中心,Bundles,Trung tâm gói quà
lang_multi_text.db,MultiText,AccessPath_805002_Description,余波珊瑚,Afterglow Coral,San Hô Dư Ba
lang_multi_text.db,MultiText,AccessPath_805003_Description,聆听星声,Tidal Exchange,Lắng Nghe Tinh Thanh
lang_multi_text.db,MultiText,AccessPath_805004_Description,活动获取,Events,Sự kiện
lang_multi_text.db,MultiText,AccessPath_810001_Description,霄山源记,Tales from Mt. Firmament,Tiêu Sơn Nguyên Ký
lang_multi_text.db,MultiText,AccessPath_82000009_Description,运营活动获得,Event,Nhận từ sự kiện vận hành
lang_multi_text.db,MultiText,AccessPath_82000010_Description,「凝月辉途」活动获得,Moonlit Path,"Nhận từ sự kiện ""Ngưng Nguyệt Huy Đồ"""
lang_multi_text.db,MultiText,AccessPath_820000_Description,心愿委托获得,Lodge Wishes,Nhận từ Ủy thác Tâm nguyện
lang_multi_text.db,MultiText,AccessPath_820001_Description,经营伙伴获得,Companions,Nhận từ Đối tác kinh doanh
lang_multi_text.db,MultiText,AccessPath_820002_Description,摊位建造获得,Fair Stalls,Nhận từ Xây dựng gian hàng
lang_multi_text.db,MultiText,AccessPath_820003_Description,完成追月节系列任务获得,Festival Journal,Hoàn thành chuỗi nhiệm vụ Lễ hội Truy Nguyệt để nhận
lang_multi_text.db,MultiText,AccessPath_820004_Description,凌晨4:00自动恢复至上限,Automatically restores to the full at 04:00 a.m.,Tự động hồi phục đến giới hạn lúc 4:00 sáng
lang_multi_text.db,MultiText,AccessPath_820005_Description,祈愿摊领取（完成「月下祈愿其四」后开放）,Wishing Stall (Complete Wish Upon the Moon IV to unlock),"Nhận tại Gian hàng Cầu nguyện (mở sau khi hoàn thành ""Nguyệt Hạ Kỳ Nguyện kỳ 4"")"
lang_multi_text.db,MultiText,AccessPath_820006_Description,完成角色委托获取,Companion Wish,Hoàn thành ủy thác nhân vật để nhận
lang_multi_text.db,MultiText,AccessPath_820013_Description,团圆铺购买,Yumyum Haven,Mua tại Tiệm Đoàn Viên
lang_multi_text.db,MultiText,AccessPath_820014_Description,找相里获取（完成「月下祈愿其四」后开放）,Xiang-LEE (Complete Wish Upon the Moon IV to unlock),"Tìm Xiangli để nhận (mở sau khi hoàn thành ""Nguyệt Hạ Kỳ Nguyện kỳ 4"")"
