db_file,table_name,id,zh,en,vi
lang_multi_text.db,MultiText,LZXBSC_14_12,*嗅到安心的味道，发出清亮的叫声。*,"*Catches a comforting scent and lets out a clear, bright yip.*","*Ngửi thấy mùi hương an lành, phát ra tiếng kêu trong trẻo.*"
lang_multi_text.db,MultiText,LZXBSC_14_13,……呼……原来是只拂尾狐啊。我说呢，还以为是残象，吓了我一大跳。,Phew... just a Flufftail Fox. Nearly scared the life out of me. I thought it was a Tacet Discord.,"...Hú hồn... hóa ra chỉ là một con Cáo Phất Vĩ thôi à. Tưởng là Tàn Tượng chứ, suýt hồn vía lên mây."
lang_multi_text.db,MultiText,LZXBSC_14_14,*竖起耳朵，随即发出尖而欢快的叫声。*,"*Pricks up its ears and lets out a high-pitched, joyful yip.*","*Vểnh tai lên, rồi phát ra tiếng kêu cao vút, vui vẻ.*"
lang_multi_text.db,MultiText,LZXBSC_14_15,发生啥了？小家伙怎么高兴成这样……,What happened? What's with the sudden excitement?,Gì vậy? Sao nhóc con phấn khích dữ vậy...
lang_multi_text.db,MultiText,LZXBSC_14_16,……诶？！不对不对！这劲头，这感觉……毛团？哈哈，毛团！是你啊！,"...Wait?! No way! This vibe, this feeling... Fluffball? Haha, Fluffball! It's you!","...Hả?! Khoan khoan! Cái thần thái này, cảm giác này... Bông Tơ? Haha, Bông Tơ! Là mày đấy hả!"
lang_multi_text.db,MultiText,LZXBSC_14_17,"听到埃罗的呼唤，那只叫“毛团”的拂尾狐轻快地扑出雪面。
它开心地绕在埃罗腿边团团转，小爪子踩得雪花乱飞。","At the sound of Ero's voice, the Flufftail Fox bursts out of the snow.
It happily circles his legs, tiny paws kicking up sprays of snow.","Nghe thấy tiếng gọi của Ero, con Cáo Phất Vĩ tên ""Bông Tơ"" nhanh nhẹn nhảy vọt khỏi lớp tuyết.
Nó vui sướng chạy vòng quanh chân Ero, móng vuốt nhỏ xíu đạp tung tuyết trắng tứ tung."
lang_multi_text.db,MultiText,LZXBSC_14_2,……,...,...
lang_multi_text.db,MultiText,LZXBSC_14_3,雪层被翻动过……,The snow's been disturbed...,Lớp tuyết đã bị xới lên...
lang_multi_text.db,MultiText,LZXBSC_14_4,……这里——被新雪掩住的洞口……,"...Here—it's a burrow, hidden by the fresh snowfall...",...Ở đây - một cái hang bị tuyết mới phủ kín...
lang_multi_text.db,MultiText,LZXBSC_14_5,……旁边的两条浅沟是……刨痕吗？,And these shallow grooves beside it... Are they claw marks?,...Hai rãnh nông bên cạnh là... vết bới sao?
lang_multi_text.db,MultiText,LZXBSC_14_6,等、等下！别动！,"Wait, hold on! Don't move!","Khoan, khoan đã! Đừng động đậy!"
lang_multi_text.db,MultiText,LZXBSC_14_7,那边……那团雪突然晃了一下！你刚才瞧见没？！,Over there... Did you see that?! That snow pile just moved!,Chỗ kia... đống tuyết đó vừa nhúc nhích! Cậu có thấy không?!
