db_file,table_name,id,zh,en,vi
lang_multi_text.db,MultiText,Main_Rinascita_2_12_80_3,死物长出口舌，日夜颂唱赞歌……这就是被黑潮腐化的造物们，最后所呈现的状态。,The dead grow tongues and sing praise day and night. That's what becomes of those consumed by the Dark Tide.,"Vật chết mọc ra lưỡi, ngày đêm hát vang thánh ca... Đây chính là trạng thái cuối cùng của những tạo vật bị Hắc Triều thối rữa."
lang_multi_text.db,MultiText,Main_Rinascita_2_12_80_4,若是巡游天国降临现世，所有黎那汐塔人……也都会变为这副模样。,"If the Journeying Paradise reaches our world, everyone in Rinascita... will suffer the same fate.","Nếu Thiên Đường Tuần Du giáng xuống trần thế, tất cả người dân Rinascita... cũng sẽ biến thành thế này."
lang_multi_text.db,MultiText,Main_Rinascita_2_12_80_5,呵……它们这是在排着队向神明颂歌献媚，请求着祂的恩典呢。,"Heh… Look at them. Lining up to flatter their Divinity, groveling for Its grace.","Hừ... Chúng đang xếp hàng hát thánh ca nịnh bợ thần linh, cầu xin ân sủng của Ngài đấy."
lang_multi_text.db,MultiText,Main_Rinascita_2_12_80_6,因为自身过于弱小，如果无法得到利维亚坦赏赐的“智识”，最后就只能成为其他造物的养料。,"Without Leviathan's ""wisdom,"" feeble minds like theirs are fit only to be devoured.","Vì bản thân quá yếu ớt, nếu không được Leviathan ban cho ""trí tuệ"", cuối cùng chỉ có thể trở thành chất dinh dưỡng cho tạo vật khác."
lang_multi_text.db,MultiText,Main_Rinascita_2_12_80_7,不知疲倦，不眠不休地膜拜巡礼，虔诚却不知去向。从此岸到对岸，从“天国”到“现世”……,"Ceaseless worship, stripped of meaning or soul. From this shore to the next, from Paradise back to our world...","Không mệt mỏi, không ngừng nghỉ, cứ thế tôn thờ hành hương, thành kính nhưng chẳng biết đi đâu. Từ bờ này sang bờ kia, từ ""Thiên Đường"" đến ""trần thế""..."
lang_multi_text.db,MultiText,Main_Rinascita_2_12_80_8,直至吸引更多的“信徒”同归天国的怀抱，然后，它们便可以去到利维亚坦那里领赏。,"All to gather more ""believers,"" to be drawn into the Paradise's maw. Then they'll go claim their due from Leviathan.","Cho đến khi lôi kéo thêm nhiều ""tín đồ"" cùng đến với vòng tay Thiên Đường, rồi sau đó, chúng có thể đến chỗ Leviathan nhận thưởng."
lang_multi_text.db,MultiText,Main_Rinascita_2_12_80_9,即使有着“磁带”缓解，我们也不能长时间暴露在这些“圣歌”的影响下……奇美拉。,"Even with the tape's help, we can't stay exposed to these ""hymns"" for too long... Chimera.","Dù có ""băng cassette"" giảm bớt, chúng ta cũng không thể tiếp xúc lâu với ảnh hưởng của những ""thánh ca"" này... Chimera."
lang_multi_text.db,MultiText,Main_Rinascita_2_12_8112_1,不必担心，治疗就交给我。,Worry not. You are safe with me.,"Đừng lo, việc chữa trị cứ để tôi."
lang_multi_text.db,MultiText,Main_Rinascita_2_12_8114_1,休想得逞！,Not while I'm watching!,Đừng hòng!
lang_multi_text.db,MultiText,Main_Rinascita_2_12_8116_1,我来献上和声！,Let my melody join yours!,Để tôi hòa thanh!
lang_multi_text.db,MultiText,Main_Rinascita_2_12_8118_1,别怕，有我在！,Stand tall! Your captain's got your back!,"Đừng sợ, có ta đây!"
lang_multi_text.db,MultiText,Main_Rinascita_2_12_811_1,我来抵挡！,No passing!,Để tôi chặn lại!
lang_multi_text.db,MultiText,Main_Rinascita_2_12_8120_1,中场演出——,Time for an interlude!,Màn giữa hiệp -
lang_multi_text.db,MultiText,Main_Rinascita_2_12_8121_1,起锚，换我们登台！,"Anchor aweigh, it's showtime!","Nhổ neo, đến lượt chúng ta lên sân khấu!"
lang_multi_text.db,MultiText,Main_Rinascita_2_12_8124_1,该你了，奥古斯塔！,"Your turn, Augusta!","Đến lượt cậu rồi, Augusta!"
lang_multi_text.db,MultiText,Main_Rinascita_2_12_8125_1,我的剑，期待已久。,My blade calls.,"Thanh kiếm của ta, đã chờ đợi từ lâu."
lang_multi_text.db,MultiText,Main_Rinascita_2_12_8128_1,请小心！在此……停滞！,Careful! Stop... right there!,Cẩn thận! Tại đây... đứng lại!
lang_multi_text.db,MultiText,Main_Rinascita_2_12_8129_1,希望的光辉！请再次庇佑我们！,"O light of hope, shine upon us once more!",Ánh sáng hy vọng! Xin hãy che chở chúng tôi một lần nữa!
lang_multi_text.db,MultiText,Main_Rinascita_2_12_8132_1,哦？意想不到的组合……,"Well, that's unexpected...",Ồ? Tổ hợp bất ngờ đấy...
lang_multi_text.db,MultiText,Main_Rinascita_2_12_8133_1,呵，这算是一种……挑衅吗？,Heh. Is this supposed to be a mockery?,"Hừ, đây là một kiểu... khiêu khích sao?"
lang_multi_text.db,MultiText,Main_Rinascita_2_12_8135_1,拙劣的模仿，真是荒谬！,"Ugh, ridiculous imitation! Disgraceful!","Bắt chước vụng về, thật nực cười!"
lang_multi_text.db,MultiText,Main_Rinascita_2_12_8136_1,总督阁下的剑技？还有我的火焰……卑鄙的小偷！,"The Ephor's swordplay... and even my flames?! Oh, you filthy thief!",Kiếm thuật của Ngài Tổng Đốc? Cả ngọn lửa của tôi nữa... Đồ trộm cắp đê tiện!
lang_multi_text.db,MultiText,Main_Rinascita_2_12_8137_1,我们引以为傲的技艺，岂容由你玷污……！,Our proud craft will not be defiled by the likes of you!,"Kỹ nghệ mà chúng ta tự hào, sao có thể để ngươi làm ô uế...!"
lang_multi_text.db,MultiText,Main_Rinascita_2_12_81_1,又回到了这里……,We're here again...,Lại trở về đây...
lang_multi_text.db,MultiText,Main_Rinascita_2_12_81_2,由利维亚坦塑造的，原本只存在于七丘传说中的“冥河”。,"The Styx Lake. A myth once whispered in Septimont, now carved into reality by Leviathan.","""Sông Minh"", do Leviathan tạo ra, vốn chỉ tồn tại trong truyền thuyết của Septimont."
lang_multi_text.db,MultiText,Main_Rinascita_2_12_81_3,与黑潮造物接触过的人们，都有可能出现幻觉。陷入幻境后，他们最先抵达的就是这里。,Those touched by the Tidespawn often begin to see things. Hallucinations... and this lake is usually the first they find.,"Những người từng tiếp xúc với tạo vật Hắc Triều đều có thể bị ảo giác. Khi rơi vào cảnh ảo, nơi đầu tiên họ đến chính là đây."
lang_multi_text.db,MultiText,Main_Rinascita_2_12_81_4,我们内心深处的愤怒、悲伤、痛苦……都会被利维亚坦读取，汇聚为这样一条，记忆的河流。,"Anger, sorrow, pain... Leviathan reads the depths of our hearts. And from them, It births this river of memory.","Nỗi giận dữ, nỗi buồn, nỗi đau sâu thẳm trong lòng chúng ta... đều bị Leviathan đọc lấy, hội tụ thành dòng sông ký ức như thế này."
lang_multi_text.db,MultiText,Main_Rinascita_2_12_81_5,但这条河流倒映出的，依然是我们自己，所呈现的，不过是我们潜意识里最害怕发生的事情。,What you see here is a part of you. The river mirrors what you fear most.,"Nhưng dòng sông này phản chiếu vẫn là chính chúng ta, thể hiện không gì khác ngoài điều mà tiềm thức ta sợ hãi nhất sẽ xảy ra."
lang_multi_text.db,MultiText,Main_Rinascita_2_12_81_6,所以那时的我，才会看到那些“不祥的画面”……但你为什么又会出现在那里？,That's why I saw those terrible visions. But why were you there too?,"Nên lúc đó tôi mới nhìn thấy những ""hình ảnh chẳng lành"" ấy... Nhưng sao cô lại xuất hiện ở đó?"
lang_multi_text.db,MultiText,Main_Rinascita_2_12_81_7,我的意识能够在现实与黑潮的世界中穿行，我曾在其中往返，尝试唤醒那些误入此地的人们。,"My mind can walk between reality and the Dark Tide. I've crossed this lake many times, trying to guide the lost home.","Ý thức của ta có thể di chuyển giữa thực tại và thế giới Hắc Triều, ta từng qua lại nhiều lần, cố đánh thức những người lạc bước vào nơi này."
lang_multi_text.db,MultiText,Main_Rinascita_2_12_81_8,很多时候，人们并非因为看到地狱而感到恐惧……而是因为恐惧，人们才看到了地狱。,"Oftentimes it isn't Hell that people fear. They fear fear itself, and that creates Hell.","Nhiều khi, con người không phải vì nhìn thấy địa ngục mà sợ hãi... mà vì sợ hãi, nên mới nhìn thấy địa ngục."
lang_multi_text.db,MultiText,Main_Rinascita_2_12_8_1,黑潮中间出现了一个……洞口？里面有什么东西，在给它们不断供应频率……,What is that in the center? An opening? Something inside is sending them frequencies to recover!,Giữa Hắc Triều xuất hiện một... lỗ hổng? Có thứ gì bên trong đang liên tục cung cấp tần số cho chúng...
