db_file,table_name,id,zh,en,vi
lang_multi_text.db,MultiText,Main_LahaiRoi_3_2_709_2,没关系，只是在磁暴中暴露了一小会儿……我身上还带着些隧群元件，应该没有大碍。,It's nothing. It was but a moment in the Void Storm. Some components of the Exoswarm I carry...  it was some protection.,"Không sao, chỉ bị phơi trong bão một lúc thôi... Tôi còn mang theo mấy linh kiện Exoswarm, chắc không vấn đề gì."
lang_multi_text.db,MultiText,Main_LahaiRoi_3_2_709_3,你看，你还看得见我，我还没有变成频率。,See? Still flesh and blood. I have not faded into a frequency...,"Thấy chưa, cậu vẫn nhìn thấy tôi mà, tôi vẫn chưa biến thành tần số đâu."
lang_multi_text.db,MultiText,Main_LahaiRoi_3_2_709_4,太可怕了，虚质磁暴竟然会突然发生……,Frightful for a Void Storm to strike so suddenly...,"Kinh quá, Bão Hư Chất lại xảy ra đột ngột như vậy..."
lang_multi_text.db,MultiText,Main_LahaiRoi_3_2_709_5,对了，我记得他们星炬学院的医务室可以做频率方面的检查！那里离得不远，现在就去看看吧！,"I remember, the healers at Startorch Academy can check for frequency sickness! It is not far. We should go there now!","Đúng rồi, tôi nhớ phòng y tế của Học viện Startorch có thể kiểm tra tần số! Chỗ đó không xa lắm, đi xem ngay thôi!"
lang_multi_text.db,MultiText,Main_LahaiRoi_3_2_800_1,接下来，是要去找那位伊摩尔祭司，参加赫尔琉斯的「归源之仪」，对吧。,"So we need to find Foreseer Yngvar at Haldarheim's Rite of Return, is that right?","Tiếp theo, chúng ta cần đi tìm tư tế Yngvar, tham gia ""Nghi Thức Quy Nguyên"" ở Haldarheim, đúng không."
lang_multi_text.db,MultiText,Main_LahaiRoi_3_2_800_2,要现在就出发吗？,Do you want to leave now?,Muốn xuất phát ngay không?
lang_multi_text.db,MultiText,Main_LahaiRoi_3_2_800_3,出发吧。,Let's go.,Đi thôi.
lang_multi_text.db,MultiText,Main_LahaiRoi_3_2_800_4,再等一会儿。,I still have something to attend to first.,Đợi thêm chút nữa.
lang_multi_text.db,MultiText,Main_LahaiRoi_3_2_800_5,嗯，一起走吧，前辈。,"Okay, let's be on our way then.","Ừ, cùng đi thôi, tiền bối."
lang_multi_text.db,MultiText,Main_LahaiRoi_3_2_8_1,冷静，玛嘉，冷静……它们已经暂时停下来了……事已至此，要不更进一步把它们强制关机？,"Calm down, Maja, calm down... Good, they've stopped for now. Maybe I should just shut them down?","Bình tĩnh, Maja, bình tĩnh... Tốt, chúng đã tạm dừng rồi... Đến nước này, hay là cứ tắt nguồn luôn đi?"
lang_multi_text.db,MultiText,Main_LahaiRoi_3_2_8_10,还是简要地说明一下这是怎么回事吧。,Why don't you start by explaining yourself?,Hãy giải thích ngắn gọn chuyện gì đang xảy ra đi.
lang_multi_text.db,MultiText,Main_LahaiRoi_3_2_8_11,哦……这是我们前几天派出去的探测机器人，用于测量野外的虚质浓度。,"Well, these are probe robots from a few days ago. We sent them out to measure Voidmatter concentrations in the tundra.","À... đây là mấy con robot thăm dò mà chúng em phái đi mấy hôm trước, dùng để đo nồng độ Hư Chất ngoài hoang dã."
lang_multi_text.db,MultiText,Main_LahaiRoi_3_2_8_12,本来预计今天回收完数据就去上课，结果不知怎么回事，一靠近它们就开始无差别攻击，更别说拿到数据了。,"We thought we'd finish collecting the data before class, but when we tried to approach them, they started attacking us.","Ban đầu em định hôm nay thu xong dữ liệu rồi đi học, ai ngờ không hiểu sao vừa đến gần là chúng tấn công bừa bãi, nói gì đến lấy dữ liệu."
lang_multi_text.db,MultiText,Main_LahaiRoi_3_2_8_13,我追了一路才追到这里，所以才错过了今天的课……,I chased them all the way here. That's why I missed the class today...,"Em đuổi theo mãi mới tới được đây, nên mới lỡ buổi học hôm nay..."
lang_multi_text.db,MultiText,Main_LahaiRoi_3_2_8_14,看起来是内部的<te href=700023>隧群元件</te>被虚质侵蚀，导致机体产生了异变。,The internal <te href=700023>Exoswarm material</te> was eroded by Voidmatter. That's what caused the malfunction.,"Có vẻ <te href=700023>linh kiện Tùy Quần</te> bên trong đã bị Hư Chất xâm thực, khiến thân máy biến đổi bất thường."
lang_multi_text.db,MultiText,Main_LahaiRoi_3_2_8_15,材料学课程上应该强调过，这种元件性质不稳定，只能在可观测的安全环境下使用啊……,This should have been covered in your Material Science coursework. Such material is inherently unstable and can only be used in controlled environments.,"Trong môn Vật liệu học đáng lẽ đã nhấn mạnh rồi, loại linh kiện này có tính chất không ổn định, chỉ được dùng trong môi trường an toàn có thể quan sát được..."
lang_multi_text.db,MultiText,Main_LahaiRoi_3_2_8_16,抱歉……,I'm so sorry...,Em xin lỗi...
lang_multi_text.db,MultiText,Main_LahaiRoi_3_2_8_17,出于安全考虑，处理这种情况，需要先停止机体的运行，再使用对虚质物质对受到污染的部件进行清洁。,"For safety reasons, you'll need to shut down the units first, then clean the contaminated parts with Voidmatter.","Vì lý do an toàn, khi xử lý tình huống này cần tắt máy trước, sau đó dùng chất chống Hư Chất để làm sạch các bộ phận bị ô nhiễm."
lang_multi_text.db,MultiText,Main_LahaiRoi_3_2_8_18,考虑到以常规形式靠近会有受攻击风险，需要用脉冲发生器进行远距离处理。要提器材调用申请了……,But approaching them right now may lead to further damage. We need a pulse generator to stun them from a distance. I'll submit a request.,"Nếu đến gần theo cách thông thường sẽ có nguy cơ bị tấn công, cần dùng máy phát xung để xử lý từ xa. Phải nộp đơn xin điều phối thiết bị..."
lang_multi_text.db,MultiText,Main_LahaiRoi_3_2_8_19,还有种更简单的方法。,There's a simpler solution.,Có cách đơn giản hơn.
lang_multi_text.db,MultiText,Main_LahaiRoi_3_2_8_2,不行——强制关机的话数据也会被清空的，那期末论文可怎么办啊！救命啊！！,"No, if I force the shutdown, I'll lose the data. Our thesis! Oh, somebody help!!","Không được -- tắt nguồn cưỡng bức thì dữ liệu cũng bị xóa sạch, luận văn cuối kỳ biết làm sao! Cứu em với!!"
lang_multi_text.db,MultiText,Main_LahaiRoi_3_2_8_20,（拔出迅刀）,(Unsheathe your sword.),(Rút kiếm ra)
lang_multi_text.db,MultiText,Main_LahaiRoi_3_2_8_21,不，那个，这不符合操作规范……,"No wait, that's against protocol...","Không, cái đó, làm vậy không đúng quy trình..."
lang_multi_text.db,MultiText,Main_LahaiRoi_3_2_8_22,……算了，还是之后再想检讨报告怎么写吧。,Never mind. I'll think about how to write the review report later.,"...Thôi, chuyện viết báo cáo kiểm điểm để tính sau vậy."
lang_multi_text.db,MultiText,Main_LahaiRoi_3_2_8_23,￥#&@……检测……目标……剿灭……,￥#&@... Scanning... Target... Eradication...,￥#&@... Phát hiện... Mục tiêu... Tiêu diệt...
