db_file,table_name,id,zh,en,vi
lang_multi_text.db,MultiText,Guide_YFSH_26_3,听说你在……怎么说来着，追求奶奶？,"I heard you're... um, what's the word? Courting Grandma?","Nghe nói ông đang... nói sao nhỉ, theo đuổi bà?"
lang_multi_text.db,MultiText,Guide_YFSH_26_4,打住打住，莹莹还小，别太关注我们老年人的事情！,"Oh my! Hold on, Yingying. You’re too young to understand what that means.","Dừng dừng, Doanh Doanh còn nhỏ, đừng quan tâm chuyện người già chúng ta!"
lang_multi_text.db,MultiText,Guide_YFSH_26_5,我还学了一个新词，叫黄昏恋！,I even learned a new term! Late-life love!,"Cháu còn học được một từ mới nữa, gọi là tình yêu xế chiều!"
lang_multi_text.db,MultiText,Guide_YFSH_26_6,总之，爷爷加油哦，我去帮你叫奶奶！,"Anyway, Grandpa, you should go for it! I’ll go tell Grandma you’re here!","Nói chung, ông cố lên nhé, cháu đi gọi bà ra cho!"
lang_multi_text.db,MultiText,Guide_YFSH_26_7,奶——奶——,GRANDMA!,Bà - ơi -
lang_multi_text.db,MultiText,Guide_YFSH_26_8,爷爷又来给你送夜息香啦——,"Grandpa Jingzhu is back with more Noctemints for you, Grandma!",Ông lại đến tặng Dạ Tức Hương cho bà rồi -
lang_multi_text.db,MultiText,Guide_YFSH_26_9,哎呀哎呀，现在的小朋友，了不得了不得。,"Oh my, oh my, kids these days are something else.","Ôi trời ơi, trẻ con bây giờ, ghê gớm thật ghê gớm."
lang_multi_text.db,MultiText,Guide_YFSH_27_1,夜息香？,Noctemints?,Dạ Tức Hương?
lang_multi_text.db,MultiText,Guide_YFSH_27_2,说来也怪，最近已经有十来个老头子跑来送我夜息香了。,"It’s strange. Lately, about ten gentlemen have brought me Noctemints.","Nói ra cũng lạ, gần đây đã có cả chục ông lão chạy đến tặng tôi Dạ Tức Hương rồi."
lang_multi_text.db,MultiText,Guide_YFSH_27_3,是十二个。,It’s twelve.,Mười hai ông.
lang_multi_text.db,MultiText,Guide_YFSH_27_4,现在我是第十三个……不对，明明前面那些也都是我嘛……,"And now I'm the thirteenth one... Hold on, those before were all me too…","Giờ tôi là người thứ mười ba... Không đúng, rõ ràng mấy người trước đó cũng đều là tôi mà..."
