db_file,table_name,id,zh,en,vi
lang_multi_text.db,MultiText,NPC_JKWW_14_3,工作早干晚干不都是干，只有摸鱼的时间是真正属于自己的。,"Work's still work, no matter how you stretch it. Only the moments when you slack off truly belong to you.","Làm sớm hay làm muộn thì cũng là làm, chỉ có lúc lười biếng mới thực sự là thời gian thuộc về mình thôi."
lang_multi_text.db,MultiText,NPC_JKWW_14_4,真羡慕你的松弛感。,I really envy your laid-back attitude.,Thật ghen tị với sự thư thái của cậu.
lang_multi_text.db,MultiText,NPC_JKWW_1_1,哇塞，金库这就连天上的云都是金色的，看上去就像……,"Wow, even the clouds here are golden, just like...","Ồ, ở Kim Khố này ngay cả mây trên trời cũng vàng rực, nhìn giống như..."
lang_multi_text.db,MultiText,NPC_JKWW_1_2,……就像拉古那黄金炸肉排。,…Just like Ragunna's Golden Fried Cutlet.,...giống như món sườn chiên vàng của Ragunna vậy.
lang_multi_text.db,MultiText,NPC_JKWW_1_3,少说两句，好好的气氛都让你破坏了。,"Keep it down, will you? You're ruining the mood with all that chatter.","Nói ít thôi đi, không khí đang đẹp thế mà bị cậu phá hỏng hết rồi."
lang_multi_text.db,MultiText,NPC_JKWW_2_1,啊，朋友，你也是来欣赏这边的夕阳的吗？这样的美景可不多见。,"Ah, my friend, come to admire the sunset too? This kind of beauty doesn't come around often.","À, bạn ơi, bạn cũng đến ngắm hoàng hôn bên này à? Cảnh đẹp thế này hiếm lắm đấy."
lang_multi_text.db,MultiText,NPC_JKWW_3_1,啧，怎么还没到？那家伙总是这么没有时间观念。,"Tsk, why aren't they here yet? That man has no concept of time.","Tch, sao vẫn chưa đến? Gã đó lúc nào cũng chẳng có khái niệm thời gian."
lang_multi_text.db,MultiText,NPC_JKWW_4_1,哎，来得晚了，黑街那出了点事，把我绊住了。,"Ugh, I'm late. Black Alley business. I got held up.","Hà, đến muộn rồi. Bên Hắc Nhai xảy ra chuyện, giữ chân tôi lại."
lang_multi_text.db,MultiText,NPC_JKWW_4_2,什么事？你别和我说，我们老家让人端了。,What happened? Don't say our home got raided.,Chuyện gì vậy? Đừng có nói với tôi là sào huyệt mình bị triệt rồi.
lang_multi_text.db,MultiText,NPC_JKWW_4_3,没什么，就是几个年轻人打架不知道收着点，差点变成了火并。,"Eh, just a few young bucks fighting, didn't know when to quit. Almost turned into a bloodbath.","Không có gì, chỉ là mấy thằng trẻ đánh nhau không biết kìm lại, suýt nữa biến thành hỗn chiến."
lang_multi_text.db,MultiText,NPC_JKWW_4_4,说正经的，你在莫塔里的地盘蹲点，蹲出什么结果来了吗？,On to more serious matters. Find anything useful while you were staking out Montelli's turf?,"Nói chuyện nghiêm túc đi, cậu canh gác ở địa bàn của Montelli, có thu được kết quả gì không?"
lang_multi_text.db,MultiText,NPC_JKWW_4_5,嘘，那么大声干嘛……你不怕让人听见？,"Shh, quiet down... do you want someone overhearing us?","Suỵt, nói to thế làm gì... Không sợ bị người ta nghe thấy à?"
lang_multi_text.db,MultiText,NPC_JKWW_5_1,……我们盯上的那批“尖货”，确实是被莫塔里的人保下来了，现在都被收进金库里了。,"...The ""prime goods"" we've been after? Yeah, the Montellis got their hands on them. They're locked up in the Vault now.","...Lô ""hàng xịn"" mà chúng ta nhắm tới, quả thật đã bị người của Montelli bảo vệ, giờ đã được cất hết vào kim khố rồi."
lang_multi_text.db,MultiText,NPC_JKWW_5_2,嘶，明明以前还接过他们的私活，没想到一点面子都不给。,"Hmph, used to do side jobs for them. Not even a scrap of respect now.","Khh, rõ ràng trước đây còn nhận việc riêng cho bọn họ, không ngờ chẳng nể mặt chút nào."
lang_multi_text.db,MultiText,NPC_JKWW_5_3,你们在聊什么呢？,What are you all talking about?,Các người đang nói chuyện gì vậy?
lang_multi_text.db,MultiText,NPC_JKWW_5_4,咳咳，{Male=这位先生;Female=这位女士}，我们刚才在聊这边的藏品拍卖会呢。,"I'm sorry, {Male=sir;Female=ma'am}, we were just discussing the collection auction here.","Khụ khụ, {Male=thưa ngài;Female=thưa cô}, chúng tôi vừa đang bàn về buổi đấu giá bộ sưu tập ở đây."
lang_multi_text.db,MultiText,NPC_JKWW_5_5,说起来，夜晚的埃弗拉德金库，景色可真是别有风味啊。,"Averardo Vault at night truly has a charm of its own, doesn't it?","Nói vậy chứ, Kim Khố Averardo về đêm, cảnh sắc quả thật rất đặc biệt."
lang_multi_text.db,MultiText,NPC_JKWW_5_6,……确实。,...No doubt.,...Đúng vậy.
lang_multi_text.db,MultiText,NPC_JKWW_6_1,这一路上来的台阶可真长啊……,"These stairs just keep going, don't they?",Bậc thang đi lên dài thật là dài...
lang_multi_text.db,MultiText,NPC_JKWW_7_1,你看到阶梯上方那栋雄伟的建筑了吗？许多人将它视作一个崭新时代的象征。,Did you notice the grand building at the top of the stairs? Many see it as a symbol of a new age.,Ngươi có thấy tòa kiến trúc hùng vĩ phía trên bậc thang kia không? Nhiều người coi nó là biểu tượng của một thời đại mới.
