db_file,table_name,id,zh,en,vi
lang_multi_text.db,MultiText,PrefabTextItem_4144488643_Text,关卡完成度：,Progress:,Tiến độ màn chơi:
lang_multi_text.db,MultiText,PrefabTextItem_4145223903_Text,结晶波片消耗,Waveplate Cost,Tiêu hao Kết Tinh Ba Phiến
lang_multi_text.db,MultiText,PrefabTextItem_4149936571_Text,玩家名称六字,Player Name,Tên người chơi
lang_multi_text.db,MultiText,PrefabTextItem_4149990340_Text,取消,Cancel,Hủy
lang_multi_text.db,MultiText,PrefabTextItem_4150238147_Text,补充所需费用,Restoration Cost,Chi phí bổ sung
lang_multi_text.db,MultiText,PrefabTextItem_415025669_Text,确定负荷模组,Confirm Stress Modules,Xác nhận mô-đun tải trọng
lang_multi_text.db,MultiText,PrefabTextItem_4151556197_Text,积分,Points,Điểm
lang_multi_text.db,MultiText,PrefabTextItem_4152762367_Text,限时,Limited-time,Giới hạn thời gian
lang_multi_text.db,MultiText,PrefabTextItem_4154457813_Text,+40,40.0,40.0
lang_multi_text.db,MultiText,PrefabTextItem_4155961621_Text,存在异常，如有疑问请联系官方客服,Please contact our Customer Service for assistance,"Phát hiện bất thường, nếu có thắc mắc vui lòng liên hệ bộ phận hỗ trợ chính thức"
lang_multi_text.db,MultiText,PrefabTextItem_4157147804_Text,放弃打出包含变化牌的对子,Do not play pairs with a Wild Card,Không đánh đôi chứa lá bài biến hóa
lang_multi_text.db,MultiText,PrefabTextItem_4157161430_Text,存在异常，如有疑问请联系官方客服,Please contact our Customer Service for assistance,"Phát hiện bất thường, nếu có thắc mắc vui lòng liên hệ bộ phận hỗ trợ chính thức"
lang_multi_text.db,MultiText,PrefabTextItem_4157773439_Text,当前武装形态,Current Weapon Form,Hình thái vũ trang hiện tại
lang_multi_text.db,MultiText,PrefabTextItem_4158407297_Text,已解锁卡牌,Unlocked Cards,Thẻ bài đã mở khóa
lang_multi_text.db,MultiText,PrefabTextItem_4159179128_Text,存在异常，如有疑问请联系官方客服,Please contact our Customer Service for assistance,"Phát hiện bất thường, nếu có thắc mắc vui lòng liên hệ bộ phận hỗ trợ chính thức"
lang_multi_text.db,MultiText,PrefabTextItem_4159278451_Text,轮次奖励,Round Rewards,Phần thưởng vòng
lang_multi_text.db,MultiText,PrefabTextItem_416014471_Text,按键设置,Controls,Cài đặt phím
lang_multi_text.db,MultiText,PrefabTextItem_4160631863_Text,限时礼物,Limited-Time Rewards,Quà giới hạn thời gian
lang_multi_text.db,MultiText,PrefabTextItem_4162351341_Text,前往,Go,Đi đến
lang_multi_text.db,MultiText,PrefabTextItem_4162772779_Text,存在异常，如有疑问请联系官方客服,Please contact our Customer Service for assistance,"Phát hiện bất thường, nếu có thắc mắc vui lòng liên hệ bộ phận hỗ trợ chính thức"
lang_multi_text.db,MultiText,PrefabTextItem_4163866925_Text,一天后……,A day later...,Một ngày sau...
lang_multi_text.db,MultiText,PrefabTextItem_4165078708_Text,等级上限,Level Cap,Giới hạn cấp độ
lang_multi_text.db,MultiText,PrefabTextItem_4165279054_Text,已调优,Tuning Complete,Đã điều chỉnh
lang_multi_text.db,MultiText,PrefabTextItem_4166363977_Text,存在异常，如有疑问请联系官方客服,Please contact our Customer Service for assistance,"Phát hiện bất thường, nếu có thắc mắc vui lòng liên hệ bộ phận hỗ trợ chính thức"
lang_multi_text.db,MultiText,PrefabTextItem_4166889119_Text,活跃度,Activity Pts,Điểm hoạt động
lang_multi_text.db,MultiText,PrefabTextItem_4169027139_Text,详情,Details,Chi tiết
lang_multi_text.db,MultiText,PrefabTextItem_417325014_Text,技能说明：,Skill Description:,Mô tả kỹ năng:
lang_multi_text.db,MultiText,PrefabTextItem_4174803454_Text,前往试用,Proceed to Trial,Đến dùng thử
lang_multi_text.db,MultiText,PrefabTextItem_4175665868_Text,已完成所有委托,All tasks completed,Đã hoàn thành tất cả ủy thác
lang_multi_text.db,MultiText,PrefabTextItem_4176731803_Text,列表中筛选,Filter Comp,Lọc trong danh sách
lang_multi_text.db,MultiText,PrefabTextItem_4176839545_Text,存在异常，如有疑问请联系官方客服,Please contact our Customer Service for assistance,"Phát hiện bất thường, nếu có thắc mắc vui lòng liên hệ bộ phận hỗ trợ chính thức"
lang_multi_text.db,MultiText,PrefabTextItem_417809823_Text,急需提升,Bad,Cần nâng cấp gấp
lang_multi_text.db,MultiText,PrefabTextItem_4178341819_Text,主动技能,Active Skill,Kỹ năng chủ động
lang_multi_text.db,MultiText,PrefabTextItem_4178497573_Text,取消,Cancel,Hủy
lang_multi_text.db,MultiText,PrefabTextItem_4180093837_Text,本次积分,Points,Điểm lần này
lang_multi_text.db,MultiText,PrefabTextItem_4182095607_Text,下载过程中可以最小化游戏,You can collapse the game while downloading,Có thể thu nhỏ trò chơi trong quá trình tải xuống
lang_multi_text.db,MultiText,PrefabTextItem_41836514_Text,筛选查看各等级奖励,Filter to view rewards for each level.,Lọc để xem phần thưởng từng cấp độ.
lang_multi_text.db,MultiText,PrefabTextItem_418445166_Text,选择登录方式,Select your login method,Chọn phương thức đăng nhập
lang_multi_text.db,MultiText,PrefabTextItem_4186126204_Text,悲鸣污染加剧,Lament Contamination Level Increasing,Ô nhiễm Bi Minh gia tăng
lang_multi_text.db,MultiText,PrefabTextItem_4186975979_Text,不打出包含变化牌的对子,Do not play pairs with a Wild Card,Không đánh ra đôi có chứa lá bài biến hóa
lang_multi_text.db,MultiText,PrefabTextItem_4187141121_Text,失去意识,Resonator Downed,Mất ý thức
lang_multi_text.db,MultiText,PrefabTextItem_4188981701_Text,存在异常，如有疑问请联系官方客服,Please contact our Customer Service for assistance,"Phát hiện bất thường, nếu có thắc mắc vui lòng liên hệ bộ phận hỗ trợ chính thức"
lang_multi_text.db,MultiText,PrefabTextItem_4189157817_Text,存在异常，如有疑问请联系官方客服,Please contact our Customer Service for assistance,"Phát hiện bất thường, nếu có thắc mắc vui lòng liên hệ bộ phận hỗ trợ chính thức"
lang_multi_text.db,MultiText,PrefabTextItem_4191645831_Text,新模拟已开启,New Simulations Available,Mô phỏng mới đã mở
lang_multi_text.db,MultiText,PrefabTextItem_4191760297_Text,图例,Legend,Chú giải
lang_multi_text.db,MultiText,PrefabTextItem_4191995654_Text,挑战时长,Challenge Duration,Thời gian thử thách
lang_multi_text.db,MultiText,PrefabTextItem_4192510731_Text,本期梦境援护,Current Dreamscape Aid,Mộng Cảnh Viện Hộ kỳ này
lang_multi_text.db,MultiText,PrefabTextItem_4193203987_Text,存在异常，如有疑问请联系官方客服,Please contact our Customer Service for assistance,"Phát hiện bất thường, nếu có thắc mắc vui lòng liên hệ bộ phận hỗ trợ chính thức"
lang_multi_text.db,MultiText,PrefabTextItem_4193206117_Text,+1,1.0,1.0
lang_multi_text.db,MultiText,PrefabTextItem_4195019226_Text,已方,Ally,Đồng minh
lang_multi_text.db,MultiText,PrefabTextItem_4197251610_Text,技能,Skill,Kỹ năng
lang_multi_text.db,MultiText,PrefabTextItem_4197550586_Text,暂无挑战记录,No Challenge Record,Chưa có lịch sử thử thách
lang_multi_text.db,MultiText,PrefabTextItem_4199552391_Text,图鉴,Gallery,Đồ giám
lang_multi_text.db,MultiText,PrefabTextItem_4200474854_Text,已完成,Complete,Đã hoàn thành
lang_multi_text.db,MultiText,PrefabTextItem_4201712852_Text,感知模块，探测附近区域的各种可用信息,Scanning Module to scan all available info from areas,"Mô-đun cảm ứng, dò quét các thông tin khả dụng trong khu vực lân cận"
lang_multi_text.db,MultiText,PrefabTextItem_420181092_Text,赛区强敌,Elite,Cường địch khu vực
lang_multi_text.db,MultiText,PrefabTextItem_420438341_Text,角色贴纸效果,Resonator Sticker Effect,Hiệu ứng nhãn dán nhân vật
lang_multi_text.db,MultiText,PrefabTextItem_4205125694_Text,奖励待领取,Unclaimed reward,Phần thưởng chờ nhận
lang_multi_text.db,MultiText,PrefabTextItem_4205403370_Text,已收录,Recorded,Đã thu thập
lang_multi_text.db,MultiText,PrefabTextItem_4206567020_Text,技能详情,Skill Detail,Chi tiết kỹ năng
lang_multi_text.db,MultiText,PrefabTextItem_4206664344_Text,试用名字,Trial Name,Tên dùng thử
lang_multi_text.db,MultiText,PrefabTextItem_4207845978_Text,本周任务,Weekly Quests,Nhiệm vụ tuần này
lang_multi_text.db,MultiText,PrefabTextItem_4212949123_Text,"湖中的巨影目光灼灼，似是要将你再度拉入永夜……
与你信任的伙伴一同踏入心之集域，链接彼此，重历与梦魇的战斗。","The looming shadow stares at you with its fiery eyes, as if trying to draw you back into the endless darkness. Enter the Somnoire with your trusted companions, link your minds and spirits, and relive your epic battle against the ever-lurking nightmare.","Bóng khổng lồ trong hồ nhìn chằm chằm với ánh mắt rực cháy, dường như muốn kéo ngươi trở lại vĩnh dạ một lần nữa...
Cùng đồng đội tin tưởng bước vào Tâm Chi Tập Vực, liên kết với nhau, trải lại trận chiến với cơn ác mộng."
lang_multi_text.db,MultiText,PrefabTextItem_4213189397_Text,进行中,Ongoing,Đang tiến hành
lang_multi_text.db,MultiText,PrefabTextItem_4217661232_Text,完成进度：{0},Progress: {0},Tiến độ hoàn thành: {0}
lang_multi_text.db,MultiText,PrefabTextItem_4220350963_Text,前往,Go,Đi đến
lang_multi_text.db,MultiText,PrefabTextItem_4221338554_Text,限时奖励,Limited-Time Rewards,Phần thưởng giới hạn
lang_multi_text.db,MultiText,PrefabTextItem_4221620803_Text,灾难情景,Disaster Trial,Tình huống thảm họa
lang_multi_text.db,MultiText,PrefabTextItem_4222738767_Text,累计可获得 [月相680],[680 Lunites] in total,Tổng cộng có thể nhận [680 Lunites]
lang_multi_text.db,MultiText,PrefabTextItem_4223057572_Text,模块,Modules,Mô-đun
lang_multi_text.db,MultiText,PrefabTextItem_4223712852_Text,存在异常，如有疑问请联系官方客服,Please contact our Customer Service for assistance,"Phát hiện bất thường, nếu có thắc mắc vui lòng liên hệ bộ phận hỗ trợ chính thức"
lang_multi_text.db,MultiText,PrefabTextItem_4224368500_Text,含有违规字符,Invalid characters,Chứa ký tự không hợp lệ
lang_multi_text.db,MultiText,PrefabTextItem_4225984639_Text,解明后可查看该月相内容,Decipher to view the details,Giải mã để xem nội dung Nguyệt Tướng này
lang_multi_text.db,MultiText,PrefabTextItem_4227102231_Text,设置,Setting,Cài đặt
lang_multi_text.db,MultiText,PrefabTextItem_4227434181_Text,模拟结束,Simulation Complete,Mô phỏng kết thúc
lang_multi_text.db,MultiText,PrefabTextItem_4229908435_Text,七日签到,7-Day Login,Điểm danh 7 ngày
lang_multi_text.db,MultiText,PrefabTextItem_423184049_Text,购买详情,Details,Chi tiết mua hàng
lang_multi_text.db,MultiText,PrefabTextItem_423363378_Text,存在异常，如有疑问请联系官方客服,Please contact our Customer Service for assistance,"Phát hiện bất thường, nếu có thắc mắc vui lòng liên hệ bộ phận hỗ trợ chính thức"
lang_multi_text.db,MultiText,PrefabTextItem_4235797181_Text,共鸣者突破,Resonator Ascension,Đột phá Cộng Hưởng Giả
lang_multi_text.db,MultiText,PrefabTextItem_4235959860_Text,界面设置,Interface,Cài đặt giao diện
lang_multi_text.db,MultiText,PrefabTextItem_4236007874_Text,确认,Confirm,Xác nhận
lang_multi_text.db,MultiText,PrefabTextItem_4236015397_Text,获取时间,Earned On,Thời gian nhận
lang_multi_text.db,MultiText,PrefabTextItem_423646034_Text,开启挑战,Start Challenge,Bắt đầu thử thách
lang_multi_text.db,MultiText,PrefabTextItem_4241061470_Text,暂无玩家,No Players,Chưa có người chơi
lang_multi_text.db,MultiText,PrefabTextItem_4241565059_Text,选择品质材料,Select Material,Chọn vật liệu phẩm chất
lang_multi_text.db,MultiText,PrefabTextItem_4241799217_Text,限时奖励,Limited-Time Rewards,Phần thưởng giới hạn
lang_multi_text.db,MultiText,PrefabTextItem_4242713761_Text,暂停,Pause,Tạm dừng
lang_multi_text.db,MultiText,PrefabTextItem_4245419163_Text,宝箱进度,Chest Progress,Tiến độ rương
lang_multi_text.db,MultiText,PrefabTextItem_4247626673_Text,领取,Claim,Nhận
lang_multi_text.db,MultiText,PrefabTextItem_425065202_Text,类型,Type,Loại
lang_multi_text.db,MultiText,PrefabTextItem_4250731435_Text,数据中心等级提升,Data Hub Level Up,Nâng cấp Trung Tâm Dữ Liệu
lang_multi_text.db,MultiText,PrefabTextItem_4251281759_Text,确认,Confirm,Xác nhận
lang_multi_text.db,MultiText,PrefabTextItem_4252161892_Text,先约电台开启,Pioneer Podcast Available,Mở Đài Phát Tiên Ước
lang_multi_text.db,MultiText,PrefabTextItem_4252853346_Text,额外获得,Extra,Nhận thêm
lang_multi_text.db,MultiText,PrefabTextItem_4253087608_Text,退出排队,Exit the queue,Thoát hàng chờ
lang_multi_text.db,MultiText,PrefabTextItem_4253133123_Text,星屑收集进度达到100时，即可自选一把四星武器,Collect 100 Stardusts to obtain a 4-Star weapon of your choice.,"Khi tiến độ thu thập Tinh Tiêu đạt 100, có thể tự chọn một vũ khí bốn sao."
lang_multi_text.db,MultiText,PrefabTextItem_4253970183_Text,常驻,Permanent,Thường trú
lang_multi_text.db,MultiText,PrefabTextItem_4256961982_Text,共鸣者列表,Resonators,Danh sách Cộng Hưởng Giả
lang_multi_text.db,MultiText,PrefabTextItem_4261150897_Text,可激活羁绊,Available Bond,Ràng Buộc khả dụng
lang_multi_text.db,MultiText,PrefabTextItem_4261190667_Text,饮品制作,Drink Making,Pha Chế Đồ Uống
