db_file,table_name,id,zh,en,vi
lang_multi_text.db,MultiText,BGYDGDSJ_75_1,学姐，这道题……抱歉，好像还是不太对。,This question… I'm sorry. I think I got it wrong again.,"Đàn chị, bài này... xin lỗi, hình như vẫn không đúng lắm."
lang_multi_text.db,MultiText,BGYDGDSJ_75_2,你啊……第二步又做错了哦。,You messed up the second step again.,Em đấy... bước thứ hai lại làm sai rồi.
lang_multi_text.db,MultiText,BGYDGDSJ_75_3,别死记硬背。喏，再看看这个——我们先把晶质的储能原理厘清楚。,Stop just memorizing. Here—read this part again. You need to understand how crystals store energy first.,"Đừng có học vẹt. Nè, xem lại cái này đi - chúng ta phải làm rõ nguyên lý tích năng lượng của tinh thể trước đã."
lang_multi_text.db,MultiText,BGYDGDSJ_75_4,啊……原来是我把流动路径搞反了……,Ah… so I had the flow path reversed…,A... hóa ra là em làm ngược đường dẫn dòng chảy...
lang_multi_text.db,MultiText,BGYDGDSJ_75_5,……,...,...
lang_multi_text.db,MultiText,BGYDGDSJ_75_6,（让人不自觉放慢脚步的画面……）,(A moment in time that makes you slow down…),(Một khung cảnh khiến người ta vô thức bước chậm lại...)
lang_multi_text.db,MultiText,BGYDGDSJ_75_7,（唔……也许很多年之后，我们怀念的，仍然会是这些安静而温柔的瞬间吧。）,"(Hmm… maybe years from now, the moments we'll miss most are still these quiet, soft ones.)","(Ừm... có lẽ rất nhiều năm sau này, điều chúng ta hoài niệm, vẫn sẽ là những khoảnh khắc yên bình và dịu dàng này thôi.)"
lang_multi_text.db,MultiText,BGYDGDSJ_75_8,（拿起终端，轻轻按下快门。）,(Lift the Terminal and press the shutter.),"(Cầm thiết bị đầu cuối lên, nhẹ nhàng bấm nút chụp.)"
lang_multi_text.db,MultiText,BGYDGDSJ_80_1,呀，这次的对了！,"Ah, you got it right this time!","A, lần này đúng rồi!"
lang_multi_text.db,MultiText,BGYDGDSJ_80_10,（拿出终端，展示刚拍下的照片。）,(Show the photo on the Terminal.),"(Lấy thiết bị đầu cuối ra, cho xem bức ảnh vừa chụp.)"
lang_multi_text.db,MultiText,BGYDGDSJ_80_11,是这样的……我最近正在为摄影同好会的「寻光集」活动拍摄作品，刚才看到你们专注的样子，忍不住按下了快门。,"So… I'm taking photos for the Photography Fan Club's ""Light Chaser Collection."" You two looked so in the zone, and I wanted to capture that moment.","Là thế này... dạo gần đây mình đang chụp tác phẩm cho sự kiện ""Tầm Quang Tập"" của Câu lạc bộ Nhiếp ảnh, vừa rồi thấy dáng vẻ tập trung của hai bạn, không kìm được nên đã bấm máy."
lang_multi_text.db,MultiText,BGYDGDSJ_80_12,要是两位觉得不方便，我可以立刻删除原片。,"If it bothers you, I can delete it right away.","Nếu hai vị thấy bất tiện, tôi có thể xóa ảnh gốc ngay lập tức."
lang_multi_text.db,MultiText,BGYDGDSJ_80_13,如果不介意的话……不知道我能不能将这张照片作为活动投稿？,But if you don't mind... could I submit this photo for the event?,Nếu không phiền... không biết mình có thể dùng bức ảnh này làm bài dự thi sự kiện được không?
lang_multi_text.db,MultiText,BGYDGDSJ_80_14,咦？这是你拍的吗？,Hm? You took this?,Hả? Cái này là bạn chụp sao?
lang_multi_text.db,MultiText,BGYDGDSJ_80_15,光影很不错呢……,The lighting is really good...,Ánh sáng đẹp thật đấy...
lang_multi_text.db,MultiText,BGYDGDSJ_80_16,哇，这张真好看！,"Wow, this one looks amazing!","Oa, tấm này đẹp thật!"
lang_multi_text.db,MultiText,BGYDGDSJ_80_17,诶，不对不对！我、我不是那个意思……我是说……学姐本来就好看来着！,"No, no, no! T-that's not what I meant... You always look good, Chuji!","Ơ, không phải không phải! Em, em không có ý đó... ý em là... đàn chị vốn dĩ đã đẹp rồi!"
lang_multi_text.db,MultiText,BGYDGDSJ_80_18,你啊……少在这里贫嘴。,Stop. Don't get cheeky with me.,Em đấy... bớt dẻo miệng đi.
lang_multi_text.db,MultiText,BGYDGDSJ_80_19,……咳，总之，想进能源学部的话，还得再下点苦功夫。,"Ahem. Anyway, if you want to get into Energy Sciences, you've gotta keep grinding.","...Khụ, tóm lại, muốn vào khoa Năng lượng thì còn phải khổ luyện nhiều."
lang_multi_text.db,MultiText,BGYDGDSJ_80_2,不错不错~照着这个进度，咱们能源学部怕是得提前给你准备分院邀请函了。,"Nice. At this rate, Energy Sciences might as well prepare your invitation letter early.","Khá lắm ~ Theo tiến độ này, e là khoa Năng lượng bọn chị phải chuẩn bị sẵn thư mời nhập học cho em rồi."
lang_multi_text.db,MultiText,BGYDGDSJ_80_20,我……明白了……,I-I know…,Em... hiểu rồi...
lang_multi_text.db,MultiText,BGYDGDSJ_80_21,（脸红）……你们这些小鬼真是的。,"(Slightly flustered) Ugh, you're impossible…",(Đỏ mặt)...Mấy đứa nhóc này thật là.
lang_multi_text.db,MultiText,BGYDGDSJ_80_22,对了同学，话说你刚刚说的活动，具体是做什么的？,"Anyway, you mentioned the event. What exactly is it?","Đúng rồi bạn học, cái sự kiện bạn vừa nói ấy, cụ thể là làm gì vậy?"
lang_multi_text.db,MultiText,BGYDGDSJ_80_23,（详细介绍「寻光集」。）,(Explain the Light Chaser Collection in detail.),"(Giới thiệu chi tiết về ""Tầm Quang Tập"".)"
lang_multi_text.db,MultiText,BGYDGDSJ_80_24,原来是这样啊，有点印象了……说起来这个活动我前几年就想报名来着，只是每次一忙起来就忘得一干二净。,"I see… Right, I remember now. I thought about joining a few years ago, but I always got too busy.","Hóa ra là vậy, có chút ấn tượng rồi... nhắc mới nhớ sự kiện này mấy năm trước chị đã định đăng ký, nhưng lần nào bận rộn lên là quên sạch sành sanh."
lang_multi_text.db,MultiText,BGYDGDSJ_80_25,毕竟现在的我已经不算是新生了呢。,"Now I'm not even a freshman anymore, anyway.",Dù sao chị bây giờ cũng không còn là tân sinh viên nữa rồi.
lang_multi_text.db,MultiText,BGYDGDSJ_80_26,我也隐隐约约听说过……不过最近都在跟着学姐补习，倒没顾得上看……,I've heard of it too… but I've been so busy catching up on my studies with Chuji that I never looked into it…,"Em cũng nghe loáng thoáng... nhưng dạo này toàn theo đàn chị học bổ túc, nên chẳng kịp xem..."
lang_multi_text.db,MultiText,BGYDGDSJ_80_27,不参加也没关系。,It's fine if you can't participate.,Không tham gia cũng không sao đâu.
lang_multi_text.db,MultiText,BGYDGDSJ_80_28,啊呀，机会都摆在眼前了~要是还傻乎乎地错过，未免太可惜了。,"No, no. Since the opportunity is right in front of us, it'd be a waste to pass it up.","Ây dà, cơ hội bày ra trước mắt rồi ~ Nếu còn ngốc nghếch bỏ lỡ thì tiếc lắm."
lang_multi_text.db,MultiText,BGYDGDSJ_80_29,不如把我们也算上。尤伦，你没意见对吧？,"What do you think, Yoren? You're okay with that, right?","Hay là tính cả bọn chị vào luôn. Yoren, em không có ý kiến gì chứ?"
lang_multi_text.db,MultiText,BGYDGDSJ_80_3,嘿嘿，谢谢学姐。,"Hehe… thanks for helping me, Chuji.","Hì hì, cảm ơn đàn chị."
lang_multi_text.db,MultiText,BGYDGDSJ_80_30,我、我听学姐的！,"I-I'll follow your lead, Chuji!",E-em nghe theo đàn chị!
lang_multi_text.db,MultiText,BGYDGDSJ_80_31,好了，一拍即合。那投稿的事就交给同学你啦~,Perfect. It's decided then. I'll leave the submission to you.,"Được rồi, nhất trí vậy nhé. Vậy chuyện nộp bài giao cho bạn học nha~"
lang_multi_text.db,MultiText,BGYDGDSJ_80_32,真好奇啊……等到我毕业，或者哪天轮到尤伦毕业，我们会变成什么样子……,"I can't help wondering… when I graduate, or when Yoren does, what will we be like?","Tò mò thật đấy... đợi đến lúc chị tốt nghiệp, hoặc hôm nào đó đến lượt Yoren tốt nghiệp, chúng ta sẽ biến thành dáng vẻ thế nào nhỉ..."
lang_multi_text.db,MultiText,BGYDGDSJ_80_33,希望到时候，这小子能让我这个学姐稍微骄傲一点。,I hope he manages to make me a little proud by then.,"Hy vọng đến lúc đó, thằng nhóc này có thể khiến bà chị này tự hào một chút."
lang_multi_text.db,MultiText,BGYDGDSJ_80_4,……,...,...
lang_multi_text.db,MultiText,BGYDGDSJ_80_5,其实我总觉得你那性子更适合去工学部的……,I always thought your personality fit Engineering better…,Thật ra chị cứ thấy tính cách em hợp với khoa Kỹ thuật hơn...
lang_multi_text.db,MultiText,BGYDGDSJ_80_6,不过啊，能为了理想咬着牙坚持下去……这一点连我也有些佩服。,"But seeing you dig your heels in for what you believe in… I have to admit, it's admirable.","Nhưng mà, có thể vì lý tưởng mà cắn răng kiên trì tiếp tục... điểm này ngay cả chị cũng có chút khâm phục."
lang_multi_text.db,MultiText,BGYDGDSJ_80_7,……算啦……以后的事，谁知道呢。,…Anyway. Who knows what the future holds.,...Thôi bỏ đi... chuyện sau này ai mà biết được chứ.
lang_multi_text.db,MultiText,BGYDGDSJ_80_8,你们好。,Hello.,Chào hai bạn.
lang_multi_text.db,MultiText,BGYDGDSJ_80_9,啊，不好意思……是不是我们两个太大声了？,"Oh, sorry, were we being too loud?","A, ngại quá... có phải hai đứa mình nói to quá không?"
lang_multi_text.db,MultiText,BGYDGDSJ_85_1,——注意！这是什么投掷姿势？,—ATTENTION! What was that throwing posture?,...CHÚ Ý! Tư thế ném này là gì?
lang_multi_text.db,MultiText,BGYDGDSJ_85_2,假如这只易拉罐是手雷，你早就把自己炸成两半了！,"If that can were a grenade, you'd have blown yourself in half already!","Giả sử lon nước này là lựu đạn, thì cậu đã tự làm mình nổ tung thành hai mảnh rồi!"
lang_multi_text.db,MultiText,BGYDGDSJ_85_3,那个……只是丢个空罐子的话，应该没那么严重吧……,Ugh… I was just tossing an empty can. How did it escalate to that…,"Cái đó... chỉ là ném cái lon rỗng thôi mà, chắc không nghiêm trọng thế đâu..."
lang_multi_text.db,MultiText,BGYDGDSJ_87_1,……那边似乎挺热闹的，去看看。,Sounds lively over there. I should take a look.,"...Đằng kia có vẻ náo nhiệt, qua xem thử."
lang_multi_text.db,MultiText,BGYDGDSJ_90_1,“只是”？战场上没有“只是”！,"""Just""? There is no ""just"" on the battlefield!","""Chỉ là""? Trên chiến trường không có ""chỉ là""!"
lang_multi_text.db,MultiText,BGYDGDSJ_90_10,准许继续报告。,Permission to proceed granted.,Cho phép tiếp tục báo cáo.
lang_multi_text.db,MultiText,BGYDGDSJ_90_11,（尝试介绍「寻光集」活动。）,(Introduce the Light Chaser Collection event.),"(Thử giới thiệu sự kiện ""Tầm Quang Tập"".)"
lang_multi_text.db,MultiText,BGYDGDSJ_90_12,诶？听上去挺有意思的。,"Hmm, that actually sounds fun.",Hả? Nghe thú vị phết.
lang_multi_text.db,MultiText,BGYDGDSJ_90_13,格里夫，要不要咱们一起试试？,"Griff, wanna try it?","Griff, hay là bọn mình cùng thử đi?"
lang_multi_text.db,MultiText,BGYDGDSJ_90_14,行啊，这种好玩的事情怎么可以少了我。不过……,Sure! How could I miss something this interesting? But…,"Được thôi, chuyện vui thế này sao có thể thiếu tớ. Nhưng mà..."
lang_multi_text.db,MultiText,BGYDGDSJ_90_15,同学同学，我可以邀请B.1.N.G.O.教官加入我们吗？,"Hey, hey, can we invite Instructor B.1.N.G.O. to join us?","Bạn học ơi, mình có thể mời giáo quan B.1.N.G.O. tham gia cùng không?"
lang_multi_text.db,MultiText,BGYDGDSJ_90_16,只要教官同意……,As long as the Instructor agrees…,Miễn là giáo quan đồng ý...
lang_multi_text.db,MultiText,BGYDGDSJ_90_17,只要垃圾桶先生同意……,As long as Mr. Trash Can agrees…,Miễn là Ngài Thùng Rác đồng ý...
lang_multi_text.db,MultiText,BGYDGDSJ_90_18,……错误称谓警告！,...INCORRECT TITLE USED!,...Cảnh báo gọi sai danh xưng!
lang_multi_text.db,MultiText,BGYDGDSJ_90_19,只要教官同意……,As long as the Instructor agrees…,Miễn là giáo quan đồng ý...
lang_multi_text.db,MultiText,BGYDGDSJ_90_2,你丢掉的每一样东西，都有可能是潜在资源。要学会回收、利用、重组——明白吗？！,"Every item you throw away could be a potential resource. Recycle it, reuse it, repurpose it—Understood?!","Mỗi thứ cậu vứt đi, đều có thể là tài nguyên tiềm năng. Phải học cách thu hồi, tận dụng, tái tổ hợp - hiểu chưa hả?!"
lang_multi_text.db,MultiText,BGYDGDSJ_90_20,……嗯。,…Good.,...Ừm.
lang_multi_text.db,MultiText,BGYDGDSJ_90_21,从士气维度评估，合影有助于增强团队凝聚力。,"From a morale-efficiency standpoint, group photos enhance unit cohesion.","Đánh giá từ khía cạnh sĩ khí, chụp ảnh chung giúp tăng cường sự gắn kết của đội ngũ."
lang_multi_text.db,MultiText,BGYDGDSJ_90_22,——同意拍摄！,—Photography request approved!,...Đồng ý chụp ảnh!
lang_multi_text.db,MultiText,BGYDGDSJ_90_23,那……战术教官！我们应该摆出什么样的拍照姿势才算合格呢？,"Hey, Tactical Instructor, what's your approved pose for a good photo?",Vậy... Giáo quan chiến thuật! Chúng em nên tạo dáng chụp ảnh thế nào mới đạt chuẩn ạ?
lang_multi_text.db,MultiText,BGYDGDSJ_90_24,立正！抬头！目视前方！,STAND AT ATTENTION! CHINS UP! EYES FORWARD!,Nghiêm! Ngẩng đầu! Mắt nhìn thẳng!
lang_multi_text.db,MultiText,BGYDGDSJ_90_25,这是标准的留影动作！,This is the standard posture for taking a picture!,Đây là động tác chụp ảnh tiêu chuẩn!
lang_multi_text.db,MultiText,BGYDGDSJ_90_26,还有，影像资料归档时请务必标注我的全称。,"Also, please ensure the archived file is labeled with my full operational name.","Còn nữa, khi lưu trữ tư liệu hình ảnh vui lòng ghi chú đầy đủ tên gọi của tôi."
lang_multi_text.db,MultiText,BGYDGDSJ_90_27,明白，「次世代战斗操作接口」。,"Understood, Battle Interface for Next-Gen Operations.","Rõ, ""Giao diện Thao tác Chiến đấu Thế hệ Mới""."
lang_multi_text.db,MultiText,BGYDGDSJ_90_3,垃圾桶先生还真是……专业……,"Well, Mr. Trash Can sure knows what he's talking about…",Ngài Thùng Rác đúng là... chuyên nghiệp thật...
lang_multi_text.db,MultiText,BGYDGDSJ_90_4,……我听见了！请这位同学使用正确称呼！,…I heard that! You <i>will</i> address me by my proper title!,...Tôi nghe thấy rồi đấy! Mời bạn học này sử dụng danh xưng chính xác!
lang_multi_text.db,MultiText,BGYDGDSJ_90_5,我是「次世代战斗操作接口」！战术教官，B.1.N.G.O.！,"I am the Battle Interface for Next-Gen Operations! Your Tactical Instructor, B.1.N.G.O.!","Tôi là ""Giao diện Thao tác Chiến đấu Thế hệ Mới""! Giáo quan chiến thuật, B.1.N.G.O.!"
lang_multi_text.db,MultiText,BGYDGDSJ_90_6,目前……咳，暂时执行环境清洁任务。,"Currently, ahem… temporarily assigned to environmental cleanup duty.","Hiện tại... khụ, tạm thời thực hiện nhiệm vụ làm sạch môi trường."
lang_multi_text.db,MultiText,BGYDGDSJ_90_7,不好意思，打扰一下……,Excuse me…,"Xin lỗi, làm phiền chút..."
lang_multi_text.db,MultiText,BGYDGDSJ_90_8,教官好，同学们好。,"Hello, Instructor. Hello everyone.","Chào giáo quan, chào các bạn học."
lang_multi_text.db,MultiText,BGYDGDSJ_90_9,嗯？礼节得体，态度良好。,Hm? Proper manners. Good attitude.,"Hả? Lễ tiết đúng mực, thái độ tốt."
lang_multi_text.db,MultiText,BGYDGDSJ_95_1,我站得还挺直的，不过表情还是不够严肃。,"My posture's good, but… my expression still isn't serious enough.","Tư thế đứng của tôi cũng thẳng đấy chứ, nhưng biểu cảm vẫn chưa đủ nghiêm túc."
lang_multi_text.db,MultiText,BGYDGDSJ_95_10,好啊，说定了就不许反悔~,Deal! No take-backsies!,"Được thôi, đã chốt rồi thì không được nuốt lời đâu nhé~"
lang_multi_text.db,MultiText,BGYDGDSJ_95_11,协议已确认，数据将归档至长期记忆库。,Agreement confirmed. Data saved to long-term memory.,"Thỏa thuận đã xác nhận, dữ liệu sẽ được lưu trữ vào bộ nhớ dài hạn."
lang_multi_text.db,MultiText,BGYDGDSJ_95_12,第五届「寻光集」，「次世代战斗操作接口」将以更高标准执行拍摄任务，时刻校准各位学员的站姿与精神面貌！,"For the fifth Light Chaser Collection, the Battle Interface for Next-Gen Operations will perform the photography mission at elevated standards, correcting each cadet's posture and spirit at any moment!","Trong sự kiện ""Tìm Ánh Sáng"" lần thứ 5, ""Giao Diện Tác Chiến Thế Hệ Mới"" sẽ thực hiện nhiệm vụ chụp ảnh với tiêu chuẩn cao hơn, luôn chỉnh đốn tư thế đứng và tinh thần của các học viên!"
lang_multi_text.db,MultiText,BGYDGDSJ_95_2,哈哈，要是你的笑容再收一收，咱俩看上去就真跟罚站差不多了。,"Haha! If you stopped grinning, we'd look like we're standing here as punishment.","Haha, nếu nụ cười của cậu mà tắt đi, thì hai ta trông chẳng khác nào đang bị phạt đứng cả."
lang_multi_text.db,MultiText,BGYDGDSJ_95_3,说起来，教官倒是一如既往地气势十足啊。,"But the Instructor though, looks ready for war as usual.","Nhắc mới nhớ, Giáo Quan vẫn khí thế ngời ngời như mọi khi nhỉ."
lang_multi_text.db,MultiText,BGYDGDSJ_95_4,当然！,Naturally!,Đương nhiên!
lang_multi_text.db,MultiText,BGYDGDSJ_95_5,作战指令一号：先声夺人，以气势动摇敌方的心理防线。,Combat Command No. 1: Seize the initiative and demoralize the enemy with superior aura!,"Chỉ thị tác chiến số 1: Phủ đầu đối phương, dùng khí thế làm lung lay phòng tuyến tâm lý của kẻ địch."
lang_multi_text.db,MultiText,BGYDGDSJ_95_6,顺带一提……照片里我左侧肩部金属反光强度超出理想值，下次请注意打光角度。,And I have a note… the metallic glare on my left shoulder exceeded optimal reflectance in the photo. Adjust your lighting angle next time.,"Nhân tiện... cường độ phản xạ kim loại ở vai trái tôi trong ảnh vượt quá mức lý tưởng, lần sau vui lòng chú ý góc chiếu sáng."
lang_multi_text.db,MultiText,BGYDGDSJ_95_7,咦？这么说下一届的「寻光集」活动，教官也要参加吗？,"Huh? Does that mean you're planning to join the next Light Chaser Collection too, Instructor?","Hả? Nói vậy là sự kiện ""Tìm Ánh Sáng"" lần sau, Giáo Quan cũng sẽ tham gia sao?"
lang_multi_text.db,MultiText,BGYDGDSJ_95_8,优秀学员的成长记录，理应定期留档。,The growth records of exemplary cadets must be archived regularly.,"Hồ sơ trưởng thành của học viên ưu tú, cần được lưu trữ định kỳ."
lang_multi_text.db,MultiText,BGYDGDSJ_95_9,那不如明年的「寻光集」，我们再在一起拍照好了！,"Then it's settled! Next year's Light Chaser Collection, let's take another group picture together!","Vậy hay là ""Tìm Ánh Sáng"" năm sau, chúng ta lại chụp ảnh cùng nhau nhé!"
lang_multi_text.db,MultiText,BVBHD_100_1,科学研究表明：当存款超过1000万贝币，人的幸福感会显著提升。,Want to level up your happiness? Science says happiness skyrockets when your savings hit ten million Shell Credits.,"Nghiên cứu khoa học chỉ ra: Khi tiền tiết kiệm vượt quá 10 triệu tín dụng, cảm giác hạnh phúc của con người sẽ tăng lên đáng kể."
lang_multi_text.db,MultiText,BVBHD_100_2,但是，没有钱要如何提升幸福感呢？,But what if your fortune's not quite there?,"Nhưng, nếu không có tiền thì làm sao nâng cao cảm giác hạnh phúc đây?"
lang_multi_text.db,MultiText,BVBHD_100_3,<b>可以来玩荣耀之丘！海量声骸随心配，万种策略由你定，你，就是最强决斗家！</b>,<b>Come play Peaks of Prestige! Countless Echoes. Limitless tactics. You could be the next Apex Duestlist!</b>,"<b>Có thể đến chơi Đồi Vinh Quang! Vô vàn Thanh Hài tùy ý phối hợp, vạn loại chiến lược do bạn quyết định, bạn chính là đấu thủ mạnh nhất!</b>"
lang_multi_text.db,MultiText,BVBHD_101_1,啊，您总算来了，{PlayerName}！,"Ah, you're finally here, {PlayerName}!","A, cuối cùng bạn cũng đến rồi, {PlayerName}!"
lang_multi_text.db,MultiText,BVBHD_101_10,唔，没关系，您可是被我所认可的决斗家。我相信，他们是不可能击败您的。,"Hmm, but I think they won't be a problem for you. After all, you won my recognition. They're no match for you.","Ưm, không sao đâu, bạn là đấu thủ được tôi công nhận mà. Tôi tin rằng bọn họ không thể nào đánh bại bạn được."
lang_multi_text.db,MultiText,BVBHD_101_11,那倒是没有。这么奇怪的人要是进了七丘，想必您早就听说了。,"Well, no. If someone of that bizarre description made it to Septimont, you'd have heard about it already.",Cái đó thì không có. Người kỳ lạ như vậy nếu vào Thất Khâu thì chắc chắn bạn đã nghe nói từ lâu rồi.
lang_multi_text.db,MultiText,BVBHD_101_12,总而言之，如果想要捍卫“巅峰决斗家”的称号的话，您必须击败他们才行。,"In short, if you want to defend your title as Apex Duelist, you'll have to defeat all four of them.","Tóm lại, nếu muốn bảo vệ danh hiệu ""Đấu Thủ Đỉnh Cao"", bạn bắt buộc phải đánh bại họ."
lang_multi_text.db,MultiText,BVBHD_101_13,我已经把他们的大致位置发到您的终端上了。,I've already sent their coordinates to your Terminal.,Tôi đã gửi vị trí đại khái của họ vào thiết bị đầu cuối của bạn rồi.
lang_multi_text.db,MultiText,BVBHD_101_14,我有个小小的建议，在他们找到您之前先下手为强——这样除了占据主动之外，也会有更强的话题性。,"A word of advice: strike first, before they come for you. It gives you the advantage and makes for better publicity.","Tôi có một đề nghị nho nhỏ, hãy ra tay trước khi họ tìm thấy bạn... Như vậy ngoài việc chiếm thế chủ động, còn tạo ra tính đề tài mạnh mẽ hơn."
lang_multi_text.db,MultiText,BVBHD_101_15,攻其不备，好主意。,A surprise attack... Good idea.,"Đánh úp bất ngờ, ý kiến hay."
lang_multi_text.db,MultiText,BVBHD_101_16,最后这句话才是重点吧……,"Emphasis on ""For better publicity,"" right?",Câu cuối mới là trọng điểm phải không...
lang_multi_text.db,MultiText,BVBHD_101_17,没错，尽情展示您作为决斗家的实力吧，如雷霆般迅捷，如落日般无情！,"That's right! Show the world your might! Faster than lightning, and fiercer than the sun!","Chính xác, hãy thỏa sức thể hiện thực lực đấu thủ của bạn đi, nhanh như sấm sét, vô tình như mặt trời lặn!"
lang_multi_text.db,MultiText,BVBHD_101_18,哈哈哈，这也被您看出来了吗？,"Hahaha, you see right through me!","Hahaha, cái này cũng bị bạn nhìn thấu rồi sao?"
lang_multi_text.db,MultiText,BVBHD_101_19,哦，差点忘了说，为了节目效果着想，建议您先击败“暗黑四天王”里的其中三位，再和最强的那位神秘人物决斗。,"Oh, almost forgot. For maximum entertainment, I suggest saving the strongest one among the Dark Four for last. Take down the other three first.","Ồ, suýt quên nói, vì hiệu quả chương trình, tôi đề nghị bạn hãy đánh bại ba người trong ""Tứ Thiên Vương Bóng Tối"" trước, rồi mới quyết đấu với nhân vật bí ẩn mạnh nhất kia."
lang_multi_text.db,MultiText,BVBHD_101_2,出什么事了？,What's going on?,Có chuyện gì xảy ra vậy?
lang_multi_text.db,MultiText,BVBHD_101_20,我明白，“为了节目效果”。,Got it.,"Tôi hiểu rồi, ""vì hiệu quả chương trình""."
