db_file,table_name,id,zh,en,vi
lang_multi_text.db,MultiText,LevelPlay_157900019_QuestScheduleSubTitle_157_14,限时内击败所有敌人完成挑战,Defeat all enemies within the time limit,Đánh bại tất cả kẻ địch trong thời gian giới hạn để hoàn thành thử thách
lang_multi_text.db,MultiText,LevelPlay_157900019_QuestScheduleSubTitle_157_9,保持战斗等级在S以上连续8秒：{挑战1统计} /8,Reach and maintain Battle Rank S or above for 8s: {挑战1统计}/8,Duy trì cấp chiến đấu S trở lên liên tục 8 giây: {挑战1统计}/8
lang_multi_text.db,MultiText,LevelPlay_157900020_ChallengeConditionMainText_157_4,请直视内心的恐惧吧...,You must stare directly into the fear within you...,Hãy đối diện với nỗi sợ hãi trong tâm...
lang_multi_text.db,MultiText,LevelPlay_157900020_ChallengeFailMainText_157_4,挑战失败,Challenge Failed,Thử thách thất bại
lang_multi_text.db,MultiText,LevelPlay_157900020_QuestScheduleMainTitle_157_4,梦境节点 · 风车之主,Dreamscape Node: Lord of the Windmill,Nút Mộng Cảnh . Chúa Tể Cối Xay Gió
lang_multi_text.db,MultiText,LevelPlay_157900020_QuestScheduleSubTitle_157_13,挑战中战斗等级达到SS,Reach Battle Rank SS,Đạt hạng chiến đấu SS trong thử thách
lang_multi_text.db,MultiText,LevelPlay_157900020_QuestScheduleSubTitle_157_14,用逆势回击反击4次浮灵偶的激光：{挑战2统计} /4,Counterattack Chop Chop's laser beam 4 times: {挑战2统计}/4,Dùng Phản Kích Nghịch Thế phản kích laser của Phù Linh Ngẫu 4 lần: {挑战2统计}/4
lang_multi_text.db,MultiText,LevelPlay_157900020_QuestScheduleSubTitle_157_16,限时内击败所有敌人完成挑战,Defeat all enemies within the time limit,Đánh bại tất cả kẻ địch trong thời gian giới hạn để hoàn thành thử thách
lang_multi_text.db,MultiText,LevelPlay_157900020_QuestScheduleSubTitle_157_17,被攻击少于6次：{挑战3统计} /6,Take less than 6 hits: {挑战3统计}/6,Bị tấn công ít hơn 6 lần: {挑战3统计}/6
lang_multi_text.db,MultiText,LevelPlay_157900020_QuestScheduleSubTitle_157_18,被攻击少于6次：6 /6,Take less than 6 hits: 6/6,Bị tấn công ít hơn 6 lần: 6/6
lang_multi_text.db,MultiText,LevelPlay_157900021_ChallengeFailMainText_157_3,挑战失败,Challenge Failed,Thử thách thất bại
lang_multi_text.db,MultiText,LevelPlay_157900021_QuestScheduleMainTitle_157_3,梦境节点 · 职业保安,Dreamscape Node: Professional Guard,Nút Mộng Cảnh . Bảo An Chuyên Nghiệp
lang_multi_text.db,MultiText,LevelPlay_157900021_QuestScheduleSubTitle_157_10,击飞魔术先生的时间达到4秒：{挑战2统计} /4,Launch a Hocus Pocus into the air for a total of 4s: {挑战2统计}/4,Thời gian đánh bay Ngài Ảo Thuật đạt 4 giây: {挑战2统计}/4
lang_multi_text.db,MultiText,LevelPlay_157900021_QuestScheduleSubTitle_157_12,限时内击败所有敌人完成挑战,Defeat all enemies within the time limit,Đánh bại tất cả kẻ địch trong thời gian giới hạn để hoàn thành thử thách
lang_multi_text.db,MultiText,LevelPlay_157900021_QuestScheduleSubTitle_157_13,被巨布偶攻击少于8次：{挑战3统计} /8,Take less than 8 hits from Cuddle Wuddle: {挑战3统计}/8,Bị Cự Bố Ngẫu tấn công ít hơn 8 lần: {挑战3统计}/8
lang_multi_text.db,MultiText,LevelPlay_157900021_QuestScheduleSubTitle_157_14,被巨布偶攻击少于8次：8 /8,Take less than 8 hits from Cuddle Wuddle: 8/8,Bị Cự Bố Ngẫu tấn công ít hơn 8 lần: 8/8
lang_multi_text.db,MultiText,LevelPlay_157900021_QuestScheduleSubTitle_157_9,挑战结束时的战斗等级达到SS,Reach Battle Rank SS when the challenge ends,Đạt hạng chiến đấu SS khi thử thách kết thúc
lang_multi_text.db,MultiText,LevelPlay_157900022_ChallengeFailMainText_157_3,挑战失败,Challenge Failed,Thử thách thất bại
lang_multi_text.db,MultiText,LevelPlay_157900022_QuestScheduleMainTitle_157_3,梦境节点 · 恶孽双瞳,Dreamscape Node: Gaze of the Evil,Nút Mộng Cảnh . Ác Nghiệt Song Đồng
lang_multi_text.db,MultiText,LevelPlay_157900022_QuestScheduleSubTitle_157_11,完成6次闪避反击：{挑战3统计} /6,Perform 6 Dodge Counters: {挑战3统计}/6,Hoàn thành 6 lần Né Tránh Phản Kích: {挑战3统计}/6
lang_multi_text.db,MultiText,LevelPlay_157900022_QuestScheduleSubTitle_157_13,限时内击败所有敌人完成挑战,Defeat all enemies within the time limit,Đánh bại tất cả kẻ địch trong thời gian giới hạn để hoàn thành thử thách
lang_multi_text.db,MultiText,LevelPlay_157900022_QuestScheduleSubTitle_157_14,击败浮灵偶的相隔时间不超过15秒：{挑战2统计} /15,Defeat 2 Chop Chops in a row within 15s: {挑战2统计}/15,Khoảng cách thời gian đánh bại Phù Linh Ngẫu không vượt quá 15 giây: {挑战2统计}/15
lang_multi_text.db,MultiText,LevelPlay_157900022_QuestScheduleSubTitle_157_15,击败浮灵偶的相隔时间不超过15秒：15 /15,Defeat 2 Chop Chops in a row within 15s: {挑战2统计}/15,Khoảng cách thời gian đánh bại Phù Linh Ngẫu không vượt quá 15 giây: 15/15
lang_multi_text.db,MultiText,LevelPlay_157900022_QuestScheduleSubTitle_157_9,保持战斗等级在S以上连续8秒：{挑战1统计} /8,Reach and maintain Battle Rank S or above for 8s: {挑战1统计}/8,Duy trì hạng chiến đấu S trở lên liên tục 8 giây: {挑战1统计}/8
lang_multi_text.db,MultiText,LevelPlay_157900023_ChallengeConditionMainText_157_3,深海的冰冷寒彻人心...,The freezing Deep Sea chills the heart...,Hơi lạnh từ biển sâu thấu tận tâm can...
lang_multi_text.db,MultiText,LevelPlay_157900023_ChallengeFailMainText_157_3,挑战失败,Challenge Failed,Thử thách thất bại
lang_multi_text.db,MultiText,LevelPlay_157900023_QuestScheduleMainTitle_157_3,梦境节点 · 深海礼仪,Dreamscape Node: Code of the Deepsea,Nút Mộng Cảnh . Lễ Nghi Biển Sâu
lang_multi_text.db,MultiText,LevelPlay_157900023_QuestScheduleSubTitle_157_10,击败毒冠贵族相隔时间不超过10秒：{挑战2统计} /10,Defeat 2 Abyssal Patricius in a row within 10s: {挑战2统计}/10,Đánh bại Quý Tộc Độc Quán cách nhau không quá 10 giây: {挑战2统计} /10
lang_multi_text.db,MultiText,LevelPlay_157900023_QuestScheduleSubTitle_157_12,限时内消灭所有敌人完成挑战,Defeat all enemies within the time limit,Tiêu diệt tất cả kẻ địch trong thời gian giới hạn để hoàn thành thử thách
lang_multi_text.db,MultiText,LevelPlay_157900023_QuestScheduleSubTitle_157_13,被冰冻的次数少于2次：{挑战3统计} /2,Be Frozen less than 2 times: {挑战3统计}/2,Số lần bị đóng băng ít hơn 2 lần: {挑战3统计} /2
lang_multi_text.db,MultiText,LevelPlay_157900023_QuestScheduleSubTitle_157_14,被冰冻的次数少于2次：2 /2,Be Frozen less than 2 times: 2 /2,Số lần bị đóng băng ít hơn 2 lần: 2 /2
lang_multi_text.db,MultiText,LevelPlay_157900023_QuestScheduleSubTitle_157_15,击败毒冠贵族相隔时间不超过10秒：10 /10,Defeat 2 Abyssal Patricius in a row within 10s: 10/10,Đánh bại Quý Tộc Độc Quán cách nhau không quá 10 giây: 10 /10
lang_multi_text.db,MultiText,LevelPlay_157900023_QuestScheduleSubTitle_157_9,保持战斗等级在S以上连续6秒：{挑战1统计} /6,Reach and maintain Battle Rank S or above for 6s: {挑战1统计}/6,Duy trì cấp chiến đấu S trở lên liên tục 6 giây: {挑战1统计} /6
lang_multi_text.db,MultiText,LevelPlay_157900024_ChallengeConditionMainText_157_5,守护梦境枢纽至挑战结束,Defend the Dreamscape Nexus throughout the challenge,Bảo vệ Đầu Mối Mộng Cảnh cho đến khi thử thách kết thúc
lang_multi_text.db,MultiText,LevelPlay_157900024_ChallengeConditionSubText_157_5,击杀怪物加速时间流逝,Defeat enemies to accelerate time flow,Hạ gục quái vật để tăng tốc dòng chảy thời gian
lang_multi_text.db,MultiText,LevelPlay_157900024_ChallengeFailMainText_157_4,挑战失败,Challenge Failed,Thử thách thất bại
lang_multi_text.db,MultiText,LevelPlay_157900024_MissionCompleteMainText_157_5,梦境即将再次涌现...,The Dreamscape will soon emerge again...,Mộng cảnh sắp trỗi dậy lần nữa...
lang_multi_text.db,MultiText,LevelPlay_157900024_MissionCompleteMainText_157_6,梦境的深层正在涌动...,The Dreamscape sways from deep within...,Tầng sâu mộng cảnh đang cuộn trào...
lang_multi_text.db,MultiText,LevelPlay_157900024_MissionCompleteMainText_157_7,梦魇即将来袭...,Nightmares are poised to strike...,Ác mộng sắp ập đến...
lang_multi_text.db,MultiText,LevelPlay_157900024_MissionCompleteMainText_157_8,梦境正在修复,The Dreamscape mends itself,Mộng cảnh đang được phục hồi
lang_multi_text.db,MultiText,LevelPlay_157900024_MissionCompleteSubText_157_5,时间加快了流逝...,The flow of time quickens...,Thời gian đang trôi nhanh hơn...
lang_multi_text.db,MultiText,LevelPlay_157900024_MissionCompleteSubText_157_6,时间加快了流逝...,The flow of time quickens...,Thời gian đang trôi nhanh hơn...
lang_multi_text.db,MultiText,LevelPlay_157900024_MissionCompleteSubText_157_7,时间正在快速流逝...,Time passes like an arrow...,Thời gian đang trôi đi nhanh chóng...
lang_multi_text.db,MultiText,LevelPlay_157900024_MissionCompleteSubText_157_8,时间正在走向尽头...,Time marches to an end...,Thời gian đang dần đi đến hồi kết...
lang_multi_text.db,MultiText,LevelPlay_157900024_QuestScheduleMainTitle_157_4,海脊的梦境枢纽完整度：{q_count},Thessaleo Fells Dreamscape Nexus integrity: {q_count},Độ nguyên vẹn Đầu Mối Mộng Cảnh Hải Tích: {q_count}
lang_multi_text.db,MultiText,LevelPlay_157900024_QuestScheduleSubTitle_157_13,梦境枢纽不被摧毁,Save the Dreamscape Nexus from destruction,Đầu Mối Mộng Cảnh không bị phá hủy
lang_multi_text.db,MultiText,LevelPlay_157900024_QuestScheduleSubTitle_157_14,梦境枢纽完整度大于30%,Keep the Dreamscape Nexus Integrity above 30%,Độ nguyên vẹn Đầu Mối Mộng Cảnh lớn hơn 30%
lang_multi_text.db,MultiText,LevelPlay_157900024_QuestScheduleSubTitle_157_15,梦境枢纽完整度大于60%,Keep the Dreamscape Nexus Integrity above 60%,Độ nguyên vẹn Đầu Mối Mộng Cảnh lớn hơn 60%
lang_multi_text.db,MultiText,LevelPlay_157900024_QuestScheduleSubTitle_157_16,守护梦境枢纽完成挑战,Defend the Dreamscape Nexus to complete the challenge,Bảo vệ Đầu Mối Mộng Cảnh để hoàn thành thử thách
lang_multi_text.db,MultiText,LevelPlay_157900025_ChallengeFailMainText_157_2,挑战失败,Challenge Failed,Thử thách thất bại
lang_multi_text.db,MultiText,LevelPlay_157900025_QuestScheduleMainTitle_157_2,梦境节点 · 猩红耦合,Dreamscape Node: Sprawling Scarlet,Nút Mộng Cảnh . Ngẫu Hợp Tinh Hồng
lang_multi_text.db,MultiText,LevelPlay_157900025_QuestScheduleSubTitle_157_10,限时内击败所有敌人完成挑战,Defeat all enemies within the time limit,Đánh Bại tất cả kẻ địch trong thời gian giới hạn để hoàn thành thử thách
lang_multi_text.db,MultiText,LevelPlay_157900025_QuestScheduleSubTitle_157_5,战斗等级达到S的时间多于10秒：{挑战1统计} /10,Reach Battle Rank S for more than 10s: {挑战1统计}/10,Duy trì hạng chiến đấu S hơn 10 giây: {挑战1统计} /10
lang_multi_text.db,MultiText,LevelPlay_157900025_QuestScheduleSubTitle_157_6,完成6次闪避反击 ：{挑战2统计} /6,Perform 6 Dodge Counters: {挑战2统计}/6,Thực hiện 6 lần Né Tránh Phản Kích: {挑战2统计} /6
lang_multi_text.db,MultiText,LevelPlay_157900025_QuestScheduleSubTitle_157_8,最后击败处刑人,Defeat the Fractsidus Executioner last,Đánh Bại Xử Hình Nhân cuối cùng
lang_multi_text.db,MultiText,LevelPlay_157900025_QuestScheduleSubTitle_157_9,最后击败处刑人,Defeat the Fractsidus Executioner last,Đánh Bại Xử Hình Nhân cuối cùng
lang_multi_text.db,MultiText,LevelPlay_157900026_ChallengeConditionMainText_157_3,小心那些动来动去的东西...,Beware of moving objects...,Cẩn thận với những thứ di chuyển xung quanh...
lang_multi_text.db,MultiText,LevelPlay_157900026_ChallengeFailMainText_157_3,挑战失败,Challenge Failed,Thử thách thất bại
lang_multi_text.db,MultiText,LevelPlay_157900026_QuestScheduleMainTitle_157_3,梦境节点 · 活动手偶,Dreamscape Node: Auto Handpuppet,Nút Mộng Cảnh . Rối Tay Hoạt Động
lang_multi_text.db,MultiText,LevelPlay_157900026_QuestScheduleSubTitle_157_10,完成4次成功闪避：{挑战2统计} /4,Perform 4 Dodges: {挑战2统计}/4,Thực hiện 4 lần Né Tránh thành công: {挑战2统计} /4
lang_multi_text.db,MultiText,LevelPlay_157900026_QuestScheduleSubTitle_157_12,限时内击败所有敌人完成挑战,Defeat all enemies within the time limit,Đánh Bại tất cả kẻ địch trong thời gian giới hạn để hoàn thành thử thách
lang_multi_text.db,MultiText,LevelPlay_157900026_QuestScheduleSubTitle_157_13,被浮灵偶抓取的次数少于5次：{挑战3统计} /5,Be grabbed by Chop Chop less than 5 times: {挑战3统计}/5,Bị Phù Linh Ngẫu tóm ít hơn 5 lần: {挑战3统计} /5
lang_multi_text.db,MultiText,LevelPlay_157900026_QuestScheduleSubTitle_157_14,被浮灵偶抓取的次数少于5次：5 /5,Be grabbed by Chop Chop less than 5 times: 5/5,Bị Phù Linh Ngẫu tóm ít hơn 5 lần: 5 /5
lang_multi_text.db,MultiText,LevelPlay_157900026_QuestScheduleSubTitle_157_9,挑战中战斗等级达到S,Reach Battle Rank S,Đạt hạng chiến đấu S trong thử thách
lang_multi_text.db,MultiText,LevelPlay_157900027_ChallengeFailMainText_157_3,挑战失败,Challenge Failed,Thử thách thất bại
lang_multi_text.db,MultiText,LevelPlay_157900027_QuestScheduleMainTitle_157_3,梦境节点 · 布偶游行,Dreamscape Node: Plushies' Parade,Nút Mộng Cảnh . Diễu Hành Bố Ngẫu
lang_multi_text.db,MultiText,LevelPlay_157900027_QuestScheduleSubTitle_157_10,强行解除巨布偶和工头布偶的合体：{挑战2统计} /1,Break Cuddle Wuddle and Diggy Duggy's formation: {挑战2统计}/1,Cưỡng chế tách hợp thể của Cự Bố Ngẫu và Công Đầu Bố Ngẫu: {挑战2统计} /1
lang_multi_text.db,MultiText,LevelPlay_157900027_QuestScheduleSubTitle_157_11,被工头布偶的铲子冲撞命中少于3次：{挑战3统计} /3,Take less than 3 hits from Diggy Duggy's shovel charge: {挑战3统计}/3,Bị xẻng xung kích của Công Đầu Bố Ngẫu trúng ít hơn 3 lần: {挑战3统计} /3
lang_multi_text.db,MultiText,LevelPlay_157900027_QuestScheduleSubTitle_157_12,被工头布偶的铲子冲撞命中少于3次：3 /3,Take less than 3 hits from Diggy Duggy's shovel charge: 3 /3,Bị xẻng xung kích của Công Đầu Bố Ngẫu trúng ít hơn 3 lần: 3 /3
lang_multi_text.db,MultiText,LevelPlay_157900027_QuestScheduleSubTitle_157_13,限时内击败所有敌人完成挑战,Defeat all enemies within the time limit,Đánh Bại tất cả kẻ địch trong thời gian giới hạn để hoàn thành thử thách
lang_multi_text.db,MultiText,LevelPlay_157900027_QuestScheduleSubTitle_157_9,挑战结束时的战斗等级达到S,Reach Battle Rank S when the challenge ends,Đạt hạng chiến đấu S khi thử thách kết thúc
lang_multi_text.db,MultiText,LevelPlay_157900028_ChallengeConditionMainText_157_4,守护梦境枢纽至挑战结束,Defend the Dreamscape Nexus throughout the challenge,Bảo vệ Đầu mối Mộng Cảnh cho đến khi thử thách kết thúc
lang_multi_text.db,MultiText,LevelPlay_157900028_ChallengeConditionSubText_157_4,击杀怪物加速时间流逝,Defeat enemies to accelerate time flow,Hạ gục quái vật để tăng tốc dòng chảy thời gian
lang_multi_text.db,MultiText,LevelPlay_157900028_ChallengeFailMainText_157_3,挑战失败,Challenge Failed,Thử thách thất bại
lang_multi_text.db,MultiText,LevelPlay_157900028_MissionCompleteMainText_157_5,梦境即将再次涌现...,The Dreamscape will soon emerge again...,Mộng cảnh sắp trỗi dậy một lần nữa...
lang_multi_text.db,MultiText,LevelPlay_157900028_MissionCompleteMainText_157_6,梦境的深层正在涌动...,The Dreamscape sways from deep within...,Tầng sâu mộng cảnh đang dậy sóng...
lang_multi_text.db,MultiText,LevelPlay_157900028_MissionCompleteMainText_157_7,梦魇即将来袭...,Nightmares are poised to strike...,Ác mộng sắp ập đến...
lang_multi_text.db,MultiText,LevelPlay_157900028_MissionCompleteMainText_157_8,梦境正在修复,The Dreamscape mends itself,Mộng cảnh đang được phục hồi
lang_multi_text.db,MultiText,LevelPlay_157900028_MissionCompleteSubText_157_5,时间加快了流逝...,The flow of time quickens...,Thời gian đang trôi nhanh hơn...
lang_multi_text.db,MultiText,LevelPlay_157900028_MissionCompleteSubText_157_6,时间加快了流逝...,The flow of time quickens...,Thời gian đang trôi nhanh hơn...
lang_multi_text.db,MultiText,LevelPlay_157900028_MissionCompleteSubText_157_7,时间正在快速流逝...,Time passes like an arrow...,Thời gian đang trôi đi nhanh chóng...
lang_multi_text.db,MultiText,LevelPlay_157900028_MissionCompleteSubText_157_8,时间正在走向尽头...,Time marches to an end...,Thời gian đang dần đi đến hồi kết...
lang_multi_text.db,MultiText,LevelPlay_157900028_QuestScheduleMainTitle_157_3,圣迹的梦境枢纽完整度：{q_count},Hallowed Reach Dreamscape Nexus integrity: {q_count},Độ nguyên vẹn Đầu mối Mộng Cảnh Thánh Tích: {q_count}
lang_multi_text.db,MultiText,LevelPlay_157900028_QuestScheduleSubTitle_157_10,梦境枢纽完整度大于30%,Keep the Dreamscape Nexus Integrity above 30%,Độ nguyên vẹn Đầu mối Mộng Cảnh lớn hơn 30%
lang_multi_text.db,MultiText,LevelPlay_157900028_QuestScheduleSubTitle_157_11,梦境枢纽完整度大于60%,Keep the Dreamscape Nexus Integrity above 60%,Độ nguyên vẹn Đầu mối Mộng Cảnh lớn hơn 60%
lang_multi_text.db,MultiText,LevelPlay_157900028_QuestScheduleSubTitle_157_12,守护梦境枢纽完成挑战,Defend the Dreamscape Nexus to complete the challenge,Bảo vệ Đầu mối Mộng Cảnh để hoàn thành thử thách
lang_multi_text.db,MultiText,LevelPlay_157900028_QuestScheduleSubTitle_157_9,梦境枢纽不被摧毁,Save the Dreamscape Nexus from destruction,Đầu mối Mộng Cảnh không bị phá hủy
lang_multi_text.db,MultiText,LevelPlay_157900029_ChallengeFailMainText_157_3,挑战失败,Challenge Failed,Thử thách thất bại
lang_multi_text.db,MultiText,LevelPlay_157900029_QuestScheduleMainTitle_157_3,梦境节点 · 破碎刀伶之心,Dreamscape Node: Shattered Heart,Nút Mộng Cảnh . Trái Tim Đao Linh Vỡ Nát
lang_multi_text.db,MultiText,LevelPlay_157900029_QuestScheduleSubTitle_157_10,用逆势回击击碎全部琉璃刀伶的武器：{挑战2统计} /2,Break all Vitreum Dancers' weapons with Counterattack: {挑战2统计}/2,Dùng Phản Kích để phá hủy vũ khí của tất cả Lưu Ly Đao Linh: {挑战2统计} /2
lang_multi_text.db,MultiText,LevelPlay_157900029_QuestScheduleSubTitle_157_11,用共鸣解放伤害击败1个敌人：{ScoreKill02} /1,Defeat 1 enemies with Resonance Liberation DMG: {ScoreKill02} /1,Dùng sát thương Giải Phóng Cộng Hưởng đánh bại 1 kẻ địch: {ScoreKill02} /1
lang_multi_text.db,MultiText,LevelPlay_157900029_QuestScheduleSubTitle_157_12,限时内击败所有敌人完成挑战,Defeat all enemies within the time limit,Đánh bại tất cả kẻ địch trong thời gian giới hạn để hoàn thành thử thách
lang_multi_text.db,MultiText,LevelPlay_157900029_QuestScheduleSubTitle_157_9,战斗等级达到S的时间多于8秒：{挑战1统计} /8,Reach Battle Rank S for more than 8s: {挑战1统计}/8,Thời gian đạt hạng chiến đấu S nhiều hơn 8 giây: {挑战1统计} /8
lang_multi_text.db,MultiText,LevelPlay_157900031_ChallengeFailMainText_157_4,挑战失败,Challenge Failed,Thử thách thất bại
lang_multi_text.db,MultiText,LevelPlay_157900031_QuestScheduleMainTitle_157_4,梦境节点 · 友谊地久天长,Dreamscape Node: Forever Friends,Nút Mộng Cảnh . Tình Bạn Vĩnh Cửu
lang_multi_text.db,MultiText,LevelPlay_157900031_QuestScheduleSubTitle_157_13,保持战斗等级在S以上连续6秒：{挑战1统计} /6,Reach and maintain Battle Rank S or above for 6s: {挑战1统计}/6,Duy trì cấp chiến đấu S trở lên liên tục 6 giây: {挑战1统计} /6
lang_multi_text.db,MultiText,LevelPlay_157900031_QuestScheduleSubTitle_157_14,使用4次变奏技能：{挑战2统计} /4,Use Intro Skill 4 times: {挑战2统计}/4,Sử dụng 4 lần kỹ năng Biến Tấu: {挑战2统计} /4
lang_multi_text.db,MultiText,LevelPlay_157900031_QuestScheduleSubTitle_157_15,被攻击少于10次：{挑战3统计} /10,Take less than 10 hits: {挑战3统计}/10,Bị tấn công ít hơn 10 lần: {挑战3统计} /10
lang_multi_text.db,MultiText,LevelPlay_157900031_QuestScheduleSubTitle_157_16,被攻击少于10次：10 /10,Take less than 10 hits: 10 /10,Bị tấn công ít hơn 10 lần: 10 /10
lang_multi_text.db,MultiText,LevelPlay_157900031_QuestScheduleSubTitle_157_17,限时内击败所有敌人完成挑战,Defeat all enemies within the time limit,Đánh bại tất cả kẻ địch trong thời gian giới hạn để hoàn thành thử thách
