db_file,table_name,id,zh,en,vi
lang_multi_text.db,MultiText,Side_HZBJT_1_13,只是“爱好”而已。,I'm only an amateur.,"Chỉ là ""sở thích"" thôi."
lang_multi_text.db,MultiText,Side_HZBJT_1_14,我可是专业人士。,I'm actually a professional.,Tôi là dân chuyên nghiệp đấy.
lang_multi_text.db,MultiText,Side_HZBJT_1_15,哈，果然，漂泊者和传说中一样谦虚。,Ha! You're just as modest as they say you are.,"Ha, quả nhiên, Lữ Khách khiêm tốn đúng như lời đồn."
lang_multi_text.db,MultiText,Side_HZBJT_1_16,哈，听起来就很可靠。,Ha! That is reassuring.,"Ha, nghe có vẻ đáng tin lắm đây."
lang_multi_text.db,MultiText,Side_HZBJT_1_17,那么，如果漂泊者你恰好有空……能不能帮我拍几张照片？几张就够了。,"In that case, if you have time... Could you take a few photos for me? Just three, four shots.","Vậy thì, nếu Lữ Khách tình cờ rảnh... có thể giúp tôi chụp vài tấm ảnh được không? Chỉ vài tấm thôi là đủ rồi."
lang_multi_text.db,MultiText,Side_HZBJT_1_18,没问题。,No problem.,Không vấn đề gì.
lang_multi_text.db,MultiText,Side_HZBJT_1_19,谢谢，真是帮了我的大忙了，漂泊者！,Thank you! You'll be doing me a great service.,"Cảm ơn, thật sự giúp tôi rất nhiều, Lữ Khách!"
lang_multi_text.db,MultiText,Side_HZBJT_1_2,你认识我？,You know of me?,Bạn biết tôi à?
lang_multi_text.db,MultiText,Side_HZBJT_1_20,哦，对了，让我和你一起去吧，我也得到处逛逛，说不定能找到意料之外的灵感。,"Oh, right, mind if I accompany you? I could use a bit of a wander myself, you know, just in case a bolt of inspiration decides to pay me a visit!","Ồ, đúng rồi, để tôi đi cùng bạn nhé. Tôi cũng cần đi dạo quanh đây, biết đâu lại tìm được nguồn cảm hứng bất ngờ."
lang_multi_text.db,MultiText,Side_HZBJT_1_3,你是……？,And you are... ?,Bạn là...?
lang_multi_text.db,MultiText,Side_HZBJT_1_4,自我介绍一下，我叫寻景，是《潮汐地理》杂志的编辑。,"Let me introduce myself. I'm Xunjing, an editor for Wutherium Geographic.","Để tôi tự giới thiệu, tôi tên Tầm Cảnh, là biên tập viên của tạp chí ""Triều Tịch Địa Lý""."
lang_multi_text.db,MultiText,Side_HZBJT_1_5,我听先行公约的同行提过你，你可是解决了今州和虹镇危机的英雄，如果我做的不是地理杂志，真想单独给你做一期采访……,"Word travels fast at the Pioneer Association. I heard you're the hero of Jinzhou and Hongzhen. If I wasn't working for a geography magazine, I'd snatch the chance to feature you in a heartbeat...","Tôi nghe đồng nghiệp ở Hiệp Ước Tiên Phong nhắc đến bạn, bạn là anh hùng đã giải quyết cuộc khủng hoảng ở Kim Châu và Hồng Trấn. Nếu tôi không làm tạp chí địa lý, thật sự muốn dành riêng một số để phỏng vấn bạn..."
lang_multi_text.db,MultiText,Side_HZBJT_1_6,哈哈……抱歉，我职业病犯了。咳，总之，我遇到了一个有关我职业生涯的危机。,"Haha... Sorry, occupational habit. Ahem, speaking of which, I'm in the middle of a career crisis.","Haha... Xin lỗi, bệnh nghề nghiệp lại tái phát rồi. Khụ, tóm lại, tôi đang gặp phải một cuộc khủng hoảng liên quan đến sự nghiệp."
lang_multi_text.db,MultiText,Side_HZBJT_1_7,什么危机？,What kind of crisis?,Khủng hoảng gì vậy?
lang_multi_text.db,MultiText,Side_HZBJT_1_8,实际上，呃……我们杂志社打算出一期增刊，介绍一下虹镇的人文特色。,"Well, um... our magazine's cooking up something special about Hongzhen's cultural scene.","Thực ra thì, ừm... tòa soạn chúng tôi định ra một số tăng san, giới thiệu về nét văn hóa đặc sắc của Hồng Trấn."
lang_multi_text.db,MultiText,Side_HZBJT_1_9,不巧的是，马上就要到截稿日了，但我们在整理稿件的时候，发现还少几张至关重要的照片……,"Unfortunately, we're staring down the barrel of the deadline, and we're missing a few crucial snaps in our stack...","Không may là, sắp đến hạn nộp bài rồi, nhưng khi chúng tôi sắp xếp bản thảo thì phát hiện vẫn còn thiếu mấy tấm ảnh rất quan trọng..."
lang_multi_text.db,MultiText,Side_HZBJT_2_1,虹镇以灵砂泉著称，我们先去拍一下镇上的温泉吧。,Hongzhen is famous for its Sagaci Springs. Let's go take some photos of the hot springs.,"Hồng Trấn nổi tiếng với suối Linh Sa, chúng ta đi chụp mấy con suối nước nóng trong trấn trước đi."
lang_multi_text.db,MultiText,Side_HZBJT_3_1,我们到了，漂泊者。让我找个好地方——,Here we are! Let's look for the perfect spot...,"Đến nơi rồi, Lữ Khách. Để tôi tìm một chỗ đẹp-"
lang_multi_text.db,MultiText,Side_HZBJT_3_2,——啊，那边有一棵古树。这简直是完美的构图！就拍那棵树吧，漂泊者！,"Oh, look at that ancient tree! Such a picturesque sight! Come, let's capture it!","- A, bên kia có một cây cổ thụ kìa. Bố cục hoàn hảo luôn! Chụp cây đó đi, Lữ Khách!"
lang_multi_text.db,MultiText,Side_HZBJT_4_1,古朴的温泉，配上古老的树……这张照片的主题感很强。,"A quaint hot spring, nestled under the shade of an ancient tree... The setting is perfect!","Suối nước nóng cổ kính, kết hợp với cây cổ thụ... Bức ảnh này rất có chiều sâu chủ đề."
lang_multi_text.db,MultiText,Side_HZBJT_4_2,岁月流转，外界早已沧海桑田。但虹镇依然保持着古老的传统。,"While the world changes around us, Hongzhen's timeless traditions live on.","Năm tháng trôi qua, thế giới bên ngoài đã đổi thay biết bao. Nhưng Hồng Trấn vẫn giữ nguyên những truyền thống xưa cũ."
lang_multi_text.db,MultiText,Side_HZBJT_4_3,人们在祖辈泡过的温泉中沐浴，用净水澄澈心灵。,"Here, people soak in the same springs their ancestors did, washing away their worries with the same clear waters.","Mọi người tắm trong những suối nước nóng mà tổ tiên từng ngâm mình, dùng dòng nước trong lành để gột rửa tâm hồn."
lang_multi_text.db,MultiText,Side_HZBJT_4_4,真的……很有意思。,It is... quite special.,Thật sự... rất thú vị.
lang_multi_text.db,MultiText,Side_HZBJT_4_5,接下来要拍什么呢……对了，我在山门附近看到了对面的山上有些奇特的圆环，就拍它们吧。,"Now, back to business... I spotted some peculiar rings on the mountains across the gate. Let's capture them.","Tiếp theo chụp gì nhỉ... À đúng rồi, gần sơn môn tôi thấy bên ngọn núi đối diện có mấy vòng tròn kỳ lạ, chụp chúng đi."
lang_multi_text.db,MultiText,Side_HZBJT_5_1,……真壮观啊。不知道这些圆环是做什么用的。也许是……虹镇先民的祭祀场所……,Wow... quite the spectacle. I wonder what these massive rings are for. Could they be... ancient ceremonial sites of Hongzhen's forebears?,...Hùng vĩ thật. Không biết mấy vòng tròn này dùng để làm gì. Có lẽ là... nơi tế lễ của cư dân Hồng Trấn thời xưa...
lang_multi_text.db,MultiText,Side_HZBJT_5_2,不……说不定是悲鸣前残留下来的……嗯……巨型对撞机或者行星发动机之类的东西？先拍一张吧，漂泊者。,"No... they might be relics from the Pre-Lament era. Hmm... Perhaps colossal colliders or planetary engines? Anyway, let's snap a picture.","Không... biết đâu là di tích còn sót lại từ trước Bi Minh... Hmm... kiểu máy gia tốc khổng lồ hay động cơ hành tinh gì đó? Chụp một tấm trước đi, Lữ Khách."
lang_multi_text.db,MultiText,Side_HZBJT_6_1,我看看……嗯，拍得不错。说不定可以出一期拿来出一期虹镇探索专栏，名字我都想好了，就叫“山中小镇未解之谜”……,"Let me have a look... Hm, this turned out pretty good. Maybe we'll feature it in an ""Explore Hongzhen"" column. Already got the headline: ""The Mountain Town's Unsolved Riddle.""","Để tôi xem... Ừm, chụp đẹp đấy. Biết đâu có thể ra một kỳ chuyên mục khám phá Hồng Trấn, tên tôi nghĩ sẵn rồi, gọi là ""Bí ẩn chưa lời giải của thị trấn trong núi""..."
lang_multi_text.db,MultiText,Side_HZBJT_6_2,……不过，也许应该把圆环两边的山峰也拍下来。这样才能更好地衬托出它们的庞大和压迫感。,But let's include the peaks flanking the rings in our shot. That'll give a sense of how enormous and awe-inspiring they are.,"...Tuy nhiên, có lẽ nên chụp thêm cả những ngọn núi hai bên vòng tròn nữa. Như vậy mới thể hiện được sự hùng vĩ và áp đảo của chúng."
lang_multi_text.db,MultiText,Side_HZBJT_6_3,附近有合适的地方吗，漂泊者？,See any good spots nearby?,"Gần đây có chỗ nào thích hợp không, Lữ Khách?"
lang_multi_text.db,MultiText,Side_HZBJT_7_1,哦，没错！就是这个角度！从这里一定能拍出很不错的照片！,"Oh, perfect! That's the angle we want! This shot will be a winner.","Ồ, đúng rồi! Chính góc này đây! Từ đây chắc chắn chụp được bức ảnh rất tuyệt!"
lang_multi_text.db,MultiText,Side_HZBJT_7_2,就在这里拍一张吧，漂泊者！,Stand over here to take it!,"Chụp một tấm ở đây đi, Lữ Khách!"
lang_multi_text.db,MultiText,Side_HZBJT_8_1,嗯……这里是不是还能看到整个虹镇？,Hmm... Can we get a panoramic view of the whole of Hongzhen from here?,Ừm... Từ đây có thể nhìn thấy toàn bộ Hồng Trấn không nhỉ?
lang_multi_text.db,MultiText,Side_HZBJT_8_2,对了，再拍一张虹镇的鸟瞰图吧。虹镇专刊还缺少一张封面图，来建立读者对虹镇的整体印象。,"Right! Let's snap an overhead shot of Hongzhen. Our special edition still needs a cover photo, and this will give readers a wonderful perspective of the town.","À đúng rồi, chụp thêm một tấm toàn cảnh Hồng Trấn từ trên cao đi. Chuyên san Hồng Trấn vẫn còn thiếu một ảnh bìa, để tạo ấn tượng tổng thể cho độc giả về Hồng Trấn."
lang_multi_text.db,MultiText,Side_HZBJT_8_3,毕竟对于大多数人来说，虹镇都是一个神秘而与世隔绝的地方。,"Because you know, to most folks, Hongzhen is still an enigmatic, secluded place.","Xét cho cùng, với đa số mọi người, Hồng Trấn vẫn là một nơi bí ẩn và tách biệt với thế giới bên ngoài."
lang_multi_text.db,MultiText,Side_HZBJT_9_1,从这个角度看，虹镇的每一座建筑都一览无遗。古迹商摊点缀其间，人行阡陌，往来穿梭。,"From up here, every part of the town is visible. Ancient relics and market stalls dot the landscape, connected by winding footpaths.","Nhìn từ góc này, mọi công trình trong Hồng Trấn đều hiện ra rõ ràng. Cổ tích và gian hàng điểm xuyết khắp nơi, người qua kẻ lại tấp nập trên những con đường nhỏ."
lang_multi_text.db,MultiText,Side_HZBJT_9_2,真想不到，古书都说虹镇是一座避世的世外桃源，但我觉得……这明明是一座充满活力和烟火气的繁华城镇。,"What's surprising is, despite the ancient lore painting Hongzhen as an isolated paradise, what I see is a vibrant, bustling community.","Thật không ngờ, sách xưa đều nói Hồng Trấn là chốn bồng lai lánh đời, nhưng tôi thấy... đây rõ ràng là một thị trấn sầm uất, tràn đầy sức sống và hơi thở cuộc sống."
lang_multi_text.db,MultiText,Side_JJSDJY_10_1,今日搜寻结果分析中……搜寻失败。,Analyzing today's search results… No matchings found.,Đang phân tích kết quả tìm kiếm hôm nay... Tìm kiếm thất bại.
lang_multi_text.db,MultiText,Side_JJSDJY_10_2,七丘——需要更多英雄！,Septimont. She calls for more heroes!,Septimont - cần thêm nhiều anh hùng hơn nữa!
lang_multi_text.db,MultiText,Side_JJSDJY_11_1,我已经找到英雄了。,I've found the hero I was searching for.,Ta đã tìm thấy anh hùng rồi.
lang_multi_text.db,MultiText,Side_JJSDJY_11_2,七丘，已经有了新的传奇！,A new legend has risen in Septimont!,"Septimont, đã có một huyền thoại mới!"
lang_multi_text.db,MultiText,Side_JJSDJY_12_1,哈德良，你回来了……我就知道你没法抛下七丘！,"Hadrian, oh, you have returned… I knew you would never abandon Septimont!","Hadrian, ngươi đã trở lại... Ta biết mà, ngươi không thể bỏ rơi Septimont!"
lang_multi_text.db,MultiText,Side_JJSDJY_12_2,哈德良，哈德良！哈——,"Hadrian, O' Hadrain! Hadr—","Hadrian, Hadrian! Had..."
lang_multi_text.db,MultiText,Side_JJSDJY_12_3,……检测到系统错误……修复中，请稍候……,…System error detected… Initiating self-repair sequence…,"...Phát hiện lỗi hệ thống... Đang sửa chữa, xin vui lòng chờ..."
lang_multi_text.db,MultiText,Side_JJSDJY_12_4,……修复完成，正在重启系统……重启成功……,…Self-repair complete. Commencing system reboot... Reboot successful…,"...Sửa chữa hoàn tất, đang khởi động lại hệ thống... Khởi động thành công..."
lang_multi_text.db,MultiText,Side_JJSDJY_12_5,咳咳，英雄，让你见笑了……你的剑技太过完美，看得我宕机了一会儿……,"Ahem. Pardon me, Hero. Your swordsmanship was so amazing it overloaded my systems.","Khụ khụ, anh hùng, để ngươi phải chứng kiến cảnh ấy thật xấu hổ... Kiếm thuật của ngươi hoàn mỹ quá, khiến ta treo máy mất một lúc..."
lang_multi_text.db,MultiText,Side_JJSDJY_12_6,这些是我的全部家当，都给你了，英雄！,"This is all of my possessions. They're all yours, Hero!","Đây là toàn bộ gia sản của ta, tặng hết cho ngươi, anh hùng!"
lang_multi_text.db,MultiText,Side_JJSDJY_12_7,虽然我没法再给你什么了，但如果你愿意的话……以后你可以自称为哈德良四世。,"I may have no more gifts to give... but if you'd like, from this day forward, you may bear the name ""Hadrian the Fourth.""","Dù ta không còn gì để tặng ngươi nữa, nhưng nếu ngươi muốn... từ nay ngươi có thể tự xưng là Hadrian Đệ Tứ."
lang_multi_text.db,MultiText,Side_JJSDJY_12_8,再见，英雄！,"Farewell, Hero!","Tạm biệt, anh hùng!"
lang_multi_text.db,MultiText,Side_JJSDJY_1_1,今日搜寻结果分析中……搜寻失败。,Analyzing today's search results… No matchings found.,Đang phân tích kết quả tìm kiếm hôm nay... Tìm kiếm thất bại.
lang_multi_text.db,MultiText,Side_JJSDJY_1_10,年轻的角斗士，你会是能够继承哈德良的剑意、为七丘带来荣耀的英雄吗？,"Young Gladiator. Could you be the chosen one that is to bear his swordsmanship, and bring about glory to Septimont?","Hỡi đấu sĩ trẻ, liệu ngươi có phải là người thừa kế kiếm ý của Hadrian, mang vinh quang về cho Septimont không?"
lang_multi_text.db,MultiText,Side_JJSDJY_1_11,怎样才能继承他的剑意？,How can I inherit his swordsmanship?,Làm sao mới có thể thừa kế kiếm ý của ông ấy?
lang_multi_text.db,MultiText,Side_JJSDJY_1_12,哈德良以身为剑，终生都在精进自己的剑术。,Hadrian was a sharpened blade. He devoted his whole life to perfecting his swordsmanship.,"Hadrian lấy thân làm kiếm, suốt đời không ngừng trau dồi kiếm thuật."
lang_multi_text.db,MultiText,Side_JJSDJY_1_13,要继承他的剑意，成为真正的英雄，首先要将剑技磨练到极致！,"To do so and become the true hero, you must walk the path he once trod. First, you must hone your skill till your sword shines!","Muốn thừa kế kiếm ý của ông ấy, trở thành anh hùng thực sự, trước tiên phải mài giũa kiếm kỹ đến mức tột đỉnh!"
lang_multi_text.db,MultiText,Side_JJSDJY_1_14,你有信心完成剑术挑战，重历哈德良经受过的考验吗？,"Well? Do you have the resolve to accept this challenge, and face the very trials he endured?","Ngươi có tự tin hoàn thành thử thách kiếm thuật, trải qua những thử luyện mà Hadrian từng chịu đựng không?"
lang_multi_text.db,MultiText,Side_JJSDJY_1_15,我可以试试。,I think I can give it a try.,Tôi có thể thử xem.
lang_multi_text.db,MultiText,Side_JJSDJY_1_16,哈德良四世，请战。,"As Hadrian the Fourth, I accept this challenge.","Hadrian Đệ Tứ, xin ứng chiến."
lang_multi_text.db,MultiText,Side_JJSDJY_1_17,敢于拔剑是迈向英雄之途的第一步，我看好你！,To draw your blade is to take the first step toward greatness. I see promise in you!,"Dám rút kiếm là bước đầu tiên trên con đường trở thành anh hùng, ta rất kỳ vọng vào ngươi!"
lang_multi_text.db,MultiText,Side_JJSDJY_1_18,有胆量！敢于拔剑是迈向英雄之途的第一步，我看好你！,That's the spirit! To draw your blade is to take the first step toward greatness. I see promise in you!,"Thật can đảm! Dám rút kiếm là bước đầu tiên trên con đường trở thành anh hùng, ta rất kỳ vọng vào ngươi!"
lang_multi_text.db,MultiText,Side_JJSDJY_1_19,角斗士，挥剑吧！,"Come, Gladiator. Draw!","Đấu sĩ, hãy vung kiếm lên!"
lang_multi_text.db,MultiText,Side_JJSDJY_1_2,你在做什么？,What are you doing?,Ngươi đang làm gì vậy?
lang_multi_text.db,MultiText,Side_JJSDJY_1_20,开启剑技试炼。,Start the swordsmanship trial.,Bắt đầu thử luyện kiếm thuật.
lang_multi_text.db,MultiText,Side_JJSDJY_1_3,正在进行对象分析……与预设条件吻合。,Running subject analysis… Confirmed match with preset.,Đang tiến hành phân tích đối tượng... Trùng khớp với điều kiện đã thiết lập.
lang_multi_text.db,MultiText,Side_JJSDJY_1_4,！！！,!!!,!!!
lang_multi_text.db,MultiText,Side_JJSDJY_1_5,我是哈德良三世，正在为七丘寻找真正的英雄。七丘——需要更多英雄！,I am Hadrian the Third. I'm in search of a true hero for Septimont. Septimont. She calls for more heroes!,"Ta là Hadrian Đệ Tam, đang tìm kiếm anh hùng thực sự cho Septimont. Septimont - cần thêm nhiều anh hùng hơn nữa!"
lang_multi_text.db,MultiText,Side_JJSDJY_1_6,哈德良三世？,Hadrian the Third?,Hadrian Đệ Tam?
lang_multi_text.db,MultiText,Side_JJSDJY_1_7,真正的英雄？,A true hero?,Anh hùng thực sự?
lang_multi_text.db,MultiText,Side_JJSDJY_1_8,传奇角斗士哈德良，他是七丘的骄傲，是真正的英雄。,"Gladiator Hadrian. He was Septimont's pride, a legend, and a true hero.","Đấu sĩ huyền thoại Hadrian, ông ấy là niềm tự hào của Septimont, là anh hùng thực sự."
lang_multi_text.db,MultiText,Side_JJSDJY_1_9,我是继承了他的觉悟的哈德良三世。但除了他的觉悟，还需要有人继承他的剑意。,"I am Hadrian the Third, and I carry his noble conscience. But we still require someone to inherit his swordsmanship.","Ta là Hadrian Đệ Tam, người thừa kế ý chí của ông ấy. Nhưng ngoài ý chí, vẫn cần có người thừa kế kiếm ý của ông ấy."
lang_multi_text.db,MultiText,Side_JJSDJY_2_1,角斗士，惜败！,"A narrow defeat, Gladiator!","Giác đấu sĩ, tiếc là thua sát nút!"
lang_multi_text.db,MultiText,Side_JJSDJY_2_2,我能看出你对英雄的渴望，但想成为传说绝非一朝一夕之事。,"I see the fire in your heart. But remember, legends are not born from a single battle.","Ta thấy được khát khao trở thành anh hùng trong ngươi, nhưng muốn trở thành huyền thoại không phải chuyện một sớm một chiều."
lang_multi_text.db,MultiText,Side_JJSDJY_2_3,坚持是英雄的美德。不要放弃，角斗士！,"Perseverance is a hero's virtue. Do not let up, Gladiator!","Kiên trì là đức tính của anh hùng. Đừng bỏ cuộc, Giác đấu sĩ!"
lang_multi_text.db,MultiText,Side_JJSDJY_3_1,要继续精进自己的剑技吗？,Ready to push your skills even further?,Muốn tiếp tục rèn luyện kiếm thuật chứ?
lang_multi_text.db,MultiText,Side_JJSDJY_3_2,开启剑技试炼。,Start the swordsmanship trial.,Bắt đầu thử thách kiếm thuật.
lang_multi_text.db,MultiText,Side_JJSDJY_3_3,我果然没看错你。角斗士，挥剑吧！,"I knew I didn't misjudge you. Come, Gladiator. Draw!","Quả nhiên ta không nhìn nhầm người. Giác đấu sĩ, hãy vung kiếm lên!"
lang_multi_text.db,MultiText,Side_JJSDJY_6_1,剑出如火，剑收如风。角斗士，胜利！,"Your blade struck like fire and sheathed like the wind. This victory is yours, Gladiator!","Kiếm rút như lửa, kiếm thu như gió. Giác đấu sĩ, chiến thắng!"
lang_multi_text.db,MultiText,Side_JJSDJY_6_2,说不定，我真是在与一位成长中的传奇同行……,"Perhaps, I truly am walking beside a legend in the making.","Biết đâu, ta thực sự đang đồng hành cùng một huyền thoại đang lớn dậy..."
lang_multi_text.db,MultiText,Side_JJSDJY_6_3,这是属于你的奖励，年轻的角斗士，或者说，未来的传奇！,"This reward is yours, young Gladiator, or should I say... Future Legend of Septimont.","Đây là phần thưởng xứng đáng của ngươi, Giác đấu sĩ trẻ tuổi, hay nên nói... huyền thoại tương lai!"
lang_multi_text.db,MultiText,Side_JJSDJY_8_1,这就是英雄的瞬斩！角斗士，大获全胜！,The very essence of a hero's stroke perfectly demonstrated! A flawless victory!,"Đây chính là nhát chém của anh hùng! Giác đấu sĩ, toàn thắng!"
lang_multi_text.db,MultiText,Side_JJSDJY_8_2,我没有亲眼见证过哈德良的剑术，但在我见证过的角斗士中，你的剑法已经登峰造极。,"I've yet to witness Hadrian's swordsmanship with my own eyes, but among all the Gladiators I've come across, your skill is unparalleled.","Ta chưa từng tận mắt chứng kiến kiếm thuật của Hadrian, nhưng trong số tất cả Giác đấu sĩ ta đã thấy, kiếm pháp của ngươi đã đạt đến đỉnh cao."
lang_multi_text.db,MultiText,Side_JJSDJY_8_3,传说中在最后一次行猎时，暮年的哈德良拖着枯朽的身躯，仍能一人成军。,"They say during his final hunt, even as age weighed heavy on him, Hadrian fought on alone. His withered frame holds the line like a fortress.","Tương truyền trong lần săn cuối cùng, Hadrian tuổi đã xế chiều kéo lê thân xác già nua, vẫn một mình địch vạn người."
lang_multi_text.db,MultiText,Side_JJSDJY_8_4,在背后看你挥剑时，我也感觉像在看着一位传奇人物的背影。,"Watching you wield your blade from behind, it felt as though I was witnessing a legend reborn.","Nhìn ngươi vung kiếm từ phía sau, ta cũng cảm thấy như đang ngắm nhìn bóng lưng của một huyền thoại."
lang_multi_text.db,MultiText,Side_JJSDJY_8_5,这是你应得的，年轻的角斗士……不，你是必将成为传奇的角斗士！,"You earned this, young Gladiator… No, soon to be a legend!","Đây là thứ ngươi xứng đáng được nhận, Giác đấu sĩ trẻ tuổi... không, ngươi là Giác đấu sĩ chắc chắn sẽ trở thành huyền thoại!"
lang_multi_text.db,MultiText,Side_JJSDJY_9_1,哈德良横挥一剑，便可如长城般将残象拒之门外……,"With a single strike, Hadrian could hold back the hordes of Tacet Discord as though a steel wall...","Hadrian chỉ cần vung một nhát kiếm, đã có thể như bức trường thành ngăn chặn Tàn Tượng bên ngoài..."
lang_multi_text.db,MultiText,Side_JJSDJY_9_2,啊，是你，英雄！哈德良虽是传奇，但我认为你的剑意也丝毫不会输给他！,"Ah, it's you, hero! Hadrian may be a legend, but you are every bit the warrior that he was.","A, là ngươi đấy à, anh hùng! Hadrian tuy là huyền thoại, nhưng ta tin rằng kiếm ý của ngươi cũng không hề thua kém ông ấy!"
lang_multi_text.db,MultiText,Side_JJSDJY_9_3,不过，哈德良曾说过：英雄之路，无止无尽。,But Hadrian once said that the path of a hero has no end.,"Tuy nhiên, Hadrian từng nói: Con đường của anh hùng là không có điểm dừng."
lang_multi_text.db,MultiText,Side_JJSDJY_9_4,年轻的英雄，要继续精进自己的剑技吗？,"So, young hero. Are you ready to push your skills even further?","Anh hùng trẻ tuổi, ngươi muốn tiếp tục trau dồi kiếm thuật chứ?"
lang_multi_text.db,MultiText,Side_JJSDJY_9_5,开启剑技试炼。,Start the swordsmanship trial.,Bắt đầu thử thách kiếm thuật.
lang_multi_text.db,MultiText,Side_JJSDJY_9_6,不用了。,I think I'll pass.,Không cần đâu.
lang_multi_text.db,MultiText,Side_JJSDJY_9_7,英雄，挥剑吧！,"Come, Hero. Draw!","Anh hùng, hãy vung kiếm lên!"
lang_multi_text.db,MultiText,Side_JJSDJY_9_8,那就等你想要尽情挥剑的时候再来找我吧，英雄！,"Very well. Return to me when your heart earns to fight again, Hero!","Vậy thì khi nào ngươi muốn thoải mái vung kiếm, hãy đến tìm ta nhé, anh hùng!"
