db_file,table_name,id,zh,en,vi
lang_multi_text.db,MultiText,TowerDefence_400050_PhantomDesc,"使用声骸技能，幻形为无归的谬误，对前方连续锤击，总计造成{0}的<color=#ffd12f>衍射伤害</color>。
该技能造成伤害时，附近队伍中所有角色减少{1}的共鸣技能冷却时间，并获得{2}共鸣技能伤害加成，上限{3}层，持续{4}秒。重复触发刷新持续时间。
技能冷却：{5}秒","Transform into Fallacy of No Return and perform consecutive strikes forward, dealing a total of {0} <color=#ffd12f>Spectro DMG</color>.
Dealing DMG to enemies with this Echo Skill reduces Resonance Skill Cooldown by {1} for all nearby Resonators in the team and grants {2} Resonance Skill DMG Bonus for {4}s, stacking up to {3} times. Retriggering the effect resets its duration.
CD: {5}s","Sử dụng Kỹ Năng Thanh Hài, biến hình thành Vô Quy Sai Lầm, liên tục đập búa về phía trước, tổng cộng gây {0} <color=#ffd12f>sát thương Quang Phổ</color>.
Khi kỹ năng này gây sát thương, tất cả nhân vật trong đội ở gần được giảm {1} thời gian hồi Kỹ Năng Cộng Hưởng và nhận thêm {2} bonus sát thương Kỹ Năng Cộng Hưởng, tối đa {3} tầng, kéo dài {4} giây. Kích hoạt lại sẽ làm mới thời gian.
Hồi chiêu: {5} giây"
lang_multi_text.db,MultiText,TowerDefence_400050_PhantomTitle,破门的利斧,Door-smashing Axe,Rìu Phá Cửa
lang_multi_text.db,MultiText,TowerDefence_400060_PhantomDesc,"使用声骸技能，召唤魔术先生，释放3次强化乐章。每次使附近队伍中所有角色获得{0}点<color=#ffd12f>共鸣能量</color>与{1}共鸣解放伤害加成，持续{2}秒。并减少{3}的共鸣解放冷却时间。
技能冷却：{4}秒","Summon a Hocus Pocus to release Augmented Note 3 times. Each time, all nearby Resonators in the team gain {0} <color=#ffd12f>Resonance Energy</color> and {1} Resonance Liberation DMG Bonus for {2}s, and have their Resonance Liberation Cooldown reduced by {3}.
CD: {4}s","Sử dụng Kỹ Năng Thanh Hài, triệu hồi Ngài Ảo Thuật, phóng ra 3 lần nhạc chương tăng cường. Mỗi lần, tất cả nhân vật trong đội ở gần nhận được {0} <color=#ffd12f>Năng Lượng Cộng Hưởng</color> và {1} bonus sát thương Giải Phóng Cộng Hưởng, kéo dài {2} giây. Đồng thời giảm {3} thời gian hồi Giải Phóng Cộng Hưởng.
Hồi chiêu: {4} giây"
lang_multi_text.db,MultiText,TowerDefence_400060_PhantomTitle,眨眼的玩偶,Winking Doll,Búp Bê Nháy Mắt
lang_multi_text.db,MultiText,TowerDefence_400070_PhantomDesc,"使用声骸技能，召唤幽翎火攻击，造成{0}的<color=#ffd12f>湮灭伤害</color>，并附加{1}层<color=#ffd12f>[恐慌]</color>。若目标<color=#ffd12f>[恐慌]</color>层数不小于70层，则本次攻击改为附加30层<color=#ffd12f>[恐慌]</color>。
目标后续受到伤害时，获得{2}层<color=#ffd12f>[恐慌]</color>，每1秒最多触发1次。
<color=#ffd12f>[恐慌]</color>达到100层后，对目标造成最大共振值100.00%的共振值伤害，使目标陷入瘫痪，期间目标受到伤害必定暴击，全属性伤害抗性降低{3}。触发效果后，移除<color=#ffd12f>[恐慌]</color>。
目标瘫痪期间无法获得<color=#ffd12f>[恐慌]</color>。
技能冷却：{4}秒","Summon a Fae Ignis to attack, dealing {0} <color=#ffd12f>Havoc DMG</color> and inflicting <SapTag=1>{1}</SapTag> {Cus:Sap,S=stack P=stacks SapTag=1} of <color=#ffd12f>Panic</color> on the target. If the target has 70 or more stacks of <color=#ffd12f>Panic</color>, the attack deals the same DMG but inflicts 30 stacks of <color=#ffd12f>Panic</color> instead.
When targets with Panic take DMG, they receive <SapTag=2>{2}</SapTag> {Cus:Sap,S=stack P=stacks SapTag=2} of <color=#ffd12f>Panic</color>. This effect is triggered once every second.
When the target receives 100 stacks of <color=#ffd12f>Panic</color>, deal Vibration Strength DMG equal to 100.00% of the Max Vibration Strength and Immobilize the target. All Attribute DMG taken by the target under this effect is guaranteed to be Crit. DMG, and their DMG RES is reduced by {3}. Triggering this effect removes all stacks of <color=#ffd12f>Panic</color>.
The target will not gain new stacks of <color=#ffd12f>Panic</color> when Immobilized.
CD: {4}s","Sử dụng Kỹ Năng Thanh Hài, triệu hồi U Linh Hỏa tấn công, gây {0} <color=#ffd12f>sát thương Hủy Diệt</color> và áp dụng {1} tầng <color=#ffd12f>[Hoảng Loạn]</color>. Nếu mục tiêu có từ 70 tầng <color=#ffd12f>[Hoảng Loạn]</color> trở lên, đòn tấn công này sẽ áp dụng 30 tầng <color=#ffd12f>[Hoảng Loạn]</color> thay thế.
Khi mục tiêu nhận sát thương, nhận thêm {2} tầng <color=#ffd12f>[Hoảng Loạn]</color>, tối đa kích hoạt 1 lần mỗi giây.
Khi <color=#ffd12f>[Hoảng Loạn]</color> đạt 100 tầng, gây sát thương cộng chấn bằng 100.00% giá trị cộng chấn tối đa lên mục tiêu, khiến mục tiêu rơi vào trạng thái tê liệt. Trong thời gian này, sát thương lên mục tiêu chắc chắn bạo kích, kháng sát thương toàn thuộc tính giảm {3}. Sau khi kích hoạt, xóa toàn bộ <color=#ffd12f>[Hoảng Loạn]</color>.
Mục tiêu trong trạng thái tê liệt không thể nhận thêm <color=#ffd12f>[Hoảng Loạn]</color>.
Hồi chiêu: {4} giây"
lang_multi_text.db,MultiText,TowerDefence_400070_PhantomTitle,漂浮的气球,Floating Balloon,Bóng Bay Lơ Lửng
lang_multi_text.db,MultiText,TowerDefence_400080_PhantomDesc,"使用声骸技能，幻形为浮灵偶，持续{0}秒。每次造成{1}<color=#ffd12f>热熔伤害</color>。该技能造成伤害时，刷新幻形持续时间，最多可持续{2}秒，并为目标附加{3}层<color=#ffd12f>[恐慌]</color>，对同一目标每秒最多触发1次。角色不在场时，不会刷新持续时间。
<color=#ffd12f>[恐慌]</color>达到100层后，对目标造成最大共振值100.00%的共振值伤害，使目标陷入瘫痪，期间目标受到伤害必定暴击，全属性伤害抗性降低{4}。触发效果后，移除<color=#ffd12f>[恐慌]</color>。
目标瘫痪期间无法获得<color=#ffd12f>[恐慌]</color>。
技能冷却：{5}秒","Transform into Chop Chop for {0}s, dealing {1} <color=#ffd12f>Fusion DMG</color>. Dealing DMG to enemies resets the duration of Echo Transformation, with a maximum of {2}s, and inflicts <SapTag=3>{3}</SapTag> {Cus:Sap,S=stack P=stacks SapTag=3} of <color=#ffd12f>Panic</color> on the target. This effect can be triggered once per second on each target. The Echo Transformation duration will not be reset when the Resonator is not on the field.
When the target receives 100 stacks of <color=#ffd12f>Panic</color>, deplete the target's Vibration Strength by 100.00% of the Max Vibration Strength and Immobilize the target. The DMG taken by the target when Immobilized is guaranteed to be Crit. DMG, and their DMG RES for all Attributes is reduced by {4}. Triggering this effect removes all stacks of <color=#ffd12f>Panic</color>.
The target will not gain new stacks of <color=#ffd12f>Panic</color> when Immobilized.
CD: {5}s","Sử dụng Kỹ Năng Thanh Hài, biến hình thành Phù Linh Ngẫu, kéo dài {0} giây. Mỗi lần gây {1} <color=#ffd12f>sát thương Hỏa Liệt</color>. Khi kỹ năng này gây sát thương, làm mới thời gian biến hình, tối đa kéo dài {2} giây, đồng thời áp dụng {3} tầng <color=#ffd12f>[Hoảng Loạn]</color> lên mục tiêu, tối đa kích hoạt 1 lần mỗi giây trên cùng một mục tiêu. Khi nhân vật không ở trên sân, thời gian sẽ không được làm mới.
Khi <color=#ffd12f>[Hoảng Loạn]</color> đạt 100 tầng, gây sát thương cộng chấn bằng 100.00% giá trị cộng chấn tối đa lên mục tiêu, khiến mục tiêu rơi vào trạng thái tê liệt. Trong thời gian này, sát thương lên mục tiêu chắc chắn bạo kích, kháng sát thương toàn thuộc tính giảm {4}. Sau khi kích hoạt, xóa toàn bộ <color=#ffd12f>[Hoảng Loạn]</color>.
Mục tiêu trong trạng thái tê liệt không thể nhận thêm <color=#ffd12f>[Hoảng Loạn]</color>.
Hồi chiêu: {5} giây"
lang_multi_text.db,MultiText,TowerDefence_400080_PhantomTitle,裂开的眼镜,Cracked Glasses,Kính Vỡ
lang_multi_text.db,MultiText,TowerDefence_400090_PhantomDesc,"使用声骸技能，召唤欺诈奇藏。欺诈奇藏不断喷涌金币，附近队伍中的角色拾取金币时<color=#ffd12f>回复</color>自身{0}的生命值与{1}点耐力。并为附近队伍中所有角色附加<color=#ffd12f>[狂热]</color>，持续{2}秒。
拥有<color=#ffd12f>[狂热]</color>时，提升{3}攻击力与{4}移动速度加成。<color=#ffd12f>[狂热]</color>层数大于6时，额外提升{5}攻击力与{6}移动速度加成，对瘫痪目标造成伤害提升{7}。
技能冷却：{8}秒","Summon a Mimic Chest that constantly spits out gold coins. When picked up, the coin <color=#ffd12f>restores</color> {0} HP and {1} Stamina for the Resonator, and applies <color=#ffd12f>Fervor</color> to all nearby Resonators in the team for {2}s.
Obtaining <color=#ffd12f>Fervor</color> increases ATK by {3} and Movement Speed by {4}. Having more than 6 stacks of <color=#ffd12f>Fervor</color> additionally increases ATK by {5}, Movement Speed by {6}, and DMG dealt to Immobilized targets by {7}.
CD: {8}s","Sử dụng Kỹ Năng Thanh Hài, triệu hồi Kỳ Tàng Lừa Đảo. Kỳ Tàng liên tục phun ra đồng vàng, khi nhân vật trong đội ở gần nhặt đồng vàng sẽ <color=#ffd12f>hồi phục</color> {0} sinh lực và {1} điểm thể lực. Đồng thời áp dụng <color=#ffd12f>[Cuồng Nhiệt]</color> cho tất cả nhân vật trong đội ở gần, kéo dài {2} giây.
Khi có <color=#ffd12f>[Cuồng Nhiệt]</color>, tăng {3} tấn công và {4} tốc độ di chuyển. Khi số tầng <color=#ffd12f>[Cuồng Nhiệt]</color> lớn hơn 6, tăng thêm {5} tấn công và {6} tốc độ di chuyển, sát thương lên mục tiêu tê liệt tăng {7}.
Hồi chiêu: {8} giây"
lang_multi_text.db,MultiText,TowerDefence_400090_PhantomTitle,不祥的藏品,Ominous Collection,Bộ Sưu Tập Xui Xẻo
lang_multi_text.db,MultiText,TowerDefence_5,支援型,Assist,Hỗ trợ
lang_multi_text.db,MultiText,TowerDefence_Cantplay,仅限世界所有者可以开始游戏,Only the host can start the game.,Chỉ chủ thế giới mới có thể bắt đầu trò chơi
lang_multi_text.db,MultiText,TowerDefence_GPint,最高分数：{0},Highest Score: {0},Điểm cao nhất: {0}
lang_multi_text.db,MultiText,TowerDefence_Getbt1,领取,Claim,Nhận
lang_multi_text.db,MultiText,TowerDefence_Getbt2,已完成,Completed,Đã hoàn thành
lang_multi_text.db,MultiText,TowerDefence_Getbt3,未达成,Not Completed,Chưa đạt
lang_multi_text.db,MultiText,TowerDefence_LV,<color=#ffd12f>{0}</color>/{1},<color=#ffd12f>{0}</color>/{1},<color=#ffd12f>{0}</color>/{1}
lang_multi_text.db,MultiText,TowerDefence_Lvup,仿制声骸等级提升,Echoid level increased.,Cấp Thanh Hài mô phỏng tăng lên
lang_multi_text.db,MultiText,TowerDefence_PhantasmTips,准备状态不能更换声骸,Cannot change Echoes in the Ready state,Không thể đổi Thanh Hài trong trạng thái chuẩn bị
lang_multi_text.db,MultiText,TowerDefence_PintDesc,活动总积分,Total Points,Tổng điểm sự kiện
lang_multi_text.db,MultiText,TowerDefence_PintOnly,最高分数：{0},Highest Score: {0},Điểm cao nhất: {0}
lang_multi_text.db,MultiText,TowerDefence_PintOnlyMore,积分上限解锁至：{0},Max points limit increased to: {0},Giới hạn điểm mở khóa đến: {0}
lang_multi_text.db,MultiText,TowerDefence_Restart,重新挑战,Restart,Thử lại
lang_multi_text.db,MultiText,TowerDefence_Rolename,联觉等级：{0},Union Level: {0},Cấp Liên Giác: {0}
lang_multi_text.db,MultiText,TowerDefence_Score,活动总积分,Total Points,Tổng điểm sự kiện
lang_multi_text.db,MultiText,TowerDefence_Vison,解锁声骸,Unlocked Echoes,Mở khóa Thanh Hài
lang_multi_text.db,MultiText,TowerDefence_confirm,装配,Equip,Trang bị
lang_multi_text.db,MultiText,TowerDefence_dead0,失去意识,Defeated,Bất tỉnh
lang_multi_text.db,MultiText,TowerDefence_dead1,当前波次结束后自动恢复状态,Status fully refreshed after the current wave.,Tự động hồi phục sau khi đợt hiện tại kết thúc.
lang_multi_text.db,MultiText,TowerDefence_dead2,中途退出将丢失当前进度,You will lose the current progress if you quit partway,Thoát giữa chừng sẽ mất tiến trình hiện tại.
lang_multi_text.db,MultiText,TowerDefence_end,退出,Quit,Thoát
lang_multi_text.db,MultiText,TowerDefence_friendMore,有{0}条好友申请,You have {0} Friend Request(s).,Có {0} lời mời kết bạn
lang_multi_text.db,MultiText,TowerDefence_friendOnly,有好友申请,New Friend Request(s),Có lời mời kết bạn
lang_multi_text.db,MultiText,TowerDefence_lock,未解锁,Locked,Chưa mở khóa
lang_multi_text.db,MultiText,TowerDefenceclear,完成关卡{0},Complete {0},Hoàn thành màn {0}
lang_multi_text.db,MultiText,TowerDefencelose,本次挑战失败,Challenge Failed,Thử thách thất bại
lang_multi_text.db,MultiText,TowerDefencesettlement,已通关高难挑战！,I Beat The Highest Difficulty!,Đã vượt qua thử thách độ khó cao nhất!
lang_multi_text.db,MultiText,TowerDefencewenhao,?,?,?
lang_multi_text.db,MultiText,TowerDefense_Battle_AuxiliaryMax,库洛洛武器携带数量已达上限,Can't equip more KU-Roro's Weapons,Số lượng vũ khí KU-Roro mang theo đã đạt giới hạn
lang_multi_text.db,MultiText,TowerDefense_Battle_AuxiliaryNeed,必须携带至少一个库洛洛武器,At least one KU-Roro's Weapon should be equipped,Phải mang theo ít nhất một vũ khí KU-Roro
lang_multi_text.db,MultiText,TowerDefense_Battle_Coinlimit,拟像贝币不足,Insufficient Sim Credits,Không đủ Bối Tệ Mô Phỏng
lang_multi_text.db,MultiText,TowerDefense_Battle_Equip,装备,Equip,Trang bị
lang_multi_text.db,MultiText,TowerDefense_Battle_Equip_Auxiliary,装备,Equip,Trang bị
lang_multi_text.db,MultiText,TowerDefense_Battle_Groundonly,该装置只能部署在地面上,This machine can only be deployed on the ground,Thiết bị này chỉ có thể triển khai trên mặt đất
lang_multi_text.db,MultiText,TowerDefense_Battle_Numlimit,已达作战装置放置上限,Can't deploy more Combat Machines,Đã đạt giới hạn đặt thiết bị chiến đấu
lang_multi_text.db,MultiText,TowerDefense_Battle_SlotLock,该作战装置无法卸下,This machine cannot be removed,Không thể tháo thiết bị chiến đấu này
lang_multi_text.db,MultiText,TowerDefense_Battle_Toponly,该装置只能部署在天花板上,This machine can only be deployed on the ceiling,Thiết bị này chỉ có thể triển khai trên trần
lang_multi_text.db,MultiText,TowerDefense_Battle_Unload,卸下,Remove,Tháo ra
lang_multi_text.db,MultiText,TowerDefense_Battle_Wallonly,该装置只能部署在墙壁上,This machine can only be deployed on the wall,Thiết bị này chỉ có thể triển khai trên tường
lang_multi_text.db,MultiText,TowerDefense_BranchName_0,基础模块,Basic Module,Module cơ bản
lang_multi_text.db,MultiText,TowerDefense_BranchName_1,可选模块·一,Optional Module I,Module tùy chọn I
lang_multi_text.db,MultiText,TowerDefense_BranchName_2,可选模块·二,Optional Module II,Module tùy chọn II
lang_multi_text.db,MultiText,TowerDefense_BuildingAttr_CD,部署冷却时间,Deployment Cooldown,Thời gian hồi triển khai
lang_multi_text.db,MultiText,TowerDefense_BuildingAttr_Cost,部署消耗,Deployment Cost,Chi phí triển khai
lang_multi_text.db,MultiText,TowerDefense_BuildingAttr_Type,类型,Type,Loại
lang_multi_text.db,MultiText,TowerDefense_BuildingLv_Text,<size=36><color=#e4e4e4ff>等级</color></size><color=#fde7a1ff>{0}</color>,<size=36><color=#e4e4e4ff>Level</color></size> <color=#fde7a1ff>{0}</color>,<size=36><color=#e4e4e4ff>Cấp</color></size><color=#fde7a1ff>{0}</color>
lang_multi_text.db,MultiText,TowerDefense_Building_AllTitle_Text,全部,All,Tất cả
lang_multi_text.db,MultiText,TowerDefense_Building_AuxiliaryTitle_Text,库洛洛武器,KU-Roro's Weapons,Vũ khí KU-Roro
lang_multi_text.db,MultiText,TowerDefense_Building_AuxiliaryTypeDungeon_Text,库洛洛武器（可携带：{0}/{1}）,KU-Roro's Weapons (Equipable: {0}/{1}),Vũ khí KU-Roro (Có thể trang bị: {0}/{1})
lang_multi_text.db,MultiText,TowerDefense_Building_AuxiliaryType_Text,库洛洛武器,KU-Roro's Weapons,Vũ khí KU-Roro
lang_multi_text.db,MultiText,TowerDefense_Building_BdLock_Text,未解锁,Locked,Chưa mở khóa
lang_multi_text.db,MultiText,TowerDefense_Building_BdLv_Text,等级{0},Level {0},Cấp {0}
lang_multi_text.db,MultiText,TowerDefense_Building_BranchSelection_Text,选择可选模块,Select Optional Module,Chọn module tùy chọn
lang_multi_text.db,MultiText,TowerDefense_Building_BuildingTitle_Text,作战装置,Combat Machines,Thiết bị chiến đấu
lang_multi_text.db,MultiText,TowerDefense_Building_CurMax_Text,已达当前最大等级,Level Cap Reached,Đã đạt cấp tối đa hiện tại
lang_multi_text.db,MultiText,TowerDefense_Building_FloorBuildingType_Text,地面,Ground,Mặt đất
lang_multi_text.db,MultiText,TowerDefense_Building_LevelUp,作战装置已升级,Combat Machine Upgraded,Thiết bị chiến đấu đã nâng cấp
lang_multi_text.db,MultiText,TowerDefense_Building_TopBuildingType_Text,天花板,Ceiling,Trần nhà
lang_multi_text.db,MultiText,TowerDefense_Building_WallBuildingType_Text,墙壁,Wall,Tường
lang_multi_text.db,MultiText,TowerDefense_ESC_WaveCountNum_Text,<color=#fee7a1ff>{0}</color>/{1},<color=#fee7a1ff>{0}</color>/{1},<color=#fee7a1ff>{0}</color>/{1}
lang_multi_text.db,MultiText,TowerDefense_Ending_GainBdUp_Text,获得拟像铸块,Sim Ingot Obtained,Nhận được Khối Đúc Nghĩ Tượng
lang_multi_text.db,MultiText,TowerDefense_Ending_GainBuildingShare_Text,携带装置,Machine Equipped,Thiết bị mang theo
lang_multi_text.db,MultiText,TowerDefense_Ending_GainBuilding_Text,解锁作战装置,Combat Machine Unlocked,Mở khóa thiết bị chiến đấu
lang_multi_text.db,MultiText,TowerDefense_Ending_GainSchoolShare_Text,战术集,Tactic Set,Bộ chiến thuật
lang_multi_text.db,MultiText,TowerDefense_Ending_GainSchool_Text,解锁战术集,Tactic Set Unlocked,Mở khóa bộ chiến thuật
lang_multi_text.db,MultiText,TowerDefense_Ending_GainStar_Text,历史最高记录,Highest Record,Kỷ lục cao nhất
lang_multi_text.db,MultiText,TowerDefense_Ending_MainTypeTitle_Text,扼守要地：{0},Pass Guardian: {0},Trấn giữ yếu địa: {0}
lang_multi_text.db,MultiText,TowerDefense_Ending_RougeTypeTitle_Text,孤绝险地：{0},Deathtrap Mode: {0},Tử địa hiểm cảnh: {0}
lang_multi_text.db,MultiText,TowerDefense_EndlesslevelTips_Main6-1,在成功抵御第7波次的残象后，后续波次中将重复出现第7波次的残象,"After successfully surviving the 7th wave of Tacet Discords, the same enemies from Wave 7 will appear in all the following waves.","Sau khi chống đỡ thành công đợt Tàn Tượng thứ 7, các đợt tiếp theo sẽ lặp lại Tàn Tượng của đợt 7."
lang_multi_text.db,MultiText,TowerDefense_EndlesslevelTips_Rouge4,在成功抵御第19波次的残象后，后续波次中将重复出现第15~19波次的残象,"After successfully surviving the 19th wave of Tacet Discords, the same enemies from Wave 15-19 will appear in all the following waves.","Sau khi chống đỡ thành công đợt Tàn Tượng thứ 19, các đợt tiếp theo sẽ lặp lại Tàn Tượng của đợt 15~19."
lang_multi_text.db,MultiText,TowerDefense_FinalBigReward_1,累计获得1000个“残象杀手“奖券。,"Obtain 1,000 ""TD Slayer"" Coupons.","Nhận tổng cộng 1000 vé thưởng ""Sát Thủ Tàn Tượng""."
lang_multi_text.db,MultiText,TowerDefense_HomeHp_Text,矩阵耐久度,Matrix Durability,Độ bền Ma Trận
lang_multi_text.db,MultiText,TowerDefense_Main_BdCostGreen_Text,<color=#e4e4e4ff>{0}</color>/{1},<color=#e4e4e4ff>{0}</color>/{1},<color=#e4e4e4ff>{0}</color>/{1}
lang_multi_text.db,MultiText,TowerDefense_Main_BdCostRed_Text,<color=#e4e4e4ff>{0}</color>/{1},<color=#e4e4e4ff>{0}</color>/{1},<color=#e4e4e4ff>{0}</color>/{1}
lang_multi_text.db,MultiText,TowerDefense_Main_BuildCost,部署所需消耗,Cost,Chi phí triển khai
lang_multi_text.db,MultiText,TowerDefense_Main_BuildTower,部署,Deploy,Triển khai
lang_multi_text.db,MultiText,TowerDefense_Main_DestroyTower,回收,Recall,Thu hồi
lang_multi_text.db,MultiText,TowerDefense_Main_Option,战前准备,Prepare,Chuẩn bị
lang_multi_text.db,MultiText,TowerDefense_Main_Shop,库默尼商行,KU-Money's Shop,Cửa hàng KU-Money
lang_multi_text.db,MultiText,TowerDefense_Main_StartFight,开始模拟,Start,Bắt đầu mô phỏng
lang_multi_text.db,MultiText,TowerDefense_Main_SwitchTower,旋转,Rotate,Xoay
lang_multi_text.db,MultiText,TowerDefense_MainstageDesc_1-1,情景模拟：残象集群试图穿过桥梁，袭击尚未疏散的平民。请固守桥梁，并歼灭所见的任何目标。,Simulated Scenario: Hordes of Tacet Discords are attempting to cross the bridge and attack civilians who have yet to be evacuated. Hold the line and eliminate all enemies on sight.,Mô phỏng tình huống: Đàn Tàn Tượng đang cố vượt qua cầu để tấn công dân thường chưa kịp sơ tán. Hãy giữ vững cây cầu và tiêu diệt mọi mục tiêu trong tầm nhìn.
lang_multi_text.db,MultiText,TowerDefense_MainstageDesc_1-2,"威胁演进：矩阵耐久度上限降至<color=#fde7a1ff>15</color>。
区域中地形将被扩展。","Threat Escalation: Max Matrix Durability is reduced to <color=#fde7a1ff>15</color>.
Terrain is expanded in this simulation.","Mối đe dọa leo thang: Giới hạn độ bền Ma Trận giảm xuống <color=#fde7a1ff>15</color>.
Địa hình khu vực sẽ được mở rộng."
lang_multi_text.db,MultiText,TowerDefense_MainstageDesc_2-1,情景模拟：这片早已废弃的庭院中存在某种吸引残象的特殊频率源。收容特勤正尝试将其无害化处理，请在处理工作完成前，尽可能迟滞残象的行动。,"Simulated Scenario: A special frequency source that attracts Tacet Discords has appeared in a long-abandoned courtyard, and agents are working to neutralize it. Keep the Tacet Discords at bay as long as possible until the operation is complete.",Mô phỏng tình huống: Trong sân vườn bỏ hoang từ lâu tồn tại một nguồn tần số đặc biệt thu hút Tàn Tượng. Đội đặc nhiệm đang cố vô hiệu hóa nó. Hãy trì hoãn bước tiến của Tàn Tượng càng lâu càng tốt cho đến khi công việc hoàn tất.
lang_multi_text.db,MultiText,TowerDefense_MainstageDesc_2-2,"威胁演进：矩阵耐久度上限降至<color=#fde7a1ff>15</color>。
残象生命值提升。
区域中地形将被扩展。","Threat Escalation: Max Matrix Durability is reduced to <color=#fde7a1ff>15</color>.
Tacet Discords have higher HP.
Terrain is expanded in this simulation.","Mối đe dọa leo thang: Giới hạn độ bền Ma Trận giảm xuống <color=#fde7a1ff>15</color>.
HP Tàn Tượng tăng.
Địa hình khu vực sẽ được mở rộng."
lang_multi_text.db,MultiText,TowerDefense_MainstageDesc_3-1,情景模拟：因悲鸣而沦为废墟的城市中形成了大量残象。当地执花计划在残象潮形成前利用频率诱饵吸引它们，并借助有利地形尽量削减其数量。请前往既定区域建立防线，以协助他的计划。,"Simulated Scenario: Destroyed by the Lament, a ruined city has become a large gathering spot for Tacet Discords. A local Bloom Bearer intends to lure them out with frequencies and eliminate them as many as possible using favorable terrain. Proceed to the designated area and establish a defense line in support of the operation.","Mô phỏng tình huống: Thành phố đổ nát vì Bi Minh đã sinh ra lượng lớn Tàn Tượng. Một người mang hoa tại đây dự định dùng mồi tần số để dụ chúng ra trước khi chúng hình thành làn sóng, rồi tận dụng địa hình có lợi để giảm bớt số lượng. Hãy đến khu vực chỉ định thiết lập phòng tuyến để hỗ trợ kế hoạch của anh ấy."
