db_file,table_name,id,zh,en,vi
lang_multi_text.db,MultiText,XJXYBC_4_16,最后，就是第一协议——保护人类：机兵不得伤害人类个体，或者因不作为致使人类个体受到伤害……,"Finally, Protocol One—Protect humanity: A mech must not harm any individual human, nor, through inaction, allow any individual human to come to harm…","Cuối cùng, chính là giao thức thứ nhất... Bảo vệ con người: Cơ Binh không được làm hại cá thể người, hoặc vì không hành động mà để cá thể người bị tổn hại..."
lang_multi_text.db,MultiText,XJXYBC_4_17,听起来已经相对完善了？,Sounds pretty thorough already?,Nghe có vẻ đã khá hoàn thiện rồi nhỉ?
lang_multi_text.db,MultiText,XJXYBC_4_18,听起来还是有些许漏洞？,Aren't there a few loopholes?,Nghe có vẻ vẫn còn chút lỗ hổng?
lang_multi_text.db,MultiText,XJXYBC_4_19,这几条协议，已经足以支持机兵们自由行动，应对大部分情境了。,These protocols are enough to let mechs operate freely and handle most situations.,"Những giao thức này đã đủ để hỗ trợ các Cơ Binh hành động tự do, ứng phó với phần lớn các tình huống rồi."
lang_multi_text.db,MultiText,XJXYBC_4_2,发生什么事了？,What happened?,Có chuyện gì vậy?
lang_multi_text.db,MultiText,XJXYBC_4_20,但随着实际应用，还是会有各种各样新的问题出现……甚至还有人专门为协议可能产生的种种矛盾，构想出了整整一部短篇小说集。,"But in practice, new problems always pop up. Someone even wrote a whole collection of short stories about the contradictions these protocols could create!","Nhưng khi áp dụng thực tế, vẫn sẽ có đủ loại vấn đề mới phát sinh... Thậm chí còn có người chuyên vì những mâu thuẫn có thể nảy sinh từ các giao thức mà viết ra cả một tập truyện ngắn."
lang_multi_text.db,MultiText,XJXYBC_4_21,学院正在考虑增加一条“机兵必须将自己视为机械体”的协议，还有一位机兵曾提出过第零协议：机兵必须保护人类整体利益不受伤害……,The Academy is considering adding a protocol that a mech must recognize itself as a machine. And one mech once proposed a Protocol Zero: A mech must protect humanity's collective interest from harm…,"Học viện đang xem xét thêm một giao thức ""Cơ Binh phải tự coi mình là cơ thể máy móc"", còn có một Cơ Binh từng đề xuất Giao thức số không: Cơ Binh phải bảo vệ lợi ích chung của nhân loại không bị tổn hại..."
lang_multi_text.db,MultiText,XJXYBC_4_22,不过，就所有协议的设计原则而言，有一条“准则”是万有不变的：守护人类。,"But across all protocol design, one ""directive"" remains the same: protect humanity.","Tuy nhiên, xét về nguyên tắc thiết kế của tất cả các giao thức, có một ""chuẩn mực"" là bất biến: Bảo vệ nhân loại."
lang_multi_text.db,MultiText,XJXYBC_4_23,但问题依然存在——我们要如何去定义“人类”呢？,"But the question remains... How are we to define ""human,"" exactly?","Nhưng vấn đề vẫn tồn tại... Chúng ta phải định nghĩa ""nhân loại"" như thế nào?"
lang_multi_text.db,MultiText,XJXYBC_4_24,如果有人身体大部分都替换为了机械义体，或是出现了大面积的残象化特征……假如“人类”的定义被修改，它们又该如何判断呢？,"If someone has replaced most of their body with mechanical prosthetics, or displays extensive Tacet Discord traits... and if the very definition of ""human"" were to change, how are they supposed to judge?","Nếu có người thay thế phần lớn cơ thể bằng bộ phận giả cơ khí, hoặc xuất hiện đặc điểm Tàn Tượng hóa diện rộng... Giả sử định nghĩa về ""nhân loại"" bị sửa đổi, chúng sẽ phán đoán ra sao?"
lang_multi_text.db,MultiText,XJXYBC_4_25,道阻且长啊。而且，你看，所有关于机兵行为规则的探讨，最后视角都会转回人类自身……,"It's a long, hard road. And look... Every discussion about mech behavior rules ultimately circles back to us humans in the end...","Đường còn dài và gian nan lắm. Hơn nữa, cậu xem, mọi cuộc thảo luận về quy tắc hành vi của Cơ Binh, cuối cùng góc nhìn đều quay trở lại bản thân con người..."
lang_multi_text.db,MultiText,XJXYBC_4_26,也许机兵们的存在，也是一种对我们自身的“反照”呢……,Maybe the very existence of mechs is also a kind of mirror we're holding up to ourselves…,"Có lẽ sự tồn tại của các Cơ Binh, cũng là một tấm gương ""phản chiếu"" chính chúng ta chăng..."
lang_multi_text.db,MultiText,XJXYBC_4_3,……先消消气。,...Let's just take a breath.,...Bớt giận đã nào.
lang_multi_text.db,MultiText,XJXYBC_4_4,呼……我是工学部的协议测试工程师，正在检查这些机兵的底层核心协议。,...I'm a protocol testing engineer from the Engineering Department. I'm checking the underlying core protocols of these mechs.,"Phù... Tôi là kỹ sư kiểm thử giao thức của Khoa Kỹ Thuật, đang kiểm tra các giao thức cốt lõi tầng thấp của những Cơ Binh này."
lang_multi_text.db,MultiText,XJXYBC_4_5,学院明明有模板，只需要引用就好，总有人要按自己的想法乱改核心协议……协议逻辑一旦混乱，就会令机兵们的系统崩溃，最终酿成大祸……,"The Academy gives you templates! Why not use 'em! But no, some people just <i>have</i> to tinker with the core protocols to suit their whims. If that gets messed up, it can crash the mechs' systems and cause a major disaster...","Học viện rõ ràng có mẫu sẵn, chỉ cần trích dẫn là được, thế mà lúc nào cũng có người sửa lung tung giao thức cốt lõi theo ý mình... Một khi logic giao thức bị rối loạn, sẽ khiến hệ thống của các Cơ Binh sụp đổ, cuối cùng gây ra đại họa..."
lang_multi_text.db,MultiText,XJXYBC_4_6,具体是什么协议？,What are these protocols?,Cụ thể là giao thức gì?
lang_multi_text.db,MultiText,XJXYBC_4_7,辛苦了，你慢慢忙……,Got it. I'll let you get back to work.,"Vất vả rồi, anh cứ làm việc đi..."
lang_multi_text.db,MultiText,XJXYBC_4_8,哦？难得有非工学部的新生愿意了解这些，那我可要好好讲讲！具体的算法我就不提了，只说说它们最终呈现出的规则吧。,"Oh? It's rare to see a freshman from outside Engineering interested in this stuff. In that case, I'll give you the full breakdown! I'll skip the algorithms and just talk about the final rules.","Ồ? Hiếm khi có tân sinh viên ngoài Khoa Kỹ Thuật muốn tìm hiểu những thứ này, vậy để tôi nói kỹ cho nghe! Thuật toán cụ thể thì tôi không nhắc đến, chỉ nói về những quy tắc cuối cùng mà chúng thể hiện thôi nhé."
lang_multi_text.db,MultiText,XJXYBC_4_9,首先，每位机兵都有一条元协议：机兵在无指令输入时，不得实施行为，除非该行为符合机兵原则。,"First, every mech has one Meta‑Protocol: In the absence of any command input, a mech must not perform any action unless that action complies with its principles.","Đầu tiên, mỗi Cơ Binh đều có một Giao thức Nguyên thủy: Khi không có chỉ thị đầu vào, Cơ Binh không được thực hiện hành vi, trừ khi hành vi đó phù hợp với nguyên tắc Cơ Binh."
lang_multi_text.db,MultiText,XJXYBC_5_1,烫烫烫烫烫……,"Hot, hot, hot, hot, hot...",Nóng nóng nóng nóng nóng...
lang_multi_text.db,MultiText,XJXYBC_5_2,嘿咻，这样应该就修好了……,"There we go, that should fix it...","Hây da, thế này chắc là sửa xong rồi..."
lang_multi_text.db,MultiText,XJXYBC_6_1,烫烫烫烫烫……,"Hot, hot, hot, hot, hot...",Nóng nóng nóng nóng nóng...
lang_multi_text.db,MultiText,XJXYBC_6_10,真的可以这么做吗？,Can we really do that?,Thật sự có thể làm vậy sao?
lang_multi_text.db,MultiText,XJXYBC_6_11,万一打坏了怎么办？,What if I break it?,Nhỡ đánh hỏng thì sao?
lang_multi_text.db,MultiText,XJXYBC_6_12,这些机兵可是人称移动的“对虚天帷”，别小瞧了它们的防御力啊！而且至少目前是没发现过有学生能一拳将「天帷机兵」打坏啦。,"These mechs are basically walking ""Antivoid Canopies,"" don't underestimate their defense! And so far, no student has ever broken a Mechascout with one punch.","Những Cơ Binh này được mệnh danh là ""Thiên Duy Chống Hư Không"" di động đấy, đừng coi thường khả năng phòng thủ của chúng! Hơn nữa ít nhất đến hiện tại chưa thấy sinh viên nào đấm một phát hỏng được ""Thiên Duy Cơ Binh"" đâu."
lang_multi_text.db,MultiText,XJXYBC_6_13,显现吧！屹立不朽的理想之盾！——别在意，这是我给它设置的解限密令……来吧，用出你的全力！打坏了由我负责！,"Reveal yourself! Everlasting Shield of Ideals! Oh, don't mind me, that's just the unlock code I set for it... Come on, give it everything you've got! If you break it, I'll take responsibility!","Hiện hình đi! Tấm khiên lý tưởng sừng sững bất diệt! ...Đừng bận tâm, đó là mật lệnh giải hạn chế tôi đặt cho nó thôi... Nào, dùng hết sức của cậu đi! Đánh hỏng tôi chịu trách nhiệm!"
lang_multi_text.db,MultiText,XJXYBC_6_14,（轻轻给出一拳。）,(Throw a light punch.),(Đấm nhẹ một cái.)
lang_multi_text.db,MultiText,XJXYBC_6_15,（对它挥出全力一击！）,(Strike it with everything you've got!),(Tung một đấm toàn lực vào nó!)
lang_multi_text.db,MultiText,XJXYBC_6_16,咣咣……真是强而有力的一击击击击击……您的身手实在了得得得得得……,"Clang, clang... What an incredibly powerful stri-stri-stri-stri-strike... Your skills are truly rema-remarkable-ble-ble-ble...",Uỳnh uỳnh... Quả là một đòn tấn công mạnh mẽ mẽ mẽ mẽ... Thân thủ của ngài thật đáng nể nể nể nể nể...
lang_multi_text.db,MultiText,XJXYBC_6_17,（面前的机兵晃了晃它的脑袋，终于从冲击中清醒了过来，显示屏上的符号也逐渐清晰……你的最终得分是……）,"(The mech in front of you shakes its head, finally coming to its senses after the impact. The symbols on its display slowly focus… Your final score is…)","(Cơ Binh trước mặt lắc lắc cái đầu, cuối cùng cũng tỉnh lại sau cú va chạm, các ký hiệu trên màn hình hiển thị cũng dần rõ nét... Điểm số cuối cùng của bạn là...)"
lang_multi_text.db,MultiText,XJXYBC_6_18,！@#￥%&*（）*&#￥%&*……<b>∞</b>！,！@#￥%&*()*&#￥%&*......<b>∞</b>！,!@#￥%&*()*&#￥%&*...<b>∞</b>!
lang_multi_text.db,MultiText,XJXYBC_6_19,这、这不对吧？又出故障了吗？,"Th-this can't be right, can it? Is it acting up again?","Cái, cái này không đúng chứ? Lại trục trặc à?"
lang_multi_text.db,MultiText,XJXYBC_6_2,嘿咻，这样应该就修好了……,"There we go, that should fix it...","Hây da, thế này chắc là sửa xong rồi..."
lang_multi_text.db,MultiText,XJXYBC_6_20,究竟是哪里出了问题……,What exactly went wrong...,Rốt cuộc là vấn đề ở đâu...
lang_multi_text.db,MultiText,XJXYBC_6_3,正好，这位同学，你有时间吗？要不要来帮忙测试一下？,"Perfect timing... Hey, you! Got a sec? Want to help me test something?","Đúng lúc lắm, bạn học này, cậu có thời gian không? Có muốn đến giúp kiểm tra thử không?"
lang_multi_text.db,MultiText,XJXYBC_6_4,需要我做什么？,"Sure, what is it?",Cần tôi làm gì?
lang_multi_text.db,MultiText,XJXYBC_6_5,暂时没有时间……,"Sorry, I don't have time for this now.",Tạm thời không có thời gian...
lang_multi_text.db,MultiText,XJXYBC_6_6,除了抵御虚质磁暴的本职工作，「天帷机兵」还搭载了评价人们的破坏力的测试模块。,"Aside from its main job of fending off Void Storms, the Mechascout is also equipped with a module that measures how powerful someone's attacks are.","Ngoài công việc chính là chống lại Hư Chất Từ Bạo, ""Thiên Duy Cơ Binh"" còn được trang bị mô-đun kiểm tra đánh giá sức phá hoại của mọi người."
lang_multi_text.db,MultiText,XJXYBC_6_7,唉，学院原本是严令禁止那些“走在路上随手给机兵来上一拳”的暴力行为的……,"Pft, the Academy used to strictly ban that kind of ""walking by and giving a Mechascout a good whack"" thing…","Haizz, Học viện vốn dĩ nghiêm cấm những hành vi bạo lực kiểu ""đang đi trên đường tiện tay đấm cho Cơ Binh một cái""..."
lang_multi_text.db,MultiText,XJXYBC_6_8,后来学院发现由于压力太大，不仅是学生，甚至有些教师也会这么做……这几乎已经成为了一种硬需求，干脆堵不如疏了……,"Then they realized the stress was so bad, even some teachers were doing it... It's practically a public service at this point. So instead of cracking down, they decided to leave it as an outlet...","Sau đó Học viện phát hiện do áp lực quá lớn, không chỉ sinh viên, thậm chí một số giáo viên cũng làm như vậy... Việc này gần như đã trở thành một nhu cầu thiết yếu, thà khơi thông còn hơn ngăn chặn..."
lang_multi_text.db,MultiText,XJXYBC_6_9,它会用巨盾接下你的攻击，然后给你的这一击打出一个公道的分数。哦，记得佩戴好自己的终端，不然它们会将你视作敌人的。,"It'll block your hit with that huge shield and give you a fair score. Oh, and don't forget to wear your Terminal, or they'll mark you as a hostile.","Nó sẽ dùng khiên lớn đỡ đòn tấn công của cậu, sau đó chấm một điểm số công bằng cho cú đánh đó. Ồ, nhớ đeo thiết bị đầu cuối của cậu vào, nếu không chúng sẽ coi cậu là kẻ địch đấy."
lang_multi_text.db,MultiText,XJXYBC_7_1,真的没有办法了吗……,Is there really nothing we can do...?,Thật sự không còn cách nào nữa sao...
lang_multi_text.db,MultiText,XJXYBC_7_2,我们现在能做的，就是和它们好好告别了。,All we can do now is give them a proper farewell.,"Điều chúng ta có thể làm bây giờ, là nói lời tạm biệt đàng hoàng với chúng."
lang_multi_text.db,MultiText,XJXYBC_8_1,真的没有办法了吗？如果是算法上有问题，我还能修……！,"Is there really nothing we can do? If it's an issue with the algorithm, I can still fix it!","Thật sự không còn cách nào nữa sao? Nếu là vấn đề thuật toán, tôi vẫn có thể sửa...!"
lang_multi_text.db,MultiText,XJXYBC_8_10,（你看到即将被回收的“准时宝”对面前的人们比出了一个大拇指，似乎是在说……）,"(You see the soon-to-be-decommissioned ""TARD-E Unit"" give a thumbs-up to everyone facing it, as if to say...)","(Bạn thấy ""Chuẩn Thời Bảo"" sắp bị thu hồi giơ ngón tay cái về phía mọi người, dường như đang nói...)"
lang_multi_text.db,MultiText,XJXYBC_8_11,（“不要悲伤，我们很快就会再见。”）,"(""Don't be sad. We'll see each other again soon."")","(""Đừng buồn, chúng ta sẽ sớm gặp lại nhau."")"
lang_multi_text.db,MultiText,XJXYBC_8_2,孩子，我能理解……那种亲眼看着自己创造的机兵被回收的感觉……,"Kid, I understand... that feeling of watching the mechs you built yourself get sent for decommissioning…","Nhóc con, ta có thể hiểu được... cái cảm giác tận mắt nhìn thấy Cơ Binh do mình tạo ra bị thu hồi..."
lang_multi_text.db,MultiText,XJXYBC_8_3,我们或许能修复它们内在运算逻辑上的问题，但这种程度的零件磨损与劣化已经是不可逆的了。,"We might be able to patch their internal operating logic, but the wear and tear on their parts at this level is irreversible.","Chúng ta có thể sửa chữa những vấn đề logic vận hành bên trong, nhưng mức độ mài mòn và xuống cấp của linh kiện thế này là không thể đảo ngược."
lang_multi_text.db,MultiText,XJXYBC_8_4,以我们现在的科技水平……就像人类一样，它们也会有“老去”的一天……,"With the level of technology we have now... Just like humans, they too will reach the day when they grow too old to go on...","Với trình độ khoa học kỹ thuật hiện tại của chúng ta... cũng giống như con người, chúng cũng sẽ có ngày ""già đi""..."
lang_multi_text.db,MultiText,XJXYBC_8_5,放心吧，学院对它们的数据做了记录备份。待回收完成，包括它们的机体在内，也会成为新生准时宝的一部分。,"Don't worry, the Academy has already backed up all of their data. Once the decommissioning is complete, their mech bodies will form parts of new TARD‑E Units.","Yên tâm đi, Học viện đã sao lưu dữ liệu của chúng rồi. Đợi thu hồi hoàn tất, bao gồm cả thân máy của chúng, cũng sẽ trở thành một phần của Chuẩn Thời Bảo thế hệ mới."
lang_multi_text.db,MultiText,XJXYBC_8_6,可是，如果它们的部件乃至整个机体都被全部替换，它们还会是原来的它们吗？,"But if all their parts, even their whole bodies, get replaced… will they still be who they were?","Nhưng mà, nếu các bộ phận hay thậm chí cả thân máy đều bị thay thế toàn bộ, liệu chúng có còn là chúng của ban đầu không?"
lang_multi_text.db,MultiText,XJXYBC_8_7,这要取决于你如何解读了。在我看来，这同样是一种“传承”。,"That depends on how you look at it. To me, they are… ""passing the torch on.""","Điều này phụ thuộc vào cách cậu lý giải. Theo ta thấy, đây cũng là một sự ""kế thừa""."
lang_multi_text.db,MultiText,XJXYBC_8_8,而我们现在能做的，就是和它们好好告别了。,"Now, all we can do is bid them adieu.","Và điều chúng ta có thể làm bây giờ, là nói lời tạm biệt đàng hoàng với chúng."
lang_multi_text.db,MultiText,XJXYBC_8_9,再见了，所有故障的准时宝……,"Goodbye, all you broken TARD-E Units...","Tạm biệt nhé, tất cả những Chuẩn Thời Bảo hỏng hóc..."
lang_multi_text.db,MultiText,XJXYBC_9_1,这只莳植机麋，已经被其他机麋视作了“首领”。,"This Flora Reindeer has been acknowledged as the ""leader"" by the rest of the herd.","Con Cơ Lộc Thực Vật này đã được những con Cơ Lộc khác xem như ""thủ lĩnh""."
lang_multi_text.db,MultiText,XJXYBC_9_2,你想说的，该不会是……,Don't tell me you mean...,"Ý anh muốn nói, chẳng lẽ là..."
lang_multi_text.db,MultiText,XJXYBGSST_10_1,新的那期《潮汐地理》，说旧穗波市的那期，你看了没？,"The new issue of ""Wutherium Geographic"" is about old Honami City. Have you read it yet?","Số mới của tạp chí ""Địa Lý Triều Tịch"", số nói về thành phố Honami cũ ấy, cậu xem chưa?"
lang_multi_text.db,MultiText,XJXYBGSST_10_2,当然看了！被悲鸣毁灭前的穗波市，居然那么美……,Of course I have. Intact pre-Lament Honami was beautiful.,"Đương nhiên xem rồi! Thành phố Honami trước khi bị Bi Minh hủy diệt, không ngờ lại đẹp đến thế..."
lang_multi_text.db,MultiText,XJXYBGSST_10_3,真要感谢那位摄影师，把城市的记忆留给了我们。,We should be thankful to that photographer. At least someone was there to photograph those cityscapes for us.,"Thật sự phải cảm ơn nhiếp ảnh gia đó, đã lưu giữ lại ký ức của thành phố cho chúng ta."
lang_multi_text.db,MultiText,XJXYBGSST_11_1,你材质仿生学这块很有天赋，怎么样，考虑来工学部吗？,You have a knack for bionic materials. Why don't you come to the Engineering Department?,"Em rất có năng khiếu về mảng vật liệu mô phỏng sinh học đấy, thế nào, có cân nhắc đến Khoa Kỹ Thuật không?"
lang_multi_text.db,MultiText,XJXYBGSST_11_2,老师……其实我、我更想去农学部……去种地……,Professor... Truth be told... I want to go to the Agronomy Wing... I want to farm...,"Thưa thầy... thực ra em, em muốn vào ""Khoa Nông Nghiệp"" hơn... đi trồng trọt..."
lang_multi_text.db,MultiText,XJXYBGSST_11_3,那也不错，适合你的就是最好的。,That's fine as well. Whatever suits your interests.,"Thế cũng không tệ, cái gì phù hợp với mình là tốt nhất."
lang_multi_text.db,MultiText,XJXYBGSST_12_1,你是……哦，拉贝尔学部的新生啊。我是负责分部测试志愿辅导的瑞霖，你有什么想问的吗？,Are you new to Rabelle College? My name is Reilynn. I'm a volunteer advisor in charge of sorting evaluations. Is there anything you'd like to ask me?,"Cậu là... ồ, tân sinh viên Khoa Rabelle à. Tôi là Reilynn, phụ trách hướng dẫn tình nguyện cho bài kiểm tra phân khoa, cậu có gì muốn hỏi không?"
lang_multi_text.db,MultiText,XJXYBGSST_12_10,当然，如果你已经有了心仪的学部，在相关课程上多下功夫，肯定会增加入选的机会。,"Of course, if you've already got your eye on a department, going the extra mile in their related courses is a surefire way to boost your odds.","Tất nhiên, nếu em đã có khoa mình thích, bỏ nhiều công sức vào các môn học liên quan, chắc chắn sẽ tăng cơ hội được chọn."
lang_multi_text.db,MultiText,XJXYBGSST_12_11,原来如此。,Naturally.,Hóa ra là vậy.
lang_multi_text.db,MultiText,XJXYBGSST_12_12,哈哈，无需担心。星炬学院的学生虽然个个都……嗯，挺有个性的，但能来到这里的人，无一不是优秀的科研苗子。,"No need to worry. Look, everyone at Startorch Academy is... let's just say ""special"" in their own way. But anyone who makes the cut is built for a science career.","Ha ha, không cần lo lắng. Sinh viên Học viện Startorch tuy ai nấy đều... ừm, khá cá tính, nhưng những người có thể đến được đây, không ai không phải là mầm non nghiên cứu khoa học xuất sắc."
lang_multi_text.db,MultiText,XJXYBGSST_12_13,既然选择了科研这条路，大家自然都做好了迎接挑战的准备。要对自己的同学们有信心啊。,"We're all here because we chose this path, and we're all ready for the grind. Have a little faith in your peers.","Đã chọn con đường nghiên cứu khoa học này, mọi người đương nhiên đều đã sẵn sàng đón nhận thử thách. Phải có niềm tin vào bạn học của mình chứ."
lang_multi_text.db,MultiText,XJXYBGSST_12_2,分部测试是什么？,What are sorting evaluations?,Kiểm tra phân khoa là gì?
lang_multi_text.db,MultiText,XJXYBGSST_12_3,我也要参加吗？有点担心……,Do I have to be assessed? I'm a bit nervous...,Tôi cũng phải tham gia sao? Hơi lo lắng...
lang_multi_text.db,MultiText,XJXYBGSST_12_4,你是拉贝尔学部的适格者，不需要参加这场考试，不清楚也很正常。,You're already a Synchronist at Rabelle College. This assessment isn't for you. Let me explain...,"Cậu là người thích hợp của Khoa Rabelle, không cần tham gia kỳ thi này, không rõ cũng là bình thường."
lang_multi_text.db,MultiText,XJXYBGSST_12_5,别担心，你可是适格者。入学的时候，就已经确定要加入拉贝尔学部，不需要再参加分部测试。,Nervous? But you're already a Synchronist! You were qualified during enrollment. There's no need for you to do this assessment.,"Đừng lo, cậu là người thích hợp mà. Lúc nhập học đã xác định sẽ gia nhập Khoa Rabelle rồi, không cần tham gia kiểm tra phân khoa nữa."
lang_multi_text.db,MultiText,XJXYBGSST_12_6,为了让新加入的同学们，能更快适应学院的氛围，学院调整了学制，设置了为期两年的预科班，进行不分学部的通识教育。,"To help new students adapt to academic life, the Academy has updated its curriculum to include a two-year Preparatory Program that provides generalized learning.","Để các bạn học mới gia nhập có thể thích nghi nhanh hơn với không khí Học viện, Học viện đã điều chỉnh học chế, thiết lập lớp dự bị kéo dài hai năm, tiến hành giáo dục đại cương không phân khoa."
lang_multi_text.db,MultiText,XJXYBGSST_12_7,这样大家既能慢慢了解各学部的专研方向，也有充足时间思考自己的兴趣所在，提前做好方向准备。,It gives everyone a chance to scope out the different departments and really think about what interests them.,"Như vậy mọi người vừa có thể từ từ tìm hiểu hướng nghiên cứu chuyên sâu của các khoa, vừa có đủ thời gian suy nghĩ về sở thích của bản thân, chuẩn bị trước định hướng."
lang_multi_text.db,MultiText,XJXYBGSST_12_8,如果考试成绩不理想呢？,What if their scores are mediocre?,Nếu kết quả thi không lý tưởng thì sao?
