db_file,table_name,id,zh,en,vi
lang_multi_text.db,MultiText,SkillDescription_1410044_Description,{0}点,{0},{0} điểm
lang_multi_text.db,MultiText,SkillDescription_1410045_AttributeName,空中攻击耐力消耗,Mid-air Attack STA Cost,Tiêu hao thể lực tấn công trên không
lang_multi_text.db,MultiText,SkillDescription_1410046_AttributeName,月弓·普攻第一段额外回复协奏能量,Moonbow - Basic Attack 1 Extra Concerto Regen,Hồi phục Năng Lượng Hiệp Tấu thêm Nguyệt Cung - Đánh Thường đoạn 1
lang_multi_text.db,MultiText,SkillDescription_1410047_AttributeName,月弓·普攻第二段额外回复协奏能量,Moonbow - Basic Attack 2 Extra Concerto Regen,Hồi phục Năng Lượng Hiệp Tấu thêm Nguyệt Cung - Đánh Thường đoạn 2
lang_multi_text.db,MultiText,SkillDescription_1410048_AttributeName,月弓·普攻第三段额外回复协奏能量,Moonbow - Basic Attack 3 Extra Concerto Regen,Hồi phục Năng Lượng Hiệp Tấu thêm Nguyệt Cung - Đánh Thường đoạn 3
lang_multi_text.db,MultiText,SkillDescription_1410049_AttributeName,月弓·闪避反击额外回复协奏能量,Moonbow - Dodge Counter Extra Concerto Regen,Hồi phục Năng Lượng Hiệp Tấu thêm Nguyệt Cung - Phản công né tránh
lang_multi_text.db,MultiText,SkillDescription_1410050_AttributeName,越限的弦引额外回复协奏能量,Arc Beyond the Edge Extra Concerto Regen,Hồi phục Năng Lượng Hiệp Tấu thêm Việt Hạn Đích Huyền Dẫn
lang_multi_text.db,MultiText,SkillDescription_1410051_AttributeName,漫溯巡游每秒耐力消耗,Meandering STA Cost per Second,Tiêu hao thể lực mỗi giây Mạn Tố Tuần Du
lang_multi_text.db,MultiText,SkillDescription_1410052_AttributeName,满月领域周期间隔,Full Moon Domain Interval,Khoảng cách chu kỳ Lĩnh Vực Trăng Tròn
lang_multi_text.db,MultiText,SkillDescription_1410053_AttributeName,重击·流变耐力消耗,Heavy Attack - Flux STA Cost,Tiêu hao thể lực Đánh Mạnh - Lưu Biến
lang_multi_text.db,MultiText,SkillDescription_1504001_AttributeName,黄灯·普攻,Yellow Light: Basic Attack,Đèn Vàng - Đánh Thường
lang_multi_text.db,MultiText,SkillDescription_1504002_AttributeName,飞星,Glitter,Phi Tinh
lang_multi_text.db,MultiText,SkillDescription_1504003_AttributeName,黄灯·下落攻击,Yellow Light: Plunging Attack,Đèn Vàng - Tấn công đáp xuống
lang_multi_text.db,MultiText,SkillDescription_1504004_AttributeName,红灯·普攻一段伤害,Red Light: Basic Attack 1 DMG,Sát thương Đèn Đỏ - Đánh Thường đoạn 1
lang_multi_text.db,MultiText,SkillDescription_1504005_AttributeName,红灯·普攻二段伤害,Red Light: Basic Attack 2 DMG,Sát thương Đèn Đỏ - Đánh Thường đoạn 2
lang_multi_text.db,MultiText,SkillDescription_1504006_AttributeName,红灯·普攻三段伤害,Red Light: Basic Attack 3 DMG,Sát thương Đèn Đỏ - Đánh Thường đoạn 3
lang_multi_text.db,MultiText,SkillDescription_1504007_AttributeName,红灯·重击伤害,Red Light: Heavy Attack DMG,Sát thương Đèn Đỏ - Đánh Mạnh
lang_multi_text.db,MultiText,SkillDescription_1504008_AttributeName,红灯·下落攻击伤害,Red Light: Plunging Attack DMG,Sát thương Đèn Đỏ - Tấn công đáp xuống
lang_multi_text.db,MultiText,SkillDescription_1504009_AttributeName,黄灯·下落攻击耐力消耗,Yellow Light: Plunging Attack STA Cost,Tiêu hao thể lực Đèn Vàng - Tấn công đáp xuống
lang_multi_text.db,MultiText,SkillDescription_1504010_AttributeName,红灯·重击耐力消耗,Red Light: Heavy Attack STA Cost,Tiêu hao thể lực Đèn Đỏ - Đánh Mạnh
lang_multi_text.db,MultiText,SkillDescription_1504011_AttributeName,红灯·下落攻击耐力消耗,Red Light: Plunging Attack STA Cost,Tiêu hao thể lực Đèn Đỏ - Tấn công đáp xuống
lang_multi_text.db,MultiText,SkillDescription_1504012_AttributeName,前扑伤害,Pounce DMG,Sát thương Vồ Tới
lang_multi_text.db,MultiText,SkillDescription_1504013_AttributeName,后撤伤害,Rebound DMG,Sát thương Rút Lui
lang_multi_text.db,MultiText,SkillDescription_1504014_AttributeName,前扑耐力消耗,Pounce STA Cost,Tiêu hao thể lực Vồ Tới
lang_multi_text.db,MultiText,SkillDescription_1504015_AttributeName,后撤耐力消耗,Rebound STA Cost,Tiêu hao thể lực Rút Lui
lang_multi_text.db,MultiText,SkillDescription_1504016_AttributeName,技能伤害,Skill DMG,Sát thương kỹ năng
lang_multi_text.db,MultiText,SkillDescription_1504017_AttributeName,技能冷却,Cooldown,Hồi chiêu kỹ năng
lang_multi_text.db,MultiText,SkillDescription_1504018_AttributeName,消耗共鸣能量,Resonance Cost,Tiêu hao năng lượng Cộng Hưởng
lang_multi_text.db,MultiText,SkillDescription_1504019_AttributeName,回复协奏能量,Concerto Regen,Hồi phục Năng Lượng Hiệp Tấu
lang_multi_text.db,MultiText,SkillDescription_1504020_AttributeName,技能伤害,Skill DMG,Sát thương kỹ năng
lang_multi_text.db,MultiText,SkillDescription_1504021_AttributeName,回复协奏能量,Concerto Regen,Hồi phục Năng Lượng Hiệp Tấu
lang_multi_text.db,MultiText,SkillDescription_1504022_AttributeName,强光伤害,Glare DMG,Sát thương Cường Quang
lang_multi_text.db,MultiText,SkillDescription_1504023_AttributeName,红灯聚光·普攻一段伤害,Red Spotlight: Basic Attack 1 DMG,Sát thương Đèn Đỏ Tụ Quang - Đánh Thường đoạn 1
lang_multi_text.db,MultiText,SkillDescription_1504024_AttributeName,红灯聚光·普攻二段伤害,Red Spotlight: Basic Attack 2 DMG,Sát thương Đèn Đỏ Tụ Quang - Đánh Thường đoạn 2
lang_multi_text.db,MultiText,SkillDescription_1504025_AttributeName,红灯聚光·普攻三段伤害,Red Spotlight: Basic Attack 3 DMG,Sát thương Đèn Đỏ Tụ Quang - Đánh Thường đoạn 3
lang_multi_text.db,MultiText,SkillDescription_1504026_AttributeName,红灯聚光·重击伤害,Red Spotlight: Heavy Attack DMG,Sát thương Đèn Đỏ Tụ Quang - Đánh Mạnh
lang_multi_text.db,MultiText,SkillDescription_1504027_AttributeName,强化前扑伤害,Energized Pounce DMG,Sát thương Vồ Tới cường hóa
lang_multi_text.db,MultiText,SkillDescription_1504028_AttributeName,强化后撤伤害,Energized Rebound DMG,Sát thương Rút Lui cường hóa
lang_multi_text.db,MultiText,SkillDescription_1504029_AttributeName,强光穿射每段伤害,Single Laser Beam DMG,Sát thương mỗi đoạn Cường Quang Xuyên Xạ
lang_multi_text.db,MultiText,SkillDescription_1504030_AttributeName,红灯·闪避反击伤害,Red Light: Dodge Counter DMG,Sát thương Đèn Đỏ - Phản công né tránh
lang_multi_text.db,MultiText,SkillDescription_1504031_AttributeName,强化前扑回复协奏能量,Energized Pounce Concerto Regen,Hồi phục Năng Lượng Hiệp Tấu Vồ Tới cường hóa
lang_multi_text.db,MultiText,SkillDescription_1504032_AttributeName,强化后撤回复协奏能量,Energized Rebound Concerto Regen,Hồi phục Năng Lượng Hiệp Tấu Rút Lui cường hóa
lang_multi_text.db,MultiText,SkillDescription_1505001_AttributeName,普攻第一段伤害,Stage 1 DMG,Sát thương Đánh Thường đoạn 1
lang_multi_text.db,MultiText,SkillDescription_1505002_AttributeName,普攻第二段伤害,Stage 2 DMG,Sát thương Đánh Thường đoạn 2
lang_multi_text.db,MultiText,SkillDescription_1505003_AttributeName,普攻第三段伤害,Stage 3 DMG,Sát thương Đánh Thường đoạn 3
lang_multi_text.db,MultiText,SkillDescription_1505004_AttributeName,普攻第四段伤害,Stage 4 DMG,Sát thương Đánh Thường đoạn 4
lang_multi_text.db,MultiText,SkillDescription_1505005_AttributeName,重击伤害,Heavy Attack DMG,Sát thương Đánh Mạnh
lang_multi_text.db,MultiText,SkillDescription_1505006_AttributeName,下落攻击伤害,Plunging Attack DMG,Sát thương tấn công đáp xuống
lang_multi_text.db,MultiText,SkillDescription_1505007_AttributeName,闪避反击伤害,Dodge Counter DMG,Sát thương phản công né tránh
lang_multi_text.db,MultiText,SkillDescription_1505008_AttributeName,重击耐力消耗,Heavy Attack STA Cost,Tiêu hao thể lực Đánh Mạnh
lang_multi_text.db,MultiText,SkillDescription_1505009_AttributeName,下落攻击耐力消耗,Plunging Attack STA Cost,Tiêu hao thể lực tấn công đáp xuống
lang_multi_text.db,MultiText,SkillDescription_1505010_AttributeName,黯星·蝶伤害,Dim Star Butterfly DMG,Sát thương Ám Tinh - Điệp
lang_multi_text.db,MultiText,SkillDescription_1505011_AttributeName,治疗量,Healing,Lượng trị liệu
lang_multi_text.db,MultiText,SkillDescription_1505011_Description,{0}生命,{0} HP,{0} HP
lang_multi_text.db,MultiText,SkillDescription_1505012_AttributeName,冷却时间,Cooldown,Thời gian hồi chiêu
lang_multi_text.db,MultiText,SkillDescription_1505012_Description,{0}秒,{0}s,{0} giây
lang_multi_text.db,MultiText,SkillDescription_1505013_AttributeName,回复协奏能量,Concerto Regen,Hồi phục Năng Lượng Hiệp Tấu
lang_multi_text.db,MultiText,SkillDescription_1505015_AttributeName,治疗量,Healing,Lượng trị liệu
lang_multi_text.db,MultiText,SkillDescription_1505015_Description,{0}生命,{0} HP,{0} HP
lang_multi_text.db,MultiText,SkillDescription_1505016_AttributeName,星域持续时间,Stellarealm Duration,Thời gian duy trì Tinh Vực
lang_multi_text.db,MultiText,SkillDescription_1505016_Description,{0}秒,{0}s,{0} giây
lang_multi_text.db,MultiText,SkillDescription_1505017_AttributeName,冷却时间,Cooldown,Thời gian hồi chiêu
lang_multi_text.db,MultiText,SkillDescription_1505017_Description,{0}秒,{0}s,{0} giây
lang_multi_text.db,MultiText,SkillDescription_1505018_AttributeName,消耗共鸣能量,Resonance Cost,Tiêu hao năng lượng Cộng Hưởng
lang_multi_text.db,MultiText,SkillDescription_1505019_AttributeName,回复协奏能量,Concerto Regen,Hồi phục Năng Lượng Hiệp Tấu
lang_multi_text.db,MultiText,SkillDescription_1505020_AttributeName,启迪伤害,Enlightenment DMG,Sát thương Khải Địch
lang_multi_text.db,MultiText,SkillDescription_1505021_AttributeName,洞悉伤害,Discernment DMG,Sát thương Động Tất
lang_multi_text.db,MultiText,SkillDescription_1505021_Description,{0}生命,{0} HP,{0} HP
lang_multi_text.db,MultiText,SkillDescription_1505022_AttributeName,启迪治疗量,Enlightenment Healing,Lượng trị liệu Khải Địch
lang_multi_text.db,MultiText,SkillDescription_1505022_Description,{0}生命,{0} HP,{0} HP
lang_multi_text.db,MultiText,SkillDescription_1505023_AttributeName,洞悉治疗量,Discernment Healing,Lượng trị liệu Động Tất
lang_multi_text.db,MultiText,SkillDescription_1505023_Description,{0}生命,{0} HP,{0} HP
lang_multi_text.db,MultiText,SkillDescription_1505024_AttributeName,启迪回复协奏能量,Enlightenment Concerto Regen,Hồi phục Năng Lượng Hiệp Tấu Khải Địch
lang_multi_text.db,MultiText,SkillDescription_1505025_AttributeName,洞悉回复协奏能量,Discernment Concerto Regen,Hồi phục Năng Lượng Hiệp Tấu Động Tất
lang_multi_text.db,MultiText,SkillDescription_1505026_AttributeName,耀星·蝶伤害,Flare Star Butterfly DMG,Sát thương Diệu Tinh - Điệp
lang_multi_text.db,MultiText,SkillDescription_1505027_AttributeName,演绎伤害,Illation DMG,Sát thương Diễn Dịch
lang_multi_text.db,MultiText,SkillDescription_1505028_AttributeName,衍变伤害,Transmutation DMG,Sát thương Diễn Biến
lang_multi_text.db,MultiText,SkillDescription_1505029_AttributeName,演绎耐力消耗,Illation STA Cost,Tiêu hao thể lực Diễn Dịch
lang_multi_text.db,MultiText,SkillDescription_1505030_AttributeName,衍变耐力消耗,Transmutation STA Cost,Tiêu hao thể lực Diễn Biến
lang_multi_text.db,MultiText,SkillDescription_1505031_AttributeName,演绎回复协奏能量,Illation Concerto Regen,Hồi phục Năng Lượng Hiệp Tấu Diễn Dịch
lang_multi_text.db,MultiText,SkillDescription_1505032_AttributeName,衍变回复协奏能量,Transmutation Concerto Regen,Hồi phục Năng Lượng Hiệp Tấu Diễn Biến
lang_multi_text.db,MultiText,SkillDescription_1506001_AttributeName,第一段伤害,Stage 1 DMG,Sát thương đoạn 1
lang_multi_text.db,MultiText,SkillDescription_1506002_AttributeName,第二段伤害,Stage 2 DMG,Sát thương đoạn 2
lang_multi_text.db,MultiText,SkillDescription_1506003_AttributeName,第三段伤害,Stage 3 DMG,Sát thương đoạn 3
lang_multi_text.db,MultiText,SkillDescription_1506004_AttributeName,重击伤害,Heavy Attack DMG,Sát thương Đánh Mạnh
lang_multi_text.db,MultiText,SkillDescription_1506005_AttributeName,重击·星辉伤害,Heavy Attack: Starflash DMG,Sát thương Đánh Mạnh - Tinh Huy
lang_multi_text.db,MultiText,SkillDescription_1506006_AttributeName,空中攻击伤害,Mid-air Attack DMG,Sát thương tấn công trên không
lang_multi_text.db,MultiText,SkillDescription_1506007_AttributeName,闪避反击伤害,Dodge Counter DMG,Sát thương phản công né tránh
lang_multi_text.db,MultiText,SkillDescription_1506008_AttributeName,夏弥尔之星·闪避反击伤害,Chamuel's Star: Dodge Counter DMG,Sát thương Ngôi Sao Của Chamuel - Phản công né tránh
lang_multi_text.db,MultiText,SkillDescription_1506009_AttributeName,重击耐力消耗,Heavy Attack STA Cost,Tiêu hao thể lực Đánh Mạnh
lang_multi_text.db,MultiText,SkillDescription_1506010_AttributeName,重击·星辉耐力消耗,Heavy Attack: Starflash STA Cost,Tiêu hao thể lực Đánh Mạnh - Tinh Huy
lang_multi_text.db,MultiText,SkillDescription_1506011_AttributeName,空中攻击耐力消耗,Mid-air Attack STA Cost,Tiêu hao thể lực tấn công trên không
lang_multi_text.db,MultiText,SkillDescription_1506012_AttributeName,技能伤害,Skill DMG,Sát thương kỹ năng
lang_multi_text.db,MultiText,SkillDescription_1506015_AttributeName,【镜之环】折射圣辉伤害,Ring of Mirrors: Refracted Holy Light DMG,Sát thương Thánh Huy Khúc Xạ [Kính Chi Hoàn]
lang_multi_text.db,MultiText,SkillDescription_1506015_Description,{0}秒,{0}s,{0} giây
lang_multi_text.db,MultiText,SkillDescription_1506016_AttributeName,夏弥尔之星第一段伤害,Chamuel's Star: Stage 1 DMG,Sát thương Ngôi Sao Của Chamuel đoạn 1
lang_multi_text.db,MultiText,SkillDescription_1506017_AttributeName,夏弥尔之星第二段伤害,Chamuel's Star: Stage 2 DMG,Sát thương Ngôi Sao Của Chamuel đoạn 2
lang_multi_text.db,MultiText,SkillDescription_1506018_AttributeName,夏弥尔之星第三段伤害,Chamuel's Star: Stage 3 DMG,Sát thương Ngôi Sao Của Chamuel đoạn 3
lang_multi_text.db,MultiText,SkillDescription_1506019_AttributeName,冷却时间,Cooldown,Thời gian hồi chiêu
lang_multi_text.db,MultiText,SkillDescription_1506020_AttributeName,技能伤害,Skill DMG,Sát thương kỹ năng
