db_file,table_name,id,zh,en,vi
lang_multi_text.db,MultiText,Main_Rinascita_2_12_77_12,在我看来，人类不需要被拯救……也不应该自救。混乱与无序是这个世界的本质，人们要做的，是变得比世界更加混乱，更加无序。,No souls deserve salvation. Why even try? This world was born from Chaos and exists in disorder. The only winning move... is to be worse. Wilder. To out-chaos the Chaos.,"Theo ta thấy, loài người không cần được cứu rỗi... cũng không nên tự cứu. Hỗn loạn và vô trật tự mới là bản chất thế giới này, con người cần phải trở nên hỗn loạn hơn cả thế giới, vô trật tự hơn cả thế giới."
lang_multi_text.db,MultiText,Main_Rinascita_2_12_77_13,意愿拯救他人的举措，一定会引发混乱……你希望“以毁灭来达成拯救”，而我，则希望“以拯救来毁灭一切”。,"Every noble act of salvation only makes Chaos hungrier. You want to destroy to save, but me... Ha, I want to save to destroy.","Hành động muốn cứu rỗi người khác, chắc chắn sẽ kéo theo hỗn loạn... Ngươi muốn ""hủy diệt để đạt được cứu rỗi"", còn ta, lại muốn ""dùng cứu rỗi để hủy diệt tất cả""."
lang_multi_text.db,MultiText,Main_Rinascita_2_12_77_14,看样子，这个故事让你感到失望了？,You sound disappointed in how this story ends.,"Có vẻ, câu chuyện này khiến ngươi thất vọng rồi?"
lang_multi_text.db,MultiText,Main_Rinascita_2_12_77_15,我可没这么说。我一直很喜欢你编写的那些故事：人们在无边的恐惧中逃窜，在无尽的绝望中挣扎……一切崩塌与失序，都会让我感到无比愉快。,"Did I say that? Your stories have always been a treat. Screaming crowds drowning in despair, a world tearing at the seams... Every collapse, every unraveling... Chefs kiss.","Ta có nói thế đâu. Ta luôn rất thích những câu chuyện ngươi viết: con người chạy trốn trong nỗi sợ vô biên, vùng vẫy trong tuyệt vọng không hồi kết... Mọi sự sụp đổ và mất trật tự, đều khiến ta vô cùng khoái trá."
lang_multi_text.db,MultiText,Main_Rinascita_2_12_77_16,若是他们无法战胜那些困境，也就会走向我所期待的那个结局，走向……永恒的混乱与痛苦。这也是我之所以，愿意与你共事的理由。,"If they cannot overcome the pain, then let them fall straight into the ending I want: an eternity of chaos and suffering. That's why I chose to work with you, dear playwright.","Nếu chúng không thể vượt qua những khốn cảnh ấy, cũng sẽ đi đến cái kết mà ta mong đợi, đi đến... hỗn loạn và đau khổ vĩnh hằng. Đó cũng là lý do ta sẵn lòng hợp tác với ngươi."
lang_multi_text.db,MultiText,Main_Rinascita_2_12_77_17,现在，舞弄人心的执笔之人，你已经和我一样恶贯满盈了。你的终幕，又在哪里呢？,"Speaking of which, Quillbearer who toys with hearts, your sins weigh as heavy as mine. Tell me... where will your ending play out?","Giờ thì, kẻ cầm bút giỏi thao túng lòng người, ngươi đã mang tội nặng nề chẳng kém gì ta rồi. Vậy màn kết của ngươi, ở đâu?"
lang_multi_text.db,MultiText,Main_Rinascita_2_12_77_18,我自己的终幕，已经写在剧本之中了。,It has already been written into the script.,"Màn kết của chính ta, đã được viết sẵn trong kịch bản rồi."
lang_multi_text.db,MultiText,Main_Rinascita_2_12_77_19,但在到达之前，只要我一息尚存，我仍会在舞台上，如一个“幽灵”般不断穿行，去“提醒”人们……要不断展望、磨砺、淬炼自己不熄的灵魂。,"But until I reach it, as long as breath remains in me, I will haunt the stage like a phantom. A reminder... that one must always look forward, sharpen thy self, and temper thy soul.","Nhưng trước khi đến lúc đó, chừng nào ta còn thở, ta vẫn sẽ trên sân khấu, như một ""bóng ma"" không ngừng lướt qua, để ""nhắc nhở"" mọi người... phải luôn hướng về phía trước, mài giũa, tôi luyện ngọn lửa linh hồn không bao giờ tắt."
lang_multi_text.db,MultiText,Main_Rinascita_2_12_77_2,我说，你是怎么想出来那个法子的？甚至能在明庭的眼皮底下，神不知鬼不觉地将我转移走……,"Still, breaking me out right under Mingting's nose without setting off a single alarm... Delicious. Tell me, how did you come up with that little idea?","Nói đi, ngươi nghĩ ra cách đó kiểu gì vậy? Thậm chí còn chuyển ta đi ngay dưới mũi Minh Đình mà không ai hay biết..."
lang_multi_text.db,MultiText,Main_Rinascita_2_12_77_20,那位{PlayerName}还真没说错，你真是一个……残忍而又极端的人。有时我甚至会觉得，你比我还要疯狂。,"Oh, {PlayerName} wasn't wrong about you. You really are a cruel, extreme man. Sometimes I think you might be even more insane than I am.","{PlayerName} nói không sai, ngươi thật sự là một kẻ... tàn nhẫn và cực đoan. Đôi khi ta còn cảm thấy, ngươi điên còn hơn cả ta."
lang_multi_text.db,MultiText,Main_Rinascita_2_12_77_21,疯狂或理智，又或是二者并存……都是「自由意志」的抉择。也只有真正的「自由意志」，才能与那「潮涌的命运」相抗衡。,"Insanity, reason… or something in between... All are choices born of free will. And only through free will can we defy the surging tides of fate.","Điên cuồng hay lý trí, hay cả hai cùng tồn tại... đều là lựa chọn của ""ý chí tự do"". Và chỉ có ""ý chí tự do"" thực sự, mới có thể đối kháng với ""vận mệnh cuồn cuộn"" kia."
lang_multi_text.db,MultiText,Main_Rinascita_2_12_77_22,我们都想改变这种境遇。在「潮涌的命运」之下……没有人，会甘愿只做一个，谦卑的仆人。,That is why we both seek to change it. For beneath such tides... no one is content to remain merely a humble servant.,"Cả ta và ngươi đều muốn thay đổi cảnh ngộ này. Dưới ""vận mệnh cuồn cuộn""... không ai, cam tâm chỉ làm một kẻ hầu khiêm nhường."
lang_multi_text.db,MultiText,Main_Rinascita_2_12_77_23,克里斯托弗，我将鸣式宝石交给了你，现在，你却把它搞丢了。,"You lost the Gem I entrusted to you, Cristoforo.","Cristoforo, ta đã giao viên bảo thạch Minh Thức cho ngươi, giờ ngươi lại để mất nó."
lang_multi_text.db,MultiText,Main_Rinascita_2_12_77_24,但我们真正想要获得的东西，已经牢牢握在了手中。,Forgive me. But haven't we already seized what we truly desired?,"Nhưng thứ mà chúng ta thực sự muốn có, đã nắm chắc trong tay rồi."
lang_multi_text.db,MultiText,Main_Rinascita_2_12_77_25,而且，你已经看到了，即使是<ano=巡游天国>以利维亚坦力量构筑出的彼岸</ano>，也并不稳定，无法与你所追求的完美相称。,"You see, even <ano=Journeying Paradise>the Beyond forged from Leviathan's power</ano> couldn't endure. It fell short of the perfection you long for.","Hơn nữa, ngài cũng đã thấy, ngay cả <ano=Thiên Đường Tuần Du>bờ bên kia được xây dựng từ sức mạnh Leviathan</ano>, cũng không ổn định, không xứng với sự hoàn hảo mà ngài theo đuổi."
lang_multi_text.db,MultiText,Main_Rinascita_2_12_77_26,如果你仍想尝试，我十分愿意效劳。,"But if you wish to try again, I remain at your service.","Nếu ngài vẫn muốn thử, tôi rất sẵn lòng phục vụ."
lang_multi_text.db,MultiText,Main_Rinascita_2_12_77_27,你的体内，还存有多少<ano=利维亚坦>祂</ano>的力量？,"Tell me, how much of <ano=Leviathan>It</ano> remains within you?","Trong người ngươi, còn bao nhiêu sức mạnh của <ano=Leviathan>Ngài</ano>?"
lang_multi_text.db,MultiText,Main_Rinascita_2_12_77_28,不多，但是足够了。,"Not much, but enough to make use of.","Không nhiều, nhưng đủ dùng."
lang_multi_text.db,MultiText,Main_Rinascita_2_12_77_29,……我已经按约定，帮助你完成了终幕。我们的组曲，就在此画上休止符吧。,...I've fulfilled my promise to complete your finale. Let this be the last note of our symphony.,"...Ta đã theo đúng thỏa thuận, giúp ngươi hoàn thành màn kết. Tổ khúc của chúng ta, hãy dừng lại ở đây."
lang_multi_text.db,MultiText,Main_Rinascita_2_12_77_3,嗯……也许是受到了「心之集域」的启发？想象力，永远是人类最强大的武器。,"Let's just say it was inspired by the Somnoire. Imagination, after all, remains humanity's sharpest blade.","Ừm... có lẽ được lấy cảm hứng từ ""Tập Vực Của Tâm""? Trí tưởng tượng, mãi là vũ khí mạnh nhất của loài người."
lang_multi_text.db,MultiText,Main_Rinascita_2_12_77_30,悉听尊便。感谢您的盛情参演，弗洛洛女士。希望您终能如愿，构建出自己的「彼岸」。,"As you wish. My sincerest gratitude for your wonderful performance, Lady Phrolova. May you find the strength to create the Beyond you once envisioned.","Tùy ý ngài. Cảm ơn ngài đã nhiệt tình tham diễn, phu nhân Phrolova. Hy vọng ngài rồi sẽ như nguyện, xây dựng nên ""bờ bên kia"" của riêng mình."
lang_multi_text.db,MultiText,Main_Rinascita_2_12_77_31,……,...,...
lang_multi_text.db,MultiText,Main_Rinascita_2_12_77_32,如果这样的世界真的无法改变，或许我会去寻找新的道路。,"If this world truly cannot change, perhaps I will seek a new path for myself.","Nếu thế giới này thật sự không thể thay đổi, có lẽ ta sẽ đi tìm một con đường mới."
lang_multi_text.db,MultiText,Main_Rinascita_2_12_77_33,呵，没想到这位偏执的大小姐，竟然也懂得了变通。,Huh… who'd've thought someone as stubborn as she would learn to adapt.,"Hừ, không ngờ cô tiểu thư cố chấp ấy, cũng biết linh hoạt rồi."
lang_multi_text.db,MultiText,Main_Rinascita_2_12_77_34,不过，会长啊，就这样放任她自己行事，没问题吗？,"But, Grand Architect, are you really going to let her walk off and do as she pleases?","Nhưng mà, Hội trưởng, cứ để mặc cô ta tự hành động thế, không sao chứ?"
lang_multi_text.db,MultiText,Main_Rinascita_2_12_77_35,就“行事自由，肆意妄为”而言，你可是我们之中，最没道理指责她的那一个。,"Of all of us, you are the last one with any right to judge her for following her whims.","Nói về ""hành động tự do, muốn làm gì thì làm"", ngươi chính là người trong chúng ta ít có tư cách trách cô ấy nhất."
lang_multi_text.db,MultiText,Main_Rinascita_2_12_77_36,怎么没道理？在这方面，我远比她极致纯粹。而且，这可不是指责，我只是想与她同行，为她的乐章再添点修饰罢了。,"Judge? You wound me. I'm far more faithful to my indulgences than she ever was. No, no, no, no, I just want to tag along… and add a few more flourishes to her symphony.","Sao lại không có tư cách? Về khoản này, ta còn thuần túy triệt để hơn cô ấy nhiều. Hơn nữa, đâu phải trách móc, ta chỉ muốn đi cùng cô ấy, thêm chút tô điểm cho nhạc chương của cô ấy thôi."
lang_multi_text.db,MultiText,Main_Rinascita_2_12_77_37,你们还有更重要的事要做。我们的理念如一，彼此的道路或有分歧，但终究殊途同归。暂时地分道而行，也是为了寻找更多的可能。,"There are still greater matters that demand your attention. Though our roads diverge, our ideals remain as one. In the end, they all lead to the same place. Separation is but the prelude to possibility.","Các ngươi còn có việc quan trọng hơn phải làm. Lý tưởng chúng ta là một, con đường có thể khác nhau, nhưng rốt cuộc đều đi đến cùng đích. Tạm chia đường mà đi, cũng là để tìm kiếm thêm nhiều khả năng."
lang_multi_text.db,MultiText,Main_Rinascita_2_12_77_38,一切都是为了，人类最终能够迈入那道……永恒的门扉。,All so that humanity may cross... that final gateway into eternity.,"Tất cả đều là để, nhân loại cuối cùng có thể bước qua cánh cửa... vĩnh hằng ấy."
lang_multi_text.db,MultiText,Main_Rinascita_2_12_77_39,我们在今州和黎那汐塔的目标已经达成。鸣式共鸣者，人造鸣式，以及二次共鸣……我们所掌握的信息与手段，也已经足够。,"Our goals in Jinzhou and Rinascita have been fulfilled. A Threnodian's Resonator, an artificial Threnodian, and a Second Resonance Awakening. We now possess both the knowledge and the means.","Mục tiêu của chúng ta ở Kim Châu và Rinascita đã đạt được. Cộng Hưởng Giả của Minh Thức, Minh Thức nhân tạo, và cộng hưởng lần hai... Thông tin và phương tiện chúng ta nắm giữ, đã đủ dùng."
lang_multi_text.db,MultiText,Main_Rinascita_2_12_77_4,提前在我体内种下黑潮的烙印，待侵蚀蔓延，我坠入黑潮世界的深处，频率也随之融入黑潮……,"As the Dark Tide spread and I was pulled in deeper, the mark of the Dark Tide you left in me allowed my frequency to merge with it...","Gieo sẵn dấu ấn Hắc Triều trong người ta, khi sự xâm thực lan rộng, ta rơi sâu vào thế giới Hắc Triều, tần số cũng hòa vào trong đó..."
lang_multi_text.db,MultiText,Main_Rinascita_2_12_77_40,接下来，该去看看……我们在「拉海洛」的另一项成果了。,Next... it is time we turn our gaze to our accomplishments in Lahai-Roi.,"Tiếp theo, đã đến lúc đi xem... thành quả khác của chúng ta ở ""Lahai-Roi""."
lang_multi_text.db,MultiText,Main_Rinascita_2_12_77_41,在黎那汐塔的某处，残星会的成员们再度聚首……,"Somewhere in Rinascita, the members of the Fractsidus gather once more…","Tại một nơi nào đó ở Rinascita, các thành viên Tàn Tinh Hội lại tề tựu..."
lang_multi_text.db,MultiText,Main_Rinascita_2_12_77_5,然后，我便可以借利维亚坦的力量，在其中“阅读”到你的那些频率，将你在别处“描述”出来。,"Of course. And through Leviathan's power, I was able to ""read"" that frequency and ""depict"" you back into reality.","Sau đó, ta có thể mượn sức mạnh Leviathan, ""đọc"" được tần số của ngươi trong đó, rồi ""phác họa"" ngươi ở một nơi khác."
lang_multi_text.db,MultiText,Main_Rinascita_2_12_77_6,只要掌握了利维亚坦的「融合」力量，现实与想象也可以交融，令虚构之事成为真实。,"Leviathan's power of assimilation blurs the line between imagination and existence, turning fiction into fact.","Chỉ cần nắm được sức mạnh ""dung hợp"" của Leviathan, hiện thực và tưởng tượng cũng có thể hòa quyện, biến hư cấu thành sự thật."
lang_multi_text.db,MultiText,Main_Rinascita_2_12_77_7,不过，前提依然存在，只有等到利维亚坦挣脱岁主的束缚，取回对黑潮的控制，我们的计划才能完成。,"But of course, none of it would have worked until Leviathan slipped the Sentinel's leash and reclaimed the reins of the Dark Tide.","Tuy nhiên, tiền đề vẫn còn đó, chỉ khi Leviathan thoát khỏi sự trói buộc của Tuế Chủ, giành lại quyền kiểm soát Hắc Triều, kế hoạch của chúng ta mới hoàn thành."
lang_multi_text.db,MultiText,Main_Rinascita_2_12_77_8,虽然比我预想中要晚上不少，但情节都没有偏离你的剧本……你为了这场戏，还真是没少费心思。,"It cost more time than I'd have liked, but everything unfolded exactly as you scripted. Such precision. Such devotion... Bravo.","Tuy muộn hơn dự kiến của ta khá nhiều, nhưng diễn biến không đi chệch kịch bản của ngươi... Ngươi quả thật đã dốc không ít tâm sức cho vở diễn này."
lang_multi_text.db,MultiText,Main_Rinascita_2_12_77_9,这是一场试炼。,"A trial, nothing less.",Đây là một cuộc thử luyện.
lang_multi_text.db,MultiText,Main_Rinascita_2_12_78_1,……呵。,...Heh.,...Hừ.
lang_multi_text.db,MultiText,Main_Rinascita_2_12_78_10,"迷雾散去，嘉贝莉娜的身影在道路尽头缓缓浮现。此时的嘉贝莉娜正独自与黑潮造物鏖战，手中猎枪虽被击落，却仍能凭借体术不落下风。
你捡起她的猎枪，扣下扳机，为她打出关键一击，随即来到她的身边，与她如约在“地狱”再度相会。
你们将背后托付给彼此，面对着怪物的包围……无需多言——一人一边。","The mists lift, revealing Galbrena locked in battle with the Tidespawn at the path's end. Her guns are knocked away, but she holds her ground with nothing but skill and grit.

You pick up her guns, fire a shot that turns the tide, and rush to her side. As promised, you meet again in ""hell."" With your backs to each other, you face the encroaching swarm. No words are needed. Together, you fight, each guarding one side.","Sương mù tan dần, bóng dáng Galbrena từ từ hiện ra ở cuối con đường. Lúc này Galbrena đang một mình giao chiến với tạo vật Hắc Triều, khẩu súng săn trong tay tuy bị đánh rơi, nhưng cô vẫn dựa vào thân pháp mà không hề lép vế.
Cậu nhặt khẩu súng săn của cô lên, bóp cò, bắn ra phát đạn quyết định, rồi đến bên cô, đúng hẹn gặp lại cô ở ""địa ngục"".
Hai người giao lưng cho nhau, đối mặt với vòng vây quái vật... không cần nhiều lời - mỗi người một phía."
lang_multi_text.db,MultiText,Main_Rinascita_2_12_78_3,你来了。,You came.,Cậu đến rồi.
lang_multi_text.db,MultiText,Main_Rinascita_2_12_78_4,给。,Yup.,Đây.
lang_multi_text.db,MultiText,Main_Rinascita_2_12_78_5,奇美拉带了个路。,Chimera showed me the way.,Chimera dẫn đường cho tôi.
lang_multi_text.db,MultiText,Main_Rinascita_2_12_78_6,我觉得我枪法不错。,"Not a bad shot, am I?",Tôi thấy tay súng mình cũng khá đấy chứ.
lang_multi_text.db,MultiText,Main_Rinascita_2_12_78_7,没来晚吧？,Hope I'm not too late?,Không đến muộn chứ?
lang_multi_text.db,MultiText,Main_Rinascita_2_12_78_8,不早不晚，刚刚好。,"Not too late, not too early. Right on time.","Không sớm không muộn, vừa đúng lúc."
lang_multi_text.db,MultiText,Main_Rinascita_2_12_78_9,一人一边？,One side each?,Mỗi người một bên?
lang_multi_text.db,MultiText,Main_Rinascita_2_12_79_1,黑潮的戎卫，冥罗督……又见面了。,"The Guardian of the Dark Tide, a Mortarch... We meet again.","Vệ binh Hắc Triều, Minh La Đốc... lại gặp mặt rồi."
lang_multi_text.db,MultiText,Main_Rinascita_2_12_79_2,本想帮你再多清理一些路上的怪物，没想到被它拦了路。,"I tried to clear the path for you, but that thing got in my way.","Tôi định giúp cậu dọn thêm vài con quái trên đường, không ngờ bị nó chặn lại."
lang_multi_text.db,MultiText,Main_Rinascita_2_12_79_3,路上的那些怪物，全都是你一个人解决的？,You handled all the monsters along the way by yourself?,"Mấy con quái trên đường, cậu một mình giải quyết hết sao?"
lang_multi_text.db,MultiText,Main_Rinascita_2_12_79_4,算是吧。只是这里道路太多，瞬息万变，我也无法确定你最后会走哪条。,"More or less. Too many roads led here, and I couldn't be sure which one you'd take.","Coi như vậy. Chỉ là đường ở đây quá nhiều, thay đổi liên tục, tôi cũng không chắc cuối cùng cậu sẽ đi đường nào."
lang_multi_text.db,MultiText,Main_Rinascita_2_12_79_5,但不论你最后要选择哪条路，我都想尽可能地多帮你铲除些阻碍。,"So I wanted to make it easier, whichever way you chose.","Nhưng dù cậu chọn đường nào, tôi đều muốn dọn sạch càng nhiều chướng ngại càng tốt."
lang_multi_text.db,MultiText,Main_Rinascita_2_12_79_6,你已经帮我解决掉不少麻烦了。,You've already helped more than enough.,Cậu đã giúp tôi giải quyết không ít rắc rối rồi.
lang_multi_text.db,MultiText,Main_Rinascita_2_12_79_7,你也一样。有些事，光靠我一个人可办不成。,So have you. There were things I couldn't have done alone.,"Cậu cũng vậy. Có những việc, chỉ mình tôi thì không làm nổi."
lang_multi_text.db,MultiText,Main_Rinascita_2_12_79_8,至于剩下的事……先把眼前的麻烦解决再说。,As for the rest... Let's deal with what's in front of us first.,Còn những chuyện còn lại... giải quyết rắc rối trước mắt đã rồi tính.
lang_multi_text.db,MultiText,Main_Rinascita_2_12_7_10,那些落败的黑潮造物，都被她吸收了……？这是什么力量？！,S-she's absorbing the Tidespawn?! What kind of power is that?!,Những tạo vật Hắc Triều bị đánh bại đều bị cô ấy hấp thụ sao...? Đây là sức mạnh gì vậy?!
lang_multi_text.db,MultiText,Main_Rinascita_2_12_7_2,没想到……我们竟会有与隐海修会并肩作战的一天。,I never thought I'd see the day... fighting side by side with the Order of the Deep.,Không ngờ... chúng ta lại có ngày sát cánh chiến đấu cùng Giáo Đoàn Ẩn Hải.
lang_multi_text.db,MultiText,Main_Rinascita_2_12_7_3,……伙计们，都打起精神来！可不能给七丘丢了份！,"...Onward, comrades! We're not about to shame Septimont now!","...Anh em, tinh thần lên nào! Không được làm mất mặt Septimont!"
lang_multi_text.db,MultiText,Main_Rinascita_2_12_7_5,虽然早对莫塔里家的“异构武装”有所耳闻，但还是第一次这么直观地感受它的火力……,"I've heard of the Montellis' ""Sentry Constructs,"" but seeing that kind of firepower up close is something else...","Dù đã nghe danh ""Vũ Khí Dị Cấu"" của gia tộc Montelli từ lâu, nhưng đây là lần đầu được tận mắt cảm nhận hỏa lực của nó..."
lang_multi_text.db,MultiText,Main_Rinascita_2_12_7_8,“毒药”治愈了伤势……也许翡萨烈……没有传闻中那么阴暗恐怖……,"That ""poison""… it healed me? Maybe the Fisalias aren't as monstrous as they say…","""Thuốc độc"" lại chữa lành vết thương... Có lẽ Fisalia... không đáng sợ như lời đồn..."
lang_multi_text.db,MultiText,Main_Rinascita_2_12_80_1,“因你的爱而闪耀……我们虔诚地团结在一起……”,"""Shining with your love... We stand united in devotion...""","""Tỏa sáng nhờ tình yêu của Ngài... Chúng ta thành kính đoàn kết bên nhau..."""
lang_multi_text.db,MultiText,Main_Rinascita_2_12_80_10,不需要你命令我。,I don't take your orders.,Không cần ngươi ra lệnh cho ta.
lang_multi_text.db,MultiText,Main_Rinascita_2_12_80_11,安静！你们这些卑劣的灵魂，“天国”已没有你们的位置。在地狱里继续沉沦，燃烧自己吧。,"Silence, wretched souls! There is no place for you in Paradise. Burn in your ruin and rot in Hell.","Im đi! Lũ linh hồn hèn hạ, ""Thiên Đường"" không có chỗ cho chúng bay. Cứ tiếp tục chìm đắm trong địa ngục, tự thiêu đốt bản thân đi."
lang_multi_text.db,MultiText,Main_Rinascita_2_12_80_12,奇美拉……似乎在这很有权威。,Seems Chimera still commands some authority here.,Chimera... có vẻ rất có uy quyền ở đây.
lang_multi_text.db,MultiText,Main_Rinascita_2_12_80_13,呵呵……我回到这里，就像回到了家一样。若是论辈数，它们也得尊称我一声……“先祖”。,"Hmph, coming back here feels like coming home. By blood, they ought to call me... Forefather.","Hừ hừ... Ta trở lại đây, giống như trở về nhà vậy. Xét theo thứ bậc, bọn chúng phải gọi ta một tiếng... ""Tiên tổ""."
lang_multi_text.db,MultiText,Main_Rinascita_2_12_80_14,利维亚坦有一点没有说错，唯有恐惧，才是所有造物心中，最古老而又永恒的情感。,Leviathan was right about one thing. Fear is the most ancient and enduring truth in all living things.,"Leviathan có một điều nói đúng, chỉ có nỗi sợ hãi, mới là thứ cảm xúc cổ xưa và vĩnh hằng nhất trong lòng mọi tạo vật."
lang_multi_text.db,MultiText,Main_Rinascita_2_12_80_15,与嘉贝莉娜一同突破黑潮造物的重围，你们终于抵达了“地狱之门”。,"Fighting through more enemies, you and Galbrena finally reach the ""gates of hell.""","Cùng Galbrena phá vỡ vòng vây của tạo vật Hắc Triều, các bạn cuối cùng đã đến được ""cổng địa ngục""."
lang_multi_text.db,MultiText,Main_Rinascita_2_12_80_2,“怀着由衷喜悦的忠诚之心……跟随你的指引……我们自海中上升……”,"""With hearts full of joyous loyalty... we rise from the sea... guided by your light...""","""Mang trái tim trung thành đầy niềm vui chân thành... Đi theo sự dẫn dắt của Ngài... Chúng ta vươn lên từ biển sâu..."""
