db_file,table_name,id,zh,en,vi
lang_multi_text.db,MultiText,SideCSYH_9_9,为什么会有飞廉之猩出现？,Why's that Feilian Beringal in the race?,Sao lại có Phi Liêm Chi Tinh xuất hiện vậy?
lang_multi_text.db,MultiText,SideLLZX_10_1,是谁？你怎么找到这里的！,Who are you? How did you find this place?,Là ai? Ngươi tìm đến đây bằng cách nào!
lang_multi_text.db,MultiText,SideLLZX_10_2,之前劫车的时候也是你？难道说——有叛徒！,You're the one who stopped the last carjacking too! So... we have a traitor!,Lần trước cướp xe cũng là ngươi sao? Chẳng lẽ... có kẻ phản bội!
lang_multi_text.db,MultiText,SideLLZX_11_1,辛苦你了，{PlayerName}！,"Good work, {PlayerName}!","Vất vả rồi, {PlayerName}!"
lang_multi_text.db,MultiText,SideLLZX_11_2,还是没见到你。,I still haven't met you yet.,Vẫn chưa gặp được cậu.
lang_multi_text.db,MultiText,SideLLZX_11_3,这回你该跟我见面，把真相都告诉我了吧？,"You will meet me in person and tell me what's really going on, right?","Lần này cậu nên gặp mặt tôi, rồi kể hết sự thật cho tôi nghe chứ?"
lang_multi_text.db,MultiText,SideLLZX_11_4,没问题，我把坐标发给你，让我当面感谢你的帮助吧！,"Certainly, I'll send you the coordinates. Let me thank you in person.","Không vấn đề gì, tôi sẽ gửi tọa độ cho cậu, để tôi đích thân cảm ơn sự giúp đỡ của cậu!"
lang_multi_text.db,MultiText,SideLLZX_12_1,拉海洛……美不胜收啊。,Lahai-Roi... is breathtaking.,Lahai-Roi... đẹp không sao tả xiết.
lang_multi_text.db,MultiText,SideLLZX_13_1,拉海洛……美不胜收啊。,Lahai-Roi... is breathtaking.,Lahai-Roi... đẹp mê hồn.
lang_multi_text.db,MultiText,SideLLZX_13_10,怎么会，只是感叹拉海洛的风景与过往截然不同了。,Not at all. I'm just reflecting on how different Lahai-Roi looks now compared to the past.,"Không có đâu, chỉ là cảm khái vì phong cảnh Lahai-Roi giờ đã khác xưa quá nhiều rồi."
lang_multi_text.db,MultiText,SideLLZX_13_11,在这样的环境中，出现对传统抱有怀疑，对外界饱含向往的罗伊人也是情有可原。,"In a place like this, it's only natural that some Roya start questioning tradition and yearning for the wider world.","Trong một môi trường như thế này, việc xuất hiện những người Roya hoài nghi truyền thống, khao khát thế giới bên ngoài cũng là điều dễ hiểu."
lang_multi_text.db,MultiText,SideLLZX_13_12,我努力帮助这样的年轻人去和深空联合建立联系，同样，我也想阻止因为这样的向往而误入歧途的。,"I work hard to help young people connect with the Spacetrek Collective—and at the same time, I want to stop their misguided yearnings from leading them down the wrong path.","Tôi nỗ lực giúp những người trẻ như vậy thiết lập liên lạc với Liên Hiệp Thâm Không. Đồng thời, tôi cũng muốn ngăn chặn những ai vì khao khát ấy mà đi lạc đường."
lang_multi_text.db,MultiText,SideLLZX_13_13,因此，我以卧底的身份潜入了伊旺、斯丁格一派流民，取得信任后，透露了一批满载物资的车队信息给他们。,"That's why I went undercover among Yvan and Stinge's Outcasts. After I earned their trust, I passed along information about a fully loaded convoy to them.","Vì vậy, tôi đã nằm vùng trong nhóm lưu dân của Yvan và Stinge. Sau khi lấy được lòng tin, tôi tiết lộ cho chúng thông tin về một đoàn xe chở đầy vật tư."
lang_multi_text.db,MultiText,SideLLZX_13_14,本意是配合深空联合对他们进行打击，没想到你先来一步，不仅效率高于预期，也避免了我方人员伤亡。,"The plan was to deal with them in coordination with the Spacetrek Collective. But you arrived first and moved faster than we expected, sparing our people from casualties.","Bản ý là phối hợp với Liên Hiệp Thâm Không để đánh dẹp bọn chúng, không ngờ cậu lại đến trước một bước. Không chỉ hiệu quả vượt mong đợi mà còn tránh được thương vong cho người của chúng tôi."
lang_multi_text.db,MultiText,SideLLZX_13_15,谢谢你，{PlayerName}，多亏你帮忙，我们的行动完成得十分顺利。,"Thank you, {PlayerName}. Thanks to you, the whole operation went off without a hitch.","Cảm ơn cậu, {PlayerName}. Nhờ có sự giúp đỡ của cậu mà hành động của chúng tôi hoàn thành rất suôn sẻ."
lang_multi_text.db,MultiText,SideLLZX_13_16,不过，恐怕还会有一些组织松散的流民想找运输车队的麻烦，如果你碰到了，就请拔刀相助吧。,"Still, there may still be Outcasts out here looking to cause trouble for the convoy. If you run into them, please help us by using your blade.","Tuy nhiên, e rằng vẫn còn một số lưu dân tổ chức lỏng lẻo muốn gây rối cho đoàn xe vận chuyển. Nếu cậu gặp phải, xin hãy rút kiếm tương trợ."
lang_multi_text.db,MultiText,SideLLZX_13_17,我会的，你也要小心，卧底工作很危险。,"I will. But you be careful too, undercover work is dangerous.","Tôi sẽ thế. Anh cũng cẩn thận, công việc nằm vùng rất nguy hiểm."
lang_multi_text.db,MultiText,SideLLZX_13_18,放心吧，我不是那种崇高到面对危险，会选择自我牺牲的人，情况不对就会离开的。,"Don't worry. I'm not noble enough to throw my life away. If it looks bad, I'll back off.","Yên tâm, tôi không phải kiểu người cao thượng đến mức đối mặt nguy hiểm mà chọn hy sinh bản thân đâu. Tình hình không ổn là tôi rút ngay."
lang_multi_text.db,MultiText,SideLLZX_13_19,（但愿如此吧。）,(Hope so.),(Mong là vậy.)
lang_multi_text.db,MultiText,SideLLZX_13_2,正是在下，{PlayerName}，感谢你铲除了危害拉海洛已久的伊旺、斯丁格一派流民。,"It was always me, {PlayerName}. Thank you for ridding Lahai-Roi of Yvan and Stinge's band of Outcasts; they've plagued us for far too long.","Chính là tại hạ, {PlayerName}. Cảm ơn cậu đã trừ khử nhóm lưu dân của Yvan và Stinge vốn gây hại Lahai-Roi bấy lâu nay."
lang_multi_text.db,MultiText,SideLLZX_13_20,果然是你啊，麦克纳提。,"I knew it was you, Macknay.","Quả nhiên là anh, Macknay."
lang_multi_text.db,MultiText,SideLLZX_13_3,终于见面了。,We meet at last.,Cuối cùng cũng gặp mặt rồi.
lang_multi_text.db,MultiText,SideLLZX_13_4,把事情的原委都说清楚吧。,Time to tell me what's really going on.,Nói rõ đầu đuôi sự việc đi.
lang_multi_text.db,MultiText,SideLLZX_13_5,嗯……{PlayerName}，你看这眼前的景色，有何感想？,"Well then... {PlayerName}, what do you think of the view before us?","Hm... {PlayerName}, cậu nhìn cảnh trước mắt này, có cảm nghĩ gì?"
lang_multi_text.db,MultiText,SideLLZX_13_6,壮阔，魅力，神秘，这些词都很适合拉海洛。,"Majestic, captivating, mysterious... They're all words that befit Lahai-Roi.","Hùng vĩ, quyến rũ, huyền bí... những từ ấy đều rất hợp với Lahai-Roi."
lang_multi_text.db,MultiText,SideLLZX_13_7,的确，拉海洛的自然风光如你所说，但就好比这座深光大桥，现今拉海洛已经处处是深空联合的痕迹。,Lahai-Roi's natural beauty is as you say. But look at Spacetrek–Bjartr Bridge. Signs of the Spacetrek Collective presence are everywhere.,"Đúng vậy, phong cảnh tự nhiên của Lahai-Roi đúng như cậu nói. Nhưng giống như cây cầu Thâm Quang này, giờ đây Lahai-Roi đâu đâu cũng là dấu ấn của Liên Hiệp Thâm Không."
lang_multi_text.db,MultiText,SideLLZX_13_8,研究院悬于天空，星炬学院建于大地，路网更是遍布各处。,"The Research Institute hangs in the sky, Startorch Academy stands on the ground, and roads criss-cross the land.","Viện Nghiên cứu treo lơ lửng trên trời, Học viện Tinh Cự xây dựng trên mặt đất, mạng lưới đường sá thì trải khắp nơi."
lang_multi_text.db,MultiText,SideLLZX_13_9,你反对深空联合的到来？,So you're against the Spacetrek Collective coming here?,Anh phản đối sự xuất hiện của Liên Hiệp Thâm Không sao?
lang_multi_text.db,MultiText,SideLLZX_14_1,（很多学生会经过眶折谷公路北段，如果他们碰上流民就危险了。）,"(Many students travel near the northern section of the Orbit Valley Pass. If they run into Outcasts there, it could be dangerous.)",(Rất nhiều học sinh sẽ đi qua đoạn phía bắc đường cao tốc Khuông Chiết Cốc. Nếu họ chạm trán lưu dân thì nguy hiểm lắm.)
lang_multi_text.db,MultiText,SideLLZX_14_2,（以防万一，去看看公路的情况吧。）,"(I should go check the highway, just in case.)","(Phòng trường hợp xấu, đi kiểm tra tình hình đường cao tốc thôi.)"
lang_multi_text.db,MultiText,SideLLZX_15_1,（深光大桥离浮光林很近了，流民居然敢到那里闹事，不太对劲。）,(The Spacetrek–Bjartr Bridge is close to the Bjartr Woods. If Outcasts have become bold enough to cause trouble there... something's not right.),(Cầu Thâm Quang rất gần Phù Quang Lâm. Lưu dân mà dám đến đó gây rối thì có gì đó không ổn.)
lang_multi_text.db,MultiText,SideLLZX_15_2,（去深光大桥看看，可不能让流民去找浮光林的麻烦。）,(I should head to Spacetrek–Bjartr Bridge. I can't let the Outcasts stir up trouble in the Bjartr Woods.),"(Đến cầu Thâm Quang xem sao, không thể để lưu dân gây rắc rối cho Phù Quang Lâm.)"
lang_multi_text.db,MultiText,SideLLZX_16_1,（好，联系深空联合，让他们来把流民带回去吧。）,(Alright. Time to contact the Spacetrek Collective to have them arrest the Outcasts.,"(Được rồi, liên hệ Thâm Không Liên Hợp, để họ đến đưa bọn lưu dân về đi.)"
lang_multi_text.db,MultiText,SideLLZX_16_2,深空联合的车队很快赶到，将流民押车送走。,A Spacetrek Collective convoy soon arrives and takes the Outcasts away.,"Đoàn xe của Thâm Không Liên Hợp nhanh chóng có mặt, áp giải lưu dân lên xe đưa đi."
lang_multi_text.db,MultiText,SideLLZX_17_1,哇，谢谢你！他们冒出来的时候我都吓死了！还以为人生的日子这就到头了！,"Wow, thank you! They came out of nowhere. I was scared to death. Thought my days were over!","Wow, cảm ơn bạn! Lúc bọn chúng xuất hiện tôi sợ chết khiếp! Còn tưởng đời mình tới đây là hết rồi!"
lang_multi_text.db,MultiText,SideLLZX_17_2,没收到路网管理局的飞讯吗？通知过这里有危险吧。,Didn't you get a message from the Route Network Office? They warned that this place is dangerous.,Không nhận được phi tín từ Cục Quản lý Lộ Võng à? Đã thông báo chỗ này nguy hiểm rồi mà.
lang_multi_text.db,MultiText,SideLLZX_17_3,那时候我已经在路上了！而且一看到这飞讯我就手心冒汗，车都不敢开快了。,"I was already on the road by then! The moment I saw that message my palms started sweating, and I got too scared to drive faster.","Lúc đó tôi đang trên đường rồi! Mà vừa thấy cái phi tín đó là lòng bàn tay đổ mồ hôi, không dám lái nhanh luôn."
lang_multi_text.db,MultiText,SideLLZX_17_4,我也要赶紧走了，不然送货迟到的话要挨骂的，唉……一想到这件事又冒汗了。,"I've gotta get going, or I'll be late with the delivery, and they'll yell at me... Ugh, just thinking about it is making me sweat again.","Tôi cũng phải đi gấp thôi, không thì giao hàng trễ lại bị mắng, haiz... nghĩ đến lại toát mồ hôi rồi."
lang_multi_text.db,MultiText,SideLLZX_17_5,（他胆子真小，但这才能当个安全驾驶的好司机吧。）,"(He's really timid... but maybe that's exactly what makes him a good, safe driver.)","(Anh ta nhát gan thật, nhưng nhờ vậy mới là một tài xế lái xe an toàn được nhỉ.)"
lang_multi_text.db,MultiText,SideLLZX_18_1,嘿！{PlayerName}！,Hey! {PlayerName}!,Này! {PlayerName}!
lang_multi_text.db,MultiText,SideLLZX_18_2,你怎么又在路网管理局通知有危险之后跑出来了？这不是巧合吧？,Why are you out here again right after another warning message from the Route Network Office? That can't just be a coincidence.,Sao cậu lại chạy ra đây ngay sau khi Cục Quản lý Lộ Võng vừa thông báo nguy hiểm thế? Không phải trùng hợp đâu nhỉ?
lang_multi_text.db,MultiText,SideLLZX_18_3,我也觉得这太巧了吧？而且也不知道流民们是怎么知道我们的运输计划的……,"I know, right? It's way too much of a coincidence. And I still don't get how those Outcasts know about our transport schedules...",Tôi cũng thấy trùng hợp quá đi? Mà cũng không hiểu sao bọn lưu dân lại biết được kế hoạch vận chuyển của chúng tôi...
lang_multi_text.db,MultiText,SideLLZX_18_4,难道真是冲着我这个小小的司机来的？不会吧！,"Don't tell me they're actually targeting a nobody driver like me… No way, right?!",Chẳng lẽ thật sự nhắm vào một tài xế quèn như tôi sao? Không thể nào!
lang_multi_text.db,MultiText,SideLLZX_18_5,我会和深空联合谈谈路网安全的问题，不用这么紧张。,I'll talk to the Spacetrek Collective about route network security. You don't need to be so on edge.,"Tôi sẽ trao đổi với Thâm Không Liên Hợp về vấn đề an ninh lộ võng, cậu không cần căng thẳng vậy đâu."
lang_multi_text.db,MultiText,SideLLZX_18_6,是吗？我看你就不是一般人，没想到还能管这些。,"You will? I knew you weren't just some ordinary traveler, didn't expect you to have that kind of pull.","Thật sao? Tôi thấy cậu không phải người bình thường, không ngờ lại quản được cả mấy chuyện này."
lang_multi_text.db,MultiText,SideLLZX_18_7,那我也继续工作了，多谢你拔刀相助！,Then I'll get back to work. Thanks again for swooping in to save me!,"Vậy tôi cũng tiếp tục công việc đây, cảm ơn cậu đã ra tay tương trợ!"
lang_multi_text.db,MultiText,SideLLZX_1_1,本局接到消息，眶折谷公路北段附近疑有流民聚集，道路安全存在隐患，请避开绕行。,Outcast groups sighted near the northern section of the Orbit Valley Pass. Highway security has been compromised. Please take an alternative route.,"Cục nhận được tin báo, khu vực gần đoạn phía bắc đường cao tốc Khuông Chiết Cốc nghi có lưu dân tụ tập, an toàn giao thông tiềm ẩn nguy cơ, xin hãy đi đường vòng."
lang_multi_text.db,MultiText,SideLLZX_2_1,本局接到消息，深光大桥附近疑有流民聚集，道路安全存在隐患，请避开绕行。,Outcast groups sighted near the Spacetrek–Bjartr Bridge. Bridge security has been compromised. Please take an alternative route.,"Cục nhận được tin, gần cầu Thâm Quang nghi có lưu dân tụ tập, an toàn đường bộ tiềm ẩn nguy hiểm, xin hãy đi đường vòng tránh."
lang_multi_text.db,MultiText,SideLLZX_3_1,大家不用慌张，有人来帮我们了！,"Everyone, stay calm! Help's here!","Mọi người đừng hoảng, có người đến giúp chúng ta rồi!"
lang_multi_text.db,MultiText,SideLLZX_4_1,听到了吗？有人来帮我们了，大家放心吧。,You hear that? Someone's come to help us. It's going to be alright.,"Nghe thấy chưa? Có người đến giúp chúng ta rồi, mọi người yên tâm đi."
lang_multi_text.db,MultiText,SideLLZX_5_1,什么情况！我们刚动手就有人来了？,What the--?! Someone's already here? We've only just started!,Cái gì! Chúng ta vừa ra tay đã có người đến rồi sao?
lang_multi_text.db,MultiText,SideLLZX_5_2,别怕，我们人多，一起上！,"Don't panic! We've got the numbers, take 'em together!","Đừng sợ, bọn mình đông hơn, xông lên cùng lúc!"
lang_multi_text.db,MultiText,SideLLZX_6_1,这么快就有人来支援了？只能硬上了！,Backup's here already?! Then we'll just have to force our way through!,Nhanh vậy đã có người đến chi viện rồi sao? Chỉ có thể liều mạng xông lên thôi!
lang_multi_text.db,MultiText,SideLLZX_7_1,辛苦你处理那些拦路的流民了。,Nice work dealing with those Outcasts blocking the road.,Vất vả cho ngươi xử lý đám lưu dân chặn đường rồi.
lang_multi_text.db,MultiText,SideLLZX_7_2,你来得可真快，原本计划里是深空联合的人来支援。,You got there fast. Our plan was for the Spacetrek Collective to sort this out.,"Ngươi đến nhanh thật, theo kế hoạch ban đầu thì người của Thâm Không Liên Hợp sẽ đến hỗ trợ."
lang_multi_text.db,MultiText,SideLLZX_7_3,你是谁？,Who are you?,Ngươi là ai?
lang_multi_text.db,MultiText,SideLLZX_7_4,什么计划？你是谁？,What plan? And who are you?,Kế hoạch gì? Ngươi là ai?
lang_multi_text.db,MultiText,SideLLZX_7_6,{PlayerName}，我们还会再见面的。,"{PlayerName}, we will meet again.","{PlayerName}, chúng ta sẽ còn gặp lại."
lang_multi_text.db,MultiText,SideLLZX_7_7,什么意思？,What do you mean?,Ý ngươi là sao?
lang_multi_text.db,MultiText,SideLLZX_7_8,什么意思？,What do you mean?,Ý ngươi là sao?
lang_multi_text.db,MultiText,SideLLZX_8_1,这次也辛苦你了，{PlayerName}，我说的没错吧？我们又见面了。,"Thanks for your hard work once more, {PlayerName}. Told you we'd meet again, didn't I?","Lần này cũng vất vả cho ngươi rồi, {PlayerName}. Ta nói không sai mà, chúng ta lại gặp nhau rồi."
lang_multi_text.db,MultiText,SideLLZX_8_2,又是你？,You again?,Lại là ngươi?
lang_multi_text.db,MultiText,SideLLZX_8_3,又是你？飞讯来得这么快，就好像你目睹了全程似的。,You again? Your message came through awfully fast... almost like you were watching the whole thing.,"Lại là ngươi? Phi tấn đến nhanh thế, cứ như ngươi đã chứng kiến toàn bộ vậy."
lang_multi_text.db,MultiText,SideLLZX_8_4,呵呵，或许吧。,Mm... maybe.,"Hehe, có lẽ vậy."
lang_multi_text.db,MultiText,SideLLZX_8_5,你有什么目的？,What are you after?,Ngươi có mục đích gì?
lang_multi_text.db,MultiText,SideLLZX_8_6,有什么目的就直说吧，不需要这么遮遮掩掩的。,"If you've got an agenda, just say it. No need to lurk in the shadows.","Có mục đích gì thì cứ nói thẳng, không cần phải giấu giấu giếm giếm thế."
lang_multi_text.db,MultiText,SideLLZX_8_7,我会的，我想很快就会有结果。,I will. I think you'll have my answer soon.,"Ta sẽ nói, ta nghĩ sẽ sớm có kết quả thôi."
lang_multi_text.db,MultiText,SideLLZX_8_8,等下次见面的时候，说不定你已经了解了一切。,"By the time we meet again, you might already know everything.","Đợi đến lần gặp sau, biết đâu ngươi đã hiểu hết mọi chuyện rồi."
lang_multi_text.db,MultiText,SideLLZX_9_1,流民营地照片,Outcast Camp Photo,Ảnh chụp doanh trại lưu dân
lang_multi_text.db,MultiText,SideLLZX_9_2,来这里，但要注意安全。,"Come here, but be careful.","Đến đây đi, nhưng cẩn thận."
lang_multi_text.db,MultiText,SideLLZX_9_3,流民？,Outcasts?,Lưu dân?
lang_multi_text.db,MultiText,SideLLZX_9_4,流民？你怎么拍的？没出事吧？,Outcasts? How did you even get that photo? Are you okay?,Lưu dân? Ngươi chụp bằng cách nào vậy? Không sao chứ?
lang_multi_text.db,MultiText,SidePLJCD_1_1,要回学院找会骑摩托的同学来，还是……,Should I head back to the Academy to find someone who can ride a motorbike? Or...,"Quay về học viện tìm bạn biết chạy xe máy, hay là..."
lang_multi_text.db,MultiText,SidePLJCD_2_1,要回学院找会骑摩托的同学来，还是……,Should I head back to the Academy to find someone who can ride a motorbike? Or...,"Quay về học viện tìm bạn nào biết đi mô tô, hay là..."
lang_multi_text.db,MultiText,SidePLJCD_2_10,你这么一说好像……,Now that you mention it...,Nghe cậu nói vậy thì hình như...
lang_multi_text.db,MultiText,SidePLJCD_2_11,对吧？所以我——咳咳，可不可爱的先放一边，说正事吧。,"Right? That's why I—Ahem! Anyway, enough about how cute they are. Down to business.","Đúng không? Vì thế nên tôi- Khụ khụ, dễ thương hay không thì tạm gác sang một bên, nói chuyện chính đã."
lang_multi_text.db,MultiText,SidePLJCD_2_12,我按导师的建议改良了这台造路悬仪，但是实际启动之后，造出来的路乱七八糟。,"I improved this Route Constructor based on my advisor's suggestions, but… well, when I fired it up, it made a complete mess.","Tôi đã cải tiến cái Tạo Lộ Huyền Nghi này theo gợi ý của giảng viên, nhưng khi thực tế khởi động, con đường tạo ra lộn xộn hết cả."
lang_multi_text.db,MultiText,SidePLJCD_2_13,虽然想采集一下道路数据，可是我不会骑摩托，需要有人帮忙在造出来的路上跑一圈。,"I want to collect data on the new road, but I can't ride a motorbike myself. So I need someone to take a test run.","Tuy muốn thu thập dữ liệu đường sá, nhưng tôi không biết đi mô tô, cần có ai đó giúp chạy một vòng trên con đường vừa tạo."
lang_multi_text.db,MultiText,SidePLJCD_2_14,造路悬仪能自动收集摩托运行的数据，以此计算道路状况。,The Route Constructor automatically retrieves data from the motorbike and calculates the road's condition.,"Tạo Lộ Huyền Nghi có thể tự động thu thập dữ liệu vận hành của mô tô, từ đó tính toán tình trạng đường."
lang_multi_text.db,MultiText,SidePLJCD_2_15,顺便一提，其它的造路悬仪也有同样的功能哦，收集来的数据会自动上传，方便深空联合观测路况。,"Oh, and by the way, all Route Constructors have this function. The data uploads automatically so the Spacetrek Collective can review it.","Nhân tiện, các Tạo Lộ Huyền Nghi khác cũng có chức năng tương tự đấy. Dữ liệu thu thập được sẽ tự động tải lên, tiện cho Thâm Không Liên Hợp quan sát tình trạng đường."
lang_multi_text.db,MultiText,SidePLJCD_2_16,那事情就是这样啦，操作一下造路悬仪就能生成道路啦，能帮我这个忙吗？！,"Anyway, that's the gist of it. Just fire up the Constructor to generate a road. Think you can help me out?!","Thì chuyện là vậy đó, chỉ cần thao tác Tạo Lộ Huyền Nghi là có thể tạo đường rồi. Cậu giúp tôi được không?!"
lang_multi_text.db,MultiText,SidePLJCD_2_17,我来试试。,I'll give it a try.,Để tôi thử xem.
lang_multi_text.db,MultiText,SidePLJCD_2_18,谢谢你，啊，忘了说，一会道路可能会超乎你的想象哦！,Thank you. Oh! I should mention… the road might be a little more… <i>imaginative</i> than you expect.,"Cảm ơn cậu, à, quên chưa nói, lát nữa con đường có thể sẽ vượt ngoài sức tưởng tượng đấy!"
lang_multi_text.db,MultiText,SidePLJCD_2_2,需要帮助吗？,Need help?,Cần giúp đỡ không?
lang_multi_text.db,MultiText,SidePLJCD_2_3,听到骑摩托我就来了。,I overheard you talking about motorcycles.,Nghe thấy đi mô tô là tôi đến liền.
lang_multi_text.db,MultiText,SidePLJCD_2_4,啊，是的，你好，我想找会骑摩托的人帮忙。,"Oh! Yes, hello. I could really use someone who knows how to ride.","À, đúng rồi, xin chào, tôi đang tìm người biết đi mô tô để nhờ giúp đỡ."
lang_multi_text.db,MultiText,SidePLJCD_2_5,啊，你好，我不太敢骑科考摩托，如果方便的话，想请你帮个忙。,"Oh, hello! I'm too afraid to ride one of those expedition bikes. If you've got a moment, could you help?","À, xin chào, tôi không dám đi mô tô khảo sát lắm, nếu tiện thì nhờ cậu giúp một tay được không."
lang_multi_text.db,MultiText,SidePLJCD_2_6,我叫晓春，是造路悬仪同好会的成员，目前正在导师的带领下，研究造路悬仪技术迭代的课题。,"I'm Xiaochun, from the Route Constructor Fan Club. I'm researching the evolution of road construction technology under my advisor's supervision.","Tôi tên Xiaochun, là thành viên câu lạc bộ yêu thích Tạo Lộ Huyền Nghi. Hiện tại đang nghiên cứu đề tài cải tiến công nghệ Tạo Lộ Huyền Nghi dưới sự hướng dẫn của giảng viên."
lang_multi_text.db,MultiText,SidePLJCD_2_7,造路悬仪也有同好会吗？,There's a club for Route Constructors?,Tạo Lộ Huyền Nghi cũng có câu lạc bộ sao?
lang_multi_text.db,MultiText,SidePLJCD_2_8,大家听我这么介绍的时候，反应都跟你一样呢，所以……同好会里目前只有我和妹妹两人。,"Everyone asks that! That's why… right now, it's just my little sister and me.","Mỗi lần tôi giới thiệu như vậy, ai cũng phản ứng giống cậu, cho nên... câu lạc bộ hiện tại chỉ có tôi và em gái thôi."
