db_file,table_name,id,zh,en,vi
lang_multi_text.db,MultiText,ATYDZH_27_9,作为你为我提供载具的小小回报，我来帮你实现愿望吧。,"But since you've been so generous offering yourself to me as a vessel, I'll grant you a wish in return.","Coi như một sự đền đáp nho nhỏ vì ông đã cung cấp vật chứa cho ta, để ta giúp ông thực hiện nguyện vọng nhé."
lang_multi_text.db,MultiText,ATYDZH_27_10,实现……愿望？,A... wish?,Thực hiện... nguyện vọng?
lang_multi_text.db,MultiText,ATYDZH_27_11,在你亲眼观赏到那场角斗之前，我会确保你求死不能。,I'll let you live long enough to see your little duel. So long that you'll be begging for death before the end.,"Trước khi ông tận mắt thưởng thức trận giác đấu đó, ta sẽ đảm bảo ông sống không bằng chết."
lang_multi_text.db,MultiText,ATYDZH_27_12,不要，不要！,No... no!,"Đừng mà, đừng mà!"
lang_multi_text.db,MultiText,ATYDZH_30_1,是我。,…It's me.,Là tôi.
