db_file,table_name,id,zh,en,vi
lang_multi_text.db,MultiText,Chengxiaoshan_main_1_1_161_1,让我出去吧……,"Please, I need to go...",Cho tôi ra ngoài đi...
lang_multi_text.db,MultiText,Chengxiaoshan_main_1_1_161_2,不行大娘，外面太危险了。,"Sorry, ma'am. You must stay here. It's too dangerous.","Không được đâu bác gái, bên ngoài nguy hiểm lắm."
lang_multi_text.db,MultiText,Chengxiaoshan_main_1_1_161_3,我的孩子……她、她被乱流……,My child... She's been... the Temporal Disruption...,"Con của tôi... nó, nó bị dòng chảy rối loạn..."
lang_multi_text.db,MultiText,Chengxiaoshan_main_1_1_161_4,求求你，我要带她回来……,"I'm begging you, please... I need to go save her...","Cầu xin cậu, tôi phải đưa nó về..."
lang_multi_text.db,MultiText,Chengxiaoshan_main_1_1_161_5,……,...,...
lang_multi_text.db,MultiText,Chengxiaoshan_main_1_1_163_1,辛夷以前就与今汐相识吗？,Did Xinyi and Jinhsi know each other?,Tân Di quen biết Jinhsi từ trước sao?
lang_multi_text.db,MultiText,Chengxiaoshan_main_1_1_163_2,今汐尚在襁褓中时，便因共鸣能力被岁主选中，等到年纪稍长就被送往边庭作为岁主的共鸣者培养。,"Jinhsi was chosen as a baby for her Resonance Ability, and raised in City Hall to become the Sentinel's Appointed Resonator.","Khi Jinhsi còn nằm nôi, đã được Tuế Chủ chọn vì năng lực cộng hưởng, đợi đến khi lớn hơn một chút thì được đưa đến Biên Đình để bồi dưỡng thành Cộng Hưởng Giả của Tuế Chủ."
lang_multi_text.db,MultiText,Chengxiaoshan_main_1_1_163_3,所以不仅仅是辛夷大人，供职于边庭的各个仕宦，都或多或少照护、教导过她。,"All the government workers there helped care for and teach her at some point, including Lady Xinyi.","Cho nên không chỉ Tân Di đại nhân, mà các vị quan lại làm việc ở Biên Đình, ít nhiều đều từng chăm sóc, dạy bảo cô ấy."
lang_multi_text.db,MultiText,Chengxiaoshan_main_1_1_163_4,……自幼便被委以重任，哪怕是孩童时，也要收敛天性。现在想想，直至接任令尹，今汐也不过才十几岁。,"She grew up with immense responsibilities, forced to suppress her true nature from a young age. Thinking back, Jinhsi was only a teenage girl when she became the Magistrate...","...Từ nhỏ đã được giao trọng trách, dù là khi còn bé, cũng phải kiềm chế bản tính. Giờ nghĩ lại, cho đến khi tiếp nhận chức Lệnh Doãn, Jinhsi cũng mới chỉ mười mấy tuổi."
lang_multi_text.db,MultiText,Chengxiaoshan_main_1_1_163_5,她所肩负的，是常人难以想象的重担……,She has been burdened with unimaginable weight that most cannot fathom.,"Gánh nặng mà cô ấy phải gánh vác, là thứ mà người thường khó có thể tưởng tượng được..."
lang_multi_text.db,MultiText,Chengxiaoshan_main_1_1_165_1,这里应该就是辛夷说的叩天关了吧。,I assume this is the Truthseeker's Pass Xinyi mentioned.,Nơi này hẳn là Khấu Thiên Quan mà Tân Di đã nói.
lang_multi_text.db,MultiText,Chengxiaoshan_main_1_1_165_10,除非，这份知识是由岁主主动传授……但岁主为何要这么做？,Unless the Sentinel willingly taught them... But why?,"Trừ khi, kiến thức này là do Tuế Chủ chủ động truyền dạy... Nhưng tại sao Tuế Chủ lại làm như vậy?"
lang_multi_text.db,MultiText,Chengxiaoshan_main_1_1_165_11,总之，进入叩天关之后多注意稷廷的物什，说不定能找出一些线索。,We need to focus on items related to the Court of Savantae in Truthseeker's Pass. Maybe we can find some clues there.,"Tóm lại, sau khi vào Khấu Thiên Quan, hãy chú ý đến đồ vật của Tắc Đình, biết đâu có thể tìm ra manh mối gì đó."
