db_file,table_name,id,zh,en,vi
lang_multi_text.db,MultiText,POI_FXZX_12_1,{PlayerName}，多谢你，我的孩子们都回家了。,"Thank you, {PlayerName}. My children have all made it home.","{PlayerName}, cảm ơn cháu, các con của ta đều về nhà rồi."
lang_multi_text.db,MultiText,POI_FXZX_12_10,这也是大个头所希望的——,That's what Chunkie would've wanted.,Đây cũng là điều Bé Bự mong muốn-
lang_multi_text.db,MultiText,POI_FXZX_12_11,对这个世界，以呼嚎致意。,May applause greet this world again.,Gửi đến thế giới này tiếng gầm chào hỏi.
lang_multi_text.db,MultiText,POI_FXZX_12_2,唔嗒，唔嗒嗒，嗒——！,"Woo ta, woo ta ta, ta—","Ư ta, ư ta ta, ta-!"
lang_multi_text.db,MultiText,POI_FXZX_12_3,新的营地也组建了起来。,Our new camp has been rebuilt as well.,Trại mới cũng đã được dựng lên.
lang_multi_text.db,MultiText,POI_FXZX_12_4,无论黑潮将我们的营地推平多少次，只要还有人活着，营地都会重新建起。,"No matter how many times the Dark Tide tears it down, as long as one of us remains standing, it will be rebuilt.","Bất kể Hắc Triều san phẳng trại của chúng ta bao nhiêu lần, chỉ cần còn người sống sót, trại sẽ được xây lại."
lang_multi_text.db,MultiText,POI_FXZX_12_5,那片大个头留下来的羽毛，我加进了营地里猎号的尾羽。,I added the feather Chunkie left behind to the Hornett's tail.,"Chiếc lông vũ mà Bé Bự để lại đó, ta đã gắn vào chùm lông đuôi của tù và trong trại."
lang_multi_text.db,MultiText,POI_FXZX_12_6,猎号的尾羽通常由不同角斗士的羽毛组成——我现在明白了这句话的含义。,"A Hornett's tail is made from the plumes of Gladiator's helmets. Now, I finally understand the significance.",Lông đuôi tù và thường được kết từ lông vũ của các giác đấu sĩ khác nhau-giờ thì ta đã hiểu ý nghĩa của câu nói này.
lang_multi_text.db,MultiText,POI_FXZX_12_7,就算黑潮能抹消我们的智识，我们的形体，也无法抹消我们反击与前进的勇气。,"The Dark Tide may erase our minds, our bodies, but it can never erase our courage to fight back and push forward.","Cho dù Hắc Triều có thể xóa bỏ trí tuệ, hình hài của chúng ta, cũng không thể xóa bỏ dũng khí phản công và tiến lên của chúng ta."
lang_multi_text.db,MultiText,POI_FXZX_12_8,大个头是一位值得尊敬的角斗士。,Chunkie was a Gladiator worth honoring.,Bé Bự là một giác đấu sĩ đáng kính.
lang_multi_text.db,MultiText,POI_FXZX_12_9,无论黑潮重来多少次，我们都会发出呼嚎，全力迎击。,"And no matter how many times the Dark Tide returns, we will rise to meet it, until the applause of triumph echoes through this land once more.","Dù Hắc Triều có quay lại bao nhiêu lần, chúng ta đều sẽ cất tiếng gầm vang, dốc toàn lực nghênh chiến."
lang_multi_text.db,MultiText,POI_FXZX_1_1,该死的黑潮……,Damn the Dark Tide...,Hắc Triều chết tiệt...
lang_multi_text.db,MultiText,POI_FXZX_1_2,嘶……别抱怨了，能活下来就不错了，要是被沾上，就会丧失神志，变成怪物。,"Tsk... Just shut it. Count yourself lucky you're still breathing. Don't let any of that dark slime get on you, or you'll be twisted into a mindless monster.","Xuýt... Đừng than vãn nữa, sống sót được là tốt lắm rồi, nếu bị dính vào thì sẽ mất trí, biến thành quái vật đấy."
lang_multi_text.db,MultiText,POI_FXZX_1_3,到那时候，连抱怨的力气都没有。,Let's see if you'd still have the strength to complain then.,Đến lúc đó thì đến sức để than vãn cũng chẳng còn đâu.
lang_multi_text.db,MultiText,POI_FXZX_20_1,唔……刚刚那个怪物好像有点眼熟？,Hmm... There's something familiar about that monster.,Ưm... con quái vật lúc nãy trông có vẻ quen quen?
lang_multi_text.db,MultiText,POI_FXZX_20_2,算了，管它什么怪物，吹响猎号，通通打倒就完事了！,Doesn't matter. I'll take 'em down just the same once the horns go off.,"Thôi kệ nó là quái vật gì, thổi tù và lên, đánh bại hết là xong!"
lang_multi_text.db,MultiText,POI_FXZX_21_1,好疼……,"Ugh, it hurts...",Đau quá...
lang_multi_text.db,MultiText,POI_FXZX_22_1,唔嗒……唔嗒嗒……,Woo ta... Woo ta ta...,Ư ta... ư ta ta...
lang_multi_text.db,MultiText,POI_FXZX_23_1,唔嗒，唔嗒嗒嗒——！,Woo ta! Woo ta ta ta—,"Ư ta, ư ta ta ta-!"
lang_multi_text.db,MultiText,POI_FXZX_24_1,你刚拉开巨石，一个棕黄色的影子飞快地窜了出去。,"As you push the huge stone aside, a brownish shadow darts out.","Bạn vừa đẩy tảng đá lớn ra, một cái bóng màu nâu vàng vụt chạy ra ngoài."
lang_multi_text.db,MultiText,POI_FXZX_24_2,你敏锐地发现，巨石旁散落着些毛发。,A tuft of fur left behind catches your eye.,"Bạn tinh ý phát hiện, bên cạnh tảng đá lớn có vương vãi một ít lông."
lang_multi_text.db,MultiText,POI_FXZX_25_1,嗒嗒开！！！,Ta ta ka!!!,Ta ta kai!!!
lang_multi_text.db,MultiText,POI_FXZX_26_1,呜……嘶，谢、谢谢嗒！,"Woo... hmm, t-thank you, ta!","Ư... đau, cảm, cảm ơn ta!"
lang_multi_text.db,MultiText,POI_FXZX_26_2,为什么受了这么重的伤，还要继续战斗？,That's a serious wound. You shouldn't be fighting like this.,Sao bị thương nặng thế này mà vẫn tiếp tục chiến đấu?
lang_multi_text.db,MultiText,POI_FXZX_26_3,为、为了把大个头带回去嗒！,T-to bring Chunkie back!,"Để, để đưa Bé Bự về ta!"
lang_multi_text.db,MultiText,POI_FXZX_26_4,小不点连连喘气，看起来伤得不轻。但它还是跃跃欲试，想继续往前冲。,"Teeny wheezes softly, clearly injured. But its wounds don't dampen its spirit. It looks ready to charge forward again.","Bé Hạt Tiêu thở hổn hển liên tục, trông có vẻ bị thương không nhẹ. Nhưng nó vẫn háo hức muốn xông lên phía trước."
lang_multi_text.db,MultiText,POI_FXZX_26_5,别冲动，先回营地包扎下吧。身体恢复了才能更好地完成你想做的事。,Easy now. Just head back to camp and get patched up first. You'll need your strength to do what you came here for.,"Đừng kích động, về trại băng bó trước đã. Khỏe lại rồi mới có thể làm tốt việc mình muốn làm chứ."
lang_multi_text.db,MultiText,POI_FXZX_26_6,唔……好吧。已经找到大个头的下落了，先回去和阿克托斯爷爷报个平安嗒。,Woo… Okay. Teeny knows where Chunkie is. Teeny should see Arctos first!,"Ưm... được thôi. Đã tìm thấy tung tích của Bé Bự rồi, về báo bình an với ông nội Arctos trước ta."
lang_multi_text.db,MultiText,POI_FXZX_27_1,听说了吗，阿克托斯家的两个孩子真是好汉啊。,Did you hear about Arctos's children? Such bravery.,"Nghe nói chưa, hai đứa con nhà Arctos đúng là hảo hán đấy."
lang_multi_text.db,MultiText,POI_FXZX_27_2,嗯，这猎号吹起来，听着更有力量了。,Indeed. The Hornett's been blaring louder than ever.,"Ừ, tiếng tù và này vang lên, nghe càng thêm mạnh mẽ."
lang_multi_text.db,MultiText,POI_FXZX_27_3,每次听到，我都不由地下定决心——要好好守护大家才行。,"Every time I hear it, it strengthens my resolve to protect those around me.","Mỗi lần nghe thấy, tôi đều không kìm được mà hạ quyết tâm-phải bảo vệ mọi người thật tốt mới được."
lang_multi_text.db,MultiText,POI_FXZX_28_1,新猎号听着得劲啊，令人热血沸腾！,The new Hornett sounds amazing! It really gets the blood pumping!,"Tiếng tù và mới nghe đã thật, làm người ta nhiệt huyết sục sôi!"
lang_multi_text.db,MultiText,POI_FXZX_28_2,无论黑潮重来多少次，我们都会发出呼嚎，全力迎击！,"No matter how many times the Dark Tide returns, we will rise to meet it, until the applause of triumph echoes through this land once more!","Dù Hắc Triều có quay lại bao nhiêu lần, chúng ta đều sẽ cất tiếng gầm vang, dốc toàn lực nghênh chiến!"
lang_multi_text.db,MultiText,POI_FXZX_28_3,诶，别那么好斗，黑潮还是不来为好。,"Hey, don't get too eager. I'd prefer the Dark Tide never return!","Này, đừng hiếu chiến thế chứ, Hắc Triều tốt nhất là đừng đến thì hơn."
lang_multi_text.db,MultiText,POI_FXZX_28_4,不过这猎号声嘛，听着干活都更有劲儿了。,"Still, that Hornett really does set you up in the mood for work.","Nhưng mà tiếng tù và này á, nghe xong làm việc cũng hăng hái hơn hẳn."
lang_multi_text.db,MultiText,POI_FXZX_28_5,是啊，大家一起把营地好好重建起来！,Yeah! Let's rebuild this camp together!,"Đúng thế, mọi người cùng nhau xây dựng lại trại thật tốt nào!"
lang_multi_text.db,MultiText,POI_FXZX_2_1,年轻人，请留步……,"Hold a moment, young warrior...","Người trẻ tuổi, xin dừng bước..."
lang_multi_text.db,MultiText,POI_FXZX_2_10,我昏倒前见到，孩子最后的身影，是往铁门那边去了。,"Before I fainted, I last saw my children running toward the iron gates.","Trước khi ngất đi, ta thấy bóng dáng cuối cùng của lũ trẻ là chạy về phía cổng sắt."
lang_multi_text.db,MultiText,POI_FXZX_2_2,老头子有个羞于启齿，又不得不开口的请求。,"It shames me to ask this of you, but… I don't know who else to turn to.","Lão già này có một thỉnh cầu khó nói, nhưng lại không thể không mở lời."
lang_multi_text.db,MultiText,POI_FXZX_2_3,能否拜托你帮我找到孩子？,Could you help me find my children?,Có thể nhờ cháu giúp ta tìm lũ trẻ không?
lang_multi_text.db,MultiText,POI_FXZX_2_4,黑潮肆虐，吞噬了不少无辜的生灵。那些昏了头的家伙们把营地弄成了这样。,The Dark Tide ravages everything in its path. So many innocent lives lost. And the ones who went mad turned the camp upside down.,"Hắc Triều hoành hành, nuốt chửng biết bao sinh linh vô tội. Những kẻ mất trí đó đã khiến trại ra nông nỗi này."
lang_multi_text.db,MultiText,POI_FXZX_2_5,营地到处都是抓痕，朋友们倒下，孩子失去踪迹，而我身受重伤，无能为力。,"See the claw marks around camp? My friends, fallen. My children, missing. And I... I can't lift a sword with these injuries.","Trong trại đầy rẫy vết cào xước, bạn bè ngã xuống, lũ trẻ mất tích, còn ta thì trọng thương, lực bất tòng tâm."
lang_multi_text.db,MultiText,POI_FXZX_2_6,有时候真憎恨自己的老迈……也不知道是时间还是黑潮，让我如此乏力，只能停留在原地。,Sometimes I hate these old bones of mine... I don't even know whether it's the Dark Tide or just the weight of years that's made me this useless.,"Đôi khi thật căm ghét sự già nua của mình... Cũng chẳng biết là do thời gian hay Hắc Triều, khiến ta yếu ớt thế này, chỉ có thể giậm chân tại chỗ."
lang_multi_text.db,MultiText,POI_FXZX_2_7,好的。,I'll help you find your children.,Được ạ.
lang_multi_text.db,MultiText,POI_FXZX_2_8,没问题，交给我吧。,Don't worry. Leave it to me.,"Không thành vấn đề, cứ giao cho tôi."
lang_multi_text.db,MultiText,POI_FXZX_2_9,谢谢你，年轻人总是充满勇气。,Thank you. Young people like you always have such courage.,"Cảm ơn cháu, người trẻ tuổi luôn tràn đầy dũng khí."
lang_multi_text.db,MultiText,POI_FXZX_30_1,灾厄的气息……,I sense something dangerous...,Hơi thở của tai ương...
lang_multi_text.db,MultiText,POI_FXZX_31_1,那边营地发生什么事了？,What happened at that camp over there?,Bên trại kia xảy ra chuyện gì vậy?
lang_multi_text.db,MultiText,POI_FXZX_31_2,一片压抑的黑色，难闻的、灾厄的气息……,"I can sense it. Something dark, filthy, and dangerous...","Một màu đen đè nén, mùi khó ngửi, hơi thở của tai ương..."
lang_multi_text.db,MultiText,POI_FXZX_31_3,很急，但又没办法，这边的营地需要我……,"It feels urgent, but I've still got things to take care of here...","Rất gấp, nhưng lại chẳng có cách nào, trại bên này cần tôi..."
lang_multi_text.db,MultiText,POI_FXZX_31_4,别急，我替你看看去。,Don't worry. I'll go check it out.,"Đừng vội, để tôi đi xem giúp bạn."
lang_multi_text.db,MultiText,POI_FXZX_32_1,嗯？黑色的灾厄消失了。,Hmm... looks like the danger has passed.,Hửm? Tai ương đen tối biến mất rồi.
lang_multi_text.db,MultiText,POI_FXZX_33_1,那边的事情好像解决了，是你帮的忙吗？,Looks like the danger has passed. Did you take care of it?,"Chuyện bên đó hình như giải quyết xong rồi, là bạn giúp đỡ sao?"
lang_multi_text.db,MultiText,POI_FXZX_33_2,是的，就是我。,"Yeah, that was me.","Đúng vậy, chính là tôi."
lang_multi_text.db,MultiText,POI_FXZX_33_3,可能是一般路过无名英雄吧。,I'm just a passerby lending a hand.,Chắc là người hùng vô danh nào đó đi ngang qua thôi.
lang_multi_text.db,MultiText,POI_FXZX_33_4,多谢你啦。,Thank you so much.,Cảm ơn bạn nhiều nha.
lang_multi_text.db,MultiText,POI_FXZX_33_5,谦虚啦。,You're too modest.,Khiêm tốn quá rồi.
lang_multi_text.db,MultiText,POI_FXZX_33_6,远远看去，大家正忙着重建营地呢。,I see everyone working hard to rebuild the camp.,"Nhìn từ xa, mọi người đang bận rộn xây dựng lại trại đấy."
lang_multi_text.db,MultiText,POI_FXZX_33_7,精神头瞧着不错。,They look full of spirit.,Tinh thần trông có vẻ khá tốt.
lang_multi_text.db,MultiText,POI_FXZX_33_8,我可以放下心来，专心守护脚下这个营地了。,That puts my mind at ease. Now I can focus on guarding this place.,"Tôi có thể yên tâm rồi, chuyên tâm bảo vệ trại dưới chân mình thôi."
lang_multi_text.db,MultiText,POI_FXZX_3_1,唔嗒嗒……唔嗒……嗒嗒！,Woo ta ta... Woo ta... Ta ta!,Ư ta ta... ư ta... ta ta!
lang_multi_text.db,MultiText,POI_FXZX_3_10,唔，獭没见过有人路过这里嗒，外面很危险，有大怪物嗒。,Woo. Wootter sees no one. Very dangerous out there. Big monster!,"Ưm, Tái chưa thấy ai đi qua đây cả ta, bên ngoài nguy hiểm lắm, có quái vật lớn ta."
lang_multi_text.db,MultiText,POI_FXZX_3_11,獭和小伙伴，为了保护营地，在外面探查嗒。獭受伤了，留在这里嗒。,Wootter and friends protect camp and search outside. Wootter hurt. Must stay here.,"Tái và các bạn, để bảo vệ trại, đang thám thính bên ngoài ta. Tái bị thương rồi, ở lại đây ta."
lang_multi_text.db,MultiText,POI_FXZX_3_12,前面还有一些小伙伴，或许可以帮到你嗒。,But Wootter's friends ahead. They help you!,"Phía trước còn có mấy bạn nhỏ nữa, có lẽ có thể giúp được bạn ta."
lang_multi_text.db,MultiText,POI_FXZX_3_13,呜獭獭一边说着，一边掏出一撮毛毛交给你。,The Wootter plucks some fur from its body and offers it to you.,"Vừa nói, Ư Tái Tái vừa móc ra một nhúm lông đưa cho bạn."
lang_multi_text.db,MultiText,POI_FXZX_3_14,沿着毛毛的味道，就能找到它们啦。,Follow the scent. It leads you to them!,Lần theo mùi của lông là có thể tìm thấy các bạn ấy thôi.
lang_multi_text.db,MultiText,POI_FXZX_3_2,小布小布，呼叫骸译员小布。,"Abby, Echo interpretation service, please.","Abby Abby, gọi phiên dịch viên Thanh Hài Abby."
lang_multi_text.db,MultiText,POI_FXZX_3_3,您的骸译员小布已上线~唔嗯嗯……这次就试试最新的情感拟人翻译吧！,"Roger that! Your five-star Echo interpreter, at your service! Ahem... Let's try out my new emotional-adaptive mode!",Phiên dịch viên Thanh Hài Abby của bạn đã trực tuyến~ Ưm hừm... lần này thử chức năng dịch thuật mô phỏng cảm xúc mới nhất nhé!
lang_multi_text.db,MultiText,POI_FXZX_3_4,滴——骸译系统已挂载，小布持续后台待命中……,Beep—loading complete! Standing by for interpretation request...,"Tít-Hệ thống dịch Thanh Hài đã kết nối, Abby tiếp tục chờ lệnh chạy ngầm..."
lang_multi_text.db,MultiText,POI_FXZX_3_5,在骸译系统的帮助下，呜獭獭唔嗒嗒的叫声被翻译成了清晰完整的话语。,"Thanks to Abby, you can now understand what the Wootter is saying.","Với sự trợ giúp của hệ thống dịch Thanh Hài, tiếng kêu ư ta ta của Ư Tái Tái đã được dịch thành những câu từ rõ ràng hoàn chỉnh."
lang_multi_text.db,MultiText,POI_FXZX_3_6,唔，大人，前方危险嗒！,Woo! Danger ahead!,"Ư, đại nhân, phía trước nguy hiểm ta!"
lang_multi_text.db,MultiText,POI_FXZX_3_7,我要去找人。,I'm looking for someone.,Tôi muốn đi tìm người.
lang_multi_text.db,MultiText,POI_FXZX_3_8,你有见到孩子路过这里吗？,Have you seen any children come this way?,Bạn có thấy đứa trẻ nào đi qua đây không?
lang_multi_text.db,MultiText,POI_FXZX_3_9,骸译系统将你的话语传达给了呜獭獭，它圆滚滚的小脑袋上露出了有些为难的表情。,Abby relays your words to the Wootter. Its chubby face scrunches up in confusion.,"Hệ thống dịch Thanh Hài truyền đạt lời của bạn cho Ư Tái Tái, cái đầu tròn vo của nó lộ vẻ hơi khó xử."
lang_multi_text.db,MultiText,POI_FXZX_4_1,地上散落着大量毛发，似乎发生过激烈的争斗。,"Judging by the tufts of fur scattered on the ground, a fierce fight must've taken place here.","Trên mặt đất vương vãi rất nhiều lông, dường như đã xảy ra một cuộc tranh đấu kịch liệt."
lang_multi_text.db,MultiText,POI_FXZX_4_2,事态严峻了起来，你赶紧继续向前走。,"Sensing the urgency, you press on without delay.","Tình hình trở nên nghiêm trọng, bạn vội vàng tiếp tục đi về phía trước."
lang_multi_text.db,MultiText,POI_FXZX_5_1,唔！,Woo!,Ư!
lang_multi_text.db,MultiText,POI_FXZX_5_2,嗒，嗒嗒！！,Ta! Ta ta!!,"Ta, ta ta!!"
lang_multi_text.db,MultiText,POI_FXZX_5_3,嗒嗒开！！！,Ta ta ka!!,Ta ta kai!!!
lang_multi_text.db,MultiText,POI_FXZX_6_1,小布小布，呼叫骸译员小布。,"Interpret that, please, Abby.","Abby Abby, gọi phiên dịch viên Thanh Hài Abby."
lang_multi_text.db,MultiText,POI_FXZX_6_10,外面这么危险，没有人类小孩会跑出来玩的嗒。,Too dangerous. No human children would play here...,"Bên ngoài nguy hiểm thế này, không có đứa trẻ loài người nào chạy ra chơi đâu ta."
lang_multi_text.db,MultiText,POI_FXZX_6_11,唔嗒嗒嗒嗒——！小不点在哪？小不点没跟上吗——！,Woo ta ta ta—! Teeny! Where's Teeny?! Teeny not with us!,Ư ta ta ta ta-! Bé Hạt Tiêu đâu? Bé Hạt Tiêu không theo kịp sao-!
lang_multi_text.db,MultiText,POI_FXZX_6_12,阿克托斯家的獭——小不点？糟了嗒，不会被黑潮怪物追上了嗒？,Teeny... Arctos's Teeny? Did monsters get Teeny?!,"Tái nhà Arctos-Bé Hạt Tiêu á? Nguy to rồi ta, không lẽ bị quái vật Hắc Triều đuổi kịp rồi ta?"
lang_multi_text.db,MultiText,POI_FXZX_6_13,大人，求求你救救小不点嗒！,Save Teeny! Help us! Pleeeassse!,"Đại nhân, cầu xin ngài cứu Bé Hạt Tiêu với ta!"
lang_multi_text.db,MultiText,POI_FXZX_6_14,（这里只有呜獭獭，根本没有人类小孩……等等，小不点是阿克托斯家的呜獭獭，该不会就是他的孩子吧？）,"(They said they didn't see any human children. Could this Wooter ""Teeny"" be one of the children Arctos is looking for?)","(Ở đây chỉ có Ư Tái Tái, hoàn toàn không có đứa trẻ loài người nào... Khoan đã, Bé Hạt Tiêu là Ư Tái Tái nhà Arctos, chẳng lẽ đó chính là đứa con mà ông ấy nói sao?)"
lang_multi_text.db,MultiText,POI_FXZX_6_15,（等找到小不点就知道了。）,(Only one way to find out.),(Đợi tìm thấy Bé Hạt Tiêu rồi sẽ biết.)
lang_multi_text.db,MultiText,POI_FXZX_6_16,好的，我去找小不点。,"Okay, I'll go find Teeny.","Được rồi, tôi sẽ đi tìm Bé Hạt Tiêu."
lang_multi_text.db,MultiText,POI_FXZX_6_17,谢谢嗒！大人真是大好人嗒！,"Thank you, woo! You a good human!",Cảm ơn ta! Đại nhân đúng là người tốt bụng ta!
lang_multi_text.db,MultiText,POI_FXZX_6_2,您的骸译员小布持续待命中——,Interpreting—,Phiên dịch viên Thanh Hài Abby của bạn tiếp tục chờ lệnh-
lang_multi_text.db,MultiText,POI_FXZX_6_3,唔，吓死獭了嗒！,Woo! So scary!,"Ư, làm Tái sợ chết khiếp ta!"
lang_multi_text.db,MultiText,POI_FXZX_6_4,谢谢大人嗒！,Thank you!,Cảm ơn đại nhân ta!
lang_multi_text.db,MultiText,POI_FXZX_6_5,呼……要是被黑潮怪物侵蚀，獭也会变得那么可怕的嗒……,Whew... If Dark Tide monsters hurt Wootter... Wootter will turn scary too...,"Phù... nếu bị quái vật Hắc Triều xâm chiếm, Rái Cá cũng sẽ trở nên đáng sợ như vậy ư..."
lang_multi_text.db,MultiText,POI_FXZX_6_6,獭才不要变成那样嗒！！！,No! Wootter no want to turn into big scary monster!,Tái không muốn biến thành như vậy đâu ta!!!
lang_multi_text.db,MultiText,POI_FXZX_6_7,请问你们有见过一个孩子么？,"Excuse me, have you seen any children around?",Cho hỏi các bạn có thấy một đứa trẻ nào không?
lang_multi_text.db,MultiText,POI_FXZX_6_8,孩子？人类的孩子吗？獭没有见过嗒。,Children? Human children? Wootter sees no children.,Trẻ con? Trẻ con loài người hả? Tái chưa thấy bao giờ ta.
lang_multi_text.db,MultiText,POI_FXZX_6_9,这里只有怪物和獭，没有人类小孩嗒。,Only Wootters and monsters here. No human children.,"Ở đây chỉ có quái vật và Tái thôi, không có trẻ con loài người ta."
lang_multi_text.db,MultiText,POI_FXZX_8_1,没事吧，小不点？,"Are you alright, Teeny?","Không sao chứ, Bé Hạt Tiêu?"
lang_multi_text.db,MultiText,POI_FXZX_8_10,阿克托斯看到了受伤的小不点，心疼地为它包扎。,"Back at the camp, Arctos notices Teeny's wounds and tends to them.","Arctos nhìn thấy Bé Hạt Tiêu bị thương, đau lòng băng bó cho nó."
lang_multi_text.db,MultiText,POI_FXZX_8_2,没大事嗒，可还是没能带回大个头……,"No worry, ta! But... Chunkie still out there...","Không sao đâu ta, nhưng mà vẫn chưa đưa được Bé Bự về..."
lang_multi_text.db,MultiText,POI_FXZX_8_3,没关系的，小不点没也被黑潮吞噬就已经很不错了。,"It's okay, Teeny. I'm just glad you made it back safely.","Không sao đâu, Bé Hạt Tiêu không bị Hắc Triều nuốt chửng là đã tốt lắm rồi."
