db_file,table_name,id,zh,en,vi
lang_multi_text.db,MultiText,Flow_313700000_27,维里奈惊喜地凑到你身边，惊叹着这也许是什么生命的奇迹。,"Surprised, Verina comes close to you and exclaims that this is life's miracle.","Verina ngạc nhiên ghé sát lại gần bạn, thốt lên rằng đây có lẽ là một phép màu của sự sống."
lang_multi_text.db,MultiText,Flow_313700000_28,这是……送给我的生日礼物吗，这样的话……生日蛋糕我就不用一个人吃完了。,Is this... my birthday gift? Then I don't have to eat up the whole cake alone.,Đây là... quà sinh nhật tặng em sao? Nếu vậy thì... em sẽ không phải ăn bánh sinh nhật một mình nữa rồi.
lang_multi_text.db,MultiText,Flow_313700000_29,她吹灭了蜡烛，将蛋糕整齐切好，分给了她眼中的玩偶们，你看着眼前的蛋糕和她一起默念……,"She blows out the candles, cuts the cake into neat slices, and presents them to the dolls around her. Looking at the cake, you join her in silently wishing...","Cô bé thổi tắt nến, cắt bánh gọn gàng rồi chia cho những con thú bông trong mắt cô bé, bạn nhìn chiếc bánh trước mặt và cùng cô thầm ước..."
lang_multi_text.db,MultiText,Flow_313700000_30,维里奈，生日快乐！,"Happy birthday, Verina!","Verina, chúc mừng sinh nhật!"
lang_multi_text.db,MultiText,Flow_313700000_31,少女一改被困时的柔弱，收起诱人的美玉，将手中的龙须酥掰成两半，送给了你一半。,"The girl no longer looks fragile like when she was trapped. She puts away the tempting jade, splits her Loong Whiskers Crisp in half, and offers you a piece.","Cô gái không còn vẻ yếu đuối như khi bị vây khốn, cô cất đi miếng ngọc bội mê người, bẻ đôi chiếc bánh Râu Rồng trên tay và đưa cho bạn một nửa."
lang_multi_text.db,MultiText,Flow_313700000_32,离开这儿吧，你没有“他们”身上的味道，路还很长，这个就当作我的谢礼了。,"You should leave here. You don't smell like ""them."" Take this as a token of my gratitude, and I wish you a safe journey.","Rời khỏi đây đi, trên người ngài không có mùi của ""bọn họ"", đường còn dài, cái này coi như quà cảm ơn của tôi."
lang_multi_text.db,MultiText,Flow_313700000_33,你将两块龙须酥笨拙地重新拼在了一起，逗得她嫣然一笑。,You clumsily piece together the two halves of the Loong Whiskers Crisp. She is amused.,"Bạn vụng về ghép hai nửa bánh Râu Rồng lại với nhau, khiến cô ấy bật cười tươi tắn."
lang_multi_text.db,MultiText,Flow_313700000_34,互相照应……有时候也还不错。,Sticking together... That seems nice.,Hỗ trợ lẫn nhau... đôi khi cũng không tệ.
