db_file,table_name,id,zh,en,vi
lang_multi_text.db,MultiText,RiskHarvest_buffDesc_1230,攻击力提升{0}。,ATK is increased by {0}.,Tấn công tăng {0}.
lang_multi_text.db,MultiText,RiskHarvest_buffDesc_1231,暴击提升{0}。,Crit. Rate is increased by {0}.,Tỉ lệ bạo kích tăng {0}.
lang_multi_text.db,MultiText,RiskHarvest_buffDesc_1232,暴击伤害提升{0}。,Crit. DMG is increased by {0}.,Sát thương bạo kích tăng {0}.
lang_multi_text.db,MultiText,RiskHarvest_buffDesc_1233,普攻伤害加成提升{0}。,Basic DMG Bonus is increased by {0}.,Bonus sát thương Đánh Thường tăng {0}.
lang_multi_text.db,MultiText,RiskHarvest_buffDesc_1234,重击伤害加成提升{0}。,Heavy DMG Bonus is increased by {0}.,Bonus sát thương Đánh Mạnh tăng {0}.
lang_multi_text.db,MultiText,RiskHarvest_buffDesc_1235,共鸣技能伤害加成提升{0}。,Resonance Skill DMG Bonus is increased by {0}.,Bonus sát thương Kỹ Năng Cộng Hưởng tăng {0}.
lang_multi_text.db,MultiText,RiskHarvest_buffDesc_1236,共鸣解放伤害加成提升{0}。,Resonance Liberation DMG Bonus is increased by {0}.,Bonus sát thương Giải Phóng Cộng Hưởng tăng {0}.
lang_multi_text.db,MultiText,RiskHarvest_buffDesc_1237,共鸣效率提升{0}。,Energy Regen is increased by {0}.,Hiệu suất cộng hưởng tăng {0}.
lang_multi_text.db,MultiText,RiskHarvest_buffDesc_1238,冷凝伤害加成提升{0}。,Glacio DMG Bonus is increased by {0}.,Bonus sát thương Ngưng Băng tăng {0}.
lang_multi_text.db,MultiText,RiskHarvest_buffDesc_1239,热熔伤害加成提升{0}。,Fusion DMG Bonus is increased by {0}.,Bonus sát thương Hỏa Liệt tăng {0}.
lang_multi_text.db,MultiText,RiskHarvest_buffDesc_1240,导电伤害加成提升{0}。,Electro DMG Bonus is increased by {0}.,Bonus sát thương Điện Từ tăng {0}.
lang_multi_text.db,MultiText,RiskHarvest_buffDesc_1241,气动伤害加成提升{0}。,Aero DMG Bonus is increased by {0}.,Bonus sát thương Khí Động tăng {0}.
lang_multi_text.db,MultiText,RiskHarvest_buffDesc_1242,衍射伤害加成提升{0}。,Spectro DMG Bonus is increased by {0}.,Bonus sát thương Quang Phổ tăng {0}.
lang_multi_text.db,MultiText,RiskHarvest_buffDesc_1243,湮灭伤害加成提升{0}。,Havoc DMG Bonus is increased by {0}.,Bonus sát thương Hủy Diệt tăng {0}.
lang_multi_text.db,MultiText,RiskHarvest_buffDesc_13,dnt/全队暴击率增加10%,Increase Crit. Rate by 10% for all team members.,dnt/Tăng tỷ lệ bạo kích 10% cho cả đội
lang_multi_text.db,MultiText,RiskHarvest_buffDesc_14,dnt/全队暴击伤害增加20%,Increase Crit. DMG by 20% for all team members.,dnt/Tăng sát thương bạo kích 20% cho cả đội
lang_multi_text.db,MultiText,RiskHarvest_buffDesc_151,角色处于冲刺状态时，全队每秒回复{0}点共鸣能量。,"When dashing, restore all team members' Resonance Energy by {0}.","Khi nhân vật đang chạy nước rút, cả đội hồi {0} năng lượng cộng hưởng mỗi giây."
lang_multi_text.db,MultiText,RiskHarvest_buffDesc_152,当前角色受到治疗时，全队每秒重击伤害加成提升{0}，共鸣效率提升{1}，持续{2}秒，可叠{3}层。,"When being healed, all Resonators in the team gain {0} Heavy Attack Bonus and their Energy Regen is increased by {1}. This effect lasts for {2}s and stacks up to {3} times.","Khi nhân vật hiện tại được hồi máu, mỗi giây bonus sát thương Đánh Mạnh cả đội tăng {0}, hiệu suất cộng hưởng tăng {1}, kéo dài {2} giây, tối đa {3} lớp."
lang_multi_text.db,MultiText,RiskHarvest_buffDesc_153,处于冲刺状态时，每{0}秒一次回复全队{1}生命。,"When dashing, restore all team members' HP by {1} every {0}s.","Khi đang chạy nước rút, mỗi {0} giây hồi {1} sinh lực cho cả đội."
lang_multi_text.db,MultiText,RiskHarvest_buffDesc_154,角色施放重击时，额外回复{0}点共鸣能量，减少全队大招cd{1}秒，该效果存在{2}秒冷却时间。,Casting Heavy Attack additionally restores Resonance Energy by {0} and reduces all team members' Resonance Liberation Cooldown by {1}s. This effect has a Cooldown of {2}s.,"Khi nhân vật tung Đánh Mạnh, hồi thêm {0} năng lượng cộng hưởng, giảm thời gian hồi chiêu Giải Phóng Cộng Hưởng cả đội {1} giây. Hiệu ứng này có thời gian hồi {2} giây."
lang_multi_text.db,MultiText,RiskHarvest_buffDesc_155,角色施放共鸣解放后，全队角色共鸣效率提升{0}，持续{1}秒；根据当前施放共鸣解放角色的共鸣效率的{2}，提升全队暴击伤害{3}秒。,"After casting Resonance Liberation, Energy Regen for all Resonators in the team is increased by {0} for {1}s. For every {2} of the caster's Energy Regen, all team members gain an increase of Crit DMG for {3}s.","Sau khi thi triển Giải Phóng Cộng Hưởng, hiệu suất cộng hưởng cả đội tăng {0}, kéo dài {1} giây; dựa trên {2} hiệu suất cộng hưởng của nhân vật thi triển, tăng sát thương bạo kích cả đội trong {3} giây."
lang_multi_text.db,MultiText,RiskHarvest_buffDesc_156,角色被攻击后，全队角色{0}秒内暴击率提升{1}，暴击伤害提升{2}。,"When being hit, all team members' Crit. Rate increases by {1} for {0}s and Crit DMG increases by {2}.","Sau khi nhân vật bị tấn công, trong {0} giây tỷ lệ bạo kích cả đội tăng {1}, sát thương bạo kích tăng {2}."
lang_multi_text.db,MultiText,RiskHarvest_buffDesc_157,dnt/暂无,Not available.,dnt/Chưa có
lang_multi_text.db,MultiText,RiskHarvest_buffDesc_158,dnt/暂无,Not available.,dnt/Chưa có
