db_file,table_name,id,zh,en,vi
lang_multi_text.db,MultiText,Huanglong_main_1_2EX_44_19,贪欲多苦，知足者富。小道刚才所施只是为了你们可以顺利进城。,Pain comes with coveting. He who knows he has enough is rich. It was only meant to sustain you long enough for you to reach the city.,"Tham dục nhiều khổ đau, người biết đủ mới là giàu. Những gì tiểu đạo vừa bố thí chỉ là để các vị có thể thuận lợi vào thành."
lang_multi_text.db,MultiText,Huanglong_main_1_2EX_44_20,不是，小姑娘你不知道，现在这时节钱也不好赚……我们要是进城找不来活，那可难办啊……,"You don't understand, girl. You don't make money very easily in a time like this. If we can't find jobs in the city, we gonna starve again.","Không phải, cô nương không biết đấy thôi, thời buổi này kiếm tiền đâu có dễ... Chúng tôi mà vào thành không kiếm được việc làm thì khó sống lắm..."
lang_multi_text.db,MultiText,Huanglong_main_1_2EX_44_21,小道也是从山上而来，一路行至今州。小道愚钝，世事半知不解，亦能在今州得一口饭吃，诸位明明各有能耐，为何不行？,"I came from a seclusive place, learning the ways of the world from scratch. It's been a hard time, but even I have managed to make a living with my own hands.","Tiểu đạo cũng từ trên núi xuống, đi một mạch đến Kim Châu. Tiểu đạo ngu dốt, sự đời nửa hiểu nửa không, mà vẫn kiếm được miếng cơm ở Kim Châu, các vị rõ ràng đều có bản lĩnh, tại sao lại không được?"
lang_multi_text.db,MultiText,Huanglong_main_1_2EX_44_22,若是入城后确实找不着活计，可以到六羡茶馆寻小道，小道名鉴心，可以同诸位一起找活，做活。,"If you really can't find any job in the city, come to Liuxian Teahouse and ask for Jianxin. I'll gladly help you search for jobs and work alongside you.","Nếu vào thành rồi mà quả thực không tìm được việc, có thể đến <ano=Trà Quán Lục Tiện>Trà Quán Lục Tiện</ano> tìm tiểu đạo, tiểu đạo tên là Giám Tâm, có thể cùng các vị tìm việc, làm việc."
lang_multi_text.db,MultiText,Huanglong_main_1_2EX_44_24,这！好吧，好吧，我们不要就是了。,Tsk... Fine! Fine! We'll go.,"Cái này! Được rồi, được rồi, chúng tôi không cần nữa là được chứ gì."
lang_multi_text.db,MultiText,Huanglong_main_1_2EX_44_25,我们走，快走，我可不想再听这个小道士的说教了。,"Hurry, move! Let's get outta here. I'm not listening to this lecture anymore.","Chúng ta đi, đi mau, tôi không muốn nghe tiểu đạo sĩ này thuyết giáo nữa đâu."
lang_multi_text.db,MultiText,Huanglong_main_1_2EX_44_26,小道并非……算了，请等一等，零件留下。,"I wasn't trying to... Wait, please put that down.","Tiểu đạo không phải... Thôi bỏ đi, xin chờ chút, để linh kiện lại."
lang_multi_text.db,MultiText,Huanglong_main_1_2EX_44_27,记性真好……给给给！都在这了！,"Ugh, quite the sharp eye you got. Fine! Here you go!",Trí nhớ tốt thật đấy... Trả trả trả! Tất cả ở đây!
lang_multi_text.db,MultiText,Huanglong_main_1_2EX_44_28,你们只破坏了这一个侦查塔吗？,Is this the only Detection Beacon you messed with?,Các người chỉ phá hoại mỗi tháp trinh sát này thôi sao?
lang_multi_text.db,MultiText,Huanglong_main_1_2EX_44_29,是啊！刚偷第一个就被你们撞见了。,Heck yeah! Just the first one we were trying to steal and you bumped right into it.,Đúng thế! Mới trộm cái đầu tiên thì bị các người bắt gặp rồi.
lang_multi_text.db,MultiText,Huanglong_main_1_2EX_44_30,但那边的侦查塔……？,Really? Then why does that one over there seem broken too?,Nhưng tháp trinh sát đằng kia...?
lang_multi_text.db,MultiText,Huanglong_main_1_2EX_44_31,那可不关我们的事！那个看起来早就坏了，而且周围还有好多荆棘，我们想过去也过不去啊。,"That ain't got nothing to do with us! It has been that way for ages. Plus, we ain't ever reaching it with all those thorns.","Cái đó không liên quan đến chúng tôi! Cái đó trông như đã hỏng từ lâu rồi, hơn nữa xung quanh còn đầy gai góc, chúng tôi muốn qua cũng chẳng qua được."
lang_multi_text.db,MultiText,Huanglong_main_1_2EX_44_32,好，我们知道了。,I see. You may leave now.,"Được, chúng tôi biết rồi."
lang_multi_text.db,MultiText,Huanglong_main_1_2EX_44_33,夜归的后方营地也不远了，漂泊者，鉴心小道长，我们可以把这些侦查设备修好再过去吗？,The military's base is not far from here. Shall we fix the Beacons before going?,"Doanh trại hậu phương của Dạ Quy cũng không còn xa nữa, Lữ Khách, Giám Tâm tiểu đạo trưởng, chúng ta có thể sửa xong các thiết bị trinh sát này rồi hãy qua đó được không?"
lang_multi_text.db,MultiText,Huanglong_main_1_2EX_44_34,好。,Okay.,Được.
lang_multi_text.db,MultiText,Huanglong_main_1_2EX_44_35,不能给。,We shouldn't give them more.,Không thể cho.
lang_multi_text.db,MultiText,Huanglong_main_1_2EX_44_36,抱歉，刚才给的物资应该已经足够大家到今州城了。即使有这么多人，也有所富余。,"Wait. What I gave them was enough for them to make it to Jinzhou, even when they are so many.","Xin lỗi, số vật tư vừa đưa hẳn là đã đủ để mọi người đến thành Kim Châu rồi. Cho dù có đông người như vậy, vẫn sẽ còn dư dả."
lang_multi_text.db,MultiText,Huanglong_main_1_2EX_44_41,制服了伪装成平民的流放者，你们拿回了被偷走的零件，继续前往另一座失联的侦察塔。,"Upon subduing the Exiles masquerading as civilians, you reclaim the stolen components and head for the next Detection Beacon.","Khống chế được đám Kẻ Lưu Đày giả dạng thường dân, các bạn lấy lại được số linh kiện bị trộm, tiếp tục đi tới một tháp trinh sát mất liên lạc khác."
lang_multi_text.db,MultiText,Huanglong_main_1_2EX_45_1,这样……应该就是修好了吧？,Is it... fixed?,Như vậy... chắc là sửa xong rồi nhỉ?
lang_multi_text.db,MultiText,Huanglong_main_1_2EX_45_2,嗯，走吧，去看看下一个。,Yes. Let's go and check on the next one.,"Ừ, đi thôi, đi xem cái tiếp theo."
lang_multi_text.db,MultiText,Huanglong_main_1_2EX_46_1,这样一来，第二个侦查塔也修好了。,"Awesome, we've got the second Beacon fixed.",Như vậy là tháp trinh sát thứ hai cũng sửa xong rồi.
lang_multi_text.db,MultiText,Huanglong_main_1_2EX_47_1,小道长，你还好吗？,"Master Jianxin, are you alright?","Tiểu đạo trưởng, bạn ổn chứ?"
lang_multi_text.db,MultiText,Huanglong_main_1_2EX_47_2,这是我第一次上战场，这里……和城里的氛围完全不一样。,This is my first time on a battlefield. It feels so different here...,"Đây là lần đầu tiên tôi ra chiến trường, nơi này... bầu không khí hoàn toàn khác với trong thành."
