db_file,table_name,id,zh,en,vi
lang_multi_text.db,MultiText,Side_QTDWZS_9_10,下次见，{PlayerName}。,"See you next time, {PlayerName}.","Hẹn gặp lại, {PlayerName}."
lang_multi_text.db,MultiText,Side_QTDWZS_9_2,它们完全没气了。,They died.,Chúng tắt thở hoàn toàn rồi.
lang_multi_text.db,MultiText,Side_QTDWZS_9_3,哎，这也算是为了逼近真理而做的牺牲，我会把它们也写进致谢词的。,"Sigh, this is a necessary sacrifice for closing in on the truth. Rest in peace. I will pay tribute to them too in the acknowledgments.","Haiz, đây cũng là sự hy sinh cần thiết để tiến gần đến chân lý thôi. Tôi sẽ ghi tên chúng vào lời cảm ơn luôn."
lang_multi_text.db,MultiText,Side_QTDWZS_9_4,那你还是把我的名字从致谢中去掉吧。,"Great, now you can remove my name from it.",Vậy thì bỏ tên tôi ra khỏi lời cảm ơn đi.
lang_multi_text.db,MultiText,Side_QTDWZS_9_5,欸，别这么说嘛，我可是真心实意地感谢所有帮助过我的动物。,"Hey, don't say that. I genuinely appreciate everyone who helped me, including animals.","Ê, đừng nói vậy chứ, tôi thật lòng biết ơn tất cả những con vật đã giúp đỡ tôi mà."
lang_multi_text.db,MultiText,Side_QTDWZS_9_6,为了不浪费它剩余的价值，你就带回去吧，听说它的肉质还不错……,"To cherish their remaining value, why don't you take it home? I heard it tastes fine...","Để không lãng phí giá trị còn lại của nó, cậu mang về đi. Nghe nói thịt nó cũng ngon lắm..."
lang_multi_text.db,MultiText,Side_QTDWZS_9_7,至于这个翻译模块，这次的故障尤其的多啊，让我来检查下……,"As for the translation module, I didn't expect so many malfunctions occuring this time. I need to check it out carefully.","Còn cái mô-đun dịch thuật này, lần này lỗi nhiều quá. Để tôi kiểm tra lại xem..."
lang_multi_text.db,MultiText,Side_QTDWZS_9_8,我还奇怪它怎么没报乱码，居然早就悄悄宕机了。好吧，那我就顺便卸载了。,"I was wondering why it didn't show any garbled text. Turns out it crashed a long time ago, haha. Alright, let me uninstall it while I'm at it.","Tôi còn thắc mắc sao nó không hiện lỗi ký tự, hóa ra nó đã âm thầm sập từ lâu rồi. Thôi được, tiện thể tôi gỡ luôn vậy."
lang_multi_text.db,MultiText,Side_SJSLYGW_101_1,大吾一个箭步冲上前去，与“世界上另一个自己”扭打在了一起……虽然被“世界上另一个自己”不断揍倒在地，但大吾还是靠着顽强的意志制服了对手……,"Daigo rushes forwards, wrestling with his ""other self""... Although being knocked down by ""himself"" over and over again, Daigo still manages to subdue his opponent through sheer willpower...","Daigo lao lên phía trước, vật lộn với ""một phiên bản khác của mình""... Dù liên tục bị ""chính mình"" đánh ngã xuống đất, nhưng Daigo vẫn dựa vào ý chí kiên cường để khống chế đối thủ..."
lang_multi_text.db,MultiText,Side_SJSLYGW_10_1,竟然真的发现他了……快抓住他！,"We actually found him... Quick, catch him!","Thật sự tìm thấy hắn rồi... Nhanh, bắt lấy hắn!"
lang_multi_text.db,MultiText,Side_SJSLYGW_10_2,那是……娜娜美小姐！小心！,That's... Miss Nanami! Be careful!,Đó là... cô Nanami! Cẩn thận!
lang_multi_text.db,MultiText,Side_SJSLYGW_11_10,不对！我发现了——这家伙到现在为止没有说过一句话！我叫你一声，你敢答应吗？,"No! I noticed something—this guy hasn't said a single word since we met! If I call out to you, will you dare to answer?","Không đúng! Tôi phát hiện rồi - thằng này từ nãy đến giờ chưa nói lấy một câu! Tôi gọi ngươi một tiếng, ngươi dám đáp lại không?"
lang_multi_text.db,MultiText,Side_SJSLYGW_11_11,……咔咔？,...Clack clack?,...Cạch cạch?
