db_file,table_name,id,zh,en,vi
lang_multi_text.db,MultiText,XJXYBGSST_41_13,我没什么要问的了。,I have no further questions.,Tôi không có gì muốn hỏi nữa.
lang_multi_text.db,MultiText,XJXYBGSST_41_14,好了，已经很晚了。现在你最大的危险就是睡眠不足，快回去休息吧。,"Alright, it's getting late. The only hazard now is you running low on sleep. Go get some rest.","Được rồi, muộn lắm rồi. Bây giờ mối nguy lớn nhất với cậu là thiếu ngủ, mau về nghỉ đi."
lang_multi_text.db,MultiText,XJXYBGSST_41_2,冰原上真的很危险吗？,Are the frostlands really that dangerous?,Băng nguyên thực sự rất nguy hiểm sao?
lang_multi_text.db,MultiText,XJXYBGSST_41_3,前往冰原有哪些注意事项？,What should you look out for in the frostlands?,Lên băng nguyên cần lưu ý những gì?
lang_multi_text.db,MultiText,XJXYBGSST_41_4,要说危险，它确实存在。你知道，冰原位于地表，而它的下方是一个巨大的空洞，也就是我们星炬学院的所在地。,"It's definitely no walk in the park. As you know, there's an enormous cavern under the frostlands. That's where Startorch Academy is.","Nói về nguy hiểm thì nó thực sự tồn tại. Cậu biết đấy, băng nguyên nằm trên bề mặt, còn bên dưới nó là một khoảng trống khổng lồ, chính là nơi Học viện Tinh Cự tọa lạc."
lang_multi_text.db,MultiText,XJXYBGSST_41_5,冰原的地壳就像一层薄薄的蛋壳，受到外力时容易破碎塌陷。,The earth up there is like a thin eggshell. One wrong step and it could crack or collapse.,"Lớp vỏ địa chất của băng nguyên giống như một lớp vỏ trứng mỏng, dễ vỡ và sụp đổ khi chịu ngoại lực."
lang_multi_text.db,MultiText,XJXYBGSST_41_6,再加上极寒的气候，还有虚质磁暴和虚诞虫的威胁，就算是经验丰富的科考队员，在冰原上也要时刻保持警惕。,"Then there's the extreme cold, plus those Void Storms and Voidworms. Even veterans of multiple expeditions are always on their toes out there.","Thêm vào đó là khí hậu cực lạnh, cùng với mối đe dọa từ Bão Từ Hư Chất và Trùng Hư Đản, ngay cả đội viên khảo sát giàu kinh nghiệm cũng phải luôn cảnh giác trên băng nguyên."
lang_multi_text.db,MultiText,XJXYBGSST_41_7,最重要的就是严格遵守安全规则，听从队长和专业人士的指挥。他们熟悉路线，只会带你们在标记好的安全区域活动。,The key is to follow all the Safety Protocols and listen to your expedition leader and the other pros. They know the safe routes inside and out and won't lead you anywhere risky.,"Quan trọng nhất là tuân thủ nghiêm ngặt quy tắc an toàn, nghe theo chỉ huy của đội trưởng và các chuyên gia. Họ thuộc đường đi nước bước, chỉ đưa các cậu hoạt động trong khu vực an toàn đã được đánh dấu."
lang_multi_text.db,MultiText,XJXYBGSST_41_8,而针对虚质磁暴，防护服能在一定程度上保护你们免受虚质的污染，而科考队都配备了升级版的监测设备，大多数时候，都能提前预警。,"As for the Void Storms, the protective suits will help keep contamination at bay, and every research team is geared up with top-notch monitors. They usually catch the warning signs early.","Còn đối với Bão Từ Hư Chất, bộ đồ bảo hộ có thể bảo vệ các cậu khỏi ô nhiễm hư chất ở một mức độ nhất định, và đội khảo sát đều được trang bị thiết bị giám sát nâng cấp, phần lớn trường hợp đều có thể cảnh báo trước."
lang_multi_text.db,MultiText,XJXYBGSST_41_9,至于其他……我个人还有一条建议，就是无论何时都要记得吃饭，要有充足的热量摄入，才能保持头脑清醒。,"Other than that... If you want my two cents, I always say never skip a meal. You need calories if you want to keep a clear head out there.","Còn những thứ khác... cá nhân tôi có thêm một lời khuyên, đó là bất kể lúc nào cũng phải nhớ ăn uống đầy đủ, phải nạp đủ năng lượng mới giữ được đầu óc tỉnh táo."
lang_multi_text.db,MultiText,XJXYBGSST_42_1,您应交付的教学计划即将逾期！剩余时间：5——,Your paper will be overdue in 5—,Kế hoạch giảng dạy ngài cần nộp sắp quá hạn! Thời gian còn lại: 5-
lang_multi_text.db,MultiText,XJXYBGSST_42_2,还有五分钟！足够我写完！这次肯定准时！,"I still have 5 minutes! TARD-E, please trust me! I can finish on time!",Còn năm phút! Đủ để tôi viết xong! Lần này chắc chắn đúng hạn!
lang_multi_text.db,MultiText,XJXYBGSST_42_3,4……3……2……,4... 3... 2...,4... 3... 2...
lang_multi_text.db,MultiText,XJXYBGSST_43_1,我调整了下它的线路，它就自己坏掉了！快帮我看看吧！,I tweaked the circuitry and it broke. Come help take a look!,Tôi chỉ chỉnh lại đường mạch của nó thôi mà nó tự hỏng rồi! Giúp tôi xem qua đi!
lang_multi_text.db,MultiText,XJXYBGSST_43_2,上次碰类似的设备还是在上次任务里……,I handled a device like this before in my last task...,Lần trước động vào thiết bị tương tự là trong nhiệm vụ trước...
lang_multi_text.db,MultiText,XJXYBGSST_43_3,修这玩意儿的原理跟拆炸弹应该差不多……吧？,Fixing this thing is kinda like defusing a bomb... I guess?,Nguyên lý sửa cái này chắc cũng giống tháo bom... nhỉ?
lang_multi_text.db,MultiText,XJXYBGSST_44_1,教授，还在忙呢？很晚了，注意安全啊！,"Professor, you're still working? Take care, it's very late.","Giáo sư, vẫn còn bận à? Muộn lắm rồi, chú ý an toàn nhé!"
lang_multi_text.db,MultiText,XJXYBGSST_44_2,放心，我给学生的开题报告批注完就走。辛苦你了！,"Don't worry, I'll leave as soon as I finish annotating this student's proposal. Thanks for staying!","Yên tâm, tôi phê xong bản báo cáo đề cương cho sinh viên là đi ngay. Vất vả cậu rồi!"
lang_multi_text.db,MultiText,XJXYBGSST_45_1,教授，有学生违规携带“裂了就跑”鱼罐头进入学院。,"Professor, there's a student smuggling ""Crack & Bolt"" fish jars onto campus.","Giáo sư, có sinh viên mang trái phép đồ hộp cá ""Nứt Là Chạy"" vào học viện."
lang_multi_text.db,MultiText,XJXYBGSST_45_2,连人带罐头，我都带来了，您说怎么处理比较好？,I've got the offender and the contraband right here. How do you want to handle this?,"Cả người lẫn đồ hộp, tôi đều mang đến đây rồi, ngài thấy xử lý thế nào?"
lang_multi_text.db,MultiText,XJXYBGSST_45_3,先、先别说处理，你把人和罐头都带远些，我要吐了……,"I want you to take them both away! Anywhere but here! Blergh, I'm going to be sick...","Khoan, khoan nói chuyện xử lý đã, cậu mang người với đồ hộp ra xa giùm, tôi sắp nôn rồi..."
lang_multi_text.db,MultiText,XJXYBGSST_4_1,这届新生真活泼，尤其那骑摩托的姑娘，跟阵风似的。,"This year's freshmen are raring to get started, especially that motorbike girl.","Khóa tân sinh năm nay thật sôi nổi, nhất là cô gái đi mô tô kia, như một cơn gió vậy."
lang_multi_text.db,MultiText,XJXYBGSST_4_2,看着他们闹腾，感觉自己都变年轻了……,Seeing their enthusiasm makes me feel young again.,"Nhìn bọn trẻ nghịch ngợm, cảm giác mình cũng trẻ lại..."
lang_multi_text.db,MultiText,XJXYBGSST_4_3,别老气横秋的，按共鸣者的平均年龄算，你也还年轻呢！,Don't pretend to be decrepit. You're still considered young for a Resonator!,"Đừng có ra vẻ già cả thế, tính theo tuổi thọ trung bình của Cộng Hưởng Giả, cậu vẫn còn trẻ chán!"
lang_multi_text.db,MultiText,XJXYBGSST_5_1,预科班的那个千咲，对海蚀现象很了解啊。,That Chisa from prep class knows a lot about Waveworn Phenomena.,"Chisa ở lớp dự bị đó, hiểu rõ về hiện tượng hải thực ghê nhỉ."
lang_multi_text.db,MultiText,XJXYBGSST_5_2,看来，我们虚质科学部又要增添一位有潜力的新人了。,Looks like our Department of Voidmatters is about to welcome another talented individual.,"Xem ra, khoa Khoa học Hư Chất của chúng ta sắp có thêm một tân binh tiềm năng rồi."
lang_multi_text.db,MultiText,XJXYBGSST_5_3,她二十年前就是我们工学部的人了。想抢？没门！,She was with us at the Department of Exostrider Engineering twelve years ago. Don't even think about poaching her!,Cô ấy từ hai mươi năm trước đã là người của khoa Công trình học chúng tôi rồi. Muốn giành à? Đừng hòng!
lang_multi_text.db,MultiText,XJXYBGSST_6_1,这次实战考试的环境设计，我觉得还缺少一点真实感……,"You know, the current combat test grounds seem to be missing a touch of realism...","Thiết kế môi trường cho kỳ thi thực chiến lần này, tôi thấy vẫn thiếu một chút cảm giác chân thực..."
lang_multi_text.db,MultiText,XJXYBGSST_6_2,把餐能中心最近的试作品加入场地怎么样？,What if we laid out some of the cafeteria's latest fare around the field?,Thêm mấy sản phẩm thử nghiệm mới nhất từ trung tâm năng lượng ẩm thực vào trường thi thì sao?
lang_multi_text.db,MultiText,XJXYBGSST_6_3,能提前尝到最新的超级食品，学生们一定也会开心的。,I'm sure students would love to try out the newest superfoods before anyone else.,"Được nếm trước thực phẩm siêu cấp mới nhất, học sinh chắc chắn cũng sẽ vui lắm."
lang_multi_text.db,MultiText,XJXYBGSST_7_1,人美心善的好姐姐，你就替我上了这几节课吧~,My esteemed and most generous colleague! Think you could sub my class?,"Chị đẹp người đẹp nết ơi, chị dạy thay em mấy tiết này đi mà~"
lang_multi_text.db,MultiText,XJXYBGSST_7_2,我的研究正在关键时刻，是真的没有空余时间了~,My research is at a critical juncture. I genuinely can't afford to be anywhere else.,"Nghiên cứu của em đang đến lúc then chốt, thật sự không còn thời gian rảnh nữa rồi~"
lang_multi_text.db,MultiText,XJXYBGSST_7_3,呵，“裂了就跑”鱼罐头，至少三个，否则免谈。,"Three ""Crack & Bolt"" fish jars, and I miiiight consider it.","Hừ, cá hộp ""Bật Nắp Là Chạy"", ít nhất ba lon, không thì miễn bàn."
lang_multi_text.db,MultiText,XJXYBGSST_8_1,你的这篇论文嘛……学术上算是已经没救了。,Your thesis paper is... academically hopeless.,Bài luận văn này của em thì... về mặt học thuật coi như hết cứu rồi.
lang_multi_text.db,MultiText,XJXYBGSST_8_2,但别灰心，说不定……它能在别的领域发光发热呢？,But don't lose hope! It might find an audience somewhere else.,"Nhưng đừng nản, biết đâu... nó có thể tỏa sáng ở lĩnh vực khác thì sao?"
lang_multi_text.db,MultiText,XJXYBGSST_9_1,马司那老小子，我早就看他不顺眼了。这么着，你把论文上写的指导老师，换成他的名字。,"Massi! I haven't seen eye to eye with that geezer in years. Alright, listen to me, delete my name from your thesis paper. Put him down as your advisor instead.","Cái lão Massi đó, ta nhìn hắn chướng mắt lâu rồi. Thế này nhé, em đổi tên giảng viên hướng dẫn trên luận văn thành tên hắn đi."
lang_multi_text.db,MultiText,XJXYBGSST_9_2,为师再如此这般，稍微运作一下，管教那家伙在学术界里身败名裂——你这篇论文，可领头功。怎么样？,"I'll find some way to discredit him. The faculty will have to strike his name from all academic works, and you'll get sole authorship! How's that sound?","Thầy sẽ vận dụng chút thủ đoạn, khiến cho gã đó thân bại danh liệt trong giới học thuật - bài luận văn của em sẽ lập đầu công. Thế nào?"
lang_multi_text.db,MultiText,XJXYBGSST_9_3,老师啊，我这都急死了，您还拿我寻开心。给点儿正经的修改意见吧，我还指着它毕业呢！,"Professor, I'm stressing out here, and you're making jokes. Please give some actual feedback. I'm counting on this paper to graduate.","Thầy ơi, em sắp chết vì lo rồi, thầy còn trêu em. Cho em vài ý kiến chỉnh sửa nghiêm túc đi, em còn trông vào nó để tốt nghiệp đây!"
lang_multi_text.db,MultiText,XJXYBGSST_9_4,说正经的？也行。那你从这儿……到这儿，全部改掉。,"Actual... feedback, alright. Change this, this, this, and everything else.","Nghiêm túc hả? Cũng được. Vậy em sửa từ chỗ này... đến chỗ này, toàn bộ."
lang_multi_text.db,MultiText,XJXYBGSST_9_5,从头改到尾，不就等于重写嘛——唯独这个绝对不行啊——,You want me to start from scratch and write a new one? The work that involves—Impossible...,Sửa từ đầu đến cuối thì khác gì viết lại đâu - cái này thì tuyệt đối không được rồi-
lang_multi_text.db,MultiText,XJXYDTK_10_1,这电梯速度慢就算了，非高峰期还要分流……,This elevator is slow enough on a good day…  Now there's traffic control during <i>off-peak hours</i>?,"Thang máy chậm đã đành, giờ ngoài giờ cao điểm còn phải phân luồng nữa..."
lang_multi_text.db,MultiText,XJXYDTK_10_2,究竟是谁想出来的设计？,Whose genius idea was that?,Rốt cuộc ai là người nghĩ ra cái thiết kế này vậy?
lang_multi_text.db,MultiText,XJXYDTK_10_3,哔哔——您的反馈已经记录，如果您有更好的设计建议，欢迎提出。,"Beep—Feedback logged. If you have a suggestion for improvement, you are welcome to submit it.","Bíp bíp - Phản hồi đã được ghi nhận. Nếu bạn có đề xuất thiết kế tốt hơn, xin hãy đóng góp."
lang_multi_text.db,MultiText,XJXYDTK_10_4,依我看，首先要做的，就是解除电梯的限速，并且尽可能地减少在每楼层的停留时间，提高它的运行效率。,"Well, first, you scrap the speed limit and cut the stop-time at each floor to maximize throughput.","Theo tôi, việc đầu tiên cần làm là bỏ giới hạn tốc độ thang máy, đồng thời giảm thiểu thời gian dừng ở mỗi tầng để nâng cao hiệu suất vận hành."
lang_multi_text.db,MultiText,XJXYDTK_10_5,还有，最好把电梯的内部改造为360°全方向可通行，提高下空间利用率……,"Then, you redesign the cabin into a 360-degree, fully accessible layout to optimize spatial efficiency...","Ngoài ra, tốt nhất nên cải tạo bên trong thang máy thành dạng 360 độ thông suốt mọi hướng, tối ưu hóa không gian sử dụng..."
lang_multi_text.db,MultiText,XJXYDTK_10_6,当然，还需要速度感应器、安全杆及多重安全带保障学生安全，必要的话可以直接配备安全座椅，加装“触底回弹”保险机制……,"And naturally, you'd need speed sensors, safety bars, and multi-strap seat belts. If necessary, we can even install impact-absorbing seats with a full ""bounce-back"" mechanism...?","Tất nhiên, còn cần cảm biến tốc độ, thanh chắn an toàn và dây đai đa điểm để bảo vệ sinh viên. Nếu cần thiết có thể lắp luôn ghế an toàn, thêm cơ chế bảo hiểm ""nảy ngược khi chạm đáy""..."
lang_multi_text.db,MultiText,XJXYDTK_10_7,嘿，这么完美的设计，学校不得给我颁个奖什么的？,"Kind of inspired, right? I deserve an award for this, don't you think?","Này, thiết kế hoàn hảo thế này, trường không trao cho tôi cái giải thưởng gì sao?"
lang_multi_text.db,MultiText,XJXYDTK_10_8,哔哔——已根据关键词在文献库中检索到相似设计，您要设计的是否是——跳楼机？,"Beep—Searching by keywords, the closest match to your description is a drop tower. Is this your intended design?",Bíp bíp - Đã tìm thấy thiết kế tương tự trong thư viện tài liệu dựa trên từ khóa. Thứ bạn muốn thiết kế có phải là - máy nhảy tự do?
lang_multi_text.db,MultiText,XJXYDTK_10_9,……,...,...
lang_multi_text.db,MultiText,XJXYDTK_11_1,总有一天，我们也能建造出太空电梯吧……,"One day, we'll build a real space elevator of our own…","Rồi sẽ có ngày, chúng ta cũng xây được thang máy vũ trụ nhỉ..."
lang_multi_text.db,MultiText,XJXYDTK_11_2,那一天什么时候才能到来呢……,Wonder when that day will come…,Ngày đó bao giờ mới đến đây...
lang_multi_text.db,MultiText,XJXYDTK_12_1,总有一天，我们也能建造出太空电梯吧……,"One day, we'll build a real space elevator of our own…","Rồi sẽ có ngày, chúng ta cũng xây được thang máy vũ trụ nhỉ..."
lang_multi_text.db,MultiText,XJXYDTK_12_2,那一天什么时候才能到来呢……,Wonder when that day will come…,Ngày đó bao giờ mới đến đây...
lang_multi_text.db,MultiText,XJXYDTK_12_3,到时，我要第一个走出空间站，去向外太空探索。然后在抵达的第一颗星球的地表上，刻下……,"When it does, I'll be the first one out of the station. And on the very first planet we find, I'm gonna carve—","Khi đó, tôi sẽ là người đầu tiên bước ra khỏi trạm không gian, khám phá vũ trụ bên ngoài. Rồi trên bề mặt hành tinh đầu tiên đặt chân đến, tôi sẽ khắc lên..."
lang_multi_text.db,MultiText,XJXYDTK_12_4,“切特，你欠我的五百贝币什么时候还？”——这样全宇宙的智慧生物都会知道你还欠着我五百贝币的事了，哈哈！,"""Chett, when do I get my five hundred Shell Credits back?"" So every intelligent being in the galaxy will know you still owe me five hundred Shell Credits, haha!","""Chett, bao giờ mày trả tao năm trăm Bối Tệ?"" - Như vậy mọi sinh vật thông minh trong vũ trụ đều sẽ biết mày còn nợ tao năm trăm Bối Tệ, haha!"
lang_multi_text.db,MultiText,XJXYDTK_12_5,无聊……如果要给外星生命留言的话，不应该留下更多有关人类的信息吗？,"You're impossible... If you're leaving messages for aliens, shouldn't you say something meaningful about humanity?","Chán thật... Nếu muốn để lại lời nhắn cho sinh vật ngoài hành tinh, chẳng phải nên ghi lại thêm thông tin về loài người sao?"
lang_multi_text.db,MultiText,XJXYDTK_12_6,那可不行，万一触犯“无光之森法则”呢？,"No way. What if it violates the ""Dim Forest Hypothesis""?","Không được đâu, lỡ vi phạm ""Pháp tắc Rừng Vô Quang"" thì sao?"
lang_multi_text.db,MultiText,XJXYDTK_12_7,不过想想，我们随手刻下的玩笑话，也可能会被其他星球的生命当作神秘学文字去解读……,"But think about it, some alien civilization might take our dumb inside joke and interpret it as some mysterious text...","Nhưng nghĩ lại mà xem, câu đùa chúng ta tiện tay khắc lên, biết đâu lại bị sinh vật trên hành tinh khác coi như văn tự huyền bí mà giải mã..."
lang_multi_text.db,MultiText,XJXYDTK_12_8,说不定，我们正试着破译的那些古老符号，也不过是某外星智慧生物的“到此一游”，甚至连“炉芯”也不过是它们星边野餐时留下的垃圾。,"For all we know, the ancient runes we're trying to decode are just some alien's ""I was here"" graffiti. Even the Reactor Drive might just be their picnic trash.","Biết đâu, những ký hiệu cổ xưa mà chúng ta đang cố giải mã, chẳng qua chỉ là dòng chữ ""đến đây một chuyến"" của sinh vật ngoài hành tinh nào đó. Thậm chí ""Lõi Lò"" cũng chỉ là rác thải từ bữa dã ngoại bên rìa sao của chúng mà thôi."
lang_multi_text.db,MultiText,XJXYDTK_12_9,只有更进一步探索深空才能知道了……不管怎么说，真希望太空电梯建成的那一天早点到来啊。,"Only deep space exploration will give us answers… Anyway, here's to hoping that space elevator gets built soon.","Chỉ có tiến sâu hơn vào không gian mới biết được... Dù sao đi nữa, thật mong ngày thang máy vũ trụ hoàn thành sớm đến."
lang_multi_text.db,MultiText,XJXYDTK_13_1,每天通勤要累晕了……,This daily hike is killing me…,Ngày nào cũng đi lại mệt muốn xỉu...
lang_multi_text.db,MultiText,XJXYDTK_13_2,学校……为什么不能把宿舍区和教学区建得近一点……呼……呼……,Why can't the school build the dorms closer to the classrooms? Huff puff...,Trường... sao không xây khu ký túc xá và khu giảng dạy gần nhau hơn một chút... hừ... hừ...
lang_multi_text.db,MultiText,XJXYDTK_13_3,兄弟，习惯成自然……,"You'll get used to it, brother...","Ông ơi, quen rồi thành tự nhiên thôi..."
lang_multi_text.db,MultiText,XJXYDTK_14_1,每天通勤要累晕了……,This daily hike is killing me…,Ngày nào cũng đi lại mệt muốn xỉu...
lang_multi_text.db,MultiText,XJXYDTK_14_2,学校……为什么不能把宿舍区和教学区建得近一点……呼……呼……不行……我要抗议！,Why can't the school build the dorms closer to the classrooms? Huff puff...,Trường... sao không xây khu ký túc xá gần khu giảng đường hơn một chút... hừ... hừ... không được... tôi phải phản đối!
lang_multi_text.db,MultiText,XJXYDTK_14_3,兄弟，习惯成自然。,"You'll get used to it, brother...","Anh bạn, quen rồi thì thành tự nhiên thôi."
lang_multi_text.db,MultiText,XJXYDTK_14_4,看你的院徽……你是农学部的？你们的试验田不应该离宿舍更远吗？,"Hey, your badge... You're from the Agro Wing, right? Aren't your test plots even farther out?",Nhìn huy hiệu viện của cậu... cậu thuộc khoa Nông nghiệp à? Ruộng thí nghiệm của các cậu chẳng phải còn xa ký túc xá hơn sao?
lang_multi_text.db,MultiText,XJXYDTK_14_5,是啊，而且我们还得时刻监控有没有机麋闯进田里，偷吃我们的“论文”……,"Yep. And we have to keep watch to make sure no mech reindeer wander in and eat our ""thesis material""...","Đúng vậy, mà bọn tôi còn phải canh chừng liên tục xem có con nai máy nào xông vào ruộng ăn mất ""luận văn"" của bọn tôi không..."
lang_multi_text.db,MultiText,XJXYDTK_14_6,那你们应该早就和学校反馈过这个问题了吧。,So you must've complained to the school a long time ago.,Vậy chắc các cậu đã phản ánh vấn đề này với trường từ lâu rồi nhỉ.
lang_multi_text.db,MultiText,XJXYDTK_14_7,这个问题，我们已经解决了。,We solved the problem already.,"Vấn đề này, bọn tôi đã giải quyết rồi."
lang_multi_text.db,MultiText,XJXYDTK_14_8,怎么解决的？是学校同意搬迁宿舍区，还是你们发明出了新型代步工具？,But how? Did the school move your dorms? Or did you invent some new transport tech?,"Giải quyết kiểu gì? Trường đồng ý dời khu ký túc xá, hay các cậu phát minh ra phương tiện di chuyển mới?"
lang_multi_text.db,MultiText,XJXYDTK_14_9,我们晚上直接睡田里了。,Nah. We just started sleeping in the plots.,Bọn tôi tối ngủ luôn ngoài ruộng.
lang_multi_text.db,MultiText,XJXYDTK_15_1,123456乘123456！,"123,456 times 123,456!",123456 nhân 123456!
lang_multi_text.db,MultiText,XJXYDTK_15_2,……15241383936！,"…15,241,383,936!",...15241383936!
lang_multi_text.db,MultiText,XJXYDTK_16_1,这就是罗伊人的种族天赋吗……好羡慕……,Is this the Roya's natural talent?... I'm so jealous…,Đây là thiên phú chủng tộc của người Roya sao... ghen tị quá...
lang_multi_text.db,MultiText,XJXYDTK_16_10,到了现在，数学已然成为了罗伊孩子们的“必修课”……说到底，还是“熟能生巧”吧。,"Now it's simply a skill every Roya child is required to learn... In the end, it all comes down to practice.","Đến bây giờ, toán học đã trở thành ""môn bắt buộc"" của trẻ em Roya rồi... Nói cho cùng, vẫn là ""quen tay hay việc"" thôi."
lang_multi_text.db,MultiText,XJXYDTK_16_11,唔……但我还是觉得你们好厉害，看到这个螺壳的一瞬间，我的大脑就已经开始旋转了……,"Hmm... but still, you're all incredible. I just took one glance at that shell and my head started spinning...","Ừm... nhưng tôi vẫn thấy các cậu giỏi lắm, vừa nhìn thấy cái vỏ ốc này là đầu tôi đã bắt đầu quay mòng mòng rồi..."
lang_multi_text.db,MultiText,XJXYDTK_16_2,也许是我们的计算思维不太一样？你有听说过“螺算”吗？,"Maybe our way of thinking about numbers is just different. Have you heard of ""Shell Arithmetic""?","Có lẽ tư duy tính toán của chúng ta hơi khác nhau? Cậu có nghe nói về ""Loa Toán"" chưa?"
lang_multi_text.db,MultiText,XJXYDTK_16_3,好像在“考古符号学课”上有看到过“螺算石母”这种东西……,"I think I saw something about ""arithmetic shells"" in Archaeo Semiotics class...","Hình như trong lớp ""Ký hiệu học Khảo cổ"" có thấy thứ gọi là ""Loa Toán Thạch Mẫu""..."
