db_file,table_name,id,zh,en,vi
lang_multi_text.db,MultiText,Achievement_200549_Desc,在昔日的据点看到琥珀中封存的记忆。,Uncover the memories sealed in amber inside the old safe house.,"Tại cứ điểm ngày xưa, nhìn thấy ký ức phong ấn trong hổ phách."
lang_multi_text.db,MultiText,Achievement_200549_Name,琥珀中的信念,Amber-Preserved Faith,Tín niệm trong hổ phách
lang_multi_text.db,MultiText,Achievement_200550_Desc,在虹音塔内得知那位少女的结局。,Witness that girl's final moment in the Neon Tower.,Biết được kết cục của cô gái ấy bên trong Tháp Hồng Âm.
lang_multi_text.db,MultiText,Achievement_200550_Name,不要温和地走进那个良宵,Do Not Go Gentle Into that Beautiful Night,Chớ nhẹ nhàng bước vào đêm lành ấy
lang_multi_text.db,MultiText,Achievement_200551_Desc,和朋友们一起度过咖啡厅的开业之夜。,Spend the first night with friends after the cafe's opening.,Cùng bạn bè trải qua đêm khai trương quán cà phê.
lang_multi_text.db,MultiText,Achievement_200551_Name,你不知道的故事,The Story You Don't Know,Câu chuyện bạn chưa biết
lang_multi_text.db,MultiText,Achievement_200552_Desc,完成「星光流转于眼眸之间」。,Complete Flowing Starlight in the Iris.,"Hoàn thành ""Ánh Sao Lưu Chuyển Giữa Đôi Mắt""."
lang_multi_text.db,MultiText,Achievement_200552_Name,如星星一般的你,"You, the Starlight","Bạn, tựa như vì sao"
lang_multi_text.db,MultiText,Achievement_200601_Desc,与琳奈成功躲避「虚诞虫」的追击。,Successfully escape the pursuing Voidworm with Lynae.,"Cùng Lynae né tránh thành công cuộc truy đuổi của ""Hư Đản Trùng""."
lang_multi_text.db,MultiText,Achievement_200601_Name,拉海洛搭车指南,The Hitchhiker's Guide to Lahai-Roi,Cẩm nang quá giang Lahai-Roi
lang_multi_text.db,MultiText,Achievement_200602_Desc,在S.I.G.M.A.处第一次领取自己的载具。,Claim your vehicle from S.I.G.M.A. for the first time.,Nhận phương tiện của mình tại S.I.G.M.A. lần đầu tiên.
lang_multi_text.db,MultiText,Achievement_200602_Name,"Hello, motor","Hello, Motor","Hello, Motor"
lang_multi_text.db,MultiText,Achievement_200603_Desc,与“死而复生”的「联络人」对峙。,"Confront the resurrected ""Liaison.""","Đối đầu với ""Liên Lạc Viên"" đã ""chết đi sống lại""."
lang_multi_text.db,MultiText,Achievement_200603_Name,行于黑暗……,Walking in Darkness,Bước trong bóng tối...
lang_multi_text.db,MultiText,Achievement_200604_Desc,成功阻止失控的海维夏探测器。,Successfully stop the rampaging Hyvatia Detector.,Ngăn chặn thành công Máy Dò Hyvatia mất kiểm soát.
lang_multi_text.db,MultiText,Achievement_200604_Name,静默模式,Silent Mode,Chế độ im lặng
lang_multi_text.db,MultiText,Achievement_200605_Desc,见证日灵们完成「归源之仪」。,Witness the Soliskin complete the Rite of Return.,"Chứng kiến các Nhật Linh hoàn thành ""Quy Nguyên Chi Nghi""."
lang_multi_text.db,MultiText,Achievement_200605_Name,辉光之下,Under the Glow,Dưới ánh huy hoàng
lang_multi_text.db,MultiText,Achievement_200606_Desc,成功完成「换日仪式」。,Complete the New Solar Ceremony.,"Hoàn thành thành công ""Nghi Thức Hoán Nhật""."
lang_multi_text.db,MultiText,Achievement_200606_Name,新日之下,Under the New Sun,Dưới vầng nhật mới
lang_multi_text.db,MultiText,Achievement_200607_Desc,完成「致第二次日出」。,"Complete ""Ode to the Second Sunrise.""","Hoàn thành ""Gửi Bình Minh Thứ Hai""."
lang_multi_text.db,MultiText,Achievement_200607_Name,致新世界,To the New World,Gửi Tân Thế Giới
lang_multi_text.db,MultiText,Achievement_200608_Desc,与琳奈成功击败「虚诞虫」。,Defeat the Voidworm with Lynae.,"Cùng Lynae đánh bại thành công ""Hư Đản Trùng""."
lang_multi_text.db,MultiText,Achievement_200608_Name,虹色新雨,Iridescent Rain,Cơn mưa sắc cầu vồng
lang_multi_text.db,MultiText,Achievement_200609_Desc,完成「冰原下的星炬」。,"Complete ""What Burns Beneath Frostlands.""","Hoàn thành ""Tinh Cự Dưới Băng Nguyên""."
lang_multi_text.db,MultiText,Achievement_200609_Name,明日伊始,A New Dawn,Khởi đầu ngày mai
lang_multi_text.db,MultiText,Achievement_200610_Desc,在星炬学院办理入学。,Complete enrollment at Startorch Academy.,Làm thủ tục nhập học tại Học Viện Tinh Cự.
lang_multi_text.db,MultiText,Achievement_200610_Name,重返校园,Back to Campus,Trở lại học đường
lang_multi_text.db,MultiText,Achievement_200611_Desc,见证引日殿出现。,Witness the appearance of Solisylum.,Chứng kiến Dẫn Nhật Điện xuất hiện.
lang_multi_text.db,MultiText,Achievement_200611_Name,行则将至,Steady Toward Destiny,Bước đi ắt sẽ đến
lang_multi_text.db,MultiText,Achievement_200612_Desc,找到在阿图雅营地的虚质磁暴中幸存的日灵。,Find the Soliskin who survived the Void Storm at Atuja camp.,Tìm thấy Nhật Linh sống sót sau cơn Bão Từ Hư Chất tại doanh trại Atuja.
lang_multi_text.db,MultiText,Achievement_200612_Name,日光的宠儿,Child of Light,Đứa Con Của Ánh Dương
lang_multi_text.db,MultiText,Achievement_200613_Desc,完成「日光落处」。,"Complete ""All That Sunlight Touches.""","Hoàn thành ""Nơi Ánh Dương Rơi Xuống""."
lang_multi_text.db,MultiText,Achievement_200613_Name,甘甜之味,Taste of Sweetness,Hương Vị Ngọt Ngào
lang_multi_text.db,MultiText,Achievement_200614_Desc,抵达叹息世界最深处。,Reach the deepest part of the World of Sighs.,Đến được nơi sâu nhất của Thế Giới Than Thở.
lang_multi_text.db,MultiText,Achievement_200614_Name,Memory in the snow,Memory in the Snow,Memory in the Snow
lang_multi_text.db,MultiText,Achievement_200615_Desc,跟随像素爱弥斯走过电子屏阵。,Follow Aemeath through the screen array.,Đi theo Aemeath phiên bản pixel xuyên qua dàn màn hình điện tử.
lang_multi_text.db,MultiText,Achievement_200615_Name,RPG高手,RPG Master,Cao Thủ RPG
lang_multi_text.db,MultiText,Achievement_200616_Desc,抵达冰原地表。,Reach the surface of the Roya Frostlands.,Đến được bề mặt băng nguyên.
lang_multi_text.db,MultiText,Achievement_200616_Name,索拉里斯之极,Pole of Solaris,Cực Điểm Solaris
lang_multi_text.db,MultiText,Achievement_200617_Desc,完成「远航星」。,"Complete ""The Star That Voyages Far.""","Hoàn thành ""Viễn Hành Tinh""."
lang_multi_text.db,MultiText,Achievement_200617_Name,春日降临,Spring Has Come,Xuân Về
lang_multi_text.db,MultiText,Achievement_200618_Desc,与陆一同击败无铭探索者。,Defeat the Nameless Explorer with Luuk.,Cùng Luuk đánh bại Thám Tác Giả Vô Danh.
lang_multi_text.db,MultiText,Achievement_200618_Name,漫长的坠落,The Long Fall,Cú Rơi Dài
lang_multi_text.db,MultiText,Achievement_200619_Desc,抵达渐湖小屋。,Reach the Ginnungamere cabin.,Đến được tiểu ốc Ginnungamere.
lang_multi_text.db,MultiText,Achievement_200619_Name,Home Sweet Home,Home Sweet Home,Home Sweet Home
lang_multi_text.db,MultiText,Achievement_200620_Desc,观看爱弥斯的歌友会演出。,Watch Aemeath's fan meeting performance.,Xem buổi biểu diễn họp mặt fan của Aemeath.
lang_multi_text.db,MultiText,Achievement_200620_Name,亲爱的乔班尼,Dear Giovanni,Giovanni Thân Mến
lang_multi_text.db,MultiText,Achievement_200621_Desc,与爱弥斯合作赢下“石头剪刀布”。,Win the game of Rock-Paper-Scissors with Aemeath.,"Hợp tác với Aemeath giành chiến thắng trong trò ""Oẳn Tù Tì""."
lang_multi_text.db,MultiText,Achievement_200621_Name,猜拳高手,Rock-Paper-Scissors Pro,Cao Thủ Oẳn Tù Tì
lang_multi_text.db,MultiText,Achievement_200622_Desc,成功逃离雪崩。,Successfully escape the avalanche.,Thoát khỏi trận tuyết lở thành công.
lang_multi_text.db,MultiText,Achievement_200622_Name,娜波摩的松果,Nivora's Pinecone,Quả Thông Của Nivora
lang_multi_text.db,MultiText,Achievement_200623_Desc,与爱弥斯一同击败辛吉勒姆。,Defeat Sigillum together with Aemeath.,Cùng Aemeath đánh bại Sigillum.
lang_multi_text.db,MultiText,Achievement_200623_Name,我是……谁？,Who... am I?,Ta là... ai?
lang_multi_text.db,MultiText,Achievement_200701_Desc,完成「开辟测界之路」。,"Complete ""Operation: Frontier Renewal.""","Hoàn thành ""Khai Phá Con Đường Trắc Giới""."
lang_multi_text.db,MultiText,Achievement_200701_Name,衷心的话语,Heartfelt Words,Lời Nói Chân Thành
lang_multi_text.db,MultiText,Achievement_200702_Desc,完成纪闻任务「被光影定格的瞬间」。,"Complete Side Quest ""Moments Captured in Light.""","Hoàn thành nhiệm vụ Kỷ Văn ""Khoảnh Khắc Được Ánh Sáng Lưu Giữ""."
lang_multi_text.db,MultiText,Achievement_200702_Name,未完成的纪念册,Unfinished Photo Album,Sổ Kỷ Niệm Chưa Hoàn Thành
lang_multi_text.db,MultiText,Achievement_200703_Desc,首次在教室里上完一堂课。,Finish your first lesson in class.,Lần đầu tiên hoàn thành một buổi học trong lớp.
lang_multi_text.db,MultiText,Achievement_200703_Name,我们度过的每一个日常,Every Ordinary Day We've Shared,Mỗi ngày bình thường chúng ta đã trải qua
lang_multi_text.db,MultiText,Achievement_200704_Desc,查看车站失物招领区中发布的所有寻物启事。,Check all the lost-and-found notices at the station.,Xem tất cả thông báo tìm đồ thất lạc tại khu nhặt được ở nhà ga.
lang_multi_text.db,MultiText,Achievement_200704_Name,找回来了，都找回来了,"Once Were Lost, But Now Are Found","Tìm lại được rồi, tất cả đều tìm lại được rồi"
lang_multi_text.db,MultiText,Achievement_200705_Desc,完成纪闻任务「终极难题」。,"Complete Side Quest ""Ultimate Challenge.""","Hoàn thành nhiệm vụ Kỷ Văn ""Nan đề tối thượng""."
lang_multi_text.db,MultiText,Achievement_200705_Name,真理与和谐,Truth and Harmony,Chân lý và hài hòa
lang_multi_text.db,MultiText,Achievement_200706_Desc,向利亚斯提供药品。,Deliver medicine to Lias.,Cung cấp thuốc cho Lias.
lang_multi_text.db,MultiText,Achievement_200706_Name,燃眉之急,Urgent Aid,Cấp bách trước mắt
lang_multi_text.db,MultiText,Achievement_200707_Desc,搜集废弃的营地内的所有线索。,Collect all the clues in the abandoned camp.,Thu thập tất cả manh mối trong doanh trại bị bỏ hoang.
lang_multi_text.db,MultiText,Achievement_200707_Name,末日后营地,Apocalypse Camp,Doanh trại hậu tận thế
lang_multi_text.db,MultiText,Achievement_200708_Desc,跟随学院的考察小队抵达3个营地。,Reach 3 camps with the Academy's expedition team.,Đi cùng đội khảo sát của Học viện đến 3 doanh trại.
lang_multi_text.db,MultiText,Achievement_200708_Name,摇曳科考,Laid-Back Expedition,Khảo sát thong dong
lang_multi_text.db,MultiText,Achievement_200709_Desc,完成纪闻任务「只有风知道的答案」。,"Complete Side Quest ""Answers Only the Wind Knows.""","Hoàn thành nhiệm vụ Kỷ Văn ""Câu trả lời chỉ gió mới biết""."
lang_multi_text.db,MultiText,Achievement_200709_Name,心跳的间奏,Interlude of Heartbeat,Khúc gian tấu của nhịp tim
lang_multi_text.db,MultiText,Achievement_200710_Desc,在纪闻任务「星海如故」中，选择告知真相。,"Choose to tell the truth in Side Quest ""Where Starry Seas Endure.""","Trong nhiệm vụ Kỷ Văn ""Biển sao vẫn thế"", chọn tiết lộ sự thật."
lang_multi_text.db,MultiText,Achievement_200710_Name,独自凝望的星海,Alone Among Stars,Biển sao ngắm nhìn trong cô độc
lang_multi_text.db,MultiText,Achievement_200711_Desc,在纪闻任务「星海如故」中，选择隐瞒真相。,"Choose to hide the truth in Side Quest ""Where Starry Seas Endure.""","Trong nhiệm vụ Kỷ Văn ""Biển sao vẫn thế"", chọn giấu kín sự thật."
lang_multi_text.db,MultiText,Achievement_200711_Name,恒定不变的星海,Eternal Among Stars,Biển sao hằng định bất biến
lang_multi_text.db,MultiText,Achievement_200712_Desc,收集齐赛斯坦教授的所有日志。,Collect all of Professor Sestan's logs.,Thu thập đầy đủ tất cả nhật ký của Giáo sư Sestan.
lang_multi_text.db,MultiText,Achievement_200712_Name,在死亡中新生,Reborn in Death,Tái sinh trong cái chết
lang_multi_text.db,MultiText,Achievement_200713_Desc,在纪闻任务「捕影捉风」中，深空联合方面于整流车站内成功挫败了流民的袭击行动。,"Help Spacetrek Collective repel the Outcast assault at Relay Station in Side Quest ""Catch the Winds.""","Trong nhiệm vụ Kỷ Văn ""Bắt bóng đuổi gió"", phía Thâm Không Liên Hợp đã thành công đẩy lùi cuộc tấn công của lưu dân tại Trạm Chỉnh Lưu."
lang_multi_text.db,MultiText,Achievement_200713_Name,风影尽散,When the Winds Stop,Gió tan bóng tán
lang_multi_text.db,MultiText,Achievement_200714_Desc,在纪闻任务「捕影捉风」中发现联系人名录并将其交予奥兰，成功阻止流民袭击整流车站。,"Find the contact list and deliver it to Oran and successfully prevent the Outcasts from attacking Relay Station in Side Quest ""Catch the Winds.""","Trong nhiệm vụ Kỷ Văn ""Bắt bóng đuổi gió"", phát hiện danh sách liên lạc và giao cho Oran, thành công ngăn chặn lưu dân tấn công Trạm Chỉnh Lưu."
lang_multi_text.db,MultiText,Achievement_200714_Name,风影未至,Before the Winds Blow,Gió bóng chưa tới
lang_multi_text.db,MultiText,Achievement_200715_Desc,在拉海洛野外的篝火旁与罗伊人一同围坐攀谈。,Sit around the campfire in Lahai-Roi's wilderness and talk to the Roya.,Ngồi quây quần trò chuyện cùng người Roya bên đống lửa trại ở vùng hoang dã Lahai-Roi.
lang_multi_text.db,MultiText,Achievement_200715_Name,并非存档点,Not A Checkpoint,Không phải điểm lưu
lang_multi_text.db,MultiText,Achievement_200716_Desc,在音乐教室坐下，聆听 I.R.I.S.的吉他与哼唱。,Sit in the music classroom and listen to I.R.I.S. playing guitar and humming.,"Ngồi xuống trong phòng học nhạc, lắng nghe I.R.I.S. chơi guitar và ngân nga."
lang_multi_text.db,MultiText,Achievement_200716_Name,Take On Me,Take On Me,Take On Me
lang_multi_text.db,MultiText,Achievement_200717_Desc,与莫宁一同见证溺森涡道的景色。,Witness the scenery of Submerged Tunnel with Mornye.,Cùng Mornye chiêm ngưỡng cảnh sắc của Đường hầm Chìm.
lang_multi_text.db,MultiText,Achievement_200717_Name,潜航器会梦见数据海吗,Do Submarines Dream of Data Seas?,Tàu ngầm có mơ về biển dữ liệu không?
lang_multi_text.db,MultiText,Achievement_200718_Desc,与正在围观日灵踩踏蕨团蕨的人们交谈。,Talk to the crowd watching the Soliskin trampling the Fern Spores.,Trò chuyện với đám đông đang xem Nhật Linh giẫm lên Quyết Đoàn Quyết.
lang_multi_text.db,MultiText,Achievement_200718_Name,完全入味,Fully Flavored,Ngấm đều hoàn toàn
lang_multi_text.db,MultiText,Achievement_200719_Desc,在电话亭中，拨打那个通往遗忘之域的号码。,Dial the number leading to the Realm of Oblivion at the telephone booth.,"Trong bốt điện thoại, quay số dẫn đến Cõi Lãng Quên."
lang_multi_text.db,MultiText,Achievement_200719_Name,由线径而存在的一处孔隙,A Hole Defined by the Line,Một kẽ hở tồn tại nhờ đường kính dây
lang_multi_text.db,MultiText,Achievement_200720_Desc,不拨打陌生的电话号码，在与好奇心的角力中取得胜利。,"Resist dialing the unknown number, triumphing in this battle of curiosity.","Không quay số điện thoại lạ, giành chiến thắng trong cuộc đấu với sự tò mò."
lang_multi_text.db,MultiText,Achievement_200720_Name,被遗忘的伊苏林迪,The Forgotten Insulindian,Insulindian bị lãng quên
lang_multi_text.db,MultiText,Achievement_200721_Desc,使用大气拟造阵列控制模块生成模拟天气。,Generate simulated weather by adjusting the Sky Projection Array.,Sử dụng mô-đun điều khiển Trận Liệt Mô Phỏng Khí Quyển để tạo thời tiết giả lập.
lang_multi_text.db,MultiText,Achievement_200721_Name,天气模拟准备就绪,Weather Simulation Ready,Mô phỏng thời tiết đã sẵn sàng
lang_multi_text.db,MultiText,Achievement_200722_Desc,跟随菲茨，找到了司各特留下的磁带。,Follow Fitz and find the cassette left behind by Scott.,"Đi theo Fitz, tìm được băng cassette mà Scott để lại."
lang_multi_text.db,MultiText,Achievement_200722_Name,伟大的悲剧,A Great Tragedy,Bi kịch vĩ đại
lang_multi_text.db,MultiText,Achievement_200723_Desc,未能跟上菲茨的脚步……,Fail to keep up with Fitz…,Không thể theo kịp bước chân của Fitz...
lang_multi_text.db,MultiText,Achievement_200723_Name,至少你还记得……,At Least You Remember...,Ít nhất cậu vẫn còn nhớ...
