db_file,table_name,id,zh,en,vi
lang_multi_text.db,MultiText,Event_TMDZJ_1_11,只要能帮助多萝西打倒那些怪物，我就可以把我收集的宝物全都送给你……,Help me beat them and get me home. My entire collection is all yours...,"Chỉ cần giúp Dorothy đánh bại mấy con quái vật đó, em sẽ tặng hết tất cả kho báu em thu thập được cho anh..."
lang_multi_text.db,MultiText,Event_TMDZJ_1_12,你怎么知道我的名字？,Why do you know my name?,Sao em biết tên tôi?
lang_multi_text.db,MultiText,Event_TMDZJ_1_13,似曾相识的台词……,That sounds oddly familiar...,Câu nói quen quen thế nào ấy...
lang_multi_text.db,MultiText,Event_TMDZJ_1_14,啊……当然是……因为我在门那一侧的世界里见过{Male=大哥哥;Female=大姐姐}呀。,"Ah, well... Because I've met you on the other side of the Gate before... Hehe.",À... tất nhiên là... vì em đã gặp {Male=anh;Female=chị} ở thế giới bên kia cánh cửa rồi mà.
lang_multi_text.db,MultiText,Event_TMDZJ_1_15,真的么？,Really?,Thật sao?
lang_multi_text.db,MultiText,Event_TMDZJ_1_16,当然，因为真正的时间比想象中的更复杂一些？就像一种并非是对过去，而是对将来的记忆？,"Yeah, it's true. Time works in a way that is a little more complicated than what you may think. Sometimes our memory stems not from the past, but from the future.","Tất nhiên, vì thời gian thật sự phức tạp hơn ta tưởng nhiều. Giống như một loại ký ức không phải về quá khứ, mà là về tương lai vậy?"
lang_multi_text.db,MultiText,Event_TMDZJ_1_17,就像一个首尾相连的圆……,It's like an never-ending loop...,Giống như một vòng tròn nối đầu nối đuôi...
lang_multi_text.db,MultiText,Event_TMDZJ_1_18,诶呀，是既视感吧？毕竟{Male=大哥哥;Female=大姐姐}一看就是经常帮助别人的善良的人啊。,"Oh, I guess it's what they call a feeling of déjà vu? You look so kind, you must've been helping other people often.","Ây da, chắc là cảm giác quen thuộc thôi? Nhìn {Male=anh;Female=chị} là biết ngay là người tốt bụng hay giúp đỡ người khác mà."
lang_multi_text.db,MultiText,Event_TMDZJ_1_19,真的么？,Really?,Thật sao?
lang_multi_text.db,MultiText,Event_TMDZJ_1_2,这里发生什么事了？,What happened here?,Chuyện gì xảy ra ở đây vậy?
