db_file,table_name,id,zh,en,vi
lang_multi_text.db,MultiText,RogueRes_EventPlot_Des_600191_06,「状态增益」寻找信件的主人,[Status Boost] Look for the letter's recipient.,[Tăng Ích Trạng Thái] Tìm kiếm chủ nhân của bức thư
lang_multi_text.db,MultiText,RogueRes_EventPlot_Des_600191_07,「节能主义」将信放回原处,[Save the Drama] Put it back.,[Tiết Kiệm] Đặt thư về chỗ cũ
lang_multi_text.db,MultiText,RogueRes_EventPlot_Des_600191_08,你试图寻找到更多的信息，但最终一无所获，只能将信件重新怀揣。,"You search for more clues but find nothing. So, you put it back to your pocket.","Bạn cố gắng tìm thêm thông tin, nhưng cuối cùng chẳng thu hoạch được gì, chỉ đành cất lại bức thư vào trong ngực."
lang_multi_text.db,MultiText,RogueRes_EventPlot_Des_600191_09,旅途还长，总能遇到它的收件人或是寄件人。,"A long journey awaits ahead, and maybe, somewhere along the way, you'll meet the sender. Or the recipient.","Hành trình còn dài, rồi sẽ gặp được người nhận hoặc người gửi của nó thôi."
lang_multi_text.db,MultiText,RogueRes_EventPlot_Des_600191_10,像这样的信还有千千万万，而你却只有一人。,There are thousands of millions of letters like this. And you? You are only one.,"Có hàng ngàn hàng vạn bức thư như thế này, mà bạn thì chỉ có một mình."
lang_multi_text.db,MultiText,RogueRes_EventPlot_Des_600191_11,何况这本来就是他人被遗忘的故事。你将信件放回原处，希望它能等来自己的主人。,"Besides, this is a forgotten story. You slip the letter back where you found it, leaving it to wait for an owner. Someone who may never return.","Huống hồ đây vốn là câu chuyện bị lãng quên của người khác. Bạn đặt bức thư về chỗ cũ, hy vọng nó có thể đợi được chủ nhân của mình."
lang_multi_text.db,MultiText,RogueRes_EventPlot_Des_600201_01,成年累月积攒的快递随货架的腐朽一同倒下。精心整理好的时间散落打乱，但这次，无人在意。,"Stacks of undelivered packages accumulated through the years collapse with the rotten shelves. Memories, once neatly organized, pour out in a mess. But this time, no one cares.","Những bưu kiện tích tụ qua năm tháng cùng với kệ hàng mục nát đổ xuống. Thời gian được sắp xếp cẩn thận giờ đây vương vãi lộn xộn, nhưng lần này, chẳng ai để ý."
lang_multi_text.db,MultiText,RogueRes_EventPlot_Des_600201_02,在这些送往异国的快递中，金钱与食物都能“被”找到主人，但家书就不一定了。,"Among the shipments bound for distant lands, money and food will always find their ways to *a* owner. Letters, though? Not always.","Trong những bưu kiện gửi đi nước ngoài này, tiền bạc và thực phẩm đều có thể ""được"" tìm thấy chủ nhân, nhưng thư nhà thì chưa chắc."
lang_multi_text.db,MultiText,RogueRes_EventPlot_Des_600201_03,“……母亲没有等来你的消息便去世了。我把家里的老屋重新修整了，如果你回来也有地方落脚。”,"""...Mother passed away before your message arrived. I redecorated the old house, so you'll have a place to stay when you're home.""","""...Mẹ chưa kịp đợi tin của anh thì đã qua đời rồi. Em đã sửa sang lại ngôi nhà cũ, nếu anh về thì cũng có nơi để ở."""
lang_multi_text.db,MultiText,RogueRes_EventPlot_Des_600201_04,“这几年来你了无音讯，我也不知道这封信能不能送到你的手中……不过，我会等你回来的。”,"""It's been years since we last heard from you. I don't know if this one will reach you... But no matter what, I'll always be here, waiting for your return.""","""Mấy năm nay anh bặt vô âm tín, em cũng không biết bức thư này có gửi được đến tay anh không... Nhưng mà, em sẽ đợi anh về."""
lang_multi_text.db,MultiText,RogueRes_EventPlot_Des_600201_05,信剩下的部分模糊不清，但收信人一栏的名字你感觉似曾相识。,"The rest of the letter is illegible, except for only the recipient's name that looks too familiar.","Phần còn lại của bức thư mờ nhòe không rõ, nhưng cái tên ở mục người nhận khiến bạn cảm thấy quen quen."
lang_multi_text.db,MultiText,RogueRes_EventPlot_Des_600201_06,「心血来潮」寻找信件的主人,[Fleeting Fancy] Look for the letter's recipient.,[Tùy Hứng] Tìm kiếm chủ nhân của bức thư
lang_multi_text.db,MultiText,RogueRes_EventPlot_Des_600201_07,「节能主义」拿走信中附件,[Save the Drama] Take away the attachment.,[Tiết Kiệm] Lấy đi vật đính kèm trong thư
lang_multi_text.db,MultiText,RogueRes_EventPlot_Des_600201_08,一封两封都是送。施以援助的信念不会因为某个突发因素发生改变。,Another letter to delivering? Not a big deal. The will to help stay the same no matter what accident comes your way.,Một bức hay hai bức thì cũng là gửi. Niềm tin giúp đỡ người khác sẽ không thay đổi vì một yếu tố bất ngờ nào đó.
lang_multi_text.db,MultiText,RogueRes_EventPlot_Des_600201_09,你带上了信件，继续去寻找它的主人。,"You take the letter with you and get back on the road, looking for its owner.","Bạn mang theo bức thư, tiếp tục đi tìm chủ nhân của nó."
lang_multi_text.db,MultiText,RogueRes_EventPlot_Des_600201_10,如果做不到物归原主，把它留在这里也不失为一种选择。,"If you can't find its owner, maybe leaving it where it is can also be a good choice.","Nếu không thể vật về nguyên chủ, để nó lại đây cũng là một lựa chọn không tồi."
lang_multi_text.db,MultiText,RogueRes_EventPlot_Des_600201_11,或许相比退回原址，无人在意的货架才是这些信件的最好归宿。,"Maybe, rather than being returned to their senders, these forgotten letters belong right here. On the collapsed shelves no one cares for.","Có lẽ so với việc bị trả về địa chỉ cũ, kệ hàng không ai để ý mới là nơi chốn tốt nhất cho những bức thư này."
lang_multi_text.db,MultiText,RogueRes_EventPlot_Des_600201_12,毕竟迟到的念想也是念想……对吧？,"After all, a message too late is still a message... is it not?",Dù sao thì nỗi nhớ đến muộn cũng là nỗi nhớ... đúng không?
lang_multi_text.db,MultiText,RogueRes_EventPlot_Des_600211_01,成年累月积攒的快递随货架的腐朽一同倒下。精心整理好的时间散落打乱，但这次，无人在意。,"Stacks of undelivered packages accumulated through the years collapse with the rotten shelves. Memories, once neatly organized, pour out in a mess. But this time, no one cares.","Những bưu kiện tích tụ qua năm tháng cùng với kệ hàng mục nát đổ xuống. Thời gian được sắp xếp cẩn thận giờ đây vương vãi lộn xộn, nhưng lần này, chẳng ai để ý."
lang_multi_text.db,MultiText,RogueRes_EventPlot_Des_600211_02,在这些送往异国的快递中，金钱与食物都能“被”找到主人，但家书就不一定了。,"Among the shipments bound for distant lands, money and food will always find their ways to *a* owner. Letters, though? Not always.","Trong những bưu kiện gửi đi nước ngoài này, tiền bạc và thực phẩm đều có thể ""được"" tìm thấy chủ nhân, nhưng thư nhà thì chưa chắc."
lang_multi_text.db,MultiText,RogueRes_EventPlot_Des_600211_03,“先生，您的名下有一笔房屋的滞纳金需要支付。请在十五个工作日内完成缴纳，逾期将面临封存处理。”,"""Dear Sir, a overdue fine is payable under your name. Please complete the payment within fifteen working days to avoid any restrictive measures due to delayed payment.""","""Thưa ông, dưới danh nghĩa của ông có một khoản phí nộp chậm tiền nhà cần thanh toán. Vui lòng hoàn tất nộp phạt trong vòng mười lăm ngày làm việc, quá hạn sẽ phải đối mặt với biện pháp niêm phong."""
lang_multi_text.db,MultiText,RogueRes_EventPlot_Des_600211_04,“另询问您是否对名下的房屋有出售或拆迁的意向。若您想了解详情，欢迎您随时致电……”,"""Additionally, we would like to inquire whether you have any plans to sell the property under your name. If you would like to learn more details, please feel free to contact us at your convenience...""","""Ngoài ra, xin hỏi ông có ý định bán hoặc di dời căn nhà dưới danh nghĩa của mình không. Nếu ông muốn biết thêm chi tiết, xin vui lòng gọi điện bất cứ lúc nào..."""
lang_multi_text.db,MultiText,RogueRes_EventPlot_Des_600211_05,信剩下的部分模糊不清，但你确信不止一次看到过这个名字。,"The rest of the letter is illegible, but you're convinced you've seen this name before. More than once.","Phần còn lại của bức thư mờ nhòe không rõ, nhưng bạn chắc chắn đã nhìn thấy cái tên này không chỉ một lần."
lang_multi_text.db,MultiText,RogueRes_EventPlot_Des_600211_06,「心血来潮」把信放回原处,[Fleeting Fancy] Put it back.,[Tùy Hứng] Đặt thư về chỗ cũ
lang_multi_text.db,MultiText,RogueRes_EventPlot_Des_600211_07,「节能主义」转身离开,[Save the Drama] Turn around and leave.,[Tiết Kiệm] Quay người rời đi
lang_multi_text.db,MultiText,RogueRes_EventPlot_Des_600211_08,你把信放回到原处。很快它就和其他的无主信件融在一起，共同记述着被遗忘的时间。,"You slip the letter back where you found it, and it soon blends in. Back into its kind, letters without owners. Just another ordinary thread in the tapestry of forgotten time.","Bạn đặt bức thư trở lại chỗ cũ. Rất nhanh nó đã hòa lẫn với những bức thư vô chủ khác, cùng nhau ghi lại thời gian bị lãng quên."
lang_multi_text.db,MultiText,RogueRes_EventPlot_Des_600211_09,它们都在渴望一个答案。但，找不到的答案或许就是答案本身。,They all yearn for an answer. But maybe the absence of one is the answer.,"Chúng đều đang khao khát một câu trả lời. Nhưng, không tìm thấy câu trả lời có lẽ chính là câu trả lời."
lang_multi_text.db,MultiText,RogueRes_EventPlot_Des_600211_10,这不过是千万封信件中所记述的一个故事。,Just another story among a thousand.,Đây chẳng qua chỉ là một câu chuyện được ghi lại trong hàng ngàn hàng vạn bức thư.
lang_multi_text.db,MultiText,RogueRes_EventPlot_Des_600211_11,没有转折和伏笔，没有希望和绝望……同样，也没有结局。,"No twists, no foreshadowing, No hope, no despair. And... no ending, either.","Không có bước ngoặt hay điềm báo, không có hy vọng và tuyệt vọng... Tương tự, cũng không có kết cục."
lang_multi_text.db,MultiText,RogueRes_EventPlot_Des_600221_01,你来到了一处被时间遗忘的幽香暗巷。,"You step into a narrow, aromatic alleyway. A place time forgets to pass through.",Bạn bước vào một con hẻm tối ngát hương bị thời gian lãng quên.
