db_file,table_name,id,zh,en,vi
lang_multi_text.db,MultiText,Achievement_200102_Desc,获得令尹转交的糖果信物。,Receive the Sugar Pearl from Jinzhou's Magistrate.,Nhận tín vật kẹo do Lệnh Doãn chuyển giao.
lang_multi_text.db,MultiText,Achievement_200102_Name,糖果与谜语,Candy Spells Riddle,Kẹo Ngọt Và Câu Đố
lang_multi_text.db,MultiText,Achievement_200103_Desc,完成「嘤鸣初相召」。,"Complete ""First Resonance.""","Hoàn thành ""Anh Minh Sơ Tướng Triệu""."
lang_multi_text.db,MultiText,Achievement_200103_Name,令尹如是说·无声留言,Thus Spoke the Magistrate: Wordless Message,Lệnh Doãn Nói Rằng - Lời Nhắn Vô Thanh
lang_multi_text.db,MultiText,Achievement_200104_Desc,和研究员们进行谈心。,Talk with the researchers.,Tâm sự với các nghiên cứu viên.
lang_multi_text.db,MultiText,Achievement_200104_Name,研究院的心灵树洞,Researchers' Trusted Confidant,Hốc Cây Tâm Sự Của Viện Nghiên Cứu
lang_multi_text.db,MultiText,Achievement_200105_Desc,完成「撞金止行阵」。,"Complete ""Echoing Marche.""","Hoàn thành ""Chàng Kim Chỉ Hành Trận""."
lang_multi_text.db,MultiText,Achievement_200105_Name,令尹如是说·前线之音,Thus Spoke the Magistrate: Frontline Calls,Lệnh Doãn Nói Rằng - Âm Thanh Tiền Tuyến
lang_multi_text.db,MultiText,Achievement_200106_Desc,完成「奔策候残星」。,"Complete ""Ominous Star.""","Hoàn thành ""Bôn Sách Hậu Tàn Tinh""."
lang_multi_text.db,MultiText,Achievement_200106_Name,牧羊游戏,Shepherd Game,Trò Chơi Chăn Cừu
lang_multi_text.db,MultiText,Achievement_200107_Desc,调查祈池村的桃树。,Inspect the peach tree in the Qichi Village.,Điều tra cây đào ở Thôn Kỳ Trì.
lang_multi_text.db,MultiText,Achievement_200107_Name,「桃树脚下埋葬着……」,"""Buried under the Peach Blossom Tree...""","""Dưới gốc đào chôn cất..."""
lang_multi_text.db,MultiText,Achievement_200108_Desc,完成「庭际刀刃鸣」。,"Complete ""Clashing Blades.""","Hoàn thành ""Đình Tế Đao Nhận Minh""."
lang_multi_text.db,MultiText,Achievement_200108_Name,想要传达的旋律,A Whispering Melody,Giai Điệu Muốn Gửi Trao
lang_multi_text.db,MultiText,Achievement_200109_Desc,完成「欲知天将雨」。,"Complete ""Rewinding Raindrops.""","Hoàn thành ""Dục Tri Thiên Tương Vũ""."
lang_multi_text.db,MultiText,Achievement_200109_Name,大雨如期而至,If the Melody Rings True,Mưa Lớn Đến Đúng Hẹn
lang_multi_text.db,MultiText,Achievement_200110_Desc,成功找回五个缺失的音斛。,Retrieve all 5 missing Sonodisks.,Tìm lại thành công 5 Âm Hộc bị mất.
lang_multi_text.db,MultiText,Achievement_200110_Name,调音师,The Tuning Master,Bậc Thầy Chỉnh Âm
lang_multi_text.db,MultiText,Achievement_200111_Desc,完成「拯救世界？拯救猫咪！」系列任务。,"Complete all quests of ""Save the World? Save the Cat!"".","Hoàn thành chuỗi nhiệm vụ ""Giải Cứu Thế Giới? Giải Cứu Mèo Con!""."
lang_multi_text.db,MultiText,Achievement_200111_Name,寻喵环游记,Kitten First,Hành Trình Tìm Mèo
lang_multi_text.db,MultiText,Achievement_200112_Desc,完成「直至无人聆听」。,"Complete ""Until No One Listens.""","Hoàn thành ""Đến Khi Không Ai Lắng Nghe""."
lang_multi_text.db,MultiText,Achievement_200112_Name,重归寂静,Return to Silence,Trở Về Tĩnh Lặng
lang_multi_text.db,MultiText,Achievement_200113_Desc,在「直至无人聆听·后日谈」中选择将千歆的结局告知晏梓、伊筹。,"Choose to tell Yanzi and Yichou about Qianxin's ending in ""Until No One Listens: Epilogue.""","Trong ""Đến Khi Không Ai Lắng Nghe - Hậu Truyện"", chọn kể kết cục của Thiên Hâm cho Yến Tử và Y Trù."
lang_multi_text.db,MultiText,Achievement_200113_Name,随风而至的歌,Windbrone Tunes,Bài Ca Theo Gió Mà Đến
lang_multi_text.db,MultiText,Achievement_200114_Desc,在「直至无人聆听·后日谈」中选择不将千歆的结局告知晏梓、伊筹。,"Choose not to tell Yenzi and Yichu about Chihshin's ending in ""Until No One Listens: Epilogue.""","Trong ""Đến Khi Không Ai Lắng Nghe - Hậu Truyện"", chọn không kể kết cục của Thiên Hâm cho Yến Tử và Y Trù."
lang_multi_text.db,MultiText,Achievement_200114_Name,慰藉没有意义,Consolation is Pointless,An Ủi Là Vô Nghĩa
lang_multi_text.db,MultiText,Achievement_200115_Desc,在「拍忆今州」中完成第一次拍照。,"Capture your first photo in ""Photos of Jinzhou.""","Hoàn thành lần chụp ảnh đầu tiên trong ""Chụp Ảnh Kim Châu""."
lang_multi_text.db,MultiText,Achievement_200115_Name,影像从心，感动常在,Captivating You Always,"Ảnh Từ Tâm, Cảm Động Mãi"
lang_multi_text.db,MultiText,Achievement_200116_Desc,完成「往岁乘霄醒惊蛰」。,"Complete ""Thaw of Eons.""","Hoàn thành ""Vãng Tuế Thừa Tiêu Tỉnh Kinh Trập""."
lang_multi_text.db,MultiText,Achievement_200116_Name,启蛰醒春,Spring Awakening,Sấm Xuân Đánh Thức
lang_multi_text.db,MultiText,Achievement_200117_Desc,进入乘霄山。,Reach Mt. Firmament.,Tiến vào Thừa Tiêu Sơn.
lang_multi_text.db,MultiText,Achievement_200117_Name,林尽水源，便得一山,Mountain Beyond the Forest,"Hết rừng cùng nước, lại thấy một ngọn núi"
lang_multi_text.db,MultiText,Achievement_200118_Desc,完成「月从今夜满」。,"Complete ""Moonlit Reunion.""","Hoàn thành ""Nguyệt Tòng Kim Dạ Mãn""."
lang_multi_text.db,MultiText,Achievement_200118_Name,祈愿传说,A Fable About Moon and Wishes,Truyền Thuyết Cầu Nguyện
lang_multi_text.db,MultiText,Achievement_200119_Desc,完成「月下祈愿其一·倾听之音」。,"Complete ""Wish Upon the Moon I: Cry of the Soul.""","Hoàn thành ""Lời Cầu Nguyện Dưới Trăng I - Âm Thanh Lắng Nghe""."
lang_multi_text.db,MultiText,Achievement_200119_Name,心声的传递,We're Listening,Truyền Tải Tiếng Lòng
lang_multi_text.db,MultiText,Achievement_200120_Desc,完成「月下祈愿其二·老人与约定」。,"Complete ""Wish Upon the Moon II: The Elder's Promise.""","Hoàn thành ""Lời Cầu Nguyện Dưới Trăng II - Ông Lão Và Lời Hứa""."
lang_multi_text.db,MultiText,Achievement_200120_Name,见证之物,Token of Promise,Vật Chứng Kiến
lang_multi_text.db,MultiText,Achievement_200121_Desc,完成「月下祈愿其三·幼小的英雄梦」。,"Complete ""Wish Upon the Moon III: Dreaming of Heroism.""","Hoàn thành ""Lời Cầu Nguyện Dưới Trăng III - Giấc Mơ Anh Hùng Nhỏ Bé""."
lang_multi_text.db,MultiText,Achievement_200121_Name,何谓英雄,What Is a Hero,Thế Nào Là Anh Hùng
lang_multi_text.db,MultiText,Achievement_200122_Desc,完成「月下祈愿其四·负手之歌」及「今宵共赏明月色」。,"Complete ""Wish Upon the Moon IV - Swan Song and Eve of Celebration.""","Hoàn thành ""Lời Cầu Nguyện Dưới Trăng IV - Khúc Ca Chắp Tay"" và ""Đêm Nay Cùng Ngắm Ánh Trăng""."
lang_multi_text.db,MultiText,Achievement_200122_Name,明月照我心,The Moon Knows My Heart,Trăng Sáng Soi Lòng Ta
lang_multi_text.db,MultiText,Achievement_200123_Desc,完成「行至海岸尽头」。,"Complete ""To the Shore's End.""","Hoàn thành ""Đi Đến Tận Cùng Bờ Biển""."
lang_multi_text.db,MultiText,Achievement_200123_Name,One Last Ocean,One Last Ocean,One Last Ocean
lang_multi_text.db,MultiText,Achievement_200124_Desc,第一次进入黑海岸区域。,Arrive at the Black Shores for the first time.,Lần đầu tiên tiến vào khu vực Bờ Biển Đen.
lang_multi_text.db,MultiText,Achievement_200124_Name,蝴蝶终越沧海,Butterfly Across the Sea,Cánh Bướm Vượt Biển Cả
lang_multi_text.db,MultiText,Achievement_200125_Desc,通过星门来到黑海岸的下层区域。,Enter the underground area of the Black Shores through the Stargate.,Thông qua Cổng Sao đi đến khu vực tầng dưới của Bờ Biển Đen.
lang_multi_text.db,MultiText,Achievement_200125_Name,穿越星门,Through the Stargate,Vượt Qua Cổng Sao
lang_multi_text.db,MultiText,Achievement_200126_Desc,分别在白天和夜晚与库哼哼、库哈哈对话。,Talk to KU-Hehe and KU-HaHa during daytime and nighttime respectively.,Đối thoại với KU-Hừ Hừ và KU-Ha Ha vào ban ngày và ban đêm.
lang_multi_text.db,MultiText,Achievement_200126_Name,哼哈二将,Hehe Haha,Hừ Ha Nhị Tướng
lang_multi_text.db,MultiText,Achievement_200127_Desc,命令任意型号的库洛洛进行充电。,Instruct any KU-Roro model to conduct a recharge.,Ra lệnh cho bất kỳ mẫu KU-Roro nào tiến hành sạc điện.
lang_multi_text.db,MultiText,Achievement_200127_Name,三点几嚟，充电先啦,Recharge Time at 3 P.M.,"Ba giờ rồi, sạc điện trước đã"
lang_multi_text.db,MultiText,Achievement_200128_Desc,完成「星海拾影」。,"Complete ""Amidst the Stars.""","Hoàn thành ""Nhặt Lấy Bóng Hình Biển Sao""."
lang_multi_text.db,MultiText,Achievement_200128_Name,暗淡蓝点,Pale Blue Dot,Điểm Xanh Mờ Nhạt
lang_multi_text.db,MultiText,Achievement_200129_Desc,命令任意型号的库洛洛执行其本职工作。,Instruct any KU-Roro model to perform their intended function.,Ra lệnh cho bất kỳ mẫu KU-Roro nào thực hiện công việc chính của nó.
lang_multi_text.db,MultiText,Achievement_200129_Name,小库同学,"""Hey, KU-Roro""",Bạn KU Nhỏ
lang_multi_text.db,MultiText,Achievement_200201_Desc,完成「此际我独行」。,"Complete ""Solitary Path.""","Hoàn thành ""Lúc Này Tôi Độc Hành""."
lang_multi_text.db,MultiText,Achievement_200201_Name,于阴影中守望,Keeper in the Darkness,Canh Giữ Trong Bóng Tối
lang_multi_text.db,MultiText,Achievement_200202_Desc,在「长夜将明」中，参与「咕咕河豚接力赛」。,"Participate in ""Gulpuff Relay"" in ""Daybreak at Last.""","Trong ""Đêm Dài Sắp Sáng"", tham gia ""Giải Chạy Tiếp Sức Cá Nóc Ục Ục""."
lang_multi_text.db,MultiText,Achievement_200202_Name,重在参与,Participation is the Key,Quan Trọng Là Tham Gia
lang_multi_text.db,MultiText,Achievement_200203_Desc,完成「长夜将明」。,"Complete ""Daybreak at Last.""","Hoàn thành ""Đêm Dài Sắp Sáng""."
lang_multi_text.db,MultiText,Achievement_200203_Name,夕阳如故,The Same Sunset,Hoàng Hôn Như Cũ
lang_multi_text.db,MultiText,Achievement_200204_Desc,在「啸野归城」中，完成「寻音溯源」。,"Complete ""Sound Tracing"" in ""Wild Heart's Return.""","Trong ""Khiếu Dã Quy Thành"", hoàn thành ""Tìm Âm Truy Nguyên""."
lang_multi_text.db,MultiText,Achievement_200204_Name,铃儿响叮当,Jingle Bells,Chuông Reo Leng Keng
lang_multi_text.db,MultiText,Achievement_200205_Desc,完成「啸野归城」。,"Complete ""Wild Heart's Return.""","Hoàn thành ""Khiếu Dã Quy Thành""."
lang_multi_text.db,MultiText,Achievement_200205_Name,抑扬百兽舞，狻猊弄斑足,Rising Suan'ni,"Trăm Thú Múa Nhịp Nhàng, Toan Nghê Khoe Chân Đốm"
lang_multi_text.db,MultiText,Achievement_200206_Desc,完成「于古榕的月光下」。,"Complete ""Under the Moonlit Banyan.""","Hoàn thành ""Dưới Ánh Trăng Cổ Thụ""."
lang_multi_text.db,MultiText,Achievement_200206_Name,榕树上的弯月亮,Crescent Moon on the Banyan Tree,Vầng Trăng Khuyết Trên Cây Đa
lang_multi_text.db,MultiText,Achievement_200307_Desc,完成「离火弈长生」。,"Complete ""Immortal Blaze.""","Hoàn thành ""Ly Hỏa Dịch Trường Sinh""."
lang_multi_text.db,MultiText,Achievement_200307_Name,古路无行客,Deserted Trail,Đường Cũ Không Người Qua
lang_multi_text.db,MultiText,Achievement_200308_Desc,完成相里要邀约「我邀朗月」。,Complete Xiangli Yao's Invitation: Moon Shall Be My Guest.,"Hoàn thành lời mời của Tương Lý Yếu ""Ta Mời Trăng Sáng""."
lang_multi_text.db,MultiText,Achievement_200308_Name,迟到的心愿,Belated Wish,Tâm Nguyện Muộn Màng
lang_multi_text.db,MultiText,Achievement_200309_Desc,完成折枝邀约「愿逐月华」。,Complete Zhezhi's Invitation: Chasing the Moon's Glory.,"Hoàn thành lời mời của Chiết Chi ""Nguyện Theo Ánh Trăng""."
lang_multi_text.db,MultiText,Achievement_200309_Name,画中人,Paint Me As Your Friend,Người Trong Tranh
lang_multi_text.db,MultiText,Achievement_200310_Desc,完成「自问丹青」。,"Complete ""True Colors.""","Hoàn thành ""Tự Vấn Đan Thanh""."
lang_multi_text.db,MultiText,Achievement_200310_Name,吾心落笔意,Preserve the True Colors,Lòng Ta Gửi Vào Nét Bút
lang_multi_text.db,MultiText,Achievement_200311_Desc,完成「小小羊咩大冒险」。,"Complete ""Small Wooly, Big Adventures.""","Hoàn thành ""Cuộc Phiêu Lưu Của Cừu Bé Bê Be""."
lang_multi_text.db,MultiText,Achievement_200311_Name,所有失去的和所有找回的,"Every Loss, Every Gain",Tất Cả Những Gì Đã Mất Và Tìm Lại Được
lang_multi_text.db,MultiText,Achievement_200312_Desc,完成「小径分岔的星海」。,"Complete ""Forking Paths Among the Stars.""","Hoàn thành ""Biển Sao Phân Nhánh""."
lang_multi_text.db,MultiText,Achievement_200312_Name,我给你，一朵椿花的记忆,I Offer You the Memory of a Camellia,Ta Tặng Ngươi Ký Ức Của Một Đóa Hoa Xuân
lang_multi_text.db,MultiText,Achievement_200313_Desc,在黑海岸找到椿，与她交谈。,Find Camellya in the Black Shores and talk to her.,Tìm Xuân ở Bờ Biển Đen và nói chuyện với cô ấy.
lang_multi_text.db,MultiText,Achievement_200313_Name,朝日如故,Yet Another Sunrise,Bình Minh Như Cũ
lang_multi_text.db,MultiText,Achievement_200314_Desc,完成潮汐任务「暗夜叩响白昼之门」。,Complete Main Quest: When the Night Knocks,"Hoàn thành nhiệm vụ Thủy Triều ""Đêm Tối Gõ Cửa Ban Mai""."
lang_multi_text.db,MultiText,Achievement_200314_Name,Save the Cat!,Save the Cat!,Save the Cat!
lang_multi_text.db,MultiText,Achievement_200315_Desc,获得1200枚「拼凑的梦」。,Obtain 1200 Dream Shards.,"Nhận được 1200 mảnh ""Giấc Mơ Chắp Vá""."
lang_multi_text.db,MultiText,Achievement_200315_Name,梦境碎片,Broken Dream,Mảnh Vỡ Giấc Mơ
lang_multi_text.db,MultiText,Achievement_200316_Desc,触发一次「联梦融觉」。,"Activate ""Dream Link"" once.","Kích hoạt ""Liên Mộng Dung Giác"" một lần."
lang_multi_text.db,MultiText,Achievement_200316_Name,共鸣者：RELINK,Resonators: Relink,Cộng Hưởng Giả: RELINK
lang_multi_text.db,MultiText,Achievement_200317_Desc,完成「如果在雨夜，一个家族」。,"Complete ""If On a Rainy Night a Family.""","Hoàn thành ""Nếu Trong Đêm Mưa, Một Gia Đình""."
lang_multi_text.db,MultiText,Achievement_200317_Name,Shine on You Crazy Opal,Shine On You Crazy Opal,Shine On You Crazy Opal
lang_multi_text.db,MultiText,Achievement_200318_Desc,完成「今夜星光灿烂」。,"Complete ""Starry is the Night.""","Hoàn thành ""Đêm Nay Sao Sáng Rực Rỡ""."
lang_multi_text.db,MultiText,Achievement_200318_Name,星光照耀港湾,Starlight Over the Harbor,Ánh Sao Soi Sáng Cảng Biển
lang_multi_text.db,MultiText,Achievement_200320_Desc,与珂莱塔交谈，得知「欧泊」的配方。,"Learn the recipe for ""Opal"" from Carlotta.","Nói chuyện với Carlotta để biết công thức pha chế ""Opal""."
lang_multi_text.db,MultiText,Achievement_200320_Name,如果我们的语言是鸡尾酒,If Our Language Is Cocktail,Nếu Ngôn Ngữ Của Chúng Ta Là Cocktail
lang_multi_text.db,MultiText,Achievement_200321_Desc,完成「启航日，船长！」。,"Complete ""Sail Day, Captain!""","Hoàn thành ""Ngày Ra Khơi, Thuyền Trưởng!""."
lang_multi_text.db,MultiText,Achievement_200321_Name,Captain！Oh，Captain！,O Captain! My Captain!,"Captain! Oh, Captain!"
lang_multi_text.db,MultiText,Achievement_200322_Desc,完成「幽夜幻梦」。,"Complete ""A Fleeting Night's Dream.""","Hoàn thành ""U Dạ Huyễn Mộng""."
lang_multi_text.db,MultiText,Achievement_200322_Name,梦的此岸,To Dream's Shores,Bờ Bên Này Của Giấc Mơ
lang_multi_text.db,MultiText,Achievement_200323_Desc,完成「梦境症候群」。,"Complete ""Dream Syndrome.""","Hoàn thành ""Hội Chứng Mộng Cảnh""."
lang_multi_text.db,MultiText,Achievement_200323_Name,梦的彼岸,From Dream's Shores,Bờ Bên Kia Của Giấc Mơ
