db_file,table_name,id,zh,en,vi
lang_multi_text.db,MultiText,Side_QTDWZS_1_15,动物的语言本质也是频率，所有的频率都是可以被解读的信息。我的动物翻译模块已经初具雏形了，在实验中也到了许多预料外的信息。,"The animal language is frequency in essence, and all frequencies are data that can be interpreted. My Animal Language Translation Module is taking shape, and I've obtained unexpected information in experiments.","Ngôn ngữ động vật về bản chất cũng là tần số, mà mọi tần số đều là thông tin có thể giải mã được. Module dịch thuật động vật của tôi đã có hình hài ban đầu rồi, trong quá trình thí nghiệm cũng thu được nhiều thông tin ngoài dự kiến."
lang_multi_text.db,MultiText,Side_QTDWZS_1_16,你刚才上来搭话，肯定也是对这只小猫感兴趣吧，正好我今天带来的是猫猫语翻译模块。,"You must be interested in this kitty, so you struck up a conversation with me, right? Lucky you! I brought a Cat Language Translation Module today.","Cậu vừa lại bắt chuyện, chắc cũng quan tâm đến chú mèo này đúng không? Vừa hay hôm nay tôi mang theo module dịch tiếng mèo đây."
lang_multi_text.db,MultiText,Side_QTDWZS_1_17,只是路过。,I'm just passing by.,Chỉ đi ngang qua thôi.
lang_multi_text.db,MultiText,Side_QTDWZS_1_18,是的。,Yes.,"Ừ, đúng vậy."
lang_multi_text.db,MultiText,Side_QTDWZS_1_19,别别！留步，听我说完！,"No, please wait! Let me finish this!","Đừng đừng! Khoan đã, nghe tôi nói hết đã!"
lang_multi_text.db,MultiText,Side_QTDWZS_1_2,喵嗷！嗷嗷……嗷呜！,Meow! MEOW!!,Meo! Meo meo... Meoooo!
lang_multi_text.db,MultiText,Side_QTDWZS_1_20,那你来得正好！,Congratulations! You came in perfect timing!,Vậy cậu đến đúng lúc quá!
lang_multi_text.db,MultiText,Side_QTDWZS_1_21,听说你的盘古终端非常特别，我想试试能否兼容我的模块，能借我试试吗？拜托了！我一定会把你写进论文的致谢词里。,"I heard that your Pangu Terminal is quite special, so I want to see if my module can also work on it. Can you let me try? Please! I'll definitely include you in the acknowledgments of my paper!","Nghe nói thiết bị đầu cuối Bàn Cổ của cậu rất đặc biệt, tôi muốn thử xem có tương thích với module của tôi không, cho tôi mượn thử được không? Làm ơn đi! Tôi nhất định sẽ ghi tên cậu vào lời cảm ơn trong luận văn!"
lang_multi_text.db,MultiText,Side_QTDWZS_1_22,不会弄坏我的终端吗。,Will it cause any harm to my Terminal?,Không làm hỏng thiết bị của tôi chứ.
lang_multi_text.db,MultiText,Side_QTDWZS_1_23,真的可靠吗。,Is it reliable?,Thật sự đáng tin không đấy.
lang_multi_text.db,MultiText,Side_QTDWZS_1_24,请你给我一次机会！,"Please, give me a chance!",Cho tôi một cơ hội đi mà!
lang_multi_text.db,MultiText,Side_QTDWZS_1_25,【悬音在你的盘古终端上加载了猫语翻译模块。】,Xuanyin loaded the Cat Language Translation Module onto your Pangu Terminal.,[Huyền Âm đã tải module dịch tiếng mèo lên thiết bị đầu cuối Bàn Cổ của bạn.]
lang_multi_text.db,MultiText,Side_QTDWZS_1_3,怎么不给摸还骂人呢！我能听出你在说我坏话哦。,"Hey! How can you scold me when you don't even allow me to pet you! I can tell you're saying bad things about me, naughty kitty!",Sao không cho vuốt mà còn mắng người thế! Tao nghe ra mày đang nói xấu tao đấy nhé.
lang_multi_text.db,MultiText,Side_QTDWZS_1_4,让我翻译翻译你在说什么……糟糕，程序又崩溃了。,"Let me use a translator to see what you're saying… Oops, the program crashed again.","Để tôi dịch xem mày đang nói gì nào... Chết, chương trình lại sập rồi."
lang_multi_text.db,MultiText,Side_QTDWZS_1_5,终端还是无法解析这些数据，明明已经做过优化了……看来是硬件性能不行。,Even though I've already optimized it... Seems like the Terminal still can't interpret this data. It's a hardware issue.,"Thiết bị đầu cuối vẫn không phân tích nổi dữ liệu này, rõ ràng đã tối ưu hóa rồi mà... Có vẻ là phần cứng không đủ mạnh."
lang_multi_text.db,MultiText,Side_QTDWZS_1_6,你在和猫说话？,Are you talking to a cat?,Cô đang nói chuyện với mèo à?
lang_multi_text.db,MultiText,Side_QTDWZS_1_7,谁？好吓人，好歹先吱一声吧！,Who? That's scary. You could at least say something before showing up!,"Ai đấy? Giật mình quá, ít nhất cũng lên tiếng trước đi chứ!"
lang_multi_text.db,MultiText,Side_QTDWZS_1_8,“吱”，动物语言？,"""Something.""","""Lên tiếng"", ngôn ngữ động vật à?"
lang_multi_text.db,MultiText,Side_QTDWZS_1_9,不是……欸，你是不是那个谁？最近老听人说起你。,"…Well, forget about it. Are you that... that famous person? People have been talking about you lately.","Không phải... Ơ, cậu có phải là người đó không? Dạo này cứ nghe mọi người nhắc đến hoài."
lang_multi_text.db,MultiText,Side_QTDWZS_24_1,{PlayerName}，跟你说个好消息！上次收集到的灰冠鸥语言样本帮了大忙。,"{PlayerName}, I've got good news for you! The Gray Crested Gull language samples we collected last time were a big help!","{PlayerName}, có tin vui nè! Mẫu ngôn ngữ Mòng Biển Mào Xám thu thập lần trước đã giúp ích rất nhiều."
lang_multi_text.db,MultiText,Side_QTDWZS_24_2,鸟语翻译模块就快完成了，今天我打算再找其他鸟类测试一下，要做到有始有终！顺便跟你说件严肃的事情。,"The Bird Language Translation Module is almost complete. I'm planning to test it with other birds to see if there are any areas for improvement. By the way, I have something serious to tell you.","Module dịch ngôn ngữ chim sắp hoàn thành rồi. Hôm nay tôi định thử nghiệm thêm với các loài chim khác, phải làm cho trọn vẹn! À, tiện thể có chuyện nghiêm túc muốn nói với cậu."
lang_multi_text.db,MultiText,Side_QTDWZS_24_3,咕咕咕。,Coo coo coo.,Cù cù cù.
lang_multi_text.db,MultiText,Side_QTDWZS_24_4,等下！志愿者出现了！,Hold on! We have volunteers here!,Khoan đã! Có tình nguyện viên xuất hiện rồi!
lang_multi_text.db,MultiText,Side_QTDWZS_24_5,需要用食物吸引它们吗？,Do we need to attract them with food?,Cần dùng thức ăn để dụ chúng không?
lang_multi_text.db,MultiText,Side_QTDWZS_24_6,嗯……我看看。地面上还有很多谷粒，它们却不感兴趣……这次应该要换个方式和它们交流了。,"Well, let me think… There are plenty of grains on the ground, but they don't seem interested. Seems like we need to find another way to attract their attention.",Hmm... để tôi xem. Trên mặt đất còn nhiều hạt lắm mà chúng chẳng quan tâm... Lần này chắc phải đổi cách giao tiếp với chúng thôi.
lang_multi_text.db,MultiText,Side_QTDWZS_24_7,先用翻译模块听听看吧！,Let's hear what they're talking first.,Dùng module dịch nghe thử xem sao đã!
lang_multi_text.db,MultiText,Side_QTDWZS_24_8,【悬音在你的盘古终端上加载了鸽语翻译模块。】,Xuanyin loads the Pigeon Language Translation Module onto your Pangu Terminal.,[Huyền Âm đã cài module dịch ngôn ngữ bồ câu lên thiết bị Bàn Cổ của bạn.]
lang_multi_text.db,MultiText,Side_QTDWZS_25_1,人，咕咕，笨，咕咕，溜了。,"Human, coo, stupid, coo, bye.","Người, cúc cu, ngu, cúc cu, chuồn đây."
lang_multi_text.db,MultiText,Side_QTDWZS_25_2,【鸽子说完便振翅飞走了。】,The pigeons fly away after saying that.,[Bồ câu nói xong liền vỗ cánh bay đi.]
lang_multi_text.db,MultiText,Side_QTDWZS_25_3,欸？怎么骂完人就飞走了，这是要在挑衅吗？,Hey! How dare you fly away after name-calling! Are you trying to pick a fight?,"Hả? Sao chửi xong lại bay mất thế, đang khiêu khích à?"
lang_multi_text.db,MultiText,Side_QTDWZS_25_4,好没礼貌的鸽子……太可恶了！快感知看看它飞去哪儿了。,Those impolite pigeons! I won't let them get away with it! Quickly scan to see where they flew off to.,Mấy con bồ câu thật vô lễ... Quá đáng quá! Mau quét xem chúng bay đi đâu rồi.
lang_multi_text.db,MultiText,Side_QTDWZS_28_2,看来我们被鸽子放了鸽子……,Looks like the pigeons stood us up.,Có vẻ chúng ta bị bồ câu... cho leo cây rồi...
lang_multi_text.db,MultiText,Side_QTDWZS_28_3,瞧不起人类是鸟类的共性吗？,Is having a condescending attitude towards humans a common trait shared by birds?,Coi thường con người là đặc tính chung của loài chim sao?
lang_multi_text.db,MultiText,Side_QTDWZS_28_4,为什么要在意鸟类的看法？正事是什么？,Why should we humans care about the opinions of birds? What's the business?,Sao phải bận tâm mấy con chim nghĩ gì? Chuyện chính là gì?
lang_multi_text.db,MultiText,Side_QTDWZS_28_5,……我的斗志燃起来了！我必须找它们要个说法！,Come on! I'm full of fight now! I've got to get an explanation from them!,...Tôi đã nổi máu rồi! Tôi nhất định phải tìm chúng mà hỏi cho ra nhẽ!
lang_multi_text.db,MultiText,Side_QTDWZS_28_7,下次一定要逮住它们问清楚！,"Next time, I must catch them and find it out!",Lần sau nhất định phải tóm được chúng mà hỏi cho rõ!
lang_multi_text.db,MultiText,Side_QTDWZS_3_10,确实，能做成这样也还算不错了。,Thank you. It took me a great effort to develop a module like this.,"Đúng vậy, làm được tới mức này cũng khá tốt rồi."
lang_multi_text.db,MultiText,Side_QTDWZS_3_11,搞研究最重要的就是试错嘛，闭门造车也不行。,You're right. The most important thing for a scientist is trial and error. Great success is built on failure!,"Nghiên cứu quan trọng nhất là thử và sai mà, cứ ngồi một chỗ thì không được."
lang_multi_text.db,MultiText,Side_QTDWZS_3_12,幸亏有你才能收集到这些数据，我会拿回去好好分析的，多谢多谢。,Thank you for helping me gather this data. I'll analyze it thoroughly and try to find a way to improve the module.,"May nhờ có cậu mới thu thập được những dữ liệu này, tôi sẽ mang về phân tích kỹ, cảm ơn nhiều nhé."
lang_multi_text.db,MultiText,Side_QTDWZS_3_13,下次有机会再一起合作吧，我会加快进度研发其他动物的翻译模块，到时候让你大吃一惊，嘿嘿……,"Let's do it again sometime. I'll speed up the development of translation modules for other animals, and they'll surely blow you away, hehe!","Lần sau có dịp lại hợp tác nhé, tôi sẽ đẩy nhanh tiến độ phát triển module dịch cho các loài động vật khác, lúc đó sẽ khiến cậu bất ngờ cho mà xem, hehe..."
lang_multi_text.db,MultiText,Side_QTDWZS_3_2,呼噜呼噜呼噜……,Purr…,Grừ grừ grừ...
lang_multi_text.db,MultiText,Side_QTDWZS_3_3,这句不用翻译，我知道！是它很开心，在感谢我们呢。,I don't need a translation for this! I know what it means! It's content and saying thank you to us.,"Câu này không cần dịch, tôi biết mà! Nó đang vui, đang cảm ơn chúng ta đấy."
lang_multi_text.db,MultiText,Side_QTDWZS_3_4,仆肉！鱼人！吃爱！好！  *乱码*,SREVNAT! FSHI! LVEO! *garbled text*,Tôi tớ! Cá người! Ăn yêu! Tốt! *lỗi mã*
lang_multi_text.db,MultiText,Side_QTDWZS_3_5,呃啊！模块开始报错了，看来兼容性还是有问题。先卸载下来吧……能运行这么久也很不错了。,"Uh-oh! The module is starting to throw errors. Seems like compatibility is still an issue. Anyway, let's uninstall it for now. I'm pretty surprised that it ran smoothly for this long.","Úi! Module bắt đầu báo lỗi rồi, xem ra vấn đề tương thích vẫn chưa ổn. Gỡ ra trước đã... chạy được lâu như vậy cũng tốt lắm rồi."
lang_multi_text.db,MultiText,Side_QTDWZS_3_6,【悬音将猫猫语翻译模块从你的盘古终端上卸载，并回传了相关数据。】,Xuanyin uninstalls the Cat Language Translation Module from your Pangu Terminal and transmits the related data back to her.,[Huyền Âm gỡ module dịch tiếng mèo khỏi thiết bị đầu cuối Bàn Cổ của bạn và truyền lại dữ liệu liên quan.]
lang_multi_text.db,MultiText,Side_QTDWZS_3_7,语言逻辑还是太简单了，果然我的技术还是比不上科班出身的研究员啊。,The logic of my module is still straightforward. My understanding of Terminal Technology is no match for those officially trained researchers.,"Logic ngôn ngữ vẫn còn quá đơn giản, quả nhiên kỹ thuật của tôi vẫn không bằng mấy nghiên cứu viên được đào tạo bài bản."
lang_multi_text.db,MultiText,Side_QTDWZS_3_8,也不妨碍理解。,It doesn't interfere with my understanding.,Cũng không ảnh hưởng gì đến việc hiểu cả.
lang_multi_text.db,MultiText,Side_QTDWZS_3_9,还是改进一下吧。,Now you know how to improve it.,Vẫn nên cải tiến thêm một chút.
lang_multi_text.db,MultiText,Side_QTDWZS_4_1,没想到能在这种荒郊野外遇见你，{PlayerName}。,"Great to see you again, {PlayerName}.","Không ngờ lại gặp được cậu ở nơi hoang vắng thế này, {PlayerName}."
lang_multi_text.db,MultiText,Side_QTDWZS_4_2,猜猜我这次带了什么动物的翻译模块来？,Can you guess which animal translation module I brought this time?,Đoán xem lần này tôi mang theo mô-đun dịch ngôn ngữ của loài vật nào nào?
lang_multi_text.db,MultiText,Side_QTDWZS_4_3,很远就听到了灰冠鸥的叫声。,I picked up the call of the Gray Crested Gull from a distance.,Từ xa đã nghe thấy tiếng kêu của mòng biển mào xám rồi.
lang_multi_text.db,MultiText,Side_QTDWZS_4_4,猜对了，是鸟语翻译模块！今州周边的水域是灰冠鸥迁徙的必经之路，但常有今州市民长期投喂他们……,"Excellent hearing! Yes, it's the Bird Language Translation Module. The water areas around Jinzhou are a crucial route for the Gray Crested Gulls' migration. However, some stupid idiots often feed them...","Đoán đúng rồi, là mô-đun dịch ngôn ngữ chim! Vùng nước quanh Kim Châu là tuyến đường di cư bắt buộc của mòng biển mào xám, nhưng thường có người dân Kim Châu cho chúng ăn liên tục..."
lang_multi_text.db,MultiText,Side_QTDWZS_4_5,请注意用言！,"Hey, watch the language...",Chú ý cách dùng từ nhé!
lang_multi_text.db,MultiText,Side_QTDWZS_4_6,抱歉抱歉。我这次的发现是：由于野外环境日渐恶劣，小部分灰冠鸥已经放弃了本能，成为了当地留鸟。,"My apologies. From my observations, due to the increasingly harsh environment, a small number of the Gray Crested Gulls have abandoned their instincts of migration and become resident birds.","Xin lỗi xin lỗi. Phát hiện lần này của tôi là: do môi trường tự nhiên ngày càng khắc nghiệt, một số ít mòng biển mào xám đã từ bỏ bản năng, trở thành chim định cư tại đây."
lang_multi_text.db,MultiText,Side_QTDWZS_4_7,据我观察，留鸟们的语言也发生了一些改变，除了同类间的交流，还多了一些只对人类发出的叫声。,"The language of these resident birds has also evolved. In addition to communication among their kind, there are some calls directed at humans.","Theo quan sát của tôi, ngôn ngữ của những con chim định cư cũng có một số thay đổi. Ngoài việc giao tiếp giữa đồng loại, còn xuất hiện thêm một số tiếng kêu chỉ dành riêng cho con người."
lang_multi_text.db,MultiText,Side_QTDWZS_4_8,或许这是他们在尝试与人类沟通……我们来收集语言样本一探究竟吧。,Perhaps they're attempting to communicate with humans. Let's collect some samples to find out.,Có lẽ đây là cách chúng đang cố giao tiếp với con người... Chúng ta đi thu thập mẫu ngôn ngữ để tìm hiểu thêm nhé.
lang_multi_text.db,MultiText,Side_QTDWZS_4_9,【悬音在你的盘古终端上加载了鸥语翻译模块。】,Xuanyin loads the Bird Language Translation Module onto your Pangu Terminal.,[Huyền Âm đã tải mô-đun dịch ngôn ngữ mòng biển lên Bàn Cổ Đơn của bạn.]
lang_multi_text.db,MultiText,Side_QTDWZS_5_1,整！整！整！整整整……,"Give! Me! Give! Me! Gimme, gimme, gimme!",Cho! Cho! Cho! Cho cho cho...
lang_multi_text.db,MultiText,Side_QTDWZS_5_2,整什么？,Give you what?,Cho cái gì?
lang_multi_text.db,MultiText,Side_QTDWZS_5_3,听说灰冠鸥对人类的食物情有独钟，尤其是星星酥，难道这是在向我们讨食？,"I heard that the Gray Crested Gulls have a thing for human food, especially Star Flakes. Are they asking us for food?","Nghe nói mòng biển mào xám rất thích đồ ăn của con người, đặc biệt là Bánh Sao Giòn. Chẳng lẽ chúng đang xin ăn chúng ta?"
lang_multi_text.db,MultiText,Side_QTDWZS_5_4,拿星星酥来试试就知道了。,We'll know when we give them Star Flakes.,Lấy Bánh Sao Giòn ra thử là biết ngay.
lang_multi_text.db,MultiText,Side_QTDWZS_5_5,上次就发现你这个大厨深藏不露，这回也要靠你了！,"You're a hidden chef, aren't you? I'm counting on you this time too!","Lần trước đã phát hiện cậu là đầu bếp giấu nghề rồi, lần này cũng nhờ cậu nhé!"
lang_multi_text.db,MultiText,Side_QTDWZS_5_6,顺便一提，灰冠鸥是种好吃懒做的鸟类，比起被投喂更喜欢抢夺别人的食物，等会我们得配合它们一下。,"By the way, the Gray Crested Gulls are infamous for their appetite for snatching food from others. If we have food in our hands, they should be rushing in to grab it.","Nhân tiện nói thêm, mòng biển mào xám là loài chim lười biếng ham ăn, so với được cho ăn thì chúng thích cướp đồ ăn của người khác hơn. Lát nữa chúng ta phải phối hợp với chúng một chút."
lang_multi_text.db,MultiText,Side_QTDWZS_5_7,阿嚏……抱歉抱歉，昨天在这水边守了个通宵，本来想和灰冠鸥们打好关系……,"Ah-choo. Sorry. I stayed up all night, trying to build good relations with them.","Hắt xì... Xin lỗi xin lỗi, hôm qua tôi canh cả đêm ở bờ nước, định kết thân với lũ mòng biển mào xám..."
lang_multi_text.db,MultiText,Side_QTDWZS_5_8,结果不但被他们偷了食物，还着凉了，哈哈。,Ended up not only losing my food but also catching a cold. Haha.,"Kết quả chẳng những bị chúng cướp mất đồ ăn, mà còn bị cảm lạnh nữa, haha."
lang_multi_text.db,MultiText,Side_QTDWZS_6_1,【灰冠鸥趁你们不备抢走了星星酥，扬长而去，在你们的头顶挑衅地盘旋。】,"A Gray Crested Gull grabs the Star Flakes from you by surprise and flies away, hovering above your head and mocking you.","[Hải Âu Mào Xám thừa lúc các bạn không để ý, cướp mất Bánh Sao Giòn rồi bay đi mất, lượn vòng trêu tức trên đầu các bạn.]"
lang_multi_text.db,MultiText,Side_QTDWZS_6_10,阿嚏，阿嚏，我得赶紧回去暖和暖和，下次再见了。,"Ah-choo, ah-choo, I need to hurry back and warm myself up. See you next time.","Hắt xì, hắt xì, tôi phải về sưởi ấm thôi. Hẹn gặp lại lần sau nhé."
lang_multi_text.db,MultiText,Side_QTDWZS_6_2,它们的叫声听起来好像嘲笑……,Are they mocking us?,Tiếng kêu của chúng nghe như đang chế nhạo vậy...
lang_multi_text.db,MultiText,Side_QTDWZS_6_3,根据我查阅的资料来看，除了星星酥，其他的油炸食物也对灰冠鸥有非同寻常的吸引力。,"According to the information I've looked up, aside from Star Flakes, other fried foods are also very appealing to them.","Theo tài liệu tôi tra được, ngoài Bánh Sao Giòn ra, các loại đồ chiên rán khác cũng có sức hấp dẫn đặc biệt với Hải Âu Mào Xám."
lang_multi_text.db,MultiText,Side_QTDWZS_6_4,这和它们的强盗作风一样，所以它们也被叫做「海贼鸥」。,"As the Gray Crested Gulls enjoy stealing others' food, they are also known as ""Pirate Gulls"".","Điều này cũng hợp với tính cướp giật của chúng, nên chúng còn được gọi là ""Hải Âu Cướp Biển""."
lang_multi_text.db,MultiText,Side_QTDWZS_6_5,有历史记载吗？,That's interesting.,Có ghi chép lịch sử nào không?
lang_multi_text.db,MultiText,Side_QTDWZS_6_6,还挺多，记载中提及最多的关键字有「码头」，和某种方言「整点」。,"Yes. They are frequently spotted around ""wharves"" and places where potato fries are sold.","Khá nhiều đấy, trong các ghi chép, từ khóa xuất hiện nhiều nhất là ""bến tàu"" và một loại phương ngữ ""kiếm chút""."
lang_multi_text.db,MultiText,Side_QTDWZS_6_7,整……整整整整整整点！！*乱码*,Gimme! *garbled text*,Ki... kiếm kiếm kiếm kiếm kiếm chút!! *lỗi ký tự*
lang_multi_text.db,MultiText,Side_QTDWZS_6_8,模块怎么还卡机了！赶紧把模块卸载吧，盘古终端缓存告急了。,Why is the module freezing? I'd better uninstall it for now. Seems like there is no storage on your Pangu Terminal.,"Sao module lại bị đơ thế này! Mau gỡ module ra đi, bộ nhớ đệm của Bàn Cổ Terminal sắp hết rồi."
lang_multi_text.db,MultiText,Side_QTDWZS_6_9,【悬音将鸟语翻译模块从你的盘古终端上卸载，并回传了相关数据。】,Xuanyin uninstalls the Bird Language Translation Module from your Pangu Terminal and transmits the related data back to her.,[Huyền Âm gỡ module dịch ngôn ngữ chim khỏi Bàn Cổ Terminal của bạn và truyền dữ liệu liên quan về.]
lang_multi_text.db,MultiText,Side_QTDWZS_7_1,你好啊，{PlayerName}，快过来看看这些群彩，动作要轻轻的！,"Hi, {PlayerName}. Come and take a look at these Tetra. Move gently.","Chào bạn, {PlayerName}, lại đây xem mấy con Quần Thái này đi, nhẹ nhàng thôi nhé!"
lang_multi_text.db,MultiText,Side_QTDWZS_7_10,确实确实，我们先听听群彩们怎么说吧？,"Well, you're right. Let's listen to what these Tetra are saying.","Đúng đúng, vậy mình nghe thử xem mấy con Quần Thái nói gì đã nhé?"
lang_multi_text.db,MultiText,Side_QTDWZS_7_11,【悬音在你的盘古终端上加载了鲤语翻译模块。】,Xuanyin loads the Fish Language Translation Module onto your Pangu Terminal.,[Huyền Âm tải module dịch ngôn ngữ cá chép lên Bàn Cổ Terminal của bạn.]
lang_multi_text.db,MultiText,Side_QTDWZS_7_2,这次是鱼鱼语言模块吗？,So it's the Fish Language Translation Module this time?,Lần này là module ngôn ngữ cá à?
lang_multi_text.db,MultiText,Side_QTDWZS_7_3,请不要玩呜呜物流的梗！鱼类没有发声器官，所以他们说话的方式也千奇百怪，严格意义上也不能叫语言模块啦。,"Perfect guess! Strictly speaking, it can't be called a language module. After all, fish don't have vocal organs. Their ways of speaking are diverse.","Đừng chơi chữ nữa! Cá không có cơ quan phát âm, nên cách chúng ""nói chuyện"" rất kỳ lạ, nói đúng ra thì không thể gọi là module ngôn ngữ được đâu."
lang_multi_text.db,MultiText,Side_QTDWZS_7_4,摩擦咽喉齿、震动肌肉、压迫鱼鳔……因此语言模块也要分门别类地做。,"They ""speak"" via grinding throat teeth, vibrating muscles, and compressing swim bladders.","Cọ xát răng họng, rung cơ, ép bóng hơi... vì thế module ngôn ngữ cũng phải chia ra từng loại riêng."
lang_multi_text.db,MultiText,Side_QTDWZS_7_5,而在水这种密度比空气大得多的介质中，还需要特殊的技术才能收集到鱼类发出的「声音」。,"As water is much denser than air, we need to use special techniques to collect the ""sounds"" emitted by them.","Hơn nữa, trong môi trường nước có mật độ lớn hơn không khí rất nhiều, cần kỹ thuật đặc biệt mới thu thập được ""âm thanh"" mà cá phát ra."
lang_multi_text.db,MultiText,Side_QTDWZS_7_6,水中的确有细微的震动。,I can sense subtle vibrations in the water.,Trong nước quả thật có những rung động rất nhỏ.
lang_multi_text.db,MultiText,Side_QTDWZS_7_7,共鸣者的知觉果然比常人更敏锐啊。,"Wow, Resonators' perceptions are indeed more sensitive than us ordinary people.",Giác quan của Cộng Hưởng Giả quả nhiên nhạy bén hơn người thường.
lang_multi_text.db,MultiText,Side_QTDWZS_7_8,不过作为普通人，能开发出媲美异能的科技也很厉害吧，嘿嘿。,"However, I've developed a technology that can help ordinary people grasp those subtle vibrations. Don't you think I'm a genius? Hehe.","Nhưng là người thường mà phát triển được công nghệ sánh ngang dị năng thì cũng ghê lắm chứ, hehe."
lang_multi_text.db,MultiText,Side_QTDWZS_7_9,可靠性和准确性才更重要吧。,Only if the results are reliable and accurate.,Độ tin cậy và chính xác mới là quan trọng hơn chứ.
lang_multi_text.db,MultiText,Side_QTDWZS_9_1,怎么会这样……,How could this happen...,Sao lại thế này...
