db_file,table_name,id,zh,en,vi
lang_multi_text.db,MultiText,zhuiyuejie_second_59_2,快看快看！,Looky that!,Mau nhìn kìa mau nhìn kìa!
lang_multi_text.db,MultiText,zhuiyuejie_second_59_20,喂……这边这边。,Hey! Over here!,Này... bên này bên này.
lang_multi_text.db,MultiText,zhuiyuejie_second_59_21,诶呀，还在拍什么呢，拍了这么多张，没有一张是有你自己的。,"You've been snapping all these pics, but why aren't you in any of them?","Ây da, còn chụp cái gì nữa, chụp nhiều tấm thế rồi, chẳng có tấm nào có mặt cậu cả."
lang_multi_text.db,MultiText,zhuiyuejie_second_59_22,对了。,Aha!,Đúng rồi.
lang_multi_text.db,MultiText,zhuiyuejie_second_59_23,让我看看，这相机不是有延时拍摄的嘛。,"There you go, the time-lapse mode.","Để tôi xem nào, cái máy ảnh này chẳng phải có chế độ chụp hẹn giờ sao."
lang_multi_text.db,MultiText,zhuiyuejie_second_59_24,好了，大家可都在等着你呢。,C'mon! Let's all take a picture together!,"Xong rồi, mọi người đều đang đợi cậu đấy."
lang_multi_text.db,MultiText,zhuiyuejie_second_59_3,明日退去月相伴……,"This word puzzle... Is the answer ""Friend"", maybe?",Minh nhật thoái khứ nguyệt tương bạn...
lang_multi_text.db,MultiText,zhuiyuejie_second_59_4,找到你了！,There you are!,Tìm thấy cậu rồi!
lang_multi_text.db,MultiText,zhuiyuejie_second_59_5,嘻嘻。,Hehe.,Hi hi.
lang_multi_text.db,MultiText,zhuiyuejie_second_59_6,好了吗？,You done?,Được chưa vậy?
lang_multi_text.db,MultiText,zhuiyuejie_second_59_7,快让我看看！,Lemme see!,Mau cho tôi xem nào!
lang_multi_text.db,MultiText,zhuiyuejie_second_59_8,要是白芷平时能像照片里一样，多笑笑就好了。,"Wow, Baizhi actually smiled! She really should smile more often.",Giá mà bình thường Bạch Chỉ cũng hay cười như trong ảnh thì tốt biết mấy.
lang_multi_text.db,MultiText,zhuiyuejie_second_59_9,你们看……,The painting...,Mọi người xem...
lang_multi_text.db,MultiText,zhuiyuejie_second_5_1,无音区……憎恨……帕斯卡……世界……,Tacet Field... Hate... Pascar... The world...,Vùng Vô Thanh... căm hận... Pascar... thế giới...
lang_multi_text.db,MultiText,zhuiyuejie_second_5_10,你脸上的表情已经透露出这个想法了。,"You're already planning to do so, I can tell. It's written all over your face.",Vẻ mặt {Male=anh;Female=cô} đã tiết lộ suy nghĩ này rồi.
lang_multi_text.db,MultiText,zhuiyuejie_second_5_11,在我的预想中，这确实是最合适的解决方案。,Yes... I've thought it through. I believe that would be the most practical solution.,"Trong dự tính của tôi, đây quả thực là giải pháp thích hợp nhất."
lang_multi_text.db,MultiText,zhuiyuejie_second_5_12,如果这个索诺拉内部是无害的，自然皆大欢喜。,"If the Sonoro is benign, we can all breathe a sigh of relief.","Nếu bên trong Sonora này vô hại, tự nhiên cả nhà cùng vui."
lang_multi_text.db,MultiText,zhuiyuejie_second_5_13,就算它因为衰减而有了危险性，对你来说也是手到擒来。,"And worst-case scenario, if it turns malignant, you'll have no trouble handling it.","Cho dù nó trở nên nguy hiểm do suy giảm, thì đối với {Male=anh;Female=cô} cũng dễ như trở bàn tay."
lang_multi_text.db,MultiText,zhuiyuejie_second_5_14,不过由你提出来，倒是显得我不够果断了。,I just didn't expect you to bring it up first. Guess I wasted time hesitating.,"Có điều do {Male=anh;Female=cô} đề xuất, lại khiến tôi có vẻ thiếu quyết đoán rồi."
lang_multi_text.db,MultiText,zhuiyuejie_second_5_15,你会纠结，是因为“帕斯卡”这个名字？,"You hesitated... because of the name ""Pascar""?","Anh do dự, là vì cái tên ""Pascar"" sao?"
lang_multi_text.db,MultiText,zhuiyuejie_second_5_16,他是我曾经的一位挚友……,Yes. He was a close friend of mine...,Cậu ấy là một người bạn thân cũ của tôi...
lang_multi_text.db,MultiText,zhuiyuejie_second_5_17,因为意外，他死在了海蚀现象中，这个索诺拉如果和他有关，那他一定是想要告诉我什么吧。,"He died from the Waveworn. I think... if this Sonoro Sphere is related to him, it must contain his messages for me.","Vì tai nạn, cậu ấy đã chết trong hiện tượng Hải Thực, nếu Sonora này có liên quan đến cậu ấy, vậy thì chắc chắn cậu ấy muốn nói với tôi điều gì đó."
lang_multi_text.db,MultiText,zhuiyuejie_second_5_18,所以我是抱着一些私心的，{PlayerName}，请帮帮我。,"This is my personal request, {PlayerName}. Please help me.","Cho nên tôi có chút tư tâm, {PlayerName}, xin hãy giúp tôi."
lang_multi_text.db,MultiText,zhuiyuejie_second_5_19,其实我也有自己的私心。,"Sure thing. In fact, I'm also doing this for a personal reason.",Thật ra tôi cũng có tư tâm của riêng mình.
lang_multi_text.db,MultiText,zhuiyuejie_second_5_2,索诺拉的味道？！,Is that... the smell of Sonoro?!,Mùi của Sonora?!
lang_multi_text.db,MultiText,zhuiyuejie_second_5_20,嗯？,You are?,Hả?
lang_multi_text.db,MultiText,zhuiyuejie_second_5_21,可不能让它打扰到之后的宵月会，因为我已经和其他人约好了。,I promised my friends we'd enjoy the Moonlit Fair together tonight. Can't let this incident ruin the festivity.,"Không thể để nó làm phiền Hội Tiêu Nguyệt sau đó, vì tôi đã hẹn với người khác rồi."
lang_multi_text.db,MultiText,zhuiyuejie_second_5_22,谢谢你的理解，让我们去探个究竟吧。,"Thank you, {PlayerName}. Let's enter the Sonoro now.","Cảm ơn {Male=anh;Female=cô} đã thấu hiểu, chúng ta đi xem rốt cuộc chuyện gì đang xảy ra nào."
lang_multi_text.db,MultiText,zhuiyuejie_second_5_23,来到祈愿树下，相里要向你解释小帕已成为索诺拉的入口，异常数据也许藏在第四个心愿中，为了让宵月会正常举行，你们决定进入索诺拉一探究竟。,"Under the Wishing Tree, Xiangli Yao informs you that Patty has become a portal to a Sonoro Sphere, and the abnormal data likely hides within the fourth wish. To ensure the Moonlit Fair runs smoothly, you, Abby, and Xiangli Yao decide to enter and investigate this Sonoro.","Đến dưới Cây Cầu Nguyện, Tương Lý Yếu giải thích với bạn rằng Tiểu Pa đã trở thành lối vào của Sonora, dữ liệu bất thường có lẽ ẩn trong tâm nguyện thứ tư. Để Hội Tiêu Nguyệt diễn ra bình thường, các bạn quyết định vào Sonora để tìm hiểu ngọn ngành."
lang_multi_text.db,MultiText,zhuiyuejie_second_5_3,漂泊者，你来了。,"Thank you for coming, Rover.","Lữ Khách, {Male=anh;Female=cô} đến rồi."
lang_multi_text.db,MultiText,zhuiyuejie_second_5_4,如你所见，小帕已经变成了索诺拉的入口。,Patty is now a portal to a Sonoro Sphere.,"Như {Male=anh;Female=cô} thấy đó, Tiểu Pa đã biến thành lối vào của Sonora."
lang_multi_text.db,MultiText,zhuiyuejie_second_5_5,应该是小帕富集的频率恰好引发了某种共鸣，才导致了索诺拉的诞生。,Its built-up frequencies likely resonated with something and created this.,"Có lẽ tần số mà Tiểu Pa tích tụ tình cờ gây ra cộng hưởng nào đó, mới dẫn đến sự ra đời của Sonora."
lang_multi_text.db,MultiText,zhuiyuejie_second_5_6,要通知夜归吗……那样就……,Should we alert the Midnight Rangers? But then...,Có cần thông báo cho Dạ Quy không... như vậy thì...
lang_multi_text.db,MultiText,zhuiyuejie_second_5_7,嗯……可能会被误认为又要发生战事……毕竟刚经历过那样的大战。,"Then people might think there's another TD outbreak. Since a major fight has just happened, I think we should...",Ừm... có thể sẽ bị hiểu lầm là sắp xảy ra chiến sự... dù sao cũng vừa trải qua trận đại chiến như vậy.
lang_multi_text.db,MultiText,zhuiyuejie_second_5_8,既然如此，就由我们来解决吧。,We'll handle it ourselves.,"Đã vậy thì, để chúng ta giải quyết đi."
lang_multi_text.db,MultiText,zhuiyuejie_second_5_9,……,...,...
lang_multi_text.db,MultiText,zhuiyuejie_second_60_1,"我长大了想成为最棒、最厉害的科学家，想要帮助很多人，被大家夸赞！还要一直带领大家不断探索更多奇妙的事情！
——帕斯卡。","When I'm older, I'll be the best scientist ever! I'll help people and everyone will love me! I'll lead the way in making lots of cool discoveries!","Sau này lớn lên mình muốn trở thành nhà khoa học giỏi nhất, tuyệt nhất, muốn giúp đỡ thật nhiều người, được mọi người khen ngợi! Còn muốn mãi mãi dẫn dắt mọi người không ngừng khám phá thêm nhiều điều kỳ diệu!
...Pascal."
lang_multi_text.db,MultiText,zhuiyuejie_second_60_2,帕斯卡……你其实一直都在啊……,Pascar... You've been here with us all along...,Pascal... hóa ra cậu vẫn luôn ở đây...
lang_multi_text.db,MultiText,zhuiyuejie_second_60_3,原来这才是真相啊……这样一来第四个愿望也实现了！,"Wow, so that's the real story... We've helped make four wishes come true now!",Thì ra đây mới là sự thật... Như vậy là nguyện vọng thứ tư cũng đã thành hiện thực rồi!
lang_multi_text.db,MultiText,zhuiyuejie_second_60_4,或许，还有第五个愿望也实现了。,Or maybe... It's actually five.,"Có lẽ, còn có nguyện vọng thứ năm cũng đã thành hiện thực."
lang_multi_text.db,MultiText,zhuiyuejie_second_60_5,诶，可是明明只有四张愿望纸啊？,Five? But we only have four wish tags here.,"Hả, nhưng rõ ràng chỉ có bốn tờ giấy điều ước thôi mà?"
lang_multi_text.db,MultiText,zhuiyuejie_second_60_6,相里要，出口就在前面，我们先出去吧。,"That must be the exit. Let's get out of here first, Yao.","Tướng Lý Yếu, lối ra ở phía trước, chúng ta ra ngoài trước đã."
lang_multi_text.db,MultiText,zhuiyuejie_second_60_7,喂，告诉人家到底是什么意思嘛！,"Hey! What did you mean? Tell me, tell meeee!","Này, nói cho người ta biết rốt cuộc là có ý gì đi mà!"
lang_multi_text.db,MultiText,zhuiyuejie_second_66_1,宵月会还没有结束，不知道还有什么我能帮上忙的，再去祈愿摊那边看看吧。,The Moonlit Fair isn't over yet. There might be something I can help with. I should check out the Wishing Stall.,"Tiêu Nguyệt Hội vẫn chưa kết thúc, không biết còn gì mình có thể giúp đỡ không, qua bên quầy cầu nguyện xem thử vậy."
lang_multi_text.db,MultiText,zhuiyuejie_second_67_1,宵月会已经到了尾声，结束前你决定再去桃源乡逛一逛……,"With the Moonlit Fair drawing to a close, you decide to take a stroll in Taoyuan Vale...","Tiêu Nguyệt Hội đã đi đến hồi kết, trước khi kết thúc bạn quyết định đi dạo Đào Nguyên Hương thêm một chút..."
lang_multi_text.db,MultiText,zhuiyuejie_second_6_1,检测到特殊对象……,Special objects detected...,Phát hiện đối tượng đặc biệt...
lang_multi_text.db,MultiText,zhuiyuejie_second_6_10,憎恨……相里要……,Hate... Xiangli Yao...,Căm hận... Tướng Lý Yếu...
lang_multi_text.db,MultiText,zhuiyuejie_second_6_11,{PlayerName}！,{PlayerName}!,{PlayerName}!
lang_multi_text.db,MultiText,zhuiyuejie_second_6_2,信息重定义……,Recalibrating data...,Định nghĩa lại thông tin...
lang_multi_text.db,MultiText,zhuiyuejie_second_6_3,可视化环境重调用……,Retrieving visual environment...,Triệu hồi lại môi trường trực quan...
lang_multi_text.db,MultiText,zhuiyuejie_second_6_4,居然在模仿小帕的程序……果然<ano=声之领域>索诺拉</ano>内部是怎样，只有实际进入后才能弄清楚。,"It's simulating Patty's program... Well, like they say, you wouldn't know what's inside a <ano=Field of Sound>Sonoro Sphere</ano> until you're actually inside it.","Vậy mà lại đang mô phỏng chương trình của Tiểu Pa... Quả nhiên bên trong <ano=Vùng Âm Thanh>Sonora</ano> thế nào, chỉ có thực tế đi vào mới biết rõ được."
lang_multi_text.db,MultiText,zhuiyuejie_second_6_5,发现未知对象……,Unknown object detected...,Phát hiện đối tượng chưa xác định...
lang_multi_text.db,MultiText,zhuiyuejie_second_6_6,这个斥力？,What's happening?,Lực đẩy này?
lang_multi_text.db,MultiText,zhuiyuejie_second_6_7,索诺拉在拒绝我们？！,The Sonoro is pushing us out?!,Sonora đang từ chối chúng ta sao?!
lang_multi_text.db,MultiText,zhuiyuejie_second_6_8,{PlayerName}！,"{PlayerName}, here! My hand!",{PlayerName}!
lang_multi_text.db,MultiText,zhuiyuejie_second_6_9,无音区……憎恨……帕斯卡……世界……,Tacet Field... Hate... Pascar... The world...,Vùng Vô Thanh... Căm hận... Pascal... Thế giới...
lang_multi_text.db,MultiText,zhuiyuejie_second_7_1,呼……你总算醒了。,Whew... Thank goodness you're awake.,Phù... cậu cuối cùng cũng tỉnh rồi.
lang_multi_text.db,MultiText,zhuiyuejie_second_7_2,还好我们没有被扔出去。,I'm glad the Sonoro didn't throw us out.,May mà chúng ta không bị ném ra ngoài.
lang_multi_text.db,MultiText,zhuiyuejie_second_7_3,不过为什么，偏偏只有我们被索诺拉排挤了呢？,But why us? What did we even do?,"Nhưng tại sao, lại chỉ có chúng ta bị Sonora bài trừ nhỉ?"
lang_multi_text.db,MultiText,zhuiyuejie_second_7_4,或许……这和“帕斯卡”有关？,Maybe... it has something to do with that Pascar person?,"Có lẽ... chuyện này có liên quan đến ""Pascal"" chăng?"
lang_multi_text.db,MultiText,zhuiyuejie_second_7_5,先想办法和相里要汇合吧。,"Anyway, we should find Xiangli Yao first.",Trước tiên nghĩ cách hội ngộ với Tướng Lý Yếu đã.
lang_multi_text.db,MultiText,描述KEY,描述生成列,Description Generation Column,Cột Tạo Mô Tả
lang_multi_text_1sthalf.db,MultiText,AMS31_1_1,（看向她。）,...,(Nhìn về phía cô ấy.)
lang_multi_text_1sthalf.db,MultiText,AMS31_1_2,……,(Look at her.),...
lang_multi_text_1sthalf.db,MultiText,AMS31_1_3,你看向「爱弥斯」，她正倚靠在小屋的沙发上，安静地闭着双眼。,"You look toward ""Aemeath."" She is leaning against the couch in the cabin, eyes gently closed, quiet.","Bạn nhìn về phía ""Aemeath"", cô ấy đang tựa lưng vào ghế sofa trong căn nhà nhỏ, lặng lẽ nhắm mắt."
lang_multi_text_1sthalf.db,MultiText,AMS31_1_4,柔软宽敞的沙发前方正摆着插着卡带的游戏机和手柄，它看起来很适合两个人一起在冬日靠着打游戏，也很适合盖上毯子睡个浅眠的午觉。,"Before the soft, spacious sofa sits a game console with a cartridge already inserted, two controllers resting side by side. It feels like a place meant for two people—to huddle together on a winter day, playing games shoulder to shoulder, or to pull a blanket over themselves and drift into a shallow afternoon sleep.","Trước chiếc sofa mềm mại rộng rãi là một máy chơi game đã gắn sẵn băng và tay cầm. Nó trông rất hợp để hai người cùng ngồi sát bên nhau chơi game trong ngày đông, cũng rất hợp để đắp chăn ngủ một giấc trưa chập chờn."
lang_multi_text_1sthalf.db,MultiText,AMS31_1_5,「她」睡着了吗？「她」也会做梦吗？,"Is ""she"" asleep? Does ""she"" dream as well?","""Cô ấy"" đang ngủ sao? ""Cô ấy"" cũng biết mơ sao?"
lang_multi_text_1sthalf.db,MultiText,AMS31_1_6,你不得而知。,You have no way of knowing.,Bạn không có cách nào biết được.
lang_multi_text_1sthalf.db,MultiText,AMS31_2_1,（看向她。）,(Look at her.),(Nhìn về phía cô ấy.)
lang_multi_text_1sthalf.db,MultiText,AMS31_2_2,……,...,...
lang_multi_text_1sthalf.db,MultiText,AMS31_2_3,你看向「爱弥斯」，她正专注着站在工作台前，歪着脑袋凝视着眼前的一切。,"You look toward ""Aemeath."" She stands before the workbench, head slightly tilted, studying everything in front of her with great concentration.","Bạn nhìn về phía ""Aemeath"", cô ấy đang chăm chú đứng trước bàn làm việc, nghiêng đầu nhìn chằm chằm vào mọi thứ trước mắt."
lang_multi_text_1sthalf.db,MultiText,AMS31_2_4,这是过去的你工作时使用的地方，也是年幼的爱弥斯常来的地方。有时候你在忙，她就坐在一旁的椅子上自个儿画画，像个忠实的小守卫。,"This was once your workspace, and a place the younger Aemeath used to visit often. When you were busy, she would sit on the chair beside you, drawing by herself, silent and steadfast, like a small, loyal guardian keeping watch.","Đây từng là nơi bạn làm việc, cũng là nơi Aemeath thuở nhỏ hay đến. Những lúc bạn bận, cô bé ngồi trên chiếc ghế bên cạnh tự vẽ tranh một mình, như một người lính canh nhỏ trung thành."
lang_multi_text_1sthalf.db,MultiText,AMS31_2_5,如今，台面上已经蒙了一层淡淡的尘埃。,"Now, a faint layer of dust has settled across the tabletop.","Giờ đây, mặt bàn đã phủ một lớp bụi mỏng."
lang_multi_text_1sthalf.db,MultiText,AMS31_3_1,（看向她。）,(Look at her.),(Nhìn về phía cô ấy.)
lang_multi_text_1sthalf.db,MultiText,AMS31_3_2,……,...,...
lang_multi_text_1sthalf.db,MultiText,AMS31_3_3,你看向「爱弥斯」，她正一动不动地坐在渐湖的湖畔，目光投向眼前闪动着瑰丽色彩的湖面。,"You look toward ""Aemeath."" She sits motionless by the shore of the Sundermere, her gaze fixed on the water ahead, where brilliant colors ripple and shimmer.","Bạn nhìn về phía ""Aemeath"", cô ấy đang ngồi bất động bên bờ hồ Sundermere, ánh mắt hướng về mặt hồ lấp lánh sắc màu rực rỡ trước mặt."
lang_multi_text_1sthalf.db,MultiText,AMS31_3_4,这片湖是一切的起始，也是一切的结束，你在这里和爱弥斯相遇，也在这里和爱弥斯分离。,"This lake is where everything began, and where everything comes to an end. It is here that your paths first crossed, and here that they finally diverged.","Hồ nước này là khởi đầu của tất cả, cũng là kết thúc của tất cả. Bạn gặp Aemeath ở đây, và cũng chia xa Aemeath tại đây."
lang_multi_text_1sthalf.db,MultiText,AMS31_3_5,命运如石子投入湖中，只溅起沉闷的声响，湖水静默如常。,"Fate is indifferent, like a pebble cast into the lake, stirring only a dull splash. The water soon grows still again, unchanged as ever.","Số phận như viên sỏi ném xuống hồ, chỉ vang lên tiếng động trầm đục, mặt hồ lặng lẽ như thường."
lang_multi_text_1sthalf.db,MultiText,MAIN_YHX_1016_1,再见~,Goodbye...,Tạm biệt~
lang_multi_text_1sthalf.db,MultiText,MAIN_YHX_102_1,回不去了。,I can't go back.,Không về được nữa rồi.
lang_multi_text_1sthalf.db,MultiText,MAIN_YHX_104_1,你在笑什么？,Why are you laughing?,Cậu cười gì thế?
lang_multi_text_1sthalf.db,MultiText,MAIN_YHX_104_10,请你帮帮我们吧！它们这么对猫说。不用说，猫当然是答应了。,"""Please save us!"" they begged the cat. And, of course, the cat agreed.","""Xin hãy cứu chúng tôi!"" Chúng nói với mèo như vậy. Khỏi phải nói, mèo đương nhiên đồng ý."
lang_multi_text_1sthalf.db,MultiText,MAIN_YHX_104_11,其实就算它们不问，猫也会答应的，因为猫一直都认为自己是救世主嘛！,"Even if they hadn't asked, the cat would've helped anyway. Because that's who the cat believed it was: a savior!","Thực ra dù chúng không hỏi, mèo cũng sẽ đồng ý thôi, vì mèo luôn tin rằng mình là đấng cứu thế mà!"
lang_multi_text_1sthalf.db,MultiText,MAIN_YHX_104_12,就这样，猫一直握着它的剑，不停地战斗，不停地说话，不停地奔波……,"And so, the cat took up its sword. Always fighting, always talking, always roving…","Cứ như vậy, mèo nắm chặt thanh kiếm, không ngừng chiến đấu, không ngừng nói chuyện, không ngừng rong ruổi..."
lang_multi_text_1sthalf.db,MultiText,MAIN_YHX_104_13,……不停地拯救世界。最后却发现纸盒被关上了。,"...Saving the world, over and over. Until one day, it realized the cardboard box had been sealed shut.",...không ngừng cứu thế giới. Cuối cùng lại phát hiện ra chiếc hộp giấy đã bị đóng lại.
lang_multi_text_1sthalf.db,MultiText,MAIN_YHX_104_14,哈哈哈！你说，这是不是特别可笑？,Hahaha! Isn't that kind of laughable?,"Hahaha! Cậu nói xem, có phải chuyện này buồn cười lắm không?"
lang_multi_text_1sthalf.db,MultiText,MAIN_YHX_104_15,是很好笑。,It is pretty laughable.,Cũng buồn cười thật.
lang_multi_text_1sthalf.db,MultiText,MAIN_YHX_104_16,我不觉得。,I don't think it is.,Tôi không thấy buồn cười.
lang_multi_text_1sthalf.db,MultiText,MAIN_YHX_104_17,对吧？明明只是一只猫，却要做这么多事！,Right?! It's just a cat! Why did it have to do all of that?!,"Đúng không? Rõ ràng chỉ là một con mèo, mà phải làm nhiều việc đến thế!"
lang_multi_text_1sthalf.db,MultiText,MAIN_YHX_104_18,真没幽默感！大家都对它只是一只猫这件事视而不见，难道不好笑吗？,Where's your sense of humor! Isn't it absurd? The sheer ridiculousness of everyone ignoring the fact that it's just a cat?,"Thiếu khiếu hài hước quá! Ai cũng lờ đi chuyện nó chỉ là một con mèo, chẳng lẽ không buồn cười sao?"
lang_multi_text_1sthalf.db,MultiText,MAIN_YHX_104_19,但在这么可笑的故事里，所有人却都很幸福。,"But in such a laughable story, somehow... everyone else gets to be happy.","Nhưng trong câu chuyện nực cười đến vậy, tất cả mọi người lại đều rất hạnh phúc."
lang_multi_text_1sthalf.db,MultiText,MAIN_YHX_104_2,啊——你问我吗？,"Oh, are you talking to me?",A... cậu hỏi tôi à?
lang_multi_text_1sthalf.db,MultiText,MAIN_YHX_104_20,依赖那只猫的人，憎恶那只猫的人，全都得到了自己想要的东西。,"The ones who relied on the cat, the ones who hated the cat...  they all got exactly what they wanted.","Những kẻ dựa dẫm vào con mèo, những kẻ căm ghét con mèo, tất cả đều có được thứ mình muốn."
lang_multi_text_1sthalf.db,MultiText,MAIN_YHX_104_21,可是，那只猫该怎么办呢？,But what about the cat?,"Thế nhưng, con mèo đó phải làm sao đây?"
lang_multi_text_1sthalf.db,MultiText,MAIN_YHX_104_22,没人记得猫想回家的事了。纸盒被封上，把猫放进纸盒里的人也拒绝了它。,"It wants to go home, but no one remembers. The box is sealed shut, and the ones who put the cat in there have already turned their backs on it.","Không ai nhớ chuyện mèo muốn về nhà nữa. Hộp giấy bị niêm kín, người đặt mèo vào hộp cũng chối bỏ nó."
lang_multi_text_1sthalf.db,MultiText,MAIN_YHX_104_23,就连猫自己，也忘记了这件事。,Even the cat itself has forgotten.,"Ngay cả bản thân con mèo, cũng quên mất chuyện đó rồi."
lang_multi_text_1sthalf.db,MultiText,MAIN_YHX_104_24,你说，这难道……不可笑吗？,Heh… isn't that... so absurdly laughable?,"Cậu nói xem, chuyện này chẳng lẽ... không buồn cười sao?"
lang_multi_text_1sthalf.db,MultiText,MAIN_YHX_104_25,"发出笑声的爱弥斯坐在教室的椅子上，和你讲了一个有关拯救世界的黑猫的故事。
纸盒里这只被认为是救世主的猫可笑吗？她弯着眉眼问你，你却觉得她在流泪。","Aemeath's laughter echoes inside the classroom as she leans back in a chair and tells you a story about a black cat saving the world.
""Do you think this cat that's inside this box, whom everyone calls a savior, is laughable?"" She asks while giving you the eyebrow, yet you feel she is actually crying.","Aemeath vừa cười vừa ngồi trên ghế trong lớp học, kể cho cậu nghe câu chuyện về một con mèo đen cứu thế giới.
Con mèo trong hộp giấy bị xem là đấng cứu thế, buồn cười không? Cô ấy cong mắt cười hỏi cậu, nhưng cậu lại có cảm giác cô ấy đang khóc."
lang_multi_text_1sthalf.db,MultiText,MAIN_YHX_104_3,因为我知道了一个特别好笑的故事，实在是忍不住嘛。,I just heard the most hilarious story. Couldn't help myself!,"Vì tôi biết được một câu chuyện cực kỳ buồn cười, nhịn không nổi mà!"
lang_multi_text_1sthalf.db,MultiText,MAIN_YHX_104_4,既然你问了，那我也给你讲讲吧？,"Since you asked, how 'bout I tell you?","Đã hỏi rồi thì, để tôi kể cho cậu nghe nhé?"
