db_file,table_name,id,zh,en,vi
lang_multi_text.db,MultiText,NPC_HZ_8_3,啊，我还以为你是来问路的……,"Oh, I thought you were asking for directions...","A, tôi cứ tưởng cậu đến hỏi đường..."
lang_multi_text.db,MultiText,NPC_HZ_8_4,你很害怕有人问路吗？,You don't like people asking you for directions?,Cậu sợ có người hỏi đường lắm sao?
lang_multi_text.db,MultiText,NPC_HZ_8_5,有一点吧……乘霄山来了很多客人，他们不熟悉路，我也想利用空闲时间来帮帮大家。,"Somewhat... We have a lot of tourists in Mt. Firmament now. They don't know their way around, and I want to help them in my spare time.","Cũng hơi hơi... Thừa Tiêu Sơn đón nhiều khách lắm, họ không quen đường, tôi cũng muốn tranh thủ lúc rảnh giúp đỡ mọi người."
lang_multi_text.db,MultiText,NPC_HZ_8_6,可平常说话倒还好，一到指路或者介绍起虹镇的事，我就开始变得磕磕绊绊的……,"Normally, I don't have problems speaking, but when it comes to pointing the way or talking about Hongzhen, I stutter and freeze up...","Nhưng nói chuyện bình thường thì không sao, hễ chỉ đường hay giới thiệu về Hồng Trấn là tôi bắt đầu lắp ba lắp bắp..."
lang_multi_text.db,MultiText,NPC_HZ_8_7,……生怕自己说错了什么，拿不出一点自信。,I'm afraid I'd give the wrong information. I have no confidence at all.,"...Cứ sợ mình nói sai gì đó, chẳng có chút tự tin nào."
lang_multi_text.db,MultiText,NPC_HZ_8_8,你不是虹镇人吗？,Aren't you a local?,Cậu không phải người Hồng Trấn sao?
lang_multi_text.db,MultiText,NPC_HZ_8_9,是……虹镇的。但是关于虹镇的许多事，我也只听家里人念叨过，说不上真正了解。,"Yes, I'm from Hongzhen, but most of my knowledge about the town comes from my family. I'm no expert.","Là... người Hồng Trấn. Nhưng nhiều chuyện về Hồng Trấn, tôi cũng chỉ nghe người nhà kể qua, không dám nói là thật sự hiểu rõ."
lang_multi_text.db,MultiText,NPC_HZ_90_1,哈哈，有人能陪我聊聊天挺好，我就当是放松放松了。,"Yes, it's nice to have someone to chat with. This is relaxing for me.","Haha, có người trò chuyện cùng cũng hay, coi như là thư giãn một chút vậy."
lang_multi_text.db,MultiText,NPC_HZ_90_2,……说句心里话，现在一想到乘霄山的时间乱流危机还是心有余悸，哪怕已经过了这么多天，脑子里的那根弦还是绷紧着，不敢泄劲。,"To be honest, I still feel a lingering fear whenever I think about the Temporal Disruption in Mt. Firmament. Even though it's in the past now, I'm still tense as a tightrope.","...Nói thật lòng, giờ mỗi khi nghĩ đến cuộc khủng hoảng loạn lưu thời gian ở Thừa Tiêu Sơn vẫn còn thấy rợn người. Dù đã qua bao nhiêu ngày rồi, sợi dây trong đầu vẫn căng thẳng, không dám lơ là."
lang_multi_text.db,MultiText,NPC_HZ_90_3,为什么？,Why is that?,Tại sao?
lang_multi_text.db,MultiText,NPC_HZ_90_4,倒不是怕别的，就是担心我分身乏术，或是铺子里的备药跟不上。,It's just that I'm worried I won't be able to manage everything or that the supplies in my shop might run short.,"Không phải sợ gì khác, chỉ lo mình phân thân không xuể, hoặc thuốc dự trữ trong tiệm không đủ cung ứng."
lang_multi_text.db,MultiText,NPC_HZ_90_5,当时情况急， 即便有令尹和辛夷大人护着，大伙也难免磕着碰着受点伤。,Things were dire at the time. It was inevitable that people would get hurt even with the Magistrate and Lady Xinyi holding down the fort.,"Lúc đó tình hình cấp bách, dù có Lệnh Doãn và đại nhân Tân Di bảo hộ, mọi người cũng khó tránh khỏi va chạm bị thương."
lang_multi_text.db,MultiText,NPC_HZ_90_6,所以啊，最近来我这里看病抓药的人不少，有的还伤到了筋骨，要是处理不好，怕是会留下病根。,That's why I've seen a lot of patients lately. Some have injuries that could cause complications later if not treated correctly.,"Cho nên dạo này người đến chỗ tôi khám bệnh bốc thuốc không ít, có người còn bị thương đến gân cốt, nếu xử lý không tốt, e là sẽ để lại di chứng."
lang_multi_text.db,MultiText,NPC_HZ_90_7,辛苦你了。,Your hard work is appreciated.,Vất vả cho ông rồi.
lang_multi_text.db,MultiText,NPC_HZ_90_8,哈哈哈，说不辛苦那是假的，可看病救人是医者的本分，我既然选择了这个行当，就没有抱怨的道理。,"I can't deny it's hard work, but it's also my duty as a healer to treat patients. I chose to do it, so no complaints.","Hahaha, nói không vất vả thì là nói dối, nhưng chữa bệnh cứu người là bổn phận của người thầy thuốc. Tôi đã chọn nghề này thì không có lý do gì mà than phiền cả."
lang_multi_text.db,MultiText,NPC_HZ_90_9,唉，只盼着大伙都能尽快好起来啊。,"Sigh, I just hope everyone will get well soon.","Hah, chỉ mong mọi người sớm bình phục thôi."
lang_multi_text.db,MultiText,NPC_HZ_95_1,诶，年轻人就是腿脚利索，不像我这老头子，腰酸腿痛的，一身毛病。,"Sigh, it's great to be young, not like this old body, aches, and pain everywhere.","Ôi, người trẻ thì chân tay nhanh nhẹn, không như lão già này, lưng mỏi chân đau, đầy bệnh."
lang_multi_text.db,MultiText,NPC_HZ_95_10,喏，沿这条路下去往南走，镇子南边那个灵砂泉池就挺不错的。,Head south down that road and you'll find a delightful hot spring.,"Đấy, đi theo con đường này xuống rồi rẽ về phía nam, hồ Linh Sa Tuyền ở phía nam trấn khá lắm đấy."
lang_multi_text.db,MultiText,NPC_HZ_95_11,年轻人，得了空不妨去瞅瞅，我老头子敢打包票，乘霄山的灵砂泉绝对不会让你失望的。,"You should check it out when you get a chance.  Trust me, Mt. Firmament's Sagaci Springs will not disappoint.","Này cậu trẻ, rảnh thì ghé qua mà xem, lão già này dám đảm bảo, suối Linh Sa Tuyền trên Thừa Tiêu Sơn tuyệt đối không làm cậu thất vọng đâu."
lang_multi_text.db,MultiText,NPC_HZ_95_2,要不是靠仲林的药还有灵砂泉养着，这把老骨头，哪儿还能出得了门啊。,Can't even leave the house without Zhonglin’s prescriptions and those magic Sagaci Springs.,"Nếu không nhờ thuốc của Trọng Lâm với suối Linh Sa Tuyền dưỡng thân, bộ xương già này làm sao mà ra khỏi cửa được."
lang_multi_text.db,MultiText,NPC_HZ_95_3,（询问仲林的药。）,(Ask about Zhonglin's prescriptions.),(Hỏi về thuốc của Trọng Lâm.)
lang_multi_text.db,MultiText,NPC_HZ_95_4,（询问灵砂泉。）,(Ask about the Sagaci Springs.),(Hỏi về suối Linh Sa Tuyền.)
lang_multi_text.db,MultiText,NPC_HZ_95_5,仲林打小就跟着他爷爷学医，年纪不大，却算是我们这儿的老大夫了。虹镇上下但凡有人闹了病都要找他瞧瞧。,Zhonglin's been studying medicine in his grandfather's footsteps since childhood and is now our most trusted doctor here. He's the one we see to treat illness.,"Trọng Lâm từ nhỏ đã theo ông nội học y, tuổi tuy không lớn nhưng đã là lão đại phu ở vùng này rồi. Hễ ai trong Hồng Trấn mà ốm đau đều phải tìm anh ấy khám."
lang_multi_text.db,MultiText,NPC_HZ_95_6,虽说他配的药不全照着老方子来，但效果没得说。,"His prescriptions don't always conform to convention, but you can't argue the result.","Tuy thuốc cậu ấy bốc không hoàn toàn theo bài thuốc cũ, nhưng hiệu quả thì không chê vào đâu được."
lang_multi_text.db,MultiText,NPC_HZ_95_7,况且这么些年了，就属他最了解咱们的病，找他啊，我也放心。,"Not to mention after all these years, he knows our conditions the best, so I trust him.","Hơn nữa bao nhiêu năm rồi, cậu ấy là người hiểu rõ bệnh tình của chúng tôi nhất, tìm cậu ấy thì tôi yên tâm."
lang_multi_text.db,MultiText,NPC_HZ_95_8,哈哈，这你算是问对人咯。别嫌我老头子啰嗦，虹镇的灵砂泉好处多着呢。,"Haha, you're asking the right guy. I can be a chatterbox when it comes to our local Sagaci Springs.","Haha, cậu hỏi đúng người rồi đấy. Đừng chê lão già này lắm lời, suối Linh Sa Tuyền ở Hồng Trấn có nhiều lợi ích lắm."
lang_multi_text.db,MultiText,NPC_HZ_95_9,什么驱寒保暖、活血舒筋，虽说我也不懂啥医学药理，但只要一泡进池子就觉得浑身舒坦。,"I don't know much about the medical theory behind it, but I know I feel great and relaxed when I get into one.","Nào là trừ hàn giữ ấm, hoạt huyết thư cân, tuy tôi cũng chẳng hiểu gì về y lý dược học, nhưng cứ ngâm mình vào hồ là thấy khoan khoái khắp người."
lang_multi_text.db,MultiText,NPC_HZ_96_1,山野闲杂，童叟无欺。这词可是我从外乡顾客那儿讨来的，您看咋样？,"Come one, come all... That's the phrase I learned from foreign customers. What do you think?","Hàng sơn dã, trẻ già đều không lừa. Câu này tôi học được từ khách ngoại xứ đấy, ngài thấy sao?"
lang_multi_text.db,MultiText,NPC_HZ_97_1,来来来，有啥喜欢的？价格绝对实惠。,"Anything you like over here? Affordable price, guaranteed.","Lại đây lại đây, có gì vừa ý không? Giá cả tuyệt đối phải chăng."
lang_multi_text.db,MultiText,NPC_HZ_98_1,好嘞，您常来。,"All right, feel free to come back.","Được rồi, mời ngài ghé lại thường xuyên."
lang_multi_text.db,MultiText,NPC_HZ_99_1,要不，您再挑挑？,"Say, why don't you pick out something else?",Hay là ngài chọn thêm gì nữa đi?
lang_multi_text.db,MultiText,NPC_HZ_9_1,虹镇的建成年代极早，早于今州建州前，这里就已经是繁华重镇。,Hongzhen was founded very early. It was thriving when Jinzhou was just an idea.,"Hồng Trấn được xây dựng từ rất sớm, trước cả khi Kim Châu lập châu, nơi đây đã là một trọng trấn phồn hoa."
lang_multi_text.db,MultiText,NPC_HZ_9_2,在当时，虹镇的地位甚至可以媲美今天的今州。,"Back then, Hongzhen rivaled Jinzhou now.","Vào thời đó, vị thế của Hồng Trấn thậm chí có thể sánh ngang Kim Châu ngày nay."
lang_multi_text.db,MultiText,NPC_HZ_9_3,正是因为这个原因，有很多学者认为，虹镇不仅仅是今州先民的祖地，也是今州的前身。,"That's also the reason many scholars believe Hongzhen is not only the ancestral land of the early settlers of Jinzhou, but also the predecessor of Jinzhou itself.","Chính vì lý do này, nhiều học giả cho rằng Hồng Trấn không chỉ là tổ địa của tiên dân Kim Châu, mà còn là tiền thân của Kim Châu."
lang_multi_text.db,MultiText,NPC_HZ_9_4,大家也可以看到，现在虹镇里保留下来的房屋，在形制上与今州城建筑有许多相似之处。,"As you can see, the houses that have been preserved in town share many similarities with Jinzhou architecture.","Mọi người cũng có thể thấy, những ngôi nhà còn được bảo tồn ở Hồng Trấn hiện tại, về hình thức có nhiều điểm tương đồng với kiến trúc thành Kim Châu."
lang_multi_text.db,MultiText,NPC_JC_53_1,听说前线之前战况很激烈啊。,I heard the front lines were pretty intense.,Nghe nói trước đó chiến sự ở tiền tuyến rất ác liệt.
lang_multi_text.db,MultiText,NPC_JC_53_2,是，我也听说了。还好一切都结束了，这场雨也停了。,"Yes, I've heard about it too. Thankfully, it's all over now, and the rain has stopped.","Ừ, tôi cũng nghe nói rồi. May mà mọi chuyện đã kết thúc, trận mưa cũng đã tạnh."
lang_multi_text.db,MultiText,NPC_JC_54_1,货物堆了那么久，这下总算能顺利开始运了！,"The goods have been piling up for so long. Finally, we can start shipping them out!","Hàng hóa chất đống lâu thế rồi, giờ cuối cùng cũng có thể bắt đầu vận chuyển được!"
lang_multi_text.db,MultiText,NPC_JC_54_2,可不是？多亏了那位漂泊者。,Yes. All thanks to that Rover.,Đúng không? Tất cả là nhờ vị Lữ Khách đó.
lang_multi_text.db,MultiText,NPC_JC_55_1,妈妈，妈妈！那个很厉害的人还没有来吗！,"Mom, mom! Where is that powerful person?","Mẹ ơi, mẹ ơi! Người rất giỏi đó vẫn chưa đến sao!"
lang_multi_text.db,MultiText,NPC_JC_55_2,就快了，别着急。我们先听说书人讲讲那个人的故事，好不好？,"{Male=He;Female=She} will be here in a minute. How about we listen to the storyteller's tale of that person first, okay?","Sắp rồi, đừng nóng vội. Chúng ta nghe ông kể chuyện kể về người đó trước đã, được không nào?"
lang_multi_text.db,MultiText,NPC_JC_56_1,你回来啦，大英雄！那个怪物消失了，今州很快又要恢复往常的繁华了。,"You're back, hero! With that monster gone, Jinzhou will be bustling again in no time!","Cậu về rồi à, đại anh hùng! Con quái vật đó đã biến mất, Kim Châu sẽ sớm phục hồi sự phồn hoa như xưa thôi."
lang_multi_text.db,MultiText,NPC_JC_56_2,肯定会很热闹的！对了对了，追月节也快到了，到时候你可一定要在我们的城市好好玩儿上一番！,"It's gonna be a blast! Oh, right, the Moon-Chasing Festival is coming up! You should stick around and enjoy the fun!","Chắc chắn sẽ rất náo nhiệt! À đúng rồi đúng rồi, Tết Truy Nguyệt cũng sắp đến rồi, lúc đó cậu nhất định phải ở lại thành phố chúng tôi mà vui chơi thỏa thích nhé!"
lang_multi_text.db,MultiText,NPC_JC_57_1,啊，是那时候的{Male=大哥哥;Female=大姐姐}！令尹姐姐的客人！,"Ah, it's {Male=big brother;Female=big sister}! Magistrate's guest!","A, là {Male=anh;Female=chị} lần trước! Khách của chị Lệnh Doãn!"
lang_multi_text.db,MultiText,NPC_JC_57_2,那、那个……谢谢你，保护了大家……！,Th-thank you... for protecting everyone!,"Cái, cái kia... cảm ơn đã bảo vệ mọi người...!"
lang_multi_text.db,MultiText,NPC_JC_58_1,感谢你，漂泊者。你让战事以最小的代价结束，挽救了许多夜归的生命。,"Thank you, Rover. You ended the conflict with the least price to pay and saved the lives of many Midnight Rangers.","Cảm ơn ngài, Lữ Khách. Ngài đã kết thúc chiến sự với cái giá nhỏ nhất, cứu sống biết bao sinh mạng Dạ Quy."
lang_multi_text.db,MultiText,NPC_JC_58_2,看到将军和你平安归来，我真的……,"Seeing you and the general back here safe and sound, I just...","Thấy tướng quân và ngài bình an trở về, tôi thật sự..."
lang_multi_text.db,MultiText,NPC_JC_58_3,……抱歉，我有点太激动了。平安回来，就是最好的事。,"...Sorry, I got a bit too excited. Anyway, nothing matters more than coming back safely.","...Xin lỗi, tôi hơi quá xúc động. Bình an trở về, đó là điều tốt đẹp nhất rồi."
lang_multi_text.db,MultiText,NPC_JC_59_1,噢，是您啊。我正想着呢，是该来见见您的。,"Oh, it's you. I was just thinking that it's about time I paid you a visit.","Ồ, là ngài đấy à. Tôi đang nghĩ, đã đến lúc phải đến gặp ngài rồi."
lang_multi_text.db,MultiText,NPC_JC_59_2,我在这儿给人说书许多年，讲了不知多少听来的传奇话本、奇谈异闻。如今，倒是也能做一回听众。,"I've been here telling stories for many years, recounting countless legends, tales, and anecdotes. Now, for a change, I can be a listener.","Tôi kể chuyện ở đây đã nhiều năm, không biết bao nhiêu truyền kỳ, kỳ đàm dị văn nghe được rồi kể lại. Giờ đây, rốt cuộc cũng được làm thính giả một phen."
lang_multi_text.db,MultiText,NPC_JC_59_3,您已经成了新故事的一部分。要是得空，也和我唠唠看吧！,"You've become part of a new story. If you've got time, come over for a chat with me!","Ngài đã trở thành một phần của câu chuyện mới. Nếu rảnh, cũng ghé nói chuyện với tôi nhé!"
lang_multi_text.db,MultiText,NPC_JC_60_1,你回来了，漂泊者。辛苦了，回城这一路很累吧。,"You're back, Rover. Must've been a tiring journey back to the city, right?","Ngươi đã về rồi, Lữ Khách. Vất vả rồi, đường về thành chắc mệt lắm nhỉ."
lang_multi_text.db,MultiText,NPC_JC_60_10,忙过劲了才感觉到浑身疼，等到手头的事告一段落，我也打算休息一阵。,"Only after the rush do I feel the aches all over my body. Once I've wrapped up my current tasks, I plan to take a break.","Bận rộn xong xuôi mới thấy đau nhức khắp người, đợi công việc trước mắt ổn thỏa, tôi cũng định nghỉ ngơi một thời gian."
lang_multi_text.db,MultiText,NPC_JC_60_11,这段时间你就好好放松，从奔波中休憩一会儿吧。,And you should also take some time to relax from all the hustle and bustle.,"Khoảng thời gian này ngươi cứ thư giãn cho thoải mái, nghỉ ngơi một chút sau những ngày bôn ba đi."
lang_multi_text.db,MultiText,NPC_JC_60_2,上一次见面还是在伏波营。那时候太忙了……没想到你就是令尹的那位贵客，都没来得及细看。如今，你已是我们夜归的英雄。,"Last time we met was at the Rearguard Camp. I was too busy then... I didn't realize you were the guest Magistrate mentioned. I didn't even get a good look at you. Now, you're a hero of the Midnight Rangers.","Lần trước gặp nhau còn là ở doanh trại Phục Ba. Lúc đó bận quá... không ngờ ngươi chính là vị quý khách mà Lệnh Doãn nhắc đến, còn chưa kịp nhìn kỹ. Giờ đây, ngươi đã là anh hùng của Dạ Quy chúng tôi rồi."
lang_multi_text.db,MultiText,NPC_JC_60_3,伏波营地现在如何？,How's the Rearguard Camp now?,Doanh trại Phục Ba giờ thế nào rồi?
lang_multi_text.db,MultiText,NPC_JC_60_4,你的近况如何？,How have you been?,Gần đây ngươi thế nào?
lang_multi_text.db,MultiText,NPC_JC_60_5,比之前情况好上很多。战事结束，伤员不再增加，医护人员总算可以喘口气了。,"Things are much better than before. The war is over, no more casualties, and the medical staff can finally catch their breath.","Tốt hơn trước rất nhiều. Chiến sự đã kết thúc, thương binh không tăng thêm nữa, nhân viên y tế cuối cùng cũng có thể thở phào."
lang_multi_text.db,MultiText,NPC_JC_60_6,不过，伏波既然身为后卫，自然还有许多需要处理的琐事。这一场雨……的确是下得太沉。,"However, as a Rearguard, there are a lot of trivial matters that I've got to attend to. This rain... it's just too heavy.","Tuy nhiên, Phục Ba vốn là hậu vệ, tự nhiên vẫn còn rất nhiều việc vặt cần xử lý. Trận mưa này... quả thực nặng nề quá."
lang_multi_text.db,MultiText,NPC_JC_60_7,会恢复如初的。无论是伏波营，还是今州。,But everything will be fine. Whether it's about Rearguard or Jinzhou.,"Sẽ phục hồi như cũ thôi. Dù là doanh trại Phục Ba, hay Kim Châu."
lang_multi_text.db,MultiText,NPC_JC_60_8,和之前差不多，和你聊完就要回去继续干活了。,"Pretty much the same as before, I'll have to get back to work after our chat.","Cũng giống như trước, nói chuyện với ngươi xong tôi lại phải quay về tiếp tục làm việc."
lang_multi_text.db,MultiText,NPC_JC_60_9,虽然给了我假期……但现在还不是时候，我得把善后工作安排好。,Even though I've been given a vacation... now's not the time. I've got to sort out the aftermath.,"Tuy được cho nghỉ phép... nhưng bây giờ chưa phải lúc, tôi phải sắp xếp xong công việc thiện hậu đã."
lang_multi_text.db,MultiText,NPC_JKWW_10_1,七丘在大量进口拉古那的香料和白云岩呢，看来我们挑了个好时间入场。,Septimont is importing large quantities of Ragunna spices and alabaster. It seems we've chosen the perfect time to enter the market.,"Thất Khâu đang nhập khẩu lượng lớn gia vị và đá bạch vân từ Ragunna, có vẻ chúng ta đã chọn đúng thời điểm để tham gia thị trường."
lang_multi_text.db,MultiText,NPC_JKWW_10_2,幸好修会在狂欢节前后放松了贸易管控，不然这份合约的收益还很难说。,"Lucky for us, the Order relaxed trade restrictions around the Carnevale. Without that, this deal might've been a gamble.","May mà Tu Hội nới lỏng quản lý thương mại trong dịp Lễ Hội Hóa Trang, không thì lợi nhuận từ hợp đồng này còn khó nói lắm."
lang_multi_text.db,MultiText,NPC_JKWW_10_3,不知道这样的好日子还能持续多久……,Who knows how long these good days will last...,Không biết những ngày tốt đẹp thế này còn kéo dài được bao lâu...
lang_multi_text.db,MultiText,NPC_JKWW_11_1,你好，你也是来和莫塔里家族谈生意的吗？,"Hello, are you here to do business with the Montelli family as well?","Xin chào, cậu cũng đến đây để đàm phán làm ăn với gia tộc Montelli sao?"
lang_multi_text.db,MultiText,NPC_JKWW_11_2,算是吧。,Something like that.,Cũng coi như vậy.
lang_multi_text.db,MultiText,NPC_JKWW_11_3,其实我就是家族的人。,I'm actually a member of the family.,Thực ra tôi là người của gia tộc.
lang_multi_text.db,MultiText,NPC_JKWW_11_4,莫塔里人虽然在金钱上非常精明，却是相当有契约精神的生意伙伴。,"The Montelli are sharp with coin, but they honor their word. Good business partners, if you can trust them.","Người Montelli tuy rất tinh tường chuyện tiền bạc, nhưng lại là đối tác kinh doanh rất giữ chữ tín."
lang_multi_text.db,MultiText,NPC_JKWW_11_5,这样吗？我猜你的职级肯定不低，毕竟普通职员都得穿统一的服饰啊。,Is that so? Guess that means you're a high rank. Most of the staff are stuck in those drab uniforms.,"Vậy sao? Tôi đoán chức vụ của cậu chắc không thấp, vì nhân viên bình thường đều phải mặc đồng phục mà."
lang_multi_text.db,MultiText,NPC_JKWW_11_6,我们兄弟俩是在拉古那和七丘两地往返的商人，兴趣领域是……大宗商品贸易、艺术品拍卖还有热血的竞技赛事。,"We're brothers traveling between Ragunna and Septimont. We deal in commodities, art auctions, and, of course, high-stakes competitions.","Anh em chúng tôi là thương nhân qua lại giữa Ragunna và Thất Khâu, lĩnh vực quan tâm là... mua bán hàng hóa số lượng lớn, đấu giá nghệ thuật và các giải thi đấu nhiệt huyết."
lang_multi_text.db,MultiText,NPC_JKWW_11_7,或许哪一天，我们还能达成商业上的合作呢。,"Perhaps one day, we'll find ourselves working together on a venture.","Biết đâu một ngày nào đó, chúng ta còn có thể hợp tác kinh doanh cùng nhau."
lang_multi_text.db,MultiText,NPC_JKWW_12_1,居然有金色的喷泉……这里真是富得流油啊！,"Well, I'll be! A golden fountain... This place is practically drowning in riches!","Trời ơi, đài phun nước bằng vàng luôn... Nơi này giàu có thật sự quá đi!"
lang_multi_text.db,MultiText,NPC_JKWW_12_2,把硬币丢进这个喷泉里许愿的话会怎么样？,"What happens if you throw a coin in and make a wish, I wonder?",Nếu ném đồng xu vào đài phun nước này để ước nguyện thì sẽ ra sao nhỉ?
lang_multi_text.db,MultiText,NPC_JKWW_12_3,这个我知道，你会被带去交罚款。,"Oh, that's easy. You'll end up being carted off to pay a fine.","Cái này tôi biết, bạn sẽ bị dẫn đi nộp phạt đấy."
lang_multi_text.db,MultiText,NPC_JKWW_13_1,喂，天空中的那个是什么啊？,"Hey, what's that in the sky?","Này, cái gì trên trời kia vậy?"
lang_multi_text.db,MultiText,NPC_JKWW_13_2,真漂亮，就像一对发光的翅膀……,"It's stunning, like a pair of glowing wings...","Đẹp quá, trông như một đôi cánh phát sáng vậy..."
lang_multi_text.db,MultiText,NPC_JKWW_13_3,你快拍下来，说不定还能给《潮汐影像》投个稿呢。,"Quick, snap a shot! Might be worth sending to Wutherium Film Studio!","Chụp lại mau đi, biết đâu còn gửi bài cho ""Triều Tịch Ảnh Tượng"" được đấy."
lang_multi_text.db,MultiText,NPC_JKWW_14_1,在前台区域工作就这点好，偶尔还能出来溜达下，呼吸新鲜空气。,"There are perks to working the front desk, like sneaking out for a bit of fresh air now and then.","Làm việc ở khu vực tiền sảnh có cái hay là thỉnh thoảng còn ra ngoài đi dạo, hít thở không khí trong lành."
lang_multi_text.db,MultiText,NPC_JKWW_14_2,真的不要紧吗？我看你的工作排期上任务还挺多的。,Everything really alright? Your schedule looks packed with tasks.,Thật sự không sao chứ? Tôi thấy lịch làm việc của cậu còn khá nhiều việc mà.
