db_file,table_name,id,zh,en,vi
lang_multi_text.db,MultiText,PhotographHandBook_85_Descrtption,再没有会被沉没的月亮了，因她知晓，自己将命中的每一处，都是她的靶心。,"The moon will fall no more, for she knows every arrow she lets loose will find its mark.","Không còn vầng trăng nào sẽ bị nhấn chìm nữa, vì nàng biết rõ, mọi nơi nàng bắn trúng đều là tâm bia của nàng."
lang_multi_text.db,MultiText,PhotographHandBook_85_Name,唯一解,Singular Answer,Đáp án duy nhất
lang_multi_text.db,MultiText,PhotographHandBook_86_Descrtption,命运的终点没有为他解围的天降之神，因那齿轮转动伊始，就不属于他自己。但他仍能选择，守护自己最后的荣光。,"At fate's end, there was no divine intervention to save him, for from the moment those gears began turning, he was no longer a man of himself. Yet he still chose to defend his final glory.","Nơi tận cùng số mệnh không có vị thần nào giáng thế giải cứu, bởi từ khoảnh khắc bánh răng bắt đầu quay, nó đã không còn thuộc về chính anh. Nhưng anh vẫn có thể chọn, bảo vệ vinh quang cuối cùng của mình."
lang_multi_text.db,MultiText,PhotographHandBook_86_Name,为人的荣光,Glory of Humanity,Vinh quang của con người
lang_multi_text.db,MultiText,PhotographHandBook_87_Descrtption,她行拯救的道，她行诛杀的恶。,She walks the path of salvation. She commits the sin of killing.,"Nàng bước trên con đường cứu rỗi, nàng gánh lấy tội ác giết chóc."
lang_multi_text.db,MultiText,PhotographHandBook_87_Name,狩光,Hunting the Light,Săn ánh sáng
lang_multi_text.db,MultiText,PhotographHandBook_88_Descrtption,尘封的过往于混乱中开启。,Sealed memories unfold amidst chaos.,Quá khứ phong ấn được khai mở giữa hỗn loạn.
lang_multi_text.db,MultiText,PhotographHandBook_88_Name,混乱的中心,Epicenter of Turmoil,Tâm điểm hỗn loạn
lang_multi_text.db,MultiText,PhotographHandBook_89_Descrtption,“黑羊揭开帷幕之时，天上寂静约有二刻。我听见末日的号角响起，那天国的门扉也随之洞开……”,"""When the black lamb parts the curtain, the heavens fall silent for about two quarters. I hear the horn of doom sound, and the gates of Paradise swing open...""","""Khi Dê Đen vén bức màn, bầu trời im lặng khoảng hai khắc. Ta nghe tiếng kèn ngày tận thế vang lên, và cánh cửa Thiên Quốc cũng theo đó mà mở toang..."""
lang_multi_text.db,MultiText,PhotographHandBook_89_Name,终末启示,Doomsday Revelation,Khải thị cuối cùng
lang_multi_text.db,MultiText,PhotographHandBook_90_Descrtption,就以此身，照亮黑暗。,Then this body shall burn to illuminate the darkness.,"Lấy thân này, chiếu sáng bóng tối."
lang_multi_text.db,MultiText,PhotographHandBook_90_Name,如若前路无光,Should Darkness Lie Ahead,Nếu phía trước không có ánh sáng
lang_multi_text.db,MultiText,PhotographHandBook_91_Descrtption,自有众灵为其摆渡。,The spirits shall ferry the one across.,Tự có chúng linh đưa người qua bến.
lang_multi_text.db,MultiText,PhotographHandBook_91_Name,扣下扳机,Pull the Trigger,Bóp cò
lang_multi_text.db,MultiText,PhotographHandBook_92_Descrtption,太阳仍将照常升起。,The sun still rises.,Mặt trời vẫn sẽ mọc như thường.
lang_multi_text.db,MultiText,PhotographHandBook_92_Name,神不在的黎明,A Dawn Without Divinity,Bình minh không có thần
lang_multi_text.db,MultiText,PhotographHandBook_93_Descrtption,祂将一切希望留给人们，指引人们走向自由的生路；祂自联结的渴望中降诞，将恐惧带至每一个自由的心灵。,"They betowed hope upon humanity, guiding them toward a path of freedom.
It was born from the longing for unity, bringing terror to every free soul.","Ngài để lại mọi hy vọng cho nhân thế, dẫn dắt con người bước đến con đường tự do; Nó giáng sinh từ khát vọng liên kết, mang nỗi sợ hãi đến mỗi tâm hồn tự do."
lang_multi_text.db,MultiText,PhotographHandBook_93_Name,千岛源起,Origin of Islands,Khởi nguồn nghìn đảo
lang_multi_text.db,MultiText,PhotographHandBook_94_Descrtption,“与我一同狩猎，或者一同赴死……选择吧。”,"""Hunt with me, or die with me... Your choice.""","""Cùng ta săn mồi, hoặc cùng ta chết... Hãy chọn đi."""
lang_multi_text.db,MultiText,PhotographHandBook_94_Name,永猎之始,Start of Eternal Hunt,Khởi đầu cuộc săn vĩnh hằng
lang_multi_text.db,MultiText,PhotographHandBook_95_Descrtption,历史没有如果。,History grants no second chances.,"Lịch sử không có chữ ""nếu""."
lang_multi_text.db,MultiText,PhotographHandBook_95_Name,问剑,Moment of Reflection,Vấn Kiếm
lang_multi_text.db,MultiText,PhotographHandBook_96_Descrtption,雨线倾泻的夜幕中，唯有她能窥见那根震颤的，绯色弦线。,"In the rain-drenched night, only she sees the trembling crimson string.","Giữa màn đêm mưa tuôn xối xả, chỉ có nàng mới nhìn thấy sợi dây đỏ thắm đang rung lên run rẩy."
lang_multi_text.db,MultiText,PhotographHandBook_96_Name,雨幕，猩红,Crimson Rainfall,"Màn Mưa, Đỏ Thắm"
lang_multi_text.db,MultiText,PhotographHandBook_97_Descrtption,少女的心象风景，她的过去，她的家乡。,"The girl's inner world: her past, her hometown.","Phong cảnh trong tâm tưởng thiếu nữ - quá khứ của cô, quê hương của cô."
lang_multi_text.db,MultiText,PhotographHandBook_97_Name,列车中的“怪物”,"""Monster"" in the Train","""Quái vật"" trên chuyến tàu"
lang_multi_text.db,MultiText,PhotographHandBook_98_Descrtption,在那境界线的彼方，会有万盏灯火，将你照亮。,"Past the horizon line, thousands of lights will illuminate your way.","Bên kia đường chân trời, sẽ có vạn ngọn đèn tỏa sáng soi đường cho ngươi."
lang_multi_text.db,MultiText,PhotographHandBook_98_Name,你的归途,Your Way Back,Đường về của ngươi
lang_multi_text.db,MultiText,PhotographHandBook_99_Descrtption,“……希望与朋友相度的时光能化为永恒。”,"""…I wish for the moments spent with friends to last forever.""","""...Mong rằng khoảng thời gian bên bạn bè sẽ hóa thành vĩnh cửu."""
lang_multi_text.db,MultiText,PhotographHandBook_99_Name,开业与星愿,Opening Party and Wishes,Khai trương và Điều ước sao
lang_multi_text.db,MultiText,PhotographicTipMainText_01,请拍摄第一帧,Capture the first frame,Hãy chụp khung hình thứ nhất
lang_multi_text.db,MultiText,PhotographicTipMainText_02,请拍摄第二帧,Capture the second frame,Hãy chụp khung hình thứ hai
lang_multi_text.db,MultiText,PhotographicTipMainText_03,请拍摄第三帧,Capture the third frame,Hãy chụp khung hình thứ ba
lang_multi_text.db,MultiText,PhotographicTipMainText_finish,所有拍摄目标已完成,All photo objectives have been completed,Đã hoàn thành tất cả mục tiêu chụp ảnh
lang_multi_text.db,MultiText,PhrolovaFarm_AnimalMax,当前声骸数量已达到上限，请移除后再尝试,Echo limit reached. Please remove some Echoes and try again.,"Số lượng Thanh Hài hiện tại đã đạt giới hạn, vui lòng xóa bớt rồi thử lại"
lang_multi_text.db,MultiText,PhrolovaFarm_CoinDesc_1,一张印有摩天轮图案的票劵，它象征着乐园曾经的辉煌。声骸们回收着它试图恢复乐园以往的模样。,"A coupon with a Ferris wheel pattern on it, symbolizing the long-gone glory of the Dreamland. By collecting these coupons, the Echoes wish to revive the place to its past splendor.","Một tấm vé in hình đu quay, tượng trưng cho thời huy hoàng xưa kia của Lạc Viên. Các Thanh Hài thu thập chúng với hy vọng khôi phục lại diện mạo ban đầu của Lạc Viên."
lang_multi_text.db,MultiText,PhrolovaFarm_CoinDesc_2,冻结着频率的晶体，它是梦境中的造物，其中蕴藏着神奇的力量。,Crystallized fragments of frozen frequencies. These artifacts of the dream possess wonderful powers.,"Tinh thể đông cứng tần số, là tạo vật trong mộng cảnh, bên trong ẩn chứa sức mạnh kỳ diệu."
lang_multi_text.db,MultiText,PhrolovaFarm_CoinDesc_3,一张印有摩天轮图案的票劵，它象征着乐园曾经的辉煌。声骸们每日收集到的票劵将记录于此。,"A coupon with a Ferris wheel pattern on it, symbolizing the long-gone glory of the Dreamland. These are the coupons Echoes collected each day.","Một tấm vé in hình đu quay, tượng trưng cho thời huy hoàng xưa kia của Lạc Viên. Số vé mà các Thanh Hài thu thập được mỗi ngày sẽ được ghi nhận tại đây."
lang_multi_text.db,MultiText,PhrolovaFarm_CoinName_1,乐园券,Dreamland Coupon,Vé Lạc Viên
lang_multi_text.db,MultiText,PhrolovaFarm_CoinName_2,频率晶体,Frequency Crystal,Tinh Thể Tần Số
lang_multi_text.db,MultiText,PhrolovaFarm_CoinName_3,每日乐园券,Daily Coupon,Vé Lạc Viên Hằng Ngày
lang_multi_text.db,MultiText,PhrolovaFarm_Comics_1,一切的起因是，深林中出现了一扇奇异的门……,It all began with a strange gateway that appeared deep in the forest...,Khởi nguồn của mọi chuyện là một cánh cửa kỳ lạ xuất hiện trong rừng sâu...
lang_multi_text.db,MultiText,PhrolovaFarm_Comics_2,好奇的指挥家穿过门扉，等待她的却是一场坠落。,"The curious Conductor stepped through, and what awaited her was a fall.","Nhà soạn nhạc tò mò bước qua cánh cửa, nhưng điều chờ đợi cô lại là một cú rơi tự do."
lang_multi_text.db,MultiText,PhrolovaFarm_Comics_3,……赫卡忒。,…Hecate.,...Hecate.
lang_multi_text.db,MultiText,PhrolovaFarm_Comics_4,荒废的设施，自由栖息的声骸，此地是人类消失后的乐园——,"Desolate ruins, roaming Echoes, this is a post-humanity paradise—","Cơ sở hoang phế, Thanh Hài tự do cư ngụ, nơi đây là thiên đường sau khi loài người biến mất-"
lang_multi_text.db,MultiText,PhrolovaFarm_Comics_5,声骸的生态，取代了人类的生活……,Echoes now thrive where human once lived…,Hệ sinh thái của Thanh Hài đã thay thế cuộc sống của con người...
lang_multi_text.db,MultiText,PhrolovaFarm_Comics_6,想必能在这里寻得与过往不同的灵感。,"Surely, this place offers inspiration unlike anything before.",Chắc hẳn có thể tìm được nguồn cảm hứng khác biệt so với trước đây ở nơi này.
lang_multi_text.db,MultiText,PhrolovaFarm_Comics_7,既是如此，便让我见证乐章的休止符会落往何处吧。,"If so, let me bear witness to where the final rest of this symphony shall fall…","Đã vậy, hãy để ta chứng kiến dấu lặng của nhạc chương sẽ rơi xuống nơi nào."
lang_multi_text.db,MultiText,PhrolovaFarm_Comics_8,糟糕，这好像不太妙……,Oops. This is no good…,"Hỏng rồi, tình hình có vẻ không ổn..."
lang_multi_text.db,MultiText,PhrolovaFarm_Comics_NextPage,【下一页】,Next,[Trang tiếp]
lang_multi_text.db,MultiText,PhrolovaFarm_DailyIncome,今日收入,Today's Yield,Thu nhập hôm nay
lang_multi_text.db,MultiText,PhrolovaFarm_FarmDetail,乐园详情,Dreamland Detail,Chi tiết Lạc Viên
lang_multi_text.db,MultiText,PhrolovaFarm_GameResult_EndlessMode,无尽挑战,Infinite Mode,Thử Thách Vô Tận
lang_multi_text.db,MultiText,PhrolovaFarm_GameResult_Homepage,返回主页,Return,Quay về trang chủ
lang_multi_text.db,MultiText,PhrolovaFarm_GameResult_NewRecord,新纪录,New Record,Kỷ lục mới
lang_multi_text.db,MultiText,PhrolovaFarm_GameResult_Title,挑战成功,Challenge Successful,Thử thách thành công
lang_multi_text.db,MultiText,PhrolovaFarm_GameResult_Title_Fail,挑战失败,Challenge Failed,Thử thách thất bại
lang_multi_text.db,MultiText,PhrolovaFarm_GameResult_TryAgain,重新挑战,Challenge Again,Thử lại
lang_multi_text.db,MultiText,PhrolovaFarm_InGameShop_Hide,隐藏当前界面,Hide this interface,Ẩn giao diện hiện tại
lang_multi_text.db,MultiText,PhrolovaFarm_InGameShop_SoldOut,已售罄,Sold Out,Đã bán hết
lang_multi_text.db,MultiText,PhrolovaFarm_InGameShop_Title,乐园商店,Dreamland Shop,Cửa hàng Lạc Viên
lang_multi_text.db,MultiText,PhrolovaFarm_LandName_1,梦块·水镜碎域,Dream Block: Watermirror,Mộng Khối: Thủy Kính Toái Vực
lang_multi_text.db,MultiText,PhrolovaFarm_LandName_2,梦块·黑石碎域,Dream Block: Obsidian,Mộng Khối - Hắc Thạch Toái Vực
lang_multi_text.db,MultiText,PhrolovaFarm_LandName_3,梦块·沙石碎域,Dream Block: Gravel,Mộng Khối - Vùng Sa Thạch Vụn
lang_multi_text.db,MultiText,PhrolovaFarm_LandName_4,梦块·冰晶碎域,Dream Block: Ice Shards,Mộng Khối - Vùng Băng Tinh Vụn
lang_multi_text.db,MultiText,PhrolovaFarm_LandName_5,梦块·林木碎域,Dream Block: Woodland,Mộng Khối: Lâm Mộc Toái Vực
lang_multi_text.db,MultiText,PhrolovaFarm_LandName_6,梦块·禁行碎域,Dream Block: Forbidden,Mộng Khối: Cấm Hành Toái Vực
lang_multi_text.db,MultiText,PhrolovaFarm_LandName_7,梦块·黑岩碎域,Dream Block: Blackstone,Mộng Khối: Hắc Nham Toái Vực
lang_multi_text.db,MultiText,PhrolovaFarm_LevelDetail_Environment,关卡环境,Stage Environment,Môi trường màn chơi
lang_multi_text.db,MultiText,PhrolovaFarm_LevelDetail_FirstReward,首通奖励,First Clear,Phần thưởng thông quan lần đầu
lang_multi_text.db,MultiText,PhrolovaFarm_LevelDetail_Goal,关卡目标,Stage Goal,Mục tiêu màn chơi
lang_multi_text.db,MultiText,PhrolovaFarm_LevelDetail_RepeatReward,重复通关奖励,Repeated Clear Rewards,Thưởng hoàn thành lặp lại
lang_multi_text.db,MultiText,PhrolovaFarm_LevelDetail_Reward,通关奖励,Rewards,Phần thưởng thông quan
lang_multi_text.db,MultiText,PhrolovaFarm_LevelDetail_Title,关卡详情,Details,Chi tiết màn chơi
lang_multi_text.db,MultiText,PhrolovaFarm_LimitedTask_1,选择【递变之梦】完成1次任意关卡,Complete any difficulty with Dream of Gradation,Chọn [Mộng Đệ Biến] hoàn thành 1 lần bất kỳ màn chơi nào
lang_multi_text.db,MultiText,PhrolovaFarm_LimitedTask_10,解锁50位乐园成员,Unlock 50 Dreamland Members,Mở khóa 50 thành viên Lạc Viên
lang_multi_text.db,MultiText,PhrolovaFarm_LimitedTask_11,解锁所有乐园成员,Unlock all Dreamland Members,Mở khóa tất cả thành viên Lạc Viên
lang_multi_text.db,MultiText,PhrolovaFarm_LimitedTask_12,解锁30个乐园道具,Unlock 30 Dreamland Props,Mở khóa 30 đạo cụ Lạc Viên
lang_multi_text.db,MultiText,PhrolovaFarm_LimitedTask_13,解锁35个乐园道具,Unlock 35 Dreamland Props,Mở khóa 35 đạo cụ Lạc Viên
lang_multi_text.db,MultiText,PhrolovaFarm_LimitedTask_14,解锁40个乐园道具,Unlock 40 Dreamland Props,Mở khóa 40 đạo cụ Lạc Viên
lang_multi_text.db,MultiText,PhrolovaFarm_LimitedTask_15,使用任意幻梦祝福1次,Use any Phantasma Blessing 1 time,Sử dụng bất kỳ Chúc Phúc Huyễn Mộng 1 lần
lang_multi_text.db,MultiText,PhrolovaFarm_LimitedTask_16,使用任意幻梦祝福5次,Use any Phantasma Blessing 5 times,Sử dụng bất kỳ Chúc Phúc Huyễn Mộng 5 lần
lang_multi_text.db,MultiText,PhrolovaFarm_LimitedTask_17,累计获得40000乐园券,"Obtain 40,000 Dreamland Coupons in total",Tích lũy nhận được 40000 Phiếu Lạc Viên
lang_multi_text.db,MultiText,PhrolovaFarm_LimitedTask_18,累计获得80000乐园券,"Obtain 80,000 Dreamland Coupons in total",Tích lũy nhận được 80000 Phiếu Lạc Viên
lang_multi_text.db,MultiText,PhrolovaFarm_LimitedTask_19,累计获得150000乐园券,"Obtain 150,000 Dreamland Coupons in total",Tích lũy nhận được 150000 Phiếu Lạc Viên
lang_multi_text.db,MultiText,PhrolovaFarm_LimitedTask_2,选择【吞噬之梦】完成1次任意关卡,Complete any difficulty with Dream of Devouring,Chọn [Mộng Thôn Phệ] hoàn thành 1 lần bất kỳ màn chơi nào
lang_multi_text.db,MultiText,PhrolovaFarm_LimitedTask_20,累计获得50频率晶体,Obtain 50 Frequency Crystals in total,Tích lũy nhận được 50 Tinh Thể Tần Số
lang_multi_text.db,MultiText,PhrolovaFarm_LimitedTask_21,累计获得100频率晶体,Obtain 100 Frequency Crystals in total,Tích lũy nhận được 100 Tinh Thể Tần Số
lang_multi_text.db,MultiText,PhrolovaFarm_LimitedTask_22,解锁梦境演变-商店之赠,Unlock Dream Boon: Shop Bonus,Mở khóa Mộng Cảnh Diễn Biến - Tặng Phẩm Thương Điếm
lang_multi_text.db,MultiText,PhrolovaFarm_LimitedTask_23,解锁梦境演变-宝贵之物·II,Unlock Dream Boon: Precious Item II,Mở khóa Mộng Cảnh Diễn Biến - Bảo Vật Quý Giá II
lang_multi_text.db,MultiText,PhrolovaFarm_LimitedTask_24,解锁梦境演变-多多益善·II,Unlock Dream Boon: More the Merrier II,Mở khóa Mộng Cảnh Diễn Biến - Càng Nhiều Càng Tốt II
lang_multi_text.db,MultiText,PhrolovaFarm_LimitedTask_25,乐园商店购买10次商品,Purchase 10 times in the Dreamland Shop,Mua 10 lần vật phẩm tại Thương Điếm Lạc Viên
lang_multi_text.db,MultiText,PhrolovaFarm_LimitedTask_26,乐园商店购买20次商品,Purchase 20 times in the Dreamland Shop,Mua 20 lần vật phẩm tại Thương Điếm Lạc Viên
lang_multi_text.db,MultiText,PhrolovaFarm_LimitedTask_3,选择【换取之梦】完成1次任意关卡,Complete any difficulty with Dream of Exchange,Chọn [Mộng Hoán Thủ] hoàn thành 1 lần bất kỳ màn chơi nào
lang_multi_text.db,MultiText,PhrolovaFarm_LimitedTask_4,选择【融合之梦】完成1次任意关卡,Complete any difficulty with Dream of Integration,Chọn [Mộng Dung Hợp] hoàn thành 1 lần bất kỳ màn chơi nào
lang_multi_text.db,MultiText,PhrolovaFarm_LimitedTask_5,选择【递变之梦】完成5次任意关卡,Complete 5 difficulties with Dream of Gradation,Chọn [Mộng Đệ Biến] hoàn thành 5 lần bất kỳ màn chơi nào
lang_multi_text.db,MultiText,PhrolovaFarm_LimitedTask_6,选择【吞噬之梦】完成5次任意关卡,Complete 5 difficulties with Dream of Devouring,Chọn [Mộng Thôn Phệ] hoàn thành 5 lần bất kỳ màn chơi nào
lang_multi_text.db,MultiText,PhrolovaFarm_LimitedTask_7,选择【换取之梦】完成5次任意关卡,Complete 5 difficulties with Dream of Exchange,Chọn [Mộng Hoán Thủ] hoàn thành 5 lần bất kỳ màn chơi nào
lang_multi_text.db,MultiText,PhrolovaFarm_LimitedTask_8,选择【融合之梦】完成5次任意关卡,Complete 5 difficulties with Dream of Integration,Chọn [Mộng Dung Hợp] hoàn thành 5 lần bất kỳ màn chơi nào
lang_multi_text.db,MultiText,PhrolovaFarm_LimitedTask_9,解锁30位乐园成员,Unlock 30 Dreamland Members,Mở khóa 30 thành viên Lạc Viên
