db_file,table_name,id,zh,en,vi
lang_multi_text.db,MultiText,InfoDisplay_160000011_Text,"不光是布兰登，还有更多的人莫名其妙地消失了。如果不是我在学校里学会了如何速记别人的长相，也许会很容易忽略这个细节。
因为这里的每个人看起来都对这些失踪事件无动于衷。他们不好奇那些人去了哪里，他们将遭受怎么样的命运，他们只是麻木地干着自己的事，忍受着日渐变少的食物配给。
那些戴面具的人——我现在可以确认，他们是黑街最近来的某个大人物的手下，他们偶尔会离开黑街，到拉古那城里去。我不敢接近他们，但我有一次在他们集会时偶尔听到了一些东西……他们是一群罪犯，一群暴徒。他们兴高采烈地谈论着“复兴黑街”的大计划，不管他们背后那个大人物到底是谁，她似乎都打算通过犯罪来弄到一大笔资金。
但之后呢？复兴黑街之后呢？我不知道。说实话，我自认为我还是个比较有勇气的人，但我确实打从心底感到害怕。害怕那个大人物，害怕她的计划……我现在只想离开这里，让诫令院派人解决这些罪犯。
今天有一个令我意外的发现，我不知道这算是好消息还是坏消息。我在通风井附近的通道里找到了一个身份牌，黑街的居民用它们来证明彼此的身份，那个身份牌，是属于布兰登的。
他是不是已经遭遇不测了？也许……他留下那个身份牌是为了指引我？抑或警告我？那些戴面具的家伙盯得太紧，我没法直接逃出去。也许布兰登有什么办法，我得去找他。","Brandon's not the only one who's gone missing. People have been disappearing left and right. Good thing I learned how to quickly memorize people's faces in school, otherwise I could've easily overlooked this.

Everyone here seems indifferent to these disappearances. They're not even remotely curious about where those people went, or what fate they'll suffer. They just go about their business numbly while enduring the dwindling food supply.

As for those masks, I'm now certain they're working for some bigshot who recently showed up in the Black Alley. They occasionally leave to return to Ragunna City. I try to keep my distance, but I once overheard something during one of their gatherings... they're a bunch of criminals. Thugs. They were in one helluva celebratory mood talking about the ""rebirth of the Black Alley."" Whoever their boss is, she seems to be planning on making her fortune through crime.

But then what? What happens after the rebirth of the Black Alley? I haven't the slightest clue. To be honest, I normally consider myself a brave person, but I'm scared. Scared of that boss of theirs. Scared of her plans... I just want to leave now. Let the Chamber of Discipline deal with these criminals.

I did make an unexpected discovery today, though I can't tell if it's good news or bad news. I found an ID card in a tunnel near the ventilation shafts, something the residents of the Black Alley use to identify each other. It belongs to Brandon.

Did something happen to him? Or maybe... he left it there on purpose as some kind of guide? Or as a warning? Those masks are watching every move I make, I can't just make a break for it. Maybe Brandon knows a way out. I have to find him.","Không chỉ Brandon, còn có nhiều người nữa biến mất một cách khó hiểu. Nếu không phải tôi đã học được cách ghi nhớ nhanh diện mạo người khác ở trường, có lẽ sẽ rất dễ bỏ qua chi tiết này.
Bởi vì mọi người ở đây có vẻ đều thờ ơ trước những vụ mất tích này. Họ không tò mò những người đó đi đâu, sẽ chịu số phận thế nào, họ chỉ tê liệt làm việc của mình, chịu đựng khẩu phần ăn ngày càng ít đi.
Những kẻ đeo mặt nạ đó... bây giờ tôi có thể xác nhận, bọn chúng là tay sai của một nhân vật lớn nào đó mới đến Hẻm Tối gần đây, thỉnh thoảng chúng sẽ rời khỏi Hẻm Tối, đi đến thành phố Ragunna. Tôi không dám đến gần bọn chúng, nhưng có một lần khi chúng tụ họp tôi tình cờ nghe được vài thứ... bọn chúng là một lũ tội phạm, một đám côn đồ. Bọn chúng hân hoan bàn luận về kế hoạch lớn ""phục hưng Hẻm Tối"", bất kể nhân vật lớn sau lưng chúng rốt cuộc là ai, bà ta dường như định thông qua phạm tội để kiếm một khoản tiền lớn.
Nhưng sau đó thì sao? Sau khi phục hưng Hẻm Tối thì sao? Tôi không biết. Nói thật, tôi tự nhận mình là người khá có dũng khí, nhưng tôi thực sự cảm thấy sợ hãi từ tận đáy lòng. Sợ nhân vật lớn kia, sợ kế hoạch của bà ta... Bây giờ tôi chỉ muốn rời khỏi đây, để Giới Luật Viện phái người giải quyết đám tội phạm này.
Hôm nay có một phát hiện khiến tôi bất ngờ, không biết nên gọi là tin tốt hay tin xấu. Tôi tìm thấy một thẻ căn cước trong đường hầm gần giếng thông gió, cư dân Hẻm Tối dùng chúng để chứng minh thân phận với nhau, thẻ căn cước đó là của Brandon.
Có phải cậu ta đã gặp chuyện chẳng lành rồi không? Có lẽ... cậu ta để lại thẻ căn cước đó để chỉ dẫn cho tôi? Hay là cảnh báo tôi? Mấy gã đeo mặt nạ kia theo dõi quá chặt, tôi không thể trực tiếp trốn ra ngoài. Có lẽ Brandon có cách nào đó, tôi phải đi tìm cậu ta."
lang_multi_text.db,MultiText,InfoDisplay_160000011_Title,【语音日志·二】,Audio Log 2,[Nhật Ký Ghi Âm 2]
lang_multi_text.db,MultiText,InfoDisplay_160000012_Text,"塔洛斯老大要我带人到处缝缝补补，修修这个，修修那个。包括前面的积水区。我费了好大功夫才搞明白这个排水系统是怎么运作的：这个看起来像是旋转楼梯的东西其实是个停止运行的排水口，我花了点时间给它重新拉了一条供能线，它现在已经能正常运作了。
<color=yellow>中间的旋转柱上有排水口，只要击打开关就能启动它。只要把水排干净，被淹没的道路就能显露出来了。</color>
没有其他事情的话最好别启动它，塔洛斯老大说这是防止敌人侵入黑街深处的最后一条防线，所以维持它在淹没状态就行，帮里的兄弟需要通过的时候再说。","Talos had me and a group of guys on fixing and patching duty. Including the flooded area out front. The amount of effort it took to figure out how this drainage system works was something else. That thing that looks like a spiral staircase is actually a dead drainage outlet. I spent some time rerouting a power line to it, and now it's working properly.

<color=yellow>There's an outlet on the central rotating column. Hit the switch and it activates. Once the water is drained, the path beneath will be accessible.</color>

Best not to activate it unless absolutely necessary. Talos said it's the last line of defense against any intruders trying to get too deep into the Black Alley, so just keep it flooded unless our guys need to pass through.","Đại ca Talos bảo tôi dẫn người đi khắp nơi vá víu, sửa cái này, sửa cái kia. Bao gồm cả khu vực ngập nước phía trước. Tôi tốn bao công sức mới hiểu được hệ thống thoát nước này hoạt động thế nào: cái thứ trông giống cầu thang xoắn ốc này thực ra là một cửa thoát nước đã ngừng hoạt động, tôi mất chút thời gian kéo lại một đường dây cấp năng lượng cho nó, giờ nó đã có thể hoạt động bình thường rồi.
<color=yellow>Trên cột xoay ở giữa có cửa thoát nước, chỉ cần đánh vào công tắc là có thể khởi động nó. Chỉ cần xả sạch nước, con đường bị ngập sẽ lộ ra.</color>
Nếu không có việc gì khác thì tốt nhất đừng khởi động nó, đại ca Talos nói đây là phòng tuyến cuối cùng ngăn kẻ địch xâm nhập vào sâu trong Hẻm Tối, cho nên cứ giữ nó trong trạng thái ngập nước là được, khi nào anh em trong bang cần đi qua thì tính sau."
lang_multi_text.db,MultiText,InfoDisplay_160000012_Title,【帮派留下的便条】,Note Left by Gang Member,[Mẩu Giấy Bang Phái Để Lại]
lang_multi_text.db,MultiText,InfoDisplay_160000013_Text,"我看到了那些失踪的人到底遭遇了什么。我不能继续再在这里待下去了。这里的空气都弥漫着疯狂，我怕……我待久了以后，会变得和他们一样，残忍，扭曲，并漠视法纪。
我已经在这里待了多久了？地下水道里并没有昼夜的概念，也许一周？也许一个月？也许等我离开这里的时候，拉古那城已经成了一片燃烧的废墟，而只有罪犯们幸存下来，他们将举办一场关于毁灭和邪恶的无止尽的狂欢夜？
……他们会毁掉我会毁掉这座城市就连海洋也无法浇熄他们内心的火焰它会在废墟上熊熊燃烧我们都会燃烧殆尽……
英白拉多庇佑我……对，没错。希望仍在，祂会庇佑我的躯体与心灵……一定会的。
现在我要履行我的职责，以一名学生，一名记者，以及一名信徒的名义，我……我必须离开这里，把真相告知所有人，赶在那个塔洛斯用罪恶的暴行荼毒我们之前阻止她。
……对，我知道，我可能会死去，可能会更惨……如果他们抓到我……
但我不能什么都不做。该死的，动起来！我的腿！不能在这个时候……
他们被塔洛斯叫走了……好机会。盯着我的人也变少了。一定是布兰登，我就知道……他引开了那些人。
我还藏了一把短刀，我一直在等待今天……我把我的日志藏在了黑街的许多地方，如果我遭遇不测，那么后来者也会因此了解这里到底发生过什么。勇气……对，唯有勇气，唯有身为人类最宝贵的品质……才能制止疯狂。
啊求求你了万能的无上的英白拉多愿你从高天赐予我垂怜愿你的目光永远凝视你的信徒愿你将勇气和胜利带给信众愿你的光耀粉碎此地的一切黑暗愿正义携你的羽翼降临于尘世……","I saw what happened to those who disappeared. I can't stay here any longer. The air here reeks of madness. I'm scared... scared that if I stay here, I'll become one of them. Cruel, twisted, with a complete disregard for the law.

How long have I been here? There's no sense of day or night down in these sewers. A week? A month? Maybe by the time I make it out of here, Ragunna City will already be a burning ruin with only the criminals left, throwing an endless carnival of destruction and evil.

They will destroy me and the city. Not even the sea can douse the hellfire in their hearts. It'll rage through the ruins, and we'll all burn to nothing... 

Imperator protect me... Yes, that's right. There's still hope. They'll protect my body and soul... They will.

I have a duty now. As a student. A journalist. And a believer. I... I must leave here, tell everyone the truth, and stop Talos before she poisons us all with her evil.

...And yes, I understand. I might die in the process, or even worse... if they catch me... But I can't just watch and let it all unfold. Damn it, legs! Move! Now's not the time...

They're being called away by Talos... Now's my chance. Fewer eyes on me. It has to be Brandon... I knew it. He drew them away.

I've got a knife hidden. Today's the day I've been waiting for. I've hidden voice recordings all over the Black Alley. If something happens to me, those who come after will know what happened here. Courage... Yes, only courage, the most precious human quality... can put an end to this madness.

Oh, great Imperator, grant me mercy from the high heavens. May your gaze forever watch over your believers, and grace them with courage and victory. May your light disperse the darkness looming over this place. And may justice descend upon the mortal world through your wings...","Tôi đã thấy những người mất tích rốt cuộc gặp phải chuyện gì. Tôi không thể tiếp tục ở lại đây nữa. Không khí nơi này tràn ngập sự điên cuồng, tôi sợ... sau khi tôi ở lâu, sẽ trở nên giống như họ, tàn nhẫn, vặn vẹo, và coi thường pháp luật.
Tôi đã ở đây bao lâu rồi? Trong đường cống ngầm không có khái niệm ngày đêm, có lẽ một tuần? Có lẽ một tháng? Có lẽ đợi khi tôi rời khỏi đây, thành phố Ragunna đã trở thành một đống đổ nát rực cháy, và chỉ có tội phạm sống sót, họ sẽ tổ chức một đêm hội cuồng hoan không hồi kết về sự hủy diệt và tà ác?
...Họ sẽ hủy hoại tôi sẽ hủy hoại thành phố này ngay cả đại dương cũng không thể dập tắt ngọn lửa trong lòng họ nó sẽ cháy hừng hực trên đống đổ nát chúng ta đều sẽ bị thiêu rụi...
Imperator phù hộ tôi... đúng, không sai. Hy vọng vẫn còn, Người sẽ phù hộ thể xác và tâm hồn tôi... chắc chắn sẽ như vậy.
Bây giờ tôi phải thực hiện chức trách của mình, với danh nghĩa một sinh viên, một phóng viên, cũng như một tín đồ, tôi... tôi phải rời khỏi đây, nói cho tất cả mọi người biết sự thật, ngăn cản Talos trước khi ả dùng bạo hành tội ác đầu độc chúng ta.
...Đúng, tôi biết, tôi có thể sẽ chết, có thể sẽ thê thảm hơn... nếu họ bắt được tôi...
Nhưng tôi không thể không làm gì cả. Chết tiệt, cử động đi! Chân của tôi! Không thể vào lúc này...
Họ bị Talos gọi đi rồi... cơ hội tốt. Người nhìn chằm chằm tôi cũng ít đi rồi. Chắc chắn là Brandon, tôi biết ngay mà... anh ấy đã dụ những người đó đi.
Tôi còn giấu một con dao găm, tôi vẫn luôn chờ đợi ngày hôm nay... Tôi đã giấu nhật ký của mình ở nhiều nơi trong Khu Phố Đen, nếu tôi gặp bất trắc, thì người đến sau cũng sẽ nhờ đó mà biết được nơi này rốt cuộc đã xảy ra chuyện gì. Lòng dũng cảm... đúng, chỉ có lòng dũng cảm, chỉ có phẩm chất quý giá nhất của con người... mới có thể ngăn chặn sự điên cuồng.
A cầu xin Người Imperator vạn năng tối cao nguyện Người ban cho con lòng thương xót từ trên cao nguyện ánh mắt Người mãi mãi nhìn chăm chú tín đồ của Người nguyện Người mang lòng dũng cảm và chiến thắng đến cho tín chúng nguyện ánh hào quang của Người nghiền nát mọi bóng tối nơi đây nguyện chính nghĩa mang đôi cánh của Người giáng lâm xuống trần thế..."
lang_multi_text.db,MultiText,InfoDisplay_160000013_Title,【语音日志·三】,Audio Log 3,[Nhật Ký Ghi Âm 3]
lang_multi_text.db,MultiText,InfoDisplay_160000014_Text,"道路隐藏于赐福之中……众使者虽超凡但仍有缺陷。若要前行，须展示足以补全其内心之物。

<color=yellow>位于左侧的使者迷失方向，于泥淖无从脱身。</color>
<color=yellow>位于中央的使者饱受背叛，其内心因之封闭。</color>
<color=yellow>位于右侧的使者一事无成，对自我深感怀疑。</color>

于其面前展示汝之品质，令其重归完整。
（刻文下方画着三个做出不同动作的人形，下方分别刻着“忠诚”、“指引”和“认可”，也许这是某种提示。）","The path lies hidden within the blessings... The messengers, though extraordinary, are not without flaws. To proceed, one must present that which can heal their hearts.

<color=yellow>The messenger on the left has lost their way, unable to escape the mire.</color>
<color=yellow>The messenger in the center is scarred by betrayal, their heart sealed because of it.</color>
<color=yellow>The messenger on the right has achieved nothing, forever consumed by doubt.</color>

Present your qualities before them to restore their wholeness.

(Below the inscription are drawings of three human figures in different poses, labeled ""Loyalty,"" ""Guidance,"" and ""Recognition."" These could be clues to solving the puzzle.)","Con đường ẩn giấu trong sự ban phước... Các sứ giả tuy phi phàm nhưng vẫn có khiếm khuyết. Nếu muốn tiến lên, phải thể hiện thứ đủ để bù đắp trái tim họ.

<color=yellow>Sứ giả ở bên trái lạc mất phương hướng, không thể thoát khỏi vũng lầy.</color>
<color=yellow>Sứ giả ở giữa chịu đựng sự phản bội, trái tim vì thế mà khép kín.</color>
<color=yellow>Sứ giả ở bên phải không làm nên trò trống gì, cảm thấy nghi ngờ sâu sắc về bản thân.</color>

Trước mặt họ hãy thể hiện phẩm chất của ngươi, khiến họ trở lại trọn vẹn.
(Bên dưới văn bia vẽ ba hình người đang làm những động tác khác nhau, bên dưới lần lượt khắc ""Trung Thành"", ""Chỉ Dẫn"" và ""Công Nhận"", có lẽ đây là một gợi ý nào đó.)"
lang_multi_text.db,MultiText,InfoDisplay_160000014_Title,【古老的刻文】,Ancient Inscriptions,[Văn Khắc Cổ Xưa]
lang_multi_text.db,MultiText,InfoDisplay_161000001_Text,"（剑冢上的文字留有刻意被抹除的痕迹）

孩子们的呜咽在角鳄的吼叫声中无助颤抖。泰娅她说得没错，那怪物确实是朝着这里来的……真混蛋啊，它是注意到████了吗？
我们还有逃跑的能力，但那些孩子们不行——他们翻不过沟壑。等角鳄突破城墙，等待他们的结局不言而喻。
……我们虽然曾为了一时利益出卖过自己的良心，但早已跪地献出时间将其赎回。
██真是造化弄人啊……谁又能想到我们这些███几十年的老家伙们还有为保护七丘重新拿起武器的那一天呢？
老麦哲的腰已经比他握在手里的刀还要弯了，贝肯那家伙也是，陪他征战多年的长枪如今被当成了支撑的拐棍，走起路一瘸一拐的活像个浮灵偶……当然我自己也没好到哪里去……现在眼睛花了，不知道枪法的准度还能有做██时的几成……
想当年我们一个个可都是████……唉，岁月真是不饶人啊。
在出发前我们挑选了一个年纪稍大的孩子带在身边。万一，我是说万一……万一我们████也好争取些时间，他可以趁此跑回去通风报信，早点带着其余的孩子们逃跑。
██的声音愈发接近了。走吧，我亲爱的老对手们，是时候前往██战场了。
祝你，祝我，祝所有人行猎愉快。","(The inscription shows signs of being deliberately defaced.)
 
The little ones are crying. Their whimpers get swallowed up in the Kerasaur's roars. Thea was right… That damn beast's heading straight for us. Guess it figured out ████.

We can still run. We've got just enough strength left to make it. But the children? They can't even get past the trenches. Once the walls fall, there's no question what happens to them.

…We were scum once. Sold our souls for money. But we bought them back along the way. ██ is interesting. Who'd have thought it? Us old outlaws, ██ for decades, picking up weapons again to guard Septimont.

Myzel's back is more bent than the sword he's gripping. Beccan's lance—the same one that carried him through a dozen wars—is just a walking stick now. I'm no exception. My vision's blurry. Don't know if I can still hit the target dead on like I once did as a ██. We were all ████ once. Time really doesn't pull its punches.

Before we left, we picked one of the older kids to come with us. If we ████ there, he's gotta make it back. Raise the alarm. Buy the others a chance to get out.

The ██'s close now. Well then, my old rivals… it's time. Time to meet ██ on the field.

I wish you, me, and everyone happy hunting.","(Văn tự trên mộ kiếm có dấu vết bị cố ý xóa bỏ)

Tiếng khóc nức nở của lũ trẻ run rẩy bất lực trong tiếng gầm của Giác Ngạc. Thea nói đúng, con quái vật đó thực sự đang hướng về phía này... Khốn kiếp thật, nó đã chú ý đến ████ rồi sao?
Chúng tôi vẫn còn khả năng chạy trốn, nhưng bọn trẻ thì không-chúng không trèo qua được khe núi. Đợi Giác Ngạc phá vỡ tường thành, kết cục chờ đợi chúng không cần nói cũng biết.
...Chúng tôi tuy từng vì lợi ích nhất thời mà bán rẻ lương tâm của mình, nhưng đã sớm quỳ gối dâng hiến thời gian để chuộc lại nó.
██ đúng là trêu ngươi mà... ai mà ngờ được những lão già ███ mấy chục năm như chúng tôi lại có ngày cầm vũ khí lên lần nữa để bảo vệ Septimont chứ?
Lưng lão Myzel đã còng hơn cả thanh đao lão cầm trong tay, tên Beccan kia cũng vậy, cây thương dài cùng gã chinh chiến bao năm giờ bị dùng làm gậy chống, đi đường tập tễnh y hệt một con Rùa Đá... Tất nhiên bản thân tôi cũng chẳng khá hơn là bao... giờ mắt mờ rồi, không biết độ chuẩn xác của súng pháp còn được mấy phần so với khi làm ██...
Nhớ năm đó chúng tôi ai nấy đều là ████... Haizz, năm tháng đúng là không tha cho ai.
Trước khi xuất phát chúng tôi đã chọn một đứa trẻ lớn tuổi hơn một chút mang theo bên mình. Vạn nhất, ý tôi là vạn nhất... vạn nhất chúng tôi ████ cũng tranh thủ được chút thời gian, nó có thể nhân cơ hội chạy về báo tin, sớm đưa những đứa trẻ còn lại chạy trốn.
Tiếng của ██ ngày càng gần rồi. Đi thôi, những đối thủ cũ thân mến của tôi, đã đến lúc đi đến chiến trường ██ rồi.
Chúc ông, chúc tôi, chúc tất cả mọi người đi săn vui vẻ."
lang_multi_text.db,MultiText,InfoDisplay_161000001_Title,褪色剑冢,Tarnished Sword Tomb,Mộ Kiếm Phai Màu
