db_file,table_name,id,zh,en,vi
lang_multi_text.db,MultiText,ItemInfo_87401005_Name,抹茶雪糕,Matcha Ice Cream,Kem Matcha
lang_multi_text.db,MultiText,ItemInfo_87401006_AttributesDescription,抱着气泡饮料和漫画书，我可以在这坐上一整天。,"With a fizzy drink and a comic book, I can sit here all day.","Ôm đồ uống có ga và truyện tranh, tôi có thể ngồi ở đây cả ngày."
lang_multi_text.db,MultiText,ItemInfo_87401006_Name,气泡饮料,Fizzy Drink,Đồ Uống Có Ga
lang_multi_text.db,MultiText,ItemInfo_87401007_AttributesDescription,穗波知名旅游纪念品，美味的巧克力夹心饼干。,A famous souvenir from Honami. These chocolate-filled cookies are simply delicious.,"Quà lưu niệm du lịch nổi tiếng của Honami, bánh quy kẹp sô cô la ngon tuyệt."
lang_multi_text.db,MultiText,ItemInfo_87401007_Name,穗波恋人饼干,Honami Sweetheart Cookie,Bánh Quy Người Yêu Honami
lang_multi_text.db,MultiText,ItemInfo_87401011_Name,嘉贝莉娜贴纸·菱形·一,Galbrena Sticker - Rhombus I,Sticker Galbrena - Thoi - I
lang_multi_text.db,MultiText,ItemInfo_87401021_Name,嘉贝莉娜贴纸·六边形·一,Galbrena Sticker - Hexagon I,Sticker Galbrena - Lục Giác - I
lang_multi_text.db,MultiText,ItemInfo_87401031_Name,嘉贝莉娜贴纸·圆形·二,Galbrena Sticker - Circle II,Sticker Galbrena - Tròn - II
lang_multi_text.db,MultiText,ItemInfo_87401041_Name,嘉贝莉娜贴纸·菱形·二,Galbrena Sticker - Rhombus II,Sticker Galbrena - Thoi - II
lang_multi_text.db,MultiText,ItemInfo_87401051_Name,嘉贝莉娜贴纸·六边形·二,Galbrena Sticker - Hexagon II,Sticker Galbrena - Lục Giác - II
lang_multi_text.db,MultiText,ItemInfo_87401061_Name,嘉贝莉娜贴纸·圆形·三,Galbrena Sticker - Circle III,Sticker Galbrena - Tròn - III
lang_multi_text.db,MultiText,ItemInfo_87401071_Name,嘉贝莉娜贴纸·菱形·三,Galbrena Sticker - Rhombus III,Sticker Galbrena - Thoi - III
lang_multi_text.db,MultiText,ItemInfo_87401081_Name,嘉贝莉娜贴纸·六边形·三,Galbrena Sticker - Hexagon III,Sticker Galbrena - Lục Giác - III
lang_multi_text.db,MultiText,ItemInfo_87401101_Name,仇远贴纸·圆形·一,Qiuyuan Sticker - Circle I,Sticker Qiuyuan - Tròn - I
lang_multi_text.db,MultiText,ItemInfo_87401111_Name,仇远贴纸·菱形·一,Qiuyuan Sticker - Rhombus I,Sticker Qiuyuan - Thoi - I
lang_multi_text.db,MultiText,ItemInfo_87401121_Name,仇远贴纸·六边形·一,Qiuyuan Sticker - Hexagon I,Sticker Qiuyuan - Lục Giác - I
lang_multi_text.db,MultiText,ItemInfo_87401131_Name,仇远贴纸·圆形·二,Qiuyuan Sticker - Circle II,Sticker Qiuyuan - Tròn - II
lang_multi_text.db,MultiText,ItemInfo_87401141_Name,仇远贴纸·菱形·二,Qiuyuan Sticker - Rhombus II,Sticker Qiuyuan - Thoi - II
lang_multi_text.db,MultiText,ItemInfo_87401151_Name,仇远贴纸·六边形·二,Qiuyuan Sticker - Hexagon II,Sticker Qiuyuan - Lục Giác - II
lang_multi_text.db,MultiText,ItemInfo_87401161_Name,仇远贴纸·圆形·三,Qiuyuan Sticker - Circle III,Sticker Qiuyuan - Tròn - III
lang_multi_text.db,MultiText,ItemInfo_87401171_Name,仇远贴纸·菱形·三,Qiuyuan Sticker - Rhombus III,Sticker Qiuyuan - Thoi - III
lang_multi_text.db,MultiText,ItemInfo_87401181_Name,仇远贴纸·六边形·三,Qiuyuan Sticker - Hexagon III,Sticker Qiuyuan - Lục Giác - III
lang_multi_text.db,MultiText,ItemInfo_87401201_Name,千咲贴纸·圆形·一,Chisa Sticker - Circle I,Sticker Chisa - Tròn - I
lang_multi_text.db,MultiText,ItemInfo_87401211_Name,千咲贴纸·菱形·一,Chisa Sticker - Rhombus I,Sticker Chisa - Thoi - I
lang_multi_text.db,MultiText,ItemInfo_87401221_Name,千咲贴纸·六边形·一,Chisa Sticker - Hexagon I,Sticker Chisa - Lục Giác - I
lang_multi_text.db,MultiText,ItemInfo_87401231_Name,千咲贴纸·圆形·二,Chisa Sticker - Circle II,Sticker Chisa - Tròn - II
lang_multi_text.db,MultiText,ItemInfo_87401241_Name,千咲贴纸·菱形·二,Chisa Sticker - Rhombus II,Sticker Chisa - Thoi - II
lang_multi_text.db,MultiText,ItemInfo_87401251_Name,千咲贴纸·六边形·二,Chisa Sticker - Hexagon II,Sticker Chisa - Lục Giác - II
lang_multi_text.db,MultiText,ItemInfo_87401261_Name,千咲贴纸·圆形·三,Chisa Sticker - Circle III,Sticker Chisa - Tròn - III
lang_multi_text.db,MultiText,ItemInfo_87401271_Name,千咲贴纸·菱形·三,Chisa Sticker - Rhombus III,Sticker Chisa - Thoi - III
lang_multi_text.db,MultiText,ItemInfo_87401281_Name,千咲贴纸·六边形·三,Chisa Sticker - Hexagon III,Sticker Chisa - Lục Giác - III
lang_multi_text.db,MultiText,ItemInfo_87402001_AttributesDescription,橘子味的波子汽水，里面的弹珠是橙色的。,Citrus-infused sparkling water. The bubble beads inside are orange.,"Nước có ga vị quýt, viên bi bên trong có màu cam."
lang_multi_text.db,MultiText,ItemInfo_87402001_Name,波子汽水·橘子,Namipon's Sparkling Water - Citrus,Nước Có Ga Namipon - Quýt
lang_multi_text.db,MultiText,ItemInfo_87402002_AttributesDescription,白巧克力的帕奇饼干，售价比经典款更高。,"White chocolate pocket cookies, priced even higher than the classic ones.","Bánh quy Paji sô cô la trắng, giá bán cao hơn loại cổ điển."
lang_multi_text.db,MultiText,ItemInfo_87402002_Name,帕吉饼干·白巧克力,Pocket Cookie - White Chocolate,Bánh Quy Paji - Sô Cô La Trắng
lang_multi_text.db,MultiText,ItemInfo_87402003_AttributesDescription,夹心款的猫爪软糖，据说某位知名影星很爱吃，因此非常抢手。,"A famous movie star is said to love Stuffed Cat Paw Gummy Candy, which makes these very much in demand.","Kẹo dẻo hình chân mèo có nhân, nghe nói một ngôi sao điện ảnh nổi tiếng rất thích ăn, nên cực kỳ đắt hàng."
lang_multi_text.db,MultiText,ItemInfo_87402003_Name,猫爪夹心软糖,Stuffed Cat Paw Gummy Candy,Kẹo Dẻo Chân Mèo Có Nhân
lang_multi_text.db,MultiText,ItemInfo_87402004_AttributesDescription,有一点刺激的味道，小孩子最好不要尝试。,You can really feel the heat. Not recommended for small children.,"Vị hơi kích thích, trẻ con tốt nhất đừng nên thử."
lang_multi_text.db,MultiText,ItemInfo_87402004_Name,辣味袋装薯片,Spicy Crisps,Bim Bim Cay
lang_multi_text.db,MultiText,ItemInfo_87402005_AttributesDescription,整盒装的抹茶雪糕，可以当做纪念品送给朋友。,An entire box of matcha ice cream. Can be gifted to friends as a souvenir.,"Kem matcha nguyên hộp, có thể dùng làm quà lưu niệm tặng bạn bè."
lang_multi_text.db,MultiText,ItemInfo_87402005_Name,抹茶雪糕礼盒,Matcha Ice Cream Gift Box,Hộp Quà Kem Matcha
lang_multi_text.db,MultiText,ItemInfo_87402006_AttributesDescription,没说就是零糖？但为什么比有糖款的卖的更贵？,"Hey, if the packaging doesn't specify, then it must be sugarless. But why does it cost more than the ""with added sugar"" version?",Không nói gì tức là không đường sao? Nhưng tại sao lại bán đắt hơn loại có đường?
lang_multi_text.db,MultiText,ItemInfo_87402006_Name,无糖气泡饮料,Sugar Free Fizzy Drink,Nước Có Ga Không Đường
lang_multi_text.db,MultiText,ItemInfo_87402007_AttributesDescription,据说在虹音塔下将这种饼干送给对方可以传达心意。,They say gifting this cookie to someone under Neon Tower is a display of affection.,Nghe nói tặng bánh này cho đối phương dưới Tháp Neon có thể truyền đạt tình cảm.
lang_multi_text.db,MultiText,ItemInfo_87402007_Name,虹音恋人饼干,Neon Sweetheart Cookie,Bánh Quy Tình Nhân Neon
lang_multi_text.db,MultiText,ItemInfo_87402008_AttributesDescription,波仔样式的钥匙扣。在穗波很常见。,A keychain in the likeness of Namipon. A common sight in Honami.,Móc khóa có hình Bánh Bao. Rất phổ biến ở Honami.
lang_multi_text.db,MultiText,ItemInfo_87402008_Name,波仔钥匙扣,Namipon Keychain,Móc Khóa Bánh Bao
lang_multi_text.db,MultiText,ItemInfo_87402009_AttributesDescription,波仔样式的水杯，造型可爱，广受好评。,A cup in the likeness of Namipon. Well-received and designed for cuteness.,"Cốc nước có hình Bánh Bao, kiểu dáng dễ thương, được đánh giá cao."
lang_multi_text.db,MultiText,ItemInfo_87402009_Name,波仔水杯,Namipon Cup,Cốc Nước Bánh Bao
lang_multi_text.db,MultiText,ItemInfo_87402010_AttributesDescription,波仔系列的收藏票劵，在爱好者中广为流传。,A Namipon series collectible card. Widely traded among enthusiasts.,"Thẻ sưu tầm thuộc series Bánh Bao, lưu truyền rộng rãi trong giới hâm mộ."
lang_multi_text.db,MultiText,ItemInfo_87402010_Name,波仔镭射卡,Namipon Refractor Card,Thẻ Laser Bánh Bao
lang_multi_text.db,MultiText,ItemInfo_87402011_AttributesDescription,波仔主题的扭蛋，听说这个系列中有隐藏款。,A Namipon themed capsule. They say there are secret editions in this series.,"Trứng đồ chơi chủ đề Bánh Bao, nghe nói series này có mẫu ẩn."
lang_multi_text.db,MultiText,ItemInfo_87402011_Name,限定扭蛋,Limited-Run Capsule,Trứng Đồ Chơi Giới Hạn
lang_multi_text.db,MultiText,ItemInfo_87402012_AttributesDescription,波仔形象的抱枕，非常柔软。,A Namipon shaped pillow. Very cuddly.,"Gối ôm hình Bánh Bao, vô cùng mềm mại."
lang_multi_text.db,MultiText,ItemInfo_87402012_Name,圆滚滚抱枕,Stuffed Pillow,Gối Ôm Tròn Vo
lang_multi_text.db,MultiText,ItemInfo_87402013_AttributesDescription,波仔形象的模型，憨厚的形象是穗波的象征。,"A figurine of Namipon, as endearing as everything else in Honami.","Mô hình Bánh Bao, vẻ ngoài ngây ngô là biểu tượng của Honami."
lang_multi_text.db,MultiText,ItemInfo_87402013_Name,波仔手办,Namipon Figurine,Mô Hình Bánh Bao
lang_multi_text.db,MultiText,ItemInfo_87402014_AttributesDescription,带有各种波仔元素的周边的包。很有价值。,Has loads of Namipon merch stuck to it. Very valuable.,Túi xách gắn đủ loại phụ kiện Bánh Bao. Rất có giá trị.
lang_multi_text.db,MultiText,ItemInfo_87402014_Name,完好痛包,Mint Condition Itabag,Túi Itabag Hoàn Hảo
lang_multi_text.db,MultiText,ItemInfo_87403001_AttributesDescription,限定款的波仔钥匙扣，听说有人高价回收。,They say the Limited-Run Namipon Keychain has high resale value.,"Móc khóa Bánh Bao bản giới hạn, nghe nói có người thu mua giá cao."
lang_multi_text.db,MultiText,ItemInfo_87403001_Name,限定款波仔钥匙扣,Limited-Run Namipon Keychain,Móc Khóa Bánh Bao Giới Hạn
lang_multi_text.db,MultiText,ItemInfo_87403002_AttributesDescription,和某人气企划进行联名推出的波仔水杯。水杯上的波仔带着新潮装饰。,"A cup showing Namipon in fashionable threads, brought to you in collaboration with a well-known project.",Cốc nước Bánh Bao hợp tác với dự án nổi tiếng nào đó. Bánh Bao trên cốc có trang phục thời thượng.
lang_multi_text.db,MultiText,ItemInfo_87403002_Name,联名款波仔水杯,Namipon Collab Cup,Cốc Nước Bánh Bao Hợp Tác
lang_multi_text.db,MultiText,ItemInfo_87403003_AttributesDescription,印有波仔亲笔签名的镭射卡。等下，谁签的？,"A refractor card autographed by Namipon. Wait a sec, who signed this?","Thẻ laser có chữ ký của Bánh Bao. Khoan đã, ai ký vậy?"
lang_multi_text.db,MultiText,ItemInfo_87403003_Name,波仔签名镭射卡,Namipon Signed Refractor Card,Thẻ Laser Bánh Bao Ký Tên
lang_multi_text.db,MultiText,ItemInfo_87403004_AttributesDescription,隐藏款的波仔扭蛋，波仔以全新的姿势起舞。,A secret edition capsule that holds a Namipon in an all-new dance pose.,"Trứng đồ chơi Bánh Bao mẫu ẩn, Bánh Bao đang nhảy múa với tư thế mới lạ."
lang_multi_text.db,MultiText,ItemInfo_87403004_Name,隐藏款扭蛋,Secret Edition Capsule,Trứng Đồ Chơi Ẩn
lang_multi_text.db,MultiText,ItemInfo_87403005_AttributesDescription,豪华加料的波仔抱枕，比普通版本更加柔软充实。,An overstuffed Namipon pillow. Much comfier and fluffier than a normal pillow.,"Gối ôm Bánh Bao bản sang trọng nhồi bông, mềm mại và đầy đặn hơn bản thường."
lang_multi_text.db,MultiText,ItemInfo_87403005_Name,豪华圆滚滚抱枕,Deluxe Stuffed Pillow,Gối Ôm Tròn Vo Sang Trọng
lang_multi_text.db,MultiText,ItemInfo_87403006_AttributesDescription,手工制作的波仔模型，每个细节都栩栩如生。,A very realistic handmade figurine of Namipon.,"Mô hình Bánh Bao làm thủ công, từng chi tiết đều sống động như thật."
lang_multi_text.db,MultiText,ItemInfo_87403006_Name,手工波仔手办,Handmade Namipon Figurine,Mô Hình Bánh Bao Thủ Công
lang_multi_text.db,MultiText,ItemInfo_87403007_AttributesDescription,官方出品的波仔周边包……等下，谁是官方？,"Official handbag merch.... Wait, define official....","Túi phụ kiện Bánh Bao hàng chính hãng... Khoan đã, ai là chính hãng?"
lang_multi_text.db,MultiText,ItemInfo_87403007_Name,官方波仔痛包,Official Namipon Itabag,Túi Itabag Bánh Bao Chính Hãng
lang_multi_text.db,MultiText,ItemInfo_87403008_AttributesDescription,过去风靡一时的游戏卡带，在爱好者中有很高人气。,A once-popular game cartridge that enthusiasts often praise.,"Băng game thịnh hành một thời, rất được người hâm mộ yêu thích."
lang_multi_text.db,MultiText,ItemInfo_87403008_Name,老式游戏卡带,Vintage Game Cartridge,Băng Game Kiểu Cũ
lang_multi_text.db,MultiText,ItemInfo_87403009_AttributesDescription,搭载了抚养波仔功能的游戏机。难道波仔最初真的是电子宠物？,A game console for raising digital Namipons. Could it be that Namipons started out as e-pets?,Máy chơi game có chức năng nuôi Bánh Bao. Lẽ nào ban đầu Bánh Bao thực sự là thú cưng điện tử?
lang_multi_text.db,MultiText,ItemInfo_87403009_Name,波仔宠物机,Namipongotchi,Máy Thú Cưng Bánh Bao
lang_multi_text.db,MultiText,ItemInfo_87403010_AttributesDescription,过去很有人气的翻盖终端，许多影视作品中都会出现。,A once fashionable flip terminal that still shows up in movies.,"Thiết bị gập từng rất nổi tiếng, thường xuất hiện trong nhiều bộ phim."
lang_multi_text.db,MultiText,ItemInfo_87403010_Name,翻盖终端,Flip Terminal,Thiết Bị Gập
lang_multi_text.db,MultiText,ItemInfo_87403011_AttributesDescription,可以随身携带的小型相机，拍出来的照片有种独特质感。,A small camera that is convenient to carry around. Photos captured by it have a unique vibe.,"Máy ảnh nhỏ gọn có thể mang theo bên mình, ảnh chụp ra có chất cảm độc đáo."
lang_multi_text.db,MultiText,ItemInfo_87403011_Name,随身相机,Compact Camera,Máy Ảnh Bỏ Túi
lang_multi_text.db,MultiText,ItemInfo_87403012_AttributesDescription,古老的便携式音乐播放器，在爱好者中颇具人气。,A vintage portable music player that is quite popular among enthusiasts.,"Máy nghe nhạc cầm tay cổ điển, khá nổi tiếng trong giới hâm mộ."
lang_multi_text.db,MultiText,ItemInfo_87403012_Name,老式随身听,Vintage Audio Player,Máy Walkman Cổ Điển
lang_multi_text.db,MultiText,ItemInfo_87403013_AttributesDescription,老式录音机，影视作品中常用来录下一些机密。,"An old-school audio recorder of the kind that often holds secrets, as seen in the movies.","Máy ghi âm kiểu cũ, trong phim thường dùng để ghi lại những bí mật cơ mật."
lang_multi_text.db,MultiText,ItemInfo_87403013_Name,旧录音机,Old Voice Recorder,Máy Ghi Âm Cũ
lang_multi_text.db,MultiText,ItemInfo_87403014_AttributesDescription,过去风靡一时的游戏机，在爱好者中具有很高人气。,A once-popular game console that enthusiasts often praise.,"Máy chơi game thịnh hành một thời, rất được người hâm mộ yêu thích."
lang_multi_text.db,MultiText,ItemInfo_87403014_Name,老式游戏机,Vintage Gaming Console,Máy Chơi Game Kiểu Cũ
lang_multi_text.db,MultiText,ItemInfo_87404001_AttributesDescription,传说中那款开山之作的初版卡带，爱好者将其视若圭臬。,The legendary first-ever game cartridge for the first-ever video game console. Revered by enthusiasts as a sacred relic.,"Băng game bản đầu tiên của tác phẩm mở đầu huyền thoại, được người hâm mộ coi như bảo vật."
lang_multi_text.db,MultiText,ItemInfo_87404001_Name,初版游戏卡带,First-Ever Game Cartridge,Băng Game Bản Đầu
lang_multi_text.db,MultiText,ItemInfo_87404002_AttributesDescription,听说对波仔使用这个可以让它改变形态……真的假的。,People say this gizmo can change Namipon's form.... Like seriously?,Nghe nói dùng cái này lên Bánh Bao có thể khiến nó thay đổi hình dạng... Thật hay giả vậy.
lang_multi_text.db,MultiText,ItemInfo_87404002_Name,波仔进化器,Namipon Evolutron,Máy Tiến Hóa Bánh Bao
lang_multi_text.db,MultiText,ItemInfo_87404003_AttributesDescription,广告中经常出现的奢华翻盖终端。性价比不高。,"A flip terminal that's advertised everywhere, though not really worth the credits.",Thiết bị gập xa xỉ thường xuất hiện trong quảng cáo. Hiệu năng trên giá thành không cao.
lang_multi_text.db,MultiText,ItemInfo_87404003_Name,”4484“翻盖终端,"""4484"" Flip Terminal","Thiết Bị Gập ""4484"""
lang_multi_text.db,MultiText,ItemInfo_87404004_AttributesDescription,口碑很棒的相机系列，有着令人印象深刻的广告词。,A camera from a well-known brand. They had a catchy slogan too.,"Dòng máy ảnh được đánh giá rất cao, có câu slogan vô cùng ấn tượng."
lang_multi_text.db,MultiText,ItemInfo_87404004_Name,“感动仍在”相机,"""DeLighting"" Camera","Máy Ảnh ""Cảm Xúc Vẹn Nguyên"""
lang_multi_text.db,MultiText,ItemInfo_87404005_AttributesDescription,某知名作品中主角的同款随身音乐播放器。,The portable music player model used by the protagonist of a well-known work.,Mẫu máy nghe nhạc giống hệt cái mà nhân vật chính trong tác phẩm nổi tiếng nào đó sử dụng.
lang_multi_text.db,MultiText,ItemInfo_87404005_Name,”走路人“随身听,"""Walker"" Audio Player","Máy Walkman ""Người Đi Bộ"""
lang_multi_text.db,MultiText,ItemInfo_87404006_AttributesDescription,容量超大的录音机，可以完整地录下一场会议中的商业机密。,A high-capacity voice recorder that's able to record a full business meeting and any trade secrets discussed.,"Máy ghi âm dung lượng siêu lớn, có thể ghi lại trọn vẹn bí mật kinh doanh trong một cuộc họp."
lang_multi_text.db,MultiText,ItemInfo_87404006_Name,商务录音机,Office Voice Recorder,Máy Ghi Âm Doanh Nhân
lang_multi_text.db,MultiText,ItemInfo_87404007_AttributesDescription,传说中那款开山之作的初版游戏机，爱好者将其视若圭臬。,The legendary game console that ushered in the dawn of a new era in video gaming. Revered by enthusiasts as a sacred relic.,"Máy chơi game bản đầu tiên của tác phẩm mở đầu huyền thoại, được người hâm mộ coi như bảo vật."
