db_file,table_name,id,zh,en,vi
lang_multi_text.db,MultiText,PrefabTextItem_3556305438_Text,开始挑战,Begin Challenge,Bắt đầu thử thách
lang_multi_text.db,MultiText,PrefabTextItem_3557287049_Text,存在异常，如有疑问请联系官方客服,Please contact our Customer Service for assistance,Ngọn lửa cứ bùng cháy mãi...
lang_multi_text.db,MultiText,PrefabTextItem_3557734500_Text,更换骑手,Switch Biker,Đổi tay lái
lang_multi_text.db,MultiText,PrefabTextItem_3559009686_Text,暂停,Pause,Tạm dừng
lang_multi_text.db,MultiText,PrefabTextItem_3560027366_Text,领取,Claim,Nhận
lang_multi_text.db,MultiText,PrefabTextItem_3560030871_Text,加载中,Loading,Đang tải
lang_multi_text.db,MultiText,PrefabTextItem_3560665557_Text,前往,Proceed,Đi đến
lang_multi_text.db,MultiText,PrefabTextItem_3561146458_Text,需推进「开辟测界之路」任务，推进深空测界台重建工程。,"Proceed with the quest ""Operation: Frontier Renewal"" to rebuild the Spacetrek Observatory.","Cần tiến hành nhiệm vụ ""Khai Phá Con Đường Trắc Giới"" để thúc đẩy công trình tái thiết Đài Trắc Giới Thâm Không."
lang_multi_text.db,MultiText,PrefabTextItem_3561326998_Text,限时奖励,Limited-Time Rewards,Phần thưởng giới hạn
lang_multi_text.db,MultiText,PrefabTextItem_3561659342_Text,每日邮币获取,Obtain Lollo Stamp,Nhận tem Lollo hàng ngày
lang_multi_text.db,MultiText,PrefabTextItem_3562185494_Text,确认选择,Confirm,Xác nhận lựa chọn
lang_multi_text.db,MultiText,PrefabTextItem_3564223953_Text,观影清单,Watchlist,Danh sách phim
lang_multi_text.db,MultiText,PrefabTextItem_3564230211_Text,升级预览,Upgrade Preview,Xem trước nâng cấp
lang_multi_text.db,MultiText,PrefabTextItem_3564317961_Text,存在异常，如有疑问请联系官方客服,Please contact our Customer Service for assistance,"Đã xảy ra lỗi, nếu có thắc mắc vui lòng liên hệ bộ phận hỗ trợ"
lang_multi_text.db,MultiText,PrefabTextItem_3566233435_Text,潮蚀模拟,Tidal Defense Simulator,Mô phỏng Triều Thực
lang_multi_text.db,MultiText,PrefabTextItem_3566396981_Text,共鸣者培养,Resonator Upgrade,Bồi dưỡng Cộng Hưởng Giả
lang_multi_text.db,MultiText,PrefabTextItem_3567273637_Text,列车长咖啡厅外,Outside Shashou Cafe,Bên ngoài quán cà phê Shashou
lang_multi_text.db,MultiText,PrefabTextItem_3568212840_Text,存在异常，如有疑问请联系官方客服,Please contact our Customer Service for assistance,"Đã xảy ra lỗi, nếu có thắc mắc vui lòng liên hệ bộ phận hỗ trợ"
lang_multi_text.db,MultiText,PrefabTextItem_3570354304_Text,16,16,16
lang_multi_text.db,MultiText,PrefabTextItem_357036681_Text,完成赛段,Stages Completed,Chặng đã hoàn thành
lang_multi_text.db,MultiText,PrefabTextItem_357045385_Text,可领取,Claimable,Có thể nhận
lang_multi_text.db,MultiText,PrefabTextItem_3570788314_Text,拼凑的梦,Dream Shards,Giấc mơ chắp vá
lang_multi_text.db,MultiText,PrefabTextItem_3570850621_Text,探索进度,Exploration Progress,Tiến độ khám phá
lang_multi_text.db,MultiText,PrefabTextItem_3575142429_Text,存在异常，如有疑问请联系官方客服,Please contact our Customer Service for assistance,"Đã xảy ra lỗi, nếu có thắc mắc vui lòng liên hệ bộ phận hỗ trợ"
lang_multi_text.db,MultiText,PrefabTextItem_3575773474_Text,购买,Purchase,Mua
lang_multi_text.db,MultiText,PrefabTextItem_357763038_Text,存在异常，如有疑问请联系官方客服,Please contact our Customer Service for assistance,"Đã xảy ra lỗi, nếu có thắc mắc vui lòng liên hệ bộ phận hỗ trợ"
lang_multi_text.db,MultiText,PrefabTextItem_3578170098_Text,进入游戏,Start,Vào game
lang_multi_text.db,MultiText,PrefabTextItem_3578660337_Text,选择徽记,Select Sigil,Chọn huy hiệu
lang_multi_text.db,MultiText,PrefabTextItem_3579502769_Text,生命力,HP,Sức sống
lang_multi_text.db,MultiText,PrefabTextItem_3580052860_Text,大量,Extra,Nhiều
lang_multi_text.db,MultiText,PrefabTextItem_358065991_Text,当前拥有,Owned,Đang sở hữu
lang_multi_text.db,MultiText,PrefabTextItem_3581428845_Text,角色总星数,Total Resonator Stars,Tổng sao nhân vật
lang_multi_text.db,MultiText,PrefabTextItem_358161153_Text,已解锁摊位,Stall Unlocked,Gian hàng đã mở
lang_multi_text.db,MultiText,PrefabTextItem_3581869243_Text,作战总览,Battle Overview,Tổng quan chiến đấu
lang_multi_text.db,MultiText,PrefabTextItem_3582621457_Text,还原,Reset,Hoàn tác
lang_multi_text.db,MultiText,PrefabTextItem_3583260893_Text,等待其他玩家确认,Waiting for other players to confirm,Đang chờ người chơi khác xác nhận
lang_multi_text.db,MultiText,PrefabTextItem_3584470112_Text,选择信物,Select Token,Chọn tín vật
lang_multi_text.db,MultiText,PrefabTextItem_3585581324_Text,领域详情,Sonoro Sphere Details,Chi tiết lĩnh vực
lang_multi_text.db,MultiText,PrefabTextItem_3585742143_Text,2阶,Rank 2,Cấp 2
lang_multi_text.db,MultiText,PrefabTextItem_3586284251_Text,赛道名称,Track Name,Tên đường đua
lang_multi_text.db,MultiText,PrefabTextItem_3586990539_Text,"累计获得<texture=/Game/Aki/UI/UIResources/UiActivity/Image/Activity31/CumulativeRecharge/Common/T_TempScoreIcon.T_TempScoreIcon,0.5/>980
即可从<color=#ffd12f>守岸人、椿、今汐</color>中任选其一获得。","Obtain <texture=/Game/Aki/UI/UIResources/UiActivity/Image/Activity31/CumulativeRecharge/Common/T_TempScoreIcon.T_TempScoreIcon,0.5/> x980 in total
to select 1 Resonator from <color=#ffd12f>Shorekeeper, Camellya, Jinhsi</color>.","Tích lũy đạt <texture=/Game/Aki/UI/UIResources/UiActivity/Image/Activity31/CumulativeRecharge/Common/T_TempScoreIcon.T_TempScoreIcon,0.5/>980
để chọn một trong các Cộng Hưởng Giả: <color=#ffd12f>Shorekeeper, Camellya, Kim Tịch</color>."
lang_multi_text.db,MultiText,PrefabTextItem_3587103314_Text,已完成,Completed,Đã hoàn thành
lang_multi_text.db,MultiText,PrefabTextItem_3587706095_Text,前往,Go,Đi đến
lang_multi_text.db,MultiText,PrefabTextItem_3587878527_Text,奖励选择,Reward Selection,Chọn phần thưởng
lang_multi_text.db,MultiText,PrefabTextItem_3588789454_Text,存在异常，如有疑问请联系官方客服,Please contact our Customer Service for assistance,"Có lỗi xảy ra, vui lòng liên hệ bộ phận hỗ trợ nếu cần trợ giúp"
lang_multi_text.db,MultiText,PrefabTextItem_3589122930_Text,上期回顾,Last Record,Nhìn lại kỳ trước
lang_multi_text.db,MultiText,PrefabTextItem_3589807864_Text,存在异常，如有疑问请联系官方客服,Please contact our Customer Service for assistance,"Có lỗi xảy ra, vui lòng liên hệ bộ phận hỗ trợ nếu cần trợ giúp"
lang_multi_text.db,MultiText,PrefabTextItem_3590179073_Text,一船欢歌,Chanty Bounty,Khúc Hoan Ca Trên Thuyền
lang_multi_text.db,MultiText,PrefabTextItem_3590341932_Text,选择服务器,Select a server,Chọn máy chủ
lang_multi_text.db,MultiText,PrefabTextItem_3591032505_Text,已领取,Claimed,Đã nhận
lang_multi_text.db,MultiText,PrefabTextItem_3592060841_Text,已完成,Completed,Đã hoàn thành
lang_multi_text.db,MultiText,PrefabTextItem_3593828797_Text,装置强化,Enhance Machines,Nâng cấp thiết bị
lang_multi_text.db,MultiText,PrefabTextItem_3594050053_Text,定格·光影瞬息,Freeze Frame: Action Highlights,Khoảnh Khắc: Ánh Sáng Chớp Nhoáng
lang_multi_text.db,MultiText,PrefabTextItem_3597078320_Text,存在异常，如有疑问请联系官方客服,Please contact our Customer Service for assistance,"Đã xảy ra lỗi, nếu có thắc mắc vui lòng liên hệ bộ phận hỗ trợ."
lang_multi_text.db,MultiText,PrefabTextItem_3597379438_Text,选择一个共鸣者,Select a Resonator,Chọn một Cộng Hưởng Giả
lang_multi_text.db,MultiText,PrefabTextItem_359755017_Text,前往解锁,Unlock,Đi mở khóa
lang_multi_text.db,MultiText,PrefabTextItem_3598506997_Text,累计击杀数据,Kill Stats,Tổng số lần hạ gục
lang_multi_text.db,MultiText,PrefabTextItem_359865884_Text,确认,Confirm,Xác nhận
lang_multi_text.db,MultiText,PrefabTextItem_3598942260_Text,音效音量,Sound Effects Volume,Âm lượng hiệu ứng
lang_multi_text.db,MultiText,PrefabTextItem_3599293742_Text,奇点扩张积分,Singularity Expansion Points,Điểm Mở Rộng Kỳ Điểm
lang_multi_text.db,MultiText,PrefabTextItem_3601020506_Text,待发送,Send,Chờ gửi
lang_multi_text.db,MultiText,PrefabTextItem_3601672931_Text,潮汐留影,Tidal Memories,Ký Ức Thủy Triều
lang_multi_text.db,MultiText,PrefabTextItem_3602551079_Text,存在异常，如有疑问请联系官方客服,Please contact our Customer Service for assistance,"Đã xảy ra lỗi, nếu có thắc mắc vui lòng liên hệ bộ phận hỗ trợ."
lang_multi_text.db,MultiText,PrefabTextItem_360294017_Text,存在异常，如有疑问请联系官方客服,Please contact our Customer Service for assistance,"Đã xảy ra lỗi, nếu có thắc mắc vui lòng liên hệ bộ phận hỗ trợ."
lang_multi_text.db,MultiText,PrefabTextItem_3603459645_Text,偶遇团子后可激活赛程特性,Meet a Cube to activate Cube Bonus,Gặp Cube để kích hoạt đặc tính đường đua
lang_multi_text.db,MultiText,PrefabTextItem_360560965_Text,奖励,Rewards,Phần thưởng
lang_multi_text.db,MultiText,PrefabTextItem_3605981371_Text,99,99,99
lang_multi_text.db,MultiText,PrefabTextItem_3606959143_Text,失序梦途,Somnium Labyrinth,Somnium Labyrinth
lang_multi_text.db,MultiText,PrefabTextItem_3611988646_Text,高风险,High Risk,Rủi ro cao
lang_multi_text.db,MultiText,PrefabTextItem_3612909200_Text,解锁新异频·残象,New Outlier: Tacet Discord unlocked,Mở khóa Dị Tần - Tàn Tượng mới
lang_multi_text.db,MultiText,PrefabTextItem_3614529489_Text,"若当前范围内，<color=Highlight>没有</color>可以交互/拾取的目标，那么【交互/拾取】的键位可以临时用于触发【探索工具】
另外，原本【探索工具】的键位不受此开关影响，可继续使用","If <color=Highlight>no object is available</color> to interact with or pick up within the range, the Pick Up/Interact input may trigger the Use Utility action. Enabling this feature will not affect the original input mapped to Use Utility.","Nếu trong phạm vi hiện tại <color=Highlight>không có</color> mục tiêu nào để tương tác/nhặt, thì phím [Tương tác/Nhặt] có thể tạm dùng để kích hoạt [Công cụ khám phá].
Ngoài ra, phím gốc của [Công cụ khám phá] không bị ảnh hưởng bởi tùy chọn này và vẫn có thể sử dụng bình thường."
lang_multi_text.db,MultiText,PrefabTextItem_3614917548_Text,延奏技能详情,Outro Skill Overview,Chi tiết kỹ năng Hiệp Tấu
lang_multi_text.db,MultiText,PrefabTextItem_3615166645_Text,此按键设置仅在当前玩法中生效,These settings only apply to this event,Cài đặt phím này chỉ có hiệu lực trong chế độ chơi hiện tại
lang_multi_text.db,MultiText,PrefabTextItem_3615931963_Text,商城,Shop,Cửa hàng
lang_multi_text.db,MultiText,PrefabTextItem_3615992592_Text,Del.,Del.,Del.
lang_multi_text.db,MultiText,PrefabTextItem_3616043789_Text,比赛结束,Challenge Complete,Trận đấu kết thúc
lang_multi_text.db,MultiText,PrefabTextItem_3616053872_Text,已开启,Unlocked,Đã mở khóa
lang_multi_text.db,MultiText,PrefabTextItem_3618081190_Text,存在异常，如有疑问请联系官方客服,Please contact our Customer Service for assistance,"Đã xảy ra lỗi, nếu có thắc mắc vui lòng liên hệ bộ phận hỗ trợ."
lang_multi_text.db,MultiText,PrefabTextItem_3618496538_Text,共鸣时间,Resonance Time,Thời gian Cộng Hưởng
lang_multi_text.db,MultiText,PrefabTextItem_3620315780_Text,存在异常，如有疑问请联系官方客服,Please contact our Customer Service for assistance,"Đã xảy ra lỗi, nếu có thắc mắc vui lòng liên hệ bộ phận hỗ trợ."
lang_multi_text.db,MultiText,PrefabTextItem_3621088413_Text,请完成当前阶段目标,Hit the revenue target within the duration to claim rewards.,Hãy hoàn thành mục tiêu giai đoạn hiện tại
lang_multi_text.db,MultiText,PrefabTextItem_3623648182_Text,未获得该角色,You do not own the Resonator,Chưa sở hữu nhân vật này
lang_multi_text.db,MultiText,PrefabTextItem_3623726109_Text,每日04:00刷新,Refresh daily at 4:00 AM,Làm mới hàng ngày lúc 04:00
lang_multi_text.db,MultiText,PrefabTextItem_3625636688_Text,点击任意位置关闭,"{Cus:Ipt,Touch=Tap anywhere PC=Click anywhere Gamepad=Press any button} to close",Nhấn vào bất kỳ đâu để đóng
lang_multi_text.db,MultiText,PrefabTextItem_3626612692_Text,矩阵叠兵·先行版,Doubled Pawns Matrix: Pilot,Ma Trận Điệp Binh - Phiên Bản Tiên Phong
lang_multi_text.db,MultiText,PrefabTextItem_3629528128_Text,点击空白处关闭,Tap the blank area to close,Nhấn vào vùng trống để đóng
lang_multi_text.db,MultiText,PrefabTextItem_363015398_Text,坠入深梦,Dive into Dreams,Chìm vào giấc mơ sâu
lang_multi_text.db,MultiText,PrefabTextItem_3630188284_Text,发布,Publish,Đăng
lang_multi_text.db,MultiText,PrefabTextItem_3630621625_Text,完成上一阶段内容解锁,Complete the previous stage to unlock,Hoàn thành giai đoạn trước để mở khóa
lang_multi_text.db,MultiText,PrefabTextItem_3631664648_Text,存在异常，如有疑问请联系官方客服,Please contact our Customer Service for assistance,"Đã xảy ra lỗi, nếu có thắc mắc vui lòng liên hệ bộ phận hỗ trợ"
lang_multi_text.db,MultiText,PrefabTextItem_3631727527_Text,确认,Confirm,Xác nhận
lang_multi_text.db,MultiText,PrefabTextItem_3632367936_Text,存在异常，如有疑问请联系官方客服,Please contact our Customer Service for assistance,"Đã xảy ra lỗi, nếu có thắc mắc vui lòng liên hệ bộ phận hỗ trợ"
lang_multi_text.db,MultiText,PrefabTextItem_3632575980_Text,团团养成,Cube Upgrade,Nuôi dưỡng Cube
lang_multi_text.db,MultiText,PrefabTextItem_3633647470_Text,没能收集到足够的侦测数据样本……,Failed to collect sufficient Surveillance Datasets...,Không thu thập đủ mẫu dữ liệu thám trắc...
lang_multi_text.db,MultiText,PrefabTextItem_3634405253_Text,新成员加入队伍,New Member,Thành viên mới gia nhập đội
lang_multi_text.db,MultiText,PrefabTextItem_3636986675_Text,继续挑战,Resume Challenge,Tiếp tục thử thách
lang_multi_text.db,MultiText,PrefabTextItem_3638218786_Text,本期友情参演,Cameo Role,Khách mời kỳ này
lang_multi_text.db,MultiText,PrefabTextItem_3638417184_Text,共鸣者动态等级,Effective Resonator Level,Cấp động của Cộng Hưởng Giả
lang_multi_text.db,MultiText,PrefabTextItem_3639691056_Text,"累计获得<texture=/Game/Aki/UI/UIResources/UiActivity/Image/Activity31/CumulativeRecharge/Common/T_TempScoreIcon.T_TempScoreIcon,0.5/>1600即可拥有","Obtain <texture=/Game/Aki/UI/UIResources/UiActivity/Image/Activity31/CumulativeRecharge/Common/T_TempScoreIcon.T_TempScoreIcon,0.5/> x1600 in total to claim","Tích lũy đạt <texture=/Game/Aki/UI/UIResources/UiActivity/Image/Activity31/CumulativeRecharge/Common/T_TempScoreIcon.T_TempScoreIcon,0.5/>1600 để nhận"
lang_multi_text.db,MultiText,PrefabTextItem_3640193407_Text,月相馈礼,Moonlit Blessings,Quà tặng Nguyệt Tướng
