db_file,table_name,id,zh,en,vi
lang_multi_text.db,MultiText,Side_LFZYDSPH_41_3,万一我打不过怎么办？,I not too sure about that last part.,Lỡ tôi đánh không lại thì sao?
lang_multi_text.db,MultiText,Side_LFZYDSPH_41_4,好，那我就指望你了！,Great. I'll be counting on you!,"Tốt, vậy tôi trông cậy vào cậu đấy!"
lang_multi_text.db,MultiText,Side_LFZYDSPH_41_5,那你到时候掩护我，我去营地里偷点能用的东西，做点炸药啥的！,"Then you just need to cover me while I sneak into the camp for some materials, make some explosives!","Vậy lúc đó cậu yểm trợ tôi, tôi lẻn vào doanh trại lấy mấy thứ dùng được, làm ít thuốc nổ gì đó!"
lang_multi_text.db,MultiText,Side_LFZYDSPH_42_1,这里应该安全了，谢谢你啊，不仅救了我还一路护送我到这里。,We should be safe here. Thank you for saving me and escorting me all this way.,"Chỗ này chắc an toàn rồi, cảm ơn cậu nhé, không chỉ cứu tôi mà còn hộ tống tôi đến tận đây."
lang_multi_text.db,MultiText,Side_LFZYDSPH_42_10,我得继续赶路了，在这里耽误了这么多时间，也不知道荒石高地那边的工事修筑怎么样了。,"I have to get going, I've wasted too much time already. I wonder how progress have been over at the Desorock Highland.","Tôi phải tiếp tục lên đường rồi, ở đây đã mất nhiều thời gian quá, cũng không biết công sự bên Hoang Thạch Cao Địa xây dựng đến đâu rồi."
lang_multi_text.db,MultiText,Side_LFZYDSPH_42_11,就此别过，别送了，再见，再见！,"Well, this is where we say goodbye. You've accompanied me far enough. Farewell!","Chia tay ở đây thôi, đừng tiễn nữa, tạm biệt, tạm biệt!"
lang_multi_text.db,MultiText,Side_LFZYDSPH_42_2,别客气。,You're welcome.,Không có gì.
