db_file,table_name,id,zh,en,vi
lang_multi_text.db,MultiText,Huanglong_main_1_6_21_51,你擒住了跟踪你的神秘少女，没想到她竟然是黑海岸的执花。她对你表现出了强烈的兴趣，并告诉你她也曾暗中为你的行动扫清障碍。少女找到机会从你手下逃脱，只留下了她的名字，椿。,"You apprehend the mysterious young woman stalking you, only to discover she is a Bloom Bearer from the Black Shores. She shows a strong interest in you and reveals she has been helping you from afar. In a flash, she manages to escape leaving only her name—Camellya.","Bạn bắt giữ thiếu nữ bí ẩn đang theo dõi mình, không ngờ cô ta lại là Người Giữ Hoa của Bờ Biển Đen. Cô ta tỏ ra rất hứng thú với bạn và cho biết mình cũng từng âm thầm dọn dẹp chướng ngại cho bạn. Thiếu nữ tìm cơ hội thoát khỏi tay bạn, chỉ để lại cái tên Camellya."
lang_multi_text.db,MultiText,Huanglong_main_1_6_22_1,发生什么事了吗，怎么这么久才接起来……,"Rover, what took you so long to pick up the call? Did something happen?","Có chuyện gì xảy ra sao, sao lâu như vậy mới bắt máy..."
lang_multi_text.db,MultiText,Huanglong_main_1_6_22_2,跟踪者现形了。,Another stalker showed up.,Kẻ theo dõi lộ diện rồi.
lang_multi_text.db,MultiText,Huanglong_main_1_6_22_3,遇到了一个奇怪的女人。,I met a weird woman.,Gặp phải một người phụ nữ kỳ lạ.
lang_multi_text.db,MultiText,Huanglong_main_1_6_22_4,是敌是友？你有受伤吗？,Is that a friend or foe? Are you hurt?,Là bạn hay thù? Bạn có bị thương không?
lang_multi_text.db,MultiText,Huanglong_main_1_6_22_5,是黑海岸的人。,She's from the Black Shores.,Là người của Bờ Biển Đen.
lang_multi_text.db,MultiText,Huanglong_main_1_6_22_6,我没事，谢谢你关心我。,"I am safe, thank you for asking.","Tôi không sao, cảm ơn bạn đã quan tâm."
lang_multi_text.db,MultiText,Huanglong_main_1_6_22_7,是黑海岸的人？有得到什么情报吗？,The Black Shores... Did she tell you anything?,Là người của Bờ Biển Đen? Có lấy được thông tin gì không?
lang_multi_text.db,MultiText,Huanglong_main_1_6_22_8,可惜，让她逃了。,A shame. I let her get away.,Tiếc là để cô ta chạy mất rồi.
lang_multi_text.db,MultiText,Huanglong_main_1_6_22_9,呼……你没受伤就好。,Phew... At least you are safe.,Phù... Bạn không bị thương là tốt rồi.
lang_multi_text.db,MultiText,Huanglong_main_1_6_22_10,呼……你没受伤就好。,Phew... At least you are safe.,Phù... Bạn không bị thương là tốt rồi.
lang_multi_text.db,MultiText,Huanglong_main_1_6_22_11,你们那边如何？,How's it going over there?,Chỗ các bạn thế nào rồi?
lang_multi_text.db,MultiText,Huanglong_main_1_6_22_12,炽霞发现了一位鬼鬼祟祟的可疑人士，现在正在暗中盯梢。,Chixia noticed a guy acting suspicious. I think she's keeping an eye on him.,"Chixia phát hiện một kẻ khả nghi cứ lén lút thập thò, hiện đang âm thầm theo dõi hắn."
lang_multi_text.db,MultiText,Huanglong_main_1_6_22_13,我马上过去。,I'll be there soon.,Tôi qua đó ngay.
lang_multi_text.db,MultiText,Huanglong_main_1_6_22_14,好，我们在商业街这里。,"Sure, we are in the shopping district. See you then.","Được, bọn mình đang ở khu phố thương mại."
