db_file,table_name,id,zh,en,vi
lang_multi_text.db,MultiText,ErrorCode_2200119_Text,作战装置等级配置不存在,Combat Machine level not configured,Cấu hình cấp độ thiết bị tác chiến không tồn tại
lang_multi_text.db,MultiText,ErrorCode_2200120_Text,作战装置已达到最高等级,The Combat Machine has reached the highest level,Thiết bị tác chiến đã đạt cấp cao nhất
lang_multi_text.db,MultiText,ErrorCode_2200121_Text,活动配置不存在,Event configuration missing,Cấu hình sự kiện không tồn tại
lang_multi_text.db,MultiText,ErrorCode_2200122_Text,库洛洛武器等级配置不存在,KU-Roro's Weapon level not configured,Cấu hình cấp độ vũ khí Kuroro không tồn tại
lang_multi_text.db,MultiText,ErrorCode_2200123_Text,库洛洛武器已达到最高等级,The KU-Roro's Weapon has reached the highest level,Vũ khí Kuroro đã đạt cấp cao nhất
lang_multi_text.db,MultiText,ErrorCode_2200124_Text,库洛洛武器没有当前选择分支,No current option for the KU-Roro's Weapon,Vũ khí Kuroro không có nhánh lựa chọn hiện tại
lang_multi_text.db,MultiText,ErrorCode_2200125_Text,作战装置没有当前选择分支,No current option for the Combat Machine,Thiết bị tác chiến không có nhánh lựa chọn hiện tại
lang_multi_text.db,MultiText,ErrorCode_2200126_Text,库洛洛武器重置操作无效,The reset action of KU-Roro's Weapon is invalid,Thao tác đặt lại vũ khí Kuroro không hợp lệ
lang_multi_text.db,MultiText,ErrorCode_2200127_Text,作战装置重置操作无效,The reset action of Combat Machine is invalid,Thao tác đặt lại thiết bị tác chiến không hợp lệ
lang_multi_text.db,MultiText,ErrorCode_2200128_Text,守望协议节点配置找不到,Overwatch Protocol configuration is missing,Không tìm thấy cấu hình nút Giao Thức Quan Sát
lang_multi_text.db,MultiText,ErrorCode_2200129_Text,守望协议已解锁,The Overwatch Protocol is unlocked,Giao Thức Quan Sát đã mở khóa
lang_multi_text.db,MultiText,ErrorCode_2200130_Text,守望协议节点配置找不到,Overwatch Protocol configuration is missing,Không tìm thấy cấu hình nút Giao Thức Quan Sát
lang_multi_text.db,MultiText,ErrorCode_2200131_Text,前置节点未解锁,Prerequisite Protocol is not activated,Nút tiền đề chưa mở khóa
lang_multi_text.db,MultiText,ErrorCode_2200132_Text,作战评级不足,Insufficient Rating Stars,Đánh giá tác chiến không đủ
lang_multi_text.db,MultiText,ErrorCode_2200133_Text,活动道具配置不存在,Event item not configured,Cấu hình vật phẩm sự kiện không tồn tại
lang_multi_text.db,MultiText,ErrorCode_2200134_Text,活动道具超过携带上限,Event item capacity exceeded,Vật phẩm sự kiện vượt quá giới hạn mang theo
lang_multi_text.db,MultiText,ErrorCode_2200135_Text,活动道具不足,Insufficient event item,Vật phẩm sự kiện không đủ
lang_multi_text.db,MultiText,ErrorCode_2200136_Text,购买的商店bd组数据不存在,Data of the purchased Tactic Set is missing,Dữ liệu nhóm bd cửa hàng đã mua không tồn tại
lang_multi_text.db,MultiText,ErrorCode_2200137_Text,购买的道具数据不存在,Data of the purchased item is missing,Dữ liệu vật phẩm đã mua không tồn tại
lang_multi_text.db,MultiText,ErrorCode_2200138_Text,拟像贝币不足,Insufficient Sim Credits,Vỏ Ốc Mô Phỏng không đủ
lang_multi_text.db,MultiText,ErrorCode_2200139_Text,支付拟像贝币失败,Sim Credit payment failed,Thanh toán Vỏ Ốc Mô Phỏng thất bại
lang_multi_text.db,MultiText,ErrorCode_2200140_Text,道具库存数量不足,Insufficient item inventory,Số lượng vật phẩm trong kho không đủ
lang_multi_text.db,MultiText,ErrorCode_2200141_Text,商店数据不存在,Shop data is missing,Dữ liệu cửa hàng không tồn tại
lang_multi_text.db,MultiText,ErrorCode_2200142_Text,商店配置不存在,Shop configuration is missing,Cấu hình cửa hàng không tồn tại
lang_multi_text.db,MultiText,ErrorCode_2200143_Text,商店刷新数量不足,Insufficient Shop refresh attempts,Số lần làm mới cửa hàng không đủ
lang_multi_text.db,MultiText,ErrorCode_2200144_Text,拟像贝币配置不存在,Sim Credit not configured,Cấu hình Vỏ Ốc Mô Phỏng không tồn tại
lang_multi_text.db,MultiText,ErrorCode_2200145_Text,不是拟像贝币实体,Not the Sim Credit entity,Không phải thực thể Vỏ Ốc Mô Phỏng
lang_multi_text.db,MultiText,ErrorCode_2200146_Text,不是残象实体,Not the Tacet Discord entity,Không phải thực thể Tàn Tượng
lang_multi_text.db,MultiText,ErrorCode_2200147_Text,不是作战装置实体,Not the Combat Machine entity,Không phải thực thể thiết bị tác chiến
lang_multi_text.db,MultiText,ErrorCode_2200148_Text,所有的变量都不能降到0以下,All variables cannot drop below 0,Tất cả các biến không thể giảm xuống dưới 0
lang_multi_text.db,MultiText,ErrorCode_2200149_Text,所有的变量类型不存在,All variable types are missing,Tất cả các loại biến không tồn tại
lang_multi_text.db,MultiText,ErrorCode_2200150_Text,库默尼商行的指定战术已被售出,The selected Tactic is sold,Chiến thuật chỉ định của Thương Hội Kumoni đã được bán
lang_multi_text.db,MultiText,ErrorCode_2200151_Text,作战装置超过部署上限,Combat Machine deployment cap reached,Thiết bị tác chiến vượt quá giới hạn triển khai
lang_multi_text.db,MultiText,ErrorCode_2200152_Text,未处于奖励阶段,Not in the reward phase,Không ở trong giai đoạn nhận thưởng
lang_multi_text.db,MultiText,ErrorCode_2200153_Text,战术抽取数据不存在,Data for drawing Tactics is missing,Dữ liệu rút chiến thuật không tồn tại
lang_multi_text.db,MultiText,ErrorCode_2200154_Text,战术抽取刷新数量不足,Insufficient refresh attempts for drawing Tactics,Số lần làm mới rút chiến thuật không đủ
lang_multi_text.db,MultiText,ErrorCode_2200155_Text,特殊地块配置不存在,Special area not configured,Cấu hình ô đất đặc biệt không tồn tại
lang_multi_text.db,MultiText,ErrorCode_2200156_Text,特定等级的特殊地块配置不存在,Special area of specific level not configured,Cấu hình ô đất đặc biệt cấp độ cụ thể không tồn tại
lang_multi_text.db,MultiText,ErrorCode_2200157_Text,dnt/行为执行时 实体对象不存在 行为名:{0} 对象:{1} 拥有者:{2},,"dnt/Khi thực hiện hành vi, đối tượng thực thể không tồn tại. Tên hành vi: {0}, đối tượng: {1}, chủ sở hữu: {2}"
lang_multi_text.db,MultiText,ErrorCode_2200158_Text,频率中和器数量不足,Insufficient Frequency Neutralizers,Số lượng Bộ Trung Hòa Tần Số không đủ
lang_multi_text.db,MultiText,ErrorCode_2200159_Text,道具逻辑配置错误,Item logic configuration error,Cấu hình logic vật phẩm bị lỗi
lang_multi_text.db,MultiText,ErrorCode_2200160_Text,特殊地块类型不同,Unmatched special area type,Loại ô đất đặc biệt khác nhau
lang_multi_text.db,MultiText,ErrorCode_2200161_Text,不是潮蚀模拟特殊地块,Not a special area in Tidal Defense Simulator,Không phải ô đất đặc biệt của Mô Phỏng Triều Thực
lang_multi_text.db,MultiText,ErrorCode_2200162_Text,超过最大部署上限,Deployment cap reached,Vượt quá giới hạn triển khai tối đa
lang_multi_text.db,MultiText,ErrorCode_2200164_Text,作战装置无法销毁,Combat Machine cannot be destroyed,Không thể phá hủy thiết bị tác chiến
lang_multi_text.db,MultiText,ErrorCode_2200165_Text,战术抽取结果为空,Tactic drawing result is empty,Kết quả rút chiến thuật bị trống
lang_multi_text.db,MultiText,ErrorCode_2200166_Text,战术已经达到最大等级,The Tactic has reached the highest level,Chiến thuật đã đạt cấp độ tối đa
lang_multi_text.db,MultiText,ErrorCode_2200167_Text,无法消耗矩阵耐久,Energy Matrix Durability cannot be depleted,Không thể tiêu hao độ bền ma trận
lang_multi_text.db,MultiText,ErrorCode_2200223_Text,智造立方重启进度次数过于频繁,Smartprint Cube rebooted too frequently,Số lần khởi động lại tiến độ Khối Lập Phương Trí Tuệ quá thường xuyên
lang_multi_text.db,MultiText,ErrorCode_2200229_Text,当前场景无法进入副本,Cannot enter Dungeon currently,Cảnh hiện tại không thể vào phó bản
lang_multi_text.db,MultiText,ErrorCode_2300000_Text,登录失败，该服务器无法进入。,Login failed. Server unavailable.,"Đăng nhập thất bại, không thể vào máy chủ này."
lang_multi_text.db,MultiText,ErrorCode_2300001_Text,该功能未在此服务器开启。,This function is not available on this server.,Tính năng này chưa mở ở máy chủ này.
lang_multi_text.db,MultiText,ErrorCode_2400000_Text,存在异常，如有疑问请联系官方客服。,Please contact our Customer Service for assistance,"Có bất thường, nếu có thắc mắc vui lòng liên hệ CSKH chính thức."
lang_multi_text.db,MultiText,ErrorCode_2500000_Text,领取奖励错误，找不到对应活动配置。,Reward claiming error. Corresponding event configuration not found.,"Lỗi nhận thưởng, không tìm thấy cấu hình sự kiện tương ứng."
lang_multi_text.db,MultiText,ErrorCode_2500001_Text,领取奖励错误，活动未开启。,Reward claiming error. Event not available.,"Lỗi nhận thưởng, sự kiện chưa mở."
lang_multi_text.db,MultiText,ErrorCode_2500002_Text,领取奖励错误，人气值不足。,Reward claiming error. Insufficient Popularity.,"Lỗi nhận thưởng, không đủ độ nổi tiếng."
lang_multi_text.db,MultiText,ErrorCode_2500003_Text,领取奖励错误，未知错误。,Reward claiming error. Unknown error.,"Lỗi nhận thưởng, lỗi không xác định."
lang_multi_text.db,MultiText,ErrorCode_2500004_Text,领取奖励错误，已领取奖励。,Reward claiming error. Reward already claimed.,"Lỗi nhận thưởng, đã nhận thưởng."
lang_multi_text.db,MultiText,ErrorCode_2500005_Text,获取活动数据失败，找不到配置。,Failed to retrieve the event data. Configuration not found.,"Lấy dữ liệu sự kiện thất bại, không tìm thấy cấu hình."
lang_multi_text.db,MultiText,ErrorCode_2500006_Text,获取活动数据失败，活动未开启。,Failed to retrieve the event data. Event not available.,"Lấy dữ liệu sự kiện thất bại, sự kiện chưa mở."
lang_multi_text.db,MultiText,ErrorCode_2500007_Text,获取活动数据失败，未知错误。,Failed to retrieve the event data. Unknown error.,"Lấy dữ liệu sự kiện thất bại, lỗi không xác định."
lang_multi_text.db,MultiText,ErrorCode_2500008_Text,活动id错误,Event id error,Lỗi ID sự kiện
lang_multi_text.db,MultiText,ErrorCode_2500009_Text,活动未开启,Event unavailable,Sự kiện chưa mở
lang_multi_text.db,MultiText,ErrorCode_2500010_Text,未知错误,Unknown error,Lỗi không xác định
lang_multi_text.db,MultiText,ErrorCode_2500011_Text,领取奖励的玩法错误,Gameplay error,Lỗi lối chơi nhận thưởng
lang_multi_text.db,MultiText,ErrorCode_2500012_Text,领取奖励的活动未开启,Event not available,Sự kiện nhận thưởng chưa mở
lang_multi_text.db,MultiText,ErrorCode_2500013_Text,领取奖励错误，未达到要求,Reward claiming error. Requirements not met.,"Lỗi nhận thưởng, chưa đạt yêu cầu"
lang_multi_text.db,MultiText,ErrorCode_2500014_Text,领取奖励错误，奖励已领取,Reward claiming error. Reward already claimed.,"Lỗi nhận thưởng, phần thưởng đã nhận"
lang_multi_text.db,MultiText,ErrorCode_2500015_Text,领取奖励错误，关卡还未解锁,Reward claiming error. Stage locked.,"Lỗi nhận thưởng, ải chưa mở khóa"
lang_multi_text.db,MultiText,ErrorCode_2500016_Text,领取奖励错误，没有对应的奖励,Reward claiming error. Corresponding reward not found.,"Lỗi nhận thưởng, không có phần thưởng tương ứng"
lang_multi_text.db,MultiText,ErrorCode_2500017_Text,传送错误，没找到玩法,Teleportation error. Gameplay not found.,"Lỗi dịch chuyển, không tìm thấy lối chơi"
lang_multi_text.db,MultiText,ErrorCode_2500018_Text,传送错误，玩法未开启,Teleportation error. Gameplay not available.,"Lỗi dịch chuyển, lối chơi chưa mở"
lang_multi_text.db,MultiText,ErrorCode_2500019_Text,传送错误，活动未开始,Teleportation error. Event has not started.,"Lỗi dịch chuyển, sự kiện chưa bắt đầu"
lang_multi_text.db,MultiText,ErrorCode_2500020_Text,传送错误，没找到传送配置,Teleportation error. Teleportation configuration not found.,"Lỗi dịch chuyển, không tìm thấy cấu hình dịch chuyển"
lang_multi_text.db,MultiText,ErrorCode_2500021_Text,道具不支持弃置操作,This item cannot be discarded,Vật phẩm không hỗ trợ vứt bỏ
lang_multi_text.db,MultiText,ErrorCode_2500022_Text,道具不支持弃置操作,This item cannot be discarded,Vật phẩm không hỗ trợ vứt bỏ
lang_multi_text.db,MultiText,ErrorCode_2500023_Text,超过批量融合最大数量,Exceeded the max number for Batch Merge,Vượt quá số lượng hợp thành hàng loạt tối đa
lang_multi_text.db,MultiText,ErrorCode_2500024_Text,融合道具重复,Echo already existed,Vật phẩm hợp thành bị trùng
lang_multi_text.db,MultiText,ErrorCode_2500025_Text,非普通声骸不可添加,Non-regular Echoes cannot be added,Không thể thêm Thanh Hài không thường
lang_multi_text.db,MultiText,ErrorCode_2500030_Text,系统异常，请稍后再试,System error. Please try again later.,"Hệ thống bất thường, vui lòng thử lại sau"
lang_multi_text.db,MultiText,ErrorCode_2500031_Text,活动任务尚未完成，无法领取,The reward is unclaimable now. Please complete the event quest first.,"Nhiệm vụ sự kiện chưa hoàn thành, không thể nhận"
lang_multi_text.db,MultiText,ErrorCode_2500032_Text,收集进度尚未达到目标，无法领取,The reward is unclaimable now. Please reach the target collection progress first.,"Tiến độ thu thập chưa đạt mục tiêu, không thể nhận"
lang_multi_text.db,MultiText,ErrorCode_2500033_Text,此奖励已领取，无法重复领取,The reward has been claimed and cannot be claimed again.,"Phần thưởng này đã nhận, không thể nhận lại"
lang_multi_text.db,MultiText,ErrorCode_2500034_Text,此奖励已领取，无法重复领取,The reward has been claimed and cannot be claimed again.,"Phần thưởng này đã nhận, không thể nhận lại"
lang_multi_text.db,MultiText,ErrorCode_2500041_Text,系统异常，请稍后再试,System error. Please try again later.,"Hệ thống bất thường, vui lòng thử lại sau"
lang_multi_text.db,MultiText,ErrorCode_2500042_Text,奖励已领取,Rewards have already been claimed,Đã nhận thưởng
lang_multi_text.db,MultiText,ErrorCode_2500043_Text,探历札记不足,Insufficient Adventure Logs,Nhật Ký Thám Hiểm không đủ
lang_multi_text.db,MultiText,ErrorCode_2500044_Text,当前轮次尚未解锁,Current round is not yet unlocked,Vòng hiện tại chưa mở khóa
lang_multi_text.db,MultiText,ErrorCode_2500045_Text,活动尚未开启,The event has not started,Sự kiện chưa mở
lang_multi_text.db,MultiText,ErrorCode_2500046_Text,未达到活动开启时间,Event not available yet,Chưa đến thời gian mở sự kiện
lang_multi_text.db,MultiText,ErrorCode_2500047_Text,未完成问卷领奖,Survey rewards unclaimed,Chưa hoàn thành khảo sát nhận thưởng
lang_multi_text.db,MultiText,ErrorCode_2500048_Text,未找到钳形激战无双版关卡配置,Pincer Maneuver Warriors stage configuration not found,Không tìm thấy cấu hình ải Chiến Dịch Kìm Kẹp - Vô Song
lang_multi_text.db,MultiText,ErrorCode_2500049_Text,钳形激战无双版活动未开启,Pincer Maneuver Warriors unavailable now,Sự kiện Chiến Dịch Kìm Kẹp - Vô Song chưa mở
lang_multi_text.db,MultiText,ErrorCode_2500050_Text,未找到钳形激战无双版缓存数据,Pincer Maneuver Warriors cache data not found.,Không tìm thấy dữ liệu bộ nhớ đệm Chiến Dịch Kìm Kẹp - Vô Song
lang_multi_text.db,MultiText,ErrorCode_2500051_Text,还未完成上半场的挑战,Complete the first half of the challenge to proceed.,Vẫn chưa hoàn thành khiêu chiến nửa đầu
lang_multi_text.db,MultiText,ErrorCode_2500052_Text,钳形激战无双版关卡id错误,Error in Pincer Maneuver Warriors stage ID.,Lỗi ID ải Chiến Dịch Kìm Kẹp - Vô Song
lang_multi_text.db,MultiText,ErrorCode_2500053_Text,角色选择错误，请重新调整队伍配置,Current lineup is not allowed in this event. Please adjust and try again.,"Lỗi chọn nhân vật, vui lòng điều chỉnh lại đội hình"
lang_multi_text.db,MultiText,ErrorCode_2500054_Text,活动词条选择错误，请稍后再试,Event buff selection error. Please try again later.,"Lỗi chọn dòng thuộc tính sự kiện, vui lòng thử lại sau"
lang_multi_text.db,MultiText,ErrorCode_2500055_Text,未找到钳形激战无双版组件,Pincer Maneuver Warriors components not found.,Không tìm thấy thành phần Chiến Dịch Kìm Kẹp - Vô Song
lang_multi_text.db,MultiText,ErrorCode_2500056_Text,队伍Ⅰ和队伍Ⅱ存在相同角色,Duplicate Resonator detected in Team I and Team II.,Đội I và Đội II có nhân vật trùng nhau
