db_file,table_name,id,zh,en,vi
lang_multi_text.db,MultiText,Guide_YFSH_12_6,好好，我也再准备准备……见她时该说些什么好呢……,No rush. I also need to make some preparations. What should I say to her…,"Được được, ta cũng chuẩn bị thêm chút... gặp bà ấy thì nên nói gì nhỉ..."
lang_multi_text.db,MultiText,Guide_YFSH_13_1,她家就在那边……我去过好多次，不会记错的。,Her house is over there. I've walked that path many times and I won't make a mistake.,"Nhà bà ấy ở đằng kia... Ta đã đến nhiều lần rồi, không thể nhớ nhầm được."
lang_multi_text.db,MultiText,Guide_YFSH_13_10,《瑝珑热门情话大全》呀！咳咳，我知道，一把年纪了还说这些话，是有点……,"<i>Popular Love Messages in Huanglong</i>! Ahem, I know it might seem a bit strange for someone of my age to say such things...","""Tuyển Tập Lời Tỏ Tình Hot Nhất Hoàng Long"" đấy! Khụ khụ, ta biết, già rồi mà còn nói mấy lời này thì hơi..."
lang_multi_text.db,MultiText,Guide_YFSH_13_11,可为了她，我这一张老脸呀，也就豁出去了。,"But as long as I can win her heart, I can put aside my pride.","Nhưng vì bà ấy, cái mặt già này của ta cũng liều luôn rồi."
lang_multi_text.db,MultiText,Guide_YFSH_13_12,等下就拜托你们了，我一句，你们一句，帮我烘托点气氛。,"I’m counting on you. After I say my line, you’ll follow up to set the perfect mood.","Lát nữa nhờ các cháu nhé, ta nói một câu, các cháu nói một câu, giúp ta tạo không khí."
lang_multi_text.db,MultiText,Guide_YFSH_13_13,行吧。,"Okay, fine.",Được thôi.
lang_multi_text.db,MultiText,Guide_YFSH_13_14,这是另外的价钱。,I require a raise.,Cái này phải tính thêm tiền đấy.
lang_multi_text.db,MultiText,Guide_YFSH_13_15,{PlayerName}，没看出来，你比我还热心啊！,"{PlayerName}, I had no idea you’re even more helpful than me! Way to go!","{PlayerName}, không ngờ cậu còn nhiệt tình hơn cả tớ!"
lang_multi_text.db,MultiText,Guide_YFSH_13_16,报酬好说，好说！到时候一起算，不会少的。,"Of course, I won’t stint on compensation. Your efforts will be duly rewarded.","Thù lao dễ nói, dễ nói! Lúc đó tính hết một thể, không thiếu đâu."
lang_multi_text.db,MultiText,Guide_YFSH_13_17,那就这样说定了，老头子我提前跟你们道声谢谢。,"That’s settled then. Thank you, kids.","Vậy thì nói thế nhé, lão già này xin cảm ơn các cháu trước."
lang_multi_text.db,MultiText,Guide_YFSH_13_2,就是……在去找她之前，还有件事情拜托你们。,"Before I go knocking on her door, there's a favor I must ask of you.","Chỉ là... trước khi đi gặp bà ấy, còn một việc muốn nhờ các cháu."
lang_multi_text.db,MultiText,Guide_YFSH_13_3,咳咳，我准备了一些开场白，待会儿可能需要你们配合下。,"Ahem, I’ve prepared some opening lines and I need your assistance in delivering them.","Khụ khụ, ta đã chuẩn bị mấy câu mở đầu, lát nữa có thể cần các cháu phối hợp chút."
lang_multi_text.db,MultiText,Guide_YFSH_13_4,开场白？,Opening lines?,Câu mở đầu?
lang_multi_text.db,MultiText,Guide_YFSH_13_5,就是一些好听的话，老头子我查了老半天呢，准灵。,"Well, just some nice words, carefully chosen, and I believe they’ll definitely do the trick.","Là mấy lời hay ho ấy mà, lão già ta tra cả nửa ngày đấy, chắc chắn linh nghiệm."
lang_multi_text.db,MultiText,Guide_YFSH_13_6,你知道最好看的是什么花吗？不是水灯花，不是鸢尾花，是我遇到你，如同铁树开花！,"Do you know what’s sweeter than any bloom? Not the Waterlamp’s glow, nor the Iris’s perfume, but the blossom of our love’s perfect tune!","Bà có biết hoa nào đẹp nhất không? Không phải hoa Thủy Đăng, không phải hoa Diên Vỹ, mà là gặp được bà, như sắt ra hoa vậy!"
lang_multi_text.db,MultiText,Guide_YFSH_13_7,你知道最美的是什么颜色吗？不是紫红，不是粉红，是最美不过我们的夕阳红！,"Do you know what lasts forever in Wuthering Waves? Not fleeting civilizations, nor Tacet Discords’ lore, but my unwavering love for you, forevermore!","Bà có biết màu nào đẹp nhất không? Không phải tím hồng, không phải phấn hồng, mà đẹp nhất là màu hoàng hôn tuổi già của chúng ta!"
lang_multi_text.db,MultiText,Guide_YFSH_13_8,……,...,...
lang_multi_text.db,MultiText,Guide_YFSH_13_9,景烛爷爷，你查的什么呀？,"Well... Grandpa Jingzhu, what are these?","Ông Cảnh Chúc ơi, ông tra cái gì vậy?"
lang_multi_text.db,MultiText,Guide_YFSH_14_1,她，她就是凌寒，我朝思暮想的老……预备老伴。,"There she is, Linghan, m-my beloved wife... wife-to-be.","Bà, bà ấy chính là Lăng Hàn, người mà ta ngày nhớ đêm mong... bạn... bạn đời tương lai."
lang_multi_text.db,MultiText,Guide_YFSH_14_10,箭在弦上，不得不发了！,"Alright, there’s no time to waste. I must make my move!","Tên đã lắp vào cung rồi, không bắn không được!"
lang_multi_text.db,MultiText,Guide_YFSH_14_11,哇，{PlayerName}，你还真豁得出去！弄得我也热血沸腾了！,"Whoa, {PlayerName}, your passion is contagious! You’ve got me all fired up too!","Wow, {PlayerName}, cậu liều thật đấy! Làm tớ cũng sôi sục lên rồi!"
lang_multi_text.db,MultiText,Guide_YFSH_14_12,凌寒啊凌寒，你知道最好看的是什么花吗？,Do you know what’s sweeter than any bloom?,"Lăng Hàn ơi Lăng Hàn, bà có biết hoa nào đẹp nhất không?"
lang_multi_text.db,MultiText,Guide_YFSH_14_13,不是水灯花！,Not the Waterlamp’s glow!,Không phải hoa Thủy Đăng!
lang_multi_text.db,MultiText,Guide_YFSH_14_14,不是鸢尾花。,Nor the Iris’s perfume.,Không phải hoa Diên Vỹ.
lang_multi_text.db,MultiText,Guide_YFSH_14_15,是我遇到你，如同铁树开花！,But the blossom of our love’s perfect tune!,"Mà là gặp được bà, như sắt ra hoa vậy!"
lang_multi_text.db,MultiText,Guide_YFSH_14_16,效果不错，再接再厉！,Good! Better strike while the iron’s hot!,"Hiệu quả tốt đấy, cố lên nào!"
lang_multi_text.db,MultiText,Guide_YFSH_14_17,凌寒啊凌寒，你知道最美的是什么颜色吗？,Do you know what lasts forever in Wuthering Waves?,"Lăng Hàn ơi Lăng Hàn, bà có biết màu nào đẹp nhất không?"
lang_multi_text.db,MultiText,Guide_YFSH_14_18,不是紫红！,Not fleeting civilizations!,Không phải tím hồng!
lang_multi_text.db,MultiText,Guide_YFSH_14_19,不是粉红。,Nor Tacet Discords’ lore.,Không phải phấn hồng.
lang_multi_text.db,MultiText,Guide_YFSH_14_2,你手里拿的花？,And this flower is...?,Hoa trong tay ông là gì vậy?
lang_multi_text.db,MultiText,Guide_YFSH_14_20,是最美不过我们的夕阳红！,"But my unwavering love for you, forevermore!",Mà đẹp nhất là màu hoàng hôn tuổi già của chúng ta!
lang_multi_text.db,MultiText,Guide_YFSH_14_21,……,...,...
lang_multi_text.db,MultiText,Guide_YFSH_14_22,没事了？那我走了？,You done? Please excuse me.,Xong rồi hả? Vậy tôi đi nhé?
lang_multi_text.db,MultiText,Guide_YFSH_14_23,等等，我还准备了一份惊喜！,Wait! I have a surprise for you!,"Khoan đã, ta còn chuẩn bị một bất ngờ nữa!"
lang_multi_text.db,MultiText,Guide_YFSH_14_24,快，快让她看看我们威风的声骸。,Hurry! Show her those majestic Echoes!,"Nhanh, nhanh cho bà ấy xem mấy Thanh Hài oai phong của chúng ta."
lang_multi_text.db,MultiText,Guide_YFSH_14_3,哦，这是夜息香，她最喜欢的花。,"It’s the Noctemint, her favorite flower.","À, đây là Dạ Tức Hương, loài hoa bà ấy thích nhất."
lang_multi_text.db,MultiText,Guide_YFSH_14_4,你听听：你愿意收下我的夜息香，成为我的老伴吗？多么优雅的瑝珑话，多么有内涵的瑝珑人！,"I’m about to ask her, ""Would you accept this Noctemint and join me on a lifelong journey?""","Nghe này: ""Bà có muốn nhận Dạ Tức Hương của tôi, làm bạn đời với tôi không?"" Thật là câu nói tao nhã của người Hoàng Long, thật là con người sâu sắc của Hoàng Long!"
lang_multi_text.db,MultiText,Guide_YFSH_14_5,不过，我和她现在……还只能算陌生人，真希望她能接过我手中的夜息香。,"But alas, my efforts seem to fall short... I truly hope she’ll appreciate this Noctemint this time.","Tuy nhiên, ta với bà ấy hiện tại... chỉ coi như người lạ thôi, thật mong bà ấy có thể nhận bông Dạ Tức Hương trong tay ta."
lang_multi_text.db,MultiText,Guide_YFSH_14_6,或许这次，她听过我精心准备的开场白，再加上你们抓的威风声骸，结果会有所不同。,"Perhaps, with my carefully prepared opening lines and the majestic Echoes you’ve captured, she’ll finally accept my love.","Có lẽ lần này, sau khi nghe mấy câu mở đầu ta chuẩn bị kỹ lưỡng, cộng thêm mấy Thanh Hài oai phong các cháu bắt được, kết quả sẽ khác đi."
lang_multi_text.db,MultiText,Guide_YFSH_14_7,开场白都记住了吗，我说一句，你们说一句，一起说出气势来！,"Do you remember the opening lines? I’ll say my line first, and you’ll follow up! Remember to set the mood!","Câu mở đầu nhớ hết chưa? Ta nói một câu, các cháu nói một câu, cùng nói cho có khí thế!"
lang_multi_text.db,MultiText,Guide_YFSH_14_8,还是有点……,"Well, but...",Vẫn hơi...
lang_multi_text.db,MultiText,Guide_YFSH_14_9,准备好了！,Always ready!,Sẵn sàng rồi!
lang_multi_text.db,MultiText,Guide_YFSH_15_1,看，这声骸威风吧！这可是我特意拜托这两位年轻人抓来的。,Look! Aren’t these Echoes impressive? These two youngsters assisted me in capturing them.,"Nhìn này, Thanh Hài oai phong chứ! Đây là ta đặc biệt nhờ hai bạn trẻ này bắt về đấy."
lang_multi_text.db,MultiText,Guide_YFSH_15_2,再加上咱们年龄相仿，志趣相投，你看能不能赏个脸，收下我手中的夜息香？,"Linghan, we’re of similar age, with shared interests. I hold you dear and desire nothing more than to journey through life with you. Would you do me the honor of accepting this Noctemint?","Thêm nữa chúng ta tuổi tác tương đương, sở thích hợp nhau, bà xem có thể chiếu cố, nhận bông Dạ Tức Hương trong tay tôi không?"
lang_multi_text.db,MultiText,Guide_YFSH_15_3,声骸我熟啊，里面的门道可多着呢。,"Speaking of Echoes, that’s my specialty.","Thanh Hài thì tôi rành lắm, bên trong nhiều thứ hay ho lắm đấy."
lang_multi_text.db,MultiText,Guide_YFSH_15_4,可不是有个威风的声骸就能横扫四方，虚有其表，没用，没用！,"If you’re aiming to become an Echo Master, you can’t judge an Echo solely from its appearance. Take this Carapace, for instance. Despite its imposing scythes, it may not be what it seems.","Không phải cứ có Thanh Hài oai phong là quét sạch bốn phương đâu nhé. Bề ngoài hào nhoáng mà rỗng ruột thì vô dụng, vô dụng!"
lang_multi_text.db,MultiText,Guide_YFSH_15_5,你们要是有心用好声骸啊，还是得找准适合自己的，好好养起来才行。净整这些花里胡哨的有啥用啊。,"What truly counts is finding the Echo that resonates with you and nurturing it wisely. Always remember, never let appearances sway your decisions!","Nếu thật lòng muốn dùng tốt Thanh Hài, thì phải tìm đúng cái phù hợp với mình, rồi chăm bồi cho tử tế mới được. Cứ chạy theo mấy thứ hào nhoáng thì có ích gì."
lang_multi_text.db,MultiText,Guide_YFSH_15_6,是，是……那，这夜息香？,"Yes, yes. So, might you consider accepting this Noctemint?","Vâng, vâng... Vậy, bông Dạ Tức Hương này thì..."
lang_multi_text.db,MultiText,Guide_YFSH_15_7,那我可就不感兴趣了，我一个人晒晒太阳嗑嗑瓜子挺好的。,"No, thank you. I’m not interested. I’d rather bask in the sunshine and enjoy some dried melon seeds all by myself.","Cái đó thì tôi không quan tâm, một mình phơi nắng cắn hạt dưa cũng vui lắm rồi."
lang_multi_text.db,MultiText,Guide_YFSH_16_1,老奶奶的意思，应该是拒绝吧。,"Grandma Linghan turned him down, right?",Ý bà cụ chắc là... từ chối rồi nhỉ.
lang_multi_text.db,MultiText,Guide_YFSH_16_10,她在指点我！哈哈哈，她心里有我！,"It’s her way of guiding me forward. Hahaha, she truly does care about me!","Bà ấy đang chỉ điểm cho ta đấy! Hahaha, trong lòng bà ấy có ta!"
lang_multi_text.db,MultiText,Guide_YFSH_16_11,……,...,...
lang_multi_text.db,MultiText,Guide_YFSH_16_12,……有点担心景烛爷爷的精神状态。,...Starting to wonder if Grandpa Jingzhu bumped his head.,...Hơi lo cho tinh thần ông Cảnh Chúc quá.
lang_multi_text.db,MultiText,Guide_YFSH_16_13,走，乘胜追击！咱们现在就出城……,"Come along, my young friends! There's no time to waste. We're leaving the city to gather the materials needed...","Đi thôi, thừa thắng xông lên! Mình ra ngoài thành ngay..."
lang_multi_text.db,MultiText,Guide_YFSH_16_14,诶诶景烛爷爷别太心急，现在天色可不早了。况且你身上还有伤呢，{PlayerName}也跑了一天了……,"Wait, Grandpa Jingzhu! Take it easy! It's getting late, and you're still recovering from your injury. Plus, {PlayerName} must be beat after capturing all those Echoes...","Ê ê ông Cảnh Chúc đừng vội quá, trời cũng không còn sớm rồi. Hơn nữa ông còn bị thương, {PlayerName} cũng chạy cả ngày rồi..."
lang_multi_text.db,MultiText,Guide_YFSH_16_15,啊，抱歉抱歉，我太心急了没注意时间。你们也累了吧，那改天吧。,"Oh, my apologies. I got carried away and lost track of time. You must be exhausted. Let’s do it another day.","À, xin lỗi xin lỗi, ta nóng vội quá không để ý thời gian. Các cháu cũng mệt rồi nhỉ, vậy để hôm khác vậy."
lang_multi_text.db,MultiText,Guide_YFSH_16_16,对了，差点忘了，还有这些报酬，请你们务必收下。,"Ah, almost forgot. Here’s your compensation. Please, accept it.","À đúng rồi, suýt quên, còn thù lao nữa, các cháu nhận giúp ta nhé."
lang_multi_text.db,MultiText,Guide_YFSH_16_17,恭敬不如从命。,If you insist.,Vậy cháu xin nhận.
lang_multi_text.db,MultiText,Guide_YFSH_16_18,直接拿就行？,Really? Just take it?,Cứ lấy thôi sao?
lang_multi_text.db,MultiText,Guide_YFSH_16_19,可以，很爽快！下次找你们帮忙，我也会给足报酬的，有来才有往嘛！,"Good! Next time I ask for your help, I’ll also pay you a decent sum. It’s how connections are forged, isn’t it?","Được, sòng phẳng lắm! Lần sau nhờ các cháu giúp, ta cũng sẽ trả đủ thù lao, có qua có lại mà!"
lang_multi_text.db,MultiText,Guide_YFSH_16_2,绝对是拒绝吧。,It’s definitely a rejection.,Chắc chắn là từ chối rồi.
lang_multi_text.db,MultiText,Guide_YFSH_16_20,哎呀，客气什么，这是你们该得的。下次找你们帮忙，我也会给足报酬的，有来才有往嘛。,"Take it, kid. You’ve earned it. Next time I ask for your help, I’ll also pay you a decent sum. It’s how connections are forged, isn’t it?","Ôi khách sáo gì, đây là các cháu xứng đáng được nhận. Lần sau nhờ các cháu giúp, ta cũng sẽ trả đủ thù lao, có qua có lại mà."
lang_multi_text.db,MultiText,Guide_YFSH_16_21,天色不早了，你们也累了一天了，早点休息啊！,You’ve both worked hard today. Hurry home and rest up! Thank you!,"Trời tối rồi, các cháu cũng mệt cả ngày rồi, nghỉ ngơi sớm nhé!"
lang_multi_text.db,MultiText,Guide_YFSH_16_3,她没有收下我的夜息香……,She didn’t accept my Noctemint...,Bà ấy không nhận Dạ Tức Hương của ta...
lang_multi_text.db,MultiText,Guide_YFSH_16_4,景烛爷爷应该很难过吧。,Grandpa Jingzhu must be very upset.,Ông Cảnh Chúc chắc buồn lắm nhỉ.
lang_multi_text.db,MultiText,Guide_YFSH_16_5,是吧，连我都跟着有点难过了……,"Yeah, that's a bit of a bummer. I'm feeling a little down about it too...","Ừ nhỉ, ngay cả tớ cũng thấy buồn lây..."
lang_multi_text.db,MultiText,Guide_YFSH_16_6,景烛爷爷，要不要我们陪你散散心？吃点东西？我知道有家冒菜很好吃——,"Hey, Grandpa Jingzhu, how about we shake off the blues with a stroll? Or maybe grab a bite to eat? I know a place that serves great Maocai, spicy but delicious!","Ông Cảnh Chúc ơi, hay mình đi dạo cho khuây khỏa? Ăn gì đó đi? Cháu biết có quán mì cay rất ngon..."
lang_multi_text.db,MultiText,Guide_YFSH_16_7,难过？没有的事！,"I’m not disheartened, not in the slightest!",Buồn á? Không có chuyện đó!
lang_multi_text.db,MultiText,Guide_YFSH_16_8,我刚才翻来覆去品味凌寒说的话，终于悟了！,"I’ve been reflecting on Linghan’s words, and it’s become clear to me.","Ta vừa ngẫm đi ngẫm lại lời Lăng Hàn nói, cuối cùng đã ngộ ra rồi!"
lang_multi_text.db,MultiText,Guide_YFSH_16_9,她是在暗示我，声骸已经够威风了，但徒有其表可不行，关键在于进一步的精心栽培。,She wasn’t rejecting me. She was urging me to nurture the Echoes with care.,"Bà ấy đang ngầm ý bảo ta, Thanh Hài đã đủ oai phong rồi, nhưng chỉ đẹp bề ngoài thôi thì không được, quan trọng là phải chăm bồi thêm nữa."
lang_multi_text.db,MultiText,Guide_YFSH_17_1,嗨，漂泊者，你还记得景烛爷爷不？,"Hey there, Rover! Remember Grandpa Jingzhu?","Này, Lữ Khách, cậu còn nhớ ông Cảnh Chúc không?"
lang_multi_text.db,MultiText,Guide_YFSH_17_10,好呀，等你有空了，来训练场附近找我们吧。,That’s fine. Swing by the training grounds when you’ve got a sec.,"Được thôi, khi nào rảnh thì đến gần sân tập tìm bọn tớ nhé."
lang_multi_text.db,MultiText,Guide_YFSH_17_2,记得。,Of course.,Nhớ chứ.
lang_multi_text.db,MultiText,Guide_YFSH_17_3,谁？,Who?,Ai cơ?
lang_multi_text.db,MultiText,Guide_YFSH_17_4,没错没错，就是那个……最美不过夕阳红。,"Yep, the one who said that “my-unwavering-love” thing.","Đúng đúng, chính là ông ấy... ""đẹp nhất là hoàng hôn tuổi già"" ấy."
lang_multi_text.db,MultiText,Guide_YFSH_17_5,就是那个……最美不过夕阳红，想起来了吗？,"The one who said that ""my-unwavering-love"" thing. Ringing any bells now?","Chính là ông... ""đẹp nhất là hoàng hôn tuổi già"" ấy, nhớ ra chưa?"
lang_multi_text.db,MultiText,Guide_YFSH_17_6,刚刚我碰到他了，他还拜托咱俩抓声骸呢……我就想，帮人帮到底嘛！,"So, I ran into him earlier, and he needs our help in snagging Echoes again. Hence, the call.","Vừa nãy tớ gặp ông ấy, ông ấy lại nhờ hai đứa mình bắt Thanh Hài nữa... Tớ nghĩ, giúp người thì giúp cho trót!"
lang_multi_text.db,MultiText,Guide_YFSH_17_7,可以啊。,"Sure, why not?",Được thôi.
lang_multi_text.db,MultiText,Guide_YFSH_17_8,等我有空。,When I have time.,Khi nào rảnh nhé.
lang_multi_text.db,MultiText,Guide_YFSH_17_9,好呀好呀，我们在训练场附近等你。,"Awesome! We’ll catch you near the training grounds, then.","Tốt tốt, bọn tớ đợi cậu ở gần sân tập nhé."
lang_multi_text.db,MultiText,Guide_YFSH_18_1,这下人齐了！景烛爷爷，说说你的计划吧。,"Now that we’re all here, Grandpa Jingzhu, what’s the plan?","Người đến đông đủ rồi! Ông Cảnh Chúc ơi, nói kế hoạch của ông đi."
lang_multi_text.db,MultiText,Guide_YFSH_18_10,那么接下来，咱们就去好好练练这声骸！,"Alright then, let’s set to sharpening these giant scythes!","Vậy thì tiếp theo, chúng ta đi luyện tập Thanh Hài thôi!"
lang_multi_text.db,MultiText,Guide_YFSH_18_11,唔……说到训练声骸的地方……,Um... Speaking of the Echo training grounds...,Ừm... Nói đến chỗ luyện Thanh Hài thì...
lang_multi_text.db,MultiText,Guide_YFSH_18_12,那就是严彦教官的训练场了！巡尉结业考核的时候我去过一次……如果可以，真不想去第二次啊。,"Ah, that’d be Instructor Yhan’s training grounds! I’ve been there before for the Patroller Graduation Assessment. Honestly, if I can help it, I’d rather not go for round two.","Đó chính là trường huấn luyện của giáo quan Nghiêm Ngạn! Lần thi tốt nghiệp tuần úy cháu đã đến đó một lần rồi... Nếu được, thật sự không muốn đến lần thứ hai."
lang_multi_text.db,MultiText,Guide_YFSH_18_13,咳咳，不过今天有{PlayerName}一起，应该会顺利一些吧？,"Ahem, but with {PlayerName} by our side today, it won’t be so nerve-wracking, right?","Khụ khụ, nhưng hôm nay có {PlayerName} cùng đi, chắc sẽ suôn sẻ hơn chứ nhỉ?"
lang_multi_text.db,MultiText,Guide_YFSH_18_14,……畏首畏尾可不是今巡尉的作风！我带路，冲了！,Being timid doesn’t fit being a Patroller! Follow my lead. Let’s roll!,"...Rụt rè thì không phải tác phong của tuần úy! Tôi dẫn đường, xông thôi!"
lang_multi_text.db,MultiText,Guide_YFSH_18_2,上次一别后，我一直在琢磨凌寒说的那些话，可谓是收获颇丰啊！,"Since our last parting, I’ve been pondering over Linghan’s words, and they’ve offered me a new perspective!","Sau lần gặp trước, ta cứ suy nghĩ mãi về những lời Lăng Hàn nói, quả thật thu hoạch rất nhiều!"
lang_multi_text.db,MultiText,Guide_YFSH_18_3,“可不是有个威风的声骸就能横扫四方，虚有其表，没用，没用！”,"“If you’re aiming to become an Echo Master, you can’t judge an Echo solely from its appearance. Take this Carapace, for instance. Despite its imposing scythes, it may not what it seems.”","""Đâu phải có Thanh Hài oai phong là có thể tung hoành bốn phương, chỉ có vẻ ngoài thôi, vô dụng, vô dụng!"""
lang_multi_text.db,MultiText,Guide_YFSH_18_4,她肯定是嫌弃咱们的声骸只有表面威风，不够锋利实用。,"She believed that the Scythes are only imposing on the surface, yet lacking in practicality and sharpness as weapons.","Bà ấy chắc chắn là chê Thanh Hài của chúng ta chỉ oai phong bề ngoài, không đủ sắc bén thực dụng."
lang_multi_text.db,MultiText,Guide_YFSH_18_5,我敢肯定，只要我把声骸锻炼得炉火纯青，凌寒就会收下我的夜息香。,"I’m sure if I can hone these scythes to blade-like sharpness, Linghan will gladly accept my Noctemint.","Ta dám chắc, chỉ cần ta luyện Thanh Hài đến mức tinh thông, Lăng Hàn sẽ nhận bông Dạ Tức Hương của ta."
lang_multi_text.db,MultiText,Guide_YFSH_18_6,真的吗？,Really?,Thật sao?
lang_multi_text.db,MultiText,Guide_YFSH_18_7,这次一定？,Are you sure this time?,Lần này chắc chắn chứ?
lang_multi_text.db,MultiText,Guide_YFSH_18_8,实践出真知嘛，试试就知道了。,One improves with practice. We’ll know the answer once I try.,"Thực hành mới biết kết quả, thử rồi sẽ rõ thôi."
lang_multi_text.db,MultiText,Guide_YFSH_18_9,咳咳，什么一定不一定的，这次不行还有下次嘛。,"Ahem, life is full of uncertainties. If I fail this time, there’s always another chance!","Khụ khụ, chắc chắn hay không thì lần này không được còn có lần sau mà."
lang_multi_text.db,MultiText,Guide_YFSH_19_1,听说严彦那小子现在都成魔鬼教官了，你们可得悠着点。,I’ve heard rumors that Yhan has turned into quite the strict instructor. You’d better take care.,"Nghe nói thằng nhóc Nghiêm Ngạn giờ đã thành giáo quan quỷ dữ rồi, các ngươi cẩn thận đấy."
lang_multi_text.db,MultiText,Guide_YFSH_19_2,里面有不少晚辈当年是我的手下败将，老头子我就不进去自讨没趣了，哈哈。,"There are quite a few juniors in there who were once beaten hard by me, haha! So, I’ll refrain from joining you and spoiling their spirits.","Trong đó có không ít đàn em năm xưa từng thua dưới tay ta, lão già này vào làm gì cho mất vui, haha."
lang_multi_text.db,MultiText,Guide_YFSH_19_3,说着说着就到了……快去吧，祝你们顺利！,Here we are. Go on in. Wish you good luck!,"Nói chuyện một lát là đến nơi rồi... Vào nhanh đi, chúc các ngươi thuận lợi!"
lang_multi_text.db,MultiText,Guide_YFSH_1_1,炽霞在和一位老大爷说话，先不打扰他们了。,Chixia is talking to someone. Come back when they’re done talking.,"Xích Hà đang nói chuyện với một ông cụ, đừng làm phiền họ vội."
lang_multi_text.db,MultiText,Guide_YFSH_1_10,哎……但是我的声骸嘛……喏，就是这霜寒陆龟，圆头圆脑的，看着一点都不威风啊。,"Sadly, I only have a Hoartoise. Round face, round head. Far from impressive.","Hà... nhưng Thanh Hài của tôi thì... đây, con Sương Hàn Lục Quy này, đầu tròn mặt tròn, nhìn chẳng oai phong gì cả."
