db_file,table_name,id,zh,en,vi
lang_multi_text.db,MultiText,RiskHarvest_InstanceToppoint,最高战略数据：{0},Highest Tactic Points: {0},Dữ liệu chiến thuật cao nhất: {0}
lang_multi_text.db,MultiText,RiskHarvest_LV,<color=Highlight>LV.{0}</color>,<color=Highlight>Lv. {0}</color>,<color=Highlight>Lv. {0}</color>
lang_multi_text.db,MultiText,RiskHarvest_Monsterpoint,战略数据,Tactic Points,Dữ liệu chiến thuật
lang_multi_text.db,MultiText,RiskHarvest_PointTap,数据奖励,Data Rewards,Phần thưởng dữ liệu
lang_multi_text.db,MultiText,RiskHarvest_Score,本关总计获得战略数据,Tactic Points obtained in this stage,Tổng dữ liệu chiến thuật đạt được trong màn này
lang_multi_text.db,MultiText,RiskHarvest_Scorelimit,本关获得战略数据已达上限,The number of Tactic Points obtained in this challenge is maxed.,Dữ liệu chiến thuật nhận được trong màn này đã đạt giới hạn
lang_multi_text.db,MultiText,RiskHarvest_StarRewardTap,阶段奖励,Stage Rewards,Phần thưởng giai đoạn
lang_multi_text.db,MultiText,RiskHarvest_Timepoint,时间折算数据,Time Bonus Points,Dữ liệu quy đổi thời gian
lang_multi_text.db,MultiText,RiskHarvest_TitleUnlock,???,???,???
lang_multi_text.db,MultiText,RiskHarvest_TotleScore,累计获得战略数据：{0},Total Tactic Points Obtained: {0},Tổng dữ liệu chiến lược đạt được: {0}
lang_multi_text.db,MultiText,RiskHarvest_Unlock,前一关战略数据{0}解锁,Reach {0} Tactic Points in the previous challenge to unlock,Đạt {0} dữ liệu chiến lược ở màn trước để mở khóa
lang_multi_text.db,MultiText,RiskHarvest_buffDesc_10,dnt/移速增加,Increase movement speed.,dnt/Tăng tốc độ di chuyển
lang_multi_text.db,MultiText,RiskHarvest_buffDesc_1001,"移速提高{0}；
角色进入冲刺状态时，在周围会形成【旋风】，持续{1}秒或停止移动时爆发，造成范围伤害，冷却时间{2}秒。
释放共鸣解放或累计击败{3}个敌人时，重置【风暴矩阵】的冷却时间。
洛可可触发【风暴矩阵】时，【旋风】的伤害倍率额外提升。","Movement speed is increased by {0}.
While dashing, a Cyclone is generated around the Resonator for {1}s. It explodes when the Resonator stops moving, dealing AoE DMG. This effect has a cooldown of {2}s.
After casting Resonance Liberation or defeating <SapTag=3>{3}</SapTag> {Cus:Sap,S=target P=targets SapTag=3}, the cooldown of Storm Matrix is reset.
When Roccia triggers Storm Matrix, the Cyclone's DMG Multiplier is additionally increased.","Tốc độ di chuyển tăng {0}.
Khi nhân vật chạy nước rút, sẽ tạo ra [Toàn Phong] xung quanh, kéo dài {1} giây hoặc phát nổ khi ngừng di chuyển, gây sát thương phạm vi. Thời gian hồi chiêu {2} giây.
Khi thi triển Giải Phóng Cộng Hưởng hoặc tích lũy Đánh Bại {3} kẻ địch, thời gian hồi chiêu của [Ma Trận Bão Tố] được đặt lại.
Khi Roccia kích hoạt [Ma Trận Bão Tố], hệ số sát thương của [Toàn Phong] được tăng thêm."
lang_multi_text.db,MultiText,RiskHarvest_buffDesc_1002,"下落攻击、闪避成功、逆势回击成功时，会制造1个持续{0}秒的【旋风】，冷却时间为{1}秒；
【旋风】触发时会给自身添加一个持续{2}秒的护盾，重复触发可刷新护盾。","Using Plunge Attacks, successful Dodges, and successful Dodge Counters generate 1 Cyclone that lasts for {0}s, with a cooldown of {1}s.
Triggering this effect grants a shield of {2}s to the active Resonator. Repeated triggers refresh the shield.","Khi tấn công bổ nhào, Né Tránh thành công hoặc Phản Công thành công, tạo ra 1 [Toàn Phong] kéo dài {0} giây, thời gian hồi chiêu {1} giây.
Khi [Toàn Phong] kích hoạt, nhân vật nhận được khiên bảo vệ kéo dài {2} giây. Kích hoạt lại sẽ làm mới khiên."
lang_multi_text.db,MultiText,RiskHarvest_buffDesc_1003,冲刺时，每秒叠加1层【狂涌】；每层【狂涌】使角色攻击力提高{0}，湮灭伤害提高{1}，持续{2}秒，叠加上限{3}层，重复叠加时不会刷新持续时间。,"While dashing, 1 stack of Surging Might is granted per second. Each stack of Surging Might increases the active Resonator's ATK by {0}, Havoc DMG by {1}, lasting for {2}s. This effect stacks up to <SapTag=3>{3}</SapTag> {Cus:Sap,S=time P=times SapTag=3}. Gaining a new stack doesn't extend the effect duration.","Khi chạy nước rút, mỗi giây cộng dồn 1 tầng [Cuồng Dũng]; mỗi tầng [Cuồng Dũng] tăng tấn công của nhân vật thêm {0}, tăng sát thương Hủy Diệt thêm {1}, kéo dài {2} giây, tối đa {3} tầng. Cộng dồn thêm tầng không làm mới thời gian hiệu lực."
lang_multi_text.db,MultiText,RiskHarvest_buffDesc_1004,空中施放普攻、闪避成功、逆势回击成功时，获得{0}层【狂涌】，【狂涌】的增益效果翻倍。,"Using Basic Attacks in mid-air, successful Dodges, and successful Dodge Counters grant <SapTag=0>{0}</SapTag> {Cus:Sap,S=stack P=stacks SapTag=0} of Surging Might. The effect of Surging Might is doubled.","Khi tung Đánh Thường trên không, Né Tránh thành công hoặc Phản Công thành công, nhận {0} tầng [Cuồng Dũng]. Hiệu quả tăng cường của [Cuồng Dũng] được nhân đôi."
lang_multi_text.db,MultiText,RiskHarvest_buffDesc_1005,【旋风】额外爆发{0}次。,"Cyclone can additionally explode <SapTag=0>{0}</SapTag> {Cus:Sap,S=time P=times SapTag=0}.",[Toàn Phong] phát nổ thêm {0} lần.
lang_multi_text.db,MultiText,RiskHarvest_buffDesc_1011,角色施放变奏技能时，召唤【混沌地】攻击周围的目标，造成衍射伤害，持续{0}秒。受到攻击的目标将会被添加{1}层【风蚀效应】和【光噪效应】,"After casting Intro Skill, a Chaotic Land will be generated to attack the nearby targets, dealing Spectro DMG for {0}s. Targets attacked obtain <SapTag=1>{1}</SapTag> {Cus:Sap,S=stack P=stacks SapTag=1} of Aero Erosion and Spectro Frazzle.","Khi nhân vật thi triển Kỹ Năng Biến Tấu, triệu hồi [Vùng Hỗn Loạn] tấn công mục tiêu xung quanh, gây sát thương Quang Phổ, kéo dài {0} giây. Mục tiêu bị tấn công sẽ bị gán {1} tầng [Hiệu Ứng Phong Thực] và [Hiệu Ứng Quang Nhiễu]."
lang_multi_text.db,MultiText,RiskHarvest_buffDesc_1012,【混沌地】会为受到其伤害的目标添加【混沌】。受【混沌】影响的敌人在受到【风蚀效应】【光噪效应】造成的伤害时，额外受到{0}次【混沌爆破】伤害。,The Chaotic Land inflicts Chaos on targets upon hit. Targets affected by Chaos take {0} additional Chaotic Blast DMG when hit by Aero Erosion and Spectro Frazzle.,[Vùng Hỗn Loạn] sẽ gán trạng thái [Hỗn Loạn] lên mục tiêu bị trúng đòn. Kẻ địch chịu ảnh hưởng bởi [Hỗn Loạn] khi nhận sát thương từ [Hiệu Ứng Phong Thực] và [Hiệu Ứng Quang Nhiễu] sẽ chịu thêm {0} lần sát thương [Nổ Hỗn Loạn].
lang_multi_text.db,MultiText,RiskHarvest_buffDesc_1013,受【混沌】影响的敌人，每次受到【风蚀效应】【光噪效应】造成的伤害时，队伍中登场角色额外恢复10点协奏能量。,"Every time targets affected by Chaos are hit by Aero Erosion and Spectro Frazzle, the active Resonator recovers 10 additional Concerto Energy.","Mỗi lần kẻ địch chịu ảnh hưởng bởi [Hỗn Loạn] nhận sát thương từ [Hiệu Ứng Phong Thực] và [Hiệu Ứng Quang Nhiễu], nhân vật đang ra trận hồi phục thêm 10 điểm năng lượng Hiệp Tấu."
lang_multi_text.db,MultiText,RiskHarvest_buffDesc_1014,受【混沌地】影响的敌人，防御力降低{0}。,Targets affected by the Chaotic Land have their DEF reduced by {0}.,Kẻ địch chịu ảnh hưởng bởi [Vùng Hỗn Loạn] bị giảm phòng thủ {0}.
lang_multi_text.db,MultiText,RiskHarvest_buffDesc_1015,受【混沌地】影响的敌人，【风蚀效应】与【光噪效应】对其造成的伤害倍率提升{0}。,Aero Erosion and Spectro Frazzle's DMG Multiplier is increased by {0} against targets affected by the Chaotic Land.,Kẻ địch chịu ảnh hưởng bởi [Vùng Hỗn Loạn] sẽ nhận hệ số sát thương từ [Hiệu Ứng Phong Thực] và [Hiệu Ứng Quang Nhiễu] tăng thêm {0}.
lang_multi_text.db,MultiText,RiskHarvest_buffDesc_1016,在【混沌地】的角色每秒恢复生命值上限{0}的生命。,Resonators within the Chaotic Land recover HP equal to {0} of their max HP per second.,Nhân vật trong [Vùng Hỗn Loạn] mỗi giây hồi phục lượng HP bằng {0} HP tối đa.
lang_multi_text.db,MultiText,RiskHarvest_buffDesc_1017,在【混沌地】的角色每秒攻击力提升{0}，持续{1}秒，该效果可叠加{2}层。,"Resonators within the Chaotic Land have their ATK increased by {0} per second for {1}s. This effect can stack up to <SapTag=2>{2}</SapTag> {Cus:Sap,S=time P=times SapTag=2}.","Nhân vật trong [Vùng Hỗn Loạn] mỗi giây tăng tấn công thêm {0}, kéo dài {1} giây, hiệu ứng này cộng dồn tối đa {2} tầng."
lang_multi_text.db,MultiText,RiskHarvest_buffDesc_1021,角色在空中攻击命中目标时，额外召唤一个【陨石】，冷却时间为{0}秒。,"When the Resonator hits a target with Mid-air Attack, a meteorite is additionally summoned, with a cooldown of {0}s.","Khi nhân vật tấn công trên không trúng mục tiêu, triệu hồi thêm 1 [Vẫn Thạch], thời gian hồi chiêu {0} giây."
lang_multi_text.db,MultiText,RiskHarvest_buffDesc_1022,【陨石】命中敌人后将形成一片【焚烧场】，持续{0}秒，对其中的敌人每{1}秒造成{2}次伤害。,"Upon hit, the meteorite generates a Burning Field for {0}s, dealing damage <SapTag=2>{2}</SapTag> {Cus:Sap,S=time P=times SapTag=2} every {1}s to the targets within the area.","[Vẫn Thạch] trúng kẻ địch sẽ tạo ra [Bãi Thiêu Đốt] kéo dài {0} giây, mỗi {1} giây gây {2} lần sát thương cho kẻ địch trong phạm vi."
lang_multi_text.db,MultiText,RiskHarvest_buffDesc_1023,处于空中时，每经过{0}秒伤害提高{1}，该效果可叠加{2}层，回到地面后将清除所有层数。,"While in mid-air, the Resonator's DMG is increased by {1} every {0}s, stacking up to <SapTag=2>{2}</SapTag> {Cus:Sap,S=time P=times SapTag=2}. All stacks are removed when the Resonator lands on the ground.","Khi ở trên không, mỗi {0} giây sát thương tăng thêm {1}, hiệu ứng này cộng dồn tối đa {2} tầng. Khi tiếp đất, toàn bộ tầng sẽ bị xóa."
lang_multi_text.db,MultiText,RiskHarvest_buffDesc_1024,【焚烧场】伤害提高{0}，召唤的【陨石】数量增加{1}个。,"The damage of Burning Field is increased by {0}, and the number of the summoned meteorite is increased by {1}.","Sát thương [Bãi Thiêu Đốt] tăng {0}, số lượng [Vẫn Thạch] triệu hồi tăng thêm {1}."
lang_multi_text.db,MultiText,RiskHarvest_buffDesc_1025,【焚烧场】上的敌人防御降低{0}。,DEF of targets within the Burning Field is reduced by {0}.,Kẻ địch trong [Bãi Thiêu Đốt] bị giảm phòng thủ {0}.
lang_multi_text.db,MultiText,RiskHarvest_buffDesc_1026,【陨石】每次命中敌人时，角色将获得最大生命值{0}的护盾，该效果每{1}秒可触发一次。,"Every time the meteorite hits a target, the active Resonator is granted a shield equal to {0} of their max HP, triggered once every {1}s.","Mỗi lần [Vẫn Thạch] trúng kẻ địch, nhân vật nhận được khiên bằng {0} HP tối đa. Hiệu ứng này kích hoạt mỗi {1} giây một lần."
lang_multi_text.db,MultiText,RiskHarvest_buffDesc_1027,【陨石】造成伤害额外提高{0}。,The damage of the meteorite is additionally increased by {0}.,Sát thương [Vẫn Thạch] tăng thêm {0}.
lang_multi_text.db,MultiText,RiskHarvest_buffDesc_1031,角色普攻命中敌人或造成普攻伤害时，额外召唤【坠星】，该效果每{0}秒可触发一次。,"When the Resonator hits a target with Basic Attack or deals Basic Attack DMG, a Starfall is additionally summoned, triggered once every {0}s.","Khi Đánh Thường trúng kẻ địch hoặc gây sát thương Đánh Thường, triệu hồi thêm [Sao Rơi]. Hiệu ứng này kích hoạt mỗi {0} giây một lần."
lang_multi_text.db,MultiText,RiskHarvest_buffDesc_1032,【坠星】命中敌人时，将获得一层层数，叠加至{0}层时，召唤【轰雷】。,"Hitting a target with Starfall grants one stack. With <SapTag=0>{0}</SapTag> {Cus:Sap,S=stack P=stacks SapTag=0}, Thunder Strike is summoned.","Khi [Sao Rơi] trúng kẻ địch, nhận được 1 tầng cộng dồn. Khi đạt {0} tầng, triệu hồi [Sấm Chấn]."
lang_multi_text.db,MultiText,RiskHarvest_buffDesc_1033,被【轰雷】命中的敌人防御力降低{0}。,Targets hit by Thunder Strike have their DEF reduced by {0}.,Kẻ địch bị [Sấm Chấn] trúng sẽ bị giảm phòng thủ {0}.
lang_multi_text.db,MultiText,RiskHarvest_buffDesc_1034,角色耐力处于上限时，防御力、攻击力提升{0}，暴击伤害提升{1}。,"When Resonators have max STA, their DEF and ATK are increased by {0} and Crit. Rate by {1}.","Khi thể lực nhân vật ở mức tối đa, phòng thủ và tấn công tăng {0}, sát thương bạo kích tăng {1}."
lang_multi_text.db,MultiText,RiskHarvest_buffDesc_1035,角色施放共鸣解放时，回复200点耐力；闪避反击命中敌人时，回复100点耐力。,Casting Resonance Liberation recovers 200 STA. Hitting a target with Dodge Counter recovers 100 STA.,"Khi thi triển Giải Phóng Cộng Hưởng, hồi phục 200 điểm thể lực; khi Phản Công né tránh trúng kẻ địch, hồi phục 100 điểm thể lực."
lang_multi_text.db,MultiText,RiskHarvest_buffDesc_1036,角色处于冲刺状态时，自身每秒回复{0}点共鸣能量，并每秒获得{1}层【速能】，每层提高全队角色{2}暴击率，可叠加{3}层，持续{4}秒。,"While dashing, Resonators recover {0} Resonance Energy per second and gains <SapTag=1>{1}</SapTag> {Cus:Sap,S=stack P=stacks SapTag=1} of Energy Surge. Each stack increases all team members' Crit. Rate by {2} for {4}s, stacking up to <SapTag=3>{3}</SapTag> {Cus:Sap,S=time P=times SapTag=3}.","Khi đang chạy nước rút, mỗi giây hồi phục {0} năng lượng cộng hưởng và nhận {1} tầng [Tốc Năng]. Mỗi tầng tăng {2} tỷ lệ bạo kích cho toàn đội, cộng dồn tối đa {3} tầng, kéo dài {4} giây."
lang_multi_text.db,MultiText,RiskHarvest_buffDesc_1037,全队雷属性伤害加深{0}。,All team members have their Electro DMG Amplified by {0}.,Tăng {0} sát thương Điện Từ cho toàn đội.
lang_multi_text.db,MultiText,RiskHarvest_buffDesc_1041,全队角色攻击力提升{0}。,All team members' ATK is increased by {0}.,Tăng {0} tấn công cho toàn đội.
lang_multi_text.db,MultiText,RiskHarvest_buffDesc_1042,全属性伤害加成提升{0}。,Attribute DMG Bonus is increased by {0}.,Tăng {0} sát thương cộng thêm toàn thuộc tính.
lang_multi_text.db,MultiText,RiskHarvest_buffDesc_1043,角色暴击率提升{0}，暴击伤害提升{1}。,Resonators' Crit. Rate is increased by {0} and Crit DMG by {1}.,"Tỷ lệ bạo kích tăng {0}, sát thương bạo kích tăng {1}."
lang_multi_text.db,MultiText,RiskHarvest_buffDesc_1044,角色复活后{0}秒内，攻击力提升{1}，暴击率提升{2}，暴击伤害提升{3}。,"Upon revival, Resonators' ATK is increased by {1}, Crit. Rate by {2}, and Crit. DMG by {3} for {0}s.","Trong {0} giây sau khi hồi sinh, tấn công tăng {1}, tỷ lệ bạo kích tăng {2}, sát thương bạo kích tăng {3}."
lang_multi_text.db,MultiText,RiskHarvest_buffDesc_1045,全属性伤害加深{0}。,Attribute DMG is Amplified by {0}.,Tăng {0} sát thương toàn thuộc tính.
lang_multi_text.db,MultiText,RiskHarvest_buffDesc_1046,角色每{0}秒攻击力提升{1}，最多叠加{2}层，角色死亡后清除。,"Resonators' ATK is increased by {1} every {0}s, stacking up to <SapTag=2>{2}</SapTag> {Cus:Sap,S=time P=times SapTag=2}. All stacks are removed after Resonators are downed.","Mỗi {0} giây, tấn công tăng {1}, cộng dồn tối đa {2} tầng. Hiệu ứng bị xóa khi nhân vật tử trận."
lang_multi_text.db,MultiText,RiskHarvest_buffDesc_1047,角色每{0}秒暴击伤害提升{1}，最多叠加{2}层，角色死亡后清除。,"Resonators' Crit. DMG is increased by {1} every {0}s, stacking up to <SapTag=2>{2}</SapTag> {Cus:Sap,S=time P=times SapTag=2}. All stacks are removed after Resonators are downed.","Mỗi {0} giây, sát thương bạo kích tăng {1}, cộng dồn tối đa {2} tầng. Hiệu ứng bị xóa khi nhân vật tử trận."
lang_multi_text.db,MultiText,RiskHarvest_buffDesc_1048,获得{0}点战略数据。,Obtain {0} Tactic Points.,Nhận {0} điểm dữ liệu chiến thuật.
lang_multi_text.db,MultiText,RiskHarvest_buffDesc_1049,获得{0}点战略数据。,Obtain {0} Tactic Points.,Nhận {0} điểm dữ liệu chiến thuật.
lang_multi_text.db,MultiText,RiskHarvest_buffDesc_11,dnt/全队攻击力增加600,Increase ATK by 600 for all team members.,dnt/Tăng 600 tấn công cho toàn đội
lang_multi_text.db,MultiText,RiskHarvest_buffDesc_110,dnt/钩锁技能CD减少50%,Grapple Cooldown is reduced by 50%.,dnt/Giảm 50% thời gian hồi kỹ năng móc câu
lang_multi_text.db,MultiText,RiskHarvest_buffDesc_111,角色普攻额外回复自身{0}点协奏能量，该效果存在{1}秒冷却时间。,Basic Attack additionally restores {0} Concerto Energy. This effect has a Cooldown of {1}s.,Đánh Thường hồi phục thêm {0} năng lượng Hiệp Tấu. Hiệu ứng có thời gian hồi {1} giây.
lang_multi_text.db,MultiText,RiskHarvest_buffDesc_112,角色每次施放钩索后{0}秒内，自身普攻伤害提升{1}，可以叠加{2}层。,"Using Grapple increases the Resonator's Basic Attack DMG by {1} for {0}s, stacking up to {2} time(s).","Trong {0} giây sau khi sử dụng móc câu, sát thương Đánh Thường tăng {1}, cộng dồn tối đa {2} tầng."
lang_multi_text.db,MultiText,RiskHarvest_buffDesc_113,角色每次施放变奏技能后{0}秒内，全队攻击力提升{1}，可以叠加{2}层。,"Casting Intro Skill increases all team members' ATK by {1} for {0}s, stacking up to {2} time(s).","Trong {0} giây sau khi thi triển kỹ năng Biến Tấu, tấn công toàn đội tăng {1}, cộng dồn tối đa {2} tầng."
lang_multi_text.db,MultiText,RiskHarvest_buffDesc_114,全队变奏技能造成伤害提升{0}，施放变奏技能后{1}秒内全队暴击率提升{2}。,"All team members' Intro Skill DMG increases by {0}. After casting Intro Skill, all team members' Crit. Rate increases by {2} for {1}s.","Sát thương kỹ năng Biến Tấu toàn đội tăng {0}. Trong {1} giây sau khi thi triển kỹ năng Biến Tấu, tỷ lệ bạo kích toàn đội tăng {2}."
lang_multi_text.db,MultiText,RiskHarvest_buffDesc_115,角色存在护盾时，自身攻击力、防御力提升{0}。,Having a shield increases ATK and DEF by {0}.,"Khi có khiên, tấn công và phòng thủ bản thân tăng {0}."
lang_multi_text.db,MultiText,RiskHarvest_buffDesc_1151,角色处于空中超过{0}秒时，下落攻击落地后，将在地面形成一个【小型冰川】。,"After remaining airborne for more than {0}s, Resonators cast a Plunging Attack and land on the ground, creating a small glacier upon landing.","Khi nhân vật ở trên không hơn {0} giây, sau khi tấn công bổ nhào chạm đất sẽ tạo ra một [Băng Hà Nhỏ] trên mặt đất."
lang_multi_text.db,MultiText,RiskHarvest_buffDesc_1152,角色处于空中超过{0}秒时，下落攻击落地后，将在地面形成一个【中型冰川】。,"After remaining airborne for more than {0}s, Resonators cast a Plunging Attack and land on the ground, creating a medium glacier upon landing.","Khi nhân vật ở trên không hơn {0} giây, sau khi tấn công bổ nhào chạm đất sẽ tạo ra một [Băng Hà Vừa] trên mặt đất."
lang_multi_text.db,MultiText,RiskHarvest_buffDesc_1153,角色处于空中超过{0}秒时，下落攻击落地后，将在地面形成一个【大型冰川】。,"After remaining airborne for more than {0}s, Resonators cast a Plunging Attack and land on the ground, creating a large glacier upon landing.","Khi nhân vật ở trên không hơn {0} giây, sau khi tấn công bổ nhào chạm đất sẽ tạo ra một [Băng Hà Lớn] trên mặt đất."
lang_multi_text.db,MultiText,RiskHarvest_buffDesc_1154,每{0}秒，队伍内每个角色获得一次复活自身的次数，可存储{1}次。,"All Resonators in the team gain one revival attempt every {0}s, up to <SapTag=1>{1}</SapTag> {Cus:Sap,S=time P=times SapTag=1}.","Mỗi {0} giây, mỗi nhân vật trong đội nhận một lượt hồi sinh, lưu trữ tối đa {1} lượt."
lang_multi_text.db,MultiText,RiskHarvest_buffDesc_1155,每{0}秒，全队角色获得一个相当于自身生命上限{1}的护盾。,All Resonators in the team gain a shield equal to {1} of their max HP every {0}s.,"Mỗi {0} giây, toàn đội nhận được khiên bằng {1} HP tối đa của bản thân."
lang_multi_text.db,MultiText,RiskHarvest_buffDesc_1156,角色攻击命中时，{0}概率回复全队{1}生命；{2}的概率回复全队{3}生命。,"When Resonators hit a target, there is a {0} chance to recover the HP of all Resonators in the team by {1}, and a {2} chance to recover all team members' HP by {3}.","Khi tấn công trúng, có {0} xác suất hồi phục {1} HP cho toàn đội; có {2} xác suất hồi phục {3} HP cho toàn đội."
lang_multi_text.db,MultiText,RiskHarvest_buffDesc_1157,施放变奏技能或共鸣解放时，额外回复自身{0}点协奏能量。,Casting Intro Skill or Resonance Liberation additionally recovers the active Resonator's Concerto Energy by {0}.,"Khi thi triển kỹ năng Biến Tấu hoặc Giải Phóng Cộng Hưởng, hồi phục thêm {0} năng lượng Hiệp Tấu cho bản thân."
lang_multi_text.db,MultiText,RiskHarvest_buffDesc_1158,施放变奏技能或共鸣解放时，额外回复自身{0}点共鸣能量。,Casting Intro Skill or Resonance Liberation additionally recovers the active Resonator's Resonance Energy by {0}.,"Khi thi triển kỹ năng Biến Tấu hoặc Giải Phóng Cộng Hưởng, hồi phục thêm {0} năng lượng Cộng Hưởng cho bản thân."
lang_multi_text.db,MultiText,RiskHarvest_buffDesc_1159,角色攻击命中时，{0}概率额外回复全队{1}点协奏能量，{2}概率回复全队{3}点协奏能量。,"When Resonators hit a target, there is a {0} chance to additionally recover the Concerto Energy of all Resonators in the team by {1}, and a {2} chance to recover the Concerto Energy of all Resonators in the team by {3}.","Khi tấn công trúng, có {0} xác suất hồi phục thêm {1} năng lượng Hiệp Tấu cho toàn đội; có {2} xác suất hồi phục {3} năng lượng Hiệp Tấu cho toàn đội."
lang_multi_text.db,MultiText,RiskHarvest_buffDesc_116,角色施放钩索时，自身添加攻击力{0}的护盾，该效果存在{1}秒冷却时间。,Using Grapple grants a shield with durability equal to {0} of ATK. This effect has a Cooldown of {1}s.,"Khi nhân vật sử dụng móc câu, nhận khiên bằng {0} tấn công. Hiệu ứng này có thời gian hồi {1} giây."
lang_multi_text.db,MultiText,RiskHarvest_buffDesc_1160,当前角色击败敌人后，伤害提升{0}，可叠加{1}层，角色死亡后清空层数。,"When the active Resonator defeats the target, DMG is increased by {0}, stacking up to <SapTag=1>{1}</SapTag> {Cus:Sap,S=time P=times SapTag=1}. All stacks are removed when Resonators are downed.","Khi nhân vật hiện tại Đánh Bại kẻ địch, sát thương tăng {0}, cộng dồn tối đa {1} tầng. Tầng sẽ bị xóa khi nhân vật tử vong."
lang_multi_text.db,MultiText,RiskHarvest_buffDesc_117,dnt/暂无,Not available.,dnt/Chưa có
lang_multi_text.db,MultiText,RiskHarvest_buffDesc_118,dnt/暂无,Not available.,dnt/Chưa có
lang_multi_text.db,MultiText,RiskHarvest_buffDesc_12,dnt/全队伤害增加45%,Increase DMG by 45% for all team members.,dnt/Sát thương toàn đội tăng 45%
lang_multi_text.db,MultiText,RiskHarvest_buffDesc_1201,生命上限提升{0}。,Max HP is increased by {0}.,HP tối đa tăng {0}.
lang_multi_text.db,MultiText,RiskHarvest_buffDesc_1202,防御提升{0}。,DEF is increased by {0}.,Phòng thủ tăng {0}.
lang_multi_text.db,MultiText,RiskHarvest_buffDesc_1203,冷凝伤害抗性提升{0}。,Glacio RES is increased by {0}.,Kháng sát thương Ngưng Băng tăng {0}.
lang_multi_text.db,MultiText,RiskHarvest_buffDesc_1204,热熔伤害抗性提升{0}。,Fusion RES is increased by {0}.,Kháng sát thương Hỏa Liệt tăng {0}.
lang_multi_text.db,MultiText,RiskHarvest_buffDesc_1205,导电伤害抗性提升{0}。,Electro RES is increased by {0}.,Kháng sát thương Điện Từ tăng {0}.
lang_multi_text.db,MultiText,RiskHarvest_buffDesc_1206,气动伤害抗性提升{0}。,Aero RES is increased by {0}.,Kháng sát thương Khí Động tăng {0}.
lang_multi_text.db,MultiText,RiskHarvest_buffDesc_1207,衍射伤害抗性提升{0}。,Spectro RES is increased by {0}.,Kháng sát thương Quang Phổ tăng {0}.
lang_multi_text.db,MultiText,RiskHarvest_buffDesc_1208,湮灭伤害抗性提升{0}。,Havoc RES is increased by {0}.,Kháng sát thương Hủy Diệt tăng {0}.
