db_file,table_name,id,zh,en,vi
lang_multi_text.db,MultiText,LevelPlay_157900029_QuestScheduleSubTitle_157_11,用共鸣解放伤害击败1个敌人：{ScoreKill02} /1,Defeat 1 enemies with Resonance Liberation DMG: {ScoreKill02} /1,Dùng sát thương Giải Phóng Cộng Hưởng đánh bại 1 kẻ địch: {ScoreKill02} /1
lang_multi_text.db,MultiText,LevelPlay_157900029_QuestScheduleSubTitle_157_12,限时内击败所有敌人完成挑战,Defeat all enemies within the time limit,Đánh bại tất cả kẻ địch trong thời gian giới hạn để hoàn thành thử thách
lang_multi_text.db,MultiText,LevelPlay_157900029_QuestScheduleSubTitle_157_9,战斗等级达到S的时间多于8秒：{挑战1统计} /8,Reach Battle Rank S for more than 8s: {挑战1统计}/8,Thời gian đạt hạng chiến đấu S nhiều hơn 8 giây: {挑战1统计} /8
lang_multi_text.db,MultiText,LevelPlay_157900031_ChallengeFailMainText_157_4,挑战失败,Challenge Failed,Thử thách thất bại
lang_multi_text.db,MultiText,LevelPlay_157900031_QuestScheduleMainTitle_157_4,梦境节点 · 友谊地久天长,Dreamscape Node: Forever Friends,Nút Mộng Cảnh . Tình Bạn Vĩnh Cửu
lang_multi_text.db,MultiText,LevelPlay_157900031_QuestScheduleSubTitle_157_13,保持战斗等级在S以上连续6秒：{挑战1统计} /6,Reach and maintain Battle Rank S or above for 6s: {挑战1统计}/6,Duy trì cấp chiến đấu S trở lên liên tục 6 giây: {挑战1统计} /6
lang_multi_text.db,MultiText,LevelPlay_157900031_QuestScheduleSubTitle_157_14,使用4次变奏技能：{挑战2统计} /4,Use Intro Skill 4 times: {挑战2统计}/4,Sử dụng 4 lần kỹ năng Biến Tấu: {挑战2统计} /4
lang_multi_text.db,MultiText,LevelPlay_157900031_QuestScheduleSubTitle_157_15,被攻击少于10次：{挑战3统计} /10,Take less than 10 hits: {挑战3统计}/10,Bị tấn công ít hơn 10 lần: {挑战3统计}/10
lang_multi_text.db,MultiText,LevelPlay_157900031_QuestScheduleSubTitle_157_16,被攻击少于10次：10 /10,Take less than 10 hits: 10 /10,Bị tấn công ít hơn 10 lần: 10/10
lang_multi_text.db,MultiText,LevelPlay_157900031_QuestScheduleSubTitle_157_17,限时内击败所有敌人完成挑战,Defeat all enemies within the time limit,Đánh bại tất cả kẻ địch trong thời gian giới hạn để hoàn thành thử thách
lang_multi_text.db,MultiText,LevelPlay_157900032_ChallengeConditionMainText_157_4,守护梦境枢纽至挑战结束,Defend the Dreamscape Nexus throughout the challenge,Bảo vệ Đầu mối Mộng Cảnh cho đến khi thử thách kết thúc
lang_multi_text.db,MultiText,LevelPlay_157900032_ChallengeConditionSubText_157_4,击杀怪物加速时间流逝,Defeat enemies to accelerate time flow,Hạ gục quái vật để tăng tốc dòng chảy thời gian
lang_multi_text.db,MultiText,LevelPlay_157900032_ChallengeFailMainText_157_3,挑战失败,Challenge Failed,Thử thách thất bại
lang_multi_text.db,MultiText,LevelPlay_157900032_MissionCompleteMainText_157_5,梦境即将再次涌现...,The Dreamscape will soon emerge again...,Mộng cảnh sắp trỗi dậy một lần nữa...
lang_multi_text.db,MultiText,LevelPlay_157900032_MissionCompleteMainText_157_6,梦境的深层正在涌动...,The Dreamscape sways from deep within...,Tầng sâu mộng cảnh đang dậy sóng...
lang_multi_text.db,MultiText,LevelPlay_157900032_MissionCompleteMainText_157_7,梦魇即将来袭...,Nightmares are poised to strike...,Ác mộng sắp ập đến...
lang_multi_text.db,MultiText,LevelPlay_157900032_MissionCompleteMainText_157_8,梦境正在修复,The Dreamscape mends itself,Mộng cảnh đang tự phục hồi
lang_multi_text.db,MultiText,LevelPlay_157900032_MissionCompleteSubText_157_5,时间加快了流逝...,The flow of time quickens...,Thời gian trôi nhanh hơn...
lang_multi_text.db,MultiText,LevelPlay_157900032_MissionCompleteSubText_157_6,时间加快了流逝...,The flow of time quickens...,Thời gian trôi nhanh hơn...
lang_multi_text.db,MultiText,LevelPlay_157900032_MissionCompleteSubText_157_7,时间正在快速流逝...,Time passes like an arrow...,Thời gian đang trôi qua nhanh chóng...
lang_multi_text.db,MultiText,LevelPlay_157900032_MissionCompleteSubText_157_8,时间正在走向尽头...,Time marches to an end...,Thời gian đang dần đi đến hồi kết...
lang_multi_text.db,MultiText,LevelPlay_157900032_QuestScheduleMainTitle_157_3,水境的梦境枢纽完整度：{q_count},Nimbus Sanctum Dreamscape Nexus integrity: {q_count},Độ nguyên vẹn Đầu mối Mộng Cảnh Thủy Cảnh: {q_count}
lang_multi_text.db,MultiText,LevelPlay_157900032_QuestScheduleSubTitle_157_10,梦境枢纽完整度大于30%,Keep the Dreamscape Nexus Integrity above 30%,Độ nguyên vẹn Đầu mối Mộng Cảnh lớn hơn 30%
lang_multi_text.db,MultiText,LevelPlay_157900032_QuestScheduleSubTitle_157_11,梦境枢纽完整度大于60%,Keep the Dreamscape Nexus Integrity above 60%,Độ nguyên vẹn Đầu mối Mộng Cảnh lớn hơn 60%
lang_multi_text.db,MultiText,LevelPlay_157900032_QuestScheduleSubTitle_157_12,守护梦境枢纽完成挑战,Defend the Dreamscape Nexus to complete the challenge,Bảo vệ Đầu mối Mộng Cảnh để hoàn thành thử thách
lang_multi_text.db,MultiText,LevelPlay_157900032_QuestScheduleSubTitle_157_9,梦境枢纽不被摧毁,Save the Dreamscape Nexus from destruction,Đầu mối Mộng Cảnh không bị phá hủy
lang_multi_text.db,MultiText,LevelPlay_157900033_ChallengeConditionMainText_157_3,请不要被宝箱诱惑...,Resist the chest's temptation..,Xin đừng bị rương báu cám dỗ...
lang_multi_text.db,MultiText,LevelPlay_157900033_ChallengeFailMainText_157_3,挑战失败,Challenge Failed,Thử thách thất bại
lang_multi_text.db,MultiText,LevelPlay_157900033_QuestScheduleMainTitle_157_3,梦境节点 · 秘密珍藏,Dreamscape Node: Treasured Secrecy,Nút Mộng Cảnh . Bảo Tàng Bí Mật
lang_multi_text.db,MultiText,LevelPlay_157900033_QuestScheduleSubTitle_157_10,用逆势回击直接击败欺诈奇藏2次：{挑战2统计} /2,Use Counterattacks to defeat 2 Chest Mimics: {挑战2统计}/2,Dùng Phản Kích để trực tiếp đánh bại Kỳ Tàng Lừa Đảo 2 lần: {挑战2统计} /2
lang_multi_text.db,MultiText,LevelPlay_157900033_QuestScheduleSubTitle_157_11,挑战中没有角色死亡：{挑战3统计} /1,Have no downed Resonators throughout the challenge: {挑战3统计}/1,Không có nhân vật nào tử vong trong thử thách: {挑战3统计} /1
lang_multi_text.db,MultiText,LevelPlay_157900033_QuestScheduleSubTitle_157_12,挑战中没有角色死亡：1 /1,Have no downed Resonators throughout the challenge: 1 /1,Không có nhân vật nào tử vong trong thử thách: 1 /1
lang_multi_text.db,MultiText,LevelPlay_157900033_QuestScheduleSubTitle_157_13,限时内击败所有敌人完成挑战,Defeat all enemies within the time limit,Đánh bại tất cả kẻ địch trong thời gian giới hạn để hoàn thành thử thách
lang_multi_text.db,MultiText,LevelPlay_157900033_QuestScheduleSubTitle_157_9,挑战中战斗等级到达SS,Reach Battle Rank SS,Đạt hạng chiến đấu SS trong thử thách
lang_multi_text.db,MultiText,LevelPlay_157900034_ChallengeConditionMainText_157_3,请躲到石柱后面吧...,Hide behind the pillar...,Hãy trốn sau cột đá...
lang_multi_text.db,MultiText,LevelPlay_157900034_ChallengeFailMainText_157_3,挑战失败,Challenge Failed,Thử thách thất bại
lang_multi_text.db,MultiText,LevelPlay_157900034_QuestScheduleMainTitle_157_3,梦境节点 · 猪突猛进,Dreamscape Node: Straight to the Goal,Nút Mộng Cảnh . Lợn Đột Kích
lang_multi_text.db,MultiText,LevelPlay_157900034_QuestScheduleSubTitle_157_10,使碎獠猪撞击障碍物而眩晕2次：{挑战2统计} /2,Have Sabyr Boar stun itself from ramming 2 times: {挑战2统计}/2,Khiến Toái Liêu Trư đâm vào chướng ngại vật và choáng 2 lần: {挑战2统计} /2
lang_multi_text.db,MultiText,LevelPlay_157900034_QuestScheduleSubTitle_157_11,完成6次成功闪避：{挑战3统计} /6,Perform 6 Dodges: {挑战3统计}/6,Hoàn thành 6 lần Né Tránh thành công: {挑战3统计} /6
lang_multi_text.db,MultiText,LevelPlay_157900034_QuestScheduleSubTitle_157_13,限时内击败所有敌人完成挑战,Defeat all enemies within the time limit,Đánh bại tất cả kẻ địch trong thời gian giới hạn để hoàn thành thử thách
lang_multi_text.db,MultiText,LevelPlay_157900034_QuestScheduleSubTitle_157_9,挑战结束时的战斗等级达到S,Reach Battle Rank S when the challenge ends,Đạt hạng chiến đấu S khi thử thách kết thúc
lang_multi_text.db,MultiText,LevelPlay_157900042_ChallengeConditionMainText_157_1,梦魇来袭...,Nightmares are approaching...,Ác mộng đang đến...
lang_multi_text.db,MultiText,LevelPlay_157900042_ChallengeConditionSubText_157_1,完成所有的挑战条件来击败梦魇,Complete all challenges to defeat Nightmares,Hoàn thành tất cả điều kiện thử thách để đánh bại ác mộng
lang_multi_text.db,MultiText,LevelPlay_157900042_ChallengeFailMainText_157_3,挑战失败,Challenge Failed,Thử thách thất bại
lang_multi_text.db,MultiText,LevelPlay_157900042_QuestScheduleMainTitle_157_3,梦魇节点 · 致命芭蕾,Nightmare Node: Deadly Ballet,Nút Ác Mộng . Vũ Điệu Chí Mạng
lang_multi_text.db,MultiText,LevelPlay_157900042_QuestScheduleSubTitle_157_13,保持战斗等级在S以上连续8秒：{挑战1统计} /8,Reach and maintain Battle Rank S or above for 8s: {挑战1统计}/8,Duy trì cấp chiến đấu S trở lên liên tục 8 giây: {挑战1统计}/8
lang_multi_text.db,MultiText,LevelPlay_157900042_QuestScheduleSubTitle_157_14,完成3次逆势回击 ：{挑战2统计} /3,Complete 3 Counterattacks: {挑战2统计}/3,Hoàn thành 3 lần Phản Kích nghịch thế: {挑战2统计} /3
lang_multi_text.db,MultiText,LevelPlay_157900042_QuestScheduleSubTitle_157_15,完成6次闪避反击 ：{挑战3统计} /6,Perform 6 Dodge Counters: {挑战3统计}/6,Hoàn thành 6 lần Né Tránh Phản Kích: {挑战3统计} /6
lang_multi_text.db,MultiText,LevelPlay_157900042_QuestScheduleSubTitle_157_16,限时内消灭所有敌人完成挑战,Defeat all enemies within the time limit,Tiêu diệt tất cả kẻ địch trong thời gian giới hạn để hoàn thành thử thách
lang_multi_text.db,MultiText,LevelPlay_157900043_ChallengeFailMainText_157_1,挑战失败,Challenge Failed,Thử thách thất bại
lang_multi_text.db,MultiText,LevelPlay_157900043_QuestScheduleMainTitle_157_1,梦境节点 · 快乐布偶朋友,Dreamscape Node: Happy Plushie Friend,Nút Mộng Cảnh . Bạn Búp Bê Vui Vẻ
lang_multi_text.db,MultiText,LevelPlay_157900043_QuestScheduleSubTitle_157_5,挑战中战斗等级达到SS,Reach Battle Rank SS,Đạt hạng chiến đấu SS trong thử thách
lang_multi_text.db,MultiText,LevelPlay_157900043_QuestScheduleSubTitle_157_6,被巨布偶扔出的工头布偶砸中少于3次：{挑战2统计} /3,Take less than 3 hits from Diggy Duggys flung by Cuddle Wuddle: {挑战2统计}/3,Bị búp bê đốc công do búp bê khổng lồ ném trúng ít hơn 3 lần: {挑战2统计} /3
lang_multi_text.db,MultiText,LevelPlay_157900043_QuestScheduleSubTitle_157_7,用共鸣解放伤害击败2个敌人：{挑战3统计} /2,Defeat 2 enemies with Resonance Liberation DMG: {挑战3统计}/2,Dùng sát thương Giải Phóng Cộng Hưởng đánh bại 2 kẻ địch: {挑战3统计} /2
lang_multi_text.db,MultiText,LevelPlay_157900043_QuestScheduleSubTitle_157_8,限时内击败所有敌人完成挑战,Defeat all enemies within the time limit,Đánh bại tất cả kẻ địch trong thời gian giới hạn để hoàn thành thử thách
lang_multi_text.db,MultiText,LevelPlay_157900044_ChallengeConditionMainText_157_1,梦魇来袭...,Nightmares are approaching...,Ác mộng đang đến...
lang_multi_text.db,MultiText,LevelPlay_157900044_ChallengeConditionSubText_157_1,完成所有的挑战条件来击败梦魇,Complete all challenges to defeat Nightmares,Hoàn thành tất cả điều kiện thử thách để đánh bại ác mộng
lang_multi_text.db,MultiText,LevelPlay_157900044_ChallengeFailMainText_157_2,挑战失败,Challenge Failed,Thử thách thất bại
lang_multi_text.db,MultiText,LevelPlay_157900044_QuestScheduleMainTitle_157_1,梦魇节点 · 白昼的双剑,Nightmare Node: Twin Swords of Daylight,Nút Ác Mộng . Song Kiếm Bạch Trú
lang_multi_text.db,MultiText,LevelPlay_157900044_QuestScheduleSubTitle_157_10,完成8次成功闪避：{挑战2统计} /8,Perform 8 Dodges: {挑战2统计}/8,Hoàn thành 8 lần né tránh thành công: {挑战2统计} /8
lang_multi_text.db,MultiText,LevelPlay_157900044_QuestScheduleSubTitle_157_11,用变奏技能伤害瘫痪敌人1次：{挑战3统计} /1,Use Intro Skill to immobilize an enemy 1 time: {挑战3统计}/1,Dùng Biến Tấu Kỹ gây sát thương khiến địch tê liệt 1 lần: {挑战3统计} /1
lang_multi_text.db,MultiText,LevelPlay_157900044_QuestScheduleSubTitle_157_12,限时内击杀所有敌人完成挑战,Defeat all enemies within the time limit,Hạ gục tất cả kẻ địch trong thời gian giới hạn để hoàn thành thử thách
lang_multi_text.db,MultiText,LevelPlay_157900044_QuestScheduleSubTitle_157_9,战斗等级达到S的时间多于10秒：{挑战1统计} /10,Reach Battle Rank S for more than 10s: {挑战1统计}/10,Duy trì hạng chiến đấu S hơn 10 giây: {挑战1统计} /10
lang_multi_text.db,MultiText,LevelPlay_157900049_ChallengeFailMainText_157_1,挑战失败,Challenge Failed,Thử thách thất bại
lang_multi_text.db,MultiText,LevelPlay_157900049_QuestScheduleMainTitle_157_2,梦境节点 · 破碎刀伶之心,Dreamscape Node: Shattered Heart,Nút Mộng Cảnh . Trái Tim Đao Linh Vỡ Nát
lang_multi_text.db,MultiText,LevelPlay_157900049_QuestScheduleSubTitle_157_5,战斗等级达到S的时间多于8秒：{挑战1统计} /8,Reach Battle Rank S for more than 8s: {挑战1统计}/8,Thời gian đạt hạng chiến đấu S nhiều hơn 8 giây: {挑战1统计} /8
lang_multi_text.db,MultiText,LevelPlay_157900049_QuestScheduleSubTitle_157_6,用逆势回击击碎全部琉璃刀伶的武器：{挑战2统计} /2,Break all Vitreum Dancers' weapons with Counterattack: {挑战2统计}/2,Dùng Phản Kích để phá hủy vũ khí của tất cả Lưu Ly Đao Linh: {挑战2统计} /2
lang_multi_text.db,MultiText,LevelPlay_157900049_QuestScheduleSubTitle_157_7,用共鸣解放伤害击败1个敌人：{ScoreKill02} /1,Defeat all enemies using Resonance Liberation: {ScoreKill02} /1,Dùng sát thương Giải Phóng Cộng Hưởng đánh bại 1 kẻ địch: {ScoreKill02} /1
lang_multi_text.db,MultiText,LevelPlay_157900049_QuestScheduleSubTitle_157_8,限时内击败所有敌人完成挑战,Defeat all enemies within the time limit,Đánh bại tất cả kẻ địch trong thời gian giới hạn để hoàn thành thử thách
lang_multi_text.db,MultiText,LevelPlay_157900050_ChallengeConditionMainText_157_3,梦魇来袭...,Nightmares are approaching...,Ác mộng đang đến...
lang_multi_text.db,MultiText,LevelPlay_157900050_ChallengeConditionSubText_157_3,完成所有的挑战条件来击败梦魇,Complete all challenges to defeat Nightmares,Hoàn thành tất cả điều kiện thử thách để đánh bại ác mộng
lang_multi_text.db,MultiText,LevelPlay_157900050_ChallengeFailMainText_157_2,挑战失败,Challenge Failed,Thử thách thất bại
lang_multi_text.db,MultiText,LevelPlay_157900050_QuestScheduleMainTitle_157_2,梦魇节点 · 风暴中的骑士,Nightmare Node: Knight in a Storm,Nút Ác Mộng . Kỵ Sĩ Giữa Bão Tố
lang_multi_text.db,MultiText,LevelPlay_157900050_QuestScheduleSubTitle_157_10,用3次逆势回击打断骑士的武器增益：{挑战2统计} /1,Perform 3 Counterattacks that interrupt the Knight's weapon enhancement: {挑战2统计} /1,Dùng 3 lần Phản Kích để gián đoạn tăng cường vũ khí của Kỵ Sĩ: {挑战2统计} /1
lang_multi_text.db,MultiText,LevelPlay_157900050_QuestScheduleSubTitle_157_11,使用共鸣解放伤害瘫痪1次敌人：{挑战3统计} /1,Immobilize an enemy with Resonance Liberation DMG: {挑战3统计} /1,Dùng sát thương Giải Phóng Cộng Hưởng để làm tê liệt kẻ địch 1 lần: {挑战3统计} /1
lang_multi_text.db,MultiText,LevelPlay_157900050_QuestScheduleSubTitle_157_12,限时内击败所有敌人完成挑战,Defeat all enemies within the time limit,Đánh bại tất cả kẻ địch trong thời gian giới hạn để hoàn thành thử thách
lang_multi_text.db,MultiText,LevelPlay_157900050_QuestScheduleSubTitle_157_9,战斗等级达到S的时间多于10秒：{挑战1统计} /10,Reach Battle Rank S for more than 10s: {挑战1统计} /10,Duy trì hạng chiến đấu S hơn 10 giây: {挑战1统计} /10
lang_multi_text.db,MultiText,LevelPlay_157900051_ChallengeFailMainText_157_3,挑战失败,Challenge Failed,Thử thách thất bại
lang_multi_text.db,MultiText,LevelPlay_157900051_QuestScheduleMainTitle_157_3,梦境节点 · 以眼还眼,Dreamscape Node: An Eye for an Eye,Nút Mộng Cảnh . Ăn Miếng Trả Miếng
lang_multi_text.db,MultiText,LevelPlay_157900051_QuestScheduleSubTitle_157_13,挑战结束时的战斗等级达到S,Reach Battle Rank S when the challenge ends,Đạt hạng chiến đấu S khi thử thách kết thúc
lang_multi_text.db,MultiText,LevelPlay_157900051_QuestScheduleSubTitle_157_14,通过射击打断刺玫菇成体的蓄力状态：{挑战2统计} /1,Use ranged attacks to interrupt a Roseshroom's charging state: {挑战2统计} /1,Dùng xạ kích để gián đoạn trạng thái tích lực của Nấm Thích Mai trưởng thành: {挑战2统计} /1
lang_multi_text.db,MultiText,LevelPlay_157900051_QuestScheduleSubTitle_157_15,使用4次共鸣技能：{挑战3统计} /4,Use Resonance Skill 4 times: {挑战3统计} /4,Sử dụng Kỹ Năng Cộng Hưởng 4 lần: {挑战3统计} /4
lang_multi_text.db,MultiText,LevelPlay_157900051_QuestScheduleSubTitle_157_16,限时内击败所有敌人完成挑战,Defeat all enemies within the time limit,Đánh bại tất cả kẻ địch trong thời gian giới hạn để hoàn thành thử thách
lang_multi_text.db,MultiText,LevelPlay_157900052_ChallengeFailMainText_157_3,挑战失败,Challenge Failed,Thử thách thất bại
lang_multi_text.db,MultiText,LevelPlay_157900052_QuestScheduleMainTitle_157_3,梦境节点 · 鬼怪马戏团,Dreamscape Node: Haunting Circus,Nút Mộng Cảnh - Gánh Xiếc Ma Quái
lang_multi_text.db,MultiText,LevelPlay_157900052_QuestScheduleSubTitle_157_19,保持战斗等级在S以上连续8秒：{挑战1统计} /8,Reach and maintain Battle Rank S or above for 8s: {挑战1统计} /8,Duy trì cấp chiến đấu S trở lên liên tục 8 giây: {挑战1统计}/8
lang_multi_text.db,MultiText,LevelPlay_157900052_QuestScheduleSubTitle_157_20,不被幽翎火的自爆命中：{挑战2统计} /1,Avoid being hit by an exploding Fae Ignis: {挑战2统计} /1,Không bị trúng tự hủy của Fae Ignis: {挑战2统计} /1
lang_multi_text.db,MultiText,LevelPlay_157900052_QuestScheduleSubTitle_157_21,不被幽翎火的自爆命中：1 /1,Avoid being hit by an exploding Fae Ignis: 1 /1,Không bị trúng tự hủy của Fae Ignis: 1 /1
lang_multi_text.db,MultiText,LevelPlay_157900052_QuestScheduleSubTitle_157_22,最后击败浮灵偶,Defeat Chop Chop last,Đánh bại Chop Chop sau cùng
lang_multi_text.db,MultiText,LevelPlay_157900052_QuestScheduleSubTitle_157_23,最后击败浮灵偶,Defeat Chop Chop last,Đánh bại Chop Chop sau cùng
lang_multi_text.db,MultiText,LevelPlay_157900052_QuestScheduleSubTitle_157_24,限时内击败所有敌人完成挑战,Defeat all enemies within the time limit,Đánh bại tất cả kẻ địch trong thời gian giới hạn để hoàn thành thử thách
lang_multi_text.db,MultiText,LevelPlay_157900053_ChallengeFailMainText_157_1,挑战失败,Challenge Failed,Thử thách thất bại
lang_multi_text.db,MultiText,LevelPlay_157900053_QuestScheduleMainTitle_157_2,梦境节点 · 遗愿的骑士,Dreamscape Node: Knight of Regrets,Nút Mộng Cảnh . Kỵ Sĩ Di Nguyện
lang_multi_text.db,MultiText,LevelPlay_157900053_QuestScheduleSubTitle_157_10,被攻击少于10次：{挑战3统计} /10,Take less than 10 hits: {挑战3统计}/10,Bị tấn công ít hơn 10 lần: {挑战3统计}/10
lang_multi_text.db,MultiText,LevelPlay_157900053_QuestScheduleSubTitle_157_12,限时内击败所有敌人完成挑战,Defeat all enemies within the time limit,Đánh bại tất cả kẻ địch trong thời gian giới hạn để hoàn thành thử thách
lang_multi_text.db,MultiText,LevelPlay_157900053_QuestScheduleSubTitle_157_7,保持战斗等级在S以上连续8秒：{挑战1统计} /8,Reach and maintain Battle Rank S or above for 8s: {挑战1统计}/8,Duy trì cấp chiến đấu S trở lên liên tục 8 giây: {挑战1统计}/8
lang_multi_text.db,MultiText,LevelPlay_157900053_QuestScheduleSubTitle_157_8,在骑士强化武器3次前击败骑士：{挑战2统计} /3,Defeat the Knight before they perform 3 weapon charges: {挑战2统计}/3,Đánh bại Kỵ Sĩ trước khi hắn cường hóa vũ khí 3 lần: {挑战2统计}/3
lang_multi_text.db,MultiText,LevelPlay_157900054_ChallengeConditionMainText_157_3,请直视内心的恐惧吧...,You must stare directly into the fear within you...,Hãy đối diện với nỗi sợ hãi trong tâm...
lang_multi_text.db,MultiText,LevelPlay_157900054_ChallengeFailMainText_157_1,挑战失败,Challenge Failed,Thử thách thất bại
lang_multi_text.db,MultiText,LevelPlay_157900054_QuestScheduleMainTitle_157_1,梦境节点 · 风车之主,Dreamscape Node: Lord of the Windmill,Nút Mộng Cảnh . Chúa Tể Cối Xay Gió
