db_file,table_name,id,zh,en,vi
lang_multi_text.db,MultiText,JijianTask_12903501_HintText,将深空测界台推进至阶段Ⅲ：望域工程,Reach the Overwatch Phase,Đưa Đài Quan Sát Không Gian Sâu đến Giai Đoạn III: Công Trình Quan Trắc
lang_multi_text.db,MultiText,JijianTask_12903502_HintText,完成深空测界台的全部重建工程,Complete all Phases and fully rebuild the Spacetrek Observatory,Hoàn thành toàn bộ công trình tái thiết Đài Quan Sát Không Gian Sâu
lang_multi_text.db,MultiText,JijianTask_12903504_HintText,重建深星公路,Rebuild the Observatory-Academy Highway,Tái thiết Xa Lộ Observatory-Academy
lang_multi_text.db,MultiText,JijianTask_12903505_HintText,重建眶折谷公路北段,Rebuild the Orbit Valley Pass - North,Tái thiết Đèo Orbit Valley - Bắc
lang_multi_text.db,MultiText,JijianTask_12903506_HintText,重建眶折谷公路南段,Rebuild the Orbit Valley Pass - South,Tái thiết Đèo Orbit Valley - Nam
lang_multi_text.db,MultiText,JijianTask_12903507_HintText,重建沙原通路,Rebuild the Sandreach Passage,Tái thiết Lối Đi Sandreach
lang_multi_text.db,MultiText,JijianTask_12903508_HintText,重建远行公路,Rebuild the Farer's Road,Tái thiết Đường Farer's Road
lang_multi_text.db,MultiText,JijianTask_12903509_HintText,重建深光大桥,Rebuild the Spacetrek–Bjartr Bridge,Tái thiết Cầu Spacetrek-Bjartr
lang_multi_text.db,MultiText,JijianTask_12903510_HintText,重建星跃公路,Rebuild the Starleap Ascent,Tái thiết Xa Lộ Starleap
lang_multi_text.db,MultiText,JijianTask_12903511_HintText,重建呼啸隧道,Rebuild the Howling Tunnel,Tái thiết Đường Hầm Howling
lang_multi_text.db,MultiText,JijianTask_12903512_HintText,重建朔尔之挽,Rebuild the Sol's Embrace,Tái thiết Vòng Tay Sol
lang_multi_text.db,MultiText,JijianTask_12903513_HintText,重建溺森涡道,Rebuild the Submerged Tunnel,Tái thiết Đường Hầm Submerged
lang_multi_text.db,MultiText,JijianTask_CompleteButton,确认,Confirm,Xác nhận
lang_multi_text.db,MultiText,JijianTask_ConstructionDifficulty,重建难度,Difficulty,Độ khó tái thiết
lang_multi_text.db,MultiText,JijianTask_Rewardsunlocked,继续推进深空测界台重建工程后解锁,Continue rebuilding the Spacetrek Observatory to unlock,Tiếp tục tái thiết Đài Quan Sát Không Gian Sâu để mở khóa
lang_multi_text.db,MultiText,JinZhouFly_FunctionLock,未解锁,Locked,Chưa mở khóa
lang_multi_text.db,MultiText,JinZhouFly_FunctionLockDes,参与活动，可解锁翱翔探索模块的使用权限,Participate in the event to gain the access to the Flight Utility,Tham gia sự kiện để mở khóa quyền sử dụng mô-đun bay khám phá
