db_file,table_name,id,zh,en,vi
lang_multi_text.db,MultiText,POI_HSBD_1001_1,「深囚者」已失去增幅「朽蚀的岁月」。,"The Lifer has lost its buff ""Decay of Time.""","""Kẻ Giam Cầm"" đã mất tăng cường ""Năm Tháng Mục Rữa""."
lang_multi_text.db,MultiText,POI_HSBD_1002_1,「深囚者」已失去增幅「逃亡的欲念」。,"The Lifer has lost its buff ""Desire for Escape.""","""Kẻ Giam Cầm"" đã mất tăng cường ""Khát Vọng Đào Tẩu""."
lang_multi_text.db,MultiText,POI_HSBD_1003_1,「深囚者」已失去增幅「孽生的孤独」。,"The Lifer has lost its buff ""Growing Loneliness.""","""Kẻ Giam Cầm"" đã mất tăng cường ""Cô Độc Nảy Sinh""."
lang_multi_text.db,MultiText,POI_HSBD_1004_1,「深囚者」已失去增幅「迫近的死局」。,"The Lifer has lost its buff ""Impending Stalemate.""","""Kẻ Giam Cầm"" đã mất tăng cường ""Tử Cục Cận Kề""."
lang_multi_text.db,MultiText,POI_HSBD_1005_1,「深囚者」已恢复增幅「朽蚀的岁月」。,"The Lifer has regained its buff ""Decay of Time.""","""Kẻ Giam Cầm"" đã hồi phục tăng cường ""Năm Tháng Mục Rữa""."
lang_multi_text.db,MultiText,POI_HSBD_1006_1,「深囚者」已恢复增幅「逃亡的欲念」。,"The Lifer has regained its buff ""Desire for Escape.""","""Kẻ Giam Cầm"" đã hồi phục tăng cường ""Khát Vọng Đào Tẩu""."
lang_multi_text.db,MultiText,POI_HSBD_1007_1,「深囚者」已恢复增幅「孽生的孤独」。,"The Lifer has regained its buff ""Growing Loneliness.""","""Kẻ Giam Cầm"" đã hồi phục tăng cường ""Cô Độc Nảy Sinh""."
lang_multi_text.db,MultiText,POI_HSBD_1008_1,「深囚者」已恢复增幅「迫近的死局」。,"The Lifer has regained its buff ""Impending Stalemate.""","""Kẻ Giam Cầm"" đã hồi phục tăng cường ""Tử Cục Cận Kề""."
lang_multi_text.db,MultiText,POI_HSBD_100_1,它又来接我们了！,Look! It's here to pick us up again!,Nó lại đến đón chúng ta rồi!
lang_multi_text.db,MultiText,POI_HSBD_101_1,嗯……需要找到合适的角度才能复原它们。,Hmm... Need a better angle to piece them together.,Hmm... Cần tìm đúng góc nhìn mới có thể phục hồi chúng được.
lang_multi_text.db,MultiText,POI_HSBD_102_1,啊——啊！！！,Ahhhhhhh!,A...a!!!
lang_multi_text.db,MultiText,POI_HSBD_102_2,这里太可怕了……你可千万不要掉下去啊！,This is too dangerous! Careful to not fall into it!,Chỗ này đáng sợ quá... Cậu đừng có rơi xuống đấy nhé!
lang_multi_text.db,MultiText,POI_HSBD_103_1,这是……要载我们一程的意思吗？,Is it... offering us a ride?,Đây là... ý muốn chở chúng ta một đoạn sao?
lang_multi_text.db,MultiText,POI_HSBD_103_2,跟上它看看吧。,"We'll catch this ride, then.",Bám theo nó xem sao.
lang_multi_text.db,MultiText,POI_HSBD_10_1,想……离开……,Want... to leave...,Muốn... rời đi...
lang_multi_text.db,MultiText,POI_HSBD_10_2,逃……出去！！！,Leave here... Leave!,Trốn... thoát ra!!!
lang_multi_text.db,MultiText,POI_HSBD_11_1,终于还是要战斗了吗！,Finally! Time to battle!,Cuối cùng cũng phải chiến đấu rồi sao!
lang_multi_text.db,MultiText,POI_HSBD_11_2,那些黑棋白棋走来走去我都要看晕了……还是用实力来决定胜负吧！,Those moving pieces got me so confused... Let's get this over with!,Mấy quân cờ đen trắng đi tới đi lui làm tôi hoa cả mắt... Thôi dùng thực lực mà phân thắng bại đi!
lang_multi_text.db,MultiText,POI_HSBD_12_1,这个家伙好像被关在这里很久很久了……,Seems like this Echo has been locked up here since forever…,Kẻ này có vẻ đã bị nhốt ở đây lâu lắm rồi...
lang_multi_text.db,MultiText,POI_HSBD_12_2,看那些碑文的意思，不管下棋谁赢了，它都没办法离开，它一直守护着这个棋盘。,"According to those inscriptions, it doesn't matter who wins or loses the game. It's stuck here guarding this board forever either way.","Theo nội dung trên bia đá, dù ai thắng ai thua ván cờ, nó cũng không thể rời đi. Nó đã luôn canh giữ bàn cờ này."
lang_multi_text.db,MultiText,POI_HSBD_12_3,也许它从来不想守护这个棋盘。,Maybe it never wanted this at all.,Có lẽ nó chưa bao giờ muốn canh giữ bàn cờ này.
lang_multi_text.db,MultiText,POI_HSBD_12_4,不知道它在被关到这里之前，是过着怎样的日子呢……,I wonder what kind of life it had before being trapped here…,"Không biết trước khi bị nhốt ở đây, nó đã sống những ngày tháng như thế nào nhỉ..."
lang_multi_text.db,MultiText,POI_HSBD_13_1,一只游鳞机枢的残骸散落在地。,Scattered debris from a Lumiscale Construct lies on the ground.,Tàn tích của một Du Lân Cơ Xu nằm rải rác trên mặt đất.
lang_multi_text.db,MultiText,POI_HSBD_13_10,但是味道很不一样，它应该是很久很久以前就坏掉了。,"Except… this one smells different, like it's been broken since a long time ago.","Nhưng mùi thì khác hẳn, nó chắc đã hỏng từ lâu lắm rồi."
lang_multi_text.db,MultiText,POI_HSBD_13_11,而且……它闻起来有种被火烧过的味道。,And... it smells burnt.,Hơn nữa... nó có mùi như bị lửa thiêu qua.
lang_multi_text.db,MultiText,POI_HSBD_13_12,……待信众安顿，「英白拉多」方才离开旧都，向东北行进……,"""…Once Their people were safe, Imperator left the old capital and journeyed northeast…""","""...Đợi tín đồ ổn định xong, ""Imperator"" mới rời cựu đô, tiến về phía đông bắc..."""
lang_multi_text.db,MultiText,POI_HSBD_13_13,……于海岸，信众目睹其腾浪乘风，消失于云端……,"""...On the shore, the faithful watched as Imperator rode the waves and wind, until Their presence dissolved into the clouds…""","""...Tại bờ biển, tín đồ chứng kiến Ngài cưỡi sóng đạp gió, tan biến vào mây trời..."""
lang_multi_text.db,MultiText,POI_HSBD_13_14,“消失于云端”……如果石板上记叙的内容是真的，那这片海岸就是岁主「英白拉多」最后出现的地方？,"""Dissolved into the clouds""… if this inscription speaks true, then this shore is where Sentinel Imperator was last seen?","""Tan biến vào mây trời""... Nếu nội dung khắc trên tấm đá là thật, thì bờ biển này chính là nơi Tuế Chủ ""Imperator"" xuất hiện lần cuối sao?"
lang_multi_text.db,MultiText,POI_HSBD_13_2,这里怎么会有游鳞机枢？,Why would a Lumiscale Construct be here?,Sao ở đây lại có Du Lân Cơ Xu?
lang_multi_text.db,MultiText,POI_HSBD_13_3,脚下石板上刻了一些字……,There's something carved on the ground...,Tấm đá dưới chân có khắc vài dòng chữ...
lang_multi_text.db,MultiText,POI_HSBD_13_4,伸手触摸它。,Touch it.,Chạm vào nó.
lang_multi_text.db,MultiText,POI_HSBD_13_5,离开。,Leave.,Rời đi.
lang_multi_text.db,MultiText,POI_HSBD_13_6,呜哈……我闻到一股熟悉的味道！,*yawn* Huh... A familiar smell!,Hửm... ta ngửi thấy mùi quen lắm!
lang_multi_text.db,MultiText,POI_HSBD_13_7,你睡醒了？,"Finally awake, are we?",Ngươi thức rồi à?
lang_multi_text.db,MultiText,POI_HSBD_13_8,说什么呢？我可是一直保持着警戒状态。,Hey! I've been on guard this whole time!,Nói gì thế? Ta luôn trong trạng thái cảnh giác nhé.
lang_multi_text.db,MultiText,POI_HSBD_13_9,这一堆废铜烂铁，虽然长得很像我们在乘霄山见过的那个什么……嗯，游鳞机枢！,These scraps look just like that thing we saw back on Mt. Firmament. The name is… right! Lumiscale Construct!,"Đống sắt vụn này, tuy trông giống cái thứ ta thấy ở Thừa Tiêu Sơn lắm... ờm, Du Lân Cơ Xu!"
lang_multi_text.db,MultiText,POI_HSBD_14_1,是地震了吗？头好晕……,"What happened? An earthquake? Ugh, I feel giddy...",Động đất à? Đầu choáng quá...
lang_multi_text.db,MultiText,POI_HSBD_15_1,这些石板上的花纹，与刚才发现游鳞机枢的地方的花纹相同。,This pattern on the ground is identical to the one we found near that Lumiscale Construct.,Hoa văn trên những tấm đá này giống hệt hoa văn ở chỗ tìm thấy Du Lân Cơ Xu lúc nãy.
lang_multi_text.db,MultiText,POI_HSBD_15_2,这种东西，应该是修会的人修的吧？,Looks like the work of those Order folks.,Thứ này chắc là do người của Tu Hội xây dựng nhỉ?
lang_multi_text.db,MultiText,POI_HSBD_16_1,这里也有类似的石板。,Here's another altar.,Ở đây cũng có tấm đá tương tự.
lang_multi_text.db,MultiText,POI_HSBD_16_2,应该跟刚才一样，把它点亮就行了吧？,Maybe we should light it up like last time?,"Chắc cũng giống lúc nãy, chỉ cần thắp sáng nó lên là được nhỉ?"
lang_multi_text.db,MultiText,POI_HSBD_17_1,这里的石碑好像破碎了……,These steles are even more worn out than the last ones…,Bia đá ở đây có vẻ đã vỡ rồi...
lang_multi_text.db,MultiText,POI_HSBD_18_1,我有种不好的感觉……{PlayerName}，刚才那堆破铜烂铁，它的味道变了。,"{PlayerName}, the smell of those scraps has changed… I don't like the feel of this.","Ta có linh cảm không hay... {PlayerName}, đống sắt vụn lúc nãy, mùi của nó thay đổi rồi."
lang_multi_text.db,MultiText,POI_HSBD_19_1,唔哇，它怎么活过来了！,Ahhh! Why is it moving now?!,"Oa, sao nó sống lại rồi!"
lang_multi_text.db,MultiText,POI_HSBD_1_1,这么偏的地方竟然修了个这么大的建筑……,Can't believe they built this colossus out here in the middle of nowhere...,Nơi hẻo lánh thế này mà lại xây một tòa nhà to thế...
lang_multi_text.db,MultiText,POI_HSBD_1_2,你什么时候醒来的？,When did you wake up?,Cậu tỉnh từ lúc nào vậy?
lang_multi_text.db,MultiText,POI_HSBD_1_3,你进来这时我就醒了！你觉不觉得，修会的人真有钱啊。,Right after you walked into this place! Those Order folks must be loaded to build it.,"Từ lúc cậu bước vào đây ấy! Cậu có thấy không, mấy người Hội Tu thật sự giàu ghê."
lang_multi_text.db,MultiText,POI_HSBD_1_4,我没考虑这个问题……我在思索石碑上的内容。,Maybe… but what does this inscription mean?,Tôi không nghĩ đến chuyện đó... Tôi đang suy nghĩ về nội dung trên tấm bia đá.
lang_multi_text.db,MultiText,POI_HSBD_1_5,这石碑上写着什么“庭院的深处”……应该是说这里面有什么秘密吧？我们去看看！,"""Depths of the garden…"" Sounds like there's a secret in there. Let's go take a look!","Trên bia đá ghi gì đó về ""sâu trong khu vườn""... Chắc là bên trong có bí mật gì đó! Mình vào xem thử đi!"
lang_multi_text.db,MultiText,POI_HSBD_200_1,赴约者，你可对敌人持有足够的敬畏之心？,"You who have answered the summon, do you have enough respect for your opponents?","Người nhận lời mời, ngươi có đủ lòng kính sợ đối với kẻ địch không?"
lang_multi_text.db,MultiText,POI_HSBD_200_10,3种。,Three.,3 loại.
lang_multi_text.db,MultiText,POI_HSBD_200_11,4种。,Four.,4 loại.
lang_multi_text.db,MultiText,POI_HSBD_200_12,5种。,Five.,5 loại.
lang_multi_text.db,MultiText,POI_HSBD_200_13,离开吧，赴约者……你对敌人毫无敬畏之心。,No respect at all... You should leave now.,"Hãy rời đi, người nhận lời mời... Ngươi chẳng có chút kính sợ nào đối với kẻ địch cả."
lang_multi_text.db,MultiText,POI_HSBD_200_14,离开吧，赴约者……你对敌人毫无敬畏之心。,No respect at all... You should leave now.,"Hãy rời đi, người nhận lời mời... Ngươi chẳng có chút kính sợ nào đối với kẻ địch cả."
lang_multi_text.db,MultiText,POI_HSBD_200_15,很好。最后一问，在方才的敌人中，哪种布偶小队的敌人出现过两次？,Impressive. And here comes the last question—what type of Plushie Echo appeared twice just now?,"Tốt lắm. Câu hỏi cuối cùng, trong số kẻ địch vừa rồi, loại kẻ địch nào trong đội Búp Bê đã xuất hiện hai lần?"
lang_multi_text.db,MultiText,POI_HSBD_200_16,工头布偶。,Diggy Duggy.,Diggy Duggy.
lang_multi_text.db,MultiText,POI_HSBD_200_17,魔术先生。,Hocus Pocus.,Hocus Pocus.
lang_multi_text.db,MultiText,POI_HSBD_200_18,寂寞小姐。,Lottie Lost.,Lottie Lost.
lang_multi_text.db,MultiText,POI_HSBD_200_19,巨布偶。,Cuddle Wuddle.,Cuddle Wuddle.
lang_multi_text.db,MultiText,POI_HSBD_200_2,我将询问你三个问题，来检验你的品质。,Answer these questions to prove yourself.,Ta sẽ hỏi ngươi ba câu hỏi để kiểm chứng phẩm chất của ngươi.
lang_multi_text.db,MultiText,POI_HSBD_200_20,离开吧，赴约者……你对敌人毫无敬畏之心。,No respect at all... You should leave now.,"Hãy rời đi, người nhận lời mời... Ngươi chẳng có chút kính sợ nào đối với kẻ địch cả."
lang_multi_text.db,MultiText,POI_HSBD_200_21,嗯……你对敌人抱持了充分的敬畏之心。,All correct... You've proved yourself to be a respectful person.,Ừm... Ngươi đã thể hiện đủ lòng kính sợ đối với kẻ địch.
lang_multi_text.db,MultiText,POI_HSBD_200_22,离开吧，赴约者……你对敌人毫无敬畏之心。,No respect at all... You should leave now.,"Hãy rời đi, người nhận lời mời... Ngươi chẳng có chút kính sợ nào đối với kẻ địch cả."
lang_multi_text.db,MultiText,POI_HSBD_200_23,离开吧，赴约者……你对敌人毫无敬畏之心。,No respect at all... You should leave now.,"Hãy rời đi, người nhận lời mời... Ngươi chẳng có chút kính sợ nào đối với kẻ địch cả."
lang_multi_text.db,MultiText,POI_HSBD_200_3,第一问，在你方才面对的敌人中，共有几只浮灵偶的手？,How many Chop Chop's hands you just defeated?,"Câu hỏi đầu tiên, trong số kẻ địch ngươi vừa đối mặt, có tổng cộng bao nhiêu tay của Chop Chop?"
lang_multi_text.db,MultiText,POI_HSBD_200_4,4只。,Four.,4 con.
lang_multi_text.db,MultiText,POI_HSBD_200_5,5只。,Five.,5 con.
lang_multi_text.db,MultiText,POI_HSBD_200_6,6只。,Six.,6 con.
lang_multi_text.db,MultiText,POI_HSBD_200_7,离开吧，赴约者……你对敌人毫无敬畏之心。,No respect at all... You should leave now.,"Hãy rời đi, người nhận lời mời... Ngươi chẳng có chút kính sợ nào đối với kẻ địch cả."
lang_multi_text.db,MultiText,POI_HSBD_200_8,离开吧，赴约者……你对敌人毫无敬畏之心。,No respect at all... You should leave now.,"Hãy rời đi, người nhận lời mời... Ngươi chẳng có chút kính sợ nào đối với kẻ địch cả."
lang_multi_text.db,MultiText,POI_HSBD_200_9,很好。第二问，在方才的敌人中，共有几种布偶小队的敌人？,Very well. How many types of Plushie Echoes you just encountered?,"Tốt lắm. Câu hỏi thứ hai, trong số kẻ địch vừa rồi, có tổng cộng bao nhiêu loại kẻ địch thuộc đội Búp Bê?"
lang_multi_text.db,MultiText,POI_HSBD_201_1,有残象冒出来了！,Tacet Discords incoming!,Có Tàn Tượng xuất hiện rồi!
lang_multi_text.db,MultiText,POI_HSBD_201_2,好像站在这个大圆圈里，石板上的花纹就会被慢慢点亮！,It seems these patterns on the altar light up gradually when you stand in this giant circle.,"Hình như đứng trong vòng tròn lớn này, hoa văn trên phiến đá sẽ dần sáng lên!"
lang_multi_text.db,MultiText,POI_HSBD_201_3,这是某种特殊的仪式吗……,Is this some kind of ritual...,Đây là nghi thức gì đó sao...
lang_multi_text.db,MultiText,POI_HSBD_202_1,又有敌人来了！,More enemies here!,Lại có kẻ địch tới rồi!
lang_multi_text.db,MultiText,POI_HSBD_202_2,怎么这么多残象……不要阻止我们点亮石板哇！,"Ugh, these pesky Tacet Discords... Stay away from us!",Sao nhiều Tàn Tượng thế này... Đừng có ngăn bọn ta thắp sáng phiến đá chứ!
lang_multi_text.db,MultiText,POI_HSBD_203_1,这就是最后的石板了！,This is the last altar!,Đây là phiến đá cuối cùng rồi!
lang_multi_text.db,MultiText,POI_HSBD_203_2,一口气点亮它吧！,Let's finish this in one go!,Thắp sáng nó một lèo thôi!
lang_multi_text.db,MultiText,POI_HSBD_20_1,它从那扇门里逃走了！,It just ran off! Over there!,Nó chạy qua cánh cửa kia rồi!
lang_multi_text.db,MultiText,POI_HSBD_21_1,根据石板上的文字，修会的人相信这里是岁主「英白拉多」最后出现的地方。,This inscription says the Order believes this is where Imperator was last seen.,"Theo nội dung trên phiến đá, người của Tu Hội tin rằng đây là nơi Tuế Chủ ""Imperator"" xuất hiện lần cuối."
lang_multi_text.db,MultiText,POI_HSBD_21_2,所以他们是为了朝拜而修建了这里吗……看起来很壮观！,"So, they made these steles to honor the Sentinel... That's pretty impressive!",Vậy họ xây dựng nơi này để bái lạy sao... Trông thật hùng vĩ!
lang_multi_text.db,MultiText,POI_HSBD_21_3,但是，这里风好大……好危险！,But the wind is really strong here. We need to watch our steps.,"Nhưng mà, gió ở đây mạnh quá... Nguy hiểm lắm!"
lang_multi_text.db,MultiText,POI_HSBD_22_1,能不能跑慢点……我有点晕车。,"Can we slow down a bit? Seriously, I'm feeling dizzy...",Chạy chậm lại chút được không... Ta hơi chóng mặt.
lang_multi_text.db,MultiText,POI_HSBD_22_2,要不你出来自己飞？,How about you just get off me and fly on your own?,Hay ngươi ra ngoài tự bay đi?
lang_multi_text.db,MultiText,POI_HSBD_22_3,啊算了算了！当我没说，我可不想被风刮走……,"No, never mind. Wouldn't wanna get swept away by the wind...","À thôi thôi! Coi như ta chưa nói gì, ta không muốn bị gió thổi bay đâu..."
lang_multi_text.db,MultiText,POI_HSBD_23_1,它要撞过来了！,It's coming at us!,Nó lao tới rồi!
lang_multi_text.db,MultiText,POI_HSBD_24_1,好险！,That was so close!,Hú vía!
lang_multi_text.db,MultiText,POI_HSBD_25_1,哼哼，束手就擒吧！你还是被我们逮到了！,"Haha, gotcha! Now you'll behave!","Hừ hừ, chịu trói đi! Cuối cùng cũng bắt được ngươi rồi!"
lang_multi_text.db,MultiText,POI_HSBD_26_1,呜哇，怎么还有大家伙！,Woah! Seriously?! Where did this big guy even come from?!,"Ối trời, sao còn có con to thế này nữa!"
lang_multi_text.db,MultiText,POI_HSBD_27_1,这样就结束了吧？,"So this is it, huh?",Vậy là xong rồi chứ?
lang_multi_text.db,MultiText,POI_HSBD_27_2,修会的人来这里一趟也很不容易啊……我肯定当不了信徒。,Those Order folks really worked hard to get here. Not my kind of thing.,Người của Tu Hội tới được đây cũng không dễ dàng gì... Ta chắc chắn không làm tín đồ được đâu.
lang_multi_text.db,MultiText,POI_HSBD_27_3,……,...,...
lang_multi_text.db,MultiText,POI_HSBD_27_4,{PlayerName}，你在想什么？,{PlayerName}? What's wrong?,"{PlayerName}, ngươi đang nghĩ gì thế?"
lang_multi_text.db,MultiText,POI_HSBD_27_5,没什么。,Nothing.,Không có gì.
lang_multi_text.db,MultiText,POI_HSBD_27_6,让信众经历这样的苦修……,I'm just wondering...,Bắt tín đồ phải trải qua khổ tu như vậy...
lang_multi_text.db,MultiText,POI_HSBD_27_7,会是「英白拉多」想要的吗？,Is this suffering really what Imperator desires for Their people?,"Liệu đó có phải điều ""Imperator"" mong muốn không?"
lang_multi_text.db,MultiText,POI_HSBD_2_1,是一个大棋盘！,Wow! It's a massive board game!,Là một bàn cờ lớn!
lang_multi_text.db,MultiText,POI_HSBD_2_2,但一共才九个格子，应该不是你之前和长离下的那种棋吧。,But there are only nine circles. Doesn't look like the kind of game you played with Changli.,"Nhưng chỉ có chín ô thôi, chắc không phải loại cờ mà cậu chơi với Trường Ly trước đó đâu nhỉ."
lang_multi_text.db,MultiText,POI_HSBD_2_3,的确，看起来像……井字棋？,"Yeah, it's more like… some kind of puzzle.","Đúng vậy, trông giống như... cờ ca-rô?"
