db_file,table_name,id,zh,en,vi
lang_multi_text.db,MultiText,Guid_CDYL_16_6,你们的聊天内容，我就不问了吧……怪不好意思的。,I won't ask about your conversation... That would be awkward.,Nội dung cuộc trò chuyện thì... tôi không hỏi đâu... hơi ngại mà.
lang_multi_text.db,MultiText,Guid_CDYL_16_7,我是有点好奇她的事情。我也觉得她有些熟悉，但是想不起来在哪里见过她了。,"I am a bit curious about her, though. She looks familiar somehow, but I can't remember where I've met her before.","Tôi cũng hơi tò mò về cô ấy. Tôi cũng thấy cô ấy quen quen, nhưng không nhớ ra gặp ở đâu."
lang_multi_text.db,MultiText,Guid_CDYL_16_8,先不说这个了！这一路的痕迹和气味，足以证明附近有温泉存在。,"Anyway, never mind! All the signs along the way point to hot springs being nearby.",Thôi không nói chuyện đó nữa! Dấu vết và mùi dọc đường đủ chứng minh gần đây có suối nước nóng.
lang_multi_text.db,MultiText,Guid_CDYL_16_9,温泉附近，必有不同于冰原的风景！我们这就去看吧！,The view around the hot springs must be a real break from all this ice! That'll be our next stop!,"Quanh suối nước nóng, chắc chắn sẽ có phong cảnh khác hẳn với vùng băng nguyên! Chúng ta đi xem ngay thôi!"
lang_multi_text.db,MultiText,Guid_CDYL_17_1,这里有房子，不是吧，居然有人住在这里？,"Look, a cabin here. I can't believe it. Is someone actually living here?","Ở đây có nhà, không đùa chứ, thật sự có người sống ở đây sao?"
lang_multi_text.db,MultiText,Guid_CDYL_17_2,我们这样在她？他？的房子附近拍照，会不会不太礼貌啊……,Do you think it'll be rude to be taking pictures around his or her house?,"Chúng ta chụp ảnh quanh nhà của cô ấy? Anh ấy? như thế này, có phải hơi bất lịch sự không..."
lang_multi_text.db,MultiText,Guid_CDYL_17_3,只是作为旅途的留念，她不会介意的。,"Just a few photos for the trip, she won't mind.","Chỉ là kỷ niệm chuyến đi thôi, cô ấy sẽ không phiền đâu."
lang_multi_text.db,MultiText,Guid_CDYL_17_4,的确，还是不要拍了。,"Good point, let's not take any pictures.","Cũng đúng, thôi đừng chụp nữa."
lang_multi_text.db,MultiText,Guid_CDYL_17_5,我懂，只是做留念，绝对不公开。其他地方也拍几张……,Totally. Just some photos I'll keep to myself. I also want a few of the other places...,"Tôi hiểu, chỉ chụp làm kỷ niệm, tuyệt đối không đăng công khai. Mấy chỗ khác cũng chụp vài tấm..."
lang_multi_text.db,MultiText,Guid_CDYL_17_6,也是。那就拍拍其他地方吧！,Yes. Let's go somewhere else instead!,Cũng đúng. Vậy đi chụp ở chỗ khác thôi!
lang_multi_text.db,MultiText,Guid_CDYL_17_7,嗯……在哪里拍纪念照比较合适呢？让我看看，这里还有这里……,Hmm... Where would be a good spot for the pictures? Let's see.. Here and here...,"Hmm... chụp ảnh kỷ niệm ở đâu thì hợp nhỉ? Để tôi xem, chỗ này rồi chỗ kia..."
lang_multi_text.db,MultiText,Guid_CDYL_17_8,伊娜拉走开几步，在其他地方寻找合适的拍照点。,"Inara takes a few steps forward, looking for a suitable photo spot somewhere else.","Inara bước đi vài bước, tìm điểm chụp ảnh phù hợp ở chỗ khác."
lang_multi_text.db,MultiText,Guid_CDYL_18_1,真是像画一样美丽又不可思议的地方。,"Such a beautiful and breathtaking place, just like a painting.",Thật là một nơi đẹp như tranh vẽ và kỳ diệu.
lang_multi_text.db,MultiText,Guid_CDYL_18_10,我觉得，我好像在冰原的一个地方，丢了东西。,I feel like I lost something here somewhere.,"Tôi cảm giác, hình như tôi đã đánh rơi thứ gì đó ở một nơi nào đó trên băng nguyên."
lang_multi_text.db,MultiText,Guid_CDYL_18_11,但我……从来没有来过冰原上才对？,"But I... I've never been to the frostlands before, have I?",Nhưng tôi... chưa bao giờ đến băng nguyên mới đúng chứ?
lang_multi_text.db,MultiText,Guid_CDYL_18_12,就当它是存在的。,Let's assume you did lose something.,Cứ coi như nó có thật đi.
lang_multi_text.db,MultiText,Guid_CDYL_18_13,我们一起去寻找它吧。,Let's go look for it together.,Chúng ta cùng đi tìm nó nhé.
lang_multi_text.db,MultiText,Guid_CDYL_18_14,如果它真的存在，我……我们……难道说，那些梦……,"If it does exist, I... We... Does that mean those dreams...","Nếu nó thật sự tồn tại, thì tôi... chúng ta... chẳng lẽ, những giấc mơ đó..."
lang_multi_text.db,MultiText,Guid_CDYL_18_15,……好，我们去找找看。这一次，我来引路。,"Okay, let's go find it. This time, I'll lead the way.","...Ừ, chúng ta đi tìm thử xem. Lần này, để tôi dẫn đường."
lang_multi_text.db,MultiText,Guid_CDYL_18_2,以前我玩建筑游戏，也会把房子建在这样的地方，像瑝珑传说中的世外隐者，或者新联邦传说中的神秘种族。,"When I played building sims, I'd always put houses in places like this, like the hermits from Huanglong legends, or the hidden races you read about in New Federation novels.","Trước đây tôi chơi game xây dựng, cũng hay xây nhà ở những nơi như thế này, giống như ẩn sĩ trong truyền thuyết Hoàng Long, hay chủng tộc bí ẩn trong truyền thuyết Tân Liên Bang."
lang_multi_text.db,MultiText,Guid_CDYL_18_3,不过，后来我就换了个地方造家。,"But later, I started building houses elsewhere.","Nhưng sau đó, tôi đổi chỗ xây nhà rồi."
lang_multi_text.db,MultiText,Guid_CDYL_18_4,为什么？,How come?,Tại sao vậy?
lang_multi_text.db,MultiText,Guid_CDYL_18_5,因为从常去的地方到这种隐秘的景点得跑很远，住在这里又太安静，很容易感到孤独。,I had to travel so far from familiar ground to reach hidden gems like this. And the silence… it just made you feel alone almost immediately.,"Vì từ những nơi hay lui tới đến mấy cảnh đẹp hẻo lánh thế này phải đi xa lắm, mà sống ở đây lại quá yên tĩnh, rất dễ cảm thấy cô đơn."
lang_multi_text.db,MultiText,Guid_CDYL_18_6,当可以欣赏的风景变成习惯，在这里待着，就只能不断地咀嚼回忆……,"When a beautiful view just becomes part of your daily routine, staying here means you're just… living in your own memories.","Khi phong cảnh đáng ngắm trở thành thói quen, ở lại đây chỉ còn biết không ngừng nhai đi nhai lại những ký ức..."
lang_multi_text.db,MultiText,Guid_CDYL_18_7,有时候，梦幻的近义词就是空虚啊。,"Sometimes, dreamy can be another name for emptiness.","Đôi khi, mộng mơ chính là từ đồng nghĩa của trống rỗng."
lang_multi_text.db,MultiText,Guid_CDYL_18_8,怎么突然开始感慨了？,Why the sentiment all of a sudden?,Sao đột nhiên lại cảm khái thế?
lang_multi_text.db,MultiText,Guid_CDYL_18_9,……其实，漂泊者，我来到冰原后，一直有种奇怪的感觉。,"Actually, I've been getting this strange feeling ever since coming to the frostlands.","...Thật ra, Lữ Khách, từ khi đến băng nguyên, tôi cứ có một cảm giác kỳ lạ."
lang_multi_text.db,MultiText,Guid_CDYL_19_1,就在这里……,Right here...,Ngay đây...
lang_multi_text.db,MultiText,Guid_CDYL_1_1,光顾着申请假期，忘了请导游了……,"Ugh, got so caught up booking my time off... Totally forgot to hire a guide...","Mải lo xin nghỉ phép, quên mất chưa thuê hướng dẫn viên..."
lang_multi_text.db,MultiText,Guid_CDYL_20_1,当心！,Watch out!,Cẩn thận!
lang_multi_text.db,MultiText,Guid_CDYL_20_2,这些……这些怪物……就是它们……,These... These monsters... It's them...,Những con... những con quái vật này... chính là chúng...
lang_multi_text.db,MultiText,Guid_CDYL_21_1,就是……这些怪物。我梦到过它们，好几次。,It's them... These monsters. I've dreamt about them several times.,"Chính là... những con quái vật này. Tôi đã mơ thấy chúng, nhiều lần."
lang_multi_text.db,MultiText,Guid_CDYL_21_10,但你记起了你能记起的一切。,But you tried to remember as much as you could.,Nhưng bạn đã nhớ lại được tất cả những gì có thể nhớ.
lang_multi_text.db,MultiText,Guid_CDYL_21_11,……这里……现在，什么都没有留下。,"...It was right here... Now, there is nothing left.","...Ở đây... Giờ, chẳng còn lại gì nữa."
lang_multi_text.db,MultiText,Guid_CDYL_21_12,我没有遗忘什么东西……只是忘记了一部分的自己。,I didn't forget anything... except for a part of myself.,Tôi không quên mất thứ gì... chỉ là quên mất một phần của chính mình.
lang_multi_text.db,MultiText,Guid_CDYL_21_13,并不是这样。,That's not true.,Không phải vậy đâu.
lang_multi_text.db,MultiText,Guid_CDYL_21_14,你看，这里的冰层下有个东西。,"Look, something's beneath the ice.","Nhìn kìa, bên dưới lớp băng ở đây có thứ gì đó."
lang_multi_text.db,MultiText,Guid_CDYL_21_15,你们敲开冰层，取出了被封冻其中的安全盒。,You break open the ice and reveal a frozen safety box.,"Hai người đập vỡ lớp băng, lấy ra chiếc hộp an toàn bị đóng băng bên trong."
lang_multi_text.db,MultiText,Guid_CDYL_21_16,这是科考队的磁带……,It's the expedition team's Cassette...,Đây là băng từ của đội khảo sát...
lang_multi_text.db,MultiText,Guid_CDYL_21_17,你要找的，可能就是它。,This might be what you're looking for.,"Thứ bạn đang tìm, có lẽ chính là nó."
lang_multi_text.db,MultiText,Guid_CDYL_21_18,……抱歉，漂泊者，请让我在这里一个人待一会儿。,"...Sorry, Rover. I need some time alone.","...Xin lỗi, Lữ Khách, để tôi ở đây một mình một lát."
lang_multi_text.db,MultiText,Guid_CDYL_21_2,我梦见我加入了一个探险队，在冰原进行考察。,"I've been dreaming about being on an expedition team, out there investigating the frostlands.","Tôi mơ thấy mình gia nhập một đội thám hiểm, khảo sát trên băng nguyên."
lang_multi_text.db,MultiText,Guid_CDYL_21_3,有人教我打游戏，有人……对元林很感兴趣，讲了很多旧时代的事……,"Some teach me how to play video games, some... are very interested in Upphaf Forest, and talk about the many pre-Lament storie...","Có người dạy tôi chơi game, có người... rất thích tìm hiểu về Rừng Upphaf, kể cho tôi nghe nhiều chuyện thời xưa..."
lang_multi_text.db,MultiText,Guid_CDYL_21_4,后来，我们被怪物追赶，然后，虚质磁暴也突然生成……大家一个接一个地……被……被……,"But later, we are chased by the monsters, and then, a Void Storm hits us out of nowhere... Everyone, one after another... are all... all...","Sau đó, chúng tôi bị quái vật đuổi theo, rồi bão Hư Chất cũng bất ngờ ập đến... Mọi người lần lượt... bị... bị..."
lang_multi_text.db,MultiText,Guid_CDYL_21_5,梦里，我没有一次能回到科考站。我一直都……只是在冰原上，一次又一次地重复……没办法回去。,"In my dreams, I never make it back to the outpost. I'm just… stuck out there in the frostlands. Always. Over and over again... I just can't make it.","Trong mơ, tôi không một lần quay về được trạm khảo sát. Tôi cứ mãi... ở trên băng nguyên, lặp đi lặp lại... không thể quay về."
lang_multi_text.db,MultiText,Guid_CDYL_21_6,（安抚她）,(Comfort her),(An ủi cô ấy)
lang_multi_text.db,MultiText,Guid_CDYL_21_7,我不记得他们的脸，醒来后，我总觉得……那些都是梦。,"I can't remember their faces. Each time I woke up, I always felt... those were just dreams.","Tôi không nhớ khuôn mặt họ, mỗi lần tỉnh dậy, tôi luôn cảm thấy... đó chỉ là giấc mơ."
lang_multi_text.db,MultiText,Guid_CDYL_21_8,漂泊者，那些，不是梦，对不对……？我忘了很重要的事情，对不对？,"Rover, those weren't just dreams... right? I've forgotten something important, haven't I?","Lữ Khách, những thứ đó... không phải giấc mơ, đúng không...? Tôi đã quên mất điều gì đó rất quan trọng, đúng không?"
lang_multi_text.db,MultiText,Guid_CDYL_21_9,有些记忆可能永远都没法回来了。,Some memories might never come back.,Có những ký ức có lẽ mãi mãi không thể lấy lại được.
lang_multi_text.db,MultiText,Guid_CDYL_22_1,谢谢你等我，漂泊者，我已经好多了。,"Thanks for waiting, Rover. I feel much better now.","Cảm ơn bạn đã đợi tôi, Lữ Khách, tôi đã ổn hơn nhiều rồi."
lang_multi_text.db,MultiText,Guid_CDYL_22_2,人的记忆真是不可靠的东西。,Human memory can be so unreliable at times.,Trí nhớ con người thật là thứ không đáng tin.
lang_multi_text.db,MultiText,Guid_CDYL_22_3,就算想要记住什么事，拼命地去重复，也可能在某一天不知不觉地忘记。,"Even if you try to hold onto a memory, repeating it over and over... you can still lose it one day, without even knowing.","Dù có cố gắng nhớ điều gì, lặp đi lặp lại hết sức, vẫn có thể vào một ngày nào đó lặng lẽ quên đi mất."
lang_multi_text.db,MultiText,Guid_CDYL_22_4,好在你还是想起来了。,At least you remember it now.,May là cuối cùng bạn cũng nhớ ra rồi.
lang_multi_text.db,MultiText,Guid_CDYL_22_5,至少梦替你记住了。,The dreams held that memory for you.,Ít nhất giấc mơ đã giữ lại ký ức thay bạn.
lang_multi_text.db,MultiText,Guid_CDYL_22_6,让我们……在这里拍照吧。我会记住这里，再也不忘掉。,Let's... take a picture here. I want to remember this place. I won't forget. Not again.,"Chúng ta... chụp ảnh ở đây đi. Tôi sẽ ghi nhớ nơi này, không bao giờ quên nữa."
lang_multi_text.db,MultiText,Guid_CDYL_23_1,辛苦了，最后让我来给你当一次导游吧。,"Thank you. Now that our trip is wrapping up, allow me be your guide instead.","Vất vả rồi, lần cuối này để tôi làm hướng dẫn viên cho bạn nhé."
lang_multi_text.db,MultiText,Guid_CDYL_23_2,这里是最适合拍纪念照的地方，同事们刚来时，大多会在这里拍照打卡。,This right here is the best photo spot. A lot of my colleagues came straight here when they first got to the outpost.,"Đây là nơi thích hợp nhất để chụp ảnh kỷ niệm, các đồng nghiệp mới đến thường hay chụp ảnh check-in ở đây."
lang_multi_text.db,MultiText,Guid_CDYL_23_3,也请你拍一张属于你的纪念照吧。,You should take a photo for yourself as well.,Bạn cũng hãy chụp một tấm ảnh kỷ niệm của riêng mình đi.
lang_multi_text.db,MultiText,Guid_CDYL_24_1,这里既是科考中心，也是物资的集散枢纽，同时，也是通往地下绿洲的关口。,"Look at this place. The research center, our supply hub, and the gateway to the underground oasis.","Đây vừa là trung tâm nghiên cứu, vừa là đầu mối vận chuyển vật tư, đồng thời cũng là cửa ngõ dẫn đến ốc đảo ngầm."
lang_multi_text.db,MultiText,Guid_CDYL_24_2,这是我们在冰原的起点，也是终点。,"This is where our frostlands journey started, and where it will end.","Đây là điểm bắt đầu của chúng ta trên băng nguyên, cũng là điểm kết thúc."
lang_multi_text.db,MultiText,Guid_CDYL_24_3,就用这张照片做我们旅途的结束吧。,Let's mark the end of our trip with this photo.,Hãy lấy bức ảnh này làm dấu chấm hết cho chuyến đi của chúng ta nhé.
lang_multi_text.db,MultiText,Guid_CDYL_24_4,旅途辛苦了，我们……,"That was a rough journey, we...","Chuyến đi vất vả rồi, chúng ta..."
lang_multi_text.db,MultiText,Guid_CDYL_24_5,我们回来了。,We're back.,Chúng ta đã về rồi.
lang_multi_text.db,MultiText,Guid_CDYL_24_6,嗯，没错！我……我们，回来了。,"Yes, that's right! W-We made it.","Ừ, đúng vậy! Tôi... không, chúng ta, đã về rồi."
lang_multi_text.db,MultiText,Guid_CDYL_24_7,我得去提交这盘磁带，然后还要冲印照片……要做的事情，可是堆积如山。,"I need to submit this Cassette and print out the pictures... Oh, there's so much to do.","Tôi phải đi nộp cuộn băng này, rồi còn phải rửa ảnh nữa... Việc cần làm chất đống luôn."
lang_multi_text.db,MultiText,Guid_CDYL_24_8,谢谢你陪我旅行，这是给你的报酬。,"Thank you for traveling with me. Here's your pay, as we agreed.","Cảm ơn bạn đã đi cùng tôi, đây là thù lao cho bạn."
lang_multi_text.db,MultiText,Guid_CDYL_24_9,下次再见，漂泊者！,"See you next time, Rover!","Hẹn gặp lại, Lữ Khách!"
lang_multi_text.db,MultiText,Guid_CDYL_25_1,真美啊……我为什么没有早点来这里呢。,It's so beautiful... Why didn't I come here sooner?,Đẹp quá... Sao tôi không đến đây sớm hơn nhỉ.
lang_multi_text.db,MultiText,Guid_CDYL_25_2,就在这里拍一张纪念照吧，漂泊者！,"Let's take a picture here, Rover!","Chụp ảnh kỷ niệm ở đây đi, Lữ Khách!"
lang_multi_text.db,MultiText,Guid_CDYL_28_1,你走开了一些。风卷着她的抽泣声，在冰原上留下一道道细微的刻痕。,"You take a few steps away. The wind drowns her soft whimpering, leaving fine marks on the frostlands.","Bạn bước ra xa một chút. Gió cuốn theo tiếng nấc nghẹn của cô ấy, để lại những vết xước mờ nhạt trên băng nguyên."
lang_multi_text.db,MultiText,Guid_CDYL_28_2,不久后，她走到你的身边。,"Not long after, she walks to your side.","Không lâu sau, cô ấy bước đến bên bạn."
lang_multi_text.db,MultiText,Guid_CDYL_2_1,你好，你是漂泊者对吧？,"Hello, you must be Rover?","Xin chào, bạn là Lữ Khách đúng không?"
lang_multi_text.db,MultiText,Guid_CDYL_2_10,现在看来，如果还想在假期逛完冰原所有的景点，就只能寄希望于请到一位好导游了……,"From the looks of it, if I want to see everything the frostlands have to offer during my vacation, my best bet is to find a good guide...","Xem ra, nếu muốn đi hết tất cả các điểm tham quan ở vùng băng nguyên trong kỳ nghỉ, cách duy nhất là tìm được một hướng dẫn viên giỏi thôi..."
lang_multi_text.db,MultiText,Guid_CDYL_2_11,你是希望我做你的导游？,So you want me to be your guide?,Bạn muốn tôi làm hướng dẫn viên cho bạn à?
lang_multi_text.db,MultiText,Guid_CDYL_2_12,没错！我想请你带我去看冰原上值得一看的那些景点，当然，报酬绝对不会少的！,"Exactly! I'd be so grateful if you could show me around all the best spots in the frostlands. Oh, and it comes with good pay, of course!","Đúng vậy! Tôi muốn nhờ bạn dẫn tôi đi xem những cảnh đẹp đáng xem trên băng nguyên. Tất nhiên, thù lao sẽ không thiếu đâu!"
lang_multi_text.db,MultiText,Guid_CDYL_2_13,交给我吧。,I can do that.,Giao cho tôi đi.
lang_multi_text.db,MultiText,Guid_CDYL_2_14,好！事不宜迟，让我们现在就开始吧！,Great! Let's head out right away!,"Tốt! Không nên chần chừ, chúng ta bắt đầu ngay thôi!"
lang_multi_text.db,MultiText,Guid_CDYL_2_15,壮阔的冰原啊，挑战者伊娜拉，现在就要出发了！,"O magnificent frostlands. Challenger Inara, coming your way!","Hỡi băng nguyên hùng vĩ, người thách thức Inara, giờ xin lên đường!"
lang_multi_text.db,MultiText,Guid_CDYL_2_16,你有特别想去的地方吗？,Any specific places in mind?,Bạn có nơi nào đặc biệt muốn đến không?
lang_multi_text.db,MultiText,Guid_CDYL_2_17,要说特别想去啊，那当然是天槎空间站了！这可是新发现的空间站，我做梦都想亲眼去看看。,"Well, if I had to choose, definitely the SkyArk Space Station! It's a newly discovered space station, and I've been dreaming of seeing it with my own eyes.","Nói về nơi đặc biệt muốn đến thì tất nhiên là Trạm Không Gian SkyArk rồi! Đó là trạm không gian mới phát hiện, tôi nằm mơ cũng muốn tận mắt đi xem."
lang_multi_text.db,MultiText,Guid_CDYL_2_18,好，走吧。,"Okay, let's go.","Được, đi thôi."
lang_multi_text.db,MultiText,Guid_CDYL_2_19,嘿嘿……这可是十多年来的第一次旅行！现在就出发吧！,Hehe... This is my first trip in over ten years! Away we go!,Hehe... Đây là chuyến đi đầu tiên sau hơn mười năm! Xuất phát ngay thôi!
lang_multi_text.db,MultiText,Guid_CDYL_2_2,你是？,You are?,Bạn là...?
lang_multi_text.db,MultiText,Guid_CDYL_2_3,我叫伊娜拉，是科考站的维修员。能在这时候遇到你，我都快要相信世上真有命运的存在了！,"I'm Inara, a maintenance worker at the Frostlands Polar Research Outpost. Running into you at a time like this, I'm starting to believe in fate!","Tôi tên Inara, là nhân viên bảo trì ở trạm khảo sát. Gặp được bạn vào lúc này, tôi gần như tin rằng số phận là có thật rồi!"
lang_multi_text.db,MultiText,Guid_CDYL_2_4,也不用这么激动……,No need to get all emotional...,Cũng không cần phấn khích thế đâu...
lang_multi_text.db,MultiText,Guid_CDYL_2_5,先说找我有什么事吧。,"Well, what can I do for you?","Nói trước đi, tìm tôi có chuyện gì vậy?"
lang_multi_text.db,MultiText,Guid_CDYL_2_6,抱歉抱歉，我太激动了。,"Oops, sorry. I got a bit carried away.","Xin lỗi xin lỗi, tôi hơi phấn khích quá."
lang_multi_text.db,MultiText,Guid_CDYL_2_7,事情是这样的。我在科考站工作也有十来年了，一直在忙工作，竟然从没好好看过冰原一眼。,"Here's the thing. I've been hard at work at the outpost for more than a decade now, and I've never taken the time to appreciate the frostlands' view.","Chuyện là thế này. Tôi làm việc ở trạm khảo sát cũng được hơn mười năm rồi, cứ mải mê công việc, chưa bao giờ ngắm nhìn băng nguyên cho tử tế."
lang_multi_text.db,MultiText,Guid_CDYL_2_8,这合理吗？这不合理。所以我请了假，打算好好逛一下冰原。,"Can you believe that? Totally unacceptable to me anyway. So, I finally put in for some time off. I'm going to give this place a proper exploration it deserves.","Hợp lý không? Không hợp lý chút nào. Nên tôi đã xin nghỉ phép, định đi dạo băng nguyên cho đàng hoàng."
lang_multi_text.db,MultiText,Guid_CDYL_2_9,但是出现了新的问题。我一直在忙维修，刚刚急着请假了，也没有提前做过旅游的功课。,"But a new problem has surfaced. Between the endless maintenance work and scrambling to get my leave approved, I did zero trip planning.","Nhưng lại nảy sinh vấn đề mới. Tôi suốt ngày bận sửa chữa, lại vội vàng xin nghỉ, nên chẳng kịp chuẩn bị gì cho chuyến đi cả."
lang_multi_text.db,MultiText,Guid_CDYL_30_1,你还站在原地。,You choose to stay.,Bạn vẫn đứng tại chỗ.
lang_multi_text.db,MultiText,Guid_CDYL_30_2,这里的主人已经离开了。等她回来时，这里还会是现在的样子吗？,Will this place still look the same when the owner returns?,"Chủ nhân của nơi này đã rời đi rồi. Khi cô ấy trở lại, nơi đây liệu có còn như bây giờ không?"
lang_multi_text.db,MultiText,Guid_CDYL_30_3,（举起相机）,(Ready the camera.),(Giơ máy ảnh lên)
lang_multi_text.db,MultiText,Guid_CDYL_31_1,（等她回来时，就把这段时间拍的照片都发给她吧。）,(I'll send her all these photos after she's back.),"(Khi cô ấy trở lại, mình sẽ gửi tất cả ảnh chụp trong thời gian này cho cô ấy.)"
lang_multi_text.db,MultiText,Guid_CDYL_31_2,（现在去看看伊娜拉拍得怎么样了……）,(Should go check on Inara now...),(Giờ đi xem Inara chụp ảnh thế nào rồi...)
lang_multi_text.db,MultiText,Guid_CDYL_3_1,哇——哦——这里的景色，我只在前两天的报告书里见过！,Wow—Oh—This is the view I saw in the reports just two days ago!,"Oa - Ồ - Cảnh ở đây, tôi chỉ mới thấy trong báo cáo hai ngày trước thôi!"
lang_multi_text.db,MultiText,Guid_CDYL_3_2,在现实中亲眼看到，居然有种怀念感……,Seeing it with my own eyes gives me a sense of nostalgia...,"Tận mắt nhìn thấy ngoài đời thật, lại thấy có cảm giác hoài niệm thế nào ấy..."
lang_multi_text.db,MultiText,Guid_CDYL_3_3,快点快点，来拍照吧！,"Quick, take some pictures!","Nhanh nhanh, đi chụp ảnh thôi!"
lang_multi_text.db,MultiText,Guid_CDYL_4_1,从这处空间站被发现到今天，科考站里有将近三分之一的研究员提交了参与发掘的申请。,"Ever since this station was discovered, nearly a third of the outpost have tried to get on the excavation crew.","Từ khi trạm không gian này được phát hiện đến nay, gần một phần ba nhà nghiên cứu ở trạm khảo sát đã nộp đơn xin tham gia khai quật."
