db_file,table_name,id,zh,en,vi
lang_multi_text.db,MultiText,PrefabTextItem_2401488138_Text,次日,Next Day,Ngày kế tiếp
lang_multi_text.db,MultiText,PrefabTextItem_2401875494_Text,渔船货舱,Cargo,Khoang hàng
lang_multi_text.db,MultiText,PrefabTextItem_2401915210_Text,未完成,Ongoing,Chưa hoàn thành
lang_multi_text.db,MultiText,PrefabTextItem_2403060325_Text,选择共鸣者,Select Resonator,Chọn Cộng Hưởng Giả
lang_multi_text.db,MultiText,PrefabTextItem_240337158_Text,开启,Open,Bật
lang_multi_text.db,MultiText,PrefabTextItem_2404346017_Text,已购买,Purchased,Đã mua
lang_multi_text.db,MultiText,PrefabTextItem_2404364582_Text,存在异常，如有疑问请联系官方客服,Please contact our Customer Service for assistance,"Đã xảy ra lỗi, nếu có thắc mắc vui lòng liên hệ bộ phận hỗ trợ."
lang_multi_text.db,MultiText,PrefabTextItem_24053136_Text,合成,Synthesize,Tổng hợp
lang_multi_text.db,MultiText,PrefabTextItem_2405789322_Text,多人模式,Co-op Mode,Chế độ nhiều người
lang_multi_text.db,MultiText,PrefabTextItem_2406526459_Text,[紧急信息],[Urgent Message],[Tin khẩn cấp]
lang_multi_text.db,MultiText,PrefabTextItem_240707000_Text,炼狱,Helltide Mode,Luyện Ngục
lang_multi_text.db,MultiText,PrefabTextItem_2407407756_Text,排行榜,Ranking,Bảng xếp hạng
lang_multi_text.db,MultiText,PrefabTextItem_2408796129_Text,存在异常，如有疑问请联系官方客服,Please contact our Customer Service for assistance,"Đã xảy ra lỗi, nếu có thắc mắc vui lòng liên hệ bộ phận hỗ trợ."
lang_multi_text.db,MultiText,PrefabTextItem_2409124858_Text,领取,Claim,Nhận
lang_multi_text.db,MultiText,PrefabTextItem_2409447847_Text,副本机制说明,Challenge Info,Thông tin phụ bản
lang_multi_text.db,MultiText,PrefabTextItem_2410072478_Text,儿童隐私政策,Privacy Policy for Children,Chính sách bảo mật trẻ em
lang_multi_text.db,MultiText,PrefabTextItem_2410279306_Text,存在异常，如有疑问请联系官方客服,Please contact our Customer Service for assistance,"Đã xảy ra lỗi, nếu có thắc mắc vui lòng liên hệ bộ phận hỗ trợ."
lang_multi_text.db,MultiText,PrefabTextItem_2413333444_Text,正在申请,Applying,Đang gửi yêu cầu
lang_multi_text.db,MultiText,PrefabTextItem_2414529224_Text,切换到PSN™的好友,Friends on PSN only,Chuyển sang bạn bè PSN™
lang_multi_text.db,MultiText,PrefabTextItem_2414617389_Text,请探索世界发现更多,Explore to discover,Hãy khám phá thế giới để tìm thêm
lang_multi_text.db,MultiText,PrefabTextItem_2414637917_Text,孤绝险地,Deathtrap Mode,Hiểm Địa Tuyệt Cảnh
lang_multi_text.db,MultiText,PrefabTextItem_2415080425_Text,噩梦模因,Nightmare Memes,Meme Ác Mộng
lang_multi_text.db,MultiText,PrefabTextItem_241740385_Text,已开启,Unlocked,Đã mở khóa
lang_multi_text.db,MultiText,PrefabTextItem_241797188_Text,中量,Medium,Trung bình
lang_multi_text.db,MultiText,PrefabTextItem_2418229450_Text,存在异常，如有疑问请联系官方客服,Please contact our Customer Service for assistance,"Đã xảy ra lỗi, nếu có thắc mắc vui lòng liên hệ bộ phận hỗ trợ."
lang_multi_text.db,MultiText,PrefabTextItem_2419044000_Text,战略数据总分,Total Tactic Points,Tổng điểm dữ liệu chiến thuật
lang_multi_text.db,MultiText,PrefabTextItem_2419257513_Text,灵光一闪,Eureka,Tia Sáng Bất Chợt
lang_multi_text.db,MultiText,PrefabTextItem_2419583339_Text,积分详情,Point Details,Chi tiết điểm
lang_multi_text.db,MultiText,PrefabTextItem_2420070682_Text,选择支援声骸,Select Support Echo,Chọn Thanh Hài hỗ trợ
lang_multi_text.db,MultiText,PrefabTextItem_2420743929_Text,存在异常，如有疑问请联系官方客服,Please contact our Customer Service for assistance,"Đã xảy ra lỗi, nếu có thắc mắc vui lòng liên hệ bộ phận hỗ trợ."
lang_multi_text.db,MultiText,PrefabTextItem_2422856748_Text,"重置将清空当前挑战记录并返还支援可用次数，
是否继续重置？","Resetting will clear the current challenge record and restore Support usage attempts.
Proceed to reset?","Đặt lại sẽ xóa toàn bộ tiến trình thử thách hiện tại và hoàn trả số lần hỗ trợ khả dụng.
Bạn có muốn tiếp tục đặt lại không?"
lang_multi_text.db,MultiText,PrefabTextItem_2422873242_Text,点击屏幕关闭,"{Cus:Ipt,Touch=Tap PC=Click Gamepad=Tap} anywhere to close","{Cus:Ipt,Touch=Chạm PC=Nhấn Gamepad=Nhấn} vào bất kỳ đâu để đóng"
lang_multi_text.db,MultiText,PrefabTextItem_2422966752_Text,推荐：前往拉海洛,Next Stop: Lahai-Roi,Gợi ý: Đến Lahai-Roi
lang_multi_text.db,MultiText,PrefabTextItem_2423096481_Text,完成活动可获得大量积分，丰厚奖励等您来兑换,Complete the event for a large amount of points and various rewards,"Hoàn thành sự kiện để nhận nhiều điểm, đổi lấy phần thưởng hấp dẫn"
lang_multi_text.db,MultiText,PrefabTextItem_242422528_Text,通关解锁,Clear to unlock,Hoàn thành để mở khóa
lang_multi_text.db,MultiText,PrefabTextItem_242486408_Text,前往,Proceed,Đi đến
lang_multi_text.db,MultiText,PrefabTextItem_2424924393_Text,主战,Main,Chủ lực
lang_multi_text.db,MultiText,PrefabTextItem_2425503197_Text,无音区,Tacet Field,Vùng Vô Thanh
lang_multi_text.db,MultiText,PrefabTextItem_2425792727_Text,拼凑的梦,Dream Shards,Giấc Mơ Chắp Vá
lang_multi_text.db,MultiText,PrefabTextItem_2427056257_Text,当前负荷等级,Current Stress Level,Cấp tải hiện tại
lang_multi_text.db,MultiText,PrefabTextItem_2428027680_Text,前往试用,Proceed to Trial,Đi dùng thử
lang_multi_text.db,MultiText,PrefabTextItem_2429768376_Text,当前暂无正在开放的角色活动唤取,No available Featured Resonator Convene,Hiện không có Triệu Hồi nhân vật sự kiện nào đang mở
lang_multi_text.db,MultiText,PrefabTextItem_2430246858_Text,领取,Claim,Nhận
lang_multi_text.db,MultiText,PrefabTextItem_2430559833_Text,保存卡组,Save Deck,Lưu bộ bài
lang_multi_text.db,MultiText,PrefabTextItem_243245814_Text,提前结算可获得,Rewards for Early Completion,Kết thúc sớm có thể nhận
lang_multi_text.db,MultiText,PrefabTextItem_2432644408_Text,购买后立即获取,Purchase to obtain,Nhận ngay sau khi mua
lang_multi_text.db,MultiText,PrefabTextItem_243339163_Text,持有,Owned,Đang có
lang_multi_text.db,MultiText,PrefabTextItem_2437772000_Text,存在异常，如有疑问请联系官方客服,Please contact our Customer Service for assistance,"Đã xảy ra lỗi, nếu có thắc mắc vui lòng liên hệ bộ phận hỗ trợ"
lang_multi_text.db,MultiText,PrefabTextItem_2438775412_Text,存在异常，如有疑问请联系官方客服,Please contact our Customer Service for assistance,"Đã xảy ra lỗi, nếu có thắc mắc vui lòng liên hệ bộ phận hỗ trợ"
lang_multi_text.db,MultiText,PrefabTextItem_2439208255_Text,持有,Owned,Đang có
lang_multi_text.db,MultiText,PrefabTextItem_2440053597_Text,存在异常，如有疑问请联系官方客服,Please contact our Customer Service for assistance,"Đã xảy ra lỗi, nếu có thắc mắc vui lòng liên hệ bộ phận hỗ trợ"
lang_multi_text.db,MultiText,PrefabTextItem_2440641917_Text,点击装配支援模组,Select a Support Module,Nhấn để lắp mô-đun hỗ trợ
lang_multi_text.db,MultiText,PrefabTextItem_244175900_Text,通关获得异想积分,Clear to obtain Illusive Points,Hoàn thành để nhận Điểm Kỳ Tưởng
lang_multi_text.db,MultiText,PrefabTextItem_2442732437_Text,05,5.0,5.0
lang_multi_text.db,MultiText,PrefabTextItem_2446779351_Text,案情描述,Case Details,Mô tả vụ án
lang_multi_text.db,MultiText,PrefabTextItem_2447040641_Text,委托完成,Completed,Ủy thác hoàn thành
lang_multi_text.db,MultiText,PrefabTextItem_2449097132_Text,预览,Preview,Xem trước
lang_multi_text.db,MultiText,PrefabTextItem_2449168566_Text,队友状态：,Ally status:,Trạng thái đồng đội:
lang_multi_text.db,MultiText,PrefabTextItem_2450501607_Text,我方卡组,Your Deck,Bộ bài của bạn
lang_multi_text.db,MultiText,PrefabTextItem_2451894850_Text,存在异常，如有疑问请联系官方客服,Please contact our Customer Service for assistance,"Đã xảy ra lỗi, nếu có thắc mắc vui lòng liên hệ bộ phận hỗ trợ"
lang_multi_text.db,MultiText,PrefabTextItem_2452189800_Text,返回,Back,Quay lại
lang_multi_text.db,MultiText,PrefabTextItem_2454993840_Text,存在异常，如有疑问请联系官方客服,Please contact our Customer Service for assistance,"Đã xảy ra lỗi, nếu có thắc mắc vui lòng liên hệ bộ phận hỗ trợ"
lang_multi_text.db,MultiText,PrefabTextItem_2458379257_Text,经营伙伴,Companions,Đối tác kinh doanh
lang_multi_text.db,MultiText,PrefabTextItem_2459806885_Text,剩余次数,Remaining Attempts,Số lần còn lại
lang_multi_text.db,MultiText,PrefabTextItem_2462272635_Text,邮贴不足，完成活动挑战获取更多,Insufficient Stamps. Complete event challenges to obtain more.,"Không đủ tem, hoàn thành thử thách sự kiện để nhận thêm."
lang_multi_text.db,MultiText,PrefabTextItem_2463751744_Text,确认,Confirm,Xác nhận
lang_multi_text.db,MultiText,PrefabTextItem_2463788865_Text,"可输入目标IP地址
如果有输入会覆盖上面选择的服务器","Type in target IP address 

Might override the Server you chose","Có thể nhập địa chỉ IP mục tiêu
Nếu có nhập sẽ ghi đè máy chủ đã chọn ở trên"
lang_multi_text.db,MultiText,PrefabTextItem_2467822365_Text,伙伴属性,Companions Stats,Chỉ số đồng đội
lang_multi_text.db,MultiText,PrefabTextItem_2468287861_Text,领取,Claim,Nhận
lang_multi_text.db,MultiText,PrefabTextItem_246833343_Text,尚未完成挑战,No Challenge Record,Chưa hoàn thành thử thách
lang_multi_text.db,MultiText,PrefabTextItem_2468919456_Text,战斗风格,Combat Role,Phong cách chiến đấu
lang_multi_text.db,MultiText,PrefabTextItem_2471459355_Text,平息！慌乱的迁徙！,Rein Back! Migration Mayhem!,Bình định! Cuộc di cư hỗn loạn!
lang_multi_text.db,MultiText,PrefabTextItem_247390283_Text,存在异常，如有疑问请联系官方客服,Please contact our Customer Service for assistance,"Đã xảy ra lỗi, nếu có thắc mắc vui lòng liên hệ bộ phận hỗ trợ"
lang_multi_text.db,MultiText,PrefabTextItem_2474211414_Text,已有补给品,Owned,Vật tư đã có
lang_multi_text.db,MultiText,PrefabTextItem_2475182261_Text,退出捕捞,Stop Fishing,Ngừng câu cá
lang_multi_text.db,MultiText,PrefabTextItem_2475434582_Text,dnt/奖励预览,Rewards Preview,dnt/Xem trước phần thưởng
lang_multi_text.db,MultiText,PrefabTextItem_2476255986_Text,特殊机制,Special Mechanism,Cơ chế đặc biệt
lang_multi_text.db,MultiText,PrefabTextItem_2477542511_Text,补给品选择,Support Item Selection,Chọn vật tư tiếp tế
lang_multi_text.db,MultiText,PrefabTextItem_2478633694_Text,调优后的效果,New Substats,Hiệu quả sau khi tinh chỉnh
lang_multi_text.db,MultiText,PrefabTextItem_2479816042_Text,存在异常，如有疑问请联系官方客服,Please contact our Customer Service for assistance,"Đã xảy ra lỗi, nếu có thắc mắc vui lòng liên hệ bộ phận hỗ trợ"
lang_multi_text.db,MultiText,PrefabTextItem_2480680608_Text,重奏荣礼,Reprise Bounty,Phần thưởng Trùng Tấu
lang_multi_text.db,MultiText,PrefabTextItem_2480800926_Text,暴击,Crit. Rate,Bạo kích
lang_multi_text.db,MultiText,PrefabTextItem_2481885119_Text,未解锁,Locked,Chưa mở khóa
lang_multi_text.db,MultiText,PrefabTextItem_2481964532_Text,x8,x8,x8
lang_multi_text.db,MultiText,PrefabTextItem_2482817690_Text,再次挑战,Challenge Again,Thử thách lại
lang_multi_text.db,MultiText,PrefabTextItem_2486310355_Text,前往编队,Edit Team,Đến đội hình
lang_multi_text.db,MultiText,PrefabTextItem_2486566913_Text,物资调集,Limited Supply,Tiếp tế vật tư
lang_multi_text.db,MultiText,PrefabTextItem_2486827092_Text,直接开始,New Challenge,Bắt đầu ngay
lang_multi_text.db,MultiText,PrefabTextItem_2487530449_Text,请选择车架,Select a Chassis,Vui lòng chọn khung xe
lang_multi_text.db,MultiText,PrefabTextItem_248779732_Text,暂无搜索结果,No detectable result,Không có kết quả tìm kiếm
lang_multi_text.db,MultiText,PrefabTextItem_2488260116_Text,章节所有结局完成进度,Unlocked Endings,Tiến độ hoàn thành tất cả kết cục của chương
lang_multi_text.db,MultiText,PrefabTextItem_2488330140_Text,·,·,.
lang_multi_text.db,MultiText,PrefabTextItem_2488881142_Text,乐园道具,Prop,Đạo cụ Lạc Viên
lang_multi_text.db,MultiText,PrefabTextItem_2489933735_Text,特殊道具,Specials,Đạo cụ đặc biệt
lang_multi_text.db,MultiText,PrefabTextItem_2490093636_Text,材料不足,Insufficient Materials,Không đủ nguyên liệu
lang_multi_text.db,MultiText,PrefabTextItem_249083484_Text,存在异常，如有疑问请联系官方客服,Please contact our Customer Service for assistance,Ngọn lửa cứ bùng cháy mãi...
lang_multi_text.db,MultiText,PrefabTextItem_2491326723_Text,波次,Wave,Đợt
lang_multi_text.db,MultiText,PrefabTextItem_2491645491_Text,重置,Reset,Đặt lại
lang_multi_text.db,MultiText,PrefabTextItem_249212813_Text,通过时间,Clear Time,Thời gian hoàn thành
lang_multi_text.db,MultiText,PrefabTextItem_2493121083_Text,*先约电台寰宇频道正式版本为购买解锁，本轮测试可通过邮件领取解锁道具。,*You will need to purchase to unlock the Insider Channel in official version. Items unlocked in this test will be send by mail.,"*Kênh Hoàn Vũ của Đài Hiệp Ước Tiên Phong trong phiên bản chính thức cần mua để mở khóa. Trong đợt thử nghiệm này, bạn có thể nhận vật phẩm mở khóa qua thư."
