db_file,table_name,id,zh,en,vi
lang_multi_text.db,MultiText,Character_Brant_48_6,你们在这里好好的，别让任何人妨碍到我。要是有人来了，就让他们见识见识我们的厉害！,"Stay here and await my return. And if anyone dares to get in our way, make them rue the day!","Các ngươi ở đây cho tốt, đừng để ai cản trở ta. Nếu có ai đến, hãy cho chúng biết tay chúng ta lợi hại thế nào!"
lang_multi_text.db,MultiText,Character_Brant_48_7,呜呜呜呜呜呜，船长，哦，船长！,"Captain! Oh, captain!","Hu hu hu hu hu hu, thuyền trưởng, ôi, thuyền trưởng!"
lang_multi_text.db,MultiText,Character_Brant_49_1,你们两个，给我停下！,"Hey, you two! Stop right there!","Hai người kia, đứng lại cho ta!"
lang_multi_text.db,MultiText,Character_Brant_49_10,你们见到了爱蒂奇的手下，但他们似乎并不想听你们说话，只想让你们见识见识海盗的厉害。,"You run into Aldric's underlings, but they don't seem to be in a talking mood. All they care about is showing you what pirates are made of.","Các cậu gặp phải thuộc hạ của Aldric, nhưng bọn chúng dường như không muốn nghe các cậu nói, chỉ muốn cho các cậu biết hải tặc lợi hại thế nào."
lang_multi_text.db,MultiText,Character_Brant_49_2,你叫我们吗？,Are you talking to us?,Anh gọi chúng tôi à?
lang_multi_text.db,MultiText,Character_Brant_49_3,我们只是路过。,We're just passing by.,Chúng tôi chỉ đi ngang qua thôi.
lang_multi_text.db,MultiText,Character_Brant_49_4,对！就是你们，船长都说了！,Yeah! You two.,"Đúng! Chính hai người đó, thuyền trưởng đã nói rồi!"
lang_multi_text.db,MultiText,Character_Brant_49_5,放屁！你们一定不是路过，船长都说了！,Nonsense! My eyes tell me you're not just passing by.,"Nói láo! Các ngươi chắc chắn không phải đi ngang qua, thuyền trưởng đã nói rồi!"
