db_file,table_name,id,zh,en,vi
lang_multi_text.db,MultiText,Character_Brant_36_29,终于能体验掌舵的乐趣了。,I'm ready to take the wheel this time.,Cuối cùng cũng được thưởng thức cảm giác cầm lái rồi.
lang_multi_text.db,MultiText,Character_Brant_36_3,至少我们救下了这些无辜的声骸。,At least we saved those innocent Echoes.,Ít nhất chúng ta đã cứu được những Thanh Hài vô tội này.
lang_multi_text.db,MultiText,Character_Brant_36_30,那就走吧！这回，就让我来为你指引方向。,Off we go! I'll lead the way.,"Vậy thì đi thôi! Lần này, để tôi dẫn đường cho cậu."
lang_multi_text.db,MultiText,Character_Brant_36_31,"你们拿到硬币，爱蒂奇却趁乱逃走。
现在你们获得了地图，该出发去寻找宝藏了！
剧团的贡多拉就停留在客运港，该去体验掌舵的乐趣了！","Having lost the coin to you, Aldric makes a break for it amidst the chaos.
You finally have the map. To the treasure!
There's a troupe Gondola docked at the passenger port. Time to give the steering some spin!","Các cậu lấy được đồng xu, nhưng Aldric lại thừa loạn bỏ trốn.
Giờ các cậu đã có bản đồ, đến lúc lên đường tìm kho báu rồi!
Gondola của đoàn kịch đang đậu ở cảng khách, đến lúc thưởng thức cảm giác cầm lái rồi!"
lang_multi_text.db,MultiText,Character_Brant_36_4,嗯，但我感觉之后我们还会再见到他。,"Don't worry, Captain. I've got a feeling our paths will cross again soon enough.","Ừm, nhưng tôi có linh cảm sau này chúng ta sẽ gặp lại hắn."
lang_multi_text.db,MultiText,Character_Brant_36_5,是啊，我们还拿回了这半枚硬币。下次去拉古那城，我就把这半枚归还给贝拉。,"Indeed, and we reclaimed this half-coin. And next time we're in Ragunna, we'll return it to Bella.","Đúng vậy, chúng ta còn lấy lại được nửa đồng xu này. Lần sau đến thành Ragunna, tôi sẽ trả lại nửa này cho Bella."
lang_multi_text.db,MultiText,Character_Brant_36_6,不过我总觉得，之后我们还会再见到爱蒂奇。,I've got a feeling we'll cross paths with Aldric again soon enough.,"Nhưng tôi cứ có cảm giác, sau này chúng ta sẽ gặp lại Aldric."
lang_multi_text.db,MultiText,Character_Brant_36_7,谢……寂寞寂……寞！,Lottie… Lost!,Tạ... tịch mịch tịch... mịch!
lang_multi_text.db,MultiText,Character_Brant_36_8,她看起来挺开心的。,I can tell she's happier now.,Cô ấy trông có vẻ vui lắm.
lang_multi_text.db,MultiText,Character_Brant_36_9,她在说Bravo！,"She's saying ""Bravo!""",Cô ấy đang nói Bravo!
lang_multi_text.db,MultiText,Character_Brant_37_1,到客运港了。船长你看，我们的贡多拉就在前面。,"Here we are, Captain—the port. See that Gondola over there? That's ours.","Đến cảng khách rồi. Thuyền trưởng nhìn kìa, chiếc Gondola của chúng ta ở ngay phía trước."
lang_multi_text.db,MultiText,Character_Brant_37_2,有时候，剧团会用它搭建临时的舞台，来场即兴表演。,"Sometimes, we set up a temporary stage on it for impromptu performances. Keeps things lively.","Đôi khi, đoàn kịch sẽ dùng nó để dựng sân khấu tạm, biểu diễn ngẫu hứng một màn."
lang_multi_text.db,MultiText,Character_Brant_38_1,船长，我已经把第一个岛屿的位置发到你的终端了。,I've sent the coordinates of the first isle to your Terminal.,"Thuyền trưởng, tôi đã gửi tọa độ hòn đảo đầu tiên đến thiết bị đầu cuối của cậu rồi."
lang_multi_text.db,MultiText,Character_Brant_38_2,接下来，只需要朝着目标点全速前进！,"Now, all we need to do is sail full speed ahead toward our destination!","Tiếp theo, chỉ cần tiến thẳng về mục tiêu với tốc độ tối đa thôi!"
lang_multi_text.db,MultiText,Character_Brant_39_1,快到渡口了，我们入港吧。,We're nearing the dock. Let's head in.,"Sắp đến bến rồi, chúng ta cập cảng thôi."
lang_multi_text.db,MultiText,Character_Brant_3_1,只有半打？不像你啊，好巴蒂尔！,"Only a six-pack? That's unlike you, Battier!","Chỉ có nửa tá thôi sao? Không giống cậu chút nào, Battier!"
lang_multi_text.db,MultiText,Character_Brant_3_10,巴蒂尔说他一定先起竿，拿出半打小麦精酿和我赌。,"Battier fancies himself my rival, so he's wagering his prized stash of wheat liquor.","Battier nói anh ta nhất định sẽ câu được trước, đem nửa tá bia lúa mì thượng hạng ra cá cược với tôi."
lang_multi_text.db,MultiText,Character_Brant_3_11,埃格拉的精酿你尝过没？甜润醇厚，绝对是能让你回味的口感。,"Believe me, that stuff from Egla Town is pure heaven—smooth, sweet… I can almost taste it already.","Bia thủ công của thị trấn Egla cậu đã thử chưa? Ngọt dịu, đậm đà, chắc chắn là hương vị khiến cậu nhớ mãi."
lang_multi_text.db,MultiText,Character_Brant_3_12,这么有自信啊船长，那我再押上一瓶「剧团烈度」，大家今天尽兴！,"Confident, are we? Let's sweeten the stakes. I'll toss in a bottle of Troupe Strength. Everyone's in for some fine spoils tonight!","Tự tin thế cơ à thuyền trưởng, vậy tôi thêm một chai ""Liệt Độ Kịch Đoàn"" nữa, hôm nay mọi người vui hết mình!"
lang_multi_text.db,MultiText,Character_Brant_3_13,这么爽快？那你要我赌上多少，报个数呗？,"Ha! A bold move, Battier! Let's make this really interesting. What would you have me wager?","Sảng khoái thế? Vậy cậu muốn tôi đặt cược bao nhiêu, nói đi!"
lang_multi_text.db,MultiText,Character_Brant_3_14,不不不，难得{PlayerName}来一次，还是酒来酒去的多没劲。,"Oh no, Captain, we're not just betting drinks today. Not with {PlayerName} as our guest!","Không không không, hiếm khi {PlayerName} đến chơi, cứ cá cược rượu qua rượu lại thì chán chết."
lang_multi_text.db,MultiText,Character_Brant_3_15,这样船长，要是我的杆先起，你就得给值日的兄弟们放个假，大家可都想再见一见狂欢节的「桂冠」呢。,"How about this? If I win, you give the crew a day off. We all want to hang out with the Carnevale's Laureate again!","Thế này nhé thuyền trưởng, nếu cần câu của tôi giật trước, cậu phải cho anh em trực nhật nghỉ một ngày, mọi người đều muốn gặp lại ""Quế Quán"" của lễ hội hóa trang đấy."
lang_multi_text.db,MultiText,Character_Brant_3_16,至于这一天的烧菜、擦甲板、擦武器……就得交给你咯！,"And you, Captain, will handle all the chores. Cooking, cleaning, deck scrubbing—the whole kit and caboodle!","Còn chuyện nấu cơm, lau sàn tàu, lau vũ khí trong ngày hôm đó... thì giao hết cho cậu nhé!"
lang_multi_text.db,MultiText,Character_Brant_3_17,布兰特和巴蒂尔就赌局讨论得热火朝天，而你注意到他们身后的鱼竿正在抖动——,"As Brant and Battier heatedly discuss the stakes, you notice the fishing rod twitching, the line pulling tight—","Brant và Battier tranh luận về cuộc cá cược sôi nổi, còn bạn lại chú ý thấy cần câu phía sau họ đang rung lên-"
lang_multi_text.db,MultiText,Character_Brant_3_18,起竿了！,The rod! Reel it in!,Cá cắn câu rồi!
lang_multi_text.db,MultiText,Character_Brant_3_19,遗憾！布兰特和巴蒂尔并没有注意到你的提醒，或许现在就算主座来这里布道，也得等他们先结束这场「光荣的赌局」。,"Neither Brant nor Battier pays you any mind, completely absorbed in their wager. Their focus is so intense that even the Primus himself would be made to wait until the bet is settled.","Đáng tiếc! Brant và Battier chẳng hề chú ý đến lời nhắc của bạn. Có lẽ bây giờ dù Chủ Tọa có đến đây thuyết giảng, cũng phải đợi họ kết thúc ""cuộc cá cược vinh quang"" này đã."
lang_multi_text.db,MultiText,Character_Brant_3_2,啧啧，这可是埃格拉小镇的上品精酿，可别说我抠门了啊。,"Tsk, this isn't just any drink. I brought the finest brew from Egla Town! Cost me a pretty penny, you know.","Tsk tsk, đây là bia thượng hạng của thị trấn Egla đấy, đừng nói tôi keo kiệt nhé."
lang_multi_text.db,MultiText,Character_Brant_3_20,行，也是有段日子没下厨了，正好给你们露一手！,"Deal! It's been too long since I last cooked for the crew. If I lose, I'll show you all what this captain can whip up in the galley!","Được thôi, cũng lâu rồi chưa vào bếp, nhân tiện trổ tài cho các cậu xem!"
lang_multi_text.db,MultiText,Character_Brant_3_21,（拉起鱼竿）,(Reel in the fishing rod.),(Kéo cần câu lên)
lang_multi_text.db,MultiText,Character_Brant_3_22,你感受到鱼竿底下传来的重量，这一定是一条足以让赌局结束的大鱼，值得你使出全身的力气——,The weight tugs heavily—this is no small catch. It must be sizeable enough to decide the outcome of the bet in one swift motion. You reel it in...,"Bạn cảm nhận được sức nặng truyền từ đáy cần câu, chắc chắn đây là một con cá lớn đủ để kết thúc cuộc cá cược, xứng đáng để bạn dồn hết sức-"
lang_multi_text.db,MultiText,Character_Brant_3_23,一条大鱼被你拉出水面！从它的眼里可以看出，这七秒它都要沉浸在离开亲密海洋拥抱空气这件事里了。,"And there it is! A colossal fish, flopping in the air with a look of sheer disbelief in its eyes. Well, fishy friend, bid goodbye to the water and say hello to dry land!","Một con cá lớn bị bạn kéo lên khỏi mặt nước! Nhìn vào mắt nó có thể thấy, bảy giây này nó sẽ chìm đắm trong việc rời xa vòng tay đại dương thân thiết để ôm lấy không khí."
lang_multi_text.db,MultiText,Character_Brant_3_24,快看，好大一条鱼！,"By the Sentinel, look at the size of that beast!","Nhìn kìa, con cá to quá!"
lang_multi_text.db,MultiText,Character_Brant_3_25,这鱼大的，一锅炖不下吧……,Do we even have a pot big enough to cook it?,"Con cá to thế này, một nồi chắc không đủ chỗ..."
lang_multi_text.db,MultiText,Character_Brant_3_26,这鱼竿……好像是巴蒂尔的？,Wait a minute... isn't that Battier's rod?,Cần câu này... hình như là của Battier?
lang_multi_text.db,MultiText,Character_Brant_3_27,……,…,...
lang_multi_text.db,MultiText,Character_Brant_3_28,……,…,...
lang_multi_text.db,MultiText,Character_Brant_3_29,如此出乎意料的结局，我喜欢！,"Well, well, I didn't see that coming! But I do relish a good twist.","Kết cục bất ngờ thế này, tôi thích đấy!"
lang_multi_text.db,MultiText,Character_Brant_3_3,再加半打吧，好巴蒂尔，今晚大家不醉不归！,"Aye! Battier, my good friend, add one more six-pack. Tonight, this deck will be riotous with our revelry!","Thêm nửa tá nữa đi, Battier, tối nay mọi người không say không về!"
lang_multi_text.db,MultiText,Character_Brant_3_30,嚯，这可是条鱼王，不错啊伙计！这下布兰特没得酒喝了，还要擦一天的甲板，哈哈哈。,"What's that, the Fish King himself? Well done, my friend! And congrats, Captain, you've just won yourself a day full of chores, haha!","Ồ, đây là cá chúa luôn, giỏi lắm bạn! Lần này Brant hết rượu uống rồi, lại còn phải lau sàn tàu cả ngày nữa, hahaha."
lang_multi_text.db,MultiText,Character_Brant_3_31,没问题，愿赌服输，今天我就是值日船员！,"Very well, a bet's a bet. Looks like I'm a humble sailor today.","Không vấn đề gì, thua cược thì chịu phạt, hôm nay tôi là thủy thủ trực nhật!"
lang_multi_text.db,MultiText,Character_Brant_3_32,可这样一来，谁做船长呢？,"If you're playing sailor, then who's gonna be our captain?",Nhưng như vậy thì ai làm thuyền trưởng đây?
lang_multi_text.db,MultiText,Character_Brant_3_33,哈哈，当然是谁赢谁做船长了。,Who do you think?!,"Haha, tất nhiên là ai thắng thì người đó làm thuyền trưởng rồi."
lang_multi_text.db,MultiText,Character_Brant_3_34,{PlayerName}钓上条这么大的鱼，又是狂欢节的「桂冠」，让{TA}做一天船长不过分吧！,Feast your eyes on that great fish {Male=he;Female=she} caught! I'd say our Laureate is more than qualified to steer this ship!,"{PlayerName} câu được con cá to thế kia, lại còn là ""Quế Quán"" của lễ hội, để {TA} làm thuyền trưởng một ngày cũng không quá đáng chứ!"
lang_multi_text.db,MultiText,Character_Brant_3_35,我做船长，真的假的？,Me? A captain? You must be joking.,"Tôi làm thuyền trưởng, thật hay đùa đấy?"
lang_multi_text.db,MultiText,Character_Brant_3_36,当船长好说，有报酬就行。,"I'll be whatever you want, provided I'm compensated.","Làm thuyền trưởng thì dễ thôi, có thù lao là được."
lang_multi_text.db,MultiText,Character_Brant_3_37,当然没问题，我相信你的能力，你一定会是一个好船长的。,I've got no doubt you'd make a great captain.,"Tất nhiên không vấn đề gì, tôi tin vào năng lực của cậu, cậu nhất định sẽ là một thuyền trưởng giỏi."
lang_multi_text.db,MultiText,Character_Brant_3_38,当然有，我们可是正经船队。,"Absolutely, my friend. We sail straight!","Tất nhiên có chứ, chúng tôi là đội tàu nghiêm chỉnh mà."
lang_multi_text.db,MultiText,Character_Brant_3_39,不过，究竟要不要接下这个「一日船长」的身份，还是得看你的意愿。,"But no pressure, of course. It's entirely up to you whether you wish to take command.","Tuy nhiên, rốt cuộc có muốn nhận danh hiệu ""thuyền trưởng một ngày"" hay không, vẫn phải tùy ý cậu thôi."
lang_multi_text.db,MultiText,Character_Brant_3_4,你们在做什么？,What are you doing here?,Các người đang làm gì vậy?
lang_multi_text.db,MultiText,Character_Brant_3_40,比起这个，今天你可一定要留下来吃晚饭呀，我们的精酿还等着它的主人呢。,"Setting that aside, why not join us for dinner? Trust me, you won't want to miss the liquor you won for us.","So với chuyện đó, hôm nay cậu nhất định phải ở lại ăn tối nhé, rượu tinh chế của chúng tôi còn đang chờ chủ nhân của nó kìa."
lang_multi_text.db,MultiText,Character_Brant_3_41,之前你帮剧团那么大的忙，趁着这次机会可得好好犒劳你一下。,"Allow us to thank you properly for all the help you've given. So, what say you? Will you honor us with your presence?","Trước đó cậu đã giúp đoàn kịch nhiều như vậy, nhân dịp này phải chiêu đãi cậu cho đàng hoàng mới được."
lang_multi_text.db,MultiText,Character_Brant_3_42,是啊，而且今天还钓上一条这么大的鱼，可以吃顿好的。,"You must! And with that beast of a fish you just hauled in, tonight's feast will be unforgettable. Come, fill your belly. It's the least you deserve!","Đúng vậy, hơn nữa hôm nay còn câu được con cá to thế kia, có thể ăn một bữa ngon rồi."
lang_multi_text.db,MultiText,Character_Brant_3_43,我这就去告诉后厨，顺便把我那几瓶酒找出来。,"Right then, I'm off to let the kitchen know what's coming and to dig up my finest liquor for the occasion!","Tôi đi báo cho bếp ngay đây, tiện thể tìm mấy chai rượu của tôi ra luôn."
lang_multi_text.db,MultiText,Character_Brant_3_44,那我也要去擦甲板了，船长。,"And I'll be excusing myself as well, Captain. Ah, time to scrub the decks until they shine like gold.","Vậy tôi cũng đi lau sàn tàu đây, thưa thuyền trưởng."
lang_multi_text.db,MultiText,Character_Brant_3_45,你可以先在剧团逛逛，最重要的，是玩得开心！,"Oh, and if you find yourself with nothing to do, feel free to explore. Make yourself feel right at home on this ship! Ciao!","Cậu có thể đi dạo quanh đoàn kịch trước, quan trọng nhất là chơi cho vui nhé!"
lang_multi_text.db,MultiText,Character_Brant_3_46,"你无意间加入了布兰特和巴蒂尔的赌局。在他们争吵之时，你钓上鱼王赢得赌局。
现在，你要成为愚人船的一日船长了。","You find yourself stumbling into Brant and Battier's bet. Just as they get into a heated debate, you manage to catch the winning King Fish.
Now, you've become the Captain of the Day for the troupe.","Bạn vô tình tham gia vào cuộc cá cược giữa Brant và Battier. Trong lúc họ tranh cãi, bạn đã câu được cá chúa và thắng cuộc.
Bây giờ, bạn sắp trở thành thuyền trưởng một ngày của Con Tàu Gã Hề."
lang_multi_text.db,MultiText,Character_Brant_3_5,哟，{PlayerName}来了！我正和巴蒂尔进行一场「光荣的赌局」。,"Ah! Look who decided to join us. You've come at the perfect moment, {PlayerName}. We're about to place a very, very important bet.","Ồ, {PlayerName} đến rồi! Tôi đang tiến hành một ""cuộc cá cược vinh quang"" với Battier đây."
lang_multi_text.db,MultiText,Character_Brant_3_6,赌的什么？,What's the bet?,Cá cược gì vậy?
lang_multi_text.db,MultiText,Character_Brant_3_7,你不是赌运很差吗？,"You do realize your luck isn't good, right?",Cậu không phải vận đỏ đen rất kém sao?
lang_multi_text.db,MultiText,Character_Brant_3_8,他们在赌谁先起竿上鱼呢。,They're betting on who will catch the first fish.,Họ đang cá xem ai giật cần câu được cá trước đấy.
lang_multi_text.db,MultiText,Character_Brant_3_9,怎么上来就拆我的台呀，我的好朋友。身为船长，我可是努力地在给大家争取好酒喝！,"Hey now, grant this captain his due! I'm working hard to secure some fine libations for us!","Sao vừa lên đã phá đám tôi thế, bạn tốt của tôi ơi. Thân là thuyền trưởng, tôi đang nỗ lực giành rượu ngon cho mọi người uống đấy!"
lang_multi_text.db,MultiText,Character_Brant_40_1,呼……好安静啊，有点像到了中场休息的时候。,It's so quiet... like an intermission.,"Hừ... yên tĩnh quá, hơi giống lúc giải lao giữa giờ vậy."
lang_multi_text.db,MultiText,Character_Brant_40_2,每次到这样的时候，我都会期待新一幕故事为我带来的惊喜。,"Whenever it gets this still, I can't help but anticipate the next act and the surprises it might bring.","Mỗi lần đến lúc như thế này, tôi đều mong chờ màn kế tiếp sẽ mang đến bất ngờ gì."
lang_multi_text.db,MultiText,Character_Brant_40_3,兄弟们，老大说得果然没错，他们来了！我们上！,"Captain was right! They're here! Everyone, get 'em!","Anh em ơi, đại ca nói đúng rồi, bọn chúng tới rồi! Lên thôi!"
lang_multi_text.db,MultiText,Character_Brant_40_4,真惊喜啊。,"That's the ""surprise"" you were waiting for.",Thật bất ngờ ghê.
lang_multi_text.db,MultiText,Character_Brant_40_5,只能应战了。,Get ready for a brawl.,Chỉ còn cách nghênh chiến thôi.
lang_multi_text.db,MultiText,Character_Brant_41_1,打不过！兄弟们我们快跑啊啊啊！,Argh! We can't win! RUN! Run for your lives!,Đánh không lại! Anh em chạy mau aaaaah!
lang_multi_text.db,MultiText,Character_Brant_41_2,他们到底是……不过，刚才他们好像在那挖什么东西， 我们可以去看看。,"I've seen more fight in a children's theater troupe. Anyway, looks like they were digging over there. Let's take a look.","Bọn chúng rốt cuộc là... Mà thôi, lúc nãy hình như chúng đang đào gì ở đằng kia, chúng ta qua xem thử đi."
lang_multi_text.db,MultiText,Character_Brant_42_1,这手感怎么怪怪的……,Hmm... something feels off.,Cảm giác sao kỳ kỳ thế này...
lang_multi_text.db,MultiText,Character_Brant_42_2,小心！,Watch out!,Cẩn thận!
lang_multi_text.db,MultiText,Character_Brant_42_3,居然真有惊喜，我的运气真好。,"Ha, now that was a surprise. Aren't we lucky?","Không ngờ thật sự có bất ngờ, vận may của tôi tốt thật đấy."
lang_multi_text.db,MultiText,Character_Brant_43_1,这个洞里什么都没有。,There's nothing else in this hole.,Cái hố này chẳng có gì cả.
lang_multi_text.db,MultiText,Character_Brant_43_2,有我的铲子和空气。,Sure there is—my trusty shovel and some air.,Có chứ - có cái xẻng của tôi với không khí nè.
lang_multi_text.db,MultiText,Character_Brant_43_3,……,…,...
lang_multi_text.db,MultiText,Character_Brant_43_4,好啦好啦，我们继续挖。,"Alright, alright. No more jokes. Keep digging, Captain!","Được rồi được rồi, tiếp tục đào thôi."
lang_multi_text.db,MultiText,Character_Brant_44_1,有了。,Here it is.,Có rồi.
lang_multi_text.db,MultiText,Character_Brant_44_2,这看起来是一块琥珀，这色泽还挺好看。,It looks like a chunk of amber. Its color is quite beautiful.,"Trông giống một miếng hổ phách, sắc trạch cũng đẹp phết."
lang_multi_text.db,MultiText,Character_Brant_44_3,你记得爱蒂奇提到过的琥珀钥匙吗？,Remember the Amber Key Aldric mentioned before?,Cậu còn nhớ chìa khóa hổ phách mà Aldric đã nhắc đến không?
lang_multi_text.db,MultiText,Character_Brant_44_4,我们把这个带上，去下一个岛吧。,This must be it. Let's take it and head to the next isle.,"Mang cái này theo, sang đảo tiếp theo thôi."
lang_multi_text.db,MultiText,Character_Brant_45_1,不知道第二座岛上，有什么在等着我们呢？,I can't wait to see what surprises the second isle has in store.,"Không biết trên hòn đảo thứ hai, có gì đang chờ đợi chúng ta nhỉ?"
lang_multi_text.db,MultiText,Character_Brant_46_1,好像起雾了。,Looks like the fog is rolling in.,Hình như có sương mù rồi.
lang_multi_text.db,MultiText,Character_Brant_46_2,别担心，船长。在海上航行，总会遇到这样的情况。请相信你手中的舵盘，相信我吧。,Don't worry. This happens often when you're out at sea. Just trust the wheel in your hands and trust me.,"Đừng lo, thuyền trưởng. Đi biển thì hay gặp chuyện này lắm. Hãy tin vào bánh lái trong tay, và tin tôi."
lang_multi_text.db,MultiText,Character_Brant_46_4,循着这些光亮，我们一定能安全驶向目的地。,"Follow their lights, Captain, and we'll safely reach our destination.","Đi theo những ánh sáng này, chúng ta nhất định sẽ đến được đích an toàn."
lang_multi_text.db,MultiText,Character_Brant_46_5,像是要安抚这段旅程，布兰特轻柔地哼起歌来。,"As if to chase away any worries, Brant hums softly.","Như muốn xoa dịu chuyến hành trình, Brant nhẹ nhàng ngân nga một bài hát."
lang_multi_text.db,MultiText,Character_Brant_47_1,你看到那些沉船了吗，船长？,"Look at those shipwrecks, Captain.","Thuyền trưởng, cậu có thấy mấy con tàu đắm kia không?"
lang_multi_text.db,MultiText,Character_Brant_47_2,那些是德雷克的船吗？,Are those... Drake's ships?,Đó là... tàu của Drake sao?
lang_multi_text.db,MultiText,Character_Brant_47_3,嗯。据说德雷克的船队航行跨越了整个风暴洋，没想到他这样的英雄居然会在这里迷失方向……,Yes. It's said that Drake's fleet sailed across the entire Stormy Sea. Hard to believe that such a legendary figure could lose his way...,"Ừ. Nghe nói hạm đội của Drake đã vượt qua cả vùng biển Bão Tố, không ngờ một anh hùng như ông ấy lại lạc lối ở nơi này..."
lang_multi_text.db,MultiText,Character_Brant_47_4,但这也说明，我们离目的地很近了！,"But if these wrecks are here, it means we're nearing our destination!","Nhưng điều này cũng chứng tỏ, chúng ta đã gần đến đích rồi!"
lang_multi_text.db,MultiText,Character_Brant_48_2,太棒了，先生们，终于让我拿到了钥匙，我有你们真是太幸福啦！！,"Wonderful, gentlemen! At last, I've found the key! O-of course, your help has been invaluable.","Tuyệt vời, các quý ông, cuối cùng cũng để tôi lấy được chìa khóa rồi, có các người thật là hạnh phúc quá!!"
lang_multi_text.db,MultiText,Character_Brant_48_3,……是爱蒂奇的声音。,…That's Aldric's voice.,...Đó là giọng của Aldric.
lang_multi_text.db,MultiText,Character_Brant_48_4,大家刚才看到那些沉船了吧？看到那些海雾了吧……多么危险啊。,Do you see those wrecked ships? And with this thick fog... This place is danger incarnate.,Mọi người vừa thấy mấy con tàu đắm kia rồi chứ? Thấy sương mù kia chưa... Nguy hiểm biết bao.
lang_multi_text.db,MultiText,Character_Brant_48_5,为了我们共同的大业，这些危险就让船长我一人承担吧！,"However, as your captain, I'm willing to sacrifice myself, braving all the dangers ahead, for our grand cause!","Vì đại nghiệp chung của chúng ta, những hiểm nguy này cứ để một mình thuyền trưởng ta gánh chịu!"
