db_file,table_name,id,zh,en,vi
lang_multi_text.db,MultiText,GNNPC_SUIBOC_5_10,我们早就，已经在足够幸福的日常生活中了啊。,"We've already lived a happy life, haven't we?",Chúng ta đã sớm sống trong những ngày tháng đủ hạnh phúc rồi mà.
lang_multi_text.db,MultiText,GNNPC_SUIBOC_6_1,你在这里做什么呢？,What are you doing here?,Em làm gì ở đây thế?
lang_multi_text.db,MultiText,GNNPC_SUIBOC_6_2,你好啊，{Male=大哥哥;Female=大姐姐}，我在等爸爸妈妈回来。,Hello… I'm waiting for my Daddy and Mommy to come home.,"Chào {Male=anh;Female=chị}, em đang đợi bố mẹ về."
lang_multi_text.db,MultiText,GNNPC_SUIBOC_6_3,为什么是在这里等？,Why here?,Sao lại đợi ở đây?
lang_multi_text.db,MultiText,GNNPC_SUIBOC_6_4,叔叔阿姨说，爸爸妈妈去了离我很远的地方，我们暂时见不到面了。,"Aunties and Uncles said Daddy and Mommy went to a place really, really far away, so we can't meet for now.","Các cô chú bảo bố mẹ em đã đi đến một nơi rất xa, tạm thời chúng em không gặp nhau được."
lang_multi_text.db,MultiText,GNNPC_SUIBOC_6_5,但每年这一天，他们就会顺着海边的浪花，从水面上回来见我。,But every year on this day… they ride the sea waves back home to visit me.,"Nhưng vào ngày này hàng năm, bố mẹ sẽ theo những con sóng biển, từ mặt nước trở về thăm em."
lang_multi_text.db,MultiText,GNNPC_SUIBOC_6_6,明明就是今天……我在这里等了很久，却什么也没等到。,"Today's the day. I've been waiting so long, but… they still haven't shown up.","Rõ ràng là hôm nay... em đã đợi ở đây rất lâu rồi, nhưng vẫn chẳng thấy gì cả."
lang_multi_text.db,MultiText,GNNPC_SUIBOC_6_7,{Male=大哥哥;Female=大姐姐}，难道爸爸妈妈已经忘记我了吗？,Do you think… maybe Daddy and Mommy forgot about me?,"{Male=Anh;Female=Chị} ơi, lẽ nào bố mẹ đã quên em rồi sao?"
