db_file,table_name,id,zh,en,vi
lang_multi_text.db,MultiText,NPC_LHLYMJS_25_3,我和你一起去。,I'll go with you.,Tôi sẽ đi cùng cậu.
lang_multi_text.db,MultiText,NPC_LHLYMJS_2_1,那个“裂了就跑”鱼罐头，到底是什么东西？,"So what exactly is the deal with ""Crack & Bolt"" fish jars?","Cái đồ hộp cá ""Nứt Là Chạy"" đó, rốt cuộc là cái gì vậy?"
lang_multi_text.db,MultiText,NPC_LHLYMJS_2_2,那是一种神秘邪恶的鱼罐头，散发着死灵一般的恶臭。,"It's this mysterious, terrible fish in a jar that reeks like the undead.","Đó là một loại đồ hộp cá bí ẩn đáng sợ, bốc mùi hôi thối như tử khí vậy."
lang_multi_text.db,MultiText,NPC_LHLYMJS_3_1,我真的、我真的好生气啊！,"I am so, so mad right now!","Tôi thật sự, tôi thật sự tức quá đi!"
lang_multi_text.db,MultiText,NPC_LHLYMJS_3_2,别生气别生气，你记得上一组实验数据是多少吗，我填一下。,"Easy, easy. Do you remember the last set of test data? I'll log it.","Đừng giận đừng giận, cậu còn nhớ bộ dữ liệu thí nghiệm trước là bao nhiêu không, để tôi ghi lại."
lang_multi_text.db,MultiText,NPC_LHLYMJS_3_3,5.524，偏差值0.03，在正常水平范围……,"It's 5.524, with a 0.03 deviation. Within normal parameters...","5.524, sai số 0.03, nằm trong phạm vi bình thường..."
lang_multi_text.db,MultiText,NPC_LHLYMJS_3_4,不对，我就是因为这个生气的，不要老把我当计算器啊！,"No, that's exactly <i>why</i> I'm mad... Stop treating me like a walking calculator!","Không phải, tôi tức chính vì chuyện này đó, đừng lúc nào cũng coi tôi như máy tính chứ!"
lang_multi_text.db,MultiText,NPC_LHLYMJS_3_5,我这不想着转换一下注意力嘛，你看，是不是不那么气了？,"Hey, I'm just trying to take your mind off it. See? Less mad already, right?","Tôi chỉ muốn chuyển sự chú ý của cậu thôi mà, thấy chưa, bớt giận rồi đúng không?"
lang_multi_text.db,MultiText,NPC_LHLYMJS_4_1,我真的、我真的好生气啊！,"I am so, so mad right now!","Tôi thật sự, tôi thật sự tức quá đi!"
lang_multi_text.db,MultiText,NPC_LHLYMJS_4_2,别生气别生气……,"Easy, easy...",Đừng giận đừng giận...
lang_multi_text.db,MultiText,NPC_LHLYMJS_5_1,艾特莉米亚，你接受炉光的祝福了啊！,"Arthelia, you've received the blessing of the Reactor's glow!","Arthelia, cậu đã nhận được phước lành từ ánh sáng Lò Phản Ứng rồi à!"
lang_multi_text.db,MultiText,NPC_LHLYMJS_5_2,是呀，你看，这就是我接受的刻印。,Yes. Look... This is the Imprint I received.,"Ừ, cậu xem, đây chính là Khắc Ấn tôi nhận được."
lang_multi_text.db,MultiText,NPC_LHLYMJS_5_3,这下我也算成年了，可以跟着商队到处走。,I'm considered an adult now. Nothing's stopping me from travelling with the merchant caravan anymore.,"Giờ tôi cũng coi như trưởng thành rồi, có thể theo thương đội đi khắp nơi."
lang_multi_text.db,MultiText,NPC_LHLYMJS_5_4,真好……感觉怎么样，试炼难吗，有没有遇到什么危险？,That's wonderful... How do you feel? Was your Trial tough? Did you run into any danger?,"Tuyệt quá... Cảm giác thế nào, thử luyện có khó không, có gặp nguy hiểm gì không?"
lang_multi_text.db,MultiText,NPC_LHLYMJS_5_5,完全没问题，毕竟为了获得刻印，我准备了很久呀！,"I think I did well. After all, I've been preparing for ages to earn my Imprint!","Hoàn toàn không vấn đề gì, dù sao để nhận được Khắc Ấn, tôi đã chuẩn bị rất lâu rồi mà!"
lang_multi_text.db,MultiText,NPC_LHLYMJS_6_1,你接受炉光的祝福了啊！,"Aelia, you've received the blessing of the Reactor's glow!",Cậu đã nhận được phước lành từ ánh sáng Lò Phản Ứng rồi à!
lang_multi_text.db,MultiText,NPC_LHLYMJS_6_2,是呀，你看，这就是我接受的刻印。,Yes. Look... This is the Imprint I received.,"Ừ, cậu xem, đây chính là Khắc Ấn tôi nhận được."
lang_multi_text.db,MultiText,NPC_LHLYMJS_7_1,这些才是食物啊……,Now this is real food...,Đây mới là đồ ăn chứ...
lang_multi_text.db,MultiText,NPC_LHLYMJS_7_2,你怎么哭了？星炬学院的饭有这么差吗？,Why are you crying? Is the food at Startorch Academy really that bad?,Sao cậu khóc vậy? Cơm ở Học viện Tinh Cự tệ đến thế sao?
lang_multi_text.db,MultiText,NPC_LHLYMJS_8_1,居然还有喀拉喀拉！我最喜欢的就是这个！,What? They even have Fruit Crackle! That's my favorite!,Không ngờ còn có cả Khách La Khách La! Đây là món tôi thích nhất!
lang_multi_text.db,MultiText,NPC_LHLYMJS_8_2,多吃点，学院生活怎么样？,"Eat up. So, how's Academy life treating you?",Ăn nhiều vào. Cuộc sống ở học viện thế nào rồi?
lang_multi_text.db,MultiText,NPC_LHLYMJS_8_3,除了不好吃之外一切都好！就是，就是功课有些难，让人提不起劲来。,"Everything's great except the food tastes awful! And well, the assignments aren't easy... Really kills my motivation sometimes.","Ngoài việc đồ ăn không ngon ra thì mọi thứ đều ổn! Chỉ là, chỉ là bài vở hơi khó, khiến người ta chẳng có động lực gì cả."
lang_multi_text.db,MultiText,NPC_LHLYMJS_8_4,也不知道西格莉卡怎么做到的，她每天很早就到教室学习了。,I have no idea how Sigrika does it. She's in the lecture hall studying super early every single day.,"Cũng không biết Sigrika làm thế nào nữa, ngày nào cô ấy cũng đến lớp học rất sớm."
lang_multi_text.db,MultiText,NPC_LHLYMJS_8_5,唉，这就是作为未来的秘日六席的觉悟吗……,"Ah, I guess that's what being a future Heliodic Six successor looks like...","Haiz, đây chính là giác ngộ của người sẽ trở thành Bí Nhật Lục Tịch trong tương lai sao..."
lang_multi_text.db,MultiText,NPC_LHLYMJS_9_2,多吃点，学院生活怎么样？,"Eat up. So, how's Academy life treating you?",Ăn nhiều vào. Cuộc sống ở học viện thế nào rồi?
lang_multi_text.db,MultiText,NPC_LHLYMJS_9_3,居然还有喀拉喀拉！我最喜欢的就是这个！,What? They even have Fruit Crackle! That's my favorite!,Không ngờ còn có cả Khách La Khách La! Đây là món tôi thích nhất!
lang_multi_text.db,MultiText,NPC_LHLYZT_10_1,反弹！这部分份额是我们的，你们别想拿走。,Rebound! This share is ours—don't even think about taking it!,"Phản đòn! Phần này là của chúng tôi, các người đừng hòng lấy đi."
lang_multi_text.db,MultiText,NPC_LHLYZT_10_2,反弹反弹！,Counter! Counter!,Phản đòn phản đòn!
lang_multi_text.db,MultiText,NPC_LHLYZT_10_3,反弹反弹反弹！,"Rebound, rebound, rebound!",Phản đòn phản đòn phản đòn!
lang_multi_text.db,MultiText,NPC_LHLYZT_1_1,皮尔，你怎么一个人在这？,"Piers, what are you doing here all by yourself?","Piers, sao cậu ở đây một mình vậy?"
lang_multi_text.db,MultiText,NPC_LHLYZT_1_2,我也不知道啊，今天说是要选出谁来做接下来的工作。,I don't know either. They said we were supposed to pick someone for the next shift today.,"Tôi cũng không biết nữa, hôm nay nói là phải chọn ra ai để làm công việc tiếp theo."
lang_multi_text.db,MultiText,NPC_LHLYZT_1_3,结果怎么没人来啊……,So why is no one here?,Kết quả sao chẳng có ai đến vậy...
lang_multi_text.db,MultiText,NPC_LHLYZT_1_4,你们组到什么阶段了？,What phase is your team at right now?,Nhóm cậu đến giai đoạn nào rồi?
lang_multi_text.db,MultiText,NPC_LHLYZT_1_5,嗯……接下来是实验的关键阶段，需要反复锤炼材料，并且尝试用共鸣力对锤炼过程进行一定干涉……,"Mm… we're entering the critical stage. We have to refine the materials over and over, and try using Forte power to… well, interfere with the refining process a bit.","Hừm... tiếp theo là giai đoạn then chốt của thí nghiệm, cần phải luyện đi luyện lại vật liệu, đồng thời thử dùng năng lực cộng hưởng để can thiệp vào quá trình luyện ở một mức độ nhất định..."
lang_multi_text.db,MultiText,NPC_LHLYZT_1_6,听上去很枯燥啊，那我懂了。,"Sounds tedious. Yeah, I get it now.","Nghe có vẻ nhàm chán thật, vậy tôi hiểu rồi."
lang_multi_text.db,MultiText,NPC_LHLYZT_1_7,也许，其实你们已经选出谁来做接下来的工作了。,Maybe you've already picked who's doing the next shift.,"Có lẽ, thực ra các cậu đã chọn ra người làm công việc tiếp theo rồi đấy."
lang_multi_text.db,MultiText,NPC_LHLYZT_1_8,真的吗？谁？,Really? Who?,Thật sao? Ai vậy?
lang_multi_text.db,MultiText,NPC_LHLYZT_2_1,你怎么一个人在这？,Why are you here all alone?,Sao cậu ở đây một mình vậy?
lang_multi_text.db,MultiText,NPC_LHLYZT_2_2,怎么没人来啊……,Why isn't anyone here…?,Sao chẳng có ai đến vậy...
lang_multi_text.db,MultiText,NPC_LHLYZT_3_1,这次科考，我们可能要探索一些更远的地方，这要求我们做好充足的准备。,"For this expedition, we might be going much farther out. That means we need to be fully prepared.","Chuyến khảo sát lần này, chúng ta có thể phải khám phá những nơi xa hơn, điều này đòi hỏi chúng ta phải chuẩn bị thật đầy đủ."
lang_multi_text.db,MultiText,NPC_LHLYZT_3_2,那么，让我看看你们带了什么。,"Now then, let me see what you've brought.","Vậy thì, để tôi xem các cậu mang theo những gì."
lang_multi_text.db,MultiText,NPC_LHLYZT_3_3,新印造出来的佩枪、大剑……没错。环境监测装置、扎营工具……没错。,"New pistols, greatswords... Good. Environmental monitoring device, camping gear... Good.","Thủ súng, đại kiếm mới ấn tạo... đúng rồi. Thiết bị giám sát môi trường, dụng cụ cắm trại... đúng rồi."
lang_multi_text.db,MultiText,NPC_LHLYZT_3_4,但我怎么没看到足量的食物？,But you've missed something critical... Enough food.,Nhưng sao tôi không thấy đủ lượng thực phẩm?
lang_multi_text.db,MultiText,NPC_LHLYZT_3_5,离出发还有些时间，你们快去准备。,We still have some time before departure. Go grab some more.,"Còn chút thời gian trước khi khởi hành, các cậu mau đi chuẩn bị đi."
lang_multi_text.db,MultiText,NPC_LHLYZT_3_6,冰原上有很多未知的危险，我们不能掉以轻心！,There are plenty of unknown dangers out in the frostlands. We can't let our guard down!,"Trên băng nguyên có rất nhiều hiểm nguy chưa biết, chúng ta không thể lơ là!"
lang_multi_text.db,MultiText,NPC_LHLYZT_4_1,让我看看你们带了什么。,Let me see what you've brought.,Để tôi xem các cậu mang theo những gì.
lang_multi_text.db,MultiText,NPC_LHLYZT_5_1,I.R.I.S.，可以帮我分析这些订单究竟来自谁吗？,"I.R.I.S., can you help me figure out who these orders are actually from?","I.R.I.S., cậu có thể giúp tôi phân tích xem những đơn hàng này rốt cuộc đến từ ai không?"
lang_multi_text.db,MultiText,NPC_LHLYZT_5_2,当然，就我所知，你手中的订单分别来自三个不同的学生，她们一个穿着旧制的校服，一个喜欢飙摩托，还有一个总是犯困。,"Of course. From what I know, the orders you're holding come from three different students: one who still wears the old Academy uniform, one who loves racing her motorbike, and one who's always nodding off.","Tất nhiên, theo những gì tôi biết, các đơn hàng trong tay cậu đến từ ba học sinh khác nhau. Một người mặc đồng phục cũ, một người thích phóng xe mô tô, còn một người lúc nào cũng buồn ngủ."
lang_multi_text.db,MultiText,NPC_LHLYZT_5_3,若是想更进一步清楚是谁，你就要回答我的一个问题。,"If you want to know exactly who they are, you must first answer a question for me.","Nếu muốn biết rõ hơn là ai, cậu phải trả lời một câu hỏi của tôi."
lang_multi_text.db,MultiText,NPC_LHLYZT_5_4,……你说。,...Go on.,...Cậu nói đi.
lang_multi_text.db,MultiText,NPC_LHLYZT_5_5,你知道自己藏在房间的“裂了就跑”罐头裂开了吗？,"Did you know the ""Crack & Bolt"" jar that you hid in your room has cracked open?","Cậu có biết cái hộp ""Nứt Là Chạy"" mà cậu giấu trong phòng đã nứt ra rồi không?"
lang_multi_text.db,MultiText,NPC_LHLYZT_5_6,什么？！,What?!,Cái gì?!
lang_multi_text.db,MultiText,NPC_LHLYZT_6_1,I.R.I.S.，可以帮我分析这些订单究竟来自谁吗？,"I.R.I.S., can you help me figure out who these orders are actually from?","I.R.I.S., cậu có thể giúp tôi phân tích xem những đơn hàng này rốt cuộc đến từ ai không?"
lang_multi_text.db,MultiText,NPC_LHLYZT_7_1,呵，你输了。从往印造台输入这个盲盒程式开始，我就在等这一刻。,"Heh. You lose. The moment we fed that Blind Box program into the Crafting Bay, I was waiting for this.","Heh, cậu thua rồi. Từ lúc nhập chương trình hộp mù vào đài ấn tạo, tôi đã chờ đợi khoảnh khắc này."
lang_multi_text.db,MultiText,NPC_LHLYZT_7_2,它将印造出最完美的共生武装！,It'll craft the ultimate Synth Armament!,Nó sẽ ấn tạo ra vũ trang cộng sinh hoàn hảo nhất!
lang_multi_text.db,MultiText,NPC_LHLYZT_7_3,来吧，让我们的概率学战斗到此为止——,"Come then, let our battle of probability end here—","Đến đi, cuộc chiến xác suất học giữa chúng ta kết thúc tại đây-"
lang_multi_text.db,MultiText,NPC_LHLYZT_7_4,怎，怎么会？这不是最普通的共生武装吗？,H-How? Isn't this just the most basic Synth Armament?,S-Sao có thể? Đây chẳng phải là loại vũ trang cộng sinh bình thường nhất sao?
lang_multi_text.db,MultiText,NPC_LHLYZT_7_5,唉，你怎么还是这么大意？我们之间的概率学恶作剧游戏都进行这么久了，你怎么没猜到……,"Eugh, how are you still this clueless? We've been playing this little probability prank game for ages. How did you not see it coming...","Haiz, sao cậu vẫn bất cẩn thế? Trò chơi khăm xác suất học giữa chúng ta đã diễn ra lâu thế rồi, sao cậu không đoán ra được..."
lang_multi_text.db,MultiText,NPC_LHLYZT_7_6,其实我已经偷偷把你的盲盒程式清除，让它回归原本的作用。,I already snuck in and wiped your little Blind Box program. Restored it to its original function.,"Thực ra tôi đã lén xóa chương trình hộp mù của cậu, khôi phục lại chức năng ban đầu."
lang_multi_text.db,MultiText,NPC_LHLYZT_7_7,这就是我的命运之黑线·概率的原点·完全白箱模式！,This is my Black Thread of Fate: Origin of Probability—Full White Box Mode!,Đây chính là Hắc Tuyến Mệnh Vận - Khởi Nguyên Xác Suất - Chế Độ Bạch Hộp Hoàn Toàn của tôi!
lang_multi_text.db,MultiText,NPC_LHLYZT_8_1,呵，你输了。,"Heh, you lost.","Heh, cậu thua rồi."
lang_multi_text.db,MultiText,NPC_LHLYZT_8_2,怎，怎么会？,H-How can that be?!,S-Sao có thể?!
lang_multi_text.db,MultiText,NPC_LHLYZT_9_1,小心那个准时宝。,Watch out for that TARD-E Unit.,Cẩn thận con Chuẩn Thời Bảo đó.
lang_multi_text.db,MultiText,NPC_LHLYZT_9_2,它怎么了？,What's wrong with it?,Nó sao vậy?
lang_multi_text.db,MultiText,NPC_LHLYZT_9_3,它居然迟到了！,It's actually late!,Nó lại đến muộn!
lang_multi_text.db,MultiText,NPC_LNXTMDST_10_1,嗯……,...,Ừm...
lang_multi_text.db,MultiText,NPC_LNXTMDST_10_10,意思是——这次必须得洛可可大副出马了！,Roccia. We need our First Mate to step up your game this time!,Ý là - lần này phải để phó thuyền trưởng Roccia ra tay thôi!
lang_multi_text.db,MultiText,NPC_LNXTMDST_10_2,嗯…………,Hmm...,Ừm......
lang_multi_text.db,MultiText,NPC_LNXTMDST_10_3,嗯…………………,Hmm......,Ừm.............
lang_multi_text.db,MultiText,NPC_LNXTMDST_10_4,怎么不说话，这不是很艺术吗？,Why so quiet? Isn't all of this just oh-so artistic?,"Sao không nói gì, thế này chẳng phải rất nghệ thuật sao?"
lang_multi_text.db,MultiText,NPC_LNXTMDST_10_5,这……你、看得懂吗？,"I... uh, can you make any sense of this?","Cái này... cậu, đọc hiểu được không?"
lang_multi_text.db,MultiText,NPC_LNXTMDST_10_6,当然了，我和你说，这是基于莫塔里家族的演出需求，由「梦中人」的奈亚拉女士倾情具现的舞台道具设计图纸。,"Of course I can! Let me explain. This is a stage prop design blueprint inspired by the Montelli family's performance requirements, passionately crafted by Madame Nyarla of the Masked Reverie.","Đương nhiên rồi, để tôi nói cho nghe, đây là bản thiết kế đạo cụ sân khấu dựa trên nhu cầu biểu diễn của gia tộc Montelli, do phu nhân Nyarla của ""Mộng Trung Nhân"" tận tâm hiện thực hóa."
lang_multi_text.db,MultiText,NPC_LNXTMDST_10_7,这些舞台设计，力图于呈现出最美、最优雅、最极致的舞美设计，让想象插上翅膀，使整个舞台变得像银河繁星一样……,"These stage designs aim to present the most beautiful, elegant, and exquisite visual spectacle, giving imagination wings and transforming the entire stage into a galaxy of stars...","Những thiết kế sân khấu này, nỗ lực trình bày mỹ thuật sân khấu đẹp nhất, tao nhã nhất, cực chí nhất, cho trí tưởng tượng đôi cánh, biến cả sân khấu thành như ngân hà đầy sao..."
lang_multi_text.db,MultiText,NPC_LNXTMDST_10_8,你这不是在念上面的字吗？唉，我俩就对着图纸干瞪眼吗？这么短的工期，这么复杂的设计……我？你？嗯？我悟了，我悟了！,"You're just reading what's on the page, aren't you? Ugh. Are we really just going to stare at these blueprints? With such a tight deadline, and these overly complicated designs? Me? You? Hmm? Ah, wait, I get it, I get it now!","Cậu chẳng phải đang đọc chữ trên đó sao? Haiz, hai đứa mình cứ nhìn bản vẽ trừng mắt thế này à? Thời hạn ngắn thế này, thiết kế phức tạp thế này... tôi? Cậu? Hả? Tôi hiểu rồi, tôi hiểu rồi!"
lang_multi_text.db,MultiText,NPC_LNXTMDST_10_9,你的意思是……？,And what exactly do you get...?,Ý cậu là...?
lang_multi_text.db,MultiText,NPC_LNXTMDST_11_1,这幽翎火都跟谁学的……,Who taught this to the Fae Ignis...,Con U Linh Hỏa này học ai mà...
lang_multi_text.db,MultiText,NPC_LNXTMDST_11_2,里奥别听！好孩子不听不听！,"Leo, don't listen! Good children shouldn't hear such things!",Leo đừng nghe! Con ngoan không nghe không nghe!
lang_multi_text.db,MultiText,NPC_LNXTMDST_11_3,*拉古那粗口*修会*拉古那粗口*没有*拉古那粗口*的懦夫和骗子！懦夫！懦夫！骗子！骗子！,*Ragunna curse* the Order! You... coward! Coward! Liar! Liar! Coward! Liar!,*chửi thề Ragunna* Tu hội *chửi thề Ragunna* toàn lũ *chửi thề Ragunna* hèn nhát và lừa đảo! Hèn nhát! Hèn nhát! Lừa đảo! Lừa đảo!
lang_multi_text.db,MultiText,NPC_LNXTMDST_12_1,好有意思呀，我想听我想听！,Wow! Cool! Let me listen!,"Hay quá, con muốn nghe, con muốn nghe!"
lang_multi_text.db,MultiText,NPC_LNXTMDST_12_2,里奥！不许！好孩子不要学！唉，我得想办法把它和其它幽翎火隔开……,"Leo! No! Good children shouldn't learn that! Ugh, I'll need to figure out how to separate it from the rest of the Fae Ignises...","Leo! Không được! Con ngoan không được học theo! Haiz, ta phải nghĩ cách tách nó ra khỏi mấy con U Linh Hỏa còn lại mới được..."
lang_multi_text.db,MultiText,NPC_LNXTMDST_12_3,发生什么事了？,What happened?,Chuyện gì xảy ra vậy?
lang_multi_text.db,MultiText,NPC_LNXTMDST_12_4,哦，是这样，这只幽翎火不知从哪学的，一直在说脏话。,"Well, this Fae Ignis somehow picked up some foul language, and it just can't stop using it.","À, là thế này, con U Linh Hỏa này không biết học ở đâu, cứ nói tục hoài."
lang_multi_text.db,MultiText,NPC_LNXTMDST_12_5,*拉古那粗口*修会*拉古那粗口*没有*拉古那粗口*的懦夫和骗子！,*Ragunna curse* the Order! You're a *Ragunna curse* coward! Coward! Liar! Liar!,*chửi thề kiểu Ragunna* Tu Hội *chửi thề kiểu Ragunna* toàn lũ *chửi thề kiểu Ragunna* hèn nhát và lừa đảo!
lang_multi_text.db,MultiText,NPC_LNXTMDST_12_6,……你看，就像这样。,See? Just like that.,"...Cậu thấy đấy, cứ thế này suốt."
lang_multi_text.db,MultiText,NPC_LNXTMDST_12_7,懦夫！懦夫！懦夫！,Coward! Coward! Coward!,Hèn nhát! Hèn nhát! Hèn nhát!
lang_multi_text.db,MultiText,NPC_LNXTMDST_12_8,真不知道它是从哪学的……难道它就是因为说这些话，才被修会流放吗？,I really don't know where it learned that. Could it be that these words were the reason the Order banished it?,Thật không biết nó học ở đâu ra... Hay là vì nói mấy lời này mà nó bị Tu Hội trục xuất?
lang_multi_text.db,MultiText,NPC_LNXTMDST_12_9,修会！骗子！骗子！骗子！,The Order! Liar! Liar! Liar!,Tu Hội! Lừa đảo! Lừa đảo! Lừa đảo!
lang_multi_text.db,MultiText,NPC_LNXTMDST_13_1,{Male=哥哥;Female=姐姐}，告诉你一个小秘密……,"Hey, let me tell you a little secret...","{Male=Anh ơi;Female=Chị ơi}, để em kể cho nghe một bí mật nhỏ nha..."
lang_multi_text.db,MultiText,NPC_LNXTMDST_13_2,什么秘密？,What secret?,Bí mật gì vậy?
lang_multi_text.db,MultiText,NPC_LNXTMDST_13_3,昨天，里奥听到潘·凯克在和剧团所有的幽翎火说悄悄话，玛丽安的幽翎火也参与啦！,"Yesterday, Leo overheard Pan Cake whispering with all the Fae Ignises in the troupe, and Marianne's Fae Ignis joined in too!","Hôm qua, Leo nghe thấy Pan Cake thì thầm với tất cả U Linh Hỏa trong đoàn kịch, U Linh Hỏa của Marianne cũng tham gia luôn!"
lang_multi_text.db,MultiText,NPC_LNXTMDST_13_4,是潘·凯克教会他们的哦！其实，剧团里所有的幽翎火都学会这句话啦！,"Pan Cake taught them that! In fact, all the Fae Ignises in the troupe have picked it up now.","Là Pan Cake dạy cho chúng nó đấy! Thật ra, tất cả U Linh Hỏa trong đoàn kịch đều học được câu đó rồi!"
lang_multi_text.db,MultiText,NPC_LNXTMDST_14_1,{PlayerName}，想不想来一杯独一无二的「剧团烈度」？,"{PlayerName}, care for a one-of-a-kind glass of Troupe Strength?","{PlayerName}, có muốn thử một ly ""Liệt Độ Đoàn Kịch"" độc nhất vô nhị không?"
lang_multi_text.db,MultiText,NPC_LNXTMDST_14_10,而公演结束时，观众就可以拿着这些烈度去剧场堵门，找喜欢的演员亲签啦。,"When the performance ends, the audience rushes to catch their favorite actors for an autograph. It's all part of the charm!","Và khi buổi công diễn kết thúc, khán giả có thể cầm mấy chai Liệt Độ này đến cửa nhà hát, xin chữ ký diễn viên yêu thích luôn."
lang_multi_text.db,MultiText,NPC_LNXTMDST_14_11,怎么样，要不要来一瓶？,How about a bottle?,"Sao nào, lấy một chai không?"
lang_multi_text.db,MultiText,NPC_LNXTMDST_14_2,独一无二？,One-of-a-kind?,Độc nhất vô nhị?
lang_multi_text.db,MultiText,NPC_LNXTMDST_14_3,是啊！你看，这瓶是船长亲笔签名款，口感甘甜刺激，回味却觉清爽，非常符合他在舞台上的风格！,"Yes! Feast your eyes, this bottle is a special edition personally signed by the captain. It's rich and sweet, bold on the tongue, with a finish that's as invigorating as the captain's own presence on stage.","Đúng vậy! Cậu xem, chai này là phiên bản có chữ ký tay của thuyền trưởng, vị ngọt thanh kích thích, hậu vị lại mát lành, rất hợp với phong cách của ông ấy trên sân khấu!"
lang_multi_text.db,MultiText,NPC_LNXTMDST_14_4,还有这瓶，瓶身上是我们女高音蒂娜的签名，你要不要试试？,"And here's another! This one's signed by our soprano, Tina. Care to give it a try?","Còn chai này nữa, trên thân chai là chữ ký của nữ cao âm Tina của chúng tôi, cậu muốn thử không?"
lang_multi_text.db,MultiText,NPC_LNXTMDST_14_5,有没有洛可可签名的？,Is there one signed by Roccia?,Có chai nào có chữ ký của Roccia không?
lang_multi_text.db,MultiText,NPC_LNXTMDST_14_6,你收藏了这么多烈度？,"Ah, you're a collector, then?",Cậu sưu tầm nhiều Liệt Độ thế cơ à?
lang_multi_text.db,MultiText,NPC_LNXTMDST_14_7,大副还没成年呢！而且，她也不喜欢烈度。,The first mate is still a child! She doesn't drink this stuff.,"Đại phó còn chưa đủ tuổi mà! Hơn nữa, cô ấy cũng không thích Liệt Độ."
