db_file,table_name,id,zh,en,vi
lang_multi_text.db,MultiText,SLDYS_18_18,“不过……马修的话，那时候我没全懂，现在好像明白一点点。”,"""Still… the words Matthew said didn't quite make sense to me. But now I think I get a little of it.""","""Nhưng mà... lời Matthew nói lúc đó, mình chưa hiểu hết. Giờ thì hình như hiểu được một chút rồi."""
lang_multi_text.db,MultiText,SLDYS_18_19,他说了什么？,What did he tell you?,Anh ấy đã nói gì?
lang_multi_text.db,MultiText,SLDYS_18_2,现在可以说说了吧。,You may tell me what happened now.,Giờ thì kể cho tôi nghe đi.
lang_multi_text.db,MultiText,SLDYS_18_20,“他说，‘音乐最怕断拍，只要能再连起来，那么间隔再久都不算真的断掉。’”,"""He said, 'Music fears losing the beat the most. As long as you can link it back, no matter how long the gap is, it's not truly broken.'""","""Anh ấy nói, 'Âm nhạc sợ nhất là lỡ nhịp, nhưng chỉ cần nối lại được, thì dù khoảng cách có bao lâu cũng không phải là thật sự đứt đoạn.'"""
lang_multi_text.db,MultiText,SLDYS_18_21,“所以只要乐声还有再响起的一天，我们之间的羁绊就不会消失，不过是间隔得久了一点点。”,"""So as long as the Melody can sound again someday, our bond won't disappear. We just need to be patient.""","""Nên chỉ cần tiếng nhạc còn vang lên được, sợi dây giữa bọn mình sẽ không bao giờ mất đi. Chẳng qua là khoảng cách hơi dài một chút thôi."""
lang_multi_text.db,MultiText,SLDYS_18_22,这就是你们想找回乐声的原因。,That's why you're trying to bring the Melody back.,Đó chính là lý do các cậu muốn tìm lại tiếng nhạc.
lang_multi_text.db,MultiText,SLDYS_18_23,“对，离别的最后，是马修带我们去了有飞鱼的高处，他让我们看见，我们一起完成的乐声是怎么飘在风里，让飞鱼在天上飞起来的。”,"""Right. Before we parted, Matthew took us to the high place where the flying fish lived. He wanted us to see how the Melody we made together drifted on the wind, and how it lifted those flying fish into the sky.""","""Đúng vậy. Trước khi chia tay, Matthew đưa bọn mình lên nơi cao có cá bay. Anh ấy muốn bọn mình thấy tiếng nhạc mà cả nhóm cùng tạo ra bay trong gió như thế nào, và cá bay nhờ nó mà bay lên trời ra sao."""
lang_multi_text.db,MultiText,SLDYS_18_24,“也是他将需要复原的乐谱留在充满回忆的地方的。”,"""He also left the music we need to restore in the places filled with our memories.""","""Cũng chính anh ấy đã để lại bản nhạc cần khôi phục ở những nơi đầy kỷ niệm."""
lang_multi_text.db,MultiText,SLDYS_18_25,“风会带走拍子，带走散落的声音，但也会将它们重新连在一起，再吹回来。”,"""The wind will scatter beats, scatter sounds… but it will also piece them together again, and carry them back.""","""Gió sẽ cuốn đi nhịp phách, cuốn đi những thanh âm rời rạc, nhưng cũng sẽ nối chúng lại với nhau, rồi thổi trở về."""
