db_file,table_name,id,zh,en,vi
lang_multi_text.db,MultiText,MonsterHandBook_320000030_FightSkillDescrtption,羽鹭吞食不同属性的聚核棱镜后会回复所有生命，并进入对应属性的强化状态，强化后的羽鹭将进行更加猛烈的攻击。,"Herons regain all of its health after devouring Cluster Prisms, befor e entering an empowered state of the element of the Prism devoured. Under this state the Herons will launch more powerful attacks.","Vũ Lộ sau khi nuốt chửng Lăng Kính Tụ Hạch thuộc tính khác nhau sẽ hồi phục toàn bộ máu, và tiến vào trạng thái cường hóa thuộc tính tương ứng, Vũ Lộ sau khi cường hóa sẽ thực hiện các đòn tấn công mãnh liệt hơn."
lang_multi_text.db,MultiText,MonsterHandBook_320000030_Name,青羽鹭,Cyan-Feathered Heron,Thanh Vũ Lộ
lang_multi_text.db,MultiText,MonsterHandBook_320000030_TypeDescrtption,异变生物,MUTANT ORGANISM,Sinh Vật Dị Biến
lang_multi_text.db,MultiText,MonsterHandBook_320000040_Descrtption,"<color=#9656d8>【导电】</color>
该敌人<color=#9656d8>导电伤害</color><color=#b49f50>抗性较高</color>。

学名“导电相记忆噬声体”，失序属失序种。外观上存在类似“飘带”的身体结构，推测能够用来迅速聚集导电属性能量。奏谕乐师持有的“长笛”实际上并无法吹奏，只是对人类行为的拙劣模仿。但残象学家们至今都没弄明白，它们究竟是从哪里接触到“演奏”这种活动的。","<color=#1891e7>[Electro]</color>

 This enemy has a <color=#b49f50> higher RES</color> against <color=#1891e7>Electro DMG</color>.  

Binomial name ""Flautist"", a member of the genus Devorsonidum. Their flutes can never be played. They are no more than poor imitation of human behaviours.","<color=#9656d8>[Điện Từ]</color>
Kẻ địch này có <color=#b49f50>kháng cao</color> với <color=#9656d8>Sát Thương Điện Từ</color>.

Tên khoa học ""Điện Từ Tương Ký Ức Phệ Thanh Thể"", thuộc Chủng Thất Tự. Về ngoại hình tồn tại cấu trúc cơ thể giống ""dải lụa"", phỏng đoán có thể dùng để tụ tập nhanh năng lượng thuộc tính Điện Từ. ""Sáo dài"" mà Nhạc Sư Tấu Dụ cầm thực ra không thể thổi, chỉ là sự bắt chước vụng về đối với hành vi của con người. Nhưng các nhà nghiên cứu Tàn Tượng đến nay vẫn chưa hiểu rõ, rốt cuộc chúng tiếp xúc với hoạt động ""biểu diễn"" này từ đâu."
lang_multi_text.db,MultiText,MonsterHandBook_320000040_FightSkillDescrtption,奏谕乐师通常是最先闪现至敌方面前的残象之一，但它们不会直接攻击敌人，而是通过“演奏”，让附近的同伴加速进入狂暴状态。而如果它受到攻击，则会想方设法在受击的间隙通过瞬移逃走。,"Though Flautist may be the first to appear in front of players, they will not attack directly. Instead, they always play a tune to turn their allies into rage. If a Flautist is under attack, it will try to flash and escape as soon as it catches the breath between attacks.","Nhạc Sư Tấu Dụ thường là một trong những Tàn Tượng tốc biến đến trước mặt kẻ địch đầu tiên, nhưng chúng sẽ không trực tiếp tấn công kẻ địch, mà thông qua ""biểu diễn"", khiến đồng minh gần đó tăng tốc tiến vào trạng thái cuồng nộ. Và nếu nó bị tấn công, sẽ tìm mọi cách dịch chuyển chạy trốn trong khoảng hở khi chịu đòn."
lang_multi_text.db,MultiText,MonsterHandBook_320000040_Name,奏谕乐师,Flautist,Nhạc Sư Tấu Dụ
lang_multi_text.db,MultiText,MonsterHandBook_320000040_TypeDescrtption,残象-失序种,Tacet Discord - Calamon,Tàn Tượng - Chủng Thất Tự
lang_multi_text.db,MultiText,MonsterHandBook_320000050_Descrtption,"<color=#7e1f57>【湮灭】</color>
该敌人<color=#7e1f57>湮灭伤害</color><color=#b49f50>抗性较高</color>。

学名“湮灭相记忆噬声体”，失序属失序种。战斗中，该残象可以通过类似“摇铃”的身体结构积聚湮灭能量，干涉对手行动。据此特点，加之首见于新联邦，学者们便以该国童话中通过摇铃蛊惑儿童的妖怪“振铎乐师”为其通用名。","<color=#7e1f57>[Havoc]</color>

This enemy has a <color=#b49f50>higher RES</color> against <color=#7e1f57>Havoc DMG</color>.  

This TD can converge Havoc Energy with its body part that looks like a ""tambourine"" and intervene players' actions in combats.","<color=#7e1f57>[Hủy Diệt]</color>
Kẻ địch này có <color=#b49f50>kháng cao</color> với <color=#7e1f57>Sát Thương Hủy Diệt</color>.

Tên khoa học ""Hủy Diệt Tương Ký Ức Phệ Thanh Thể"", thuộc Chủng Thất Tự. Trong chiến đấu, Tàn Tượng này có thể thông qua cấu trúc cơ thể giống ""lục lạc"" để tích tụ năng lượng Hủy Diệt, can thiệp hành động của đối thủ. Dựa vào đặc điểm này, cộng thêm lần đầu thấy ở Tân Liên Bang, các học giả bèn lấy tên yêu quái ""Nhạc Sư Chấn Đạc"" dùng lục lạc mê hoặc trẻ em trong truyện cổ tích nước đó làm tên thông dụng cho nó."
lang_multi_text.db,MultiText,MonsterHandBook_320000050_FightSkillDescrtption,振铎乐师可以通过“演奏”在场上持续制造出湮灭属性的能量球，以此阻碍敌方行动。,Tambourinists can play a tune to create energy spheres of Havoc eEnergy to hinder players' actions.,"Nhạc Sư Chấn Đạc có thể thông qua ""biểu diễn"" liên tục tạo ra cầu năng lượng thuộc tính Hủy Diệt trên sân, nhằm cản trở hành động của kẻ địch."
lang_multi_text.db,MultiText,MonsterHandBook_320000050_Name,振铎乐师,Tambourinist,Nhạc Sư Chấn Đạc
lang_multi_text.db,MultiText,MonsterHandBook_320000050_TypeDescrtption,残象-失序种,Tacet Discord - Calamon,Tàn Tượng - Chủng Thất Tự
lang_multi_text.db,MultiText,MonsterHandBook_320000060_Descrtption,"<color=#d4bf5f>【衍射】</color>
该敌人<color=#d4bf5f>衍射伤害</color><color=#b49f50>抗性较高</color>。

学名“衍射相抑制噬声体”，失序属失序种。外形上已经初具人形，但举止依然较为单调，如果贸然靠近，会遭受其猛烈的冲撞和盾击。","<color=#1891e7>[Spectro]</color>

 This enemy has a <color=#b49f50> higher RES</color> against <color=#1891e7>Spectro DMG</color>.  

Binomial name ""Devorsonidum spectrum"", a member of the genus Devorsonidum. If approached, it might violently bump and slam players.","<color=#d4bf5f>[Quang Phổ]</color>
Kẻ địch này có <color=#b49f50>kháng cao</color> với <color=#d4bf5f>Sát Thương Quang Phổ</color>.

Tên khoa học ""Quang Phổ Tương Ức Chế Phệ Thanh Thể"", thuộc Chủng Thất Tự. Ngoại hình đã bắt đầu có dạng người, nhưng cử chỉ vẫn khá đơn điệu, nếu mạo muội lại gần, sẽ phải chịu những cú húc và đập khiên mãnh liệt của nó."
lang_multi_text.db,MultiText,MonsterHandBook_320000060_FightSkillDescrtption,磐石守卫胸口的星核是其弱点，使用佩枪进行攻击可造成高额伤害。,The Tacecrux on the chest of the Rocksteady Guardian is its weak spot. Use pistols to deal satisfactory damage.,"Tinh hạch trước ngực Vệ Binh Bàn Thạch là điểm yếu của nó, dùng súng lục tấn công có thể gây sát thương cao."
lang_multi_text.db,MultiText,MonsterHandBook_320000060_Name,磐石守卫,Rocksteady Guardian,Vệ Binh Bàn Thạch
lang_multi_text.db,MultiText,MonsterHandBook_320000060_TypeDescrtption,残象-失序种,Tacet Discord - Calamon,Tàn Tượng - Chủng Thất Tự
lang_multi_text.db,MultiText,MonsterHandBook_320000070_Descrtption,"<color=#7e1f57>【湮灭】</color>
该敌人<color=#7e1f57>湮灭伤害</color><color=#b49f50>抗性较高</color>。

学名“湮灭相抑制噬声体”，失序属失序种，外观已开始向人型演变，可利用单侧上肢进行挥、砸和盾击，是组成残象战斗力的中流砥柱之一。","<color=#7e1f57>[Havoc]</color>

This enemy has a <color=#b49f50>higher RES</color> against <color=#7e1f57>Havoc DMG</color>. 

Binomial name ""Tambourinist"", a member of the genus Devorsonidum. Its appearance shows signs of evolution towards humanoid shapes.","<color=#7e1f57>[Hủy Diệt]</color>
Kẻ địch này có <color=#b49f50>kháng cao</color> với <color=#7e1f57>Sát Thương Hủy Diệt</color>.

Tên khoa học ""Hủy Diệt Tương Ức Chế Phệ Thanh Thể"", thuộc Chủng Thất Tự, ngoại hình đã bắt đầu diễn biến theo hướng nhân dạng, có thể lợi dụng một bên chi trên để vung, đập và tấn công bằng khiên, là một trong những trụ cột cấu thành lực lượng chiến đấu của Tàn Tượng."
lang_multi_text.db,MultiText,MonsterHandBook_320000070_FightSkillDescrtption,冥渊守卫胸口的星核是其弱点，使用佩枪进行攻击可造成高额伤害。,The Tacecrux on the chest of the Chasm Guardian is its weak point. Attack it with pistols to deal high amounts of damage.,"Tinh hạch trước ngực Vệ Binh Minh Uyên là điểm yếu của nó, dùng súng lục tấn công có thể gây sát thương cao."
lang_multi_text.db,MultiText,MonsterHandBook_320000070_Name,冥渊守卫,Chasm Guardian,Vệ Binh Minh Uyên
lang_multi_text.db,MultiText,MonsterHandBook_320000070_TypeDescrtption,残象-失序种,Tacet Discord - Calamon,Tàn Tượng - Chủng Thất Tự
lang_multi_text.db,MultiText,MonsterHandBook_320000080_Descrtption,"<color=#e15226>【热熔】</color>
该敌人<color=#e15226>热熔伤害</color><color=#b49f50>抗性较高</color>。

学名“石化崖蜥”，肉食性群居异变生物。成熟体约有1.5成人高，多出没于地表裸岩较多的区域。石化蜥性格凶暴，会群体攻击一切靠近领地的生物，日间一般不易接近。但其鳞片、牙齿等价值较高，因此依然有人铤而走险，利用凌晨其体温下降、活动受限的短暂时间进行狩猎。","<color=#1891e7>[Fusion]</color>

This enemy has a <color=#b49f50> higher RES</color> against <color=#1891e7>Fusion DMG</color>.  
Binomial name ""Aigialosauridae lapis"", a carnivorous, gregarious Mutant Organism. Adults can be as high as up to 1.5 times of human adult.","<color=#e15226>[Hỏa Liệt]</color>
Kẻ địch này có <color=#b49f50>kháng cao</color> với <color=#e15226>Sát Thương Hỏa Liệt</color>.

Tên khoa học ""Thạch Hóa Nhai Tích"", sinh vật dị biến ăn thịt sống theo đàn. Con trưởng thành cao khoảng 1.5 lần người lớn, thường xuất hiện ở khu vực có nhiều đá trần trên mặt đất. Thạch Hóa Tích tính tình hung bạo, sẽ tấn công theo đàn tất cả sinh vật lại gần lãnh địa, ban ngày thường khó tiếp cận. Nhưng vảy, răng của chúng có giá trị khá cao, do đó vẫn có người liều lĩnh, lợi dụng thời gian ngắn ngủi lúc rạng sáng khi thân nhiệt chúng giảm, hoạt động bị hạn chế để săn bắt."
lang_multi_text.db,MultiText,MonsterHandBook_320000080_FightSkillDescrtption,使用佩枪攻击石化蜥成体背部的潮石核心，会使其受到极大冲击并陷入无法行动的状态。,"Use a pistol to strike the Tacetrite core on the Geohide Saurian's back. This will inflict a great shock on it, putting it in a paralyzed state.","Dùng súng lục tấn công lõi Triều Thạch trên lưng Thạch Hóa Tích trưởng thành, sẽ khiến nó chịu xung kích cực lớn và rơi vào trạng thái không thể hành động."
lang_multi_text.db,MultiText,MonsterHandBook_320000080_Name,绿熔蜥,Viridblaze Saurian,Lục Dung Tích
lang_multi_text.db,MultiText,MonsterHandBook_320000080_TypeDescrtption,异变生物,MUTANT ORGANISM,Sinh Vật Dị Biến
lang_multi_text.db,MultiText,MonsterHandBook_320000090_Descrtption,"<color=#7e1f57>【湮灭】</color>
该敌人<color=#7e1f57>湮灭伤害</color><color=#b49f50>抗性较高</color>。

学名“拟薇伞菌”。喜阴喜湿，多两三成群聚集在黑石富集的湿润洞窟之中。作为一种植物，刺玫菇没有智力，一切攻击行为均是单纯的应激反应。","<color=#7e1f57>[Havoc]</color>

This enemy has a <color=#b49f50>higher RES</color> against <color=#7e1f57>Havoc DMG</color>. 

Binomial name ""Agaricus mimicus"". A shade-tolerant, hygrophilous plant that tends to gather in groups in wet caves rich in Tacetite.","<color=#7e1f57>[Hủy Diệt]</color>
Kẻ địch này có <color=#b49f50>kháng cao</color> với <color=#7e1f57>Sát Thương Hủy Diệt</color>.

Tên khoa học ""Nghĩ Vi Tản Khuẩn"". Ưa bóng râm ưa ẩm ướt, thường tụ tập thành nhóm hai ba con trong các hang động ẩm ướt giàu Hắc Thạch. Là một loại thực vật, Nấm Thích Mai không có trí tuệ, mọi hành vi tấn công đều là phản ứng kích thích đơn thuần."
lang_multi_text.db,MultiText,MonsterHandBook_320000090_FightSkillDescrtption,刺玫菇成体头部的潮石核心实际上是用来欺骗敌人的假体，真正的弱点是其“头部”中心位置，使用佩枪攻击该部位可使其丧失活动能力。,The Tacetrite core on the top of mature Roseshroom is actually a taunt to fool its enemy. Its real weakness is the center of its Tacetite head. Attacking this position with pistols can disable it.,"Lõi Triều Thạch trên đầu Nấm Thích Mai trưởng thành thực ra là bộ phận giả dùng để đánh lừa kẻ địch, điểm yếu thực sự là vị trí trung tâm ""đầu"" của nó, dùng súng lục tấn công bộ phận này có thể khiến nó mất khả năng hoạt động."
lang_multi_text.db,MultiText,MonsterHandBook_320000090_Name,刺玫菇,Roseshroom (Mature),Nấm Thích Mai
lang_multi_text.db,MultiText,MonsterHandBook_320000090_TypeDescrtption,异变生物,MUTANT ORGANISM,Sinh Vật Dị Biến
lang_multi_text.db,MultiText,MonsterHandBook_320000100_Descrtption,"<color=#7e1f57>【湮灭】</color>
该敌人<color=#7e1f57>湮灭伤害</color><color=#b49f50>抗性较高</color>。
学名“恐鬣暗狼”。成年狼体型巨大，昼伏夜出，属于群居动物，有很强的社会性和攻击性。其茂密的鬃毛对湮灭属性攻击有一定免疫性。","<color=#7e1f57>[Havoc]</color>

This enemy has a <color=#b49f50>higher RES</color> against <color=#7e1f57>Havoc DMG</color>. 

Trinomial name ""Chrysocyon brachyurus terreo"". Adult Dreadmanes are larger in size, nocturnal, and gregarious, with strong social and aggressive characteristics.","<color=#7e1f57>[Hủy Diệt]</color>
Kẻ địch này có <color=#b49f50>kháng cao</color> với <color=#7e1f57>Sát Thương Hủy Diệt</color>.
Tên khoa học ""Khủng Liệp Ám Lang"". Sói trưởng thành có kích thước khổng lồ, ngày ẩn đêm hiện, thuộc động vật sống theo đàn, có tính xã hội và tính tấn công rất mạnh. Bờm rậm rạp của nó có khả năng miễn dịch nhất định đối với tấn công thuộc tính Hủy Diệt."
lang_multi_text.db,MultiText,MonsterHandBook_320000100_FightSkillDescrtption,暗鬃狼成体能够巧妙地在进行攻击前躲避敌人的伤害，但这种躲避并不能每次都奏效。当积累足够的伤害后，暗鬃狼会进入狂暴状态，可通过狼嚎强化附近同类，与此同时，暗鬃狼的攻击会额外生成湮灭属性结晶进行远程攻击。,"Rupture Dreadmanes can cleverly dodge enemy attacks even before attacks are made, though this doesn't work every time. When endured with enough damage, Dreadmanes will enter an enraged state and can encourage its nearby companions with its howl. At the same time, its own attacks will generate additional Havoc Energy infused crystals for long-range attacks.","Ám Tông Lang trưởng thành có thể khéo léo né tránh sát thương của kẻ địch trước khi thực hiện tấn công, nhưng kiểu né tránh này không phải lúc nào cũng hiệu quả. Khi tích lũy đủ sát thương, Ám Tông Lang sẽ rơi vào trạng thái cuồng nộ, có thể cường hóa đồng loại gần đó thông qua tiếng hú, đồng thời, đòn tấn công của Ám Tông Lang sẽ tạo thêm tinh thể thuộc tính Hủy Diệt để tấn công tầm xa."
lang_multi_text.db,MultiText,MonsterHandBook_320000100_Name,暗鬓狼（成体）,Rupture Dreadmane Major,Ám Tông Lang (Trưởng Thành)
lang_multi_text.db,MultiText,MonsterHandBook_320000100_TypeDescrtption,异变生物,MUTANT ORGANISM,Sinh Vật Dị Biến
lang_multi_text.db,MultiText,MonsterHandBook_320000110_Descrtption,"<color=#46c3d4>【气动】</color>
该敌人<color=#46c3d4>气动伤害</color><color=#b49f50>抗性较高</color>。

学名“谑猿”。仅在无光之森有目击记录，是瑝珑境内已发现智力水平最高的异变生物。据现有观测数据推断，捣蛋猿种群内部可能已经存在类似原始部落的复杂社会关系。得益于此，它们在无光之森横行霸道，会主动袭击、劫掠进入无光之森的人类，不幸遭遇它们的瑝珑人无不恐慌地称呼它们为“不会说话的悍匪”。","<color=#1891e7>[Aero]</color>

This enemy has a <color=#b49f50> higher RES</color> against <color=#1891e7>Aero DMG</color>.  

Binomial name ""Hoolock vexo"". Sightings of this are only located in the Dim Forest. The Mutant Organism with the highest level of intelligence found in Huanglong.","<color=#46c3d4>[Khí Động]</color>
Kẻ địch này có <color=#b49f50>kháng cao</color> với <color=#46c3d4>Sát Thương Khí Động</color>.

Tên khoa học ""Hác Viên"". Chỉ có ghi chép nhìn thấy ở Rừng Vô Quang, là sinh vật dị biến có trình độ trí tuệ cao nhất được phát hiện trong lãnh thổ Hoàng Long. Theo dữ liệu quan sát hiện có suy đoán, trong quần thể Đảo Đản Viên có thể đã tồn tại quan hệ xã hội phức tạp tương tự bộ lạc nguyên thủy. Nhờ vậy, chúng hoành hành ngang ngược trong Rừng Vô Quang, sẽ chủ động tập kích, cướp bóc con người tiến vào Rừng Vô Quang, những người Hoàng Long không may gặp phải chúng đều hoảng sợ gọi chúng là ""đám thổ phỉ không biết nói""."
lang_multi_text.db,MultiText,MonsterHandBook_320000110_FightSkillDescrtption,捣蛋猿通常群体活动，幼体也会加入到战斗中，但幼体受到一定伤害后会逃走并装死。此时如果附近有成年捣蛋猿，则可迅速阻止它们逃走，并鼓舞它们重新加入战斗。,"Hoochiefs are usually found in groups, and their minors will join along in fights, but minors tend to flee and play dead after taking some damage. At this point, if there are adults nearby, younger individuals will be stopped from fleeing and inspired to rejoin the fight.","Đảo Đản Viên thường hoạt động theo bầy đàn, ấu thể cũng sẽ tham gia chiến đấu, nhưng ấu thể sau khi chịu sát thương nhất định sẽ bỏ chạy và giả chết. Lúc này nếu gần đó có Đảo Đản Viên trưởng thành, sẽ nhanh chóng ngăn cản chúng bỏ chạy, và cổ vũ chúng tham gia lại trận chiến."
lang_multi_text.db,MultiText,MonsterHandBook_320000110_Name,捣蛋猿（成体）,Hoochief,Đảo Đản Viên (Trưởng Thành)
lang_multi_text.db,MultiText,MonsterHandBook_320000110_TypeDescrtption,异变生物,MUTANT ORGANISM,Sinh Vật Dị Biến
lang_multi_text.db,MultiText,MonsterHandBook_320000120_Descrtption,学名“箭脊洞熊”，主要栖息于瑝珑森林区域。该异变生物视力不佳，狩猎主要依靠听觉。其头部被坚硬的黑石结构遮挡，甚至共鸣者武器都很难造成伤害，正面遭遇时最好的办法是放轻脚步，小心行动，直到离开它的听力范围。,"Trinomial name ""Ursus spelaeus sagispina"", mainly found inhabiting the Huanglong Forest. This Mutant Organism has poor eyesight and relies mainly on hearing for hunting.","Tên khoa học ""Gấu Hang Gai Nhọn"", chủ yếu sống ở khu vực rừng Hoàng Long. Sinh vật biến dị này thị lực kém, săn mồi chủ yếu dựa vào thính giác. Đầu của nó được che chắn bởi cấu trúc Hắc Thạch cứng rắn, ngay cả vũ khí của Cộng Hưởng Giả cũng rất khó gây sát thương. Cách tốt nhất khi chạm trán trực diện là nhẹ bước chân, hành động cẩn thận cho đến khi rời khỏi phạm vi thính lực của nó."
lang_multi_text.db,MultiText,MonsterHandBook_320000120_FightSkillDescrtption,箭簇熊前爪被黑石覆盖，拥有极强的物理防御能力。,"Spearback's front paws are covered with Tacetite, providing extremely strong physical durability.","Móng trước của Gấu Mũi Tên được bao phủ bởi Hắc Thạch, có khả năng phòng thủ vật lý cực mạnh."
lang_multi_text.db,MultiText,MonsterHandBook_320000120_Name,箭簇熊,Spearback,Gấu Mũi Tên
lang_multi_text.db,MultiText,MonsterHandBook_320000120_TypeDescrtption,异变生物,MUTANT ORGANISM,Sinh vật biến dị
lang_multi_text.db,MultiText,MonsterHandBook_320000130_Descrtption,"<color=#46c3d4>【气动】</color>
该敌人<color=#46c3d4>气动伤害</color><color=#b49f50>抗性较高</color>。

人工属人工种，仅见于无光之森。该残象一般用废弃的车辆作为寄居的外壳，行动迅捷，一旦盯上猎物就穷追不舍，故得名“车刃镰”。","<color=#1891e7>[Aero]</color>

This enemy has a <color=#b49f50> higher RES</color> against <color=#1891e7>Aero DMG</color>.  

Part of the artificial species, only found in the Dim Forest. This Tacet Discord usually uses abandoned vehicles as a host shell, and moves quickly. Once it has set eyes on its prey, it will never give up, hence the name ""Carapace"".","<color=#46c3d4>[Khí Động]</color>
Kẻ địch này có <color=#b49f50>kháng cao</color> với <color=#46c3d4>sát thương Khí Động</color>.

Thuộc Chi Nhân Tạo Giống Nhân Tạo, chỉ thấy ở Rừng Vô Quang. Tàn Tượng này thường dùng xe cộ bỏ hoang làm vỏ bọc ký sinh, hành động nhanh nhẹn, một khi đã nhắm vào con mồi thì sẽ truy đuổi không buông, nên có tên là ""Xe Lưỡi Liềm""."
lang_multi_text.db,MultiText,MonsterHandBook_320000130_FightSkillDescrtption,车刃镰会大范围，长时间地追击自己的猎物，一旦发现它的活动痕迹，应当尽快消灭，以绝后患。,"The Carapace will chase its prey for a long time over vast distances. Therefore, it is advisable to eliminate it at the earliest sighting of its tracks to evade any potential danger.","Xe Lưỡi Liềm sẽ truy đuổi con mồi của mình trong phạm vi lớn và thời gian dài, một khi phát hiện dấu vết hoạt động của nó, nên tiêu diệt càng sớm càng tốt để tránh hậu họa."
lang_multi_text.db,MultiText,MonsterHandBook_320000130_Name,车刃镰,Carapace,Xe Lưỡi Liềm
lang_multi_text.db,MultiText,MonsterHandBook_320000130_TypeDescrtption,残象-人工种,Tacet Discord - Artifian,Tàn Tượng - Chủng Nhân Tạo
lang_multi_text.db,MultiText,MonsterHandBook_320000140_Descrtption,"<color=#7e1f57>【湮灭】</color>
该敌人<color=#7e1f57>湮灭伤害</color><color=#b49f50>抗性较高</color>。

流放者团伙的“首领”，大多数是共鸣者。以瑝珑地区为例，流放者首领通常是因为种种原因被逐出晓卫的人，战斗经验和能力不能和普通流放者同日而语。不过一旦被击败，那些失去了靠山的手下就会四散而逃。","<color=#1891e7>[Havoc]</color>

This enemy has a <color=#b49f50>higher RES</color> against <color=#7e1f57>Havoc DMG</color>. 

Exile Leaders. Mostly Resonators. In the Huanglong region, for example, the Exile Leaders are usually those who have been expelled from the Mornguard for various reasons, so their combat experience and abilities far exceed ordinary Exiles.","<color=#7e1f57>[Hủy Diệt]</color>
Kẻ địch này có <color=#b49f50>kháng cao</color> với <color=#7e1f57>sát thương Hủy Diệt</color>.

""Thủ Lĩnh"" của băng nhóm Kẻ Lưu Đày, đa số là Cộng Hưởng Giả. Lấy khu vực Hoàng Long làm ví dụ, Thủ Lĩnh Lưu Đày thường là những kẻ bị trục xuất khỏi Hiểu Vệ vì nhiều lý do khác nhau, kinh nghiệm chiến đấu và năng lực không thể so sánh với Kẻ Lưu Đày bình thường. Tuy nhiên một khi bị đánh bại, những tên tay sai mất đi chỗ dựa sẽ bỏ chạy tán loạn."
lang_multi_text.db,MultiText,MonsterHandBook_320000140_FightSkillDescrtption,在受到一定伤害后，流放者首领会因为疼痛和愤怒而大幅较高攻击欲望。,"After taking a certain amount of damage, the Exile Leader will have a significantly increased desire to attack due to pain and anger.","Sau khi chịu một lượng sát thương nhất định, Thủ Lĩnh Lưu Đày sẽ tăng mạnh ham muốn tấn công do đau đớn và phẫn nộ."
lang_multi_text.db,MultiText,MonsterHandBook_320000140_Name,流放者首领,Exile Leader,Thủ Lĩnh Kẻ Lưu Đày
lang_multi_text.db,MultiText,MonsterHandBook_320000140_TypeDescrtption,人类,Humans,Con người
