db_file,table_name,id,zh,en,vi
lang_multi_text.db,MultiText,Event_THCQDYBF_9_18,不，如果是{PlayerName}和散华大人的话，弄到这些莲实应该还是没问题的。就让我期待一下吧。,"...On second thought, with {PlayerName} and Lady Sanhua, getting those seeds would be a breeze. Can't wait for your Plumpcake!","Không, nếu là {PlayerName} và Tán Hoa đại nhân, kiếm được mấy hạt sen này chắc không thành vấn đề. Để tôi mong chờ xem sao."
lang_multi_text.db,MultiText,Event_THCQDYBF_9_19,片刻之后，散华以行云流水的刀法和出神入化的技巧完美还原了每一个制作团圆饼的步骤。,"Soon, Sanhua effortlessly recreates the Plumpcake with her incredible talents.","Một lát sau, Tán Hoa dùng đao pháp điêu luyện như mây trôi nước chảy và kỹ thuật xuất thần nhập hóa tái hiện hoàn hảo từng bước làm Bánh Đoàn Viên."
lang_multi_text.db,MultiText,Event_THCQDYBF_9_20,就连路过的游客在看到这一幕后也情不自禁地鼓起了掌。,Onlookers pause to applaud her mastery in action.,Ngay cả du khách đi ngang qua khi nhìn thấy cảnh này cũng không kìm được mà vỗ tay tán thưởng.
lang_multi_text.db,MultiText,Event_THCQDYBF_9_21,——完成了。给，{PlayerName}。尝尝看吧。,"Done. {PlayerName}, please give it a try.","...Xong rồi. Của ngài đây, {PlayerName}. Nếm thử xem."
lang_multi_text.db,MultiText,Event_THCQDYBF_9_22,请告诉我……味道怎么样？,How do you like it?,Xin hãy cho tôi biết... mùi vị thế nào?
