db_file,table_name,id,zh,en,vi
lang_infodisplay.db,InfoDisplay,10,"幽闭禁林的环境比想象中的还要神奇。围绕着这棵巨树的枝干，形成了独特的树冠生态系统。
 根据我的调查，这颗树的枝干内蕴含着丰沛的共鸣能量。从无光之森区域四周的汇集而来的能量，自树顶传到到整个树干之中。在这种能量的催化下，形成了如此庞大的树木。而正是依靠这些能量，树上繁衍出了一个全然不同的生态系统。可能是因为树内时不时传来的凶暴吼声，这颗树木没有大型异变生物与幻象的活动痕迹。这给了植物更好的繁衍生息的机会，也让残响生物隙声蝶得以存在。
 制造这颗巨树的共鸣者与我的异能力十分相似。想必他也是个热爱自然的人。不然即使在树顶的音波仪的加持辅助下，也不太可能制造出这么庞大且复杂的巨树。
 为了方便以后的探险，我在幽闭禁林的枝干上做了一点小小的荧光装饰作为路标。这样以后的科研考察就会更有效率了。那么是时候出发了，去探索幽闭禁林的深处！","The environment of the Confinement Woods is even more magical than expected. A unique canopy ecosystem has formed around the branches of this giant tree.
According to my investigation, the tree's branches contain abundant Resonance Energy within. The energy gathered from around the area of the Dim Forest travels from the top of the tree to the entire trunk. Under the catalyst of this energy, such a huge tree was formed. And it is by relying on these energies that the tree reproduces a whole different ecosystem. Probably because of the ferocious roars that come from time to time within the tree, the tree has no signs of activity from large MO or TD. This gives the plants a better chance to flourish and allows the Remnant Mutterfly to exist.
The skills of the Resonator who created this giant tree is very similar to mine. I guess he is also a nature lover. Otherwise, even with the assistance of the sonic instrument at the top of the tree, it is unlikely that such a large and complex giant tree could have been created.
In order to facilitate future expeditions, I made a little fluorescent decoration on the branch of Confinement Woods as a sign. This will make future research expeditions more efficient. So it's time to go, to explore the depths of the Confinement Woods!","Môi trường của U Bế Cấm Lâm kỳ diệu hơn cả tưởng tượng. Xung quanh cành nhánh của cây khổng lồ này đã hình thành một hệ sinh thái tán cây độc đáo.
 Theo khảo sát của tôi, cành nhánh của cây này chứa đựng năng lượng cộng hưởng dồi dào. Năng lượng tụ hội từ khắp nơi trong khu vực Rừng Vô Quang truyền từ ngọn cây xuống toàn bộ thân cây. Dưới sự xúc tác của năng lượng này, cây khổng lồ như vậy đã được hình thành. Và chính nhờ dựa vào năng lượng này, trên cây đã sinh sôi ra một hệ sinh thái hoàn toàn khác biệt. Có lẽ vì tiếng gầm hung bạo thỉnh thoảng vọng ra từ trong cây, nên cây này không có dấu vết hoạt động của sinh vật dị biến lớn hay Ảo Ảnh. Điều này tạo cơ hội tốt hơn cho thực vật sinh sôi, cũng giúp sinh vật tàn hưởng Khe Thanh Điệp có thể tồn tại.
 Cộng Hưởng Giả tạo ra cây khổng lồ này có dị năng rất giống với tôi. Chắc hẳn người đó cũng là người yêu thiên nhiên. Nếu không thì dù có sự hỗ trợ của máy phát sóng âm trên đỉnh cây, cũng khó mà tạo ra cây khổng lồ đồ sộ và phức tạp đến vậy.
 Để tiện cho những chuyến thám hiểm sau này, tôi đã làm một chút trang trí phát quang nhỏ trên cành nhánh của U Bế Cấm Lâm làm mốc đường. Như vậy những chuyến khảo sát khoa học sau này sẽ hiệu quả hơn. Vậy thì đã đến lúc xuất phát, đi khám phá sâu vào U Bế Cấm Lâm!"
lang_infodisplay.db,InfoDisplay,11,无光之森生态调查总结,Dim Forest Ecological Survey (Conclusion),Tổng Kết Khảo Sát Sinh Thái Rừng Vô Quang
lang_infodisplay.db,InfoDisplay,12,"玦园：但地区内的多数物种正处于一个相对危险的境地。以保育区的紫叶榕为例，该树种基本处于功能性灭绝的边缘，需要及时进行人工保育。
 玦园：另外……
 【捣蛋猿的吱吱声——】
 玦园：坏猩猩！那个不是吃的东西！
 【捣蛋猿的嘲笑声——】
 玦园：给我站住——（声音渐弱，以表达渐远）","Jueyuan: However, most species in the region are in a relatively precarious situation. Take the XXX in the conservation area for example, the species is essentially on the verge of functional extinction and needs timely artificial conservation.
Jueyuan: Besides...
[Hoochief squeaking]
Jueyuan: Bad gorilla! That's not food!
[Hoochief mocking]
Jueyuan: Stop there -- (voice lowering, getting far)","Quyết Viên: Tuy nhiên phần lớn các loài trong khu vực đang ở trong tình trạng khá nguy hiểm. Lấy cây Tử Diệp Dung trong khu bảo tồn làm ví dụ, loài cây này về cơ bản đang ở bờ vực tuyệt chủng chức năng, cần được bảo tồn nhân tạo kịp thời.
 Quyết Viên: Ngoài ra...
 [Tiếng kêu chí chí của Quậy Phá Viên -]
 Quyết Viên: Con tinh tinh hư! Cái đó không phải đồ ăn!
 [Tiếng cười chế nhạo của Quậy Phá Viên -]
 Quyết Viên: Đứng lại cho tôi - (giọng nhỏ dần, biểu thị đang xa dần)"
lang_infodisplay.db,InfoDisplay,13,兽皮地图,Map of Hides,Bản Đồ Da Thú
lang_infodisplay.db,InfoDisplay,14,"五个形状像笼子一样的标识，其中某个笼子里似乎关着特殊的东西。
至于解开笼子的线索，也许可以去额外标记的地方找找看……","Five markers shaped like a cage, where a particular cage seems to hold something special.
As for clues to unlock the cage, maybe look for the extra markers......","Năm dấu hiệu hình dáng giống cái lồng, trong đó một cái lồng dường như nhốt thứ gì đó đặc biệt.
Còn manh mối để mở lồng, có lẽ có thể đến những chỗ được đánh dấu thêm mà tìm..."
lang_infodisplay.db,InfoDisplay,15,当季热门剧目推荐,Featured Shows of the Season,Vở Diễn Nổi Bật Trong Mùa
lang_infodisplay.db,InfoDisplay,16,"【本期剧院精选】
 
 
“见焦土好一似孤村旧梦，
不由我知来事泪眼蒙蒙。”
——回梦今昔，穿越时空，全新沉浸式戏剧《月满天脊》即将上演。


第五届天城相声大会开幕在即。
青禾、将生相声作品《旧城风云》首次公演。
雅俗共赏，齐聚曲艺之夜。


【观演指南】
1. 天城剧院为开放式剧场，请观众自觉遵守公共秩序。
2. 演出期间可随时进出场，但请保持安静。
3. 严禁擅闯舞台，违者交由晓卫处理。
4. 爱护公共环境人人有责，演出结束后，请自行带走垃圾。","[Featured in the Cinema]

""Ravages remind of old dreams of old towns,
Future is never for me to see, but past is to cry.""
- Dream of the past, travel through time. A fresh, immersive play <i> Moon over Sky</i> on premiere.

The Fifth Tiancheng Comic Conference is on the horizon.
Qinghe and Shongsheng's lastest comic work <i>Old City Storm</i> premiering.
Elegant and vulgar in the same night of opera.

[Audience Guide]
1. Tiancheng Theatre is an open theatre, so please observe public order.
2. During the performance, you may enter and exit the theater at any time, but please keep quiet.
3. it is strictly prohibited to trespass on the stage. Offenders will be handed to Mourn Guards.
4. It is everyone's responsibility to take care of the public environment. After the performance, please take away any waste.","[Tinh Tuyển Nhà Hát Kỳ Này]
 
 
""Thấy đất cháy tựa giấc mơ xưa làng cũ,
Chẳng ngăn được mắt lệ nhòa biết chuyện tương lai.""
- Hồi mộng xưa nay, xuyên không gian thời gian, vở kịch chìm đắm hoàn toàn mới ""Trăng Tròn Thiên Tích"" sắp được công diễn.


Đại hội Tướng Thanh Thiên Thành lần thứ năm sắp khai mạc.
Tác phẩm tướng thanh ""Phong Vân Cựu Thành"" của Thanh Hòa và Tương Sinh công diễn lần đầu.
Nhã tục cùng thưởng, tề tụ đêm nghệ thuật.


[Hướng Dẫn Xem Diễn]
1. Nhà hát Thiên Thành là sân khấu mở, mong khán giả tự giác tuân thủ trật tự công cộng.
2. Trong thời gian biểu diễn có thể ra vào bất cứ lúc nào, nhưng xin giữ yên lặng.
3. Nghiêm cấm tự ý xông lên sân khấu, người vi phạm sẽ được giao cho Hiểu Vệ xử lý.
4. Bảo vệ môi trường công cộng là trách nhiệm của mọi người, sau khi biểu diễn kết thúc, xin tự mang rác đi."
lang_infodisplay.db,InfoDisplay,17,归梦声料店,<i>Return to Dream</i> Sound Material Shop,Tiệm Thanh Liệu Quy Mộng
lang_infodisplay.db,InfoDisplay,18,"“采撷，归梦之声，给您身临其境般的体验。”

【今日主题：月】

如月光坠落荧海，涟漪轻语。
——沉月 1000黑石币

乌啼西楼，窗竹影摇。
——晚秋 5000黑石币

滴答、滴答，屋檐的鸣泣。
——不见月 9999黑石币","""Pick the sounds of dream returning. Immersive Experience for just you.""

[theme of the day: moon]

Moon dropping in the sea of fireflies, whispers in the ripples.
- Moon Sunk 1000 Tacetite coins

Raven cawing at west tower, bamboo reflecting from window.
- Late Autumn 5000 Tacetite coins

Tik tok, tik tok, eave is whimpering.
- Moonless Night 9999 Tacetie coins","""Hái lượm thanh âm giấc mộng trở về, mang đến cho bạn trải nghiệm như đang ở đó.""

[Chủ đề hôm nay: Trăng]

Như ánh trăng rơi xuống biển huỳnh quang, gợn sóng thì thầm.
- Trầm Nguyệt 1000 đồng Hắc Thạch

Quạ kêu lầu tây, bóng trúc lay ngoài cửa sổ.
- Vãn Thu 5000 đồng Hắc Thạch

Tích tắc, tích tắc, mái hiên khẽ khóc.
- Bất Kiến Nguyệt 9999 đồng Hắc Thạch"
lang_infodisplay.db,InfoDisplay,19,安全生产公告,Notice about Safe Production,Thông Báo An Toàn Sản Xuất
lang_infodisplay.db,InfoDisplay,20,"标准化、流程化、工业化。
高效开采黑石，精密提炼鸣液。
安全运输，合规生产。
 
  ——天工发布","Standardized, flow and industrialized.
Efficient mining of Tacetite, precise refining of Wutherium Fluid.
Safe transportation, compliant production.

Ministry of Development","Tiêu chuẩn hóa, quy trình hóa, công nghiệp hóa.
Khai thác Hắc Thạch hiệu quả, tinh luyện Minh Dịch chính xác.
Vận chuyển an toàn, sản xuất đúng quy định.
 
  - Thiên Công phát hành"
lang_infodisplay.db,InfoDisplay,21,工作简报,Work Brief,Tóm Tắt Công Việc
lang_infodisplay.db,InfoDisplay,22,"新历159年 12月31日
 记录人：怀瑾
 
研究院和天工联合发布了最新版的《鸣潮子泄漏应急手册》，工头说这里就属我最懂黑石能源，让我先学习学习，过两天给其他矿工们培训下。六十多页的说明，两天哪够，怎么着也得两周吧。
“对于沾染了放射性粉尘的人员、装备、物资，可通过洗消措施降低放射性污染。”
 “被污染的废水，必须经过离子交换处理，不可随意排放。”
研究院的人不知道怎么想的，既然是给矿工的手册，就应该用简单直白的话。什么离子交换，矿工哪懂这些。
 算了，算了，虽然麻烦了点儿，看在工头的面子上，我给大家提炼提炼重点吧。
哎，大过节的还要加班，真希望干了这活儿，能给我放一周假。","159 A. L. Dec. 31
Recorder: Huaijin

The Academy and the Ministry jointly released the latest version of the ""Wutheron Leakage Emergency Response Manual"", and the foreman said that I knew best about Tacetite energy here, so I should study it first and give the other mine workers some trainings in a couple of days. More than sixty pages of instructions in two days. It should be two weeks at least.
""For personnel, equipment and materials contaminated with radioactive dust, the damage can be reduced by cleaning and decontamination.""
 ""Contaminated wastewater must be treated by ion exchange and must not be discharged at will.""
The people at the Academy must be fools. If this is a manual for miners, they should use simple and straightforward words. Ion exchange and blah blah, miners do not know this.
 Forget it, forget it, sure it's a trouble, but for the sake of the foreman, I will make some outlines of it.
Sigh, overtime work in the holiday. I really hope I'd get a week off after this.","Năm 159 Tân Lịch, ngày 31 tháng 12
 Người ghi chép: Hoài Cẩn
 
Viện Nghiên cứu và Thiên Công phối hợp phát hành phiên bản mới nhất của ""Sổ Tay Ứng Phó Khẩn Cấp Rò Rỉ Minh Triều Tử"", đội trưởng nói ở đây tôi là người hiểu rõ năng lượng Hắc Thạch nhất, bảo tôi học trước rồi vài ngày nữa đào tạo cho các thợ mỏ khác. Hơn sáu mươi trang hướng dẫn, hai ngày làm sao đủ, ít nhất cũng phải hai tuần chứ.
""Đối với nhân viên, trang thiết bị, vật tư bị nhiễm bụi phóng xạ, có thể giảm mức ô nhiễm phóng xạ thông qua biện pháp tẩy rửa.""
 ""Nước thải bị ô nhiễm phải được xử lý qua trao đổi ion, không được xả tùy tiện.""
Mấy người ở Viện Nghiên cứu không biết nghĩ gì, đã là sổ tay cho thợ mỏ thì phải dùng lời đơn giản dễ hiểu chứ. Trao đổi ion gì, thợ mỏ nào hiểu được.
 Thôi kệ, thôi kệ, tuy phiền một chút, nhưng vì thể diện đội trưởng, để tôi tóm tắt trọng điểm cho mọi người vậy.
À, đúng dịp lễ mà vẫn phải tăng ca, thật mong xong việc này được nghỉ một tuần."
lang_infodisplay.db,InfoDisplay,23,鸣钟园,Knell Garden,Minh Chung Viên
lang_infodisplay.db,InfoDisplay,24,"即使暗夜淹没了足迹，只要常怀探索未知的勇气，我们终将抵达远方。
 ——致献身长夜的战士们 
 
 【鸣钟园背景】
鸣钟园建立于新历155年，意在铭记每一位为人类文明献身的勇士，园内每朵花均由第五任夜归团长忌炎亲自播种、浇灌。花种由特聘植物研究员玦园根据皇龙地质、气候特殊培育，即使在恶劣天气下也能保证100%存活率，象征着不屈的皇龙精神。
各位市民在吊唁时，请尊重逝者，勿踩踏花海，违者将交由晓卫处理。","Even if the darkness of night drowns our footprint, we can and will reach the far, as long as we have the constant courage to explore the unknown.
- to the warriors who dedicate themselves to the long nights

[About the Knell Garden]
Established in 155 A.L., the Knell Garden is meant to remember every warrior who gave his life for human civilization. Every flower in the garden was personally sown and watered by the fifth head of the Midnight Rangers, Jiyan. The flower seeds are specially cultivated by the specially hired botanical researcher Jueyuan, according to the geology and climate in Huanglong, which can guarantee 100% survival rate even in bad weather, symbolizing the indomitable spirit of Huanglong.
When paying condolences, citizens should respect the deceased and do not trample on the sea of flowers. Violators will be taken to Mourn Guards.","Dù đêm tối nhấn chìm dấu chân, chỉ cần luôn mang trong mình dũng khí khám phá điều chưa biết, chúng ta rồi sẽ đến được nơi xa.
 - Kính tặng những chiến sĩ hiến mình cho đêm trường
 
 [Giới Thiệu Minh Chung Viên]
Minh Chung Viên được thành lập vào năm 155 Tân Lịch, nhằm ghi nhớ mỗi dũng sĩ đã hy sinh vì nền văn minh nhân loại. Mỗi bông hoa trong vườn đều do Kị Viêm - đoàn trưởng đời thứ năm của Dạ Quy - đích thân gieo trồng và tưới nước. Giống hoa được nhà nghiên cứu thực vật đặc biệt Quyết Viên nuôi dưỡng riêng theo đặc điểm địa chất và khí hậu Hoàng Long, đảm bảo tỷ lệ sống 100% ngay cả trong thời tiết khắc nghiệt, tượng trưng cho tinh thần bất khuất của Hoàng Long.
Các vị thị dân khi đến viếng, xin hãy tôn trọng người đã khuất, không dẫm lên biển hoa, người vi phạm sẽ được giao cho Hiểu Vệ xử lý."
lang_infodisplay.db,InfoDisplay,25,鸣钟语音,Voice of Tolling,Giọng Nói Minh Chung
lang_infodisplay.db,InfoDisplay,26,"康健：请尊重逝者，不得踩踏！
康健：最后警告一次，不！得！踩！踏！
康健：不得……真是屡教不改！我已经通知晓卫了。","Kangjian: please respect the dead and refrain from treading!
Kangjian: Final warning. REFRAIN, FROM, TREADING!
Kangjian: Refra... incorrigible! Morn Guards have been called.","Khang Kiện: Xin hãy tôn trọng người đã khuất, không được giẫm đạp!
Khang Kiện: Cảnh cáo lần cuối, không! được! giẫm! đạp!
Khang Kiện: Không được... thật là không chừa! Tôi đã thông báo cho Hiểu Vệ rồi."
lang_infodisplay.db,InfoDisplay,27,检修记录,Maintanence Records,Ghi Chép Bảo Trì
lang_infodisplay.db,InfoDisplay,28,"时间：1600125
检修记录：例行检修，无特殊故障报告。
责任人：0134
下次预计检修时间：1600424
时间：1600425
检修记录：右侧自（修订记录：“自”改为“制”）制动装置回声异常，有联合（修订记录：“联合”改为“接合”）接合元件老化可能。
责任人：0210
下次预计检修时间：16006（修订记录：“6”改为“7”）725
时间：1600426
检修记录：已排除接合元件老化可能性，为异物卡顿问题，已上报故障，上报编号0766。
责任人：0134
下次预计检修时间：1600725
备注：请注意检修日期间隔，保持术语准确、规范，修订记录已附，望查阅。","Time: 1600125
Maintenance Record: Regular maintenance. No special faults reported.
Record Made by: 0134
Next Expected Maintenance: 1600424
Time: 1600425
Maintenance Record: Baking (Revised: ""Braking"" instead of ""baking"") braking device on the right shows abnormal echo. Possible aging problem at the unifying (Revised: ""joint"" instead of ""unifying"") joint component.
Record Made by: 0210
Next Expected Maintenance: 16006 (Revised: ""7"" instead of ""6"") 725
Time: 1600426
Maintenance Record: Aging possibility ruled out. Alien jamming confirmed. Fault reported as Report No. 0766.
Record Made by: 0134
Next Expected Maintenance: 1600725
Note: Please observe date requirement and the accuracy and norms of terminology. Revisions are attached.","Thời gian: 1600125
Ghi chép bảo trì: Bảo trì định kỳ, không có báo cáo sự cố đặc biệt.
Người chịu trách nhiệm: 0134
Thời gian bảo trì dự kiến tiếp theo: 1600424
Thời gian: 1600425
Ghi chép bảo trì: Thiết bị tự (Ghi chú sửa đổi: ""tự"" sửa thành ""chế"") chế động bên phải có tiếng vọng bất thường, có khả năng linh kiện liên hợp (Ghi chú sửa đổi: ""liên hợp"" sửa thành ""tiếp hợp"") tiếp hợp bị lão hóa.
Người chịu trách nhiệm: 0210
Thời gian bảo trì dự kiến tiếp theo: 16006 (Ghi chú sửa đổi: ""6"" sửa thành ""7"") 725
Thời gian: 1600426
Ghi chép bảo trì: Đã loại trừ khả năng lão hóa linh kiện tiếp hợp, là vấn đề dị vật gây kẹt, đã báo cáo sự cố, mã báo cáo 0766.
Người chịu trách nhiệm: 0134
Thời gian bảo trì dự kiến tiếp theo: 1600725
Ghi chú: Xin lưu ý khoảng cách ngày bảo trì, giữ thuật ngữ chính xác và chuẩn mực, ghi chú sửa đổi đã đính kèm, kính mời xem xét."
lang_infodisplay.db,InfoDisplay,29,观众留言,Viewer's Comments,Lời Nhắn Của Khán Giả
lang_infodisplay.db,InfoDisplay,30,"<留言编号010>
呜呜呜呜呜呜——
《月满天脊》也太好哭了吧！什么样的编剧老师能写出这样的故事啊！散场了我的眼泪都止不住，下周休假一定再来二刷！呜——
剧场回复：感谢贵客对该剧的热爱，下周日晚18点30分，期待您的光临。

<留言编号025>
《旧城风云》真的下饭！我下次可以带点我老姨做的辣酱来边吃边看吗？
剧场回复：感谢贵客对该剧的喜爱，本剧场不禁止饮食，但请注意不要食用气味过于强烈的食物。","<Comment No. 010>
sob sob...
<i>Moon Over Sky</i> is so tearful! What a talent of the writers to create a story like this! I can't even stop my tears after letting out. Will definitely come for a second time! Sob...
Reply from theater: Thank you for your passion for the show. We look forward to you at 6: 30 p. m. next Sunday.

<Comment No. 025>
The <i>Old City Storm</i> is such a great side dish! Can I bring some chilli sauce my aunt made next time and eat while I watch the show?
Reply from theater: Thank you for your affection for the show. Eating is not prohibited in the theater, but please refrain from food with strong smells.","<Lời nhắn số 010>
Hu hu hu hu hu hu -
""Trăng Tròn Thiên Tích"" cảm động quá đi mất! Biên kịch nào mà viết ra được câu chuyện như thế! Tan rạp rồi mà nước mắt tôi cứ chảy không ngừng, tuần sau nghỉ phép nhất định phải đến xem lần hai! Hu -
Nhà hát trả lời: Cảm ơn quý khách yêu thích vở diễn, Chủ Nhật tuần sau lúc 18 giờ 30 phút, mong được đón tiếp.

<Lời nhắn số 025>
""Phong Vân Cựu Thành"" xem cực đã! Lần sau tôi có thể mang theo tương ớt dì tôi làm vừa ăn vừa xem không?
Nhà hát trả lời: Cảm ơn quý khách yêu thích vở diễn, nhà hát không cấm ăn uống, nhưng xin lưu ý không ăn đồ có mùi quá nồng."
lang_infodisplay.db,InfoDisplay,31,失物招领,Lost and Found,Nhặt Được Đồ Thất Lạc
lang_infodisplay.db,InfoDisplay,32,"前日晚间21时《月满天脊》散场后，有观众于剧场内捡拾到他人遗失财物，现列举如下：

蓝色耳环 5排9座 1只
天工造物局身份识别卡 6排9座 1张
小龙包兑换券（含特殊龙纹标记） 8排10座 2张
手工发带（红蓝交织，未编完） 16排11座 1条

请以上物品失主或相关人士于招领公告发布的10日之内前来认领。","Lost and Found after the <i>Moon Over Sky</i> at 9 p. m. the day before yesterday:

Blue Earring                                                                                               I, 5th    1 piece
ID card at Creation Bureau, Ministry of Development                        I, 6th    1 card
Dumpling Coupon (with speical loong marks）                                J, 8th    2 pieces
Handmade Hairwrap (intertwined with red and blue, unfinished)  K, 16th  1 piece

The original owners of these items are asked to collect them within 10 days as of this notice.","Sau khi tan buổi diễn ""Trăng Tròn Thiên Tích"" vào lúc 21 giờ tối hôm trước, có khán giả nhặt được tài sản thất lạc của người khác trong nhà hát, liệt kê như sau:

Bông tai xanh dương, hàng 5 ghế 9, 1 chiếc
Thẻ nhận dạng Cục Tạo Vật Thiên Công, hàng 6 ghế 9, 1 tấm
Phiếu đổi tiểu long bao (có hoa văn rồng đặc biệt), hàng 8 ghế 10, 2 tấm
Băng đô thủ công (đỏ xanh đan xen, chưa hoàn thành), hàng 16 ghế 11, 1 chiếc

Xin chủ sở hữu các vật phẩm trên hoặc người liên quan đến nhận lại trong vòng 10 ngày kể từ ngày đăng thông báo."
lang_infodisplay.db,InfoDisplay,33,吱吱快运招聘启事,Squeaky Delivery Recruitment,Thông Báo Tuyển Dụng Chí Chí Chuyển Phát Nhanh
