db_file,table_name,id,zh,en,vi
lang_multi_text.db,MultiText,Main_Linaxita_2_4_126_18,我明白了……,I understand...,Tôi hiểu rồi...
lang_multi_text.db,MultiText,Main_Linaxita_2_4_126_19,谢谢你……,Thank you...,Cảm ơn bạn...
lang_multi_text.db,MultiText,Main_Linaxita_2_4_126_2,这是我最后一个请求，现在同时拥有分离与融合能力的你一定可以办到。,"I have one final request. Now that you have the power to split and merge energy, there is something only you can do.","Đây là lời thỉnh cầu cuối cùng của tôi. Giờ bạn đã đồng thời sở hữu cả năng lực tách rời và hợp nhất, chắc chắn có thể làm được."
lang_multi_text.db,MultiText,Main_Linaxita_2_4_126_20,以及……对不起。,And... forgive me.,Và... xin lỗi.
lang_multi_text.db,MultiText,Main_Linaxita_2_4_126_3,请……利用我和「芙露德莉斯」本为一体的联系，将她所剩无几的意识也带到这里吧。,Please... use the connection I still share with Fleurdelys to bring the last fragments of her tortured consciousness here.,"Xin hãy... lợi dụng mối liên kết vốn là một thể giữa tôi và Fleurdelys, đưa chút ý thức còn sót lại của cô ấy đến đây."
lang_multi_text.db,MultiText,Main_Linaxita_2_4_126_4,让我们重新合一……然后彻底消散吧。,"Then, with your power, remake us as one... and finally release us from this world.",Để chúng tôi hợp nhất lại... rồi tan biến hoàn toàn.
lang_multi_text.db,MultiText,Main_Linaxita_2_4_126_5,为什么……,Why...,Tại sao...
lang_multi_text.db,MultiText,Main_Linaxita_2_4_126_6,因为这样……鸣式的意识将被永远困死在毫无力量的躯壳中，祂将失去重来的可能。,"That way... the Threnodian will remain trapped forever in a lifeless shell, unable to return to this world.","Bởi vì như vậy... ý thức của Minh Thức sẽ bị giam giữ vĩnh viễn trong lớp vỏ không còn chút sức mạnh nào, Ngài sẽ mất đi mọi cơ hội quay lại."
lang_multi_text.db,MultiText,Main_Linaxita_2_4_126_7,你不是想要延续的那部分吗？,But doesn't that mean the end of the part of you that wishes to live?,Bạn không phải là phần muốn tiếp tục sống sao?
lang_multi_text.db,MultiText,Main_Linaxita_2_4_126_8,我已经享受过很精彩的人生了，现在该把真实的未来还给剩下的人了。,I have lived my life to the fullest. I would like the ones who are left to do so as well.,Tôi đã được tận hưởng một cuộc đời thật tuyệt vời rồi. Giờ đến lúc trả lại tương lai thật sự cho những người còn lại.
lang_multi_text.db,MultiText,Main_Linaxita_2_4_126_9,「卡提希娅」的愿望已经达成，现在该轮到「芙露德莉斯」了。,Cartethyia has had her wish fulfilled. Now it's Fleurdelys' turn.,"Nguyện vọng của Cartethyia đã hoàn thành, giờ đến lượt Fleurdelys."
lang_multi_text.db,MultiText,Main_Linaxita_2_4_127_1,啊啊啊……我也压不住啦……,Ahhhhh... I can't hold it any longer...,Ahhh... tôi cũng không kìm được nữa rồi...
lang_multi_text.db,MultiText,Main_Linaxita_2_4_127_2,为什么要这么做……不论是卡提希娅还是芙露德莉斯都不应该继续存在了！,Why? Why are you doing this?! Neither Cartethyia nor Fleurdelys should continue to exist!,Tại sao lại làm thế... dù là Cartethyia hay Fleurdelys đều không nên tiếp tục tồn tại nữa!
lang_multi_text.db,MultiText,Main_Linaxita_2_4_127_3,不要去……,Don't go...,Đừng đi...
lang_multi_text.db,MultiText,Main_Linaxita_2_4_127_4,我已收到你的求助，接下来……,I heard your request...,Tôi đã nhận được lời cầu cứu của bạn. Tiếp theo...
lang_multi_text.db,MultiText,Main_Linaxita_2_4_127_5,该按我的风格解决了,But I prefer to handle this my way.,Để tôi xử lý theo cách của mình.
lang_multi_text.db,MultiText,Main_Linaxita_2_4_128_1,苹果不会落在离树太远的地方，就算是被分离出来的一部分，也有相似的坚持吗？,"Not even whole, yet still ever so determined.","Quả táo không rơi xa cây quá... Dù chỉ là một phần bị tách ra, vẫn mang trong mình sự kiên định tương tự sao?"
lang_multi_text.db,MultiText,Main_Linaxita_2_4_128_10,活下来的人总会或多或少丢失部分记忆 ，并得到部分真相的碎片。,"Those who survive receive fragments of truth, but at a cost. Memories lost in varying degrees.","Những người sống sót ít nhiều đều mất đi một phần ký ức, và nhận được những mảnh vỡ của sự thật."
lang_multi_text.db,MultiText,Main_Linaxita_2_4_128_100,"坎特蕾拉带着重新恢复力量的「提尔芬」来到了卡提希娅面前，里面寄宿着历代圣女候选人尝试共鸣时，岁主分离出的力量碎片。
“真正的圣女已经死了”，因为本可以与「英白拉多」二次共鸣的坎特蕾拉割舍了二次共鸣的力量，换取到了斩杀异化岁主的机会。
所以现在，“冒牌”的圣女为何不能成为“真正”的圣女呢？","Cantarella approaches Cartethyia with the now restored Tyrvine in hand. Within it are fragments of the Sentinel's power, remnants of failed resonances from the Maiden candidates in the past.

""The real Blessed Maiden is dead."" Cantarella sacrificed her Second Awakening with Imperator for a chance to destroy the Sentinel's corrupted form.

So now, why can't the ""false"" Blessed Maiden become the ""true"" one?","Cantarella mang ""Tyrvine"" đã phục hồi sức mạnh đến trước mặt Cartethyia. Bên trong chứa những mảnh vỡ sức mạnh mà Tuế Chủ tách ra mỗi khi các ứng viên Thánh Nữ qua các đời thử cộng hưởng.
""Thánh Nữ thật sự đã chết rồi"" - bởi Cantarella, người đáng lẽ có thể cộng hưởng lần hai với ""Imperator"", đã từ bỏ sức mạnh cộng hưởng lần hai để đổi lấy cơ hội chém hạ Tuế Chủ đã bị dị hóa.
Vậy thì bây giờ, tại sao Thánh Nữ ""giả"" lại không thể trở thành Thánh Nữ ""thật"" chứ?"
lang_multi_text.db,MultiText,Main_Linaxita_2_4_128_11,而那些丢失的记忆碎片其实就散落在这索诺拉中，它们所承载的正是岁主传递真相时，切割的微弱力量。,"The lost memories fall into this Sonoro Sphere, each carrying faint traces of the Sentinel's power. The power within those fragments of truth.",Còn những mảnh ký ức đã mất ấy thực ra nằm rải rác khắp Sonoro này. Chúng mang theo chính sức mạnh nhỏ nhoi mà Tuế Chủ cắt ra khi truyền đạt sự thật.
lang_multi_text.db,MultiText,Main_Linaxita_2_4_128_12,「提尔芬」恰好能将这些力量收集起来。,Tyrvine absorbs this energy.,"""Tyrvine"" có thể thu thập những sức mạnh ấy lại."
lang_multi_text.db,MultiText,Main_Linaxita_2_4_128_13,岁主残存的力量正在你体内流淌，你比任何人都有资格拿起这把剑。,The Sentinel's energy flows through you. You are more than worthy of wielding this sword.,Sức mạnh còn sót lại của Tuế Chủ đang chảy trong người cậu. Cậu xứng đáng cầm thanh kiếm này hơn bất kỳ ai.
lang_multi_text.db,MultiText,Main_Linaxita_2_4_128_14,但这并非命运的选定，而是因为你……因为卡提希娅你选择拿起了这把剑，它才成了“圣女的剑”。,"But you, Cartethyia... you alone must choose to wield it. Only then will it become the ""Blessed Maiden's Sword.""","Nhưng đây không phải do số phận chọn lựa, mà bởi vì cậu... bởi vì Cartethyia, cậu đã chọn cầm lấy thanh kiếm này, nên nó mới trở thành ""kiếm của Thánh Nữ""."
lang_multi_text.db,MultiText,Main_Linaxita_2_4_128_15,这里面……也有当初坎特蕾拉割舍的部分吗？,Does it also hold the sacrifice you made?,Bên trong này... cũng có phần mà Cantarella đã từ bỏ năm xưa sao?
lang_multi_text.db,MultiText,Main_Linaxita_2_4_128_16,没有……我割舍的东西，早就物尽其用了。,No... My sacrifice was used up long ago.,Không... Thứ ta từ bỏ đã dùng hết từ lâu rồi.
lang_multi_text.db,MultiText,Main_Linaxita_2_4_128_17,在那次共鸣中，我与岁主的意识共鸣，通过已经异化的眼睛，看到了“你”。,"At the time I resonated with the Sentinel, I saw...""you"" through Their distorted eyes.","Trong lần cộng hưởng đó, ta đã cộng hưởng với ý thức của Tuế Chủ, và qua đôi mắt đã bị dị hóa, ta nhìn thấy ""cậu""."
lang_multi_text.db,MultiText,Main_Linaxita_2_4_128_18,准确说是看到了和鸣式战斗的「芙露德莉斯」。,"Or rather, I saw Fleurdelys battling the Threnodian.","Chính xác hơn là ta nhìn thấy ""Fleurdelys"" đang chiến đấu với Minh Thức."
lang_multi_text.db,MultiText,Main_Linaxita_2_4_128_19,而那时我放弃了一样东西，以换取破局的关键。,"In that moment, I made a sacrifice that would shift the balance of power.","Và khi ấy, ta đã từ bỏ một thứ để đổi lấy chìa khóa phá vỡ thế cục."
lang_multi_text.db,MultiText,Main_Linaxita_2_4_128_2,坎特蕾拉……,Cantarella...,Cantarella...
lang_multi_text.db,MultiText,Main_Linaxita_2_4_128_20,难道是……,Was it...,Chẳng lẽ là...
lang_multi_text.db,MultiText,Main_Linaxita_2_4_128_21,我与岁主二次共鸣获得的力量。,The energy I received from the Sentinel's Second Awakening.,Sức mạnh ta nhận được từ lần cộng hưởng thứ hai với Tuế Chủ.
lang_multi_text.db,MultiText,Main_Linaxita_2_4_128_22,利用分离的权能，我将它彻底分割反哺岁主，以让岁主能暂时夺回身体的控制权。,"I split it from myself and offered it back to the Sentinel so They could, for a moment, regain control of Their body.","Dùng quyền năng phân tách, ta đã cắt rời nó hoàn toàn và trả lại cho Tuế Chủ, để Tuế Chủ có thể tạm thời giành lại quyền kiểm soát cơ thể."
lang_multi_text.db,MultiText,Main_Linaxita_2_4_128_23,也只有这样，「芙露德莉斯」才能抓住机会斩杀已经被异化的岁主。,Only by doing this could Fleurdelys seize the moment to kill the already tainted Sentinel.,"Chỉ có như vậy, ""Fleurdelys"" mới có thể nắm bắt cơ hội chém hạ Tuế Chủ đã bị dị hóa."
lang_multi_text.db,MultiText,Main_Linaxita_2_4_128_24,所以……,So...,Vậy nên...
lang_multi_text.db,MultiText,Main_Linaxita_2_4_128_25,真正的圣女已经死了。,The real Blessed Maiden is dead.,Thánh Nữ thật sự đã chết rồi.
lang_multi_text.db,MultiText,Main_Linaxita_2_4_128_26,既然如此，“冒牌”的圣女为何不能成为“真正”的圣女呢？,"But there is no reason why the ""false"" Blessed Maiden cannot herself become the ""true"" Blessed Maiden, is there?","Đã vậy, tại sao Thánh Nữ ""giả"" lại không thể trở thành Thánh Nữ ""thật"" chứ?"
lang_multi_text.db,MultiText,Main_Linaxita_2_4_128_27,一往无前的人是不会被停滞不前的剑定义的。,A person of true character should never be defined by an inanimate blade.,Người dũng tiến không ngừng sẽ không bị định nghĩa bởi một thanh kiếm đứng yên.
lang_multi_text.db,MultiText,Main_Linaxita_2_4_128_28,我们都是被鸣式诅咒和戏弄的生命，但也可以开创自己的变局。,"Both you and I were cursed to be mere playthings of the Threnodian, but that doesn't mean we cannot reshape our fate.","Chúng ta đều là những sinh mệnh bị Minh Thức nguyền rủa và đùa bỡn, nhưng cũng có thể tự tay mở ra cục diện mới cho mình."
lang_multi_text.db,MultiText,Main_Linaxita_2_4_128_29,谢谢……我会用这被诅咒，被戏弄的生命去完成真实的拯救。,"Thank you... in spite of my curse, my life of hardship, I must still save what is true.","Cảm ơn... Tôi sẽ dùng sinh mệnh bị nguyền rủa, bị đùa bỡn này để hoàn thành sự cứu rỗi đích thực."
lang_multi_text.db,MultiText,Main_Linaxita_2_4_128_3,“呼姆”带我来的，原本想着应该与你们汇合。,Phaom brought me here. I'd have shown myself earlier...,"""Phaom"" dẫn ta tới đây. Ban đầu ta định hội hợp với các cậu."
lang_multi_text.db,MultiText,Main_Linaxita_2_4_128_30,该说谢谢的是我……如果不是你阻止了第二次黑潮……,"Had you not stopped the second Dark Tide... Well, it is we who should be thanking you.",Người phải nói cảm ơn là ta mới đúng... Nếu không phải cậu đã ngăn chặn đợt Hắc Triều thứ hai...
lang_multi_text.db,MultiText,Main_Linaxita_2_4_128_31,呼……这样算还了一些救命之恩了吗……想稍微休息一下啊……,Huh... at least you can't accuse me of ingratitude... I just need a moment's rest.,Hừ... Vậy coi như đã trả được chút ơn cứu mạng rồi chứ... Muốn nghỉ ngơi một chút quá...
lang_multi_text.db,MultiText,Main_Linaxita_2_4_128_32,抱歉，他们俩正在努力做一件很了不起的事。,"Apologies, but they're doing something rather important.","Xin lỗi nhé, hai người họ đang cố gắng làm một việc rất quan trọng."
lang_multi_text.db,MultiText,Main_Linaxita_2_4_128_33,可以……,Please...,Nên là...
lang_multi_text.db,MultiText,Main_Linaxita_2_4_128_34,请你们不要打扰吗？,Do give them some privacy.,Các cậu đừng quấy rầy được không?
lang_multi_text.db,MultiText,Main_Linaxita_2_4_128_4,但刚才似乎不是现身的好时机。,But it didn't seem like the right time to interrupt.,Nhưng lúc nãy có vẻ không phải thời điểm thích hợp để xuất hiện.
lang_multi_text.db,MultiText,Main_Linaxita_2_4_128_5,看来，我做的准备还是可以派上用场了。,Looks like what I prepared could still be put to good use.,"Xem ra, những gì ta chuẩn bị vẫn có thể dùng được."
lang_multi_text.db,MultiText,Main_Linaxita_2_4_128_6,「提尔芬」……,Tyrvine...,"""Tyrvine""..."
lang_multi_text.db,MultiText,Main_Linaxita_2_4_128_7,岁主的剑，应该能帮你抵御鸣式的片刻攻势。,The Sentinel's Sword. It will help you resist the Threnodian's attack.,"Thanh kiếm của Tuế Chủ, có thể giúp cậu chống đỡ đòn tấn công của Minh Thức trong chốc lát."
lang_multi_text.db,MultiText,Main_Linaxita_2_4_128_8,这里面是……,What's inside?,Bên trong này là...
lang_multi_text.db,MultiText,Main_Linaxita_2_4_128_9,历代通过圣女试炼的候选人，都会尝试通过「提尔芬」与岁主共鸣。,"To pass the Divine Trials, every potential Maiden must resonate with the Sentinel through Tyrvine.","Các ứng viên vượt qua thử thách Thánh Nữ qua các đời đều sẽ thử cộng hưởng với Tuế Chủ thông qua ""Tyrvine""."
lang_multi_text.db,MultiText,Main_Linaxita_2_4_129_1,阿布？,Abby?,Abby?
lang_multi_text.db,MultiText,Main_Linaxita_2_4_129_2,嗯，我懂的，要把那什么利维亚坦揪出来是吧？,"Yep, I get it. We gonna yoink Leviathan out?","Ừ, ta hiểu rồi, phải lôi cái thằng Leviathan ra đúng không?"
lang_multi_text.db,MultiText,Main_Linaxita_2_4_129_4,不过，你现在只剩下我吃过的力量了，真的没问题吗？,But all you have left is the energy I ate before. Are you sure that's enough?,"Nhưng giờ ngươi chỉ còn lại phần sức mạnh ta đã nuốt thôi, thật sự không sao chứ?"
lang_multi_text.db,MultiText,Main_Linaxita_2_4_129_5,有些事，必须要去做。,"Some things, you just gotta do.","Có những việc, nhất định phải làm."
lang_multi_text.db,MultiText,Main_Linaxita_2_4_12_1,我们到了。,This is it.,Đến rồi.
lang_multi_text.db,MultiText,Main_Linaxita_2_4_130_1,你来了，弑神者。,"Come to me, mighty godkiller.","Ngươi đến rồi, kẻ giết thần."
lang_multi_text.db,MultiText,Main_Linaxita_2_4_131_1,你弱了太多,You are much weaker.,Ngươi yếu quá.
lang_multi_text.db,MultiText,Main_Linaxita_2_4_131_3,为了……拯救你！,I'm here... to save you!,Vì... cứu Ngài!
lang_multi_text.db,MultiText,Main_Linaxita_2_4_131_4,如果无法为我带来毁灭，就迎接毁灭吧,"End me, or I will end you.","Nếu không thể mang đến hủy diệt cho ta, thì hãy đón nhận hủy diệt."
lang_multi_text.db,MultiText,Main_Linaxita_2_4_133_1,你也要违背“自己”吗？,"You would betray ""yourself""?","Ngươi cũng định phản bội ""chính mình"" sao?"
lang_multi_text.db,MultiText,Main_Linaxita_2_4_133_2,没有违背……,No... this is not betrayal.,Không hề phản bội...
lang_multi_text.db,MultiText,Main_Linaxita_2_4_134_1,英白拉多？不……你自己的力量吗？,Imperator's? No... Your own power?,Imperator? Không... là sức mạnh của chính ngươi sao?
lang_multi_text.db,MultiText,Main_Linaxita_2_4_134_10,这温暖的光不能熄灭……,This warm light must not fade...,Ánh sáng ấm áp này không thể tắt...
lang_multi_text.db,MultiText,Main_Linaxita_2_4_134_11,我将我的力量、我的祝福、我的过去托付给你……至于未来——,"Take my power, my blessings, my past. Seek out a future...","Tôi giao phó sức mạnh, phước lành, quá khứ của mình cho ngươi... Còn tương lai -"
lang_multi_text.db,MultiText,Main_Linaxita_2_4_134_12,就让我成为你的剑，一起寻找吧,Where I am your blade. We'll find it together.,"Hãy để tôi trở thành thanh kiếm của ngươi, cùng nhau tìm kiếm."
lang_multi_text.db,MultiText,Main_Linaxita_2_4_134_13,{PlayerName},{PlayerName}.,{PlayerName}
lang_multi_text.db,MultiText,Main_Linaxita_2_4_134_2,无用之举！,Useless!,Vô ích!
lang_multi_text.db,MultiText,Main_Linaxita_2_4_134_3,只要救下眼前一人,As long as I can save the person in front of me...,Chỉ cần cứu được người trước mắt...
lang_multi_text.db,MultiText,Main_Linaxita_2_4_134_4,就不是无用！,I am not useless!,Thì không phải vô ích!
lang_multi_text.db,MultiText,Main_Linaxita_2_4_134_5,不能退缩！,No retreat!,Không thể lùi bước!
lang_multi_text.db,MultiText,Main_Linaxita_2_4_134_6,至少……打破这个牢笼！,"At least... break, damn it!",Ít nhất... phải phá vỡ cái lồng này!
lang_multi_text.db,MultiText,Main_Linaxita_2_4_134_7,拼尽全力也……怎么可以……,I tried everything... How could this be...,Dốc hết sức rồi mà... sao có thể...
lang_multi_text.db,MultiText,Main_Linaxita_2_4_134_8,又是……谁也救不了……,Again... I failed...,Lại là... không cứu được ai...
lang_multi_text.db,MultiText,Main_Linaxita_2_4_134_9,对不起……,I'm sorry...,Xin lỗi...
lang_multi_text.db,MultiText,Main_Linaxita_2_4_135_1,做得好,Well done.,Làm tốt lắm.
lang_multi_text.db,MultiText,Main_Linaxita_2_4_135_2,至于未来——就让我成为你的剑，一起寻找吧,Seek out a future... where I am your blade. We'll find it together.,"Còn tương lai - hãy để tôi trở thành thanh kiếm của ngươi, cùng nhau tìm kiếm."
lang_multi_text.db,MultiText,Main_Linaxita_2_4_135_3,这具身体里的频率已经……,The frequency in her body is already...,Tần số trong cơ thể cô ấy đã...
lang_multi_text.db,MultiText,Main_Linaxita_2_4_135_4,御者，请不要悲伤，希望仍在,"Arbiter, despair not, for all is not lost.","Ngự Giả, xin đừng đau buồn, hy vọng vẫn còn."
lang_multi_text.db,MultiText,Main_Linaxita_2_4_136_1,御者，抱歉只能以这种姿态与你相见。,"Arbiter, forgive me for meeting thee in such a form.","Ngự Giả, xin thứ lỗi vì chỉ có thể gặp ngươi trong hình dáng này."
lang_multi_text.db,MultiText,Main_Linaxita_2_4_136_10,不受任何限制，难道你……,"With unrestricted access, you were going to...","Không chịu bất kỳ hạn chế nào, chẳng lẽ ngươi..."
lang_multi_text.db,MultiText,Main_Linaxita_2_4_136_100,"在纯白的世界中，你见到了「英白拉多」最后的意识，也知道了祂变成如今这般模样的真相。
为了完成探究鸣式本质的约定，「英白拉多」在迫不得已的情况下被鸣式融合后，便开始将计就计尝试解析对方，并最终得出结论——鸣式固然不可消灭，但却可以套上名为共鸣者的枷锁。
过程曲折——若没有卡提希娅即便知晓残酷真相亦要坚持的决心，若没有坎特蕾拉放弃二次共鸣的决绝，那么局面或许根本撑不到转机的到来。
「英白拉多」用自己最后的生命，唤醒了卡提希娅。","In a realm of pure white, you encounter Imperator's final consciousness and learn the truth behind Their transformation.

In order to understand the Threnodian's true nature, Imperator was forced to allow the Threnodian's assimilation. In doing so, They discovered that while the Threnodian is indestructible, it can be bound by a human Resonator.

The journey was fraught with difficulty. Without Cartethyia's determination and Cantarella's sacrifice of her Second Awakening, the situation would have been doomed.

With the last bit of Their power, Imperator awakens Cartethyia.","Trong thế giới trắng tinh, bạn gặp được ý thức cuối cùng của ""Imperator"" và biết được sự thật đằng sau hình dáng hiện tại của Ngài.
Để hoàn thành lời hẹn tìm hiểu bản chất Minh Thức, ""Imperator"" trong tình thế bất đắc dĩ đã bị Minh Thức đồng hóa, rồi tương kế tựu kế phân tích đối phương, cuối cùng rút ra kết luận - Minh Thức tuy không thể tiêu diệt, nhưng có thể trói buộc bằng xiềng xích mang tên Cộng Hưởng Giả.
Quá trình đầy gian nan - nếu không có quyết tâm kiên định của Cartethyia dù biết sự thật tàn khốc, nếu không có sự dứt khoát từ bỏ cộng hưởng lần hai của Cantarella, thì cục diện có lẽ không thể trụ được đến lúc chuyển cơ.
""Imperator"" dùng sinh mệnh cuối cùng của mình đánh thức Cartethyia."
lang_multi_text.db,MultiText,Main_Linaxita_2_4_136_11,是利维亚坦的融合……确实是形势所迫……当时我已无力阻止。,"Merge with Leviathan, a measure of last resort. At the time, I had no other recourse.",Là sự dung hợp với Leviathan... quả thực là tình thế ép buộc... khi đó ta đã không còn sức ngăn cản.
lang_multi_text.db,MultiText,Main_Linaxita_2_4_136_12,但之后，便是将计就计了。,So I allowed It to believe It hadst prevailed.,"Nhưng sau đó, ta đã tương kế tựu kế."
lang_multi_text.db,MultiText,Main_Linaxita_2_4_136_13,为什么要这么做？,Why?,Tại sao lại làm vậy?
lang_multi_text.db,MultiText,Main_Linaxita_2_4_136_14,你怎么可以这么做？,How could you!,Sao Ngài lại có thể làm vậy?
lang_multi_text.db,MultiText,Main_Linaxita_2_4_136_15,鸣式乃文明之毒，我只有身染，才能解析它。,The Threnodian is a taint upon civilization. Only by partaking of Its blight could I seek to comprehend It.,"Minh Thức là chất độc của văn minh, ta chỉ có thể nhiễm vào thân mới phân tích được nó."
lang_multi_text.db,MultiText,Main_Linaxita_2_4_136_16,你的结论呢？,"So, what did you learn?",Vậy kết luận của Ngài là gì?
lang_multi_text.db,MultiText,Main_Linaxita_2_4_136_17,鸣式无法彻底被消灭，文明不亡，鸣式不止，甚至他们本身都不知道自己该怎么被消灭。,The Threnodian cannot be undone whilst civilization endureth. Even It knows not the means of Its own destruction.,"Minh Thức không thể bị tiêu diệt hoàn toàn, văn minh còn thì Minh Thức còn, thậm chí bản thân chúng cũng không biết mình bị tiêu diệt bằng cách nào."
lang_multi_text.db,MultiText,Main_Linaxita_2_4_136_18,但，我们可以为它套上枷锁。,But we may yet shackle It.,"Nhưng, chúng ta có thể trói xiềng nó lại."
lang_multi_text.db,MultiText,Main_Linaxita_2_4_136_19,……卡提希娅也在你的算计中？,What role does Cartethyia play in this?,...Cartethyia cũng nằm trong tính toán của Ngài sao?
lang_multi_text.db,MultiText,Main_Linaxita_2_4_136_2,英白拉多，你不是已经被……,Imperator? I thought you...,"Imperator, Ngài chẳng phải đã bị..."
lang_multi_text.db,MultiText,Main_Linaxita_2_4_136_20,利维亚坦试图同化我的过程中，攫取了我的智识。,"When Leviathan merged with me, It breached my mind.","Trong quá trình Leviathan cố đồng hóa ta, nó đã chiếm đoạt trí tuệ của ta."
lang_multi_text.db,MultiText,Main_Linaxita_2_4_136_21,我故意释放了有关“共鸣者”的信息，但隐藏了一点微不足道的常识。,"I offered knowledge of the ""Resonator,"" yet concealed one small truth.","Ta cố tình tiết lộ thông tin về ""Cộng Hưởng Giả"", nhưng giấu đi một chi tiết nhỏ."
lang_multi_text.db,MultiText,Main_Linaxita_2_4_136_22,一个个体同一时间只能有一位共鸣者。,Beings such as we may bear but a single Resonator.,"Cùng một lúc, một cá thể chỉ có thể có một Cộng Hưởng Giả."
