db_file,table_name,id,zh,en,vi
lang_multi_text.db,MultiText,HHACZST_13_1,请止步，前面的房间不可以进入。,No entry beyond this point. Please leave.,"Xin dừng bước, căn phòng phía trước không được vào."
lang_multi_text.db,MultiText,HHACZST_13_2,应急处置小组正在清扫异常频率。,The emergency response team is clearing abnormal frequencies.,Nhóm xử lý khẩn cấp đang quét dọn tần số bất thường.
lang_multi_text.db,MultiText,HHACZST_14_1,你不要拉我，绑定协议要断开了！,Stop dragging me! The binding code is gonna snap!,"Cậu đừng có kéo tôi, giao thức liên kết sắp đứt rồi!"
lang_multi_text.db,MultiText,HHACZST_14_10,这也是我的工作！,What? I was just about to say that!,Đây cũng là công việc của tôi!
lang_multi_text.db,MultiText,HHACZST_14_11,哼。,Heh!,Hừ.
lang_multi_text.db,MultiText,HHACZST_14_12,哼。,Heh!,Hừ.
lang_multi_text.db,MultiText,HHACZST_14_2,阿德里安说过，我们的站位应该在这里！要往这边来点才行！还有，你断了绑定协议都不会断的！,"Just come over here and stand where Adrian told us! Even if you break, the code will hold!","Adrian đã nói rồi, vị trí đứng của chúng ta nên ở đây! Phải xích qua bên này một chút mới được! Còn nữa, giao thức liên kết sẽ không đứt cho dù cậu có đứt đâu!"
lang_multi_text.db,MultiText,HHACZST_14_3,阿德里安说的是守护好这里！你总是纠结位置会更分心做不好工作的！等等，有人来了！,"Adrian said to guard this area. It doesn't matter exactly where we stand. Don't get hung up on the details. Wait, someone's coming.","Adrian nói là bảo vệ tốt nơi này! Cậu cứ so đo vị trí sẽ càng phân tâm không làm tốt công việc đấy! Khoan đã, có người đến!"
lang_multi_text.db,MultiText,HHACZST_14_4,你好，请止步，前面的房间不可以进入。,Excuse me. No entry beyond this point. Please leave.,"Xin chào, xin dừng bước, căn phòng phía trước không được vào."
lang_multi_text.db,MultiText,HHACZST_14_5,为什么不可以？,What's going on?,Tại sao không được?
lang_multi_text.db,MultiText,HHACZST_14_6,你们刚才是在吵架吗？,Are you two arguing?,Hai người vừa cãi nhau à?
lang_multi_text.db,MultiText,HHACZST_14_7,黑海岸地表多个区域遭到了异常频率入侵，产生了许多数据虫洞。,"The surface of the Black Shores has been invaded by abnormal frequencies, creating multiple data wormholes.","Nhiều khu vực trên bề mặt Bờ Biển Đen bị tần số bất thường xâm nhập, sinh ra rất nhiều lỗ sâu dữ liệu."
lang_multi_text.db,MultiText,HHACZST_14_8,应急处置小组的成员还在对室内进行清扫，所以现在任何人都不能进去。,The emergency response team is clearing the indoor area. No one is permitted to enter now.,"Thành viên nhóm xử lý khẩn cấp vẫn đang tiến hành quét dọn trong phòng, cho nên bây giờ bất kỳ ai cũng không được vào."
lang_multi_text.db,MultiText,HHACZST_14_9,喂，你为什么要抢我的话？,Hey! I'm in charge here!,"Này, tại sao cậu lại cướp lời tôi?"
lang_multi_text.db,MultiText,HHACZST_15_1,都怪你！,It's all your fault!,Đều tại cậu!
lang_multi_text.db,MultiText,HHACZST_15_2,都怪你！,"Your fault, not mine!",Đều tại cậu!
lang_multi_text.db,MultiText,HHACZST_16_1,那个充电桩明明就是我先看到的。,I saw that charging station first!,Cái trạm sạc đó rõ ràng là tôi nhìn thấy trước.
lang_multi_text.db,MultiText,HHACZST_16_10,因为这件事，阿德里安没收了我们的零花钱，罚我们一起在这里守门。,Adrian docked our allowances for it and told us to guard this room.,"Vì chuyện này, Adrian đã tịch thu tiền tiêu vặt của chúng tôi, phạt chúng tôi cùng nhau canh cửa ở đây."
lang_multi_text.db,MultiText,HHACZST_16_11,他希望我们能够学会合作，才给我们输入了一串绑定协议，强制我们时刻连在一起。,"He wanted us to learn to cooperate, so he input a code that binds us 24/7.","Anh ấy hy vọng chúng tôi có thể học cách hợp tác, mới nhập cho chúng tôi một chuỗi giao thức liên kết, ép buộc chúng tôi lúc nào cũng phải dính lấy nhau."
lang_multi_text.db,MultiText,HHACZST_16_12,原来是这样。,So that's the reason.,Hóa ra là như vậy.
lang_multi_text.db,MultiText,HHACZST_16_13,哼，但是我才不想在它身边多待一秒呢。,But I can't stand being around this guy! Not for another second!,"Hừ, nhưng tôi chẳng muốn ở bên cạnh nó thêm một giây nào đâu."
lang_multi_text.db,MultiText,HHACZST_16_14,……看起来反思得还不够。,...Looks like you haven't learned the lesson.,...Xem ra kiểm điểm vẫn chưa đủ.
lang_multi_text.db,MultiText,HHACZST_16_2,那个充电桩是我一直在用的！,But I've always used it!,Trạm sạc đó là tôi dùng suốt mà!
lang_multi_text.db,MultiText,HHACZST_16_3,充电桩根本没有划分归属！,Doesn't mean it's yours!,Trạm sạc căn bản không có phân chia quyền sở hữu!
lang_multi_text.db,MultiText,HHACZST_16_4,你们在说什么？,What are you arguing about?,Hai người đang nói gì vậy?
lang_multi_text.db,MultiText,HHACZST_16_5,库哈哈前段时间抢我的充电桩，被我发现了还不承认，还把我的充电桩搞爆炸了！,This KU-Haha here stole my charging station and pretended it didn't! It even made the station explode!,"Ku-Haha thời gian trước cướp trạm sạc của tôi, bị tôi phát hiện còn không thừa nhận, còn làm trạm sạc của tôi nổ tung nữa!"
lang_multi_text.db,MultiText,HHACZST_16_6,如果不是你非要挤到运行中的充电桩上，路过的库嘻嘻就不会受伤，返厂检修了！,It wouldn't have blown up if you hadn't barged in while it was running! And KU-Heehee wouldn't have gotten hurt and needed factory repairs!,"Nếu không phải cậu cứ cố chen vào trạm sạc đang hoạt động, thì Ku-Heehee đi ngang qua đã không bị thương, phải quay về xưởng sửa chữa rồi!"
lang_multi_text.db,MultiText,HHACZST_16_7,所以，你们的争执还伤到了别人？,"Wait, your argument caused someone else to get hurt?","Cho nên, tranh chấp của hai người còn làm bị thương người khác?"
lang_multi_text.db,MultiText,HHACZST_16_8,我……,I...,Tôi...
lang_multi_text.db,MultiText,HHACZST_16_9,我们没想到会发生意外……,That was an accident...,Chúng tôi không ngờ sẽ xảy ra tai nạn...
lang_multi_text.db,MultiText,HHACZST_17_1,勒克蕾尔，库乔内什么时候检修回来，你可以帮我问问吗？,"Ms. Leclerc, could you check when KU-Join's maintenance will be finished?","Leclerc, Ku-Join bao giờ sửa xong về, cô có thể giúp tôi hỏi thử không?"
lang_multi_text.db,MultiText,HHACZST_17_10,是的！,Definitely!,Đúng vậy!
lang_multi_text.db,MultiText,HHACZST_17_11,是的！,Absolutely!,Đúng vậy!
lang_multi_text.db,MultiText,HHACZST_17_12,呵呵呵…我很荣幸。,"Haha, I'm honored.",Ha ha ha... tôi rất vinh hạnh.
lang_multi_text.db,MultiText,HHACZST_17_13,其实我是一名认知行为学家，现在正在研究它们。可能交流多了，它们就慢慢信任我了吧。,"I'm a cognitive behaviorist, and I've been studying the Tethys System robots. Maybe they trust me because I talk to them a lot.","Thực ra tôi là một nhà nghiên cứu hành vi nhận thức, hiện đang nghiên cứu chúng. Có lẽ giao tiếp nhiều rồi, chúng dần dần tin tưởng tôi chăng."
lang_multi_text.db,MultiText,HHACZST_17_14,研究它们的行为、认知？,"So, you study how they think and behave?","Nghiên cứu hành vi, nhận thức của chúng?"
lang_multi_text.db,MultiText,HHACZST_17_15,是啊。这些小机器人的人格最初是泰缇斯系统随机赋予的，为了辅助功能而存在。,Yes. Their personalities were originally assigned by the Tethys System to help with tasks.,"Đúng vậy. Nhân cách của những người máy nhỏ này ban đầu là do hệ thống Tethys ngẫu nhiên ban tặng, tồn tại để hỗ trợ chức năng."
lang_multi_text.db,MultiText,HHACZST_17_16,但是你看，它们也想表达自己的心声，也有自己的秘密和烦恼。,"But now, they're expressing themselves, with their own thoughts and worries.","Nhưng bạn xem, chúng cũng muốn bày tỏ tiếng lòng của mình, cũng có bí mật và phiền não của riêng mình."
lang_multi_text.db,MultiText,HHACZST_17_17,我一直认为，它们可以经过教育、引导，让逻辑代码不断成长，形成更加完整而自洽的观念。,"I believe with some guidance and education, their logic program can evolve and form more developed identities.","Tôi luôn cho rằng, chúng có thể thông qua giáo dục, dẫn dắt, để mã logic không ngừng trưởng thành, hình thành quan niệm hoàn chỉnh và tự nhất quán hơn."
lang_multi_text.db,MultiText,HHACZST_17_18,现在的它们，已经远远超出了最初系统给予它们的一切。这种别样的生命力很美，不是吗？,"Just look at them—they've already gone beyond what the system initially gave them. It's a different kind of life, but it's still life, isn't it?","Chúng của hiện tại, đã vượt xa tất cả những gì hệ thống ban đầu cho chúng. Sức sống khác biệt này rất đẹp, phải không?"
lang_multi_text.db,MultiText,HHACZST_17_19,听起来很有意思。,Sounds interesting.,Nghe có vẻ rất thú vị.
lang_multi_text.db,MultiText,HHACZST_17_2,嗯？库皮卡最近问了很多次库乔内的情况呢…你想它了吗？别担心，我会帮你问问的。,"Hmm, you've been asking about KU-Join a lot lately. Missing it? Don't worry, I'll find out for you.","Hửm? Ku-Pika gần đây hỏi rất nhiều lần về tình hình của Ku-Join nhỉ... Cậu nhớ nó à? Đừng lo, tôi sẽ giúp cậu hỏi thử."
lang_multi_text.db,MultiText,HHACZST_17_20,听起来会有隐藏的危险。,Sounds risky.,Nghe có vẻ tiềm ẩn nguy hiểm.
lang_multi_text.db,MultiText,HHACZST_17_21,你也可以尝试和它们多多交流哦，说不定会找到意气相投的朋友呢。,You should try talking to the robots more. Perhaps you'll even make friends with one of them.,"Bạn cũng có thể thử giao tiếp nhiều hơn với chúng đấy, biết đâu sẽ tìm được người bạn hợp ý."
lang_multi_text.db,MultiText,HHACZST_17_22,我理解你的担忧。但我觉得阻止和放弃不是好方法，我们应该试着在变化中找到新的道路。,"I get your concern, but I think instead of curbing it, we should find ways to adapt and move forward.","Tôi hiểu nỗi lo của bạn. Nhưng tôi cảm thấy ngăn cản và từ bỏ không phải là cách hay, chúng ta nên thử tìm ra con đường mới trong sự thay đổi."
lang_multi_text.db,MultiText,HHACZST_17_3,勒克蕾尔救救我，阿德里安说明天要给我升级！他上次给我升级之后，我丢失了一年的记忆！,"Ms. Leclerc, help! Adrian says he's upgrading me tomorrow! Last time he did that, I lost a whole year's worth of memory!","Leclerc cứu tôi với, Adrian nói ngày mai phải nâng cấp cho tôi! Lần trước sau khi anh ấy nâng cấp cho tôi, tôi đã mất ký ức của một năm!"
lang_multi_text.db,MultiText,HHACZST_17_4,那个家伙！又在自作主张了……别害怕，我帮你和他沟通。,"Ugh, that man! Always doing whatever he feels like... Don't worry, I'll talk to him for you.","Cái tên đó! Lại tự tung tự tác rồi... Đừng sợ, tôi giúp cậu nói chuyện với anh ta."
lang_multi_text.db,MultiText,HHACZST_17_5,勒克蕾尔，库列托和库斯本吵架了。,"Ms. Leclerc, KU-Leto and KU-Svan are fighting.","Leclerc, Ku-Leto và Ku-Svan cãi nhau rồi."
lang_multi_text.db,MultiText,HHACZST_17_6,它们两个居然会吵架吗？我一会儿去问问情况吧。,Those two? Really? I'll go check on them in a bit.,Hai đứa nó mà lại cãi nhau sao? Lát nữa tôi đi hỏi tình hình xem.
lang_multi_text.db,MultiText,HHACZST_17_7,咦，你好啊。抱歉，没有及时注意到你在。,"Oh, hello there. Sorry, I didn't see you.","Ơ, chào bạn. Xin lỗi, không chú ý kịp thời bạn ở đây."
lang_multi_text.db,MultiText,HHACZST_17_8,你好受欢迎啊。,You're really popular.,Cô được yêu thích thật đấy.
lang_multi_text.db,MultiText,HHACZST_17_9,勒克蕾尔是我们最好的朋友！,Ms. Leclerc is our best friend!,Leclerc là người bạn tốt nhất của chúng tôi!
lang_multi_text.db,MultiText,HHACZST_18_1,更新失败？为什么只有这一部机器不兼容呢……,Update failed? Why is this the only robot that's incompatible?,Cập nhật thất bại? Tại sao chỉ có cỗ máy này là không tương thích nhỉ...
lang_multi_text.db,MultiText,HHACZST_18_2,这个机器人怎么了？,What's wrong with this robot?,Con robot này bị sao thế?
lang_multi_text.db,MultiText,HHACZST_18_3,它的控制系统元件出现了错误，我在维修它，顺便帮它把老旧的系统升级优化。,The components of its control system got an error. I'm repairing it and updating the system.,"Linh kiện hệ thống điều khiển của nó bị lỗi, tôi đang sửa chữa, tiện thể nâng cấp tối ưu hóa hệ thống cũ kỹ cho nó luôn."
lang_multi_text.db,MultiText,HHACZST_18_4,库…库…难受…库……,Ku... Ku... Feels bad... Ku...,Ku... Ku... Khó chịu quá... Ku...
lang_multi_text.db,MultiText,HHACZST_18_5,它好像不太舒服？,It looks uncomfortable.,Nó có vẻ không thoải mái lắm?
lang_multi_text.db,MultiText,HHACZST_18_6,不可能。这些机器人是没有痛觉的。你刚才听到的，是他们在被维修时必定会触发的语言模块的反应。,It can't be. These robots don't feel pain. What you're hearing is just the language module reacting to the repairs.,Không thể nào. Mấy con robot này làm gì biết đau. Những gì bạn vừa nghe chỉ là phản ứng của mô-đun ngôn ngữ chắc chắn sẽ kích hoạt khi được bảo trì thôi.
lang_multi_text.db,MultiText,HHACZST_18_7,它们的人格也是一样，只是泰缇斯系统为了区分它们而附加的，需要不断维护的功能逻辑而已。,"Their personalities are also functions added by the Tethys System, something that needs regular maintenance.","Nhân cách của chúng cũng vậy, chỉ là logic chức năng mà hệ thống Tethys gắn thêm để phân biệt chúng, cần được bảo trì liên tục mà thôi."
lang_multi_text.db,MultiText,HHACZST_18_8,把它们的系统和芯片不断迭代、升级是让它们变得更厉害的最有效方式。,Upgrading their systems and chips is the best way to improve them.,"Liên tục thay thế, nâng cấp hệ thống và chip là cách hiệu quả nhất để khiến chúng trở nên lợi hại hơn."
lang_multi_text.db,MultiText,HHACZST_18_9,放心，我的编码能力是所有工程师里最强的。很快，这个机器人会变得比以前还要完美。,"Trust me, I'm the best engineer here. This robot will be better than ever when I'm done.","Yên tâm, khả năng lập trình của tôi là mạnh nhất trong số các kỹ sư. Rất nhanh thôi, con robot này sẽ trở nên hoàn hảo hơn cả trước đây."
lang_multi_text.db,MultiText,HHACZST_19_1,天上应该有几个月亮？,How many moons are there in the sky?,Trên trời nên có mấy mặt trăng?
lang_multi_text.db,MultiText,HHACZST_19_2,一个……别问了，我头疼……,One... Can you stop asking me these weird questions? My head hurts...,"Một... Đừng hỏi nữa, tôi đau đầu lắm..."
lang_multi_text.db,MultiText,HHACZST_19_3,水是有毒的还是没毒的？,Is water toxic or non-toxic?,Nước có độc hay không có độc?
lang_multi_text.db,MultiText,HHACZST_19_4,没毒啊。,Are you serious? Non-toxic.,Không có độc.
lang_multi_text.db,MultiText,HHACZST_19_5,守岸人是男的还是女的？,Is the Shorekeeper male or female?,Thủ Hộ Bờ Biển là nam hay nữ?
lang_multi_text.db,MultiText,HHACZST_19_6,我没见过守岸人啊！,How am I supposed to know? I've never met them before!,Tôi chưa gặp Thủ Hộ Bờ Biển bao giờ mà!
lang_multi_text.db,MultiText,HHACZST_1_1,这还是我第一次见到在黑石上扎根、成长的植物。,I've never seen a plant rooted in the Tacetite before.,"Đây là lần đầu tiên tôi thấy thực vật bám rễ, sinh trưởng trên Hắc Thạch."
lang_multi_text.db,MultiText,HHACZST_1_10,库。要是黑海岸变秃的话，那我库浇浇就要退休了。,"And a barren island would have no use of a gardener like me, ku ku...","Ku. Nếu Bờ Biển Đen trở nên trọc lóc, thì Ku-Tưới-Nước tôi đây sẽ phải nghỉ hưu mất."
lang_multi_text.db,MultiText,HHACZST_1_11,你的意思是……稳定锚本身就是巨大的防护装置？,So… the Anchors are like one giant protective device for the Black Shores?,Ý của bạn là... bản thân Neo Ổn Định chính là thiết bị bảo hộ khổng lồ?
lang_multi_text.db,MultiText,HHACZST_1_12,库。先帮我浇花，我再告诉你答案！你要一起吗？,"Ku... Help me water these flowers first, and then I'll answer your questions in exchange. And you over there, wanna give it a try too?","Ku. Giúp tôi tưới hoa trước, tôi sẽ cho bạn biết câu trả lời! Bạn có muốn cùng làm không?"
lang_multi_text.db,MultiText,HHACZST_1_13,下次一定。,"Thanks, but I'll pass.",Lần sau nhất định sẽ giúp.
lang_multi_text.db,MultiText,HHACZST_1_14,我可能更擅长锄大地。,Turning over rocks for Astrites is more of my thing.,Có lẽ tôi giỏi cuốc đất hơn.
lang_multi_text.db,MultiText,HHACZST_1_2,库。生长在黑石之上的植物会不断失去本色，叶片和花束最终都会变成紫色或白色。,Ku—Plants that grow on the Tacetite will slowly lose their pigmentation until they turn purple or white.,"Ku. Thực vật sinh trưởng trên Hắc Thạch sẽ không ngừng mất đi màu sắc vốn có, lá và hoa cuối cùng đều sẽ biến thành màu tím hoặc màu trắng."
lang_multi_text.db,MultiText,HHACZST_1_3,库。不论你再怎么努力，这块岛屿之上也不会生长出这两种颜色以外的植物啦。,"No matter what you do, you can't find plants in any other colors here.","Ku. Dù bạn có cố gắng thế nào đi nữa, trên hòn đảo này cũng sẽ không mọc ra thực vật có màu sắc nào khác ngoài hai màu này đâu."
lang_multi_text.db,MultiText,HHACZST_1_4,或许你的头发会慢慢变成白色或者紫色也说不定哦，库库库……,Maybe your hair would turn purple or white too. Ku ku ku...,"Biết đâu tóc của bạn cũng sẽ từ từ biến thành màu trắng hoặc màu tím không chừng đó, ku ku ku..."
lang_multi_text.db,MultiText,HHACZST_1_5,难道我也会……？,Me too...?,Lẽ nào tôi cũng sẽ...?
lang_multi_text.db,MultiText,HHACZST_1_6,怎么可能啦，你们又不是植物，库库库……,"Just kidding! You're human, not a plant. Ku ku ku...","Sao có thể chứ, các bạn đâu phải thực vật, ku ku ku..."
lang_multi_text.db,MultiText,HHACZST_1_7,不过没有佩戴特殊的防护装置的话，黑石的频率会对普通人类产生负面影响才对。,"But actually, without protective gear, humans could be affected by the Tacetite's frequency and start showing symptoms like ataxia.","Tuy nhiên nếu không đeo thiết bị bảo hộ đặc biệt, tần số của Hắc Thạch sẽ gây ảnh hưởng tiêu cực đến con người bình thường mới đúng."
lang_multi_text.db,MultiText,HHACZST_1_8,比如共济失调什么的，但黑海岸的大家并没有遇到这种情况。,"However, the Black Shores members don't seem to experience that issue.","Ví dụ như mất điều hòa các thứ, nhưng mọi người ở Bờ Biển Đen lại không gặp phải tình trạng này."
lang_multi_text.db,MultiText,HHACZST_1_9,库。那是因为有泰缇斯稳定锚的存在。如果没有稳定锚的话，黑海岸就会变成光秃秃的一片。,"Ku—That's because we have the Anchors. Without them, the Black Shores would just be a barren island.","Ku. Đó là vì có sự tồn tại của Neo Ổn Định Tethys. Nếu không có Neo Ổn Định, Bờ Biển Đen sẽ trở thành một vùng trọc lóc."
lang_multi_text.db,MultiText,HHACZST_20_1,等等…等等…这个人，这个走到我身边的人是真实的吗？还是{TA}也是系统模拟出来的？,W-wait a second... Is this person here real or simulated?,"Từ từ... từ từ... người này, người đang đi tới chỗ tôi là thật sao? Hay {TA} cũng do hệ thống mô phỏng ra?"
lang_multi_text.db,MultiText,HHACZST_20_10,我从黑海岸地下紧急撤出之后就一直肚子疼、头疼，一定也是因为这个吧！,No wonder I've had a stomachache and headache ever since I got out of the underground area.,"Sau khi rút lui khẩn cấp từ dưới lòng đất Bờ Biển Đen lên, tôi cứ bị đau bụng, đau đầu mãi, chắc chắn cũng là do cái này rồi!"
lang_multi_text.db,MultiText,HHACZST_20_11,诶，不对，我是真的疼还是幻觉呢……,"Wait... Is this pain even real, or...?","Ơ, không đúng, tôi đau thật hay là ảo giác nhỉ..."
lang_multi_text.db,MultiText,HHACZST_20_12,那是真的疼。,"It's real, trust me.",Đó là đau thật đấy.
lang_multi_text.db,MultiText,HHACZST_20_13,啊啊啊！刚来黑海岸工作就碰到这种事倒下了…我真是太没用了！,Darn it! I've only been to the Black Shores for a few days... Useless me!,Aaa! Mới đến Bờ Biển Đen làm việc đã gặp phải chuyện này rồi lăn ra ốm... tôi đúng là vô dụng quá mà!
lang_multi_text.db,MultiText,HHACZST_20_2,我当然是真实的。,Of course I'm real.,Tất nhiên tôi là thật rồi.
lang_multi_text.db,MultiText,HHACZST_20_3,我是假人。,"Yeah, I'm totally fake.",Tôi là người giả.
lang_multi_text.db,MultiText,HHACZST_20_4,哇啊啊啊！,Ahhhhh!,Oaaa á á á!
lang_multi_text.db,MultiText,HHACZST_20_5,请放心，{TA}是真实的。,"Don't worry, {Male=he's;Female=she's} real.","Xin hãy yên tâm, {TA} là người thật."
lang_multi_text.db,MultiText,HHACZST_20_6,诊疗尚未结束，请勿乱动。,Your treatment isn't finished yet. Please stay still.,"Việc khám bệnh vẫn chưa xong, xin đừng cử động lung tung."
lang_multi_text.db,MultiText,HHACZST_20_7,他怎么了？,What happened to him?,Anh ta bị sao vậy?
lang_multi_text.db,MultiText,HHACZST_20_8,外事特勤人员，雨宫，初步诊断结果为，轻度“现实解体”认知障碍。,"Amamiya, field agent. The preliminary diagnosis is mild reality perception disorder. In other words, the patient may feel like their surroundings aren't real.","Amamiya, nhân viên đặc vụ ngoại giao. Kết quả chẩn đoán sơ bộ là rối loạn nhận thức ""giải thể hiện thực"" mức độ nhẹ."
lang_multi_text.db,MultiText,HHACZST_20_9,泰缇斯现实稳定锚失衡，导致不少人员出现这种症状。简单来说，病人会觉得自身所处的环境不真切。,Most of our members are experiencing this because the Tethys' reality Anchors are unstable.,"Neo Ổn Định Hiện Thực của Tethys bị mất cân bằng, dẫn đến việc không ít nhân viên xuất hiện triệu chứng này. Nói đơn giản là bệnh nhân sẽ cảm thấy môi trường mình đang ở không thực."
lang_multi_text.db,MultiText,HHACZST_21_1,生活物资齐全，接下来还有……,"All the supplies are here. Now, what's next...","Nhu yếu phẩm sinh hoạt đã đủ, tiếp theo còn..."
lang_multi_text.db,MultiText,HHACZST_21_10,……我不是这个意思。,...That's not what I meant.,...Ý tôi không phải vậy.
lang_multi_text.db,MultiText,HHACZST_21_11,货船是怎么抵达黑海岸的？,And how do the ships even find this place?,Tàu hàng làm sao đến được Bờ Biển Đen?
lang_multi_text.db,MultiText,HHACZST_21_12,哈哈哈，抱歉，刚才开了个小玩笑。不过，你所好奇的，是商业机密。,"Haha, just messing with you. But honestly, I can't share that—it's a company secret.","Hahaha, xin lỗi, vừa rồi tôi đùa chút thôi. Nhưng mà, điều bạn tò mò thuộc về bí mật kinh doanh."
lang_multi_text.db,MultiText,HHACZST_21_13,哦，等等，我又忘记佩戴黑花了。是不是因为这个才引起了你的误解？,"No offense, but is there some misunderstanding here? Oh, I forgot to wear my Blake Bloom. No wonder you're asking all these questions.","Ồ, chờ đã, tôi lại quên đeo Hoa Đen rồi. Có phải vì thế nên mới khiến bạn hiểu lầm không?"
lang_multi_text.db,MultiText,HHACZST_21_14,其实我也是一名黑海岸客卿，不过，在岛外我一般不会佩戴黑花，上岛后就经常忘记戴回来。,"I'm also a Black Shores Consultant, but I usually don't wear the Blake Bloom outside this island.","Thật ra tôi cũng là một Khách Khanh của Bờ Biển Đen, nhưng khi ở ngoài đảo tôi thường không đeo Hoa Đen, lên đảo rồi lại hay quên đeo vào."
