db_file,table_name,id,zh,en,vi
lang_multi_text.db,MultiText,Character_JiYan_43_36,我答应你。,I promise.,Tôi hứa với anh.
lang_multi_text.db,MultiText,Character_JiYan_43_37,鸣钟广场的这片花海是忌炎为了纪念逝去的战友而种下的。你和忌炎在花海中种下了一颗新的“如故”花种，让那些你们在领域中看到的牺牲战士们能够魂归故里，守望家乡。在此，忌炎与你约定，如果有一天他也无法再回到故乡，希望你能在这里也为他种下一株如故。,"At Knell Square, you see the flowers Jiyan planted for the fallen soldiers. Together, you plant an ""Emortia"" seed, hoping the souls you met in the Sonoro find peace and return home. Jiyan asks you to plant an Emortia for him if he cannot return home someday.","Biển hoa ở Quảng Trường Minh Chung này là do Kỵ Viêm trồng để tưởng nhớ những đồng đội đã khuất. Bạn và Kỵ Viêm cùng gieo một hạt giống hoa ""Như Cố"" mới trong biển hoa, để những chiến sĩ hy sinh mà các bạn nhìn thấy trong lĩnh vực có thể hồn quy cố lý, trông coi quê hương. Tại đây, Kỵ Viêm ước định với bạn, nếu có một ngày anh ấy cũng không thể quay về cố hương nữa, hy vọng bạn cũng có thể trồng một đóa Như Cố cho anh ấy ở nơi này."
lang_multi_text.db,MultiText,Character_JiYan_43_4,这是什么？,And this is...?,Đây là gì?
lang_multi_text.db,MultiText,Character_JiYan_43_5,一颗种子。,A seed.,Một hạt giống.
lang_multi_text.db,MultiText,Character_JiYan_43_6,什么种子？,What seed?,Hạt giống gì?
lang_multi_text.db,MultiText,Character_JiYan_43_7,这是我多年前拜托研究院培育的花种，研究院曾告诉我，它的生命力十分顽强。,"This is the seed of a resilient type of flower, which I asked the Academy to help me breed years ago.","Đây là hạt giống hoa tôi nhờ Viện Nghiên Cứu nhân giống nhiều năm trước, Viện Nghiên Cứu từng nói với tôi, sức sống của nó vô cùng mãnh liệt."
lang_multi_text.db,MultiText,Character_JiYan_43_8,这片花海是你种的吗？,Did you plant all these flowers here?,Biển hoa này là anh trồng sao?
lang_multi_text.db,MultiText,Character_JiYan_43_9,鸣钟广场选址于此，可以看见整个今州城。,"From here, you can see all of Jinzhou city.","Quảng Trường Minh Chung chọn vị trí tại đây, có thể nhìn thấy toàn bộ thành Kim Châu."
lang_multi_text.db,MultiText,Character_JiYan_44_1,你先冷静下，别再宣扬坐河豚的事情了。,"Sir, please calm down and stop talking about riding Gulpuffs.","Anh bình tĩnh lại trước đã, đừng tuyên truyền chuyện cưỡi cá nóc nữa."
lang_multi_text.db,MultiText,Character_JiYan_44_10,好在伤口并非河豚攻击导致，先用这个暂时止痛吧。,"Fortunately, it's not caused by the Gulpuffs. Please take this to relieve the pain for now.","Cũng may vết thương không phải do cá nóc tấn công gây ra, dùng cái này giảm đau tạm thời trước đi."
lang_multi_text.db,MultiText,Character_JiYan_44_11,嘶……这么一说还真痛起来了。,Ouch... It's really starting to hurt now that you've mentioned it.,A... nói vậy mới thấy đau thật.
lang_multi_text.db,MultiText,Character_JiYan_44_12,哎，你呀，这会儿冷静下来了吧？,Alright. Have you calmed down now?,"Hầy, anh đấy, giờ thì bình tĩnh lại rồi chứ?"
lang_multi_text.db,MultiText,Character_JiYan_44_13,抱歉，我有些玩过头了……给大家添麻烦了。,I'm sorry. I got a little carried away... Sorry again for the trouble I've caused.,"Xin lỗi, tôi hơi ham vui quá đà... làm phiền mọi người rồi."
lang_multi_text.db,MultiText,Character_JiYan_44_14,走吧，我先带你去处理下伤口。,Let's go have someone see to your wound.,"Đi thôi, tôi đưa anh đi xử lý vết thương trước."
lang_multi_text.db,MultiText,Character_JiYan_44_15,{PlayerName}也在啊，好巧。,"{PlayerName}, fancy seeing you here.","{PlayerName} cũng ở đây à, trùng hợp quá."
lang_multi_text.db,MultiText,Character_JiYan_44_16,我和忌炎一起参加比赛。,Jiyan and I are joining the relay race together.,Tôi tham gia thi đấu cùng Kỵ Viêm.
lang_multi_text.db,MultiText,Character_JiYan_44_17,那我可能要扫你们的兴了，比赛……恐怕需要暂停了。,"I don't want to spoil your fun, but I'm afraid we need to suspend the race for now.","Vậy thì tôi e là phải làm các bạn mất hứng rồi, trận đấu... e rằng phải tạm dừng."
lang_multi_text.db,MultiText,Character_JiYan_44_18,监测结果出来了？,Can you fill us in on the data?,Đã có kết quả quan trắc rồi sao?
lang_multi_text.db,MultiText,Character_JiYan_44_19,我按照你说的，调查了水道的监测数据，北面上游水域附近的确出现了异常波动。,"I checked the monitoring data as you asked, and I found unusual fluctuations near the upper waters to the north.","Tôi đã làm theo lời anh, điều tra dữ liệu quan trắc của đường nước, gần vùng nước thượng nguồn phía Bắc quả thực xuất hiện dao động bất thường."
lang_multi_text.db,MultiText,Character_JiYan_44_2,可是真的很好玩啊！,But that was really fun!,Nhưng mà chơi vui thật sự luôn á!
lang_multi_text.db,MultiText,Character_JiYan_44_20,附近的信标为何没有观测到？,Why didn't the nearest Beacon pick up on this anomaly?,Tại sao Tín Hiệu Ghi gần đó không quan trắc được?
lang_multi_text.db,MultiText,Character_JiYan_44_21,信标功能都是正常的，至于为什么没有预警到这次异常……我会再复查一下。,"The Resonance Beacon is functioning properly, but we still don't know why it didn't issue a warning this time. I will investigate this further at a later time.","Chức năng của Tín Hiệu Ghi đều bình thường, còn về việc tại sao không cảnh báo được sự bất thường lần này... tôi sẽ kiểm tra lại."
lang_multi_text.db,MultiText,Character_JiYan_44_22,这个异常和咕咕河豚有什么关系？,Is it related to the Gulpuffs' strange behaviors?,Sự bất thường này có liên quan gì đến Cá Nóc Gugu?
lang_multi_text.db,MultiText,Character_JiYan_44_24,有种说法叫“动物预警”，灾难前它们总是最先察觉到征兆并做出逃难行为。,Animals are often the first to detect signs of danger.,"Có một cách nói gọi là ""cảnh báo động vật"", trước thảm họa chúng luôn là kẻ đầu tiên cảm nhận được điềm báo và thực hiện hành vi chạy trốn."
lang_multi_text.db,MultiText,Character_JiYan_44_25,这些咕咕河豚残象也是一样，它们对频率波动的变化非常敏感，想必也是察觉到了异常才会失控。,Tacet Discords are similar to animals in this regard. They're very sensitive to any change in the frequencies in their surroundings. That's why those Gulpuffs went haywire.,"Những Tàn Tượng Cá Nóc Gugu này cũng vậy, chúng vô cùng nhạy cảm với sự thay đổi dao động tần số, hẳn là cũng cảm nhận được sự bất thường nên mới mất kiểm soát."
lang_multi_text.db,MultiText,Character_JiYan_44_26,你也是发现了这一点，才会让我收集水域监测数据的，对吧？,"I suppose that's why you asked me to check the monitoring data for you, Jiyan?","Anh cũng phát hiện ra điểm này, nên mới bảo tôi thu thập dữ liệu quan trắc vùng nước, đúng không?"
lang_multi_text.db,MultiText,Character_JiYan_44_27,没错。,Yes.,Đúng vậy.
lang_multi_text.db,MultiText,Character_JiYan_44_28,这个波动变化出现的时机让我有些在意……为什么偏偏是竞渡会。,The timing of this change is concerning. Why did it happen precisely during the Riverside Games?,Thời điểm xuất hiện sự thay đổi dao động này làm tôi có chút để ý... tại sao cứ phải là Hội Đua Thuyền.
lang_multi_text.db,MultiText,Character_JiYan_44_29,也许，是竞渡会的某种振频和水域上游产生了共鸣？,Perhaps the Riverside Games' frequency resonated with something in the upper waters?,"Có lẽ, tần số rung động nào đó của Hội Đua Thuyền đã cộng hưởng với thượng nguồn vùng nước?"
lang_multi_text.db,MultiText,Character_JiYan_44_3,可否将手伸出？,May I have your hand?,Có thể đưa tay ra không?
lang_multi_text.db,MultiText,Character_JiYan_44_30,直接去上游看看吧。,Let's go check out the upper waters now.,Trực tiếp lên thượng nguồn xem sao.
lang_multi_text.db,MultiText,Character_JiYan_44_31,你说的对，事不宜迟。,Yes. Let's go.,"Anh nói đúng, việc này không nên chậm trễ."
lang_multi_text.db,MultiText,Character_JiYan_44_32,没被预警的突发状况，往往意味着未知的风险，两位，注意安全。,"The lack of perceivable warning signs typically suggests unknown risks. Jiyan, {PlayerName}, stay safe.","Tình huống bất ngờ không được cảnh báo, thường đồng nghĩa với rủi ro chưa biết, hai vị, chú ý an toàn."
lang_multi_text.db,MultiText,Character_JiYan_44_33,你和忌炎一起劝离了兴奋的受伤观众后，在和莫特斐的通讯中了解到，是上游水域附近出现了异常频率波动才影响了咕咕河豚。这个问题出现的时机让忌炎觉得事有蹊跷，于是你们决定去上游一探究竟。,"Once the injured are safe, you and Jiyan learn from Mortefi that the manic Gulpuffs were affected by abnormal frequency fluctuations upstream. The timing of this accident strikes Jiyan as suspicious, so you decide to investigate upstream.","Sau khi bạn và Kỵ Viêm cùng khuyên giải khán giả bị thương đang hưng phấn rời đi, qua liên lạc với Mortefi biết được rằng, là do gần vùng nước thượng nguồn xuất hiện dao động tần số bất thường mới ảnh hưởng đến Cá Nóc Gugu. Thời điểm xuất hiện vấn đề này khiến Kỵ Viêm cảm thấy có điều kỳ lạ, thế là các bạn quyết định đi lên thượng nguồn tìm hiểu ngọn ngành."
lang_multi_text.db,MultiText,Character_JiYan_44_4,怎……怎么了？,What... What's wrong?,Sao... sao vậy?
lang_multi_text.db,MultiText,Character_JiYan_44_5,别担心，只是想确认一件事。,Nothing major. I just need to confirm something.,"Đừng lo, chỉ muốn xác nhận một chuyện thôi."
lang_multi_text.db,MultiText,Character_JiYan_44_6,果然。,As I expected.,Quả nhiên.
lang_multi_text.db,MultiText,Character_JiYan_44_7,啊？究竟什么时候受伤的……我居然完全没感觉。,Huh? When did I get hurt? I didn't feel it at all.,Hả? Rốt cuộc bị thương lúc nào... tôi thế mà hoàn toàn không cảm giác gì.
lang_multi_text.db,MultiText,Character_JiYan_44_8,人在过度兴奋的状态下，肾上腺素分泌会增加，痛感也会随之减弱。,The adrenaline from excitement may have dampened your sensitivity to pain.,"Khi con người ở trạng thái hưng phấn quá độ, adrenaline tiết ra sẽ tăng lên, cảm giác đau đớn cũng sẽ theo đó mà giảm đi."
lang_multi_text.db,MultiText,Character_JiYan_44_9,但神经反应不会骗人，方才起，你的右手就一直不自主微颤，应该是伤口没及时处理导致的。,"However, your nervous response betrays your condition. You right hand has been shaking involuntarily, likely because the wound has been left untreated.","Nhưng phản ứng thần kinh sẽ không lừa người, từ nãy đến giờ, tay phải của anh cứ run nhẹ không tự chủ, chắc là do vết thương không được xử lý kịp thời."
lang_multi_text.db,MultiText,Character_JiYan_45_1,咕咕河豚玩偶，限量贩售，欲购从速啦。,"Gulpuff plushies! First come, first served!","Thú bông Cá Nóc Gugu, bán số lượng có hạn, mua nhanh kẻo hết nào."
lang_multi_text.db,MultiText,Character_JiYan_45_4,外婆，我想要小的那个！,"Nanna, I want that small one!","Bà ơi, cháu muốn cái nhỏ kia!"
lang_multi_text.db,MultiText,Character_JiYan_45_5,乖孩子，等竞渡会结束再买，现在太贵了。,We'll get one for you once the race is over. It's too expensive now.,"Bé ngoan, đợi Hội Đua Thuyền kết thúc rồi mua, bây giờ đắt quá."
lang_multi_text.db,MultiText,Character_JiYan_45_6,呜呜呜，我就要嘛！,"Nooo, I want it now!","Hu hu hu, cháu muốn ngay cơ!"
lang_multi_text.db,MultiText,Character_JiYan_46_1,还剩最后一箱了吧？,Is that the last box left?,Còn thùng cuối cùng này thôi nhỉ?
lang_multi_text.db,MultiText,Character_JiYan_46_2,没错，赶紧搬完去看接力赛。,Yep. Let's hurry and go watch the relay once we finish.,"Đúng vậy, mau chuyển cho xong rồi đi xem đua tiếp sức."
lang_multi_text.db,MultiText,Character_JiYan_46_3,我弟今年也参加了，好久没见过他了，等会儿我得抢个好位置看比赛。,My brother's running this year. It's been a while since I last hangout with him. I gotta find a good spot to watch the race.,"Em trai tôi năm nay cũng tham gia, lâu lắm rồi không gặp nó, lát nữa tôi phải giành chỗ tốt để xem thi đấu."
lang_multi_text.db,MultiText,Character_JiYan_47_1,来老婆子这买点儿饮料润润嗓子吧。,Come buy some drink to wet your whistle!,Đến chỗ bà già này mua chút đồ uống nhuận giọng đi.
lang_multi_text.db,MultiText,Character_JiYan_47_2,实惠好喝，绝不坐地起价。,Cheap and delicious!,"Rẻ ngon bổ dưỡng, tuyệt đối không tăng giá ép khách."
lang_multi_text.db,MultiText,Character_JiYan_48_1,我哥哥也参加比赛了！,Hey! That's my brother!,Anh trai tớ cũng tham gia thi đấu!
lang_multi_text.db,MultiText,Character_JiYan_48_2,我哥哥去年还拿了奖牌呢！,My brother won a medal last year!,Anh tớ năm ngoái còn giành huy chương nữa cơ!
lang_multi_text.db,MultiText,Character_JiYan_48_3,哼，拿奖牌算什么！,Hmph! So what! That's not a big deal!,"Hứ, giành huy chương thì tính là gì!"
lang_multi_text.db,MultiText,Character_JiYan_48_4,妈妈说哥哥一直没回家，是因为他在打怪兽！,My brother's just busy fighting monsters! That's why he's not with us! Mommy told me so!,"Mẹ bảo anh tớ mãi không về nhà, là vì anh ấy đang đánh quái vật!"
lang_multi_text.db,MultiText,Character_JiYan_48_5,你哥哥肯定没我哥哥厉害。,You'll know when he's back. He's much cooler!,Anh cậu chắc chắn không lợi hại bằng anh tớ.
lang_multi_text.db,MultiText,Character_JiYan_48_6,呜哇——,N-no! You're lying! Waaah!,Oaaaaa...
lang_multi_text.db,MultiText,Character_JiYan_48_7,臭小子，你又欺负人了？给我过来！,"Hey, did you bully someone again? Come here!","Thằng quỷ con, mày lại bắt nạt người khác à? Lại đây cho tao!"
lang_multi_text.db,MultiText,Character_JiYan_49_1,你这次回来休息多久？,How long are you back for?,Lần này anh về nghỉ được bao lâu?
lang_multi_text.db,MultiText,Character_JiYan_49_2,竞渡会结束就走。,I'll need to leave after the Riverside Games is over.,Hội Đua Thuyền kết thúc là đi.
lang_multi_text.db,MultiText,Character_JiYan_49_3,这么快？我还以为……,That's so soon. I thought...,Nhanh vậy sao? Em còn tưởng...
lang_multi_text.db,MultiText,Character_JiYan_49_4,抱歉。,Sorry.,Xin lỗi.
lang_multi_text.db,MultiText,Character_JiYan_49_5,没关系，能在这里见到你我已经很满足了。,"It's okay, darling. That's good enough for me to meet you here.","Không sao, được gặp anh ở đây em đã mãn nguyện lắm rồi."
lang_multi_text.db,MultiText,Character_JiYan_49_6,等会儿比赛加油！,I'll root for you!,Lát nữa thi đấu cố lên nhé!
lang_multi_text.db,MultiText,Character_JiYan_4_1,{PlayerName}，你怎么来这里了？有找到心仪的比赛项目吗？,"{PlayerName}, what are you doing here? Have you found any event that you're interested in?","{PlayerName}, sao bạn lại đến đây? Đã tìm được hạng mục thi đấu ưng ý chưa?"
lang_multi_text.db,MultiText,Character_JiYan_4_10,并非如此。,No.,Không phải vậy.
lang_multi_text.db,MultiText,Character_JiYan_4_11,比起速度，接力赛更多是考验队员间的默契、配合、信任。,"The key to winning a relay race lies in mutual understanding, cooperation, and trust among team members.","So với tốc độ, đua tiếp sức thử thách sự ăn ý, phối hợp và tin tưởng giữa các thành viên nhiều hơn."
lang_multi_text.db,MultiText,Character_JiYan_4_12,大多数队伍，都是按照自己所属的夜归编队组成的，因为他们彼此熟悉，有着足够的默契。,"Most of the teams are formed according to the Midnight Rangers units they belong to. Therefore, they're familiar with their teammates and have good teamwork.","Đa số các đội đều được lập theo biên chế Dạ Quy của mình, vì họ đã quen thuộc với nhau, có đủ sự ăn ý."
lang_multi_text.db,MultiText,Character_JiYan_4_13,我是在想，场内应该还有比我更加合适的人。,I believe you can find a better candidate for your team. That candidate doesn't have to be me.,"Tôi đang nghĩ, trong sân chắc chắn còn có người phù hợp hơn tôi."
lang_multi_text.db,MultiText,Character_JiYan_4_14,我们再组不到人就失去比赛资格了。,But we'll be disqualified without another teammate.,Chúng tôi mà không tìm đủ người là sẽ bị mất tư cách thi đấu đấy.
lang_multi_text.db,MultiText,Character_JiYan_4_15,我还挺想和你一起参加的。,I really want to join the race with you.,Tôi cũng khá muốn tham gia cùng anh.
lang_multi_text.db,MultiText,Character_JiYan_4_16,人员未满取消比赛资格……规则的确如此。若是就这样“不战而败”，想必对他们而言，无疑是一种巨大的遗憾吧。,"Disqualification for teams without enough participants... Yes, I remember that rule. I imagine your teammates would be greatly disappointed if that happened.","Không đủ người sẽ bị hủy tư cách thi đấu... Quy tắc đúng là như vậy. Nếu cứ thế mà ""thua không cần đánh"", chắc hẳn đối với họ sẽ là một sự tiếc nuối rất lớn."
lang_multi_text.db,MultiText,Character_JiYan_4_17,和你一起参赛……好，说不定会很有意思。,Joining you... I see. It might be fun.,"Cùng tham gia với bạn... Được, biết đâu sẽ rất thú vị."
lang_multi_text.db,MultiText,Character_JiYan_4_18,不过，只是仓促组成的队伍，可能没法取得想要的好成绩。,"But given we never trained together before, it may prove challenging to win.","Có điều, chỉ là một đội được lập vội vàng, có thể sẽ không đạt được thành tích tốt như mong muốn."
lang_multi_text.db,MultiText,Character_JiYan_4_19,临时小队，重在参与。,"Doesn't matter, we're a last-minute temporary team anyway.","Tiểu đội tạm thời, quan trọng là tham gia."
lang_multi_text.db,MultiText,Character_JiYan_4_2,有，但遇到点麻烦。,"Yes, but I've run into a bit of trouble.","Có, nhưng gặp chút rắc rối."
lang_multi_text.db,MultiText,Character_JiYan_4_20,临时小队……,A temporary team...,Tiểu đội tạm thời...
lang_multi_text.db,MultiText,Character_JiYan_4_21,有什么问题吗？,You alright?,Có vấn đề gì sao?
lang_multi_text.db,MultiText,Character_JiYan_4_22,没什么……只是很久没听到过这个名字了。,"I'm fine, thank you for asking... It's been a long time since I last heard that phrase.",Không có gì... chỉ là đã lâu không nghe thấy cái tên này rồi.
lang_multi_text.db,MultiText,Character_JiYan_4_24,你说得不错，重在参与，如果连比赛都参加不了，又谈何成绩。,Indeed. No need to worry about the end result before the competition begins.,"Bạn nói đúng, quan trọng là tham gia, nếu ngay cả thi đấu cũng không tham gia được, thì còn nói gì đến thành tích."
lang_multi_text.db,MultiText,Character_JiYan_4_25,嗯……我知道了。,Yes... I'll join you.,Ừm... tôi hiểu rồi.
lang_multi_text.db,MultiText,Character_JiYan_4_26,观众们正往赛道聚集，想来比赛应该快开始了。,Spectators are gathering along the lanes. The race should start soon.,"Khán giả đang tụ tập về phía đường đua, xem ra trận đấu sắp bắt đầu rồi."
lang_multi_text.db,MultiText,Character_JiYan_4_27,走吧，先去和他们汇合吧。,Let's go join our new teammates.,"Đi thôi, đến hội họp với họ trước đã."
lang_multi_text.db,MultiText,Character_JiYan_4_28,……,...,...
lang_multi_text.db,MultiText,Character_JiYan_4_29,怎么了？,What's wrong?,Sao vậy?
lang_multi_text.db,MultiText,Character_JiYan_4_3,麻烦？不妨说来听听，也许我能帮上什么。,"Trouble? If you're comfortable sharing, tell me about it. Maybe I can help.","Rắc rối? Không ngại thì nói nghe thử xem, biết đâu tôi giúp được gì đó."
lang_multi_text.db,MultiText,Character_JiYan_4_30,没什么……应该是我的错觉。,Nothing... Perhaps it's just my imagination.,Không có gì... chắc là ảo giác của tôi thôi.
lang_multi_text.db,MultiText,Character_JiYan_4_31,……,...,...
lang_multi_text.db,MultiText,Character_JiYan_4_32,和你一同参赛，也是他们的心愿。,The team would be thrilled to have you.,"Cùng bạn tham gia thi đấu, cũng là tâm nguyện của họ."
lang_multi_text.db,MultiText,Character_JiYan_4_33,你向忌炎发出邀请，希望他能作为临时队员一起参加比赛，忌炎思考过后，接受了你的邀请。,You invite Jiyan to join the team. He agrees to be a substitute after careful consideration.,"Bạn gửi lời mời đến Kỵ Viêm, hy vọng anh ấy có thể tham gia thi đấu cùng với tư cách thành viên tạm thời, sau khi suy nghĩ, Kỵ Viêm đã nhận lời mời của bạn."
lang_multi_text.db,MultiText,Character_JiYan_4_4,这事的确得你来解决。,"Actually, I do need your help.",Việc này đúng là cần anh giải quyết.
lang_multi_text.db,MultiText,Character_JiYan_4_5,也就是说……你希望我作为临时队员一起参加比赛？,So... you want me to join the relay as your temporary teammate?,Nói cách khác... bạn muốn tôi cùng tham gia thi đấu với tư cách thành viên tạm thời?
lang_multi_text.db,MultiText,Character_JiYan_4_6,没错。,Yes.,Đúng vậy.
lang_multi_text.db,MultiText,Character_JiYan_4_7,你怎么了？,What's the matter?,Anh sao thế?
lang_multi_text.db,MultiText,Character_JiYan_4_8,你不会是怕了吧？,"What, are you scared?",Anh không phải sợ rồi chứ?
lang_multi_text.db,MultiText,Character_JiYan_4_9,没事。,No worries.,Không sao.
lang_multi_text.db,MultiText,Character_JiYan_50_1,爸爸，我全都想吃！,"Dad, I want to eat them all!","Bố ơi, con muốn ăn hết!"
lang_multi_text.db,MultiText,Character_JiYan_50_2,好好好。,"Right, right, right.",Được được được.
lang_multi_text.db,MultiText,Character_JiYan_50_3,小朋友，你爸爸真爱你啊。,"Boy, your dad really loves you.","Bạn nhỏ à, bố cháu yêu cháu thật đấy."
lang_multi_text.db,MultiText,Character_JiYan_50_4,平常见得少，也就只有这种时候能宠宠了。,"We can't see each other often, so this is my only chance to show my love for him.","Bình thường ít gặp, cũng chỉ có những lúc thế này mới chiều chuộng được thôi."
lang_multi_text.db,MultiText,Character_JiYan_50_5,我爸爸可是在北落野打大怪兽的英雄呢！,My dad is a super hero who fights monsters in the Norfall Barrens!,Bố cháu là anh hùng đánh quái vật lớn ở Cánh Đồng Bắc Lạc đấy!
lang_multi_text.db,MultiText,Character_JiYan_51_1,还记得咱们读书那会儿的竞渡会吗？,Do you remember the Riverside Games when we were students?,Còn nhớ Hội Đua Thuyền hồi chúng ta đi học không?
