db_file,table_name,id,zh,en,vi
lang_multi_text.db,MultiText,MonsterHandBook_340000020_FightSkillDescrtption,鸣钟之龟的外壳看似坚不可摧，只有背负的古钟有少许裂痕存在，古钟之下就是击败它的关键。,The shell of the Bell-Borne Geochelone seems indestructible. Only the ancient bell on its back has a few cracks present. Perhaps the key to defeating it lies beneath the bell.,"Lớp vỏ của Minh Chung Chi Quy trông có vẻ bất khả xâm phạm, chỉ có chiếc chuông cổ trên lưng là có chút vết nứt, bên dưới chiếc chuông cổ chính là chìa khóa để đánh bại nó."
lang_multi_text.db,MultiText,MonsterHandBook_340000020_Name,鸣钟之龟,Bell-Borne Geochelone,Minh Chung Chi Quy
lang_multi_text.db,MultiText,MonsterHandBook_340000020_TypeDescrtption,异变生物,MUTANT ORGANISM,Sinh vật biến dị
lang_multi_text.db,MultiText,MonsterInfo_310000010_DiscoveredDes,"碎岩构筑的残象，视力低下、喜欢横冲直撞。
岩角与其它事物撞击而发出的叮叮声，能够帮助先锋幼岩在辨明自身的处境。","A TD constructed with fragmented rocks. It has poor eyesight and a preference for rampaging. 

The clinks and clacks of its rock skin colliding with other objects help Vanguard Junrock identify its circumstances.","Tàn Tượng được cấu tạo từ đá vụn, thị lực kém, thích đâm lung tung.
Tiếng leng keng phát ra khi sừng đá va chạm với vật khác giúp Ấu Nham Tiên Phong xác định vị trí của mình."
lang_multi_text.db,MultiText,MonsterInfo_310000010_Name,先锋幼岩,Vanguard Junrock,Ấu Nham Tiên Phong
lang_multi_text.db,MultiText,MonsterInfo_310000010_UndiscoveredDes,出现在山岩地区的静默种残象，因形如岩石，常常被人容易忽略，危险度隶属于轻波级。,A Common Class Tranquilite TD inhabiting mountainous areas. Often overlooked due to its rock-like appearance.,"Tàn Tượng Chủng Tĩnh Mặc xuất hiện ở vùng núi đá, vì hình dáng như tảng đá nên thường bị người ta bỏ qua, mức độ nguy hiểm thuộc cấp Khinh Ba."
lang_multi_text.db,MultiText,MonsterInfo_310000020_DiscoveredDes,"碎岩构筑的残象，常和先锋幼岩一同出现。
与先锋幼岩不同的是，裂变幼岩的能量更活跃且不稳定，在外部的冲击下容易爆炸，有被其他残象当作投掷武器的情况。","A TD constructed with fragmented rocks. Commonly found in the company of Vanguard Junrock. 

Different from the latter, Fission Junrock has a more active and unstable energy and easily explodes under impact. Records show that it is sometimes used as a throwing weapon by other Tacet Discords.","Tàn Tượng được cấu tạo từ đá vụn, thường xuất hiện cùng với Ấu Nham Tiên Phong.
Khác với Ấu Nham Tiên Phong, năng lượng của Ấu Nham Phân Hạch hoạt động mạnh và không ổn định hơn, dễ phát nổ dưới tác động bên ngoài, có trường hợp bị các Tàn Tượng khác dùng làm vũ khí ném."
lang_multi_text.db,MultiText,MonsterInfo_310000020_Name,裂变幼岩,Fission Junrock,Ấu Nham Phân Hạch
lang_multi_text.db,MultiText,MonsterInfo_310000020_UndiscoveredDes,出现在山岩地区的静默种残象，因形如熔岩，常常被人容易忽略，危险度隶属于轻波级。,A Common Class Tranquilite TD inhabiting mountainous areas. Often overlooked due to its lava-like shape.,"Tàn Tượng Chủng Tĩnh Mặc xuất hiện ở vùng núi đá, vì hình dáng như dung nham nên thường bị người ta bỏ qua, mức độ nguy hiểm thuộc cấp Khinh Ba."
lang_multi_text.db,MultiText,MonsterInfo_310000030_DiscoveredDes,"该敌人<color=Thunder>导电伤害</color><color=HighlightB>抗性提高</color>。
手持猎具的类人残象，引雷电为箭矢。
惊蛰猎手的引弦如始鸣的春雷般迅捷，它将荒原视作恣意的围场，以逐猎为乐。","This enemy has a <color=HighlightB>higher RES</color> to <color=Thunder>Electro DMG</color>. 

A humanoid Tacet Discord wielding hunting gear that fires lightning arrows. 

Electro Predators' string pulls are as fast as lightning strikes in the first of spring. The wastelands are its hunting ground, and it takes delight in the pursuit of prey.","Kẻ địch này có <color=HighlightB>kháng cao</color> với <color=Thunder>sát thương Điện Từ</color>.
Tàn Tượng dạng người cầm dụng cụ săn bắt, dẫn sấm sét làm mũi tên.
Cú kéo dây cung của Thợ Săn Kinh Trập nhanh như sấm xuân đầu mùa, nó coi vùng hoang dã là bãi săn tùy ý, lấy việc săn đuổi làm niềm vui."
lang_multi_text.db,MultiText,MonsterInfo_310000030_Name,惊蛰猎手,Electro Predator,Thợ Săn Kinh Trập
lang_multi_text.db,MultiText,MonsterInfo_310000030_UndiscoveredDes,出现于野外的呓语种残象，据记录其会引雷为矢，类人拉弓射击，危险度隶属于轻波级。,A Common Class Whisperin TD that frequents the wilderness. Records show it is capable of pulling bowstrings like humans and shooting lightning as arrows.,"Tàn Tượng Chủng Nghệ Ngữ xuất hiện ngoài hoang dã, theo ghi chép nó biết dẫn sấm làm tên, giương cung bắn như người, mức độ nguy hiểm thuộc cấp Khinh Ba."
lang_multi_text.db,MultiText,MonsterInfo_310000040_DiscoveredDes,"该敌人<color=Ice>冷凝伤害</color><color=HighlightB>抗性提高</color>。
手持猎具的类人残象，凝冰霜为长矛。
破霜猎手的掷枪如破风的寒芒般精准，它将荒原视作恣意的围场，以逐猎为乐。","This enemy has a <color=HighlightB>higher RES</color> to <color=Ice>Glacio DMG</color>. 

A humanoid Tacet Discord wielding ice-tipped hunting gear. 

Glacio Predators' spears are as precise as lightning that slices the wind. The wastelands are its hunting ground, and it takes delight in the pursuit of prey.","Kẻ địch này có <color=HighlightB>kháng cao</color> với <color=Ice>sát thương Ngưng Băng</color>.
Tàn Tượng dạng người cầm dụng cụ săn bắt, ngưng tụ băng giá làm trường thương.
Cú ném lao của Thợ Săn Phá Sương chuẩn xác như tia lạnh xé gió, nó coi vùng hoang dã là bãi săn tùy ý, lấy việc săn đuổi làm niềm vui."
