db_file,table_name,id,zh,en,vi
lang_multi_text.db,MultiText,CarnivalTaskTitle22,累计调谐10次声骸,Perform Echo Tuning 10 times in total.,Hòa âm tích lũy 10 lần Thanh Hài
lang_multi_text.db,MultiText,CarnivalTaskTitle23,任意5枚五星声骸强化至25级,Upgrade any 5 Echoes of 5-star rarity to Level 25.,Cường hóa 5 Thanh Hài 5 sao bất kỳ lên cấp 25
lang_multi_text.db,MultiText,CarnivalTaskTitle24,累计消耗240结晶波片,Consume 240 Waveplates in total.,Tiêu hao tích lũy 240 Nhựa Kết Tinh
lang_multi_text.db,MultiText,CarnivalTaskTitle25,完成闪避或延奏技能的基础训练,Complete Dodge or Outro Skill tutorial.,Hoàn thành huấn luyện cơ bản Né Tránh hoặc Kỹ Năng Biến Tấu
lang_multi_text.db,MultiText,CarnivalTaskTitle26,完成任意「全息战略·强袭/幻痛/同步」3次,Complete 3 Tactical Hologram: Calamity/Phantom Pain/Synchronization challenges.,"Hoàn thành ""Chiến lược Toàn Tức - Cường Kích/Ảo Cảnh/Đồng Bộ"" bất kỳ 3 lần"
lang_multi_text.db,MultiText,CarnivalTaskTitle27,在「逆境深塔·稳定区」的「残响之塔」中取得3枚印记,Obtain 3 Crests in the Resonant Tower in Tower of Adversity: Stable Zone.,"Đạt 3 Ấn Ký trong ""Tháp Tàn Hưởng"" của ""Tháp Nghịch Cảnh - Vùng Ổn Định"""
lang_multi_text.db,MultiText,CarnivalTaskTitle28,在「逆境深塔·实验区」的「回音之塔」中取得6枚印记,Obtain 6 Crests in the Echoing Tower in Tower of Adversity: Experimental Zone,"Đạt 6 Ấn Ký trong ""Tháp Hồi Âm"" của ""Tháp Nghịch Cảnh - Vùng Thử Nghiệm"""
lang_multi_text.db,MultiText,CarnivalTaskTitle29,通过「冥歌海墟」的「禁忌海域」第2层,Clear second floor in the Forbidden Waters in Whimpering Wastes.,"Vượt qua tầng 2 ""Vùng Biển Cấm"" của ""Minh Ca Hải Khư"""
lang_multi_text.db,MultiText,CarnivalTaskTitle3,完成任意4幕潮汐任务,Complete any 4 Acts of the Main Quest,Hoàn thành 4 màn Nhiệm Vụ Triều Tịch bất kỳ
lang_multi_text.db,MultiText,CarnivalTaskTitle30,在活动「千道门扉的异想」中一个周期内累计获得2000点积分,Obtain a total of 2000 points in one cycle in Fantasies of the Thousand Gateways.,"Tích lũy 2000 điểm trong một chu kỳ của sự kiện ""Dị Tưởng Của Ngàn Cánh Cửa"""
lang_multi_text.db,MultiText,CarnivalTaskTitle31,累计获取2个庆典热度,Obtain 2 Festivity Points.,Tích lũy nhận 2 Độ Nhiệt Huyết Lễ Hội
lang_multi_text.db,MultiText,CarnivalTaskTitle32,累计获取6个庆典热度,Obtain 6 Festivity Points.,Tích lũy nhận 6 Độ Nhiệt Huyết Lễ Hội
lang_multi_text.db,MultiText,CarnivalTaskTitle33,累计获取12个庆典热度,Obtain 12 Festivity Points.,Tích lũy nhận 12 Độ Nhiệt Huyết Lễ Hội
lang_multi_text.db,MultiText,CarnivalTaskTitle34,累计获取18个庆典热度,Obtain 18 Festivity Points.,Tích lũy nhận 18 Độ Nhiệt Huyết Lễ Hội
lang_multi_text.db,MultiText,CarnivalTaskTitle35,累计获取24个庆典热度,Obtain 24 Festivity Points.,Tích lũy nhận 24 Độ Nhiệt Huyết Lễ Hội
lang_multi_text.db,MultiText,CarnivalTaskTitle4,完成任意5幕潮汐任务,Complete any 5 Acts of the Main Quest,Hoàn thành 5 màn Nhiệm Vụ Triều Tịch bất kỳ
lang_multi_text.db,MultiText,CarnivalTaskTitle5,联觉等级达到30级,Reach Union Level 30.,Đạt cấp Liên Giác 30
lang_multi_text.db,MultiText,CarnivalTaskTitle6,完成任意1个伴星任务,Complete any 1 Companion Story,Hoàn thành 1 Nhiệm Vụ Bạn Sao bất kỳ
lang_multi_text.db,MultiText,CarnivalTaskTitle7,数据坞等级达到15级,Reach Data Bank Level 15.,Đạt cấp Kho Dữ Liệu 15
lang_multi_text.db,MultiText,CarnivalTaskTitle8,累计消耗1600星声,Consume 1600 Astrites in total.,Tiêu hao tích lũy 1600 Astrites
lang_multi_text.db,MultiText,CarnivalTaskTitle9,累计解锁5个中枢信标,Unlock 5 Resonance Nexus in total.,Mở khóa tích lũy 5 Tín Tiêu Trung Khu
lang_multi_text.db,MultiText,CelebrationAwardLeftTimeDay,距离奖励解锁还剩<color=#fdcf43>{0}</color>天<color=#fdcf43>{1}</color>小时,Rewards unlocked in <color=#fdcf43>{0}</color>d <color=#fdcf43>{1}</color>h.,Còn <color=#fdcf43>{0}</color> ngày <color=#fdcf43>{1}</color> giờ nữa mở thưởng
lang_multi_text.db,MultiText,CelebrationAwardLeftTimeHour,距离奖励解锁还剩<color=#fdcf43>{0}</color>小时<color=#fdcf43>{1}</color>分钟,Rewards unlocked in <color=#fdcf43>{0}</color>h <color=#fdcf43>{1}</color>min.,Còn <color=#fdcf43>{0}</color> giờ <color=#fdcf43>{1}</color> phút nữa mở thưởng
lang_multi_text.db,MultiText,CelebrationAwardLeftTimeLessSecond,距离奖励解锁还剩<color=#fdcf43>{0}</color>秒,Rewards unlocked in <color=#fdcf43>{0}</color>s.,Còn <color=#fdcf43>{0}</color> giây nữa mở thưởng
lang_multi_text.db,MultiText,CelebrationAwardLeftTimeSecond,距离奖励解锁还剩<color=#fdcf43>{0}</color>分钟<color=#fdcf43>{1}</color>秒,Rewards unlocked in <color=#fdcf43>{0}</color>min <color=#fdcf43>{1}</color>s.,Còn <color=#fdcf43>{0}</color> phút <color=#fdcf43>{1}</color> giây nữa mở thưởng
lang_multi_text.db,MultiText,ChallengeAgain,重新挑战,Restart,Thách đấu lại
lang_multi_text.db,MultiText,ChallengeAgain_mobile,点击重新挑战,Tap to Restart,Nhấn để thách đấu lại
lang_multi_text.db,MultiText,ChallengeOL_Bestrecord,最佳记录:{0},Best Record: {0},Kỷ lục tốt nhất: {0}
lang_multi_text.db,MultiText,ChallengeOL_Norecord,暂无挑战记录,No Challenge Record,Chưa có kỷ lục
lang_multi_text.db,MultiText,Change4KWarning_Text,算力不足，建议降低分辨率或关闭插帧,Insufficient computing power. Please lower the resolution or disable Frame Generation.,"Hiệu suất không đủ, đề nghị giảm độ phân giải hoặc tắt tạo khung hình"
lang_multi_text.db,MultiText,ChangeDefaultVisionSkinText,对全部<color=Highlight>{0}</color>生效,Effective for all <color=Highlight>{0}</color>.,Áp dụng cho tất cả <color=Highlight>{0}</color>
lang_multi_text.db,MultiText,ChangeMapBtn_Text,切换地图,Switch Map,Đổi bản đồ
lang_multi_text.db,MultiText,ChanllengeBackToCockpit,返回驾驶舱,Return to Cockpit,Về buồng lái
lang_multi_text.db,MultiText,CharacAlbum_GuideDesc_Cantarella,<color=Highlight>坎特蕾拉</color>正在品评美食，难道她的味觉恢复了？去<color=Highlight>餐吧</color>陪她聊聊吧。,<color=Highlight>Cantarella</color> is reviewing the dishes. Has her sense of taste finally returned? Go chat with her at the <color=Highlight>Bar</color>.,"<color=Highlight>Cantarella</color> đang nếm thử món ngon, lẽ nào vị giác của cô ấy đã hồi phục? Hãy đến <color=Highlight>Quầy Bar</color> trò chuyện cùng cô ấy nhé."
lang_multi_text.db,MultiText,CharacAlbum_GuideDesc_Firework,让这里变成最欢乐的派对吧，到时候，这里会绽放出最美丽的烟花（完成任务「答案在银河倾落之地」后解锁）。,"Bring the party to its climax and witness the most breathtaking fireworks that exist only for this very moment.
(Unlocks after completing the Quest ""The Answer Is Where a River of Stars Falls"")","Hãy biến nơi đây thành bữa tiệc vui vẻ nhất, đến lúc đó, những bông pháo hoa đẹp nhất sẽ nở rộ (Mở khóa sau khi hoàn thành nhiệm vụ ""Câu Trả Lời Ở Nơi Ngân Hà Đổ Xuống"")."
lang_multi_text.db,MultiText,CharacAlbum_GuideDesc_Jiyan,<color=Highlight>忌炎</color>难得来到宴会，却一直盯着声骸若有所思……去<color=Highlight>前厅</color>和他打个招呼吧。,"Rarely one for festivities, <color=Highlight>Jiyan</color> now stands before a displayed Echo, quietly gazing at it. Go find him in the <color=Highlight>Lobby</color> and say hello.","Hiếm khi <color=Highlight>Kỵ Viêm</color> tới dự tiệc, nhưng anh ấy cứ nhìn chằm chằm vào Thanh Hài vẻ suy tư... Hãy đến <color=Highlight>Tiền Sảnh</color> chào hỏi anh ấy một tiếng nhé."
lang_multi_text.db,MultiText,CharacAlbum_GuideDesc_Lynae,在<color=Highlight>放映厅</color>发现了<color=Highlight>琳奈</color>，该不会是……又逃课了吧，去问问看吧（在任务「答案在银河倾落之地」中与灯灯对话后解锁）。,"You run into <color=Highlight>Lynae</color> in the <color=Highlight>Screening Room</color>. Did she… skip classes again? Maybe you should ask her yourself. (Unlocks after talking to Lumi in the Quest ""The Answer Is Where a River of Stars Falls"")","Phát hiện <color=Highlight>Lynae</color> ở <color=Highlight>Phòng Chiếu Phim</color>, chẳng lẽ là... lại trốn học nữa rồi? Thử đi hỏi xem sao (Mở khóa sau khi nói chuyện với Đăng Đăng trong nhiệm vụ ""Câu Trả Lời Ở Nơi Ngân Hà Đổ Xuống"")."
lang_multi_text.db,MultiText,CharacAlbum_GuideDesc_Yinlin,据说<color=Highlight>二楼露台</color>出现了<color=Highlight>吟霖</color>的身影，这回她是以什么身份前来的呢？不如去探查一番吧。,<color=Highlight>Yinlin</color> is spotted on the <color=Highlight>second-floor balcony</color>. What identity is she wearing this time? Go find out for yourself.,"Nghe nói bóng dáng <color=Highlight>Ngâm Lâm</color> xuất hiện ở <color=Highlight>ban công tầng 2</color>, lần này cô ấy đến với thân phận gì đây? Hay là đi thám thính thử xem."
lang_multi_text.db,MultiText,CharacAlbum_GuideDesc_Zani,<color=Highlight>赞妮</color>终于获得了假期，却似乎一时不太习惯，去<color=Highlight>室外休闲区</color>陪她聊聊吧。,"<color=Highlight>Zani</color> is enjoying a rare vacation, but she doesn't quite seem used to it. Go talk to her in the <color=Highlight>Outdoor Lounge</color>.","<color=Highlight>Zani</color> cuối cùng cũng có kỳ nghỉ, nhưng có vẻ nhất thời chưa quen lắm, hãy đến <color=Highlight>Khu Giải Trí Ngoài Trời</color> trò chuyện cùng cô ấy nhé."
lang_multi_text.db,MultiText,CharacAlbum_TaskName_Cantarella,夜宴来客·坎特蕾拉,Fest Guest: Cantarella,Khách Mời Dạ Tiệc - Cantarella
lang_multi_text.db,MultiText,CharacAlbum_TaskName_Firework,绽放烟花吧,Launch fireworks,"Hãy nở rộ đi, pháo hoa"
lang_multi_text.db,MultiText,CharacAlbum_TaskName_Jiyan,夜宴来客·忌炎,Fest Guest: Jiyan,Khách Mời Dạ Tiệc - Kỵ Viêm
lang_multi_text.db,MultiText,CharacAlbum_TaskName_Lynae,夜宴来客·琳奈,Fest Guest: Lynae,Khách Mời Dạ Tiệc - Lynae
lang_multi_text.db,MultiText,CharacAlbum_TaskName_Yinlin,夜宴来客·吟霖,Fest Guest: Yinlin,Khách Mời Dạ Tiệc - Ngâm Lâm
lang_multi_text.db,MultiText,CharacAlbum_TaskName_Zani,夜宴来客·赞妮,Fest Guest: Zani,Khách Mời Dạ Tiệc - Zani
lang_multi_text.db,MultiText,CharacAlbum_UnlockDesc_Cantarella,美食与旅行总是相伴，愿她展开一场欢乐的旅途。,Good food and travel always go hand in hand. May she set off on a journey filled with joy.,"Ẩm thực và du lịch luôn song hành, mong cô ấy có một chuyến đi vui vẻ."
lang_multi_text.db,MultiText,CharacAlbum_UnlockDesc_Firework,那银河倾落的瞬间，会照亮你璀璨的前路。,"When the stars come cascading down, they will light the radiant path ahead of you.",Khoảnh khắc ngân hà đổ xuống đó sẽ soi sáng con đường rực rỡ phía trước của bạn.
lang_multi_text.db,MultiText,CharacAlbum_UnlockDesc_Jiyan,即便公务缠身，又怎能放弃一场欢宴？,"Even when duty weighs heavy, who could turn down a grand festivity?","Dù công vụ bộn bề, sao nỡ từ chối một bữa tiệc vui?"
lang_multi_text.db,MultiText,CharacAlbum_UnlockDesc_Lynae,兴趣使然的人生，或许有最好的未来。,A life sparked by impulse may yet lead to the brightest future.,Một cuộc đời sống theo sở thích có lẽ sẽ có một tương lai tốt đẹp nhất.
lang_multi_text.db,MultiText,CharacAlbum_UnlockDesc_Yinlin,总有些时候，你可以卸下所有的伪装，毕竟，我们可是来玩儿的。,"There are moments when you can cast aside every disguise. After all, we're here for a great time.","Luôn có những lúc bạn có thể trút bỏ mọi ngụy trang, rốt cuộc thì, chúng ta đến đây để chơi mà."
lang_multi_text.db,MultiText,CharacAlbum_UnlockDesc_Zani,纵然无所事事，但，这也是假期的一种意义。,"Even doing nothing at all can be meaningful. That, too, is what a vacation is for.","Dù chẳng làm gì cả, nhưng đó cũng là một ý nghĩa của kỳ nghỉ."
lang_multi_text.db,MultiText,CharacterDetailsTip,未选中共鸣者,No Resonator is selected,Chưa chọn Cộng Hưởng Giả
lang_multi_text.db,MultiText,CharacterDisplayStyle_50001_Desc,正在切换至{PlayerName}视角,Switching to {PlayerName}'s perspective,Đang chuyển sang góc nhìn của {PlayerName}
lang_multi_text.db,MultiText,CharacterDisplayStyle_50001_Name,漂泊者,Rover,Lữ Khách
lang_multi_text.db,MultiText,CharacterDisplayStyle_50004_Desc,正在切换至千咲视角,Switching to Chisa's perspective,Đang chuyển sang góc nhìn của Thiên Tiếu
lang_multi_text.db,MultiText,CharacterDisplayStyle_50004_Name,千咲,Chisa,Thiên Tiếu
lang_multi_text.db,MultiText,CharacterDisplayStyle_50005_Desc,正在切换至{PlayerName}视角,Switching to {PlayerName}'s perspective,Đang chuyển sang góc nhìn của {PlayerName}
lang_multi_text.db,MultiText,CharacterDisplayStyle_50005_Name,漂泊者,Rover,Lữ Khách
lang_multi_text.db,MultiText,CharacterDisplayStyle_800001_Desc,test/测试用1,,test/Dùng để test 1
lang_multi_text.db,MultiText,CharacterDisplayStyle_800001_Name,test/测试用1,,test/Dùng để test 1
lang_multi_text.db,MultiText,CharacterDisplayStyle_800002_Desc,test/测试用2,,test/Dùng để test 2
lang_multi_text.db,MultiText,CharacterDisplayStyle_800002_Name,test/测试用2,,test/Dùng để test 2
lang_multi_text.db,MultiText,Character_Brant_10_1,这些文书工作就交给明天的布兰特吧，别担心，那是他该做的事。,Leave the paperwork to Brant. It's part of his responsibilities.,"Mấy công việc giấy tờ này cứ để cho Brant của ngày mai lo đi, đừng lo, đó là việc cậu ta phải làm."
lang_multi_text.db,MultiText,Character_Brant_11_1,离吃饭还有些时间，你可以先在剧团逛逛，但最重要的，是玩得开心！,There's still time before dinner! Smiles are all around. Why not wander about and soak it all in?,"Vẫn còn chút thời gian trước bữa ăn, cậu có thể dạo quanh đoàn kịch trước, nhưng quan trọng nhất là phải chơi thật vui nhé!"
lang_multi_text.db,MultiText,Character_Brant_11_10,听起来充满挑战。,Sounds easier said than done.,Nghe có vẻ đầy thử thách.
lang_multi_text.db,MultiText,Character_Brant_11_11,听起来有些累……,I feel like there are easier ways to find glory...,Nghe có vẻ hơi mệt...
lang_multi_text.db,MultiText,Character_Brant_11_12,毕竟越高的巨浪，会带来越传奇的冒险嘛，我的朋友。,That's true. But you know the greatest legends are forged in the fiercest storms.,"Rốt cuộc thì sóng càng to, cuộc phiêu lưu càng huyền thoại mà, bạn tôi ơi."
lang_multi_text.db,MultiText,Character_Brant_11_13,是啊，但有疲惫就有欢笑，有冒险就有宝藏。,"True, but every drop of sweat brings laughter, and every adventure leads to a chest full of treasure.","Đúng vậy, nhưng có mệt mỏi mới có tiếng cười, có phiêu lưu mới có kho báu."
lang_multi_text.db,MultiText,Character_Brant_11_14,不过最有意思的，还是剧团的大家啊。,"But none of this is possible without a captain, and the same goes for every member of the troupe.",Nhưng điều thú vị nhất vẫn là mọi người trong đoàn kịch.
lang_multi_text.db,MultiText,Character_Brant_11_15,巴蒂尔是个钓鱼好手，蒂娜清楚每一片海况，拉维特的故事三天三夜都听不完……,"Take Battier, for example, he's our best fisherman. Tina? She knows every inch of the sea. And Lavito's stories could stretch on to fill a hundred nights.","Battier là tay câu cá cừ khôi, Tina nắm rõ từng vùng biển, còn chuyện của Lavito thì nghe ba ngày ba đêm không hết..."
lang_multi_text.db,MultiText,Character_Brant_11_16,每个人都有自己擅长的事，剧团的每个成员都很重要。,Everyone's unique talents make this troupe what it is. Each soul plays an important role.,"Mỗi người đều có sở trường riêng, mỗi thành viên trong đoàn kịch đều rất quan trọng."
lang_multi_text.db,MultiText,Character_Brant_11_17,好啦船长，我要继续工作了，得赶在晚饭前把甲板擦干净。,"Ah, but duty calls, Captain. Oh, time to scrub the decks before dinner, as promised.","Được rồi Thuyền Trưởng, tôi phải tiếp tục làm việc đây, phải lau sạch boong tàu trước bữa tối."
lang_multi_text.db,MultiText,Character_Brant_11_18,今天应该也是六点开饭吧，我看看……还有时间，我们待会儿再聊。,Dinner's at six. Good... there's still time. Until then!,"Hôm nay chắc cũng sáu giờ ăn cơm nhỉ, để tôi xem... vẫn còn thời gian, lát nữa chúng ta nói chuyện tiếp."
lang_multi_text.db,MultiText,Character_Brant_11_2,关于船长的事……,About this captain thing…,Về chuyện Thuyền Trưởng...
lang_multi_text.db,MultiText,Character_Brant_11_3,虽然巴蒂尔那样说，但要不要做这个一日船长，还是得看你的意愿。,"Battier did say the winner would be the captain, but of course, the choice is yours. So, do you want the helm?","Tuy Battier nói vậy, nhưng có làm ""Thuyền Trưởng một ngày"" hay không vẫn tùy thuộc vào ý muốn của cậu."
lang_multi_text.db,MultiText,Character_Brant_11_4,「船长」一般要做些什么？,What does being captain actually involve?,"""Thuyền Trưởng"" thường phải làm gì?"
lang_multi_text.db,MultiText,Character_Brant_11_5,规划航线、掌舵冒险……只要「船长」确定了航向，大家随时都能出海。,"Simply put, you chart the course and steer the ship. The crew will be ready to sail on your order at a moment's notice.","Hoạch định hải trình, cầm lái phiêu lưu... Chỉ cần ""Thuyền Trưởng"" xác định hướng đi, mọi người lúc nào cũng có thể ra khơi."
lang_multi_text.db,MultiText,Character_Brant_11_6,虽说看上去没什么特别的，但我觉得，对剧团来说，「船长」必不可少。,"Might seem easy enough, but there's more to being captain of the Troupe of Fools.","Tuy trông có vẻ không có gì đặc biệt, nhưng tôi thấy đối với đoàn kịch, ""Thuyền Trưởng"" là không thể thiếu."
lang_multi_text.db,MultiText,Character_Brant_11_7,这片海上有的是激动人心的故事和闪闪发光的宝藏。,These seas are full of thrilling quests and glittering treasures.,Vùng biển này có đầy những câu chuyện ly kỳ và kho báu lấp lánh.
lang_multi_text.db,MultiText,Character_Brant_11_8,需要有人带领剧团去<ano=寻找故事>冒险</ano>、去<ano=带来欢笑>掠夺</ano>，去穿过风暴海的层层巨浪，带大家驶向目的地。,"That's where a true captain shines! Leading their crew to uncover lost legends, revel in the crowd's cheers, and sail boldly through the Stormy Sea toward glory.","Cần có người dẫn dắt đoàn kịch đi <ano=tìm kiếm câu chuyện>phiêu lưu</ano>, đi <ano=mang lại tiếng cười>cướp bóc</ano>, vượt qua tầng tầng sóng dữ của Biển Bão Táp, đưa mọi người đến đích."
lang_multi_text.db,MultiText,Character_Brant_11_9,听起来很有意思。,That does get me going.,Nghe có vẻ thú vị đấy.
lang_multi_text.db,MultiText,Character_Brant_12_1,六点，吃饭！六点，吃饭！,"Six o'clock, dinner! Six o'clock, dinner!","Sáu giờ, ăn cơm! Sáu giờ, ăn cơm!"
lang_multi_text.db,MultiText,Character_Brant_12_2,似乎还没到吃饭时间……先去剧团转转吧。,There's still some time before dinner. A little stroll could be a good idea.,Hình như chưa đến giờ cơm... Đi dạo quanh đoàn kịch trước đã.
lang_multi_text.db,MultiText,Character_Brant_13_1,你的「剧团烈度」，拿着！在我们剧团，这可是硬通货。,"A bottle of Troupe Strength, just for you! Around these parts, this stuff is as good as gold.","""Độ Mạnh Đoàn Kịch"" của cậu đây, cầm lấy! Ở đoàn kịch chúng tôi, cái này là tiền tệ mạnh đấy."
lang_multi_text.db,MultiText,Character_Brant_13_10,D……我记得这片大海上，只有一个关于「D」的传说。,"Hmm, yes. On these seas, there is only one legend about ""D.""","D... Tôi nhớ trên vùng biển rộng lớn này, chỉ có một truyền thuyết về ""D""."
lang_multi_text.db,MultiText,Character_Brant_13_11,那就是黄金船长德雷克！,"The story of Drake, the Golden Captain.",Đó chính là Thuyền Trưởng Vàng Drake!
lang_multi_text.db,MultiText,Character_Brant_13_12,德雷克船长……那不就是传说中的冒险家！,Captain Drake! That adventurer everyone talks about?,Thuyền Trưởng Drake... Đó chẳng phải là nhà thám hiểm trong truyền thuyết sao!
lang_multi_text.db,MultiText,Character_Brant_13_13,是啊，还以为那只是传说……,I thought that was just a fanciful story…,"Đúng vậy, cứ tưởng đó chỉ là truyền thuyết..."
lang_multi_text.db,MultiText,Character_Brant_13_14,德雷克船长？,Who is Captain Drake?,Thuyền Trưởng Drake?
lang_multi_text.db,MultiText,Character_Brant_13_15,传说中的冒险家？,What do they say about him?,Nhà thám hiểm trong truyền thuyết?
lang_multi_text.db,MultiText,Character_Brant_13_16,是啊，黎那汐塔的传奇冒险家德雷克船长，据说他曾经只靠一枚硬币就组建起了船队，还从当年的首富手里赢下了一大桶金。,"Captain Drake, the famed hero of Rinascita. Legend has it he assembled a crew with naught but a single coin and amassed great riches from the wealthiest of men.","Đúng vậy, Thuyền Trưởng Drake, nhà thám hiểm huyền thoại của Rinascita. Nghe nói ông ấy từng lập nên hạm đội chỉ với một đồng xu, và còn thắng được cả một thùng vàng lớn từ tay người giàu nhất thời bấy giờ."
lang_multi_text.db,MultiText,Character_Brant_13_17,这之后，他就带着全部身家出航，去寻找能通过风暴洋的安全航路，这可是了不起的成就！,He then embarked on a quest to chart a safe passage across the Stormy Sea. A feat worthy of being remembered forever!,"Sau đó, ông ấy mang theo toàn bộ gia sản ra khơi, đi tìm tuyến đường an toàn có thể vượt qua Biển Bão Táp, đây quả là một thành tựu vĩ đại!"
lang_multi_text.db,MultiText,Character_Brant_13_18,可惜最后回来的只有个疯了的船员，没人知道他们遇见了什么。,"But there was a price. Only one crew member returned, and he had been driven mad. What happened out there is still a mystery.","Tiếc là cuối cùng chỉ có một thuyền viên điên loạn trở về, không ai biết họ đã gặp phải chuyện gì."
lang_multi_text.db,MultiText,Character_Brant_13_19,你还挺熟悉的。,You seem to know the story well.,Anh rành rẽ thật đấy.
lang_multi_text.db,MultiText,Character_Brant_13_2,还有，刚去破鱼的时候，从鱼肚子里找出了这个。,"Oh, and look what I found while gutting the fish!","Còn nữa, vừa nãy lúc làm cá, tôi tìm thấy cái này trong bụng cá."
lang_multi_text.db,MultiText,Character_Brant_13_20,那当然，我听这些故事长大的嘛。,Such tales were my bedtime stories.,"Đương nhiên rồi, tôi lớn lên cùng những câu chuyện này mà."
lang_multi_text.db,MultiText,Character_Brant_13_21,那时候我刚上朝圣船，天天做噩梦。托斯卡尼尼就给我讲这些冒险故事。,"Back when I just boarded the Pilgrim's Sail, with no family and nightmares that could raise the dead, Toscanini would share such stories to comfort me.","Hồi đó tôi mới lên Tàu Hành Hương, ngày nào cũng gặp ác mộng. Toscanini liền kể cho tôi nghe những câu chuyện phiêu lưu này."
lang_multi_text.db,MultiText,Character_Brant_13_22,当时我就想，如果我做了船长，一定不会让这样的事发生。我一定会让船员们平安回来。,"At the time, I swore that if I ever became a captain, every crew member would come back safe. No exceptions.","Lúc đó tôi đã nghĩ, nếu tôi làm thuyền trưởng, nhất định sẽ không để chuyện như vậy xảy ra. Tôi nhất định sẽ đưa các thuyền viên bình an trở về."
lang_multi_text.db,MultiText,Character_Brant_13_23,天选守夜人托斯卡尼尼啊……也就你小子还记得他。,"Ah, Toscanini, the Night Watcher. Hahaha. You're one of the few who still remembers him.",Người Canh Đêm Được Chọn Toscanini à... Chắc chỉ còn mỗi cậu nhóc nhà cậu là nhớ ông ấy.
