db_file,table_name,id,zh,en,vi
lang_multi_text.db,MultiText,Main_Rinascita_2_12_53_1,不久之前，冥湖之畔……,"Not long ago, by the Styx Lake...","Không lâu trước đó, bên bờ Hồ U Minh..."
lang_multi_text.db,MultiText,Main_Rinascita_2_12_53_10,你应该也体会过，很多被你拯救的人，并不感谢你……在他们眼中，你永远只是一个“异类”。,"You must have felt it. The cold stares of those you saved. No gratitude, only fear for that which they cannot understand.","Ngươi chắc cũng đã nếm trải rồi, nhiều người được ngươi cứu chẳng hề biết ơn... Trong mắt họ, ngươi mãi chỉ là một ""kẻ dị loại""."
lang_multi_text.db,MultiText,Main_Rinascita_2_12_53_11,那又如何？我意愿如此。,"So what? I chose this path, and I'll follow it.",Thì sao? Đó là lựa chọn của ta.
lang_multi_text.db,MultiText,Main_Rinascita_2_12_53_12,你的频率，已经与残象的频率纠缠在了一起。你已经跨越了「那道界限」，这尘世……已不再有你的岸。,"Your frequency now intertwines with the Tacet Discords. The moment you crossed that threshold, the mortal world... ceased to be your home.","Tần số của ngươi đã vướng víu với tần số Tàn Tượng. Ngươi đã vượt qua ""ranh giới ấy"" rồi, cõi trần này... không còn bến bờ nào dành cho ngươi nữa."
lang_multi_text.db,MultiText,Main_Rinascita_2_12_53_13,我曾邀请过你加入残星会，这份诚意，如今也未曾改变：我们同为跨越界限之人，这里，会有你的容身之所与一席之地。,"My offer still stands. Join the Fractsidus. You, too, have crossed the veil that parts life and death. Among us, you shall find haven and purpose.","Ta từng mời ngươi gia nhập Tàn Tinh Hội, thành ý ấy đến giờ vẫn không thay đổi: chúng ta đều là kẻ đã vượt qua ranh giới, ở đây, sẽ có chỗ đứng dành cho ngươi."
lang_multi_text.db,MultiText,Main_Rinascita_2_12_53_14,自这双羽翼显现后，我早就习惯了在天空翱翔……,"Ever since I got these wings, I've found freedom in the open sky...","Từ khi đôi cánh này xuất hiện, ta đã quen với việc bay lượn trên bầu trời..."
lang_multi_text.db,MultiText,Main_Rinascita_2_12_53_15,我不需要我的岸，更不需要谁人来为我定义……我只站在，我自己的这一边。,I don't need a haven or titles to cage me. I am what I choose to be.,"Ta không cần bến bờ nào, càng không cần ai định nghĩa ta... Ta chỉ đứng về phía chính mình."
lang_multi_text.db,MultiText,Main_Rinascita_2_12_53_16,若是追求力量，我们可以许诺予你……甚至是，鸣式的力量。若是寻求拯救，我们也可以率领人类，走向一个，更高维度的未来。,"Shoulds you crave power, we shall grant it, even that of the Threnodian. Should you seek to help, we shall guide mankind toward a future beyond all comprehension.","Nếu ngươi tìm kiếm sức mạnh, chúng ta có thể ban cho ngươi... thậm chí là sức mạnh Minh Thức. Nếu ngươi muốn cứu rỗi, chúng ta cũng có thể dẫn dắt nhân loại, hướng đến một tương lai ở tầm cao hơn."
lang_multi_text.db,MultiText,Main_Rinascita_2_12_53_17,听起来，你们还挺自诩正义的。,Sounds like something a hypocrite would say.,"Nghe có vẻ, các ngươi còn tự xưng mình chính nghĩa lắm nhỉ."
lang_multi_text.db,MultiText,Main_Rinascita_2_12_53_18,人类的视野太过狭隘，无法理解我们所做的事业。,Mortal sight is too narrow to fathom our path.,"Tầm nhìn của con người quá hẹp hòi, không thể hiểu được sự nghiệp mà chúng ta đang làm."
lang_multi_text.db,MultiText,Main_Rinascita_2_12_53_19,倒是将自己和人类的界限划得清晰……行了，我对你们的理念和大道理都不感兴趣。,"So you think you stand above humanity, huh? Whatever, I don't give a damn about you or your grand ideals.","Ranh giới giữa bản thân với con người thì vạch rõ ràng thật... Thôi được, ta chẳng hứng thú gì với lý tưởng hay đạo lý lớn lao của các ngươi."
lang_multi_text.db,MultiText,Main_Rinascita_2_12_53_2,所以……你的目标，一直是我。,So… I was your true target all along.,"Vậy là... mục tiêu của ngươi, từ đầu đến giờ là ta."
lang_multi_text.db,MultiText,Main_Rinascita_2_12_53_20,要击败你的理由只有一个——你挡了我的道了。,I only need one reason to take you down. You're in my way.,Lý do đánh bại ngươi chỉ có một - ngươi chắn đường ta.
lang_multi_text.db,MultiText,Main_Rinascita_2_12_53_21,你体内的残象已经被我尽数剥离。失去了它们的加持，你，又能做些什么？,"The Tacet Discords within you are gone. Now, tell me. What remains of you?","Tàn Tượng trong người ngươi đã bị ta tước sạch. Không còn sức mạnh của chúng hỗ trợ, ngươi còn làm được gì?"
lang_multi_text.db,MultiText,Main_Rinascita_2_12_53_22,类似的话，我已经听过太多次了。,I've heard enough of this crap.,"Những lời kiểu này, ta đã nghe quá nhiều rồi."
lang_multi_text.db,MultiText,Main_Rinascita_2_12_53_23,没有“自我”的人，你总是借别人的面貌而活。而我向来……绝对相信着自己。,You hide behind borrowed faces. But me? I've never once doubted who I am.,"Kẻ không có ""bản ngã"", ngươi luôn sống bằng khuôn mặt người khác. Còn ta... luôn tuyệt đối tin vào chính mình."
lang_multi_text.db,MultiText,Main_Rinascita_2_12_53_24,千万遍，我从鲜血与烈火中起身，走向那些排着队等待吞噬我的残象，和它们撕扯，残杀……,"I've risen from blood and inferno a thousand times, faced the monsters that lined up to devour me, and fought back, without mercy...","Ngàn vạn lần, ta đứng dậy từ máu và lửa, bước về phía những Tàn Tượng xếp hàng chờ nuốt chửng ta, giằng xé, chém giết..."
lang_multi_text.db,MultiText,Main_Rinascita_2_12_53_25,我折断哈尔庇恩的锐翼，剜下巴罗尔的魔眼，杜拉罕的铁蹄也未能令我屈膝……黑潮的诅咒，早已给我宣判了死刑，可我，依然活到了现在。,"I broke Harpyia's razor wings and tore out Balor's demon eye. Not even Dullahan's iron hooves could bring me to my knees. The Dark Tide cursed me long ago. I should have been dead, but here I stand.","Ta bẻ gãy đôi cánh sắc của Harpyia, khoét mắt quỷ của Balor, móng sắt của Dullahan cũng không khiến ta quỳ gối... Lời nguyền Hắc Triều đã tuyên án tử cho ta từ lâu, nhưng ta vẫn sống đến giờ."
lang_multi_text.db,MultiText,Main_Rinascita_2_12_53_26,仅凭你的一个分身……也想拦住我？,And you think one of your clones can stop me?,Chỉ với một phân thân của ngươi... cũng muốn chặn ta sao?
lang_multi_text.db,MultiText,Main_Rinascita_2_12_53_27,还是不愿意放弃吗？一时的口舌之利，可以提起你的勇气，却不会让你的胜算多上一分。,"Still clinging to hope? A sharp tongue may spark your courage, but it shall not change your end.","Vẫn không chịu bỏ cuộc sao? Lời nói sắc bén nhất thời có thể khích lệ dũng khí, nhưng chẳng tăng thêm phần thắng nào cho ngươi."
lang_multi_text.db,MultiText,Main_Rinascita_2_12_53_28,既然如此……不要再希望看见天堂，我来把你们领到对岸，领到永恒的黑暗……到地狱中去吧。,"Then so be it. Forsake all hope of ever beholding Paradise. I shall guide you to the other shore, into eternal darkness... into hell.","Vậy thì... đừng mong nhìn thấy thiên đường nữa, ta sẽ đưa các ngươi sang bờ bên kia, đến bóng tối vĩnh hằng... xuống địa ngục."
lang_multi_text.db,MultiText,Main_Rinascita_2_12_53_29,……斯瓦茨洛，我们，已经到了。,"We're already there, Schwarzloch.","...Schwarzloch, chúng ta đã đến rồi."
lang_multi_text.db,MultiText,Main_Rinascita_2_12_53_3,等待{TA}的，是另一个死局。而你，自黑潮归来的“亡灵”，才是闯入我们剧本的……“能够终结利维亚坦的角色”。,"Indeed. Another stalemate awaiteth {Male=him;Female=her}. And you, the revenant returned from the Dark Tide... You are the one chosen to end Leviathan in our script.","Điều chờ đợi {TA}, là một tử cục khác. Còn ngươi, ""vong linh"" trở về từ Hắc Triều, mới chính là kẻ xen vào kịch bản của chúng ta... ""vai trò có thể kết thúc Leviathan""."
lang_multi_text.db,MultiText,Main_Rinascita_2_12_53_30,"冥湖之畔，独自断后迎战<ano=残星会会长>卡戎</ano> 的嘉贝莉娜，如今已是伤痕累累。她也已经察觉到，自己正是残星会此行特别针对的目标。
卡戎以高傲之姿对嘉贝莉娜发出“质问”与“邀请”：在吞噬吸收了如此之多的残象之后，她早已越过了“人类的界限”，残星会……才应是她的容身之所。
而对于这样一个与人类划清了界限的存在，嘉贝莉娜则是选择以嘲讽回应。言谈间，嘉贝莉娜不断发起攻势，但她的子弹均被隔空拦下，火焰无法触及敌人分毫，体内的残象力量也被对方扯出……尽管如此，嘉贝莉娜仍选择再度起身，向卡戎发起了最后的冲锋。
对此，卡戎也不再选择留手，幻化出的影爪径直贯穿了她的胸膛……
而此时，嘉贝莉娜的脸上，却浮现出了一丝“阴谋得逞”的笑容……","By the shores of Styx Lake, Galbrena faces <ano=Grand Architect>Kharon</ano> alone, bloodied and spent. She realizes she has been the Fractsidus's true target all along.

Condescendingly, Kharon questions and tempts her: After devouring so many Tacet Discords, she has long since crossed the threshold of what it means to be human. The Fractsidus is where she can belong and find purpose.

Galbrena answers with scorn. She strikes again, but her bullets freeze in mid-air, her flames cannot reach him, and the Tacet Discords within her are torn away. Even so, she gets back up and charges in a final, desperate strike.

This time, Kharon does not hold back. A shadowed claw pierces straight through her chest. Galbrena only smiles faintly, as if this was her plan all along.","Bên bờ Hồ U Minh, Galbrena một mình chặn hậu đối đầu <ano=Hội trưởng Tàn Tinh Hội>Kharon</ano>, giờ đã đầy thương tích. Cô cũng nhận ra rằng, mình chính là mục tiêu mà Tàn Tinh Hội nhắm đến trong chuyến này.
Kharon với vẻ cao ngạo ""chất vấn"" và ""mời gọi"" Galbrena: sau khi nuốt và hấp thụ nhiều Tàn Tượng đến vậy, cô đã vượt qua ""giới hạn con người"" từ lâu, Tàn Tinh Hội... mới là nơi cô thuộc về.
Trước một kẻ tự tách mình khỏi loài người như vậy, Galbrena chọn đáp lại bằng lời chế nhạo. Giữa lời qua tiếng lại, Galbrena liên tục tấn công, nhưng đạn đều bị chặn giữa không trung, lửa không chạm nổi đối thủ, sức mạnh Tàn Tượng trong người cũng bị rút ra... Dù vậy, Galbrena vẫn chọn đứng dậy lần nữa, phát động đợt xung phong cuối cùng về phía Kharon.
Lần này, Kharon không còn nương tay, móng vuốt ảo hóa đâm thẳng xuyên ngực cô...
Nhưng lúc này, trên gương mặt Galbrena lại hiện lên nụ cười ""mưu kế đã thành""..."
lang_multi_text.db,MultiText,Main_Rinascita_2_12_53_4,我知道你所拥有的能力。为了不让你干预剧本原有的编排，我必须让你，在此止步了。,"I know the power you wield. Left unchecked, it unravels the fabric of our play. And so, I must still your steps here.","Ta biết năng lực ngươi sở hữu. Để ngươi không can thiệp vào kịch bản đã sắp đặt, ta phải để ngươi dừng bước ở đây."
lang_multi_text.db,MultiText,Main_Rinascita_2_12_53_5,但我必须承认，嘉贝莉娜，你的成长速度远超我的想象。你是吞食了多少残象，才成长到如今这个程度？,"Yet I confess, Galbrena... Your growth hath far outstripped what I foresaw.
How many Tacet Discords have you devoured to stand here now?","Nhưng ta phải thừa nhận, Galbrena, tốc độ trưởng thành của ngươi vượt xa tưởng tượng của ta. Ngươi đã nuốt bao nhiêu Tàn Tượng, mới mạnh đến mức này?"
lang_multi_text.db,MultiText,Main_Rinascita_2_12_53_6,……我可不记得，自己这一生中吃过多少龙衔果了。,...Heh. Do you count how many gemberries you've eaten in your life?,...Ta có nhớ cả đời mình đã ăn bao nhiêu quả Long Hàm đâu.
lang_multi_text.db,MultiText,Main_Rinascita_2_12_53_7,不过作为一名“长生者”，以你所积累的岁月与见识，你不妨猜得更大胆一些。,"For one with a lifespan like yours, surely you know more than most. So go on. Take a guess.","Nhưng với tư cách ""trường sinh giả"", với bao nhiêu năm tháng và kiến thức tích lũy, ngươi cứ đoán táo bạo hơn đi."
lang_multi_text.db,MultiText,Main_Rinascita_2_12_53_8,只是为了……去拯救更多的，与自己毫无关联的人？,You risked all to save those who share no bond with you.,Chỉ vì... muốn cứu thêm nhiều người chẳng liên quan gì đến mình sao?
lang_multi_text.db,MultiText,Main_Rinascita_2_12_53_9,你可以选择去拯救他们，但唯独不该使用这份“异于人类的力量”去拯救。,"To choose to protect is one thing, but to do so wielding power not born of mankind... That, you should never have done.","Ngươi có thể chọn cứu họ, nhưng không nên dùng thứ ""sức mạnh khác biệt với con người"" này để cứu."
lang_multi_text.db,MultiText,Main_Rinascita_2_12_54_1,这些血液……差不多足够了。,…This blood. It should be enough.,Máu này... đủ rồi.
lang_multi_text.db,MultiText,Main_Rinascita_2_12_54_2,我的火焰，原本无法触及你分毫。,My flames could never reach you before.,"Ngọn lửa của ta, vốn không thể chạm đến ngươi."
lang_multi_text.db,MultiText,Main_Rinascita_2_12_54_3,但现在，你该为自己的傲慢付出代价了。,But now… it's time you paid for your arrogance.,"Nhưng giờ, đã đến lúc ngươi trả giá cho sự kiêu ngạo."
lang_multi_text.db,MultiText,Main_Rinascita_2_12_54_4,狩猎，开始了。,The hunt begins.,Cuộc săn... bắt đầu.
lang_multi_text.db,MultiText,Main_Rinascita_2_12_54_5,你的火焰……净化了那些被污染的频率？,Your flames… they purified the corrupted frequencies?,Ngọn lửa của ngươi... đã tịnh hóa những tần số bị ô nhiễm?
lang_multi_text.db,MultiText,Main_Rinascita_2_12_54_6,正中靶心。,Bullseye.,Trúng đích.
lang_multi_text.db,MultiText,Main_Rinascita_2_12_54_7,愿以此火，照亮你们的归途。,May the flames light your way home.,Nguyện ngọn lửa này soi sáng đường về cho các ngươi.
lang_multi_text.db,MultiText,Main_Rinascita_2_12_55_1,真是令我意外……,You never cease to surprise...,Thật bất ngờ...
lang_multi_text.db,MultiText,Main_Rinascita_2_12_55_10,左边可没有路。,There is no path on the left.,Bên trái không có đường đâu.
lang_multi_text.db,MultiText,Main_Rinascita_2_12_55_11,所谓道路……都是由人自己创造的。,Then I'll carve one out myself.,Đường đi... là do con người tự tạo ra.
lang_multi_text.db,MultiText,Main_Rinascita_2_12_55_12,还是说，你也误会了什么？未必是因为你们，我才变得强大……而是因为我足够强大，才驯服了你们。,Or did you misunderstand? I didn't become strong because of any of you... I was strong. That's how I broke you.,"Hay là ngươi cũng hiểu lầm rồi? Chưa chắc nhờ có các ngươi mà ta trở nên mạnh mẽ... mà chính vì ta đủ mạnh, nên mới thuần phục được các ngươi."
lang_multi_text.db,MultiText,Main_Rinascita_2_12_55_13,"卡戎的影爪刺穿了嘉贝莉娜的身躯，但这也正是她等待已久的反攻之时……她的血液溅顺势流淌在卡戎的影爪之上，瞬间将对方引燃——这般经由地狱焚烧后的骨血，早已化作了更加炽热不熄的火焰。而随着卡戎的“断臂求存”，猎人与猎物的身份也瞬间反转。
战斗之时，嘉贝莉娜的火焰净化了冥湖中被黑潮污染的频率，无数人类将“灵魂”凝聚为“溯海之鲸”的形态，协助嘉贝莉娜将卡戎拖入了燃烧的冥湖之中。
在向那些人类灵魂告别后，嘉贝莉娜迅速赶向所在漂泊者的方向，前去与之汇合。","Kharon's shadowed claw pierces through Galbrena, but this is what she had been waiting for. Her blood, tempered in the depths of this hell, splatters on Kharon and sets him ablaze. Forced to sever his arm to survive, the predator becomes the prey.

As they clash, Galbrena's flames purify the lake's corrupted frequencies. The souls of the dead gather into the form of Cetus the Tidebreaker and drag Kharon into the burning depths.

After bidding farewell to those freed souls, Galbrena turns and rushes to find you once more.","Móng vuốt bóng tối của Kharon xuyên thủng thân thể Galbrena, nhưng đây chính là khoảnh khắc phản công mà cô chờ đợi bấy lâu... Máu cô bắn tung lên móng vuốt bóng tối của hắn, lập tức bốc cháy dữ dội - xương thịt đã qua lửa địa ngục từ lâu đã hóa thành ngọn lửa rực cháy không bao giờ tắt. Khi Kharon buộc phải chặt đứt cánh tay để thoát thân, thợ săn và con mồi lập tức hoán đổi vị trí.
Trong trận chiến, ngọn lửa của Galbrena tịnh hóa những tần số bị Hắc Triều ô nhiễm trong hồ Minh. Vô số linh hồn con người ngưng tụ thành hình dạng ""Cá Voi Ngược Dòng"", hỗ trợ Galbrena kéo Kharon xuống hồ Minh đang bốc cháy.
Sau khi từ biệt những linh hồn ấy, Galbrena nhanh chóng lao về phía Lữ Khách để hội hợp."
lang_multi_text.db,MultiText,Main_Rinascita_2_12_55_2,我以为你足够了解我呢？好猎人，总要学会利用周围的环境，将它改造成自己的猎场。,And here I thought you knew me well. A good hunter turns nature to her advantage.,"Ta tưởng ngươi đủ hiểu ta rồi chứ? Thợ săn giỏi phải biết tận dụng môi trường xung quanh, biến nó thành bãi săn của mình."
lang_multi_text.db,MultiText,Main_Rinascita_2_12_55_3,我指的不是这个。没想到，那些魂灵竟然愿意听你差遣，将频率聚合为“溯海之鲸”的形态来帮助你……,"I wasn't referring to that. I was surprised to see the spirits rise at your command, forming as Cetus the Tidebreaker...","Ta không nói chuyện đó. Không ngờ, những linh hồn ấy lại chịu nghe lệnh ngươi, ngưng tụ tần số thành hình dạng ""Cá Voi Ngược Dòng"" để giúp ngươi..."
