db_file,table_name,id,zh,en,vi
lang_multi_text.db,MultiText,ConsumptiveTaskTabTitle1,活跃任务,Activity Tasks,Nhiệm vụ hoạt động
lang_multi_text.db,MultiText,ConsumptiveTaskTabTitle2,角色唤取任务,Resonator Convene,Triệu hồi nhân vật
lang_multi_text.db,MultiText,ConsumptiveTaskTabTitle3,武器唤取任务,Weapon Convene,Triệu hồi vũ khí
lang_multi_text.db,MultiText,ConsumptiveTaskTabTitle4,常驻唤取任务,Standard Convene,Triệu hồi thường trú
lang_multi_text.db,MultiText,ConsumptiveTaskTitle1,在活动期间首次登录游戏,Log in to the game during the event for the first time.,Đăng nhập game lần đầu trong thời gian sự kiện
lang_multi_text.db,MultiText,ConsumptiveTaskTitle10,累计进行10次角色活动唤取,Convene Resonator 10 times in total.,Tích lũy 10 lần triệu hồi nhân vật sự kiện
lang_multi_text.db,MultiText,ConsumptiveTaskTitle11,累计进行20次角色活动唤取,Convene Resonator 20 times in total.,Tích lũy 20 lần triệu hồi nhân vật sự kiện
lang_multi_text.db,MultiText,ConsumptiveTaskTitle12,累计进行60次角色活动唤取,Convene Resonator 60 times in total.,Tích lũy 60 lần triệu hồi nhân vật sự kiện
lang_multi_text.db,MultiText,ConsumptiveTaskTitle13,累计进行90次角色活动唤取,Convene Resonator 90 times in total.,Tích lũy 90 lần triệu hồi nhân vật sự kiện
lang_multi_text.db,MultiText,ConsumptiveTaskTitle14,进行40次角色活动唤取（可重复完成）,Convene Resonator 40 times (repeatable).,Thực hiện 40 lần triệu hồi nhân vật sự kiện (có thể lặp lại)
lang_multi_text.db,MultiText,ConsumptiveTaskTitle15,累计进行10次武器活动唤取,Convene Weapon 10 times in total.,Tích lũy 10 lần triệu hồi vũ khí sự kiện
lang_multi_text.db,MultiText,ConsumptiveTaskTitle16,累计进行20次武器活动唤取,Convene Weapon 20 times in total.,Tích lũy 20 lần triệu hồi vũ khí sự kiện
lang_multi_text.db,MultiText,ConsumptiveTaskTitle17,累计进行60次武器活动唤取,Convene Weapon 60 times in total.,Tích lũy 60 lần triệu hồi vũ khí sự kiện
lang_multi_text.db,MultiText,ConsumptiveTaskTitle18,累计进行90次武器活动唤取,Convene Weapon 90 times in total.,Tích lũy 90 lần triệu hồi vũ khí sự kiện
lang_multi_text.db,MultiText,ConsumptiveTaskTitle19,进行40次武器活动唤取（可重复完成）,Convene Weapon 40 times (repeatable).,Thực hiện 40 lần triệu hồi vũ khí sự kiện (có thể lặp lại)
lang_multi_text.db,MultiText,ConsumptiveTaskTitle2,在活动「团团团团转」中通关咘咘魔王城第5层,"Clear Abbowser Castle Level 5 in ""Cube, Cubic n Cubie.""","Vượt qua tầng 5 Lâu Đài Ma Vương Abbowser trong sự kiện ""Cube, Cubic n Cubie"""
lang_multi_text.db,MultiText,ConsumptiveTaskTitle20,累计消耗10个唤声涡纹,Consume 10 Lustrous Tides in total.,Tích lũy tiêu hao 10 Lustrous Tide
lang_multi_text.db,MultiText,ConsumptiveTaskTitle3,在活动「团团团团转」中通关咘咘魔王城第10层,"Clear Abbowser Castle Level 10 in ""Cube, Cubic n Cubie.""","Vượt qua tầng 10 Lâu Đài Ma Vương Abbowser trong sự kiện ""Cube, Cubic n Cubie"""
lang_multi_text.db,MultiText,ConsumptiveTaskTitle4,在活动「小团快跑·热身赛」中完成三轮热身,"Complete three rounds in ""Cubie Derby: Warmup.""","Hoàn thành 3 vòng khởi động trong sự kiện ""Cubie Derby: Warmup"""
lang_multi_text.db,MultiText,ConsumptiveTaskTitle5,在活动「小团快跑」中累计应援并前往活动界面结算2场比赛,"Support a Cube and confirm the result of  2 ""Cubie Derby"" matches in the event page","Cổ vũ và xem kết quả 2 trận đấu trong trang sự kiện ""Cubie Derby"""
lang_multi_text.db,MultiText,ConsumptiveTaskTitle6,在活动「小团快跑」中累计应援并前往活动界面结算4场比赛,"Support a Cube and confirm the result of 2 ""Cubie Derby"" matches in the event page","Cổ vũ và xem kết quả 4 trận đấu trong trang sự kiện ""Cubie Derby"""
lang_multi_text.db,MultiText,ConsumptiveTaskTitle7,在活动「浸梦海床」中通关「2」号影厅「新乘霄客栈」,"Complete Theater 2 ""Mt. Firmament Inn"" in ""Dreaming Deep.""","Hoàn thành phòng chiếu số 2 ""Mt. Firmament Inn"" trong sự kiện ""Dreaming Deep"""
lang_multi_text.db,MultiText,ConsumptiveTaskTitle8,在活动「浸梦海床」中通关「3」号影厅「边缘测量者」,"Complete Theater 3 ""Psyche Pass: The Outlier"" in ""Dreaming Deep.""","Hoàn thành phòng chiếu số 3 ""Psyche Pass: The Outlier"" trong sự kiện ""Dreaming Deep"""
lang_multi_text.db,MultiText,ConsumptiveTaskTitle9,在活动任务「唯你的长夏永不凋落」中完成「终章·不同的抉择」,"Complete ""Final Chapter: Diverging Paths"" in ""Your Summer Will Never Wither.""","Hoàn thành ""Chương Cuối: Lựa Chọn Khác Biệt"" trong nhiệm vụ sự kiện ""Your Summer Will Never Wither"""
lang_multi_text.db,MultiText,Controler_Notconnect,未连接控制器,Controller not connected,Chưa kết nối tay cầm
lang_multi_text.db,MultiText,Controler_Notconnect_tips,控制器未连接切换失败,Controller not connected. Switch failed.,"Tay cầm chưa kết nối, chuyển đổi thất bại"
lang_multi_text.db,MultiText,CookLevel_1_AttributesDescription,授予刚拿起菜刀的厨界新人的称号，是每个厨师的起点与初心。,A title awarded to those who pick up the kitchen knife and start the journey as a cook. A symbol of every cook's original wish.,"Danh hiệu dành cho người mới bước chân vào nghề bếp, là khởi điểm và sơ tâm của mọi đầu bếp."
lang_multi_text.db,MultiText,CookLevel_1_Name,烹调学徒,Apprentice,Học Việc Nấu Ăn
lang_multi_text.db,MultiText,CookLevel_2_AttributesDescription,给予掌握了基础技能的厨师的称号，证明着已经走在了漫长的厨师之路上。,A title awarded to those chefs who mastered the basic cooking skills. Proof of a strider on the long path of cookery.,"Danh hiệu dành cho đầu bếp đã nắm vững kỹ năng cơ bản, chứng minh đã bước đi trên con đường dài của nghề bếp."
lang_multi_text.db,MultiText,CookLevel_2_Name,烹调助理,Assistant Chef,Trợ Lý Bếp
lang_multi_text.db,MultiText,CookLevel_3_AttributesDescription,给予已经能独当一面的厨师的称号，是很多人一生的顶点。,A title awarded to those chefs who can already work without instructions. Many only make it here.,"Danh hiệu dành cho đầu bếp đã có thể tự mình đảm đương, là đỉnh cao cả đời của nhiều người."
lang_multi_text.db,MultiText,CookLevel_3_Name,副厨,Sous Chef,Phó Bếp
lang_multi_text.db,MultiText,CookLevel_4_AttributesDescription,颁发给在厨艺与厨道均已臻于至境的优秀厨师的称号。,A title awarded to master chefs who deserve their place in the hall of fame for both their art and their character.,Danh hiệu dành cho đầu bếp xuất sắc đã đạt đến cảnh giới tột cùng cả về kỹ nghệ lẫn đạo nấu ăn.
lang_multi_text.db,MultiText,CookLevel_4_Name,厨师长,Head Chef,Bếp Trưởng
lang_multi_text.db,MultiText,CookLevel_5_AttributesDescription,仅大师享有的特别称号。大匠运斤，勺中不止酸甜苦辣，锅内更有人间百味。,"A rare title awarded to limited chefs only, whose works reflect not only the best of flavors, but the feelings of life.","Danh hiệu đặc biệt chỉ dành riêng cho bậc đại sư. Bàn tay tài hoa, trong muỗng canh không chỉ có chua ngọt đắng cay, mà còn chứa đựng trăm vị nhân gian."
lang_multi_text.db,MultiText,CookLevel_5_Name,特级厨师,Top Chef,Đầu Bếp Đặc Cấp
lang_multi_text.db,MultiText,CookProcessMsg_10_Description,豆腐需要将两份豆子磨浆后，利用两份盐进行凝固定型方才能有弹性。,"To make Tofu elastic, grind 2 servings of beans and then add 2 servings of salt for coagulation.",Đậu phụ cần xay nhuyễn hai phần đậu thành nước rồi dùng hai phần muối để đông đặc tạo hình mới có độ đàn hồi.
lang_multi_text.db,MultiText,CookProcessMsg_10_Introduce,豆腐需要将两份豆子磨浆后，利用两份盐进行凝固定型方才能有弹性。,"To make Tofu elastic, grind 2 servings of beans and then add 2 servings of salt for coagulation.",Đậu phụ cần xay nhuyễn hai phần đậu thành nước rồi dùng hai phần muối để đông đặc tạo hình mới có độ đàn hồi.
lang_multi_text.db,MultiText,CookProcessMsg_1_Description,今州的攀花据说是极优秀的厨师，说不定能提供关于清汤的信息。,It is said that Panhua of Jinzhou is an excellent cook. Maybe she is willing to share about how to make Clear Soup.,"Phan Hoa ở Kim Châu nghe nói là đầu bếp cực giỏi, biết đâu có thể cung cấp thông tin về canh trong?"
lang_multi_text.db,MultiText,CookProcessMsg_1_Introduce,攀花提到，清汤的主要调味料是两份盐。,"Panhua says, 2 servings of Salt are needed to clear the impurities in the Clear Soup.",Phan Hoa nói rằng gia vị chính của canh trong là hai phần muối.
lang_multi_text.db,MultiText,CookProcessMsg_2_Description,今州的马和听说对清汤的调制有着独特的理解，不如去打听一下？,Mahe of Jinzhou is believed to have a unique understanding of making Clear Soup. Why not ask him about it?,"Mã Hòa ở Kim Châu nghe nói có hiểu biết riêng về cách chế biến canh trong, sao không đi hỏi thử nhỉ?"
lang_multi_text.db,MultiText,CookProcessMsg_2_Introduce,马和说两份花蕈是清汤中必不可少的配料。,"Mahe says, 2 servings of Edodes are indispensable ingredients for Clear Soup.",Mã Hòa nói rằng hai phần nấm hoa là nguyên liệu không thể thiếu trong canh trong.
lang_multi_text.db,MultiText,CookProcessMsg_3_Description,今州的黎叔听说对清汤的调制有着独特的理解，不如去打听一下？,Uncle Li of Jinzhou is believed to have a unique understanding of making Clear Soup. Why not ask him about it?,"Chú Lê ở Kim Châu nghe nói có hiểu biết riêng về cách chế biến canh trong, sao không đi hỏi thử nhỉ?"
lang_multi_text.db,MultiText,CookProcessMsg_3_Introduce,黎叔提到一份糖可以提升清汤的风味。,"Uncle Li says, 1 serving of Sugar can add extra flavor to the Clear Soup.",Chú Lê nói rằng một phần đường có thể nâng cao hương vị canh trong.
lang_multi_text.db,MultiText,CookProcessMsg_4_Description,今州的蔻蔻听说对清汤的调制有着独特的理解，不如去打听一下？,Koko of Jinzhou is believed to have a unique understanding of making Clear Soup. Why not ask her about it?,"Khấu Khấu ở Kim Châu nghe nói có hiểu biết riêng về cách chế biến canh trong, sao không đi hỏi thử nhỉ?"
lang_multi_text.db,MultiText,CookProcessMsg_4_Introduce,蔻蔻认为，清汤需要一份禽肉扫汤。,Koko believes that the main seasoning for the Clear Soup is 1 serving of Fowl Meat.,Khấu Khấu cho rằng canh trong cần một phần thịt gia cầm để lọc nước dùng.
lang_multi_text.db,MultiText,CookProcessMsg_5_Description,今州的伟叔听说对卤汁的调制有着独特的理解，不如去打听一下？,Uncle Wei in Jinzhou is believed to have a unique understanding of making Braising Sauce. Why not ask him about it?,"Chú Vĩ ở Kim Châu nghe nói có hiểu biết riêng về cách chế biến nước lô, sao không đi hỏi thử nhỉ?"
lang_multi_text.db,MultiText,CookProcessMsg_5_Introduce,伟叔提到，卤汁的是卤煮禽肉的汤汁，因此一份禽肉必不可少。,"Uncle Wei says, Braising Sauce is made by stewing Fowl Meat. Therefore, 2 servings of Fowl Meat are indispensable.","Chú Vĩ nói rằng nước lô là nước ninh từ thịt gia cầm, nên một phần thịt gia cầm là không thể thiếu."
lang_multi_text.db,MultiText,CookProcessMsg_6_Description,今州的甘雪听说对卤汁的调制有着独特的理解，不如去打听一下？,Gan'xue of Jinzhou is believed to have a unique understanding of making Braising Sauce. Why not ask her about it?,"Cam Tuyết ở Kim Châu nghe nói có hiểu biết riêng về cách chế biến nước lô, sao không đi hỏi thử nhỉ?"
lang_multi_text.db,MultiText,CookProcessMsg_6_Introduce,甘雪说，她推荐加两份糖来为卤汁着色。,Gan'xue recommends adding 1 serving of Sugar to give the Braising Sauce an appetizing color.,Cam Tuyết nói rằng cô ấy khuyên thêm hai phần đường để tạo màu cho nước lô.
lang_multi_text.db,MultiText,CookProcessMsg_7_Description,今州的陈皮听说对卤汁的调制有着独特的理解，不如去打听一下？,Chenpi of Jinzhou is believed to have a unique understanding of making Braising Sauce. Why not ask him about it?,"Trần Bì ở Kim Châu nghe nói có hiểu biết riêng về cách chế biến nước lô, sao không đi hỏi thử nhỉ?"
lang_multi_text.db,MultiText,CookProcessMsg_7_Introduce,陈皮讲到卤汁的风味需要用一份盐来提升。,"Chenpi says, adding 1 serving of Salt is necessary to give extra flavor to the Braising Sauce.",Trần Bì nói rằng hương vị nước lô cần một phần muối để nâng cao.
lang_multi_text.db,MultiText,CookProcessMsg_8_Description,攀花说火锅底料有这样一句口诀：两油，两辣，一盐，一禽肉来提鲜。,"Panhua says she has a trick for making the Hot Pot Base: 2 Oil, 2 Chili Pepper, 1 Salt, and 1 Fowl Meat to increase the flavor.","Phan Hoa nói về nước lẩu có câu quyết như thế này: hai dầu, hai ớt, một muối, một thịt gia cầm để tăng vị."
lang_multi_text.db,MultiText,CookProcessMsg_8_Introduce,攀花说火锅底料有这样一句口诀：两油，两辣，一盐，一禽肉来提鲜。,"Panhua says she has a trick for making the Hot Pot Base: 2 Oil, 2 Chili Pepper, 1 Salt, and 1 Fowl Meat to increase the flavor.","Phan Hoa nói về nước lẩu có câu quyết như thế này: hai dầu, hai ớt, một muối, một thịt gia cầm để tăng vị."
lang_multi_text.db,MultiText,CookProcessMsg_9_Description,糖醋汁需要一份醋和两份糖煸炒后，淋上一份热油锁住风味。,"To maintain the flavor of Sweet & Sour Sauce, stir-fry 1 serving of Vinegar and 2 servings of Sugar and then pour 1 serving of hot Oil to lock in the flavor.","Nước chua ngọt cần xào một phần giấm và hai phần đường, sau đó rưới một phần dầu nóng để giữ hương vị."
lang_multi_text.db,MultiText,CookProcessMsg_9_Introduce,糖醋汁需要一份醋和两份糖煸炒后，淋上一份热油锁住风味。,"To maintain the flavor of Sweet & Sour Sauce, stir-fry 1 serving of Vinegar and 2 servings of Sugar and then pour 1 serving of hot Oil to lock in the flavor.","Nước chua ngọt cần xào một phần giấm và hai phần đường, sau đó rưới một phần dầu nóng để giữ hương vị."
lang_multi_text.db,MultiText,CorniceMeetingMarkPanelCurrent,当前：,Current:,Hiện tại:
lang_multi_text.db,MultiText,CorniceMeetingMarkPanelScore,收集进度：,Collection Progress:,Tiến độ thu thập:
lang_multi_text.db,MultiText,CorniceMeetingSettleSuccess,挑战完成,Challenge Complete,Hoàn thành thử thách
lang_multi_text.db,MultiText,Cost1,Cost1,COST 1,COST 1
lang_multi_text.db,MultiText,Cost3,Cost3,COST 3,COST 3
lang_multi_text.db,MultiText,Cost4,Cost4,COST 4,COST 4
lang_multi_text.db,MultiText,CostStamina,结晶波片消耗,Waveplate Consumption,Tiêu hao Phiến Sóng Kết Tinh
lang_multi_text.db,MultiText,CountryExploreProgress,{0}探索度：{1}%,{0} Exploration Progress: {1}%,Tiến độ khám phá {0}: {1}%
lang_multi_text.db,MultiText,Country_0_Title,随机国家,Random Nation,Quốc gia ngẫu nhiên
lang_multi_text.db,MultiText,Country_1_Desc,"瑝珑建国至今已千年有余，漫长的历史让这个国家散发着悠久而浓厚的文化积淀，悲鸣虽然打断了瑝珑的发展，但植根于人们心中的抗争与传承精神还留存于世。
复苏时代，瑝珑依靠黑石工业实现了快速发展，源源不断的黑石订单让瑝珑成为当之无愧的经济之国。","Huanglong is a nation of thousands of years. Long history forged a special and traditional culture for this nation. Although the Lament fracture it's development, but its people are still fighting and trying their best to inherit whatever the nation remains.  In the age of Resurgence. Huanglong's Tacetite Industry brought life again to this country. With the endless order for the Tacetite, Huanglong's economy has ever stopped booming.","Hoàng Long lập quốc đã hơn ngàn năm, lịch sử lâu dài khiến đất nước này tỏa ra nền văn hóa sâu dày và đậm đà. Bi Minh tuy đã gián đoạn sự phát triển của Hoàng Long, nhưng tinh thần đấu tranh và truyền thừa ăn sâu trong lòng người vẫn còn lưu giữ đến ngày nay.
Thời đại phục hưng, Hoàng Long nhờ vào công nghiệp Hắc Thạch đã đạt được bước phát triển vượt bậc, những đơn hàng Hắc Thạch không ngừng đổ về khiến Hoàng Long trở thành quốc gia kinh tế xứng đáng."
lang_multi_text.db,MultiText,Country_1_Title,瑝珑,Huanglong,Hoàng Long
lang_multi_text.db,MultiText,Country_2_Title,黑海岸,The Black Shores,Bờ Biển Đen
lang_multi_text.db,MultiText,Country_3_Title,黎那汐塔,Rinascita,Rinascita
lang_multi_text.db,MultiText,Country_4_Title,罗伊冰原,Roya Frostlands,Roya Frostlands
lang_multi_text.db,MultiText,CreatingAccount,账号生成中...,Setting up your account...,Đang tạo tài khoản...
lang_multi_text.db,MultiText,CrossLineEasyTitle,简单,Easy,Dễ
lang_multi_text.db,MultiText,CrossLineHideTitle,挑战,Expert,Thử thách
lang_multi_text.db,MultiText,CrossLineHighTitle,挑战,Expert,Thử thách
lang_multi_text.db,MultiText,CrossLineNormalTitle,困难,Hard,Khó
lang_multi_text.db,MultiText,CrossLine_Fail_Tips,次数耗尽，解析已还原,All moves used. Challenge has been reset.,"Đã hết lượt, tiến trình đã được đặt lại"
lang_multi_text.db,MultiText,CrossLine_Level_01_Desc01,树林摇曳，光芒洒落。静谧的林中，兽影隐现。,"The forest sways, making way for the peeking light. Somewhere in the quietness, the beasts stir.","Rừng cây lay động, ánh sáng rải rác. Giữa khu rừng tĩnh lặng, bóng thú ẩn hiện."
lang_multi_text.db,MultiText,CrossLine_Level_01_Desc02,树林摇曳，光芒洒落。静谧的林中，兽影隐现。,"The forest sways, making way for the peeking light. Somewhere in the quietness, the beasts stir.","Rừng cây lay động, ánh sáng rải rác. Giữa khu rừng tĩnh lặng, bóng thú ẩn hiện."
lang_multi_text.db,MultiText,CrossLine_Level_01_Desc03,树林摇曳，光芒洒落。静谧的林中，兽影隐现。,"The forest sways, making way for the peeking light. Somewhere in the quietness, the beasts stir.","Rừng cây lay động, ánh sáng rải rác. Giữa khu rừng tĩnh lặng, bóng thú ẩn hiện."
lang_multi_text.db,MultiText,CrossLine_Level_01_Easy,初入密林·简单,Into the Thicket: Easy,Bước Vào Rừng Rậm - Dễ
lang_multi_text.db,MultiText,CrossLine_Level_01_Title01,初入密林·困难,Into the Thicket: Hard,Bước Vào Rừng Rậm - Khó
lang_multi_text.db,MultiText,CrossLine_Level_01_Title02,初入密林·挑战,Into the Thicket: Expert,Bước Vào Rừng Rậm - Thử Thách
lang_multi_text.db,MultiText,CrossLine_Level_02_Desc01,时间无情地从沙漏中坠落……最后一粒沙落下之前，我们能否找到答案？,Time trickles down in the hourglass… Can we find the answer before the last grain falls?,"Thời gian lạnh lùng rơi xuống từ chiếc đồng hồ cát... Trước khi hạt cát cuối cùng rơi, liệu ta có tìm ra đáp án?"
lang_multi_text.db,MultiText,CrossLine_Level_02_Desc02,时间无情地从沙漏中坠落……最后一粒沙落下之前，我们能否找到答案？,Time trickles down in the hourglass… Can we find the answer before the last grain falls?,"Thời gian lạnh lùng rơi xuống từ chiếc đồng hồ cát... Trước khi hạt cát cuối cùng rơi, liệu ta có tìm ra đáp án?"
lang_multi_text.db,MultiText,CrossLine_Level_02_Desc03,时间无情地从沙漏中坠落……最后一粒沙落下之前，我们能否找到答案？,Time trickles down in the hourglass… Can we find the answer before the last grain falls?,"Thời gian lạnh lùng rơi xuống từ chiếc đồng hồ cát... Trước khi hạt cát cuối cùng rơi, liệu ta có tìm ra đáp án?"
lang_multi_text.db,MultiText,CrossLine_Level_02_Easy,静候时机·简单,Waiting Game: Easy,Chờ Đợi Thời Cơ - Dễ
lang_multi_text.db,MultiText,CrossLine_Level_02_Title01,静候时机·困难,Waiting Game: Hard,Chờ Thời Cơ - Khó
lang_multi_text.db,MultiText,CrossLine_Level_02_Title02,静候时机·挑战,Waiting Game: Expert,Chờ Thời Cơ - Thử Thách
lang_multi_text.db,MultiText,CrossLine_Level_03_Desc01,猎物与猎人，毫无预兆地打了照面。,"Without warning, the prey and the hunter come face to face.","Con mồi và thợ săn, bất ngờ chạm mặt nhau."
lang_multi_text.db,MultiText,CrossLine_Level_03_Desc02,猎物与猎人，毫无预兆地打了照面。,"Without warning, the prey and the hunter come face to face.","Con mồi và thợ săn, bất ngờ chạm mặt nhau."
lang_multi_text.db,MultiText,CrossLine_Level_03_Desc03,猎物与猎人，毫无预兆地打了照面。,"Without warning, the prey and the hunter come face to face.","Con mồi và thợ săn, bất ngờ chạm mặt nhau."
lang_multi_text.db,MultiText,CrossLine_Level_03_Easy,狭路相逢·简单,Face to Face: Easy,Đường Hẹp Gặp Nhau - Dễ
lang_multi_text.db,MultiText,CrossLine_Level_03_Title01,狭路相逢·困难,Face to Face: Hard,Đường Hẹp Gặp Nhau - Khó
lang_multi_text.db,MultiText,CrossLine_Level_03_Title02,狭路相逢·挑战,Face to Face: Expert,Đường Hẹp Gặp Nhau - Thử Thách
lang_multi_text.db,MultiText,CrossLine_Level_04_Desc01,包围圈向着猎物收紧，一切似乎已成定局。,The circle tightens. The outcome seems decided.,"Vòng vây siết chặt quanh con mồi, mọi thứ dường như đã an bài."
lang_multi_text.db,MultiText,CrossLine_Level_04_Desc02,包围圈向着猎物收紧，一切似乎已成定局。,The circle tightens. The outcome seems decided.,"Vòng vây siết chặt quanh con mồi, mọi thứ dường như đã an bài."
lang_multi_text.db,MultiText,CrossLine_Level_04_Desc03,包围圈向着猎物收紧，一切似乎已成定局。,The circle tightens. The outcome seems decided.,"Vòng vây siết chặt quanh con mồi, mọi thứ dường như đã an bài."
lang_multi_text.db,MultiText,CrossLine_Level_04_Easy,包围圈·简单,Encirclement: Easy,Vòng Vây - Dễ
lang_multi_text.db,MultiText,CrossLine_Level_04_Title01,包围圈·困难,Encirclement: Hard,Vòng Vây - Khó
lang_multi_text.db,MultiText,CrossLine_Level_04_Title02,包围圈·挑战,Encirclement: Expert,Vòng Vây - Thử Thách
