db_file,table_name,id,zh,en,vi
lang_multi_text.db,MultiText,Character_Zani_17_2,{PlayerName}？时间还没到，不打算多休息一会儿吗？,{PlayerName}? It's not time yet. Aren't you going to rest a little longer?,"{PlayerName}? Chưa đến giờ mà, không nghỉ thêm chút nữa sao?"
lang_multi_text.db,MultiText,Character_Zani_17_20,我投降……你的直觉很敏锐，和你待久了容易没有秘密啊……,"Alright, alright... You've got sharp instincts. Spending too much time with you, and I'm running out of secrets.","Tôi chịu thua... Trực giác của cậu nhạy lắm, ở bên cậu lâu thì chẳng còn bí mật gì nữa..."
lang_multi_text.db,MultiText,Character_Zani_17_21,其实当年「塔洛斯」还有那些「黑街」高层都是被我绑过去的。,I was the one who delivered Talos and those Black Alley leaders to The Order.,"Thật ra năm đó, Talos cùng mấy tay lãnh đạo ""Hắc Nhai"" đều do tôi trói đem nộp cho Tu Hội."
lang_multi_text.db,MultiText,Character_Zani_17_22,啊？,What?!,Hả?
lang_multi_text.db,MultiText,Character_Zani_17_23,嗯……我早就知道了。,I knew it all along.,Ừm... Tôi biết từ lâu rồi.
lang_multi_text.db,MultiText,Character_Zani_17_24,「焰光的夜行者」……黎那汐塔是人手一个外号吗？,The Blazing Nightwalker... So is it the Rinascitan tradition to have a moniker?,"""Dạ Hành Giả của Viêm Quang""... Rinascita ai cũng có biệt danh hết vậy sao?"
lang_multi_text.db,MultiText,Character_Zani_17_25,嗯，我就是那个……「焰光的夜行者」，真不想重复这个外号啊。,"Yeah, that's me... the Blazing Nightwalker. But honestly? I really don't want to keep repeating that name.","Ừ, tôi chính là... ""Dạ Hành Giả của Viêm Quang"" đó. Thật sự không muốn nhắc lại cái biệt danh này chút nào."
lang_multi_text.db,MultiText,Character_Zani_17_26,这种事按照传统，不该是最后才揭露吗？,"By tradition, shouldn't you have revealed your true identity at the end?","Chuyện này theo truyền thống, chẳng phải nên để đến cuối mới tiết lộ sao?"
lang_multi_text.db,MultiText,Character_Zani_17_27,传统是指，经历千难万险，中途还因为诸多误会而分道扬镳，最后一方在另一方的怀里用最后一口气吐露真相，让另一方抱憾终生？,"Oh, you're talking about the stories where, after a lot of hardship and misunderstanding, one side lets the truth out with their last breath, leaving the other to regret it forever?","Truyền thống là kiểu, trải qua muôn vàn gian khổ, giữa chừng còn vì bao nhiêu hiểu lầm mà chia xa, cuối cùng một bên nằm trong vòng tay người kia, dùng hơi thở cuối cùng thổ lộ sự thật, khiến người còn lại ân hận cả đời ấy hả?"
lang_multi_text.db,MultiText,Character_Zani_17_28,这是从哪看的？,Where did you read that?,Đọc ở đâu ra vậy?
