db_file,table_name,id,zh,en,vi
lang_multi_text.db,MultiText,Event_THCQDYBF_7_20,嗯？怎么了，{PlayerName}？我的提议有什么问题吗？,"Yes, {PlayerName}? Is there something wrong with my plans?","Hm? Sao vậy, {PlayerName}? Đề xuất của tôi có vấn đề gì sao?"
lang_multi_text.db,MultiText,Event_THCQDYBF_7_21,你就没什么“自己”想做的事吗？,I want to know what YOU want to do.,"Cậu không có gì ""bản thân"" muốn làm à?"
lang_multi_text.db,MultiText,Event_THCQDYBF_7_22,这可是散心啊。,"We're here to relax, remember?",Đây là đi thư giãn mà.
lang_multi_text.db,MultiText,Event_THCQDYBF_7_23,啊……抱歉，我忘记这不是在边庭了。,I apologize. I forgot I'm not in City Hall handling affairs right now.,"À... xin lỗi, tôi quên mất đây không phải ở Biên Đình."
lang_multi_text.db,MultiText,Event_THCQDYBF_7_24,我自己想做的事……请让我思考一下。,Something I want to do… Please give me a moment.,Thứ bản thân tôi muốn làm... xin cho tôi suy nghĩ một chút.
lang_multi_text.db,MultiText,Event_THCQDYBF_7_25,刚才你好像在看团圆铺的点心？,I remember you were eyeing the desserts at Yumyum Haven?,Lúc nãy cậu có vẻ đang nhìn bánh ở tiệm Đoàn Viên?
lang_multi_text.db,MultiText,Event_THCQDYBF_7_26,是的。我之前没见过这种点心的制作方式。它好像叫……“团圆饼”？,"Yes, I've never actually seen anyone make that dessert before. It's called... Plumpcake, right?","Vâng. Trước giờ tôi chưa từng thấy cách làm loại bánh này. Hình như nó gọi là... ""Bánh Đoàn Viên""?"
lang_multi_text.db,MultiText,Event_THCQDYBF_7_27,看起来似乎与潮饼有相似之处，但却使用了特殊的馅料与模具。看起来味道应该很独特。,Similar to Wuthercake but with different fillings and shapes. I bet it has a unique taste.,"Trông có vẻ giống Triều Bính, nhưng lại dùng nhân và khuôn đặc biệt. Hẳn là hương vị rất độc đáo."
lang_multi_text.db,MultiText,Event_THCQDYBF_7_28,你想尝尝看吗？,Would you like some of that?,Cậu muốn thử không?
lang_multi_text.db,MultiText,Event_THCQDYBF_7_29,不，我是想学习它的做法。如果学会的话……,"No, I simply want to learn how to make it, then I can…","Không, tôi muốn học cách làm nó. Nếu học được thì..."
lang_multi_text.db,MultiText,Event_THCQDYBF_7_3,呵……我今天是为公务而来，{PlayerName}。今汐大人托我给您带一封信。,"No, I'm here for work today. Madam Jinhsi entrusted me with this letter for you.","Hà... Hôm nay tôi đến vì công vụ, {PlayerName}. Kim Tịch đại nhân nhờ tôi mang cho ngài một lá thư."
lang_multi_text.db,MultiText,Event_THCQDYBF_7_30,好，那我们就去学做“团圆饼”吧！,Great. Then let's learn how to make Plumpcake!,"Được, vậy chúng ta đi học làm ""Bánh Đoàn Viên"" thôi!"
lang_multi_text.db,MultiText,Event_THCQDYBF_7_31,没问题。我刚才看了一会，已经大概知道它要怎么制作了。,Sure. I've watched them make it enough to have a general idea of how to do it myself.,"Không cần đâu. Lúc nãy tôi đã quan sát một lúc, đã nắm được cách làm đại khái rồi."
lang_multi_text.db,MultiText,Event_THCQDYBF_7_32,而且，我还有一些新的想法……能请您陪我一起去寻找原料吗？,"Besides, I have some new ideas… Can we go gather the ingredients together?","Hơn nữa, tôi còn có vài ý tưởng mới... ngài có thể cùng tôi đi tìm nguyên liệu được không?"
lang_multi_text.db,MultiText,Event_THCQDYBF_7_33,新的想法？,New ideas?,Ý tưởng mới?
lang_multi_text.db,MultiText,Event_THCQDYBF_7_34,什么原料？,Ingredients?,Nguyên liệu gì?
lang_multi_text.db,MultiText,Event_THCQDYBF_7_35,是一种名为“双生莲实”的特殊莲实，它们一般生长在怨鸟泽深处，有残象活动的危险湖泊。,"There's a special lotus seed called Twin Lotus Seed, found near lakes in the Whining Aix's Mire.","Đó là một loại hạt sen đặc biệt gọi là ""Song Sinh Liên Thực"", chúng thường mọc sâu trong Oán Điểu Trạch, ở những hồ nước nguy hiểm có Tàn Tượng hoạt động."
lang_multi_text.db,MultiText,Event_THCQDYBF_7_36,我曾在《瑝览类书》中看到过关于此物的记载，它有一种独特的清香。,I once read about it in The Grand Library. It has a unique fragrance.,"Tôi từng đọc được ghi chép về nó trong ""Hoàng Lãm Loại Thư"", nó có một mùi thơm thanh nhã rất đặc trưng."
lang_multi_text.db,MultiText,Event_THCQDYBF_7_37,用它来替代普通莲实，想必能在团圆饼原本的风味上锦上添花。,I believe using it in the Plumpcake would elevate the flavor.,"Dùng nó thay cho hạt sen thường, chắc chắn sẽ làm hương vị Bánh Đoàn Viên thêm phần tinh tế."
lang_multi_text.db,MultiText,Event_THCQDYBF_7_38,但它非常稀少，又一般生长在残象的栖息地，因此很少有人所知。,"But it's rare and only grows where Tacet Discords roam, making it hard to come by.","Nhưng nó rất hiếm, lại thường mọc ở nơi Tàn Tượng cư trú, nên ít người biết đến."
lang_multi_text.db,MultiText,Event_THCQDYBF_7_39,没问题。,I'm ready to go get some of that.,Không vấn đề gì.
lang_multi_text.db,MultiText,Event_THCQDYBF_7_4,{PlayerName}现今负责筹办宵月会一应事宜，想必她在信中定然有要事与你相商。,"As you're involved with the Moonlit Fair, she may have something important to discuss with you.","Hiện tại {PlayerName} đang phụ trách tổ chức mọi việc cho Tiêu Nguyệt Hội, chắc hẳn trong thư Lệnh Doãn có việc quan trọng muốn bàn với ngài."
lang_multi_text.db,MultiText,Event_THCQDYBF_7_40,那我们出发吧，{PlayerName}。,"Then let's get going, {PlayerName}.","Vậy chúng ta đi thôi, {PlayerName}."
lang_multi_text.db,MultiText,Event_THCQDYBF_7_5,你打开信件，上面的内容并非什么要事。边庭近来事务繁杂，全靠散华居中处置。,"As you open the letter, you realize it contains no pressing matters. It simply mentions that Sanhua has been shouldering a heavy workload at City Hall.","Mở thư ra, bên trong không phải chuyện gì cấp bách. Gần đây Biên Đình công việc bộn bề, mọi thứ đều nhờ Tản Hoa xử lý."
lang_multi_text.db,MultiText,Event_THCQDYBF_7_6,今汐担心她过度操劳，因此在信中提出，让你带散华在宵月会上散散心。,Jinhsi expresses concern and suggests taking her to the Moonlit Fair for some much-needed relaxation.,"Kim Tịch lo cô ấy làm việc quá sức, nên trong thư đề nghị bạn dẫn Tản Hoa đi dạo Tiêu Nguyệt Hội để thư giãn."
lang_multi_text.db,MultiText,Event_THCQDYBF_7_7,……看完了吗，{PlayerName}？您有什么话要我带回边庭吗？,"Have you finished reading it, {PlayerName}? Do you have any messages you would like me to convey?","...Đọc xong rồi chứ, {PlayerName}? Ngài có lời nhắn gì cần tôi mang về Biên Đình không?"
lang_multi_text.db,MultiText,Event_THCQDYBF_7_8,（将信的内容如实相告。）,(Tell her the content of the letter.),(Kể lại nội dung bức thư cho cô ấy.)
lang_multi_text.db,MultiText,Event_THCQDYBF_7_9,要不要陪我逛一逛？,How about taking a walk with me?,Cậu có muốn đi dạo cùng tôi không?
lang_multi_text.db,MultiText,Event_THCQDYBF_8_1,……没错，是双生莲实。这么多应该就够了。,These are the Twin Lotus Seeds I wanted. I think we have picked enough of them.,"...Đúng rồi, đây là Song Sinh Liên Thực. Nhiêu đây chắc là đủ rồi."
lang_multi_text.db,MultiText,Event_THCQDYBF_8_10,但我只能忙里偷闲，偶尔去听几句……毕竟，还是护卫的工作更重要。,"But I don't have much time for that. After all, Madam Jinhsi's safety is always my top priority.","Nhưng tôi chỉ có thể tranh thủ lúc rảnh, thỉnh thoảng nghe vài đoạn... dù sao, công việc hộ vệ vẫn quan trọng hơn."
lang_multi_text.db,MultiText,Event_THCQDYBF_8_11,真的有这么忙吗？,Are you really that busy?,Thật sự bận đến vậy sao?
lang_multi_text.db,MultiText,Event_THCQDYBF_8_12,是啊。今州毕竟位于边方，事务繁杂。不过，以后应该会轻松一些吧。,"I'm afraid so. Jinzhou is located on the borders, and safety has been a constant concern. But my workload may lessen in a few years.","Vâng. Kim Châu nằm ở vùng biên giới, công việc rất phức tạp. Nhưng sau này có lẽ sẽ nhẹ nhàng hơn."
lang_multi_text.db,MultiText,Event_THCQDYBF_8_13,鸣式的威胁已然消失，一切重回正轨。也许再过几年，大家就不会这么忙碌了。,"The Threnodian is no longer a threat, and everything is getting back on track. I am positive life will be tranquil for our people soon.","Mối đe dọa từ Minh Thức đã tiêu tan, mọi thứ đang dần trở lại bình thường. Có lẽ vài năm nữa, mọi người sẽ không còn bận rộn đến thế."
lang_multi_text.db,MultiText,Event_THCQDYBF_8_14,我很期待那一天的到来。,I'm looking forward to that day.,Tôi rất mong ngày đó đến.
lang_multi_text.db,MultiText,Event_THCQDYBF_8_15,我也是，{PlayerName}。,"So am I, {PlayerName}.","Tôi cũng vậy, {PlayerName}."
lang_multi_text.db,MultiText,Event_THCQDYBF_8_2,我有点好奇……,I'm a bit curious…,Tôi hơi tò mò...
lang_multi_text.db,MultiText,Event_THCQDYBF_8_3,你平时都做些什么？,What do you usually do?,Bình thường cậu hay làm gì?
lang_multi_text.db,MultiText,Event_THCQDYBF_8_4,我吗？主要是今汐大人的护卫工作。,My main duty is to protect Madam Jinhsi.,Tôi ư? Chủ yếu là công việc hộ vệ cho Lệnh Doãn Kim Tịch.
lang_multi_text.db,MultiText,Event_THCQDYBF_8_5,除此之外，还要协助她处理文书，帮她接见访客，或是向其他部门传达她所下的命令。,"I also assist her with paperwork, meet visitors, and convey her orders to other departments.","Ngoài ra, còn phải giúp bà ấy xử lý văn thư, tiếp khách, hoặc truyền đạt mệnh lệnh của bà ấy đến các bộ phận khác."
lang_multi_text.db,MultiText,Event_THCQDYBF_8_6,……除了工作之外呢？,...What do you do except work?,...Ngoài công việc ra thì sao?
lang_multi_text.db,MultiText,Event_THCQDYBF_8_7,我想想……喝花酿算吗？不，应该不算吧。喝花酿容易误事，特别是……会影响护卫工作。这可不是什么好习惯……,"Let me think… I sometimes drink flower wine… but not too much, as overdrinking leads to mistakes, which would affect my performance as a guard.","Để tôi nghĩ... uống rượu hoa có tính không nhỉ? Không, chắc là không. Uống rượu hoa dễ làm hỏng việc, đặc biệt là... ảnh hưởng đến công tác hộ vệ. Đó không phải thói quen tốt..."
lang_multi_text.db,MultiText,Event_THCQDYBF_8_8,再有就是听书了。我从那些故事中了解他人的人生，倾听他人的命运，以及我无法亲眼见识的，关于这个世界的一切。,"Other times, I listen to the storytellers. I learn about how other people live their lives, how they respond to life's ups and downs, and everything in this world that I cannot witness myself.","Còn nữa là nghe kể chuyện. Qua những câu chuyện đó, tôi hiểu được cuộc đời người khác, lắng nghe số phận của họ, và tất cả những gì về thế giới này mà tôi không thể tận mắt chứng kiến."
lang_multi_text.db,MultiText,Event_THCQDYBF_8_9,双生莲实比普通的莲实更好吃，就是我从听来的书中知道的。,"In fact, I learned from a story that Twin Lotus Seeds taste better than ordinary ones.","Song Sinh Liên Thực ngon hơn hạt sen thường, cũng là điều tôi biết được từ những câu chuyện ấy."
lang_multi_text.db,MultiText,Event_THCQDYBF_9_1,——欢迎光临！是{PlayerName}和散华大人啊。二位想来点什么啊？,"Welcome, {PlayerName} and Lady Sanhua! What can I get for you?",-- Chào mừng quý khách! Hóa ra là {PlayerName} và Tản Hoa đại nhân. Hai vị muốn dùng gì ạ?
lang_multi_text.db,MultiText,Event_THCQDYBF_9_10,我相信散华。,Sanhua can definitely nail it.,Tôi tin Tản Hoa.
lang_multi_text.db,MultiText,Event_THCQDYBF_9_11,没问题。我刚才又看了一会，已经记住整个制作过程了。,"You can count on me. I just observed the baking process a bit more, and I have memorized it all.","Không vấn đề gì. Vừa nãy tôi đã quan sát thêm một lúc, đã nhớ hết toàn bộ quy trình làm rồi."
lang_multi_text.db,MultiText,Event_THCQDYBF_9_12,好，那我就把炉灶借给你们用用吧。,"Alright, I'll let you use my stove.","Được, vậy tôi cho hai người mượn bếp lò nhé."
lang_multi_text.db,MultiText,Event_THCQDYBF_9_13,我也来帮忙！,Count me in!,Để tôi giúp một tay!
lang_multi_text.db,MultiText,Event_THCQDYBF_9_14,嗯，{PlayerName}。请帮我剥一下莲实。,"Thank you, {PlayerName}. Please peel the lotus seeds for me.","Ừm, {PlayerName}. Phiền ngươi bóc vỏ hạt sen giúp tôi."
lang_multi_text.db,MultiText,Event_THCQDYBF_9_15,莲实……？不对，那是……,"Lotus seeds…? No, these are…","Hạt sen......? Không đúng, cái kia là......"
lang_multi_text.db,MultiText,Event_THCQDYBF_9_16,是新鲜的“双生莲实”。加以高温烤制的话，更能激发它蕴含的清香。所以我选用了它作为莲实的替代品。,"Twin Lotus Seeds, freshly picked. Baking them at high temperatures brings out their fresh fragrance. I'll be using them to enhance the taste.","Là ""Hạt Sen Song Sinh"" tươi. Nếu nướng ở nhiệt độ cao, sẽ khơi dậy được hương thơm thanh khiết bên trong. Vì vậy tôi chọn nó làm nguyên liệu thay thế cho hạt sen thường."
lang_multi_text.db,MultiText,Event_THCQDYBF_9_17,但……但这东西，据说只有怨鸟泽深处的残象栖息地才有。,"But these are said to only grow in the depths of Whining Aix's Mire, where many monsters live...","Nhưng... nhưng thứ này, nghe nói chỉ có ở sâu trong vùng Oán Điểu Trạch, nơi Tàn Tượng cư ngụ mới có."
lang_multi_text.db,MultiText,Event_THCQDYBF_9_18,不，如果是{PlayerName}和散华大人的话，弄到这些莲实应该还是没问题的。就让我期待一下吧。,"...On second thought, with {PlayerName} and Lady Sanhua, getting those seeds would be a breeze. Can't wait for your Plumpcake!","Không, nếu là {PlayerName} và Tản Hoa đại nhân thì việc kiếm mấy hạt sen này chắc không thành vấn đề. Để tôi chờ thưởng thức nhé."
lang_multi_text.db,MultiText,Event_THCQDYBF_9_19,片刻之后，散华以行云流水的刀法和出神入化的技巧完美还原了每一个制作团圆饼的步骤。,"Soon, Sanhua effortlessly recreates the Plumpcake with her incredible talents.","Một lát sau, Tản Hoa với đao pháp hành vân lưu thủy và kỹ thuật xuất thần nhập hóa đã tái hiện hoàn hảo từng bước làm Bánh Đoàn Viên."
lang_multi_text.db,MultiText,Event_THCQDYBF_9_2,我们想学一下“团圆饼”的做法。,We want to learn how to make Plumpcake.,"Chúng tôi muốn học cách làm ""Bánh Đoàn Viên""."
lang_multi_text.db,MultiText,Event_THCQDYBF_9_20,就连路过的游客在看到这一幕后也情不自禁地鼓起了掌。,Onlookers pause to applaud her mastery in action.,Ngay cả những du khách đi ngang qua khi thấy cảnh tượng này cũng không kìm được mà vỗ tay tán thưởng.
lang_multi_text.db,MultiText,Event_THCQDYBF_9_21,——完成了。给，{PlayerName}。尝尝看吧。,"Done. {PlayerName}, please give it a try.","-- Xong rồi. Đây, {PlayerName}. Thử nếm xem nào."
lang_multi_text.db,MultiText,Event_THCQDYBF_9_22,请告诉我……味道怎么样？,How do you like it?,Xin hãy cho tôi biết... mùi vị thế nào?
lang_multi_text.db,MultiText,Event_THCQDYBF_9_23,非常非常非常好吃！,It's amazing!,Ngon cực kỳ cực kỳ cực kỳ luôn!
lang_multi_text.db,MultiText,Event_THCQDYBF_9_24,还行？,"Not bad, I guess?",Cũng tạm?
lang_multi_text.db,MultiText,Event_THCQDYBF_9_25,呵，谢谢……{PlayerName}喜欢就好。,Thank you. I'm glad you like it.,"Heh, cảm ơn... {PlayerName} thích là tốt rồi."
lang_multi_text.db,MultiText,Event_THCQDYBF_9_26,……您的表情和频率都骗不过我，其实您……觉得很好吃吧，{PlayerName}？,"…{PlayerName}, you are not fooling me with your expression and change in frequencies. You find it delightful, don't you?","...Biểu cảm và tần số của ngươi không lừa được tôi đâu, thật ra ngươi... thấy rất ngon đúng không, {PlayerName}?"
lang_multi_text.db,MultiText,Event_THCQDYBF_9_27,散华把烤好的团圆饼分成了两份，并递给{PlayerName}一份。,"Sanhua boxes up the fresh Plumpcakes, then hands a box to you.","Tản Hoa chia Bánh Đoàn Viên vừa nướng xong thành hai phần, rồi đưa cho {PlayerName} một phần."
lang_multi_text.db,MultiText,Event_THCQDYBF_9_28,——这个给你，{PlayerName}。,"This is for you, {PlayerName}.","-- Phần này cho ngươi, {PlayerName}."
lang_multi_text.db,MultiText,Event_THCQDYBF_9_29,那一份呢？,And the other box is...,Còn phần kia thì sao?
lang_multi_text.db,MultiText,Event_THCQDYBF_9_3,哈，那你们可问对人了。团圆饼可是门老手艺，传承了少说也有几百年了吧。,"Haha, you've come to the right person. Plumpcake is a traditional dessert that's been around for at least a few hundred years.","Ha, vậy thì hai người hỏi đúng người rồi đấy. Bánh Đoàn Viên là nghề truyền thống lâu đời, ít nhất cũng đã mấy trăm năm rồi."
lang_multi_text.db,MultiText,Event_THCQDYBF_9_30,这份是带给今汐大人的。{PlayerName}所认可的点心……我也想让她尝尝看。想必她也会喜欢的吧。,That is for Madam Jinhsi. Since you enjoyed the Plumpcakes I made... I think she'll like it too.,Phần này là mang cho Kim Tịch đại nhân. Món bánh mà {PlayerName} đã công nhận... tôi cũng muốn để cô ấy nếm thử. Chắc hẳn cô ấy cũng sẽ thích.
lang_multi_text.db,MultiText,Event_THCQDYBF_9_31,那你呢？不给自己留一份吗？,What about you? You haven't tasted any yet.,Thế còn cô? Không giữ lại một phần cho mình sao?
lang_multi_text.db,MultiText,Event_THCQDYBF_9_32,我吗？我……不需要。这不是我工作之内的事。,Me? I don't need it. Eating cake isn't part of my duty.,Tôi ư? Tôi... không cần đâu. Đây không nằm trong phạm vi công việc của tôi.
lang_multi_text.db,MultiText,Event_THCQDYBF_9_33,今汐不是也让你好好享受节日吗？,But Jinhsi wants you to enjoy the festival.,Kim Tịch chẳng phải cũng bảo cô hãy tận hưởng lễ hội sao?
lang_multi_text.db,MultiText,Event_THCQDYBF_9_34,原来如此……今汐大人写的那封信，其实是这个意思吗？,I see… So that's what Madam Jinhsi really wanted to convey?,"Thì ra là vậy... Bức thư Kim Tịch đại nhân viết, thật ra là ý đó sao?"
lang_multi_text.db,MultiText,Event_THCQDYBF_9_35,……你才明白过来吗。,...Don't tell me you're only getting it now...,...Giờ mới hiểu à.
lang_multi_text.db,MultiText,Event_THCQDYBF_9_36,人生可不应该只有工作。,"Life isn't just about work, you know.",Cuộc đời đâu chỉ có mỗi công việc.
lang_multi_text.db,MultiText,Event_THCQDYBF_9_37,散华若有所思地看着眼前的繁华景象，烟火和街上的彩灯全都倒映在她的眼睛里。,"As Sanhua gazes at the bustling scene unfolding before her, her mind seems elsewhere, captivated by the brilliance of fireworks and streetlights reflecting in her eyes.","Tản Hoa trầm tư nhìn cảnh tượng nhộn nhịp trước mắt, pháo hoa và đèn lồng sắc màu trên phố đều in bóng trong đôi mắt nàng."
lang_multi_text.db,MultiText,Event_THCQDYBF_9_38,所以，这就是追月节的意义：给大家一次机会，忘掉过去的不开心，忘掉明天所面对的威胁……,Now I get it. Festivities like this help people let go of the past's sorrows and the future's unknowns…,"Vậy ra, đây chính là ý nghĩa của Tết Truy Nguyệt: cho mọi người một cơ hội, quên đi những buồn phiền trong quá khứ, quên đi những mối đe dọa ngày mai..."
lang_multi_text.db,MultiText,Event_THCQDYBF_9_39,只是和重要的人一起，享受眼前，享受当下，享受此刻的快乐。,It's a chance to live in the moment with their loved ones. Finding joy in the little things in life.,"Chỉ đơn giản là cùng người quan trọng, tận hưởng hiện tại, tận hưởng khoảnh khắc này, tận hưởng niềm vui lúc này."
lang_multi_text.db,MultiText,Event_THCQDYBF_9_4,不过现在，会做团圆饼的人可越来越少了。现在的年轻人应该都不太见得到了吧。,Not many people can make it nowadays. I bet most of the youngsters have never seen one.,"Nhưng giờ đây, người biết làm Bánh Đoàn Viên ngày càng ít đi. Lớp trẻ bây giờ chắc hiếm ai còn thấy nữa."
lang_multi_text.db,MultiText,Event_THCQDYBF_9_40,没错。,"Yes, I think so.",Đúng vậy.
lang_multi_text.db,MultiText,Event_THCQDYBF_9_41,所以这点心才叫“团圆饼”啊。,She just wanted you to be happy.,"Nên món bánh này mới gọi là ""Bánh Đoàn Viên"" đấy."
lang_multi_text.db,MultiText,Event_THCQDYBF_9_42,谢谢你今天陪我这么久，{PlayerName}。今天……我很开心。,"Thank you for your company, {PlayerName}. I had a great time today.","Cảm ơn ngươi đã ở bên tôi lâu như vậy hôm nay, {PlayerName}. Hôm nay... tôi rất vui."
lang_multi_text.db,MultiText,Event_THCQDYBF_9_43,接下来你打算做什么？,What would you like to do next?,Tiếp theo cô định làm gì?
lang_multi_text.db,MultiText,Event_THCQDYBF_9_44,还没想好，大概会继续享受宵月会的庆典吧。也许，边庭的那些事务也并没有那么紧急，或者那么重要。,"I don't have a plan yet. I will probably continue enjoying the Moonlit Fair, just as Madam Jinhsi hoped. Perhaps the tasks on my to-do list aren't as urgent as they seem.","Chưa nghĩ ra, có lẽ sẽ tiếp tục tận hưởng lễ hội Tiêu Nguyệt Hội. Có lẽ, những công việc ở biên cương cũng không gấp gáp hay quan trọng đến thế."
lang_multi_text.db,MultiText,Event_THCQDYBF_9_45,当然，如果你需要我的话……请随时找我，我会第一时间赶到你身边的，{PlayerName}。,"If you need me for anything, you need only call. I'll be by your side right away, {PlayerName}.","Tất nhiên, nếu ngươi cần tôi... hãy gọi bất cứ lúc nào, tôi sẽ đến bên ngươi ngay lập tức, {PlayerName}."
lang_multi_text.db,MultiText,Event_THCQDYBF_9_5,但我得提醒你们，这团圆饼看似简单，可没那么好做。,"Though it might seem easy, making Plumpcake takes a lot of effort.","Nhưng tôi phải nhắc hai người trước, Bánh Đoàn Viên nhìn thì đơn giản, nhưng làm không dễ đâu."
lang_multi_text.db,MultiText,Event_THCQDYBF_9_6,从和面到调制馅料，每一步都有诀窍。想要做到金黄酥软，唇齿留香的程度，怎么也得学个一年半载才行。,Kneading the dough and preparing the fillings are just the beginning—every step has its secrets. It takes at least a year or two of practice to get that perfect crispy texture with a lingering aftertaste.,"Từ nhào bột đến pha nhân, mỗi bước đều có bí quyết riêng. Muốn đạt đến mức vàng giòn mềm xốp, thơm lưu luyến thì ít nhất cũng phải học cả năm trời."
lang_multi_text.db,MultiText,Event_THCQDYBF_9_7,一年半载……有那么夸张吗？,That's a lot of practice…,Cả năm trời... Có quá đáng không vậy?
lang_multi_text.db,MultiText,Event_THCQDYBF_9_8,呵，我第一次学做这种点心的时候，光背食谱就用了三天……,"You know, when I learned how to make it, I spent three whole days just memorizing the recipe!","Heh, lần đầu tôi học làm loại bánh này, chỉ riêng việc thuộc công thức đã mất ba ngày..."
lang_multi_text.db,MultiText,Event_THCQDYBF_9_9,要不然……我们还是先学一下再说？,"Anyway, let's give it a try first.",Hay là... chúng ta cứ học thử trước đã?
lang_multi_text.db,MultiText,Event_TMDZJ_1_1,{Male=大哥哥;Female=大姐姐}，你，你是来帮助“多萝西”的么？,"A-are you here to help ""Dorothy""?","{Male=Anh ơi;Female=Chị ơi}, anh... anh có phải đến giúp ""Dorothy"" không?"
lang_multi_text.db,MultiText,Event_TMDZJ_1_10,拜托了，{PlayerName}{Male=大哥哥;Female=大姐姐}，我找不到其他可以帮忙的人了。,"Please help, {Male=Mr. ;Female=Miss }{PlayerName}... I have no one else to turn to.","Làm ơn đi, {PlayerName} {Male=anh;Female=chị}, em không tìm được ai khác giúp nữa rồi."
