db_file,table_name,id,zh,en,vi
lang_multi_text.db,MultiText,Flow_11000001_778,你好，我是瑞狮团的鼓师阿奇。,"Hello, I'm Chie, the drummer of the Liondance Troupe.","Xin chào, tôi là A Kỳ, tay trống của đoàn Thụy Sư."
lang_multi_text.db,MultiText,Flow_11000001_779,如果对狮舞演出感兴趣，可以在那边留言。,"If you're interested in the Liondance performance, you can leave a message over there.","Nếu quan tâm đến tiết mục múa lân, bạn có thể để lại lời nhắn ở đằng kia."
lang_multi_text.db,MultiText,Flow_11000001_780,是漂泊者啊。有事来找凌阳吗？,"Hi, Rover. Are you here for Lingyang?",Lữ Khách à. Có việc gì cần tìm Lăng Dương sao?
lang_multi_text.db,MultiText,Flow_11000001_781,那小子最近训练更刻苦了……,That kid has been training even harder recently...,Thằng nhóc đó dạo này luyện tập chăm chỉ hơn rồi...
lang_multi_text.db,MultiText,Flow_11000001_782,上次找人新做的鼓槌不太趁手，得让凌阳帮我再打磨打磨……,The new drumstick doesn't feel quite right. I'll have to ask Lingyang to help me refine it a bit...,"Đôi dùi trống mới nhờ người làm lần trước không vừa tay lắm, phải nhờ Lăng Dương mài giũa lại mới được..."
lang_multi_text.db,MultiText,Flow_11000001_783,啊，是客人吗？如果您有狮舞表演的需求，可以去那边登记！,"Is there anything I can help? If you're interested in a Liondance performance, you can go over there to register!","À, có khách sao? Nếu bạn cần đặt biểu diễn múa lân, có thể đến đằng kia đăng ký!"
lang_multi_text.db,MultiText,Flow_11000001_784,嘿，漂泊者！有什么事吗？,"Hey, Rover! What's up?","Ê, Lữ Khách! Có chuyện gì không?"
lang_multi_text.db,MultiText,Flow_11000001_785,要不要加入我们瑞狮团啊！哈哈，我开玩笑的。,"Would you like to join our Liondance Troupe? Haha, just kidding.","Muốn gia nhập đoàn Thụy Sư của bọn tao không! Haha, đùa thôi."
lang_multi_text.db,MultiText,Flow_11000001_786,失落的真心，就像在无光之森孤独绽开的花，绯色依旧，却脆弱缥缈，遍体鳞伤。,"The lost heart is like a flower blooming alone in the Dim Forest. Its scarlet color remains, but fragile and indistinct, with scars running down its body.","Trái tim lạc lối, như đóa hoa cô đơn nở giữa khu rừng không ánh sáng. Sắc đỏ vẫn còn, nhưng mong manh mờ ảo, đầy thương tích."
