db_file,table_name,id,zh,en,vi
lang_multi_text.db,MultiText,XJXYBGSST_12_9,那也不用担心。分部测试只是帮助同学们确立自己的方向，而最终分部的结果，学院还是会综合平时成绩和个人的潜能来评定。,"Oh, don't worry. The sorting evaluation is just there to point you in a direction. What really matters is your overall performance and your own potential.","Vậy cũng không cần lo. Kiểm tra phân khoa chỉ là giúp các bạn xác định hướng đi của mình, còn kết quả phân khoa cuối cùng, Học viện vẫn sẽ tổng hợp thành tích thường ngày và tiềm năng cá nhân để đánh giá."
lang_multi_text.db,MultiText,XJXYBGSST_13_1,对了，我让你放我办公桌抽屉里的文件，你放哪儿了？,Where's the file I asked you to put in my desk drawer?,"Đúng rồi, tập tài liệu tôi bảo cậu để vào ngăn kéo bàn làm việc của tôi, cậu để đâu rồi?"
lang_multi_text.db,MultiText,XJXYBGSST_13_2,我放您办公室抽屉里了。,"It's in your desk drawer, sir.",Em để trong ngăn kéo văn phòng của thầy rồi ạ.
lang_multi_text.db,MultiText,XJXYBGSST_13_3,哦，那就行。下次你放到哪儿了，记得跟我说一声。,Oh... fine. I'd appreciate it if you told me where you put stuff next time.,"Ừ, thế thì được. Lần sau cậu để đâu nhớ nói với tôi một tiếng."
lang_multi_text.db,MultiText,XJXYBGSST_14_1,“家中机麋分离焦虑，申请陪同进行心理疏导”……,"""Pet mech reindeer has separation anxiety. Need time off to administer wellness therapy""...","""Cơ Lộc ở nhà bị lo âu chia ly, xin phép nghỉ để ở bên cạnh điều trị tâm lý""..."
lang_multi_text.db,MultiText,XJXYBGSST_14_2,……你自己说说，这请假理由，它合理吗？,You tell me! Is this a valid reason to take leave?,"...Em tự nói xem, cái lý do xin nghỉ này, nó có hợp lý không?"
lang_multi_text.db,MultiText,XJXYBGSST_14_3,是真的！它舍不得我来上学，连撞人的力道都小了……,It's true! Its heart breaks every time I go to school. Its headbutting energy is already at an all-time low...,"Là thật đấy ạ! Nó không nỡ để em đi học, đến lực húc người cũng yếu đi rồi..."
lang_multi_text.db,MultiText,XJXYBGSST_15_1,学院明明只有四个学部，那个“农学部”是哪儿来的？,"Startorch Academy only has four departments. Where did this ""Agronomy Wing"" come from?","Học viện rõ ràng chỉ có bốn khoa, cái ""Khoa Nông Nghiệp"" kia là ở đâu ra?"
lang_multi_text.db,MultiText,XJXYBGSST_15_2,那是光矩能源学部下，生态维持学科群的外号。,"Oh, that's a nickname for the Division of Ecology Conservation, out of the Department of Light Energy Sciences.",Đó là biệt danh của Bộ Môn Duy Trì Sinh Thái thuộc Khoa Năng Lượng Quang Củ.
lang_multi_text.db,MultiText,XJXYBGSST_15_3,反正四天王惯例有五个人，作为本院特色不也挺好的吗？,"We're like the fantastic four and a half. Kinda funny, don't you think?","Dù sao Tứ Đại Thiên Vương theo thông lệ cũng có năm người, coi như nét đặc sắc của trường mình chẳng phải cũng hay sao?"
lang_multi_text.db,MultiText,XJXYBGSST_16_1,哟，拉贝尔学部的新生！想了解什么？学院里的大小事情，问我就对了。,"Ah, a new student of Rabelle College. What do you want to know? I'm familiar with the ins and outs of this place. Got questions? Ask away!","Yo, tân sinh viên Khoa Rabelle! Muốn tìm hiểu gì nào? Chuyện lớn nhỏ trong Học viện, hỏi tôi là đúng người rồi."
lang_multi_text.db,MultiText,XJXYBGSST_16_10,虚质科学部专门研究海蚀现象和虚质磁暴，希望能有效预警并控制这一灾害。但研究的劲一起来，往往就忘了觅食，容易丧失人性……,"The Department of Voidmatters specializes in studying Waveworn Phenomena and Void Storms to predict and control these disasters. But once they get deep into their research, they often forget to eat and... can start to lose touch with humanity.","Khoa Khoa Học Hư Chất chuyên nghiên cứu hiện tượng Hải Thực và Hư Chất Từ Bạo, hy vọng có thể cảnh báo và kiểm soát hiệu quả tai họa này. Nhưng một khi hăng say nghiên cứu là thường quên ăn quên uống, dễ đánh mất nhân tính..."
lang_multi_text.db,MultiText,XJXYBGSST_16_11,还有光矩能源部另一边搞能源转化的光能矩阵学科群，他们天天泡在图纸和算式里，画风跟农学院截然不同。,"Then there's the Department of Light Energy Sciences, home to the Division of Light Array Engineering, focused on energy conversion. They spend their days buried in blueprints and equations—a stark contrast to the guys over at the Agro Wing.","Còn có Bộ Môn Kỹ Thuật Ma Trận Ánh Sáng chuyên về chuyển hóa năng lượng bên Khoa Năng Lượng Quang Củ nữa, bọn họ ngày nào cũng vùi đầu vào bản vẽ và công thức, phong cách khác hẳn bên Khoa Nông Nghiệp."
lang_multi_text.db,MultiText,XJXYBGSST_16_12,总而言之，每个学部都各有特色。选学部不只是选研究方向，更是选择了未来四年的生活方式。,"In short, each department is unique. Choosing one isn't just about picking an area of study, it's about choosing a lifestyle for the next four years.","Tóm lại, mỗi khoa đều có nét đặc sắc riêng. Chọn khoa không chỉ là chọn hướng nghiên cứu, mà còn là chọn lối sống cho bốn năm tới."
lang_multi_text.db,MultiText,XJXYBGSST_16_13,希望你能在这段星炬学院的求学时光里，找到属于自己的那份热爱。,I hope you'll find your passion during your time here at Startorch Academy.,Hy vọng cậu có thể tìm thấy niềm đam mê thuộc về mình trong quãng thời gian theo học tại Học viện Startorch này.
lang_multi_text.db,MultiText,XJXYBGSST_16_2,想了解“农学部”外号的来源。,"Tell me about how the ""Agronomy Wing"" nickname came to be.","Muốn tìm hiểu nguồn gốc biệt danh ""Khoa Nông Nghiệp""."
lang_multi_text.db,MultiText,XJXYBGSST_16_3,想了解拉贝尔学部。,Tell me about Rabelle College.,Muốn tìm hiểu Khoa Rabelle.
lang_multi_text.db,MultiText,XJXYBGSST_16_4,想了解其他学部。,Tell me about the other departments.,Muốn tìm hiểu các khoa khác.
lang_multi_text.db,MultiText,XJXYBGSST_16_5,"""农学部""是个外号，指的是光矩能源学部下的生态维持学科群。他们整天围着月壤种这种那，是全院最接""地气""的一群人。","The nickname ""Agronomy Wing"" refers to the Division of Ecology Conservation within the Department of Light Energy Sciences. They spend their days planting things in lunar soil and are the most ""grounded"" bunch in the entire Academy.","""Khoa Nông Nghiệp"" là biệt danh, chỉ Bộ Môn Duy Trì Sinh Thái thuộc Khoa Năng Lượng Quang Củ. Bọn họ cả ngày vây quanh đất mặt trăng trồng cái này cái kia, là nhóm người ""gần gũi đất đai"" nhất toàn viện."
lang_multi_text.db,MultiText,XJXYBGSST_16_6,餐能中心那些新奇的食物，基本上都是他们的研究成果。营养嘛，绝对可以保证，但味道嘛……就不要在意了。,"The novel foodstuffs served in the Food, Utilities & Energy Lounge are mostly the result of their research. Always nutritious, but the taste... well, best not to think about that.","Những món ăn lạ lùng ở trung tâm ăn uống về cơ bản đều là thành quả nghiên cứu của họ. Dinh dưỡng thì tuyệt đối đảm bảo, nhưng mùi vị thì... đừng để ý làm gì."
lang_multi_text.db,MultiText,XJXYBGSST_16_7,既然你也是拉贝尔学部的，作为已毕业的前辈，我告诉你个实用的消息——要是有同学拉你参加“超级食物”研究组，千万躲远点！,"As a recent graduate, here's the advice I give to current students: If a classmate tries to recruit you into the ""superfood"" research group, start running!","Đã là người Khoa Rabelle, với tư cách là đàn anh đã tốt nghiệp, tôi cho cậu một tin hữu ích đây... nếu có bạn học rủ cậu tham gia nhóm nghiên cứu ""siêu thực phẩm"", nhớ tránh xa ra!"
lang_multi_text.db,MultiText,XJXYBGSST_16_8,他们搞出来的东西，比餐能中心的食物还难吃十倍！信我，学长不会坑你的！,"The stuff they come up with tastes ten times worse than the food in <ano=the cafeteria>F.U.E.L.</ano>. I wouldn't steer you wrong, fresher!","Thứ họ làm ra còn khó ăn gấp mười lần đồ ăn ở <ano=trung tâm ăn uống>F.U.E.L.</ano>! Tin tôi đi, đàn anh không lừa cậu đâu!"
lang_multi_text.db,MultiText,XJXYBGSST_16_9,其他学部嘛……隧者工学部，聚集了一大堆痴迷于隧者的机械狂人。学生们不是天才就是疯子，算是学院中最“危险”的学部。,"Well, the Department of Exostrider Engineering is obsessed with all things Exostrider. The students there are either geniuses or lunatics. It's the most ""dangerous"" department in the Academy.","Các khoa khác à... Khoa Kỹ Thuật Túy Giả, tụ tập một đống người cuồng máy móc đam mê Túy Giả. Sinh viên không phải thiên tài thì cũng là kẻ điên, được coi là khoa ""nguy hiểm"" nhất Học viện."
lang_multi_text.db,MultiText,XJXYBGSST_17_1,虚质科学部的队伍早就出发了，你怎么现在才来交申请？,The Voidmatter research team set out ages ago. Why are you only applying now?,"Đội của Khoa Khoa Học Hư Chất đã xuất phát từ lâu rồi, sao giờ này cậu mới đến nộp đơn?"
lang_multi_text.db,MultiText,XJXYBGSST_17_2,抱歉，老师，我本来以为上次采集的样本足够了……,"Sorry Professor, I thought I had collected enough samples last time...","Xin lỗi cô, em cứ tưởng mẫu vật thu thập lần trước đã đủ rồi..."
lang_multi_text.db,MultiText,XJXYBGSST_17_3,算了，我帮你联络其他学部的教授，问问有没有机会吧。,"Never mind, I'll ring up another department. There might still be a professor with a vacancy for you.","Thôi được rồi, để tôi liên hệ giáo sư các khoa khác giúp cậu, hỏi xem có cơ hội nào không nhé."
