db_file,table_name,id,zh,en,vi
lang_multi_text.db,MultiText,Huanglong_main_1_2EX_6_15,小道觉得致远所说亦有其理所在，小道无法说服，于是，小道想起师父处事，在小道每行一事时，师父都要让我过一关，与师父切磋。,"I, too, found what Zhiyuan said was reasonable to an extent, and I couldn't change his mind with words. So I tried to imagine what my masters would do. They'd set up a spar in this case. And if I won, they'd let me do what I wanted.","Tiểu đạo cảm thấy lời Chí Viễn nói cũng có lý, tiểu đạo không thể thuyết phục, thế là, tiểu đạo nhớ lại cách xử sự của sư phụ, mỗi khi tiểu đạo làm một việc gì, sư phụ đều bắt tôi qua một ải, so tài với sư phụ."
lang_multi_text.db,MultiText,Huanglong_main_1_2EX_6_16,你打服他了？,So you beat him up?,Cô đánh cho cậu ta phục rồi à?
lang_multi_text.db,MultiText,Huanglong_main_1_2EX_6_17,一力降十会。,"Anything that works for you, I guess.",Lấy sức mạnh áp chế tất cả.
lang_multi_text.db,MultiText,Huanglong_main_1_2EX_6_18,你应当是假意认输。,You pretended to lose.,Cô hẳn là giả vờ nhận thua.
lang_multi_text.db,MultiText,Huanglong_main_1_2EX_6_19,你当然赢了他。,You won.,Cô đương nhiên là thắng cậu ta rồi.
lang_multi_text.db,MultiText,Huanglong_main_1_2EX_6_20,“虚而不屈，动而愈出。多闻数穷，不若守中。”,"""The shape changes, but not the forms; the more it moves, the more it yields. Less thinking, more knowing. Simplify for clarity.”","""Hư nhi bất khuất, động nhi dũ xuất. Đa văn số cùng, bất nhược thủ trung."" Quả thực là như vậy!"
lang_multi_text.db,MultiText,Huanglong_main_1_2EX_6_21,漂泊者说的是，小道假意认输，却被致远看了出来。,"Yes, I pretended to lose, but Zhiyuan saw it through.","Lữ Khách nói phải, tiểu đạo giả vờ nhận thua, nhưng lại bị Chí Viễn nhìn ra."
lang_multi_text.db,MultiText,Huanglong_main_1_2EX_6_22,在切磋之后，致远意识到，他所在意的共鸣者与普通人的差别即使不存在，他也仍需努力，现在不过是空谈上阵杀敌。,"After our fight, Zhiyuan admitted he saw the gap between Resonators and ordinary people. He seemed to realize how he was still far from being able to fight the Tacet Discords.","Sau khi so tài, Chí Viễn nhận ra rằng, sự khác biệt giữa Cộng Hưởng Giả và người bình thường mà cậu ấy để ý cho dù không tồn tại, cậu ấy vẫn cần nỗ lực, hiện tại chẳng qua chỉ là nói suông chuyện ra trận giết địch."
lang_multi_text.db,MultiText,Huanglong_main_1_2EX_6_23,营内确有自己可做之事，但有可做之事，与为想做之事准备与努力并无半分冲突，上阵杀敌，需强健自身。,"He realized how he was just trying to convince himself that he could make a difference, not wanting to acknowledge his own limitations. Fighting on the battlefield requires physical and mental strength, and he was not yet prepared for that.","Trong doanh trại quả thực có việc mình có thể làm, nhưng có việc có thể làm, và việc chuẩn bị cùng nỗ lực cho việc muốn làm tịnh không hề mâu thuẫn chút nào, ra trận giết địch, cần bản thân phải cường tráng."
lang_multi_text.db,MultiText,Huanglong_main_1_2EX_6_24,“挫其锐，解其纷，和其光，同其尘。”确是如此。,"""All tangles untied, all glare tempered, all dust smoothed. It is like a deep pool that never dries. ” How true! I've come to understand this line more.","""Mài nhọn cái sắc, gỡ cái rối, hòa cái sáng, đồng cái bụi."" Quả đúng là như vậy."
lang_multi_text.db,MultiText,Huanglong_main_1_2EX_6_25,小道承诺不以异能取胜，但致远尚不能接取一招。,"I promised not to use my Forte in the battle, but Zhiyuan still couldn't take a single blow from me.","Tiểu đạo hứa không dùng dị năng để thắng, nhưng Chí Viễn vẫn không thể đỡ nổi một chiêu."
lang_multi_text.db,MultiText,Huanglong_main_1_2EX_6_26,在落败后，致远了悟到残象非人，而自己尚无自保之力，只是空谈上阵杀敌。军营中确有自己可做之事，但不过是自欺欺人。,"After his defeat, Zhiyuan seemed to realize his weakness. Talking about confronting the Tacet Discords on the battlefield would be mere lip service, he said. He was just trying to convince himself that he could make a difference, not wanting to acknowledge his own limitations.","Sau khi thất bại, Chí Viễn ngộ ra Tàn Tượng không phải con người, mà bản thân vẫn chưa có sức tự bảo vệ, chỉ là nói suông chuyện ra trận giết địch. Trong doanh trại quân đội quả thực có việc mình có thể làm, nhưng chẳng qua là tự lừa mình dối người."
lang_multi_text.db,MultiText,Huanglong_main_1_2EX_6_27,小道听闻漂泊者与秧秧还有需要处理之事，若是漂泊者、秧秧姑娘之后得空，可来六羡茶馆一叙。,"I heard you two still have other matters to attend to. When you have the time, let's catch up at Liuxian Teahouse.","Tiểu đạo nghe nói Lữ Khách và Ương Ương còn có việc cần xử lý, nếu Lữ Khách, cô nương Ương Ương sau này rảnh rỗi, có thể đến Trà Quán Lục Tiễn hàn huyên."
lang_multi_text.db,MultiText,Huanglong_main_1_2EX_6_28,有缘遇见两位，甚幸之。,It's my great pleasure to have met you.,"Có duyên gặp gỡ hai vị, thật là may mắn."
lang_multi_text.db,MultiText,Huanglong_main_1_2EX_6_29,再会。,Farewell.,Tạm biệt.
lang_multi_text.db,MultiText,Huanglong_main_1_2EX_6_30,之后见。,See you.,Gặp lại sau.
lang_multi_text.db,MultiText,Huanglong_main_1_2EX_6_31,小道并非想要致远平白挨一顿打，师父常通过招式切磋告诉小道道理，小道亦有所得。此次切磋，漂泊者认为我是赢，还是输？,"I didn't mean to beat him up for nothing. My masters taught me valuable lessons through sparring, and I gained important insights from those fights. Now, who do you think won that fight?","Tiểu đạo tịnh không muốn Chí Viễn vô cớ bị đánh một trận, sư phụ thường thông qua so tài chiêu thức để dạy đạo lý cho tiểu đạo, tiểu đạo cũng có sở đắc. Lần so tài này, Lữ Khách cho rằng tôi thắng, hay là thua?"
lang_multi_text.db,MultiText,Huanglong_main_1_2EX_6_32,你们与鉴心汇合，她已经找到致远并劝他回了今州城，这次出行令她有了诸多体悟，她也期待与你和秧秧能有缘再会。,"Reuniting with Jianxin, you learn she has successfully found Zhiyuan and convinced him to return to Jinzhou. This journey has been enlightening for her, and she looks forward to seeing you and Yangyang again.","Các bạn hội họp với Giám Tâm, cô ấy đã tìm thấy Chí Viễn và khuyên cậu ấy về thành Kim Châu, chuyến đi này giúp cô ấy có nhiều thể ngộ, cô ấy cũng mong đợi có duyên gặp lại bạn và Ương Ương."
lang_multi_text.db,MultiText,Huanglong_main_1_2EX_7_1,遇到鉴心小道长应当是意外，如果莽吉柿指向的是战争，今令尹想要说的究竟是什么呢？,"Us running into Master Jianxin was a one-off incident. If the mangosteen indicates something about war, what is Madam Magistrate trying to convey?","Gặp tiểu đạo trưởng Giám Tâm hẳn là ngoài ý muốn, nếu Măng Cụt ám chỉ chiến tranh, rốt cuộc Lệnh Y, ngài ấy muốn nói điều gì đây?"
lang_multi_text.db,MultiText,Huanglong_main_1_2EX_7_2,世间由战生，因战苦。,That civilizations are born from war and suffer from war.,"Thế gian sinh ra từ chiến tranh, khổ đau vì chiến tranh."
lang_multi_text.db,MultiText,Huanglong_main_1_2EX_7_3,说不定，她想让我见到谁。,Perhaps she wants me to meet someone.,"Nói không chừng, cô ấy muốn tôi gặp ai đó."
lang_multi_text.db,MultiText,Huanglong_main_1_2EX_7_4,也许只是暂时没有触发。,Perhaps the moment hasn't arrived yet.,Có lẽ chỉ là tạm thời chưa kích hoạt.
lang_multi_text.db,MultiText,Huanglong_main_1_2EX_7_5,只是给我一个契机。,She's just giving me a chance to do a certain thing.,Chỉ là cho tôi một cơ hội.
lang_multi_text.db,MultiText,Huanglong_main_1_2EX_7_6,漂泊者想到了什么？,"Have you thought of something, Rover?",Lữ Khách nghĩ tới điều gì rồi?
lang_multi_text.db,MultiText,Huanglong_main_1_2EX_7_7,我觉得……,I think...,Tôi cảm thấy...
lang_multi_text.db,MultiText,Huanglong_main_1_2EX_7_8,（说起残象潮。）,(Mention the Tacet Discord outbreak.),(Nói về Thủy Triều Tàn Tượng.)
lang_multi_text.db,MultiText,Huanglong_main_1_2EX_7_9,（说起运输路线。）,(Mention the mangosteen's route of transportation.),(Nói về tuyến đường vận chuyển.)
lang_multi_text.db,MultiText,Huanglong_main_1_2EX_7_10,（说起将军。）,(Mention the general you saw.),(Nói về Tướng Quân.)
lang_multi_text.db,MultiText,Huanglong_main_1_2EX_7_11,漂泊者是认为，残象潮是令尹想要通过莽吉柿告诉漂泊者的重要信息吗？,So Madam Magistrate wants to tell us about the TD outbreak?,"Lữ Khách cho rằng, Thủy Triều Tàn Tượng là thông tin quan trọng mà Lệnh Y muốn thông qua Măng Cụt nói cho Lữ Khách sao?"
lang_multi_text.db,MultiText,Huanglong_main_1_2EX_7_12,如潮水般涌来的残象，若是防线溃败，不仅仅是瑝珑之难……,"If those Tacet Discords break through our defenses, it would be a disaster for not just Huanglong, but for all of humanity...","Tàn Tượng tràn đến như thủy triều, nếu phòng tuyến vỡ lở, không chỉ là tai nạn của Hoàng Long..."
lang_multi_text.db,MultiText,Huanglong_main_1_2EX_7_13,漂泊者是认为，莽吉柿的运输路线是令尹想要通过莽吉柿告诉漂泊者的重要信息吗？,So Madam Magistrate wants to tell us something about the mangosteen's route of transportation?,"Lữ Khách cho rằng, tuyến đường vận chuyển Măng Cụt là thông tin quan trọng mà Lệnh Y muốn thông qua Măng Cụt nói cho Lữ Khách sao?"
lang_multi_text.db,MultiText,Huanglong_main_1_2EX_7_14,刚刚军需官有提到，<color=Highlight>南</color>线是水运路线。,That quartermaster said the mangosteens are transported by boat from the <color=Highlight>South</color>.,"Vừa rồi sĩ quan quân nhu có nhắc đến, tuyến đường phía <color=Highlight>Nam</color> là tuyến đường thủy."
lang_multi_text.db,MultiText,Huanglong_main_1_2EX_7_15,漂泊者是认为，莽吉柿指向今州现在的战事情况，指向忌炎将军吗？,"So Madam Magistrate wants to tell us about General Jiyan, or about the war against Tacet Discords?","Lữ Khách cho rằng, Măng Cụt ám chỉ tình hình chiến sự hiện tại của Kim Châu, ám chỉ Tướng Quân Kỵ Viêm sao?"
lang_multi_text.db,MultiText,Huanglong_main_1_2EX_7_16,尚是在战场后方，风中就已经充满了肃杀的气息……紧张、不安，戍边的将士们……,"We haven't reached the frontlines yet, but I can already smell the iron in the air... I sense tension and unease. Our soldiers stationed at the borders... I hope they are okay...","Vẫn còn ở phía sau chiến trường, mà trong gió đã tràn ngập hơi thở chết chóc... Căng thẳng, bất an, các tướng sĩ trấn giữ biên cương..."
lang_multi_text.db,MultiText,Huanglong_main_1_2EX_7_17,食物……,Food...,Đồ ăn...
lang_multi_text.db,MultiText,Huanglong_main_1_2EX_7_18,你们如今已经知道莽吉柿意指战争，但今汐究竟想传达什么还不得而知。你暗自思索时却忽地产生了幻觉……,"You now know the mangosteen has something to do with the war. But in what way? What is Jinhsi trying to tell you? As you ponder these questions, vivid images flood your mind.","Các bạn giờ đây đã biết Măng Cụt ám chỉ chiến tranh, nhưng rốt cuộc Kim Tịch muốn truyền đạt điều gì vẫn chưa rõ. Khi bạn đang âm thầm suy nghĩ thì bỗng nhiên nảy sinh ảo giác..."
lang_multi_text.db,MultiText,Huanglong_main_1_2EX_41_1,前面便是侦查信标了？怎会围着那么多人？,Is that the Beacon? Why are there so many people?,Phía trước là Trạm Tín Hiệu Thám Thính sao? Tại sao lại có nhiều người vây quanh thế kia?
lang_multi_text.db,MultiText,Huanglong_main_1_2EX_41_2,看起来不是军人……,They don't look like soldiers...,Trông không giống quân nhân...
lang_multi_text.db,MultiText,Huanglong_main_1_2EX_42_1,请问，你们在这里干什么呢？这里离战场很近，很危险的。,Greetings. What might interest you here? It's dangerous.,"Xin hỏi, các vị đang làm gì ở đây vậy? Nơi này rất gần chiến trường, nguy hiểm lắm."
lang_multi_text.db,MultiText,Huanglong_main_1_2EX_42_2,啊？我们……我们没干什么，我们这不是南下进城呢。,"Oh. We, uh... Nothing, really. You see, we're just on our way south, to the city.","Hả? Chúng tôi... chúng tôi đâu có làm gì, chúng tôi đang đi xuống phía nam để vào thành mà."
lang_multi_text.db,MultiText,Huanglong_main_1_2EX_42_3,别藏了，你不会以为我看不到吧？,Stop lying. I saw it.,"Đừng giấu nữa, các người nghĩ tôi không nhìn thấy sao?"
lang_multi_text.db,MultiText,Huanglong_main_1_2EX_42_4,请问，这个侦查塔……,"Excuse me, about this Detection Beacon...","Xin hỏi, tháp trinh sát này..."
lang_multi_text.db,MultiText,Huanglong_main_1_2EX_42_5,大家快跑！,"Run, everyone!",Mọi người chạy mauuuu!
lang_multi_text.db,MultiText,Huanglong_main_1_2EX_42_6,有古怪。,Something's fishy about them.,Có gì đó mờ ám.
lang_multi_text.db,MultiText,Huanglong_main_1_2EX_42_7,追。,Don't let them run off.,Đuổi theo.
lang_multi_text.db,MultiText,Huanglong_main_1_2EX_42_8,你们在侦察信标附近遇到了几个鬼鬼祟祟的“平民”，准备截住他们问个明白。,"As you near the first Detection Beacon, you stumble upon some shifty-looking ""civilians."" You move to confront them.","Bạn bắt gặp vài ""thường dân"" lén lút gần Trạm Tín Hiệu Thám Thính, bèn chặn họ lại để hỏi cho ra lẽ."
lang_multi_text.db,MultiText,Huanglong_main_1_2EX_43_1,哥，我走不动了……太饿了……,I-I can't move... So hungry...,"Anh ơi, em đi không nổi nữa... đói quá..."
lang_multi_text.db,MultiText,Huanglong_main_1_2EX_43_2,别，别抓我们！我们……我们实在没办法了才偷东西的！,P-please don't arrest us! We really had no choice!,"Đừng, đừng bắt chúng tôi! Chúng tôi... chúng tôi thực sự hết cách rồi mới phải trộm đồ!"
lang_multi_text.db,MultiText,Huanglong_main_1_2EX_43_3,你们是遇到什么困难了吗？,What happened? Do you need help?,Các vị gặp khó khăn gì sao?
lang_multi_text.db,MultiText,Huanglong_main_1_2EX_43_4,这不是现在北边战事紧张吗，我们这些人没有物资实在活不下去了，想来想去还是打算回城过活。,"The battles are getting real bad up north, and we couldn't live there anymore. Figured we have to go back to the city.","Chẳng phải là chiến sự phía Bắc đang căng thẳng sao, những người như chúng tôi không có vật tư thì không sống nổi, nghĩ đi nghĩ lại vẫn là nên quay về thành sinh sống."
lang_multi_text.db,MultiText,Huanglong_main_1_2EX_43_5,我们只是太久没吃东西了，身上的钱也用完了，很多人饿得都快要走不动路了。,"We ain't eaten in ages, and we're broke. Some of us can barely move 'cause we're so damn hungry.","Chúng tôi đã nhịn đói quá lâu rồi, tiền trên người cũng cạn sạch, nhiều người đói đến mức sắp không đi nổi nữa."
lang_multi_text.db,MultiText,Huanglong_main_1_2EX_43_6,我们路过这正好看到这里有些值钱设备，军队都去打仗了，现在这里也没什么人，所以才想趁机偷点东西去换钱。,"Then we found some expensive looking stuff here. Now that the military's out there fighting and nobody's really using these thingies, we thought it might get us a few pennies.","Chúng tôi đi ngang qua đây đúng lúc thấy có vài thiết bị đáng giá, quân đội đều đi đánh trận cả rồi, giờ ở đây cũng chẳng có ai, nên mới muốn tranh thủ trộm ít đồ đi đổi tiền."
lang_multi_text.db,MultiText,Huanglong_main_1_2EX_43_7,侦测塔的损坏可能会让这个方位突然出现残象潮入侵。,A damaged Detection Beacon might result in a sudden TD invasion from the direction it covers.,Tháp trinh sát bị hỏng có thể khiến phương vị này đột ngột xuất hiện đợt xâm lăng của Triều Tàn Tượng.
lang_multi_text.db,MultiText,Huanglong_main_1_2EX_43_8,你们有没有想过，如果真的发生了这种事情，前线将士们将陷入腹背受敌的境地。,Our frontline troops would face attacks from both sides. Have you thought about the consequences?,"Các người có nghĩ tới chưa, nếu chuyện đó thực sự xảy ra, các tướng sĩ tiền tuyến sẽ rơi vào tình cảnh bụng lưng thọ địch."
lang_multi_text.db,MultiText,Huanglong_main_1_2EX_43_9,我们管不了那么多！要是不偷，残象潮还没来呢，我们就先饿死在这了！,"We ain't got the time for that! If we don't steal, we'd starve to death before the Tacet Discords kill us.","Chúng tôi không lo được nhiều như thế! Nếu không trộm, Triều Tàn Tượng chưa tới thì chúng tôi đã chết đói ở đây rồi!"
lang_multi_text.db,MultiText,Huanglong_main_1_2EX_43_10,不可窃取公物，请把零件还回去。,You shouldn't be stealing public property. Please return the parts.,"Không được trộm cắp của công, hãy trả lại linh kiện đi."
lang_multi_text.db,MultiText,Huanglong_main_1_2EX_43_11,这里到今州城还有段距离，我这有锅盔，给你们吃吧。,"There's still some distance from here to Jinzhou city. Here, you can have my flatbreads.","Từ đây đến thành Kim Châu còn một đoạn đường nữa, tôi có bánh nướng đây, cho các vị ăn đấy."
lang_multi_text.db,MultiText,Huanglong_main_1_2EX_43_12,这饼你拿着吧，喏，这还有一些吃的，还有这些钱你们也拿着，这些应该足够你们走到今州城了。,And here's some money. This should be enough for you to reach the city.,"Bánh này cầm lấy đi, đây, còn chút đồ ăn nữa, cả số tiền này các vị cũng cầm lấy, chỗ này chắc đủ để mọi người đi đến thành Kim Châu rồi."
lang_multi_text.db,MultiText,Huanglong_main_1_2EX_43_13,这些……都给我们？谢谢……谢谢！,You're giving us... all of these? Thank you. Thank you!,Chỗ này... đều cho chúng tôi sao? Cảm ơn... cảm ơn!
lang_multi_text.db,MultiText,Huanglong_main_1_2EX_43_14,你！你们别抢！别光顾着吃了！快来谢谢恩人啊！,Hey! You! Come over and say thank you before you eat!,Này! Mấy người đừng tranh nhau! Đừng chỉ lo ăn! Mau lại cảm ơn ân nhân đi!
lang_multi_text.db,MultiText,Huanglong_main_1_2EX_43_15,师父说过，常善救人，故无弃人。所以，不必客气！,"It was nothing. Master once told me, ""The sage takes care of all men, and abandons none.""","Sư phụ từng nói, thường thiện cứu người, nên không bỏ ai. Vậy nên, không cần khách sáo!"
lang_multi_text.db,MultiText,Huanglong_main_1_2EX_43_16,小心！,Watch out!,Cẩn thận!
lang_multi_text.db,MultiText,Huanglong_main_1_2EX_43_17,你们对这些“平民”施以援手，没成想对方不仅是破坏侦察塔的元凶，竟然还恩将仇报心生歹意。这下便不用吝惜拳脚了！,"You offer assistance to the ""civilians"" responsible for damaging the Detection Beacon, but they repay your kindness with violence. You have no choice but to teach them a lesson.","Các bạn ra tay giúp đỡ những ""thường dân"" này, không ngờ đối phương không chỉ là thủ phạm phá hoại tháp trinh sát mà còn lấy oán báo ân, nảy sinh ý đồ xấu. Lần này thì không cần nương tay nữa rồi!"
lang_multi_text.db,MultiText,Huanglong_main_1_2EX_44_1,停停停！我们认输！我们错了！别打了！真倒霉……,"We're beggin' ya, stop! We surrender. Take us in!",Dừng dừng dừng! Chúng tôi nhận thua! Chúng tôi sai rồi! Đừng đánh nữa! Xui xẻo thật...
lang_multi_text.db,MultiText,Huanglong_main_1_2EX_44_2,我已经给了你们食物与钱，为什么还要抢劫？,Why did you attack us when I already gave you food and funds?,"Tiểu đạo đã cho các vị thức ăn và tiền rồi, tại sao còn muốn cướp bóc?"
lang_multi_text.db,MultiText,Huanglong_main_1_2EX_44_3,难道除了我们看到的这些人，你们还有其他同伴吗？,"Do you have other mouths to feed, aside from what we see here?","Lẽ nào ngoài những người chúng tôi nhìn thấy, các vị còn đồng bọn khác sao?"
lang_multi_text.db,MultiText,Huanglong_main_1_2EX_44_8,看装扮和身手……你们应该不是普通百姓吧？,They seem trained... These are not ordinary people.,Nhìn cách ăn mặc và thân thủ... các vị chắc không phải dân thường đâu nhỉ?
lang_multi_text.db,MultiText,Huanglong_main_1_2EX_44_9,说！你们到底是谁！,Who are you?,Nói! Các người rốt cuộc là ai!
lang_multi_text.db,MultiText,Huanglong_main_1_2EX_44_10,谁说我们不是普通百姓！我们是啊！只不过……前段时间刚刚成为流放者而已。,O-of course we are ordinary people! We just... we just joined the Exiles recently.,Ai bảo bọn ta không phải dân thường! Bọn ta đúng là dân thường mà! Chỉ là... thời gian trước vừa mới trở thành Kẻ Lưu Đày thôi.
lang_multi_text.db,MultiText,Huanglong_main_1_2EX_44_11,本来是想出城躲开巡尉抓捕，谁能想到北边战事这么快就严重起来了，我们在营地里人还没认熟呢，老大的家底就被掏空了，我们想了想还是回城算了……,"We done some wrongs. Tried to run from them Patrollers and left the city, but dang, didn't know the battles up north were so crazy. Our new boss ran outta food before we could even figure out the camp. Figured we'd be better off just go back to the city and get locked up...","Vốn định ra khỏi thành để tránh sự truy bắt của Tuần Úy, ai ngờ chiến sự phía Bắc lại nghiêm trọng nhanh đến thế. Chúng tôi ở trong trại còn chưa quen mặt nhau thì gia sản của lão đại đã bị vét sạch rồi, nghĩ đi nghĩ lại chúng tôi vẫn là về thành thì hơn..."
lang_multi_text.db,MultiText,Huanglong_main_1_2EX_44_12,我们走到半路，粮食和钱确实不够了，这才打起偷东西的主意的。,Then we ran outta food and cash halfway. So we turned to thieving.,"Đi được nửa đường thì lương thực và tiền quả thực không đủ nữa, thế nên mới nảy ra ý định trộm đồ."
lang_multi_text.db,MultiText,Huanglong_main_1_2EX_44_13,要不是赶上军营这边没人，我们也不敢来偷军队的零件……,"We ain't got the balls to rob the army, but with stuff just sitting around, why not?","Nếu không phải đúng lúc doanh trại bên này vắng người, chúng tôi cũng chẳng dám đến trộm linh kiện của quân đội đâu..."
lang_multi_text.db,MultiText,Huanglong_main_1_2EX_44_14,对了，既然你们好心，不如再多给我们些盘缠吧。你看我们这么多人，现在又负伤一批，这点东西真的不够用啊……,"Hey, since you're being so generous, how about you throw a little extra cash our way? There's a bunch of us, some injured too. Your first amount ain't gonna cut it for us to survive.","Phải rồi, nếu các người đã có lòng tốt, hay là cho chúng tôi thêm chút lộ phí đi. Nhìn xem chúng tôi đông người thế này, giờ lại có một đám bị thương, chút đồ đó thật sự không đủ dùng đâu..."
lang_multi_text.db,MultiText,Huanglong_main_1_2EX_44_15,我们还有些物资。,We have some spare supplies.,Chúng tôi còn chút vật tư.
lang_multi_text.db,MultiText,Huanglong_main_1_2EX_44_16,等等，刚才给的物资应该已经足够他们到今州城了，应当还有一些富余。,Wait. What I gave them was more than enough for them to make it to Jinzhou.,"Khoan đã, số vật tư vừa đưa hẳn là đã đủ để họ đến thành Kim Châu rồi, đáng lẽ còn dư dả một chút mới đúng."
lang_multi_text.db,MultiText,Huanglong_main_1_2EX_44_17,小道曾净身下山，知道一个人存活于世、行至今州需要多少物资。,I used to travel alone when I left my Master. I know how much it takes for someone to survive.,"Tiểu đạo từng xuống núi với hai bàn tay trắng, biết rõ một người sống trên đời, đi đến Kim Châu cần bao nhiêu vật tư."
lang_multi_text.db,MultiText,Huanglong_main_1_2EX_44_18,嘿！你这丫头怎么回事！多给点怎么了，我看你们也不缺啊！,"Hey! What's wrong with you, girlie? It won't hurt to give us more!","Này! Con nhóc nhà ngươi bị sao thế! Cho thêm chút thì có làm sao, ta thấy các ngươi cũng đâu có thiếu!"
