db_file,table_name,id,zh,en,vi
lang_multi_text.db,MultiText,Character_ChangLi_3_2,（询问字条中的提到的内容）,(Ask about the riddle in Changli's note.),(Hỏi về nội dung được nhắc đến trong tờ giấy)
lang_multi_text.db,MultiText,Character_ChangLi_3_20,你也别怪我说话直，我是见你一脸清澈，一看就很容易被骗才提醒你的……看你的装束，不是今州本地人吧？,"I hope you don't mind my frankness. Just giving some advice, 'cause you look pretty innocent and gullible... Not from Jinzhou judging by your outfit, right?","Ngươi cũng đừng trách ta nói thẳng, ta thấy mặt ngươi ngây thơ, nhìn là biết dễ bị lừa nên mới nhắc nhở ngươi... Nhìn trang phục của ngươi, không phải người bản địa Kim Châu đúng không?"
lang_multi_text.db,MultiText,Character_ChangLi_3_21,我是那个技高一筹的贵客。,I am that VIP guest.,Tôi là vị khách quý cao tay hơn một bậc đó đây.
lang_multi_text.db,MultiText,Character_ChangLi_3_22,他们都叫我漂泊者。,People call me Rover.,Họ đều gọi tôi là Lữ Khách.
lang_multi_text.db,MultiText,Character_ChangLi_3_23,……,...,...
lang_multi_text.db,MultiText,Character_ChangLi_3_24,…………,...,............
lang_multi_text.db,MultiText,Character_ChangLi_3_25,我突然想起我有点事，先走了……,"Oh shoot, I completely forgot about something I need to do. Sorry, gotta run...","Ta chợt nhớ ra ta có chút việc, đi trước đây..."
lang_multi_text.db,MultiText,Character_ChangLi_3_3,啊，呃，问路啊……我不是虹镇本地人，帮不到你。,"Huh? Uh... You're just asking for directions...? Sorry, I'm not a local, can't help you there.","A, ơ, hỏi đường à... Ta không phải người bản địa Hồng Trấn, không giúp được ngươi đâu."
lang_multi_text.db,MultiText,Character_ChangLi_3_4,等下，你是……刚才和长离大人说话的那个？,"Wait, you... you were the one talking to Lady Changli earlier, weren't you?","Khoan đã, ngươi là... người vừa nói chuyện với đại nhân Trường Ly lúc nãy?"
lang_multi_text.db,MultiText,Character_ChangLi_3_5,青年四下张望，似乎是在惧怕暗处隐藏着什么可怕的东西。,"The young man begins looking around warily, as if in fear of something terrible hidden in the shadows.","Thanh niên nhìn quanh quất, dường như đang sợ hãi thứ gì đó đáng sợ ẩn trong bóng tối."
lang_multi_text.db,MultiText,Character_ChangLi_3_6,奉劝你离她远点，那人心思深不可测，尤其喜欢玩弄人心，是个不折不扣的佞臣，当心被她利用还不自知啊。,"If I were you, I'd steer clear of her. She's a deceitful woman who enjoys toying with people's hearts. A cunning villain who will manipulate you without you even knowing it.","Khuyên ngươi tránh xa ả ta ra, người đó tâm tư thâm sâu khó lường, đặc biệt thích đùa giỡn lòng người, là một nịnh thần chính hiệu, cẩn thận bị ả lợi dụng mà không biết đấy."
lang_multi_text.db,MultiText,Character_ChangLi_3_7,为什么这么说？,How so?,Tại sao lại nói vậy?
lang_multi_text.db,MultiText,Character_ChangLi_3_8,你不知道吗？她放着大官不当，跑到这边陲小城来，里面肯定有什么阴谋。,"Haven't you heard? She left her government job to come here, to this small town. There's gotta be a reason behind it.","Ngươi không biết sao? Ả đang làm quan lớn không làm, chạy đến cái thành nhỏ biên giới này, bên trong chắc chắn có âm mưu gì đó."
lang_multi_text.db,MultiText,Character_ChangLi_3_9,表面说是自请，说不定是她在明庭做了什么坏事才被贬谪过来……,"I heard she chose to quit her job, but I bet she messed up back in the capital and got demoted here as punishment.","Ngoài mặt nói là tự xin đi, biết đâu là ả đã làm chuyện xấu gì ở Minh Đình nên mới bị giáng chức đến đây..."
lang_multi_text.db,MultiText,Character_ChangLi_40_1,我曾经生活的村子被残象潮毁灭，所有人都没能逃过残象的攻击。,The village I lived in got destroyed by those scary monsters.,"Ngôi làng tôi từng sống bị thủy triều Tàn Tượng hủy diệt, tất cả mọi người đều không thoát khỏi sự tấn công của Tàn Tượng."
lang_multi_text.db,MultiText,Character_ChangLi_40_2,我是唯一生存下来的人，因为在残象到来之前，我被村民藏在不会着火的地下室里。,They hid me in a safe basement... While everyone else died or ran away... No one except me made it out alive.,"Tôi là người duy nhất sống sót, vì trước khi Tàn Tượng đến, tôi được dân làng giấu trong tầng hầm không bắt lửa."
lang_multi_text.db,MultiText,Character_ChangLi_40_3,等我出去的时候……已经没有任何人回应我的话了。,When I came out... No one was there anymore.,Đợi đến khi tôi ra ngoài... đã không còn bất kỳ ai trả lời tôi nữa.
lang_multi_text.db,MultiText,Character_ChangLi_40_4,现在这里也不安全了……,"Now, I must get to somewhere safe...",Bây giờ ở đây cũng không an toàn nữa...
lang_multi_text.db,MultiText,Character_ChangLi_40_5,没事，现在你不是一个人了。,"It's okay, you're not alone anymore.","Không sao, bây giờ em không còn một mình nữa rồi."
lang_multi_text.db,MultiText,Character_ChangLi_40_6,我们一起找更安全的地方。,Let's go find somewhere safe together.,Chúng ta cùng tìm nơi an toàn hơn.
lang_multi_text.db,MultiText,Character_ChangLi_40_7,嗯……！,Okay...!,Vâng...!
lang_multi_text.db,MultiText,Character_ChangLi_40_8,小女孩自白她曾生活的村庄已被残象潮毁灭，所有人都死去了。残象到来前，她被村民藏在了防火的地下室里，这才逃过一劫。,The girl reveals her entire village was destroyed during a TD Outbreak. She only survived because some villagers hid her in a fireproof basement.,"Cô bé tự bạch rằng ngôi làng cô từng sống đã bị thủy triều Tàn Tượng hủy diệt, tất cả mọi người đều đã chết. Trước khi Tàn Tượng đến, cô được dân làng giấu trong tầng hầm chống lửa, nhờ đó mới thoát nạn."
lang_multi_text.db,MultiText,Character_ChangLi_41_1,唔……,Ugh...,Ưm...
lang_multi_text.db,MultiText,Character_ChangLi_41_10,那，那是因为我还不会控制……,T-That's because I don't know how to properly control it yet...,"Đó, đó là vì tôi chưa biết cách kiểm soát..."
lang_multi_text.db,MultiText,Character_ChangLi_41_11,教我认识“共鸣能力”的共鸣者说，我的能力如果使用不当就会折损寿命。,"The Resonator who taught me about my ""Forte"" said if I don't use it properly, I'll die young.","Cộng Hưởng Giả dạy tôi nhận biết ""năng lực cộng hưởng"" nói rằng, năng lực của tôi nếu sử dụng không đúng cách sẽ làm tổn hại tuổi thọ."
lang_multi_text.db,MultiText,Character_ChangLi_41_14,那个人说了很长一段我听不懂的话……还说，我不应该那么频繁地使用能力。,They also said a lot of things I couldn't understand... Told me I shouldn't use it too often.,"Người đó nói một tràng dài những lời tôi không hiểu... còn nói, tôi không nên sử dụng năng lực thường xuyên như vậy."
lang_multi_text.db,MultiText,Character_ChangLi_41_15,但是……不使用能力，就会被残象吃掉，被坏人杀掉……,"But... if I don't use my Forte, I'd get eaten by the Tacet Discords, or killed by the bad people...","Nhưng mà... không sử dụng năng lực, thì sẽ bị Tàn Tượng ăn thịt, bị người xấu giết chết..."
lang_multi_text.db,MultiText,Character_ChangLi_41_16,如果活不过现在，就算拥有再长的寿命，又有什么用呢？,What's the point of living a longer life if I can't even survive?,"Nếu không sống qua nổi hiện tại, thì dù có tuổi thọ dài đến đâu, cũng có tác dụng gì chứ?"
lang_multi_text.db,MultiText,Character_ChangLi_41_17,我想活下去，想要成为厉害的大人。,I want to live. I want to become a strong grown-up.,"Tôi muốn sống tiếp, muốn trở thành một người lớn thật lợi hại."
lang_multi_text.db,MultiText,Character_ChangLi_41_18,想要能好好地控制力量，帮助保护过我的人。,"I want to have good control of my power, and protect the people who protected me in the past.","Muốn có thể kiểm soát tốt sức mạnh, giúp bảo vệ những người từng bảo vệ tôi."
lang_multi_text.db,MultiText,Character_ChangLi_41_19,到那时候……盛世太平，一定就不远了。,And then... And then I'll make a peaceful and prosperous world for everyone.,"Đến lúc đó... thịnh thế thái bình, nhất định sẽ không còn xa nữa."
lang_multi_text.db,MultiText,Character_ChangLi_41_2,你的手……,Your hands...,Tay của em...
lang_multi_text.db,MultiText,Character_ChangLi_41_20,盛世太平……,A peaceful and prosperous world for everyone...,Thịnh thế thái bình...
lang_multi_text.db,MultiText,Character_ChangLi_41_21,真是伟大的梦想。,That's a respectable goal.,Quả là một ước mơ vĩ đại.
lang_multi_text.db,MultiText,Character_ChangLi_41_22,嗯，是村子里的教书先生说过的话，意思就是不会再有孩子被残象攻击，大家都能吃饱饭，有安稳的家。,"Yes. According to the village teacher, that means children will no longer be in danger from monsters. We'll all have enough to eat and stable lives.","Vâng, là lời thầy giáo trong làng đã nói, ý nghĩa là sẽ không còn đứa trẻ nào bị Tàn Tượng tấn công, mọi người đều được ăn no, có mái nhà yên ổn."
lang_multi_text.db,MultiText,Character_ChangLi_41_23,但我什么都不懂……所以要找很厉害的人拜师才行。,"But I've still got lots to learn... so I'll need to find someone really strong, and learn from them.",Nhưng tôi chẳng hiểu gì cả... nên phải tìm người thật lợi hại để bái sư mới được.
lang_multi_text.db,MultiText,Character_ChangLi_41_24,你会找到很厉害的师父的。,You will find a great mentor.,Em sẽ tìm được người sư phụ rất lợi hại.
lang_multi_text.db,MultiText,Character_ChangLi_41_25,也能成为很厉害的人。,And you'll become very strong yourself.,Cũng sẽ trở thành người rất lợi hại.
lang_multi_text.db,MultiText,Character_ChangLi_41_26,嗯……,Thank you...,Vâng...
lang_multi_text.db,MultiText,Character_ChangLi_41_27,如果，也能成为像你一样厉害的人就好了。,I want to become as strong as you are...,"Nếu như, cũng có thể trở thành người lợi hại như bạn thì tốt biết mấy."
lang_multi_text.db,MultiText,Character_ChangLi_41_28,前提是……,"Sure, but promise me...",Tiền đề là...
lang_multi_text.db,MultiText,Character_ChangLi_41_29,要珍惜自己，好好活着。,"Promise me you'll take good care of yourself, okay?","Phải trân trọng bản thân, sống thật tốt."
lang_multi_text.db,MultiText,Character_ChangLi_41_3,很疼吗？,Does it hurt?,Có đau lắm không?
lang_multi_text.db,MultiText,Character_ChangLi_41_30,我，我知道了……我会努力的。,I-I understand... I'll do my best.,"Tôi, tôi biết rồi... Tôi sẽ cố gắng."
lang_multi_text.db,MultiText,Character_ChangLi_41_31,你从小女孩口中得知——她不顾寿命折损，为了活过当下而频繁地使用着能力，是因为她想要活着长大，成为能够帮助他人的大人。为了实现盛世太平的梦想，她必须找厉害的人拜师，学习本领。,"She confides that despite the toll her abilities take on her life, she uses them frequently to survive. Her dream is to grow up and become someone strong enough to help others. To bring peace to this world, she must find a skilled mentor to guide her.","Bạn biết được từ miệng cô bé - cô bé bất chấp tổn hại tuổi thọ, thường xuyên sử dụng năng lực để sống qua hiện tại, là vì cô bé muốn sống để trưởng thành, trở thành người lớn có thể giúp đỡ người khác. Để thực hiện ước mơ thịnh thế thái bình, cô bé phải tìm người lợi hại để bái sư, học hỏi bản lĩnh."
lang_multi_text.db,MultiText,Character_ChangLi_41_4,虽然看起来很可怕，但其实……一点也不疼。,"It might look kind of scary, but actually... it doesn't hurt at all.","Tuy trông có vẻ đáng sợ, nhưng thực ra... không đau chút nào đâu."
lang_multi_text.db,MultiText,Character_ChangLi_41_5,真的？,Are you sure?,Thật sao?
lang_multi_text.db,MultiText,Character_ChangLi_41_6,当然，我也是共鸣者，我的共鸣能力可是很强的，是火哦。,"Of course. I'm a Resonator too, you know. My Forte is a powerful one. I control fire.","Đương nhiên, tôi cũng là Cộng Hưởng Giả, năng lực cộng hưởng của tôi rất mạnh đấy, là lửa đó nha."
lang_multi_text.db,MultiText,Character_ChangLi_41_7,没有什么比火焰更明亮，更温暖……它能驱逐寒冷，赶跑怪物。,Nothing's brighter and warmer than the fire... it can burn away the cold and drive away monsters.,"Không có gì sáng hơn, ấm áp hơn ngọn lửa... Nó có thể xua tan cái lạnh, đuổi chạy quái vật."
lang_multi_text.db,MultiText,Character_ChangLi_41_8,可你也会被灼伤。,But the fire could burn yourself too.,Nhưng em cũng sẽ bị bỏng.
lang_multi_text.db,MultiText,Character_ChangLi_41_9,但你看上去很虚弱……,But you look very tired...,Nhưng trông em rất yếu ớt...
lang_multi_text.db,MultiText,Character_ChangLi_42_1,好奇怪……本应该是已经很熟悉的地方，却又有很多从没见过的东西……,"What a strange place... It's supposed to look familiar, but there are so many things I've never seen before...","Kỳ lạ thật... Vốn dĩ phải là nơi rất quen thuộc, nhưng lại có rất nhiều thứ chưa từng thấy bao giờ..."
lang_multi_text.db,MultiText,Character_ChangLi_42_2,这个门……,This door...,Cánh cổng này...
lang_multi_text.db,MultiText,Character_ChangLi_42_5,……虽然不知道为什么，但我总觉得我好像来过这里，真奇怪……,"... I don't know why, but I keep getting the feeling that I've been here before, it's so weird...","...Tuy không biết tại sao, nhưng tôi luôn cảm thấy dường như mình đã từng đến đây, thật kỳ lạ..."
lang_multi_text.db,MultiText,Character_ChangLi_42_6,我们再四处找一找吧，说不定会有什么线索。,Let's look around... Maybe we'll find something.,"Chúng ta tìm xung quanh xem sao, biết đâu sẽ có manh mối gì."
lang_multi_text.db,MultiText,Character_ChangLi_43_1,哇……！,Whoa...!,Oa...!
lang_multi_text.db,MultiText,Character_ChangLi_43_10,我，我还不饿……,I-I'm not hungry yet...,"Tôi, tôi chưa đói..."
lang_multi_text.db,MultiText,Character_ChangLi_43_2,找到了吗？,Did you find something?,Tìm thấy chưa?
lang_multi_text.db,MultiText,Character_ChangLi_43_3,是干粮……保存得很好，还可以吃！,"I found some dry rations... They look well-kept, should be still edible!","Là lương khô... bảo quản rất tốt, vẫn còn ăn được!"
lang_multi_text.db,MultiText,Character_ChangLi_43_4,有点被冻住了……没关系，我可以用火热一热。,"It's a bit frozen... No worries, I can use my fire to heat it up.","Hơi bị đông đá một chút... không sao, tôi có thể dùng lửa hâm nóng lại."
lang_multi_text.db,MultiText,Character_ChangLi_43_5,{Male=大哥哥;Female=大姐姐}，你的肚子饿不饿？我都没有见过你吃东西……,Are you hungry? I haven't seen you take a single bite...,"{Male=Anh;Female=Chị} ơi, bụng {Male=anh;Female=chị} có đói không? Tôi chưa thấy {Male=anh;Female=chị} ăn gì cả..."
lang_multi_text.db,MultiText,Character_ChangLi_43_6,都给你。,You can have these.,Cho em hết đấy.
lang_multi_text.db,MultiText,Character_ChangLi_43_7,谢谢你，我还不饿。,Thank you. I'm not hungry.,"Cảm ơn em, tôi chưa đói."
lang_multi_text.db,MultiText,Character_ChangLi_43_8,那你呢？,What about you?,Còn em thì sao?
lang_multi_text.db,MultiText,Character_ChangLi_43_9,太久不吃东西，会走不动路的。,"If you don't eat anything for too long, you won't be able to walk.","Lâu quá không ăn gì, sẽ không đi nổi đâu."
lang_multi_text.db,MultiText,Character_ChangLi_44_1,这里有一张纸条……已经发黄了。,There's a piece of paper... It has turned yellow.,Ở đây có một tờ giấy... đã ố vàng rồi.
lang_multi_text.db,MultiText,Character_ChangLi_44_2,……村落被袭，空有本领却未护住一人，如今伤重难治，也命不久矣，只余一些口粮，赠予来者。,"...When the village was raided, I failed to protect anyone with all my efforts. Now all I'm left with are these old injuries and the rest of my meager life, and some food to spare for anyone who passes by.","...Thôn xóm bị tấn công, có bản lĩnh nhưng không bảo vệ được một ai, nay trọng thương khó chữa, mạng cũng chẳng còn bao lâu, chỉ còn lại ít lương thực, tặng cho người đến sau."
lang_multi_text.db,MultiText,Character_ChangLi_44_3,……,…,...
lang_multi_text.db,MultiText,Character_ChangLi_44_4,如果我能早到一些……,If I had arrived sooner...,Nếu tôi có thể đến sớm hơn một chút...
lang_multi_text.db,MultiText,Character_ChangLi_44_5,这并不是你的错。,It's not your fault.,Đây không phải lỗi của em.
lang_multi_text.db,MultiText,Character_ChangLi_44_6,已经过去很久了。,It's a thing of the past now.,Đã qua lâu rồi.
lang_multi_text.db,MultiText,Character_ChangLi_44_7,……嗯。,...Okay.,...Vâng.
lang_multi_text.db,MultiText,Character_ChangLi_45_1,这是什么……有点看不懂。,What is this all about? I don't understand...,Đây là gì... hơi khó hiểu.
lang_multi_text.db,MultiText,Character_ChangLi_46_1,这是……,This is...,Đây là...
lang_multi_text.db,MultiText,Character_ChangLi_46_2,（……是过去的幻影。）,(... A mirage of the past.),(...Là ảo ảnh của quá khứ.)
lang_multi_text.db,MultiText,Character_ChangLi_46_3,（这个地方……也似曾相识。）,"(This place... It looks familiar, too.)",(Nơi này... cũng dường như đã từng quen biết.)
lang_multi_text.db,MultiText,Character_ChangLi_46_4,（在这个蜃境中重现的，是我的回忆。）,(These are my memories... recreated inside this Sonoro Sphere.),"(Thứ tái hiện trong Thận Cảnh này, là ký ức của ta.)"
lang_multi_text.db,MultiText,Character_ChangLi_46_5,（从进入这里起，漂泊者和残星会都不见踪影……频率扰动不休，时流的混乱也与曾经结界破损的乘霄山相同……）,"(As I stepped inside, both Rover and the Fractsidus vanished into thin air. The frequencies are constantly changing, and the flow of time is chaotic, just like it had been on Mt. Firmament...)","(Kể từ khi vào đây, Lữ Khách và Tàn Tinh Hội đều không thấy tăm hơi... Tần số dao động không ngừng, sự hỗn loạn của dòng thời gian cũng giống hệt Thừa Tiêu Sơn khi kết giới bị phá vỡ năm xưa...)"
lang_multi_text.db,MultiText,Character_ChangLi_46_6,（这是混杂着时间乱流的蜃境……一旦迷失便有再也无法走出的可能，如果它与师父有关……）,"(A Sonoro Sphere affected by Temporal Disruption… Once someone enters, there's a risk of being stuck inside forever. And if my master had planned all of this...)","(Đây là Thận Cảnh hỗn tạp dòng chảy nhiễu loạn thời gian... một khi lạc lối sẽ có khả năng vĩnh viễn không thể thoát ra, nếu nó có liên quan đến sư phụ...)"
lang_multi_text.db,MultiText,Character_ChangLi_46_7,（是为误导，还是筛选，亦或者……）,"(Did he do this to mislead, to separate, or perhaps...)","(Là để đánh lạc hướng, hay là sàng lọc, hay là...)"
lang_multi_text.db,MultiText,Character_ChangLi_46_8,（谨慎前进，无论如何……要先找到{PlayerName}。）,(I should be careful. Whatever the case... I must find {PlayerName} first.),"(Cẩn thận tiến lên, dù thế nào đi nữa... phải tìm thấy {PlayerName} trước đã.)"
lang_multi_text.db,MultiText,Character_ChangLi_46_9,你和小女孩见到了长离的幻影，另一边，长离看到道路上有许多过去自己的幻影。她揣度着这场迷局的真意，决定无论如何要先找到你。,"You and the girl encounter a mirage of Changli, while elsewhere, Changli sees multiple reflections of her past self. She ponders over it and resolves to find you at all costs.","Bạn và cô bé nhìn thấy ảo ảnh của Trường Ly, ở một bên khác, Trường Ly nhìn thấy trên đường có rất nhiều ảo ảnh quá khứ của chính mình. Cô ấy suy đoán chân ý của mê cục này, quyết định dù thế nào cũng phải tìm thấy bạn trước."
lang_multi_text.db,MultiText,Character_ChangLi_47_1,好饿……,I'm starving...,Đói quá...
lang_multi_text.db,MultiText,Character_ChangLi_47_2,这个，拿火烧一下的话，应该是可以吃的吧？,"This thing... Umm, if I burn it a bit with my fire... I can eat it, I guess?","Cái này, nếu dùng lửa nướng một chút, chắc là ăn được nhỉ?"
lang_multi_text.db,MultiText,Character_ChangLi_47_3,……,...,...
lang_multi_text.db,MultiText,Character_ChangLi_48_1,我没有……,I-I didn't...,Tôi không có...
lang_multi_text.db,MultiText,Character_ChangLi_48_2,你这小偷，还想狡辩？,"Don't try to play me, you little thief.","Đồ ăn trộm kia, còn muốn chối cãi sao?"
lang_multi_text.db,MultiText,Character_ChangLi_48_3,这些是我自己找到的……！,I found these all by myself...!,Những thứ này là tôi tự tìm được...!
lang_multi_text.db,MultiText,Character_ChangLi_48_4,别开玩笑了，像你这样的小乞丐哪能搞到这么多粮食？,Ha! You think I'm buying this story? How the hell does a little homeless brat like you score all this food?,"Đừng đùa nữa, đứa ăn mày nhỏ như mày làm sao kiếm được nhiều lương thực thế này?"
lang_multi_text.db,MultiText,Character_ChangLi_48_5,这是我们的地盘，识相就赶快滚。,This is our turf. Better scurry off if you know what's good for you...,"Đây là địa bàn của bọn tao, biết điều thì mau cút đi."
lang_multi_text.db,MultiText,Character_ChangLi_48_6,不如……让她留下？你看她也……,"Why don't we... let her stay? See, she's a...",Hay là... cho nó ở lại? Mày xem nó cũng...
lang_multi_text.db,MultiText,Character_ChangLi_48_7,……不行，我们那么多张嘴等着吃饭，难道她的那份从你碗里抠？,...We've got plenty of mouths to feed already. Unless you're planning to have her eat from your plate?,"...Không được, chúng ta có bao nhiêu miệng ăn đang chờ, lẽ nào phần của nó trích từ bát của mày ra?"
lang_multi_text.db,MultiText,Character_ChangLi_49_1,呼……呼……我还能……,Huff... Hah... I-I can do it...,Hộc... hộc... Tôi vẫn còn có thể...
lang_multi_text.db,MultiText,Character_ChangLi_49_2,（是了，那时的我尚不知如何控制离火，只会用蛮力脱困……总是落得遍体鳞伤。）,"(Yes, back then, I didn't know how to control my flames. I could only brute force my way out it, and my body was always covered in burns...)","(Đúng rồi, ta của lúc đó vẫn chưa biết cách kiểm soát Ly Hỏa, chỉ biết dùng sức mạnh thô bạo để thoát thân... luôn khiến bản thân đầy thương tích.)"
lang_multi_text.db,MultiText,Character_ChangLi_4_1,唔……怎么一眨眼就不见了……啊，你难道是那个拯救了今州的传奇漂泊者？！,"Uhh... How did she disappear like that? Wait, are you that legendary Rover who saved Jinzhou?!","Ừm... Sao chớp mắt cái đã không thấy đâu rồi... A, lẽ nào ngài là Lữ Khách huyền thoại đã cứu Kim Châu đó sao?!"
lang_multi_text.db,MultiText,Character_ChangLi_4_10,这么厉害？,Really?,Lợi hại vậy sao?
lang_multi_text.db,MultiText,Character_ChangLi_4_11,对啊！而且她为了瑝珑天下太平，自请下今州辅佐今汐大人，从此自愿隐于幕后，殚精竭虑……,"Yeah! And she came all the way to Jinzhou to help out Magistrate Jinhsi for the sake of peace in Huanglong. She's been working tirelessly behind the scenes since then, fully dedicated to her task...","Đúng vậy! Hơn nữa vì thiên hạ Hoàng Long thái bình, cô ấy đã tự xin xuống Kim Châu phò tá đại nhân Kim Tịch, từ đó tự nguyện lui về hậu trường, dốc hết tâm sức..."
lang_multi_text.db,MultiText,Character_ChangLi_4_12,这种无私之举，如何不让人敬仰？,How could anyone not revere such a selfless act?,"Hành động vô tư như vậy, sao có thể không khiến người ta ngưỡng mộ chứ?"
