db_file,table_name,id,zh,en,vi
lang_multi_text.db,MultiText,MapMark_3051026_MarkTitle,重启智造立方,Smartprint Cube Reboot,Khởi Động Lại Lập Phương Trí Tạo
lang_multi_text.db,MultiText,MapMark_3051027_MarkDesc,学院设置在地下的小型打印设施，当打印设施受虚质磁暴严重影响后，便会弹出立方阻断器，阻止虚质磁暴对设施核心部分的影响。当虚质磁暴影响减弱后，受影响弱的地区会自动校准，关闭阻断器；严重受影响的地区则需要人工校准。,"Beneath the Academy lies a series of small printing machines. When a Void Storm causes severe disruption, they deploy Cube Blockers to protect their core components.
After the Void Storm passes, less affected machines restore automatically. However, any heavily affected machines require manual reset.","Cơ sở in ấn nhỏ được Học Viện đặt dưới lòng đất. Khi bị ảnh hưởng nghiêm trọng bởi bão từ Hư Chất, thiết bị sẽ bật ra Bộ Chặn Lập Phương để ngăn bão từ tác động đến phần lõi. Sau khi bão từ suy yếu, những khu vực ít bị ảnh hưởng sẽ tự động hiệu chỉnh và tắt bộ chặn; còn những khu vực bị ảnh hưởng nặng thì cần hiệu chỉnh thủ công."
lang_multi_text.db,MultiText,MapMark_3051027_MarkTitle,重启智造立方,Smartprint Cube Reboot,Khởi Động Lại Lập Phương Trí Tạo
lang_multi_text.db,MultiText,MapMark_3051028_MarkDesc,需完成道路<color=Highlight>眶折谷公路南段</color>的修建后解锁。学院设置在地下的小型打印设施，当打印设施受虚质磁暴严重影响后，便会弹出立方阻断器，阻止虚质磁暴对设施核心部分的影响。当虚质磁暴影响减弱后，受影响弱的地区会自动校准，关闭阻断器；严重受影响的地区则需要人工校准。,"Unlocked after rebuilding <color=Highlight>Orbit Valley Pass - South</color>.

Beneath the Academy lies a series of small printing machines. When a Void Storm causes severe disruption, they deploy Cube Blockers to protect their core components.
After the Void Storm passes, less affected machines restore automatically. However, any heavily affected machines require manual reset.","Cần hoàn thành xây dựng tuyến đường <color=Highlight>Đoạn Nam Xa Lộ Thung Lũng Orbit</color> để mở khóa. Cơ sở in ấn nhỏ được Học Viện đặt dưới lòng đất. Khi bị ảnh hưởng nghiêm trọng bởi bão từ Hư Chất, thiết bị sẽ bật ra Bộ Chặn Lập Phương để ngăn bão từ tác động đến phần lõi. Sau khi bão từ suy yếu, những khu vực ít bị ảnh hưởng sẽ tự động hiệu chỉnh và tắt bộ chặn; còn những khu vực bị ảnh hưởng nặng thì cần hiệu chỉnh thủ công."
lang_multi_text.db,MultiText,MapMark_3051028_MarkTitle,重启智造立方,Smartprint Cube Reboot,Khởi Động Lại Lập Phương Trí Tạo
lang_multi_text.db,MultiText,MapMark_3051029_MarkDesc,学院设置在地下的小型打印设施，当打印设施受虚质磁暴严重影响后，便会弹出立方阻断器，阻止虚质磁暴对设施核心部分的影响。当虚质磁暴影响减弱后，受影响弱的地区会自动校准，关闭阻断器；严重受影响的地区则需要人工校准。,"Beneath the Academy lies a series of small printing machines. When a Void Storm causes severe disruption, they deploy Cube Blockers to protect their core components.
After the Void Storm passes, less affected machines restore automatically. However, any heavily affected machines require manual reset.","Cơ sở in ấn nhỏ được Học Viện đặt dưới lòng đất. Khi bị ảnh hưởng nghiêm trọng bởi bão từ Hư Chất, thiết bị sẽ bật ra Bộ Chặn Lập Phương để ngăn bão từ tác động đến phần lõi. Sau khi bão từ suy yếu, những khu vực ít bị ảnh hưởng sẽ tự động hiệu chỉnh và tắt bộ chặn; còn những khu vực bị ảnh hưởng nặng thì cần hiệu chỉnh thủ công."
lang_multi_text.db,MultiText,MapMark_3051029_MarkTitle,重启智造立方,Smartprint Cube Reboot,Khởi Động Lại Lập Phương Trí Tạo
lang_multi_text.db,MultiText,MapMark_3051030_MarkDesc,挑战竞速赛道，达成用时目标获取奖励。,A racing challenge track. Complete the course within the required time to earn rewards.,"Thử thách đường đua tốc độ, đạt mục tiêu thời gian để nhận thưởng."
lang_multi_text.db,MultiText,MapMark_3051030_MarkTitle,竞速挑战,Motorbike Racing,Thử Thách Đua Tốc Độ
lang_multi_text.db,MultiText,MapMark_3051033_MarkDesc,一处依靠太阳能加热的野外温泉。旅途之中，请您放松身心，尽情地抬头，仰望头顶那片美好的星空。,A remote hot spring warmed by the sun. Let the waters soothe you as you look up and lose yourself in the splendor of the night sky.,"Một suối nước nóng ngoài trời sưởi ấm bằng năng lượng mặt trời. Giữa hành trình, hãy thả lỏng thân tâm, ngẩng đầu ngắm nhìn bầu trời sao tuyệt đẹp phía trên."
lang_multi_text.db,MultiText,MapMark_3051033_MarkTitle,温泉观星,Hot Spring Stargazing,Ngắm Sao Suối Nóng
lang_multi_text.db,MultiText,MapMark_3051037_MarkDesc,前往路网阻塞点，清除阻塞源头，使路网恢复畅通。,Head to the Route Network Blockage and eliminate its source to restore normal traffic flow.,"Đến điểm tắc nghẽn mạng lưới đường, dọn sạch nguồn gây tắc nghẽn để khôi phục giao thông thông suốt."
lang_multi_text.db,MultiText,MapMark_3051037_MarkTitle,路网阻塞点,Route Network Blockage,Điểm Tắc Nghẽn Mạng Lưới Đường
lang_multi_text.db,MultiText,MapMark_3051041_MarkDesc,虚诞虫的异常活跃已被压制，学院危机暂告平息。区域内虚诞虫的活动逐渐恢复至常态巡游水平，但区域内的虚质扰动仍未完全散尽，仍需保持观测。,"The abnormal Voidworm activity has been contained, and the Academy's crisis has passed. While the Voidworm has returned to its normal route, lingering Voidmatter disturbances have yet to fully dissipate. Continued monitoring is required.","Hoạt động bất thường của Sâu Hư Không đã bị dập tắt, cuộc khủng hoảng tại Học Viện tạm thời lắng xuống. Hoạt động của Sâu Hư Không trong khu vực dần trở về mức tuần tra bình thường, nhưng nhiễu loạn Hư Chất trong vùng vẫn chưa tan hết, cần tiếp tục theo dõi."
lang_multi_text.db,MultiText,MapMark_3051041_MarkTitle,虚诞潜迹,Voidspawn Emergence,Dấu Vết Hư Sinh
lang_multi_text.db,MultiText,MapMark_3051050_MarkDesc,"深空联合文献中心，每日都会遭受来自世界各地的服务器攻击，尽职尽责的管理员小姐守护着学院的数据库，不让任何窥探的眼睛越雷池一步。然而，如此潇洒能干的管理员，如今也要向你求助……
矩阵之中，看不见的威胁接踵而至。在虚拟实境中击败敌人，完成这次特别的勤工俭学吧。","Every day, the Spacetrek Archive faces waves of server attacks from around Solaris. Its devoted administrator has long safeguarded the Academy's database, allowing no intruders to cross the line. But this time, even she must turn to you for help...
Within the matrix, invisible threats lie in wait. Dive into the virtual realm, defeat the enemies, and complete this special work-study program.","Trung Tâm Tư Liệu Liên Hợp Thâm Không mỗi ngày đều phải chịu các cuộc tấn công máy chủ từ khắp nơi trên thế giới. Cô quản lý tận tụy bảo vệ kho dữ liệu của Học Viện, không để bất kỳ con mắt dòm ngó nào vượt qua ranh giới. Thế nhưng, một quản lý tài giỏi như vậy giờ cũng phải nhờ đến sự giúp đỡ của bạn...
Trong ma trận, những mối đe dọa vô hình ập đến liên tiếp. Hãy đánh bại kẻ thù trong thực tại ảo và hoàn thành công việc làm thêm đặc biệt này."
lang_multi_text.db,MultiText,MapMark_3051050_MarkTitle,矩阵叠兵·先行版,Doubled Pawns Matrix: Pilot,Ma Trận Trùng Binh - Phiên Bản Thử Nghiệm
lang_multi_text.db,MultiText,MapMark_3051101_MarkDesc,学院安放的小型打印设施，当打印设施受虚质磁暴严重影响后，便会弹出立方阻断器，阻止虚质磁暴对设施核心部分的影响。当虚质磁暴减弱后，部分受虚质磁暴严重影响的打印设施需要人工操作，关闭掉阻断器使设施恢复正常的工作状态。,"A series of small printing machines installed by the Academy. When a Void Storm causes severe disruption, they deploy Cube Blockers to protect their core components.
After the Void Storm passes, any heavily affected machines require manual reset. Operators must disable the Cube Blockers to restore normal operation.","Cơ sở in ấn nhỏ do Học Viện lắp đặt. Khi bị ảnh hưởng nghiêm trọng bởi bão từ Hư Chất, thiết bị sẽ bật ra Bộ Chặn Lập Phương để ngăn bão từ tác động đến phần lõi. Sau khi bão từ Hư Chất suy yếu, một số cơ sở bị ảnh hưởng nặng cần được thao tác thủ công, tắt bộ chặn để khôi phục trạng thái hoạt động bình thường."
lang_multi_text.db,MultiText,MapMark_3051101_MarkTitle,重启智造立方·冰原地表,Smartprint Cube Reboot - Frostland Surface,Khởi Động Lại Lập Phương Trí Tạo - Bề Mặt Băng Nguyên
lang_multi_text.db,MultiText,MapMark_3052001_MarkDesc,通过造路悬仪生成技巧挑战赛道，穿过积分圈完成挑战，获取奖励。,Use the Route Constructor to generate a skill-based race track. Pass through all Score Rings to complete the challenge and claim your reward.,"Sử dụng Thiết Bị Tạo Đường để tạo đường đua thử thách kỹ năng, đi qua các vòng tính điểm để hoàn thành thử thách và nhận thưởng."
lang_multi_text.db,MultiText,MapMark_3052001_MarkTitle,造路悬仪挑战赛道1,Route Constructor Racing Challenge I,Đường Đua Thử Thách Thiết Bị Tạo Đường 1
lang_multi_text.db,MultiText,MapMark_3052002_MarkTitle,造路悬仪挑战赛道2,Route Constructor Racing Challenge II,Đường Đua Thử Thách Thiết Bị Tạo Đường 2
lang_multi_text.db,MultiText,MapMark_3052003_MarkTitle,造路悬仪挑战赛道3,Route Constructor Racing Challenge III,Đường Đua Thử Thách Thiết Bị Tạo Đường 3
lang_multi_text.db,MultiText,MapMark_3052004_MarkTitle,造路悬仪挑战赛道4,Route Constructor Racing Challenge IV,Đường Đua Thử Thách Thiết Bị Tạo Đường 4
lang_multi_text.db,MultiText,MapMark_3052005_MarkTitle,造路悬仪挑战赛道5,Route Constructor Racing Challenge V,Đường Đua Thử Thách Thiết Bị Tạo Đường 5
lang_multi_text.db,MultiText,MapMark_3052006_MarkTitle,造路悬仪挑战赛道6,Route Constructor Racing Challenge VI,Đường Đua Thử Thách Thiết Bị Tạo Đường 6
lang_multi_text.db,MultiText,MapMark_3052007_MarkTitle,造路悬仪挑战赛道7,Route Constructor Racing Challenge VII,Đường Đua Thử Thách Thiết Bị Tạo Đường 7
lang_multi_text.db,MultiText,MapMark_3052008_MarkTitle,造路悬仪挑战赛道8,Route Constructor Racing Challenge VIII,Đường Đua Thử Thách Thiết Bị Tạo Đường 8
lang_multi_text.db,MultiText,MapMark_3052009_MarkTitle,造路悬仪挑战赛道9,Route Constructor Racing Challenge IX,Đường Đua Thử Thách Thiết Bị Tạo Đường 9
lang_multi_text.db,MultiText,MapMark_3052010_MarkTitle,造路悬仪挑战赛道10,Route Constructor Racing Challenge X,Đường Đua Thử Thách Thiết Bị Tạo Đường 10
lang_multi_text.db,MultiText,MapMark_3052011_MarkTitle,造路悬仪挑战赛道11,Route Constructor Racing Challenge XI,Đường Đua Thử Thách Thiết Bị Tạo Đường 11
lang_multi_text.db,MultiText,MapMark_3052012_MarkTitle,造路悬仪挑战赛道12,Route Constructor Racing Challenge XII,Đường Đua Thử Thách Thiết Bị Tạo Đường 12
lang_multi_text.db,MultiText,MapMark_3053001_MarkDesc,"敏娜刚刚买到自己人生中的第一个终端，但她似乎不太会用……
在她把终端弄坏前，也许可以去浮光林里帮帮她。","Minna has just bought her very first Terminal, but she doesn't seem to have the faintest idea how to use it...
Find her in Bjartr Woods and lend a hand before she accidentally breaks it.","Minna vừa mua chiếc thiết bị đầu tiên trong đời, nhưng cô ấy có vẻ không biết dùng lắm...
Trước khi cô ấy làm hỏng nó, có lẽ bạn nên đến Rừng Bjartr giúp cô ấy một tay."
lang_multi_text.db,MultiText,MapMark_3053001_MarkTitle,光的来处,Where Light Takes Shape,Nơi Ánh Sáng Sinh Ra
lang_multi_text.db,MultiText,MapMark_3053002_MarkDesc,你被一个终端的智能助理吸引了注意力，他提到了一条无人能抵达终点的赛道……,You've caught the attention of a particularly perceptive Terminal assistant. He claims there exists a race track where no one has ever crossed the finish line...,Bạn bị thu hút bởi một trợ lý thông minh trên thiết bị. Anh ta nhắc đến một đường đua mà chưa ai từng chạm tới đích...
lang_multi_text.db,MultiText,MapMark_3053002_MarkTitle,车手一号,No. 1 Biker,Tay Đua Số Một
lang_multi_text.db,MultiText,MapMark_3053003_MarkDesc,一段被风吹散的旋律，日灵们渴望再次将它奏响……去充斥回忆之地，和日灵们一起复原完整的“乐谱”吧，若乐声重新响起，沉睡的故事也将随之苏醒。,"A melody, once scattered to the winds, is now sought by Soliskin who yearn to hear it whole again. 
Follow them to a place heavy with memory. Work with the Soliskin to restore the lost ""music sheet."" If the music returns, the story it holds may finally awaken.","Một giai điệu bị gió cuốn tan tác, những Tinh Linh Mặt Trời khao khát được tấu lên lần nữa... Hãy đến nơi ngập tràn ký ức, cùng các Tinh Linh khôi phục bản ""nhạc phổ"" hoàn chỉnh. Nếu tiếng nhạc vang lên một lần nữa, câu chuyện đang ngủ say cũng sẽ thức giấc."
lang_multi_text.db,MultiText,MapMark_3053003_MarkTitle,失落的乐声,The Lost Melody,Tiếng Nhạc Đã Mất
lang_multi_text.db,MultiText,MapMark_3054001_MarkDesc,天帷机兵·跃送型特化定制了一只巨型机械臂，可将人员跃送至远处。,"Mechascout: Transition is equipped with a customized giant mech arm, powerful enough to send anyone flying a remarkable distance with a single throw.","Cơ Binh Thiên Vệ - Loại Phóng Chuyển được trang bị một cánh tay cơ khí khổng lồ tùy chỉnh, có thể phóng người đến nơi xa."
lang_multi_text.db,MultiText,MapMark_3054001_MarkTitle,天帷机兵·跃送型,Mechascout: Transition,Cơ Binh Thiên Vệ - Loại Phóng Chuyển
lang_multi_text.db,MultiText,MapMark_3070001_MarkDesc,掩于山体或地下的通路，应需而建，将人们紧密相连。,A route built through mountains or underground to facilitate transport and connect people.,"Tuyến đường ẩn trong lòng núi hoặc dưới lòng đất, được xây dựng theo nhu cầu, kết nối mọi người lại với nhau."
lang_multi_text.db,MultiText,MapMark_3070001_MarkTitle,落辉长隧,Lightfall Tunnel,Đường Hầm Lightfall
lang_multi_text.db,MultiText,MapMark_3070002_MarkDesc,掩于山体或地下的通路，应需而建，将人们紧密相连。,A route built through mountains or underground to facilitate transport and connect people.,"Tuyến đường ẩn trong lòng núi hoặc dưới lòng đất, được xây dựng theo nhu cầu, kết nối mọi người lại với nhau."
lang_multi_text.db,MultiText,MapMark_3070002_MarkTitle,联坠长廊·基座段,Riseway-Sundermere Corridor - Riseway Base,Hành Lang Riseway-Sundermere - Đoạn Nền Riseway
lang_multi_text.db,MultiText,MapMark_3070003_MarkDesc,掩于山体或地下的通路，应需而建，将人们紧密相连。,A route built through mountains or underground to facilitate transport and connect people.,"Tuyến đường ẩn trong lòng núi hoặc dưới lòng đất, được xây dựng theo nhu cầu, kết nối mọi người lại với nhau."
lang_multi_text.db,MultiText,MapMark_3070003_MarkTitle,联坠长廊·地下段,Riseway-Sundermere Corridor - Underground,Hành Lang Riseway-Sundermere - Ngầm
lang_multi_text.db,MultiText,MapMark_3070004_MarkDesc,"藏于山岩中或地下的隐秘之所,似乎通往了未知的某处......","A concealed passage in the rocks or underground, leading to an unknown destination...","Nơi bí ẩn ẩn trong vách núi hoặc dưới lòng đất, dường như dẫn đến một nơi nào đó chưa biết..."
lang_multi_text.db,MultiText,MapMark_3070004_MarkTitle,深浮长廊,Spacetrek-Bjartr Corridor,Hành Lang Spacetrek-Bjartr
lang_multi_text.db,MultiText,MapMark_3070005_MarkDesc,掩于山体或地下的通路，应需而建，将人们紧密相连。,A route built through mountains or underground to facilitate transport and connect people.,"Lối đi ẩn trong lòng núi hoặc dưới đất, được xây dựng theo nhu cầu, kết nối mọi người lại gần nhau."
lang_multi_text.db,MultiText,MapMark_3070005_MarkTitle,溺森涡道,Submerged Tunnel,Đường Xoáy Rừng Chìm
lang_multi_text.db,MultiText,MapMark_3070006_MarkDesc,"藏于山岩中或地下的隐秘之所,似乎通往了未知的某处......","A concealed passage in the rocks or underground, leading to an unknown destination...","Nơi bí ẩn ẩn trong vách núi hoặc dưới lòng đất, dường như dẫn đến một nơi nào đó chưa biết..."
lang_multi_text.db,MultiText,MapMark_3070006_MarkTitle,第一日树,The First Solistree,Solistree Thứ Nhất
lang_multi_text.db,MultiText,MapMark_3070007_MarkDesc,"藏于山岩中或地下的隐秘之所,似乎通往了未知的某处......","A concealed passage in the rocks or underground, leading to an unknown destination...","Nơi bí ẩn ẩn trong vách núi hoặc dưới lòng đất, dường như dẫn đến một nơi nào đó chưa biết..."
lang_multi_text.db,MultiText,MapMark_3070007_MarkTitle,第二日树,The Second Solistree,Solistree Thứ Hai
lang_multi_text.db,MultiText,MapMark_3070008_MarkDesc,"藏于山岩中或地下的隐秘之所,似乎通往了未知的某处......","A concealed passage in the rocks or underground, leading to an unknown destination...","Nơi bí ẩn ẩn trong vách núi hoặc dưới lòng đất, dường như dẫn đến một nơi nào đó chưa biết..."
lang_multi_text.db,MultiText,MapMark_3070008_MarkTitle,第三日树,The Third Solistree,Solistree Thứ Ba
lang_multi_text.db,MultiText,MapMark_3070009_MarkDesc,"藏于山岩中或地下的隐秘之所,似乎通往了未知的某处......","A concealed passage in the rocks or underground, leading to an unknown destination...","Nơi bí ẩn ẩn trong vách núi hoặc dưới lòng đất, dường như dẫn đến một nơi nào đó chưa biết..."
lang_multi_text.db,MultiText,MapMark_3070009_MarkTitle,第四日树,The Fourth Solistree,Solistree Thứ Tư
lang_multi_text.db,MultiText,MapMark_3110001_MarkDesc,找到走失的日灵，并将收集到的青实交还给元林再生舱中的巨日灵吧。巨日灵会将青实转为能量送还给日脉悬林……在那里新的日灵将会诞生。,"Seek out the lost Soliskin and bring the Soliseeds you gather to the Upphaf Life Chamber. There, the Giant Soliskin will convert the Soliseed's energy back to the Solvein Canopy, allowing new Soliskin to be born.","Tìm những Soliskin đi lạc và mang những Soliseed thu thập được trả lại cho Soliskin Khổng Lồ trong Buồng Tái Sinh Upphaf. Soliskin Khổng Lồ sẽ chuyển Soliseed thành năng lượng gửi về Tán Rừng Solvein... Tại đó, những Soliskin mới sẽ ra đời."
lang_multi_text.db,MultiText,MapMark_3110001_MarkTitle,青实归还之碑,Monument of Returning Soliseeds,Bia Hoàn Trả Soliseed
lang_multi_text.db,MultiText,MapMark_311006_MarkDesc,下层金库地区连通集域的梦境节点，完成挑战可收集梦境样本，获得奖励。 “只有财富才是世间的唯一真理。”,"A Dreamscape Node in the Vault Underground. Complete the challenge to claim Dream Samples and rewards. 
""Wealth is the only truth in the world.""","Điểm Mộng Cảnh kết nối tập vực tại khu vực tầng dưới Hầm Vàng. Hoàn thành thử thách để thu thập Mẫu Mộng Cảnh và nhận thưởng. 
""Chỉ có tài sản mới là chân lý duy nhất trên đời."""
lang_multi_text.db,MultiText,MapMark_311006_MarkDesc_Finish,下层金库地区连通集域的梦境节点，已完成该节点，可尝试再次挑战。 “只有财富才是世间的唯一真理。”,"A Dreamscape Node in the Vault Underground. This challenge is completed and can be challenged again.
""Wealth is the only truth in the world.""","Điểm Mộng Cảnh kết nối tập vực tại khu vực tầng dưới Hầm Vàng. Đã hoàn thành điểm này, có thể thử thách lại.
""Chỉ có tài sản mới là chân lý duy nhất trên đời."""
lang_multi_text.db,MultiText,MapMark_311006_MarkTitle,巡礼之梦·白金剑卫,Dream Patrol: Platinum Bladeguard,Giấc Mơ Tuần Lễ: Vệ Sĩ Bạch Kim
lang_multi_text.db,MultiText,MapMark_311007_MarkDesc,下层金库地区连通集域的梦境节点，完成挑战可收集梦境样本，获得奖励。 “没有买卖，就没有伤害。”,"A Dreamscape Node in the Vault Underground. Complete the challenge to claim Dream Samples and rewards. 
""A failed transaction means nobody's worse off.""","Điểm Mộng Cảnh kết nối tập vực tại khu vực tầng dưới Hầm Vàng. Hoàn thành thử thách để thu thập Mẫu Mộng Cảnh và nhận thưởng. 
""Không có mua bán thì không có tổn thương."""
lang_multi_text.db,MultiText,MapMark_311007_MarkDesc_Finish,下层金库地区连通集域的梦境节点，已完成该节点，可尝试再次挑战。 “没有买卖，就没有伤害。”,"A Dreamscape Node in the Vault Underground. This challenge is completed and can be challenged again.
""A failed transaction means nobody's worse off.""","Điểm Mộng Cảnh kết nối tập vực tại khu vực tầng dưới Hầm Vàng. Đã hoàn thành điểm này, có thể thử thách lại.
""Không có mua bán thì không có tổn thương."""
lang_multi_text.db,MultiText,MapMark_311007_MarkTitle,巡礼之梦·愿望宝石,Dream Patrol: Gemstone of Desire,Giấc Mơ Tuần Lễ: Đá Quý Ước Nguyện
lang_multi_text.db,MultiText,MapMark_311010_MarkDesc,分布于埃弗拉德金库下层的声骸车站台，可从此处通往下层金库的各个地点。,"The Echo Station in the Averardo Vault, providing access to various locations within the Vault.","Ga Tàu Thanh Hài nằm ở tầng dưới Hầm Vàng Averardo, từ đây có thể đến các địa điểm khác nhau trong tầng dưới Hầm Vàng."
lang_multi_text.db,MultiText,MapMark_311010_MarkTitle,声骸车站入口,Echo Station Entrance,Lối Vào Ga Tàu Thanh Hài
lang_multi_text.db,MultiText,MapMark_311011_MarkDesc,位于埃弗拉德金库下层，可前往贵金属与艺术品藏区。,"Located in the Averardo Vault, leading directly to the Precious Metals and Artworks Depository.","Nằm ở tầng dưới Hầm Vàng Averardo, dẫn đến Khu Lưu Trữ Kim Loại Quý và Tác Phẩm Nghệ Thuật."
lang_multi_text.db,MultiText,MapMark_311011_MarkTitle,贵金属与艺术品藏区入口,Precious Metals and Artworks Depository Entrance,Lối Vào Khu Lưu Trữ Kim Loại Quý và Tác Phẩm Nghệ Thuật
lang_multi_text.db,MultiText,MapMark_311012_MarkDesc,位于埃弗拉德金库下层，可前往声骸藏区。,"Located in the Averardo Vault, leading directly to the Echo Depository.","Nằm ở tầng dưới Hầm Vàng Averardo, dẫn đến Khu Lưu Trữ Thanh Hài."
lang_multi_text.db,MultiText,MapMark_311012_MarkTitle,声骸藏区入口,Echo Depository Entrance,Lối Vào Khu Lưu Trữ Thanh Hài
lang_multi_text.db,MultiText,MapMark_311013_MarkDesc,位于埃弗拉德金库下层，通往不为常人所知的深处，似乎埋藏着晦暗的过往。,"Located in the Averardo Vault, leading to unknown depths where dark pasts are buried.","Nằm ở tầng dưới Hầm Vàng Averardo, dẫn đến tầng sâu không ai biết, dường như chôn giấu một quá khứ u ám."
lang_multi_text.db,MultiText,MapMark_311013_MarkTitle,深层藏区入口,Underground Depository Entrance,Lối Vào Khu Lưu Trữ Tầng Sâu
lang_multi_text.db,MultiText,MapMark_311014_MarkDesc,藏于山岩中或地下的隐秘之所，似乎通往了未知的某处……,"A concealed passage in the rocks or underground, leading to an unknown destination...","Nơi bí ẩn ẩn trong vách núi hoặc dưới lòng đất, dường như dẫn đến một nơi nào đó chưa biết..."
lang_multi_text.db,MultiText,MapMark_311014_MarkTitle,隐秘入口,Secret Entrance,Lối Vào Bí Mật
