db_file,table_name,id,zh,en,vi
lang_multi_text.db,MultiText,LGNCZSTBC_2_2,你是父亲指定的第一顺位继承人，也是马尔蒂尼家的未来。,"You are the designated heir, the future of the Martini family.","Em là người thừa kế thứ nhất do cha chỉ định, cũng là tương lai của nhà Martini."
lang_multi_text.db,MultiText,LGNCZSTBC_2_3,我会成为你最亲近的人，你的左膀右臂。,"And I will be the one closest to you—your right hand, your confidant.","Anh sẽ trở thành người thân cận nhất của em, cánh tay phải của em."
lang_multi_text.db,MultiText,LGNCZSTBC_2_4,阿尔芭，绝对不能在外人面前露怯。相信我，好吗？,"Alba, you must never show such weakness in front of others. Trust me, okay?","Alba, tuyệt đối không được tỏ ra yếu đuối trước người ngoài. Tin anh, được không?"
lang_multi_text.db,MultiText,LGNCZSTBC_3_1,你也不喜欢喧嚣的地方吗？,"Not a fan of crowded places too, huh?",Cậu cũng không thích chỗ ồn ào à?
lang_multi_text.db,MultiText,LGNCZSTBC_3_2,呼噜……呼噜……,Zzz... Zzz...,Khò khò... khò khò...
lang_multi_text.db,MultiText,LGNCZSTBC_3_3,果然，还是僻静的地方更有安全感，对吧？,See? Isn't it nice being in our own little corner? All quiet and safe.,"Quả nhiên, vẫn là nơi vắng vẻ mang lại cảm giác an toàn hơn, đúng không?"
lang_multi_text.db,MultiText,LGNCZSTBC_4_1,太新潮了，太过分了！,The style! The boldness!,"Tân thời quá, quá đáng quá!"
lang_multi_text.db,MultiText,LGNCZSTBC_4_2,这种编排，堪称对学院派的一次大胆扬弃！,This outfit is a daring departure from the usual academic style!,"Sự sắp xếp này, có thể gọi là một sự chối bỏ táo bạo đối với phái học thuật!"
lang_multi_text.db,MultiText,LGNCZSTBC_4_3,去*拉古那粗口*的实用主义、功利主义，还有无所不在的戏剧批评！,"To *Ragunnesi profanity* with pragmatism, utilitarianism, and the endless critiques of drama!","Mặc xác chủ nghĩa thực dụng, chủ nghĩa công lợi đáng *chửi thề tiếng Ragunna*, và cả những phê bình kịch nghệ nhan nhản khắp nơi!"
lang_multi_text.db,MultiText,LGNCZSTBC_5_1,呜呜妈妈……我做了一个噩梦……,Wahh! Mommy... I had a nightmare...,Hu hu mẹ ơi... con gặp ác mộng...
lang_multi_text.db,MultiText,LGNCZSTBC_5_2,告诉妈妈和教士先生，你梦见了什么，维蒂？,"There, there, Viti. Can you tell Mommy and Mr. Acolyte here what it was about?","Kể cho mẹ và thầy tu nghe nào, con mơ thấy gì thế Viti?"
lang_multi_text.db,MultiText,LGNCZSTBC_5_3,我梦见我在一艘贡多拉上，船下是黑色的潮水，水里有一条大鱼在叫我，呜呜呜……,"I-I was on a Gondola, the water under me was all black, and a giant fish was calling my name.. Wahh-wahh...","Con mơ thấy con ở trên một chiếc thuyền Gondola, dưới thuyền là nước triều đen ngòm, trong nước có con cá to đang gọi con, hu hu hu..."
lang_multi_text.db,MultiText,LGNCZSTBC_6_1,近来身体有所好转吗？,Have you been feeling better lately?,Gần đây sức khỏe đã đỡ hơn chưa?
lang_multi_text.db,MultiText,LGNCZSTBC_6_2,承蒙您的关照，拉玛佐蒂教士……咳咳……,"Yes, and it's all thanks to you, Acolyte Ramazotti... cough...","Nhờ ơn ngài quan tâm, Thầy Tu Ramazotti... khụ khụ..."
lang_multi_text.db,MultiText,LGNCZSTBC_6_3,在罗斯玛丽小姐的帮助下，那些可怖的幻觉正在逐渐离我远去……那只海触……,"With Miss Rosamary's help, those terrifying illusions are finally fading... that thing...","Dưới sự giúp đỡ của cô Rosamary, những ảo giác đáng sợ đó đang dần rời xa tôi... cái Sea Bloom đó..."
lang_multi_text.db,MultiText,LGNCZSTBC_6_4,修会正在调查海触失控的原因，还请您安心休养。,The Order is investigating the cause of that Primordial Bloom's rampage. You may rest easy.,"Tu Hội đang điều tra nguyên nhân Sea Bloom mất kiểm soát, xin bà hãy yên tâm tịnh dưỡng."
lang_multi_text.db,MultiText,LGNCZST_100_1,无论尘世的海洋多么凶恶，总有一天，我们都会发觉，在我们的背后，早已拥有了前往遥远未来的，神赐的羽翼。,"No matter how rough the tides of this world may be, one day we'll see—behind us, we've always had wings of grace, ready to carry us forward.","Dù biển cả trần thế có hung hiểm đến đâu, rồi một ngày, chúng ta sẽ nhận ra, sau lưng mình đã sớm có đôi cánh thần ban để bay đến tương lai xa xăm."
