db_file,table_name,id,zh,en,vi
lang_multi_text.db,MultiText,Main_Linaxita_2_7_64_12,所以？,And?,Vì vậy?
lang_multi_text.db,MultiText,Main_Linaxita_2_7_64_13,重诺，或者是……固执。,Maybe it's about keeping a promise. Or maybe it's your own stubbornness.,"Giữ lời hứa, hay có lẽ là... bướng bỉnh."
lang_multi_text.db,MultiText,Main_Linaxita_2_7_64_14,呵……,Heh...,Hừ...
lang_multi_text.db,MultiText,Main_Linaxita_2_7_64_15,共鸣能力与情感相关联，如果你的固执能够让你为之创造一个索诺拉，我认为，那必然已经变成“执念”。,"Resonance abilities are tied to emotions. If your stubbornness drove you to create an entire Sonoro, then I'd call it an obsession.","Năng lực cộng hưởng gắn liền với cảm xúc, nếu sự bướng bỉnh của ngươi đủ lớn để tạo ra cả một Sonoro, tôi cho rằng, nó chắc chắn đã trở thành ""nỗi ám ảnh"" rồi."
lang_multi_text.db,MultiText,Main_Linaxita_2_7_64_16,也许吧。,Perhaps.,Có lẽ vậy.
lang_multi_text.db,MultiText,Main_Linaxita_2_7_64_17,过去遗留的录音揭示了芬莱克想要争夺失亡彼岸和鸣式残力的目标，但这似乎和曾经他下达过的命令有矛盾，芬莱克似乎意识到了自己的异常。弗洛洛发现芬莱克似乎陷入了迷失，你开始怀疑芬莱克的状态是否是受到了鸣式的影响，并借此机会询问弗洛洛创造失亡彼岸的根本原因，弗洛洛却只是告诉你，一切都是为了久远的承诺与执念。,"You find recordings that reveal Fenrico's scheme to seize the Lost Beyond and the Threnodian's residual energy, which seems to contradict his previous commands. Fenrico appears to notice his abnormality. When Phrolova points out that Fenrico is in disarray, you suspect he has fallen under the Threnodian's influence. You then seize the moment to ask Phrolova about her true reason for creating the Lost Beyond. She simply replies that it was but to keep a distant promise and satisfy an obsession.","Đoạn ghi âm từ quá khứ hé lộ mục tiêu của Fenrico là muốn chiếm đoạt Thất Vong Bỉ Ngạn và sức mạnh tàn dư của Minh Thức, nhưng điều này dường như mâu thuẫn với mệnh lệnh mà hắn từng ban ra trước đó. Fenrico có vẻ đã nhận ra sự bất thường của chính mình. Phrolova phát hiện Fenrico đang rơi vào trạng thái mê muội, bạn bắt đầu nghi ngờ liệu tình trạng của hắn có phải do ảnh hưởng của Minh Thức hay không, và nhân cơ hội hỏi Phrolova về lý do thực sự tạo ra Thất Vong Bỉ Ngạn. Phrolova chỉ nói rằng, tất cả đều vì một lời hứa xa xưa và nỗi ám ảnh."
lang_multi_text.db,MultiText,Main_Linaxita_2_7_64_18,主座，弗洛洛已经进行到最后一步了。,"Primus, Phrolova has reached the final stage.","Chủ Tòa, Phrolova đã tiến đến bước cuối cùng rồi."
lang_multi_text.db,MultiText,Main_Linaxita_2_7_64_19,天国的雏形已经完成，是时候肃清偏离的个体了。,The foundation of the Paradise is complete. It is time to purge those who have strayed.,"Hình hài của thiên đường đã hoàn thành, đã đến lúc thanh trừ những cá thể đi lệch hướng."
lang_multi_text.db,MultiText,Main_Linaxita_2_7_64_2,或者说，这位强权者已经陷入了名为迷失的沼泽。,"Or, more precisely, this man of authority has already sunk deep into the mire of his own confusion.","Hay nói cách khác, kẻ nắm quyền này đã sa vào vũng lầy của sự mê muội."
lang_multi_text.db,MultiText,Main_Linaxita_2_7_64_20,囿于黑暗中的灵魂需要一个承载他们的临时居所，为此我们需要她的成果。,"The souls trapped in darkness need a temporary dwelling. For that, we need her work.","Những linh hồn bị giam trong bóng tối cần một nơi trú ngụ tạm thời, vì thế chúng ta cần thành quả của cô ấy."
lang_multi_text.db,MultiText,Main_Linaxita_2_7_64_21,主座？,But Primus…,Chủ Tòa?
lang_multi_text.db,MultiText,Main_Linaxita_2_7_64_22,为何疑问？,You hesitate. Why?,Sao lại do dự?
lang_multi_text.db,MultiText,Main_Linaxita_2_7_64_23,这……您刚才说的，和您之前告诉我们的并不相同。,This is... different from what you told us.,Cái này... những gì Người vừa nói không giống với những gì Người từng nói với chúng tôi trước đây.
lang_multi_text.db,MultiText,Main_Linaxita_2_7_64_24,您上次说，我们的目的是让宝石中的神力回归圣所，可从未提过刚才的事。,You said our goal was to return the divine power within the Gem to the holy sphere. You never mentioned this part.,"Lần trước Người nói, mục tiêu của chúng ta là đưa thần lực trong Bảo Thạch trở về Thánh Sở, chưa bao giờ đề cập đến chuyện vừa rồi."
lang_multi_text.db,MultiText,Main_Linaxita_2_7_64_25,是计划有变吗？,Has the plan changed?,Kế hoạch đã thay đổi sao?
lang_multi_text.db,MultiText,Main_Linaxita_2_7_64_26,……,...,...
lang_multi_text.db,MultiText,Main_Linaxita_2_7_64_27,主座？这段还要继续记录吗？,Primus? Should I continue the recording?,Chủ Tòa? Đoạn này có tiếp tục ghi lại không?
lang_multi_text.db,MultiText,Main_Linaxita_2_7_64_28,记录……我什么时候……不，记下来吧。,"Recording... When did I ever... I see. No, continue recording.","Ghi lại... ta có khi nào... không, cứ ghi lại đi."
lang_multi_text.db,MultiText,Main_Linaxita_2_7_64_3,（这种状况……和坎特蕾拉之前提到过的很像。）,(This feels a lot like what Cantarella described before.),(Tình trạng này... rất giống với những gì Cantarella từng nói trước đây.)
lang_multi_text.db,MultiText,Main_Linaxita_2_7_64_4,（是鸣式的力量在蛊惑他去做什么吗？）,(Is the Threnodian's power driving him toward something?),(Sức mạnh của Minh Thức đang mê hoặc hắn làm gì đó sao?)
lang_multi_text.db,MultiText,Main_Linaxita_2_7_64_5,你创造失亡彼岸又是为了什么？,Why did you create the Lost Beyond?,Còn ngươi tạo ra Thất Vong Bỉ Ngạn là vì mục đích gì?
lang_multi_text.db,MultiText,Main_Linaxita_2_7_64_6,……,...,...
lang_multi_text.db,MultiText,Main_Linaxita_2_7_64_7,因为……想要完成一个久远的承诺。,"Because... I made a promise long, long ago.",Bởi vì... tôi muốn hoàn thành một lời hứa từ rất lâu trước đây.
lang_multi_text.db,MultiText,Main_Linaxita_2_7_64_8,一位失散已久的朋友告诉过我，任何一个承诺都很重要，只要许诺了就一定要实现。,"A long-lost friend once told me that every promise matters. Once you make one, you see it through, no matter the cost.","Một người bạn đã thất lạc từ lâu từng nói với tôi rằng, mọi lời hứa đều quan trọng, đã hứa thì nhất định phải thực hiện."
lang_multi_text.db,MultiText,Main_Linaxita_2_7_64_9,如果你是指真正的“久远”……,"How long is ""long, long ago""…","Nếu ngươi nói đến ""lâu dài"" theo đúng nghĩa đen..."
lang_multi_text.db,MultiText,Main_Linaxita_2_7_65_1,终于可以安静了。,"Finally, some peace.",Cuối cùng cũng được yên tĩnh rồi.
lang_multi_text.db,MultiText,Main_Linaxita_2_7_65_2,你是指……,You mean…,Ngươi muốn nói...
lang_multi_text.db,MultiText,Main_Linaxita_2_7_65_3,混乱的旋律、扭曲的圣歌、嘈杂的生命律动……我们抛在身后的，简直是一场灾难的交响乐。,"The chaotic melodies, the distorted hymns, the clamor of life's rhythm... Everything we left behind was nothing short of a disastrous symphony.","Giai điệu hỗn loạn, thánh ca méo mó, nhịp sống ồn ào... Những gì chúng ta bỏ lại phía sau, đúng là một bản giao hưởng của thảm họa."
lang_multi_text.db,MultiText,Main_Linaxita_2_7_65_4,听你的意思，前面的区域不会如此。,"If that's the case, can I expect the path ahead to be different?","Theo ý ngươi, khu vực phía trước sẽ không như vậy."
lang_multi_text.db,MultiText,Main_Linaxita_2_7_65_5,那里或许仍是沉静的湖泊。,Perhaps the lake ahead remains undisturbed.,Nơi đó có lẽ vẫn là hồ nước tĩnh lặng.
lang_multi_text.db,MultiText,Main_Linaxita_2_7_66_1,这里看起来可并不沉静。,This is far from undisturbed.,Nơi này trông chẳng tĩnh lặng chút nào.
lang_multi_text.db,MultiText,Main_Linaxita_2_7_66_10,如果这样的世界真的无法改变，或许应该寻找新的道路了……即使与以往的办法完全不同。,"If this world can't be changed, then maybe it's time to take a different path... even if it's nothing like before.","Nếu thế giới này thực sự không thể thay đổi, có lẽ nên tìm một con đường mới... dù hoàn toàn khác với cách làm trước đây."
lang_multi_text.db,MultiText,Main_Linaxita_2_7_66_11,我会为你实现自己的理想提供一切帮助，因为我们是同样境遇的人，我已让你见证了实现的可能。,"I'll do whatever it takes to help you achieve your goal. We stand in the same place, and I've already shown you that what you seek is within reach.","Ta sẽ hỗ trợ hết mình để ngươi đạt được lý tưởng, vì chúng ta là những người cùng cảnh ngộ, ta đã cho ngươi thấy khả năng hiện thực hóa."
lang_multi_text.db,MultiText,Main_Linaxita_2_7_66_12,（实现的可能……）,(It's… possible...?),(Khả năng hiện thực hóa...)
lang_multi_text.db,MultiText,Main_Linaxita_2_7_66_13,弗洛洛。,Phrolova.,Phrolova.
lang_multi_text.db,MultiText,Main_Linaxita_2_7_66_14,这些雾……比之前遇到的还要浓重……,This mist… It's even thicker than before.,Sương mù này... còn dày đặc hơn lần trước...
lang_multi_text.db,MultiText,Main_Linaxita_2_7_66_15,而且……,And...,Hơn nữa...
lang_multi_text.db,MultiText,Main_Linaxita_2_7_66_16,彼岸的情况又变差了？,Things are getting worse in the Lost Beyond?,Tình hình Bỉ Ngạn lại tệ hơn rồi sao?
lang_multi_text.db,MultiText,Main_Linaxita_2_7_66_17,你创造的索诺拉，似乎也和你时刻性命相连。,The Sonoro Sphere you created seems to be tied to your life.,"Sonoro ngươi tạo ra, dường như cũng gắn liền với sinh mệnh của ngươi từng giây từng phút."
lang_multi_text.db,MultiText,Main_Linaxita_2_7_66_18,敏锐的推测。,A sharp observation.,Suy đoán tinh tường đấy.
lang_multi_text.db,MultiText,Main_Linaxita_2_7_66_19,但别担心，这不会影响我们合作的目标。,Worry not. It won't affect our goal.,"Nhưng đừng lo, điều này không ảnh hưởng đến mục tiêu hợp tác của chúng ta."
lang_multi_text.db,MultiText,Main_Linaxita_2_7_66_2,看来这场混乱席卷了整座试验场……,It seems the chaos has seeped into every corner of the Fabricatorium…,Có vẻ hỗn loạn này đã lan rộng khắp toàn bộ thí nghiệm trường...
lang_multi_text.db,MultiText,Main_Linaxita_2_7_66_20,路总会有的，跟上我。,There is always a way forward. Stay close.,"Luôn có đường đi, theo tôi."
lang_multi_text.db,MultiText,Main_Linaxita_2_7_66_21,看着弗洛洛主动使用能力寻找出路，你发现她的身体状态在逐渐好转，在她受伤基础上达成的合作关系开始摇摇欲坠。弗洛洛仍然在使用能力的过程中看到了短暂的幻影，这让她意识到，失亡彼岸的状况仍在变差，而且那里的状态与她时刻相连。,"You realize Phrolova is recovering as she uses her abilities more to find a way out. This means the partnership based on her injuries is shattering. Meanwhile, Phrolova continues to see visions while using her ability, an indication to her that the situation in the Lost Beyond is deteriorating, as she and the space are closely connected.","Nhìn Phrolova chủ động sử dụng năng lực để tìm đường, bạn nhận ra tình trạng cơ thể cô đang dần hồi phục, mối quan hệ hợp tác dựa trên thương tích của cô bắt đầu lung lay. Phrolova vẫn nhìn thấy những ảo ảnh thoáng qua khi sử dụng năng lực, khiến cô nhận ra tình trạng Thất Vong Bỉ Ngạn vẫn đang xấu đi, và nơi đó luôn gắn liền với cô từng khắc."
lang_multi_text.db,MultiText,Main_Linaxita_2_7_66_3,那这里应该也需要调律？,Need to orchestrate it then?,Vậy ở đây cũng cần điều luật sao?
lang_multi_text.db,MultiText,Main_Linaxita_2_7_66_4,嗯，调律台就在柱子后面。,Yes. The Orchestration Altar is behind that pillar.,"Ừ, đài điều luật ở ngay sau cây cột kia."
lang_multi_text.db,MultiText,Main_Linaxita_2_7_66_5,水好像不深，或许可以走过去。,The water's not deep. Maybe we could walk it through.,"Nước có vẻ không sâu lắm, có thể lội qua được."
lang_multi_text.db,MultiText,Main_Linaxita_2_7_66_6,水？它们是维持试验场运转的能源。,Water? It's the energy source that keeps this site running.,Nước ư? Đó là nguồn năng lượng duy trì hoạt động của thí nghiệm trường.
lang_multi_text.db,MultiText,Main_Linaxita_2_7_66_7,别着急，我先进行调律，看能否驱散浓雾，清出最近的道路。,Hold on. I'll orchestrate this area first. Let's see if the path will reveal itself after the mist is cleared.,"Đừng vội, để tôi điều luật trước, xem có thể xua tan sương mù và mở đường gần nhất không."
lang_multi_text.db,MultiText,Main_Linaxita_2_7_66_8,（主动使用能力，脸色也没有刚才那么差了……她的伤势和共鸣能力，看起来都在慢慢恢复。）,(She's trying to use her Forte again… and she looks better now. Her injuries and Resonance ability are recovering.),"(Chủ động dùng năng lực mà sắc mặt cũng không tệ như lúc nãy nữa... Vết thương và năng lực cộng hưởng của cô ấy, có vẻ đều đang dần hồi phục.)"
lang_multi_text.db,MultiText,Main_Linaxita_2_7_66_9,（我们的合作建立在她受伤的基础上，不知道她完全恢复需要多久……一旦恢复完全，这短暂的同盟恐怕就会立刻结束。）,"(Our alliance hinges on her weakened state. I'm not sure how long it'll take for her to fully recover… but when she does, this fragile pact could end in an instant.)","(Sự hợp tác của chúng tôi được xây dựng trên cơ sở cô ấy bị thương, không biết cô ấy hồi phục hoàn toàn cần bao lâu... Một khi hồi phục xong, liên minh tạm thời này sợ là sẽ chấm dứt ngay lập tức.)"
lang_multi_text.db,MultiText,Main_Linaxita_2_7_67_1,这也想不通？,Is it that difficult for you?,Cái này cũng không nghĩ ra sao?
lang_multi_text.db,MultiText,Main_Linaxita_2_7_67_2,踩住那里，不要让它中断。,Stand on it and make sure it holds.,"Giẫm lên chỗ đó, đừng để nó bị gián đoạn."
lang_multi_text.db,MultiText,Main_Linaxita_2_7_68_1,成功了。,It worked.,Thành công rồi.
lang_multi_text.db,MultiText,Main_Linaxita_2_7_68_2,继续向前。,Let's keep moving.,Tiếp tục đi thôi.
lang_multi_text.db,MultiText,Main_Linaxita_2_7_69_1,看起来要在调律中抓准时机才能过去。,Have to time it right during the Orchestration to make it through.,Có vẻ phải chọn đúng thời điểm trong lúc điều luật mới đi qua được.
lang_multi_text.db,MultiText,Main_Linaxita_2_7_6_1,（与蜜芽体内鸣式力量一致的能量波动……难道，还有和蜜芽类似的存在？）,(Energy similar to the Threnodian's power in Mya's body… Does that mean Mya wasn't the only one?),"(Sóng năng lượng trùng khớp với sức mạnh Minh Thức trong người Mya... Lẽ nào, còn có tồn tại giống Mya nữa sao?)"
lang_multi_text.db,MultiText,Main_Linaxita_2_7_6_2,接下来我们去做什么？,"So, where to next?",Tiếp theo chúng ta làm gì?
lang_multi_text.db,MultiText,Main_Linaxita_2_7_6_3,总归要出海，先去码头。,The dock. It's time to set sail.,"Dù gì cũng phải ra khơi, trước hết đi đến bến tàu đã."
lang_multi_text.db,MultiText,Main_Linaxita_2_7_70_1,完全混乱了……,It's a complete mess...,Hoàn toàn hỗn loạn...
lang_multi_text.db,MultiText,Main_Linaxita_2_7_70_2,蓄能中枢存储着大量能源，这里的一切都更容易被影响。,"The Energy Hub holds immense power, making it all the more susceptible to distortion.","Trung khu tích năng lưu trữ lượng lớn năng lượng, mọi thứ ở đây đều dễ bị ảnh hưởng hơn."
lang_multi_text.db,MultiText,Main_Linaxita_2_7_70_3,蓄能中枢……听起来是维持这里运转的关键一环。,Energy Hub... Sounds like a key component keeping this place running.,Trung khu tích năng... nghe có vẻ là mắt xích then chốt duy trì hoạt động ở đây.
lang_multi_text.db,MultiText,Main_Linaxita_2_7_70_4,没错。,It is.,Đúng vậy.
lang_multi_text.db,MultiText,Main_Linaxita_2_7_71_1,走那边。,That way.,Đi lối kia.
lang_multi_text.db,MultiText,Main_Linaxita_2_7_72_1,这些柱子上溢出的能量有危险。,The energy leaking from these poles looks dangerous.,Năng lượng tràn ra từ những cây cột này rất nguy hiểm.
lang_multi_text.db,MultiText,Main_Linaxita_2_7_72_2,旋律混乱造成的外溢。,Another consequence of the distorted melodies.,Do giai điệu hỗn loạn gây ra.
lang_multi_text.db,MultiText,Main_Linaxita_2_7_72_3,那我们可以通过调律控制住它们。,Then we should be able to stabilize it through Orchestration.,Vậy chúng ta có thể khống chế chúng bằng điều luật.
lang_multi_text.db,MultiText,Main_Linaxita_2_7_73_1,……,...,...
lang_multi_text.db,MultiText,Main_Linaxita_2_7_73_2,……,...,...
lang_multi_text.db,MultiText,Main_Linaxita_2_7_73_3,这些柱子的阻拦……,The way these poles are arranged...,Những cây cột chắn đường này...
lang_multi_text.db,MultiText,Main_Linaxita_2_7_73_4,……好刻意。,...Feels too intentional.,...thật cố ý.
lang_multi_text.db,MultiText,Main_Linaxita_2_7_74_1,这些残象真是源源不断……,These Tacet Discords just keep coming...,Tàn Tượng này cứ kéo đến liên miên...
lang_multi_text.db,MultiText,Main_Linaxita_2_7_74_10,这首曲子原本出自你手。,"You composed this piece, didn't you?",Bản nhạc này vốn do ngươi sáng tác.
lang_multi_text.db,MultiText,Main_Linaxita_2_7_74_11,你……记得这首曲子？,You... recognize this melody?,Ngươi... nhớ bản nhạc này?
lang_multi_text.db,MultiText,Main_Linaxita_2_7_74_12,没印象，但不难猜，合作肯定是双向的。,"No, but I can tell. You were working with them, right?","Không có ấn tượng gì, nhưng không khó đoán, hợp tác chắc chắn là hai chiều."
lang_multi_text.db,MultiText,Main_Linaxita_2_7_74_13,……,...,...
lang_multi_text.db,MultiText,Main_Linaxita_2_7_74_14,你说得没错。,"Of course, you're right.",Ngươi nói đúng.
lang_multi_text.db,MultiText,Main_Linaxita_2_7_74_15,没留点后手以防万一？,"Did you leave any backdoors, just in case?",Không giữ lại vài thủ đoạn phòng thân sao?
lang_multi_text.db,MultiText,Main_Linaxita_2_7_74_16,如果没有，我们又怎会走到这里？,"If I didn't, we wouldn't have made it this far.","Nếu không, làm sao chúng ta có thể đến được đây?"
lang_multi_text.db,MultiText,Main_Linaxita_2_7_74_17,不过……本应在调律台上的曲谱，却被藏在了这个声骸培育舱中……,"However... this piece should have been on the Orchestration Altar, but now it's hidden in this Echo Brooder...","Tuy nhiên... bản nhạc lẽ ra nằm trên đài điều luật, lại bị giấu trong khoang nuôi dưỡng Thanh Hài..."
lang_multi_text.db,MultiText,Main_Linaxita_2_7_74_18,正好一并带过去复原。,Good. We can fix them all at once.,Vừa hay mang luôn đi khôi phục.
lang_multi_text.db,MultiText,Main_Linaxita_2_7_74_19,……恐怕不会这么容易。,...It won't be that simple.,...e rằng không dễ dàng như vậy đâu.
lang_multi_text.db,MultiText,Main_Linaxita_2_7_74_2,你看这里。,Look at this.,Nhìn chỗ này.
lang_multi_text.db,MultiText,Main_Linaxita_2_7_74_20,你们发现了遗落的曲谱，弗洛洛告诉你，乐曲是控制隐海试验场正常运转的核心，只有将它放回调律台将旋律调整回去，区域内才能恢复正常。你猜测这曲子是她创作的，她承认这是她与芬莱克合作的一部分后，你们打算将乐谱拿到调律台前将乐曲复原。,"You discover a piece of sheet music. Phrolova explains that this music is the core of the Fabricatorium of the Deep. The area can only be restored by returning it to the Orchestration Altar and fixing the melodies. When you speculate she composed it, she admits it was part of her collaboration with Fenrico. You both then agree to bring the sheet music back to the Altar.","Bạn phát hiện bản nhạc bị rơi, Phrolova cho biết bản nhạc là cốt lõi điều khiển hoạt động bình thường của Ẩn Hải Thí Nghiệm Trường, chỉ khi đặt nó lại đài điều luật và chỉnh sửa giai điệu, khu vực mới có thể trở lại bình thường. Bạn đoán bản nhạc là do cô sáng tác, cô thừa nhận đây là một phần hợp tác giữa cô và Fenrico, sau đó cả hai quyết định mang bản nhạc đến đài điều luật để khôi phục."
lang_multi_text.db,MultiText,Main_Linaxita_2_7_74_3,一段曲谱？它好像和之前调律台上的那些曲谱形制一样。,Some kind of sheet music? It looks similar to what we saw back at the Altar.,Một đoạn nhạc phổ? Nó trông giống với những bản nhạc trên đài điều luật lúc trước.
lang_multi_text.db,MultiText,Main_Linaxita_2_7_74_4,它们是同一首曲谱中的不同乐章，只有全部调律完成，整首曲子才能回归正常的曲调。,They are different movements of the same composition. Only when they are all orchestrated can the piece return to its original harmony.,"Chúng là những chương khác nhau trong cùng một bản nhạc, chỉ khi tất cả đều được điều luật xong, toàn bộ bản nhạc mới trở về giai điệu bình thường."
lang_multi_text.db,MultiText,Main_Linaxita_2_7_74_5,这首曲子到底有什么作用？,What is this composition for?,Bản nhạc này rốt cuộc có tác dụng gì?
lang_multi_text.db,MultiText,Main_Linaxita_2_7_74_6,我之前说过，万物皆由频率构成，旋律可以改变事物原有的节奏，调律它们的本质就可以改变它们的状态。,"As I mentioned, everything is made of frequencies. Melodies can bend the rhythm of existence, and by orchestrating their essence, we reshape their very nature.","Tôi đã nói trước đó, vạn vật đều được tạo thành từ tần số, giai điệu có thể thay đổi nhịp điệu vốn có của sự vật, điều luật bản chất của chúng chính là thay đổi trạng thái của chúng."
lang_multi_text.db,MultiText,Main_Linaxita_2_7_74_7,你的意思是我们见到的失控，都是芬莱克把这首曲子打乱造成的。,So all this chaos was caused by Fenrico disrupting the composition?,"Ý ngươi là những hỗn loạn chúng ta thấy, đều do Fenrico phá vỡ bản nhạc này gây ra."
lang_multi_text.db,MultiText,Main_Linaxita_2_7_74_8,是。,Exactly.,Đúng.
lang_multi_text.db,MultiText,Main_Linaxita_2_7_74_9,这首乐曲是控制<te href=851020>隐海试验场</te>正常运转的核心，只有将它调整回去，各区域才能恢复正常，区域之间的通路才能正常打开。,"This piece is the heartbeat of this entire <te href=851020>place</te>. Restore it, and order will return. The pathways between regions will open again.","Bản nhạc này là cốt lõi điều khiển hoạt động bình thường của <te href=851020>Ẩn Hải Thí Nghiệm Trường</te>, chỉ khi chỉnh sửa lại nó, các khu vực mới trở lại bình thường, lối đi giữa các khu vực mới mở ra được."
lang_multi_text.db,MultiText,Main_Linaxita_2_7_75_1,果然……还缺失了两段曲谱，真是拙劣的手段。,As expected... two movements are missing. Despicable.,"Quả nhiên... còn thiếu hai đoạn nhạc phổ, thủ đoạn thật vụng về."
lang_multi_text.db,MultiText,Main_Linaxita_2_7_75_2,刚才所过之处只有那一个。,There was only one at the place we just passed.,Đoạn đường vừa đi qua chỉ có một bản.
lang_multi_text.db,MultiText,Main_Linaxita_2_7_75_3,那么，只剩一种可能。,Then there is only one other place they could be.,Vậy thì chỉ còn một khả năng.
lang_multi_text.db,MultiText,Main_Linaxita_2_7_75_4,剩余的两段，都在我们脚下。,They are right beneath our feet.,Hai đoạn còn lại đều ở ngay dưới chân chúng ta.
lang_multi_text.db,MultiText,Main_Linaxita_2_7_75_5,你们发现调律台上还缺少另外两份曲谱，弗洛洛提议前往这里的下一层空间中寻找。,You notice that two more pieces are still missing from the Orchestration Altar. Phrolova proposes heading to the lower levels to search for them.,"Bạn phát hiện đài điều luật vẫn còn thiếu hai bản nhạc phổ khác, Phrolova đề nghị đi xuống tầng dưới của nơi này để tìm kiếm."
