db_file,table_name,id,zh,en,vi
lang_infodisplay.db,InfoDisplay,34,"岗位名称：
【速运收派员】
岗位要求：
年龄不限，持有任意国家驾驶执照，按照公司要求，安全、快捷、准确地完成日常收、派件工作。
工作地点：
根据求职者意愿和实际岗位需求空缺就近分配站点。
工作时间：
5天9小时工作制，上午7点左右到岗，下午7点左右结束工作，中午休息3小时左右，超出此时段均视为加班并双倍支付相应酬劳。

薪资福利：
1.多劳多得，按计件提，上不封顶；
2.公司提供完善的人身安全保险，配运输车辆，提供住宿及相应收派技能教育（包括但不限于危险物种辨识、黑石污染物无害化处理、急救等），可颁发相应职业资格证书；
3.节假日三倍薪资；
4.免费提供一年四季的工作服装；
5.危险区域收派将提供完善的人身安全保障（包括但不限于物资保障、武装支援、专人护送等），费用由本公司权全承担。","Job Title:
[Delivery Driver]
Job Description:
Any age, in possession of any national driving license, able to collect, deliver packages safely, swiftly, accurately as per tasked by the company.
Job Location:
Site pursuant to applicant's wish and actual job demands
Job Time:
9 hours a day, 5 days a week. Starts at 7 a.m. and ends at 7 p.m., with 3 hours in between for rest. Works outside this time are regarded as overtime and subject to double pay.

Pay and Perks:
1. Get paid at piece rate with no upper limit;
2. Complete life insurance included. Carrier vehicle allocated. Accomadation and vocational education provided (including but limited to identification of dangerous objects, Tacetite pollutant neutralization, first aid etc.). Eligible for skill certification;
3. Triple pay for public holiday;
4. works clothes for all season;
5. Collection and Delivery in dangerous areas are fully covered (including and not limited to supply guarantee, armed backup, special escort etc.), which is paid by the company.","Tên vị trí:
[Nhân viên thu gom và giao hàng nhanh]
Yêu cầu:
Không giới hạn tuổi, có bằng lái xe của bất kỳ quốc gia nào, hoàn thành công việc thu gom và giao hàng hàng ngày một cách an toàn, nhanh chóng, chính xác theo yêu cầu công ty.
Địa điểm làm việc:
Phân bổ trạm gần nhất theo nguyện vọng ứng viên và nhu cầu thực tế.
Giờ làm việc:
Chế độ 5 ngày 9 tiếng, đến nơi khoảng 7 giờ sáng, kết thúc khoảng 7 giờ tối, nghỉ trưa khoảng 3 tiếng, ngoài khung giờ này đều tính là tăng ca và trả lương gấp đôi.

Lương và phúc lợi:
1. Làm nhiều hưởng nhiều, tính theo sản phẩm, không giới hạn trần;
2. Công ty cung cấp bảo hiểm an toàn cá nhân đầy đủ, xe vận chuyển, chỗ ở và đào tạo kỹ năng thu gom giao hàng (bao gồm nhưng không giới hạn: nhận diện loài nguy hiểm, xử lý vô hại chất ô nhiễm Hắc Thạch, sơ cứu, v.v.), có thể cấp chứng chỉ nghề tương ứng;
3. Ngày lễ lương gấp ba;
4. Cung cấp miễn phí đồng phục làm việc bốn mùa;
5. Thu gom giao hàng tại khu vực nguy hiểm sẽ được đảm bảo an toàn cá nhân đầy đủ (bao gồm nhưng không giới hạn: đảm bảo vật tư, hỗ trợ vũ trang, hộ tống chuyên trách, v.v.), chi phí do công ty chịu toàn bộ."
lang_infodisplay.db,InfoDisplay,35,皇龙研究院学术讲座安排,"Academic Lecture Schedule, Huanglong Academy",Lịch Trình Giảng Dạy Học Thuật Viện Nghiên Cứu Hoàng Long
lang_infodisplay.db,InfoDisplay,36,"学术交流周讲座安排：

讲座题目：幻象分类及其能源学研究意义——以解离棱镜为例
讲座地点：第一报告厅
主讲人：詹斯曼
主讲人简介：新联邦科学院首席研究员，幻象研究中心审核评估专家，新联邦鸣潮生态研究学会常务理事。主要研究领域为幻象分类学、鸣潮生态学等。

讲座题目：从巡回法庭案例看学术伦理
讲座地点：阶梯报告厅
主讲人：麦赫西丝
主讲人简介：先行公约高级法律顾问，新联邦《科学技术普及法周刊》执行主编，皇龙研究院名誉研究员。","Lecture Schedule of the Academic Exchange Week:

Title: TD Taxonomy and Its Meaning for Energy Science - Rupture Prism as Example
Location: 1st Lecture Hall
Lecturer: Jansman
Lecturer Intro: Chief Research Fellow at New Federation's Academy of Science, Assessment Expert at TD Research Center, Standing Director at New Federation's Institute of Wuthering Waves ecology. Research interests include TD taxonomy, Wuthering Waves ecology etc..

Title: Academic Ethnics in the perspective of Circuit Court Cases
Location: the Amphitheatre
Lecturer: Maichthis
Lecturer Intro: Senior Legal Advisor for the Pioneer Association, Executive Chief Editor at New Federation's <i>Popular Science and Technology Act Weekly</i>, Honorary Research Fellow at Huanglong Academy.","Lịch trình giảng dạy Tuần Giao Lưu Học Thuật:

Chủ đề bài giảng: Phân loại Ảo Ảnh và ý nghĩa nghiên cứu năng lượng học - lấy Lăng Kính Hủy Diệt làm ví dụ
Địa điểm: Hội trường báo cáo số 1
Diễn giả: Jansman
Giới thiệu diễn giả: Nghiên cứu viên trưởng Viện Khoa Học Tân Liên Bang, chuyên gia đánh giá thẩm định Trung Tâm Nghiên Cứu Ảo Ảnh, thường vụ lý sự Hội Nghiên Cứu Sinh Thái Minh Triều Tân Liên Bang. Lĩnh vực nghiên cứu chính là phân loại học Ảo Ảnh, sinh thái học Minh Triều, v.v.

Chủ đề bài giảng: Nhìn nhận đạo đức học thuật từ các vụ án tòa lưu động
Địa điểm: Hội trường bậc thang
Diễn giả: Maichthis
Giới thiệu diễn giả: Cố vấn pháp lý cao cấp Hiệp Ước Tiên Phong, tổng biên tập Tuần San ""Luật Phổ Cập Khoa Học Kỹ Thuật"" Tân Liên Bang, nghiên cứu viên danh dự Viện Nghiên Cứu Hoàng Long."
lang_infodisplay.db,InfoDisplay,37,夜莺茶馆,夜莺茶馆,Trà Quán Dạ Oanh
lang_infodisplay.db,InfoDisplay,38,"【茶疗推荐】
渊武老板甄选春茶，佐以“晚秋”声料，冷水冲泡五分钟，即可听见四季在茶韵中流转，有安神、静心之效，欢迎各位客人进店品茶。


【温馨提示】
茶馆附近的小猫小狗性情温顺，是渊武老板的特殊客人，可逗玩投喂，不可驱赶虐待，否则后果自负。

【急招！！！】
本店急招茶疗研发师，培训上岗，薪资面聊！","【茶疗推荐】
渊武老板甄选春茶，佐以“晚秋”声料，冷水冲泡五分钟，即可听见四季在茶韵中流转，有安神、静心之效，欢迎各位客人进店品茶。


【温馨提示】
茶馆附近的小猫小狗性情温顺，是渊武老板的特殊客人，可逗玩投喂，不可驱赶虐待，否则后果自负。

【急招！！！】
本店急招茶疗研发师，培训上岗，薪资面聊！","[Trà Liệu Pháp Được Đề Xuất]
Trà xuân được ông chủ Uyên Vũ tuyển chọn, kết hợp với thanh liệu ""Vãn Thu"", pha nước lạnh năm phút, là có thể nghe thấy bốn mùa xoay chuyển trong hương trà, có tác dụng an thần, tĩnh tâm, hoan nghênh quý khách ghé cửa hàng thưởng trà.


[Lưu Ý]
Mấy chú mèo chú chó gần trà quán tính tình hiền lành, là khách đặc biệt của ông chủ Uyên Vũ, có thể đùa giỡn cho ăn, không được xua đuổi ngược đãi, nếu không hậu quả tự chịu.

[Tuyển Gấp!!!]
Cửa hàng cần tuyển gấp chuyên viên nghiên cứu phát triển trà liệu pháp, đào tạo trước khi nhận việc, lương thỏa thuận trực tiếp!"
lang_infodisplay.db,InfoDisplay,39,检查日志,,Nhật Ký Kiểm Tra
lang_infodisplay.db,InfoDisplay,40,"石头负责批次10200至10299：已过检，已完成运输及配装。
连珂负责批次10300至10399：已过检，运输中。
谢伯负责批次10400至10449：<s>无检测信息，状态未知。</s>人工过检，相关事宜联系本人处理。",,"Thạch Đầu phụ trách lô 10200 đến 10299: Đã qua kiểm tra, đã hoàn thành vận chuyển và lắp đặt.
Liên Kha phụ trách lô 10300 đến 10399: Đã qua kiểm tra, đang vận chuyển.
Tạ Bá phụ trách lô 10400 đến 10449: <s>Không có thông tin kiểm tra, trạng thái chưa rõ.</s>Kiểm tra thủ công, các vấn đề liên quan liên hệ bản thân xử lý."
lang_infodisplay.db,InfoDisplay,41,未知信号,Unknown signal,Tín Hiệu Không Xác Định
lang_infodisplay.db,InfoDisplay,42,“灯塔的光永远不会熄灭，欢迎回家，朋友。”,"""Light will never fade at the lighthouse. Welcome home, friend.""","""Ánh sáng ngọn hải đăng sẽ không bao giờ tắt, chào mừng trở về nhà, bạn ơi."""
lang_infodisplay.db,InfoDisplay,43,紧急撤离通知,Emergency Evacuation Notice,Thông Báo Sơ Tán Khẩn Cấp
lang_infodisplay.db,InfoDisplay,44,"各祈池村住户、第九调查区驻地人员：
近日观测到祈池村（含第九调查区）北面鸣潮子浓度异常，有较大概率发生小型至中型兽潮、突发无音区等灾害。
为了各位的生命财产安全，请祈池村住户在收到本通知后立即准备撤离，不要携带过多物资。夜归兵团将尽快派出小队，协助各位撤离。
再次重复，不要携带过多物资，快速撤离！
另：第九调查区驻地人员请关注后续通知。","Villagers of Qichi, post personnel at the 9th research area:
Abnormal density of Wutherons is observed recently in the north of Qichi Village (including the 9th research area). There is a great probability of small to medium-sized TD wave, sudden Tacet Fields or other disasters.
For the safety of your lives and property, villagers of Qichi in the receipt of this notice please immediately prepare to evacuate, and do not carry too much supplies. The Midnight Rangers will send a froces to assist you in evacuating as soon as possible.
Repeat, do not carry too much supplies, evacuate quickly!
P. S.: post personnel at the 9th research area, please pay attention to the later notices.","Gửi toàn thể cư dân thôn Kỳ Trì, nhân viên đồn trú Khu Điều Tra số 9:
Gần đây quan trắc phát hiện nồng độ Minh Triều Tử ở phía bắc thôn Kỳ Trì (bao gồm Khu Điều Tra số 9) bất thường, có xác suất cao xảy ra thú triều quy mô nhỏ đến trung bình, Vùng Vô Thanh đột phát và các thảm họa khác.
Vì sự an toàn tính mạng và tài sản của mọi người, xin cư dân thôn Kỳ Trì sau khi nhận được thông báo này lập tức chuẩn bị sơ tán, không mang theo quá nhiều vật tư. Binh đoàn Dạ Quy sẽ nhanh chóng cử đội hỗ trợ mọi người sơ tán.
Nhắc lại lần nữa, không mang theo quá nhiều vật tư, sơ tán nhanh chóng!
Thêm: Nhân viên đồn trú Khu Điều Tra số 9 xin theo dõi thông báo tiếp theo."
lang_infodisplay.db,InfoDisplay,45,打包清单,Package List,Danh Sách Đóng Gói
lang_infodisplay.db,InfoDisplay,46,"辛香肉片1份、小龙包1份、烤串10根
-带压缩干粮。
-我不爱吃压缩干粮……锅盔可不可以？
-妈妈没时间做锅盔了。

活力饮料10罐
-带这些又重又没用的干什么……带点阻滞剂就好，省省空间吧！
-那口渴了怎么办？
-忍一忍，我们去天城喝咸奶茶。

麻将1套、帐篷1顶
-宝贝，我们不是去露营。
-爸爸说是去露营啊？
-嗯……不是普通的露营。奶奶做的平安扣还在吗？都带上。","1 serving of Spicy Fillet, 1 serving of dumplings, 10 skewers
- take compressed rations.
- I don't like compressed rations... Can we take Guokui?
- Mum has no time to make Guokui.

10 cans of energy drink
- Don't take these weighty, useless stuff... take blockers. Save some space!
- What if we get thirsty?
- Tolerate it. We will have salty milk tea in Tiancheng.

1 set of Mahjong, 1 tent
- baby, we are not going camping.
- But dad said we were.
- Hmm... not a normal camping. Have you got that Lucky Jade Grandma made? Bring it.","Thịt thái cay 1 phần, tiểu long bao 1 phần, xiên nướng 10 que
-Mang lương khô nén đi.
-Con không thích ăn lương khô nén... Bánh quắt có được không?
-Mẹ không có thời gian làm bánh quắt rồi.

Nước tăng lực 10 lon
-Mang mấy thứ vừa nặng vừa vô dụng này làm gì... Mang ít thuốc ức chế là được rồi, tiết kiệm chỗ đi!
-Thế khát nước thì làm sao?
-Chịu một chút, mình đến Thiên Thành uống trà sữa mặn.

Mạt chược 1 bộ, lều 1 cái
-Con yêu, mình không phải đi cắm trại.
-Bố nói là đi cắm trại mà?
-Ừm... không phải cắm trại bình thường. Miếng bình an bà nội làm còn không? Mang hết theo đi."
lang_infodisplay.db,InfoDisplay,47,古榕“龙望”,"Ancient Banyan ""Longwang""","Cổ Dung ""Long Vọng"""
lang_infodisplay.db,InfoDisplay,48,"古榕“龙望”，位于中曲台地龙望郊北部。据《皇龙新植物考》记载，龙望的树龄推测在1400-1500年间，历经悲鸣仍屹立不倒。其根曲折，如蟒绕龙幡；虬枝似利爪，尽显恣意。
鸣式战争初期，面对无冠者的幻象大军，皇龙军队与祈池村民齐心协力，在此奋力抵抗，取得了可贵的胜利。岿然不动的古树如同大地的坐标，成为人们内心的依靠。只要龙望还在，中曲台地就有再次重生的一天。
新历147年，祈池村的居民们在天城的帮助下进行了古树复壮，并正式定名“龙望”。 

*温馨提示：请勿在树干、树枝上刻字。爱护古木，人人有责。","The ancient banyan ""Longwang"" is located in the northern part of Longwang land in Central Plains. According to the <i>New Botanical Records of Huanglong</i>, the age of Longwang is estimated to be between 1400 and 1500 years, and the tree still stands after Lament. Its roots twist and turn like a pythons and loongs; its gnarled branches resemble sharp claws, showing all the wantonness.
In the early days of the Threnodian War, when faced with the TD army of the Crownless, the Huanglong Army and the villagers of Qichi worked together to resist here and achieved a valuable victory. The immovable ancient tree is like the coordinates of the earth and has become a symbol to rely on. As long as Longwang is still here, the Central Plains will be reborn again.
In 147 A. L., the inhabitants of Qichi Village, with the help of Tiancheng, restored the old tree and officially named it ""Longwang"".

Kind Reminder: Please carve marks on the trunk or branches. Everyone should be responsible for taking care of the ancient tree.","Cổ dung ""Long Vọng"" nằm ở phía bắc ngoại ô Long Vọng, Trung Khúc Đài Địa. Theo ghi chép trong ""Hoàng Long Tân Thực Vật Khảo"", tuổi cây Long Vọng được ước tính trong khoảng 1400-1500 năm, trải qua Bi Minh vẫn sừng sững không đổ. Rễ cây quanh co, như trăn quấn rồng phướn; cành gân guốc tựa móng vuốt sắc bén, toát lên vẻ phóng khoáng tự do.
Đầu cuộc chiến Minh Thức, đối mặt với đội quân Ảo Ảnh của Vô Miện Giả, quân đội Hoàng Long và dân làng Kỳ Trì đồng lòng hiệp lực, anh dũng chống trả tại đây, giành được chiến thắng quý giá. Cây cổ thụ sừng sững bất động như tọa độ của đất trời, trở thành chỗ dựa trong lòng mọi người. Chỉ cần Long Vọng còn đó, Trung Khúc Đài Địa sẽ có ngày tái sinh.
Năm 147 Tân Lịch, cư dân thôn Kỳ Trì với sự giúp đỡ của Thiên Thành đã phục hồi cây cổ thụ, và chính thức đặt tên ""Long Vọng"".

*Lưu ý: Xin không khắc chữ lên thân cây, cành cây. Bảo vệ cây cổ là trách nhiệm của mọi người."
lang_infodisplay.db,InfoDisplay,49,未署名日记·其一,Journal without signature No. 1,Nhật Ký Không Đề Tên - Phần 1
lang_infodisplay.db,InfoDisplay,50,"第27天
炮击持续了三个小时。停顿两小时，再炮击三小时。

第28天
炮击持续了三个小时。停顿两小时，再炮击三小时。三水让我别乱记了，没个准的。但我是看小贵叹气计时，一般半小时他就要唉一下。我是知道他的习惯的，一直这样。
记录时间是很必要的。我们总有一天要出去。","Day 27
The bombing kept on for 3 hours. Then it stopped for 2 hours, and started again for another 3 hours.

Day 28
The bombing kept on for 3 hours. Then it stopped for 2 hours, and started again for another 3 hours. Sanshui tried to stop me from taking note of this. There isn't a routine. But I count the time by watching Gui sigh. He sighs every half an hour. I know his habit, it's always like that.
It's necessary to note the time. There will be the day we get out of here.","Ngày thứ 27
Pháo kích kéo dài ba tiếng. Ngừng hai tiếng, rồi lại pháo kích ba tiếng.

Ngày thứ 28
Pháo kích kéo dài ba tiếng. Ngừng hai tiếng, rồi lại pháo kích ba tiếng. Tam Thủy bảo tôi đừng ghi lung tung, không có chuẩn đâu. Nhưng tôi nhìn Tiểu Quý thở dài để tính giờ, khoảng nửa tiếng anh ấy lại thở dài một cái. Tôi biết thói quen của anh ấy mà, lúc nào cũng vậy.
Ghi lại thời gian là rất cần thiết. Tổng có ngày chúng tôi sẽ ra ngoài."
lang_infodisplay.db,InfoDisplay,51,未署名日记·其二,Journal without signature No. 2,Nhật Ký Không Đề Tên - Phần 2
lang_infodisplay.db,InfoDisplay,52,"第109天
今天有两声巨响，听不出来是什么，中间停顿了大概两分钟……三分钟？第一声响的时候，小贵那边刚搭好的新床被震得全散架，沙尘从头顶的石缝里哗哗掉，他立马就傻了，动也不动。直到第二声响，他又猛地嚎起来。
三水叫他闭嘴，他还是嚎，三水就给了他一巴掌，让他别影响大家。
我倒是无所谓。第一声响的时候，我已经在考虑下辈子的事情了。下辈子我想当一只咕咕河豚，谁弄我我就扎谁，不至于在这个阴暗的洞穴里躲躲藏藏。

第110天
三水说鸣式一脚就能踩爆几百只咕咕河豚，我说无所谓，咕咕河豚会扎他的脚。
今天没什么响动。","Day 109
Today there were two loud noises, I couldn't tell what they were. There was a pause in the middle of about two minutes or...... three minutes? When the first noise came, the new bed Gui just built was shaken all apart, sand and dust from the stone cracks overhead clattering off. he was immediately shocked, frozen there. And when the second noise striked, he howled violently all of a sudden.
Sanshui told him to shut up, but he kept howling. Sanshui gave him a slap, told him to not affect others.
I didn't care, though. At the first noise, I was already thinking about my next life. In my next life I want to be a Gulpuff, and I'll prick whoever messes with me, so I don't have to hide in this dull cave.

Day 110
Sanshui said Threnodians could trample hundres of Gulpuffs into pieces in one blow. I said that wouldn't matter. The Gulpuffs would prick his foot.
No sounds heard today.","Ngày thứ 109
Hôm nay có hai tiếng nổ lớn, không nghe ra là gì, giữa chừng ngừng khoảng hai phút... hay ba phút? Lúc tiếng nổ đầu tiên vang lên, cái giường mới dựng xong bên Tiểu Quý bị chấn động rung rời hết cả, cát bụi từ khe đá trên đầu ào ào rơi xuống, anh ấy lập tức đứng chết trân, không nhúc nhích. Cho đến khi tiếng nổ thứ hai vang lên, anh ấy lại bật gào lên dữ dội.
Tam Thủy bảo anh ấy im đi, anh ấy vẫn gào, Tam Thủy liền tát cho một cái, bảo đừng ảnh hưởng mọi người.
Còn tôi thì không sao. Lúc tiếng nổ đầu tiên vang lên, tôi đã bắt đầu nghĩ chuyện kiếp sau rồi. Kiếp sau tôi muốn làm một con cá nóc Cù Cù, ai trêu tôi thì tôi chích lại, chứ không phải trốn chui trốn nhủi trong cái hang tối tăm này.

Ngày thứ 110
Tam Thủy nói Minh Thức một chân có thể giẫm nát mấy trăm con cá nóc Cù Cù, tôi nói kệ, cá nóc Cù Cù sẽ chích chân nó.
Hôm nay không có tiếng động gì."
lang_infodisplay.db,InfoDisplay,53,未署名日记·其三,Journal without signature No. 3,Nhật Ký Không Đề Tên - Phần 3
lang_infodisplay.db,InfoDisplay,54,"小贵的孩子出生了，是在夜里。月光从被炸开的那个大洞照进来，还算亮。大家叽叽哇哇给孩子取名，最后选了“长明”。孩子一听就哭了，然后小贵也跟着哭，大家都跟着哭，就连三水也抹了抹眼睛。
在洞顶没被炸开之前，这里一直是看不见天光的。听着外面的炮火，除了恐惧，还有点说不上来的……轻松。现在好了，总归是知道天亮天暗，天雨天晴。大家已经决定住在这里，鸣式最后如何，我也不打算去想了，这里就挺好。

可能，未来会有人来这里调查，发现“洞穴人”之类的。我记下这些是希望那位探险家别把我们当做远古猿人，又是考证又是研究的，弄得很尴尬。
我们只是来这里避难的村民，没什么特别的，不必记住我们。","Gui's baby was born at night. The moonlight shone in through the big hole that was blown open, and it was quite bright. Everyone was yakking and trying to name the child, and we finally chose ""Changming"". The child immediately cried, and then Gui followed, and everyone cried, even Sanshui also wiped his eyes.
Before the roof of the cave was blown open, daylight could not be seen at this place. When we listen to the artillery fire outside, in addition to fear, there was also a little unspeakable...... ease. Now well, people always know the dawn and dusk, the rain and shine. Everyone has decided to live here. I give up on thinking about how the Threnodians will end up. We are good here.

Maybe, in the future, someone will come here for investigation and find ""cavemen"" or something like that. I'm writing this down because I hope the explorer won't treat us like ancient apes, and make it awkward with all the verifications and research.
We are just villagers who came here for refuge, nothing special, no need to remember us.","Con của Tiểu Quý chào đời rồi, vào ban đêm. Ánh trăng chiếu qua cái lỗ lớn bị bom thổi tung, cũng khá sáng. Mọi người xúm xít bàn tán đặt tên cho đứa bé, cuối cùng chọn tên ""Trường Minh"". Đứa bé vừa nghe xong liền khóc, rồi Tiểu Quý cũng khóc theo, mọi người đều khóc theo, ngay cả Tam Thủy cũng lau mắt.
Trước khi nóc hang bị bom thổi tung, nơi này chưa bao giờ nhìn thấy ánh sáng. Nghe tiếng pháo bên ngoài, ngoài sợ hãi, còn có chút gì đó... nhẹ nhõm nói không nên lời. Giờ thì tốt rồi, dù sao cũng biết trời sáng trời tối, trời mưa trời nắng. Mọi người đã quyết định ở lại đây, Minh Thức cuối cùng ra sao, tôi cũng không định nghĩ nữa, ở đây cũng tốt lắm rồi.

Có lẽ, tương lai sẽ có người đến đây điều tra, phát hiện ra ""người hang động"" hay gì đó. Tôi ghi lại những thứ này là hy vọng nhà thám hiểm đó đừng coi chúng tôi là vượn người cổ đại, rồi lại nghiên cứu khảo chứng, rất kỳ cục.
Chúng tôi chỉ là dân làng đến đây trú ẩn thôi, không có gì đặc biệt, không cần nhớ đến chúng tôi."
lang_infodisplay.db,InfoDisplay,55,施工公告,Notice of Construction,Thông Báo Thi Công
