db_file,table_name,id,zh,en,vi
lang_multi_text.db,MultiText,Main_Rinascita_2_12_50_12,你们想要改写人类的命运。,You want to rewrite humanity's fate.,Các ngươi muốn viết lại số phận của nhân loại.
lang_multi_text.db,MultiText,Main_Rinascita_2_12_50_13,……无论你有多么冠冕堂皇的理由，你曾在黎那汐塔降下无数灾难，早已无法洗脱自己的罪行。,"No matter how noble your reason may sound, the crimes you've committed in Rinascita are far too great to ever be forgiven.","...Dù lý do có hoa mỹ đến đâu, ngươi đã giáng xuống Rinascita vô số tai ương, tội ấy không gì có thể gột rửa."
lang_multi_text.db,MultiText,Main_Rinascita_2_12_50_14,我个人的命运无关紧要，在那「宏伟剧目」的面前，我也不过是一枚，小小的注脚。,"I care little for my own fate. I am but a small footnote in this ""grand repertoire.""","Số phận của riêng tôi chẳng quan trọng. Trước ""Vở Diễn Vĩ Đại"" kia, tôi cũng chỉ là một chú thích nhỏ bé mà thôi."
lang_multi_text.db,MultiText,Main_Rinascita_2_12_50_15,我同样会迎来自己的终局。若是为了剧本的完满，为了那「宏伟剧目」的落幕，我亦可将自己的陨落，写进自己的「剧本」之中。,"One day, my role will, too, end. And if that finale serves to bring the curtain down with perfection and grandeur, I'd gladly add it to the ""script.""","Tôi cũng sẽ đón nhận kết cục của mình. Nếu để kịch bản được trọn vẹn, để ""Vở Diễn Vĩ Đại"" hạ màn hoàn hảo, tôi sẵn sàng viết sự sụp đổ của chính mình vào ""kịch bản"" của tôi."
lang_multi_text.db,MultiText,Main_Rinascita_2_12_50_16,但……我真正的登台之日，尚未到来。此方舞台，现在属于黎那汐塔的人们。,"However, my moment on stage has yet to come. The spotlight now belongs to the people of Rinascita.","Nhưng... ngày tôi thực sự bước lên sân khấu vẫn chưa đến. Sân khấu này, giờ thuộc về người dân Rinascita."
lang_multi_text.db,MultiText,Main_Rinascita_2_12_50_17,为了证明自己的观点，你为阿维狄亚，甚至是为黎那汐塔的人们，“书写”了如此残酷的命运……,"You wrote Avidius and all of Rinascita into a tragedy, just to prove a point.","Để chứng minh quan điểm của mình, ngươi đã ""viết"" nên số phận tàn khốc như vậy cho Avidius, thậm chí cho cả người dân Rinascita..."
lang_multi_text.db,MultiText,Main_Rinascita_2_12_50_18,当你拿起“笔”时，你的所作所为，又与你所厌恶的「神明」有什么区别？——我绝不会信任你，将“笔”置于你的手中。,"You speak of divinities with disdain, but the moment you took up that ""quill,"" you became no different. I don't trust you, or the ""quill"" in your hands.","Khi ngươi cầm lấy ""cây bút"", hành động của ngươi có khác gì ""Thần Minh"" mà ngươi căm ghét? - Tôi sẽ không bao giờ tin ngươi, cũng không giao ""cây bút"" vào tay ngươi."
lang_multi_text.db,MultiText,Main_Rinascita_2_12_50_19,诚然。我相信，一定有比我更适合执笔的人选。,Certainly. I do believe there is someone more worthy than I to wield it.,"Đúng vậy. Tôi tin rằng, nhất định có người phù hợp hơn tôi để cầm bút."
lang_multi_text.db,MultiText,Main_Rinascita_2_12_50_2,为何要如此急于奔赴深渊？在剧本走向最高潮之前，我们理应拥有一个短暂的幕间。,"No need to rush toward the abyss in such haste. Please, take your time to enjoy this interlude before the story meets its climax.","Sao phải vội vã lao xuống vực thẳm như vậy? Trước khi kịch bản đạt đến cao trào, chúng ta nên có một khoảng nghỉ giữa màn ngắn ngủi."
lang_multi_text.db,MultiText,Main_Rinascita_2_12_50_20,我们曾无数次向你发出邀请，如果你愿意加入我们……拿起那支笔的资格，理应为你所有。,"We've invited you before, many times. Should you choose to accept… you would be the one to hold that quill.","Chúng tôi đã vô số lần gửi lời mời đến bạn. Nếu bạn chịu gia nhập... quyền cầm bút ấy, đáng lẽ đã thuộc về bạn."
lang_multi_text.db,MultiText,Main_Rinascita_2_12_50_21,命运，是由人类一同撰写的。,Fate should be written by all of humanity.,"Số phận, là do cả nhân loại cùng nhau viết nên."
lang_multi_text.db,MultiText,Main_Rinascita_2_12_50_22,没有人有决定他人命运的权力。,No one has the right to dictate another's fate.,Không ai có quyền quyết định số phận của người khác.
lang_multi_text.db,MultiText,Main_Rinascita_2_12_50_23,“笔”不应属于任何一个人，我也不例外。,That quill belongs to no one. Not you. Not me.,"""Cây bút"" không nên thuộc về bất kỳ ai, kể cả tôi."
lang_multi_text.db,MultiText,Main_Rinascita_2_12_50_24,你的命运与黎那汐塔本无关联。如今为了帮助他们夺还命运，只身赶赴深渊……你，又何尝不是在希望，能够通过自己去拯救所有人？,"Unbound by Rinascita's fate, and still, you descend into the abyss alone… to aid in their defiance of fate. Aren't you merely playing the role of savior?","Số phận của bạn vốn không liên quan gì đến Rinascita. Giờ vì giúp họ giành lại số phận mà một mình lao xuống vực thẳm... bạn chẳng phải cũng đang hy vọng, dùng chính bản thân mình để cứu tất cả mọi người hay sao?"
lang_multi_text.db,MultiText,Main_Rinascita_2_12_50_25,我知道，你拥有着“不属于此世的力量”，它为你带来了过人的勇气。但很可惜……,"I know you bear a ""power not of this world."" It grants you a courage that borders on folly. But even so...","Tôi biết, bạn sở hữu ""sức mạnh không thuộc về thế giới này"", nó mang đến cho bạn lòng dũng cảm phi thường. Nhưng đáng tiếc..."
lang_multi_text.db,MultiText,Main_Rinascita_2_12_50_26,阿布的体内，存在着无相燹主的力量。而鸣式的本源如一，若是令两股鸣式频率相碰……,Ovathrax's power lies dormant within Abby. A Threnodian's essence is one and the same. Should two such frequencies ever collide…,"Trong cơ thể Abby tồn tại sức mạnh của Vô Tướng Tiến Chủ. Mà nguồn gốc Minh Thức vốn là một, nếu để hai dòng tần số Minh Thức va chạm..."
lang_multi_text.db,MultiText,Main_Rinascita_2_12_50_27,利维亚坦，便可以利用黑潮彻底侵蚀阿布，同时“融合”无相燹主的频率，令自己完全重生。,"Leviathan could use the Dark Tide to possess Abby, merge with Ovathrax, and eventually, complete Its rebirth.","Leviathan có thể lợi dụng Hắc Triều để xâm thực hoàn toàn Abby, đồng thời ""dung hợp"" tần số của Vô Tướng Tiến Chủ, khiến bản thân được tái sinh trọn vẹn."
lang_multi_text.db,MultiText,Main_Rinascita_2_12_50_28,（{PlayerName}，本布，没问题的……）,"(I'm alright, {PlayerName}.)","({PlayerName}, ta, không sao đâu...)"
lang_multi_text.db,MultiText,Main_Rinascita_2_12_50_29,……你似乎，从未怀疑过它的身份。,"You've never questioned what Abby is, have you?",...Có vẻ bạn chưa bao giờ nghi ngờ về thân phận của nó.
lang_multi_text.db,MultiText,Main_Rinascita_2_12_50_3,我不在乎你的故事。,I don't care about your theatrics.,Tôi không quan tâm đến câu chuyện của ngươi.
lang_multi_text.db,MultiText,Main_Rinascita_2_12_50_30,也许，与利维亚坦融合后，它的记忆也会被唤醒，从而找回自己“真正的本质”……如果你愿为此冒险尝试，我亦愿为你，修改我的剧本。,"Perhaps, once Abby merges with Leviathan, it will recall what it once was and find its ""true self."" If that's the risk you're prepared to take, I suppose I can revise my script accordingly.","Có lẽ, sau khi dung hợp với Leviathan, ký ức của nó cũng sẽ được đánh thức, từ đó tìm lại ""bản chất thật sự"" của mình... Nếu bạn sẵn sàng mạo hiểm thử, tôi cũng sẵn lòng vì bạn mà sửa lại kịch bản."
lang_multi_text.db,MultiText,Main_Rinascita_2_12_50_31,你们，从一开始就在针对我？,So I was your target all along?,"Các ngươi, ngay từ đầu đã nhắm vào tôi?"
lang_multi_text.db,MultiText,Main_Rinascita_2_12_50_32,你的伏笔，是在多久前埋下的？,How long have you been setting this up?,"Phục bút này, ngươi đã cài từ bao giờ?"
lang_multi_text.db,MultiText,Main_Rinascita_2_12_50_33,让我成为代行者，也是你的编排？,Making me the Harbinger… was that part of your design too?,"Biến tôi thành Đại Hành Giả, cũng là do ngươi sắp đặt?"
lang_multi_text.db,MultiText,Main_Rinascita_2_12_50_34,利维亚坦一直在挑选祂的代行者，但祂最开始的目标，并非是你。而是七丘的总督，奥古斯塔。,"Leviathan has long sought Its Harbinger, but you weren't Its first choice. That role was meant for Augusta, Septimont's current Ephor.","Leviathan luôn tìm kiếm Đại Hành Giả cho mình, nhưng mục tiêu ban đầu không phải là bạn. Mà là Tổng đốc Bảy Đồi - Augusta."
lang_multi_text.db,MultiText,Main_Rinascita_2_12_50_35,那位谕女，以自身存在为代价所射出的一箭，不仅阻碍了“天国”的降临，也扰动了我剧本原有的安排。,"The Paradise should have descended as I had written. Yet the Priestess's arrow, fired at the cost of her very existence, sent the story veering off-script.","Mũi tên mà vị Dụ Nữ đánh đổi cả sự tồn tại để bắn ra, không chỉ cản trở sự giáng lâm của ""Thiên Quốc"", mà còn xáo trộn kịch bản ban đầu của tôi."
lang_multi_text.db,MultiText,Main_Rinascita_2_12_50_36,但初稿难免需要修改，剧本总是要不断打磨，才能变得更加完满。也是因此，我们才能选中……更加适合带去绝望的代行者。,"Still, any script worth its ink must be able to adapt. Just a few careful strokes, and we found the perfect protagonist to bear the mantle of despair.","Nhưng bản thảo đầu khó tránh phải sửa, kịch bản luôn cần mài giũa mới hoàn hảo hơn. Cũng nhờ vậy, chúng tôi mới chọn được... Đại Hành Giả phù hợp hơn để mang đến tuyệt vọng."
lang_multi_text.db,MultiText,Main_Rinascita_2_12_50_37,你们的计划，我们早已知晓。你的同伴都已落入黑潮，失去了锚定的方向，只会是永陷幽冥，无尽沉沦。,"We knew your plan from the beginning. Now your companions are lost to the Dark Tide, adrift with no Anchor in sight, fated to sink endlessly into the depths.","Kế hoạch của các ngươi, chúng tôi đã biết từ lâu. Đồng đội của bạn đều đã rơi vào Hắc Triều, mất phương hướng neo giữ, chỉ còn mãi chìm trong u minh, đắm đuối không ngừng."
lang_multi_text.db,MultiText,Main_Rinascita_2_12_50_38,而卡提希娅……为她偿还代价的神明已死。你……当真认为，仅凭她自己的「人性」，就足以同利维亚坦的意志相抗衡？,As for Cartethyia... The Divinity that granted her a second life is dead. Do you truly believe her Humanity alone can stand against Leviathan?,"Còn Cartethyia... vị thần từng trả giá thay cô ấy đã chết. Bạn... thật sự cho rằng, chỉ dựa vào ""Nhân Tính"" của riêng cô ấy, là đủ để chống lại ý chí của Leviathan sao?"
lang_multi_text.db,MultiText,Main_Rinascita_2_12_50_39,……我相信着他们。,I believe in all of them...,...Tôi tin họ.
lang_multi_text.db,MultiText,Main_Rinascita_2_12_50_4,你们究竟想做什么？,What are you really after?,Rốt cuộc các ngươi muốn làm gì?
lang_multi_text.db,MultiText,Main_Rinascita_2_12_50_40,……正如他们相信我一样。,...Just as they believe in me.,...Như cách họ tin tôi vậy.
lang_multi_text.db,MultiText,Main_Rinascita_2_12_50_41,在困境中心怀希望，至少好过溺毙在迷茫中。描述人们在绝望中挣扎着走向末路的故事，历来更加扣人心弦。,"Yes. Hope amid hardship makes a finer tale than one of aimless doubt. The audience always favors stories steeped in distress, struggle, and ruin.","Giữ hy vọng trong nghịch cảnh, ít ra cũng tốt hơn là chết chìm trong mờ mịt. Những câu chuyện về con người vật lộn trong tuyệt vọng rồi đi đến tận cùng, xưa nay vẫn luôn lay động lòng người."
lang_multi_text.db,MultiText,Main_Rinascita_2_12_50_42,短暂的幕间休息，只能到此为止了。利维亚坦已经结束了祂的沉眠，祂的怒火，将随着祂的福音一同蔓延。,"Alas, this interlude must end here. Leviathan stirs from Its slumber, and with Its wrath comes Its gospel.","Khoảng nghỉ giữa màn ngắn ngủi chỉ có thể đến đây thôi. Leviathan đã tỉnh giấc, cơn thịnh nộ của Ngài sẽ lan tràn cùng phúc âm."
lang_multi_text.db,MultiText,Main_Rinascita_2_12_50_43,希望你们能够展现……人类，具有战胜神明的可能吧。证明你们的「自由意志」，证明你们，具有「书写命运」的资格。,"Now then, show me... Show me that humanity can rise against the divine. Prove your will is your own. Prove you are worthy to pen your own fate.","Hy vọng các bạn có thể cho thấy... nhân loại, có khả năng chiến thắng thần minh. Hãy chứng minh ""ý chí tự do"" của các bạn, chứng minh rằng các bạn có đủ tư cách ""viết nên số phận""."
lang_multi_text.db,MultiText,Main_Rinascita_2_12_50_44,但如果，人类无法跨越神明的门阶……我们，将会代替人类，去书写新的命运。,But if humanity cannot cross the threshold of the divine... then we shall be the ones to write its fate instead.,Nhưng nếu nhân loại không thể bước qua ngưỡng cửa của thần minh... chúng tôi sẽ thay nhân loại viết nên số phận mới.
lang_multi_text.db,MultiText,Main_Rinascita_2_12_50_45,而现在，你也已知晓，即使是黎那汐塔的命运，亦有被岁主撰写的痕迹。,"By now, you must have realized that Rinascita's fate was forged by the Sentinel.","Và giờ, bạn cũng đã biết, ngay cả số phận của Rinascita, cũng có dấu vết được Tuế Chủ viết nên."
lang_multi_text.db,MultiText,Main_Rinascita_2_12_50_46,或曾想过，为何它在吸收黑潮之后，会出现眩晕的症状？黑潮的本质，你已经了解……,Never paused to wonder why it grows dizzy each time it absorbs the Dark Tide? You do already know what the Dark Tide really is...,"Bạn có bao giờ tự hỏi, vì sao sau khi hấp thụ Hắc Triều, nó lại bị chóng mặt không? Bản chất của Hắc Triều, bạn đã hiểu rồi..."
lang_multi_text.db,MultiText,Main_Rinascita_2_12_50_47,"在通往「天国」的最后长阶之上，克里斯托弗再一次挡在了你的面前。
自他的话语中，你终于知晓了他们的目的……他们意欲成为比肩“神明”的存在，并以此，改写“人类的命运”。
即使理由再冠冕堂皇，你也无法认可他们的所作所为，克里斯托弗却对你发出了邀请：他们愿意将“执笔的权力”交给你。
命运，是由人类一同书写的。你再度坚定了自己的态度，而克里斯托弗似乎早已识破了你的计划：鸣式的本源如一，阿布的体内尚存有无相燹主的频率，若是尝试吸收鸣式宝石，只会使利维亚坦「融合」无相燹主的频率，从而令祂完全苏生。
你们的手段均被识破，但你却从未放弃希望。克里斯托弗为你让开了道路，利维亚坦的烈怒却随即降下……如此，便证明你们的“自由意志”，足以“战胜神明”，取得“书写命运的资格”吧。","On the final path leading to the Paradise, Cristoforo once again blocks your path.

He reveals the Fractsidus's goal: to become beings equal to the gods themselves, and to rewrite ""humanity's fate.""

No matter how noble their reasoning, you cannot condone their methods. Still, Cristoforo extends an offer: to make you the ""Quillbearer,"" granting you the authority to write the fate of humankind.

But humanity's fate belongs to no one but humanity itself. You make your stance known. Cristoforo, however, has already seen through your plan. Because Abby still carries the frequency of the Ovathrax, if it attempts to absorb the Gem, Leviathan may merge with that power and complete Its rebirth.

Your strategy is exposed, but you refuse to abandon hope. Cristoforo steps aside, and in the next instant, Leviathan's wrath descends. Let your free will rise against the divine. Let it prove you worthy to seize the right to write fate with your own hands.","Trên bậc thang cuối cùng dẫn đến ""Thiên Quốc"", Cristoforo một lần nữa chắn đường bạn.
Từ lời hắn, bạn cuối cùng cũng biết được mục đích của họ... họ muốn trở thành tồn tại ngang hàng ""Thần Minh"", và từ đó viết lại ""số phận nhân loại"".
Dù lý do có hoa mỹ đến đâu, bạn cũng không thể chấp nhận những gì họ đã làm. Nhưng Cristoforo lại mời gọi bạn: họ sẵn sàng trao ""quyền cầm bút"" cho bạn.
Số phận là do cả nhân loại cùng viết nên. Bạn một lần nữa giữ vững lập trường, nhưng Cristoforo dường như đã nhìn thấu kế hoạch của bạn: nguồn gốc Minh Thức vốn là một, trong cơ thể Abby vẫn còn tần số của Vô Tướng Tiến Chủ, nếu thử hấp thụ Minh Thức bảo thạch, chỉ khiến Leviathan ""dung hợp"" tần số Vô Tướng Tiến Chủ, từ đó hoàn toàn tái sinh.
Mọi thủ đoạn của các bạn đều bị nhìn thấu, nhưng bạn chưa từng từ bỏ hy vọng. Cristoforo nhường đường cho bạn, nhưng cơn thịnh nộ của Leviathan lập tức giáng xuống... Vậy thì, hãy chứng minh ""ý chí tự do"" của các bạn, đủ để ""chiến thắng thần minh"", giành lấy ""tư cách viết nên số phận""."
lang_multi_text.db,MultiText,Main_Rinascita_2_12_50_5,阿维狄亚的故事，是否曾让你感到悲悯与激愤？,Did Avidius's story stir sorrow and anger in your heart?,"Câu chuyện của Avidius, có khiến bạn cảm thấy xót thương và phẫn nộ không?"
lang_multi_text.db,MultiText,Main_Rinascita_2_12_50_6,阿维狄亚的故事，曾让你感到悲悯与激愤。,"Avidius's story stirred sorrow and anger in your heart, I presume?","Câu chuyện của Avidius, đã khiến bạn cảm thấy xót thương và phẫn nộ."
lang_multi_text.db,MultiText,Main_Rinascita_2_12_50_7,那么，你是否怀疑过，在这世界上，同样有一个更加崇高的存在……在默默撰写着「人类的命运」。,"With that truth exposed, have you ever suspected that ""humanity's fate"" could also be the design of a higher being?","Vậy, bạn có bao giờ nghi ngờ rằng, trên thế giới này cũng tồn tại một thực thể cao quý hơn... đang âm thầm viết nên ""số phận nhân loại""."
lang_multi_text.db,MultiText,Main_Rinascita_2_12_50_8,于战火中降生的女婴，为何注定要与神明抗衡，承受“第二次苦难”……因为是自索诺拉中诞生的存在，便注定要成为“弥补空缺的核心”……,"A girl born into a land ravaged by war... Tell me, why was she fated to stand against the divine and endure a ""Second Suffering""? And that one, born of Sonoro itself, designed to serve as the ""core of a hollow system""...","Đứa bé gái sinh ra giữa lửa chiến, vì sao lại định sẵn phải chống lại thần minh, gánh chịu ""Khổ nạn lần thứ hai""... Vì là tồn tại sinh ra từ Sonoro, nên định mệnh phải trở thành ""lõi bù đắp chỗ trống""..."
lang_multi_text.db,MultiText,Main_Rinascita_2_12_50_9,这一切的命运，由谁决定？这一切的苦难，由谁定夺？如若命运，无法给予所有人同等的恩惠，无法给予所有人同样公正的结局……,Who scripts such destinies? Who appoints such suffering? If fate cannot grant equal grace to all... If it cannot offer each soul a just and rightful end...,"Tất cả số phận này, ai quyết định? Tất cả khổ nạn này, ai phán xét? Nếu số phận không thể ban ân huệ ngang bằng cho mọi người, không thể cho mọi người một kết cục công bằng như nhau..."
lang_multi_text.db,MultiText,Main_Rinascita_2_12_51_1,明天，又一个明天，又一个明天。,"Tomorrow, and tomorrow, and tomorrow...","Ngày mai, rồi lại ngày mai, rồi lại ngày mai."
lang_multi_text.db,MultiText,Main_Rinascita_2_12_51_2,迈着琐碎的脚步，日复一日地向前，直到生命终结的最后一幕。,"Creeps in this petty pace from day to day, to the last syllable of recorded time.","Bước đi nhỏ nhặt, ngày qua ngày, cho đến màn cuối cùng khi đời tàn."
lang_multi_text.db,MultiText,Main_Rinascita_2_12_51_3,我们所有的昨天，不过是……照亮了通往死亡的道路。,All our yesterdays are but... faint glimmers lighting the road to the grave.,"Tất cả ngày hôm qua của chúng ta, chẳng qua chỉ là... soi sáng con đường dẫn đến cái chết."
lang_multi_text.db,MultiText,Main_Rinascita_2_12_52_1,生命不过是个行走的影子，一个可怜的伶人，在舞台上懊恼、张狂……,"Life is but a walking shadow, a poor player that struts and frets their hour upon the stage...","Đời người chẳng qua là cái bóng lang thang, một kẻ hát rong tội nghiệp, trên sân khấu ân hận, cuồng loạn..."
lang_multi_text.db,MultiText,Main_Rinascita_2_12_52_2,在短暂的时光过后……永远消亡。,"And then, in the blink of a moment, is heard no more...",Rồi sau khoảnh khắc ngắn ngủi... vĩnh viễn tiêu vong.
lang_multi_text.db,MultiText,Main_Rinascita_2_12_52_3,我相信他们……正如他们，相信着我一样……,I believe in them... just as they believe in me...,Tôi tin họ... như cách họ... tin tôi vậy...
lang_multi_text.db,MultiText,Main_Rinascita_2_12_52_4,呵呵……没错，在这场戏剧里，你一直是我们的主角。,Hehe... of course. You've always been the protagonist of our play.,"Hehe... đúng vậy, trong vở kịch này, bạn luôn là nhân vật chính của chúng tôi."
lang_multi_text.db,MultiText,Main_Rinascita_2_12_52_5,但如果，我们口中的那位，能够“终结利维亚坦的角色”……并非是身为主角的你呢？,"But what if, the one we speak of, ""the one meant to end Leviathan""...is not you?","Nhưng nếu, người mà chúng tôi nói đến, có thể ""kết thúc vai trò của Leviathan""... lại không phải bạn - nhân vật chính, thì sao?"
lang_multi_text.db,MultiText,Main_Rinascita_2_12_52_6,你们真正的目标，难道是……,What...? So your true target is...,"Mục tiêu thật sự của các ngươi, chẳng lẽ là..."
lang_multi_text.db,MultiText,Main_Rinascita_2_12_52_7,我不会插手，她与那位大人的戏份。,The special scene between her and our Grand Architect must not be disturbed.,Tôi sẽ không can thiệp vào phân cảnh giữa cô ấy và vị đại nhân kia.
lang_multi_text.db,MultiText,Main_Rinascita_2_12_52_8,也请你稍作歇息，准备迎接，独属于你的终幕吧。,"For now, take a brief rest. The stage is nearly set for your finale.","Bạn cũng hãy nghỉ ngơi chút đi, chuẩn bị đón nhận... màn cuối dành riêng cho bạn."
lang_multi_text.db,MultiText,Main_Rinascita_2_12_52_9,"克里斯托弗的话语再度传来，似是要瓦解你最后的希望——如果，他们口中的那位，能够“终结利维亚坦的角色”……并非是身为主角的你呢？而与之对弈的角色，也要远比他更加强大。
你意识到了他们的笔锋所向。与此同时，天国的阶梯逐渐崩毁，在你即将抵达尽头之时，“黑潮的侵蚀”却突然袭来，你也因此不慎落入了黑潮。
现在，还是请你稍作歇息……准备迎接，独属于你的终幕吧。","Cristoforo's voice continues, seeking to shatter your final hope: What if the one meant to end Leviathan... is not you? What if whoever is capable of doing so is far stronger than even Cristoforo himself?

The Fractsidus's endgame begins to dawn on you. At the same time, the stairway to Paradise begins to crumble. Just as you near the end, the Dark Tide surges and pulls you under.

Rest for now. The final act of your story awaits.","Lời của Cristoforo lại vang lên, dường như muốn phá tan hy vọng cuối cùng của bạn - nếu người mà họ nói đến, có thể ""kết thúc vai trò của Leviathan""... lại không phải bạn - nhân vật chính, thì sao? Và đối thủ thực sự còn mạnh hơn hắn rất nhiều.
Bạn nhận ra đích ngắm thật sự trong kịch bản của họ. Cùng lúc đó, bậc thang dẫn đến Thiên Quốc dần sụp đổ. Khi bạn sắp chạm đến tận cùng, ""sự xâm thực của Hắc Triều"" bất ngờ ập đến, khiến bạn rơi vào Hắc Triều.
Bây giờ, hãy nghỉ ngơi đi... chuẩn bị đón nhận màn cuối dành riêng cho bạn."
