db_file,table_name,id,zh,en,vi
lang_multi_text.db,MultiText,InfoDisplay_160000005_Text,"那个自称塔洛斯的女人没收了我们的食物，强迫我们为她效命。她说这才是黑街原本该有的秩序，靠力量来获得地位，靠力量夺取财富，而弱者根本没有存在的必要。从十年前，二十年前，很久很久以前就一直这样了。布兰登他们向她发起了挑战，希望能够把我们从她的“统治”下解放出来，但他们失败了。在这之后，大家都没再见过他们。
我又不是没听过之前帮派的故事。他们无恶不作，最后还是得到了应有的审判和惩罚。我们只是想在黑街安安稳稳地生活下去，我们不想去和他们一样，去城里干那些犯罪勾当，我们只想在这里过我们自己的日子。黑街就是我们的家。
我想了个主意，如果顺利的话，我就能逃离这个鬼地方。我听说，之前的帮派是被一个名为「焰光的夜行者」的英雄解决掉的，也许我能找到她，并请她再一次拯救黑街。","That woman who calls herself Talos took all of our food and forced us to obey her commands. She said this was the way of the Black Alley of old, where strength determines power and wealth, and the weak have no place. This order existed ten, twenty years ago, and even long before that. Brandon and the others tried to challenge her, hoping to liberate us from her ""rule,"" but they failed. That was the last anyone ever saw of them.

Oh, I've heard plenty of stories about the Black Alley, all right. The evil they committed. How they eventually received the judgment and punishment they had coming for them. All we wanted was a peaceful life in the Black Alley. We never wanted to be like them, wreaking havoc in the city. We just want to live our own lives here. The Black Alley is our home.

I have a plan in mind. If all goes well, then I can escape this miserable dump. I heard that a hero named the ""Blazing Nightwalker"" took out the previous gang. Maybe I can find her and ask her to save the Black Alley again.","Người phụ nữ tự xưng Talos đó đã tịch thu thức ăn của chúng tôi, ép buộc chúng tôi bán mạng cho ả. Ả nói đây mới là trật tự vốn có của Phố Đen, dựa vào sức mạnh để đạt được địa vị, dựa vào sức mạnh đoạt lấy của cải, còn kẻ yếu hoàn toàn không cần thiết tồn tại. Từ mười năm trước, hai mươi năm trước, từ rất lâu rất lâu trước đây đã luôn như vậy. Nhóm Brandon đã khiêu chiến với ả, hy vọng có thể giải phóng chúng tôi khỏi sự ""cai trị"" của ả, nhưng bọn họ đã thất bại. Sau chuyện này, mọi người đều không gặp lại bọn họ nữa.
Tôi đâu phải chưa từng nghe chuyện về bang phái trước kia. Bọn họ không việc ác nào không làm, cuối cùng vẫn nhận được sự phán xét và trừng phạt thích đáng. Chúng tôi chỉ muốn sống yên ổn ở Phố Đen, chúng tôi không muốn giống như bọn họ, vào thành làm những chuyện phạm tội đó, chúng tôi chỉ muốn sống cuộc sống của riêng mình ở đây. Phố Đen chính là nhà của chúng tôi.
Tôi nghĩ ra một ý tưởng, nếu thuận lợi, tôi sẽ có thể thoát khỏi cái nơi quỷ quái này. Tôi nghe nói, bang phái trước kia bị một người anh hùng tên là ""Dạ Hành Giả Diễm Quang"" giải quyết, có lẽ tôi có thể tìm được cô ấy, và xin cô ấy cứu Phố Đen một lần nữa."
lang_multi_text.db,MultiText,InfoDisplay_160000005_Title,【笔记本残页】,Torn Pages of a Journal,[Trang Sổ Tay Rách]
lang_multi_text.db,MultiText,InfoDisplay_160000006_Text,"换班的时间又过了，科尔！我可不会再像昨天那样等你了，我要回我的小屋，好好喝上两杯，再睡一觉。反正我已经值完班了，就算塔洛斯老大问起来，这也怪不到我身上。
我先回去了。你应该记得机关的解除方式，沿着地上涂鸦的方向操作就行。等中间人把新人带来的时候，别忘了给他们开门。","You missed your shift again, Cole! I'm not waiting around for you like I did yesterday. I'm heading back to my shack, grabbing a few drinks, and getting some sleep. I've done my part of the shift. If Talos starts asking questions, don't expect me to take the fall.

I'm off. I'm sure you know how to disarm the traps. Just follow the directions of the drawings on the ground. When the Runner brings in the new recruits, don't forget to open the gates for them.","Lại qua giờ đổi ca rồi, Cole! Tôi sẽ không đợi cậu như hôm qua nữa đâu, tôi phải về cái chòi của tôi, uống vài ly cho đã, rồi ngủ một giấc. Dù sao tôi cũng trực xong rồi, cho dù đại tỷ Talos hỏi tới, chuyện này cũng không trách được tôi.
Tôi về trước đây. Cậu chắc nhớ cách giải trừ cơ quan chứ, cứ thao tác theo hướng hình vẽ trên đất là được. Đợi khi người trung gian đưa người mới đến, đừng quên mở cửa cho họ."
lang_multi_text.db,MultiText,InfoDisplay_160000006_Title,【看守的便条】,Note From a Lookout,[Giấy Nhắn Của Lính Canh]
lang_multi_text.db,MultiText,InfoDisplay_160000007_Text,"塔洛斯老大让我这两天去城里办点事，这里的场子就先交给你管了，菜鸟。
压力别太大，只要你严格按照我说的做，就不会把事儿搞砸。
场子开放时间是晚上六点以后，白天的时候你负责指挥那几个小子打扫打扫卫生，把打碎的东西收拾收拾，不然大家看到这里乱糟糟的也不痛快。黑街看不到太阳，你记得多看看表，别耽误营业。
等人来了之后，先按绿色的按钮，按两下，放个开场曲给他们暖暖场子。记住，这时候不要提供饮料，如果有人因此闹事就让文森特陪他们到拳台上解决，要是文森特打不过就喊塔洛斯老大。
等暖场二十分钟之后按红色按钮，然后再按两下绿色按钮，之后每隔半小时再重复按一次就行了。我留了些很劲爆的新曲子，他们会喜欢这个的。这时候让手下的小子们把饮料都搬出来，气氛越高越能卖个好价钱。
记住，不管什么时候，只要你看到塔洛斯老大出现在这里，就立刻按黄色按钮。那会播放她最喜欢的摇滚乐《黑街的恶魔》。
别的就没什么了。好好干，菜鸟！","Talos sent me to the city on errands for the next couple of days, so you're in charge while I'm gone, rookie.
Don't sweat it. Just follow my instructions to the letter, and you won't screw this up.

We open for business after six in the evening. During the day, put those kids on cleaning duty and make sure the broken bottles and mess from the night before are taken care of. No one likes a messy establishment. The Black Alley doesn't get any sunlight, so keep an eye on your watch and don't miss opening time.

Once people start to come in, hit the green button twice. Start things off with a track to set the mood. And remember: don't serve beverages just yet. If someone decides to make a scene about it, have Vincent take them to the ring and settle it over fists. If Vincent can't handle it, call Talos.

After a twenty-minute warmup, hit the red button once and the green button twice. Repeat this every half hour. I've prepped some banger music that they'll love. This is when you have the boys bring out the drinks. Once the vibe picks up, that's when the booze starts selling.

Keep in mind, whenever you see Talos show up, hit the yellow button right away. That'll play her favorite rock song, ""The Black Alley Devils.""

That's about it. She's all yours, rookie!","Đại ca Talos bảo tôi hai ngày này phải lên thành phố lo chút việc, nên cái quán này tạm giao cho cậu quản lý, lính mới.
Đừng áp lực quá, chỉ cần cậu làm đúng y như những gì tôi dặn thì sẽ không hỏng việc đâu.
Quán mở cửa sau sáu giờ tối, ban ngày cậu chỉ huy mấy thằng nhóc dọn dẹp vệ sinh, thu dọn mấy thứ vỡ nát đi, không thì mọi người nhìn thấy bừa bộn lại mất hứng. Ở Hẻm Tối không thấy được mặt trời đâu, nhớ xem đồng hồ thường xuyên, đừng để lỡ giờ mở cửa.
Khi khách đến, đầu tiên ấn nút màu xanh lá, ấn hai cái, mở nhạc mở màn cho nóng không khí. Nhớ kỹ, lúc này chưa phục vụ đồ uống, nếu có ai gây sự vì chuyện này thì bảo Vincent dẫn bọn họ lên võ đài giải quyết, nếu Vincent đánh không lại thì gọi đại ca Talos.
Sau khi làm nóng không khí khoảng hai mươi phút thì ấn nút màu đỏ, rồi lại ấn nút màu xanh lá hai lần, sau đó cứ cách nửa tiếng lại lặp lại một lần là được. Tôi đã để sẵn mấy bài nhạc mới rất bốc, bọn họ sẽ thích cái đó. Lúc này bảo mấy thằng đệ bê hết đồ uống ra, không khí càng cao trào càng bán được giá hời.
Nhớ kỹ, bất kể lúc nào, chỉ cần thấy đại ca Talos xuất hiện thì lập tức ấn nút màu vàng. Nó sẽ phát bài Rock cô ấy thích nhất ""Ác Ma Hẻm Tối"".
Còn lại thì chẳng có gì nữa. Làm cho tốt vào, lính mới!"
lang_multi_text.db,MultiText,InfoDisplay_160000007_Title,【生活区备忘录】,Living Quarters Memo,[Ghi Chú Khu Sinh Hoạt]
lang_multi_text.db,MultiText,InfoDisplay_160000008_Text,"这是我进入黑街的第五天。这里的人都很警觉，他们就像是在害怕着什么一样。当然啦，他们什么也不肯对我说。
黑街，对于拉古那人来说是个相当神秘的地方。年轻人根本不知道它的存在，老人们都将这里视为禁忌。想想看，如果我能够把这里的秘密写成稿件，发表在报纸上，会在拉古那引起多大的轰动！
我找到了一个好心人——大家都说他是个中间人，虽然不知道他背后到底站着谁。在他的慷慨帮助下，我成功进入了黑街，得以接触这个神秘之地的第一手资料。
我前三天的调查基本上一无所获。不过，我和一个叫布兰登的年轻人混熟了，他似乎在这里住了很久。我和他是在打台球的时候认识的，说实话，他的球技很不错，是个不错的对手——只要他不耍诈的话。上次打台球的时候我挂在旁边的外套突然开始冒烟，还好我及时把它扑灭了。但等我回来一看，他已经趁我不在“打”进了三颗球。
虽然布兰登对黑街的事情也绝口不提，而且总是心事重重的样子，但我觉得他会成为我这场短暂采访中的一个良好突破口。他不像那些老人那么执拗，也不像那些戴面具的家伙那么不好说话。我不知道那些面具人到底是什么来路，不过，我觉得我总有一天会搞明白的。
说起来，布兰登已经有两天没露过面了。也许他是去照顾那些饥饿的老人了。如同我之前调查到的一样，黑街的人们靠打零工谋生，所以他们很难获取到足够的食物，布兰登总是把自己的口粮分给他们。
不管布兰登到底去哪了，他总会回来打台球的。我觉得我在这里等着他就好。","This is my fifth day in the Black Alley. People here are always on edge like they're afraid of something. No one says a word about it, of course.

The Black Alley is an oddity to the Ragunnesi. Youngsters these days don't even know it exists, while the old consider it a forbidden territory. Imagine the uproar it would cause in Ragunna if I wrote about its secrets and published them!

I met a nice fellow—everyone calls him the Runner, although I'm not sure who's pulling his strings. Thanks to his help, I got access to the Black Alley and its many mysteries.

The first three days of my investigation came up empty. But I did get to know a young man named Brandon over a game of pool. Seems like he's spent his fair share of time here. To be honest, he's damn good at the game, a worthy opponent, as long as he isn't cheating. Last time we played, the coat I had hanging nearby suddenly started burning. Luckily, I put it out in time, but by the time I came back, he had ""scored"" three points while I was gone.

Brandon is really tight-lipped about the Black Alley and always seems preoccupied with something. Still, I believe he could be the breakthrough I need in my investigation. He's not as stubborn as the old timers, nor as much of a pain to talk to as those masks. I still can't figure out where they came from. Maybe I'll figure it out someday.

Speaking of which, I haven't seen Brandon for two days. Maybe he went to help the starving old folks. As I learned during my investigation, the people here scrape by with odd jobs, barely managing to get enough food. Brandon is always sharing his rations with them.

Wherever he's gone, he'll be back for more pool. All I need to do is wait for him.","Đây là ngày thứ năm tôi đến Hẻm Tối. Người ở đây rất cảnh giác, họ cứ như đang sợ hãi điều gì đó vậy. Tất nhiên rồi, họ chẳng chịu nói gì với tôi cả.
Hẻm Tối, đối với người Ragunna mà nói là một nơi khá bí ẩn. Người trẻ tuổi hoàn toàn không biết đến sự tồn tại của nó, người già thì coi nơi này là cấm kỵ. Thử nghĩ xem, nếu tôi có thể viết những bí mật ở đây thành bản thảo, đăng lên báo, sẽ gây chấn động lớn thế nào ở Ragunna!
Tôi đã tìm được một người tốt bụng... mọi người đều gọi anh ta là Người Môi Giới, mặc dù không biết đứng sau anh ta rốt cuộc là ai. Dưới sự giúp đỡ hào phóng của anh ta, tôi đã thành công vào được Hẻm Tối, có thể tiếp cận tư liệu trực tiếp về vùng đất bí ẩn này.
Ba ngày điều tra đầu tiên của tôi gần như chẳng thu được gì. Tuy nhiên, tôi đã làm quen với một thanh niên tên là Brandon, cậu ta có vẻ đã sống ở đây rất lâu rồi. Tôi và cậu ta quen nhau khi chơi bi-a, nói thật thì kỹ năng của cậu ta rất khá, là một đối thủ không tồi... miễn là cậu ta không giở trò. Lần trước khi đánh bi-a, chiếc áo khoác tôi treo bên cạnh đột nhiên bốc khói, may mà tôi kịp dập tắt nó. Nhưng khi tôi quay lại nhìn, cậu ta đã nhân lúc tôi không để ý ""đánh"" vào ba quả bóng.
Mặc dù Brandon cũng tuyệt đối không nhắc đến chuyện của Hẻm Tối, và lúc nào trông cũng đầy tâm sự, nhưng tôi cảm thấy cậu ta sẽ trở thành một đột phá khẩu tốt trong cuộc phỏng vấn ngắn ngủi này của tôi. Cậu ta không cố chấp như mấy người già kia, cũng không khó nói chuyện như mấy gã đeo mặt nạ. Tôi không biết mấy người mặt nạ kia rốt cuộc có lai lịch gì, nhưng tôi nghĩ sẽ có ngày tôi làm rõ được thôi.
Nhắc mới nhớ, Brandon đã hai ngày nay không xuất hiện rồi. Có lẽ cậu ta đi chăm sóc mấy người già đói khát kia. Giống như tôi đã điều tra trước đó, người dân Hẻm Tối sống dựa vào việc làm thuê vặt, nên họ rất khó kiếm đủ thức ăn, Brandon luôn chia khẩu phần ăn của mình cho họ.
Bất kể Brandon rốt cuộc đã đi đâu, cậu ta chắc chắn sẽ quay lại đánh bi-a thôi. Tôi nghĩ tôi cứ đợi cậu ta ở đây là được."
lang_multi_text.db,MultiText,InfoDisplay_160000008_Title,【语音日志·一】,Audio Log 1,[Nhật Ký Ghi Âm 1]
lang_multi_text.db,MultiText,InfoDisplay_160000009_Text,"第三赛季黑街飞镖积分赛排名（截止今日）：
第一名：“飞快老乔”
第二名：“鹰眼杰克”
第三名：“子弹科尔”
（潦草的笔迹）看来今天老乔运气不错。科尔，你是喝多了吗？给他们点厉害瞧瞧！
（工整的笔迹）老乔肯定作弊了。他怎么可能比杰克积分高？他扔飞镖的时候手都在抖。
（龙飞凤舞的笔迹）作弊？你有证据吗？
（工整的笔迹）我懒得和你这种爱抬杠的家伙讲道理，拳台见吧。","Black Alley Dart League, Season 3 Rankings (As of Today):
1st: ""Lightning Ol' Joe""
2nd: ""Eagle Eye Jack""
3rd: ""Buckshot Cole""
(Scribbled handwriting) Looks like it's Ol' Joe's lucky day. What's the matter, Cole? Too many drinks? Show 'em what you're made of!
(Neat handwriting) Ol' Joe's a cheat, all right. There's no way he beat Jack. You saw how much his hands were shaking when he was tossing?
(Cursive handwriting) A cheat? Why don't you show me some proof?
(Neat handwriting) I ain't got time to waste my breath on you. I'll see you in the ring.","Xếp hạng giải đấu phi tiêu Hẻm Tối mùa 3 (Tính đến hôm nay):
Hạng nhất: ""Joe Già Thần Tốc""
Hạng nhì: ""Jack Mắt Ưng""
Hạng ba: ""Cole Đạn Ghém""
(Nét chữ nguệch ngoạc) Có vẻ hôm nay Joe Già gặp may. Cole, mày uống say rồi à? Cho bọn họ biết thế nào là lễ độ đi!
(Nét chữ nắn nót) Joe Già chắc chắn gian lận rồi. Sao ông ta có thể nhiều điểm hơn Jack được? Lúc ném phi tiêu tay ông ta run bần bật mà.
(Nét chữ bay bướm) Gian lận? Mày có bằng chứng không?
(Nét chữ nắn nót) Tao lười nói lý lẽ với cái loại thích cãi cùn như mày, gặp nhau trên võ đài nhé."
lang_multi_text.db,MultiText,InfoDisplay_160000009_Title,【飞镖盘上的贴纸】,Sticker on Dartboard,[Giấy Dán Trên Bia Phi Tiêu]
lang_multi_text.db,MultiText,InfoDisplay_160000010_Text,"【今日饮料推荐】
通风井之夜：以陈酿作为基底，加入沁人心脾的草本植物提取物，一口就能让你从头凉到脚底，就像洗完冰水澡之后去通风井里吹风一样！
推荐指数：☆☆☆☆
燃油龙息：添加从码头货物中盗取的雀翎果汁，以及一勺真正的燃油，极致超绝辣度，硬核老饕的心头好！和朋友一起来挑战从食管灼烧到胃部的感觉吧，谁先喝水谁付钱！
推荐指数：☆☆☆
生化奇藏：用腌鱼和腌肉坛子里的汁液配置的饮料，闻起来和尝起来都一样糟糕。我也不知道为什么有人喜欢喝这个，但根据一封匿名信中提出的需求还是制作出来了……总之，很适合用来整蛊你的朋友！
推荐指数：☆，请寄信者尽快来买走所有已经配置好的成品，不然我就把这事告诉塔洛斯老大，她会查出来那封信是谁寄的。
金色时光特饮：用风滚牦奶油加蜜露果酒精心调制的特饮，拂风水畔风情的田园风味与莫塔里区高雅品味的完美结合体。也许有人会觉得这饮料不够有劲，但请相信我，你们一定会被它绵密的气泡和柔滑的口感所征服的。
推荐指数：☆☆☆☆☆","[Today's Drink Specials]
Vent-a-Nite: Made with aged liquor as the base, infused with refreshing herbal extracts. One sip will send a cool rush from head to toe, like stepping into a ventilation shaft after an ice-cold shower!
Recommendation: ☆☆☆☆

Dragon's Breath Octane: Featuring Pavo Plum juice swiped from the docks and a spoonful of real fossil fuel, this fiery mix is for the boldest drinkers! Dare your friends to survive the burning journey from throat to stomach. First one to take a sip of water picks up the tab!
Recommendation: ☆☆☆

Biohoard: A concoction made from pickled fish and corned meat juices. Tastes just as bad as it smells. I don't know how anyone could enjoy this, but it was made on request from an anonymous letter... Anyway, makes for a good prank on your friends!
Recommendation: ☆
To the anonymous requester: Your drink is ready. Please pay for it soon, or I'll tell Talos and she'll find out who sent this letter.

Golden Hour Special: A special blend of Tumbleyak butter and Nectarwine. A perfect fusion of the rustic charm of Whisperwind Haven and the sophisticated taste of the Montelli Quarters. Some might find it lacking a bold kick, but trust me, the creamy bubbles and velvety texture will win you over.
Recommendation: ☆☆☆☆☆","[Đồ Uống Hôm Nay]
Đêm Giếng Thông Gió: Dùng rượu lâu năm làm nền, thêm chiết xuất thảo mộc mát lạnh, một ngụm là mát từ đầu đến chân, giống như tắm nước đá xong ra giếng thông gió hóng mát vậy!
Chỉ số đề cử: ☆☆☆☆
Hơi Thở Rồng Cháy: Thêm nước quả Tước Linh trộm được từ hàng hóa bến cảng, cùng một thìa nhiên liệu thật, độ cay cực hạn, món khoái khẩu của dân chơi thứ thiệt! Hãy cùng bạn bè thử thách cảm giác thiêu đốt từ thực quản xuống dạ dày, ai uống nước trước người đó trả tiền!
Chỉ số đề cử: ☆☆☆
Kho Tàng Sinh Hóa: Đồ uống pha chế từ nước trong hũ cá muối và thịt muối, ngửi hay nếm đều tệ như nhau. Tôi cũng chẳng biết tại sao có người thích uống cái này, nhưng dựa theo yêu cầu trong một bức thư nặc danh thì vẫn làm ra... tóm lại, rất thích hợp để chơi khăm bạn bè!
Chỉ số đề cử: ☆, xin người gửi thư mau đến mua hết thành phẩm đã pha chế đi, nếu không tôi sẽ nói chuyện này cho đại ca Talos, cô ấy sẽ tra ra ai là người gửi bức thư đó.
Thời Gian Hoàng Kim: Đồ uống đặc biệt được pha chế tỉ mỉ từ bơ bò Tumbleyak và rượu mật, sự kết hợp hoàn hảo giữa hương vị đồng quê của Bến Gió Hú và gu thẩm mỹ tao nhã của khu Montelli. Có thể có người thấy đồ uống này không đủ đô, nhưng hãy tin tôi, các bạn nhất định sẽ bị chinh phục bởi lớp bọt mịn màng và cảm giác êm dịu của nó.
Chỉ số đề cử: ☆☆☆☆☆"
lang_multi_text.db,MultiText,InfoDisplay_160000010_Title,【饮料清单】,Drinks Menu,[Thực Đơn Đồ Uống]
