db_file,table_name,id,zh,en,vi
lang_multi_text.db,MultiText,ImportTest_1_33,太好了，一起走吧。,,"Tuyệt quá, cùng đi thôi!"
lang_multi_text.db,MultiText,ImportTest_1_34,谷内地形地势复杂，我们惯常走的道路只有一条，如果漂泊者不介意的话，不如先结伴同行，出了云陵谷后再做打算？,,"Địa hình trong thung lũng rất phức tạp, con đường chúng tôi thường đi chỉ có một, nếu Lữ Khách không phiền thì chi bằng kết bạn đồng hành trước, ra khỏi Vân Lăng Cốc rồi hãy tính tiếp?"
lang_multi_text.db,MultiText,ImportTest_1_35,走吧走吧，一起走吧！,,"Đi thôi đi thôi, cùng đi nào!"
lang_multi_text.db,MultiText,ImportTest_1_38,嗯。,,Ừm.
lang_multi_text.db,MultiText,ImportTest_1_4,……醒了。,,...Tỉnh rồi.
lang_multi_text.db,MultiText,ImportTest_1_5,让我看看我看看！,,Để tôi xem xem nào!
lang_multi_text.db,MultiText,ImportTest_1_6,幸好你醒了，差点我就要掏出压箱底的本领了，初级巡尉必备急救技能第一课——心肺复苏，但现实实践这可能还是第一次……,,"May mà cậu tỉnh rồi, chút nữa là tôi phải lôi tuyệt chiêu áp hòm ra rồi đấy, bài học đầu tiên trong kỹ năng sơ cứu bắt buộc của Sơ cấp Tuần úy - hô hấp nhân tạo, nhưng thực hành ngoài đời thì có lẽ đây là lần đầu..."
lang_multi_text.db,MultiText,ImportTest_1_7,……炽霞。,,...Chixia.
lang_multi_text.db,MultiText,ImportTest_1_8,不好意思不好意思，你刚醒来，我这噼里啪啦的一堆话……,,"Xin lỗi xin lỗi, cậu vừa mới tỉnh, mà tớ đã luyên thuyên một đống thế này..."
lang_multi_text.db,MultiText,ImportTest_1_9,你还好吗？身体有什么不舒服的地方吗？,,Cậu có sao không? Có chỗ nào trên người khó chịu không?
lang_multi_text.db,MultiText,ImportTest_2_1,刚刚我提到的「天空海」是一种特殊的异象天气，天空会像倒映的海面一般，而往往天空海的聚拢形成，都是地面无音区形成的预兆。,,"""Thiên Không Hải"" mà tôi vừa nhắc đến là một loại hiện tượng thời tiết dị thường, bầu trời sẽ trông giống như mặt biển phản chiếu ngược vậy. Và thường thì khi Thiên Không Hải tụ lại hình thành, đó chính là điềm báo của một Vùng Vô Thanh sắp xuất hiện trên mặt đất."
lang_multi_text.db,MultiText,ImportTest_2_10,这叫什么，说来就来哦。,,"Cái này gọi là gì nhỉ, vừa nói là có luôn đấy."
lang_multi_text.db,MultiText,ImportTest_2_11,漂泊者，小心！,,"Lữ Khách, cẩn thận!"
lang_multi_text.db,MultiText,ImportTest_2_13,这……你的身手好快！,,Này... thân thủ cậu nhanh thật đấy!
lang_multi_text.db,MultiText,ImportTest_2_14,我都来不及出手，只看见秧秧下意识像老……咳咳，下意识护在漂泊者的前面的时候，刷刷几下，残象就被消灭了！,,"Tôi còn chưa kịp ra tay, chỉ thấy Yangyang theo bản năng như kiểu lão... khụ khụ, theo bản năng lao lên che chắn trước mặt Lữ Khách, rồi vèo vèo mấy cái, Tàn Tượng đã bị tiêu diệt rồi!"
lang_multi_text.db,MultiText,ImportTest_2_15,没有残留<ano=残象的余留频率>声骸</ano>，那漂泊者只是稍稍领先一点点！,,"Không có <ano=tần số dư lưu của Tàn Tượng>Thanh Hài</ano> nào sót lại, Lữ Khách chỉ dẫn trước một chút xíu thôi!"
lang_multi_text.db,MultiText,ImportTest_2_16,下次我必定一马当先！不然我就不叫……马……不对不对，不叫炽霞！,,"Lần sau tôi nhất định sẽ xông lên đầu tiên! Không thì tôi không phải tên là... Mã... không không, không phải tên là Chixia!"
lang_multi_text.db,MultiText,ImportTest_2_17,等等……炽霞。,,Khoan đã... Chixia.
lang_multi_text.db,MultiText,ImportTest_2_2,而「无音区」则是<ano=残响体>残象</ano>孕育汇集的地方，在野外往往越接近无音区，越危险。,,"Còn ""Vùng Vô Thanh"" chính là nơi <ano=tàn hưởng thể>Tàn Tượng</ano> thai nghén và tụ tập, ở ngoài hoang dã càng tiến gần Vùng Vô Thanh thì càng nguy hiểm."
lang_multi_text.db,MultiText,ImportTest_2_3,但无音区的形成又几乎没有规律，只知道天空海是出现的预兆。,,"Nhưng sự hình thành của Vùng Vô Thanh gần như không có quy luật, chỉ biết rằng Thiên Không Hải là điềm báo trước khi nó xuất hiện."
lang_multi_text.db,MultiText,ImportTest_2_4,还有就是有些「共鸣者」，比如说秧秧的共鸣能力可以通过风感知到外界的信息，所以刚才能大概感知到附近有无音区正在形成。,,"Ngoài ra, có một số ""Cộng Hưởng Giả"", ví dụ như năng lực cộng hưởng của Yangyang có thể thông qua gió để cảm nhận thông tin từ bên ngoài, nên lúc nãy mới có thể đại khái cảm nhận được gần đây đang có một Vùng Vô Thanh hình thành."
lang_multi_text.db,MultiText,ImportTest_2_5,像我就完全感知不到，嘿嘿。,,"Còn tớ thì hoàn toàn không cảm nhận được gì, hehe."
lang_multi_text.db,MultiText,ImportTest_2_6,虽然漂泊者什么都想不起来，但有件事我可以九成……不十成确定！你是一位共鸣者。,,"Tuy Lữ Khách không nhớ được gì, nhưng có một điều tớ chắc chín phần... không, mười phần luôn! Cậu là một Cộng Hưởng Giả đấy."
lang_multi_text.db,MultiText,ImportTest_2_7,漂泊者的手背有声痕，身上也携带着<ano=终端>葫芦</ano>，虽然看上去样式有些不同，但这两者都是共鸣者的象征。,,"Mu bàn tay Lữ Khách có thanh ngân, trên người cũng mang theo <ano=thiết bị đầu cuối>hồ lô</ano>, tuy trông kiểu dáng có hơi khác, nhưng cả hai đều là biểu tượng của Cộng Hưởng Giả."
lang_multi_text.db,MultiText,ImportTest_2_8,而且除了共鸣者，非必要时刻，也少有人没事在野外跑了。,,"Hơn nữa, ngoài Cộng Hưởng Giả ra, nếu không cần thiết, ít ai lại rảnh rỗi mà chạy ngoài hoang dã lắm."
lang_multi_text.db,MultiText,ImportTest_2_9,别看现在谷内安静祥和的样子，指不定打哪就蹦出一危险的残象来。,,"Đừng thấy trong thung lũng bây giờ yên ắng thanh bình mà chủ quan, biết đâu từ đâu lại có một con Tàn Tượng nguy hiểm nhảy ra ấy chứ."
lang_multi_text.db,MultiText,ImportTest_3_1,怎么了？有哪里不舒服吗？是刚才的战斗……？,,Sao vậy? Có chỗ nào không thoải mái không? Là do trận chiến vừa rồi...?
lang_multi_text.db,MultiText,ImportTest_3_10,存在文明与历史的疆域地界就会存在岁主，而皇珑较为特别，皇珑历史渊远，文明厚重，地大物博，以致皇珑是现今世上岁主同生共存最多的地方。,,"Nơi nào tồn tại văn minh và lịch sử thì nơi đó sẽ có Tuế Chủ. Hoàng Long khá đặc biệt, lịch sử lâu đời, văn minh thâm hậu, đất rộng vật phong phú, khiến Hoàng Long trở thành nơi có nhiều Tuế Chủ cùng tồn tại nhất trên thế giới hiện nay."
lang_multi_text.db,MultiText,ImportTest_3_11,根据记载，皇珑岁主本为一体，合则九九归一，分而治之。,,"Theo ghi chép, các Tuế Chủ của Hoàng Long vốn là một thể, hợp lại thì cửu cửu quy nhất, tách ra thì phân nhi trị chi."
lang_multi_text.db,MultiText,ImportTest_3_12,其他地界，自然也存在相对应的岁主，只是数量大多远不及皇珑。,,"Các vùng đất khác tự nhiên cũng tồn tại Tuế Chủ tương ứng, chỉ là số lượng phần lớn không sánh được với Hoàng Long."
lang_multi_text.db,MultiText,ImportTest_3_13,皇珑的岁主以龙形居多，而皇珑外各有不同，有的甚至……难以描述。,,"Tuế Chủ ở Hoàng Long đa phần mang hình dáng Long, còn bên ngoài Hoàng Long thì mỗi nơi mỗi khác, có vị thậm chí... khó mà miêu tả nổi."
lang_multi_text.db,MultiText,ImportTest_3_14,与真实的岁主对面而立？,,Đứng đối diện với Tuế Chủ thật sao?
lang_multi_text.db,MultiText,ImportTest_3_15,岁主真身一般是难以见到的……几乎只有在授任大典上才能一睹真容。,,Chân thân Tuế Chủ thường rất khó gặp... gần như chỉ có trong đại điển thụ nhiệm mới có thể chiêm ngưỡng dung mạo thật.
lang_multi_text.db,MultiText,ImportTest_3_16,且按漂泊者描述这么近的距离，除非是岁主的共鸣者，但现今今州岁主的共鸣者正是今州<ano=一州之主>令尹</ano>……,,"Hơn nữa, theo mô tả của Lữ Khách, ở khoảng cách gần như vậy, trừ phi là Cộng Hưởng Giả của Tuế Chủ, nhưng Cộng Hưởng Giả của Tuế Chủ Kim Châu hiện tại chính là <ano=một châu chi chủ>Lệnh Doãn</ano> Kim Châu..."
lang_multi_text.db,MultiText,ImportTest_3_17,或许，这只是我的想象？,,"Hay là, đó chỉ là tưởng tượng của tôi?"
lang_multi_text.db,MultiText,ImportTest_3_18,……,,...
lang_multi_text.db,MultiText,ImportTest_3_2,我好像想起了些东西。,,Tôi hình như nhớ lại được vài thứ.
lang_multi_text.db,MultiText,ImportTest_3_20,嗬！可恶……这起码也得是巨浪级别的残象了吧！,,Hừ! Đáng ghét... Ít nhất cũng phải là Tàn Tượng cấp Cự Lãng rồi!
lang_multi_text.db,MultiText,ImportTest_3_21,炽霞那边好像遇到了危险，漂泊者……！,,"Phía Chixia có vẻ gặp nguy hiểm rồi, Lữ Khách...!"
lang_multi_text.db,MultiText,ImportTest_3_25,漂泊者，小心！,,"Lữ Khách, cẩn thận!"
lang_multi_text.db,MultiText,ImportTest_3_3,这座雕像是……？,,Bức tượng này là...?
lang_multi_text.db,MultiText,ImportTest_3_4,记忆里出现了岁主的影像？,,Trong ký ức xuất hiện hình ảnh Tuế Chủ sao?
lang_multi_text.db,MultiText,ImportTest_3_5,岁主？,,Tuế Chủ?
lang_multi_text.db,MultiText,ImportTest_3_6,就是这座龙形雕像的真身，今州的<ano=指引机枢>岁主</ano>，皇珑共有一庭九州，各有一位岁主，身形样貌有相似相近亦有不同，今州的岁主为龙形，如雕像所呈一般。,,"Chính là chân thân của bức tượng hình Long này, <ano=chỉ dẫn cơ xu>Tuế Chủ</ano> của Kim Châu. Hoàng Long tổng cộng có một đình cửu châu, mỗi châu đều có một vị Tuế Chủ, hình dáng diện mạo có tương tự cũng có khác biệt. Tuế Chủ Kim Châu mang hình Long, như bức tượng đã thể hiện."
lang_multi_text.db,MultiText,ImportTest_3_7,除了皇珑外的地界也有岁主？,,"Ngoài Hoàng Long ra, các vùng đất khác cũng có Tuế Chủ sao?"
lang_multi_text.db,MultiText,ImportTest_3_8,其他岁主长什么样？,,Các Tuế Chủ khác trông như thế nào?
lang_multi_text.db,MultiText,ImportTest_3_9,我看见我与祂对面而立。,,Tôi thấy mình đứng đối diện với Ngài ấy.
lang_multi_text.db,MultiText,ImportTest_4_1,刚才好险，你两配合得也太默契了！,,"Vừa rồi hú vía, hai người phối hợp ăn ý quá đi!"
lang_multi_text.db,MultiText,ImportTest_4_10,你一直没有醒……,,Cậu mãi không tỉnh dậy...
lang_multi_text.db,MultiText,ImportTest_4_11,而白芷又有另外的任务需要完成，所以决定我们两留下来照顾你，之后在约定的地方汇合。,,"Mà Baizhi lại có nhiệm vụ khác cần hoàn thành, nên quyết định để hai chúng tớ ở lại chăm sóc cậu, sau đó hẹn gặp nhau ở địa điểm đã thỏa thuận."
lang_multi_text.db,MultiText,ImportTest_4_2,漂泊者看来是除我外，第二，哦还要除白芷外……那就是第三跟秧秧战斗配合默契的共鸣者！,,"Lữ Khách có vẻ là Cộng Hưởng Giả thứ hai ngoài tớ ra, ồ còn phải trừ Baizhi nữa... vậy thì là người thứ ba phối hợp chiến đấu ăn ý với Yangyang!"
lang_multi_text.db,MultiText,ImportTest_4_3,不过这才第一次配合，感觉默契度很快就要超过白芷了啊。,,"Mà mới lần đầu phối hợp thôi đấy, cảm giác độ ăn ý sắp vượt qua cả Baizhi rồi."
lang_multi_text.db,MultiText,ImportTest_4_4,可恶，明明是我们先到的，我们可是从小一起长大……,,"Đáng ghét, rõ ràng là bọn tớ đến trước mà, bọn tớ lớn lên cùng nhau từ nhỏ cơ..."
lang_multi_text.db,MultiText,ImportTest_4_5,……炽霞。,,...Chixia.
lang_multi_text.db,MultiText,ImportTest_4_6,嘿嘿嘿……那个啊，说到白芷！,,"He he he... cái đó á, nói đến Baizhi!"
lang_multi_text.db,MultiText,ImportTest_4_7,和白芷约定的地方快到了！白芷就是我一直挂在嘴边的，她的共鸣能力是治疗相关，我们是一起在谷底发现你的。,,"Sắp đến chỗ hẹn với Baizhi rồi! Baizhi chính là người tớ cứ nhắc hoài đó, năng lực cộng hưởng của cô ấy liên quan đến chữa trị, bọn tớ cùng nhau phát hiện ra cậu ở đáy thung lũng."
lang_multi_text.db,MultiText,ImportTest_4_8,白芷对你做了一些简单的治疗处理，你出现了一些溺水的类似症状，但口鼻无异物，身上衣物也是干爽整洁的。,,"Baizhi đã sơ cứu cho cậu một chút, cậu xuất hiện một số triệu chứng giống đuối nước, nhưng miệng mũi không có dị vật, quần áo trên người cũng khô ráo gọn gàng."
lang_multi_text.db,MultiText,ImportTest_4_9,当然这一切都是秧秧通过感应知道的，她可小心翼翼了，好像生怕把你碰伤了！,,"Tất nhiên tất cả những điều này đều là Yangyang cảm nhận được đấy, cô ấy cẩn thận lắm, cứ như sợ chạm vào cậu là cậu bị thương vậy!"
lang_multi_text.db,MultiText,ImportTest_5_1,啊，前面快到信标点了。,,"À, phía trước sắp đến điểm tín hiệu rồi."
lang_multi_text.db,MultiText,ImportTest_5_2,看到信标记得用登记激活一下，信标方圆五米应该是比较安全的，有一定防护的作用。,,"Thấy tín hiệu nhớ đăng ký kích hoạt nhé, trong phạm vi năm mét quanh tín hiệu tương đối an toàn, có tác dụng phòng hộ nhất định."
lang_multi_text.db,MultiText,ImportTest_5_3,漂泊者，可以把你的终端给我一下吗?,,"Lữ Khách, cậu có thể đưa tớ thiết bị đầu cuối một chút được không?"
lang_multi_text.db,MultiText,ImportTest_5_4,好了，虽然型号和版本不同，但数据传输功能和一些基础模块功能是确认可用的。,,"Xong rồi, tuy mẫu mã và phiên bản khác nhau, nhưng chức năng truyền dữ liệu và một số module cơ bản đã xác nhận là dùng được."
lang_multi_text.db,MultiText,ImportTest_5_5,前面就快到谷口了，会有一些高度落差，但如果终端的伞翼模块可用，会更方便一些。,,"Phía trước sắp đến cửa thung lũng rồi, sẽ có một số chênh lệch độ cao, nhưng nếu module dù lượn của thiết bị đầu cuối dùng được thì sẽ tiện hơn nhiều."
lang_multi_text.db,MultiText,ImportTest_5_6,等下我告诉你如何开启吧。,,Chút nữa tớ chỉ cậu cách mở nhé.
lang_multi_text.db,MultiText,ImportTest_6_1,出了谷口，再走一段路就是今州城了！1,,"Ra khỏi cửa thung lũng, đi thêm một đoạn nữa là đến thành Kim Châu rồi!1"
lang_multi_text.db,MultiText,ImportTest_6_10,天空海在这里汇聚了。,,Thiên Không Hải hội tụ tại đây rồi.
lang_multi_text.db,MultiText,ImportTest_6_11,【炽霞左顾右盼，然后往下看】,,"[Chixia nhìn quanh, rồi nhìn xuống dưới]"
lang_multi_text.db,MultiText,ImportTest_6_12,……无音区？,,...Vùng Vô Thanh?
lang_multi_text.db,MultiText,ImportTest_6_13,……什么时候形成的？,,...Hình thành từ khi nào vậy?
lang_multi_text.db,MultiText,ImportTest_6_14,来的时候还没有的。,,Lúc đến đây vẫn chưa có mà.
lang_multi_text.db,MultiText,ImportTest_6_15,恐怕是在更短的时间内。,,E rằng nó hình thành trong khoảng thời gian còn ngắn hơn thế.
lang_multi_text.db,MultiText,ImportTest_6_16,在刚才我并没有感应到任何无音区的气息……,,Vừa nãy tôi hoàn toàn không cảm nhận được bất kỳ khí tức nào của Vùng Vô Thanh...
lang_multi_text.db,MultiText,ImportTest_6_17,难道是在刚刚一瞬间生成的？就这么会儿功夫？,,Chẳng lẽ nó sinh ra chỉ trong khoảnh khắc vừa rồi? Nhanh đến vậy sao?
lang_multi_text.db,MultiText,ImportTest_6_18,还是这天空海会追踪啊？跟着我们跑？,,Hay là cái Thiên Không Hải này biết truy vết à? Đuổi theo chúng ta luôn?
lang_multi_text.db,MultiText,ImportTest_6_19,【三人往悬崖边上站，往下看】,,"[Ba người đứng sát mép vách đá, nhìn xuống dưới]"
lang_multi_text.db,MultiText,ImportTest_6_2,城里是最安全的地方了，中枢信标辐射全城，还有防护罩，天工的防御工事也不是盖的。,,"Trong thành là nơi an toàn nhất rồi, tín hiệu trung khu phủ sóng toàn thành, lại còn có lá chắn bảo vệ, công sự phòng ngự của Thiên Công cũng không phải chuyện đùa đâu."
lang_multi_text.db,MultiText,ImportTest_6_20,……无音区中央……,,...Trung tâm Vùng Vô Thanh...
lang_multi_text.db,MultiText,ImportTest_6_21,好像有什么东西。,,Hình như có gì đó ở trong.
lang_multi_text.db,MultiText,ImportTest_6_22,有个人。,,Có một người.
lang_multi_text.db,MultiText,ImportTest_6_23,那不是白芷吗！,,Đó không phải Baizhi sao!
lang_multi_text.db,MultiText,ImportTest_6_24,白芷！,,Baizhi!
lang_multi_text.db,MultiText,ImportTest_6_25,白芷——！,,BAIZHI--!
lang_multi_text.db,MultiText,ImportTest_6_26,距离太远了，声音传不过去……,,"Khoảng cách quá xa, tiếng nói truyền không tới được..."
lang_multi_text.db,MultiText,ImportTest_6_27,无音区不是很危险么？,,Vùng Vô Thanh chẳng phải rất nguy hiểm sao?
lang_multi_text.db,MultiText,ImportTest_6_28,为什么她会在那里？,,Tại sao cô ấy lại ở trong đó?
lang_multi_text.db,MultiText,ImportTest_6_29,刚形成的无音区会有一段时间的“蛰伏期”，这一段时间是相对安全的。,,"Vùng Vô Thanh mới hình thành sẽ có một khoảng thời gian ""ẩn phục"", trong giai đoạn này thì tương đối an toàn."
lang_multi_text.db,MultiText,ImportTest_6_3,真壮观。,,Thật hùng vĩ.
lang_multi_text.db,MultiText,ImportTest_6_30,这段时间？,,Giai đoạn này?
lang_multi_text.db,MultiText,ImportTest_6_31,那这个无音区相对“安全”？,,"Vậy Vùng Vô Thanh này hiện tại tương đối ""an toàn"" sao?"
lang_multi_text.db,MultiText,ImportTest_6_32,应该说是“暂时”安全。,,"Nên nói chính xác hơn là ""tạm thời"" an toàn."
lang_multi_text.db,MultiText,ImportTest_6_33,蛰伏期根据无音区形成时间有变化，一般来说，形成的时间越短，蛰伏期则越长。但蛰伏期越长，无音区孕育生成的残象则越加强大。,,"Giai đoạn ẩn phục thay đổi tùy theo thời gian hình thành Vùng Vô Thanh. Nói chung, thời gian hình thành càng ngắn thì giai đoạn ẩn phục càng dài. Nhưng giai đoạn ẩn phục càng dài thì Tàn Tượng được ấp ủ sinh ra trong đó càng mạnh."
lang_multi_text.db,MultiText,ImportTest_6_34,我们约定在这附近汇合，她说是去采样，结果一个人采到无音区正中心去了吗！,,"Chúng tôi hẹn hợp nhau ở gần đây, cô ấy nói đi lấy mẫu, kết quả một mình lấy mẫu đến tận giữa trung tâm Vùng Vô Thanh luôn sao!"
lang_multi_text.db,MultiText,ImportTest_6_35,按白芷的个性来说，不会做不加考虑，纯粹冒险的事。刚形成的无音区会有一段时间的“蛰伏期”，无音区形成的时间越短，蛰伏期则越长，现在这个无音区，在短时间内应该是安全的。,,"Theo tính cách của Baizhi mà nói, cô ấy sẽ không làm chuyện liều lĩnh mà không suy nghĩ. Vùng Vô Thanh mới hình thành sẽ có một khoảng thời gian ""ẩn phục"", thời gian hình thành càng ngắn thì giai đoạn ẩn phục càng dài. Vùng Vô Thanh này hiện tại, trong thời gian ngắn sẽ an toàn."
lang_multi_text.db,MultiText,ImportTest_6_37,不会一下去哗地冒出强大的残象吧。,,Sẽ không vừa xuống là ào một cái xuất hiện Tàn Tượng mạnh chứ.
lang_multi_text.db,MultiText,ImportTest_6_38,有没有可能底下的白芷是个诱饵。,,Có khả năng Baizhi ở dưới kia là mồi nhử không?
lang_multi_text.db,MultiText,ImportTest_6_39,→那我们下去吧。,,→Vậy chúng ta xuống đi.
lang_multi_text.db,MultiText,ImportTest_6_4,还可以。,,Cũng được.
lang_multi_text.db,MultiText,ImportTest_6_40,按照<ano=今州流行戏剧>英雄戏</ano>的编排，确实有这种可能！,,"Theo cách biên soạn của <ano=Kim Châu lưu hành hí kịch>Anh Hùng Hí</ano>, quả thực có khả năng đó!"
lang_multi_text.db,MultiText,ImportTest_6_41,确实，那会是谁布下的诱饵呢？,,"Đúng vậy, vậy ai là người giăng bẫy nhỉ?"
lang_multi_text.db,MultiText,ImportTest_6_43,你。,,Cậu.
