db_file,table_name,id,zh,en,vi
lang_multi_text.db,MultiText,PropertyIndex_10108_Name,dnt/攀爬跳跃消耗的耐力（一次）,Climbing Jump Stamina Consumption (Once),dnt/Thể lực tiêu hao khi Nhảy lúc Leo trèo (một lần)
lang_multi_text.db,MultiText,PropertyIndex_10109_Name,dnt/滑翔耐力消耗速度x/秒,Gliding Stamina Consumption Speed x/Second,dnt/Tốc độ tiêu hao thể lực khi Lượn x/giây
lang_multi_text.db,MultiText,PropertyIndex_10110_Name,dnt/质量,Mass,dnt/Khối lượng
lang_multi_text.db,MultiText,PropertyIndex_10111_Name,dnt/摩擦力系数,Friction Coefficient,dnt/Hệ số ma sát
lang_multi_text.db,MultiText,PropertyIndex_10112_Name,dnt/重力系数,Gravity Coefficient,dnt/Hệ số trọng lực
lang_multi_text.db,MultiText,PropertyIndex_10113_Name,移动速率,Movement Speed,Tốc độ di chuyển
lang_multi_text.db,MultiText,PropertyIndex_10114_Name,声骸技能伤害加成,Echo Skill DMG Bonus,Tăng sát thương Kỹ Năng Thanh Hài
lang_multi_text.db,MultiText,PropertyIndex_10115_Name,普攻速度,Basic Attack Speed,Tốc độ Đánh Thường
lang_multi_text.db,MultiText,PropertyIndex_10116_Name,重击速度,Heavy Attack Speed,Tốc độ Đánh Mạnh
lang_multi_text.db,MultiText,PropertyIndex_10117_Name,dnt/状态累积值1 上限,Status Accumulation Value 1 Limit,dnt/Giới hạn Giá trị Tích lũy Trạng thái 1
lang_multi_text.db,MultiText,PropertyIndex_10118_Name,dnt/状态累积值1,Status Accumulation Value 1,dnt/Giá trị Tích lũy Trạng thái 1
lang_multi_text.db,MultiText,PropertyIndex_10119_Name,dnt/状态累积值2 上限,Status Accumulation Value 2 Limit,dnt/Giới hạn Giá trị Tích lũy Trạng thái 2
lang_multi_text.db,MultiText,PropertyIndex_10120_Name,dnt/状态累积值2,Status Accumulation Value 2,dnt/Giá trị Tích lũy Trạng thái 2
lang_multi_text.db,MultiText,PropertyIndex_10121_Name,dnt/状态累积值3 上限,Status Accumulation Value 3 Limit,dnt/Giới hạn Giá trị Tích lũy Trạng thái 3
lang_multi_text.db,MultiText,PropertyIndex_10122_Name,dnt/状态累积值3,Status Accumulation Value 3,dnt/Giá trị Tích lũy Trạng thái 3
lang_multi_text.db,MultiText,PropertyIndex_10123_Name,dnt/状态累积值4 上限,Status Accumulation Value 4 Limit,dnt/Giới hạn Giá trị Tích lũy Trạng thái 4
lang_multi_text.db,MultiText,PropertyIndex_10124_Name,dnt/状态累积值4,Status Accumulation Value 4,dnt/Giá trị Tích lũy Trạng thái 4
lang_multi_text.db,MultiText,PropertyIndex_10125_Name,dnt/状态累积值5 上限,Status Accumulation Value 5 Limit,dnt/Giới hạn Giá trị Tích lũy Trạng thái 5
lang_multi_text.db,MultiText,PropertyIndex_10126_Name,dnt/状态累积值5,Status Accumulation Value 5,dnt/Giá trị Tích lũy Trạng thái 5
lang_multi_text.db,MultiText,PropertyIndex_10127_Name,dnt/狂暴上限,Rage Limit,dnt/Giới hạn Cuồng Nộ
lang_multi_text.db,MultiText,PropertyIndex_10128_Name,dnt/狂暴,Rage,dnt/Cuồng Nộ
lang_multi_text.db,MultiText,PropertyIndex_10129_Name,dnt/狂暴恢复,Rage Recovery,dnt/Hồi phục Cuồng Nộ
lang_multi_text.db,MultiText,PropertyIndex_10130_Name,dnt/空狂暴惩罚时间,Empty Rage Penalty Time,dnt/Thời gian Phạt khi cạn Cuồng Nộ
lang_multi_text.db,MultiText,PropertyIndex_10131_Name,dnt/破狂暴倍率,Broken Rage Multiplier,dnt/Bội số Phá Cuồng Nộ
lang_multi_text.db,MultiText,PropertyIndex_10132_Name,dnt/被破狂暴倍率,Broken Rage Multiplier,dnt/Bội số Bị Phá Cuồng Nộ
lang_multi_text.db,MultiText,PropertyIndex_10133_Name,dnt/韧性恢复延迟时间,Poise Recovery Delay Time,dnt/Thời gian trễ hồi phục Độ bền
lang_multi_text.db,MultiText,PropertyIndex_10141_Name,偏谐值累积效率,Off-Tune Buildup Rate,Hiệu suất tích lũy Trị Số Lệch Hài
lang_multi_text.db,MultiText,PropertyIndex_10142_Name,谐度破坏增幅,Tune Break Boost,Tăng cường Phá Hủy Hòa Âm
lang_multi_text.db,MultiText,PropertyIndex_101_Name,dnt/无视属性1伤害抗性,Ignore Attribute 1 Damage Resistance,dnt/Bỏ qua Kháng Sát thương Thuộc tính 1
lang_multi_text.db,MultiText,PropertyIndex_102_Name,dnt/无视属性2伤害抗性,Ignore Attribute 2 Damage Resistance,dnt/Bỏ qua Kháng Sát thương Thuộc tính 2
lang_multi_text.db,MultiText,PropertyIndex_103_Name,dnt/无视属性3伤害抗性,Ignore Attribute 3 Damage Resistance,dnt/Bỏ qua Kháng Sát thương Thuộc tính 3
lang_multi_text.db,MultiText,PropertyIndex_104_Name,dnt/无视属性4伤害抗性,Ignore Attribute 4 Damage Resistance,dnt/Bỏ qua Kháng Sát thương Thuộc tính 4
lang_multi_text.db,MultiText,PropertyIndex_105_Name,dnt/无视属性5伤害抗性,Ignore Attribute 5 Damage Resistance,dnt/Bỏ qua Kháng Sát thương Thuộc tính 5
lang_multi_text.db,MultiText,PropertyIndex_106_Name,dnt/无视属性6伤害抗性,Ignore Attribute 6 Damage Resistance,dnt/Bỏ qua Kháng Sát thương Thuộc tính 6
lang_multi_text.db,MultiText,PropertyIndex_107_Name,dnt/技能状态韧性系数,Skill Status Poise Coefficient,dnt/Hệ số Độ bền Trạng thái Kỹ năng
lang_multi_text.db,MultiText,PropertyIndex_108_Name,dnt/攀爬跳跃消耗的耐力（一次）,Stamina Consumed by Climbing Jump (Once),dnt/Thể lực tiêu hao khi Nhảy lúc Leo trèo (một lần)
lang_multi_text.db,MultiText,PropertyIndex_109_Name,dnt/滑翔耐力消耗速度x/秒,Gliding Stamina Consumption Speed x/second,dnt/Tốc độ tiêu hao thể lực khi Lượn x/giây
lang_multi_text.db,MultiText,PropertyIndex_10_AnotherName,基础防御,Base DEF,Phòng thủ cơ bản
lang_multi_text.db,MultiText,PropertyIndex_10_Name,防御,DEF,Phòng thủ
lang_multi_text.db,MultiText,PropertyIndex_110_Name,dnt/质量,Quality,dnt/Khối lượng
lang_multi_text.db,MultiText,PropertyIndex_111_Name,dnt/摩擦力系数,Coefficient of Friction,dnt/Hệ số ma sát
lang_multi_text.db,MultiText,PropertyIndex_112_Name,dnt/重力系数,Gravity Coefficient,dnt/Hệ số trọng lực
lang_multi_text.db,MultiText,PropertyIndex_113_Name,移动速率,Movement Speed,Tốc độ di chuyển
lang_multi_text.db,MultiText,PropertyIndex_114_Name,声骸技能伤害加成,Echo Skill DMG Bonus,Tăng sát thương Kỹ Năng Thanh Hài
lang_multi_text.db,MultiText,PropertyIndex_115_Name,普攻速度,Basic Attack Speed,Tốc độ Đánh Thường
lang_multi_text.db,MultiText,PropertyIndex_116_Name,重击速度,Heavy Attack Speed,Tốc độ Đánh Mạnh
lang_multi_text.db,MultiText,PropertyIndex_117_Name,dnt/状态累积值1 上限,Status Accumulation Value I Limit,dnt/Giới hạn Giá trị Tích lũy Trạng thái 1
lang_multi_text.db,MultiText,PropertyIndex_118_Name,dnt/状态累积值1,Status Accumulation Value I,dnt/Giá trị Tích lũy Trạng thái 1
lang_multi_text.db,MultiText,PropertyIndex_119_Name,dnt/状态累积值2 上限,Status Accumulation Value II Limit,dnt/Giới hạn Giá trị Tích lũy Trạng thái 2
lang_multi_text.db,MultiText,PropertyIndex_11_Dec,提高常态攻击、共鸣技能、共鸣回路、共鸣解放、变奏技能获得的共鸣能量。,"Increases the amount of Resonance Energy gained when using Normal Attack, Resonance Skill, Forte Circuit, and Intro Skill.","Tăng lượng Năng Lượng Cộng Hưởng nhận được từ Đánh Thường, Kỹ Năng Cộng Hưởng, Mạch Cộng Hưởng, Giải Phóng Cộng Hưởng và Kỹ Năng Biến Tấu."
lang_multi_text.db,MultiText,PropertyIndex_11_Name,共鸣效率,Energy Regen,Hiệu Suất Cộng Hưởng
lang_multi_text.db,MultiText,PropertyIndex_120_Name,dnt/状态累积值2,Status Accumulation Value II,dnt/Giá trị Tích lũy Trạng thái 2
lang_multi_text.db,MultiText,PropertyIndex_121_Name,dnt/状态累积值3 上限,Status Accumulation Value III Limit,dnt/Giới hạn Giá trị Tích lũy Trạng thái 3
lang_multi_text.db,MultiText,PropertyIndex_122_Name,dnt/状态累积值3,Status Accumulation Value III,dnt/Giá trị Tích lũy Trạng thái 3
lang_multi_text.db,MultiText,PropertyIndex_123_Name,dnt/状态累积值4 上限,Status Accumulation Value IV Limit,dnt/Giới hạn Giá trị Tích lũy Trạng thái 4
lang_multi_text.db,MultiText,PropertyIndex_124_Name,dnt/状态累积值4,Status Accumulation Value IV,dnt/Giá trị Tích lũy Trạng thái 4
lang_multi_text.db,MultiText,PropertyIndex_125_Name,dnt/状态累积值5 上限,Status Accumulation Value V Limit,dnt/Giới hạn Giá trị Tích lũy Trạng thái 5
lang_multi_text.db,MultiText,PropertyIndex_126_Name,dnt/状态累积值5,Status Accumulation Value V,dnt/Giá trị Tích lũy Trạng thái 5
lang_multi_text.db,MultiText,PropertyIndex_127_Name,dnt/狂暴上限,Rage Limit,dnt/Giới hạn Cuồng Nộ
lang_multi_text.db,MultiText,PropertyIndex_128_Name,dnt/狂暴,Rage,dnt/Cuồng Nộ
lang_multi_text.db,MultiText,PropertyIndex_129_Name,dnt/狂暴恢复,Rage Recovery,dnt/Hồi phục Cuồng Nộ
lang_multi_text.db,MultiText,PropertyIndex_12_Name,冷却时间降低,Cooldown Reduction,Giảm hồi chiêu
lang_multi_text.db,MultiText,PropertyIndex_130_Name,dnt/空狂暴惩罚时间,Empty Rage Punishment Time,dnt/Thời gian Phạt khi cạn Cuồng Nộ
lang_multi_text.db,MultiText,PropertyIndex_131_Name,dnt/破狂暴倍率,Broken Rage Multiplier,dnt/Bội số Phá Cuồng Nộ
lang_multi_text.db,MultiText,PropertyIndex_132_Name,dnt/被破狂暴倍率,Broken Rage Multiplier,dnt/Bội số Bị Phá Cuồng Nộ
lang_multi_text.db,MultiText,PropertyIndex_133_Name,dnt/韧性恢复延迟时间,Resilience Recovery Delay Time,dnt/Thời gian trễ hồi phục Độ bền
lang_multi_text.db,MultiText,PropertyIndex_138_Name,dnt/弱点积蓄值,Weak Point Accumulator Value,dnt/Giá trị Tích lũy Điểm yếu
lang_multi_text.db,MultiText,PropertyIndex_138_Name_Soaring,翱翔耐力上限,Max Flight STA,Giới hạn Thể lực Bay lượn
lang_multi_text.db,MultiText,PropertyIndex_13_Dec,提升共鸣能量的效果。,Boosts the effect of Resonance Energy.,Tăng hiệu quả của Năng Lượng Cộng Hưởng.
lang_multi_text.db,MultiText,PropertyIndex_13_Name,dnt/协奏升华,Concert Sublimation,dnt/Thăng Hoa Hiệp Tấu
lang_multi_text.db,MultiText,PropertyIndex_141_Dec,提升角色部分技能使目标获得的偏谐值。,Scales up the Off-Tune Level accumulated on targets through certain skills.,Tăng Trị Số Lệch Hài tích lũy lên mục tiêu từ một số kỹ năng của nhân vật.
lang_multi_text.db,MultiText,PropertyIndex_141_Name,偏谐值累积效率,Off-Tune Buildup Rate,Hiệu suất tích lũy Trị Số Lệch Hài
lang_multi_text.db,MultiText,PropertyIndex_142_Dec,谐度破坏增幅可以提升谐度破坏伤害，并提升角色对处于干涉状态目标的收益。,Tune Break Boost increases Tune Break DMG and the DMG dealt to Interfered targets,"Tăng cường Phá Hủy Hòa Âm giúp tăng sát thương Phá Hủy Hòa Âm, đồng thời tăng hiệu quả của nhân vật lên mục tiêu đang trong trạng thái Can Thiệp."
lang_multi_text.db,MultiText,PropertyIndex_142_Name,谐度破坏增幅,Tune Break Boost,Tăng cường Phá Hủy Hòa Âm
lang_multi_text.db,MultiText,PropertyIndex_14_Name,共鸣技能伤害加成,Resonance Skill DMG Bonus,Tăng sát thương Kỹ Năng Cộng Hưởng
lang_multi_text.db,MultiText,PropertyIndex_15_Name,通用伤害加成,General DMG Bonus,Tăng sát thương chung
lang_multi_text.db,MultiText,PropertyIndex_16_Name,通用受伤减免,General DMG Reduction,Giảm sát thương chung
lang_multi_text.db,MultiText,PropertyIndex_17_Name,普攻伤害加成,Basic Attack DMG Bonus,Tăng sát thương Đánh Thường
lang_multi_text.db,MultiText,PropertyIndex_18_Name,重击伤害加成,Heavy Attack DMG Bonus,Tăng sát thương Đánh Mạnh
lang_multi_text.db,MultiText,PropertyIndex_19_Name,共鸣解放伤害加成,Resonance Liberation DMG Bonus,Tăng sát thương Giải Phóng Cộng Hưởng
lang_multi_text.db,MultiText,PropertyIndex_1_Dec,这个是等级,This is your Level,Đây là cấp độ
lang_multi_text.db,MultiText,PropertyIndex_1_Name,等级,Level,Cấp độ
lang_multi_text.db,MultiText,PropertyIndex_20_Name,变奏技能伤害加成,Intro Skill DMG Bonus,Tăng sát thương Kỹ Năng Biến Tấu
lang_multi_text.db,MultiText,PropertyIndex_21_Name,物理伤害加成,Physical DMG Bonus,Tăng Sát Thương Vật Lý
lang_multi_text.db,MultiText,PropertyIndex_22_Name,冷凝伤害加成,Glacio DMG Bonus,Tăng Sát Thương Ngưng Băng
lang_multi_text.db,MultiText,PropertyIndex_23_Name,热熔伤害加成,Fusion DMG Bonus,Tăng Sát Thương Hỏa Liệt
lang_multi_text.db,MultiText,PropertyIndex_24_Name,导电伤害加成,Electro DMG Bonus,Tăng Sát Thương Điện Từ
lang_multi_text.db,MultiText,PropertyIndex_25_Name,气动伤害加成,Aero DMG Bonus,Tăng Sát Thương Khí Động
lang_multi_text.db,MultiText,PropertyIndex_26_Name,衍射伤害加成,Spectro DMG Bonus,Tăng Sát Thương Quang Phổ
lang_multi_text.db,MultiText,PropertyIndex_27_Name,湮灭伤害加成,Havoc DMG Bonus,Tăng Sát Thương Hủy Diệt
lang_multi_text.db,MultiText,PropertyIndex_28_Name,物理伤害抗性,Physical RES,Kháng Sát Thương Vật Lý
lang_multi_text.db,MultiText,PropertyIndex_29_Name,冷凝伤害抗性,Glacio RES,Kháng Sát Thương Ngưng Băng
lang_multi_text.db,MultiText,PropertyIndex_2_AnotherName,基础生命,Base HP,Sinh lực cơ bản
lang_multi_text.db,MultiText,PropertyIndex_2_Name,生命,HP,Sinh lực
lang_multi_text.db,MultiText,PropertyIndex_30_Name,热熔伤害抗性,Fusion RES,Kháng Sát Thương Hỏa Liệt
lang_multi_text.db,MultiText,PropertyIndex_31_Name,导电伤害抗性,Electro RES,Kháng Sát Thương Điện Từ
lang_multi_text.db,MultiText,PropertyIndex_32_Name,气动伤害抗性,Aero RES,Kháng Sát Thương Khí Động
lang_multi_text.db,MultiText,PropertyIndex_33_Name,衍射伤害抗性,Spectro RES,Kháng Sát Thương Quang Phổ
lang_multi_text.db,MultiText,PropertyIndex_34_Name,湮灭伤害抗性,Havoc RES,Kháng Sát Thương Hủy Diệt
lang_multi_text.db,MultiText,PropertyIndex_35_Name,治疗效果加成,Healing Bonus,Tăng trị liệu
