db_file,table_name,id,zh,en,vi
lang_multi_text.db,MultiText,Main_LahaiRoi_3_1_32_16,你跟随莫宁来到人工太阳车间，两名研究员正在争执，魏尔伦主张依照罗伊人推算的发射窗口推进“换日仪式”，而安瑟姆教授则对罗伊人的推算表达不信任。莫宁开口调解，支持按原计划推进，魏尔伦表示现在最重要的是确保探测器“海维夏”在换日计划中的测算，安瑟姆留下警告后不快地离开。,"In the Artificial Sun Lab, Researchers Warren and Anslem are in a heated dispute. Warren supports following the Roya's predicted launch window for the New Solar Ceremony, while Anslem refuses to trust their calculations. Mornye mediates, siding with the original plan. Warren stresses that the Hyvatia Detector's measurements are critical, and Anslem leaves after issuing a warning.","Bạn theo Mornye đến xưởng mặt trời nhân tạo, hai nghiên cứu viên đang tranh cãi. Warren chủ trương tiến hành ""Nghi Thức Đổi Mặt Trời"" theo thời điểm phóng do người Roya tính toán, trong khi Giáo sư Anslem bày tỏ sự không tin tưởng vào tính toán của người Roya. Mornye lên tiếng hòa giải, ủng hộ tiến hành theo kế hoạch ban đầu. Warren cho rằng điều quan trọng nhất hiện nay là đảm bảo việc tính toán của thiết bị dò tìm ""Hyvatia"" trong kế hoạch đổi mặt trời, Anslem để lại lời cảnh báo rồi bực bội rời đi."
lang_multi_text.db,MultiText,Main_LahaiRoi_3_1_33_1,刚才那个方案……能赶得上最后一次测试吗？会不会太保守了？,That last proposal... can we even make the final testing window? Isn't it a bit too conservative?,Phương án vừa rồi... có kịp cho lần thử nghiệm cuối cùng không? Liệu có quá bảo thủ không?
lang_multi_text.db,MultiText,Main_LahaiRoi_3_1_33_2,……可刚才安瑟姆教授说这个方案太激进了，让我再改改。,But Professor Anslem just said it was too radical. He told me to revise it again.,"...Nhưng vừa rồi Giáo sư Anslem nói phương án này quá mạo hiểm, bảo tôi sửa lại."
lang_multi_text.db,MultiText,Main_LahaiRoi_3_1_33_3,这……算了，我这边再把备用方案细化一下，还有几个数据需要再测算一遍。,Ugh... Fine. I'll go refine the backup plan on my end. There are still a few data points I need to recalculate.,"Chuyện này... Thôi được, tôi sẽ chi tiết hóa phương án dự phòng bên này, còn vài dữ liệu cần tính toán lại một lần nữa."
lang_multi_text.db,MultiText,Main_LahaiRoi_3_1_35_1,坠剑湖区域检测到虚质磁暴反应……读数在急剧升高！,Void Storm detected near Sundermere... Readings rising rapidly!,Phát hiện phản ứng Bão Hư Không tại khu vực Hồ Kiếm Rơi... Chỉ số đang tăng vọt!
lang_multi_text.db,MultiText,Main_LahaiRoi_3_1_35_2,……源头是……海维夏探测器？！,The source is... the Hyvatia Detector?!,...Nguồn gốc là... thiết bị dò tìm Hyvatia?!
lang_multi_text.db,MultiText,Main_LahaiRoi_3_1_35_4,报告详细情况。,Give me a full report.,Báo cáo tình hình chi tiết.
lang_multi_text.db,MultiText,Main_LahaiRoi_3_1_35_5,莫宁教授，海维夏探测器受到虚质磁暴污染，进入了失控状态……防御阵列开启……,"Yes, Professor. Hyvatia's been compromised by the Void Storm. It's gone rogue. The Defense Array is activating...","Giáo sư Mornye, thiết bị dò tìm Hyvatia bị Bão Hư Không ô nhiễm, đã rơi vào trạng thái mất kiểm soát... Mạng lưới phòng thủ đang khởi động..."
lang_multi_text.db,MultiText,Main_LahaiRoi_3_1_35_6,目标是……研究院。,Their target is... the Institute itself.,Mục tiêu là... Viện Nghiên Cứu.
lang_multi_text.db,MultiText,Main_LahaiRoi_3_1_35_7,发生什么了？,What happened?,Xảy ra chuyện gì vậy?
lang_multi_text.db,MultiText,Main_LahaiRoi_3_1_35_8,海维夏？,Hy-what-tia?,Hyvatia?
lang_multi_text.db,MultiText,Main_LahaiRoi_3_1_35_9,炉芯探测器海维夏受到虚质磁暴污染，进入了失控状态，研究院成为了它的攻击目标。,"The Void Storm has corrupted the Hyvatia Detector, a critical sensor for the Reactor Drive. It's off course and now targeting us.","Thiết bị dò tìm Lõi Lò Phản Ứng Hyvatia bị Bão Hư Không ô nhiễm, đã rơi vào trạng thái mất kiểm soát, Viện Nghiên Cứu trở thành mục tiêu tấn công của nó."
lang_multi_text.db,MultiText,Main_LahaiRoi_3_1_35_10,深空联合为了检测和维护炉芯状态修建的地表探测器，也会为换日仪式提供数据校准……这种时候出状况……,"A surface detector built by the Spacetrek Collective for the Reactor Drive's inspection and maintenance. It's vital for the Ceremony's data calibration. And now, at the worst possible time…","Thiết bị dò tìm mặt đất do Liên Hợp Không Gian xây dựng để kiểm tra và bảo trì trạng thái Lõi Lò Phản Ứng, cũng cung cấp hiệu chuẩn dữ liệu cho Nghi Thức Đổi Mặt Trời... Gặp sự cố vào lúc này..."
lang_multi_text.db,MultiText,Main_LahaiRoi_3_1_35_11,等等……探测器的附近有人！好像……是个学生？,"Wait, someone's near the Detector! Is that… a student?",Khoan đã... gần thiết bị dò tìm có người! Hình như... là một sinh viên?
lang_multi_text.db,MultiText,Main_LahaiRoi_3_1_35_16,……怎么回事！我并没有执行全域封锁指令……糟糕，进程无法停止……！,"What?! I never authorized this command… Ugh, I can't stop it!","...Sao lại thế này! Tôi đâu có thực hiện lệnh phong tỏa toàn vùng... Nguy rồi, tiến trình không thể dừng lại...!"
lang_multi_text.db,MultiText,Main_LahaiRoi_3_1_35_17,现在是什么情况？,What's the situation?,Tình hình bây giờ thế nào?
lang_multi_text.db,MultiText,Main_LahaiRoi_3_1_35_18,海维夏的失控触发了研究院的最高等级避险协议，意味着在危机解除之前，我们都会被困在这里。,Hyvatia's contamination triggered the highest-level safety protocol. We'll all be sealed in here until the threat is neutralized.,"Sự mất kiểm soát của Hyvatia đã kích hoạt giao thức tránh hiểm họa cấp cao nhất của Viện Nghiên Cứu, nghĩa là trước khi nguy cơ được giải trừ, chúng ta đều sẽ bị kẹt ở đây."
lang_multi_text.db,MultiText,Main_LahaiRoi_3_1_35_19,……我尝试停止，但权限被拒绝了。,I tried to stop it… but my access has been denied.,"...Tôi đã thử dừng lại, nhưng quyền hạn bị từ chối."
lang_multi_text.db,MultiText,Main_LahaiRoi_3_1_35_20,看来只能先直接下去了。,Then we need to find a way to get out there.,Xem ra chỉ có thể trực tiếp đi xuống thôi.
lang_multi_text.db,MultiText,Main_LahaiRoi_3_1_35_23,等等……现在联运列车已经因为避险模式停运了……！,"Wait, the main train's suspended under lockdown protocol!",Khoan đã... hiện tại tàu liên vận đã ngừng hoạt động do chế độ tránh hiểm họa rồi...!
lang_multi_text.db,MultiText,Main_LahaiRoi_3_1_35_24,莫宁教授，我需要借用研究院的载具。,"Professor Mornye, I need to borrow an Institute vehicle.","Giáo sư Mornye, tôi cần mượn phương tiện của Viện Nghiên Cứu."
lang_multi_text.db,MultiText,Main_LahaiRoi_3_1_35_25,在接驳口有备用载具，你要怎么下去？,We have backup vehicles at the transfer gate. But how do you plan to reach it?,"Ở cửa kết nối có phương tiện dự phòng, nhưng bạn xuống đó bằng cách nào?"
lang_multi_text.db,MultiText,Main_LahaiRoi_3_1_35_26,……从进来的地方！,The same way I got in!,...Từ chỗ đi vào!
lang_multi_text.db,MultiText,Main_LahaiRoi_3_1_35_27,……那么，在你了解有关研究院的一切之后，我有一个问题。,"Now that you're caught up, may I ask you a question?","...Vậy thì, sau khi bạn đã tìm hiểu mọi thứ về Viện Nghiên Cứu, tôi có một câu hỏi."
lang_multi_text.db,MultiText,Main_LahaiRoi_3_1_35_28,请问吧，教授。,"Yes, Professor.","Mời hỏi, Giáo sư."
lang_multi_text.db,MultiText,Main_LahaiRoi_3_1_35_29,……你，要不要来参加换日仪式？,Would you like to attend the New Solar Ceremony?,...Bạn có muốn đến tham gia Nghi Thức Đổi Mặt Trời không?
lang_multi_text.db,MultiText,Main_LahaiRoi_3_1_35_30,我吗？可我只是一个刚入学的学生……,Me? But... I'm just a freshman.,Tôi sao? Nhưng tôi chỉ là một sinh viên mới nhập học...
lang_multi_text.db,MultiText,Main_LahaiRoi_3_1_35_31,你可以理解成，是我想要邀请你。,Consider this my personal invitation.,"Bạn có thể hiểu là, tôi muốn mời bạn."
