db_file,table_name,id,zh,en,vi
lang_multi_text.db,MultiText,SIDE_SQSJZNL_2_1,加油，拉拉米娅，别害怕，就算失败了，洛乐也会把你拉上来的……,"Pull yourself together. Don't be scared. Even if you fall, Lorel will pull you back up...","Cố lên, Laramia, đừng sợ, dù có thất bại thì Lorel cũng sẽ kéo mình lên mà..."
lang_multi_text.db,MultiText,SIDE_SQSJZNL_2_10,哈哈，洛乐是我给这只小啪嗒起的名字啦，毕竟，每次掉下去的时候它都会把我安全地送回起点，很神奇吧！,"Haha, that's the name I gave to this little Ta-da. Every time I fall, it carries me back to where I fell. It's amazing, right?","Haha, Lorel là cái tên mình đặt cho chú Pata nhỏ này đó, mỗi lần mình rơi xuống, nó đều đưa mình về lại điểm xuất phát an toàn. Thần kỳ lắm đúng không!"
lang_multi_text.db,MultiText,SIDE_SQSJZNL_2_11,算是有惊无险吧，毕竟有洛乐在，挑战失败了也不会出现生命危险！,"So, it's not that dangerous. Lorel's always here to catch you. Even if you fail, you'll still be safe!","Cũng chỉ hú vía thôi, có Lorel ở đây rồi, dù thử thách thất bại cũng không nguy hiểm đến tính mạng đâu!"
lang_multi_text.db,MultiText,SIDE_SQSJZNL_2_12,这位朋友……你身手一定很棒吧，你要不要来尝试一下？,"Say, you look pretty agile. Want to give it a try?","Bạn ơi... trông bạn có vẻ nhanh nhẹn lắm, bạn có muốn thử sức không?"
lang_multi_text.db,MultiText,SIDE_SQSJZNL_2_13,如果你能挑战成功的话，洛乐就会提供相应的奖励！,"If you make it, Lorel will reward you!","Nếu bạn vượt qua thử thách, Lorel sẽ trao phần thưởng cho bạn!"
lang_multi_text.db,MultiText,SIDE_SQSJZNL_2_2,女孩做了一个深呼吸……,The girl takes a deep breath...,Cô gái hít một hơi thật sâu...
lang_multi_text.db,MultiText,SIDE_SQSJZNL_2_3,*鼓励的叫声*,*An encouraging chirp*,*Tiếng kêu cổ vũ*
lang_multi_text.db,MultiText,SIDE_SQSJZNL_2_4,你在这里做什么呢？,What are you doing here?,Cậu đang làm gì ở đây vậy?
lang_multi_text.db,MultiText,SIDE_SQSJZNL_2_5,嗨，你好！我正在尝试进行一种秘密特训！,"Oh, hello! I'm in the middle of a secret training!",Chào bạn! Mình đang thử một bài luyện tập bí mật!
lang_multi_text.db,MultiText,SIDE_SQSJZNL_2_6,你看到那些插在悬崖上的大剑了么？,You seen those giant swords stuck into the cliff?,Bạn có thấy mấy thanh Đại Kiếm cắm trên vách đá kia không?
lang_multi_text.db,MultiText,SIDE_SQSJZNL_2_7,据说只要沿着崖壁上的那些大剑跳到终点，就能够完成洛乐的试炼。,"They say if you jump along those swords all the way to the end, you can finish Lorel's trial!",Nghe nói chỉ cần nhảy theo những thanh Đại Kiếm trên vách đá đến điểm cuối là hoàn thành thử thách của Lorel.
lang_multi_text.db,MultiText,SIDE_SQSJZNL_2_8,洛乐？,Lorel?,Lorel?
lang_multi_text.db,MultiText,SIDE_SQSJZNL_2_9,你这样做不是很危险么？,But that sounds dangerous...,Làm vậy không nguy hiểm sao?
lang_multi_text.db,MultiText,SIDE_SQSJZNL_3_1,怎么样，{PlayerName}，你完成挑战了没有？,"So, {PlayerName}, did you finish the challenge?","Thế nào, {PlayerName}, cậu hoàn thành thử thách chưa?"
lang_multi_text.db,MultiText,SIDE_SQSJZNL_3_10,貌似暂时没有了呢，它说以你的本领，已经是从未见过的出色战士了。好厉害呀……,"Seems like there aren't for now. It said that with your skill, you're already one of the greatest warriors it's ever seen. That's amazing...","Có vẻ tạm thời chưa có thêm rồi. Nó nói với khả năng của cậu, cậu đã là chiến binh xuất sắc nhất mà nó từng thấy. Giỏi quá đi..."
lang_multi_text.db,MultiText,SIDE_SQSJZNL_3_11,如果有一天，我也能变得像你一样强就好了。,I wish I could be as strong as you someday.,"Giá mà một ngày nào đó, tớ cũng có thể mạnh được như cậu."
lang_multi_text.db,MultiText,SIDE_SQSJZNL_3_12,是这样呀……没关系的！,I see... That's okay.,Vậy à... Không sao đâu!
lang_multi_text.db,MultiText,SIDE_SQSJZNL_3_13,*鼓励的叫声*,*An encouraging chirp*,*Tiếng kêu động viên*
lang_multi_text.db,MultiText,SIDE_SQSJZNL_3_14,嗯！它说准备好了再来挑战就可以！它会一直等在这里。,Great! It says you can come back anytime once you're ready. It'll always be here waiting for you.,Ừm! Nó nói khi nào sẵn sàng thì quay lại thử thách là được! Nó sẽ luôn đợi ở đây.
lang_multi_text.db,MultiText,SIDE_SQSJZNL_3_2,完成了,I did.,Xong rồi.
lang_multi_text.db,MultiText,SIDE_SQSJZNL_3_3,还没有……,Not yet...,Chưa xong...
lang_multi_text.db,MultiText,SIDE_SQSJZNL_3_4,！*开心的叫声*,! *A happy chirp*,! *Tiếng kêu vui mừng*
lang_multi_text.db,MultiText,SIDE_SQSJZNL_3_5,好厉害，{PlayerName}！现在……你有什么感想么？,"Wow, that's impressive! So, how do you feel?","Giỏi quá, {PlayerName}! Giờ... cậu có cảm nghĩ gì không?"
lang_multi_text.db,MultiText,SIDE_SQSJZNL_3_6,好轻松的挑战。,It was easy.,Thử thách nhẹ nhàng thôi.
lang_multi_text.db,MultiText,SIDE_SQSJZNL_3_7,还有其他挑战么？,Are there other challenges?,Còn thử thách nào khác không?
lang_multi_text.db,MultiText,SIDE_SQSJZNL_3_8,咦？轻松么？这，这种事情也因人而异的吧，哈，哈哈……,"Huh? Easy? Well, I won't say that. Guess it depends on the person, haha...","Hả? Nhẹ nhàng á? Cái, cái này chắc cũng tùy người thôi nhỉ, ha, haha..."
lang_multi_text.db,MultiText,SIDE_SQSJZNL_3_9,*沮丧的叫声*,*A frustrating chirp*,*Tiếng kêu chán nản*
lang_multi_text.db,MultiText,SIDE_ZDDFX_1_1,早些时候……,Earlier...,Trước đó một lúc...
lang_multi_text.db,MultiText,SIDE_ZDDFX_1_2,周围都检查完了，没什么奇怪的地方。,I've done a search of the area. Nothing out of the ordinary.,"Xung quanh đã kiểm tra hết rồi, không có gì bất thường cả."
lang_multi_text.db,MultiText,SIDE_ZDDFX_1_3,就是这轨道……看上去是残星会建造的。上次来的时候，我发现这轨道可以用来滑行。,These rails however... They seem to have been built by the Fractsidus. In my previous visit I found out that I could slide along them.,"Chỉ có đường ray này... Trông giống do Tàn Tinh Hội xây dựng. Lần trước đến đây, tôi phát hiện có thể dùng đường ray này để trượt."
lang_multi_text.db,MultiText,SIDE_ZDDFX_1_4,是的，要不要试试？我教你。,Why yes. Would you like to try? I can show you.,"Đúng vậy, muốn thử không? Để tôi chỉ cho."
lang_multi_text.db,MultiText,SIDE_ZDDFX_1_5,滑行？,Slide?,Trượt?
lang_multi_text.db,MultiText,SIDE_ZDDFX_1_6,什么时候会这个的？,Since when did you learn how to do that?,Từ bao giờ mà biết làm cái này vậy?
lang_multi_text.db,MultiText,SIDE_ZDDFX_1_7,在你看不到的时候，我做的事可不少呢！,"Well, it just so happens that I've picked up lots of things when you weren't around!","Lúc ngài không thấy ấy, tôi làm được khối việc đấy chứ!"
lang_multi_text.db,MultiText,SIDE_ZDDFX_2_1,这里有些轨道断裂了，滑行的时候要小心些。,Careful of the broken sections on the rails.,"Có vài đoạn đường ray bị đứt gãy, khi trượt phải cẩn thận nhé."
lang_multi_text.db,MultiText,SIDE_ZDDFX_2_2,还挺有意思的，有点像在地底飞行。,That was actually pretty fun. Like flying underground.,"Cũng thú vị đấy, giống như đang bay dưới lòng đất vậy."
lang_multi_text.db,MultiText,SIDE_ZDDFX_2_3,之前来的时候，我还有些紧张。,I was actually pretty nervous the last time I was here.,"Lần trước đến đây, tôi còn hơi lo lắng."
lang_multi_text.db,MultiText,SIDE_ZDDFX_2_4,现在和你一起，我很开心。,Being with you feels truly reassuring.,"Giờ được đi cùng bạn, tôi rất vui."
lang_multi_text.db,MultiText,SIDE_ZDDFX_2_5,感觉如何？,How did it feel?,Cảm thấy thế nào?
lang_multi_text.db,MultiText,SIDE_ZDDFX_2_6,现在呢？,How about now?,Còn bây giờ thì sao?
lang_multi_text.db,MultiText,SIDE_ZDDFX_3_1,那些矿车，应该是残星会用来运输货物的吧。,Those mine carts were likely used by the Fractsidus for transporting supplies.,Mấy xe goòng kia chắc là Tàn Tinh Hội dùng để vận chuyển hàng hóa.
lang_multi_text.db,MultiText,SIDE_ZDDFX_3_2,七丘似乎正准备修缮这里。,Septimont plans to repurpose this place.,Septimont có vẻ đang chuẩn bị tu sửa nơi này.
lang_multi_text.db,MultiText,SIDE_ZDDFX_3_3,嗯，所以我们才来检查这里的情况。,Yes. Which is why we're here to examine its conditions.,"Ừ, nên chúng tôi mới đến kiểm tra tình hình ở đây."
lang_multi_text.db,MultiText,SIDE_ZDDFX_4_4,你看，好大的树。,See that? Such a large tree.,"Nhìn kìa, cái cây lớn quá."
lang_multi_text.db,MultiText,SIDE_ZDDFX_4_5,现在看上去没什么危险。,Looks safe now.,Trông bây giờ không có gì nguy hiểm.
lang_multi_text.db,MultiText,SIDE_ZDDFX_4_6,残星会居然在这树上建立了临时的据点。,That's where the Fractsidus has set up their temporary headquarters.,Không ngờ Tàn Tinh Hội lại lập cứ điểm tạm thời trên cái cây này.
lang_multi_text.db,MultiText,SIDE_ZDDFX_5_1,这样一来，检查就完全结束了。看来，这里已经没什么问题了。,I believe this concludes our investigation. Everything seems to be in order.,Vậy là việc kiểm tra đã hoàn tất. Có vẻ nơi này không còn vấn đề gì nữa.
lang_multi_text.db,MultiText,SIDE_ZDDFX_5_2,{PlayerName}，谢谢你。,"Thank you, {PlayerName}.","{PlayerName}, cảm ơn bạn."
lang_multi_text.db,MultiText,SIDE_ZDDFX_5_3,我会记得这在地底飞行的感觉。,I shall remember this underground flying experience we had together today.,Tôi sẽ nhớ mãi cảm giác bay dưới lòng đất này.
lang_multi_text.db,MultiText,SLDYS_15_10,“而他像一位引路人，指引我们一步一步向前游，我永远也忘不了那画面——我们的心和他是完全同步的。”,"""He taught us how to follow the music's flow until our hearts beat in the same rhythm, a moment that would always stay in my mind.""","""Còn anh ấy như một người dẫn đường, dắt chúng tôi từng bước từng bước bơi về phía trước. Tôi mãi không quên được hình ảnh ấy - trái tim chúng tôi hoàn toàn hòa nhịp cùng anh."""
lang_multi_text.db,MultiText,SLDYS_15_11,“等我们都能跟上节奏时，他说‘这才是绿色的声音，稳稳地、轻轻地，像一片草在长大。’”,"""And when we finally follow the rhythm perfectly, he said, 'That's the sound of green. Little, but steady, like growing grass.'""","""Khi tất cả đã bắt kịp nhịp, anh ấy nói 'Đây mới là âm thanh của màu xanh. Vững vàng, nhẹ nhàng, như một ngọn cỏ đang lớn lên.'"""
lang_multi_text.db,MultiText,SLDYS_15_12,“原来‘咪’的颜色不只是绿，是‘长大’的颜色。”,"""So Mi isn't just green. It means growth.""","""Thì ra màu của 'Mi' không chỉ là xanh, mà là màu của 'lớn lên'."""
lang_multi_text.db,MultiText,SLDYS_15_13,微风卷起草叶，发出柔软的簌簌声。光线重新汇聚，小咪的眼中映着明亮的绿。,"A breeze stirs the grass, filling the air with a soft rustling. In Mi's eyes, the light gathers once more, brightening into a vivid, verdant shade.","Gió nhẹ cuốn những chiếc lá cỏ, phát ra tiếng xào xạc êm ái. Ánh sáng hội tụ trở lại, trong mắt Mi bé ánh lên một màu xanh rực rỡ."
lang_multi_text.db,MultiText,SLDYS_15_14,“也许，那个时候马修就在为后来的分别做准备，他是真的想教会我们……”,"""Maybe… maybe Matthew was preparing us for the day he'd leave. He really wanted us to learn…""","""Có lẽ... lúc đó Matthew đã chuẩn bị sẵn cho cuộc chia ly sau này rồi. Anh ấy thật sự muốn dạy chúng tôi..."""
lang_multi_text.db,MultiText,SLDYS_15_15,“不要困在旋律和节奏里，不是死记硬背，而是跟随自己内心的感受，学会看见彼此眼中的‘色彩’。”,"""Not to get trapped in notes and rhythm... Not just to memorize it, but follow the feelings inside. It's about learning to see the 'colors' in each other's eyes.""","""Đừng mắc kẹt trong giai điệu và nhịp phách, không phải học thuộc máy móc, mà là đi theo cảm xúc trong lòng mình, học cách nhìn thấy 'sắc màu' trong mắt nhau."""
lang_multi_text.db,MultiText,SLDYS_15_16,“谢谢你，谢谢你让我再次想起那个时候的感受，找回高潮部分的乐声！”,"""Thank you for helping me remember what that moment felt like and find the climax of the Melody again.""","""Cảm ơn cậu, cảm ơn cậu đã giúp tôi nhớ lại cảm giác ngày ấy, tìm lại được âm thanh của đoạn cao trào!"""
lang_multi_text.db,MultiText,SLDYS_15_17,我开始好奇完整的乐声了。,I'm curious about the full Melody now.,Tôi bắt đầu tò mò về giai điệu hoàn chỉnh rồi.
lang_multi_text.db,MultiText,SLDYS_15_18,我开始好奇更多的颜色了。,I'm curious about the rest of the colors.,Tôi bắt đầu tò mò về những màu sắc còn lại rồi.
lang_multi_text.db,MultiText,SLDYS_15_19,“那就和我们一起找找看吧！相信我，你一定不会失望的！”,"""Then let's search for them together! Trust me, you won't be disappointed!""","""Vậy thì cùng chúng tôi đi tìm nhé! Tin tôi đi, cậu chắc chắn sẽ không thất vọng đâu!"""
lang_multi_text.db,MultiText,SLDYS_15_2,“我全记起来了，乐声的高潮……‘咪’的声音，是绿色的，就像树在生长，像山在呼吸，像叶子舒展开来……”,"""I remember it now… the climax of this Melody. The sound of Mi is green, the same green as sprouting branches, breathing mountain forests, fresh young leaves…""","""Tôi nhớ hết rồi, cao trào của giai điệu... âm thanh của 'Mi' là màu xanh, như cây đang lớn, như núi đang thở, như lá đang xòe ra..."""
lang_multi_text.db,MultiText,SLDYS_15_22,草地上最后一点绿光闪烁消散，风像在轻轻哼唱“咪——咪——”，直到完全归于寂静。,"The last trace of green light flickers out across the grass. The wind hums a faint ""Mi—mi—"" before fading into silence.","Chút ánh xanh cuối cùng trên bãi cỏ lấp lánh rồi tan biến, gió như khe khẽ ngân nga ""Mi-- Mi--"", cho đến khi hoàn toàn chìm vào tĩnh lặng."
lang_multi_text.db,MultiText,SLDYS_15_3,日灵在纸状物的空白处补上了绿色的印记，仿佛将失落的乐谱重新填满。,"The Soliskin fills the empty space on the paper with green marks, as if completing a piece of music that had been scattered and lost.","Nhật Linh điền thêm dấu ấn màu xanh vào chỗ trống trên tờ giấy, như thể lấp đầy lại bản nhạc đã thất lạc."
lang_multi_text.db,MultiText,SLDYS_15_4,伴随这只日灵的动作，你眼前似乎真的浮现出马修和它们一同的景象。,"As it keeps filling in the marks, you seem to catch fleeting glimpses of its time with Matthew.","Theo từng động tác của Nhật Linh, trước mắt cậu dường như thật sự hiện lên hình ảnh Matthew cùng chúng ngày ấy."
lang_multi_text.db,MultiText,SLDYS_15_6,“……就像那时候一样。”,"""…It was just like back then.""","""...Y như ngày đó vậy."""
lang_multi_text.db,MultiText,SLDYS_15_7,“那次我们试了好多次，好不容易成功了那么一次，我们气喘吁吁地趴在地上，马修却只是笑。”,"""We tried so many times and only pulled it off once. It was exhausting, but Matthew just watched us with that gentle smile of his.""","""Lần đó chúng tôi thử bao nhiêu lần, mãi mới thành công được một lần. Chúng tôi thở hổn hển nằm bẹp xuống đất, còn Matthew thì chỉ cười."""
lang_multi_text.db,MultiText,SLDYS_15_8,“他说，‘现在的我们太慢啦，弹完飞鱼听了都要跑去躲懒了。’”,"""'We've got to hurry a bit. If we take too long, the flying fish will be too tired to soar,' he joked.""","""Anh ấy nói, 'Bọn mình chậm quá rồi, đàn xong thì lũ cá bay nghe xong cũng bỏ đi ngủ mất thôi.'"""
lang_multi_text.db,MultiText,SLDYS_15_9,“可他没生气，带着我们一起，更慢更慢地用琴键去敲打，旋律像海水一样，我们好像也和飞鱼一样摇摇摆摆。”,"""He never got upset. Instead, he slowed the rhythm down even more, guiding us patiently. The Melody drifted through the air like seawater, and with it, we moved as if we were the flying fish themselves.""","""Nhưng anh ấy không giận, mà dẫn chúng tôi cùng nhau, gõ phím chậm hơn, chậm hơn nữa. Giai điệu như nước biển vậy, còn chúng tôi cũng lắc lư như lũ cá bay."""
lang_multi_text.db,MultiText,SLDYS_16_1,噜噜……啾……噜噜……啾！,Lulu... chu... Lulu... chu!,Lulu... chiu... Lulu... chiu!
lang_multi_text.db,MultiText,SLDYS_16_2,啾啾……噜……啾啾……噜！,Chuuu... lu... Chuuu... lu!,Chiuchiu... lu... Chiuchiu... lu!
lang_multi_text.db,MultiText,SLDYS_17_1,阿布再次开始为你同声翻译起日灵的话。,"Once again, Abby is already interpreting in perfect sync.",Abby lại bắt đầu phiên dịch đồng thời lời của tinh linh cho bạn.
lang_multi_text.db,MultiText,SLDYS_17_10,好像不是小小小问题吧。,"You sure this is just a ""tiny teeny"" problem?",Có vẻ không phải là vấn đề nhỏ nhỏ nhỏ đâu nhỉ.
lang_multi_text.db,MultiText,SLDYS_17_11,“嘿嘿，总之，反正现在有你在帮忙了嘛！先用那边的噼啪啪给重机充电，把我救出来吧，等出来我再和你好好解释！”,"""He… hehe… Anyway, I have you to help me now! Can you please charge the Explorer with that Zip Zap over there and get me out first? I'll explain everything properly later! Promise!""","""Hê hê, nói chung, giờ đã có cậu giúp rồi mà! Dùng cái Bíp Bíp ở đằng kia sạc cho cỗ máy đi, cứu tớ ra trước đã, ra rồi tớ sẽ giải thích cho cậu nghe!"""
lang_multi_text.db,MultiText,SLDYS_17_2,但奇怪的是，你眼前除了一台陷入休眠状态的重机之外，再没其他身影。,"But in front of you, there's nothing except a Spacetrek Explorer quietly sitting in sleep mode.","Nhưng kỳ lạ thay, trước mắt bạn ngoài một cỗ máy thám hiểm đang ở chế độ ngủ ra, không còn bóng dáng nào khác."
lang_multi_text.db,MultiText,SLDYS_17_3,“……咿——呀——再来一次！小来你一定可以的！”,"""...Eeeeeyaaaa—one more time! You can do this, Re!""","""...Í...ya...thêm lần nữa! Re, cậu làm được mà!"""
lang_multi_text.db,MultiText,SLDYS_17_4,……小来？,...Re?,...Re?
lang_multi_text.db,MultiText,SLDYS_17_5,“没错，就是我啦！诶……有、有人来了！太好了！”,"""That's me! Ah, f-finally, someone's here! Yayyy!!""","""Đúng rồi, là tớ đây! Ơ... có, có người tới rồi! Tuyệt quá!"""
lang_multi_text.db,MultiText,SLDYS_17_6,“这边这边，朝下看……不对，你应该看不到啦……我被压在重机下面了！”,"""Hello! I'm down here! Oh… right, you can't actually see me, can you? Umm… I'm under the Spacetrek Explorer!""","""Đây đây, nhìn xuống dưới... à không, chắc cậu không thấy đâu... Tớ bị đè dưới cỗ máy rồi!"""
lang_multi_text.db,MultiText,SLDYS_17_7,你这是怎么搞的？,How did you end up there?,Cậu làm sao mà ra nông nỗi này vậy?
lang_multi_text.db,MultiText,SLDYS_17_8,“那什么，看起来还挺明显的吧~我在试着掌握‘来’的节奏啦……就是，遇到了一点小小小小问题……”,"""Well, isn't it obvious? I was trying to find the rhythm of Re and, um, ran into this tiny, teeny problem…""","""Cái đó, nhìn thì cũng rõ rồi mà~ Tớ đang cố nắm bắt nhịp của 'Re' ấy... rồi thì, gặp chút vấn đề nhỏ nhỏ nhỏ nhỏ..."""
lang_multi_text.db,MultiText,SLDYS_17_9,明显吗？完全看不出来！,It's NOT obvious at all.,Rõ ư? Hoàn toàn chẳng thấy gì cả!
lang_multi_text.db,MultiText,SLDYS_181_1,（对应照片的地方都已经去过了，乐谱的部分也复原得差不多了。）,(I've already checked every spot from those photos. The music sheet is also complete now.),"(Những nơi tương ứng với ảnh đều đã đi qua hết rồi, phần bản nhạc cũng đã khôi phục gần xong.)"
lang_multi_text.db,MultiText,SLDYS_181_2,（现在，是时候去石化飞鱼那集合，听一听它们的乐声了。）,(Time to head back to the stone flying fish and listen to the Soliskin's song.),"(Giờ là lúc tập hợp ở chỗ cá bay hóa đá, nghe thử giai điệu của chúng thôi.)"
lang_multi_text.db,MultiText,SLDYS_18_1,“呜哇！总算是出来了，小来我啊，再待一会儿都要被压扁了！”,"""Uwah! Finally out! One more minute and I would've been flattened into a Soliskin pie!""","""Uwah! Cuối cùng cũng ra được rồi, tí nữa là Lai này bị đè bẹp mất!"""
lang_multi_text.db,MultiText,SLDYS_18_10,“我很开心，以为这样的时光永远不会结束，直到有一天，马修和我们说尾声也完成了。”,"""I was so happy, and thought those days would last forever. Until one day, Matthew told us he'd finished composing the ending.""","""Mình vui lắm, cứ nghĩ những ngày như thế sẽ kéo dài mãi mãi. Cho đến một ngày, Matthew nói với bọn mình rằng phần kết cũng đã hoàn thành rồi."""
lang_multi_text.db,MultiText,SLDYS_18_11,“完成，意味着结束，也意味着我们要分开了。”,"""Finished… meant it was over. And that we'd have to say goodbye to each other.""","""Hoàn thành... có nghĩa là kết thúc. Và cũng có nghĩa là bọn mình phải chia tay nhau."""
lang_multi_text.db,MultiText,SLDYS_18_12,“一想到可能再也见不到他，我……再也没有办法像之前那样踩准对应的位置了，有什么卡在我的身体里，乐声……变成了让人难受的东西。”,"""Once I realized I might never see him again, I… I couldn't step to the right spot anymore. Something jammed inside me, and the Melody… it became something painful.""","""Khi nghĩ đến việc có thể không bao giờ gặp lại anh ấy nữa, mình... không thể bước đúng chỗ như trước được nữa. Có gì đó mắc kẹt trong người mình, tiếng nhạc... biến thành thứ khiến mình đau."""
lang_multi_text.db,MultiText,SLDYS_18_13,“但是马修发现了，他说快结尾的来是有力量的，就像闪亮亮的电流、光亮一样，甚至为了让我开心，他还找来了些重机。”,"""But Matthew noticed the 'Re' near the ending carried a certain strength, like sparkling currents and flashes of light. To cheer me up, he even brought an Explorer.""","""Nhưng Matthew nhận ra rồi, anh ấy nói nốt 'Re' gần đoạn kết có sức mạnh riêng, giống như dòng điện lấp lánh, như ánh sáng vậy. Để mình vui lên, anh ấy còn tìm đến một chiếc xe thám hiểm nữa."""
lang_multi_text.db,MultiText,SLDYS_18_14,“他带着我一起，跟着它的亮闪打拍子，‘来、来、来——’，看着那些光我好像又能继续了。”,"""He tapped the beat with me along the Explorer's blinking lights. 'Re, re, re—' As I watched them flash, it felt like I could keep going again.""","""Anh ấy cùng mình gõ nhịp theo ánh đèn nhấp nháy của nó. 'Re, re, re-', nhìn những ánh sáng đó, mình thấy như mình có thể tiếp tục được."""
lang_multi_text.db,MultiText,SLDYS_18_15,电光的亮度在草地上闪烁出稳定的节奏，嗡鸣声化为柔和的低音。,"The bright pulse flickers across the grass in a steady tempo. Its low hum softens, blending into something warm and gentle.","Ánh điện nhấp nháy trên bãi cỏ theo nhịp đều đặn, tiếng vo ve hòa thành âm trầm dịu dàng."
lang_multi_text.db,MultiText,SLDYS_18_16,日灵在纸状物的空白处补上了黄色的印记，仿佛将失落的乐谱重新填满。,"The Soliskin fills the empty space on the paper with yellow marks, as if completing a piece of music that had been scattered and lost.","Tinh linh điền thêm dấu vàng vào chỗ trống trên tờ giấy, như thể lấp đầy bản nhạc đã thất lạc."
lang_multi_text.db,MultiText,SLDYS_18_17,“所以我想着，要复原得准确，或许也得用一样的办法才行！只是这种大家伙，我，我一只灵搞不定啊！”,"""So I thought… to restore the music sheet properly, maybe I had to use the same method! But the Explorer is too big to be handled all by myself!""","""Nên mình nghĩ, muốn khôi phục chính xác thì có lẽ phải dùng cùng một cách! Chỉ là cái máy to thế này, mình... một mình mình không xử lý nổi!"""
