db_file,table_name,id,zh,en,vi
lang_multi_text.db,MultiText,Character_ChangLi_21_51,之前听说夜归军来这里正是为了处理山中残留的异象，不允许我们进山，也是这个缘由吧……,"...So that's why there were rumors of Rangers being here to take care of the leftover Tacet Discords, and block off access to the mountain...","Trước đó nghe nói quân Dạ Quy đến đây chính là để xử lý dị tượng tàn dư trong núi, không cho chúng tôi lên núi cũng là vì lý do này..."
lang_multi_text.db,MultiText,Character_ChangLi_21_52,那么……如果这个时间乱流真的如此危险……,Then... if this Temporal Disruption you speak of is truly so dangerous...,Vậy thì... nếu loạn lưu thời gian này thật sự nguy hiểm đến vậy...
lang_multi_text.db,MultiText,Character_ChangLi_21_53,请{PlayerName}和长离大人，务必解决它。,"{PlayerName}, Lady Changli, please help us get rid of it. For the sake of everyone here.","Xin {PlayerName} và đại nhân Changli, nhất định hãy giải quyết nó."
lang_multi_text.db,MultiText,Character_ChangLi_21_54,但是你的朋友……,But your friend...,Nhưng bạn của cô...
lang_multi_text.db,MultiText,Character_ChangLi_21_55,在他看来，这是唯一能够真正拯救你的方法，若是有万分之一可能，它真实存在呢？,"He truly thinks it's the only way to save you. He's willing to take a slim chance, just for you.","Trong mắt anh ấy, đây là cách duy nhất có thể thật sự cứu cô. Nếu có một phần vạn khả năng, nó thực sự tồn tại thì sao?"
lang_multi_text.db,MultiText,Character_ChangLi_21_57,咳咳咳……我……我没事，抱歉，很久没有说过这么多话了。,*cough* I... I'm okay. I haven't talked this much in a long time.,"Khụ khụ khụ... tôi... tôi không sao, xin lỗi, đã lâu rồi không nói nhiều như vậy."
lang_multi_text.db,MultiText,Character_ChangLi_21_58,我去叫医师来。,I'll go get a doctor for you.,Tôi đi gọi thầy thuốc đến.
lang_multi_text.db,MultiText,Character_ChangLi_21_59,不要勉强。,You need to rest.,Đừng gắng gượng.
lang_multi_text.db,MultiText,Character_ChangLi_21_6,伏翎……！,Fuling...!,Fuling...!
lang_multi_text.db,MultiText,Character_ChangLi_21_60,……我只是，有点累了，休息一会就好。,...I'm just a little tired. I'll be fine after some rest.,"...Tôi chỉ hơi mệt thôi, nghỉ một chút là ổn."
lang_multi_text.db,MultiText,Character_ChangLi_21_61,等梧黎醒来的时候，我会和他好好解释的。,"Once Wuli wakes up, I'll explain everything to him.","Khi Ngô Lê tỉnh lại, tôi sẽ giải thích rõ với anh ấy."
lang_multi_text.db,MultiText,Character_ChangLi_21_62,如果你有其他的想法，也最好直接告诉他。,"If you have any other ideas, just tell him.","Nếu cô có suy nghĩ gì khác, tốt nhất cũng nên nói thẳng với anh ấy."
lang_multi_text.db,MultiText,Character_ChangLi_21_63,有些事情若不说出口，哪怕是最亲密的人，也无从得知啊。,"But if you keep it all to yourself... No one, even those closest to you, will know how you really feel.","Có những chuyện nếu không nói ra, dù là người thân thiết nhất cũng không thể nào biết được."
lang_multi_text.db,MultiText,Character_ChangLi_21_64,……嗯，我明白了。,...Yes. I understand.,"...Vâng, tôi hiểu rồi."
