db_file,table_name,id,zh,en,vi
lang_multi_text.db,MultiText,Main_LahaiRoi_3_1_3201_16,让你见笑了，我相信莫宁不会带无关人员进入车间。,Sorry if I'm being blunt. I'm sure Professor Mornye has her reasons for bringing someone into the lab.,"Để cậu chê cười rồi, tôi tin Mornye sẽ không dẫn người không phận sự vào xưởng đâu."
lang_multi_text.db,MultiText,Main_LahaiRoi_3_1_3201_17,但这里的每个人我都应该记得，唯独对你没有什么印象，请问你是？,"But I recognize every face here, except yours. Mind telling me who you are?","Nhưng tôi nhớ mặt tất cả mọi người ở đây, duy chỉ có cậu là tôi không có ấn tượng gì, xin hỏi cậu là?"
lang_multi_text.db,MultiText,Main_LahaiRoi_3_1_3201_18,{PlayerName}，是新生。,{PlayerName}. I'm a freshman.,"{PlayerName}, là học sinh mới."
lang_multi_text.db,MultiText,Main_LahaiRoi_3_1_3201_19,新生，是来录制磁带的吗……不对，虚质磁暴的肆虐期应该……,"Ah, so you're here to record your Cassette? Though, with the Void Storm in full force…","Học sinh mới, đến để ghi băng sao... Khoan đã, thời kỳ Bão Từ Hư Không đang hoành hành lẽ ra phải..."
lang_multi_text.db,MultiText,Main_LahaiRoi_3_1_3201_20,{TA}是黑海岸举荐过来的。,{Male=He;Female=She} comes recommended by the Black Shores.,{TA} được Bờ Biển Đen tiến cử tới đây.
lang_multi_text.db,MultiText,Main_LahaiRoi_3_1_3201_21,原来是他们……我明白了。,The Black Shores... I see.,Hóa ra là họ... tôi hiểu rồi.
lang_multi_text.db,MultiText,Main_LahaiRoi_3_1_3201_22,你是和那位千咲同学通过同样的方法进入这里的吧？,"So you came here by the same means as Miss Chisa, correct?",Cậu cũng vào đây bằng phương pháp giống như cô bạn Chisa kia phải không?
lang_multi_text.db,MultiText,Main_LahaiRoi_3_1_3201_23,她当时突然出现可是让校方吓了一跳呢……你们是通过什么方式进入这里的，可以告诉我吗？,Her sudden appearance in the Academy caused quite a stir that day. Would you mind sharing how you made it here?,"Lúc đó cô ấy đột nhiên xuất hiện khiến nhà trường giật mình đấy... Các cậu vào đây bằng cách nào, có thể cho tôi biết không?"
lang_multi_text.db,MultiText,Main_LahaiRoi_3_1_3201_24,我和校方那边联系不多，也只是道听途说有人凭空出现在了学院外。,I don't deal with the Academy all that much. All I heard was that someone appeared out of nowhere outside the gates.,"Tôi không liên lạc nhiều với phía nhà trường, cũng chỉ nghe đồn có người bỗng nhiên xuất hiện bên ngoài Học viện thôi."
lang_multi_text.db,MultiText,Main_LahaiRoi_3_1_3201_25,魏尔伦教授，现在不是说这个的时候。,"This may not be the right time for such questions, Professor Warren.","Giáo sư Warren, giờ không phải lúc nói chuyện này."
lang_multi_text.db,MultiText,Main_LahaiRoi_3_1_3201_26,啊……是我唐突了，我这人就是好奇心比较强。,Oh... forgive me. Curiosity has always been my second nature.,"A... là tôi đường đột quá, tính tôi vốn tò mò mà."
lang_multi_text.db,MultiText,Main_LahaiRoi_3_1_3201_27,嗯……黑海岸既然举荐你来这里入学，我就暂时把你当学生对待了。,"Well, if you have the Black Shores' recommendation, you're certainly a student here.",Ừm... Đã được Bờ Biển Đen tiến cử nhập học thì tôi tạm thời coi cậu là học sinh vậy.
lang_multi_text.db,MultiText,Main_LahaiRoi_3_1_3201_28,自我介绍下，我是魏尔伦，目前是这所车间的主管。,"Allow me to introduce myself: I'm Warren, supervisor of this lab.","Xin tự giới thiệu, tôi là Warren, hiện là quản lý của xưởng này."
lang_multi_text.db,MultiText,Main_LahaiRoi_3_1_3201_29,除了贴有禁止进入标识的房间，这里的其他地方都对学生开放参观。,"Aside from the rooms marked ""No Entry,"" the rest of the facility is open for student visits.","Trừ những phòng có dán biển cấm vào, những nơi khác ở đây đều mở cửa cho học sinh tham quan."
lang_multi_text.db,MultiText,Main_LahaiRoi_3_1_3201_30,看来我也不用给你找向导了，不过可不要占用莫宁教授太多时间啊，她可是这个项目的核心成员之一呢。,"I'm sure Professor Mornye will give you a thorough tour, but please don't take too long. A key member like her needs to focus on our project.","Xem ra tôi không cần tìm người hướng dẫn cho cậu nữa, nhưng đừng chiếm dụng quá nhiều thời gian của Giáo sư Mornye nhé, cô ấy là một trong những thành viên cốt cán của dự án này đấy."
lang_multi_text.db,MultiText,Main_LahaiRoi_3_1_3201_31,我也要去处理其他事，就不再继续打扰你们了。,"Alas, my work calls. I'll leave you two to it.","Tôi cũng phải đi xử lý việc khác, không làm phiền hai người nữa."
lang_multi_text.db,MultiText,Main_LahaiRoi_3_1_3202_32,抱歉，把你卷入了这种争执里……,Sorry you had to witness their quarrel.,"Xin lỗi, đã kéo cậu vào cuộc tranh cãi này..."
lang_multi_text.db,MultiText,Main_LahaiRoi_3_1_3202_33,就如魏尔伦教授所言，如果你对这里感兴趣，可以随意参观。,"Anyway, just like Professor Warren said, feel free to look around as you like.","Như Giáo sư Warren đã nói, nếu cậu hứng thú với nơi này thì cứ tự nhiên tham quan."
lang_multi_text.db,MultiText,Main_LahaiRoi_3_1_320_1,还剩最后一处。,Down to the last one.,Còn lại chỗ cuối cùng.
lang_multi_text.db,MultiText,Main_LahaiRoi_3_1_320_2,等等……那个大虫子的味道越来越近了……,"Hold on, that worm's scent feels like it's getting closer.",Khoan đã... mùi của con sâu bự đó ngày càng gần rồi...
lang_multi_text.db,MultiText,Main_LahaiRoi_3_1_320_3,……嗯，得抓紧时间。,We'd better hurry.,"...Ừ, phải tranh thủ thời gian."
lang_multi_text.db,MultiText,Main_LahaiRoi_3_1_320_4,不能让琳奈一个人撑太久。,Can't leave Lynae holding it off for long.,Không thể để Lynae một mình chống đỡ quá lâu.
lang_multi_text.db,MultiText,Main_LahaiRoi_3_1_321_1,虚诞虫朝着这边来了。,The Voidworm's coming this way.,Trùng Hư Không đang hướng về phía này.
lang_multi_text.db,MultiText,Main_LahaiRoi_3_1_321_2,琳奈……！,Lynae!,Lynae...!
lang_multi_text.db,MultiText,Main_LahaiRoi_3_1_321_3,……我……没事……*滋啦*先……防御阵列……,I'm... okay... *Bzzt* Just... the array...,...Tôi... không sao... *Rẹt rẹt* Trước tiên... trận địa phòng thủ...
lang_multi_text.db,MultiText,Main_LahaiRoi_3_1_321_4,……我知道了。,Got it.,...Tôi biết rồi.
lang_multi_text.db,MultiText,Main_LahaiRoi_3_1_321_5,不会让你等太久。,I won't keep you waiting long.,Sẽ không để cô đợi lâu đâu.
lang_multi_text.db,MultiText,Main_LahaiRoi_3_1_322_1,小心！,Watch out!,Cẩn thận!
lang_multi_text.db,MultiText,Main_LahaiRoi_3_1_322_2,……！,...!,...!
lang_multi_text.db,MultiText,Main_LahaiRoi_3_1_322_3,呼……还好赶上了。,Phew... that was close.,Phù... may mà kịp.
lang_multi_text.db,MultiText,Main_LahaiRoi_3_1_322_4,这里交给我，你专心去启动防御阵列！,I've got this! Go ahead and activate the Defense Array!,"Chỗ này giao cho tôi, cậu tập trung đi kích hoạt trận địa phòng thủ đi!"
lang_multi_text.db,MultiText,Main_LahaiRoi_3_1_323_1,这里的守卫机械，也被虚诞虫污染了么。,The Voidworm has contaminated these security mechs too.,Máy móc bảo vệ ở đây cũng bị Trùng Hư Không làm ô nhiễm rồi sao.
lang_multi_text.db,MultiText,Main_LahaiRoi_3_1_323_2,来不及了，直接破坏吧。,No time to waste. I'll take them out.,"Không kịp nữa rồi, phá hủy trực tiếp đi."
lang_multi_text.db,MultiText,Main_LahaiRoi_3_1_324_1,防御阵列启动，虚诞虫被成功束缚了！,The Defense Array is online! The Voidworm is now restrained!,"Trận địa phòng thủ đã kích hoạt, Trùng Hư Không đã bị trói buộc thành công!"
lang_multi_text.db,MultiText,Main_LahaiRoi_3_1_324_2,你看到它头上的那些了吗？那是它的虚质反应炉，只要全部破坏就能让它过载，彻底瘫痪。,"See those things on its head? They're its Voidmatter Regulators. Take 'em all out, and we'll fry this worm!","Cậu thấy mấy thứ trên đầu nó không? Đó là Lò Phản Ứng Hư Chất của nó, chỉ cần phá hủy hết là có thể khiến nó quá tải, tê liệt hoàn toàn."
lang_multi_text.db,MultiText,Main_LahaiRoi_3_1_324_3,这个距离……我们需要爬到它身上去才能做到。,It's too far to hit from here. We'll have to climb onto it.,Khoảng cách này... chúng ta cần phải leo lên người nó mới làm được.
lang_multi_text.db,MultiText,Main_LahaiRoi_3_1_324_4,……跟我来！,Follow me!,...Đi theo tôi!
lang_multi_text.db,MultiText,Main_LahaiRoi_3_1_325_1,好混乱的频率……,Its frequency is scrambled.,Tần số hỗn loạn quá...
lang_multi_text.db,MultiText,Main_LahaiRoi_3_1_325_10,这学院生活也太精彩了。,This Academy life has sure been one hell of a trip.,Cuộc sống Học viện này thú vị quá đi mất.
lang_multi_text.db,MultiText,Main_LahaiRoi_3_1_325_2,跟紧我，我们得趁着它攻击的间隔靠近它！,Keep up! We gotta close the gap between attacks!,"Theo sát tôi, chúng ta phải tận dụng khoảng thời gian giữa các đợt tấn công của nó để tiếp cận!"
lang_multi_text.db,MultiText,Main_LahaiRoi_3_1_325_3,它要发动攻击了！注意隐蔽！,It's about to strike! Find cover!,Nó sắp tấn công rồi! Chú ý ẩn nấp!
lang_multi_text.db,MultiText,Main_LahaiRoi_3_1_325_4,跟紧我！,Stay close!,Theo sát tôi!
lang_multi_text.db,MultiText,Main_LahaiRoi_3_1_325_5,快，来这边！,"This way, hurry!","Nhanh, lối này!"
lang_multi_text.db,MultiText,Main_LahaiRoi_3_1_325_6,就是现在，我们上去！,Now! Start climbing!,"Chính là lúc này, chúng ta lên thôi!"
lang_multi_text.db,MultiText,Main_LahaiRoi_3_1_325_7,……哈哈。,Haha.,...Haha.
lang_multi_text.db,MultiText,Main_LahaiRoi_3_1_325_8,怎么了？,What's so funny?,Sao vậy?
lang_multi_text.db,MultiText,Main_LahaiRoi_3_1_325_9,只是觉得，没想到有一天，我还能往虚诞虫背上骑啊……,Nothing. Just didn't think I'd get to actually ride a Voidworm.,"Chỉ là cảm thấy, không ngờ có ngày mình lại cưỡi lên lưng Trùng Hư Không..."
lang_multi_text.db,MultiText,Main_LahaiRoi_3_1_326_1,首先是……姓名，直接填你的名字就好。,First up... Name. Just input it right there.,"Đầu tiên là... họ tên, cứ điền thẳng tên cậu vào là được."
lang_multi_text.db,MultiText,Main_LahaiRoi_3_1_326_10,因为你是中途入学嘛，所以很多东西还没来得及准备好，我之前也是这样的。,"Since you're joining mid-term, a lot of things aren't ready yet. That's what happened to me too.","Vì cậu nhập học giữa chừng mà, nên nhiều thứ chưa kịp chuẩn bị, trước đây tôi cũng vậy."
lang_multi_text.db,MultiText,Main_LahaiRoi_3_1_326_11,放心！这些之后都会有的。,Don't worry! Those will come later.,Yên tâm! Sau này sẽ có đủ cả thôi.
lang_multi_text.db,MultiText,Main_LahaiRoi_3_1_326_2,班级会自动分配，新入学的学生会先加入预科班……不过，你既然通过了适格者的测试，那一入学就会被分配进拉贝尔学部。,"Your class will be assigned automatically. New students usually start in the Preparatory Program, but since you passed the Synchronist Test, you'll be placed straight into the Rabelle College.","Lớp học sẽ được phân bổ tự động, học sinh mới nhập học sẽ vào lớp dự bị trước... Nhưng mà, vì cậu đã qua bài kiểm tra Thích Cách Giả, nên vừa nhập học sẽ được phân vào khoa Rabelle ngay."
lang_multi_text.db,MultiText,Main_LahaiRoi_3_1_326_3,然后是……联系地址，也就是家庭住址，或者监护人的地址。,Next... contact address. You can fill in your home or guardian's address.,"Tiếp theo là... địa chỉ liên lạc, tức là địa chỉ nhà, hoặc địa chỉ của người giám hộ."
lang_multi_text.db,MultiText,Main_LahaiRoi_3_1_326_4,今州边庭。,Jinzhou City Hall.,Biên Đình Kim Châu.
lang_multi_text.db,MultiText,Main_LahaiRoi_3_1_326_5,黑海岸。,The Black Shores.,Bờ Biển Đen.
lang_multi_text.db,MultiText,Main_LahaiRoi_3_1_326_6,列奥尼达酒店套房。,Leonidas Hotel.,Phòng Suite Khách sạn Leonidas.
lang_multi_text.db,MultiText,Main_LahaiRoi_3_1_326_7,天被地床，四海为家……,"Sky for roof, earth for bed. Home is wherever I roam.","Trời là màn đất là chiếu, bốn biển là nhà..."
lang_multi_text.db,MultiText,Main_LahaiRoi_3_1_326_8,填好了吗？接下来就是拍证件照了！,All set? Then it's time to take your ID photo!,Điền xong chưa? Tiếp theo là chụp ảnh thẻ!
lang_multi_text.db,MultiText,Main_LahaiRoi_3_1_326_9,不需要穿校服吗？,Do I need a school uniform?,Không cần mặc đồng phục sao?
lang_multi_text.db,MultiText,Main_LahaiRoi_3_1_328_1,有什么能帮你的？,Hello there. Can I help you with something?,Có chuyện gì cần giúp không?
lang_multi_text.db,MultiText,Main_LahaiRoi_3_1_328_10,对了，这是她的房号。,"By the way, here's her room number.","Đúng rồi, đây là số phòng của cô ấy."
lang_multi_text.db,MultiText,Main_LahaiRoi_3_1_328_11,多谢。,Thank you.,Cảm ơn.
lang_multi_text.db,MultiText,Main_LahaiRoi_3_1_328_2,你好，我来找琳奈同学。,"Hi, I'm here to see Lynae.","Chào bạn, tôi đến tìm bạn Lynae."
lang_multi_text.db,MultiText,Main_LahaiRoi_3_1_328_3,琳奈……她现在不在宿舍，需要我帮你留言吗？,Miss Lynae? She's not in the dorm right now. Would you like to leave a message?,"Lynae... cô ấy hiện không có ở ký túc xá, cậu có cần tôi nhắn lại gì không?"
lang_multi_text.db,MultiText,Main_LahaiRoi_3_1_328_4,嗯？等等，你是{PlayerName}吗？,Wait... are you {PlayerName}?,"Hả? Khoan đã, cậu là {PlayerName} phải không?"
lang_multi_text.db,MultiText,Main_LahaiRoi_3_1_328_5,我是。,Yes.,Là tôi.
lang_multi_text.db,MultiText,Main_LahaiRoi_3_1_328_6,琳奈同学离开前嘱咐过……如果你来找她，就请你先去宿舍里等她。,"Miss Lynae asked me to tell you that if you're coming to see her, just wait in her room.",Trước khi đi bạn Lynae có dặn... nếu cậu đến tìm thì cứ vào phòng đợi cô ấy.
lang_multi_text.db,MultiText,Main_LahaiRoi_3_1_328_7,她去哪儿了？,Do you know where she is?,Cô ấy đi đâu vậy?
lang_multi_text.db,MultiText,Main_LahaiRoi_3_1_328_8,这个就不太清楚了……似乎是接到了学院的临时通知，她离开的时候没有多说什么。,Not really... She got a sudden notice from the Academy and left without saying much.,"Cái này thì tôi không rõ lắm... hình như nhận được thông báo đột xuất của Học viện, lúc đi cô ấy không nói gì nhiều."
lang_multi_text.db,MultiText,Main_LahaiRoi_3_1_328_9,不过很少见到她那么低落的样子……不管发生了什么，都希望她能顺利。,"It's rare to see her so down. Whatever's going on, I hope it works out for her.",Nhưng hiếm khi thấy cô ấy ủ rũ như vậy... dù có chuyện gì xảy ra thì cũng mong cô ấy thuận lợi.
lang_multi_text.db,MultiText,Main_LahaiRoi_3_1_329_1,发生什么了？,What happened?,Có chuyện gì vậy?
lang_multi_text.db,MultiText,Main_LahaiRoi_3_1_329_2,等等……防壁，出故障了！,Wait... the barrier! It's failing!,"Khoan đã... tường chắn, bị hỏng rồi!"
lang_multi_text.db,MultiText,Main_LahaiRoi_3_1_329_3,不要靠近那里，快撤退！,Don't get any closer! Get back!,"Đừng lại gần đó, mau rút lui!"
lang_multi_text.db,MultiText,Main_LahaiRoi_3_1_329_4,快走！,Go! Now!,Mau đi đi!
lang_multi_text.db,MultiText,Main_LahaiRoi_3_1_329_5,我们走。,Let's go.,Chúng ta đi.
lang_multi_text.db,MultiText,Main_LahaiRoi_3_1_329_6,……嗯！,Mm!,...Ừ!
lang_multi_text.db,MultiText,Main_LahaiRoi_3_1_329_7,警告。虚质防壁没有完全开启。,Warning: Voidmatter Barrier not fully activated.,Cảnh báo. Tường chắn Hư Chất chưa được mở hoàn toàn.
lang_multi_text.db,MultiText,Main_LahaiRoi_3_1_32_1,莫宁教授你总算……,Professor Mornye! What a relief to see you—,"Giáo sư Mornye, cuối cùng cô cũng..."
lang_multi_text.db,MultiText,Main_LahaiRoi_3_1_32_10,我支持继续按原流程推进。,I'm inclined to proceed with the original plan.,Tôi ủng hộ việc tiếp tục tiến hành theo quy trình ban đầu.
lang_multi_text.db,MultiText,Main_LahaiRoi_3_1_32_11,之前的演习结果不好，我理解安瑟姆教授的担忧。稍后我会去浮光林同秘日六席再确认一次参数。,"But given the unsatisfying results from the last simulation, I understand Professor Anslem's concerns. I'll go to Bjartr Woods to consult with the Heliodic Six and reverify the parameters.","Kết quả diễn tập trước đó không tốt, tôi hiểu nỗi lo lắng của Giáo sư Anslem. Lát nữa tôi sẽ đến Rừng Bjartr cùng Lục Tịch Bí Nhật xác nhận lại thông số một lần nữa."
lang_multi_text.db,MultiText,Main_LahaiRoi_3_1_32_12,现在最重要的，是确保研究院在新日升空时能够及时对炉芯数据进行测算和校准。,What matters now is ensuring that the Institute can calculate and calibrate the Reactor Drive's data in time for the launch of the new sun.,Điều quan trọng nhất bây giờ là đảm bảo Viện Nghiên Cứu có thể kịp thời tính toán và hiệu chỉnh dữ liệu Lò Phản Ứng khi mặt trời mới mọc lên.
lang_multi_text.db,MultiText,Main_LahaiRoi_3_1_32_13,我想，我们都无法否认<te href=700013>海维夏</te>在这其中的重要性，安瑟姆教授，你应该对我们的成果更有信心一些。,"We all know the importance of <te href=700013>Hyvatia</te> in this process, and I sincerely hope you'll place more trust in it, Anslem.","Tôi nghĩ chúng ta đều không thể phủ nhận tầm quan trọng của <te href=700013>Hyvatia</te> trong việc này, Giáo sư Anslem, ông nên có thêm chút niềm tin vào thành quả của chúng ta chứ."
lang_multi_text.db,MultiText,Main_LahaiRoi_3_1_32_14,这是深空联合的心血，也是罗伊人的心血，是拉海洛的未来。我理解你作为研究者的谨慎和骄傲，但请不要再困在过去的失败中了。,"This is a shared achievement between the Collective and the Roya, the very future of Lahai-Roi. I respect your caution and the pride you take in your work. But please, don't let past failures hold you back now.","Đây là tâm huyết của Liên Hợp Không Gian, cũng là tâm huyết của người Roya, là tương lai của Lahai-Roi. Tôi hiểu sự thận trọng và kiêu hãnh của ông với tư cách là một nhà nghiên cứu, nhưng xin đừng mãi mắc kẹt trong những thất bại quá khứ nữa."
lang_multi_text.db,MultiText,Main_LahaiRoi_3_1_32_15,哼，冠冕堂皇……别怪我没提醒过你。,"Hmph, fine words… Just don't forget that I warned you.","Hừ, nói hay lắm... Đừng trách tôi không báo trước đấy."
lang_multi_text.db,MultiText,Main_LahaiRoi_3_1_32_16,你跟随莫宁来到人工太阳车间，两名研究员正在争执，魏尔伦主张依照罗伊人推算的发射窗口推进“换日仪式”，而安瑟姆教授则对罗伊人的推算表达不信任。莫宁开口调解，支持按原计划推进，魏尔伦表示现在最重要的是确保探测器“海维夏”在换日计划中的测算，安瑟姆留下警告后不快地离开。,"In the Artificial Sun Lab, Researchers Warren and Anslem are in a heated dispute. Warren supports following the Roya's predicted launch window for the New Solar Ceremony, while Anslem refuses to trust their calculations. Mornye mediates, siding with the original plan. Warren stresses that the Hyvatia Detector's measurements are critical, and Anslem leaves after issuing a warning.","Bạn đi theo Mornye đến xưởng mặt trời nhân tạo, hai nghiên cứu viên đang tranh cãi. Warren chủ trương đẩy nhanh ""Nghi Thức Đổi Mặt Trời"" theo khung giờ phóng mà người Roya tính toán, còn Giáo sư Anslem lại tỏ ra không tin tưởng vào sự tính toán của người Roya. Mornye lên tiếng hòa giải, ủng hộ việc tiến hành theo kế hoạch ban đầu, Warren cho biết điều quan trọng nhất hiện tại là đảm bảo máy dò ""Hyvatia"" tính toán chuẩn xác trong kế hoạch đổi mặt trời, Anslem để lại lời cảnh báo rồi bực bội bỏ đi."
lang_multi_text.db,MultiText,Main_LahaiRoi_3_1_32_2,其实……,Actually—,Thực ra...
lang_multi_text.db,MultiText,Main_LahaiRoi_3_1_32_3,好吧……,Well then...,Được rồi...
lang_multi_text.db,MultiText,Main_LahaiRoi_3_1_32_4,安瑟姆教授，我理解你的心情。,"I appreciate your perspective, Professor Anslem.","Giáo sư Anslem, tôi hiểu tâm trạng của ông."
lang_multi_text.db,MultiText,Main_LahaiRoi_3_1_32_5,但下次窗口期对我们来说是绝佳的机会，根据罗伊人的推算，数十年内都不会再有这么契合的发射窗口了。,"But according to Royan calculations, this launch window is the best we've had in decades.","Nhưng khung giờ phóng lần sau là cơ hội tuyệt vời cho chúng ta, theo tính toán của người Roya, trong vài thập kỷ tới sẽ không còn khung giờ phóng nào phù hợp như vậy nữa đâu."
lang_multi_text.db,MultiText,Main_LahaiRoi_3_1_32_6,魏尔伦，你怎么能保证那些令人费解的符文就一定能推算出最佳的时期？他们甚至没有给出推断过程，这可是我们的演算机都没法涉足的混沌系统！,"How can you be so certain, Warren? Their ""optimal window"" is derived from those indecipherable runes, with no methodology disclosed. Even our most advanced computational systems have failed to decipher their process!","Warren, sao cậu có thể đảm bảo những ký tự khó hiểu đó chắc chắn tính ra được thời điểm tốt nhất? Họ thậm chí còn không đưa ra quá trình suy luận, đây là hệ thống hỗn loạn mà ngay cả máy tính của chúng ta cũng không thể can thiệp được!"
lang_multi_text.db,MultiText,Main_LahaiRoi_3_1_32_7,安瑟姆教授，罗伊人始终是我们的合作伙伴。,"The Roya are our partners, Professor.","Giáo sư Anslem, người Roya luôn là đối tác hợp tác của chúng ta."
lang_multi_text.db,MultiText,Main_LahaiRoi_3_1_32_8,他们的推算能力毋庸置疑，我们能做的，就是做好本职工作，确保换日仪式顺利进行。,Their calculations are unquestionable. All we can do is uphold our side of the bargain and make sure the New Solar Ceremony goes off without a hitch.,"Khả năng tính toán của họ là không thể nghi ngờ, điều chúng ta có thể làm là hoàn thành tốt công việc của mình, đảm bảo Nghi Thức Đổi Mặt Trời diễn ra suôn sẻ."
lang_multi_text.db,MultiText,Main_LahaiRoi_3_1_32_9,呼……既然如此，我们来听听第三人的意见吧？,Well then... I believe counsel from a third person may serve us well at this point.,"Phù... đã như vậy, chúng ta hãy nghe ý kiến của người thứ ba xem sao?"
lang_multi_text.db,MultiText,Main_LahaiRoi_3_1_3302_1,巨大的培养仓中种植着许多你在地表未曾见过的古老植物，地下空洞中曾鲜有生命，直至炉心于此点亮，深空联合在求索前行的过程中，也仍不忘拾起罗伊冰原之下沉睡的种子。,"Massive cultivation tanks house many ancient plant species you've never seen on the surface. Life was once scarce in these underground caverns, until the Reactor Drive ignited here. In its relentless pursuit of progress, the Spacetrek Collective did not forget to retrieve the dormant seeds that slept beneath the Roya Frostlands.","Trong những lồng nuôi cấy khổng lồ là rất nhiều loài thực vật cổ xưa mà bạn chưa từng thấy trên mặt đất. Trong hang động ngầm dưới lòng đất từng hiếm có sự sống, cho đến khi Lò Phản Ứng được thắp sáng tại đây. Trong quá trình tìm tòi tiến về phía trước, Liên Hợp Không Gian cũng không quên nhặt lại những hạt giống đang ngủ say dưới Băng Nguyên Roya."
lang_multi_text.db,MultiText,Main_LahaiRoi_3_1_3302_2,“从一滴水、一粒种子、一束炬火开始，生命自会找到出路。”,"""From a single drop of water, a single seed, a single torch... life will find its way.""","""Bắt đầu từ một giọt nước, một hạt giống, một ngọn đuốc, sự sống sẽ tự tìm thấy lối ra."""
lang_multi_text.db,MultiText,Main_LahaiRoi_3_1_331_1,……呜啊，小心！,"Whoa, watch out!","...Oái, cẩn thận!"
lang_multi_text.db,MultiText,Main_LahaiRoi_3_1_332_1,呼，有惊无险……不过这个路况得报告学院才行。,Phew... That was a close call. I'd better report that mess back to the Academy.,"Phù, hú hồn... nhưng tình trạng đường xá thế này phải báo cáo Học viện mới được."
