db_file,table_name,id,zh,en,vi
lang_multi_text.db,MultiText,HuanglongM1_1_11_24,今令尹什么时候才能回来？,When will the Magistrate return?,Khi nào Lệnh Doãn mới trở về?
lang_multi_text.db,MultiText,HuanglongM1_1_11_25,我还有其他疑问。,I still have other questions.,Tôi còn thắc mắc khác.
lang_multi_text.db,MultiText,HuanglongM1_1_11_26,令尹原名「汐」，因就任令尹，自此更名为今汐。,Our Magistrate's birth name was Hsi. She took on the name Jinhsi when she became the Magistrate of Jinzhou.,"Lệnh Doãn vốn tên ""Tịch"", vì nhậm chức Lệnh Doãn nên đổi tên thành Jinhsi."
lang_multi_text.db,MultiText,HuanglongM1_1_11_27,当然，平时他人多以官称称呼令尹大人。,"Nowadays, she is usually addressed as ""Madam Magistrate.""","Tất nhiên, bình thường mọi người đều gọi bà ấy bằng quan xưng ""Lệnh Doãn đại nhân""."
lang_multi_text.db,MultiText,HuanglongM1_1_11_28,令尹有「龙女」之称，是因与岁主「角」共鸣之故。,"She is also known as the ""Loong Maiden"", because of her Resonance connection with our Sentinel, ""Jué"", who manifests in the shape of a <ano=Dragon>Loong</ano>.","Lệnh Doãn có danh xưng ""Long Nữ"", là bởi đã cộng hưởng với Tuế Chủ ""Giác""."
lang_multi_text.db,MultiText,HuanglongM1_1_11_29,据我所知，岁主与令尹的相处之道各有所异，而今州岁主与令尹的关系类似亲长。,"The ways Huanglong's Magistrates interact with their corresponding Sentinels can differ. In Jinzhou, our Magistrate seems to share a familial bond with the Sentinel.","Theo tôi được biết, cách Tuế Chủ và Lệnh Doãn tương xử ở mỗi nơi đều khác nhau, còn Tuế Chủ Kim Châu với Lệnh Doãn có mối quan hệ tựa như bậc trưởng bối trong gia đình."
lang_multi_text.db,MultiText,HuanglongM1_1_11_3,我想问问有关今令尹的事。,I have questions about the Magistrate.,Tôi muốn hỏi về Lệnh Doãn.
lang_multi_text.db,MultiText,HuanglongM1_1_11_31,这些……也只是我从令尹平日所透露的信息中推断而出，我见过岁主的次数，也寥寥可数。,Though... This is what I understand from what she has told me. I have only seen our Sentinel a handful of times.,"Những điều này... cũng chỉ là tôi suy luận từ những gì Lệnh Doãn tiết lộ hàng ngày thôi, số lần tôi gặp Tuế Chủ cũng chỉ đếm trên đầu ngón tay."
lang_multi_text.db,MultiText,HuanglongM1_1_11_32,这个问题的答案，不仅关乎令尹。,"It depends on Madam Magistrate, and...","Câu trả lời cho vấn đề này, không chỉ liên quan đến Lệnh Doãn."
lang_multi_text.db,MultiText,HuanglongM1_1_11_33,关于信物，您想了解什么？,With pleasure. What do you wish to know about the tokens?,"Về tín vật, Ngài muốn tìm hiểu điều gì?"
lang_multi_text.db,MultiText,HuanglongM1_1_11_35,我要怎么调查信物？,How should I make use of the tokens?,Tôi nên điều tra tín vật như thế nào?
lang_multi_text.db,MultiText,HuanglongM1_1_11_36,我可以不调查信物吗？,Can I not investigate the tokens?,Tôi có thể không điều tra tín vật được không?
lang_multi_text.db,MultiText,HuanglongM1_1_11_37,我还有其他疑问。,I still have other questions.,Tôi còn thắc mắc khác.
lang_multi_text.db,MultiText,HuanglongM1_1_11_39,它们所蕴含的讯息与它们的来源有关。,I suggest looking into where these tokens come from.,Thông tin chúng chứa đựng có liên quan đến nguồn gốc của chúng.
lang_multi_text.db,MultiText,HuanglongM1_1_11_4,我想问问有关信物的事。,I have questions about the tokens.,Tôi muốn hỏi về chuyện liên quan đến tín vật.
lang_multi_text.db,MultiText,HuanglongM1_1_11_40,了解其来源，与所指向的地点或是事件，您想要提前了解的，令尹想要传达给您的话语或许就在那之中。,"Examine their locations of origin, and explore the sites or past events they represent... Then you should uncover the message Madam Magistrate wanted to convey, and hopefully learn everything you want to know.","Tìm hiểu nguồn gốc, cùng với địa điểm hoặc sự kiện mà chúng chỉ đến, những điều Ngài muốn biết trước, lời mà Lệnh Doãn muốn truyền đạt cho Ngài có lẽ nằm trong đó."
lang_multi_text.db,MultiText,HuanglongM1_1_11_41,当然可以，若您认为这并非您现在想做的事……,Of course. It is fully up to you.,"Đương nhiên được, nếu Ngài cho rằng đây không phải điều Ngài muốn làm lúc này..."
lang_multi_text.db,MultiText,HuanglongM1_1_11_42,好的，只要在我能够回答的范畴内。,"Of course. Please feel free to ask me anything, and I will answer to the best of my ability.","Vâng, miễn là nằm trong phạm vi tôi có thể trả lời."
lang_multi_text.db,MultiText,HuanglongM1_1_11_43,你见过我吗？,Have we met before?,Cô từng gặp tôi chưa?
lang_multi_text.db,MultiText,HuanglongM1_1_11_45,在边庭第一次会面之前，我从未见过您。,I'm afraid not. I have never seen you before.,"Trước lần gặp đầu tiên ở Biên Đình, tôi chưa từng gặp Ngài."
lang_multi_text.db,MultiText,HuanglongM1_1_11_46,如果见过您，我是不会忘记的。,"If I had, I would never forget you.","Nếu đã gặp Ngài, tôi sẽ không quên đâu."
lang_multi_text.db,MultiText,HuanglongM1_1_11_47,也关乎漂泊者您。,"It depends on your decision, Rover.","Mà còn liên quan đến chính Ngài, Lữ Khách."
lang_multi_text.db,MultiText,HuanglongM1_1_11_48,我只能言尽于此，抱歉。,Please pardon me. This is all I can say at the moment.,"Tôi chỉ có thể nói đến đây thôi, xin lỗi Ngài."
lang_multi_text.db,MultiText,HuanglongM1_1_11_49,另有「踏白」与「夜归」相对，虽隶属于夜归，其成员多以临时调配的志愿者或预备役军人为主，是为斥候。,"Additionally, there is a detachment unit called the Outriders, mostly made up of volunteers or reservists who serve as reconnaissance agents.","Ngoài ra còn có ""Đạp Bạch"" đối ứng với ""Dạ Quy"", tuy trực thuộc Dạ Quy nhưng thành viên chủ yếu là tình nguyện viên hoặc quân dự bị được điều phối tạm thời, đảm nhận vai trò trinh sát."
lang_multi_text.db,MultiText,HuanglongM1_1_11_5,我想问问有关你的事。,I have questions about you.,Tôi muốn hỏi về chuyện liên quan đến cô.
lang_multi_text.db,MultiText,HuanglongM1_1_11_50,……,...,...
lang_multi_text.db,MultiText,HuanglongM1_1_11_51,……于我而言，今州是最特殊的地方。,...Jinzhou holds a special place in my heart.,"...Đối với tôi, Kim Châu là nơi đặc biệt nhất."
lang_multi_text.db,MultiText,HuanglongM1_1_11_52,你从散华处有了解到了一些有关今州、今汐还有与信物相关的事情。,"You ask Sanhua about Jinzhou, Jinhsi, and the tokens.","Bạn đã tìm hiểu từ Sanhua một số chuyện liên quan đến Kim Châu, Jinhsi và tín vật."
lang_multi_text.db,MultiText,HuanglongM1_1_11_6,后会有期。,Nothing in particular.,Hẹn gặp lại.
lang_multi_text.db,MultiText,HuanglongM1_1_11_7,关于今州，您想知道……？,With pleasure. What do you wish to know about Jinzhou?,"Về Kim Châu, Ngài muốn biết...?"
lang_multi_text.db,MultiText,HuanglongM1_1_11_8,夜归是什么？,Who are the Midnight Rangers?,Dạ Quy là gì?
lang_multi_text.db,MultiText,HuanglongM1_1_12_1,漂泊者！,Rover!,Lữ Khách!
lang_multi_text.db,MultiText,HuanglongM1_1_12_10,……炽霞。,...Chixia.,...Chixia.
lang_multi_text.db,MultiText,HuanglongM1_1_12_11,陆续复苏的无音区、异常强大的残象、不在边庭的令尹……,"The increasing Tacet Fields, uncannily powerful Tacet Discords, and now, our Magistrate's absence...","Các Vùng Vô Thanh liên tục hồi phục, Tàn Tượng mạnh bất thường, Lệnh Doãn lại không có ở Biên Đình..."
lang_multi_text.db,MultiText,HuanglongM1_1_12_12,还有……神秘的漂泊者！,Plus... The mysterious Rover!,Còn có... Lữ Khách bí ẩn nữa!
lang_multi_text.db,MultiText,HuanglongM1_1_12_13,今州……,I'm afraid...,Kim Châu...
lang_multi_text.db,MultiText,HuanglongM1_1_12_14,或许将有异变。,Jinzhou might be in danger.,Có lẽ sắp có biến cố.
lang_multi_text.db,MultiText,HuanglongM1_1_12_15,不用担心。,There's no need to worry.,Không cần lo lắng đâu.
lang_multi_text.db,MultiText,HuanglongM1_1_12_16,不如想想今晚吃什么。,"Before that, what should we get for dinner?",Chi bằng nghĩ xem tối nay ăn gì đi.
lang_multi_text.db,MultiText,HuanglongM1_1_12_17,接下来做什么？,What should we do next?,Tiếp theo làm gì bây giờ?
lang_multi_text.db,MultiText,HuanglongM1_1_12_18,哎，边庭、军策府和研究院统统上报了一遍了，现在能做的都做了。,"Well, we've reported to the City Hall, the Ministry of War, AND the Academy. We've done everything we can.","Ây, Biên Đình, Quân Sách Phủ và Nghiên Cứu Viện đều đã báo cáo hết rồi, giờ những gì làm được đều làm cả rồi."
lang_multi_text.db,MultiText,HuanglongM1_1_12_19,更何况，瑝珑诶，今州诶，这千百年间哪时候没点动荡的，都是大家一起挺过来的。,"I mean, this is Huanglong! And we're talking about Jinzhou, of all places! We've been through our fair share of unrest over the past thousand years, and we've made it together every time.","Huống chi, Hoàng Long nè, Kim Châu nè, ngàn năm nay có khi nào yên ổn hoàn toàn đâu, đều là mọi người cùng nhau vượt qua hết thôi."
lang_multi_text.db,MultiText,HuanglongM1_1_12_2,你去了好久，怎么，令尹大人是个小话痨吗？,It took you so long. What gives? Was our Magistrate a chatterbox?,"Cậu đi lâu quá, sao thế, Lệnh Doãn đại nhân hay chuyện lắm hả?"
lang_multi_text.db,MultiText,HuanglongM1_1_12_20,残象潮年年来涌，且——天塌下不还有一高个子夜归将军顶着，地陷了还有令尹岁主镇着呢！更何况我们也不是吃干饭的。,"There's been TD outbreaks every year, but we can always trust General Jiyan, Madam Magistrate, and our Sentinel to have our backs! We're not ones to mess with.","Triều Tàn Tượng năm nào chẳng ập đến, với lại - trời sập còn có tướng quân Dạ Quy cao lớn chống đỡ, đất lở còn có Lệnh Doãn và Tuế Chủ trấn giữ! Huống chi bọn mình cũng đâu phải hạng tay mơ."
lang_multi_text.db,MultiText,HuanglongM1_1_12_21,咽喉关口，众志成城，一人当关，万夫莫开，炽霞说得对。,"""United we stand, a bastion of might; one equals a legion, invulnerable in fight""... Well said, Chixia.","Yết hầu quan ải, chúng chí thành thành, một người giữ ải, vạn người khó phá. Chixia nói đúng."
lang_multi_text.db,MultiText,HuanglongM1_1_12_22,是啊是啊，漂泊者说得对，边庭、军策府和研究院统统上报了一遍了，现在能做的都做了。,"Yeah! We've reported to the City Hall, the Ministry of War, AND the Academy. We've done everything we can so far.","Đúng rồi đúng rồi, Lữ Khách nói phải, Biên Đình, Quân Sách Phủ và Nghiên Cứu Viện đều đã báo cáo hết rồi, giờ những gì làm được đều làm cả rồi."
lang_multi_text.db,MultiText,HuanglongM1_1_12_23,更何况瑝珑今州，今州诶，这千百年间哪时候整个太平的，残象潮年年来涌，都是大家一起挺过来的。,"I mean, this is Huanglong! And we're talking about Jinzhou of all places. It's never actually been safe here over the past thousands of years. We made it through all those TD outbreaks anyway.","Huống chi Hoàng Long Kim Châu, Kim Châu nè, ngàn năm nay có khi nào hoàn toàn thái bình đâu, triều Tàn Tượng năm nào cũng ập đến, đều là mọi người cùng nhau vượt qua cả thôi."
lang_multi_text.db,MultiText,HuanglongM1_1_12_24,且——天塌下来有高个子夜归将军忌炎顶着，地陷了还有令尹岁主镇着呢！更何况我们也不是吃干饭的。,"We can always trust General Jiyan, Madam Magistrate, and our Sentinel to have our backs! We're not ones to mess with.","Với lại - trời sập còn có tướng quân Dạ Quy Jiyan cao lớn chống đỡ, đất lở còn có Lệnh Doãn và Tuế Chủ trấn giữ! Huống chi bọn mình cũng đâu phải hạng tay mơ."
lang_multi_text.db,MultiText,HuanglongM1_1_12_25,炽霞说得是。,Well said.,Chixia nói có lý.
lang_multi_text.db,MultiText,HuanglongM1_1_12_26,漂泊者倒是实际！,Aren't you the practical type!,Lữ Khách thiết thực quá ha!
lang_multi_text.db,MultiText,HuanglongM1_1_12_27,油辣豆腐、今州冒菜、辛香肉片……饿了饿了。是不是还得去找白芷来着？,"I'd love me some Chili Sauce Tofu, Jinzhou Maocai, Spicy Meat Slices... Ugh, I'm starving. Wait a sec, we still need to meet up with Baizhi first, right?","Đậu hũ dầu ớt, mạo thái Kim Châu, thịt thái cay thơm... Đói quá đói quá. À mà còn phải đi tìm Baizhi nữa đúng không?"
lang_multi_text.db,MultiText,HuanglongM1_1_12_28,三日为期，信物相托，可以先行寻找指向的信息……,"So Madam Magistrate is meeting you in three days, and she left these tokens for you, said you can look into what they represent while she is away...","Hẹn ba ngày, giao tín vật, có thể tìm hiểu trước thông tin mà chúng chỉ dẫn..."
lang_multi_text.db,MultiText,HuanglongM1_1_12_29,那这三天里，漂泊者有什么打算吗？,"Do you have any plans, Rover?","Vậy trong ba ngày này, Lữ Khách có dự định gì không?"
lang_multi_text.db,MultiText,HuanglongM1_1_12_3,简单地向炽霞、秧秧说明了会面的谈话内容。,You told Chixia and Yangyang about your conversation with Sanhua.,Đã tóm tắt nội dung cuộc gặp cho Chixia và Yangyang.
lang_multi_text.db,MultiText,HuanglongM1_1_12_30,闲着也是闲着。,I don't think there's much for me to do.,Rảnh rỗi cũng chẳng biết làm gì.
lang_multi_text.db,MultiText,HuanglongM1_1_12_31,先看看信物指向的信息吧。,Let's investigate the items.,Xem thử thông tin mà tín vật chỉ dẫn trước đã.
lang_multi_text.db,MultiText,HuanglongM1_1_12_32,放三天假不好吗。,That's a three-day vacation in my books.,Nghỉ ba ngày không tốt sao.
lang_multi_text.db,MultiText,HuanglongM1_1_12_33,说的也是，三日为期，三天假期！,Fair point. A three-day vacation it is!,"Nói cũng đúng, hẹn ba ngày, nghỉ ba ngày!"
lang_multi_text.db,MultiText,HuanglongM1_1_12_34,先逛逛城里，管他什么信物信息，有缘遇到就解，无缘就再见。,Let's just go chill out then! We'll figure out the tokens when we have the chance.,"Đi dạo trong thành trước đã, mặc kệ tín vật thông tin gì, có duyên gặp thì giải, không duyên thì thôi."
lang_multi_text.db,MultiText,HuanglongM1_1_12_35,信物传情……啊，好像也不怎么恰当？总觉得有种秘密约会的感觉。令尹葫芦里到底卖的什么药哦？,"Ooh, reminds me of the tokens of love in those stories... It sounds like you're off to a secret date or something. What is our Magistrate planning to do with these token puzzles?","Tín vật truyền tình... à, hình như cũng không hợp lắm nhỉ? Sao cứ có cảm giác hẹn hò bí mật ấy. Lệnh Doãn rốt cuộc đang toan tính gì vậy?"
lang_multi_text.db,MultiText,HuanglongM1_1_12_36,可能是“一点通”吧。,Maybe she is looking for a soulmate.,"Có lẽ là ""tâm đầu ý hợp"" chăng."
lang_multi_text.db,MultiText,HuanglongM1_1_12_37,我没有头绪。,I have no idea.,Tôi không có manh mối gì cả.
lang_multi_text.db,MultiText,HuanglongM1_1_12_38,什么意思？,A soulmate? Hmm...,Ý là sao?
lang_multi_text.db,MultiText,HuanglongM1_1_12_39,……心有灵犀，令尹是笃定，那位重要的客人可以读懂隐藏的信号……,So Madam Magistrate left some hidden clues in her tokens. Clues that only the right person would be able to decipher...,"...Tâm có linh tê, Lệnh Doãn chắc chắn rằng vị khách quan trọng kia có thể đọc được tín hiệu ẩn giấu..."
lang_multi_text.db,MultiText,HuanglongM1_1_12_4,令尹不在边庭之内吗……,So Madam Magistrate's not in the City Hall...,Lệnh Doãn không ở trong Biên Đình sao...
lang_multi_text.db,MultiText,HuanglongM1_1_12_40,可是，明明知道漂泊者失忆了……还是，令尹想让客人注意些什么？,"But Rover has lost all memories, and would likely forget any kind of decryption method they agreed on. It doesn't quite make sense. Or maybe... She is trying to make Rover notice something else?","Nhưng mà, rõ ràng biết Lữ Khách đã mất trí nhớ rồi... hay là, Lệnh Doãn muốn vị khách chú ý đến điều gì đó?"
lang_multi_text.db,MultiText,HuanglongM1_1_12_41,我们可以看一下令尹交给你的信物吗？,"Rover, do you mind if we have a look at the tokens?",Chúng tôi có thể xem tín vật mà Lệnh Doãn giao cho cậu được không?
lang_multi_text.db,MultiText,HuanglongM1_1_12_42,向秧秧和炽霞展示了下获得的信物。,You showed Yangyang and Chixia the tokens.,Đã cho Yangyang và Chixia xem những tín vật nhận được.
lang_multi_text.db,MultiText,HuanglongM1_1_12_43,都是些小玩意？看不出有什么特别的啊？,"So, what's so special about them?",Toàn đồ lặt vặt thôi mà? Chẳng thấy có gì đặc biệt cả?
lang_multi_text.db,MultiText,HuanglongM1_1_12_44,（拿起糖果。）,(Take the candy.),(Cầm viên kẹo lên.)
lang_multi_text.db,MultiText,HuanglongM1_1_12_45,（拿起小型装置。）,(Take the small device.),(Cầm thiết bị nhỏ lên.)
lang_multi_text.db,MultiText,HuanglongM1_1_12_46,（拿起树叶。）,(Take the leaf.),(Cầm chiếc lá lên.)
lang_multi_text.db,MultiText,HuanglongM1_1_12_47,（拿起黑色果实。）,(Take the black fruit.),(Cầm quả đen lên.)
lang_multi_text.db,MultiText,HuanglongM1_1_12_48,（并不行动。）,(Take out.),(Không hành động.)
lang_multi_text.db,MultiText,HuanglongM1_1_12_49,圆圆的，我有印象！我小时候吃过这种糖果，应该叫糖丸？,A candy? Oh! I've had these when I was a kid. I think they were called... Sugar pearls?,"Tròn tròn, tôi có ấn tượng! Hồi nhỏ tôi từng ăn loại kẹo này, hình như gọi là đường hoàn?"
lang_multi_text.db,MultiText,HuanglongM1_1_12_5,……,...,...
lang_multi_text.db,MultiText,HuanglongM1_1_12_50,不过好像现在没再见着这种模样的糖果了吧……是不时兴了吗？,But I haven't seen anything like this in a while... Went out of trend maybe?,Nhưng hình như bây giờ không thấy loại kẹo kiểu này nữa rồi nhỉ... Hết thời rồi sao?
lang_multi_text.db,MultiText,HuanglongM1_1_12_51,是小时候的记忆呢。还记得，糖果很甜。,It reminds me of my childhood. I still remember the taste. It was so sweet.,"Là ký ức thời nhỏ đấy. Vẫn còn nhớ, kẹo rất ngọt."
lang_multi_text.db,MultiText,HuanglongM1_1_12_52,小时候我特别害怕打针，有几次打完针，护士姐姐就会奖励一颗这样的糖果。,"I was really scared of getting my flu shots when I was little, and sometimes the nurse lady would hand out candies like this as a prize for being good.","Hồi nhỏ tôi đặc biệt sợ tiêm, có mấy lần tiêm xong, chị y tá sẽ thưởng một viên kẹo như thế này."
lang_multi_text.db,MultiText,HuanglongM1_1_12_53,但是糖果……又有什么含义呢？,But... What does it mean as a token?,Nhưng kẹo... thì có ý nghĩa gì nhỉ?
lang_multi_text.db,MultiText,HuanglongM1_1_12_54,这看起来像是一个……小型日晷？,It seems like... a miniature sundial.,Cái này trông giống một... đồng hồ mặt trời thu nhỏ?
lang_multi_text.db,MultiText,HuanglongM1_1_12_55,那是什么？,A sundial?,Đó là cái gì?
lang_multi_text.db,MultiText,HuanglongM1_1_12_56,嗯。,I believe so.,Ừm.
lang_multi_text.db,MultiText,HuanglongM1_1_12_57,是一种利用太阳的投影方向来测定时刻的计时仪器。,It is a horological device that tells time by using sunlight's direction.,Là một loại dụng cụ đo thời gian dựa vào hướng chiếu của bóng mặt trời để xác định giờ giấc.
lang_multi_text.db,MultiText,HuanglongM1_1_12_58,一般来说，晷面上标记的刻度为十二时辰，显示节气和月份。但这个日晷的晷面却有点特别。,"Sundials in Huanglong usually have marked lines for the twelve <ano=Time Periods>Shichens</ano> in a day, and every Shichen is 2 hours long, with some showing seasons or months. The design of this sundial looks a bit unusual, though...","Thông thường, mặt đồng hồ sẽ khắc vạch chia thành mười hai thời thần, hiển thị tiết khí và tháng. Nhưng mặt chiếu của đồng hồ mặt trời này lại hơi đặc biệt."
lang_multi_text.db,MultiText,HuanglongM1_1_12_59,晷面外圈显示的……应当是以十二地支划分十二时辰的时间刻度。,"On this sundial... Time seems to be represented by the twelve Earthly Branches, drawn on the outer ring of its surface.",Vòng ngoài mặt chiếu hiển thị... có lẽ là thang thời gian chia mười hai thời thần theo Thập Nhị Địa Chi.
lang_multi_text.db,MultiText,HuanglongM1_1_12_6,怎么了？,What's going on?,Sao vậy?
lang_multi_text.db,MultiText,HuanglongM1_1_12_60,里圈似乎是以四神兽为方位指向，《三辅黄图》记载：“苍龙、白虎、朱雀、玄武，天之四灵，以正四方，王者制宫阙殿阁取法焉。”,"And its inner ring shows the ""Four Symbols"", each representing one cardinal direction. These are the four famous auspicious beasts in Huanglong's folklore. They are believed to protect people from all four directions under heaven.","Vòng trong dường như lấy Tứ Thần Thú làm chỉ hướng phương vị. ""Tam Phụ Hoàng Đồ"" có ghi: ""Thanh Long, Bạch Hổ, Chu Tước, Huyền Vũ, là tứ linh của trời, dùng để chính bốn phương, bậc vương giả xây cung khuyết điện các đều theo phép ấy."""
lang_multi_text.db,MultiText,HuanglongM1_1_12_61,一般来说，青龙代表<color=Highlight>东方</color>，白虎代表<color=Highlight>西方</color>，朱雀代表<color=Highlight>南方</color> ，玄武代表<color=Highlight>北方</color> 。,"Generally, The Teal Loong represents the <color=Highlight>East</color>, the White Tiger stands for the <color=Highlight>West</color>, the Vermilion Bird stands for the <color=Highlight>South</color>, and finally, we have the Black Tortoise for the <color=Highlight>North</color>.","Thông thường, Thanh Long đại diện cho <color=Highlight>phương Đông</color>, Bạch Hổ đại diện cho <color=Highlight>phương Tây</color>, Chu Tước đại diện cho <color=Highlight>phương Nam</color>, Huyền Vũ đại diện cho <color=Highlight>phương Bắc</color>."
lang_multi_text.db,MultiText,HuanglongM1_1_12_62,时间和方位吗？但日晷显示的时间是根据真实的时间变化的……且在没有太阳光光源的情况下，日晷将毫无用处。,"It seems this sundial is supposed to show both time and direction, but how could it work when there is not a compass attached? Not to mention the lack of sunlight basically renders it useless...","Thời gian và phương vị sao? Nhưng thời gian đồng hồ mặt trời hiển thị biến đổi theo thời gian thực... và trong điều kiện không có nguồn ánh sáng mặt trời, đồng hồ mặt trời sẽ hoàn toàn vô dụng."
lang_multi_text.db,MultiText,HuanglongM1_1_12_63,哇，听起来就很复杂的样子……,Ugh. That requires way too much brain power...,"Waa, nghe có vẻ phức tạp quá đi..."
lang_multi_text.db,MultiText,HuanglongM1_1_12_64,这个树叶的颜色有点特别哦。但看不出来是什么树啊。,The color of this leaf seems a bit odd. Can't tell what tree it is.,Màu chiếc lá này hơi đặc biệt đấy. Nhưng không nhận ra là lá cây gì.
lang_multi_text.db,MultiText,HuanglongM1_1_12_65,我似乎在它上面感知到一些……,I think... I can feel something from it...,Tôi dường như cảm nhận được điều gì đó trên nó...
lang_multi_text.db,MultiText,HuanglongM1_1_12_66,唔……不，没有什么。只是一些很微弱的感知，微弱到像是我的错觉……也许真的是错觉吧。,Hmm... Nevermind. It's too faint. Maybe it was just my imagination...,"Ừm... không, không có gì. Chỉ là cảm nhận rất mờ nhạt, mờ nhạt đến mức như là ảo giác... có lẽ thật sự chỉ là ảo giác thôi."
lang_multi_text.db,MultiText,HuanglongM1_1_12_67,我也看不出这是什么品种树木的叶子，抱歉。,"Sorry. I can't tell what kind of tree this leaf belongs to, either.","Tôi cũng không nhận ra đây là lá của loại cây gì, xin lỗi."
lang_multi_text.db,MultiText,HuanglongM1_1_12_68,这是……莽吉柿。,This is... A mangosteen fruit.,Đây là... măng cụt.
