db_file,table_name,id,zh,en,vi
lang_multi_text.db,MultiText,SidePLJCD_2_9,我们俩都觉得造路悬仪很像一个白白胖胖的大蘑菇，怎么看怎么可爱呢。,"To us, Route Constructors are like adorable, roly-poly white mushrooms. Don't you think?","Hai chị em đều thấy Tạo Lộ Huyền Nghi trông giống một cây nấm trắng mập mạp, nhìn kiểu gì cũng thấy dễ thương."
lang_multi_text.db,MultiText,SidePLJCD_3_1,哇，好厉害的车技！收集到了很棒的数据！,Whoa! That was incredible driving! I got some amazing data!,"Woa, kỹ thuật lái tuyệt vời quá! Thu thập được dữ liệu rất tốt!"
lang_multi_text.db,MultiText,SidePLJCD_4_1,哇，好厉害的车技！收集到了很棒的数据！,Whoa! That was incredible driving! I got some amazing data!,"Woa, kỹ thuật lái xe tuyệt vời quá! Thu thập được dữ liệu rất tốt!"
lang_multi_text.db,MultiText,SidePLJCD_4_10,（她怎么总是忘记说关键的事情。）,(Why does she always nearly forget to mention the important part…?),(Sao cô ấy lúc nào cũng quên nói chuyện quan trọng vậy.)
lang_multi_text.db,MultiText,SidePLJCD_4_11,深空测界台的悬台其实就运用了一部分技术，只不过那是有很多其它的装置作为辅助才能实现的。,"The Spacetrek Observatory's Suspension Platform uses some of this tech, but that needs a bunch of other devices supporting it to stay in the air.","Huyền đài của Đài Quan Trắc Thâm Không thực ra đã ứng dụng một phần công nghệ này, chỉ là nó cần rất nhiều thiết bị hỗ trợ khác mới thực hiện được."
lang_multi_text.db,MultiText,SidePLJCD_4_2,这道路还真是挺刺激的……,That was really intense...,Con đường này thật sự khá kích thích...
lang_multi_text.db,MultiText,SidePLJCD_4_3,嘿嘿，对吧？我和导师想尝试让造路悬仪能制造悬浮道路，甚至是大型悬浮平台！,"Hehe! I know, right? My advisor and I dream of building floating roads, even big floating platforms!","Hehe, đúng không? Tôi và thầy hướng dẫn muốn thử để Tạo Lộ Huyền Nghi có thể tạo ra đường lơ lửng, thậm chí là bệ nổi lớn!"
lang_multi_text.db,MultiText,SidePLJCD_4_4,这样不仅能让路网设计更自由，等有朝一日，我们前往隧门的另一侧，或许会需要在没有大地的宇宙中制造道路。,"It'd give route networks way more freedom. And one day, if we ever travel through the Stridergate… we might need to build roads in space where there’s no ground.","Như vậy không chỉ giúp thiết kế mạng lưới đường tự do hơn, mà một ngày nào đó, khi chúng ta đi qua phía bên kia Toại Môn, có lẽ sẽ cần tạo đường trong vũ trụ không có mặt đất."
lang_multi_text.db,MultiText,SidePLJCD_4_5,想只靠造路悬仪就实现悬空造物，还有很多问题要解决，目前连道路都无法按预期生成呢。,But we've got a ton of problems to solve before a Constructor can generate floating constructs. It still struggles with regular roads sometimes.,"Muốn chỉ dựa vào Tạo Lộ Huyền Nghi để tạo vật thể lơ lửng thì còn rất nhiều vấn đề cần giải quyết, hiện tại ngay cả đường đi cũng chưa thể tạo ra đúng như dự kiến."
lang_multi_text.db,MultiText,SidePLJCD_4_6,请让我再次感谢你的帮助，一会我就把收集到数据带回学院研究！,Let me thank you again! I'm heading back to the Academy to study this data!,"Cho tôi cảm ơn cậu lần nữa, lát nữa tôi sẽ mang dữ liệu thu thập được về Học viện nghiên cứu!"
