db_file,table_name,id,zh,en,vi
lang_multi_text.db,MultiText,MapMark_311015_MarkDesc,藏于山岩中或地下的隐秘之所，似乎通往了未知的某处……,"A concealed passage in the rocks or underground, leading to an unknown destination...","Nơi bí ẩn ẩn trong vách núi hoặc dưới lòng đất, dường như dẫn đến một nơi nào đó chưa biết..."
lang_multi_text.db,MultiText,MapMark_311015_MarkTitle,隐秘入口,Secret Entrance,Lối Vào Bí Mật
lang_multi_text.db,MultiText,MapMark_311018_MarkDesc,可操控特殊的琉璃刀伶进行四向移动冲刺，通过在认证范围内停留一定时间来获取隐藏奖励。,Take control of a special Vitreum Dancer to dash in 4 directions. Stop at designated locations for a certain period of time to obtain hidden rewards.,"Điều khiển một Vũ Công Vitreum đặc biệt lướt nhanh theo 4 hướng, dừng lại trong phạm vi chỉ định một khoảng thời gian nhất định để nhận phần thưởng ẩn."
lang_multi_text.db,MultiText,MapMark_311018_MarkTitle,声骸挑战·刀伶操控,Echo Challenge: Dancer Hacking,Thử Thách Thanh Hài: Điều Khiển Vũ Công
lang_multi_text.db,MultiText,MapMark_311021_MarkDesc,位于四方殿地底，供谕女们冥想修行的静默之所。无人的黑暗中，谕女们学习以慧眼观测自己，从而窥见真实的本相。,"A tranquil sanctuary beneath the Tetragon Temple, reserved exclusively for the Priestesses to meditate and reflect. Here, in the quiet darkness, they learn to turn inward, to see with the heart and glimpse the truth itself.","Nằm dưới lòng đất của Tetragon Temple, nơi yên tĩnh dành cho các Nữ Tư Tế thiền định tu hành. Trong bóng tối không người, các Nữ Tư Tế học cách dùng tuệ nhãn quan sát bản thân, từ đó nhìn thấy bản chất thật sự."
lang_multi_text.db,MultiText,MapMark_311021_MarkTitle,静思所,Sanctum of Quietude,Phòng Tĩnh Tâm
lang_multi_text.db,MultiText,MapMark_311022_MarkDesc,狩猎者营地附近的洞穴。,A cavern close to the Hunter's Den.,Hang động gần Doanh Trại Thợ Săn.
lang_multi_text.db,MultiText,MapMark_311022_MarkTitle,鸣猎之穴,Howlfang Lair,Hang Howlfang
lang_multi_text.db,MultiText,MapMark_311023_MarkDesc,位于赤林台地中层的洞穴。老练的猎人应擅长利用地形来布置陷阱，而老练的猎物也懂得在洞穴里伏击敌人。,"A cave at the middle level of Maroonwood. Veteran hunters use the terrain to set deadly traps, and cunning prey lie in wait to turn the tables.","Hang động ở tầng giữa cao nguyên Maroonwood. Thợ săn lão luyện giỏi lợi dụng địa hình để đặt bẫy, còn con mồi dày dạn cũng biết cách phục kích kẻ thù trong hang."
lang_multi_text.db,MultiText,MapMark_311023_MarkTitle,赤林岩窟,Maroonwood Crypt,Hang Đá Maroonwood
lang_multi_text.db,MultiText,MapMark_311024_MarkDesc,洞穴位于赤林岩窟的西侧，靠近往世花平野。向前去，即是鏖战不休的最终猎场，但逐猎黑潮造物的角斗士们，从来无人回首。,"A tunnel found on the western edge of Maroonwood Crypt, connecting the crypt with the Asphodel Barrens. Beyond lies the final hunting grounds where the fight never ends. Yet the Gladiators who hunt Dark Tide's creations press forward, never looking back.","Hang động nằm ở phía tây Hang Đá Maroonwood, gần Bình Nguyên Asphodel. Tiến về phía trước chính là bãi săn cuối cùng nơi chiến trận không ngừng, nhưng những đấu sĩ truy đuổi tạo vật của Hắc Triều chưa từng ngoái đầu nhìn lại."
lang_multi_text.db,MultiText,MapMark_311024_MarkTitle,赤林西喉,Maroonwood Maw,Họng Tây Maroonwood
lang_multi_text.db,MultiText,MapMark_311025_MarkDesc,蚀脊龙的栖身地，诸多英雄的葬身之所。,"The lair of Corrosaurus, where many brave warriors embraced their end.","Nơi trú ngụ của Corrosaurus, cũng là nơi yên nghỉ của biết bao anh hùng."
lang_multi_text.db,MultiText,MapMark_311025_MarkTitle,溶蚀地窟,Corrosaurus's Throat,Hang Ăn Mòn
lang_multi_text.db,MultiText,MapMark_3140002_MarkDesc,位于覆海原的虚质磁暴Ⅰ区。虚质磁暴区内，万物的残留化作虚质折射的映像，于此间浮现……,"The Void Storm Zone I in Tidelost Forest. Inside, the remnants of all things are warped into refracted echoes of Voidmatter, re-emerging into this world...","Vùng Bão Hư Chất I nằm tại Rừng Tidelost. Bên trong vùng bão hư chất, tàn dư của vạn vật hóa thành ảnh chiết xạ của hư chất, hiện lên nơi đây..."
lang_multi_text.db,MultiText,MapMark_3140002_MarkTitle,冰原地表·虚质磁暴I区,Frostlands Surface - Void Storm Zone I,Bề Mặt Băng Nguyên - Vùng Bão Hư Chất I
lang_multi_text.db,MultiText,MapMark_3140003_MarkDesc,位于覆海原与-断流岬交界地带的虚质磁暴Ⅱ区。虚质磁暴区内，万物的残留化作虚质折射的映像，于此间浮现……,"The Void Storm Zone II in the borderland between Tidelost Forest and Wavecleave Cape. Inside, the remnants of all things are warped into refracted echoes of Voidmatter, re-emerging into this world...","Vùng Bão Hư Chất II nằm tại ranh giới giữa Rừng Tidelost và Mũi Wavecleave. Bên trong vùng bão hư chất, tàn dư của vạn vật hóa thành ảnh chiết xạ của hư chất, hiện lên nơi đây..."
lang_multi_text.db,MultiText,MapMark_3140003_MarkTitle,冰原地表·虚质磁暴Ⅱ区,Frostlands Surface - Void Storm Zone II,Bề Mặt Băng Nguyên - Vùng Bão Hư Chất II
lang_multi_text.db,MultiText,MapMark_3140004_MarkDesc,位于加拉尔冠阶与渐湖磁暴监测区交界地带的虚质磁暴Ⅲ区。虚质磁暴区内，万物的残留化作虚质折射的映像，于此间浮现……,"The Void Storm Zone III in the borderland between Mount Gjallar and Ginnungamere Void Storm Monitoring Zone. Inside, the remnants of all things are warped into refracted echoes of Voidmatter, re-emerging into this world...","Vùng Bão Hư Chất III nằm tại ranh giới giữa Núi Gjallar và Khu Giám Sát Bão Hư Chất Ginnungamere. Bên trong vùng bão hư chất, tàn dư của vạn vật hóa thành ảnh chiết xạ của hư chất, hiện lên nơi đây..."
lang_multi_text.db,MultiText,MapMark_3140004_MarkTitle,冰原地表·虚质磁暴Ⅲ区,Frostlands Surface - Void Storm Zone III,Bề Mặt Băng Nguyên - Vùng Bão Hư Chất III
lang_multi_text.db,MultiText,MapMark_3140005_MarkDesc,"位于冰原运输港的虚质磁暴Ⅳ区。虚质磁暴区内，万物的残留化作虚质折射的映像，于此间浮现……

<color=#c25757>*该区域挑战难度较高，建议科考摩托解锁对虚策略模块下的对虚反应装甲后前往。</color>","The Void Storm Zone IV in Frostlands Transit Port. Inside, the remnants of all things are warped into refracted echoes of Voidmatter, re-emerging into this world...

<color=#c25757>*This area poses a difficult challenge. It is recommended to equip your Expedition Motorbike with Antivoid Tactics: Antivoid Armor before proceeding.</color>","Vùng Bão Hư Chất IV nằm tại Cảng Vận Chuyển Băng Nguyên. Bên trong vùng bão hư chất, tàn dư của vạn vật hóa thành ảnh chiết xạ của hư chất, hiện lên nơi đây...

<color=#c25757>*Khu vực này có độ khó cao, khuyến nghị mở khóa Giáp Phản Hư trong module Chiến Thuật Chống Hư trên Xe Khảo Sát trước khi đến.</color>"
lang_multi_text.db,MultiText,MapMark_3140005_MarkTitle,冰原地表·虚质磁暴Ⅳ区,Frostlands Surface - Void Storm Zone IV,Bề Mặt Băng Nguyên - Vùng Bão Hư Chất IV
lang_multi_text.db,MultiText,MapMark_3140006_MarkDesc,"位于元林遗址与溯源野地交界地带的虚质磁暴Ⅴ区。虚质磁暴区内，万物的残留化作虚质折射的映像，于此间浮现……

<color=#c25757>*该区域挑战难度较高，建议科考摩托解锁对虚策略模块下的对虚反应装甲后前往。</color>","The Void Storm Zone V in the borderland between Upphaf Forest Ruins and Root-Seeking Outpost. Inside, the remnants of all things are warped into refracted echoes of Voidmatter, re-emerging into this world...

<color=#c25757>*This area poses a difficult challenge. It is recommended to equip your Expedition Motorbike with Antivoid Tactics: Antivoid Armor before proceeding.</color>","Vùng Bão Hư Chất V nằm tại ranh giới giữa Di Tích Rừng Upphaf và Tiền Đồn Truy Nguyên. Bên trong vùng bão hư chất, tàn dư của vạn vật hóa thành ảnh chiết xạ của hư chất, hiện lên nơi đây...

<color=#c25757>*Khu vực này có độ khó cao, khuyến nghị mở khóa Giáp Phản Hư trong module Chiến Thuật Chống Hư trên Xe Khảo Sát trước khi đến.</color>"
lang_multi_text.db,MultiText,MapMark_3140006_MarkTitle,冰原地表·虚质磁暴V区,Frostlands Surface - Void Storm Zone V,Bề Mặt Băng Nguyên - Vùng Bão Hư Chất V
