db_file,table_name,id,zh,en,vi
lang_multi_text.db,MultiText,PunishReportDescText80,击败「倦怠之翼」,Defeat the Wings of Exhaustion,"Đánh bại ""Đôi Cánh Mệt Mỏi"""
lang_multi_text.db,MultiText,PunishReportDescText90,击败「僭越之矛」,Defeat the Spear of Transgression,"Đánh bại ""Ngọn Giáo Vượt Quyền"""
lang_multi_text.db,MultiText,PunishReportDescText100,击败「愚执之瞳」,Defeat Eye of Ignorance,"Đánh bại ""Con Mắt Ngu Muội"""
lang_multi_text.db,MultiText,PunishReportDescText210,完成节点挑战获得奖励,Complete the Dreamscape Node to claim rewards,Hoàn thành Thử Thách Điểm Mối để nhận thưởng
lang_multi_text.db,MultiText,PunishReportDescText230,击败「背誓之脊」,Defeat the Forsworn,"Đánh bại ""Trụ Cột Bội Thề"""
lang_multi_text.db,MultiText,PunishReportDescText250,击败「遗恨之指」,Defeat Claws of Regret,"Đánh bại ""Ngón Tay Di Hận"""
lang_multi_text.db,MultiText,PunishReportMainText,约兰的战术测试,Yhoran's Tactical Trial,Bài kiểm tra chiến thuật của Yhoran
lang_multi_text.db,MultiText,PunishReportMainText20,巡礼之梦·拉古那篇,Dream Patrol: Ragunna,Giấc Mơ Tuần Lễ: Ragunna
lang_multi_text.db,MultiText,PunishReportMainText30,巡礼之梦·拉古那篇,Dream Patrol: Ragunna,Giấc Mơ Tuần Lễ: Ragunna
lang_multi_text.db,MultiText,PunishReportMainText40,巡礼之梦·拉古那篇,Dream Patrol: Ragunna,Giấc Mơ Tuần Lễ: Ragunna
lang_multi_text.db,MultiText,PunishReportMainText50,巡礼之梦·拉古那篇,Dream Patrol: Ragunna,Giấc Mơ Tuần Lễ: Ragunna
lang_multi_text.db,MultiText,PunishReportMainText60,巡礼之梦·拉古那篇,Dream Patrol: Ragunna,Giấc Mơ Tuần Lễ: Ragunna
lang_multi_text.db,MultiText,PunishReportMainText70,巡礼之梦·拉古那篇,Dream Patrol: Ragunna,Giấc Mơ Tuần Lễ: Ragunna
lang_multi_text.db,MultiText,PunishReportMainText80,巡礼之梦·拉古那篇,Dream Patrol: Ragunna,Giấc Mơ Tuần Lễ: Ragunna
lang_multi_text.db,MultiText,PunishReportMainText90,巡礼之梦·拉古那篇,Dream Patrol: Ragunna,Giấc Mơ Tuần Lễ: Ragunna
lang_multi_text.db,MultiText,PunishReportMainText200,染秽之梦·七丘篇,Dream Contagion: Septimont,Giấc Mơ Nhiễm Bẩn: Septimont
lang_multi_text.db,MultiText,PunishReportMainText220,梦魇·七丘篇,Nightmares: Septimont,Ác Mộng: Septimont
lang_multi_text.db,MultiText,PunishReportMainText240,梦魇·隐海试验场篇,Nightmare: Fabricatorium of the Deep,Ác Mộng: Khu Thử Nghiệm Biển Ẩn
lang_multi_text.db,MultiText,PupuVillage_LevelText,等级{0}->等级{1},Lv. {0} → Lv. {1},Cấp {0} -> Cấp {1}
lang_multi_text.db,MultiText,PYDML_1_1,扎希拉小姐，你就……别拿我开玩笑了……,"Please, Miss Zahira… d-don't tease me like that…","Cô Zahira, cô... đừng trêu tôi nữa..."
lang_multi_text.db,MultiText,PYDML_1_2,……总之什么“星炬学院七大不思议”，什么“咒术游牧女”……这肯定是谣言，对吧？,"That ""Startorch's Seven Great Mysteries"" and ""Mindbending Herder"" stuff… t-they're just rumors… right?","...Tóm lại cái gì mà ""Bảy điều kỳ bí của Học viện Startorch"", cái gì mà ""Nữ du mục nguyền rủa""... chắc chắn là tin đồn thôi, đúng không?"
lang_multi_text.db,MultiText,PYDML_1_3,（狡黠地眨了眨眼睛，并没有停下手中动作的意思。）,"(Zahira gives a sly blink, her hands still moving without the slightest intention of stopping.)","(Nháy mắt tinh nghịch, tay vẫn không có ý định dừng lại.)"
lang_multi_text.db,MultiText,PYDML_1_4,咳咳……我是说，路网最近还在测试阶段，就这样让隧群跑上去……确实不太合适。,"Ahem... What I mean to say is, the new route network is still in testing. It's really... um... not safe to let the Exoswarm run on it yet.","Khụ khụ... Ý tôi là, mạng lưới đường bộ gần đây vẫn đang trong giai đoạn thử nghiệm, để Bầy Mòn xác chạy lên như vậy... thực sự không thích hợp lắm."
lang_multi_text.db,MultiText,PYDML_1_5,……我当然明白扎希拉小姐的心情，那次地陷发生以后，蚀刻平原的旧路网几乎全被毁了。,"I understand how you feel, Miss Zahira. After that land collapse, almost every old road across the Etching Plains was buried.","...Tôi đương nhiên hiểu tâm trạng của cô Zahira, sau trận sụt lún đó, mạng lưới đường cũ ở Đồng Bằng Khắc Ấn gần như bị phá hủy hoàn toàn."
lang_multi_text.db,MultiText,PYDML_1_6,为了避开磁暴区域，大家平日不得不绕着平原跑，运送物资多了几倍的路程，要是遇到得抢时间的情况，路上连喘口气的机会都没有。,"Since then, everyone's had to take a detour several times longer than the old route just to avoid the Void Storm. For urgent deliveries, that means racing non-stop the long way around.","Để tránh khu vực bão từ, mọi người ngày thường buộc phải đi đường vòng quanh đồng bằng, quãng đường vận chuyển vật tư xa hơn gấp mấy lần, nếu gặp tình huống cần tranh thủ thời gian, trên đường thậm chí còn chẳng có cơ hội thở lấy hơi."
lang_multi_text.db,MultiText,PYDML_1_7,我会尽快推进这项工作的，我保证。,I <i>will</i> make progress on this project. I promise.,"Tôi sẽ thúc đẩy công việc này nhanh nhất có thể, tôi hứa."
lang_multi_text.db,MultiText,PYDML_1_8,（撇嘴……）,(Zahira purses her lips...),(Bĩu môi...)
lang_multi_text.db,MultiText,PYDML_1_9,相信我嘛，你看，招募测试员的海报！熬夜做好的！,You've got to believe me! I even burned the midnight oil making these recruitment posters for test volunteers!,"Tin tôi đi mà, cô xem này, áp phích tuyển dụng người thử nghiệm! Tôi thức trắng đêm làm đấy!"
lang_multi_text.db,MultiText,PYDML_1_10,（指了指自己，眼底闪着亮晶晶的光。）,"(Zahira points proudly at herself, eyes glittering.)","(Chỉ vào bản thân, ánh mắt lấp lánh.)"
lang_multi_text.db,MultiText,PYDML_1_11,扎希拉小姐……想当测试员吗？可……,"You mean... you want to be a tester yourself, Miss Zahira? That's really kind, but...",Cô Zahira... muốn làm người thử nghiệm sao? Nhưng...
lang_multi_text.db,MultiText,PYDML_1_12,可最理想的测定载具应该是摩托车才对，机器跑得更快，也够分量，数据——,"...We actually prefer using motorbikes for data collection. You see, they're faster and carry more gear—","Nhưng phương tiện đo lường lý tưởng nhất phải là xe mô tô mới đúng, máy chạy nhanh hơn, cũng đủ trọng lượng, dữ liệu..."
lang_multi_text.db,MultiText,PYDML_1_13,（双手抱胸，眯起眼。）,(Zahira folds her arms and squints skeptically.),"(Khoanh tay trước ngực, nheo mắt lại.)"
lang_multi_text.db,MultiText,PYDML_1_14,（随即像是早就注意到了身旁“热心又靠谱”的你，小步跳到你的身侧，轻轻将你往前推了推。）,"(Then, as if suddenly remembering the ""reliable, helpful"" person beside her, she hops over and gently pushes you forward.)","(Ngay sau đó như thể đã sớm chú ý đến người ""nhiệt tình và đáng tin"" bên cạnh là bạn, cô ấy nhảy bước nhỏ đến bên cạnh bạn, nhẹ nhàng đẩy bạn về phía trước.)"
lang_multi_text.db,MultiText,PYDML_1_15,我只是一个一般路过的学生……,I'm just a student passing by...,Tôi chỉ là một sinh viên đi ngang qua thôi...
lang_multi_text.db,MultiText,PYDML_1_16,要我搭把手吗？,Need any help here?,Cần tôi giúp một tay không?
lang_multi_text.db,MultiText,PYDML_1_17,让……这位{Male=先生;Female=女士}来做测试员么？,…You want this {Male=gentleman;Female=lady} to be a tester?,Để... {Male=vị này;Female=cô đây} làm người thử nghiệm sao?
lang_multi_text.db,MultiText,PYDML_1_18,看上去是学院的学生没错，这样的话，应该也有调用载具的权限……嗯，的确符合测试员的招募要求。,"{Male=He;Female=She} does look like a Startorch student. Must have access to vehicles, already know the basics… Yes, {Male=he;Female=she} would be perfect.","Trông đúng là sinh viên của học viện, nếu vậy thì chắc cũng có quyền hạn điều động phương tiện... ừm, quả thực phù hợp với yêu cầu tuyển dụng người thử nghiệm."
lang_multi_text.db,MultiText,PYDML_1_19,不过……最重要的是，要问问本人的意愿才行。,"But of course, we need {Male=his;Female=her} consent first.",Tuy nhiên... quan trọng nhất là phải hỏi ý nguyện của đương sự mới được.
lang_multi_text.db,MultiText,PYDML_1_20,啊，差点忘了。自我介绍一下，我叫艾洛温，深空联合的研究员。,"Oh—right, I should introduce myself. I'm Elowyn, a researcher with the Spacetrek Collective.","A, suýt thì quên. Tự giới thiệu một chút, tôi tên là Elowyn, nghiên cứu viên của Liên Hợp Không Gian Sâu."
lang_multi_text.db,MultiText,PYDML_1_21,我和同事们一直在尝试重建被地陷破坏的蚀刻平原路网，最近总算有了些进展。眼下我们正准备着手规划建设路线，但功能测试方面还需要人手……,"My colleagues and I are rebuilding the route network that collapsed across the Etching Plains. With our recent progress, we're finally planning the next step… but we're short on testers.","Tôi và các đồng nghiệp vẫn luôn cố gắng tái thiết mạng lưới đường bộ Đồng Bằng Khắc Ấn bị phá hủy bởi sụt lún, gần đây cuối cùng cũng có chút tiến triển. Trước mắt chúng tôi đang chuẩn bị bắt tay vào quy hoạch tuyến đường xây dựng, nhưng về mặt thử nghiệm chức năng thì vẫn cần nhân lực..."
lang_multi_text.db,MultiText,PYDML_1_22,所以……要不要来试试？,So… would you be willing to lend us a hand?,Cho nên... có muốn thử không?
lang_multi_text.db,MultiText,PYDML_1_23,（用力点头。）,(She gives a firm nod.),(Gật đầu mạnh.)
lang_multi_text.db,MultiText,PYDML_1_24,这是扎希拉小姐，游牧集市的商人，呃……也是你的推荐人。,"Oh, and this is Miss Zahira. She's a regular trader at the Royan Market. She's the one who, well, recommended you.","Đây là cô Zahira, thương nhân của Chợ Du Mục, ừm... cũng là người giới thiệu của bạn."
lang_multi_text.db,MultiText,PYDML_1_25,你好。,Hello.,Chào.
lang_multi_text.db,MultiText,PYDML_1_26,幸会，“精通咒术”的不思议小姐。,"Glad to meet you, Miss Mysterious-Who-Can-Bend-Minds.","Hân hạnh được gặp, quý cô kỳ bí ""thông thạo nguyền rủa""."
lang_multi_text.db,MultiText,PYDML_1_27,（扑闪着睫毛，微笑。）,(Zahira bats her eyelashes playfully.),"(Chớp chớp hàng mi, mỉm cười.)"
lang_multi_text.db,MultiText,PYDML_1_28,（微微侧过头，故意坏心眼地露出一个得意的笑。）,"(Zahira tilts her head, flashing you a mischievous, triumphant grin.)","(Hơi nghiêng đầu, cố tình nở một nụ cười đắc ý đầy tinh quái.)"
lang_multi_text.db,MultiText,PYDML_1_29,如果需要帮手，找我没问题。,Just tell me what you need.,"Nếu cần người giúp đỡ, cứ tìm tôi."
lang_multi_text.db,MultiText,PYDML_1_30,当测试员也行，但是……,"I'll be your tester, but only if...","Làm người thử nghiệm cũng được, nhưng mà..."
lang_multi_text.db,MultiText,PYDML_1_31,诶，可以吗？那真是帮大忙了！,"Oh, really? That's wonderful!","Hả, được sao? Vậy thì giúp đỡ nhiều quá rồi!"
lang_multi_text.db,MultiText,PYDML_1_32,放心，不会让你白忙活，报酬肯定有。,"Rewards, right? Don't worry, we'll have those prepared for you.","Yên tâm, sẽ không để bạn làm không công đâu, thù lao chắc chắn có."
lang_multi_text.db,MultiText,PYDML_1_33,既然如此，那这份任务我就接下了。,Then let's do it.,Đã vậy thì tôi nhận nhiệm vụ này.
lang_multi_text.db,MultiText,PYDML_1_34,告诉我该怎么做吧。,Where do we start?,Nói cho tôi biết phải làm gì đi.
lang_multi_text.db,MultiText,PYDML_1_35,呵呵，蛮有干劲的嘛。,"Haha, love the enthusiasm!","Ha ha, hăng hái quá nhỉ."
lang_multi_text.db,MultiText,PYDML_1_36,来，把学生证给我，我登记一下，然后咱们就开始。,Let me register your student ID first. Then we can jump right into the work.,"Nào, đưa thẻ sinh viên cho tôi, tôi đăng ký một chút rồi chúng ta bắt đầu."
lang_multi_text.db,MultiText,PYDML_1_37,（递交学生证。）,(Hand her your student ID.),(Đưa thẻ sinh viên.)
lang_multi_text.db,MultiText,PYDML_1_38,{PlayerName}，学号是……好了，上传成功。,Name… {PlayerName}. Student number… there. It's uploaded.,"{PlayerName}, mã số sinh viên là... xong rồi, tải lên thành công."
lang_multi_text.db,MultiText,PYDML_1_39,那么……{PlayerName}，准备好了吗？记得竖起耳朵，听我指挥哦~,"Perfect, {PlayerName}. Please get ready and listen to my instructions closely, alright?","Vậy thì... {PlayerName}, chuẩn bị xong chưa? Nhớ dỏng tai lên nghe tôi chỉ huy nhé~"
lang_multi_text.db,MultiText,PYDML_3_1,扎、扎希拉小姐，这个现在还不行！,"M–Miss Zahira, you can't do that yet!","C-cô Zahira, cái này bây giờ vẫn chưa được!"
lang_multi_text.db,MultiText,PYDML_3_2,设备需要调试，再等……,The device still needs a few more minutes to tune—,"Thiết bị cần phải điều chỉnh, đợi thêm..."
lang_multi_text.db,MultiText,PYDML_3_3,（鼓起腮颊，抬手在空中画了几个圈……）,(Zahira puffs her cheeks and traces circles in the air…),"(Phồng má, giơ tay vẽ vài vòng tròn trong không trung...)"
lang_multi_text.db,MultiText,PYDML_3_4,……咒、咒语吗？,"...Y-You're not trying to read my mind, are you?",...Th-thần chú sao?
lang_multi_text.db,MultiText,PYDML_5_1,在正式测试之前，我们需要先将测定用的路网“打印”出来。,"First things first, we need to ""print out"" the route we'll be testing.","Trước khi thử nghiệm chính thức, chúng ta cần ""in"" mạng lưới đường bộ dùng để đo lường ra trước."
lang_multi_text.db,MultiText,PYDML_5_2,“打印”？,"""Print out""?","""In""?"
lang_multi_text.db,MultiText,PYDML_5_3,没错，这种类型的路网叫做“印造路网”，它的好处在于灵活机动，可以根据需求随时衍造出新的路面，方便我们应对各种突发状况或是复杂的地形。,"You heard right. It's a kind of ""road crafting."" The technology enables us to dynamically generate new road surfaces for emergency situations or rough terrain.","Đúng vậy, loại mạng lưới đường bộ này gọi là ""Mạng Lưới Đường Bộ In Ấn"", ưu điểm của nó nằm ở sự linh hoạt cơ động, có thể dựa theo nhu cầu mà tạo ra mặt đường mới bất cứ lúc nào, thuận tiện cho chúng ta ứng phó với các loại tình huống bất ngờ hoặc địa hình phức tạp."
lang_multi_text.db,MultiText,PYDML_5_4,智造立方我已经提前布置好了。,I've already set up the Smartprint Cube here.,Khối Lập Phương Chế Tạo tôi đã bố trí trước rồi.
lang_multi_text.db,MultiText,PYDML_5_5,只要激活智造装置，连接的造路悬仪就会自动运转，为我们生成第一条测试通路。,"Once we activate it, the linked Route Constructor will boot up on its own and generate the first test route.","Chỉ cần kích hoạt thiết bị chế tạo, Thiết Bị Tạo Đường trên không được kết nối sẽ tự động vận hành, tạo ra con đường thử nghiệm đầu tiên cho chúng ta."
lang_multi_text.db,MultiText,PYDML_5_6,交给我吧。,Leave the test to me.,Giao cho tôi đi.
lang_multi_text.db,MultiText,PYDML_10_1,很好，就是这样一条……呃……不算平坦，但是相当通畅的道路。,"Well done. The lane looks… ahem, a little bumpy, but it definitely worked.","Rất tốt, chính là một con đường như vậy... ừm... không tính là bằng phẳng, nhưng khá thông thoáng."
lang_multi_text.db,MultiText,PYDML_10_2,{PlayerName}，找准落点，跳上去。,"Now, {PlayerName}, find a good spot to hop on.","{PlayerName}, tìm điểm đáp chuẩn xác, nhảy lên đi."
lang_multi_text.db,MultiText,PYDML_15_1,保持车速，沿着轨道一路前进。,Keep your pace steady and follow the lane.,"Giữ tốc độ xe, tiến lên dọc theo đường ray."
lang_multi_text.db,MultiText,PYDML_15_2,我会实时记录你的行驶数据以及路网的各项参数。,I'll be recording your driving data and the route's parameters in real time.,Tôi sẽ ghi lại dữ liệu di chuyển của bạn và các thông số của mạng lưới đường bộ theo thời gian thực.
lang_multi_text.db,MultiText,PYDML_20_1,注意前方的坡道！,Watch that ramp up ahead!,Chú ý con dốc phía trước!
lang_multi_text.db,MultiText,PYDML_20_2,借助它，跃到下方去。,Ride up and take the jump.,"Mượn lực của nó, nhảy xuống phía dưới."
lang_multi_text.db,MultiText,PYDML_25_1,{PlayerName}，看到那台造路悬仪了吗？试着击中它！,"See that Route Constructor, {PlayerName}? Go hit it!","{PlayerName}, nhìn thấy Thiết Bị Tạo Đường trên không kia không? Thử bắn trúng nó xem!"
lang_multi_text.db,MultiText,PYDML_25_2,对，就是这样！激活它，让它帮我们把下一段路造出来。,Perfect! Activate it to print the next lane.,"Đúng, chính là như vậy! Kích hoạt nó, để nó giúp chúng ta tạo ra đoạn đường tiếp theo."
lang_multi_text.db,MultiText,PYDML_30_1,轨道中断了……,The lane cuts off here…,Đường ray bị ngắt quãng rồi...
lang_multi_text.db,MultiText,PYDML_30_2,{PlayerName}，旁边还有条路，准备好，跳过去！,There's another one nearby. Get ready—jump!,"{PlayerName}, bên cạnh còn một con đường, chuẩn bị sẵn sàng, nhảy qua đó!"
lang_multi_text.db,MultiText,PYDML_35_1,像刚才一样，再来一次跃坡。,Let's go for that ramp jump again.,"Giống như vừa rồi, nhảy dốc thêm lần nữa."
lang_multi_text.db,MultiText,PYDML_40_1,老规矩，瞄准造路悬仪，开始铺路！,You know what to do—aim for the Route Constructor and let it do its job!,"Quy tắc cũ, nhắm vào Thiết Bị Tạo Đường, bắt đầu rải đường!"
lang_multi_text.db,MultiText,PYDML_45_1,{PlayerName}，前面路况复杂。,"{PlayerName}, the road ahead looks rough.","{PlayerName}, tình hình đường xá phía trước phức tạp."
lang_multi_text.db,MultiText,PYDML_45_2,找准时机，利用跳跃切换路线，躲开那些障碍！,Time your jumps and switch between lanes to dodge the obstacles!,"Tìm đúng thời cơ, tận dụng cú nhảy để chuyển làn đường, né tránh những chướng ngại vật đó!"
lang_multi_text.db,MultiText,PYDML_50_1,是坡道，全速冲上去！,It's a ramp—full speed ahead!,"Là dốc, tăng tốc tối đa lao lên!"
lang_multi_text.db,MultiText,PYDML_55_1,现在，将最后一段通路打印出来吧！,Let's print the final section now!,"Bây giờ, hãy in đoạn đường cuối cùng ra nào!"
lang_multi_text.db,MultiText,PYDML_60_1,当心路面！,Careful!,Cẩn thận mặt đường!
lang_multi_text.db,MultiText,PYDML_60_2,{PlayerName}，跳过去！,"Jump now, {PlayerName}!","{PlayerName}, nhảy qua đó!"
lang_multi_text.db,MultiText,PYDML_65_1,我听见了，是引擎在呼啸。这说明——终点就在眼前了！,"Hear that engine roar! Come on, our destination's right ahead!","Tôi nghe thấy rồi, là tiếng gầm rú của động cơ. Điều này chứng tỏ... đích đến ở ngay trước mắt rồi!"
lang_multi_text.db,MultiText,PYDML_70_1,干得漂亮！数据相当清晰，完美的测试……嗯，不管从哪种角度来说，都是一次宝贵的试验经验。,"Impressive! Clear data, precise execution... a truly valuable test run.","Làm tốt lắm! Dữ liệu khá rõ ràng, một cuộc thử nghiệm hoàn hảo... ừm, dù nhìn từ góc độ nào, đây cũng là kinh nghiệm thử nghiệm quý báu."
lang_multi_text.db,MultiText,PYDML_70_2,多亏了扎希拉小姐的推荐，也要谢谢你，{PlayerName}。感谢你的贡献。,It seems Miss Zahira read your abilities perfectly. Thank you both for your help.,"Nhờ có sự giới thiệu của cô Zahira, cũng phải cảm ơn bạn, {PlayerName}. Cảm ơn sự đóng góp của bạn."
lang_multi_text.db,MultiText,PYDML_70_3,（赞同地笑着。）,(Zahira smiles in agreement.),(Mỉm cười tán đồng.)
lang_multi_text.db,MultiText,PYDML_70_4,贡献还谈不上吧。,Just doing what I can.,Chưa nói đến mức cống hiến đâu.
lang_multi_text.db,MultiText,PYDML_70_5,不，你的信任和配合已经是莫大的帮助了。,Don't sell yourself short. Your trust and cooperation mean a lot to us.,"Không, sự tin tưởng và phối hợp của bạn đã là sự giúp đỡ to lớn rồi."
lang_multi_text.db,MultiText,PYDML_70_6,虽说比起研究隧者，我的工作实在有些……微不足道。但看到这份成果能够切实地改变大家的生活，我真的很开心。,"I used to think this job was… Well, trivial compared to my research on the Exostrider. But seeing how it actually improves people's lives makes me genuinely happy.","Mặc dù so với việc nghiên cứu Người Đi Bộ Ngoài Không Gian, công việc của tôi thực sự có chút... nhỏ bé không đáng kể. Nhưng nhìn thấy thành quả này có thể thực sự thay đổi cuộc sống của mọi người, tôi thật sự rất vui."
lang_multi_text.db,MultiText,PYDML_70_7,今天又离目标近了一步，这是最棒的事。,Nothing beats getting closer to your goal.,"Hôm nay lại tiến gần hơn đến mục tiêu một bước, đây là điều tuyệt vời nhất."
lang_multi_text.db,MultiText,PYDML_70_8,（将一朵小小的野花递到艾洛温面前，转身眉眼一弯，又将另一朵小花轻轻放进你的掌心。）,"(Zahira picks a tiny wildflower and offers it to Elowyn, then turns with a gentle smile and places another in your palm.)","(Đưa một bông hoa dại nhỏ đến trước mặt Elowyn, quay người cười tít mắt, rồi nhẹ nhàng đặt một bông hoa nhỏ khác vào lòng bàn tay bạn.)"
lang_multi_text.db,MultiText,PYDML_70_9,扎希拉小姐……这是？,Miss Zahira… what's this?,Cô Zahira... đây là?
lang_multi_text.db,MultiText,PYDML_70_10,我猜……扎希拉的意思应该是“谢谢”？顺便也想给你打打气呢。,"I guess it's her way of saying ""thank you."" A little gift to lift your spirits.","Tôi đoán... ý của Zahira chắc là ""cảm ơn""? Tiện thể cũng muốn cổ vũ tinh thần cho bạn đấy."
lang_multi_text.db,MultiText,PYDML_70_11,（点头。）,(Zahira nods.),(Gật đầu.)
lang_multi_text.db,MultiText,PYDML_70_12,别太看轻自己，你在做的，可是了不起的事啊。,You should be proud of the work you're doing. It truly matters.,"Đừng quá coi nhẹ bản thân, việc bạn đang làm là một việc rất tuyệt vời đấy."
lang_multi_text.db,MultiText,PYDML_70_13,在飞向浩瀚的宇宙之前，我们得先学会在地面上奔跑不是吗？,"Before we reach for the stars, we have to learn to run on solid ground first, don't we?","Trước khi bay vào vũ trụ bao la, chúng ta phải học cách chạy trên mặt đất trước đã, phải không?"
