db_file,table_name,id,zh,en,vi
lang_multi_text.db,MultiText,Character_LevelTest03_23_2,十年前那场运动会结束后不久，荒石高地爆发了一场始料未及的残象潮。,,"Không lâu sau khi hội thao mười năm trước kết thúc, Cao Nguyên Hoang Thạch đã bùng phát một làn sóng Tàn Tượng không ai ngờ tới."
lang_multi_text.db,MultiText,Character_LevelTest03_23_3,迷雾里的声音就来自那次战役对吧？,,Âm thanh trong sương mù là đến từ trận chiến đó đúng không?
lang_multi_text.db,MultiText,Character_LevelTest03_23_30,……,,...
lang_multi_text.db,MultiText,Character_LevelTest03_23_4,嗯，当时事发突然，许多新人也被紧急派往前线。,,"Ừm, lúc đó sự việc xảy ra đột ngột, nhiều người mới cũng được phái gấp ra tiền tuyến."
lang_multi_text.db,MultiText,Character_LevelTest03_25_1,这些事都是十年前发生的，临时小队为什么今天才发出求救？,,"Những chuyện này đều xảy ra mười năm trước, tại sao đội tạm thời hôm nay mới phát tín hiệu cầu cứu?"
lang_multi_text.db,MultiText,Character_LevelTest03_25_10,也许他们一直凭借这些美好的回忆来对抗残象的融合。,,Có lẽ họ luôn dựa vào những ký ức tốt đẹp này để chống lại sự dung hợp của Tàn Tượng.
lang_multi_text.db,MultiText,Character_LevelTest03_25_11,直到我们发现了这个领域？,,Cho đến khi chúng ta phát hiện ra lĩnh vực này?
lang_multi_text.db,MultiText,Character_LevelTest03_25_12,嗯，若是没坚持住，恐怕这里会爆发残象潮。,,"Ừm, nếu không cầm cự được, e rằng nơi này sẽ bùng phát thủy triều Tàn Tượng."
lang_multi_text.db,MultiText,Character_LevelTest03_25_13,刚才在兵团大楼前，你其实是想告诉我，你认识他们，对吧？,,"Vừa nãy trước tòa nhà binh đoàn, thực ra anh muốn nói với tôi là anh quen họ, đúng không?"
lang_multi_text.db,MultiText,Character_LevelTest03_25_14,……嗯，不止是认识。,,"...Ừm, không chỉ là quen biết."
lang_multi_text.db,MultiText,Character_LevelTest03_25_15,荒石高地的那场战役，你和他们……？,,"Trận chiến ở Cao Nguyên Hoang Thạch, anh và họ...?"
lang_multi_text.db,MultiText,Character_LevelTest03_25_16,我们在同一个战场。,,Chúng tôi ở cùng một chiến trường.
lang_multi_text.db,MultiText,Character_LevelTest03_25_17,我记得，那日也是这样的天气……,,Tôi nhớ hôm đó thời tiết cũng như thế này...
lang_multi_text.db,MultiText,Character_LevelTest03_25_18,他们应该不想重现那天的场面吧。,,Họ chắc hẳn không muốn tái hiện lại cảnh tượng ngày hôm đó đâu nhỉ.
lang_multi_text.db,MultiText,Character_LevelTest03_25_19,嗯，所以才会求助于我们。,,"Ừm, vì vậy mới cầu cứu chúng ta."
lang_multi_text.db,MultiText,Character_LevelTest03_25_2,我想是因为你。,,Tôi nghĩ là vì cô.
lang_multi_text.db,MultiText,Character_LevelTest03_25_20,抓紧吧。,,Bám chắc vào.
lang_multi_text.db,MultiText,Character_LevelTest03_25_3,因为我？可我并不认识他们。,,Vì tôi? Nhưng tôi đâu có quen họ.
lang_multi_text.db,MultiText,Character_LevelTest03_25_4,我一直在想，为什么偏偏是今年的运动会引起了他们的注意。,,"Tôi vẫn luôn suy nghĩ, tại sao đại hội thể thao năm nay lại thu hút sự chú ý của họ."
lang_multi_text.db,MultiText,Character_LevelTest03_25_5,唯一的变量，就是你。,,"Biến số duy nhất, chính là cô."
lang_multi_text.db,MultiText,Character_LevelTest03_25_6,为了完成凌言和甘泉参赛的心愿，你邀请我组建了临时小队。,,"Để hoàn thành tâm nguyện tham gia thi đấu của Lăng Ngôn và Cam Tuyền, cô đã mời tôi thành lập đội tạm thời."
lang_multi_text.db,MultiText,Character_LevelTest03_25_7,从不被看好，到遥遥领先。,,"Từ việc không được đánh giá cao, đến việc dẫn đầu bỏ xa đối thủ."
lang_multi_text.db,MultiText,Character_LevelTest03_25_8,所有的一切，都似曾相识。,,"Tất cả mọi thứ, đều có vẻ quen thuộc."
lang_multi_text.db,MultiText,Character_LevelTest03_25_9,所以才会引发了能量共鸣……,,Vì vậy mới gây ra sự cộng hưởng năng lượng...
lang_multi_text.db,MultiText,Character_LevelTest03_26_1,钟声越来越近。,,Tiếng chuông ngày càng gần.
lang_multi_text.db,MultiText,Character_LevelTest03_26_2,前方是……鸣钟广场？,,Phía trước là... Quảng Trường Minh Chung?
lang_multi_text.db,MultiText,Character_LevelTest03_27_15,每一个夜归，都是从这里开始，又从这里结束。,,"Mỗi một Dạ Quy, đều bắt đầu từ đây, và cũng kết thúc tại đây."
lang_multi_text.db,MultiText,Character_LevelTest03_27_19,……,,...
lang_multi_text.db,MultiText,Character_LevelTest03_27_7,只有完成了这堂课，才能正式走入战场。,,"Chỉ khi hoàn thành bài học này, mới có thể chính thức bước vào chiến trường."
lang_multi_text.db,MultiText,Character_LevelTest03_28_1,救……救救我……,,Cứu... cứu tôi với...
lang_multi_text.db,MultiText,Character_LevelTest03_28_2,别过来……,,Đừng qua đây...
lang_multi_text.db,MultiText,Character_LevelTest03_28_3,……,,...
lang_multi_text.db,MultiText,Character_LevelTest03_28_4,…………,,......
lang_multi_text.db,MultiText,Character_LevelTest03_28_5,………………,,.........
lang_multi_text.db,MultiText,Character_LevelTest03_30_1,……拜托了……机会难得……一起参加……,,...Làm ơn... cơ hội hiếm có... cùng tham gia...
lang_multi_text.db,MultiText,Character_LevelTest03_30_2,抱歉……是我失误……,,Xin lỗi... là tôi sơ suất...
lang_multi_text.db,MultiText,Character_LevelTest03_30_3,……冠军……,,...Quán quân...
lang_multi_text.db,MultiText,Character_LevelTest03_30_4,……相信你……,,...Tin tưởng cậu...
lang_multi_text.db,MultiText,Character_LevelTest03_30_5,怕什么……这不是还有忌炎……,,Sợ gì chứ... chẳng phải còn có Kỵ Viêm sao...
lang_multi_text.db,MultiText,Character_LevelTest03_30_6,如果是你的话……,,Nếu là cậu thì...
lang_multi_text.db,MultiText,Character_LevelTest03_30_7,指挥权……快走……没时间了……,,Quyền chỉ huy... mau đi đi... không còn thời gian nữa...
lang_multi_text.db,MultiText,Character_LevelTest03_30_8,交给你了……忌炎……,,Giao cho cậu đấy... Kỵ Viêm...
lang_multi_text.db,MultiText,Character_LevelTest03_30_9,等一切结束……下次再一起……,,Đợi mọi chuyện kết thúc... lần sau lại cùng nhau...
lang_multi_text.db,MultiText,Character_LevelTest03_32_1,{PlayerName}，谢谢你。,,"{PlayerName}, cảm ơn cô."
lang_multi_text.db,MultiText,Character_LevelTest03_32_3,我……没事。,,Tôi... không sao.
lang_multi_text.db,MultiText,Character_LevelTest03_62_3,我也想参加接力赛。,,Tôi cũng muốn tham gia chạy tiếp sức.
lang_multi_text.db,MultiText,Character_LevelTest03_63_3,不对不对！！！没有救兵了，全没了！！,,"Không đúng không đúng!!! Không có cứu viện đâu, hết sạch rồi!!"
lang_multi_text.db,MultiText,Character_LevelTest03_63_4,我们是来帮忙的。,,Chúng tôi đến để giúp đỡ.
lang_multi_text.db,MultiText,Character_LevelTest03_63_5,这是弥留之际的残存记忆，没法沟通。,,"Đây là ký ức còn sót lại lúc hấp hối, không thể giao tiếp được."
lang_multi_text.db,MultiText,Character_LevelTest03_63_6,他以为自己还在战场上。,,Cậu ấy tưởng mình vẫn đang ở trên chiến trường.
lang_multi_text.db,MultiText,Character_LevelTest03_63_7,嗯，被记忆困住了。,,"Ừm, bị ký ức giam cầm rồi."
lang_multi_text.db,MultiText,Character_LevelTest03_64_3,难道……难道其他防线被攻破了？没人了吗？,,Lẽ nào... lẽ nào các phòng tuyến khác bị chọc thủng rồi? Không còn ai sao?
lang_multi_text.db,MultiText,Character_LevelTest03_64_4,这些是战场记忆？,,Đây là ký ức chiến trường sao?
lang_multi_text.db,MultiText,Character_LevelTest03_64_5,嗯，残象吞噬了战亡者的频率，获得了这些记忆。,,"Ừm, Tàn Tượng đã nuốt chửng tần số của những người tử trận và có được những ký ức này."
lang_multi_text.db,MultiText,Character_LevelTest03_64_6,新人增援是怎么回事？,,Tân binh tiếp viện là chuyện thế nào?
lang_multi_text.db,MultiText,Character_LevelTest03_64_7,应该是十年前那场战役，当时多处防线同时被袭，兵力不足，情况危急只能派新兵前去增援。,,"Chắc là trận chiến mười năm trước, khi đó nhiều phòng tuyến bị tấn công cùng lúc, binh lực không đủ, tình thế nguy cấp chỉ có thể phái tân binh đi tiếp viện."
lang_multi_text.db,MultiText,Character_LevelTest03_64_8,很多人……没回得来。,,Rất nhiều người... đã không trở về được.
lang_multi_text.db,MultiText,Character_LevelTest03_65_10,我想当时应该选择死守了吧？,,Tôi nghĩ lúc đó chắc đã chọn tử thủ rồi nhỉ?
lang_multi_text.db,MultiText,Character_LevelTest03_65_11,为了保全更多人，必须死守防线。,,"Để bảo toàn nhiều người hơn, bắt buộc phải tử thủ phòng tuyến."
lang_multi_text.db,MultiText,Character_LevelTest03_65_12,所以现在荒石高地才没陷落。,,Cho nên bây giờ Cao Nguyên Hoang Thạch mới không bị thất thủ.
lang_multi_text.db,MultiText,Character_LevelTest03_65_13,嗯。,,Ừm.
lang_multi_text.db,MultiText,Character_LevelTest03_65_3,退还是守……他会怎么选择？,,Rút hay thủ... cậu ấy sẽ chọn thế nào?
lang_multi_text.db,MultiText,Character_LevelTest03_65_4,没得选！再退就退到今州城了！只有守住才能争取更多时间……谁来守？怎么守？都是问题！,,Không có lựa chọn! Rút nữa là rút về thành Kim Châu đấy! Chỉ có giữ vững mới tranh thủ được thêm thời gian... Ai giữ? Giữ thế nào? Đều là vấn đề!
lang_multi_text.db,MultiText,Character_LevelTest03_65_5,留下来守的人，估计是再也回不去了。,,"Người ở lại giữ, e là sẽ không bao giờ trở về nữa."
lang_multi_text.db,MultiText,Character_LevelTest03_65_6,如果真要用命守住防线，我会留下来的，不然后方的压力只会更大！,,"Nếu thực sự phải dùng mạng để giữ phòng tuyến, tôi sẽ ở lại, nếu không áp lực phía sau chỉ càng lớn hơn!"
lang_multi_text.db,MultiText,Character_LevelTest03_65_7,但他真的能那么果断做出判断吗？,,Nhưng cậu ấy thực sự có thể quyết đoán đưa ra phán đoán như vậy sao?
lang_multi_text.db,MultiText,Character_LevelTest03_65_8,他们说的新人……,,Tân binh mà họ nói...
lang_multi_text.db,MultiText,Character_LevelTest03_65_9,……,,...
lang_multi_text.db,MultiText,Character_LingYang_10_1,呼，谢谢你们，多亏你们来得及时。,Phew... Thank you! You saved my life!,"Phù, cảm ơn hai người, may mà hai người đến kịp lúc."
lang_multi_text.db,MultiText,Character_LingYang_10_10,这个包裹你有印象吗？,Does this look familiar to you?,Gói hàng này cậu có ấn tượng gì không?
lang_multi_text.db,MultiText,Character_LingYang_10_11,啊，这个包裹？我、我不认识……,"Hmm, I'm sorry, but this doesn't ring any bell...","A, gói hàng này? Tôi, tôi không biết..."
lang_multi_text.db,MultiText,Character_LingYang_10_12,哦？可是从它的物流轨迹来看，这个包裹是从你这直接发出的。,"But we just checked the package tracker, and it said you were the deliveryman...","Ồ? Nhưng xem lộ trình vận chuyển của nó, gói hàng này được gửi trực tiếp từ chỗ cậu mà."
lang_multi_text.db,MultiText,Character_LingYang_10_13,有可能……是搞错了吧？,...M-Maybe it was a mistake?,Có khả năng... là nhầm lẫn chăng?
lang_multi_text.db,MultiText,Character_LingYang_10_14,嗯……好吧，那我们再换个问题……,"I see... Well, we still have another question.","Ừm... được thôi, vậy chúng ta đổi câu hỏi khác..."
lang_multi_text.db,MultiText,Character_LingYang_10_15,关于“丁零当啷兽”……,About the Jingle Beast...,"Về ""Quái Thú Leng Keng""..."
lang_multi_text.db,MultiText,Character_LingYang_10_16,关于“野兽帮”……,"About ""The Savages""...","Về ""Bang Hội Dã Thú""..."
lang_multi_text.db,MultiText,Character_LingYang_10_17,“叮铃哐啷兽”啊？我记得是最近传得特别火的那个怪兽……,"The ""Twinkle Beast""? You mean that monster everyone's been talking about recently?","""Quái Thú Lanh Canh"" à? Tôi nhớ là con quái thú gần đây được đồn đại rất nhiều..."
lang_multi_text.db,MultiText,Character_LingYang_10_18,是“丁零当啷兽”吧？,"You mean the ""Jingle Beast"", right?","Là ""Quái Thú Leng Keng"" chứ?"
lang_multi_text.db,MultiText,Character_LingYang_10_19,叫什么有区别吗？反正都是害人的野兽……,"Yeah, whatever. That dangerous, man-eating thing.",Gọi là gì có khác nhau không? Dù sao cũng đều là dã thú hại người...
lang_multi_text.db,MultiText,Character_LingYang_10_2,没有受伤吧？,Are you alright?,Không bị thương chứ?
lang_multi_text.db,MultiText,Character_LingYang_10_20,据说它们长着长长的牙齿，利爪可以轻易撕碎猎物……,It's said to have long tusks and sharp claws that can tear anything to shreds...,"Nghe nói chúng có răng nanh dài ngoằng, móng vuốt sắc bén có thể dễ dàng xé nát con mồi..."
lang_multi_text.db,MultiText,Character_LingYang_10_21,但是有个叫“野兽帮”的流放者团体，说是可以和它沟通……,"And there's this Exile group, called ""The Savages,"" and they claim to be able to talk to that beast.","Nhưng có một nhóm Lưu Đày Giả tên là ""Bang Hội Dã Thú"", nói là có thể giao tiếp với nó..."
lang_multi_text.db,MultiText,Character_LingYang_10_22,所以居民们都在“出钱”拜托他们让“丁零当啷兽”不要搞破坏了……,"So people have been paying them to talk the ""Jingle Beast"" out of attacking humans...","Cho nên cư dân đều đang ""bỏ tiền"" nhờ họ khiến ""Quái Thú Leng Keng"" đừng phá hoại nữa..."
lang_multi_text.db,MultiText,Character_LingYang_10_23,“野兽帮”啊……有点印象吧……,"""The Savages""... Yeah, sounds familiar...","""Bang Hội Dã Thú"" à... cũng có chút ấn tượng..."
lang_multi_text.db,MultiText,Character_LingYang_10_24,你们知道那个“叮铃咣当兽”吗？那个最近被流传得非常火的怪兽……,"Do you know the ""Tingle Beast""? That monster everyone's been talking about recently.","Các cậu biết con ""Quái Thú Lanh Canh"" đó không? Con quái vật gần đây được đồn thổi rất dữ ấy..."
lang_multi_text.db,MultiText,Character_LingYang_10_25,是“丁零当啷兽”吧？,"You mean the ""Jingle Beast"", right?","Là ""Quái Thú Leng Keng"" chứ?"
lang_multi_text.db,MultiText,Character_LingYang_10_26,叫什么有区别吗？反正都是害人的野兽……,"Yeah, whatever. That dangerous, man-eating thing.",Gọi là gì có khác nhau không? Dù sao cũng đều là dã thú hại người...
lang_multi_text.db,MultiText,Character_LingYang_10_27,据说他们知道怎么和那头凶恶的“丁零当啷兽”沟通……,It's said that they know how to communicate with that ferocious beast.,"Nghe nói họ biết cách giao tiếp với con ""Quái Thú Leng Keng"" hung dữ đó..."
lang_multi_text.db,MultiText,Character_LingYang_10_28,所以居民们都在“出钱”拜托他们让“丁零当啷兽”不要搞破坏了……,"So people have been paying them to talk the ""Jingle Beast"" out of attacking humans...","Cho nên cư dân đều đang ""bỏ tiền"" nhờ họ khiến ""Quái Thú Leng Keng"" đừng phá hoại nữa..."
lang_multi_text.db,MultiText,Character_LingYang_10_29,恩人，这就是我知道的全部了……,"That's all I know, sir.","Ân nhân, đây là tất cả những gì tôi biết..."
lang_multi_text.db,MultiText,Character_LingYang_10_3,我还好，没什么大碍，其实也可以直接逃走的，只是……这些包裹就要遭殃了。,"Thanks for asking. I'm fine. I could have run away, but then the packages wouldn't reach their recipients...","Tôi vẫn ổn, không có gì đáng ngại, thực ra cũng có thể trực tiếp chạy trốn, chỉ là... những gói hàng này sẽ gặp họa mất."
lang_multi_text.db,MultiText,Character_LingYang_10_30,我还有最后一个问题。,"Thank you, but I've got one last question.",Tôi còn một câu hỏi cuối cùng.
lang_multi_text.db,MultiText,Character_LingYang_10_31,你知道，这个“野兽帮”，或者“丁零当啷兽”在哪里活动吗？,"Do you know where we can find The Savages, or the Jingle Beast?","Cậu có biết, ""Bang Hội Dã Thú"" này, hoặc ""Quái Thú Leng Keng"" hoạt động ở đâu không?"
lang_multi_text.db,MultiText,Character_LingYang_10_32,我们是有原则的……客、客户的信息我们是绝对不会泄露的。,"...Sorry, but we have our rules to f-follow... I cannot divulge details of our clients.",Chúng tôi có nguyên tắc... thông tin của khách hàng chúng tôi tuyệt đối sẽ không tiết lộ.
lang_multi_text.db,MultiText,Character_LingYang_10_33,不过我听说，这个“丁零当啷兽”，好像经常在山腰处，一个位于歪倒大树附近的营地里活动……,"But I heard the Jingle Beast is often found roaming in a campsite. It's somewhere near a broken tree, on that mountainside...","Nhưng tôi nghe nói, con ""Quái Thú Leng Keng"" này, hình như thường hoạt động ở sườn núi, trong một doanh trại gần cái cây lớn bị đổ nghiêng..."
lang_multi_text.db,MultiText,Character_LingYang_10_34,也有人经常能在哨塔上目击到它……,"Those working on the guard tower can often spot it, too.",Cũng có người thường xuyên nhìn thấy nó từ trên tháp canh...
lang_multi_text.db,MultiText,Character_LingYang_10_35,原来如此……我知道了，谢谢你。,I see. Thank you for answering my questions.,"Ra là vậy... tôi biết rồi, cảm ơn cậu."
lang_multi_text.db,MultiText,Character_LingYang_10_38,恩人，我想再提醒一句。,"Sir, may I remind you...","Ân nhân, tôi muốn nhắc nhở một câu."
lang_multi_text.db,MultiText,Character_LingYang_10_39,那头野兽，真的很危险，你们一定要小心啊。,That thing is very dangerous... It's ferocious beyond your wildest imagination. Please be careful...,"Con dã thú đó, thực sự rất nguy hiểm, hai người nhất định phải cẩn thận đấy."
lang_multi_text.db,MultiText,Character_LingYang_10_4,你还挺有职业精神。,Your professionalism is commendable.,Cậu cũng có tinh thần nghề nghiệp đấy chứ.
